LSTSLBDTHHMNDTHMEZ7VL7BXZ,Hot Berries Classy Chain Sling Bag,http://www.flipkart.com/lifestyle/bags-wallets-belts/women?otracker=hp_nmenu_sub_women_0_Bags%2C%20Belts%20and%20wallets,Rs. 1599,Bags  Belts and wallets,Slingbags,Hot Berries,http://img6a.flixcart.com/image/sling-bag/e/z/7/lccos-439-hot-berries-classy-chain-400x400-imadthzknqe2jfph.jpeg,Rs. 1599,Green,women,http://www.flipkart.com/hot-berries-classy-chain-sling-bag/p/itmdthhmde325bek?pid=SLBDTHHMNDTHMEZ7&srno=b_4&ref=3d76829f-9771-4e68-a2a2-276535997690,Fashionara,Hot Berries Classy Chain Sling Bag Dark Green - Price in India | Flipkart.com,Flipkart.com: Buy Hot Berries Classy Chain Sling Bag for Rs. 1599 from Flipkart.com. Only Genuine Products. 30 Day Replacement Guarantee. Free Shipping. Cash On,[],<div class="item_left_column" id="description"> <h3 class="item_desc_title fk-uppercase">Hot Berries Classy Chain Sling Bag (Dark Green)         Price: Rs.1599</h3> <div class="cls"></div> <div class="item_desc_text line"> <div style="float:right"> </div>                         Set hearts racing with this trendy and stylish sling bag. This clutch bag has a stylish metal plate on the flap with diamante for the twist and turn closure. It has a detachable chain sling and detachable wristlet making it very versatile. It also features: 1 compartment  2 inner zippered pockets  2 inner pockets  1 outer zippered pocket. Carry it to a party wearing shorts and a racerback top to for a look that spells trendy.        </div> <div style="clear: both;"></div> </div>,<div class="item_left_column" id="specifications"> <h3 class="item_desc_title fk-uppercase">         Specifications of Hot Berries Classy Chain Sling Bag (Dark Green)    </h3> <table cellspacing="0" class="fk-specs-type2"> <tr> <th class="group-head" colspan="2">General</th> </tr> <tr class=""> <td class="specs-key">Ideal For</td> <td class="specs-value fk-data">Women</td> </tr> <tr class=""> <td class="specs-key">Material</td> <td class="specs-value fk-data">Faux Leather</td> </tr> <tr class=""> <td class="specs-key">Style Code</td> <td class="specs-value fk-data">LCCOS-439</td> </tr> <tr class=""> <td class="specs-key">Color Code</td> <td class="specs-value fk-data">Dark Green</td> </tr> </table> </div>,11:03:2014,None
LSTSLBDS7SPHMZRDZGFN1WD1K,Hot Berries Sling Bag,http://www.flipkart.com/lifestyle/bags-wallets-belts/women?otracker=hp_nmenu_sub_women_0_Bags%2C%20Belts%20and%20wallets,Rs. 999,Bags  Belts and wallets,Slingbags,Hot Berries,http://img6a.flixcart.com/image/sling-bag/z/g/f/sbcos252-hot-berries-sling-bag-400x400-imadswyf5ngntbeh.jpeg,Rs. 999,Black,women,http://www.flipkart.com/hot-berries-sling-bag/p/itmds7sp7sf3wxcg?pid=SLBDS7SPHMZRDZGF&srno=b_2&ref=3d76829f-9771-4e68-a2a2-276535997690,Fashionara,Hot Berries Sling Bag Black - Price in India | Flipkart.com,Flipkart.com: Buy Hot Berries Sling Bag for Rs. 999 from Flipkart.com. Only Genuine Products. 30 Day Replacement Guarantee. Free Shipping. Cash On,[],<div class="item_left_column" id="description"> <h3 class="item_desc_title fk-uppercase">                 Key Features of Hot Berries Sling Bag (Black)            </h3> <div class="cls"></div> <div class="item_desc_text"> <ul class="fk-key-features"> <li>3 Pockets</li><li>Textured Design</li><li>Flap with Turn Lock Closure</li><li>1 Compartment</li><li>Ideal for Women</li> </ul> </div> <div style="clear: both;"></div> </div>,<div class="item_left_column" id="specifications"> <h3 class="item_desc_title fk-uppercase">         Specifications of Hot Berries Sling Bag (Black)    </h3> <table cellspacing="0" class="fk-specs-type2"> <tr> <th class="group-head" colspan="2">General</th> </tr> <tr class=""> <td class="specs-key">Type</td> <td class="specs-value fk-data">Sling Bag</td> </tr> <tr class=""> <td class="specs-key">Ideal For</td> <td class="specs-value fk-data">Women</td> </tr> <tr class=""> <td class="specs-key">Occasion</td> <td class="specs-value fk-data">Casual</td> </tr> <tr class=""> <td class="specs-key">Closure</td> <td class="specs-value fk-data">Flap with Turn Lock</td> </tr> <tr class=""> <td class="specs-key">Style Code</td> <td class="specs-value fk-data">SBCOS252</td> </tr> <tr class=""> <td class="specs-key">Color Code</td> <td class="specs-value fk-data">Black</td> </tr> </table> <table cellspacing="0" class="fk-specs-type2"> <tr> <th class="group-head" colspan="2">Body Features</th> </tr> <tr class=""> <td class="specs-key">Number of Pockets</td> <td class="specs-value fk-data">3</td> </tr> <tr class=""> <td class="specs-key">Number of Compartments</td> <td class="specs-value fk-data">1</td> </tr> <tr class=""> <td class="specs-key">Pattern</td> <td class="specs-value fk-data">Textured</td> </tr> <tr class=""> <td class="specs-key">Other Body Features</td> <td class="specs-value fk-data">Zippered Pocket  Inside Mobile Pocket  1 Adjustable Strap  Main Compartment  PDA Pocket</td> </tr> </table> <table cellspacing="0" class="fk-specs-type2"> <tr> <th class="group-head" colspan="2">Dimensions</th> </tr> <tr class=""> <td class="specs-key">Width</td> <td class="specs-value fk-data">235 mm</td> </tr> <tr class=""> <td class="specs-key">Height</td> <td class="specs-value fk-data">160 mm</td> </tr> <tr class=""> <td class="specs-key">Depth</td> <td class="specs-value fk-data">70 mm</td> </tr> </table> </div>,11:03:2014,None
LSTSLBDS7SP8UGBVWNNZJMQQJ,Hot Berries Sling Bag,http://www.flipkart.com/lifestyle/bags-wallets-belts/women?otracker=hp_nmenu_sub_women_0_Bags%2C%20Belts%20and%20wallets,Rs. 1049,Bags  Belts and wallets,Slingbags,Hot Berries,http://img5a.flixcart.com/image/sling-bag/w/n/n/sbcos292-hot-berries-sling-bag-400x400-imadsuw5ueqf9qde.jpeg,Rs. 1499,Blue,women,http://www.flipkart.com/hot-berries-sling-bag/p/itmds7spvgbxecbk?pid=SLBDS7SP8UGBVWNN&srno=b_1&ref=3d76829f-9771-4e68-a2a2-276535997690,WS Retail,Hot Berries Sling Bag Blue - Price in India | Flipkart.com,Flipkart.com: Buy Hot Berries Sling Bag for Rs. 1049 from Flipkart.com. Only Genuine Products. 30 Day Replacement Guarantee. Free Shipping. Cash On,[],<div class="item_left_column" id="description"> <h3 class="item_desc_title fk-uppercase">                 Key Features of Hot Berries Sling Bag (Blue)            </h3> <div class="cls"></div> <div class="item_desc_text"> <ul class="fk-key-features"> <li>Ideal for Women</li><li>3 Compartments</li><li>1 Pocket</li><li>Flap with Turn Lock Closure</li><li>Textured Design</li> </ul> </div> <div style="clear: both;"></div> </div>,<div class="item_left_column" id="specifications"> <h3 class="item_desc_title fk-uppercase">         Specifications of Hot Berries Sling Bag (Blue)    </h3> <table cellspacing="0" class="fk-specs-type2"> <tr> <th class="group-head" colspan="2">General</th> </tr> <tr class=""> <td class="specs-key">Type</td> <td class="specs-value fk-data">Sling Bag</td> </tr> <tr class=""> <td class="specs-key">Ideal For</td> <td class="specs-value fk-data">Women</td> </tr> <tr class=""> <td class="specs-key">Occasion</td> <td class="specs-value fk-data">Casual</td> </tr> <tr class=""> <td class="specs-key">Closure</td> <td class="specs-value fk-data">Flap with Turn Lock</td> </tr> <tr class=""> <td class="specs-key">Style Code</td> <td class="specs-value fk-data">SBCOS292</td> </tr> <tr class=""> <td class="specs-key">Color Code</td> <td class="specs-value fk-data">Blue</td> </tr> </table> <table cellspacing="0" class="fk-specs-type2"> <tr> <th class="group-head" colspan="2">Body Features</th> </tr> <tr class=""> <td class="specs-key">Number of Pockets</td> <td class="specs-value fk-data">1</td> </tr> <tr class=""> <td class="specs-key">Number of Compartments</td> <td class="specs-value fk-data">3</td> </tr> <tr class=""> <td class="specs-key">Pattern</td> <td class="specs-value fk-data">Textured</td> </tr> <tr class=""> <td class="specs-key">Other Body Features</td> <td class="specs-value fk-data">Zippered Compartment  Inside Zippered Pocket  Main Compartments  1 Metal Chain Strap</td> </tr> </table> <table cellspacing="0" class="fk-specs-type2"> <tr> <th class="group-head" colspan="2">Dimensions</th> </tr> <tr class=""> <td class="specs-key">Width</td> <td class="specs-value fk-data">290 mm</td> </tr> <tr class=""> <td class="specs-key">Height</td> <td class="specs-value fk-data">180 mm</td> </tr> <tr class=""> <td class="specs-key">Depth</td> <td class="specs-value fk-data">80 mm</td> </tr> </table> </div>,11:03:2014,None
LSTSLBDTHHM6Q9TGKBRBPHBTQ,Hot Berries Decorative Hand Strap Sling Bag,http://www.flipkart.com/lifestyle/bags-wallets-belts/women?otracker=hp_nmenu_sub_women_0_Bags%2C%20Belts%20and%20wallets,Rs. 1299,Bags  Belts and wallets,Slingbags,Hot Berries,http://img5a.flixcart.com/image/sling-bag/k/b/r/lcraj-008-hot-berries-decorative-hand-strap-400x400-imadthzksbecddfx.jpeg,Rs. 1299,Green,women,http://www.flipkart.com/hot-berries-decorative-hand-strap-sling-bag/p/itmdthhmz5qmzayg?pid=SLBDTHHM6Q9TGKBR&srno=b_7&ref=3d76829f-9771-4e68-a2a2-276535997690,Fashionara,Hot Berries Decorative Hand Strap Sling Bag Dark Green - Price in India | Flipkart.com,Flipkart.com: Buy Hot Berries Decorative Hand Strap Sling Bag for Rs. 1299 from Flipkart.com. Only Genuine Products. 30 Day Replacement Guarantee. Free Shipping. Cash On,[],<div class="item_left_column" id="description"> <h3 class="item_desc_title fk-uppercase">Hot Berries Decorative Hand Strap Sling Bag (Dark Green)         Price: Rs.1299</h3> <div class="cls"></div> <div class="item_desc_text line"> <div style="float:right"> </div>                         Go trendy with this sizzling clutch. Featuring a textured look  this oversized clutch has a studded hand strap anda strap that can be attached to convert it into a sling bag. It features: 1 compartment. Satin inner lining. 1 zippered inner pocket. Detachable sling strap. The gorgeous colour of this clutch will look best with a light coloured dress.        </div> <div style="clear: both;"></div> </div>,<div class="item_left_column" id="specifications"> <h3 class="item_desc_title fk-uppercase">         Specifications of Hot Berries Decorative Hand Strap Sling Bag (Dark Green)    </h3> <table cellspacing="0" class="fk-specs-type2"> <tr> <th class="group-head" colspan="2">General</th> </tr> <tr class=""> <td class="specs-key">Ideal For</td> <td class="specs-value fk-data">Women</td> </tr> <tr class=""> <td class="specs-key">Material</td> <td class="specs-value fk-data">Faux Leather</td> </tr> <tr class=""> <td class="specs-key">Style Code</td> <td class="specs-value fk-data">LCRAJ-008</td> </tr> <tr class=""> <td class="specs-key">Color Code</td> <td class="specs-value fk-data">Dark Green</td> </tr> </table> </div>,11:03:2014,None
LSTSLBDTHHMHFZHDHSYVFUCEA,Hot Berries Party All Night Sling Bag,http://www.flipkart.com/lifestyle/bags-wallets-belts/women?otracker=hp_nmenu_sub_women_0_Bags%2C%20Belts%20and%20wallets,Rs. 1599,Bags  Belts and wallets,Slingbags,Hot Berries,http://img5a.flixcart.com/image/sling-bag/h/s/y/lccos-441-hot-berries-party-all-night-400x400-imadthzksyzcytrf.jpeg,Rs. 1599,Black,women,http://www.flipkart.com/hot-berries-party-all-night-sling-bag/p/itmdthhmz9dztdvj?pid=SLBDTHHMHFZHDHSY&srno=b_6&ref=3d76829f-9771-4e68-a2a2-276535997690,Fashionara,Hot Berries Party All Night Sling Bag Black - Price in India | Flipkart.com,Flipkart.com: Buy Hot Berries Party All Night Sling Bag for Rs. 1599 from Flipkart.com. Only Genuine Products. 30 Day Replacement Guarantee. Free Shipping. Cash On,[],<div class="item_left_column" id="description"> <h3 class="item_desc_title fk-uppercase">Hot Berries Party All Night Sling Bag (Black)         Price: Rs.1599</h3> <div class="cls"></div> <div class="item_desc_text line"> <div style="float:right"> </div>                         Set hearts racing with this trendy and stylish sling bag. This clutch bag has a stylish metal plate on the flap with diamante for the twist and turn closure. It has a detachable chain sling and detachable wristlet making it very versatile. It also features: 1 compartment  2 inner zippered pockets  2 inner pockets  1 outer zippered pocket. Carry it to a party wearing shorts and a racerback top to for a look that spells trendy.        </div> <div style="clear: both;"></div> </div>,<div class="item_left_column" id="specifications"> <h3 class="item_desc_title fk-uppercase">         Specifications of Hot Berries Party All Night Sling Bag (Black)    </h3> <table cellspacing="0" class="fk-specs-type2"> <tr> <th class="group-head" colspan="2">General</th> </tr> <tr class=""> <td class="specs-key">Ideal For</td> <td class="specs-value fk-data">Women</td> </tr> <tr class=""> <td class="specs-key">Material</td> <td class="specs-value fk-data">Faux Leather</td> </tr> <tr class=""> <td class="specs-key">Style Code</td> <td class="specs-value fk-data">LCCOS-441</td> </tr> <tr class=""> <td class="specs-key">Color Code</td> <td class="specs-value fk-data">Black</td> </tr> </table> </div>,11:03:2014,None
LSTSLBDTHHMRH5NQ9CQATJPIA,Hot Berries Studded Hand Strap Sling Bag,http://www.flipkart.com/lifestyle/bags-wallets-belts/women?otracker=hp_nmenu_sub_women_0_Bags%2C%20Belts%20and%20wallets,Rs. 1299,Bags  Belts and wallets,Slingbags,Hot Berries,http://img6a.flixcart.com/image/sling-bag/9/c/q/lcraj-009-hot-berries-studded-hand-strap-400x400-imadthzk3knbefgy.jpeg,Rs. 1299,Red,women,http://www.flipkart.com/hot-berries-studded-hand-strap-sling-bag/p/itmdthhmuf9hxb3y?pid=SLBDTHHMRH5NQ9CQ&srno=b_8&ref=3d76829f-9771-4e68-a2a2-276535997690,Fashionara,Hot Berries Studded Hand Strap Sling Bag Red - Price in India | Flipkart.com,Flipkart.com: Buy Hot Berries Studded Hand Strap Sling Bag for Rs. 1299 from Flipkart.com. Only Genuine Products. 30 Day Replacement Guarantee. Free Shipping. Cash On,[],<div class="item_left_column" id="description"> <h3 class="item_desc_title fk-uppercase">Hot Berries Studded Hand Strap Sling Bag (Red)         Price: Rs.1299</h3> <div class="cls"></div> <div class="item_desc_text line"> <div style="float:right"> </div>                         Go trendy with this sizzling clutch. Featuring a textured look  this oversized clutch has a studded hand strap anda strap that can be attached to convert it into a sling bag. It features: 1 compartment. Satin inner lining. 1 zippered inner pocket. Detachable sling strap. The gorgeous colour of this clutch will look best with a light coloured dress.        </div> <div style="clear: both;"></div> </div>,<div class="item_left_column" id="specifications"> <h3 class="item_desc_title fk-uppercase">         Specifications of Hot Berries Studded Hand Strap Sling Bag (Red)    </h3> <table cellspacing="0" class="fk-specs-type2"> <tr> <th class="group-head" colspan="2">General</th> </tr> <tr class=""> <td class="specs-key">Ideal For</td> <td class="specs-value fk-data">Women</td> </tr> <tr class=""> <td class="specs-key">Material</td> <td class="specs-value fk-data">Faux Leather</td> </tr> <tr class=""> <td class="specs-key">Style Code</td> <td class="specs-value fk-data">LCRAJ-009</td> </tr> <tr class=""> <td class="specs-key">Color Code</td> <td class="specs-value fk-data">Red</td> </tr> </table> </div>,11:03:2014,None
LSTSLBDTHHMPMGXFFGFNBAKGU,Hot Berries Party Princess Sling Bag,http://www.flipkart.com/lifestyle/bags-wallets-belts/women?otracker=hp_nmenu_sub_women_0_Bags%2C%20Belts%20and%20wallets,Rs. 1599,Bags  Belts and wallets,Slingbags,Hot Berries,http://img5a.flixcart.com/image/sling-bag/f/g/f/lccos-440-hot-berries-party-princess-400x400-imadthzkg6gzfjzu.jpeg,Rs. 1599,Pink,women,http://www.flipkart.com/hot-berries-party-princess-sling-bag/p/itmdthhmf7hds35d?pid=SLBDTHHMPMGXFFGF&srno=b_5&ref=3d76829f-9771-4e68-a2a2-276535997690,Fashionara,Hot Berries Party Princess Sling Bag Dark Pink - Price in India | Flipkart.com,Flipkart.com: Buy Hot Berries Party Princess Sling Bag for Rs. 1599 from Flipkart.com. Only Genuine Products. 30 Day Replacement Guarantee. Free Shipping. Cash On,[],<div class="item_left_column" id="description"> <h3 class="item_desc_title fk-uppercase">Hot Berries Party Princess Sling Bag (Dark Pink)         Price: Rs.1599</h3> <div class="cls"></div> <div class="item_desc_text line"> <div style="float:right"> </div>                         Set hearts racing with this trendy and stylish sling bag. This clutch bag has a stylish metal plate on the flap with diamante for the twist and turn closure. It has a detachable chain sling and detachable wristlet making it very versatile. It also features: 1 compartment  2 inner zippered pockets  2 inner pockets  1 outer zippered pocket. Carry it to a party wearing shorts and a racerback top to for a look that spells trendy.        </div> <div style="clear: both;"></div> </div>,<div class="item_left_column" id="specifications"> <h3 class="item_desc_title fk-uppercase">         Specifications of Hot Berries Party Princess Sling Bag (Dark Pink)    </h3> <table cellspacing="0" class="fk-specs-type2"> <tr> <th class="group-head" colspan="2">General</th> </tr> <tr class=""> <td class="specs-key">Ideal For</td> <td class="specs-value fk-data">Women</td> </tr> <tr class=""> <td class="specs-key">Material</td> <td class="specs-value fk-data">Faux Leather</td> </tr> <tr class=""> <td class="specs-key">Style Code</td> <td class="specs-value fk-data">LCCOS-440</td> </tr> <tr class=""> <td class="specs-key">Color Code</td> <td class="specs-value fk-data">Dark Pink</td> </tr> </table> </div>,11:03:2014,None
LSTSLBDS7SP5JERKY7JPWTDWA,Hot Berries Sling Bag,http://www.flipkart.com/lifestyle/bags-wallets-belts/women?otracker=hp_nmenu_sub_women_0_Bags%2C%20Belts%20and%20wallets,Rs. 1299,Bags  Belts and wallets,Slingbags,Hot Berries,http://img5a.flixcart.com/image/sling-bag/y/7/j/sbcos187-hot-berries-sling-bag-400x400-imadswyffz9r54zv.jpeg,Rs. 1299,Green,women,http://www.flipkart.com/hot-berries-sling-bag/p/itmds7sp3zhvwwhm?pid=SLBDS7SP5JERKY7J&srno=b_3&ref=3d76829f-9771-4e68-a2a2-276535997690,Fashionara,Hot Berries Sling Bag Green - Price in India | Flipkart.com,Flipkart.com: Buy Hot Berries Sling Bag for Rs. 1299 from Flipkart.com. Only Genuine Products. 30 Day Replacement Guarantee. Free Shipping. Cash On,[],<div class="item_left_column" id="description"> <h3 class="item_desc_title fk-uppercase">                 Key Features of Hot Berries Sling Bag (Green)            </h3> <div class="cls"></div> <div class="item_desc_text"> <ul class="fk-key-features"> <li>1 Compartment</li><li>2 Pockets</li><li>Stitch Design</li><li>Flap with Turn Lock Closure</li><li>Ideal for Women</li> </ul> </div> <div style="clear: both;"></div> </div>,<div class="item_left_column" id="specifications"> <h3 class="item_desc_title fk-uppercase">         Specifications of Hot Berries Sling Bag (Green)    </h3> <table cellspacing="0" class="fk-specs-type2"> <tr> <th class="group-head" colspan="2">General</th> </tr> <tr class=""> <td class="specs-key">Type</td> <td class="specs-value fk-data">Sling Bag</td> </tr> <tr class=""> <td class="specs-key">Ideal For</td> <td class="specs-value fk-data">Women</td> </tr> <tr class=""> <td class="specs-key">Occasion</td> <td class="specs-value fk-data">Casual</td> </tr> <tr class=""> <td class="specs-key">Closure</td> <td class="specs-value fk-data">Flap with Turn Lock</td> </tr> <tr class=""> <td class="specs-key">Style Code</td> <td class="specs-value fk-data">SBCOS187</td> </tr> <tr class=""> <td class="specs-key">Color Code</td> <td class="specs-value fk-data">Green</td> </tr> </table> <table cellspacing="0" class="fk-specs-type2"> <tr> <th class="group-head" colspan="2">Body Features</th> </tr> <tr class=""> <td class="specs-key">Number of Pockets</td> <td class="specs-value fk-data">2</td> </tr> <tr class=""> <td class="specs-key">Number of Compartments</td> <td class="specs-value fk-data">1</td> </tr> <tr class=""> <td class="specs-key">Pattern</td> <td class="specs-value fk-data">Stitch</td> </tr> <tr class=""> <td class="specs-key">Other Body Features</td> <td class="specs-value fk-data">Inside Mobile Pocket and PDA Pocket  Main Compartment  1 Detachable Strap</td> </tr> </table> <table cellspacing="0" class="fk-specs-type2"> <tr> <th class="group-head" colspan="2">Dimensions</th> </tr> <tr class=""> <td class="specs-key">Width</td> <td class="specs-value fk-data">285 mm</td> </tr> <tr class=""> <td class="specs-key">Height</td> <td class="specs-value fk-data">120 mm</td> </tr> <tr class=""> <td class="specs-key">Depth</td> <td class="specs-value fk-data">80 mm</td> </tr> </table> </div>,11:03:2014,None
