{'sku': [u'/viewcart?eid=LSTHMBDR5Y2WZGPB7YVGSZAIZ'], 'seller': [u'CleanPlanet'], 'title': [u'\n                    Clean Planet Bag of the Year 2014 - Urban Style Tote            '], 'colour': [], 'sp': [u' Rs. 345'], 'mrp': [u'Rs. 495'], 'titleimg': [u'http://img6a.flixcart.com/image/hand-messenger-bag/7/y/v/2014calendarbag04-clean-planet-tote-bag-of-the-year-2014-urban-400x400-imadr6b7myzbg2r5.jpeg'], 'catname': ['totes'], 'brandname': ['Clean Planet.'], 'date': ['18:02:2014'], 'itemlink': ['http://www.flipkart.com/clean-planet-bag-year-2014-urban-style-tote/p/itmdr5y2kuqfjupj?pid=HMBDR5Y2WZGPB7YV&srno=b_20&ref=ae628545-3dff-40db-8059-dc5e6d3dfcfd'], 'desc': [u'<div class="item_left_column" id="description">\n        <h3 class="item_desc_title fk-uppercase">Clean Planet Bag of the Year 2014 - Urban Style Tote (Dark Brown)         Price: Rs.345</h3>\n        <div class="cls"></div>\n        <div class="item_desc_text line">\n            <div style="float:right">\n                \n \n            </div>\n                        Welcome 2014 with our cool and chic Bag of the Year, Heres a Bag that is more than just a bag. Versatile in its utility, it makes for a nifty calendar, which does not need monthly flipping, or as a handy file-folder for your important letters, documents, etc. or as a cool looking wall calendar for your home or office. And when the year?s done, just turn it over and carry it around. At the beginning of every year our office is flooded with calendars that quite frankly are eyesores, with more focus on celebrities than readable print. It also occurred to us that these calendars are thrown away at the end of the year. So we dug deep into our passion for creating reusable, versatile and enduring products and it was thus that the Bag of the Year came to be. Its stylish readable print makes it the perfect wall calendar plus it snugly holds all that mail that?s often misplaced at home or at work. The only date missing on this calendar is an expiration date, because when the year?s over you simply turn it inside out to carry along as a stylish Eco tote, This New Year do away with the same old boring paper calendar and get a stylish new Bag of the Year instead.        </div>\n        <div style="clear: both;"></div>\n            </div>'], 'spec': [u'<div id="specifications" class="item_left_column">\n    <h3 class="item_desc_title fk-uppercase">\n        Specifications of Clean Planet Bag of the Year 2014 - Urban Style Tote (Dark Brown)    </h3>\n\n            <table cellspacing="0" class="fk-specs-type2"><tr><th class="group-head" colspan="2">General</th>\n            </tr><tr class=""><td class="specs-key">Type</td>\n                                        <td class="specs-value fk-data">Tote</td>\n                </tr><tr class=""><td class="specs-key">Ideal For</td>\n                                        <td class="specs-value fk-data">Men, Women</td>\n                </tr><tr class=""><td class="specs-key">Bag Size</td>\n                                        <td class="specs-value fk-data">Free Size</td>\n                </tr><tr class=""><td class="specs-key">Occasion</td>\n                                        <td class="specs-value fk-data">Casual</td>\n                </tr><tr class=""><td class="specs-key">Material</td>\n                                        <td class="specs-value fk-data">Cotton</td>\n                </tr><tr class=""><td class="specs-key">Style Code</td>\n                                        <td class="specs-value fk-data">2014CALENDARBAG04</td>\n                </tr><tr class=""><td class="specs-key">Color Code</td>\n                                        <td class="specs-value fk-data">Dark Brown</td>\n                </tr></table><table cellspacing="0" class="fk-specs-type2"><tr><th class="group-head" colspan="2">Body Features</th>\n            </tr><tr class=""><td class="specs-key">Number of Compartments</td>\n                                        <td class="specs-value fk-data">1</td>\n                </tr><tr class=""><td class="specs-key">Bag Design</td>\n                                        <td class="specs-value fk-data">Urban</td>\n                </tr></table><table cellspacing="0" class="fk-specs-type2"><tr><th class="group-head" colspan="2">Dimensions</th>\n            </tr><tr class=""><td class="specs-key">Width</td>\n                                        <td class="specs-value fk-data">406.4 mm</td>\n                </tr><tr class=""><td class="specs-key">Height</td>\n                                        <td class="specs-value fk-data">317.5 mm</td>\n                </tr></table></div>'], 'size': []}
{'sku': [u'/viewcart?eid=LSTHMBDEFWVABBHZW6MP4RD6Z'], 'seller': [u'CleanPlanet'], 'title': [u'\n                    Clean Planet Warm Tote            '], 'colour': [], 'sp': [u' Rs. 950'], 'mrp': [], 'titleimg': [u'http://img6a.flixcart.com/image/hand-messenger-bag/w/6/m/cosmopolita-clean-planet-tote-warm-400x400-imade58s5qrv7s3z.jpeg'], 'catname': ['totes'], 'brandname': ['Clean Planet.'], 'date': ['18:02:2014'], 'itemlink': ['http://www.flipkart.com/clean-planet-warm-tote/p/itmdpznbuujxrmhn?pid=HMBDEFWVABBHZW6M&srno=b_17&ref=ae628545-3dff-40db-8059-dc5e6d3dfcfd'], 'desc': [u'<div class="item_left_column" id="description">\n            <h3 class="item_desc_title fk-uppercase">\n                Key Features of Clean Planet Warm Tote (Jigsaw Brown)            </h3>\n            <div class="cls"></div>\n            <div class="item_desc_text">\n                <ul class="fk-key-features"><li>1 Compartment</li><li>Tote</li><li>Ideal for Men and Women</li><li>2 Pockets</li><li>Made of Recycled Wool</li>                </ul></div>\n            <div style="clear: both;"></div>\n        </div>'], 'spec': [u'<div id="specifications" class="item_left_column">\n    <h3 class="item_desc_title fk-uppercase">\n        Specifications of Clean Planet Warm Tote (Jigsaw Brown)    </h3>\n\n            <table cellspacing="0" class="fk-specs-type2"><tr><th class="group-head" colspan="2">General</th>\n            </tr><tr class=""><td class="specs-key">Type</td>\n                                        <td class="specs-value fk-data">Tote</td>\n                </tr><tr class=""><td class="specs-key">Ideal For</td>\n                                        <td class="specs-value fk-data">Men, Women</td>\n                </tr><tr class=""><td class="specs-key">Occasion</td>\n                                        <td class="specs-value fk-data">Casual</td>\n                </tr><tr class=""><td class="specs-key">Material</td>\n                                        <td class="specs-value fk-data">Recycled Wool</td>\n                </tr><tr class=""><td class="specs-key">Style Code</td>\n                                        <td class="specs-value fk-data">Cosmopolita</td>\n                </tr><tr class=""><td class="specs-key">Color Code</td>\n                                        <td class="specs-value fk-data">Jigsaw Brown</td>\n                </tr></table><table cellspacing="0" class="fk-specs-type2"><tr><th class="group-head" colspan="2">Body Features</th>\n            </tr><tr class=""><td class="specs-key">Number of Pockets</td>\n                                        <td class="specs-value fk-data">2</td>\n                </tr><tr class=""><td class="specs-key">Number of Compartments</td>\n                                        <td class="specs-value fk-data">1</td>\n                </tr><tr class=""><td class="specs-key">Other Body Features</td>\n                                        <td class="specs-value fk-data">Jacket Style Lining, Button-down Outer Pocket, Double Stitching</td>\n                </tr></table><table cellspacing="0" class="fk-specs-type2"><tr><th class="group-head" colspan="2">Dimensions</th>\n            </tr><tr class=""><td class="specs-key">Width</td>\n                                        <td class="specs-value fk-data">330.2 mm</td>\n                </tr><tr class=""><td class="specs-key">Height</td>\n                                        <td class="specs-value fk-data">381 mm</td>\n                </tr></table></div>'], 'size': []}
{'sku': [u'/viewcart?eid=LSTHMBDR5Y2YKRYVFHPHZOGBY'], 'seller': [u'CleanPlanet'], 'title': [u'\n                    Clean Planet Bag of the Year 2014 - Urban Style Tote            '], 'colour': [], 'sp': [u' Rs. 345'], 'mrp': [u'Rs. 495'], 'titleimg': [u'http://img6a.flixcart.com/image/hand-messenger-bag/f/h/p/2014calendarbag06-clean-planet-tote-bag-of-the-year-2014-urban-400x400-imadr6b7s3hhhgbz.jpeg'], 'catname': ['totes'], 'brandname': ['Clean Planet.'], 'date': ['18:02:2014'], 'itemlink': ['http://www.flipkart.com/clean-planet-bag-year-2014-urban-style-tote/p/itmdr5y2bwp7psur?pid=HMBDR5Y2YKRYVFHP&srno=b_22&ref=ae628545-3dff-40db-8059-dc5e6d3dfcfd'], 'desc': [u'<div class="item_left_column" id="description">\n        <h3 class="item_desc_title fk-uppercase">Clean Planet Bag of the Year 2014 - Urban Style Tote (Deep Blue)         Price: Rs.345</h3>\n        <div class="cls"></div>\n        <div class="item_desc_text line">\n            <div style="float:right">\n                \n \n            </div>\n                        Welcome 2014 with our cool and chic Bag of the Year, Heres a Bag that is more than just a bag. Versatile in its utility, it makes for a nifty calendar, which does not need monthly flipping, or as a handy file-folder for your important letters, documents, etc. or as a cool looking wall calendar for your home or office. And when the year?s done, just turn it over and carry it around. At the beginning of every year our office is flooded with calendars that quite frankly are eyesores, with more focus on celebrities than readable print. It also occurred to us that these calendars are thrown away at the end of the year. So we dug deep into our passion for creating reusable, versatile and enduring products and it was thus that the Bag of the Year came to be. Its stylish readable print makes it the perfect wall calendar plus it snugly holds all that mail that?s often misplaced at home or at work. The only date missing on this calendar is an expiration date, because when the year?s over you simply turn it inside out to carry along as a stylish Eco tote, This New Year do away with the same old boring paper calendar and get a stylish new Bag of the Year instead.        </div>\n        <div style="clear: both;"></div>\n            </div>'], 'spec': [u'<div id="specifications" class="item_left_column">\n    <h3 class="item_desc_title fk-uppercase">\n        Specifications of Clean Planet Bag of the Year 2014 - Urban Style Tote (Deep Blue)    </h3>\n\n            <table cellspacing="0" class="fk-specs-type2"><tr><th class="group-head" colspan="2">General</th>\n            </tr><tr class=""><td class="specs-key">Type</td>\n                                        <td class="specs-value fk-data">Tote</td>\n                </tr><tr class=""><td class="specs-key">Ideal For</td>\n                                        <td class="specs-value fk-data">Men, Women</td>\n                </tr><tr class=""><td class="specs-key">Bag Size</td>\n                                        <td class="specs-value fk-data">Free Size</td>\n                </tr><tr class=""><td class="specs-key">Occasion</td>\n                                        <td class="specs-value fk-data">Casual</td>\n                </tr><tr class=""><td class="specs-key">Material</td>\n                                        <td class="specs-value fk-data">Cotton</td>\n                </tr><tr class=""><td class="specs-key">Style Code</td>\n                                        <td class="specs-value fk-data">2014CALENDARBAG06</td>\n                </tr><tr class=""><td class="specs-key">Color Code</td>\n                                        <td class="specs-value fk-data">Deep Blue</td>\n                </tr></table><table cellspacing="0" class="fk-specs-type2"><tr><th class="group-head" colspan="2">Body Features</th>\n            </tr><tr class=""><td class="specs-key">Number of Compartments</td>\n                                        <td class="specs-value fk-data">1</td>\n                </tr><tr class=""><td class="specs-key">Bag Design</td>\n                                        <td class="specs-value fk-data">Urban</td>\n                </tr></table><table cellspacing="0" class="fk-specs-type2"><tr><th class="group-head" colspan="2">Dimensions</th>\n            </tr><tr class=""><td class="specs-key">Width</td>\n                                        <td class="specs-value fk-data">406.4 mm</td>\n                </tr><tr class=""><td class="specs-key">Height</td>\n                                        <td class="specs-value fk-data">317.5 mm</td>\n                </tr></table></div>'], 'size': []}
{'sku': [u'/viewcart?eid=LSTHMBDR5Y2HHHXBSJAFML1A4'], 'seller': [u'CleanPlanet'], 'title': [u'\n                    Clean Planet Bag of the Year 2014 - Contemporary Style Tote            '], 'colour': [], 'sp': [u' Rs. 345'], 'mrp': [u'Rs. 495'], 'titleimg': [u'http://img5a.flixcart.com/image/hand-messenger-bag/s/j/a/2014calendarbag05-clean-planet-tote-bag-of-the-year-2014-400x400-imadr6b7skurnhwf.jpeg'], 'catname': ['totes'], 'brandname': ['Clean Planet.'], 'date': ['18:02:2014'], 'itemlink': ['http://www.flipkart.com/clean-planet-bag-year-2014-contemporary-style-tote/p/itmdr5y2fdzwwtyk?pid=HMBDR5Y2HHHXBSJA&srno=b_21&ref=ae628545-3dff-40db-8059-dc5e6d3dfcfd'], 'desc': [u'<div class="item_left_column" id="description">\n        <h3 class="item_desc_title fk-uppercase">Clean Planet Bag of the Year 2014 - Contemporary Style Tote (Deep Blue)         Price: Rs.345</h3>\n        <div class="cls"></div>\n        <div class="item_desc_text line">\n            <div style="float:right">\n                \n \n            </div>\n                        Welcome 2014 with our cool and chic Bag of the Year, Heres a Bag that is more than just a bag. Versatile in its utility, it makes for a nifty calendar, which does not need monthly flipping, or as a handy file-folder for your important letters, documents, etc. or as a cool looking wall calendar for your home or office. And when the year?s done, just turn it over and carry it around. At the beginning of every year our office is flooded with calendars that quite frankly are eyesores, with more focus on celebrities than readable print. It also occurred to us that these calendars are thrown away at the end of the year. So we dug deep into our passion for creating reusable, versatile and enduring products and it was thus that the Bag of the Year came to be. Its stylish readable print makes it the perfect wall calendar plus it snugly holds all that mail that?s often misplaced at home or at work. The only date missing on this calendar is an expiration date, because when the year?s over you simply turn it inside out to carry along as a stylish Eco tote, This New Year do away with the same old boring paper calendar and get a stylish new Bag of the Year instead.        </div>\n        <div style="clear: both;"></div>\n            </div>'], 'spec': [u'<div id="specifications" class="item_left_column">\n    <h3 class="item_desc_title fk-uppercase">\n        Specifications of Clean Planet Bag of the Year 2014 - Contemporary Style Tote (Deep Blue)    </h3>\n\n            <table cellspacing="0" class="fk-specs-type2"><tr><th class="group-head" colspan="2">General</th>\n            </tr><tr class=""><td class="specs-key">Type</td>\n                                        <td class="specs-value fk-data">Tote</td>\n                </tr><tr class=""><td class="specs-key">Ideal For</td>\n                                        <td class="specs-value fk-data">Men, Women</td>\n                </tr><tr class=""><td class="specs-key">Bag Size</td>\n                                        <td class="specs-value fk-data">Free Size</td>\n                </tr><tr class=""><td class="specs-key">Occasion</td>\n                                        <td class="specs-value fk-data">Casual</td>\n                </tr><tr class=""><td class="specs-key">Material</td>\n                                        <td class="specs-value fk-data">Cotton</td>\n                </tr><tr class=""><td class="specs-key">Style Code</td>\n                                        <td class="specs-value fk-data">2014CALENDARBAG05</td>\n                </tr><tr class=""><td class="specs-key">Color Code</td>\n                                        <td class="specs-value fk-data">Deep Blue</td>\n                </tr></table><table cellspacing="0" class="fk-specs-type2"><tr><th class="group-head" colspan="2">Body Features</th>\n            </tr><tr class=""><td class="specs-key">Number of Compartments</td>\n                                        <td class="specs-value fk-data">1</td>\n                </tr><tr class=""><td class="specs-key">Bag Design</td>\n                                        <td class="specs-value fk-data">Contemporary</td>\n                </tr></table><table cellspacing="0" class="fk-specs-type2"><tr><th class="group-head" colspan="2">Dimensions</th>\n            </tr><tr class=""><td class="specs-key">Width</td>\n                                        <td class="specs-value fk-data">406.4 mm</td>\n                </tr><tr class=""><td class="specs-key">Height</td>\n                                        <td class="specs-value fk-data">317.5 mm</td>\n                </tr></table></div>'], 'size': []}
{'sku': [u'/viewcart?eid=LSTHMBDQXBWZB5YYRMRNTGHYI'], 'seller': [u'CleanPlanet'], 'title': [u'\n                    Clean Planet Bag of the Year 2014 - Office style Tote            '], 'colour': [], 'sp': [u' Rs. 345'], 'mrp': [u'Rs. 495'], 'titleimg': [u'http://img6a.flixcart.com/image/hand-messenger-bag/r/m/r/2014calendarbag02-clean-planet-tote-bag-of-the-year-2014-office-400x400-imadqy397p4qpnd8.jpeg'], 'catname': ['totes'], 'brandname': ['Clean Planet.'], 'date': ['18:02:2014'], 'itemlink': ['http://www.flipkart.com/clean-planet-bag-year-2014-office-style-tote/p/itmdqxbwcweh4xfn?pid=HMBDQXBWZB5YYRMR&srno=b_19&ref=ae628545-3dff-40db-8059-dc5e6d3dfcfd'], 'desc': [u'<div class="item_left_column" id="description">\n        <h3 class="item_desc_title fk-uppercase">Clean Planet Bag of the Year 2014 - Office style Tote (Shell Cream)         Price: Rs.345</h3>\n        <div class="cls"></div>\n        <div class="item_desc_text line">\n            <div style="float:right">\n                \n \n            </div>\n                        Welcome 2014 with our cool and chic Bag of the Year, Here is a Bag that is more than just a bag. Versatile in its utility, it makes for a nifty calendar, which does not need monthly flipping, or as a handy file-folder for your important letters, documents, etc. or as a cool looking wall calendar for your home or office . And when the years done, just turn it over and carry it around.This New Year do away with the same old boring paper calendar and get a stylish new Bag of the Year instead.        </div>\n        <div style="clear: both;"></div>\n            </div>'], 'spec': [u'<div id="specifications" class="item_left_column">\n    <h3 class="item_desc_title fk-uppercase">\n        Specifications of Clean Planet Bag of the Year 2014 - Office style Tote (Shell Cream)    </h3>\n\n            <table cellspacing="0" class="fk-specs-type2"><tr><th class="group-head" colspan="2">General</th>\n            </tr><tr class=""><td class="specs-key">Type</td>\n                                        <td class="specs-value fk-data">Tote</td>\n                </tr><tr class=""><td class="specs-key">Ideal For</td>\n                                        <td class="specs-value fk-data">Women, Men</td>\n                </tr><tr class=""><td class="specs-key">Bag Size</td>\n                                        <td class="specs-value fk-data">Free size</td>\n                </tr><tr class=""><td class="specs-key">Occasion</td>\n                                        <td class="specs-value fk-data">Casual</td>\n                </tr><tr class=""><td class="specs-key">Material</td>\n                                        <td class="specs-value fk-data">Cotton</td>\n                </tr><tr class=""><td class="specs-key">Style Code</td>\n                                        <td class="specs-value fk-data">2014CALENDARBAG02</td>\n                </tr><tr class=""><td class="specs-key">Color Code</td>\n                                        <td class="specs-value fk-data">Shell Cream</td>\n                </tr></table><table cellspacing="0" class="fk-specs-type2"><tr><th class="group-head" colspan="2">Body Features</th>\n            </tr><tr class=""><td class="specs-key">Number of Compartments</td>\n                                        <td class="specs-value fk-data">1</td>\n                </tr><tr class=""><td class="specs-key">Bag Design</td>\n                                        <td class="specs-value fk-data">Office Like</td>\n                </tr></table><table cellspacing="0" class="fk-specs-type2"><tr><th class="group-head" colspan="2">Dimensions</th>\n            </tr><tr class=""><td class="specs-key">Width</td>\n                                        <td class="specs-value fk-data">406.4 mm</td>\n                </tr><tr class=""><td class="specs-key">Height</td>\n                                        <td class="specs-value fk-data">317.5 mm</td>\n                </tr></table></div>'], 'size': []}
