{'sku': [u'/viewcart?eid=LSTHMBDAZXHGCPHUGHFUGXWKU'], 'seller': [u'CleanPlanet'], 'title': [u'\n                    Clean Planet Imagine Classic Short Handle Tote            '], 'colour': [u'Black'], 'sp': [u' Rs. 795'], 'mrp': [], 'titleimg': [u'http://img5a.flixcart.com/image/hand-messenger-bag/g/h/f/classic-short-handle-clean-planet-tote-imagine-classic-short-handle-400x400-imadggxf9gb9gg3y.jpeg'], 'catname': ['totes'], 'brandname': ['Clean Planet.'], 'date': ['18:02:2014'], 'itemlink': ['http://www.flipkart.com/clean-planet-imagine-classic-short-handle-tote/p/itmdpznbfzyqykz9?pid=HMBDAZXHGCPHUGHF&srno=b_8&ref=55fcdcc4-dd53-473d-99d9-7b29d098ad77'], 'desc': [u'<div class="item_left_column" id="description">\n        <h3 class="item_desc_title fk-uppercase">Clean Planet Imagine Classic Short Handle Tote (Wood Brown)         Price: Rs.795</h3>\n        <div class="cls"></div>\n        <div class="item_desc_text line">\n            <div style="float:right">\n                \n \n            </div>\n                            <h3><b> Key Features </b></h3>\n                <div class="line bmargin10">\n                    <ul class="feature_bullet"><li><span>Tote</span></li><li><span>Graphic Print Design</span></li><li><span>1 Pocket</span></li><li><span>Free Size</span></li><li><span>Made of Cotton Canvas</span></li><li><span>1 Compartment</span></li><li><span>Ideal for Unisex</span></li>                    </ul></div>\n                        <p style="text-align: justify;">\r\n\tCustomized to cater to your go-green conscious, this Clean Planet Imagine Classic Short Handle Tote - Unisex is certainly a must-have accessory of your wardrobe. <strong>Made of hundred per cent cotton canvas</strong>, this tote bag ensures a secure and firm support to all the basic essentials while you are on the move. This free-size tote bag is embellished with exquisite graphic print design that makes it an exclusive fashion accessory. Crafted for convenience, this\xa0<strong>Clean Planet Imagine Classic Short Handle Tote - Unisex\xa0consists of capacious interiors</strong> that are equipped with one pocket and one compartment, accommodating all your possessions without any hassle. This tote bag measures 285.75 x 406.4 mm in dimension, is lightweight and easy to handle while use. Besides this, the bag weighs 154 g and is certainly an easily portable satchel on the go. This Clean Planet Imagine Classic Short Handle Tote - Unisex is perfect for casual daily use.</p>        </div>\n        <div style="clear: both;"></div>\n            </div>'], 'spec': [u'<div id="specifications" class="item_left_column">\n    <h3 class="item_desc_title fk-uppercase">\n        Specifications of Clean Planet Imagine Classic Short Handle Tote (Wood Brown)    </h3>\n\n            <table cellspacing="0" class="fk-specs-type2"><tr><th class="group-head" colspan="2">General</th>\n            </tr><tr class=""><td class="specs-key">Type</td>\n                                        <td class="specs-value fk-data">Tote</td>\n                </tr><tr class=""><td class="specs-key">Ideal For</td>\n                                        <td class="specs-value fk-data">Men, Women</td>\n                </tr><tr class=""><td class="specs-key">Bag Size</td>\n                                        <td class="specs-value fk-data">Free Size</td>\n                </tr><tr class=""><td class="specs-key">Occasion</td>\n                                        <td class="specs-value fk-data">Casual</td>\n                </tr><tr class=""><td class="specs-key">Material</td>\n                                        <td class="specs-value fk-data">Cotton Canvas</td>\n                </tr><tr class=""><td class="specs-key">Style Code</td>\n                                        <td class="specs-value fk-data">Classic Short Handle</td>\n                </tr><tr class=""><td class="specs-key">Color Code</td>\n                                        <td class="specs-value fk-data">Wood Brown</td>\n                </tr></table><table cellspacing="0" class="fk-specs-type2"><tr><th class="group-head" colspan="2">Body Features</th>\n            </tr><tr class=""><td class="specs-key">Number of Pockets</td>\n                                        <td class="specs-value fk-data">1</td>\n                </tr><tr class=""><td class="specs-key">Number of Compartments</td>\n                                        <td class="specs-value fk-data">1</td>\n                </tr><tr class=""><td class="specs-key">Bag Design</td>\n                                        <td class="specs-value fk-data">Graphic Print</td>\n                </tr></table><table cellspacing="0" class="fk-specs-type2"><tr><th class="group-head" colspan="2">Dimensions</th>\n            </tr><tr class=""><td class="specs-key">Width</td>\n                                        <td class="specs-value fk-data">285.75 mm</td>\n                </tr><tr class=""><td class="specs-key">Height</td>\n                                        <td class="specs-value fk-data">406.4 mm</td>\n                </tr><tr class=""><td class="specs-key">Weight</td>\n                                        <td class="specs-value fk-data">154 g</td>\n                </tr></table></div>'], 'size': []}
{'sku': [u'/viewcart?eid=LSTHMBDR5Y2KXCANBSW9G3UZH'], 'seller': [u'CleanPlanet'], 'title': [u'\n                    Clean Planet Bag of the Year 2014 - Contemporary Style Tote            '], 'colour': [], 'sp': [u' Rs. 345'], 'mrp': [u'Rs. 495'], 'titleimg': [u'http://img5a.flixcart.com/image/hand-messenger-bag/b/s/w/2014calendarbag03-clean-planet-tote-bag-of-the-year-2014-400x400-imadr6b8zhegasyz.jpeg'], 'catname': ['totes'], 'brandname': ['Clean Planet.'], 'date': ['18:02:2014'], 'itemlink': ['http://www.flipkart.com/clean-planet-bag-year-2014-contemporary-style-tote/p/itmdr5y2hh9gqj4k?pid=HMBDR5Y2KXCANBSW&srno=b_7&ref=55fcdcc4-dd53-473d-99d9-7b29d098ad77'], 'desc': [u'<div class="item_left_column" id="description">\n        <h3 class="item_desc_title fk-uppercase">Clean Planet Bag of the Year 2014 - Contemporary Style Tote (Dark Brown)         Price: Rs.345</h3>\n        <div class="cls"></div>\n        <div class="item_desc_text line">\n            <div style="float:right">\n                \n \n            </div>\n                        Welcome 2014 with our cool and chic Bag of the Year, Heres a Bag that is more than just a bag. Versatile in its utility, it makes for a nifty calendar, which does not need monthly flipping, or as a handy file-folder for your important letters, documents, etc. or as a cool looking wall calendar for your home or office. And when the year?s done, just turn it over and carry it around. At the beginning of every year our office is flooded with calendars that quite frankly are eyesores, with more focus on celebrities than readable print. It also occurred to us that these calendars are thrown away at the end of the year. So we dug deep into our passion for creating reusable, versatile and enduring products and it was thus that the Bag of the Year came to be. Its stylish readable print makes it the perfect wall calendar plus it snugly holds all that mail that?s often misplaced at home or at work. The only date missing on this calendar is an expiration date, because when the year?s over you simply turn it inside out to carry along as a stylish Eco tote, This New Year do away with the same old boring paper calendar and get a stylish new Bag of the Year instead.        </div>\n        <div style="clear: both;"></div>\n            </div>'], 'spec': [u'<div id="specifications" class="item_left_column">\n    <h3 class="item_desc_title fk-uppercase">\n        Specifications of Clean Planet Bag of the Year 2014 - Contemporary Style Tote (Dark Brown)    </h3>\n\n            <table cellspacing="0" class="fk-specs-type2"><tr><th class="group-head" colspan="2">General</th>\n            </tr><tr class=""><td class="specs-key">Type</td>\n                                        <td class="specs-value fk-data">Tote</td>\n                </tr><tr class=""><td class="specs-key">Ideal For</td>\n                                        <td class="specs-value fk-data">Men, Women</td>\n                </tr><tr class=""><td class="specs-key">Bag Size</td>\n                                        <td class="specs-value fk-data">Free Size</td>\n                </tr><tr class=""><td class="specs-key">Occasion</td>\n                                        <td class="specs-value fk-data">Casual</td>\n                </tr><tr class=""><td class="specs-key">Material</td>\n                                        <td class="specs-value fk-data">Cotton</td>\n                </tr><tr class=""><td class="specs-key">Style Code</td>\n                                        <td class="specs-value fk-data">2014CALENDARBAG03</td>\n                </tr><tr class=""><td class="specs-key">Color Code</td>\n                                        <td class="specs-value fk-data">Dark Brown</td>\n                </tr></table><table cellspacing="0" class="fk-specs-type2"><tr><th class="group-head" colspan="2">Body Features</th>\n            </tr><tr class=""><td class="specs-key">Number of Compartments</td>\n                                        <td class="specs-value fk-data">1</td>\n                </tr><tr class=""><td class="specs-key">Bag Design</td>\n                                        <td class="specs-value fk-data">Contemporary</td>\n                </tr></table><table cellspacing="0" class="fk-specs-type2"><tr><th class="group-head" colspan="2">Dimensions</th>\n            </tr><tr class=""><td class="specs-key">Width</td>\n                                        <td class="specs-value fk-data">406.4 mm</td>\n                </tr><tr class=""><td class="specs-key">Height</td>\n                                        <td class="specs-value fk-data">317.5 mm</td>\n                </tr></table></div>'], 'size': []}
{'sku': [u'/viewcart?eid=LSTHMBDAZXHSFDVGPHPHNJTS9'], 'seller': [u'CleanPlanet'], 'title': [u'\n                    Clean Planet Wise RekTangle Pale Blue Dot Tote            '], 'colour': [], 'sp': [u' Rs. 795'], 'mrp': [], 'titleimg': [u'http://img6a.flixcart.com/image/hand-messenger-bag/p/h/p/rektangel-pale-blue-dot-clean-planet-tote-wise-400x400-imadazxvqkxhzx8c.jpeg'], 'catname': ['totes'], 'brandname': ['Clean Planet.'], 'date': ['18:02:2014'], 'itemlink': ['http://www.flipkart.com/clean-planet-wise-rektangle-pale-blue-dot-tote/p/itmdpznbdafya7uh?pid=HMBDAZXHSFDVGPHP&srno=b_6&ref=55fcdcc4-dd53-473d-99d9-7b29d098ad77'], 'desc': [u'<div class="item_left_column" id="description">\n        <h3 class="item_desc_title fk-uppercase">Clean Planet Wise RekTangle Pale Blue Dot Tote (Shell Cream)         Price: Rs.795</h3>\n        <div class="cls"></div>\n        <div class="item_desc_text line">\n            <div style="float:right">\n                \n \n            </div>\n                            <h3><b> Key Features </b></h3>\n                <div class="line bmargin10">\n                    <ul class="feature_bullet"><li><span>Made of Cotton Canvas</span></li><li><span>1 Compartment</span></li><li><span>Ideal for Unisex</span></li><li><span>2 Pockets</span></li><li><span>Tote</span></li><li><span>Free Size</span></li><li><span>Graphic Print Design</span></li>                    </ul></div>\n                        <p style="text-align: justify;">\r\n\tContribute to the wellness of mother earth by going-green even in the smallest possible way. Accessorize in style with this Clean Planet Wise Rektangle Pale Blue Dot Tote \u2013 Unisex. <strong>Made of cotton canvas</strong>, this tote bag assures a secure hold of all the essentials you intend stash while you are on the move. Crafted with extravagant interiors, this free-size satchel comes with the capacity to accommodate all your possessions and allows for an orderly placement of the basic items. These interiors are <strong>equipped with two pockets and one compartment.</strong> The trendy graphic print design on the bag complements any chic and smart casual attire, making you look a class apart. This <strong>Clean Planet Wise Rektangle Pale Blue Dot Tote \u2013 Unisex </strong>measures 317.5 x 381 mm in dimension, is lightweight and easy to carry along while you are set to go outdoors. Besides this, the bag also weighs 144 g and hence is extremely portable.</p>        </div>\n        <div style="clear: both;"></div>\n            </div>'], 'spec': [u'<div id="specifications" class="item_left_column">\n    <h3 class="item_desc_title fk-uppercase">\n        Specifications of Clean Planet Wise RekTangle Pale Blue Dot Tote (Shell Cream)    </h3>\n\n            <table cellspacing="0" class="fk-specs-type2"><tr><th class="group-head" colspan="2">General</th>\n            </tr><tr class=""><td class="specs-key">Type</td>\n                                        <td class="specs-value fk-data">Tote</td>\n                </tr><tr class=""><td class="specs-key">Ideal For</td>\n                                        <td class="specs-value fk-data">Men, Women</td>\n                </tr><tr class=""><td class="specs-key">Bag Size</td>\n                                        <td class="specs-value fk-data">Free Size</td>\n                </tr><tr class=""><td class="specs-key">Occasion</td>\n                                        <td class="specs-value fk-data">Casual</td>\n                </tr><tr class=""><td class="specs-key">Material</td>\n                                        <td class="specs-value fk-data">Cotton Canvas</td>\n                </tr><tr class=""><td class="specs-key">Style Code</td>\n                                        <td class="specs-value fk-data">RekTangel Pale Blue Dot</td>\n                </tr><tr class=""><td class="specs-key">Color Code</td>\n                                        <td class="specs-value fk-data">Shell Cream</td>\n                </tr></table><table cellspacing="0" class="fk-specs-type2"><tr><th class="group-head" colspan="2">Body Features</th>\n            </tr><tr class=""><td class="specs-key">Number of Pockets</td>\n                                        <td class="specs-value fk-data">2</td>\n                </tr><tr class=""><td class="specs-key">Number of Compartments</td>\n                                        <td class="specs-value fk-data">1</td>\n                </tr><tr class=""><td class="specs-key">Bag Design</td>\n                                        <td class="specs-value fk-data">Graphic Print</td>\n                </tr><tr class=""><td class="specs-key">Other Body Features</td>\n                                        <td class="specs-value fk-data">Hand Screen Print</td>\n                </tr></table><table cellspacing="0" class="fk-specs-type2"><tr><th class="group-head" colspan="2">Dimensions</th>\n            </tr><tr class=""><td class="specs-key">Width</td>\n                                        <td class="specs-value fk-data">317.5 mm</td>\n                </tr><tr class=""><td class="specs-key">Height</td>\n                                        <td class="specs-value fk-data">381 mm</td>\n                </tr><tr class=""><td class="specs-key">Weight</td>\n                                        <td class="specs-value fk-data">144 g</td>\n                </tr></table></div>'], 'size': []}
{'sku': [u'/viewcart?eid=LSTHMBDAZXH7FNHVJAEDF0UW7'], 'seller': [u'CleanPlanet'], 'title': [u'\n                    Clean Planet Wise RekTangle Pale Blue Dot Tote            '], 'colour': [], 'sp': [u' Rs. 795'], 'mrp': [], 'titleimg': [u'http://img5a.flixcart.com/image/hand-messenger-bag/j/a/e/clean-planet-tote-wise-rektangle-pale-blue-dot-400x400-imadfyka4qfdf9m7.jpeg'], 'catname': ['totes'], 'brandname': ['Clean Planet.'], 'date': ['18:02:2014'], 'itemlink': ['http://www.flipkart.com/clean-planet-wise-rektangle-pale-blue-dot-tote/p/itmdpznaszzzwdy4?pid=HMBDAZXH7FNHVJAE&srno=b_3&ref=55fcdcc4-dd53-473d-99d9-7b29d098ad77'], 'desc': [u'<div class="item_left_column" id="description">\n        <h3 class="item_desc_title fk-uppercase">Clean Planet Wise RekTangle Pale Blue Dot Tote (Forest Black)         Price: Rs.795</h3>\n        <div class="cls"></div>\n        <div class="item_desc_text line">\n            <div style="float:right">\n                \n \n            </div>\n                            <h3><b> Key Features </b></h3>\n                <div class="line bmargin10">\n                    <ul class="feature_bullet"><li><span>2 Pockets</span></li><li><span>1 Compartment</span></li><li><span>Made of Cotton Canvas</span></li><li><span>Graphic Print Design</span></li><li><span>Tote</span></li><li><span>Ideal for Unisex</span></li><li><span>Free Size</span></li>                    </ul></div>\n                        <p style="text-align: justify;">\r\n\tGoing-green doesn\u2019t just mean turning off your lights and water taps. You could take a step ahead and lend Mother Nature a helping hand by accessorizing with this <strong>eco-friendly Clean Planet Wise Rektangle Pale Blue Dot Tote \u2013 Unisex</strong>. Made of cotton canvas, this tote bag ensures sturdy and rigid support to all the essentials you intend to carry along for the day. Built with roomy interiors, this satchel comes with the capacity to accommodate all your possessions without any hassle These interiors are <strong>equipped with two pockets and one compartment, </strong>making ample space for you to stash your everyday essentials. The intricate graphic print design on this free-size Planet Wise Rektangle Pale Blue Dot Tote \u2013 Unisex, makes it an exclusive fashion accessory for casual everyday use. This satchel measures 317.5 x 381 mm in dimension, is lightweight and easy to carry along while use. Furthermore, this bag weighs a mere 144 g and is effortlessly portable on the go.</p>        </div>\n        <div style="clear: both;"></div>\n            </div>'], 'spec': [u'<div id="specifications" class="item_left_column">\n    <h3 class="item_desc_title fk-uppercase">\n        Specifications of Clean Planet Wise RekTangle Pale Blue Dot Tote (Forest Black)    </h3>\n\n            <table cellspacing="0" class="fk-specs-type2"><tr><th class="group-head" colspan="2">General</th>\n            </tr><tr class=""><td class="specs-key">Type</td>\n                                        <td class="specs-value fk-data">Tote</td>\n                </tr><tr class=""><td class="specs-key">Ideal For</td>\n                                        <td class="specs-value fk-data">Women, Men</td>\n                </tr><tr class=""><td class="specs-key">Bag Size</td>\n                                        <td class="specs-value fk-data">Free Size</td>\n                </tr><tr class=""><td class="specs-key">Occasion</td>\n                                        <td class="specs-value fk-data">Casual</td>\n                </tr><tr class=""><td class="specs-key">Material</td>\n                                        <td class="specs-value fk-data">Cotton Canvas</td>\n                </tr><tr class=""><td class="specs-key">Color Code</td>\n                                        <td class="specs-value fk-data">Forest Black</td>\n                </tr></table><table cellspacing="0" class="fk-specs-type2"><tr><th class="group-head" colspan="2">Body Features</th>\n            </tr><tr class=""><td class="specs-key">Number of Pockets</td>\n                                        <td class="specs-value fk-data">2</td>\n                </tr><tr class=""><td class="specs-key">Number of Compartments</td>\n                                        <td class="specs-value fk-data">1</td>\n                </tr><tr class=""><td class="specs-key">Bag Design</td>\n                                        <td class="specs-value fk-data">Graphic Print</td>\n                </tr><tr class=""><td class="specs-key">Other Body Features</td>\n                                        <td class="specs-value fk-data">Hand Screen Print</td>\n                </tr></table><table cellspacing="0" class="fk-specs-type2"><tr><th class="group-head" colspan="2">Dimensions</th>\n            </tr><tr class=""><td class="specs-key">Width</td>\n                                        <td class="specs-value fk-data">317.5 mm</td>\n                </tr><tr class=""><td class="specs-key">Height</td>\n                                        <td class="specs-value fk-data">381 mm</td>\n                </tr><tr class=""><td class="specs-key">Weight</td>\n                                        <td class="specs-value fk-data">144 g</td>\n                </tr></table></div>'], 'size': []}
{'sku': [u'/viewcart?eid=LSTHMBDNPEDUDJSHWYGRYDRJN'], 'seller': [u'CleanPlanet'], 'title': [u'\n                    Clean Planet Wise Tote - Manifesto Tote            '], 'colour': [], 'sp': [u' Rs. 795'], 'mrp': [], 'titleimg': [u'http://img6a.flixcart.com/image/hand-messenger-bag/w/y/g/wisetote-04-clean-planet-tote-wise-tote-manifesto-400x400-imadnzpdmsqhqggf.jpeg'], 'catname': ['totes'], 'brandname': ['Clean Planet.'], 'date': ['18:02:2014'], 'itemlink': ['http://www.flipkart.com/clean-planet-wise-tote-manifesto/p/itmdqfvn9qtqaur4?pid=HMBDNPEDUDJSHWYG&srno=b_5&ref=55fcdcc4-dd53-473d-99d9-7b29d098ad77'], 'desc': [u'<div class="item_left_column" id="description">\n        <h3 class="item_desc_title fk-uppercase">Clean Planet Wise Tote - Manifesto Tote (Shell Cream)         Price: Rs.795</h3>\n        <div class="cls"></div>\n        <div class="item_desc_text line">\n            <div style="float:right">\n                \n \n            </div>\n                        Inspiring todays people, these tote blend the wise and the witty. Carry this tote and spread their wisdom throughout the world. These wise bags come with a unique pocket outside as well as a fine-stitched one inside them.        </div>\n        <div style="clear: both;"></div>\n            </div>'], 'spec': [u'<div id="specifications" class="item_left_column">\n    <h3 class="item_desc_title fk-uppercase">\n        Specifications of Clean Planet Wise Tote - Manifesto Tote (Shell Cream)    </h3>\n\n            <table cellspacing="0" class="fk-specs-type2"><tr><th class="group-head" colspan="2">In the Box</th>\n            </tr><tr class=""><td colspan="2" class="specs-value fk-data">Eco friendly envelope bag</td>\n                </tr></table><table cellspacing="0" class="fk-specs-type2"><tr><th class="group-head" colspan="2">General</th>\n            </tr><tr class=""><td class="specs-key">Type</td>\n                                        <td class="specs-value fk-data">Tote</td>\n                </tr><tr class=""><td class="specs-key">Ideal For</td>\n                                        <td class="specs-value fk-data">Men, Women</td>\n                </tr><tr class=""><td class="specs-key">Bag Size</td>\n                                        <td class="specs-value fk-data">Free size</td>\n                </tr><tr class=""><td class="specs-key">Occasion</td>\n                                        <td class="specs-value fk-data">Formal, Casual, Party, Evening</td>\n                </tr><tr class=""><td class="specs-key">Material</td>\n                                        <td class="specs-value fk-data">100% Cotton</td>\n                </tr><tr class=""><td class="specs-key">Style Code</td>\n                                        <td class="specs-value fk-data">WiseTote-04</td>\n                </tr><tr class=""><td class="specs-key">Color Code</td>\n                                        <td class="specs-value fk-data">Shell Cream</td>\n                </tr></table><table cellspacing="0" class="fk-specs-type2"><tr><th class="group-head" colspan="2">Body Features</th>\n            </tr><tr class=""><td class="specs-key">Number of Pockets</td>\n                                        <td class="specs-value fk-data">1</td>\n                </tr><tr class=""><td class="specs-key">Number of Compartments</td>\n                                        <td class="specs-value fk-data">1</td>\n                </tr><tr class=""><td class="specs-key">Bag Design</td>\n                                        <td class="specs-value fk-data">Inspiring and Thought-provoking</td>\n                </tr></table><table cellspacing="0" class="fk-specs-type2"><tr><th class="group-head" colspan="2">Dimensions</th>\n            </tr><tr class=""><td class="specs-key">Width</td>\n                                        <td class="specs-value fk-data">330.2 mm</td>\n                </tr><tr class=""><td class="specs-key">Height</td>\n                                        <td class="specs-value fk-data">406.4 mm</td>\n                </tr><tr class=""><td class="specs-key">Depth</td>\n                                        <td class="specs-value fk-data">50.8 mm</td>\n                </tr></table></div>'], 'size': []}
