LSTSARDNHV5U5RHJ86FRVQSTD,Sunaina Solid Synthetic  Silk Sari,http://www.flipkart.com/womens-clothing?otracker=hp_nmenu_sub_women_0_Clothing,Rs. 649,Clothing,Saris,Sunaina,http://img5a.flixcart.com/image/sari/8/6/f/18145-sunaina-free-size-400x400-imadnhw9fqbdhcgj.jpeg,Rs. 1499,Blue,women,http://www.flipkart.com/sunaina-solid-synthetic-silk-sari/p/itmdz65ep6awhapg?pid=SARDNHV5U5RHJ86F&srno=b_3&ref=eb993966-6232-495c-966e-1c5602078d7b,Gallibazaar,Sunaina Solid Synthetic  Silk Sari - Buy Blue Sunaina Solid Synthetic  Silk Sari Online at Best Prices in India | Flipkart.com,Sunaina Solid Synthetic  Silk Sari - Buy Blue Sunaina Solid Synthetic  Silk Sari For Only Rs. 0.0 Online in India. Shop Online For Apparels. Huge Collection of Branded Clothes Only at,[],<div class="item_left_column" id="description"> <h3 class="item_desc_title fk-uppercase">Sunaina Solid Synthetic  Silk Sari         Price: Rs.649</h3> <div class="cls"></div> <div class="item_desc_text line"> <div style="float:right"> </div> <p>   Tiled to soothing colors  this synthetic silk sari from the house of <strong>Sunaina</strong> has gorgeous <strong>paisley print</strong> all over. The elegant style of prints  especially on the pallu that glamorize your persona and make you ready to grab compliments at social events and gatherings.</p> </div> <div style="clear: both;"></div> </div>,<div class="item_left_column" id="specifications"> <h3 class="item_desc_title fk-uppercase">         Specifications of Sunaina Solid Synthetic  Silk Sari    </h3> <table cellspacing="0" class="fk-specs-type2"> <tr> <th class="group-head" colspan="2">General Details<a class="see-more unitExt rmargin10 no-underline" href="javascript:void(0);" onclick="$(this).closest('.fk-specs-type2').toggleClass('expandedMore')" title="Expand">[+]</a><a class="hidden unitExt rmargin10 no-underline" href="javascript:void(0);" onclick="$(this).closest('.fk-specs-type2').toggleClass('expandedMore')" title="Collapse">[-]</a></th> </tr> <tr class="hidden"> <td class="specs-key">Ideal For</td> <td class="specs-value fk-data">Women's</td> </tr> <tr class="hidden"> <td class="specs-key">Occasion</td> <td class="specs-value fk-data">Casual</td> </tr> <tr class="hidden"> <td class="specs-key">Pattern</td> <td class="specs-value fk-data">Solid</td> </tr> </table> <table cellspacing="0" class="fk-specs-type2"> <tr> <th class="group-head" colspan="2">Sari Details</th> </tr> <tr class=""> <td class="specs-key">Ideal For</td> <td class="specs-value fk-data">Women's</td> </tr> <tr class=""> <td class="specs-key">Fabric</td> <td class="specs-value fk-data">Synthetic  Silk</td> </tr> <tr class=""> <td class="specs-key">Number of Contents in Sales Package</td> <td class="specs-value fk-data">Pack of 1</td> </tr> </table> <table cellspacing="0" class="fk-specs-type2"> <tr> <th class="group-head" colspan="2">In The Box</th> </tr> <tr class=""> <td class="specs-key"> </td> <td class="specs-value fk-data">Blouse  Saree</td> </tr> </table> </div>,10:03:2014,None
LSTSARDPDZENH8TJRBHQ7JBJM,Sunaina Checkered Cotton  Silk Sari,http://www.flipkart.com/womens-clothing?otracker=hp_nmenu_sub_women_0_Clothing,Rs. 699,Clothing,Saris,Sunaina,http://img6a.flixcart.com/image/sari/r/b/h/5071-sunaina-400x400-imadpdqhugbsggvd.jpeg,Rs. 1999,Green,women,http://www.flipkart.com/sunaina-checkered-cotton-silk-sari/p/itmdpdzfdzwmxbgz?pid=SARDPDZENH8TJRBH&srno=b_4&ref=eb993966-6232-495c-966e-1c5602078d7b,Gallibazaar,Sunaina Checkered Cotton  Silk Sari - Buy Green Sunaina Checkered Cotton  Silk Sari Online at Best Prices in India | Flipkart.com,Sunaina Checkered Cotton  Silk Sari - Buy Green Sunaina Checkered Cotton  Silk Sari For Only Rs. 0.0 Online in India. Shop Online For Apparels. Huge Collection of Branded Clothes Only at,[],<div class="item_left_column" id="description"> <h3 class="item_desc_title fk-uppercase">Sunaina Checkered Cotton  Silk Sari         Price: Rs.699</h3> <div class="cls"></div> <div class="item_desc_text line"> <div style="float:right"> </div> <p style="text-align: justify;">   Amp up your style quotient in this beautiful vibrant checkered sari from Sunaina. This <strong>South Indian cotton silk </strong>sari is soft and light-weight. Available with a blouse piece  this sari will look great with a pair of earrings and wooden bangles.</p> </div> <div style="clear: both;"></div> </div>,<div class="item_left_column" id="specifications"> <h3 class="item_desc_title fk-uppercase">         Specifications of Sunaina Checkered Cotton  Silk Sari    </h3> <table cellspacing="0" class="fk-specs-type2"> <tr> <th class="group-head" colspan="2">General Details<a class="see-more unitExt rmargin10 no-underline" href="javascript:void(0);" onclick="$(this).closest('.fk-specs-type2').toggleClass('expandedMore')" title="Expand">[+]</a><a class="hidden unitExt rmargin10 no-underline" href="javascript:void(0);" onclick="$(this).closest('.fk-specs-type2').toggleClass('expandedMore')" title="Collapse">[-]</a></th> </tr> <tr class="hidden"> <td class="specs-key">Occasion</td> <td class="specs-value fk-data">Party  Casual</td> </tr> <tr class="hidden"> <td class="specs-key">Pattern</td> <td class="specs-value fk-data">Checkered</td> </tr> </table> <table cellspacing="0" class="fk-specs-type2"> <tr> <th class="group-head" colspan="2">Sari Details</th> </tr> <tr class=""> <td class="specs-key">Fabric</td> <td class="specs-value fk-data">Cotton  Silk</td> </tr> <tr class=""> <td class="specs-key">Region</td> <td class="specs-value fk-data">South Indian</td> </tr> <tr class=""> <td class="specs-key">Number of Contents in Sales Package</td> <td class="specs-value fk-data">Pack of 1</td> </tr> <tr class=""> <td class="specs-key">Blouse Piece</td> <td class="specs-value fk-data">Yes</td> </tr> </table> <table cellspacing="0" class="fk-specs-type2"> <tr> <th class="group-head" colspan="2">Dimensions</th> </tr> <tr class=""> <td class="specs-key">Length</td> <td class="specs-value fk-data">5.5 m</td> </tr> </table> <table cellspacing="0" class="fk-specs-type2"> <tr> <th class="group-head" colspan="2">In The Box</th> </tr> <tr class=""> <td class="specs-key"> </td> <td class="specs-value fk-data">Saree  Blouse Piece</td> </tr> </table> </div>,10:03:2014,None
LSTSARDNHV5ZK5UEGV3IDIXBM,Sunaina Striped Silk  Synthetic Sari,http://www.flipkart.com/womens-clothing?otracker=hp_nmenu_sub_women_0_Clothing,Rs. 649,Clothing,Saris,Sunaina,http://img5a.flixcart.com/image/sari/g/v/3/5194-sunaina-free-size-400x400-imadnhwbehzve2eu.jpeg,Rs. 1499,Brownie black,women,http://www.flipkart.com/sunaina-striped-silk-synthetic-sari/p/itmdz65e4zmtk5ps?pid=SARDNHV5ZK5UEGV3&srno=b_5&ref=eb993966-6232-495c-966e-1c5602078d7b,Gallibazaar,Sunaina Striped Silk  Synthetic Sari - Buy Brownie black Sunaina Striped Silk  Synthetic Sari Online at Best Prices in India | Flipkart.com,Sunaina Striped Silk  Synthetic Sari - Buy Brownie black Sunaina Striped Silk  Synthetic Sari For Only Rs. 0.0 Online in India. Shop Online For Apparels. Huge Collection of Branded Clothes Only at,[],<div class="item_left_column" id="description"> <h3 class="item_desc_title fk-uppercase">Sunaina Striped Silk  Synthetic Sari         Price: Rs.649</h3> <div class="cls"></div> <div class="item_desc_text line"> <div style="float:right"> </div> <p>   It’s time to own the much sought after palate by donning this beautiful sari from the house of <strong>Sunaina</strong>. With red and gold prints splashed across a black canvas  this sari stands out from the mundane crowd and speaks volumes of your forward taste in fashion. Don with golden jewelry to complete the look.</p> </div> <div style="clear: both;"></div> </div>,<div class="item_left_column" id="specifications"> <h3 class="item_desc_title fk-uppercase">         Specifications of Sunaina Striped Silk  Synthetic Sari    </h3> <table cellspacing="0" class="fk-specs-type2"> <tr> <th class="group-head" colspan="2">General Details<a class="see-more unitExt rmargin10 no-underline" href="javascript:void(0);" onclick="$(this).closest('.fk-specs-type2').toggleClass('expandedMore')" title="Expand">[+]</a><a class="hidden unitExt rmargin10 no-underline" href="javascript:void(0);" onclick="$(this).closest('.fk-specs-type2').toggleClass('expandedMore')" title="Collapse">[-]</a></th> </tr> <tr class="hidden"> <td class="specs-key">Ideal For</td> <td class="specs-value fk-data">Women's</td> </tr> <tr class="hidden"> <td class="specs-key">Occasion</td> <td class="specs-value fk-data">Casual</td> </tr> <tr class="hidden"> <td class="specs-key">Pattern</td> <td class="specs-value fk-data">Striped</td> </tr> </table> <table cellspacing="0" class="fk-specs-type2"> <tr> <th class="group-head" colspan="2">Sari Details</th> </tr> <tr class=""> <td class="specs-key">Ideal For</td> <td class="specs-value fk-data">Women's</td> </tr> <tr class=""> <td class="specs-key">Fabric</td> <td class="specs-value fk-data">Silk  Synthetic</td> </tr> <tr class=""> <td class="specs-key">Number of Contents in Sales Package</td> <td class="specs-value fk-data">Pack of 1</td> </tr> </table> <table cellspacing="0" class="fk-specs-type2"> <tr> <th class="group-head" colspan="2">In The Box</th> </tr> <tr class=""> <td class="specs-key"> </td> <td class="specs-value fk-data">Saree  Blouse</td> </tr> </table> </div>,10:03:2014,None
LSTSARDPDZEU9VHBUHUPVOGOC,Sunaina Printed Art Silk Sari,http://www.flipkart.com/womens-clothing?otracker=hp_nmenu_sub_women_0_Clothing,Rs. 649,Clothing,Saris,Sunaina,http://img5a.flixcart.com/image/sari/u/h/u/18187-sunaina-400x400-imadpdqhafhc9wzs.jpeg,Rs. 1499,Pink-Green,women,http://www.flipkart.com/sunaina-printed-art-silk-sari/p/itmdpdzfuafhmmcy?pid=SARDPDZEU9VHBUHU&srno=b_1&ref=eb993966-6232-495c-966e-1c5602078d7b,Gallibazaar,Sunaina Printed Art Silk Sari - Buy Pink-Green Sunaina Printed Art Silk Sari Online at Best Prices in India | Flipkart.com,Sunaina Printed Art Silk Sari - Buy Pink-Green Sunaina Printed Art Silk Sari For Only Rs. 0.0 Online in India. Shop Online For Apparels. Huge Collection of Branded Clothes Only at,[],<div class="item_left_column" id="description"> <h3 class="item_desc_title fk-uppercase">Sunaina Printed Art Silk Sari         Price: Rs.649</h3> <div class="cls"></div> <div class="item_desc_text line"> <div style="float:right"> </div> <p style="text-align: justify;">   Representing fashion at its best  Sunaina designs this <strong>printed sari </strong>that takes your style a notch higher. Be a fashionista when you drape this silk sari that has been inspired by the region of South India. Look your best by wearing a sleeveless blouse and shimmery heels with this sari.</p> </div> <div style="clear: both;"></div> </div>,<div class="item_left_column" id="specifications"> <h3 class="item_desc_title fk-uppercase">         Specifications of Sunaina Printed Art Silk Sari    </h3> <table cellspacing="0" class="fk-specs-type2"> <tr> <th class="group-head" colspan="2">General Details<a class="see-more unitExt rmargin10 no-underline" href="javascript:void(0);" onclick="$(this).closest('.fk-specs-type2').toggleClass('expandedMore')" title="Expand">[+]</a><a class="hidden unitExt rmargin10 no-underline" href="javascript:void(0);" onclick="$(this).closest('.fk-specs-type2').toggleClass('expandedMore')" title="Collapse">[-]</a></th> </tr> <tr class="hidden"> <td class="specs-key">Occasion</td> <td class="specs-value fk-data">Party  Casual</td> </tr> <tr class="hidden"> <td class="specs-key">Pattern</td> <td class="specs-value fk-data">Printed</td> </tr> </table> <table cellspacing="0" class="fk-specs-type2"> <tr> <th class="group-head" colspan="2">Sari Details</th> </tr> <tr class=""> <td class="specs-key">Fabric</td> <td class="specs-value fk-data">Art Silk</td> </tr> <tr class=""> <td class="specs-key">Region</td> <td class="specs-value fk-data">South Indian</td> </tr> <tr class=""> <td class="specs-key">Number of Contents in Sales Package</td> <td class="specs-value fk-data">Pack of 1</td> </tr> <tr class=""> <td class="specs-key">Blouse Piece</td> <td class="specs-value fk-data">Yes</td> </tr> </table> <table cellspacing="0" class="fk-specs-type2"> <tr> <th class="group-head" colspan="2">Dimensions</th> </tr> <tr class=""> <td class="specs-key">Length</td> <td class="specs-value fk-data">5.5 m</td> </tr> </table> <table cellspacing="0" class="fk-specs-type2"> <tr> <th class="group-head" colspan="2">In The Box</th> </tr> <tr class=""> <td class="specs-key"> </td> <td class="specs-value fk-data">Blouse Piece  Saree</td> </tr> </table> </div>,10:03:2014,None
LSTSARDNHV5BFRCSXGNKGN9IR,Sunaina Printed Synthetic  Silk Sari,http://www.flipkart.com/womens-clothing?otracker=hp_nmenu_sub_women_0_Clothing,Rs. 649,Clothing,Saris,Sunaina,http://img5a.flixcart.com/image/sari/x/g/n/18164-sunaina-free-size-400x400-imadnhwayvvw9gxg.jpeg,Rs. 1499,Pink,women,http://www.flipkart.com/sunaina-printed-synthetic-silk-sari/p/itmdz65enrzzh9gs?pid=SARDNHV5BFRCSXGN&srno=b_19&ref=4a51133a-f055-448e-88b6-d64add66fc79,Gallibazaar,Sunaina Printed Synthetic  Silk Sari - Buy Pink Sunaina Printed Synthetic  Silk Sari Online at Best Prices in India | Flipkart.com,Sunaina Printed Synthetic  Silk Sari - Buy Pink Sunaina Printed Synthetic  Silk Sari For Only Rs. 0.0 Online in India. Shop Online For Apparels. Huge Collection of Branded Clothes Only at,[],<div class="item_left_column" id="description"> <h3 class="item_desc_title fk-uppercase">Sunaina Printed Synthetic  Silk Sari         Price: Rs.649</h3> <div class="cls"></div> <div class="item_desc_text line"> <div style="float:right"> </div>                         Peppy colors  designer trends  comfortable and a trendy look in ethnic wear. Just peep into the style quotient of popular onscreen divas following this thumb rule. Saree. You have caught us right. Vibrant shades  floral motifs  splendid stripes and much more for your revamped wardrobe. Were sure you have gathered enough inspiration to ditch your westerns for the sake of stylish sarees. Go ahead. Product Overview - Fancy saree with amazing color combos &amp; prints. It gives an amazing outlook to the lady who is dressed in it. It is made of malbari silk fabric. Saree length is 6.3 m with blouse piece. Fabric Superior Quality Malbari Silk with Digital High Quality printing        </div> <div style="clear: both;"></div> </div>,<div class="item_left_column" id="specifications"> <h3 class="item_desc_title fk-uppercase">         Specifications of Sunaina Printed Synthetic  Silk Sari    </h3> <table cellspacing="0" class="fk-specs-type2"> <tr> <th class="group-head" colspan="2">General Details<a class="see-more unitExt rmargin10 no-underline" href="javascript:void(0);" onclick="$(this).closest('.fk-specs-type2').toggleClass('expandedMore')" title="Expand">[+]</a><a class="hidden unitExt rmargin10 no-underline" href="javascript:void(0);" onclick="$(this).closest('.fk-specs-type2').toggleClass('expandedMore')" title="Collapse">[-]</a></th> </tr> <tr class="hidden"> <td class="specs-key">Ideal For</td> <td class="specs-value fk-data">Women's</td> </tr> <tr class="hidden"> <td class="specs-key">Occasion</td> <td class="specs-value fk-data">Casual</td> </tr> <tr class="hidden"> <td class="specs-key">Pattern</td> <td class="specs-value fk-data">Printed</td> </tr> </table> <table cellspacing="0" class="fk-specs-type2"> <tr> <th class="group-head" colspan="2">Sari Details</th> </tr> <tr class=""> <td class="specs-key">Ideal For</td> <td class="specs-value fk-data">Women's</td> </tr> <tr class=""> <td class="specs-key">Fabric</td> <td class="specs-value fk-data">Synthetic  Silk</td> </tr> <tr class=""> <td class="specs-key">Number of Contents in Sales Package</td> <td class="specs-value fk-data">Pack of 1</td> </tr> </table> <table cellspacing="0" class="fk-specs-type2"> <tr> <th class="group-head" colspan="2">In The Box</th> </tr> <tr class=""> <td class="specs-key"> </td> <td class="specs-value fk-data">Saree  Blouse</td> </tr> </table> </div>,10:03:2014,None
LSTSARDQRUNVTGSQDZGI0O0OC,Sunaina Printed Art Silk Sari,http://www.flipkart.com/womens-clothing?otracker=hp_nmenu_sub_women_0_Clothing,Rs. 649,Clothing,Saris,Sunaina,http://img5a.flixcart.com/image/sari/d/z/g/5357-sunaina-400x400-imadqsh5eyqgqzqc.jpeg,Rs. 1999,Multicolor,women,http://www.flipkart.com/sunaina-printed-art-silk-sari/p/itmdqrun5vgayzs3?pid=SARDQRUNVTGSQDZG&srno=b_12&ref=eb993966-6232-495c-966e-1c5602078d7b,Gallibazaar,Sunaina Printed Art Silk Sari - Buy Multicolor Sunaina Printed Art Silk Sari Online at Best Prices in India | Flipkart.com,Sunaina Printed Art Silk Sari - Buy Multicolor Sunaina Printed Art Silk Sari For Only Rs. 0.0 Online in India. Shop Online For Apparels. Huge Collection of Branded Clothes Only at,[],<div class="item_left_column" id="description"> <h3 class="item_desc_title fk-uppercase">Sunaina Printed Art Silk Sari         Price: Rs.649</h3> <div class="cls"></div> <div class="item_desc_text line"> <div style="float:right"> </div>                         Peppy colors  designer trends  comfortable and a trendy look in ethnic wear. Just peep into the style quotient of popular onscreen divas following this thumb rule. You have caught us right. Vibrant shades  floral motifs  splendid stripes.        </div> <div style="clear: both;"></div> </div>,<div class="item_left_column" id="specifications"> <h3 class="item_desc_title fk-uppercase">         Specifications of Sunaina Printed Art Silk Sari    </h3> <table cellspacing="0" class="fk-specs-type2"> <tr> <th class="group-head" colspan="2">General Details<a class="see-more unitExt rmargin10 no-underline" href="javascript:void(0);" onclick="$(this).closest('.fk-specs-type2').toggleClass('expandedMore')" title="Expand">[+]</a><a class="hidden unitExt rmargin10 no-underline" href="javascript:void(0);" onclick="$(this).closest('.fk-specs-type2').toggleClass('expandedMore')" title="Collapse">[-]</a></th> </tr> <tr class="hidden"> <td class="specs-key">Occasion</td> <td class="specs-value fk-data">Casual  Party</td> </tr> <tr class="hidden"> <td class="specs-key">Pattern</td> <td class="specs-value fk-data">Printed</td> </tr> </table> <table cellspacing="0" class="fk-specs-type2"> <tr> <th class="group-head" colspan="2">Sari Details</th> </tr> <tr class=""> <td class="specs-key">Fabric</td> <td class="specs-value fk-data">Art Silk</td> </tr> </table> <table cellspacing="0" class="fk-specs-type2"> <tr> <th class="group-head" colspan="2">In The Box</th> </tr> <tr class=""> <td class="specs-key"> </td> <td class="specs-value fk-data">Saree  Blouse Piece</td> </tr> </table> </div>,10:03:2014,None
LSTSARDPDZFEZDX5BZMOVWA4L,Sunaina Printed Cotton Sari,http://www.flipkart.com/womens-clothing?otracker=hp_nmenu_sub_women_0_Clothing,Rs. 849,Clothing,Saris,Sunaina,http://img6a.flixcart.com/image/sari/b/z/m/7711-sunaina-400x400-imadpdqhwzuthxek.jpeg,Rs. 1999,Multicolor,women,http://www.flipkart.com/sunaina-printed-cotton-sari/p/itmdpdzf3a7ktz3m?pid=SARDPDZFEZDX5BZM&srno=b_14&ref=eb993966-6232-495c-966e-1c5602078d7b,Gallibazaar,Sunaina Printed Cotton Sari - Buy Multicolor Sunaina Printed Cotton Sari Online at Best Prices in India | Flipkart.com,Sunaina Printed Cotton Sari - Buy Multicolor Sunaina Printed Cotton Sari For Only Rs. 0.0 Online in India. Shop Online For Apparels. Huge Collection of Branded Clothes Only at,[],<div class="item_left_column" id="description"> <h3 class="item_desc_title fk-uppercase">Sunaina Printed Cotton Sari         Price: Rs.849</h3> <div class="cls"></div> <div class="item_desc_text line"> <div style="float:right"> </div> <p style="text-align: justify;">   Drape yourself in elegance and class by getting your hands on this Sunaina Sari. This printed sari is <strong>made of cotton</strong> which helps keep you comfy while you are still looking like an absolute stunner. Golden heels and antique jewelry will go well with it. </p> <p style="text-align: justify;">    </p> <p>    </p> </div> <div style="clear: both;"></div> </div>,<div class="item_left_column" id="specifications"> <h3 class="item_desc_title fk-uppercase">         Specifications of Sunaina Printed Cotton Sari    </h3> <table cellspacing="0" class="fk-specs-type2"> <tr> <th class="group-head" colspan="2">General Details<a class="see-more unitExt rmargin10 no-underline" href="javascript:void(0);" onclick="$(this).closest('.fk-specs-type2').toggleClass('expandedMore')" title="Expand">[+]</a><a class="hidden unitExt rmargin10 no-underline" href="javascript:void(0);" onclick="$(this).closest('.fk-specs-type2').toggleClass('expandedMore')" title="Collapse">[-]</a></th> </tr> <tr class="hidden"> <td class="specs-key">Occasion</td> <td class="specs-value fk-data">Party  Casual</td> </tr> <tr class="hidden"> <td class="specs-key">Pattern</td> <td class="specs-value fk-data">Printed</td> </tr> </table> <table cellspacing="0" class="fk-specs-type2"> <tr> <th class="group-head" colspan="2">Sari Details</th> </tr> <tr class=""> <td class="specs-key">Fabric</td> <td class="specs-value fk-data">Cotton</td> </tr> <tr class=""> <td class="specs-key">Region</td> <td class="specs-value fk-data">South Indian</td> </tr> </table> <table cellspacing="0" class="fk-specs-type2"> <tr> <th class="group-head" colspan="2">In The Box</th> </tr> <tr class=""> <td class="specs-key"> </td> <td class="specs-value fk-data">Saree  Blouse Piece</td> </tr> </table> </div>,10:03:2014,None
LSTSARDNHV5V6Z9ZYJWPXO6DD,Sunaina Printed Silk  Synthetic Sari,http://www.flipkart.com/womens-clothing?otracker=hp_nmenu_sub_women_0_Clothing,Rs. 649,Clothing,Saris,Sunaina,http://img6a.flixcart.com/image/sari/y/j/w/18169-sunaina-free-size-400x400-imadnhwaxpy4hsgh.jpeg,Rs. 1499,Chikoo,women,http://www.flipkart.com/sunaina-printed-silk-synthetic-sari/p/itmdz65e4dzvhe6t?pid=SARDNHV5V6Z9ZYJW&srno=b_13&ref=eb993966-6232-495c-966e-1c5602078d7b,Gallibazaar,Sunaina Printed Silk  Synthetic Sari - Buy Chikoo Sunaina Printed Silk  Synthetic Sari Online at Best Prices in India | Flipkart.com,Sunaina Printed Silk  Synthetic Sari - Buy Chikoo Sunaina Printed Silk  Synthetic Sari For Only Rs. 0.0 Online in India. Shop Online For Apparels. Huge Collection of Branded Clothes Only at,[],<div class="item_left_column" id="description"> <h3 class="item_desc_title fk-uppercase">Sunaina Printed Silk  Synthetic Sari         Price: Rs.649</h3> <div class="cls"></div> <div class="item_desc_text line"> <div style="float:right"> </div> <p>   Elegant and completely traditional  this <strong>printed brown sari</strong> from Sunaina drapes beautifully and gives you a chic look effortlessly. Complete your ethnic look with simple drop earrings  matching bangles and look really gorgeous at your friend’s house warming ceremony.</p> </div> <div style="clear: both;"></div> </div>,<div class="item_left_column" id="specifications"> <h3 class="item_desc_title fk-uppercase">         Specifications of Sunaina Printed Silk  Synthetic Sari    </h3> <table cellspacing="0" class="fk-specs-type2"> <tr> <th class="group-head" colspan="2">General Details<a class="see-more unitExt rmargin10 no-underline" href="javascript:void(0);" onclick="$(this).closest('.fk-specs-type2').toggleClass('expandedMore')" title="Expand">[+]</a><a class="hidden unitExt rmargin10 no-underline" href="javascript:void(0);" onclick="$(this).closest('.fk-specs-type2').toggleClass('expandedMore')" title="Collapse">[-]</a></th> </tr> <tr class="hidden"> <td class="specs-key">Ideal For</td> <td class="specs-value fk-data">Women's</td> </tr> <tr class="hidden"> <td class="specs-key">Occasion</td> <td class="specs-value fk-data">Casual</td> </tr> <tr class="hidden"> <td class="specs-key">Pattern</td> <td class="specs-value fk-data">Printed</td> </tr> </table> <table cellspacing="0" class="fk-specs-type2"> <tr> <th class="group-head" colspan="2">Sari Details</th> </tr> <tr class=""> <td class="specs-key">Ideal For</td> <td class="specs-value fk-data">Women's</td> </tr> <tr class=""> <td class="specs-key">Fabric</td> <td class="specs-value fk-data">Silk  Synthetic</td> </tr> <tr class=""> <td class="specs-key">Number of Contents in Sales Package</td> <td class="specs-value fk-data">Pack of 1</td> </tr> </table> <table cellspacing="0" class="fk-specs-type2"> <tr> <th class="group-head" colspan="2">In The Box</th> </tr> <tr class=""> <td class="specs-key"> </td> <td class="specs-value fk-data">Saree  Blouse</td> </tr> </table> </div>,10:03:2014,None
