LSTSARDQRUNPEKQBFQQSFF9CQ,Sunaina Printed Art Silk Sari,http://www.flipkart.com/womens-clothing?otracker=hp_nmenu_sub_women_0_Clothing,Rs. 649,Clothing,Saris,Sunaina,http://img5a.flixcart.com/image/sari/f/q/q/5343-sunaina-400x400-imadqsh5c5d8hm4v.jpeg,Rs. 1999,Multicolor,women,http://www.flipkart.com/sunaina-printed-art-silk-sari/p/itmdqrungtuhtfat?pid=SARDQRUNPEKQBFQQ&srno=b_28&ref=4a51133a-f055-448e-88b6-d64add66fc79,Gallibazaar,Sunaina Printed Art Silk Sari - Buy Multicolor Sunaina Printed Art Silk Sari Online at Best Prices in India | Flipkart.com,Sunaina Printed Art Silk Sari - Buy Multicolor Sunaina Printed Art Silk Sari For Only Rs. 0.0 Online in India. Shop Online For Apparels. Huge Collection of Branded Clothes Only at,[],<div class="item_left_column" id="description"> <h3 class="item_desc_title fk-uppercase">Sunaina Printed Art Silk Sari         Price: Rs.649</h3> <div class="cls"></div> <div class="item_desc_text line"> <div style="float:right"> </div>                         Peppy colors  designer trends  comfortable and a trendy look in ethnic wear. Just peep into the style quotient of popular onscreen divas following this thumb rule. You have caught us right. Vibrant shades  floral motifs  splendid stripes.        </div> <div style="clear: both;"></div> </div>,<div class="item_left_column" id="specifications"> <h3 class="item_desc_title fk-uppercase">         Specifications of Sunaina Printed Art Silk Sari    </h3> <table cellspacing="0" class="fk-specs-type2"> <tr> <th class="group-head" colspan="2">General Details<a class="see-more unitExt rmargin10 no-underline" href="javascript:void(0);" onclick="$(this).closest('.fk-specs-type2').toggleClass('expandedMore')" title="Expand">[+]</a><a class="hidden unitExt rmargin10 no-underline" href="javascript:void(0);" onclick="$(this).closest('.fk-specs-type2').toggleClass('expandedMore')" title="Collapse">[-]</a></th> </tr> <tr class="hidden"> <td class="specs-key">Occasion</td> <td class="specs-value fk-data">Casual  Party</td> </tr> <tr class="hidden"> <td class="specs-key">Pattern</td> <td class="specs-value fk-data">Printed</td> </tr> </table> <table cellspacing="0" class="fk-specs-type2"> <tr> <th class="group-head" colspan="2">Sari Details</th> </tr> <tr class=""> <td class="specs-key">Fabric</td> <td class="specs-value fk-data">Art Silk</td> </tr> </table> <table cellspacing="0" class="fk-specs-type2"> <tr> <th class="group-head" colspan="2">In The Box</th> </tr> <tr class=""> <td class="specs-key"> </td> <td class="specs-value fk-data">Saree  Blouse Piece</td> </tr> </table> </div>,10:03:2014,None
LSTSARDNHV5STSPJFJYOXDXPH,Sunaina Printed Synthetic  Silk Sari,http://www.flipkart.com/womens-clothing?otracker=hp_nmenu_sub_women_0_Clothing,Rs. 499,Clothing,Saris,Sunaina,http://img6a.flixcart.com/image/sari/f/j/y/18061-sunaina-free-size-400x400-imadnhwaghmn6cdc.jpeg,Rs. 1499,Greeny-silver,women,http://www.flipkart.com/sunaina-printed-synthetic-silk-sari/p/itmdz65en4suuqn2?pid=SARDNHV5STSPJFJY&srno=b_7&ref=eb993966-6232-495c-966e-1c5602078d7b,Gallibazaar,Sunaina Printed Synthetic  Silk Sari - Buy Greeny-silver Sunaina Printed Synthetic  Silk Sari Online at Best Prices in India | Flipkart.com,Sunaina Printed Synthetic  Silk Sari - Buy Greeny-silver Sunaina Printed Synthetic  Silk Sari For Only Rs. 0.0 Online in India. Shop Online For Apparels. Huge Collection of Branded Clothes Only at,[],<div class="item_left_column" id="description"> <h3 class="item_desc_title fk-uppercase">Sunaina Printed Synthetic  Silk Sari         Price: Rs.499</h3> <div class="cls"></div> <div class="item_desc_text line"> <div style="float:right"> </div> <p style="text-align: justify;">   Jazz up your ensemble with this stylish<strong> silver printed sari from Sunaina</strong> that gives you a stylish appeal. The blend of silk and synthetic assures you comfort. Get ready to go to the temple by teaming this sari with a matching three-fourth sleeved blouse and sandals.</p> </div> <div style="clear: both;"></div> </div>,<div class="item_left_column" id="specifications"> <h3 class="item_desc_title fk-uppercase">         Specifications of Sunaina Printed Synthetic  Silk Sari    </h3> <table cellspacing="0" class="fk-specs-type2"> <tr> <th class="group-head" colspan="2">General Details<a class="see-more unitExt rmargin10 no-underline" href="javascript:void(0);" onclick="$(this).closest('.fk-specs-type2').toggleClass('expandedMore')" title="Expand">[+]</a><a class="hidden unitExt rmargin10 no-underline" href="javascript:void(0);" onclick="$(this).closest('.fk-specs-type2').toggleClass('expandedMore')" title="Collapse">[-]</a></th> </tr> <tr class="hidden"> <td class="specs-key">Ideal For</td> <td class="specs-value fk-data">Women's</td> </tr> <tr class="hidden"> <td class="specs-key">Occasion</td> <td class="specs-value fk-data">Casual</td> </tr> <tr class="hidden"> <td class="specs-key">Pattern</td> <td class="specs-value fk-data">Printed</td> </tr> </table> <table cellspacing="0" class="fk-specs-type2"> <tr> <th class="group-head" colspan="2">Sari Details</th> </tr> <tr class=""> <td class="specs-key">Ideal For</td> <td class="specs-value fk-data">Women's</td> </tr> <tr class=""> <td class="specs-key">Fabric</td> <td class="specs-value fk-data">Synthetic  Silk</td> </tr> <tr class=""> <td class="specs-key">Number of Contents in Sales Package</td> <td class="specs-value fk-data">Pack of 1</td> </tr> </table> <table cellspacing="0" class="fk-specs-type2"> <tr> <th class="group-head" colspan="2">In The Box</th> </tr> <tr class=""> <td class="specs-key"> </td> <td class="specs-value fk-data">Saree  Blouse</td> </tr> </table> </div>,10:03:2014,None
LSTSARDNHV5HPKWHHWATKRBUW,Sunaina Printed Synthetic  Silk Sari,http://www.flipkart.com/womens-clothing?otracker=hp_nmenu_sub_women_0_Clothing,Rs. 649,Clothing,Saris,Sunaina,http://img5a.flixcart.com/image/sari/h/w/a/5294-sunaina-free-400x400-imadqbw3xmefszz8.jpeg,Rs. 1499,Whitey-green,women,http://www.flipkart.com/sunaina-printed-synthetic-silk-sari/p/itmdz65eqb55qsjh?pid=SARDNHV5HPKWHHWA&srno=b_20&ref=4a51133a-f055-448e-88b6-d64add66fc79,Gallibazaar,Sunaina Printed Synthetic  Silk Sari - Buy Whitey-green Sunaina Printed Synthetic  Silk Sari Online at Best Prices in India | Flipkart.com,Sunaina Printed Synthetic  Silk Sari - Buy Whitey-green Sunaina Printed Synthetic  Silk Sari For Only Rs. 0.0 Online in India. Shop Online For Apparels. Huge Collection of Branded Clothes Only at,[],<div class="item_left_column" id="description"> <h3 class="item_desc_title fk-uppercase">Sunaina Printed Synthetic  Silk Sari         Price: Rs.649</h3> <div class="cls"></div> <div class="item_desc_text line"> <div style="float:right"> </div> <p style="text-align: justify;">   Remodeling the way saris look is this Sunaina Sari. This white<strong> silk and synthetic sari</strong> is sure to grab extra attention because of it's classy finish when you drape it. A simple necklace and stilettos will go perfectly with this printed sari.  </p> </div> <div style="clear: both;"></div> </div>,<div class="item_left_column" id="specifications"> <h3 class="item_desc_title fk-uppercase">         Specifications of Sunaina Printed Synthetic  Silk Sari    </h3> <table cellspacing="0" class="fk-specs-type2"> <tr> <th class="group-head" colspan="2">General Details<a class="see-more unitExt rmargin10 no-underline" href="javascript:void(0);" onclick="$(this).closest('.fk-specs-type2').toggleClass('expandedMore')" title="Expand">[+]</a><a class="hidden unitExt rmargin10 no-underline" href="javascript:void(0);" onclick="$(this).closest('.fk-specs-type2').toggleClass('expandedMore')" title="Collapse">[-]</a></th> </tr> <tr class="hidden"> <td class="specs-key">Ideal For</td> <td class="specs-value fk-data">Women's</td> </tr> <tr class="hidden"> <td class="specs-key">Occasion</td> <td class="specs-value fk-data">Casual</td> </tr> <tr class="hidden"> <td class="specs-key">Pattern</td> <td class="specs-value fk-data">Printed</td> </tr> </table> <table cellspacing="0" class="fk-specs-type2"> <tr> <th class="group-head" colspan="2">Sari Details</th> </tr> <tr class=""> <td class="specs-key">Ideal For</td> <td class="specs-value fk-data">Women's</td> </tr> <tr class=""> <td class="specs-key">Fabric</td> <td class="specs-value fk-data">Synthetic  Silk</td> </tr> <tr class=""> <td class="specs-key">Number of Contents in Sales Package</td> <td class="specs-value fk-data">Pack of 1</td> </tr> </table> <table cellspacing="0" class="fk-specs-type2"> <tr> <th class="group-head" colspan="2">In The Box</th> </tr> <tr class=""> <td class="specs-key"> </td> <td class="specs-value fk-data">Saree  Blouse</td> </tr> </table> </div>,10:03:2014,None
LSTSARDPDZE6PVAMYH8RDXUR1,Sunaina Printed Silk Sari,http://www.flipkart.com/womens-clothing?otracker=hp_nmenu_sub_women_0_Clothing,Rs. 799,Clothing,Saris,Sunaina,http://img6a.flixcart.com/image/sari/y/h/8/53-sunaina-400x400-imadpdqhpxqbmhu4.jpeg,Rs. 1999,Multicolor,women,http://www.flipkart.com/sunaina-printed-silk-sari/p/itmdpdzfvcuy7s6p?pid=SARDPDZE6PVAMYH8&srno=b_26&ref=4a51133a-f055-448e-88b6-d64add66fc79,Gallibazaar,Sunaina Printed Silk Sari - Buy Multicolor Sunaina Printed Silk Sari Online at Best Prices in India | Flipkart.com,Sunaina Printed Silk Sari - Buy Multicolor Sunaina Printed Silk Sari For Only Rs. 0.0 Online in India. Shop Online For Apparels. Huge Collection of Branded Clothes Only at,[],<div class="item_left_column" id="description"> <h3 class="item_desc_title fk-uppercase">Sunaina Printed Silk Sari         Price: Rs.799</h3> <div class="cls"></div> <div class="item_desc_text line"> <div style="float:right"> </div> <p>   Look very pretty at the next festive occasion in this <strong>beautiful silk sari</strong> from Sunaina that combines subtle checks with chic traditional motifs. Accessorise this printed sari with matching green earrings and bangles for a divalicious style.</p> </div> <div style="clear: both;"></div> </div>,<div class="item_left_column" id="specifications"> <h3 class="item_desc_title fk-uppercase">         Specifications of Sunaina Printed Silk Sari    </h3> <table cellspacing="0" class="fk-specs-type2"> <tr> <th class="group-head" colspan="2">General Details<a class="see-more unitExt rmargin10 no-underline" href="javascript:void(0);" onclick="$(this).closest('.fk-specs-type2').toggleClass('expandedMore')" title="Expand">[+]</a><a class="hidden unitExt rmargin10 no-underline" href="javascript:void(0);" onclick="$(this).closest('.fk-specs-type2').toggleClass('expandedMore')" title="Collapse">[-]</a></th> </tr> <tr class="hidden"> <td class="specs-key">Occasion</td> <td class="specs-value fk-data">Party  Casual</td> </tr> <tr class="hidden"> <td class="specs-key">Pattern</td> <td class="specs-value fk-data">Printed</td> </tr> </table> <table cellspacing="0" class="fk-specs-type2"> <tr> <th class="group-head" colspan="2">Sari Details</th> </tr> <tr class=""> <td class="specs-key">Fabric</td> <td class="specs-value fk-data">Silk</td> </tr> <tr class=""> <td class="specs-key">Region</td> <td class="specs-value fk-data">South Indian</td> </tr> </table> <table cellspacing="0" class="fk-specs-type2"> <tr> <th class="group-head" colspan="2">In The Box</th> </tr> <tr class=""> <td class="specs-key"> </td> <td class="specs-value fk-data">Saree  Blouse Piece</td> </tr> </table> </div>,10:03:2014,None
LSTSARDPDZEMFW8UEYH0CD8SZ,Sunaina Printed Cotton  Silk Sari,http://www.flipkart.com/womens-clothing?otracker=hp_nmenu_sub_women_0_Clothing,Rs. 699,Clothing,Saris,Sunaina,http://img6a.flixcart.com/image/sari/e/y/h/5084-sunaina-400x400-imadpdqhhpjc6hqy.jpeg,Rs. 1999,Creamy-White,women,http://www.flipkart.com/sunaina-printed-cotton-silk-sari/p/itmdpdzfvbwhnh5d?pid=SARDPDZEMFW8UEYH&srno=b_27&ref=4a51133a-f055-448e-88b6-d64add66fc79,Gallibazaar,Sunaina Printed Cotton  Silk Sari - Buy Creamy-White Sunaina Printed Cotton  Silk Sari Online at Best Prices in India | Flipkart.com,Sunaina Printed Cotton  Silk Sari - Buy Creamy-White Sunaina Printed Cotton  Silk Sari For Only Rs. 0.0 Online in India. Shop Online For Apparels. Huge Collection of Branded Clothes Only at,[],<div class="item_left_column" id="description"> <h3 class="item_desc_title fk-uppercase">Sunaina Printed Cotton  Silk Sari         Price: Rs.699</h3> <div class="cls"></div> <div class="item_desc_text line"> <div style="float:right"> </div> <p style="text-align: justify;">   Adorned with contemporary <strong>devanagari script prints</strong> all over that complements the vibrant border  this cotton silk sari from Sunaina is a beautiful addition to your ethnic wear collection. Ideal for party or casual wear  this sari lends an aura of feminism. Style it with a set of bangles and sandals.</p> </div> <div style="clear: both;"></div> </div>,<div class="item_left_column" id="specifications"> <h3 class="item_desc_title fk-uppercase">         Specifications of Sunaina Printed Cotton  Silk Sari    </h3> <table cellspacing="0" class="fk-specs-type2"> <tr> <th class="group-head" colspan="2">General Details<a class="see-more unitExt rmargin10 no-underline" href="javascript:void(0);" onclick="$(this).closest('.fk-specs-type2').toggleClass('expandedMore')" title="Expand">[+]</a><a class="hidden unitExt rmargin10 no-underline" href="javascript:void(0);" onclick="$(this).closest('.fk-specs-type2').toggleClass('expandedMore')" title="Collapse">[-]</a></th> </tr> <tr class="hidden"> <td class="specs-key">Occasion</td> <td class="specs-value fk-data">Casual  Party</td> </tr> <tr class="hidden"> <td class="specs-key">Pattern</td> <td class="specs-value fk-data">Printed</td> </tr> </table> <table cellspacing="0" class="fk-specs-type2"> <tr> <th class="group-head" colspan="2">Sari Details</th> </tr> <tr class=""> <td class="specs-key">Fabric</td> <td class="specs-value fk-data">Cotton  Silk</td> </tr> <tr class=""> <td class="specs-key">Region</td> <td class="specs-value fk-data">South Indian</td> </tr> <tr class=""> <td class="specs-key">Number of Contents in Sales Package</td> <td class="specs-value fk-data">Pack of 1</td> </tr> <tr class=""> <td class="specs-key">Blouse Piece</td> <td class="specs-value fk-data">Yes</td> </tr> </table> <table cellspacing="0" class="fk-specs-type2"> <tr> <th class="group-head" colspan="2">Dimensions</th> </tr> <tr class=""> <td class="specs-key">Length</td> <td class="specs-value fk-data">5.5 m</td> </tr> </table> <table cellspacing="0" class="fk-specs-type2"> <tr> <th class="group-head" colspan="2">In The Box</th> </tr> <tr class=""> <td class="specs-key"> </td> <td class="specs-value fk-data">Saree  Blouse Piece</td> </tr> </table> </div>,10:03:2014,None
LSTSARDNHV5FK3EY9C7V96WPN,Sunaina Striped Silk  Synthetic Sari,http://www.flipkart.com/womens-clothing?otracker=hp_nmenu_sub_women_0_Clothing,Rs. 499,Clothing,Saris,Sunaina,http://img6a.flixcart.com/image/sari/9/c/7/18008-sunaina-free-size-400x400-imadnhwaaqghgrdr.jpeg,Rs. 1499,Dark Brown,women,http://www.flipkart.com/sunaina-striped-silk-synthetic-sari/p/itmdz65eycq4hbyg?pid=SARDNHV5FK3EY9C7&srno=b_6&ref=eb993966-6232-495c-966e-1c5602078d7b,Gallibazaar,Sunaina Striped Silk  Synthetic Sari - Buy Dark Brown Sunaina Striped Silk  Synthetic Sari Online at Best Prices in India | Flipkart.com,Sunaina Striped Silk  Synthetic Sari - Buy Dark Brown Sunaina Striped Silk  Synthetic Sari For Only Rs. 0.0 Online in India. Shop Online For Apparels. Huge Collection of Branded Clothes Only at,[],<div class="item_left_column" id="description"> <h3 class="item_desc_title fk-uppercase">Sunaina Striped Silk  Synthetic Sari         Price: Rs.499</h3> <div class="cls"></div> <div class="item_desc_text line"> <div style="float:right"> </div> <p style="text-align: justify;">   Reveal your modish appeal and express your uniqueness in dressing by draping this<strong> brown printed sari from the house of Sunaina</strong>. The ethnic wear is a bend of synthetic and silk that give you a relaxed feel. Wear heels  a matching blouse and stylish earrings with this sari.</p> </div> <div style="clear: both;"></div> </div>,<div class="item_left_column" id="specifications"> <h3 class="item_desc_title fk-uppercase">         Specifications of Sunaina Striped Silk  Synthetic Sari    </h3> <table cellspacing="0" class="fk-specs-type2"> <tr> <th class="group-head" colspan="2">General Details<a class="see-more unitExt rmargin10 no-underline" href="javascript:void(0);" onclick="$(this).closest('.fk-specs-type2').toggleClass('expandedMore')" title="Expand">[+]</a><a class="hidden unitExt rmargin10 no-underline" href="javascript:void(0);" onclick="$(this).closest('.fk-specs-type2').toggleClass('expandedMore')" title="Collapse">[-]</a></th> </tr> <tr class="hidden"> <td class="specs-key">Ideal For</td> <td class="specs-value fk-data">Women's</td> </tr> <tr class="hidden"> <td class="specs-key">Occasion</td> <td class="specs-value fk-data">Casual</td> </tr> <tr class="hidden"> <td class="specs-key">Pattern</td> <td class="specs-value fk-data">Striped</td> </tr> </table> <table cellspacing="0" class="fk-specs-type2"> <tr> <th class="group-head" colspan="2">Sari Details</th> </tr> <tr class=""> <td class="specs-key">Ideal For</td> <td class="specs-value fk-data">Women's</td> </tr> <tr class=""> <td class="specs-key">Fabric</td> <td class="specs-value fk-data">Silk  Synthetic</td> </tr> <tr class=""> <td class="specs-key">Number of Contents in Sales Package</td> <td class="specs-value fk-data">Pack of 1</td> </tr> </table> <table cellspacing="0" class="fk-specs-type2"> <tr> <th class="group-head" colspan="2">In The Box</th> </tr> <tr class=""> <td class="specs-key"> </td> <td class="specs-value fk-data">Saree  Blouse</td> </tr> </table> </div>,10:03:2014,None
LSTSARDNHV5EA5SZWX2ZODFVP,Sunaina Printed Synthetic  Silk Sari,http://www.flipkart.com/womens-clothing?otracker=hp_nmenu_sub_women_0_Clothing,Rs. 649,Clothing,Saris,Sunaina,http://img6a.flixcart.com/image/sari/w/x/2/5270-sunaina-free-size-400x400-imadnhwaz2yass8g.jpeg,Rs. 1499,Yellow,women,http://www.flipkart.com/sunaina-printed-synthetic-silk-sari/p/itmdz65efankdhmk?pid=SARDNHV5EA5SZWX2&srno=b_30&ref=4a51133a-f055-448e-88b6-d64add66fc79,Gallibazaar,Sunaina Printed Synthetic  Silk Sari - Buy Yellow Sunaina Printed Synthetic  Silk Sari Online at Best Prices in India | Flipkart.com,Sunaina Printed Synthetic  Silk Sari - Buy Yellow Sunaina Printed Synthetic  Silk Sari For Only Rs. 0.0 Online in India. Shop Online For Apparels. Huge Collection of Branded Clothes Only at,[],<div class="item_left_column" id="description"> <h3 class="item_desc_title fk-uppercase">Sunaina Printed Synthetic  Silk Sari         Price: Rs.649</h3> <div class="cls"></div> <div class="item_desc_text line"> <div style="float:right"> </div> <p style="text-align: justify;">   Up your glam quotient by wearing this<strong> printed sari </strong>from the house of Sunaina. This sari take your fashion statement to a new level. Look smart and stylish by wearing a matching blouse and sandals with this synthetic and silk sari.</p> </div> <div style="clear: both;"></div> </div>,<div class="item_left_column" id="specifications"> <h3 class="item_desc_title fk-uppercase">         Specifications of Sunaina Printed Synthetic  Silk Sari    </h3> <table cellspacing="0" class="fk-specs-type2"> <tr> <th class="group-head" colspan="2">General Details<a class="see-more unitExt rmargin10 no-underline" href="javascript:void(0);" onclick="$(this).closest('.fk-specs-type2').toggleClass('expandedMore')" title="Expand">[+]</a><a class="hidden unitExt rmargin10 no-underline" href="javascript:void(0);" onclick="$(this).closest('.fk-specs-type2').toggleClass('expandedMore')" title="Collapse">[-]</a></th> </tr> <tr class="hidden"> <td class="specs-key">Ideal For</td> <td class="specs-value fk-data">Women's</td> </tr> <tr class="hidden"> <td class="specs-key">Occasion</td> <td class="specs-value fk-data">Casual</td> </tr> <tr class="hidden"> <td class="specs-key">Pattern</td> <td class="specs-value fk-data">Printed</td> </tr> </table> <table cellspacing="0" class="fk-specs-type2"> <tr> <th class="group-head" colspan="2">Sari Details</th> </tr> <tr class=""> <td class="specs-key">Ideal For</td> <td class="specs-value fk-data">Women's</td> </tr> <tr class=""> <td class="specs-key">Fabric</td> <td class="specs-value fk-data">Synthetic  Silk</td> </tr> <tr class=""> <td class="specs-key">Number of Contents in Sales Package</td> <td class="specs-value fk-data">Pack of 1</td> </tr> </table> <table cellspacing="0" class="fk-specs-type2"> <tr> <th class="group-head" colspan="2">In The Box</th> </tr> <tr class=""> <td class="specs-key"> </td> <td class="specs-value fk-data">Saree  Blouse</td> </tr> </table> </div>,10:03:2014,None
LSTSARDNHV5CTGP9ZMDTWMJ2V,Sunaina Printed Silk  Synthetic Sari,http://www.flipkart.com/womens-clothing?otracker=hp_nmenu_sub_women_0_Clothing,Rs. 649,Clothing,Saris,Sunaina,http://img5a.flixcart.com/image/sari/z/m/d/5328-sunaina-free-size-400x400-imadnhwbwgq7zn9s.jpeg,Rs. 1499,Dark yellow,women,http://www.flipkart.com/sunaina-printed-silk-synthetic-sari/p/itmdz65edquh4gwf?pid=SARDNHV5CTGP9ZMD&srno=b_32&ref=a76a19cb-8966-4bcb-8851-b60b1e4dc254,Gallibazaar,Sunaina Printed Silk  Synthetic Sari - Buy Dark yellow Sunaina Printed Silk  Synthetic Sari Online at Best Prices in India | Flipkart.com,Sunaina Printed Silk  Synthetic Sari - Buy Dark yellow Sunaina Printed Silk  Synthetic Sari For Only Rs. 0.0 Online in India. Shop Online For Apparels. Huge Collection of Branded Clothes Only at,[],<div class="item_left_column" id="description"> <h3 class="item_desc_title fk-uppercase">Sunaina Printed Silk  Synthetic Sari         Price: Rs.649</h3> <div class="cls"></div> <div class="item_desc_text line"> <div style="float:right"> </div> <p>   Vibrant shades  floral motifs  splendid stripes-all against a dark yellow canvas  this sari is crafted from <strong>synthetic silk fabric</strong>. With hints of blue on the border this sari looks best with a matching blouse and long chains to give you a raw ethnic appeal.</p> </div> <div style="clear: both;"></div> </div>,<div class="item_left_column" id="specifications"> <h3 class="item_desc_title fk-uppercase">         Specifications of Sunaina Printed Silk  Synthetic Sari    </h3> <table cellspacing="0" class="fk-specs-type2"> <tr> <th class="group-head" colspan="2">General Details<a class="see-more unitExt rmargin10 no-underline" href="javascript:void(0);" onclick="$(this).closest('.fk-specs-type2').toggleClass('expandedMore')" title="Expand">[+]</a><a class="hidden unitExt rmargin10 no-underline" href="javascript:void(0);" onclick="$(this).closest('.fk-specs-type2').toggleClass('expandedMore')" title="Collapse">[-]</a></th> </tr> <tr class="hidden"> <td class="specs-key">Ideal For</td> <td class="specs-value fk-data">Women's</td> </tr> <tr class="hidden"> <td class="specs-key">Occasion</td> <td class="specs-value fk-data">Casual</td> </tr> <tr class="hidden"> <td class="specs-key">Pattern</td> <td class="specs-value fk-data">Printed</td> </tr> </table> <table cellspacing="0" class="fk-specs-type2"> <tr> <th class="group-head" colspan="2">Sari Details</th> </tr> <tr class=""> <td class="specs-key">Ideal For</td> <td class="specs-value fk-data">Women's</td> </tr> <tr class=""> <td class="specs-key">Fabric</td> <td class="specs-value fk-data">Silk  Synthetic</td> </tr> <tr class=""> <td class="specs-key">Number of Contents in Sales Package</td> <td class="specs-value fk-data">Pack of 1</td> </tr> </table> <table cellspacing="0" class="fk-specs-type2"> <tr> <th class="group-head" colspan="2">In The Box</th> </tr> <tr class=""> <td class="specs-key"> </td> <td class="specs-value fk-data">Saree  Blouse</td> </tr> </table> </div>,10:03:2014,None
