LSTSARDQRUNFJ9X8FNW5K2OH0,Sunaina Printed Cotton  Silk Sari,http://www.flipkart.com/womens-clothing?otracker=hp_nmenu_sub_women_0_Clothing,Rs. 1199,Clothing,Saris,Sunaina,http://img5a.flixcart.com/image/sari/f/n/w/8533-sunaina-400x400-imadqsh8tdvu9d7j.jpeg,Rs. 1999,Multicolor,women,http://www.flipkart.com/sunaina-printed-cotton-silk-sari/p/itmdqrunc9ak79bz?pid=SARDQRUNFJ9X8FNW&srno=b_43&ref=a76a19cb-8966-4bcb-8851-b60b1e4dc254,Gallibazaar,Sunaina Printed Cotton  Silk Sari - Buy Multicolor Sunaina Printed Cotton  Silk Sari Online at Best Prices in India | Flipkart.com,Sunaina Printed Cotton  Silk Sari - Buy Multicolor Sunaina Printed Cotton  Silk Sari For Only Rs. 0.0 Online in India. Shop Online For Apparels. Huge Collection of Branded Clothes Only at,[],<div class="item_left_column" id="description"> <h3 class="item_desc_title fk-uppercase">Sunaina Printed Cotton  Silk Sari         Price: Rs.1199</h3> <div class="cls"></div> <div class="item_desc_text line"> <div style="float:right"> </div>                         Peppy colors  designer trends  comfortable and a trendy look in ethnic wear. Just peep into the style quotient of popular onscreen divas following this thumb rule. You have caught us right. Vibrant shades  floral motifs  splendid stripes.        </div> <div style="clear: both;"></div> </div>,<div class="item_left_column" id="specifications"> <h3 class="item_desc_title fk-uppercase">         Specifications of Sunaina Printed Cotton  Silk Sari    </h3> <table cellspacing="0" class="fk-specs-type2"> <tr> <th class="group-head" colspan="2">General Details<a class="see-more unitExt rmargin10 no-underline" href="javascript:void(0);" onclick="$(this).closest('.fk-specs-type2').toggleClass('expandedMore')" title="Expand">[+]</a><a class="hidden unitExt rmargin10 no-underline" href="javascript:void(0);" onclick="$(this).closest('.fk-specs-type2').toggleClass('expandedMore')" title="Collapse">[-]</a></th> </tr> <tr class="hidden"> <td class="specs-key">Occasion</td> <td class="specs-value fk-data">Party  Wedding  Casual</td> </tr> <tr class="hidden"> <td class="specs-key">Pattern</td> <td class="specs-value fk-data">Printed</td> </tr> </table> <table cellspacing="0" class="fk-specs-type2"> <tr> <th class="group-head" colspan="2">Sari Details</th> </tr> <tr class=""> <td class="specs-key">Fabric</td> <td class="specs-value fk-data">Cotton  Silk</td> </tr> </table> <table cellspacing="0" class="fk-specs-type2"> <tr> <th class="group-head" colspan="2">In The Box</th> </tr> <tr class=""> <td class="specs-key"> </td> <td class="specs-value fk-data">Saree  Blouse Piece</td> </tr> </table> </div>,10:03:2014,None
LSTSARDNHV5UAP4MDRFBJFBVO,Sunaina Printed Synthetic  Silk Sari,http://www.flipkart.com/womens-clothing?otracker=hp_nmenu_sub_women_0_Clothing,Rs. 649,Clothing,Saris,Sunaina,http://img5a.flixcart.com/image/sari/d/r/f/5199-sunaina-free-size-400x400-imadnhw9mqghkh2z.jpeg,Rs. 1499,Cream-grey,women,http://www.flipkart.com/sunaina-printed-synthetic-silk-sari/p/itmdz65eggtjrwgm?pid=SARDNHV5UAP4MDRF&srno=b_31&ref=a76a19cb-8966-4bcb-8851-b60b1e4dc254,Gallibazaar,Sunaina Printed Synthetic  Silk Sari - Buy Cream-grey Sunaina Printed Synthetic  Silk Sari Online at Best Prices in India | Flipkart.com,Sunaina Printed Synthetic  Silk Sari - Buy Cream-grey Sunaina Printed Synthetic  Silk Sari For Only Rs. 0.0 Online in India. Shop Online For Apparels. Huge Collection of Branded Clothes Only at,[],<div class="item_left_column" id="description"> <h3 class="item_desc_title fk-uppercase">Sunaina Printed Synthetic  Silk Sari         Price: Rs.649</h3> <div class="cls"></div> <div class="item_desc_text line"> <div style="float:right"> </div> <p>   With a halter-neck blouse and a long chain of beads to complement it  this <strong>printed silk synthetic</strong> sari from Sunaina comes in a ravishing cream and grey that will ensure that you make your presence felt in any room.</p> </div> <div style="clear: both;"></div> </div>,<div class="item_left_column" id="specifications"> <h3 class="item_desc_title fk-uppercase">         Specifications of Sunaina Printed Synthetic  Silk Sari    </h3> <table cellspacing="0" class="fk-specs-type2"> <tr> <th class="group-head" colspan="2">General Details<a class="see-more unitExt rmargin10 no-underline" href="javascript:void(0);" onclick="$(this).closest('.fk-specs-type2').toggleClass('expandedMore')" title="Expand">[+]</a><a class="hidden unitExt rmargin10 no-underline" href="javascript:void(0);" onclick="$(this).closest('.fk-specs-type2').toggleClass('expandedMore')" title="Collapse">[-]</a></th> </tr> <tr class="hidden"> <td class="specs-key">Ideal For</td> <td class="specs-value fk-data">Women's</td> </tr> <tr class="hidden"> <td class="specs-key">Occasion</td> <td class="specs-value fk-data">Casual</td> </tr> <tr class="hidden"> <td class="specs-key">Pattern</td> <td class="specs-value fk-data">Printed</td> </tr> </table> <table cellspacing="0" class="fk-specs-type2"> <tr> <th class="group-head" colspan="2">Sari Details</th> </tr> <tr class=""> <td class="specs-key">Ideal For</td> <td class="specs-value fk-data">Women's</td> </tr> <tr class=""> <td class="specs-key">Fabric</td> <td class="specs-value fk-data">Synthetic  Silk</td> </tr> <tr class=""> <td class="specs-key">Number of Contents in Sales Package</td> <td class="specs-value fk-data">Pack of 1</td> </tr> </table> <table cellspacing="0" class="fk-specs-type2"> <tr> <th class="group-head" colspan="2">In The Box</th> </tr> <tr class=""> <td class="specs-key"> </td> <td class="specs-value fk-data">Saree  Blouse</td> </tr> </table> </div>,10:03:2014,None
LSTSARDPDZEU9VHBUHUPVOGOC,Sunaina Printed Art Silk Sari,http://www.flipkart.com/womens-clothing?otracker=hp_nmenu_sub_women_0_Clothing,Rs. 649,Clothing,Saris,Sunaina,http://img5a.flixcart.com/image/sari/u/h/u/18187-sunaina-400x400-imadpdqhafhc9wzs.jpeg,Rs. 1499,Pink-Green,women,http://www.flipkart.com/sunaina-printed-art-silk-sari/p/itmdpdzfuafhmmcy?pid=SARDPDZEU9VHBUHU&srno=b_1&ref=b1c9ed14-9fa6-4c98-aa3a-67a1645bed69,Gallibazaar,Sunaina Printed Art Silk Sari - Buy Pink-Green Sunaina Printed Art Silk Sari Online at Best Prices in India | Flipkart.com,Sunaina Printed Art Silk Sari - Buy Pink-Green Sunaina Printed Art Silk Sari For Only Rs. 0.0 Online in India. Shop Online For Apparels. Huge Collection of Branded Clothes Only at,[],<div class="item_left_column" id="description"> <h3 class="item_desc_title fk-uppercase">Sunaina Printed Art Silk Sari         Price: Rs.649</h3> <div class="cls"></div> <div class="item_desc_text line"> <div style="float:right"> </div> <p style="text-align: justify;">   Representing fashion at its best  Sunaina designs this <strong>printed sari </strong>that takes your style a notch higher. Be a fashionista when you drape this silk sari that has been inspired by the region of South India. Look your best by wearing a sleeveless blouse and shimmery heels with this sari.</p> </div> <div style="clear: both;"></div> </div>,<div class="item_left_column" id="specifications"> <h3 class="item_desc_title fk-uppercase">         Specifications of Sunaina Printed Art Silk Sari    </h3> <table cellspacing="0" class="fk-specs-type2"> <tr> <th class="group-head" colspan="2">General Details<a class="see-more unitExt rmargin10 no-underline" href="javascript:void(0);" onclick="$(this).closest('.fk-specs-type2').toggleClass('expandedMore')" title="Expand">[+]</a><a class="hidden unitExt rmargin10 no-underline" href="javascript:void(0);" onclick="$(this).closest('.fk-specs-type2').toggleClass('expandedMore')" title="Collapse">[-]</a></th> </tr> <tr class="hidden"> <td class="specs-key">Occasion</td> <td class="specs-value fk-data">Party  Casual</td> </tr> <tr class="hidden"> <td class="specs-key">Pattern</td> <td class="specs-value fk-data">Printed</td> </tr> </table> <table cellspacing="0" class="fk-specs-type2"> <tr> <th class="group-head" colspan="2">Sari Details</th> </tr> <tr class=""> <td class="specs-key">Fabric</td> <td class="specs-value fk-data">Art Silk</td> </tr> <tr class=""> <td class="specs-key">Region</td> <td class="specs-value fk-data">South Indian</td> </tr> <tr class=""> <td class="specs-key">Number of Contents in Sales Package</td> <td class="specs-value fk-data">Pack of 1</td> </tr> <tr class=""> <td class="specs-key">Blouse Piece</td> <td class="specs-value fk-data">Yes</td> </tr> </table> <table cellspacing="0" class="fk-specs-type2"> <tr> <th class="group-head" colspan="2">Dimensions</th> </tr> <tr class=""> <td class="specs-key">Length</td> <td class="specs-value fk-data">5.5 m</td> </tr> </table> <table cellspacing="0" class="fk-specs-type2"> <tr> <th class="group-head" colspan="2">In The Box</th> </tr> <tr class=""> <td class="specs-key"> </td> <td class="specs-value fk-data">Blouse Piece  Saree</td> </tr> </table> </div>,10:03:2014,None
LSTSARDNHV5U5RHJ86FRVQSTD,Sunaina Solid Synthetic  Silk Sari,http://www.flipkart.com/womens-clothing?otracker=hp_nmenu_sub_women_0_Clothing,Rs. 649,Clothing,Saris,Sunaina,http://img5a.flixcart.com/image/sari/8/6/f/18145-sunaina-free-size-400x400-imadnhw9fqbdhcgj.jpeg,Rs. 1499,Blue,women,http://www.flipkart.com/sunaina-solid-synthetic-silk-sari/p/itmdz65ep6awhapg?pid=SARDNHV5U5RHJ86F&srno=b_3&ref=b1c9ed14-9fa6-4c98-aa3a-67a1645bed69,Gallibazaar,Sunaina Solid Synthetic  Silk Sari - Buy Blue Sunaina Solid Synthetic  Silk Sari Online at Best Prices in India | Flipkart.com,Sunaina Solid Synthetic  Silk Sari - Buy Blue Sunaina Solid Synthetic  Silk Sari For Only Rs. 0.0 Online in India. Shop Online For Apparels. Huge Collection of Branded Clothes Only at,[],<div class="item_left_column" id="description"> <h3 class="item_desc_title fk-uppercase">Sunaina Solid Synthetic  Silk Sari         Price: Rs.649</h3> <div class="cls"></div> <div class="item_desc_text line"> <div style="float:right"> </div> <p>   Tiled to soothing colors  this synthetic silk sari from the house of <strong>Sunaina</strong> has gorgeous <strong>paisley print</strong> all over. The elegant style of prints  especially on the pallu that glamorize your persona and make you ready to grab compliments at social events and gatherings.</p> </div> <div style="clear: both;"></div> </div>,<div class="item_left_column" id="specifications"> <h3 class="item_desc_title fk-uppercase">         Specifications of Sunaina Solid Synthetic  Silk Sari    </h3> <table cellspacing="0" class="fk-specs-type2"> <tr> <th class="group-head" colspan="2">General Details<a class="see-more unitExt rmargin10 no-underline" href="javascript:void(0);" onclick="$(this).closest('.fk-specs-type2').toggleClass('expandedMore')" title="Expand">[+]</a><a class="hidden unitExt rmargin10 no-underline" href="javascript:void(0);" onclick="$(this).closest('.fk-specs-type2').toggleClass('expandedMore')" title="Collapse">[-]</a></th> </tr> <tr class="hidden"> <td class="specs-key">Ideal For</td> <td class="specs-value fk-data">Women's</td> </tr> <tr class="hidden"> <td class="specs-key">Occasion</td> <td class="specs-value fk-data">Casual</td> </tr> <tr class="hidden"> <td class="specs-key">Pattern</td> <td class="specs-value fk-data">Solid</td> </tr> </table> <table cellspacing="0" class="fk-specs-type2"> <tr> <th class="group-head" colspan="2">Sari Details</th> </tr> <tr class=""> <td class="specs-key">Ideal For</td> <td class="specs-value fk-data">Women's</td> </tr> <tr class=""> <td class="specs-key">Fabric</td> <td class="specs-value fk-data">Synthetic  Silk</td> </tr> <tr class=""> <td class="specs-key">Number of Contents in Sales Package</td> <td class="specs-value fk-data">Pack of 1</td> </tr> </table> <table cellspacing="0" class="fk-specs-type2"> <tr> <th class="group-head" colspan="2">In The Box</th> </tr> <tr class=""> <td class="specs-key"> </td> <td class="specs-value fk-data">Blouse  Saree</td> </tr> </table> </div>,10:03:2014,None
LSTSARDPDZFXGEXKMQRHP7FPP,Sunaina Printed Georgette Sari,http://www.flipkart.com/womens-clothing?otracker=hp_nmenu_sub_women_0_Clothing,Rs. 849,Clothing,Saris,Sunaina,http://img5a.flixcart.com/image/sari/m/q/r/7717-sunaina-400x400-imadpdqh7vh7xftt.jpeg,Rs. 1999,Multicolor,women,http://www.flipkart.com/sunaina-printed-georgette-sari/p/itmdpdzfvnzdgubw?pid=SARDPDZFXGEXKMQR&srno=b_34&ref=a76a19cb-8966-4bcb-8851-b60b1e4dc254,Gallibazaar,Sunaina Printed Georgette Sari - Buy Multicolor Sunaina Printed Georgette Sari Online at Best Prices in India | Flipkart.com,Sunaina Printed Georgette Sari - Buy Multicolor Sunaina Printed Georgette Sari For Only Rs. 0.0 Online in India. Shop Online For Apparels. Huge Collection of Branded Clothes Only at,[],<div class="item_left_column" id="description"> <h3 class="item_desc_title fk-uppercase">Sunaina Printed Georgette Sari         Price: Rs.849</h3> <div class="cls"></div> <div class="item_desc_text line"> <div style="float:right"> </div> <p style="text-align: justify;">   Understated drama and splendour mark the beauty of this lovely printed sari from Sunaina. The <strong>contrast hued border</strong> makes this georgette sari a wardrobe solution for all occassion. Available with a matching blouse piece  style this sari with a set of bangles and earrings.</p> </div> <div style="clear: both;"></div> </div>,<div class="item_left_column" id="specifications"> <h3 class="item_desc_title fk-uppercase">         Specifications of Sunaina Printed Georgette Sari    </h3> <table cellspacing="0" class="fk-specs-type2"> <tr> <th class="group-head" colspan="2">General Details<a class="see-more unitExt rmargin10 no-underline" href="javascript:void(0);" onclick="$(this).closest('.fk-specs-type2').toggleClass('expandedMore')" title="Expand">[+]</a><a class="hidden unitExt rmargin10 no-underline" href="javascript:void(0);" onclick="$(this).closest('.fk-specs-type2').toggleClass('expandedMore')" title="Collapse">[-]</a></th> </tr> <tr class="hidden"> <td class="specs-key">Occasion</td> <td class="specs-value fk-data">Casual  Party</td> </tr> <tr class="hidden"> <td class="specs-key">Pattern</td> <td class="specs-value fk-data">Printed</td> </tr> </table> <table cellspacing="0" class="fk-specs-type2"> <tr> <th class="group-head" colspan="2">Sari Details</th> </tr> <tr class=""> <td class="specs-key">Fabric</td> <td class="specs-value fk-data">Georgette</td> </tr> <tr class=""> <td class="specs-key">Region</td> <td class="specs-value fk-data">South Indian</td> </tr> </table> <table cellspacing="0" class="fk-specs-type2"> <tr> <th class="group-head" colspan="2">In The Box</th> </tr> <tr class=""> <td class="specs-key"> </td> <td class="specs-value fk-data">Blouse Piece  Saree</td> </tr> </table> </div>,10:03:2014,None
LSTSARDPDZESJXVZMMDIXZ9QQ,Sunaina Printed Art Silk Sari,http://www.flipkart.com/womens-clothing?otracker=hp_nmenu_sub_women_0_Clothing,Rs. 649,Clothing,Saris,Sunaina,http://img5a.flixcart.com/image/sari/m/m/d/5404-sunaina-400x400-imadpdqhunuqmkfe.jpeg,Rs. 1499,Green,women,http://www.flipkart.com/sunaina-printed-art-silk-sari/p/itmdpdzfgcgmtjhg?pid=SARDPDZESJXVZMMD&srno=b_44&ref=a76a19cb-8966-4bcb-8851-b60b1e4dc254,Gallibazaar,Sunaina Printed Art Silk Sari - Buy Green Sunaina Printed Art Silk Sari Online at Best Prices in India | Flipkart.com,Sunaina Printed Art Silk Sari - Buy Green Sunaina Printed Art Silk Sari For Only Rs. 0.0 Online in India. Shop Online For Apparels. Huge Collection of Branded Clothes Only at,[],<div class="item_left_column" id="description"> <h3 class="item_desc_title fk-uppercase">Sunaina Printed Art Silk Sari         Price: Rs.649</h3> <div class="cls"></div> <div class="item_desc_text line"> <div style="float:right"> </div>                         Peppy colors  designer trends  comfortable and a trendy look in ethnic wear. Just peep into the style quotient of popular onscreen divas following this thumb rule. You have caught us right. Vibrant shades  floral motifs  splendid stripes.        </div> <div style="clear: both;"></div> </div>,<div class="item_left_column" id="specifications"> <h3 class="item_desc_title fk-uppercase">         Specifications of Sunaina Printed Art Silk Sari    </h3> <table cellspacing="0" class="fk-specs-type2"> <tr> <th class="group-head" colspan="2">General Details<a class="see-more unitExt rmargin10 no-underline" href="javascript:void(0);" onclick="$(this).closest('.fk-specs-type2').toggleClass('expandedMore')" title="Expand">[+]</a><a class="hidden unitExt rmargin10 no-underline" href="javascript:void(0);" onclick="$(this).closest('.fk-specs-type2').toggleClass('expandedMore')" title="Collapse">[-]</a></th> </tr> <tr class="hidden"> <td class="specs-key">Occasion</td> <td class="specs-value fk-data">Casual  Party</td> </tr> <tr class="hidden"> <td class="specs-key">Pattern</td> <td class="specs-value fk-data">Printed</td> </tr> </table> <table cellspacing="0" class="fk-specs-type2"> <tr> <th class="group-head" colspan="2">Sari Details</th> </tr> <tr class=""> <td class="specs-key">Fabric</td> <td class="specs-value fk-data">Art Silk</td> </tr> <tr class=""> <td class="specs-key">Region</td> <td class="specs-value fk-data">South Indian</td> </tr> <tr class=""> <td class="specs-key">Number of Contents in Sales Package</td> <td class="specs-value fk-data">Pack of 1</td> </tr> <tr class=""> <td class="specs-key">Blouse Piece</td> <td class="specs-value fk-data">Yes</td> </tr> </table> <table cellspacing="0" class="fk-specs-type2"> <tr> <th class="group-head" colspan="2">Dimensions</th> </tr> <tr class=""> <td class="specs-key">Length</td> <td class="specs-value fk-data">5.5 m</td> </tr> </table> <table cellspacing="0" class="fk-specs-type2"> <tr> <th class="group-head" colspan="2">In The Box</th> </tr> <tr class=""> <td class="specs-key"> </td> <td class="specs-value fk-data">Saree  Blouse Piece</td> </tr> </table> </div>,10:03:2014,None
LSTSARDPDZFYGWPXTGFEUCUW1,Sunaina Printed Georgette Sari,http://www.flipkart.com/womens-clothing?otracker=hp_nmenu_sub_women_0_Clothing,Rs. 899,Clothing,Saris,Sunaina,http://img6a.flixcart.com/image/sari/t/g/f/7744-sunaina-400x400-imadpdqhjxnjzy8s.jpeg,Rs. 1899,Multicolor,women,http://www.flipkart.com/sunaina-printed-georgette-sari/p/itmdpdzfwkshyman?pid=SARDPDZFYGWPXTGF&srno=b_45&ref=a76a19cb-8966-4bcb-8851-b60b1e4dc254,Gallibazaar,Sunaina Printed Georgette Sari - Buy Multicolor Sunaina Printed Georgette Sari Online at Best Prices in India | Flipkart.com,Sunaina Printed Georgette Sari - Buy Multicolor Sunaina Printed Georgette Sari For Only Rs. 0.0 Online in India. Shop Online For Apparels. Huge Collection of Branded Clothes Only at,[],<div class="item_left_column" id="description"> <h3 class="item_desc_title fk-uppercase">Sunaina Printed Georgette Sari         Price: Rs.899</h3> <div class="cls"></div> <div class="item_desc_text line"> <div style="float:right"> </div>                         Peppy colors  designer trends  comfortable and a trendy look in ethnic wear. Just peep into the style quotient of popular onscreen divas following this thumb rule. You have caught us right. Vibrant shades  floral motifs  splendid stripes.        </div> <div style="clear: both;"></div> </div>,<div class="item_left_column" id="specifications"> <h3 class="item_desc_title fk-uppercase">         Specifications of Sunaina Printed Georgette Sari    </h3> <table cellspacing="0" class="fk-specs-type2"> <tr> <th class="group-head" colspan="2">General Details<a class="see-more unitExt rmargin10 no-underline" href="javascript:void(0);" onclick="$(this).closest('.fk-specs-type2').toggleClass('expandedMore')" title="Expand">[+]</a><a class="hidden unitExt rmargin10 no-underline" href="javascript:void(0);" onclick="$(this).closest('.fk-specs-type2').toggleClass('expandedMore')" title="Collapse">[-]</a></th> </tr> <tr class="hidden"> <td class="specs-key">Occasion</td> <td class="specs-value fk-data">Party  Casual</td> </tr> <tr class="hidden"> <td class="specs-key">Pattern</td> <td class="specs-value fk-data">Printed</td> </tr> </table> <table cellspacing="0" class="fk-specs-type2"> <tr> <th class="group-head" colspan="2">Sari Details</th> </tr> <tr class=""> <td class="specs-key">Fabric</td> <td class="specs-value fk-data">Georgette</td> </tr> <tr class=""> <td class="specs-key">Region</td> <td class="specs-value fk-data">South Indian</td> </tr> </table> <table cellspacing="0" class="fk-specs-type2"> <tr> <th class="group-head" colspan="2">In The Box</th> </tr> <tr class=""> <td class="specs-key"> </td> <td class="specs-value fk-data">Blouse Piece  Saree</td> </tr> </table> </div>,10:03:2014,None
LSTSARDNHV5VYYMS9SH3HMTDC,Sunaina Striped Silk  Synthetic Sari,http://www.flipkart.com/womens-clothing?otracker=hp_nmenu_sub_women_0_Clothing,Rs. 649,Clothing,Saris,Sunaina,http://img5a.flixcart.com/image/sari/9/s/h/18102-sunaina-free-size-400x400-imadnhwarkvrnugb.jpeg,Rs. 1499,Magenta  Pink,women,http://www.flipkart.com/sunaina-striped-silk-synthetic-sari/p/itmdz65eh8n6gwxm?pid=SARDNHV5VYYMS9SH&srno=b_2&ref=b1c9ed14-9fa6-4c98-aa3a-67a1645bed69,Gallibazaar,Sunaina Striped Silk  Synthetic Sari - Buy Magenta  Pink Sunaina Striped Silk  Synthetic Sari Online at Best Prices in India | Flipkart.com,Sunaina Striped Silk  Synthetic Sari - Buy Magenta  Pink Sunaina Striped Silk  Synthetic Sari For Only Rs. 0.0 Online in India. Shop Online For Apparels. Huge Collection of Branded Clothes Only at,[],<div class="item_left_column" id="description"> <h3 class="item_desc_title fk-uppercase">Sunaina Striped Silk  Synthetic Sari         Price: Rs.649</h3> <div class="cls"></div> <div class="item_desc_text line"> <div style="float:right"> </div> <p>   Make a grand entry and look very beautiful in this orange printed sari from Sunaina that is designed with an ethnic pattern and gives you a traditional look. Style this <strong>synthetic silk sari</strong> with gold jhumkis and bangles and look stunning.</p> </div> <div style="clear: both;"></div> </div>,<div class="item_left_column" id="specifications"> <h3 class="item_desc_title fk-uppercase">         Specifications of Sunaina Striped Silk  Synthetic Sari    </h3> <table cellspacing="0" class="fk-specs-type2"> <tr> <th class="group-head" colspan="2">General Details<a class="see-more unitExt rmargin10 no-underline" href="javascript:void(0);" onclick="$(this).closest('.fk-specs-type2').toggleClass('expandedMore')" title="Expand">[+]</a><a class="hidden unitExt rmargin10 no-underline" href="javascript:void(0);" onclick="$(this).closest('.fk-specs-type2').toggleClass('expandedMore')" title="Collapse">[-]</a></th> </tr> <tr class="hidden"> <td class="specs-key">Ideal For</td> <td class="specs-value fk-data">Women's</td> </tr> <tr class="hidden"> <td class="specs-key">Occasion</td> <td class="specs-value fk-data">Casual</td> </tr> <tr class="hidden"> <td class="specs-key">Pattern</td> <td class="specs-value fk-data">Striped</td> </tr> </table> <table cellspacing="0" class="fk-specs-type2"> <tr> <th class="group-head" colspan="2">Sari Details</th> </tr> <tr class=""> <td class="specs-key">Ideal For</td> <td class="specs-value fk-data">Women's</td> </tr> <tr class=""> <td class="specs-key">Fabric</td> <td class="specs-value fk-data">Silk  Synthetic</td> </tr> <tr class=""> <td class="specs-key">Number of Contents in Sales Package</td> <td class="specs-value fk-data">Pack of 1</td> </tr> </table> <table cellspacing="0" class="fk-specs-type2"> <tr> <th class="group-head" colspan="2">In The Box</th> </tr> <tr class=""> <td class="specs-key"> </td> <td class="specs-value fk-data">Blouse  Saree</td> </tr> </table> </div>,10:03:2014,None
