LSTSARDPDZE7WHZYHGU2Y2SM6,Sunaina Printed Cotton Sari,http://www.flipkart.com/womens-clothing?otracker=hp_nmenu_sub_women_0_Clothing,Rs. 777,Clothing,Saris,Sunaina,http://img5a.flixcart.com/image/sari/h/g/u/54-sunaina-400x400-imadpdqhpexxbv5n.jpeg,Rs. 799,Multicolor,women,http://www.flipkart.com/sunaina-printed-cotton-sari/p/itmdpdzfz9dyak79?pid=SARDPDZE7WHZYHGU&srno=b_23&ref=4a51133a-f055-448e-88b6-d64add66fc79,Gallibazaar,Sunaina Printed Cotton Sari - Buy Multicolor Sunaina Printed Cotton Sari Online at Best Prices in India | Flipkart.com,Sunaina Printed Cotton Sari - Buy Multicolor Sunaina Printed Cotton Sari For Only Rs. 0.0 Online in India. Shop Online For Apparels. Huge Collection of Branded Clothes Only at,[],<div class="item_left_column" id="description"> <h3 class="item_desc_title fk-uppercase">Sunaina Printed Cotton Sari         Price: Rs.777</h3> <div class="cls"></div> <div class="item_desc_text line"> <div style="float:right"> </div> <p style="text-align: justify;">   Drape elegance by getting your hands on this Sunaina Sari. This <strong>printed cotton sari </strong>is apt for those parties where you need to leave a lasting impression. A pair of golden stilettos and golden hoops will go perfectly with with this gorgeous sari. </p> <p style="text-align: justify;">    </p> <p>    </p> </div> <div style="clear: both;"></div> </div>,<div class="item_left_column" id="specifications"> <h3 class="item_desc_title fk-uppercase">         Specifications of Sunaina Printed Cotton Sari    </h3> <table cellspacing="0" class="fk-specs-type2"> <tr> <th class="group-head" colspan="2">General Details<a class="see-more unitExt rmargin10 no-underline" href="javascript:void(0);" onclick="$(this).closest('.fk-specs-type2').toggleClass('expandedMore')" title="Expand">[+]</a><a class="hidden unitExt rmargin10 no-underline" href="javascript:void(0);" onclick="$(this).closest('.fk-specs-type2').toggleClass('expandedMore')" title="Collapse">[-]</a></th> </tr> <tr class="hidden"> <td class="specs-key">Occasion</td> <td class="specs-value fk-data">Casual  Party</td> </tr> <tr class="hidden"> <td class="specs-key">Pattern</td> <td class="specs-value fk-data">Printed</td> </tr> </table> <table cellspacing="0" class="fk-specs-type2"> <tr> <th class="group-head" colspan="2">Sari Details</th> </tr> <tr class=""> <td class="specs-key">Fabric</td> <td class="specs-value fk-data">Cotton</td> </tr> <tr class=""> <td class="specs-key">Region</td> <td class="specs-value fk-data">South Indian</td> </tr> </table> <table cellspacing="0" class="fk-specs-type2"> <tr> <th class="group-head" colspan="2">In The Box</th> </tr> <tr class=""> <td class="specs-key"> </td> <td class="specs-value fk-data">Saree  Blouse Piece</td> </tr> </table> </div>,10:03:2014,None
LSTSARDNHV54TKQGVXSB80XLI,Sunaina Printed Silk Sari,http://www.flipkart.com/womens-clothing?otracker=hp_nmenu_sub_women_0_Clothing,Rs. 699,Clothing,Saris,Sunaina,http://img5a.flixcart.com/image/sari/v/x/s/s506-sunaina-free-size-400x400-imadnhwahzm27yj6.jpeg,Rs. 1499,White,women,http://www.flipkart.com/sunaina-printed-silk-sari/p/itmdz65ebv2byg7x?pid=SARDNHV54TKQGVXS&srno=b_17&ref=4a51133a-f055-448e-88b6-d64add66fc79,Gallibazaar,Sunaina Printed Silk Sari - Buy White Sunaina Printed Silk Sari Online at Best Prices in India | Flipkart.com,Sunaina Printed Silk Sari - Buy White Sunaina Printed Silk Sari For Only Rs. 0.0 Online in India. Shop Online For Apparels. Huge Collection of Branded Clothes Only at,[],<div class="item_left_column" id="description"> <h3 class="item_desc_title fk-uppercase">Sunaina Printed Silk Sari         Price: Rs.699</h3> <div class="cls"></div> <div class="item_desc_text line"> <div style="float:right"> </div>                         Peppy colors  designer trends  comfortable and a trendy look in ethnic wear. Just peep into the style quotient of popular onscreen divas following this thumb rule. Saree. You have caught us right. Vibrant shades  floral motifs  splendid stripes and much more for your revamped wardrobe. Were sure you have gathered enough inspiration to ditch your westerns for the sake of stylish sarees. Go ahead. Product Overview - Fancy saree with amazing color combos &amp; prints. It gives an amazing outlook to the lady who is dressed in it. It is made of malbari silk fabric. Saree length is 6.3 m with blouse piece. Fabric Superior Quality Malbari Silk with Digital High Quality printing        </div> <div style="clear: both;"></div> </div>,<div class="item_left_column" id="specifications"> <h3 class="item_desc_title fk-uppercase">         Specifications of Sunaina Printed Silk Sari    </h3> <table cellspacing="0" class="fk-specs-type2"> <tr> <th class="group-head" colspan="2">General Details<a class="see-more unitExt rmargin10 no-underline" href="javascript:void(0);" onclick="$(this).closest('.fk-specs-type2').toggleClass('expandedMore')" title="Expand">[+]</a><a class="hidden unitExt rmargin10 no-underline" href="javascript:void(0);" onclick="$(this).closest('.fk-specs-type2').toggleClass('expandedMore')" title="Collapse">[-]</a></th> </tr> <tr class="hidden"> <td class="specs-key">Ideal For</td> <td class="specs-value fk-data">Women's</td> </tr> <tr class="hidden"> <td class="specs-key">Occasion</td> <td class="specs-value fk-data">Casual</td> </tr> <tr class="hidden"> <td class="specs-key">Pattern</td> <td class="specs-value fk-data">Printed</td> </tr> </table> <table cellspacing="0" class="fk-specs-type2"> <tr> <th class="group-head" colspan="2">Sari Details</th> </tr> <tr class=""> <td class="specs-key">Ideal For</td> <td class="specs-value fk-data">Women's</td> </tr> <tr class=""> <td class="specs-key">Fabric</td> <td class="specs-value fk-data">Silk</td> </tr> <tr class=""> <td class="specs-key">Number of Contents in Sales Package</td> <td class="specs-value fk-data">Pack of 1</td> </tr> </table> <table cellspacing="0" class="fk-specs-type2"> <tr> <th class="group-head" colspan="2">In The Box</th> </tr> <tr class=""> <td class="specs-key"> </td> <td class="specs-value fk-data">Blouse  Saree</td> </tr> </table> </div>,10:03:2014,None
LSTSARDQRUNX8666BPGUCNHCD,Sunaina Printed Art Silk Sari,http://www.flipkart.com/womens-clothing?otracker=hp_nmenu_sub_women_0_Clothing,Rs. 649,Clothing,Saris,Sunaina,http://img6a.flixcart.com/image/sari/b/p/g/5387-sunaina-400x400-imadqsh5dwjwfr2k.jpeg,Rs. 1999,Multicolor,women,http://www.flipkart.com/sunaina-printed-art-silk-sari/p/itmdqrun9kbyz8ff?pid=SARDQRUNX8666BPG&srno=b_35&ref=a76a19cb-8966-4bcb-8851-b60b1e4dc254,Gallibazaar,Sunaina Printed Art Silk Sari - Buy Multicolor Sunaina Printed Art Silk Sari Online at Best Prices in India | Flipkart.com,Sunaina Printed Art Silk Sari - Buy Multicolor Sunaina Printed Art Silk Sari For Only Rs. 0.0 Online in India. Shop Online For Apparels. Huge Collection of Branded Clothes Only at,[],<div class="item_left_column" id="description"> <h3 class="item_desc_title fk-uppercase">Sunaina Printed Art Silk Sari         Price: Rs.649</h3> <div class="cls"></div> <div class="item_desc_text line"> <div style="float:right"> </div>                         Peppy colors  designer trends  comfortable and a trendy look in ethnic wear. Just peep into the style quotient of popular onscreen divas following this thumb rule. You have caught us right. Vibrant shades  floral motifs  splendid stripes.        </div> <div style="clear: both;"></div> </div>,<div class="item_left_column" id="specifications"> <h3 class="item_desc_title fk-uppercase">         Specifications of Sunaina Printed Art Silk Sari    </h3> <table cellspacing="0" class="fk-specs-type2"> <tr> <th class="group-head" colspan="2">General Details<a class="see-more unitExt rmargin10 no-underline" href="javascript:void(0);" onclick="$(this).closest('.fk-specs-type2').toggleClass('expandedMore')" title="Expand">[+]</a><a class="hidden unitExt rmargin10 no-underline" href="javascript:void(0);" onclick="$(this).closest('.fk-specs-type2').toggleClass('expandedMore')" title="Collapse">[-]</a></th> </tr> <tr class="hidden"> <td class="specs-key">Occasion</td> <td class="specs-value fk-data">Casual  Wedding  Party</td> </tr> <tr class="hidden"> <td class="specs-key">Pattern</td> <td class="specs-value fk-data">Printed</td> </tr> </table> <table cellspacing="0" class="fk-specs-type2"> <tr> <th class="group-head" colspan="2">Sari Details</th> </tr> <tr class=""> <td class="specs-key">Fabric</td> <td class="specs-value fk-data">Art Silk</td> </tr> </table> <table cellspacing="0" class="fk-specs-type2"> <tr> <th class="group-head" colspan="2">In The Box</th> </tr> <tr class=""> <td class="specs-key"> </td> <td class="specs-value fk-data">Saree  Blouse Piece</td> </tr> </table> </div>,10:03:2014,None
LSTSARDQRUN6KZUTQGGRRIYTL,Sunaina Printed Cotton  Silk Sari,http://www.flipkart.com/womens-clothing?otracker=hp_nmenu_sub_women_0_Clothing,Rs. 1199,Clothing,Saris,Sunaina,http://img6a.flixcart.com/image/sari/q/g/g/8503-sunaina-400x400-imadqsh8gmuzjepm.jpeg,Rs. 1999,Multicolor,women,http://www.flipkart.com/sunaina-printed-cotton-silk-sari/p/itmdqrunqc5udakk?pid=SARDQRUN6KZUTQGG&srno=b_37&ref=a76a19cb-8966-4bcb-8851-b60b1e4dc254,Gallibazaar,Sunaina Printed Cotton  Silk Sari - Buy Multicolor Sunaina Printed Cotton  Silk Sari Online at Best Prices in India | Flipkart.com,Sunaina Printed Cotton  Silk Sari - Buy Multicolor Sunaina Printed Cotton  Silk Sari For Only Rs. 0.0 Online in India. Shop Online For Apparels. Huge Collection of Branded Clothes Only at,[],<div class="item_left_column" id="description"> <h3 class="item_desc_title fk-uppercase">Sunaina Printed Cotton  Silk Sari         Price: Rs.1199</h3> <div class="cls"></div> <div class="item_desc_text line"> <div style="float:right"> </div>                         Peppy colors  designer trends  comfortable and a trendy look in ethnic wear. Just peep into the style quotient of popular onscreen divas following this thumb rule. You have caught us right. Vibrant shades  floral motifs  splendid stripes.        </div> <div style="clear: both;"></div> </div>,<div class="item_left_column" id="specifications"> <h3 class="item_desc_title fk-uppercase">         Specifications of Sunaina Printed Cotton  Silk Sari    </h3> <table cellspacing="0" class="fk-specs-type2"> <tr> <th class="group-head" colspan="2">General Details<a class="see-more unitExt rmargin10 no-underline" href="javascript:void(0);" onclick="$(this).closest('.fk-specs-type2').toggleClass('expandedMore')" title="Expand">[+]</a><a class="hidden unitExt rmargin10 no-underline" href="javascript:void(0);" onclick="$(this).closest('.fk-specs-type2').toggleClass('expandedMore')" title="Collapse">[-]</a></th> </tr> <tr class="hidden"> <td class="specs-key">Occasion</td> <td class="specs-value fk-data">Party  Casual</td> </tr> <tr class="hidden"> <td class="specs-key">Pattern</td> <td class="specs-value fk-data">Printed</td> </tr> </table> <table cellspacing="0" class="fk-specs-type2"> <tr> <th class="group-head" colspan="2">Sari Details</th> </tr> <tr class=""> <td class="specs-key">Fabric</td> <td class="specs-value fk-data">Cotton  Silk</td> </tr> </table> <table cellspacing="0" class="fk-specs-type2"> <tr> <th class="group-head" colspan="2">In The Box</th> </tr> <tr class=""> <td class="specs-key"> </td> <td class="specs-value fk-data">Blouse Piece  Saree</td> </tr> </table> </div>,10:03:2014,None
LSTSARDNHV5AQXKUZY2KICDR9,Sunaina Printed Synthetic  Silk Sari,http://www.flipkart.com/womens-clothing?otracker=hp_nmenu_sub_women_0_Clothing,Rs. 649,Clothing,Saris,Sunaina,http://img5a.flixcart.com/image/sari/z/y/2/18048-sunaina-free-size-400x400-imadnhwbfgev8tjc.jpeg,Rs. 1499,Silver-orange,women,http://www.flipkart.com/sunaina-printed-synthetic-silk-sari/p/itmdz65ejanbyzg2?pid=SARDNHV5AQXKUZY2&srno=b_21&ref=4a51133a-f055-448e-88b6-d64add66fc79,Gallibazaar,Sunaina Printed Synthetic  Silk Sari - Buy Silver-orange Sunaina Printed Synthetic  Silk Sari Online at Best Prices in India | Flipkart.com,Sunaina Printed Synthetic  Silk Sari - Buy Silver-orange Sunaina Printed Synthetic  Silk Sari For Only Rs. 0.0 Online in India. Shop Online For Apparels. Huge Collection of Branded Clothes Only at,[],<div class="item_left_column" id="description"> <h3 class="item_desc_title fk-uppercase">Sunaina Printed Synthetic  Silk Sari         Price: Rs.649</h3> <div class="cls"></div> <div class="item_desc_text line"> <div style="float:right"> </div> <p style="text-align: justify;">   Dressing you immaculately  Sunaina presents this <strong>orange printed sari</strong>. Crafted from silk and synthetic  the sari assures you comfort all day long. You can wear this sari with a bright colored blouse that blends well with the sari and sandals.</p> </div> <div style="clear: both;"></div> </div>,<div class="item_left_column" id="specifications"> <h3 class="item_desc_title fk-uppercase">         Specifications of Sunaina Printed Synthetic  Silk Sari    </h3> <table cellspacing="0" class="fk-specs-type2"> <tr> <th class="group-head" colspan="2">General Details<a class="see-more unitExt rmargin10 no-underline" href="javascript:void(0);" onclick="$(this).closest('.fk-specs-type2').toggleClass('expandedMore')" title="Expand">[+]</a><a class="hidden unitExt rmargin10 no-underline" href="javascript:void(0);" onclick="$(this).closest('.fk-specs-type2').toggleClass('expandedMore')" title="Collapse">[-]</a></th> </tr> <tr class="hidden"> <td class="specs-key">Ideal For</td> <td class="specs-value fk-data">Women's</td> </tr> <tr class="hidden"> <td class="specs-key">Occasion</td> <td class="specs-value fk-data">Casual</td> </tr> <tr class="hidden"> <td class="specs-key">Pattern</td> <td class="specs-value fk-data">Printed</td> </tr> </table> <table cellspacing="0" class="fk-specs-type2"> <tr> <th class="group-head" colspan="2">Sari Details</th> </tr> <tr class=""> <td class="specs-key">Ideal For</td> <td class="specs-value fk-data">Women's</td> </tr> <tr class=""> <td class="specs-key">Fabric</td> <td class="specs-value fk-data">Synthetic  Silk</td> </tr> <tr class=""> <td class="specs-key">Number of Contents in Sales Package</td> <td class="specs-value fk-data">Pack of 1</td> </tr> </table> <table cellspacing="0" class="fk-specs-type2"> <tr> <th class="group-head" colspan="2">In The Box</th> </tr> <tr class=""> <td class="specs-key"> </td> <td class="specs-value fk-data">Saree  Blouse</td> </tr> </table> </div>,10:03:2014,None
LSTSARDPDZEYGM5TUQM6FXNKX,Sunaina Printed Cotton  Silk Sari,http://www.flipkart.com/womens-clothing?otracker=hp_nmenu_sub_women_0_Clothing,Rs. 649,Clothing,Saris,Sunaina,http://img6a.flixcart.com/image/sari/u/q/m/5059-sunaina-400x400-imadpdqhwdtnnt4g.jpeg,Rs. 1499,Multicolor,women,http://www.flipkart.com/sunaina-printed-cotton-silk-sari/p/itmdpdzfpyqmsgfd?pid=SARDPDZEYGM5TUQM&srno=b_36&ref=a76a19cb-8966-4bcb-8851-b60b1e4dc254,Gallibazaar,Sunaina Printed Cotton  Silk Sari - Buy Multicolor Sunaina Printed Cotton  Silk Sari Online at Best Prices in India | Flipkart.com,Sunaina Printed Cotton  Silk Sari - Buy Multicolor Sunaina Printed Cotton  Silk Sari For Only Rs. 0.0 Online in India. Shop Online For Apparels. Huge Collection of Branded Clothes Only at,[],<div class="item_left_column" id="description"> <h3 class="item_desc_title fk-uppercase">Sunaina Printed Cotton  Silk Sari         Price: Rs.649</h3> <div class="cls"></div> <div class="item_desc_text line"> <div style="float:right"> </div>                         Peppy colors  designer trends  comfortable and a trendy look in ethnic wear. Just peep into the style quotient of popular onscreen divas following this thumb rule. You have caught us right. Vibrant shades  floral motifs  splendid stripes.        </div> <div style="clear: both;"></div> </div>,<div class="item_left_column" id="specifications"> <h3 class="item_desc_title fk-uppercase">         Specifications of Sunaina Printed Cotton  Silk Sari    </h3> <table cellspacing="0" class="fk-specs-type2"> <tr> <th class="group-head" colspan="2">General Details<a class="see-more unitExt rmargin10 no-underline" href="javascript:void(0);" onclick="$(this).closest('.fk-specs-type2').toggleClass('expandedMore')" title="Expand">[+]</a><a class="hidden unitExt rmargin10 no-underline" href="javascript:void(0);" onclick="$(this).closest('.fk-specs-type2').toggleClass('expandedMore')" title="Collapse">[-]</a></th> </tr> <tr class="hidden"> <td class="specs-key">Occasion</td> <td class="specs-value fk-data">Casual  Party</td> </tr> <tr class="hidden"> <td class="specs-key">Pattern</td> <td class="specs-value fk-data">Printed</td> </tr> </table> <table cellspacing="0" class="fk-specs-type2"> <tr> <th class="group-head" colspan="2">Sari Details</th> </tr> <tr class=""> <td class="specs-key">Fabric</td> <td class="specs-value fk-data">Cotton  Silk</td> </tr> <tr class=""> <td class="specs-key">Region</td> <td class="specs-value fk-data">South Indian</td> </tr> <tr class=""> <td class="specs-key">Number of Contents in Sales Package</td> <td class="specs-value fk-data">Pack of 1</td> </tr> <tr class=""> <td class="specs-key">Blouse Piece</td> <td class="specs-value fk-data">Yes</td> </tr> </table> <table cellspacing="0" class="fk-specs-type2"> <tr> <th class="group-head" colspan="2">Dimensions</th> </tr> <tr class=""> <td class="specs-key">Length</td> <td class="specs-value fk-data">5.5 m</td> </tr> </table> <table cellspacing="0" class="fk-specs-type2"> <tr> <th class="group-head" colspan="2">In The Box</th> </tr> <tr class=""> <td class="specs-key"> </td> <td class="specs-value fk-data">Blouse Piece  Saree</td> </tr> </table> </div>,10:03:2014,None
LSTSARDNHV5YGXDWBXNMVN2TR,Sunaina Printed Synthetic  Silk Sari,http://www.flipkart.com/womens-clothing?otracker=hp_nmenu_sub_women_0_Clothing,Rs. 499,Clothing,Saris,Sunaina,http://img5a.flixcart.com/image/sari/b/x/n/18155-sunaina-free-size-400x400-imadnhwajxh2wjyh.jpeg,Rs. 1499,Yellow-pink,women,http://www.flipkart.com/sunaina-printed-synthetic-silk-sari/p/itmdz65egddybgd6?pid=SARDNHV5YGXDWBXN&srno=b_22&ref=4a51133a-f055-448e-88b6-d64add66fc79,Gallibazaar,Sunaina Printed Synthetic  Silk Sari - Buy Yellow-pink Sunaina Printed Synthetic  Silk Sari Online at Best Prices in India | Flipkart.com,Sunaina Printed Synthetic  Silk Sari - Buy Yellow-pink Sunaina Printed Synthetic  Silk Sari For Only Rs. 0.0 Online in India. Shop Online For Apparels. Huge Collection of Branded Clothes Only at,[],<div class="item_left_column" id="description"> <h3 class="item_desc_title fk-uppercase">Sunaina Printed Synthetic  Silk Sari         Price: Rs.499</h3> <div class="cls"></div> <div class="item_desc_text line"> <div style="float:right"> </div> <p style="text-align: justify;">   Sunaina brings to you this beautiful <strong>peppy yellow and pink</strong> synthetic sari that is sure to make you look like a diva. Flaunt a comfortable and trendy ethnic look as you accessorize your look with chandelier earrings and a pair of stilettos.</p> </div> <div style="clear: both;"></div> </div>,<div class="item_left_column" id="specifications"> <h3 class="item_desc_title fk-uppercase">         Specifications of Sunaina Printed Synthetic  Silk Sari    </h3> <table cellspacing="0" class="fk-specs-type2"> <tr> <th class="group-head" colspan="2">General Details<a class="see-more unitExt rmargin10 no-underline" href="javascript:void(0);" onclick="$(this).closest('.fk-specs-type2').toggleClass('expandedMore')" title="Expand">[+]</a><a class="hidden unitExt rmargin10 no-underline" href="javascript:void(0);" onclick="$(this).closest('.fk-specs-type2').toggleClass('expandedMore')" title="Collapse">[-]</a></th> </tr> <tr class="hidden"> <td class="specs-key">Ideal For</td> <td class="specs-value fk-data">Women's</td> </tr> <tr class="hidden"> <td class="specs-key">Occasion</td> <td class="specs-value fk-data">Casual</td> </tr> <tr class="hidden"> <td class="specs-key">Pattern</td> <td class="specs-value fk-data">Printed</td> </tr> </table> <table cellspacing="0" class="fk-specs-type2"> <tr> <th class="group-head" colspan="2">Sari Details</th> </tr> <tr class=""> <td class="specs-key">Ideal For</td> <td class="specs-value fk-data">Women's</td> </tr> <tr class=""> <td class="specs-key">Fabric</td> <td class="specs-value fk-data">Synthetic  Silk</td> </tr> <tr class=""> <td class="specs-key">Number of Contents in Sales Package</td> <td class="specs-value fk-data">Pack of 1</td> </tr> </table> <table cellspacing="0" class="fk-specs-type2"> <tr> <th class="group-head" colspan="2">In The Box</th> </tr> <tr class=""> <td class="specs-key"> </td> <td class="specs-value fk-data">Blouse  Saree</td> </tr> </table> </div>,10:03:2014,None
LSTSARDQRUND2DM7EATF695TH,Sunaina Printed Cotton  Silk Sari,http://www.flipkart.com/womens-clothing?otracker=hp_nmenu_sub_women_0_Clothing,Rs. 1199,Clothing,Saris,Sunaina,http://img5a.flixcart.com/image/sari/e/a/t/8519-sunaina-400x400-imadqshcuuyhhgns.jpeg,Rs. 1999,Multicolor,women,http://www.flipkart.com/sunaina-printed-cotton-silk-sari/p/itmdqrunf6dtjndb?pid=SARDQRUND2DM7EAT&srno=b_41&ref=a76a19cb-8966-4bcb-8851-b60b1e4dc254,Gallibazaar,Sunaina Printed Cotton  Silk Sari - Buy Multicolor Sunaina Printed Cotton  Silk Sari Online at Best Prices in India | Flipkart.com,Sunaina Printed Cotton  Silk Sari - Buy Multicolor Sunaina Printed Cotton  Silk Sari For Only Rs. 0.0 Online in India. Shop Online For Apparels. Huge Collection of Branded Clothes Only at,[],<div class="item_left_column" id="description"> <h3 class="item_desc_title fk-uppercase">Sunaina Printed Cotton  Silk Sari         Price: Rs.1199</h3> <div class="cls"></div> <div class="item_desc_text line"> <div style="float:right"> </div>                         Peppy colors  designer trends  comfortable and a trendy look in ethnic wear. Just peep into the style quotient of popular onscreen divas following this thumb rule. You have caught us right. Vibrant shades  floral motifs  splendid stripes.        </div> <div style="clear: both;"></div> </div>,<div class="item_left_column" id="specifications"> <h3 class="item_desc_title fk-uppercase">         Specifications of Sunaina Printed Cotton  Silk Sari    </h3> <table cellspacing="0" class="fk-specs-type2"> <tr> <th class="group-head" colspan="2">General Details<a class="see-more unitExt rmargin10 no-underline" href="javascript:void(0);" onclick="$(this).closest('.fk-specs-type2').toggleClass('expandedMore')" title="Expand">[+]</a><a class="hidden unitExt rmargin10 no-underline" href="javascript:void(0);" onclick="$(this).closest('.fk-specs-type2').toggleClass('expandedMore')" title="Collapse">[-]</a></th> </tr> <tr class="hidden"> <td class="specs-key">Occasion</td> <td class="specs-value fk-data">Wedding  Casual  Party</td> </tr> <tr class="hidden"> <td class="specs-key">Pattern</td> <td class="specs-value fk-data">Printed</td> </tr> </table> <table cellspacing="0" class="fk-specs-type2"> <tr> <th class="group-head" colspan="2">Sari Details</th> </tr> <tr class=""> <td class="specs-key">Fabric</td> <td class="specs-value fk-data">Cotton  Silk</td> </tr> </table> <table cellspacing="0" class="fk-specs-type2"> <tr> <th class="group-head" colspan="2">In The Box</th> </tr> <tr class=""> <td class="specs-key"> </td> <td class="specs-value fk-data">Saree  Blouse Piece</td> </tr> </table> </div>,10:03:2014,None
LSTSARDQRUNZDUE75VCFY2QWX,Sunaina Printed Cotton  Silk Sari,http://www.flipkart.com/womens-clothing?otracker=hp_nmenu_sub_women_0_Clothing,Rs. 1199,Clothing,Saris,Sunaina,http://img5a.flixcart.com/image/sari/5/v/c/8544-sunaina-400x400-imadqsh5uzfqkdzh.jpeg,Rs. 1999,Multicolor,women,http://www.flipkart.com/sunaina-printed-cotton-silk-sari/p/itmdqrunfwnz4hpb?pid=SARDQRUNZDUE75VC&srno=b_42&ref=a76a19cb-8966-4bcb-8851-b60b1e4dc254,Gallibazaar,Sunaina Printed Cotton  Silk Sari - Buy Multicolor Sunaina Printed Cotton  Silk Sari Online at Best Prices in India | Flipkart.com,Sunaina Printed Cotton  Silk Sari - Buy Multicolor Sunaina Printed Cotton  Silk Sari For Only Rs. 0.0 Online in India. Shop Online For Apparels. Huge Collection of Branded Clothes Only at,[],<div class="item_left_column" id="description"> <h3 class="item_desc_title fk-uppercase">Sunaina Printed Cotton  Silk Sari         Price: Rs.1199</h3> <div class="cls"></div> <div class="item_desc_text line"> <div style="float:right"> </div>                         Peppy colors  designer trends  comfortable and a trendy look in ethnic wear. Just peep into the style quotient of popular onscreen divas following this thumb rule. You have caught us right. Vibrant shades  floral motifs  splendid stripes.        </div> <div style="clear: both;"></div> </div>,<div class="item_left_column" id="specifications"> <h3 class="item_desc_title fk-uppercase">         Specifications of Sunaina Printed Cotton  Silk Sari    </h3> <table cellspacing="0" class="fk-specs-type2"> <tr> <th class="group-head" colspan="2">General Details<a class="see-more unitExt rmargin10 no-underline" href="javascript:void(0);" onclick="$(this).closest('.fk-specs-type2').toggleClass('expandedMore')" title="Expand">[+]</a><a class="hidden unitExt rmargin10 no-underline" href="javascript:void(0);" onclick="$(this).closest('.fk-specs-type2').toggleClass('expandedMore')" title="Collapse">[-]</a></th> </tr> <tr class="hidden"> <td class="specs-key">Occasion</td> <td class="specs-value fk-data">Party  Casual  Wedding</td> </tr> <tr class="hidden"> <td class="specs-key">Pattern</td> <td class="specs-value fk-data">Printed</td> </tr> </table> <table cellspacing="0" class="fk-specs-type2"> <tr> <th class="group-head" colspan="2">Sari Details</th> </tr> <tr class=""> <td class="specs-key">Fabric</td> <td class="specs-value fk-data">Cotton  Silk</td> </tr> </table> <table cellspacing="0" class="fk-specs-type2"> <tr> <th class="group-head" colspan="2">In The Box</th> </tr> <tr class=""> <td class="specs-key"> </td> <td class="specs-value fk-data">Saree  Blouse Piece</td> </tr> </table> </div>,10:03:2014,None
