15:02:2014,formals,Cocoon.,Cocoon Slip On,Rs. 545,http://img5a.flixcart.com/image/shoe/r/j/2/black-1058-cocoon-39-400x400-imadz3vt8z4etdy7.jpeg, No more colour,Rs. 545,WS Retail,http://www.flipkart.com/cocoon-slip-on/p/itmdnjxg64fywqjr?pid=SHODNJXGSMZ7EFC7&srno=b_1&ref=a50fd65b-3643-4dde-8258-66bc2be86e56,LSTSHODNJXGSMZ7EFC7OEFQYI, 36 37 38 39 40 41,<div class="item_left_column" id="description"><h3 class="item_desc_title fk-uppercase">Cocoon Slip On         Price: Rs.545</h3><div class="cls"></div><div class="item_desc_text line"><div style="float:right"></div><p>	As you step into the office, your look attracts attention like never before. The elegant crafting of this pair makes way for such style that formal wear is not so boring anymore. Slip into these <strong>formal shoes</strong> when you're dressed in a pair of trousers and a blouse.</p><p>	The range of sandals from <strong>Cocoon</strong> is sure to put more than just a dazzle in your attitude, thanks to the groovy blend of premium material and cutting-edge designs.</p><p><strong>Footwear Care</strong></p><p>	Use a soft brush to give these shoes a shine.</p> </div><div style="clear: both;"></div></div>,<div class="item_left_column" id="specifications"><h3 class="item_desc_title fk-uppercase">        Specifications of Cocoon Slip On    </h3><table cellspacing="0" class="fk-specs-type2"><tr><th class="group-head" colspan="2">General</th></tr><tr class=""><td class="specs-key">Ideal For</td><td class="specs-value fk-data">Women</td></tr></table><table cellspacing="0" class="fk-specs-type2"><tr><th class="group-head" colspan="2">Shoe Details</th></tr><tr class=""><td class="specs-key">Style</td><td class="specs-value fk-data">Strap Detail in Front, Panel and Stitch Detail</td></tr><tr class=""><td class="specs-key">Color</td><td class="specs-value fk-data">Black</td></tr><tr class=""><td class="specs-key">Outer Material</td><td class="specs-value fk-data">Synthetic Leather</td></tr><tr class=""><td class="specs-key">Inner Material</td><td class="specs-value fk-data">Fabric</td></tr><tr class=""><td class="specs-key">Sole Material</td><td class="specs-value fk-data">TPR</td></tr><tr class=""><td class="specs-key">Heel Height</td><td class="specs-value fk-data">0.75 inch</td></tr><tr class=""><td class="specs-key">Tip Shape</td><td class="specs-value fk-data">Round</td></tr><tr class=""><td class="specs-key">Weight</td><td class="specs-value fk-data">163 gm (per single Shoe) - Weight of the product may vary depending on size.</td></tr></table><table cellspacing="0" class="fk-specs-type2"><tr><th class="group-head" colspan="2">Additional Details</th></tr><tr class=""><td class="specs-key">Other Details</td><td class="specs-value fk-data">Padded Footbed</td></tr></table></div>
15:02:2014,formals,Cocoon.,Cocoon Slip On,Rs. 986,http://img6a.flixcart.com/image/shoe/h/z/6/brown-1375-cocoon-36-400x400-imadrukgqswafzr2.jpeg, No more colour,Rs. 986,WS Retail,http://www.flipkart.com/cocoon-slip-on/p/itmdr4syz5njuhvx?pid=SHODR4SYTGEHZHZ6&srno=b_2&ref=a50fd65b-3643-4dde-8258-66bc2be86e56,LSTSHODR4SYTGEHZHZ6EJPOBF, 36 37 38 39 40 41,<div class="item_left_column" id="description"><h3 class="item_desc_title fk-uppercase">Cocoon Slip On         Price: Rs.986</h3><div class="cls"></div><div class="item_desc_text line"><div style="float:right"></div><p style="text-align: justify;">	Nail the 9-5 look in a matter of seconds by letting your feet do all the talking in these elegant <strong>formal shoes</strong>. Boasting of intricate<strong> stitch details</strong> and a moderate <strong>2.5 inch heel</strong>, these shoes rake style points at the workplace without a shadow of a doubt. Pair these formal shoes with a knee-length skirt or with cigarette pants.</p><p style="text-align: justify;">	The range of footwear from <strong>Cocoon </strong>is sure to put more than just a dazzle in your attitude, thanks to the groovy blend of premium materials and cutting-edge designs.</p><p style="text-align: justify;"><strong>Footwear Care</strong></p><p style="text-align: justify;">	Wipe these shoes gently with a soft cloth.</p> </div><div style="clear: both;"></div></div>,<div class="item_left_column" id="specifications"><h3 class="item_desc_title fk-uppercase">        Specifications of Cocoon Slip On    </h3><table cellspacing="0" class="fk-specs-type2"><tr><th class="group-head" colspan="2">General</th></tr><tr class=""><td class="specs-key">Ideal For</td><td class="specs-value fk-data">Women</td></tr></table><table cellspacing="0" class="fk-specs-type2"><tr><th class="group-head" colspan="2">Shoe Details</th></tr><tr class=""><td class="specs-key">Style</td><td class="specs-value fk-data">Panel and Stitch Detail, Wedge Heel</td></tr><tr class=""><td class="specs-key">Color</td><td class="specs-value fk-data">Brown</td></tr><tr class=""><td class="specs-key">Heel Height</td><td class="specs-value fk-data">2.5 inch</td></tr><tr class=""><td class="specs-key">Tip Shape</td><td class="specs-value fk-data">Round</td></tr><tr class=""><td class="specs-key">Weight</td><td class="specs-value fk-data">95 gm (per single Shoe) - Weight of the product may vary depending on size.</td></tr></table><table cellspacing="0" class="fk-specs-type2"><tr><th class="group-head" colspan="2">Additional Details</th></tr><tr class=""><td class="specs-key">Other Details</td><td class="specs-value fk-data">Textured Sole, Padded Footbed, Heel Construction</td></tr></table></div>
