LSTSHODP8ZHCZPSKJWKOVYJ0H,Hush Puppies Qing Dao Canvas Shoes,http://www.flipkart.com/womens-footwear?otracker=hp_nmenu_sub_women_0_Footwear,Rs. 1116,Footwear,Casual Shoes,Hush Puppies,http://img6a.flixcart.com/image/shoe/u/h/y/red-529192-hush-puppies-6-400x400-imadqjxhpqgaattw.jpeg,Rs. 1599,Red,women,http://www.flipkart.com/hush-puppies-qing-dao-canvas-shoes/p/itmdp8zjpkrvgsbs?pid=SHODP8ZHCZPSKJWK&srno=b_2&ref=c023a2bc-74d0-420e-9280-0a9d96112f8b,WS Retail,Hush Puppies Qing Dao Canvas Shoes - Buy Red Color Hush Puppies Qing Dao Canvas Shoes Online at Best Price - Shop Online for Footwears in India | Flipkart.com,Hush Puppies Qing Dao Canvas Shoes - Buy Hush Puppies Qing Dao Canvas Shoes - 529192 only for Rs. 1116.1 from Flipkart.com. Only Genuine Products. 30 Day Replacement Guarantee. Free Shipping. Cash On,['5'],<div class="item_left_column" id="description"> <h3 class="item_desc_title fk-uppercase">Hush Puppies Qing Dao Canvas Shoes         Price: Rs.1116</h3> <div class="cls"></div> <div class="item_desc_text line"> <div style="float:right"> </div> <p>   Splashed with a bright hue of red  this pair of Qing Dao Canvas Shoes from Hush Puppies is the best way to flaunt your athletic persona with a dash of style and attitude. The<strong> rivet detailing</strong> lends a refined finish to these classic walking shoes. Flaunt your impeccable style by teaming these shoes with a printed top and shorts.</p> <p>   Coming with innovative designs and breathable materials  footwear from <strong>Hush Puppies </strong>are a fine blend of seamless style and ultimate comfort.</p> <p> <strong>Footwear Care</strong></p> <p>   Gently wipe these shoes clean with a dry cloth. </p> </div> <div style="clear: both;"></div> </div>,<div class="item_left_column" id="specifications"> <h3 class="item_desc_title fk-uppercase">         Specifications of Hush Puppies Qing Dao Canvas Shoes    </h3> <table cellspacing="0" class="fk-specs-type2"> <tr> <th class="group-head" colspan="2">General</th> </tr> <tr class=""> <td class="specs-key">Ideal For</td> <td class="specs-value fk-data">Women</td> </tr> </table> <table cellspacing="0" class="fk-specs-type2"> <tr> <th class="group-head" colspan="2">Shoe Details</th> </tr> <tr class=""> <td class="specs-key">Style</td> <td class="specs-value fk-data">Panel and Stitch Detail  Rivets Detail  Elastic Strap Under Tongue</td> </tr> <tr class=""> <td class="specs-key">Color</td> <td class="specs-value fk-data">Red</td> </tr> <tr class=""> <td class="specs-key">Outer Material</td> <td class="specs-value fk-data">Canvas</td> </tr> <tr class=""> <td class="specs-key">Inner Material</td> <td class="specs-value fk-data">Textile</td> </tr> <tr class=""> <td class="specs-key">Sole Material</td> <td class="specs-value fk-data">Rubber</td> </tr> <tr class=""> <td class="specs-key">Tip Shape</td> <td class="specs-value fk-data">Round</td> </tr> <tr class=""> <td class="specs-key">Weight</td> <td class="specs-value fk-data">212 gm (per single Shoe) - Weight of the product may vary depending on size.</td> </tr> </table> <table cellspacing="0" class="fk-specs-type2"> <tr> <th class="group-head" colspan="2">Additional Details</th> </tr> <tr class=""> <td class="specs-key">Other Details</td> <td class="specs-value fk-data">Padded Footbed</td> </tr> </table> </div>,11:03:2014,None
LSTSHODP8ZH724PP9QSQ6F9TD,Hush Puppies Lumair Oxford Sneakers,http://www.flipkart.com/womens-footwear?otracker=hp_nmenu_sub_women_0_Footwear,Rs. 3489,Footwear,Casual Shoes,Hush Puppies,http://img6a.flixcart.com/image/shoe/t/9/z/brown-524112-hush-puppies-6-400x400-imadqhfzzgjrhwvz.jpeg,Rs. 4999,Brown,women,http://www.flipkart.com/hush-puppies-lumair-oxford-sneakers/p/itmdp8zj89szrf92?pid=SHODP8ZH724PP9QS&srno=b_4&ref=8f3b4cde-9e90-4ce4-9913-98229f292236,WS Retail,Hush Puppies Lumair Oxford Sneakers - Buy Brown Color Hush Puppies Lumair Oxford Sneakers Online at Best Price - Shop Online for Footwears in India | Flipkart.com,Hush Puppies Lumair Oxford Sneakers - Buy Hush Puppies Lumair Oxford Sneakers - 524112 only for Rs. 3489.3 from Flipkart.com. Only Genuine Products. 30 Day Replacement Guarantee. Free Shipping. Cash On,['3'  '4'  '5'  '6'  '7'],<div class="item_left_column" id="description"> <h3 class="item_desc_title fk-uppercase">Hush Puppies Lumair Oxford Sneakers         Price: Rs.3489</h3> <div class="cls"></div> <div class="item_desc_text line"> <div style="float:right"> </div> <p style="text-align: justify;">   With every step that you take forward in these Lumair Oxford Sneakers by Hush Puppies  both your style quotient and comfort factor are heightened. Built with a <strong>padded footbed</strong> that cushions every step  these sneakers are a must-have for the city-trotting lass. Team these sneakers with skinny jeans.</p> <p style="text-align: justify;">   Coming with innovative designs and breathable materials  footwear from <strong>Hush Puppies</strong> are a fine blend of seamless style and ultimate comfort.</p> <p> <strong>Footwear Care</strong></p> <p>   Wipe gently with a soft cloth.</p> </div> <div style="clear: both;"></div> </div>,<div class="item_left_column" id="specifications"> <h3 class="item_desc_title fk-uppercase">         Specifications of Hush Puppies Lumair Oxford Sneakers    </h3> <table cellspacing="0" class="fk-specs-type2"> <tr> <th class="group-head" colspan="2">General</th> </tr> <tr class=""> <td class="specs-key">Ideal For</td> <td class="specs-value fk-data">Women</td> </tr> </table> <table cellspacing="0" class="fk-specs-type2"> <tr> <th class="group-head" colspan="2">Shoe Details</th> </tr> <tr class=""> <td class="specs-key">Style</td> <td class="specs-value fk-data">Panel and Stitch Detail</td> </tr> <tr class=""> <td class="specs-key">Color</td> <td class="specs-value fk-data">Brown</td> </tr> <tr class=""> <td class="specs-key">Outer Material</td> <td class="specs-value fk-data">Leather</td> </tr> <tr class=""> <td class="specs-key">Inner Material</td> <td class="specs-value fk-data">Mesh</td> </tr> <tr class=""> <td class="specs-key">Sole Material</td> <td class="specs-value fk-data">Tpr</td> </tr> <tr class=""> <td class="specs-key">Closure</td> <td class="specs-value fk-data">Laced</td> </tr> <tr class=""> <td class="specs-key">Tip Shape</td> <td class="specs-value fk-data">Round</td> </tr> <tr class=""> <td class="specs-key">Weight</td> <td class="specs-value fk-data">270 gm (per single Shoe) - Weight of the product may vary depending on size.</td> </tr> </table> <table cellspacing="0" class="fk-specs-type2"> <tr> <th class="group-head" colspan="2">Additional Details</th> </tr> <tr class=""> <td class="specs-key">Other Details</td> <td class="specs-value fk-data">Padded Footbed  Textured Sole</td> </tr> </table> </div>,11:03:2014,None
LSTSHODP8ZHBCDGJNQVHHF6RJ,Hush Puppies Qing Dao Canvas Shoes,http://www.flipkart.com/womens-footwear?otracker=hp_nmenu_sub_women_0_Footwear,Rs. 1116,Footwear,Casual Shoes,Hush Puppies,http://img5a.flixcart.com/image/shoe/n/q/v/pink-529292-hush-puppies-6-400x400-imadqjxy5marqjjv.jpeg,Rs. 1599,Pink,women,http://www.flipkart.com/hush-puppies-qing-dao-canvas-shoes/p/itmdp8zjayzsjbhz?pid=SHODP8ZHBCDGJNQV&srno=b_1&ref=c023a2bc-74d0-420e-9280-0a9d96112f8b,WS Retail,Hush Puppies Qing Dao Canvas Shoes - Buy Pink Color Hush Puppies Qing Dao Canvas Shoes Online at Best Price - Shop Online for Footwears in India | Flipkart.com,Hush Puppies Qing Dao Canvas Shoes - Buy Hush Puppies Qing Dao Canvas Shoes - 529292 only for Rs. 1116.1 from Flipkart.com. Only Genuine Products. 30 Day Replacement Guarantee. Free Shipping. Cash On,['5'  '6'  '7'],None,<div class="item_left_column" id="specifications"> <h3 class="item_desc_title fk-uppercase">         Specifications of Hush Puppies Qing Dao Canvas Shoes    </h3> <table cellspacing="0" class="fk-specs-type2"> <tr> <th class="group-head" colspan="2">General</th> </tr> <tr class=""> <td class="specs-key">Ideal For</td> <td class="specs-value fk-data">Women</td> </tr> </table> <table cellspacing="0" class="fk-specs-type2"> <tr> <th class="group-head" colspan="2">Shoe Details</th> </tr> <tr class=""> <td class="specs-key">Style</td> <td class="specs-value fk-data">Elastic Gusset Under the Tongue  Panel and Stitch Detail</td> </tr> <tr class=""> <td class="specs-key">Color</td> <td class="specs-value fk-data">Pink</td> </tr> <tr class=""> <td class="specs-key">Outer Material</td> <td class="specs-value fk-data">Canvas</td> </tr> <tr class=""> <td class="specs-key">Inner Material</td> <td class="specs-value fk-data">Textile</td> </tr> <tr class=""> <td class="specs-key">Sole Material</td> <td class="specs-value fk-data">Rubber</td> </tr> <tr class=""> <td class="specs-key">Tip Shape</td> <td class="specs-value fk-data">Round</td> </tr> <tr class=""> <td class="specs-key">Weight</td> <td class="specs-value fk-data">185 gm (per single Shoe) - Weight of the product may vary depending on size.</td> </tr> </table> <table cellspacing="0" class="fk-specs-type2"> <tr> <th class="group-head" colspan="2">Additional Details</th> </tr> <tr class=""> <td class="specs-key">Other Details</td> <td class="specs-value fk-data">Padded Footbed  Textured Outsole</td> </tr> </table> </div>,11:03:2014,None
LSTSHODP8ZHBCDGJNQVHHF6RJ,Hush Puppies Qing Dao Canvas Shoes,http://www.flipkart.com/womens-footwear?otracker=hp_nmenu_sub_women_0_Footwear,Rs. 1116,Footwear,Casual Shoes,Hush Puppies,http://img5a.flixcart.com/image/shoe/n/q/v/pink-529292-hush-puppies-6-400x400-imadqjxy5marqjjv.jpeg,Rs. 1599,Pink,women,http://www.flipkart.com/hush-puppies-qing-dao-canvas-shoes/p/itmdp8zjayzsjbhz?pid=SHODP8ZHBCDGJNQV&srno=b_1&ref=8f3b4cde-9e90-4ce4-9913-98229f292236,WS Retail,Hush Puppies Qing Dao Canvas Shoes - Buy Pink Color Hush Puppies Qing Dao Canvas Shoes Online at Best Price - Shop Online for Footwears in India | Flipkart.com,Hush Puppies Qing Dao Canvas Shoes - Buy Hush Puppies Qing Dao Canvas Shoes - 529292 only for Rs. 1116.1 from Flipkart.com. Only Genuine Products. 30 Day Replacement Guarantee. Free Shipping. Cash On,['5'  '6'  '7'],None,<div class="item_left_column" id="specifications"> <h3 class="item_desc_title fk-uppercase">         Specifications of Hush Puppies Qing Dao Canvas Shoes    </h3> <table cellspacing="0" class="fk-specs-type2"> <tr> <th class="group-head" colspan="2">General</th> </tr> <tr class=""> <td class="specs-key">Ideal For</td> <td class="specs-value fk-data">Women</td> </tr> </table> <table cellspacing="0" class="fk-specs-type2"> <tr> <th class="group-head" colspan="2">Shoe Details</th> </tr> <tr class=""> <td class="specs-key">Style</td> <td class="specs-value fk-data">Elastic Gusset Under the Tongue  Panel and Stitch Detail</td> </tr> <tr class=""> <td class="specs-key">Color</td> <td class="specs-value fk-data">Pink</td> </tr> <tr class=""> <td class="specs-key">Outer Material</td> <td class="specs-value fk-data">Canvas</td> </tr> <tr class=""> <td class="specs-key">Inner Material</td> <td class="specs-value fk-data">Textile</td> </tr> <tr class=""> <td class="specs-key">Sole Material</td> <td class="specs-value fk-data">Rubber</td> </tr> <tr class=""> <td class="specs-key">Tip Shape</td> <td class="specs-value fk-data">Round</td> </tr> <tr class=""> <td class="specs-key">Weight</td> <td class="specs-value fk-data">185 gm (per single Shoe) - Weight of the product may vary depending on size.</td> </tr> </table> <table cellspacing="0" class="fk-specs-type2"> <tr> <th class="group-head" colspan="2">Additional Details</th> </tr> <tr class=""> <td class="specs-key">Other Details</td> <td class="specs-value fk-data">Padded Footbed  Textured Outsole</td> </tr> </table> </div>,11:03:2014,None
LSTSHODP8ZGWQF8QEDF7LZYRK,Hush Puppies Ceil Mocc Loafers,http://www.flipkart.com/womens-footwear?otracker=hp_nmenu_sub_women_0_Footwear,Rs. 3140,Footwear,Casual Shoes,Hush Puppies,http://img5a.flixcart.com/image/shoe/e/k/9/black-554122-hush-puppies-6-400x400-imadqjxyn3pkshcj.jpeg,Rs. 4499,Black,women,http://www.flipkart.com/hush-puppies-ceil-mocc-loafers/p/itmdp8zkurbb3dck?pid=SHODP8ZGWQF8QEDF&srno=b_5&ref=8f3b4cde-9e90-4ce4-9913-98229f292236,WS Retail,Hush Puppies Ceil Mocc Loafers - Buy Black Color Hush Puppies Ceil Mocc Loafers Online at Best Price - Shop Online for Footwears in India | Flipkart.com,Hush Puppies Ceil Mocc Loafers - Buy Hush Puppies Ceil Mocc Loafers - 554122 only for Rs. 3140.3 from Flipkart.com. Only Genuine Products. 30 Day Replacement Guarantee. Free Shipping. Cash On,['3'  '4'],<div class="item_left_column" id="description"> <h3 class="item_desc_title fk-uppercase">Hush Puppies Ceil Mocc Loafers         Price: Rs.3140</h3> <div class="cls"></div> <div class="item_desc_text line"> <div style="float:right"> </div> <p>   Crafted in black  this pair of Ceil Mocc Loafers from Hush Puppies boasts elastic gussets on the sides for a comfortable grip and perfect fit. Made using the finest<strong> leather materials</strong>  this pair of loafers promises a luxe feel to your feet. You can team these loafers with a casual shirt and casual trousers.</p> <p>   Coming with innovative designs and breathable materials  footwear from <strong>Hush Puppies</strong> are a fine blend of seamless style and ultimate comfort.</p> <p> <strong>Footwear Care</strong></p> <p>   Clean these loafers with a dry cloth. </p> </div> <div style="clear: both;"></div> </div>,<div class="item_left_column" id="specifications"> <h3 class="item_desc_title fk-uppercase">         Specifications of Hush Puppies Ceil Mocc Loafers    </h3> <table cellspacing="0" class="fk-specs-type2"> <tr> <th class="group-head" colspan="2">General</th> </tr> <tr class=""> <td class="specs-key">Ideal For</td> <td class="specs-value fk-data">Women</td> </tr> </table> <table cellspacing="0" class="fk-specs-type2"> <tr> <th class="group-head" colspan="2">Shoe Details</th> </tr> <tr class=""> <td class="specs-key">Style</td> <td class="specs-value fk-data">Panel and Stitch Detail  Elastic Gusset on the Sides</td> </tr> <tr class=""> <td class="specs-key">Color</td> <td class="specs-value fk-data">Black</td> </tr> <tr class=""> <td class="specs-key">Outer Material</td> <td class="specs-value fk-data">Leather</td> </tr> <tr class=""> <td class="specs-key">Inner Material</td> <td class="specs-value fk-data">Leather</td> </tr> <tr class=""> <td class="specs-key">Sole Material</td> <td class="specs-value fk-data">Tpr</td> </tr> <tr class=""> <td class="specs-key">Tip Shape</td> <td class="specs-value fk-data">Round</td> </tr> <tr class=""> <td class="specs-key">Weight</td> <td class="specs-value fk-data">175 gm (per single Shoe) - Weight of the product may vary depending on size.</td> </tr> </table> <table cellspacing="0" class="fk-specs-type2"> <tr> <th class="group-head" colspan="2">Additional Details</th> </tr> <tr class=""> <td class="specs-key">Other Details</td> <td class="specs-value fk-data">Padded Footbed  Textured Outsole</td> </tr> </table> </div>,11:03:2014,None
LSTSHODP8ZH724PP9QSQ6F9TD,Hush Puppies Lumair Oxford Sneakers,http://www.flipkart.com/womens-footwear?otracker=hp_nmenu_sub_women_0_Footwear,Rs. 3489,Footwear,Casual Shoes,Hush Puppies,http://img6a.flixcart.com/image/shoe/t/9/z/brown-524112-hush-puppies-6-400x400-imadqhfzzgjrhwvz.jpeg,Rs. 4999,Brown,women,http://www.flipkart.com/hush-puppies-lumair-oxford-sneakers/p/itmdp8zj89szrf92?pid=SHODP8ZH724PP9QS&srno=b_4&ref=c023a2bc-74d0-420e-9280-0a9d96112f8b,WS Retail,Hush Puppies Lumair Oxford Sneakers - Buy Brown Color Hush Puppies Lumair Oxford Sneakers Online at Best Price - Shop Online for Footwears in India | Flipkart.com,Hush Puppies Lumair Oxford Sneakers - Buy Hush Puppies Lumair Oxford Sneakers - 524112 only for Rs. 3489.3 from Flipkart.com. Only Genuine Products. 30 Day Replacement Guarantee. Free Shipping. Cash On,['3'  '4'  '5'  '6'  '7'],<div class="item_left_column" id="description"> <h3 class="item_desc_title fk-uppercase">Hush Puppies Lumair Oxford Sneakers         Price: Rs.3489</h3> <div class="cls"></div> <div class="item_desc_text line"> <div style="float:right"> </div> <p style="text-align: justify;">   With every step that you take forward in these Lumair Oxford Sneakers by Hush Puppies  both your style quotient and comfort factor are heightened. Built with a <strong>padded footbed</strong> that cushions every step  these sneakers are a must-have for the city-trotting lass. Team these sneakers with skinny jeans.</p> <p style="text-align: justify;">   Coming with innovative designs and breathable materials  footwear from <strong>Hush Puppies</strong> are a fine blend of seamless style and ultimate comfort.</p> <p> <strong>Footwear Care</strong></p> <p>   Wipe gently with a soft cloth.</p> </div> <div style="clear: both;"></div> </div>,<div class="item_left_column" id="specifications"> <h3 class="item_desc_title fk-uppercase">         Specifications of Hush Puppies Lumair Oxford Sneakers    </h3> <table cellspacing="0" class="fk-specs-type2"> <tr> <th class="group-head" colspan="2">General</th> </tr> <tr class=""> <td class="specs-key">Ideal For</td> <td class="specs-value fk-data">Women</td> </tr> </table> <table cellspacing="0" class="fk-specs-type2"> <tr> <th class="group-head" colspan="2">Shoe Details</th> </tr> <tr class=""> <td class="specs-key">Style</td> <td class="specs-value fk-data">Panel and Stitch Detail</td> </tr> <tr class=""> <td class="specs-key">Color</td> <td class="specs-value fk-data">Brown</td> </tr> <tr class=""> <td class="specs-key">Outer Material</td> <td class="specs-value fk-data">Leather</td> </tr> <tr class=""> <td class="specs-key">Inner Material</td> <td class="specs-value fk-data">Mesh</td> </tr> <tr class=""> <td class="specs-key">Sole Material</td> <td class="specs-value fk-data">Tpr</td> </tr> <tr class=""> <td class="specs-key">Closure</td> <td class="specs-value fk-data">Laced</td> </tr> <tr class=""> <td class="specs-key">Tip Shape</td> <td class="specs-value fk-data">Round</td> </tr> <tr class=""> <td class="specs-key">Weight</td> <td class="specs-value fk-data">270 gm (per single Shoe) - Weight of the product may vary depending on size.</td> </tr> </table> <table cellspacing="0" class="fk-specs-type2"> <tr> <th class="group-head" colspan="2">Additional Details</th> </tr> <tr class=""> <td class="specs-key">Other Details</td> <td class="specs-value fk-data">Padded Footbed  Textured Sole</td> </tr> </table> </div>,11:03:2014,None
LSTSHODP8ZHCZPSKJWKOVYJ0H,Hush Puppies Qing Dao Canvas Shoes,http://www.flipkart.com/womens-footwear?otracker=hp_nmenu_sub_women_0_Footwear,Rs. 1116,Footwear,Casual Shoes,Hush Puppies,http://img6a.flixcart.com/image/shoe/u/h/y/red-529192-hush-puppies-6-400x400-imadqjxhpqgaattw.jpeg,Rs. 1599,Red,women,http://www.flipkart.com/hush-puppies-qing-dao-canvas-shoes/p/itmdp8zjpkrvgsbs?pid=SHODP8ZHCZPSKJWK&srno=b_2&ref=8f3b4cde-9e90-4ce4-9913-98229f292236,WS Retail,Hush Puppies Qing Dao Canvas Shoes - Buy Red Color Hush Puppies Qing Dao Canvas Shoes Online at Best Price - Shop Online for Footwears in India | Flipkart.com,Hush Puppies Qing Dao Canvas Shoes - Buy Hush Puppies Qing Dao Canvas Shoes - 529192 only for Rs. 1116.1 from Flipkart.com. Only Genuine Products. 30 Day Replacement Guarantee. Free Shipping. Cash On,['5'],<div class="item_left_column" id="description"> <h3 class="item_desc_title fk-uppercase">Hush Puppies Qing Dao Canvas Shoes         Price: Rs.1116</h3> <div class="cls"></div> <div class="item_desc_text line"> <div style="float:right"> </div> <p>   Splashed with a bright hue of red  this pair of Qing Dao Canvas Shoes from Hush Puppies is the best way to flaunt your athletic persona with a dash of style and attitude. The<strong> rivet detailing</strong> lends a refined finish to these classic walking shoes. Flaunt your impeccable style by teaming these shoes with a printed top and shorts.</p> <p>   Coming with innovative designs and breathable materials  footwear from <strong>Hush Puppies </strong>are a fine blend of seamless style and ultimate comfort.</p> <p> <strong>Footwear Care</strong></p> <p>   Gently wipe these shoes clean with a dry cloth. </p> </div> <div style="clear: both;"></div> </div>,<div class="item_left_column" id="specifications"> <h3 class="item_desc_title fk-uppercase">         Specifications of Hush Puppies Qing Dao Canvas Shoes    </h3> <table cellspacing="0" class="fk-specs-type2"> <tr> <th class="group-head" colspan="2">General</th> </tr> <tr class=""> <td class="specs-key">Ideal For</td> <td class="specs-value fk-data">Women</td> </tr> </table> <table cellspacing="0" class="fk-specs-type2"> <tr> <th class="group-head" colspan="2">Shoe Details</th> </tr> <tr class=""> <td class="specs-key">Style</td> <td class="specs-value fk-data">Panel and Stitch Detail  Rivets Detail  Elastic Strap Under Tongue</td> </tr> <tr class=""> <td class="specs-key">Color</td> <td class="specs-value fk-data">Red</td> </tr> <tr class=""> <td class="specs-key">Outer Material</td> <td class="specs-value fk-data">Canvas</td> </tr> <tr class=""> <td class="specs-key">Inner Material</td> <td class="specs-value fk-data">Textile</td> </tr> <tr class=""> <td class="specs-key">Sole Material</td> <td class="specs-value fk-data">Rubber</td> </tr> <tr class=""> <td class="specs-key">Tip Shape</td> <td class="specs-value fk-data">Round</td> </tr> <tr class=""> <td class="specs-key">Weight</td> <td class="specs-value fk-data">212 gm (per single Shoe) - Weight of the product may vary depending on size.</td> </tr> </table> <table cellspacing="0" class="fk-specs-type2"> <tr> <th class="group-head" colspan="2">Additional Details</th> </tr> <tr class=""> <td class="specs-key">Other Details</td> <td class="specs-value fk-data">Padded Footbed</td> </tr> </table> </div>,11:03:2014,None
LSTSHODP8ZGGGFBSXDYCIIBMS,Hush Puppies Ceil Mocc Loafers,http://www.flipkart.com/womens-footwear?otracker=hp_nmenu_sub_women_0_Footwear,Rs. 3140,Footwear,Casual Shoes,Hush Puppies,http://img6a.flixcart.com/image/shoe/c/c/g/red-554122-hush-puppies-6-400x400-imadqjx4ukbdxgpx.jpeg,Rs. 4499,Red,women,http://www.flipkart.com/hush-puppies-ceil-mocc-loafers/p/itmdp8zjhp9jsbbe?pid=SHODP8ZGGGFBSXDY&srno=b_3&ref=c023a2bc-74d0-420e-9280-0a9d96112f8b,WS Retail,Hush Puppies Ceil Mocc Loafers - Buy Red Color Hush Puppies Ceil Mocc Loafers Online at Best Price - Shop Online for Footwears in India | Flipkart.com,Hush Puppies Ceil Mocc Loafers - Buy Hush Puppies Ceil Mocc Loafers - 554122 only for Rs. 3140.3 from Flipkart.com. Only Genuine Products. 30 Day Replacement Guarantee. Free Shipping. Cash On,['3'  '4'  '6'  '7'],<div class="item_left_column" id="description"> <h3 class="item_desc_title fk-uppercase">Hush Puppies Ceil Mocc Loafers         Price: Rs.3140</h3> <div class="cls"></div> <div class="item_desc_text line"> <div style="float:right"> </div> <p style="text-align: justify;">   Her enthusiasm just heightened after she caught a glimpse of these super-cool <strong>loafers from Hush Puppies</strong>. While the simplistic design appeals to the modern woman  she certainly doesn't miss out on the durability of these <strong>leather and TPR-made loafers</strong>  making them a must-have pair for regular wear. Team these loafers with skinny jeans or capris.</p> <p style="text-align: justify;">   Coming with innovative designs and breathable materials  footwear from <strong>Hush Puppies</strong> are a fine blend of seamless style and ultimate comfort.</p> <p> <strong>Footwear Care</strong></p> <p>   Wipe clean with a dry cloth.</p> </div> <div style="clear: both;"></div> </div>,<div class="item_left_column" id="specifications"> <h3 class="item_desc_title fk-uppercase">         Specifications of Hush Puppies Ceil Mocc Loafers    </h3> <table cellspacing="0" class="fk-specs-type2"> <tr> <th class="group-head" colspan="2">General</th> </tr> <tr class=""> <td class="specs-key">Ideal For</td> <td class="specs-value fk-data">Women</td> </tr> </table> <table cellspacing="0" class="fk-specs-type2"> <tr> <th class="group-head" colspan="2">Shoe Details</th> </tr> <tr class=""> <td class="specs-key">Style</td> <td class="specs-value fk-data">Elastic Gusset on the Sides  Panel and Stitch Detail</td> </tr> <tr class=""> <td class="specs-key">Color</td> <td class="specs-value fk-data">Red</td> </tr> <tr class=""> <td class="specs-key">Outer Material</td> <td class="specs-value fk-data">Leather</td> </tr> <tr class=""> <td class="specs-key">Inner Material</td> <td class="specs-value fk-data">Leather</td> </tr> <tr class=""> <td class="specs-key">Sole Material</td> <td class="specs-value fk-data">Tpr</td> </tr> <tr class=""> <td class="specs-key">Tip Shape</td> <td class="specs-value fk-data">Round</td> </tr> <tr class=""> <td class="specs-key">Weight</td> <td class="specs-value fk-data">175 gm (per single Shoe) - Weight of the product may vary depending on size.</td> </tr> </table> <table cellspacing="0" class="fk-specs-type2"> <tr> <th class="group-head" colspan="2">Additional Details</th> </tr> <tr class=""> <td class="specs-key">Other Details</td> <td class="specs-value fk-data">Textured Outsole  Padded Footbed</td> </tr> </table> </div>,11:03:2014,None
