LSTKTADQXFBVGDXWYQXAT9FAI,Morph Maternity Women's Kurta,http://www.flipkart.com/womens-clothing?otracker=hp_nmenu_sub_women_0_Clothing,Rs. 1299,Clothing,Maternity Wear,Lovely Lady,http://img5a.flixcart.com/image/kurta/c/c/e/ekav776ikrbl0-morph-maternity-l-400x400-imadrcqauujqjvdy.jpeg,Rs. 1299,Blue,women,http://www.flipkart.com/morph-maternity-women-s-kurta/p/itmdqxfcmxzcs8yz?pid=KTADQXFBVGDXWYQX&srno=b_3&ref=d0766f7c-fb68-43a0-9763-8beb1b737408,WS Retail,Morph Maternity Women's Kurta - Buy Blue Morph Maternity Women's Kurta Online at Best Prices in India | Flipkart.com,Morph Maternity Women's Kurta - Buy Blue Morph Maternity Women's Kurta For Only Rs. 1299.0 Online in India. Shop Online For Apparels. Huge Collection of Branded Clothes Only at,['S'  'M'  'L'],None,<div class="item_left_column" id="specifications"> <h3 class="item_desc_title fk-uppercase">         Specifications of Morph Maternity Women's Kurta    </h3> <table cellspacing="0" class="fk-specs-type2"> <tr> <th class="group-head" colspan="2">General Details<a class="see-more unitExt rmargin10 no-underline" href="javascript:void(0);" onclick="$(this).closest('.fk-specs-type2').toggleClass('expandedMore')" title="Expand">[+]</a><a class="hidden unitExt rmargin10 no-underline" href="javascript:void(0);" onclick="$(this).closest('.fk-specs-type2').toggleClass('expandedMore')" title="Collapse">[-]</a></th> </tr> <tr class="hidden"> <td class="specs-key">Ideal For</td> <td class="specs-value fk-data">Women's</td> </tr> </table> <table cellspacing="0" class="fk-specs-type2"> <tr> <th class="group-head" colspan="2">Kurta Details</th> </tr> <tr class=""> <td class="specs-key">Fabric</td> <td class="specs-value fk-data">100% Cotton</td> </tr> </table> <table cellspacing="0" class="fk-specs-type2"> <tr> <th class="group-head" colspan="2">Additional Details<a class="see-more unitExt rmargin10 no-underline" href="javascript:void(0);" onclick="$(this).closest('.fk-specs-type2').toggleClass('expandedMore')" title="Expand">[+]</a><a class="hidden unitExt rmargin10 no-underline" href="javascript:void(0);" onclick="$(this).closest('.fk-specs-type2').toggleClass('expandedMore')" title="Collapse">[-]</a></th> </tr> <tr class="hidden"> <td class="specs-key">Style Code</td> <td class="specs-value fk-data">EKAV776IKRBL0</td> </tr> </table> </div>,10:03:2014,None
LSTNDNDQXFCWWNGDSSNX4NPXN,Morph Maternity Women's,http://www.flipkart.com/womens-clothing?otracker=hp_nmenu_sub_women_0_Clothing,Rs. 1299,Clothing,Maternity Wear,Lovely Lady,http://img6a.flixcart.com/image/night-dress-nighty/k/z/n/swlg736japnk0-morph-maternity-l-400x400-imadrcqaq7zvatz2.jpeg,Rs. 1299,Pink,women,http://www.flipkart.com/morph-maternity-women-s/p/itmdqxfdggyb2hrd?pid=NDNDQXFCWWNGDSSN&srno=b_22&ref=125601ce-4894-4f08-baf9-b0f4297aad37,WS Retail,Morph Maternity Women's - Buy Pink Morph Maternity Women's Online at Best Prices in India | Flipkart.com,Morph Maternity Women's - Buy Pink Morph Maternity Women's For Only Rs. 1299.0 Online in India. Shop Online For Apparels. Huge Collection of Branded Clothes Only at,['S'  'M'],None,<div class="item_left_column" id="specifications"> <h3 class="item_desc_title fk-uppercase">         Specifications of Morph Maternity Women's    </h3> <table cellspacing="0" class="fk-specs-type2"> <tr> <th class="group-head" colspan="2">General Details<a class="see-more unitExt rmargin10 no-underline" href="javascript:void(0);" onclick="$(this).closest('.fk-specs-type2').toggleClass('expandedMore')" title="Expand">[+]</a><a class="hidden unitExt rmargin10 no-underline" href="javascript:void(0);" onclick="$(this).closest('.fk-specs-type2').toggleClass('expandedMore')" title="Collapse">[-]</a></th> </tr> <tr class="hidden"> <td class="specs-key">Ideal For</td> <td class="specs-value fk-data">Women's</td> </tr> </table> <table cellspacing="0" class="fk-specs-type2"> <tr> <th class="group-head" colspan="2">Night Dress/Nighty Details</th> </tr> <tr class=""> <td class="specs-key">Fabric</td> <td class="specs-value fk-data">100% Cotton</td> </tr> </table> <table cellspacing="0" class="fk-specs-type2"> <tr> <th class="group-head" colspan="2">Fabric Care</th> </tr> <tr class=""> <td class="specs-value fk-data" colspan="2">Hand or Machine Wash in Normal Cycle</td> </tr> </table> <table cellspacing="0" class="fk-specs-type2"> <tr> <th class="group-head" colspan="2">Additional Details<a class="see-more unitExt rmargin10 no-underline" href="javascript:void(0);" onclick="$(this).closest('.fk-specs-type2').toggleClass('expandedMore')" title="Expand">[+]</a><a class="hidden unitExt rmargin10 no-underline" href="javascript:void(0);" onclick="$(this).closest('.fk-specs-type2').toggleClass('expandedMore')" title="Collapse">[-]</a></th> </tr> <tr class="hidden"> <td class="specs-key"> </td> <td class="specs-value fk-data">Square neck.. 3/4th Puffed sleeve. Vertical Zipper for Nursing.Has Patent Pending Leak-Proof layer. Has a back tie that can be adjusted to fit.</td> </tr> </table> </div>,10:03:2014,None
LSTTOPDQX5GM3SGDETPDYFGSU,Morph Maternity Casual Women's Top,http://www.flipkart.com/womens-clothing?otracker=hp_nmenu_sub_women_0_Clothing,Rs. 522,Clothing,Maternity Wear,Lovely Lady,http://img6a.flixcart.com/image/top/m/w/b/ewtp572vkblk0-morph-maternity-l-400x400-imadrcqamdcnpne5.jpeg,Rs. 745,Black,women,http://www.flipkart.com/morph-maternity-casual-women-s-top/p/itmdqx5h2qcnuhu9?pid=TOPDQX5GM3SGDETP&srno=b_27&ref=125601ce-4894-4f08-baf9-b0f4297aad37,WS Retail,Morph Maternity Casual Women's Top - Buy Black Morph Maternity Casual Women's Top Online at Best Prices in India | Flipkart.com,Morph Maternity Casual Women's Top - Buy Black Morph Maternity Casual Women's Top For Only Rs. 745.0 Online in India. Shop Online For Apparels. Huge Collection of Branded Clothes Only at,['S'  'M'],None,<div class="item_left_column" id="specifications"> <h3 class="item_desc_title fk-uppercase">         Specifications of Morph Maternity Casual Women's Top    </h3> <table cellspacing="0" class="fk-specs-type2"> <tr> <th class="group-head" colspan="2">General Details<a class="see-more unitExt rmargin10 no-underline" href="javascript:void(0);" onclick="$(this).closest('.fk-specs-type2').toggleClass('expandedMore')" title="Expand">[+]</a><a class="hidden unitExt rmargin10 no-underline" href="javascript:void(0);" onclick="$(this).closest('.fk-specs-type2').toggleClass('expandedMore')" title="Collapse">[-]</a></th> </tr> <tr class="hidden"> <td class="specs-key">Ideal For</td> <td class="specs-value fk-data">Women's</td> </tr> <tr class="hidden"> <td class="specs-key">Occasion</td> <td class="specs-value fk-data">Casual</td> </tr> </table> <table cellspacing="0" class="fk-specs-type2"> <tr> <th class="group-head" colspan="2">Top Details</th> </tr> <tr class=""> <td class="specs-key">Fabric</td> <td class="specs-value fk-data">Knit Cotton</td> </tr> </table> <table cellspacing="0" class="fk-specs-type2"> <tr> <th class="group-head" colspan="2">Fabric Care</th> </tr> <tr class=""> <td class="specs-value fk-data" colspan="2">Hand or Machine Wash in Normal Cycle</td> </tr> </table> <table cellspacing="0" class="fk-specs-type2"> <tr> <th class="group-head" colspan="2">Additional Details<a class="see-more unitExt rmargin10 no-underline" href="javascript:void(0);" onclick="$(this).closest('.fk-specs-type2').toggleClass('expandedMore')" title="Expand">[+]</a><a class="hidden unitExt rmargin10 no-underline" href="javascript:void(0);" onclick="$(this).closest('.fk-specs-type2').toggleClass('expandedMore')" title="Collapse">[-]</a></th> </tr> <tr class="hidden"> <td class="specs-key"> </td> <td class="specs-value fk-data">Gathered Neck 3/4 Raglan sleeve Detailing at waist Fits elegantly during and post pregnancy</td> </tr> </table> </div>,10:03:2014,None
LSTTRODQX66NGKZHGKJG0C42J,Morph Maternity Women's Trousers,http://www.flipkart.com/womens-clothing?otracker=hp_nmenu_sub_women_0_Clothing,Rs. 1395,Clothing,Maternity Wear,Lovely Lady,http://img5a.flixcart.com/image/trouser/g/k/j/cphs844pldgy0-morph-maternity-l-400x400-imadrch5wqnqsz44.jpeg,Rs. 1395,Grey,women,http://www.flipkart.com/morph-maternity-women-s-trousers/p/itmdqx69gy8rewsj?pid=TRODQX66NGKZHGKJ&srno=b_21&ref=125601ce-4894-4f08-baf9-b0f4297aad37,WS Retail,Morph Maternity Women's Trousers - Buy Grey Morph Maternity Women's Trousers Online at Best Prices in India | Flipkart.com,Morph Maternity Women's Trousers - Buy Grey Morph Maternity Women's Trousers For Only Rs. 1395.0 Online in India. Shop Online For Apparels. Huge Collection of Branded Clothes Only at,['S'  'M'  'L'],None,<div class="item_left_column" id="specifications"> <h3 class="item_desc_title fk-uppercase">         Specifications of Morph Maternity Women's Trousers    </h3> <table cellspacing="0" class="fk-specs-type2"> <tr> <th class="group-head" colspan="2">General Details<a class="see-more unitExt rmargin10 no-underline" href="javascript:void(0);" onclick="$(this).closest('.fk-specs-type2').toggleClass('expandedMore')" title="Expand">[+]</a><a class="hidden unitExt rmargin10 no-underline" href="javascript:void(0);" onclick="$(this).closest('.fk-specs-type2').toggleClass('expandedMore')" title="Collapse">[-]</a></th> </tr> <tr class="hidden"> <td class="specs-key">Ideal For</td> <td class="specs-value fk-data">Women's</td> </tr> <tr class="hidden"> <td class="specs-key">Occasion</td> <td class="specs-value fk-data">Casual</td> </tr> </table> <table cellspacing="0" class="fk-specs-type2"> <tr> <th class="group-head" colspan="2">Trouser Details</th> </tr> <tr class=""> <td class="specs-key">Fabric</td> <td class="specs-value fk-data">Polyester</td> </tr> </table> <table cellspacing="0" class="fk-specs-type2"> <tr> <th class="group-head" colspan="2">Fabric Care</th> </tr> <tr class=""> <td class="specs-value fk-data" colspan="2">Hand or Machine Wash in Normal Cycle</td> </tr> </table> <table cellspacing="0" class="fk-specs-type2"> <tr> <th class="group-head" colspan="2">Additional Details<a class="see-more unitExt rmargin10 no-underline" href="javascript:void(0);" onclick="$(this).closest('.fk-specs-type2').toggleClass('expandedMore')" title="Expand">[+]</a><a class="hidden unitExt rmargin10 no-underline" href="javascript:void(0);" onclick="$(this).closest('.fk-specs-type2').toggleClass('expandedMore')" title="Collapse">[-]</a></th> </tr> <tr class="hidden"> <td class="specs-key">Style Code</td> <td class="specs-value fk-data">CPHS844PLDGY0</td> </tr> <tr class="hidden"> <td class="specs-key">Other Details</td> <td class="specs-value fk-data">Straight fit High belly panel stretches over the belly providing great support</td> </tr> </table> </div>,10:03:2014,None
LSTBRADQWZPHJQYGBU6H6IWLX,Morph Maternity Women's Bra,http://www.flipkart.com/womens-clothing?otracker=hp_nmenu_sub_women_0_Clothing,Rs. 595,Clothing,Maternity Wear,Lovely Lady,http://img5a.flixcart.com/image/bra/j/e/n/lpnb023cowht-morph-maternity-32b-400x400-imadrcqatzmuy6vm.jpeg,Rs. 595,White,women,http://www.flipkart.com/morph-maternity-women-s-bra/p/itmdqwzpmh3pfeuh?pid=BRADQWZPHJQYGBU6&srno=b_30&ref=125601ce-4894-4f08-baf9-b0f4297aad37,WS Retail,Morph Maternity Women's Bra - Buy White Morph Maternity Women's Bra Online at Best Prices in India | Flipkart.com,Morph Maternity Women's Bra - Buy White Morph Maternity Women's Bra For Only Rs. 595.0 Online in India. Shop Online For Apparels. Huge Collection of Branded Clothes Only at,['32B'  '34B'  '36B'],None,<div class="item_left_column" id="specifications"> <h3 class="item_desc_title fk-uppercase">         Specifications of Morph Maternity Women's Bra    </h3> <table cellspacing="0" class="fk-specs-type2"> <tr> <th class="group-head" colspan="2">General Details<a class="see-more unitExt rmargin10 no-underline" href="javascript:void(0);" onclick="$(this).closest('.fk-specs-type2').toggleClass('expandedMore')" title="Expand">[+]</a><a class="hidden unitExt rmargin10 no-underline" href="javascript:void(0);" onclick="$(this).closest('.fk-specs-type2').toggleClass('expandedMore')" title="Collapse">[-]</a></th> </tr> <tr class="hidden"> <td class="specs-key">Ideal For</td> <td class="specs-value fk-data">Women's</td> </tr> </table> <table cellspacing="0" class="fk-specs-type2"> <tr> <th class="group-head" colspan="2">Bra Details</th> </tr> <tr class=""> <td class="specs-key">Fabric</td> <td class="specs-value fk-data">Cotton</td> </tr> </table> <table cellspacing="0" class="fk-specs-type2"> <tr> <th class="group-head" colspan="2">Fabric Care</th> </tr> <tr class=""> <td class="specs-value fk-data" colspan="2">Hand or Machine Wash in Normal Cycle</td> </tr> </table> <table cellspacing="0" class="fk-specs-type2"> <tr> <th class="group-head" colspan="2">Additional Details<a class="see-more unitExt rmargin10 no-underline" href="javascript:void(0);" onclick="$(this).closest('.fk-specs-type2').toggleClass('expandedMore')" title="Expand">[+]</a><a class="hidden unitExt rmargin10 no-underline" href="javascript:void(0);" onclick="$(this).closest('.fk-specs-type2').toggleClass('expandedMore')" title="Collapse">[-]</a></th> </tr> <tr class="hidden"> <td class="specs-key"> </td> <td class="specs-value fk-data">The Cups are leak-proof   so no more embarrassing breast-milk leaks in public It is made of 100% breathable fabric  so very comfortable. Drop cup for easy nursing . Rear Clouser with Adjustable hook &amp; eye Breathable cotton fabric maximizies support &amp; comfort all day and night Discrete nursing clips  featuring one handed access.</td> </tr> </table> </div>,10:03:2014,None
LSTBRADQWZPAGZXQ6HQTIP07B,Morph Maternity Women's Nursing Bra,http://www.flipkart.com/womens-clothing?otracker=hp_nmenu_sub_women_0_Clothing,Rs. 595,Clothing,Maternity Wear,Lovely Lady,http://img5a.flixcart.com/image/bra/h/q/5/lpnb024cowht-morph-maternity-32c-400x400-imads7wffansqjsf.jpeg,Rs. 595,White,women,http://www.flipkart.com/morph-maternity-women-s-nursing-bra/p/itmdqwzpjhznhsrk?pid=BRADQWZPAGZXQ6HQ&srno=b_25&ref=125601ce-4894-4f08-baf9-b0f4297aad37,WS Retail,Morph Maternity Women's Nursing Bra - Buy White Morph Maternity Women's Nursing Bra Online at Best Prices in India | Flipkart.com,Morph Maternity Women's Nursing Bra - Buy White Morph Maternity Women's Nursing Bra For Only Rs. 595.0 Online in India. Shop Online For Apparels. Huge Collection of Branded Clothes Only at,['32C'  '34C'],None,<div class="item_left_column" id="specifications"> <h3 class="item_desc_title fk-uppercase">         Specifications of Morph Maternity Women's Nursing Bra    </h3> <table cellspacing="0" class="fk-specs-type2"> <tr> <th class="group-head" colspan="2">General Details<a class="see-more unitExt rmargin10 no-underline" href="javascript:void(0);" onclick="$(this).closest('.fk-specs-type2').toggleClass('expandedMore')" title="Expand">[+]</a><a class="hidden unitExt rmargin10 no-underline" href="javascript:void(0);" onclick="$(this).closest('.fk-specs-type2').toggleClass('expandedMore')" title="Collapse">[-]</a></th> </tr> <tr class="hidden"> <td class="specs-key">Ideal For</td> <td class="specs-value fk-data">Women's</td> </tr> <tr class="hidden"> <td class="specs-key">Pattern</td> <td class="specs-value fk-data">Solid</td> </tr> </table> <table cellspacing="0" class="fk-specs-type2"> <tr> <th class="group-head" colspan="2">Bra Details</th> </tr> <tr class=""> <td class="specs-key">Type</td> <td class="specs-value fk-data">Nursing Bra</td> </tr> <tr class=""> <td class="specs-key">Fabric</td> <td class="specs-value fk-data">Cotton</td> </tr> <tr class=""> <td class="specs-key">Style</td> <td class="specs-value fk-data">Elastic Underbust  Panel Detail</td> </tr> <tr class=""> <td class="specs-key">Straps</td> <td class="specs-value fk-data">Adjustable</td> </tr> <tr class=""> <td class="specs-key">Closure</td> <td class="specs-value fk-data">Hooks at Back</td> </tr> </table> <table cellspacing="0" class="fk-specs-type2"> <tr> <th class="group-head" colspan="2">Fabric Care</th> </tr> <tr class=""> <td class="specs-value fk-data" colspan="2">Hand Wash Cold  Do Not Tumble Dry  Low Iron</td> </tr> </table> <table cellspacing="0" class="fk-specs-type2"> <tr> <th class="group-head" colspan="2">Additional Details<a class="see-more unitExt rmargin10 no-underline" href="javascript:void(0);" onclick="$(this).closest('.fk-specs-type2').toggleClass('expandedMore')" title="Expand">[+]</a><a class="hidden unitExt rmargin10 no-underline" href="javascript:void(0);" onclick="$(this).closest('.fk-specs-type2').toggleClass('expandedMore')" title="Collapse">[-]</a></th> </tr> <tr class="hidden"> <td class="specs-key"> </td> <td class="specs-value fk-data">The Cups are leak-proof   so no more embarrassing breast-milk leaks in public It is made of 100% breathable fabric  so very comfortable. Drop cup for easy nursing . Rear Clouser with Adjustable hook &amp; eye Breathable cotton fabric maximizies support &amp; comfort all day and night Discrete nursing clips  featuring one handed access.</td> </tr> </table> </div>,10:03:2014,None
LSTKTADTSH2GRARHJGM08ZB1P,Lovely Lady Self Design Women's Straight Kurta,http://www.flipkart.com/womens-clothing?otracker=hp_nmenu_sub_women_0_Clothing,Rs. 698,Clothing,Maternity Wear,Lovely Lady,http://img6a.flixcart.com/image/kurta/m/f/u/kt-1617-black-f-lovely-lady-36-400x400-imadtjvhtghwzu2z.jpeg,Rs. 1399,Black,women,http://www.flipkart.com/lovely-lady-self-design-women-s-straight-kurta/p/itmdtpf6hauypaee?pid=KTADTSH2GRARHJGM&srno=b_2&ref=f9a3e64d-93b8-4e53-b6f4-9635372121f7,Fashionara,Lovely Lady Self Design Women's Straight Kurta - Buy Black Lovely Lady Self Design Women's Straight Kurta Online at Best Prices in India | Flipkart.com,Lovely Lady Self Design Women's Straight Kurta - Buy Black Lovely Lady Self Design Women's Straight Kurta For Only Rs. 1399.00 Online in India. Shop Online For Apparels. Huge Collection of Branded Clothes Only at,['34'  '36'  '38'  '40'  '42'],<div class="item_left_column" id="description"> <h3 class="item_desc_title fk-uppercase">Lovely Lady Self Design Women's Straight Kurta         Price: Rs.698</h3> <div class="cls"></div> <div class="item_desc_text line"> <div style="float:right"> </div>                         Cotton:: Dry clean only:: No guarantee for embroidery  zari or colours:: Minor shrinkage may be expected:: Cool iron inside out        </div> <div style="clear: both;"></div> </div>,<div class="item_left_column" id="specifications"> <h3 class="item_desc_title fk-uppercase">         Specifications of Lovely Lady Self Design Women's Straight Kurta    </h3> <table cellspacing="0" class="fk-specs-type2"> <tr> <th class="group-head" colspan="2">General Details<a class="see-more unitExt rmargin10 no-underline" href="javascript:void(0);" onclick="$(this).closest('.fk-specs-type2').toggleClass('expandedMore')" title="Expand">[+]</a><a class="hidden unitExt rmargin10 no-underline" href="javascript:void(0);" onclick="$(this).closest('.fk-specs-type2').toggleClass('expandedMore')" title="Collapse">[-]</a></th> </tr> <tr class="hidden"> <td class="specs-key">Ideal For</td> <td class="specs-value fk-data">Women's</td> </tr> <tr class="hidden"> <td class="specs-key">Occasion</td> <td class="specs-value fk-data">Festive</td> </tr> <tr class="hidden"> <td class="specs-key">Pattern</td> <td class="specs-value fk-data">Self Design</td> </tr> </table> <table cellspacing="0" class="fk-specs-type2"> <tr> <th class="group-head" colspan="2">Kurta Details</th> </tr> <tr class=""> <td class="specs-key">Type</td> <td class="specs-value fk-data">Straight</td> </tr> <tr class=""> <td class="specs-key">Fabric</td> <td class="specs-value fk-data">Cotton</td> </tr> <tr class=""> <td class="specs-key">Number of Contents in Sales Package</td> <td class="specs-value fk-data">Pack of 1</td> </tr> </table> <table cellspacing="0" class="fk-specs-type2"> <tr> <th class="group-head" colspan="2">Additional Details<a class="see-more unitExt rmargin10 no-underline" href="javascript:void(0);" onclick="$(this).closest('.fk-specs-type2').toggleClass('expandedMore')" title="Expand">[+]</a><a class="hidden unitExt rmargin10 no-underline" href="javascript:void(0);" onclick="$(this).closest('.fk-specs-type2').toggleClass('expandedMore')" title="Collapse">[-]</a></th> </tr> <tr class="hidden"> <td class="specs-key">Style Code</td> <td class="specs-value fk-data">KT-1617_Black..F</td> </tr> </table> <table cellspacing="0" class="fk-specs-type2"> <tr> <th class="group-head" colspan="2">In the Box</th> </tr> <tr class=""> <td class="specs-key"> </td> <td class="specs-value fk-data">Kurta</td> </tr> </table> </div>,10:03:2014,None
LSTKTADTPF5Z5GDNEPUWVVE0C,Lovely Lady Self Design Women's A-line Kurta,http://www.flipkart.com/womens-clothing?otracker=hp_nmenu_sub_women_0_Clothing,Rs. 898,Clothing,Maternity Wear,Lovely Lady,http://img6a.flixcart.com/image/kurta/d/h/b/kt-1654-white-f-lovely-lady-34-400x400-imadtjvtxu9tfbhd.jpeg,Rs. 1799,Off white,women,http://www.flipkart.com/lovely-lady-self-design-women-s-a-line-kurta/p/itmdtpf6xkaxpk9m?pid=KTADTPF5Z5GDNEPU&srno=b_13&ref=d0766f7c-fb68-43a0-9763-8beb1b737408,Fashionara,Lovely Lady Self Design Women's A-line Kurta - Buy Off white Lovely Lady Self Design Women's A-line Kurta Online at Best Prices in India | Flipkart.com,Lovely Lady Self Design Women's A-line Kurta - Buy Off white Lovely Lady Self Design Women's A-line Kurta For Only Rs. 1799.00 Online in India. Shop Online For Apparels. Huge Collection of Branded Clothes Only at,['34'  '36'  '38'  '40'  '42'],<div class="item_left_column" id="description"> <h3 class="item_desc_title fk-uppercase">Lovely Lady Self Design Women's A-line Kurta         Price: Rs.898</h3> <div class="cls"></div> <div class="item_desc_text line"> <div style="float:right"> </div>                         Look trendy and chic in this cotton kurti. Featuring a stylised notch neck with contrast floral embroidery on the yoke  this ethnic print cotton kurti has contrast panels on the asymmetrical hem.  Wear this kurti with jeans and a bright coloured chappal for a modern take on a desi look.        </div> <div style="clear: both;"></div> </div>,<div class="item_left_column" id="specifications"> <h3 class="item_desc_title fk-uppercase">         Specifications of Lovely Lady Self Design Women's A-line Kurta    </h3> <table cellspacing="0" class="fk-specs-type2"> <tr> <th class="group-head" colspan="2">General Details<a class="see-more unitExt rmargin10 no-underline" href="javascript:void(0);" onclick="$(this).closest('.fk-specs-type2').toggleClass('expandedMore')" title="Expand">[+]</a><a class="hidden unitExt rmargin10 no-underline" href="javascript:void(0);" onclick="$(this).closest('.fk-specs-type2').toggleClass('expandedMore')" title="Collapse">[-]</a></th> </tr> <tr class="hidden"> <td class="specs-key">Ideal For</td> <td class="specs-value fk-data">Women's</td> </tr> <tr class="hidden"> <td class="specs-key">Occasion</td> <td class="specs-value fk-data">Festive</td> </tr> <tr class="hidden"> <td class="specs-key">Pattern</td> <td class="specs-value fk-data">Self Design</td> </tr> </table> <table cellspacing="0" class="fk-specs-type2"> <tr> <th class="group-head" colspan="2">Kurta Details</th> </tr> <tr class=""> <td class="specs-key">Type</td> <td class="specs-value fk-data">A-line</td> </tr> <tr class=""> <td class="specs-key">Fabric</td> <td class="specs-value fk-data">Cotton</td> </tr> <tr class=""> <td class="specs-key">Number of Contents in Sales Package</td> <td class="specs-value fk-data">Pack of 1</td> </tr> </table> <table cellspacing="0" class="fk-specs-type2"> <tr> <th class="group-head" colspan="2">Additional Details<a class="see-more unitExt rmargin10 no-underline" href="javascript:void(0);" onclick="$(this).closest('.fk-specs-type2').toggleClass('expandedMore')" title="Expand">[+]</a><a class="hidden unitExt rmargin10 no-underline" href="javascript:void(0);" onclick="$(this).closest('.fk-specs-type2').toggleClass('expandedMore')" title="Collapse">[-]</a></th> </tr> <tr class="hidden"> <td class="specs-key">Style Code</td> <td class="specs-value fk-data">KT-1654_White..F</td> </tr> </table> <table cellspacing="0" class="fk-specs-type2"> <tr> <th class="group-head" colspan="2">In the Box</th> </tr> <tr class=""> <td class="specs-key"> </td> <td class="specs-value fk-data">Kurta</td> </tr> </table> </div>,10:03:2014,None
