LSTKTADTPF5WJPGZRNU2HV3FI,Lovely Lady Self Design Women's Anarkali Kurta,http://www.flipkart.com/womens-clothing?otracker=hp_nmenu_sub_women_0_Clothing,Rs. 1048,Clothing,Maternity Wear,Lovely Lady,http://img6a.flixcart.com/image/kurta/z/b/b/kt-1670-yellow-f-lovely-lady-34-400x400-imadtjvtzgxugg8g.jpeg,Rs. 2099,Dark Blue,women,http://www.flipkart.com/lovely-lady-self-design-women-s-anarkali-kurta/p/itmdtpf5g7hhexfj?pid=KTADTPF5WJPGZRNU&srno=b_51&ref=d6bfeb36-16f6-4742-8016-3b8a8967dcf6,Fashionara,Lovely Lady Self Design Women's Anarkali Kurta - Buy Lemon Lovely Lady Self Design Women's Anarkali Kurta Online at Best Prices in India | Flipkart.com,Lovely Lady Self Design Women's Anarkali Kurta - Buy Lemon Lovely Lady Self Design Women's Anarkali Kurta For Only Rs. 2099.00 Online in India. Shop Online For Apparels. Huge Collection of Branded Clothes Only at,['34'  '36'  '38'  '40'  '42'],<div class="item_left_column" id="description"> <h3 class="item_desc_title fk-uppercase">Lovely Lady Self Design Women's Anarkali Kurta         Price: Rs.1048</h3> <div class="cls"></div> <div class="item_desc_text line"> <div style="float:right"> </div>                         Make a spectacular impression on everyone with this vivid kurti. It features a summery notch neck with eye-catching floral embroidery  chakra-inspired motif printed all over the kurti and contrast band at the bodice and hem. The kurti comes with attached sleeves that can be stitched later.  Wear this kurti with skinny jeans and bright coloured chappals for a laidback look.        </div> <div style="clear: both;"></div> </div>,<div class="item_left_column" id="specifications"> <h3 class="item_desc_title fk-uppercase">         Specifications of Lovely Lady Self Design Women's Anarkali Kurta    </h3> <table cellspacing="0" class="fk-specs-type2"> <tr> <th class="group-head" colspan="2">General Details<a class="see-more unitExt rmargin10 no-underline" href="javascript:void(0);" onclick="$(this).closest('.fk-specs-type2').toggleClass('expandedMore')" title="Expand">[+]</a><a class="hidden unitExt rmargin10 no-underline" href="javascript:void(0);" onclick="$(this).closest('.fk-specs-type2').toggleClass('expandedMore')" title="Collapse">[-]</a></th> </tr> <tr class="hidden"> <td class="specs-key">Ideal For</td> <td class="specs-value fk-data">Women's</td> </tr> <tr class="hidden"> <td class="specs-key">Occasion</td> <td class="specs-value fk-data">Festive</td> </tr> <tr class="hidden"> <td class="specs-key">Pattern</td> <td class="specs-value fk-data">Self Design</td> </tr> </table> <table cellspacing="0" class="fk-specs-type2"> <tr> <th class="group-head" colspan="2">Kurta Details</th> </tr> <tr class=""> <td class="specs-key">Type</td> <td class="specs-value fk-data">Anarkali</td> </tr> <tr class=""> <td class="specs-key">Fabric</td> <td class="specs-value fk-data">Cotton</td> </tr> <tr class=""> <td class="specs-key">Number of Contents in Sales Package</td> <td class="specs-value fk-data">Pack of 1</td> </tr> </table> <table cellspacing="0" class="fk-specs-type2"> <tr> <th class="group-head" colspan="2">Additional Details<a class="see-more unitExt rmargin10 no-underline" href="javascript:void(0);" onclick="$(this).closest('.fk-specs-type2').toggleClass('expandedMore')" title="Expand">[+]</a><a class="hidden unitExt rmargin10 no-underline" href="javascript:void(0);" onclick="$(this).closest('.fk-specs-type2').toggleClass('expandedMore')" title="Collapse">[-]</a></th> </tr> <tr class="hidden"> <td class="specs-key">Style Code</td> <td class="specs-value fk-data">KT-1670_Yellow..F</td> </tr> </table> <table cellspacing="0" class="fk-specs-type2"> <tr> <th class="group-head" colspan="2">In the Box</th> </tr> <tr class=""> <td class="specs-key"> </td> <td class="specs-value fk-data">Kurta</td> </tr> </table> </div>,10:03:2014,None
LSTKTADTPF6ADVFQR8ZR3ZS8C,Lovely Lady Self Design Women's A-line Kurta,http://www.flipkart.com/womens-clothing?otracker=hp_nmenu_sub_women_0_Clothing,Rs. 648,Clothing,Maternity Wear,Lovely Lady,http://img5a.flixcart.com/image/kurta/w/b/t/kt-1607-green-f-lovely-lady-38-400x400-imadtjvtdvz7ey6q.jpeg,Rs. 1299,Black,women,http://www.flipkart.com/lovely-lady-self-design-women-s-a-line-kurta/p/itmdtpf6uggtzju9?pid=KTADTPF6ADVFQR8Z&srno=b_52&ref=d6bfeb36-16f6-4742-8016-3b8a8967dcf6,Fashionara,Lovely Lady Self Design Women's A-line Kurta - Buy Green Lovely Lady Self Design Women's A-line Kurta Online at Best Prices in India | Flipkart.com,Lovely Lady Self Design Women's A-line Kurta - Buy Green Lovely Lady Self Design Women's A-line Kurta For Only Rs. 1299.00 Online in India. Shop Online For Apparels. Huge Collection of Branded Clothes Only at,['34'  '36'  '38'  '40'  '42'],<div class="item_left_column" id="description"> <h3 class="item_desc_title fk-uppercase">Lovely Lady Self Design Women's A-line Kurta         Price: Rs.648</h3> <div class="cls"></div> <div class="item_desc_text line"> <div style="float:right"> </div>                         Style and Charisma come together to create this kurta. The contrast piping on the neckline and sleeve hems matches the floral embroidery underneath and the buttons on the short placket. The real scene stealers are the pintucks with contrast stitch lines.  Wear it with a bright coloured churidar and dupatta for a casual outing.        </div> <div style="clear: both;"></div> </div>,<div class="item_left_column" id="specifications"> <h3 class="item_desc_title fk-uppercase">         Specifications of Lovely Lady Self Design Women's A-line Kurta    </h3> <table cellspacing="0" class="fk-specs-type2"> <tr> <th class="group-head" colspan="2">General Details<a class="see-more unitExt rmargin10 no-underline" href="javascript:void(0);" onclick="$(this).closest('.fk-specs-type2').toggleClass('expandedMore')" title="Expand">[+]</a><a class="hidden unitExt rmargin10 no-underline" href="javascript:void(0);" onclick="$(this).closest('.fk-specs-type2').toggleClass('expandedMore')" title="Collapse">[-]</a></th> </tr> <tr class="hidden"> <td class="specs-key">Ideal For</td> <td class="specs-value fk-data">Women's</td> </tr> <tr class="hidden"> <td class="specs-key">Occasion</td> <td class="specs-value fk-data">Festive</td> </tr> <tr class="hidden"> <td class="specs-key">Pattern</td> <td class="specs-value fk-data">Self Design</td> </tr> </table> <table cellspacing="0" class="fk-specs-type2"> <tr> <th class="group-head" colspan="2">Kurta Details</th> </tr> <tr class=""> <td class="specs-key">Type</td> <td class="specs-value fk-data">A-line</td> </tr> <tr class=""> <td class="specs-key">Fabric</td> <td class="specs-value fk-data">Cotton</td> </tr> <tr class=""> <td class="specs-key">Number of Contents in Sales Package</td> <td class="specs-value fk-data">Pack of 1</td> </tr> </table> <table cellspacing="0" class="fk-specs-type2"> <tr> <th class="group-head" colspan="2">Additional Details<a class="see-more unitExt rmargin10 no-underline" href="javascript:void(0);" onclick="$(this).closest('.fk-specs-type2').toggleClass('expandedMore')" title="Expand">[+]</a><a class="hidden unitExt rmargin10 no-underline" href="javascript:void(0);" onclick="$(this).closest('.fk-specs-type2').toggleClass('expandedMore')" title="Collapse">[-]</a></th> </tr> <tr class="hidden"> <td class="specs-key">Style Code</td> <td class="specs-value fk-data">KT-1607_Green..F</td> </tr> </table> <table cellspacing="0" class="fk-specs-type2"> <tr> <th class="group-head" colspan="2">In the Box</th> </tr> <tr class=""> <td class="specs-key"> </td> <td class="specs-value fk-data">Kurta</td> </tr> </table> </div>,10:03:2014,None
None,Lovely Lady Self Design Women's A-line Kurta,http://www.flipkart.com/womens-clothing?otracker=hp_nmenu_sub_women_0_Clothing,Rs. 648,Clothing,Maternity Wear,Lovely Lady,http://img6a.flixcart.com/image/kurta/h/7/p/kt-1607-dark-blue-f-lovely-lady-34-400x400-imadtjvtmzhpzacd.jpeg,Rs. 1299,Black,women,http://www.flipkart.com/lovely-lady-self-design-women-s-a-line-kurta/p/itmdtpf7azznknux?pid=KTADTPF6ECCEGK2Z&srno=b_53&ref=d6bfeb36-16f6-4742-8016-3b8a8967dcf6,Fashionara,Lovely Lady Self Design Women's A-line Kurta - Buy Dark Blue Lovely Lady Self Design Women's A-line Kurta Online at Best Prices in India | Flipkart.com,Lovely Lady Self Design Women's A-line Kurta - Buy Dark Blue Lovely Lady Self Design Women's A-line Kurta For Only Rs. 1299.00 Online in India. Shop Online For Apparels. Huge Collection of Branded Clothes Only at,['36'  '38'  '42'],<div class="item_left_column" id="description"> <h3 class="item_desc_title fk-uppercase">Lovely Lady Self Design Women's A-line Kurta         Price: Rs.648</h3> <div class="cls"></div> <div class="item_desc_text line"> <div style="float:right"> </div>                         Style and Charisma come together to create this kurta. The contrast piping on the neckline and sleeve hems matches the floral embroidery underneath and the buttons on the short placket. The real scene stealers are the pintucks with contrast stitch lines.  Wear it with a churidar  silver jhumkis and carry a box clutch for an elegant look.        </div> <div style="clear: both;"></div> </div>,<div class="item_left_column" id="specifications"> <h3 class="item_desc_title fk-uppercase">         Specifications of Lovely Lady Self Design Women's A-line Kurta    </h3> <table cellspacing="0" class="fk-specs-type2"> <tr> <th class="group-head" colspan="2">General Details<a class="see-more unitExt rmargin10 no-underline" href="javascript:void(0);" onclick="$(this).closest('.fk-specs-type2').toggleClass('expandedMore')" title="Expand">[+]</a><a class="hidden unitExt rmargin10 no-underline" href="javascript:void(0);" onclick="$(this).closest('.fk-specs-type2').toggleClass('expandedMore')" title="Collapse">[-]</a></th> </tr> <tr class="hidden"> <td class="specs-key">Ideal For</td> <td class="specs-value fk-data">Women's</td> </tr> <tr class="hidden"> <td class="specs-key">Occasion</td> <td class="specs-value fk-data">Festive</td> </tr> <tr class="hidden"> <td class="specs-key">Pattern</td> <td class="specs-value fk-data">Self Design</td> </tr> </table> <table cellspacing="0" class="fk-specs-type2"> <tr> <th class="group-head" colspan="2">Kurta Details</th> </tr> <tr class=""> <td class="specs-key">Type</td> <td class="specs-value fk-data">A-line</td> </tr> <tr class=""> <td class="specs-key">Fabric</td> <td class="specs-value fk-data">Cotton</td> </tr> <tr class=""> <td class="specs-key">Number of Contents in Sales Package</td> <td class="specs-value fk-data">Pack of 1</td> </tr> </table> <table cellspacing="0" class="fk-specs-type2"> <tr> <th class="group-head" colspan="2">Additional Details<a class="see-more unitExt rmargin10 no-underline" href="javascript:void(0);" onclick="$(this).closest('.fk-specs-type2').toggleClass('expandedMore')" title="Expand">[+]</a><a class="hidden unitExt rmargin10 no-underline" href="javascript:void(0);" onclick="$(this).closest('.fk-specs-type2').toggleClass('expandedMore')" title="Collapse">[-]</a></th> </tr> <tr class="hidden"> <td class="specs-key">Style Code</td> <td class="specs-value fk-data">KT-1607_Dark Blue..F</td> </tr> </table> <table cellspacing="0" class="fk-specs-type2"> <tr> <th class="group-head" colspan="2">In the Box</th> </tr> <tr class=""> <td class="specs-key"> </td> <td class="specs-value fk-data">Kurta</td> </tr> </table> </div>,10:03:2014,None
LSTKTADTPF6D4ZZS9HXBVHMSJ,Lovely Lady Self Design Women's Anarkali Kurta,http://www.flipkart.com/womens-clothing?otracker=hp_nmenu_sub_women_0_Clothing,Rs. 1148,Clothing,Maternity Wear,Lovely Lady,http://img6a.flixcart.com/image/kurta/m/x/c/kt-1679-light-green-f-lovely-lady-36-400x400-imadtjvhhhdrhgds.jpeg,Rs. 2299,Dark Green,women,http://www.flipkart.com/lovely-lady-self-design-women-s-anarkali-kurta/p/itmdtpf6mgrgwaxk?pid=KTADTPF6D4ZZS9HX&srno=b_43&ref=fece6d94-bb3f-46e2-83d7-d015aa7c3467,Fashionara,Lovely Lady Self Design Women's Anarkali Kurta - Buy Light green Lovely Lady Self Design Women's Anarkali Kurta Online at Best Prices in India | Flipkart.com,Lovely Lady Self Design Women's Anarkali Kurta - Buy Light green Lovely Lady Self Design Women's Anarkali Kurta For Only Rs. 2299.00 Online in India. Shop Online For Apparels. Huge Collection of Branded Clothes Only at,['34'  '36'  '38'  '40'  '42'],<div class="item_left_column" id="description"> <h3 class="item_desc_title fk-uppercase">Lovely Lady Self Design Women's Anarkali Kurta         Price: Rs.1148</h3> <div class="cls"></div> <div class="item_desc_text line"> <div style="float:right"> </div>                         Look stunning and feel amazing in this ravishing cotton kurta. Cut in a kalidar style  this kurta has awe inducing embroidery on the yoke  and a feminine sweetheart neckline with contrast piping.  Wear it with dark coloured leggings and jhumkas to look stylish.        </div> <div style="clear: both;"></div> </div>,<div class="item_left_column" id="specifications"> <h3 class="item_desc_title fk-uppercase">         Specifications of Lovely Lady Self Design Women's Anarkali Kurta    </h3> <table cellspacing="0" class="fk-specs-type2"> <tr> <th class="group-head" colspan="2">General Details<a class="see-more unitExt rmargin10 no-underline" href="javascript:void(0);" onclick="$(this).closest('.fk-specs-type2').toggleClass('expandedMore')" title="Expand">[+]</a><a class="hidden unitExt rmargin10 no-underline" href="javascript:void(0);" onclick="$(this).closest('.fk-specs-type2').toggleClass('expandedMore')" title="Collapse">[-]</a></th> </tr> <tr class="hidden"> <td class="specs-key">Ideal For</td> <td class="specs-value fk-data">Women's</td> </tr> <tr class="hidden"> <td class="specs-key">Occasion</td> <td class="specs-value fk-data">Festive</td> </tr> <tr class="hidden"> <td class="specs-key">Pattern</td> <td class="specs-value fk-data">Self Design</td> </tr> </table> <table cellspacing="0" class="fk-specs-type2"> <tr> <th class="group-head" colspan="2">Kurta Details</th> </tr> <tr class=""> <td class="specs-key">Type</td> <td class="specs-value fk-data">Anarkali</td> </tr> <tr class=""> <td class="specs-key">Fabric</td> <td class="specs-value fk-data">Cotton</td> </tr> <tr class=""> <td class="specs-key">Number of Contents in Sales Package</td> <td class="specs-value fk-data">Pack of 1</td> </tr> </table> <table cellspacing="0" class="fk-specs-type2"> <tr> <th class="group-head" colspan="2">Additional Details<a class="see-more unitExt rmargin10 no-underline" href="javascript:void(0);" onclick="$(this).closest('.fk-specs-type2').toggleClass('expandedMore')" title="Expand">[+]</a><a class="hidden unitExt rmargin10 no-underline" href="javascript:void(0);" onclick="$(this).closest('.fk-specs-type2').toggleClass('expandedMore')" title="Collapse">[-]</a></th> </tr> <tr class="hidden"> <td class="specs-key">Style Code</td> <td class="specs-value fk-data">KT-1679_Light Green..F</td> </tr> </table> <table cellspacing="0" class="fk-specs-type2"> <tr> <th class="group-head" colspan="2">In the Box</th> </tr> <tr class=""> <td class="specs-key"> </td> <td class="specs-value fk-data">Kurta</td> </tr> </table> </div>,10:03:2014,None
LSTKTADTPF5NCXNAYZT0BMYGZ,Lovely Lady Printed Women's A-line Kurta,http://www.flipkart.com/womens-clothing?otracker=hp_nmenu_sub_women_0_Clothing,Rs. 648,Clothing,Maternity Wear,Lovely Lady,http://img5a.flixcart.com/image/kurta/j/z/4/kt-1610-light-green-f-lovely-lady-36-400x400-imadtjvhsay5fyze.jpeg,Rs. 1299,Light green,women,http://www.flipkart.com/lovely-lady-printed-women-s-a-line-kurta/p/itmdtpf5f3augg8z?pid=KTADTPF5NCXNAYZT&srno=b_55&ref=d6bfeb36-16f6-4742-8016-3b8a8967dcf6,Fashionara,Lovely Lady Printed Women's A-line Kurta - Buy Light green Lovely Lady Printed Women's A-line Kurta Online at Best Prices in India | Flipkart.com,Lovely Lady Printed Women's A-line Kurta - Buy Light green Lovely Lady Printed Women's A-line Kurta For Only Rs. 1299.00 Online in India. Shop Online For Apparels. Huge Collection of Branded Clothes Only at,['34'  '36'  '38'  '40'  '42'],<div class="item_left_column" id="description"> <h3 class="item_desc_title fk-uppercase">Lovely Lady Printed Women's A-line Kurta         Price: Rs.648</h3> <div class="cls"></div> <div class="item_desc_text line"> <div style="float:right"> </div>                         A printed sleeveless kurti is a summer staple that you ought to own. The brighter coloured it is  the better. This kurti features a mixed print and a round neck with a slit. The asymmetrical hem gives it a quirky and contemporary twist.  Wear yours with contrasting leggings and carry a jhola for a contemporary chic look.        </div> <div style="clear: both;"></div> </div>,<div class="item_left_column" id="specifications"> <h3 class="item_desc_title fk-uppercase">         Specifications of Lovely Lady Printed Women's A-line Kurta    </h3> <table cellspacing="0" class="fk-specs-type2"> <tr> <th class="group-head" colspan="2">General Details<a class="see-more unitExt rmargin10 no-underline" href="javascript:void(0);" onclick="$(this).closest('.fk-specs-type2').toggleClass('expandedMore')" title="Expand">[+]</a><a class="hidden unitExt rmargin10 no-underline" href="javascript:void(0);" onclick="$(this).closest('.fk-specs-type2').toggleClass('expandedMore')" title="Collapse">[-]</a></th> </tr> <tr class="hidden"> <td class="specs-key">Ideal For</td> <td class="specs-value fk-data">Women's</td> </tr> <tr class="hidden"> <td class="specs-key">Occasion</td> <td class="specs-value fk-data">Festive</td> </tr> <tr class="hidden"> <td class="specs-key">Pattern</td> <td class="specs-value fk-data">Printed</td> </tr> </table> <table cellspacing="0" class="fk-specs-type2"> <tr> <th class="group-head" colspan="2">Kurta Details</th> </tr> <tr class=""> <td class="specs-key">Type</td> <td class="specs-value fk-data">A-line</td> </tr> <tr class=""> <td class="specs-key">Fabric</td> <td class="specs-value fk-data">Cotton</td> </tr> <tr class=""> <td class="specs-key">Number of Contents in Sales Package</td> <td class="specs-value fk-data">Pack of 1</td> </tr> </table> <table cellspacing="0" class="fk-specs-type2"> <tr> <th class="group-head" colspan="2">Additional Details<a class="see-more unitExt rmargin10 no-underline" href="javascript:void(0);" onclick="$(this).closest('.fk-specs-type2').toggleClass('expandedMore')" title="Expand">[+]</a><a class="hidden unitExt rmargin10 no-underline" href="javascript:void(0);" onclick="$(this).closest('.fk-specs-type2').toggleClass('expandedMore')" title="Collapse">[-]</a></th> </tr> <tr class="hidden"> <td class="specs-key">Style Code</td> <td class="specs-value fk-data">KT-1610_Light Green..F</td> </tr> </table> <table cellspacing="0" class="fk-specs-type2"> <tr> <th class="group-head" colspan="2">In the Box</th> </tr> <tr class=""> <td class="specs-key"> </td> <td class="specs-value fk-data">Kurta</td> </tr> </table> </div>,10:03:2014,None
LSTKTADTPF6DWZ62VXD2G2HRP,Lovely Lady Self Design Women's A-line Kurta,http://www.flipkart.com/womens-clothing?otracker=hp_nmenu_sub_women_0_Clothing,Rs. 698,Clothing,Maternity Wear,Lovely Lady,http://img6a.flixcart.com/image/kurta/z/8/x/kt-1615-yellow-f-lovely-lady-42-400x400-imadtjvhue8h9wep.jpeg,Rs. 1399,Dark pink,women,http://www.flipkart.com/lovely-lady-self-design-women-s-a-line-kurta/p/itmdtpf692j4ackz?pid=KTADTPF6DWZ62VXD&srno=b_44&ref=fece6d94-bb3f-46e2-83d7-d015aa7c3467,Fashionara,Lovely Lady Self Design Women's A-line Kurta - Buy Yellow Lovely Lady Self Design Women's A-line Kurta Online at Best Prices in India | Flipkart.com,Lovely Lady Self Design Women's A-line Kurta - Buy Yellow Lovely Lady Self Design Women's A-line Kurta For Only Rs. 1399.00 Online in India. Shop Online For Apparels. Huge Collection of Branded Clothes Only at,['34'  '36'  '38'  '40'  '42'],<div class="item_left_column" id="description"> <h3 class="item_desc_title fk-uppercase">Lovely Lady Self Design Women's A-line Kurta         Price: Rs.698</h3> <div class="cls"></div> <div class="item_desc_text line"> <div style="float:right"> </div>                         A chic kurti like this deserves a place in your closet. With a stylish ethnic print in panels on the kurta  stark embroidery with hints of metallic thread on the yoke and pleats below  contrast buttons and contrast piping on the neckline and arm holes along with stitch lines on the neck  this kurta is fab.  Team it with denim skinnies and carry a contrast coloured sling bag to make an impression.        </div> <div style="clear: both;"></div> </div>,<div class="item_left_column" id="specifications"> <h3 class="item_desc_title fk-uppercase">         Specifications of Lovely Lady Self Design Women's A-line Kurta    </h3> <table cellspacing="0" class="fk-specs-type2"> <tr> <th class="group-head" colspan="2">General Details<a class="see-more unitExt rmargin10 no-underline" href="javascript:void(0);" onclick="$(this).closest('.fk-specs-type2').toggleClass('expandedMore')" title="Expand">[+]</a><a class="hidden unitExt rmargin10 no-underline" href="javascript:void(0);" onclick="$(this).closest('.fk-specs-type2').toggleClass('expandedMore')" title="Collapse">[-]</a></th> </tr> <tr class="hidden"> <td class="specs-key">Ideal For</td> <td class="specs-value fk-data">Women's</td> </tr> <tr class="hidden"> <td class="specs-key">Occasion</td> <td class="specs-value fk-data">Festive</td> </tr> <tr class="hidden"> <td class="specs-key">Pattern</td> <td class="specs-value fk-data">Self Design</td> </tr> </table> <table cellspacing="0" class="fk-specs-type2"> <tr> <th class="group-head" colspan="2">Kurta Details</th> </tr> <tr class=""> <td class="specs-key">Type</td> <td class="specs-value fk-data">A-line</td> </tr> <tr class=""> <td class="specs-key">Fabric</td> <td class="specs-value fk-data">Cotton</td> </tr> <tr class=""> <td class="specs-key">Number of Contents in Sales Package</td> <td class="specs-value fk-data">Pack of 1</td> </tr> </table> <table cellspacing="0" class="fk-specs-type2"> <tr> <th class="group-head" colspan="2">Additional Details<a class="see-more unitExt rmargin10 no-underline" href="javascript:void(0);" onclick="$(this).closest('.fk-specs-type2').toggleClass('expandedMore')" title="Expand">[+]</a><a class="hidden unitExt rmargin10 no-underline" href="javascript:void(0);" onclick="$(this).closest('.fk-specs-type2').toggleClass('expandedMore')" title="Collapse">[-]</a></th> </tr> <tr class="hidden"> <td class="specs-key">Style Code</td> <td class="specs-value fk-data">KT-1615_Yellow..F</td> </tr> </table> <table cellspacing="0" class="fk-specs-type2"> <tr> <th class="group-head" colspan="2">In the Box</th> </tr> <tr class=""> <td class="specs-key"> </td> <td class="specs-value fk-data">Kurta</td> </tr> </table> </div>,10:03:2014,None
