LSTPANDHFQAZY64BACC9HXNTC,Morph Maternity Women's Maternity Panty Panty,http://www.flipkart.com/womens-clothing?otracker=hp_nmenu_sub_women_0_Clothing,Rs. 275,Clothing,Maternity Wear,Lovely Lady,http://img6a.flixcart.com/image/panty/a/c/c/mphs017copch00peach-morph-maternity-xl-400x400-imadmv9wehyf4uy5.jpeg,Rs. 275,Peach,women,http://www.flipkart.com/morph-maternity-women-s-panty/p/itmdmwg732dshj7u?pid=PANDHFQAZY64BACC&srno=b_8&ref=d0766f7c-fb68-43a0-9763-8beb1b737408,WS Retail,Morph Maternity Women's Maternity Panty Panty - Buy Peach Morph Maternity Women's Maternity Panty Panty Online at Best Prices in India | Flipkart.com,Morph Maternity Women's Maternity Panty Panty - Buy Peach Morph Maternity Women's Maternity Panty Panty For Only Rs. 275.0 Online in India. Shop Online For Apparels. Huge Collection of Branded Clothes Only at,['L'  'XL'],<div class="item_left_column" id="description"> <h3 class="item_desc_title fk-uppercase">Morph Maternity Women's Maternity Panty Panty         Price: Rs.275</h3> <div class="cls"></div> <div class="item_desc_text line"> <div style="float:right"> </div> <p>   Crafted from the finest cotton material  this maternity panty from Morph Maternity ensures a right amount of relaxed and breathable comfort to all those expecting mothers. The <strong>elastic waistband </strong>of this comfortable panty ensures perfect grip and fit.</p> </div> <div style="clear: both;"></div> </div>,<div class="item_left_column" id="specifications"> <h3 class="item_desc_title fk-uppercase">         Specifications of Morph Maternity Women's Maternity Panty Panty    </h3> <table cellspacing="0" class="fk-specs-type2"> <tr> <th class="group-head" colspan="2">General Details<a class="see-more unitExt rmargin10 no-underline" href="javascript:void(0);" onclick="$(this).closest('.fk-specs-type2').toggleClass('expandedMore')" title="Expand">[+]</a><a class="hidden unitExt rmargin10 no-underline" href="javascript:void(0);" onclick="$(this).closest('.fk-specs-type2').toggleClass('expandedMore')" title="Collapse">[-]</a></th> </tr> <tr class="hidden"> <td class="specs-key">Ideal For</td> <td class="specs-value fk-data">Women's</td> </tr> <tr class="hidden"> <td class="specs-key">Occasion</td> <td class="specs-value fk-data">Casual</td> </tr> <tr class="hidden"> <td class="specs-key">Pattern</td> <td class="specs-value fk-data">Solid</td> </tr> </table> <table cellspacing="0" class="fk-specs-type2"> <tr> <th class="group-head" colspan="2">Panty Details</th> </tr> <tr class=""> <td class="specs-key">Type</td> <td class="specs-value fk-data">Maternity Panty</td> </tr> <tr class=""> <td class="specs-key">Fabric</td> <td class="specs-value fk-data">100% Cotton</td> </tr> <tr class=""> <td class="specs-key">Design</td> <td class="specs-value fk-data">Logo Print at Front</td> </tr> </table> <table cellspacing="0" class="fk-specs-type2"> <tr> <th class="group-head" colspan="2">Fabric Care</th> </tr> <tr class=""> <td class="specs-value fk-data" colspan="2">Machine Wash at 40째C  Do Not Bleach  Do Not Wring  Do Not Iron</td> </tr> </table> <table cellspacing="0" class="fk-specs-type2"> <tr> <th class="group-head" colspan="2">Additional Details<a class="see-more unitExt rmargin10 no-underline" href="javascript:void(0);" onclick="$(this).closest('.fk-specs-type2').toggleClass('expandedMore')" title="Expand">[+]</a><a class="hidden unitExt rmargin10 no-underline" href="javascript:void(0);" onclick="$(this).closest('.fk-specs-type2').toggleClass('expandedMore')" title="Collapse">[-]</a></th> </tr> <tr class="hidden"> <td class="specs-key"> </td> <td class="specs-value fk-data">Elasticated Waistband and Leg Opening</td> </tr> </table> </div>,10:03:2014,None
LSTKTADQXFBE5KC3HPKIFRSEV,Morph Maternity Women's Kurta,http://www.flipkart.com/womens-clothing?otracker=hp_nmenu_sub_women_0_Clothing,Rs. 1395,Clothing,Maternity Wear,Lovely Lady,http://img5a.flixcart.com/image/kurta/n/y/h/ekav865ikorg0-morph-maternity-l-400x400-imadrch6ffpxzpgv.jpeg,Rs. 1395,Orange,women,http://www.flipkart.com/morph-maternity-women-s-kurta/p/itmdqxfcmtz7zszq?pid=KTADQXFBE5KC3HPK&srno=b_5&ref=d0766f7c-fb68-43a0-9763-8beb1b737408,WS Retail,Morph Maternity Women's Kurta - Buy Orange Morph Maternity Women's Kurta Online at Best Prices in India | Flipkart.com,Morph Maternity Women's Kurta - Buy Orange Morph Maternity Women's Kurta For Only Rs. 1395.0 Online in India. Shop Online For Apparels. Huge Collection of Branded Clothes Only at,['S'  'M'  'L'],None,<div class="item_left_column" id="specifications"> <h3 class="item_desc_title fk-uppercase">         Specifications of Morph Maternity Women's Kurta    </h3> <table cellspacing="0" class="fk-specs-type2"> <tr> <th class="group-head" colspan="2">General Details<a class="see-more unitExt rmargin10 no-underline" href="javascript:void(0);" onclick="$(this).closest('.fk-specs-type2').toggleClass('expandedMore')" title="Expand">[+]</a><a class="hidden unitExt rmargin10 no-underline" href="javascript:void(0);" onclick="$(this).closest('.fk-specs-type2').toggleClass('expandedMore')" title="Collapse">[-]</a></th> </tr> <tr class="hidden"> <td class="specs-key">Ideal For</td> <td class="specs-value fk-data">Women's</td> </tr> </table> <table cellspacing="0" class="fk-specs-type2"> <tr> <th class="group-head" colspan="2">Kurta Details</th> </tr> <tr class=""> <td class="specs-key">Fabric</td> <td class="specs-value fk-data">100% Cotton</td> </tr> </table> <table cellspacing="0" class="fk-specs-type2"> <tr> <th class="group-head" colspan="2">Additional Details<a class="see-more unitExt rmargin10 no-underline" href="javascript:void(0);" onclick="$(this).closest('.fk-specs-type2').toggleClass('expandedMore')" title="Expand">[+]</a><a class="hidden unitExt rmargin10 no-underline" href="javascript:void(0);" onclick="$(this).closest('.fk-specs-type2').toggleClass('expandedMore')" title="Collapse">[-]</a></th> </tr> <tr class="hidden"> <td class="specs-key">Style Code</td> <td class="specs-value fk-data">EKAV865IKORG0</td> </tr> </table> </div>,10:03:2014,None
LSTKTADTPF6YSHRTHFDHPCT2I,Lovely Lady Self Design Women's Straight Kurta,http://www.flipkart.com/womens-clothing?otracker=hp_nmenu_sub_women_0_Clothing,Rs. 648,Clothing,Maternity Wear,Lovely Lady,http://img6a.flixcart.com/image/kurta/h/f/d/kt-1604-black-f-lovely-lady-34-400x400-imadtjvt8vgftzbr.jpeg,Rs. 1299,Black,women,http://www.flipkart.com/lovely-lady-self-design-women-s-straight-kurta/p/itmdtpf68xpgpcms?pid=KTADTPF6YSHRTHFD&srno=b_2&ref=d0766f7c-fb68-43a0-9763-8beb1b737408,Fashionara,Lovely Lady Self Design Women's Straight Kurta - Buy Black Lovely Lady Self Design Women's Straight Kurta Online at Best Prices in India | Flipkart.com,Lovely Lady Self Design Women's Straight Kurta - Buy Black Lovely Lady Self Design Women's Straight Kurta For Only Rs. 1299.00 Online in India. Shop Online For Apparels. Huge Collection of Branded Clothes Only at,['34'  '36'  '38'  '40'],<div class="item_left_column" id="description"> <h3 class="item_desc_title fk-uppercase">Lovely Lady Self Design Women's Straight Kurta         Price: Rs.648</h3> <div class="cls"></div> <div class="item_desc_text line"> <div style="float:right"> </div>                         A kurta as striking as this is a sure shot attention-getter!  This vibrant kurta has pintucks and contrast embroidery on the yoke with subtle sequin work. There is a busy print on the hem and contrast piping on the neckline and sleeve hems.  Wear this kurta with red leggings and carry a smart sling bag to look trendy.        </div> <div style="clear: both;"></div> </div>,<div class="item_left_column" id="specifications"> <h3 class="item_desc_title fk-uppercase">         Specifications of Lovely Lady Self Design Women's Straight Kurta    </h3> <table cellspacing="0" class="fk-specs-type2"> <tr> <th class="group-head" colspan="2">General Details<a class="see-more unitExt rmargin10 no-underline" href="javascript:void(0);" onclick="$(this).closest('.fk-specs-type2').toggleClass('expandedMore')" title="Expand">[+]</a><a class="hidden unitExt rmargin10 no-underline" href="javascript:void(0);" onclick="$(this).closest('.fk-specs-type2').toggleClass('expandedMore')" title="Collapse">[-]</a></th> </tr> <tr class="hidden"> <td class="specs-key">Ideal For</td> <td class="specs-value fk-data">Women's</td> </tr> <tr class="hidden"> <td class="specs-key">Occasion</td> <td class="specs-value fk-data">Festive</td> </tr> <tr class="hidden"> <td class="specs-key">Pattern</td> <td class="specs-value fk-data">Self Design</td> </tr> </table> <table cellspacing="0" class="fk-specs-type2"> <tr> <th class="group-head" colspan="2">Kurta Details</th> </tr> <tr class=""> <td class="specs-key">Type</td> <td class="specs-value fk-data">Straight</td> </tr> <tr class=""> <td class="specs-key">Fabric</td> <td class="specs-value fk-data">Cotton</td> </tr> <tr class=""> <td class="specs-key">Number of Contents in Sales Package</td> <td class="specs-value fk-data">Pack of 1</td> </tr> </table> <table cellspacing="0" class="fk-specs-type2"> <tr> <th class="group-head" colspan="2">Additional Details<a class="see-more unitExt rmargin10 no-underline" href="javascript:void(0);" onclick="$(this).closest('.fk-specs-type2').toggleClass('expandedMore')" title="Expand">[+]</a><a class="hidden unitExt rmargin10 no-underline" href="javascript:void(0);" onclick="$(this).closest('.fk-specs-type2').toggleClass('expandedMore')" title="Collapse">[-]</a></th> </tr> <tr class="hidden"> <td class="specs-key">Style Code</td> <td class="specs-value fk-data">KT-1604_Black..F</td> </tr> </table> <table cellspacing="0" class="fk-specs-type2"> <tr> <th class="group-head" colspan="2">In the Box</th> </tr> <tr class=""> <td class="specs-key"> </td> <td class="specs-value fk-data">Kurta</td> </tr> </table> </div>,10:03:2014,None
LSTPANDHFQANF2EHVYZVHX5AW,Morph Maternity Women's Maternity Panty Panty,http://www.flipkart.com/womens-clothing?otracker=hp_nmenu_sub_women_0_Clothing,Rs. 275,Clothing,Maternity Wear,Lovely Lady,http://img5a.flixcart.com/image/panty/v/y/z/mphs013colbl00light-blue-morph-maternity-xl-400x400-imadmv9wzpcvmmgg.jpeg,Rs. 275,Green  Light Blue,women,http://www.flipkart.com/morph-maternity-women-s-panty/p/itmdmwg7bnwwgb82?pid=PANDHFQANF2EHVYZ&srno=b_9&ref=d0766f7c-fb68-43a0-9763-8beb1b737408,WS Retail,Morph Maternity Women's Maternity Panty Panty - Buy Light Blue Morph Maternity Women's Maternity Panty Panty Online at Best Prices in India | Flipkart.com,Morph Maternity Women's Maternity Panty Panty - Buy Light Blue Morph Maternity Women's Maternity Panty Panty For Only Rs. 275.0 Online in India. Shop Online For Apparels. Huge Collection of Branded Clothes Only at,[],<div class="item_left_column" id="description"> <h3 class="item_desc_title fk-uppercase">Morph Maternity Women's Maternity Panty Panty         Price: Rs.275</h3> <div class="cls"></div> <div class="item_desc_text line"> <div style="float:right"> </div> <p>   Let fashion collide with comfort in a piece of clothing no pregnant woman can do without. This Morph maternity panty is crafted with ideal fit and fabric for better care  every single minute. Light blue and necessary suit this panty just right.</p> </div> <div style="clear: both;"></div> </div>,<div class="item_left_column" id="specifications"> <h3 class="item_desc_title fk-uppercase">         Specifications of Morph Maternity Women's Maternity Panty Panty    </h3> <table cellspacing="0" class="fk-specs-type2"> <tr> <th class="group-head" colspan="2">General Details<a class="see-more unitExt rmargin10 no-underline" href="javascript:void(0);" onclick="$(this).closest('.fk-specs-type2').toggleClass('expandedMore')" title="Expand">[+]</a><a class="hidden unitExt rmargin10 no-underline" href="javascript:void(0);" onclick="$(this).closest('.fk-specs-type2').toggleClass('expandedMore')" title="Collapse">[-]</a></th> </tr> <tr class="hidden"> <td class="specs-key">Ideal For</td> <td class="specs-value fk-data">Women's</td> </tr> <tr class="hidden"> <td class="specs-key">Occasion</td> <td class="specs-value fk-data">Casual</td> </tr> <tr class="hidden"> <td class="specs-key">Pattern</td> <td class="specs-value fk-data">Solid</td> </tr> </table> <table cellspacing="0" class="fk-specs-type2"> <tr> <th class="group-head" colspan="2">Panty Details</th> </tr> <tr class=""> <td class="specs-key">Type</td> <td class="specs-value fk-data">Maternity Panty</td> </tr> <tr class=""> <td class="specs-key">Fabric</td> <td class="specs-value fk-data">100% Cotton</td> </tr> <tr class=""> <td class="specs-key">Design</td> <td class="specs-value fk-data">Logo Print at Front</td> </tr> </table> <table cellspacing="0" class="fk-specs-type2"> <tr> <th class="group-head" colspan="2">Fabric Care</th> </tr> <tr class=""> <td class="specs-value fk-data" colspan="2">Machine Wash at 40째C  Do Not Bleach  Do Not Iron  Do Not Wring</td> </tr> </table> <table cellspacing="0" class="fk-specs-type2"> <tr> <th class="group-head" colspan="2">Additional Details<a class="see-more unitExt rmargin10 no-underline" href="javascript:void(0);" onclick="$(this).closest('.fk-specs-type2').toggleClass('expandedMore')" title="Expand">[+]</a><a class="hidden unitExt rmargin10 no-underline" href="javascript:void(0);" onclick="$(this).closest('.fk-specs-type2').toggleClass('expandedMore')" title="Collapse">[-]</a></th> </tr> <tr class="hidden"> <td class="specs-key"> </td> <td class="specs-value fk-data">Elasticated Waistband and Leg Opening</td> </tr> </table> </div>,10:03:2014,None
LSTBRADQWZPRXA8GVFBE1SNJS,Morph Maternity Women's Nursing Bra,http://www.flipkart.com/womens-clothing?otracker=hp_nmenu_sub_women_0_Clothing,Rs. 595,Clothing,Maternity Wear,Lovely Lady,http://img5a.flixcart.com/image/bra/g/z/7/lpnb026coskn-morph-maternity-32c-400x400-imads7wa8agpebbp.jpeg,Rs. 595,Beige,women,http://www.flipkart.com/morph-maternity-women-s-nursing-bra/p/itmdqwzpb3a5x9u2?pid=BRADQWZPRXA8GVFB&srno=b_12&ref=d0766f7c-fb68-43a0-9763-8beb1b737408,WS Retail,Morph Maternity Women's Nursing Bra - Buy Beige Morph Maternity Women's Nursing Bra Online at Best Prices in India | Flipkart.com,Morph Maternity Women's Nursing Bra - Buy Beige Morph Maternity Women's Nursing Bra For Only Rs. 595.0 Online in India. Shop Online For Apparels. Huge Collection of Branded Clothes Only at,['32C'  '34C'],None,<div class="item_left_column" id="specifications"> <h3 class="item_desc_title fk-uppercase">         Specifications of Morph Maternity Women's Nursing Bra    </h3> <table cellspacing="0" class="fk-specs-type2"> <tr> <th class="group-head" colspan="2">General Details<a class="see-more unitExt rmargin10 no-underline" href="javascript:void(0);" onclick="$(this).closest('.fk-specs-type2').toggleClass('expandedMore')" title="Expand">[+]</a><a class="hidden unitExt rmargin10 no-underline" href="javascript:void(0);" onclick="$(this).closest('.fk-specs-type2').toggleClass('expandedMore')" title="Collapse">[-]</a></th> </tr> <tr class="hidden"> <td class="specs-key">Ideal For</td> <td class="specs-value fk-data">Women's</td> </tr> <tr class="hidden"> <td class="specs-key">Pattern</td> <td class="specs-value fk-data">Solid</td> </tr> </table> <table cellspacing="0" class="fk-specs-type2"> <tr> <th class="group-head" colspan="2">Bra Details</th> </tr> <tr class=""> <td class="specs-key">Type</td> <td class="specs-value fk-data">Nursing Bra</td> </tr> <tr class=""> <td class="specs-key">Fabric</td> <td class="specs-value fk-data">Cotton</td> </tr> <tr class=""> <td class="specs-key">Style</td> <td class="specs-value fk-data">Panel Detail  Elastic Underbust</td> </tr> <tr class=""> <td class="specs-key">Straps</td> <td class="specs-value fk-data">Adjustable</td> </tr> <tr class=""> <td class="specs-key">Closure</td> <td class="specs-value fk-data">Hooks at Back</td> </tr> </table> <table cellspacing="0" class="fk-specs-type2"> <tr> <th class="group-head" colspan="2">Fabric Care</th> </tr> <tr class=""> <td class="specs-value fk-data" colspan="2">Hand Wash Cold  Low Iron  Do Not Tumble Dry  Do Not Bleach</td> </tr> </table> <table cellspacing="0" class="fk-specs-type2"> <tr> <th class="group-head" colspan="2">Additional Details<a class="see-more unitExt rmargin10 no-underline" href="javascript:void(0);" onclick="$(this).closest('.fk-specs-type2').toggleClass('expandedMore')" title="Expand">[+]</a><a class="hidden unitExt rmargin10 no-underline" href="javascript:void(0);" onclick="$(this).closest('.fk-specs-type2').toggleClass('expandedMore')" title="Collapse">[-]</a></th> </tr> <tr class="hidden"> <td class="specs-key"> </td> <td class="specs-value fk-data">The Cups are leak-proof   so no more embarrassing breast-milk leaks in public It is made of 100% breathable fabric  so very comfortable. Drop cup for easy nursing . Rear Clouser with Adjustable hook &amp; eye Breathable cotton fabric maximizies support &amp; comfort all day and night Discrete nursing clips  featuring one handed access.</td> </tr> </table> </div>,10:03:2014,None
LSTNDNDQXFCZ8ZQG3CVVTIN86,Morph Maternity Women's Nighty,http://www.flipkart.com/womens-clothing?otracker=hp_nmenu_sub_women_0_Clothing,Rs. 1095,Clothing,Maternity Wear,Lovely Lady,http://img5a.flixcart.com/image/night-dress-nighty/7/v/w/swsh800bpblu0-morph-maternity-s-400x400-imadryv89yz7e4ga.jpeg,Rs. 1095,Blue  White,women,http://www.flipkart.com/morph-maternity-women-s-nighty/p/itmdqxfd9fdxyepv?pid=NDNDQXFCZ8ZQG3CV&srno=b_14&ref=d0766f7c-fb68-43a0-9763-8beb1b737408,WS Retail,Morph Maternity Women's Nighty - Buy Blue  White Morph Maternity Women's Nighty Online at Best Prices in India | Flipkart.com,Morph Maternity Women's Nighty - Buy Blue  White Morph Maternity Women's Nighty For Only Rs. 1095.0 Online in India. Shop Online For Apparels. Huge Collection of Branded Clothes Only at,['S'  'M'],None,<div class="item_left_column" id="specifications"> <h3 class="item_desc_title fk-uppercase">         Specifications of Morph Maternity Women's Nighty    </h3> <table cellspacing="0" class="fk-specs-type2"> <tr> <th class="group-head" colspan="2">General Details<a class="see-more unitExt rmargin10 no-underline" href="javascript:void(0);" onclick="$(this).closest('.fk-specs-type2').toggleClass('expandedMore')" title="Expand">[+]</a><a class="hidden unitExt rmargin10 no-underline" href="javascript:void(0);" onclick="$(this).closest('.fk-specs-type2').toggleClass('expandedMore')" title="Collapse">[-]</a></th> </tr> <tr class="hidden"> <td class="specs-key">Ideal For</td> <td class="specs-value fk-data">Women's</td> </tr> </table> <table cellspacing="0" class="fk-specs-type2"> <tr> <th class="group-head" colspan="2">Night Dress/Nighty Details</th> </tr> <tr class=""> <td class="specs-key">Type</td> <td class="specs-value fk-data">Nighty</td> </tr> <tr class=""> <td class="specs-key">Fabric</td> <td class="specs-value fk-data">100% Cotton</td> </tr> <tr class=""> <td class="specs-key">Fit</td> <td class="specs-value fk-data">Print Allover</td> </tr> <tr class=""> <td class="specs-key">Design</td> <td class="specs-value fk-data">Button Detail at Front  Pleat Detail at Front  Tie-up at Back</td> </tr> <tr class=""> <td class="specs-key">Style</td> <td class="specs-value fk-data">Printed</td> </tr> <tr class=""> <td class="specs-key">Sleeve</td> <td class="specs-value fk-data">Half Sleeve</td> </tr> </table> <table cellspacing="0" class="fk-specs-type2"> <tr> <th class="group-head" colspan="2">Cup Details</th> </tr> <tr class=""> <td class="specs-key">Cup Size</td> <td class="specs-value fk-data">Zipper Under the Bust</td> </tr> </table> <table cellspacing="0" class="fk-specs-type2"> <tr> <th class="group-head" colspan="2">Fabric Care</th> </tr> <tr class=""> <td class="specs-value fk-data" colspan="2">Tumble Dry Low  Do Not Bleach  Do Not Wring  Medium Iron  Wash Before Wearing  Hand or Machine Wash Cold with Like Colors</td> </tr> </table> <table cellspacing="0" class="fk-specs-type2"> <tr> <th class="group-head" colspan="2">Additional Details<a class="see-more unitExt rmargin10 no-underline" href="javascript:void(0);" onclick="$(this).closest('.fk-specs-type2').toggleClass('expandedMore')" title="Expand">[+]</a><a class="hidden unitExt rmargin10 no-underline" href="javascript:void(0);" onclick="$(this).closest('.fk-specs-type2').toggleClass('expandedMore')" title="Collapse">[-]</a></th> </tr> <tr class="hidden"> <td class="specs-key"> </td> <td class="specs-value fk-data">Square neck. Short sleeve. Horizontal Zipper for Nursing.Has Patent Pending Leak-Proof layer. Has a back tie that can be adjusted to fit.</td> </tr> </table> </div>,10:03:2014,None
LSTPANDHFQAFUM3WGF2AUGEWA,Morph Maternity Women's Maternity Panty,http://www.flipkart.com/womens-clothing?otracker=hp_nmenu_sub_women_0_Clothing,Rs. 275,Clothing,Maternity Wear,Lovely Lady,http://img6a.flixcart.com/image/panty/y/6/m/mphs017copch000peach-morph-maternity-l-400x400-imadkpgbs4e3ubgz.jpeg,Rs. 275,Peach,women,http://www.flipkart.com/morph-maternity-women-s-panty/p/itmdhtgxvzhe9guf?pid=PANDHFQAFUM3WGF2&srno=b_16&ref=125601ce-4894-4f08-baf9-b0f4297aad37,WS Retail,Morph Maternity Women's Maternity Panty - Buy Peach Morph Maternity Women's Maternity Panty Online at Best Prices in India | Flipkart.com,Morph Maternity Women's Maternity Panty - Buy Peach Morph Maternity Women's Maternity Panty For Only Rs. 275.0 Online in India. Shop Online For Apparels. Huge Collection of Branded Clothes Only at,['L'  'XL'],<div class="item_left_column" id="description"> <h3 class="item_desc_title fk-uppercase">Morph Maternity Women's Maternity Panty         Price: Rs.275</h3> <div class="cls"></div> <div class="item_desc_text line"> <div style="float:right"> </div> <p style="text-align: justify;">   Aiming to provide all those expecting mothers unparalleled comfort during their pregnancy  these <strong>maternity panties</strong> from Morph Maternity are exceptionally crafted from pure cotton to keep you at ease at all times. The elasticated waistband and leg hole see to it that you slip into them without any difficulty.</p> </div> <div style="clear: both;"></div> </div>,<div class="item_left_column" id="specifications"> <h3 class="item_desc_title fk-uppercase">         Specifications of Morph Maternity Women's Maternity Panty    </h3> <table cellspacing="0" class="fk-specs-type2"> <tr> <th class="group-head" colspan="2">General Details<a class="see-more unitExt rmargin10 no-underline" href="javascript:void(0);" onclick="$(this).closest('.fk-specs-type2').toggleClass('expandedMore')" title="Expand">[+]</a><a class="hidden unitExt rmargin10 no-underline" href="javascript:void(0);" onclick="$(this).closest('.fk-specs-type2').toggleClass('expandedMore')" title="Collapse">[-]</a></th> </tr> <tr class="hidden"> <td class="specs-key">Ideal For</td> <td class="specs-value fk-data">Women's</td> </tr> <tr class="hidden"> <td class="specs-key">Occasion</td> <td class="specs-value fk-data">Casual</td> </tr> <tr class="hidden"> <td class="specs-key">Pattern</td> <td class="specs-value fk-data">Solid</td> </tr> </table> <table cellspacing="0" class="fk-specs-type2"> <tr> <th class="group-head" colspan="2">Panty Details</th> </tr> <tr class=""> <td class="specs-key">Type</td> <td class="specs-value fk-data">Maternity</td> </tr> <tr class=""> <td class="specs-key">Fabric</td> <td class="specs-value fk-data">100% Cotton</td> </tr> <tr class=""> <td class="specs-key">Design</td> <td class="specs-value fk-data">Logo Print Below Waistband</td> </tr> </table> <table cellspacing="0" class="fk-specs-type2"> <tr> <th class="group-head" colspan="2">Fabric Care</th> </tr> <tr class=""> <td class="specs-value fk-data" colspan="2">Do Not Bleach  Do Not Iron  Machine Wash at 40째C  Do Not Wring</td> </tr> </table> <table cellspacing="0" class="fk-specs-type2"> <tr> <th class="group-head" colspan="2">Additional Details<a class="see-more unitExt rmargin10 no-underline" href="javascript:void(0);" onclick="$(this).closest('.fk-specs-type2').toggleClass('expandedMore')" title="Expand">[+]</a><a class="hidden unitExt rmargin10 no-underline" href="javascript:void(0);" onclick="$(this).closest('.fk-specs-type2').toggleClass('expandedMore')" title="Collapse">[-]</a></th> </tr> <tr class="hidden"> <td class="specs-key"> </td> <td class="specs-value fk-data">Elasticated Waistband and Leghole</td> </tr> </table> </div>,10:03:2014,None
