15:02:2014,hair-care,Iraya.,Iraya Black Tea & Lime Shampoo,Rs. 345,http://img5a.flixcart.com/image/shampoo/t/v/w/iraya-150-black-tea-lime-shampoo-400x400-imadhhufpdb2myhc.jpeg,(150 ml),Rs. 345,VNV-Enterprises,http://www.flipkart.com/iraya-black-tea-lime-shampoo/p/itmdhkyggs5hrxhb?pid=SMPDHKYEAR8PZTVW&srno=b_1&ref=6dda5d02-99b8-41af-9cb3-abe71ed87745,LSTSMPDHKYEAR8PZTVW6WSBFA,150 ml,<div class="item_left_column" id="description"><h3 class="item_desc_title fk-uppercase">Iraya Black Tea &amp; Lime Shampoo (150 ml)         Price: Rs.345</h3><div class="cls"></div><div class="item_desc_text line"><div style="float:right"></div>                        Iraya Black Tea &amp; Lime Shampoo contains wild lime juice, extracts of black and green tea and olive oil,it is a volumising shampoo that adds bounce and fullness to hair. Black and green tea extracts work as antioxidants, remove toxins and strengthen hair roots. Wild lime deep cleanses and adds gloss and lustre. Directions for use: Apply to wet hair and scalp. Gently massage in for 2 minutes. Wash off. Repeat if necessary. Follow with a Iraya Black Tea &amp; Lime conditioner.        </div><div style="clear: both;"></div></div>,<div class="item_left_column" id="specifications"><h3 class="item_desc_title fk-uppercase">        Specifications of Iraya Black Tea &amp; Lime Shampoo (150 ml)    </h3><table cellspacing="0" class="fk-specs-type2"><tr><th class="group-head" colspan="2">In the Box</th></tr><tr class=""><td class="specs-value fk-data" colspan="2">Shampoo</td></tr></table><table cellspacing="0" class="fk-specs-type2"><tr><th class="group-head" colspan="2">Shampoo Traits</th></tr><tr class=""><td class="specs-key">Applied For</td><td class="specs-value fk-data">Hair Volumnization</td></tr><tr class=""><td class="specs-key">Hair Type</td><td class="specs-value fk-data">All Hair Types</td></tr><tr class=""><td class="specs-key">Organic Type</td><td class="specs-value fk-data">Herbal</td></tr></table><table cellspacing="0" class="fk-specs-type2"><tr><th class="group-head" colspan="2">General Traits</th></tr><tr class=""><td class="specs-key">Brand</td><td class="specs-value fk-data">Iraya</td></tr><tr class=""><td class="specs-key">Quantity</td><td class="specs-value fk-data">150 ml</td></tr><tr class=""><td class="specs-key">Model Name</td><td class="specs-value fk-data">Black Tea &amp; Lime Shampoo</td></tr></table></div>
15:02:2014,hair-care,Iraya.,Iraya Classic Shikakai Shampoo,Rs. 345,http://img5a.flixcart.com/image/shampoo/b/r/f/iraya-150-classic-shikakai-shampoo-400x400-imadhhufek5gswp3.jpeg,(150 ml),Rs. 345,VNV-Enterprises,http://www.flipkart.com/iraya-classic-shikakai-shampoo/p/itmdhkygagdhx9g7?pid=SMPDHKYEHVHGWBRF&srno=b_2&ref=6dda5d02-99b8-41af-9cb3-abe71ed87745,LSTSMPDHKYEHVHGWBRFILUFEJ,150 ml,<div class="item_left_column" id="description"><h3 class="item_desc_title fk-uppercase">Iraya Classic Shikakai Shampoo (150 ml)         Price: Rs.345</h3><div class="cls"></div><div class="item_desc_text line"><div style="float:right"></div>                        A classic formula Shikakai is made with concentrated extracts of the shikakai fruit, rosemary and lime. Ideal for cleansing and reviving all hair types and sensitive scalp, while ensuring that the natural oil balance of the scalp is not disturbed. Regular use promotes strong and healthy hair. Directions for use: Shake the bottle well before use. Apply to wet hair and scalp. Gently massage in for 2 minutes. Wash off. For best results, follow with a suitable Iraya hair conditioner. For excessively dry scalp, apply an Iraya hair oil for 30 minutes before shampooing.        </div><div style="clear: both;"></div></div>,<div class="item_left_column" id="specifications"><h3 class="item_desc_title fk-uppercase">        Specifications of Iraya Classic Shikakai Shampoo (150 ml)    </h3><table cellspacing="0" class="fk-specs-type2"><tr><th class="group-head" colspan="2">In the Box</th></tr><tr class=""><td class="specs-value fk-data" colspan="2">Shampoo</td></tr></table><table cellspacing="0" class="fk-specs-type2"><tr><th class="group-head" colspan="2">Shampoo Traits</th></tr><tr class=""><td class="specs-key">Hair Type</td><td class="specs-value fk-data">All Hair Types</td></tr><tr class=""><td class="specs-key">Organic Type</td><td class="specs-value fk-data">Herbal</td></tr></table><table cellspacing="0" class="fk-specs-type2"><tr><th class="group-head" colspan="2">General Traits</th></tr><tr class=""><td class="specs-key">Brand</td><td class="specs-value fk-data">Iraya</td></tr><tr class=""><td class="specs-key">Quantity</td><td class="specs-value fk-data">150 ml</td></tr><tr class=""><td class="specs-key">Model Name</td><td class="specs-value fk-data">Classic Shikakai Shampoo</td></tr></table></div>
15:02:2014,hair-care,Iraya.,Iraya Neelbhringadi Taila Hair Oil,Rs. 495,http://img5a.flixcart.com/image/hair-oil/6/w/x/iraya-100-neelbhringadi-taila-400x400-imadhm424pcnz8rb.jpeg,(100 ml),Rs. 495,VNV-Enterprises,http://www.flipkart.com/iraya-neelbhringadi-taila-hair-oil/p/itmdhm3wv8fsygxc?pid=HOLDHM3UCZ6TA6WX&srno=b_3&ref=6dda5d02-99b8-41af-9cb3-abe71ed87745,LSTHOLDHM3UCZ6TA6WXAEPKKW,100 ml,<div class="item_left_column" id="description"><h3 class="item_desc_title fk-uppercase">Iraya Neelbhringadi Taila Hair Oil (100 ml)         Price: Rs.495</h3><div class="cls"></div><div class="item_desc_text line"><div style="float:right"></div>                        Recommended in the ancient Ayurveda text - Sahasrayogam, Neelbhringadi is the secret for lush and healthy hair. Iraya Neelbhringadi Oil is made with cold-pressed oils of coconut &amp; sesame that are processed with a carefully selected combination of herbs like indigo, brahmi and bhringraj and coconut milk on a slow, wood-fired iron cauldron to ensure that the full potency of the herbs has been extracted into the oil. Apply it on the scalp regularly to ensure abundant, lustrous, dandruff free, healthy hair. Directions for Use: Massage gently with fingertips into the scalp and leave in for at least an hour or overnight. Apart from nourishing the hair, Neelbhringadi Taila also serves as a relaxant that calms the mind.        </div><div style="clear: both;"></div></div>,<div class="item_left_column" id="specifications"><h3 class="item_desc_title fk-uppercase">        Specifications of Iraya Neelbhringadi Taila Hair Oil (100 ml)    </h3><table cellspacing="0" class="fk-specs-type2"><tr><th class="group-head" colspan="2">In the Box</th></tr><tr class=""><td class="specs-value fk-data" colspan="2">Hair Oil</td></tr></table><table cellspacing="0" class="fk-specs-type2"><tr><th class="group-head" colspan="2">Hair Oil Traits</th></tr><tr class=""><td class="specs-key">Hair Type</td><td class="specs-value fk-data">All Hair Types</td></tr><tr class=""><td class="specs-key">Composition</td><td class="specs-value fk-data">Behada (Terminalia Belerica), Neelikapatti (Indigofera Tinctoria)., Kevda (Pandanus Odoratissimus), Sesame Oil (Sesamum Indicum), Sairayak (Barleria Prionitis), Tagar (Valeriana Wallichii), Arjuna (Terminalia Arjuna), Dalimsal (Punica Granatum), Priyangu (Callicarpa Macrophylla), Black Til (Sesamum Indicum), Kamal (Nelumbium Speciosum), Guduchi (Tinospora Cordifolia), Maka (Eclipta Alba), Vijaysar (Pterocarpus Marsupium), Hirda (Terminalia Chebula), Mandoor (Purified Iron Crust), Aawla (Emblic Myrobalam)</td></tr><tr class=""><td class="specs-key">Applied For</td><td class="specs-value fk-data">Anti-dandruff, Lustre &amp; Shine, Hair Growth</td></tr></table><table cellspacing="0" class="fk-specs-type2"><tr><th class="group-head" colspan="2">General Traits</th></tr><tr class=""><td class="specs-key">Container Type</td><td class="specs-value fk-data">Bottle</td></tr><tr class=""><td class="specs-key">Quantity</td><td class="specs-value fk-data">100 ml</td></tr><tr class=""><td class="specs-key">Organic Type</td><td class="specs-value fk-data">Herbal</td></tr></table></div>
15:02:2014,hair-care,Iraya.,Iraya Arunshikha Nashak Taila for Dandruff Hair Oil,Rs. 495,http://img6a.flixcart.com/image/hair-oil/p/b/9/iraya-100-arunshikha-nashak-taila-for-dandruff-400x400-imadhm42usgtytmj.jpeg,(100 ml),Rs. 495,VNV-Enterprises,http://www.flipkart.com/iraya-arunshikha-nashak-taila-dandruff-hair-oil/p/itmdhm3whr4uhkhp?pid=HOLDHM3UKYWGGPB9&srno=b_4&ref=6dda5d02-99b8-41af-9cb3-abe71ed87745,LSTHOLDHM3UKYWGGPB9TYYCAL,100 ml,<div class="item_left_column" id="description"><h3 class="item_desc_title fk-uppercase">Iraya Arunshikha Nashak Taila for Dandruff Hair Oil (100 ml)         Price: Rs.495</h3><div class="cls"></div><div class="item_desc_text line"><div style="float:right"></div>                        Massaging the scalp with coconut oil is an ancient Ayurvedic tradition, an essential part of haircare. Iraya Arunshikha Nashak Taila consists of Pure Coconut Oil blended with Neem, which is well known for its wide range of benefits. It helps clear dandruff, stops flaking and balances scalp irregularities. Directions for Use: Massage the oil gently into scalp and leave for atleast an hour, overnight for chronic problems, before shampooing.        </div><div style="clear: both;"></div></div>,<div class="item_left_column" id="specifications"><h3 class="item_desc_title fk-uppercase">        Specifications of Iraya Arunshikha Nashak Taila for Dandruff Hair Oil (100 ml)    </h3><table cellspacing="0" class="fk-specs-type2"><tr><th class="group-head" colspan="2">In the Box</th></tr><tr class=""><td class="specs-value fk-data" colspan="2">Hair Oil</td></tr></table><table cellspacing="0" class="fk-specs-type2"><tr><th class="group-head" colspan="2">Hair Oil Traits</th></tr><tr class=""><td class="specs-key">Hair Type</td><td class="specs-value fk-data">All Hair Types</td></tr><tr class=""><td class="specs-key">Composition</td><td class="specs-value fk-data">Lime Oil, Coconut Oil (Cocos Nucifera), Essential Oils Of: Rosemary, Neem Leaves (Azadiractha Indica), Frankincense</td></tr><tr class=""><td class="specs-key">Applied For</td><td class="specs-value fk-data">Anti-dandruff</td></tr></table><table cellspacing="0" class="fk-specs-type2"><tr><th class="group-head" colspan="2">General Traits</th></tr><tr class=""><td class="specs-key">Container Type</td><td class="specs-value fk-data">Bottle</td></tr><tr class=""><td class="specs-key">Quantity</td><td class="specs-value fk-data">100 ml</td></tr><tr class=""><td class="specs-key">Organic Type</td><td class="specs-value fk-data">Herbal</td></tr></table></div>
15:02:2014,hair-care,Iraya.,Iraya Keshavardhak Taila Nourishing Hair Oil,Rs. 495,http://img5a.flixcart.com/image/hair-oil/y/z/s/iraya-100-keshavardhak-taila-nourishing-400x400-imadhm42ahffgahj.jpeg,(100 ml),Rs. 495,VNV-Enterprises,http://www.flipkart.com/iraya-keshavardhak-taila-nourishing-hair-oil/p/itmdhm3wtyty2yyg?pid=HOLDHM3UP5GGPYZS&srno=b_7&ref=6dda5d02-99b8-41af-9cb3-abe71ed87745,LSTHOLDHM3UP5GGPYZSM80G7D,100 ml,<div class="item_left_column" id="description"><h3 class="item_desc_title fk-uppercase">Iraya Keshavardhak Taila Nourishing Hair Oil (100 ml)         Price: Rs.495</h3><div class="cls"></div><div class="item_desc_text line"><div style="float:right"></div>                        A perfect blend of 11 time- tested Ayurvedic herbs, Iraya Keshavardhak Taila nourishes the hair roots and follicles. The synergy of these 11 powerful natural herbs helps to revitalise the scalp and bring essential nutrition to the hair root. Regular use restores the hair's natural vigour and vitality. Directions for Use: Massage gently into the scalp and leave in for at least an hour or overnight.        </div><div style="clear: both;"></div></div>,<div class="item_left_column" id="specifications"><h3 class="item_desc_title fk-uppercase">        Specifications of Iraya Keshavardhak Taila Nourishing Hair Oil (100 ml)    </h3><table cellspacing="0" class="fk-specs-type2"><tr><th class="group-head" colspan="2">In the Box</th></tr><tr class=""><td class="specs-value fk-data" colspan="2">Hair Oil</td></tr></table><table cellspacing="0" class="fk-specs-type2"><tr><th class="group-head" colspan="2">Hair Oil Traits</th></tr><tr class=""><td class="specs-key">Hair Type</td><td class="specs-value fk-data">All Hair Types</td></tr><tr class=""><td class="specs-key">Composition</td><td class="specs-value fk-data">Awala (Phyllanthus Embelica), Gunja (Abrus Precatorius), Clary Sage., Sesame Oil (Sesamum Indicum), Hirda (Terminalia Chebula), Vekhand (Acorus Calamus), Frankincense, Coconut Oil (Cocos Nucifera), Gokharu (Tribulus Terristris), Maka (Eclipta Prostrate), Henna (Lawsonia Inermis), Behada (Terminalia Belerica), Shivanmool (Gmelina Arborea), Essential Oil Of: Neroli</td></tr><tr class=""><td class="specs-key">Applied For</td><td class="specs-value fk-data">Hair Strengthening, Healthy Scalp</td></tr></table><table cellspacing="0" class="fk-specs-type2"><tr><th class="group-head" colspan="2">General Traits</th></tr><tr class=""><td class="specs-key">Container Type</td><td class="specs-value fk-data">Bottle</td></tr><tr class=""><td class="specs-key">Quantity</td><td class="specs-value fk-data">100 ml</td></tr><tr class=""><td class="specs-key">Organic Type</td><td class="specs-value fk-data">Herbal</td></tr></table></div>
15:02:2014,hair-care,Iraya.,Iraya Black Tea & Lime Conditioner,Rs. 395,http://img6a.flixcart.com/image/conditioner/a/d/m/iraya-150-black-tea-lime-conditioner-400x400-imadhhuf2qgmf2ps.jpeg,(150 ml),Rs. 395,VNV-Enterprises,http://www.flipkart.com/iraya-black-tea-lime-conditioner/p/itmdhky7mxz2zp8a?pid=CNDDHKY5HZACVADM&srno=b_5&ref=6dda5d02-99b8-41af-9cb3-abe71ed87745,LSTCNDDHKY5HZACVADM1XEINS,No size defined,<div class="item_left_column" id="description"><h3 class="item_desc_title fk-uppercase">Iraya Black Tea &amp; Lime Conditioner (150 ml)         Price: Rs.395</h3><div class="cls"></div><div class="item_desc_text line"><div style="float:right"></div>                        With the extracts of black tea, green tea and lime juice, this volumising conditioner makes the hair soft, manageable and adds a lustrous shine. Iraya Black Tea &amp; Lime Conditioner restores bounce and fullness. It also improves the texture of the hair. Ideal for hair that feels limp and lifeless. Directions for Use: Apply to moist hair directly after shampooing and leave on for 2 to 5 minutes. Rinse off. Scalp feels more comfortable and hair easier to manage.        </div><div style="clear: both;"></div></div>,<div class="item_left_column" id="specifications"><h3 class="item_desc_title fk-uppercase">        Specifications of Iraya Black Tea &amp; Lime Conditioner (150 ml)    </h3><table cellspacing="0" class="fk-specs-type2"><tr><th class="group-head" colspan="2">In the Box</th></tr><tr class=""><td class="specs-value fk-data" colspan="2">Conditioner</td></tr></table><table cellspacing="0" class="fk-specs-type2"><tr><th class="group-head" colspan="2">Conditioner Traits</th></tr><tr class=""><td class="specs-key">Hair Type</td><td class="specs-value fk-data">All Hair Types, Dry Hair</td></tr><tr class=""><td class="specs-key">Composition</td><td class="specs-value fk-data">Cellulose Gum, Green Tea (Camellia Sinensis), Black Tea (Camellia Sinensis), Aqua, Phenoxyethanol, Fragrance., Carbomer, Vegetable Glycerine, Xanthan Gum, Citrus Grandis</td></tr><tr class=""><td class="specs-key">Applied For</td><td class="specs-value fk-data">Hair Moisturization, Conditioning</td></tr></table><table cellspacing="0" class="fk-specs-type2"><tr><th class="group-head" colspan="2">General Traits</th></tr><tr class=""><td class="specs-key">Brand</td><td class="specs-value fk-data">Iraya</td></tr><tr class=""><td class="specs-key">Container Type</td><td class="specs-value fk-data">Bottle with Dispenser</td></tr><tr class=""><td class="specs-key">Quantity</td><td class="specs-value fk-data">150 ml</td></tr><tr class=""><td class="specs-key">Organic Type</td><td class="specs-value fk-data">Herbal</td></tr><tr class=""><td class="specs-key">Model Name</td><td class="specs-value fk-data">Black Tea &amp; Lime Conditioner</td></tr></table></div>
15:02:2014,hair-care,Iraya.,Iraya Keshavardhak Lepa (Nourishing Scalp-Tonic Pack),Rs. 495,http://img5a.flixcart.com/image/hair-treatment/g/u/h/iraya-50-keshavardhak-lepa-nourishing-scalp-tonic-pack-400x400-imadhhufgynggak6.jpeg,(50 g),Rs. 495,VNV-Enterprises,http://www.flipkart.com/iraya-keshavardhak-lepa-nourishing-scalp-tonic-pack/p/itmdhky7rapdupfy?pid=HTTDHKY5HFVB7GUH&srno=b_6&ref=6dda5d02-99b8-41af-9cb3-abe71ed87745,LSTHTTDHKY5HFVB7GUHPLSD85,No size defined,<div class="item_left_column" id="description"><h3 class="item_desc_title fk-uppercase">Iraya Keshavardhak Lepa (Nourishing Scalp-Tonic Pack) (50 g)         Price: Rs.495</h3><div class="cls"></div><div class="item_desc_text line"><div style="float:right"></div>                        Iraya's Keshavardhak Lepa, an ancient ayurvedic recipe contains 10 powerful herbs for reversing premature hair loss. It is a powerful hair tonic compound that strengthens the hair root and stimulates micro- circulation in the scalp. Helps prevent and stop hairfall. The perfect care for thinning hair and for treating alopecia. Directions for Use: Form a thin paste by mixing it with water and/or some oil (for dry scalp). Part the hair and carefully apply to the entire scalp. For best results, cover your hair with a hot, wet towel and leave on for atleast an hour. Please Note- After the first application, you may notice some hair fall, do not worry these are dead hair follicles that are eliminated as the first part of the treatment.        </div><div style="clear: both;"></div></div>,<div class="item_left_column" id="specifications"><h3 class="item_desc_title fk-uppercase">        Specifications of Iraya Keshavardhak Lepa (Nourishing Scalp-Tonic Pack) (50 g)    </h3><table cellspacing="0" class="fk-specs-type2"><tr><th class="group-head" colspan="2">In the Box</th></tr><tr class=""><td class="specs-key">Package</td><td class="specs-value fk-data">1 Hair Treatment</td></tr></table><table cellspacing="0" class="fk-specs-type2"><tr><th class="group-head" colspan="2">General Traits</th></tr><tr class=""><td class="specs-key">Treatment Type</td><td class="specs-value fk-data">Hair- fall treatment</td></tr><tr class=""><td class="specs-key">Container Type</td><td class="specs-value fk-data">Jar</td></tr><tr class=""><td class="specs-key">Quantity</td><td class="specs-value fk-data">50 g</td></tr></table><table cellspacing="0" class="fk-specs-type2"><tr><th class="group-head" colspan="2">Hair Treatment Details</th></tr><tr class=""><td class="specs-key">Suitable Hair Type</td><td class="specs-value fk-data">All Hair types</td></tr><tr class=""><td class="specs-key">Formula</td><td class="specs-value fk-data">Powder</td></tr><tr class=""><td class="specs-key">Application Area</td><td class="specs-value fk-data">Hair:Scalp</td></tr><tr class=""><td class="specs-key">Application Frequency</td><td class="specs-value fk-data">Daily Usage</td></tr><tr class=""><td class="specs-key">Applied For</td><td class="specs-value fk-data">Prevents Hair fall, Cure alopecia, Stop Hair fall, Strengthens hair root</td></tr><tr class=""><td class="specs-key">Organic Type</td><td class="specs-value fk-data">Herbal</td></tr></table></div>
15:02:2014,hair-care,Iraya.,Iraya Nourishing Hair Masque with 11 herbs,Rs. 795,http://img6a.flixcart.com/image/hair-treatment/r/h/q/iraya-200-nourishing-hair-masque-with-11-herbs-400x400-imadhhufxxfeh5rf.jpeg,(200 g),Rs. 795,VNV-Enterprises,http://www.flipkart.com/iraya-nourishing-hair-masque-11-herbs/p/itmdhky7jryunzkz?pid=HTTDHKY5JHMHURHQ&srno=b_8&ref=6dda5d02-99b8-41af-9cb3-abe71ed87745,no sku defined,No size defined,<div class="item_left_column" id="description"><h3 class="item_desc_title fk-uppercase">Iraya Nourishing Hair Masque with 11 herbs (200 g)         Price: Rs.795</h3><div class="cls"></div><div class="item_desc_text line"><div style="float:right"></div>                        Filled with vitamins and nutrients, Iraya Nourishing Hair Masque is a great recipe for improving shine naturally. It also increases blood circulation to keep your scalp healthy, giving beautiful hair. Enhances the hair's natural vigour &amp; Helps improve texture, lustre, volume and radiance of the hair. Directions for Use: Apply to moist hair directly after shampooing and leave on for 2 to 5 minutes. Rinse off. Scalp feels more comfortable and hair becomes easier to manage.        </div><div style="clear: both;"></div></div>,<div class="item_left_column" id="specifications"><h3 class="item_desc_title fk-uppercase">        Specifications of Iraya Nourishing Hair Masque with 11 herbs (200 g)    </h3><table cellspacing="0" class="fk-specs-type2"><tr><th class="group-head" colspan="2">In the Box</th></tr><tr class=""><td class="specs-key">Package</td><td class="specs-value fk-data">1 Hair Treatment</td></tr></table><table cellspacing="0" class="fk-specs-type2"><tr><th class="group-head" colspan="2">Hair Treatment Details</th></tr><tr class=""><td class="specs-key">Suitable Hair Type</td><td class="specs-value fk-data">All Hair types</td></tr><tr class=""><td class="specs-key">Formula</td><td class="specs-value fk-data">Cream</td></tr><tr class=""><td class="specs-key">Application Area</td><td class="specs-value fk-data">Hair:Scalp</td></tr><tr class=""><td class="specs-key">Application Frequency</td><td class="specs-value fk-data">Daily Usage</td></tr><tr class=""><td class="specs-key">Applied For</td><td class="specs-value fk-data">Healthy Scalp, Enhances the hair?s natural vigour, Helps improve texture, lustre, volume and radiance of hair</td></tr><tr class=""><td class="specs-key">Organic Type</td><td class="specs-value fk-data">Herbal</td></tr></table><table cellspacing="0" class="fk-specs-type2"><tr><th class="group-head" colspan="2">General Traits</th></tr><tr class=""><td class="specs-key">Treatment Type</td><td class="specs-value fk-data">Improves Hair Shine::Improves blood circulation for a healthy scalp</td></tr><tr class=""><td class="specs-key">Container Type</td><td class="specs-value fk-data">Jar</td></tr><tr class=""><td class="specs-key">Quantity</td><td class="specs-value fk-data">200 g</td></tr></table></div>
