15:02:2014,hair-care,RevAyur.,RevAyur Hair Care Basics Intense Nourishing Shampoo,Rs. 45,http://img5a.flixcart.com/image/shampoo/4/b/v/revayur-50-hair-care-basics-intense-nourishing-shampoo-400x400-imadmt3tcjvnnksu.jpeg,(50 ml),Rs. 45,RevAyur,http://www.flipkart.com/revayur-hair-care-basics-intense-nourishing-shampoo/p/itmdmsffgxsskthp?pid=SMPDMSFDRFE824BV&srno=b_1&ref=134ed2cb-c6e9-4412-833d-c6b16c735bb2,LSTSMPDMSFDRFE824BVR5FI9K,50 ml,<div class="item_left_column" id="description"><h3 class="item_desc_title fk-uppercase">RevAyur Hair Care Basics Intense Nourishing Shampoo (50 ml)         Price: Rs.45</h3><div class="cls"></div><div class="item_desc_text line"><div style="float:right"></div>                        RevAyur Hair Care Basics Intense Nourishing Shampoo Offers Gentle cleansing &amp; effective healing benefits to dry &amp; damaged hair. A combination of herbal extracts like Aloevera Juice &amp; Bamboo Extract enhances moisture retention capacity deep within the hair cuticle &amp; strengthens hair. Coconut Oil &amp; Peach Oil provides hair with extra nutrition &amp; nourishment leaving hair soft, supple, healthy &amp; manageable. Perfect remedy for dry &amp; damaged hair. How to Use: Massage gently on wet hair &amp; scalp to build lather. Leave for 1 - 2 minutes. Rinse thoroughly. Repeat if necessary.        </div><div style="clear: both;"></div></div>,<div class="item_left_column" id="specifications"><h3 class="item_desc_title fk-uppercase">        Specifications of RevAyur Hair Care Basics Intense Nourishing Shampoo (50 ml)    </h3><table cellspacing="0" class="fk-specs-type2"><tr><th class="group-head" colspan="2">In the Box</th></tr><tr class=""><td class="specs-value fk-data" colspan="2">Shampoo</td></tr></table><table cellspacing="0" class="fk-specs-type2"><tr><th class="group-head" colspan="2">Shampoo Traits</th></tr><tr class=""><td class="specs-key">Applied For</td><td class="specs-value fk-data">Damage Repair</td></tr><tr class=""><td class="specs-key">Hair Type</td><td class="specs-value fk-data">Dry Hair</td></tr><tr class=""><td class="specs-key">Hair Condition</td><td class="specs-value fk-data">Damaged Hair</td></tr><tr class=""><td class="specs-key">Organic Type</td><td class="specs-value fk-data">Natural</td></tr></table><table cellspacing="0" class="fk-specs-type2"><tr><th class="group-head" colspan="2">General Traits</th></tr><tr class=""><td class="specs-key">Brand</td><td class="specs-value fk-data">RevAyur</td></tr><tr class=""><td class="specs-key">Quantity</td><td class="specs-value fk-data">50 ml</td></tr><tr class=""><td class="specs-key">Model Name</td><td class="specs-value fk-data">Hair Care Basics Intense Nourishing Shampoo</td></tr></table></div>
15:02:2014,hair-care,RevAyur.,RevAyur Insta Shine Non-sticky  Hair Oil,Rs. 105,http://img6a.flixcart.com/image/hair-oil/2/2/5/revayur-100-insta-shine-non-sticky-hair-oil-400x400-imadahqgbhptzu2d.jpeg,(100 ml),Rs. 105,RevAyur,http://www.flipkart.com/revayur-insta-shine-non-sticky-hair-oil/p/itmdagsbtngfgw57?pid=HOLDAGS6CHYHW225&srno=b_2&ref=134ed2cb-c6e9-4412-833d-c6b16c735bb2,LSTHOLDAGS6CHYHW225E0Z9IB,100 ml,None,<div class="item_left_column" id="specifications"><h3 class="item_desc_title fk-uppercase">        Specifications of RevAyur Insta Shine Non-sticky  Hair Oil (100 ml)    </h3><table cellspacing="0" class="fk-specs-type2"><tr><th class="group-head" colspan="2">Hair Oil Traits</th></tr><tr class=""><td class="specs-key">Hair Type</td><td class="specs-value fk-data">Dry Hair</td></tr><tr class=""><td class="specs-key">Composition</td><td class="specs-value fk-data">Almond, Jojoba Oil</td></tr><tr class=""><td class="specs-key">Applied For</td><td class="specs-value fk-data">Hair Strenthening, Lustre &amp; Shine</td></tr><tr class=""><td class="specs-key">Hair Condition</td><td class="specs-value fk-data">Damaged Hair</td></tr></table><table cellspacing="0" class="fk-specs-type2"><tr><th class="group-head" colspan="2">General Traits</th></tr><tr class=""><td class="specs-key">Ideal For</td><td class="specs-value fk-data">Men, Women</td></tr><tr class=""><td class="specs-key">Container Type</td><td class="specs-value fk-data">Bottle</td></tr><tr class=""><td class="specs-key">Quantity</td><td class="specs-value fk-data">100 ml</td></tr><tr class=""><td class="specs-key">Organic</td><td class="specs-value fk-data">Yes</td></tr><tr class=""><td class="specs-key">Organic Type</td><td class="specs-value fk-data">Natural</td></tr></table><table cellspacing="0" class="fk-specs-type2"><tr><th class="group-head" colspan="2">Additional Traits</th></tr><tr class=""><td class="specs-key"> </td><td class="specs-value fk-data">Non-greasy, Nourishes and Strengthens Hair, Improves Manageability, Helps Control Fly Away and Frizz Hair, Gives Instant Shine</td></tr></table></div>
15:02:2014,hair-care,RevAyur.,RevAyur Daily Care  Hair Oil,Rs. 80,http://img6a.flixcart.com/image/hair-oil/4/s/a/revayur-100-daily-care-hair-oil-400x400-imadahqgaegfaghm.jpeg,(100 ml),Rs. 80,RevAyur,http://www.flipkart.com/revayur-daily-care-hair-oil/p/itmdagsby7t2cz3k?pid=HOLDAGS6XYZ2Q4SA&srno=b_3&ref=134ed2cb-c6e9-4412-833d-c6b16c735bb2,LSTHOLDAGS6XYZ2Q4SADDIAFY,100 ml,None,<div class="item_left_column" id="specifications"><h3 class="item_desc_title fk-uppercase">        Specifications of RevAyur Daily Care  Hair Oil (100 ml)    </h3><table cellspacing="0" class="fk-specs-type2"><tr><th class="group-head" colspan="2">Hair Oil Traits</th></tr><tr class=""><td class="specs-key">Composition</td><td class="specs-value fk-data">Amla Oil, Coconut Oil, Vitamin E</td></tr><tr class=""><td class="specs-key">Applied For</td><td class="specs-value fk-data">Healthy Scalp, Hair Strenthening</td></tr></table><table cellspacing="0" class="fk-specs-type2"><tr><th class="group-head" colspan="2">General Traits</th></tr><tr class=""><td class="specs-key">Ideal For</td><td class="specs-value fk-data">Women, Men</td></tr><tr class=""><td class="specs-key">Container Type</td><td class="specs-value fk-data">Bottle</td></tr><tr class=""><td class="specs-key">Quantity</td><td class="specs-value fk-data">100 ml</td></tr><tr class=""><td class="specs-key">Organic</td><td class="specs-value fk-data">Yes</td></tr><tr class=""><td class="specs-key">Organic Type</td><td class="specs-value fk-data">Natural</td></tr></table><table cellspacing="0" class="fk-specs-type2"><tr><th class="group-head" colspan="2">Additional Traits</th></tr><tr class=""><td class="specs-key"> </td><td class="specs-value fk-data">Enriches Hair, Problem Free Scalp, Nourishes Hair</td></tr></table></div>
15:02:2014,hair-care,RevAyur.,RevAyur Hair Care Basics Intense Nourishing,Rs. 55,http://img5a.flixcart.com/image/conditioner/x/s/c/revayur-150-hair-care-basics-intense-nourishing-400x400-imadmkhwspf28qgt.jpeg,(50 ml),Rs. 55,RevAyur,http://www.flipkart.com/revayur-hair-care-basics-intense-nourishing/p/itmdmeveuefqafcm?pid=CNDDMEVCWYYEGMAE&srno=b_4&ref=134ed2cb-c6e9-4412-833d-c6b16c735bb2,LSTCNDDMEVCWYYEGMAEXS9OTQ,No size defined,<div class="item_left_column" id="description"><h3 class="item_desc_title fk-uppercase">RevAyur Hair Care Basics Intense Nourishing (50 ml)         Price: Rs.55</h3><div class="cls"></div><div class="item_desc_text line"><div style="float:right"></div>                        RevAyur Hair Care Basics Intense Nourishing Conditioner Offers, Nourishing &amp; effective healing benefits to dry &amp; damaged hair, Peach Oil &amp; Soya Oil gives intense moisture to revitalize hair, Leaves your hair smooth, tangle free &amp; more manageable, Makes hair light &amp; shiny, helps reduce the formation of split ends &amp; restrain flyaway. How to Use: Apply on hair after Shampooing. Leave for 1 ? 2 minutes. Rinse thoroughly. For best results, use with RevAyur Hair Care Basics Intense Nourishing Shampoo.        </div><div style="clear: both;"></div></div>,<div class="item_left_column" id="specifications"><h3 class="item_desc_title fk-uppercase">        Specifications of RevAyur Hair Care Basics Intense Nourishing (50 ml)    </h3><table cellspacing="0" class="fk-specs-type2"><tr><th class="group-head" colspan="2">In the Box</th></tr><tr class=""><td class="specs-value fk-data" colspan="2">Conditioner</td></tr></table><table cellspacing="0" class="fk-specs-type2"><tr><th class="group-head" colspan="2">Conditioner Traits</th></tr><tr class=""><td class="specs-key">Hair Type</td><td class="specs-value fk-data">Dry Hair, Damaged Hair</td></tr><tr class=""><td class="specs-key">Applied For</td><td class="specs-value fk-data">Dry Hair, Damaged Hair</td></tr><tr class=""><td class="specs-key">Organic Type</td><td class="specs-value fk-data">Natural</td></tr></table><table cellspacing="0" class="fk-specs-type2"><tr><th class="group-head" colspan="2">General Traits</th></tr><tr class=""><td class="specs-key">Brand</td><td class="specs-value fk-data">RevAyur</td></tr><tr class=""><td class="specs-key">Composition</td><td class="specs-value fk-data">Soya Oil, Aloevera Juice, Peach Oil</td></tr><tr class=""><td class="specs-key">Container Type</td><td class="specs-value fk-data">Bottle</td></tr><tr class=""><td class="specs-key">Quantity</td><td class="specs-value fk-data">50 ml</td></tr><tr class=""><td class="specs-key">Model Name</td><td class="specs-value fk-data">Hair Care Basics Intense Nourishing</td></tr></table></div>
15:02:2014,hair-care,RevAyur.,RevAyur Ayurvedic  Hair Oil,Rs. 175,http://img6a.flixcart.com/image/hair-oil/p/v/m/revayur-100-ayurvedic-hair-oil-400x400-imadahqg4agtvfrt.jpeg,(100 ml),Rs. 175,RevAyur,http://www.flipkart.com/revayur-ayurvedic-hair-oil/p/itmdagsbx25nmhgu?pid=HOLDAGS6PGKAHPVM&srno=b_5&ref=134ed2cb-c6e9-4412-833d-c6b16c735bb2,LSTHOLDAGS6PGKAHPVMNGHK04,100 ml,None,<div class="item_left_column" id="specifications"><h3 class="item_desc_title fk-uppercase">        Specifications of RevAyur Ayurvedic  Hair Oil (100 ml)    </h3><table cellspacing="0" class="fk-specs-type2"><tr><th class="group-head" colspan="2">Hair Oil Traits</th></tr><tr class=""><td class="specs-key">Hair Type</td><td class="specs-value fk-data">All Hair Types</td></tr><tr class=""><td class="specs-key">Composition</td><td class="specs-value fk-data">Neem, Amla, Bramhi, Jatamansi, Til Oil</td></tr><tr class=""><td class="specs-key">Applied For</td><td class="specs-value fk-data">Anti-dandruff, Anti-hair Fall, Lustre &amp; Shine, Healthy Scalp</td></tr></table><table cellspacing="0" class="fk-specs-type2"><tr><th class="group-head" colspan="2">General Traits</th></tr><tr class=""><td class="specs-key">Ideal For</td><td class="specs-value fk-data">Men, Women</td></tr><tr class=""><td class="specs-key">Container Type</td><td class="specs-value fk-data">Bottle</td></tr><tr class=""><td class="specs-key">Quantity</td><td class="specs-value fk-data">100 ml</td></tr><tr class=""><td class="specs-key">Organic</td><td class="specs-value fk-data">Yes</td></tr><tr class=""><td class="specs-key">Organic Type</td><td class="specs-value fk-data">Ayurvedic</td></tr></table><table cellspacing="0" class="fk-specs-type2"><tr><th class="group-head" colspan="2">Additional Traits</th></tr><tr class=""><td class="specs-key"> </td><td class="specs-value fk-data">Nourishes Hair Roots, Controls Hair Loss, Relaxes and Soothes Itchy Scalp, Removes Dandruff, Non-greasy</td></tr></table></div>
15:02:2014,hair-care,RevAyur.,RevAyur Hair Care Basics Dandruff Cleansing Shampoo,Rs. 120,http://img6a.flixcart.com/image/shampoo/z/y/y/revayur-150-hair-care-basics-dandruff-cleansing-shampoo-400x400-imadmt3tra9bpfrx.jpeg,(150 ml),Rs. 120,RevAyur,http://www.flipkart.com/revayur-hair-care-basics-dandruff-cleansing-shampoo/p/itmdmsffzuzgbnu3?pid=SMPDMSFDF7W4JZYY&srno=b_7&ref=134ed2cb-c6e9-4412-833d-c6b16c735bb2,LSTSMPDMSFDF7W4JZYYVP8KLY,150 ml,<div class="item_left_column" id="description"><h3 class="item_desc_title fk-uppercase">RevAyur Hair Care Basics Dandruff Cleansing Shampoo (150 ml)         Price: Rs.120</h3><div class="cls"></div><div class="item_desc_text line"><div style="float:right"></div>                        RevAyur Hair Care Basics Dandruff Cleansing Shampoo has the combination of Rosemary Extract &amp; Neem Extract which effectively removes dandruff from scalp &amp; prevents recurrence. This shampoo gives soothing benefit to itchy scalp whereas Aloevera Juice &amp; Coconut Oil provides extract moisture and nourishment to hair. It gently cleanses and improves manageability. This Anti-dandruff Shampoo is suitable for all types of scalps that are prone to dandruff. How to Use: Massage gently on wet hair and scalp to build lather. Leave for 1 - 2 minutes. Rinse thoroughly. Repeat if necessary.        </div><div style="clear: both;"></div></div>,<div class="item_left_column" id="specifications"><h3 class="item_desc_title fk-uppercase">        Specifications of RevAyur Hair Care Basics Dandruff Cleansing Shampoo (150 ml)    </h3><table cellspacing="0" class="fk-specs-type2"><tr><th class="group-head" colspan="2">In the Box</th></tr><tr class=""><td class="specs-value fk-data" colspan="2">Shampoo</td></tr></table><table cellspacing="0" class="fk-specs-type2"><tr><th class="group-head" colspan="2">Shampoo Traits</th></tr><tr class=""><td class="specs-key">Applied For</td><td class="specs-value fk-data">Anti-dandruff</td></tr><tr class=""><td class="specs-key">Hair Type</td><td class="specs-value fk-data">All Hair Types</td></tr><tr class=""><td class="specs-key">Organic Type</td><td class="specs-value fk-data">Natural</td></tr></table><table cellspacing="0" class="fk-specs-type2"><tr><th class="group-head" colspan="2">General Traits</th></tr><tr class=""><td class="specs-key">Brand</td><td class="specs-value fk-data">RevAyur</td></tr><tr class=""><td class="specs-key">Quantity</td><td class="specs-value fk-data">150 ml</td></tr><tr class=""><td class="specs-key">Model Name</td><td class="specs-value fk-data">Hair Care Basics Dandruff Cleansing Shampoo</td></tr></table></div>
15:02:2014,hair-care,RevAyur.,RevAyur Hair Care Basics Deep Cleansing Volumnizing Shampoo,Rs. 45,http://img6a.flixcart.com/image/shampoo/t/b/a/revayur-50-hair-care-basics-deep-cleansing-volumnizing-shampoo-400x400-imadmt3tzu2swgey.jpeg,(50 ml),Rs. 45,RevAyur,http://www.flipkart.com/revayur-hair-care-basics-deep-cleansing-volumnizing-shampoo/p/itmdmsfftjynyvch?pid=SMPDMSFD7CWT7TBA&srno=b_6&ref=134ed2cb-c6e9-4412-833d-c6b16c735bb2,LSTSMPDMSFD7CWT7TBAYGM7JY,50 ml,<div class="item_left_column" id="description"><h3 class="item_desc_title fk-uppercase">RevAyur Hair Care Basics Deep Cleansing Volumnizing Shampoo (50 ml)         Price: Rs.45</h3><div class="cls"></div><div class="item_desc_text line"><div style="float:right"></div>                        A daily shampoo for mild &amp; deep cleansing of hair &amp; scalp which removes excess sebum, grime and prevents rebound. Thoroughly dissolves dirt &amp; impurities of oily scalp &amp; makes instantly hair feel light and voluminous. Apple Extract provides extra nourishment to hair &amp; balances oiliness leaving hair sleeker, suppler, brighter &amp; manageable. This shampoo enhances volume from root to tip of Hair. How to Use: Massage gently on wet hair &amp; scalp to build lather. Leave for 1 - 2 minutes. Rinse thoroughly. Repeat if necessary.        </div><div style="clear: both;"></div></div>,<div class="item_left_column" id="specifications"><h3 class="item_desc_title fk-uppercase">        Specifications of RevAyur Hair Care Basics Deep Cleansing Volumnizing Shampoo (50 ml)    </h3><table cellspacing="0" class="fk-specs-type2"><tr><th class="group-head" colspan="2">In the Box</th></tr><tr class=""><td class="specs-value fk-data" colspan="2">Shampoo</td></tr></table><table cellspacing="0" class="fk-specs-type2"><tr><th class="group-head" colspan="2">Shampoo Traits</th></tr><tr class=""><td class="specs-key">Hair Type</td><td class="specs-value fk-data">All Hair Types</td></tr><tr class=""><td class="specs-key">Organic Type</td><td class="specs-value fk-data">Natural</td></tr></table><table cellspacing="0" class="fk-specs-type2"><tr><th class="group-head" colspan="2">General Traits</th></tr><tr class=""><td class="specs-key">Brand</td><td class="specs-value fk-data">RevAyur</td></tr><tr class=""><td class="specs-key">Quantity</td><td class="specs-value fk-data">50 ml</td></tr><tr class=""><td class="specs-key">Model Name</td><td class="specs-value fk-data">Hair Care Basics Deep Cleansing Volumnizing Shampoo</td></tr></table></div>
15:02:2014,hair-care,RevAyur.,RevAyur Hair Care Basics Volumizing,Rs. 120,http://img6a.flixcart.com/image/conditioner/k/m/4/revayur-150-hair-care-basics-volumizing-400x400-imadmkhw98x37ufg.jpeg,(150 ml),Rs. 120,RevAyur,http://www.flipkart.com/revayur-hair-care-basics-volumizing/p/itmdmeveywca3zn3?pid=CNDDMEVCYGWNCKM4&srno=b_8&ref=134ed2cb-c6e9-4412-833d-c6b16c735bb2,LSTCNDDMEVCYGWNCKM4H98QN7,No size defined,<div class="item_left_column" id="description"><h3 class="item_desc_title fk-uppercase">RevAyur Hair Care Basics Volumizing (150 ml)         Price: Rs.120</h3><div class="cls"></div><div class="item_desc_text line"><div style="float:right"></div>                        Instantly makes hair feel light &amp; voluminous. Aloevera Juice, Apple Extract &amp; Mango Leaf Extract provides extra nutrition, strength and balances oiliness. This conditioner enhances volume, detangles the hair &amp; makes hair soft &amp; shiny.        </div><div style="clear: both;"></div></div>,<div class="item_left_column" id="specifications"><h3 class="item_desc_title fk-uppercase">        Specifications of RevAyur Hair Care Basics Volumizing (150 ml)    </h3><table cellspacing="0" class="fk-specs-type2"><tr><th class="group-head" colspan="2">In the Box</th></tr><tr class=""><td class="specs-value fk-data" colspan="2">Conditioner</td></tr></table><table cellspacing="0" class="fk-specs-type2"><tr><th class="group-head" colspan="2">Conditioner Traits</th></tr><tr class=""><td class="specs-key">Hair Type</td><td class="specs-value fk-data">Oily Hair</td></tr><tr class=""><td class="specs-key">Applied For</td><td class="specs-value fk-data">Nutrition, Voluminizing</td></tr><tr class=""><td class="specs-key">Organic Type</td><td class="specs-value fk-data">Natural</td></tr></table><table cellspacing="0" class="fk-specs-type2"><tr><th class="group-head" colspan="2">General Traits</th></tr><tr class=""><td class="specs-key">Brand</td><td class="specs-value fk-data">RevAyur</td></tr><tr class=""><td class="specs-key">Composition</td><td class="specs-value fk-data">Mango Leaf Extract, Aloevera Juice, Apple Extract</td></tr><tr class=""><td class="specs-key">Container Type</td><td class="specs-value fk-data">Bottle</td></tr><tr class=""><td class="specs-key">Quantity</td><td class="specs-value fk-data">150 ml</td></tr><tr class=""><td class="specs-key">Model Name</td><td class="specs-value fk-data">Hair Care Basics Volumizing</td></tr></table></div>
