15:02:2014,oral-care,Sensodyne.,Sensodyne Pronamel Fresh Breath Anti-Cavity Fluoride Toothpaste,Rs. 2100,http://img6a.flixcart.com/image/toothpaste/2/6/p/sensodyne-120-pronamel-fresh-breath-anti-cavity-fluoride-toothpaste-400x400-imadzd7ntykafdwx.jpeg,(120 g),Rs. 2100,Caart2India,http://www.flipkart.com/sensodyne-pronamel-fresh-breath-anti-cavity-fluoride-toothpaste/p/itmdzdfmqg7nafgf?pid=TPSDZDFAZ5Z8F26P&srno=b_1&ref=5fee727a-e59a-4dbb-9434-b99ab9eb83c6,no sku defined,No size defined,<div class="item_left_column" id="description"><h3 class="item_desc_title fk-uppercase">Sensodyne Pronamel Fresh Breath Anti-Cavity Fluoride Toothpaste (120 g)         Price: Rs.2100</h3><div class="cls"></div><div class="item_desc_text line"><div style="float:right"></div>                        Editorial Review This toothpaste is formulated to help protect against acid erosion. It also contains fluoride providing all the benefit of a regular toothpaste.Helps protect the youthful appearance of teeth Hardens tooth enamel Freshens breath Two 4 oz tubes Stop use and ask a dentist if: The problem persists or worsens. Sensitive teeth may indicate a serious problem that may need prompt care by a dentistPain sensitivity still persists after 4 weeks of use Keep out of reach of children. If more than used for brushing is accidentally swallowed get medical help or contact a Poison Control Center right away.. Active Ingredients:Potassium Nitrate (5%) (Antihypersensitivity) Sodium Fluoride - 0.15 % (Anticavity)Inactive Ingredients:Water Sorbitol Hydrated Silica Glycerin PEG-8 Cocamidopropyl Betaine Flavor Xanthan Gum Sodium Saccharin Titanium Dioxide Sodium Hydroxide Specification Brand : Sensodyne InTheBox : 4 Ounces Title : Sensodyne Pronamel Fresh Breath Anti-Cavity Fluoride Toothpaste 4 Ounces        </div><div style="clear: both;"></div></div>,<div class="item_left_column" id="specifications"><h3 class="item_desc_title fk-uppercase">        Specifications of Sensodyne Pronamel Fresh Breath Anti-Cavity Fluoride Toothpaste (120 g)    </h3><table cellspacing="0" class="fk-specs-type2"><tr><th class="group-head" colspan="2">General</th></tr><tr class=""><td class="specs-key">Type</td><td class="specs-value fk-data">Tooth Paste</td></tr></table></div>
15:02:2014,oral-care,Sensodyne.,Sensodyne Pronamel Daily Protection Toothpaste,Rs. 2100,http://img5a.flixcart.com/image/toothpaste/j/p/x/sensodyne-125-pronamel-daily-protection-toothpaste-400x400-imadzd7nnfzc3yg6.jpeg,(125 g),Rs. 2100,Caart2India,http://www.flipkart.com/sensodyne-pronamel-daily-protection-toothpaste/p/itmdzdfmhbpfdz92?pid=TPSDZDFAYGUPAJPX&srno=b_2&ref=5fee727a-e59a-4dbb-9434-b99ab9eb83c6,no sku defined,No size defined,<div class="item_left_column" id="description"><h3 class="item_desc_title fk-uppercase">Sensodyne Pronamel Daily Protection Toothpaste (125 g)         Price: Rs.2100</h3><div class="cls"></div><div class="item_desc_text line"><div style="float:right"></div>                        Editorial Review 9 out of 10 dentists recommended brand. How Does it Work?: New Pronamel iso-active transforms into a Microfine foam during brushing protecting against the effects of acid erosion by re-hardening your enamel with daily brushing. Does not contain CFC s. Builds increasing protection against painful sensitivity of the teeth to cold heat acids sweets or contact. Aids in the prevention of dental cavities. Features 1) 9 out of 10 dentists recommended brand 2) Sensodyne Specification Binding : Health and Beauty Brand : Sensodyne EAN : 0310158820000 Label : Sensodyne Manufacturer : Sensodyne PackageDimensions_Weight : 0.35 pounds PackageDimensions : L:5.90 X W:1.10 X H:1.10 ProductGroup : Health and Beauty ProductTypeName : HEALTH_PERSONAL_CARE Publisher : Sensodyne Size : 4.3 SKU : 310158820000 Studio : Sensodyne Title : Sensodyne Pronamel Daily Protection Toothpaste -- 4.3 oz        </div><div style="clear: both;"></div></div>,<div class="item_left_column" id="specifications"><h3 class="item_desc_title fk-uppercase">        Specifications of Sensodyne Pronamel Daily Protection Toothpaste (125 g)    </h3><table cellspacing="0" class="fk-specs-type2"><tr><th class="group-head" colspan="2">General</th></tr><tr class=""><td class="specs-key">Type</td><td class="specs-value fk-data">Tooth Paste</td></tr></table></div>
15:02:2014,oral-care,Sensodyne.,Sensodyne Gum Care Toothpaste Daily Protection for Sensitive Teeth,Rs. 2300,http://img6a.flixcart.com/image/toothpaste/z/j/b/sensodyne-100-gum-care-toothpaste-daily-protection-for-sensitive-teeth-400x400-imadzd7nnyrqufap.jpeg,(100 g),Rs. 2300,Caart2India,http://www.flipkart.com/sensodyne-gum-care-toothpaste-daily-protection-sensitive-teeth/p/itmdzdfmq2htzvs2?pid=TPSDZDFAMDCFQZJB&srno=b_3&ref=5fee727a-e59a-4dbb-9434-b99ab9eb83c6,no sku defined,No size defined,<div class="item_left_column" id="description"><h3 class="item_desc_title fk-uppercase">Sensodyne Gum Care Toothpaste Daily Protection for Sensitive Teeth (100 g)         Price: Rs.2300</h3><div class="cls"></div><div class="item_desc_text line"><div style="float:right"></div>                        Editorial Review - sensodyne gum care toothpaste daily protection for sensitive teeth. - Thailand product - 100 g. Features 1) Thailand product 2) sensodyne toothpaste daily protection for sensitive teeth 3) Gum Care 4) New 5) Quality product Specification Binding : Health and Beauty Brand : Sensodyne Label : Thailand Manufacturer : Thailand Model : HS125 ProductGroup : Health and Beauty ProductTypeName : HEALTH_PERSONAL_CARE Publisher : Thailand Studio : Thailand Title : Sensodyne Gum Care Toothpaste Daily Protection for Sensitive Teeth 100 G Thailand Product        </div><div style="clear: both;"></div></div>,<div class="item_left_column" id="specifications"><h3 class="item_desc_title fk-uppercase">        Specifications of Sensodyne Gum Care Toothpaste Daily Protection for Sensitive Teeth (100 g)    </h3><table cellspacing="0" class="fk-specs-type2"><tr><th class="group-head" colspan="2">General</th></tr><tr class=""><td class="specs-key">Type</td><td class="specs-value fk-data">Tooth Paste</td></tr></table></div>
15:02:2014,oral-care,Sensodyne.,Sensodyne Toothpaste for Sensitive Teeth and Cavity Prevention Maximum Strenth 3-Pack,Rs. 3400,http://img6a.flixcart.com/image/toothpaste/p/c/s/sensodyne-120-toothpaste-for-sensitive-teeth-and-cavity-prevention-maximum-strenth-3-pack-400x400-imadzd7njwpq754u.jpeg,(120 g),Rs. 3400,Caart2India,http://www.flipkart.com/sensodyne-toothpaste-sensitive-teeth-cavity-prevention-maximum-strenth-3-pack/p/itmdzdfmny86vvfm?pid=TPSDZDFAZ4UFUPCS&srno=b_4&ref=5fee727a-e59a-4dbb-9434-b99ab9eb83c6,no sku defined,No size defined,<div class="item_left_column" id="description"><h3 class="item_desc_title fk-uppercase">Sensodyne Toothpaste for Sensitive Teeth and Cavity Prevention Maximum Strenth 3-Pack (120 g)         Price: Rs.3400</h3><div class="cls"></div><div class="item_desc_text line"><div style="float:right"></div>                        Editorial Review With Fluoride. Relieves painful sensitivity. Use Sensodyne whenever you brush: It contains Potassium Nitrate clinically proven to reduce painful sensitivity. It has fluoride for cavity protection. Its great taste keeps mouth feeling fresh and clean. It provides fast relief within two weeks. This product contains no sugar. Maximum FDA sensitivity active ingredient. Dentist recommended brand. Dentists have been recommending Sensodyne for over 20 years. Brushing twice a day with Sensodyne build a shield of protection against painful sensitivity. And since Sensodyne has fluoride it helps protect against cavities too. Made in the U.S.A. Features 1) 3 pack - Total Net Wt 19.5 oz 2) Relieves painful sensitivity 3) Maximum strength with fluoride 4) Extra whitening 5) #1 Dentist recommended for brand for sensitive teeth Specification Binding : Health and Beauty Brand : Sensodyne EAN : 0310158084280 Label : Sensodyne Manufacturer : Sensodyne PackageDimensions_Weight : 1.45 pounds PackageDimensions : L:8.40 X W:5.90 X H:1.80 ProductGroup : Health and Beauty ProductTypeName : HEALTH_PERSONAL_CARE Publisher : Sensodyne Size : 6.5 oz (3 Pack) SKU : 08428-3 Studio : Sensodyne Title : Sensodyne Toothpaste for Sensitive Teeth and Cavity Prevention Maximum Strenth 3-Pack        </div><div style="clear: both;"></div></div>,<div class="item_left_column" id="specifications"><h3 class="item_desc_title fk-uppercase">        Specifications of Sensodyne Toothpaste for Sensitive Teeth and Cavity Prevention Maximum Strenth 3-Pack (120 g)    </h3><table cellspacing="0" class="fk-specs-type2"><tr><th class="group-head" colspan="2">General</th></tr><tr class=""><td class="specs-key">Type</td><td class="specs-value fk-data">Tooth Paste</td></tr></table></div>
15:02:2014,oral-care,Sensodyne.,Sensodyne Pronamel Toothpaste 3 Tubes,Rs. 3400,http://img6a.flixcart.com/image/toothpaste/k/5/z/sensodyne-180-pronamel-toothpaste-3-tubes-400x400-imadzd7ny9gewayz.jpeg,(180 g),Rs. 3400,Caart2India,http://www.flipkart.com/sensodyne-pronamel-toothpaste-3-tubes/p/itmdzdfmegppgb9c?pid=TPSDZDFAZY46ZK5Z&srno=b_6&ref=5fee727a-e59a-4dbb-9434-b99ab9eb83c6,no sku defined,No size defined,<div class="item_left_column" id="description"><h3 class="item_desc_title fk-uppercase">Sensodyne Pronamel Toothpaste 3 Tubes (180 g)         Price: Rs.3400</h3><div class="cls"></div><div class="item_desc_text line"><div style="float:right"></div>                        Editorial Review Pronamel Toothpaste 3 ~ 6.5oz Tubes Specification Binding : Health and Beauty Brand : Sensodyne EAN : 0310158830450 Label : Sensodyne Manufacturer : Sensodyne PackageDimensions_Weight : 1.45 pounds PackageDimensions : L:8.30 X W:6.20 X H:1.80 ProductGroup : Health and Beauty ProductTypeName : HEALTH_PERSONAL_CARE Publisher : Sensodyne SKU : BJ-310158830450 Studio : Sensodyne Title : Sensodyne Pronamel Toothpaste 3 ~ 6.5oz Tubes        </div><div style="clear: both;"></div></div>,<div class="item_left_column" id="specifications"><h3 class="item_desc_title fk-uppercase">        Specifications of Sensodyne Pronamel Toothpaste 3 Tubes (180 g)    </h3><table cellspacing="0" class="fk-specs-type2"><tr><th class="group-head" colspan="2">General</th></tr><tr class=""><td class="specs-key">Type</td><td class="specs-value fk-data">Tooth Paste</td></tr></table></div>
15:02:2014,oral-care,Sensodyne.,Sensodyne Reapair and Protect Toothpaste,Rs. 2700,http://img5a.flixcart.com/image/toothpaste/e/n/q/sensodyne-100-reapair-and-protect-toothpaste-400x400-imadzd7nahqfvfnj.jpeg,(100 g),Rs. 2700,Caart2India,http://www.flipkart.com/sensodyne-reapair-protect-toothpaste/p/itmdzdfmmq2grzr3?pid=TPSDZDFAKJUVHENQ&srno=b_5&ref=5fee727a-e59a-4dbb-9434-b99ab9eb83c6,no sku defined,No size defined,<div class="item_left_column" id="description"><h3 class="item_desc_title fk-uppercase">Sensodyne Reapair and Protect Toothpaste (100 g)         Price: Rs.2700</h3><div class="cls"></div><div class="item_desc_text line"><div style="float:right"></div>                        Editorial Review - Sensodyne Reapair and protect toothpaste. - Thailand product - 100 g. Features 1) Thailand product 2) Sensodyne Reapair and protect toothpaste 3) Effective 4) New 5) Quality product Specification Binding : Health and Beauty Brand : Sensodyne Label : Thailand Manufacturer : Thailand Model : HS117 ProductGroup : Health and Beauty ProductTypeName : HEALTH_PERSONAL_CARE Publisher : Thailand Studio : Thailand Title : Sensodyne Reapair and Protect Toothpaste 100 G Thailand Product        </div><div style="clear: both;"></div></div>,<div class="item_left_column" id="specifications"><h3 class="item_desc_title fk-uppercase">        Specifications of Sensodyne Reapair and Protect Toothpaste (100 g)    </h3><table cellspacing="0" class="fk-specs-type2"><tr><th class="group-head" colspan="2">General</th></tr><tr class=""><td class="specs-key">Type</td><td class="specs-value fk-data">Tooth Paste</td></tr></table></div>
15:02:2014,oral-care,Sensodyne.,Sensodyne Pronamel,Rs. 2000,http://img5a.flixcart.com/image/toothpaste/g/8/f/sensodyne-75-pronamel-400x400-imadzd7nvyzyzkqy.jpeg,(75 g),Rs. 2000,Caart2India,http://www.flipkart.com/sensodyne-pronamel/p/itmdzdfmzfycfkyc?pid=TPSDZDFAGDEGAG8F&srno=b_7&ref=5fee727a-e59a-4dbb-9434-b99ab9eb83c6,no sku defined,No size defined,<div class="item_left_column" id="description"><h3 class="item_desc_title fk-uppercase">Sensodyne Pronamel (75 g)         Price: Rs.2000</h3><div class="cls"></div><div class="item_desc_text line"><div style="float:right"></div>                        Editorial Review Sensodyne Toothpaste Pronamel 75ml - Sensodyne Pronamel is a new daily toothpaste which has been specifically designed to help protect teeth from the effects of acid erosion. Features 1) Helps protect against acid erosion. 2) Specially formulated for people with sensitive teeth. Specification Binding : Health and Beauty Brand : Sensodyne EAN : 5000347022999 Label : Sensodyne Manufacturer : Sensodyne Model : 3207859 PackageDimensions_Weight : 0.18 pounds PackageDimensions : L:6.22 X W:1.81 X H:1.50 ProductGroup : Health and Beauty ProductTypeName : HEALTH_PERSONAL_CARE Publisher : Sensodyne Size : 75ml SKU : SE516 Studio : Sensodyne Title : Sensodyne Toothpaste Pronamel 75ml        </div><div style="clear: both;"></div></div>,<div class="item_left_column" id="specifications"><h3 class="item_desc_title fk-uppercase">        Specifications of Sensodyne Pronamel (75 g)    </h3><table cellspacing="0" class="fk-specs-type2"><tr><th class="group-head" colspan="2">General</th></tr><tr class=""><td class="specs-key">Type</td><td class="specs-value fk-data">Tooth Paste</td></tr></table></div>
