LSTWATD9H77YQR4QQRJMVDDTN,Oxbow Analog Watch  - For Women,http://www.flipkart.com/watches/women?otracker=hp_nmenu_sub_women_1_Watches,Rs. 3355,Watches,Watches,Oxbow,http://img6a.flixcart.com/image/watch/q/r/j/4521702-oxbow-400x400-imadrrz2f8573d8y.jpeg,Rs. 8390,None,women,http://www.flipkart.com/oxbow-analog-watch-women/p/itmd9gjgch8fezvr?pid=WATD9H77YQR4QQRJ&srno=b_5&ref=76e3e2a3-c882-43d2-a762-ff5f80c5d4df,WS Retail,Oxbow Analog Watch - For Women - Buy Oxbow Analog Watch - For Women 4521702 Online at Best Prices in India | Flipkart.com,Oxbow Analog Watch - For Women - Buy Oxbow Analog Watch - For Women 4521702 Online at Rs.3355 in India Only at Flipkart.com. Contemporary Dial, Silver Strap, Water Resistant - Great Discounts, Only Genuine Products, 30,[],<div class="item_left_column" id="description"> <h3 class="item_desc_title fk-uppercase">Oxbow Analog Watch  - For Women (Silver)         Price: Rs.3355</h3> <div class="cls"></div> <div class="item_desc_text line"> <div style="float:right"> </div> <h3><b> Key Features </b></h3> <div class="line bmargin10"> <ul class="feature_bullet"> <li><span>Contemporary Dial</span></li><li><span>Silver Strap</span></li><li><span>Water Resistant</span></li> </ul> </div> <p style="text-align: justify;">   Oxbow boasts of a wide variety of watches that suit all your requirements and keep you simple yet stylish. Equipped with an assortment of features and functions, this <strong>Oxbow Analog Watch for women</strong> is built to make heads turn and grab attention as it stays wrapped around your wrist with panache, courtesy of the attractive colour. The <strong>classic time wear</strong> from Oxbow attracts your attention with its voguish design and technological finesse. The Oxbow ladies’ watch uses the piezoelectric effect of high-quality <strong>Quartz crystals</strong> and delivers accurate and reliable timekeeping.</p> <p style="text-align: justify;"> <strong>Body and Design</strong></p> <p style="text-align: justify;">   Oxbow watches are reputed for their innovative style and out-of-the-box craftsmanship and this beautiful timepiece is no exception. A dazzling time wear, the <strong>Oxbow women’s analog wristwatch</strong> boasts of the presence of bold index hour markers on the dial that will win you a lot of admiring glances at a weekend party at your friend’s house. The elegance of the watch face is expressed in the <strong>contemporary dial </strong>of the Oxbow watch, which is designed in tranquil hues.</p> <p style="text-align: justify;">   The delicate dial is covered by a layer of <strong>mineral glass</strong>, which makes this beautiful timepiece resistant against scratches. The brilliant optical clarity of the glass allows the wearer to read time in the <strong>analog wristwatch for women</strong> without hassles.</p> <p style="text-align: justify;">   The <strong>Oxbow analog wristwatch for women</strong> is an epitome of feminine splendour, the presence of an intricately-designed strap being another reason for its attractive appeal. Thanks to the floral designs adorning the <strong>bracelet-type strap</strong>, the watch justifies the tag of an exquisite fashion accessory. The watch <strong>strap is made of metal</strong>, which keeps the timepiece durable against wear and tear. The polished appearance of the strap makes the watch a comfy wear with an attractive appeal.</p> <p style="text-align: justify;"> <strong>Functions and Other Features</strong></p> <p style="text-align: justify;">   Thanks to the wonderful functionalities of the trendy time wear, you can now have your share of fun. Enjoy cool water rides with friends at an amusement park without any worries of damaging your watch; the women’s analog watch from Oxbow is <strong>water-resistant up to a depth of a whopping 30 m</strong>. The exquisite analog wristwatch from Oxbow is a must buy for every woman who craves for a timepiece that has style, technology, elegance, reliability, accuracy and perfection.</p> </div> <div style="clear: both;"></div> </div>,<div class="item_left_column" id="specifications"> <h3 class="item_desc_title fk-uppercase">         Specifications of Oxbow Analog Watch  - For Women (Silver)    </h3> <table cellspacing="0" class="fk-specs-type2"> <tr> <th class="group-head" colspan="2">General</th> </tr> <tr class=""> <td class="specs-key">Type</td> <td class="specs-value fk-data">Analog</td> </tr> <tr class=""> <td class="specs-key">Ideal For</td> <td class="specs-value fk-data">Women</td> </tr> <tr class=""> <td class="specs-key">Occasion</td> <td class="specs-value fk-data">Fashion</td> </tr> <tr class=""> <td class="specs-key">Mechanism</td> <td class="specs-value fk-data">Quartz</td> </tr> <tr class=""> <td class="specs-key">Style Code</td> <td class="specs-value fk-data">4521702</td> </tr> </table> <table cellspacing="0" class="fk-specs-type2"> <tr> <th class="group-head" colspan="2">Body Features</th> </tr> <tr class=""> <td class="specs-key">Strap Material</td> <td class="specs-value fk-data">Metal Strap</td> </tr> <tr class=""> <td class="specs-key">Strap Color</td> <td class="specs-value fk-data">Silver</td> </tr> <tr class=""> <td class="specs-key">Strap Type</td> <td class="specs-value fk-data">Bracelet</td> </tr> <tr class=""> <td class="specs-key">Dial Color</td> <td class="specs-value fk-data">White</td> </tr> <tr class=""> <td class="specs-key">Dial Shape</td> <td class="specs-value fk-data">Contemporary</td> </tr> <tr class=""> <td class="specs-key">Water Resistant</td> <td class="specs-value fk-data">Yes</td> </tr> <tr class=""> <td class="specs-key">Water Resistance Depth</td> <td class="specs-value fk-data">30 m</td> </tr> <tr class=""> <td class="specs-key">Other Body Features</td> <td class="specs-value fk-data">Mineral Glass</td> </tr> </table> <table cellspacing="0" class="fk-specs-type2"> <tr> <th class="group-head" colspan="2">Warranty</th> </tr> <tr class=""> <td class="specs-key"> </td> <td class="specs-value fk-data">2 Years Domestic Warranty</td> </tr> </table> </div>,10:03:2014,None
LSTWATD9H77JBGCFWUZ8Q5MGJ,Oxbow Analog Watch  - For Women,http://www.flipkart.com/watches/women?otracker=hp_nmenu_sub_women_1_Watches,Rs. 3690,Watches,Watches,Oxbow,http://img5a.flixcart.com/image/watch/w/u/z/4530402-oxbow-400x400-imadrrzfkgky2gyg.jpeg,Rs. 9230,None,women,http://www.flipkart.com/oxbow-analog-watch-women/p/itmd9gjgxxsrrrhd?pid=WATD9H77JBGCFWUZ&srno=b_2&ref=da84f269-2b70-4614-9fdc-6fe5b8fd394e,WS Retail,Oxbow Analog Watch - For Women - Buy Oxbow Analog Watch - For Women 4530402 Online at Best Prices in India | Flipkart.com,Oxbow Analog Watch - For Women - Buy Oxbow Analog Watch - For Women 4530402 Online at Rs.3690 in India Only at Flipkart.com. Rectangular Dial, Silver Strap, Water Resistant - Great Discounts, Only Genuine Products, 30,[],<div class="item_left_column" id="description"> <h3 class="item_desc_title fk-uppercase">Oxbow Analog Watch  - For Women (Silver)         Price: Rs.3690</h3> <div class="cls"></div> <div class="item_desc_text line"> <div style="float:right"> </div> <h3><b> Key Features </b></h3> <div class="line bmargin10"> <ul class="feature_bullet"> <li><span>Rectangular Dial</span></li><li><span>Silver Strap</span></li><li><span>Water Resistant</span></li> </ul> </div> <p style="text-align: justify;">   Oxbow boasts of a wide range of watches that suits all your requirements and keeps you simple yet stylish. Equipped with an assortment of features and functions, this <strong>Oxbow Analog Watch for women</strong> is built to make heads turn and grab attention as it stays wrapped around your wrist with panache, courtesy of the attractive colour. The <strong>fashionable time wear</strong> from Oxbow attracts your attention with its voguish design and technological finesse. The Oxbow ladies’ watch uses the piezoelectric effect of high-quality<strong> quartz crystals</strong> and delivers accurate and reliable timekeeping.</p> <p style="text-align: justify;"> <strong style="text-align: justify;">Body and Design</strong></p> <p style="text-align: justify;">   Oxbow watches are reputed for their innovative style and out-of-the-box craftsmanship and this beautiful timepiece is no exception. A dazzling time wear, the <strong>Oxbow women’s analog wristwatch </strong>boasts of the presence of bold index hour markers on the dial that will win you a lot of admiring glances at a weekend party at your friend’s house. The elegance of the watch face is expressed in the <strong>rectangular dial </strong>of the Oxbow watch, which is designed in tranquil hues.</p> <p style="text-align: justify;">   The delicate dial is covered by a layer of <strong style="text-align: justify;">mineral crystal glass</strong>, which makes the beautiful timepiece resistant against scratches. The brilliant optical clarity of the glass allows the wearer to read time on the watch without hassles.</p> <p style="text-align: justify;">   The <strong>Oxbow analog wristwatch for women</strong> is an epitome of feminine splendour, the presence of an intricately-designed strap being another reason for its attractive appeal. Thanks to the floral designs adorning the strap, the watch justifies the tag of an exquisite fashion accessory. The watch <strong>strap is made of steel</strong>, which keeps the timepiece durable against wear and tear. The polished appearance of the strap makes the watch a comfy wear with an attractive appeal.</p> <p style="text-align: justify;"> <strong style="text-align: justify;">Functions and Other Features</strong></p> <p style="text-align: justify;">   Enjoy cool water rides with friends at an amusement park without any worries of damaging your watch; the women’s analog watch from Oxbow is <strong>water-resistant</strong>. The exquisite analog wristwatch from Oxbow is a must buy for every woman who craves for a timepiece that has style, technology, elegance, reliability, accuracy and perfection.</p> </div> <div style="clear: both;"></div> </div>,<div class="item_left_column" id="specifications"> <h3 class="item_desc_title fk-uppercase">         Specifications of Oxbow Analog Watch  - For Women (Silver)    </h3> <table cellspacing="0" class="fk-specs-type2"> <tr> <th class="group-head" colspan="2">General</th> </tr> <tr class=""> <td class="specs-key">Type</td> <td class="specs-value fk-data">Analog</td> </tr> <tr class=""> <td class="specs-key">Ideal For</td> <td class="specs-value fk-data">Women</td> </tr> <tr class=""> <td class="specs-key">Occasion</td> <td class="specs-value fk-data">Fashion</td> </tr> <tr class=""> <td class="specs-key">Mechanism</td> <td class="specs-value fk-data">Quartz</td> </tr> <tr class=""> <td class="specs-key">Style Code</td> <td class="specs-value fk-data">4530402</td> </tr> </table> <table cellspacing="0" class="fk-specs-type2"> <tr> <th class="group-head" colspan="2">Body Features</th> </tr> <tr class=""> <td class="specs-key">Strap Material</td> <td class="specs-value fk-data">Steel Strap</td> </tr> <tr class=""> <td class="specs-key">Strap Color</td> <td class="specs-value fk-data">Silver</td> </tr> <tr class=""> <td class="specs-key">Dial Color</td> <td class="specs-value fk-data">Black</td> </tr> <tr class=""> <td class="specs-key">Dial Shape</td> <td class="specs-value fk-data">Rectangle</td> </tr> <tr class=""> <td class="specs-key">Water Resistant</td> <td class="specs-value fk-data">Yes</td> </tr> <tr class=""> <td class="specs-key">Other Body Features</td> <td class="specs-value fk-data">Mineral Crystal</td> </tr> </table> <table cellspacing="0" class="fk-specs-type2"> <tr> <th class="group-head" colspan="2">Warranty</th> </tr> <tr class=""> <td class="specs-key"> </td> <td class="specs-value fk-data">2 Years Domestic Warranty</td> </tr> </table> </div>,10:03:2014,None
LSTWATD9H77KCTAJFH2OLVP6O,Oxbow Analog Watch  - For Women,http://www.flipkart.com/watches/women?otracker=hp_nmenu_sub_women_1_Watches,Rs. 2345,Watches,Watches,Oxbow,http://img5a.flixcart.com/image/watch/f/h/2/4515901-oxbow-400x400-imadrrz2meugz3hz.jpeg,Rs. 5870,None,women,http://www.flipkart.com/oxbow-analog-watch-women/p/itmd9gjhdseghfgc?pid=WATD9H77KCTAJFH2&srno=b_3&ref=76e3e2a3-c882-43d2-a762-ff5f80c5d4df,WS Retail,Oxbow Analog Watch - For Women - Buy Oxbow Analog Watch - For Women 4515901 Online at Best Prices in India | Flipkart.com,Oxbow Analog Watch - For Women - Buy Oxbow Analog Watch - For Women 4515901 Online at Rs.2345 in India Only at Flipkart.com. Rectangular Dial, Black Strap, Resin Case, Water Resistant - Great Discounts, Only Genuine,[],<div class="item_left_column" id="description"> <h3 class="item_desc_title fk-uppercase">                 Key Features of Oxbow Analog Watch  - For Women (Black)            </h3> <div class="cls"></div> <div class="item_desc_text"> <ul class="fk-key-features"> <li>Rectangular Dial</li><li>Black Strap</li><li>Resin Case</li><li>Water Resistant</li> </ul> </div> <div style="clear: both;"></div> </div>,<div class="item_left_column" id="specifications"> <h3 class="item_desc_title fk-uppercase">         Specifications of Oxbow Analog Watch  - For Women (Black)    </h3> <table cellspacing="0" class="fk-specs-type2"> <tr> <th class="group-head" colspan="2">General</th> </tr> <tr class=""> <td class="specs-key">Type</td> <td class="specs-value fk-data">Analog</td> </tr> <tr class=""> <td class="specs-key">Ideal For</td> <td class="specs-value fk-data">Women</td> </tr> <tr class=""> <td class="specs-key">Occasion</td> <td class="specs-value fk-data">Fashion</td> </tr> <tr class=""> <td class="specs-key">Mechanism</td> <td class="specs-value fk-data">Quartz</td> </tr> <tr class=""> <td class="specs-key">Style Code</td> <td class="specs-value fk-data">4515901</td> </tr> </table> <table cellspacing="0" class="fk-specs-type2"> <tr> <th class="group-head" colspan="2">Body Features</th> </tr> <tr class=""> <td class="specs-key">Strap Material</td> <td class="specs-value fk-data">Plastic Strap</td> </tr> <tr class=""> <td class="specs-key">Strap Color</td> <td class="specs-value fk-data">Black</td> </tr> <tr class=""> <td class="specs-key">Case / Bezel Material</td> <td class="specs-value fk-data">Resin Case</td> </tr> <tr class=""> <td class="specs-key">Dial Color</td> <td class="specs-value fk-data">Grey</td> </tr> <tr class=""> <td class="specs-key">Dial Shape</td> <td class="specs-value fk-data">Rectangle</td> </tr> <tr class=""> <td class="specs-key">Water Resistant</td> <td class="specs-value fk-data">Yes</td> </tr> <tr class=""> <td class="specs-key">Water Resistance Depth</td> <td class="specs-value fk-data">50 m</td> </tr> <tr class=""> <td class="specs-key">Other Body Features</td> <td class="specs-value fk-data">Mineral Glass</td> </tr> </table> <table cellspacing="0" class="fk-specs-type2"> <tr> <th class="group-head" colspan="2">Functions</th> </tr> <tr class=""> <td class="specs-key">Calendar</td> <td class="specs-value fk-data">Yes</td> </tr> </table> <table cellspacing="0" class="fk-specs-type2"> <tr> <th class="group-head" colspan="2">Warranty</th> </tr> <tr class=""> <td class="specs-key"> </td> <td class="specs-value fk-data">2 Years Domestic Warranty</td> </tr> </table> </div>,10:03:2014,None
LSTWATD9H77JBGCFWUZ8Q5MGJ,Oxbow Analog Watch  - For Women,http://www.flipkart.com/watches/women?otracker=hp_nmenu_sub_women_1_Watches,Rs. 3690,Watches,Watches,Oxbow,http://img5a.flixcart.com/image/watch/w/u/z/4530402-oxbow-400x400-imadrrzfkgky2gyg.jpeg,Rs. 9230,None,women,http://www.flipkart.com/oxbow-analog-watch-women/p/itmd9gjgxxsrrrhd?pid=WATD9H77JBGCFWUZ&srno=b_2&ref=da84f269-2b70-4614-9fdc-6fe5b8fd394e,WS Retail,Oxbow Analog Watch - For Women - Buy Oxbow Analog Watch - For Women 4530402 Online at Best Prices in India | Flipkart.com,Oxbow Analog Watch - For Women - Buy Oxbow Analog Watch - For Women 4530402 Online at Rs.3690 in India Only at Flipkart.com. Rectangular Dial, Silver Strap, Water Resistant - Great Discounts, Only Genuine Products, 30,[],<div class="item_left_column" id="description"> <h3 class="item_desc_title fk-uppercase">Oxbow Analog Watch  - For Women (Silver)         Price: Rs.3690</h3> <div class="cls"></div> <div class="item_desc_text line"> <div style="float:right"> </div> <h3><b> Key Features </b></h3> <div class="line bmargin10"> <ul class="feature_bullet"> <li><span>Rectangular Dial</span></li><li><span>Silver Strap</span></li><li><span>Water Resistant</span></li> </ul> </div> <p style="text-align: justify;">   Oxbow boasts of a wide range of watches that suits all your requirements and keeps you simple yet stylish. Equipped with an assortment of features and functions, this <strong>Oxbow Analog Watch for women</strong> is built to make heads turn and grab attention as it stays wrapped around your wrist with panache, courtesy of the attractive colour. The <strong>fashionable time wear</strong> from Oxbow attracts your attention with its voguish design and technological finesse. The Oxbow ladies’ watch uses the piezoelectric effect of high-quality<strong> quartz crystals</strong> and delivers accurate and reliable timekeeping.</p> <p style="text-align: justify;"> <strong style="text-align: justify;">Body and Design</strong></p> <p style="text-align: justify;">   Oxbow watches are reputed for their innovative style and out-of-the-box craftsmanship and this beautiful timepiece is no exception. A dazzling time wear, the <strong>Oxbow women’s analog wristwatch </strong>boasts of the presence of bold index hour markers on the dial that will win you a lot of admiring glances at a weekend party at your friend’s house. The elegance of the watch face is expressed in the <strong>rectangular dial </strong>of the Oxbow watch, which is designed in tranquil hues.</p> <p style="text-align: justify;">   The delicate dial is covered by a layer of <strong style="text-align: justify;">mineral crystal glass</strong>, which makes the beautiful timepiece resistant against scratches. The brilliant optical clarity of the glass allows the wearer to read time on the watch without hassles.</p> <p style="text-align: justify;">   The <strong>Oxbow analog wristwatch for women</strong> is an epitome of feminine splendour, the presence of an intricately-designed strap being another reason for its attractive appeal. Thanks to the floral designs adorning the strap, the watch justifies the tag of an exquisite fashion accessory. The watch <strong>strap is made of steel</strong>, which keeps the timepiece durable against wear and tear. The polished appearance of the strap makes the watch a comfy wear with an attractive appeal.</p> <p style="text-align: justify;"> <strong style="text-align: justify;">Functions and Other Features</strong></p> <p style="text-align: justify;">   Enjoy cool water rides with friends at an amusement park without any worries of damaging your watch; the women’s analog watch from Oxbow is <strong>water-resistant</strong>. The exquisite analog wristwatch from Oxbow is a must buy for every woman who craves for a timepiece that has style, technology, elegance, reliability, accuracy and perfection.</p> </div> <div style="clear: both;"></div> </div>,<div class="item_left_column" id="specifications"> <h3 class="item_desc_title fk-uppercase">         Specifications of Oxbow Analog Watch  - For Women (Silver)    </h3> <table cellspacing="0" class="fk-specs-type2"> <tr> <th class="group-head" colspan="2">General</th> </tr> <tr class=""> <td class="specs-key">Type</td> <td class="specs-value fk-data">Analog</td> </tr> <tr class=""> <td class="specs-key">Ideal For</td> <td class="specs-value fk-data">Women</td> </tr> <tr class=""> <td class="specs-key">Occasion</td> <td class="specs-value fk-data">Fashion</td> </tr> <tr class=""> <td class="specs-key">Mechanism</td> <td class="specs-value fk-data">Quartz</td> </tr> <tr class=""> <td class="specs-key">Style Code</td> <td class="specs-value fk-data">4530402</td> </tr> </table> <table cellspacing="0" class="fk-specs-type2"> <tr> <th class="group-head" colspan="2">Body Features</th> </tr> <tr class=""> <td class="specs-key">Strap Material</td> <td class="specs-value fk-data">Steel Strap</td> </tr> <tr class=""> <td class="specs-key">Strap Color</td> <td class="specs-value fk-data">Silver</td> </tr> <tr class=""> <td class="specs-key">Dial Color</td> <td class="specs-value fk-data">Black</td> </tr> <tr class=""> <td class="specs-key">Dial Shape</td> <td class="specs-value fk-data">Rectangle</td> </tr> <tr class=""> <td class="specs-key">Water Resistant</td> <td class="specs-value fk-data">Yes</td> </tr> <tr class=""> <td class="specs-key">Other Body Features</td> <td class="specs-value fk-data">Mineral Crystal</td> </tr> </table> <table cellspacing="0" class="fk-specs-type2"> <tr> <th class="group-head" colspan="2">Warranty</th> </tr> <tr class=""> <td class="specs-key"> </td> <td class="specs-value fk-data">2 Years Domestic Warranty</td> </tr> </table> </div>,10:03:2014,None
LSTWATD9H77G5UZYKRWAD3URQ,Oxbow Analog Watch  - For Women,http://www.flipkart.com/watches/women?otracker=hp_nmenu_sub_women_1_Watches,Rs. 2010,Watches,Watches,Oxbow,http://img6a.flixcart.com/image/watch/k/r/w/4526405-oxbow-400x400-imad9gnbfrgdf8na.jpeg,Rs. 5030,None,women,http://www.flipkart.com/oxbow-analog-watch-women/p/itmd9gjgzdtnjjtz?pid=WATD9H77G5UZYKRW&srno=b_2&ref=76e3e2a3-c882-43d2-a762-ff5f80c5d4df,WS Retail,Oxbow Analog Watch - For Women - Buy Oxbow Analog Watch - For Women 4526405 Online at Best Prices in India | Flipkart.com,Oxbow Analog Watch - For Women - Buy Oxbow Analog Watch - For Women 4526405 Online at Rs.2010 in India Only at Flipkart.com. Round Dial, Violet Strap, Plastic Case, Water Resistant, Buckle Clasp - Great Discounts, Only,[],<div class="item_left_column" id="description"> <h3 class="item_desc_title fk-uppercase">                 Key Features of Oxbow Analog Watch  - For Women (Violet)            </h3> <div class="cls"></div> <div class="item_desc_text"> <ul class="fk-key-features"> <li>Round Dial</li><li>Violet Strap</li><li>Plastic Case</li><li>Water Resistant</li><li>Buckle Clasp</li> </ul> </div> <div style="clear: both;"></div> </div>,<div class="item_left_column" id="specifications"> <h3 class="item_desc_title fk-uppercase">         Specifications of Oxbow Analog Watch  - For Women (Violet)    </h3> <table cellspacing="0" class="fk-specs-type2"> <tr> <th class="group-head" colspan="2">General</th> </tr> <tr class=""> <td class="specs-key">Type</td> <td class="specs-value fk-data">Analog</td> </tr> <tr class=""> <td class="specs-key">Ideal For</td> <td class="specs-value fk-data">Women</td> </tr> <tr class=""> <td class="specs-key">Occasion</td> <td class="specs-value fk-data">Fashion</td> </tr> <tr class=""> <td class="specs-key">Mechanism</td> <td class="specs-value fk-data">Quartz</td> </tr> <tr class=""> <td class="specs-key">Style Code</td> <td class="specs-value fk-data">4526405</td> </tr> </table> <table cellspacing="0" class="fk-specs-type2"> <tr> <th class="group-head" colspan="2">Body Features</th> </tr> <tr class=""> <td class="specs-key">Strap Material</td> <td class="specs-value fk-data">Polyurethane Strap</td> </tr> <tr class=""> <td class="specs-key">Strap Color</td> <td class="specs-value fk-data">Violet</td> </tr> <tr class=""> <td class="specs-key">Case / Bezel Material</td> <td class="specs-value fk-data">Plastic Case</td> </tr> <tr class=""> <td class="specs-key">Dial Color</td> <td class="specs-value fk-data">Violet</td> </tr> <tr class=""> <td class="specs-key">Dial Shape</td> <td class="specs-value fk-data">Round</td> </tr> <tr class=""> <td class="specs-key">Clasp Type</td> <td class="specs-value fk-data">Buckle</td> </tr> <tr class=""> <td class="specs-key">Water Resistant</td> <td class="specs-value fk-data">Yes</td> </tr> <tr class=""> <td class="specs-key">Water Resistance Depth</td> <td class="specs-value fk-data">30 m</td> </tr> <tr class=""> <td class="specs-key">Other Body Features</td> <td class="specs-value fk-data">Mineral Crystal</td> </tr> </table> <table cellspacing="0" class="fk-specs-type2"> <tr> <th class="group-head" colspan="2">Warranty</th> </tr> <tr class=""> <td class="specs-key"> </td> <td class="specs-value fk-data">2 Years Domestic Warranty</td> </tr> </table> </div>,10:03:2014,None
