{'sku': [], 'seller': [], 'title': [], 'colour': [], 'sp': [], 'mrp': [], 'titleimg': [u'http://img5a.flixcart.com/image/crib-cradle/9/z/q/o24-new-natraj-cradle-star-swing-400x400-imadm5rqgjg3yynz.jpeg'], 'catname': ['furniture-decoration'], 'brandname': ['Infanto.'], 'date': ['18:02:2014'], 'itemlink': ['http://www.flipkart.com/infanto-star-swing/p/itmdq2bgmtrpmge6?pid=CCDDM5RJZZ2FR9ZQ&srno=b_3&ref=aa3c957c-1611-4149-8855-1feb459ba19b'], 'desc': [u'<div class="item_left_column" id="description">\n            <h3 class="item_desc_title fk-uppercase">\n                Key Features of Infanto Star Swing            </h3>\n            <div class="cls"></div>\n            <div class="item_desc_text">\n                <ul class="fk-key-features"><li>Safety and Comfort While Sleeping</li>                </ul></div>\n            <div style="clear: both;"></div>\n        </div>'], 'spec': [u'<div id="specifications" class="item_left_column">\n    <h3 class="item_desc_title fk-uppercase">\n        Specifications of Infanto Star Swing    </h3>\n\n            <table cellspacing="0" class="fk-specs-type2"><tr><th class="group-head" colspan="2">General</th>\n            </tr><tr class=""><td class="specs-key">Type</td>\n                                        <td class="specs-value fk-data">Cradle</td>\n                </tr><tr class=""><td class="specs-key">Ideal For</td>\n                                        <td class="specs-value fk-data">Girls, Boys</td>\n                </tr><tr class=""><td class="specs-key">Age Group</td>\n                                        <td class="specs-value fk-data">0 - 15 Months</td>\n                </tr><tr class=""><td class="specs-key">Foldable</td>\n                                        <td class="specs-value fk-data">Yes</td>\n                </tr></table><table cellspacing="0" class="fk-specs-type2"><tr><th class="group-head" colspan="2">Body Features</th>\n            </tr><tr class=""><td class="specs-key">Matress</td>\n                                        <td class="specs-value fk-data">Yes</td>\n                </tr><tr class=""><td class="specs-key">Other Body Features</td>\n                                        <td class="specs-value fk-data">Suspension and Safety Design, Deluxe Swing Cum Cradle with Detachable Structure</td>\n                </tr></table><table cellspacing="0" class="fk-specs-type2"><tr><th class="group-head" colspan="2">Additional Features</th>\n            </tr><tr class=""><td class="specs-key">Other Features</td>\n                                        <td class="specs-value fk-data">Safety and Comfort to the Child while Sleeping, Comfortable Mattress, Waterproof Material, Well Ventilated Fabric, Easy to Fold and Portable</td>\n                </tr></table><table cellspacing="0" class="fk-specs-type2"><tr><th class="group-head" colspan="2">Dimensions</th>\n            </tr><tr class=""><td class="specs-key">Other Dimensions</td>\n                                        <td class="specs-value fk-data">Dimension - 80 x 54 x 103 cm, Outer Dimension - 72 x 32 x 63 cm, Inner Dimension - 71 x 31 x 54 cm</td>\n                </tr></table></div>'], 'size': []}
{'sku': [], 'seller': [u'WS Retail'], 'title': [u'\n                    Infanto Multipurpose High Chair            '], 'colour': [], 'sp': [u' Rs. 2395'], 'mrp': [], 'titleimg': [u'http://img5a.flixcart.com/image/chair/b/w/y/o40a-natraj-high-chair-multipurpose-high-chair-400x400-imadhu9guugwm4hj.jpeg'], 'catname': ['furniture-decoration'], 'brandname': ['Infanto.'], 'date': ['18:02:2014'], 'itemlink': ['http://www.flipkart.com/infanto-multipurpose-high-chair/p/itmdrjd4gcsm8spc?pid=CHRDHU7WTJSPRBWY&srno=b_6&ref=aa3c957c-1611-4149-8855-1feb459ba19b'], 'desc': [u'<div class="item_left_column" id="description">\n        <h3 class="item_desc_title fk-uppercase">Infanto Multipurpose High Chair (Pastel Pink)         Price: Rs.2395</h3>\n        <div class="cls"></div>\n        <div class="item_desc_text line">\n            <div style="float:right">\n                \n \n            </div>\n                            <h3><b> Key Features </b></h3>\n                <div class="line bmargin10">\n                    <ul class="feature_bullet"><li><span>Easy Folding</span></li><li><span>Auto Locking</span></li><li><span>Large Removable Tray</span></li><li><span>Easy to Clean Tray and Seat</span></li><li><span>3 Point Harness</span></li>                    </ul></div>\n                        <p style="text-align: justify;">\r\n\tLetting your baby grab and eat their own food is one of the integral skills they learn with time. Help your little one develop some motor and sensory skills by getting this <strong>Infanto\xa0Multipurpose High Chair.</strong> This chair allows you to feed your baby or lets them eat their food on their own.</p>\r\n<p style="text-align: justify;">\r\n\t<strong>Easy to clean tray and seat</strong></p>\r\n<p style="text-align: justify;">\r\n\tWith an easy to clean tray and seat, this high chair becomes extremely easy to maintain.</p>\r\n<p style="text-align: justify;">\r\n\t<strong>Auto Locking</strong></p>\r\n<p style="text-align: justify;">\r\n\tWith the auto locking system, this high chair is safe for your baby.</p>\r\n<p style="text-align: justify;">\r\n\t<strong>3 point harness</strong></p>\r\n<p style="text-align: justify;">\r\n\tEnsuring your baby doesn\u2019t slip out and hurt themselves is the 3 point harness of this high chair.</p>\r\n<p style="text-align: justify;">\r\n\t<strong>Easy Folding</strong></p>\r\n<p style="text-align: justify;">\r\n\tFor your convenience and effortless portability, this chair has an easy folding body.</p>\r\n<p style="text-align: justify;">\r\n\t<strong>Large removable tray</strong></p>\r\n<p style="text-align: justify;">\r\n\tThe large removable tray is where you can keep your little one\u2019s food and toys for easy reach.</p>        </div>\n        <div style="clear: both;"></div>\n            </div>'], 'spec': [u'<div id="specifications" class="item_left_column">\n    <h3 class="item_desc_title fk-uppercase">\n        Specifications of Infanto Multipurpose High Chair (Pastel Pink)    </h3>\n\n            <table cellspacing="0" class="fk-specs-type2"><tr><th class="group-head" colspan="2">General</th>\n            </tr><tr class=""><td class="specs-key">Type</td>\n                                        <td class="specs-value fk-data">High Chair</td>\n                </tr><tr class=""><td class="specs-key">Ideal For</td>\n                                        <td class="specs-value fk-data">Girls, Boys</td>\n                </tr><tr class=""><td class="specs-key">Age Group</td>\n                                        <td class="specs-value fk-data">6 Months - 3 Years</td>\n                </tr></table><table cellspacing="0" class="fk-specs-type2"><tr><th class="group-head" colspan="2">Body Features</th>\n            </tr><tr class=""><td class="specs-key">Tray</td>\n                                        <td class="specs-value fk-data">Yes</td>\n                </tr><tr class=""><td class="specs-key">Other Body Features</td>\n                                        <td class="specs-value fk-data">Large Removable Food Tray, Foam Padded PVC Material, Easily Converted to Baby Chair</td>\n                </tr></table><table cellspacing="0" class="fk-specs-type2"><tr><th class="group-head" colspan="2">Wheel Features</th>\n            </tr><tr class=""><td class="specs-key">Wheeled Bottom</td>\n                                        <td class="specs-value fk-data">Yes</td>\n                </tr><tr class=""><td class="specs-key">Wheel Type</td>\n                                        <td class="specs-value fk-data">Rotable Castors</td>\n                </tr></table><table cellspacing="0" class="fk-specs-type2"><tr><th class="group-head" colspan="2">Additional Features</th>\n            </tr><tr class=""><td class="specs-key">Safety Features</td>\n                                        <td class="specs-value fk-data">Auto Locking</td>\n                </tr></table></div>'], 'size': []}
{'sku': [], 'seller': [], 'title': [], 'colour': [], 'sp': [], 'mrp': [], 'titleimg': [u'http://img5a.flixcart.com/image/chair/r/g/y/o40-new-natraj-high-chair-baby-high-chair-400x400-imadj7b4ywecwg8s.jpeg'], 'catname': ['furniture-decoration'], 'brandname': ['Infanto.'], 'date': ['18:02:2014'], 'itemlink': ['http://www.flipkart.com/infanto-baby-high-chair/p/itmdq2bhgzrwpfra?pid=CHRDEZYNXTZDHRGY&srno=b_4&ref=aa3c957c-1611-4149-8855-1feb459ba19b'], 'desc': [u'<div class="item_left_column" id="description">\n        <h3 class="item_desc_title fk-uppercase">Infanto Baby High Chair (Pink)         Price: Rs.1895</h3>\n        <div class="cls"></div>\n        <div class="item_desc_text line">\n            <div style="float:right">\n                \n \n            </div>\n                            <h3><b> Key Features </b></h3>\n                <div class="line bmargin10">\n                    <ul class="feature_bullet"><li><span>Compact and Portable</span></li><li><span>Padded Foam Seat that is Made of PVC Material</span></li><li><span>Auto-locking System</span></li><li><span>Large Removable Tray</span></li>                    </ul></div>\n                        <p style="text-align: justify;">\r\n\tHigh chairs are must-have baby accessories as they simplify the entire mealtime procedure for you as a parent. This\xa0Infanto Baby High Chair is <strong>ideal for use for both boys and girls. </strong>In addition to this, the high chair comes in handy for <strong>babies from six months to three years.</strong></p>\r\n<p style="text-align: justify;">\r\n\tThis high chair is furnished with a <strong>large removable tray</strong> that lets you place essentials like baby bottle, hand towel and more effortlessly. In addition to this the high chair also comes with a <strong>padded foam seat that is made of PVC material, </strong>thereby offering long lasting performance while in use.</p>\r\n<p style="text-align: justify;">\r\n\tYou could now stop fretting about the safety of your little one while using this\xa0Infanto\xa0Baby High Chair as it comes with an <strong>auto-locking system.</strong> Furthermore, this high chair comes with a portable and compact design, letting you carry it along even while you are travelling on long distance voyages with your little one. This\xa0<strong>Infanto\xa0</strong><strong>Baby High Chair </strong>is undoubtedly a wise and worthy buy.</p>        </div>\n        <div style="clear: both;"></div>\n            </div>'], 'spec': [u'<div id="specifications" class="item_left_column">\n    <h3 class="item_desc_title fk-uppercase">\n        Specifications of Infanto Baby High Chair (Pink)    </h3>\n\n            <table cellspacing="0" class="fk-specs-type2"><tr><th class="group-head" colspan="2">General</th>\n            </tr><tr class=""><td class="specs-key">Type</td>\n                                        <td class="specs-value fk-data">High Chair</td>\n                </tr><tr class=""><td class="specs-key">Ideal For</td>\n                                        <td class="specs-value fk-data">Boys, Girls</td>\n                </tr><tr class=""><td class="specs-key">Age Group</td>\n                                        <td class="specs-value fk-data">6 Months - 3 Years</td>\n                </tr></table><table cellspacing="0" class="fk-specs-type2"><tr><th class="group-head" colspan="2">Body Features</th>\n            </tr><tr class=""><td class="specs-key">Tray</td>\n                                        <td class="specs-value fk-data">Yes</td>\n                </tr><tr class=""><td class="specs-key">Other Body Features</td>\n                                        <td class="specs-value fk-data">Large Removable Tray, Foam Padded PVC Seat</td>\n                </tr></table><table cellspacing="0" class="fk-specs-type2"><tr><th class="group-head" colspan="2">Additional Features</th>\n            </tr><tr class=""><td class="specs-key">Safety Features</td>\n                                        <td class="specs-value fk-data">Auto Locking</td>\n                </tr><tr class=""><td class="specs-key">Other Features</td>\n                                        <td class="specs-value fk-data">Compact, Portable</td>\n                </tr></table></div>'], 'size': []}
{'sku': [u'/viewcart?eid=LSTCBTDRCZMEUZPE22XFBJDGM'], 'seller': [u'WS Retail', u'[?]'], 'title': [u'\n                    Infanto Baby Playpen Cum Cot            '], 'colour': [], 'sp': [u' Rs. 5095', u'(1,979,333'], 'mrp': [], 'titleimg': [u'http://img6a.flixcart.com/image/cot-bassinet/2/2/x/o48-infanto-baby-playpen-cum-cot-400x400-imadrcpj3vkuu5zz.jpeg'], 'catname': ['furniture-decoration'], 'brandname': ['Infanto.'], 'date': ['18:02:2014'], 'itemlink': ['http://www.flipkart.com/infanto-baby-playpen-cum-cot/p/itmdrczmywqztvvj?pid=CBTDRCZMEUZPE22X&srno=b_2&ref=aa3c957c-1611-4149-8855-1feb459ba19b'], 'desc': [u'<div class="item_left_column" id="description">\n            <h3 class="item_desc_title fk-uppercase">\n                Key Features of Infanto Baby Playpen Cum Cot (Red)            </h3>\n            <div class="cls"></div>\n            <div class="item_desc_text">\n                <ul class="fk-key-features"><li>Folds and Unfolds Quickly</li><li>Can be Taken any Where</li><li>Very Compact and Portable</li>                </ul></div>\n            <div style="clear: both;"></div>\n        </div>'], 'spec': [u'<div id="specifications" class="item_left_column">\n    <h3 class="item_desc_title fk-uppercase">\n        Specifications of Infanto Baby Playpen Cum Cot (Red)    </h3>\n\n            <table cellspacing="0" class="fk-specs-type2"><tr><th class="group-head" colspan="2">General</th>\n            </tr><tr class=""><td class="specs-key">Ideal For</td>\n                                        <td class="specs-value fk-data">Girls, Boys</td>\n                </tr><tr class=""><td class="specs-key">Age Group</td>\n                                        <td class="specs-value fk-data">0 Month +</td>\n                </tr></table><table cellspacing="0" class="fk-specs-type2"><tr><th class="group-head" colspan="2">Body Features</th>\n            </tr><tr class=""><td class="specs-key">Body Material</td>\n                                        <td class="specs-value fk-data">Steel, Plastic</td>\n                </tr><tr class=""><td class="specs-key">Other Body Features</td>\n                                        <td class="specs-value fk-data">Easy Umbrella Type Folding, With Carry Bag</td>\n                </tr></table><table cellspacing="0" class="fk-specs-type2"><tr><th class="group-head" colspan="2">Dimensions</th>\n            </tr><tr class=""><td class="specs-key">Width</td>\n                                        <td class="specs-value fk-data">27.99 inch</td>\n                </tr><tr class=""><td class="specs-key">Other Dimensions</td>\n                                        <td class="specs-value fk-data">Length: 1066 mm</td>\n                </tr></table><table cellspacing="0" class="fk-specs-type2"><tr><th class="group-head" colspan="2">Additional Features</th>\n            </tr><tr class=""><td class="specs-key">Other Features</td>\n                                        <td class="specs-value fk-data">Folds and Unfolds Quickly, Very Compact and Portable, Can be Taken any Where</td>\n                </tr></table></div>'], 'size': []}
{'sku': [], 'seller': [], 'title': [], 'colour': [], 'sp': [], 'mrp': [], 'titleimg': [u'http://img6a.flixcart.com/image/chair/y/g/2/40-natraj-high-chair-baby-highchair-400x400-imaddhdradvdeyhg.jpeg'], 'catname': ['furniture-decoration'], 'brandname': ['Infanto.'], 'date': ['18:02:2014'], 'itemlink': ['http://www.flipkart.com/infanto-baby-highchair/p/itmdq2bgtmgt3dgs?pid=CHRDDGUQJEM9UYG2&srno=b_7&ref=aa3c957c-1611-4149-8855-1feb459ba19b'], 'desc': [u'<div class="item_left_column" id="description">\n        <h3 class="item_desc_title fk-uppercase">Infanto Baby Highchair (White)         Price: Rs.1895</h3>\n        <div class="cls"></div>\n        <div class="item_desc_text line">\n            <div style="float:right">\n                \n \n            </div>\n                            <h3><b> Key Features </b></h3>\n                <div class="line bmargin10">\n                    <ul class="feature_bullet"><li><span>Foam Padded PVC Seat</span></li><li><span>Large Removable Tray</span></li><li><span>Compact and Portable</span></li><li><span>Auto Locking for Extra Safety</span></li>                    </ul></div>\n                        <p style="text-align: justify;">\r\n\tFeeding your baby can be quite a hassle if you don\u2019t have the right kind of furniture. Get this<strong>\xa0Infanto Baby Highchair</strong> which has been designed to make sure you can feed your baby with much ease.</p>\r\n<p style="text-align: justify;">\r\n\t<strong>Auto locking for extra safety</strong></p>\r\n<p style="text-align: justify;">\r\n\tMaking sure your little one doesn\u2019t try to slip out of the chair and hurt themselves is the auto locking which gives extra safety.</p>\r\n<p style="text-align: justify;">\r\n\t<strong>Foam padded PVC seat</strong></p>\r\n<p style="text-align: justify;">\r\n\tThe foam padded PVC seat of this chair enhances your baby\u2019s comfort and makes sure they don\u2019t experience any uneasiness.</p>\r\n<p style="text-align: justify;">\r\n\t<strong>Large removable tray</strong></p>\r\n<p style="text-align: justify;">\r\n\tFor your convenience, this chair has been provided with a large removable tray where you can keep food and toys.</p>\r\n<p style="text-align: justify;">\r\n\t<strong>Compact and portable</strong></p>\r\n<p style="text-align: justify;">\r\n\tAs this chair is compact and portable, you can move it from one place to another without much of an effort.</p>        </div>\n        <div style="clear: both;"></div>\n            </div>'], 'spec': [u'<div id="specifications" class="item_left_column">\n    <h3 class="item_desc_title fk-uppercase">\n        Specifications of Infanto Baby Highchair (White)    </h3>\n\n            <table cellspacing="0" class="fk-specs-type2"><tr><th class="group-head" colspan="2">General</th>\n            </tr><tr class=""><td class="specs-key">Type</td>\n                                        <td class="specs-value fk-data">High Chair</td>\n                </tr><tr class=""><td class="specs-key">Ideal For</td>\n                                        <td class="specs-value fk-data">Boys, Girls</td>\n                </tr><tr class=""><td class="specs-key">Age Group</td>\n                                        <td class="specs-value fk-data">6 Months - 3 Years</td>\n                </tr></table><table cellspacing="0" class="fk-specs-type2"><tr><th class="group-head" colspan="2">Body Features</th>\n            </tr><tr class=""><td class="specs-key">Tray</td>\n                                        <td class="specs-value fk-data">Yes</td>\n                </tr><tr class=""><td class="specs-key">Other Body Features</td>\n                                        <td class="specs-value fk-data">Large Removable Tray, Foam Padded PVC Seat</td>\n                </tr></table><table cellspacing="0" class="fk-specs-type2"><tr><th class="group-head" colspan="2">Additional Features</th>\n            </tr><tr class=""><td class="specs-key">Safety Features</td>\n                                        <td class="specs-value fk-data">Auto Locking</td>\n                </tr><tr class=""><td class="specs-key">Other Features</td>\n                                        <td class="specs-value fk-data">Compact, Portable</td>\n                </tr></table></div>'], 'size': []}
{'sku': [], 'seller': [], 'title': [], 'colour': [], 'sp': [], 'mrp': [], 'titleimg': [u'http://img6a.flixcart.com/image/crib-cradle/x/k/y/o37-new-natraj-cradle-baby-cocoon-cradle-400x400-imadzhre2stxaybt.jpeg'], 'catname': ['furniture-decoration'], 'brandname': ['Infanto.'], 'date': ['18:02:2014'], 'itemlink': ['http://www.flipkart.com/infanto-baby-cocoon-cradle/p/itmdq2bgvfce9fdk?pid=CCDDM5RJDJYAHXKY&srno=b_1&ref=aa3c957c-1611-4149-8855-1feb459ba19b'], 'desc': [u'<div class="item_left_column" id="description">\n        <h3 class="item_desc_title fk-uppercase">Infanto Baby Cocoon Cradle (Blue)         Price: Rs.2595</h3>\n        <div class="cls"></div>\n        <div class="item_desc_text line">\n            <div style="float:right">\n                \n \n            </div>\n                            <h3><b> Key Features </b></h3>\n                <div class="line bmargin10">\n                    <ul class="feature_bullet"><li><span>Attached Mosquito Net</span></li><li><span>Cotton Fabric with PVC Mattress</span></li><li><span>Easy Folding &amp; Portable</span></li><li><span>Safety Lock</span></li><li><span>Deluxe Quality Mosquito Net</span></li>                    </ul></div>\n                        <p style="text-align: justify;">\r\n\tCradles are designed to make sure your baby has their own personal space to rest and sleep. This<strong> New Natraj Baby Cocoon Cradle</strong> has been designed to keep your baby safe and at the same time allow them to experience uninterrupted sleep.</p>\r\n<p style="text-align: justify;">\r\n\t<strong>Attached mosquito net</strong></p>\r\n<p style="text-align: justify;">\r\n\tWith an attached mosquito net, this cradle keeps bugs and insects at bay.</p>\r\n<p style="text-align: justify;">\r\n\t<strong>Safety lock</strong></p>\r\n<p style="text-align: justify;">\r\n\tThe safety lock allows your baby to sleep and makes sure there is no unnecessary movement.</p>\r\n<p style="text-align: justify;">\r\n\t<strong>Easy folding &amp; portable</strong></p>\r\n<p style="text-align: justify;">\r\n\tFor hassle-free portability and storage, this cradle can be folded easily.</p>\r\n<p style="text-align: justify;">\r\n\t<strong>Cotton fabric with PVC mattress\xa0 </strong></p>\r\n<p style="text-align: justify;">\r\n\tTo enhance your baby\u2019s comfort, this cradle comes with cotton fabric and a PVC mattress.</p>        </div>\n        <div style="clear: both;"></div>\n            </div>'], 'spec': [u'<div id="specifications" class="item_left_column">\n    <h3 class="item_desc_title fk-uppercase">\n        Specifications of Infanto Baby Cocoon Cradle (Blue)    </h3>\n\n            <table cellspacing="0" class="fk-specs-type2"><tr><th class="group-head" colspan="2">General</th>\n            </tr><tr class=""><td class="specs-key">Type</td>\n                                        <td class="specs-value fk-data">Cradle</td>\n                </tr><tr class=""><td class="specs-key">Ideal For</td>\n                                        <td class="specs-value fk-data">Girls, Boys</td>\n                </tr><tr class=""><td class="specs-key">Foldable</td>\n                                        <td class="specs-value fk-data">Yes</td>\n                </tr></table><table cellspacing="0" class="fk-specs-type2"><tr><th class="group-head" colspan="2">Body Features</th>\n            </tr><tr class=""><td class="specs-key">Matress</td>\n                                        <td class="specs-value fk-data">Yes</td>\n                </tr><tr class=""><td class="specs-key">Mattress Material</td>\n                                        <td class="specs-value fk-data">Cotton Fabric with PVC</td>\n                </tr><tr class=""><td class="specs-key">Other Body Features</td>\n                                        <td class="specs-value fk-data">Front Wheeled Bottom, Attached Mosquito Net</td>\n                </tr></table><table cellspacing="0" class="fk-specs-type2"><tr><th class="group-head" colspan="2">Safety Features</th>\n            </tr><tr class=""><td class="specs-key">Other Safety Features</td>\n                                        <td class="specs-value fk-data">Lock Facility</td>\n                </tr></table><table cellspacing="0" class="fk-specs-type2"><tr><th class="group-head" colspan="2">Additional Features</th>\n            </tr><tr class=""><td class="specs-key">Other Features</td>\n                                        <td class="specs-value fk-data">Easy Folding and Portable</td>\n                </tr></table><table cellspacing="0" class="fk-specs-type2"><tr><th class="group-head" colspan="2">Dimensions</th>\n            </tr><tr class=""><td class="specs-key">Other Dimensions</td>\n                                        <td class="specs-value fk-data">Box Dimensions : 37.9 x 22.2 x 33.2 inch, Outer Product Dimension : 31.8 x 17.7 x 8.6 inch, Folding Dimension : 37 x 22 x 3.1 inch, Inner Dimension : 30.7 x 16.3 x 7.8 inch</td>\n                </tr></table></div>'], 'size': []}
