LSTHMBDHZEEBCEJW2GYRIYTVZ,Lupine Primrose Hand Bag,http://www.flipkart.com/lifestyle/bags-wallets-belts/women?otracker=hp_nmenu_sub_women_1_Bags%2C%20Wallets%20and%20Belts,Rs. 1299,Bags  Wallets and Belts,Handbags,Lupine,http://img6a.flixcart.com/image/hand-messenger-bag/2/g/y/lb-1024-lupine-hand-bag-primrose-400x400-imadhzjewqfrbdgh.jpeg,Rs. 2999,Beige  White,women,http://www.flipkart.com/lupine-primrose-hand-bag/p/itmdpznaejxrtzhh?pid=HMBDHZEEBCEJW2GY&srno=b_12&ref=f239b80e-8d50-408b-89d7-6072db65b44e,lupine,Lupine Primrose Hand Bag White::Beige White - Price in India | Flipkart.com,Flipkart.com: Buy Lupine Primrose Hand Bag for Rs. 1299 from Flipkart.com. Only Genuine Products. 30 Day Replacement Guarantee. Free Shipping. Cash On,[],<div class="item_left_column" id="description"> <h3 class="item_desc_title fk-uppercase">Lupine Primrose Hand Bag (White::Beige White)         Price: Rs.1299</h3> <div class="cls"></div> <div class="item_desc_text line"> <div style="float:right"> </div>                         Superior canvas with genuine leather combination bag having following features superior quality canvas perfectly blended with genuine leather is stylish bag for all purpose.The bag is styling is blended with genuine leather at the bottom for longivity and also a strong lether handles for the shoulder wear. Added is detachable cotton sling that can be used fro cross body or heavy stuffing with collapsable leather patch that is fitted with invisible magnet.The bag has inside small pocket to keep essentials and there are three front pockets for easy picks and center pocket is again gaurded well by magnetic invisible snap button.Bag come with genuine letaher blended with premium canvas.Its a light grey colour premium canvas with black genuine leather trims.Dimensions in cms L 43.5 x W 43 x D 13.        </div> <div style="clear: both;"></div> </div>,<div class="item_left_column" id="specifications"> <h3 class="item_desc_title fk-uppercase">         Specifications of Lupine Primrose Hand Bag (White::Beige White)    </h3> <table cellspacing="0" class="fk-specs-type2"> <tr> <th class="group-head" colspan="2">General</th> </tr> <tr class=""> <td class="specs-key">Type</td> <td class="specs-value fk-data">Hand Bag</td> </tr> <tr class=""> <td class="specs-key">Ideal For</td> <td class="specs-value fk-data">Women</td> </tr> <tr class=""> <td class="specs-key">Material</td> <td class="specs-value fk-data">Leather</td> </tr> <tr class=""> <td class="specs-key">Style Code</td> <td class="specs-value fk-data">LB-1024</td> </tr> <tr class=""> <td class="specs-key">Color Code</td> <td class="specs-value fk-data">White::Beige White</td> </tr> </table> <table cellspacing="0" class="fk-specs-type2"> <tr> <th class="group-head" colspan="2">Body Features</th> </tr> <tr class=""> <td class="specs-key">Number of Compartments</td> <td class="specs-value fk-data">1</td> </tr> </table> </div>,10:03:2014,None
LSTHMBDZE7VFTGFZWCCHDGPJH,Lupine Sundew Hand Bag,http://www.flipkart.com/lifestyle/bags-wallets-belts/women?otracker=hp_nmenu_sub_women_1_Bags%2C%20Wallets%20and%20Belts,Rs. 3499,Bags  Wallets and Belts,Handbags,Lupine,http://img6a.flixcart.com/image/hand-messenger-bag/w/c/c/lb-1052-lupine-hand-bag-sundew-400x400-imadzkjajrezzgnh.jpeg,Rs. 4999,Grey  Tan,women,http://www.flipkart.com/lupine-sundew-hand-bag/p/itmdpznc8neyytyk?pid=HMBDZE7VFTGFZWCC&srno=b_28&ref=b2c59b07-5219-4c13-9eb6-a2846557e293,lupine,Lupine Sundew Hand Bag Grey::Tan - Price in India | Flipkart.com,Flipkart.com: Buy Lupine Sundew Hand Bag for Rs. 3499 from Flipkart.com. Only Genuine Products. 30 Day Replacement Guarantee. Free Shipping. Cash On,[],<div class="item_left_column" id="description"> <h3 class="item_desc_title fk-uppercase">Lupine Sundew Hand Bag (Grey::Tan)         Price: Rs.3499</h3> <div class="cls"></div> <div class="item_desc_text line"> <div style="float:right"> </div>                         Genuine Leather Bag. Dimensions in cms : L 35 x W 36 x D 12 cms. The special edition Bag has suede leather on body in grey colour with soft tan leather at bottom. It has unique loose strips from main leather part and held by leather grip handle that looks stylish. Bag has a metal zip pocket on the back and has a main long metal zip . A stylish D rings looks elegant  bag has zip lining and a pocket for mobile on ther side        </div> <div style="clear: both;"></div> </div>,<div class="item_left_column" id="specifications"> <h3 class="item_desc_title fk-uppercase">         Specifications of Lupine Sundew Hand Bag (Grey::Tan)    </h3> <table cellspacing="0" class="fk-specs-type2"> <tr> <th class="group-head" colspan="2">General</th> </tr> <tr class=""> <td class="specs-key">Type</td> <td class="specs-value fk-data">Hand Bag</td> </tr> <tr class=""> <td class="specs-key">Ideal For</td> <td class="specs-value fk-data">Women</td> </tr> <tr class=""> <td class="specs-key">Material</td> <td class="specs-value fk-data">Genuine Leather</td> </tr> <tr class=""> <td class="specs-key">Style Code</td> <td class="specs-value fk-data">LB-1052</td> </tr> <tr class=""> <td class="specs-key">Color Code</td> <td class="specs-value fk-data">Grey::Tan</td> </tr> </table> <table cellspacing="0" class="fk-specs-type2"> <tr> <th class="group-head" colspan="2">Body Features</th> </tr> <tr class=""> <td class="specs-key">Number of Compartments</td> <td class="specs-value fk-data">1</td> </tr> </table> </div>,10:03:2014,None
LSTHMBDZE7VWCP4HZJTK63M3M,Lupine Azalea Hand Bag,http://www.flipkart.com/lifestyle/bags-wallets-belts/women?otracker=hp_nmenu_sub_women_1_Bags%2C%20Wallets%20and%20Belts,Rs. 1999,Bags  Wallets and Belts,Handbags,Lupine,http://img6a.flixcart.com/image/hand-messenger-bag/z/j/t/lb-1048-lupine-hand-bag-azalea-400x400-imadzebkw2ktngfe.jpeg,Rs. 2299,Black  Blue,women,http://www.flipkart.com/lupine-azalea-hand-bag/p/itmdpznccszzzfz4?pid=HMBDZE7VWCP4HZJT&srno=b_27&ref=b2c59b07-5219-4c13-9eb6-a2846557e293,lupine,Lupine Azalea Hand Bag Blue::Black - Price in India | Flipkart.com,Flipkart.com: Buy Lupine Azalea Hand Bag for Rs. 1999 from Flipkart.com. Only Genuine Products. 30 Day Replacement Guarantee. Free Shipping. Cash On,[],<div class="item_left_column" id="description"> <h3 class="item_desc_title fk-uppercase">Lupine Azalea Hand Bag (Blue::Black)         Price: Rs.1999</h3> <div class="cls"></div> <div class="item_desc_text line"> <div style="float:right"> </div>                         Dimensions in cms : L 32 x W 43 x D 13 cms. This nylon Bag has combination of Black and blue has cross zip on either side of the bag in blue colour with a deep pockets. With long Handle   one running fro bottom and other from top end body. Bag has 15 inch lap top spongy protected area with a flap. And other area for office and personal accessories. Bag has stylish side handle to hold that can be worn to one shoulder or held by one hand. A stylish nylon bag from Lupine        </div> <div style="clear: both;"></div> </div>,<div class="item_left_column" id="specifications"> <h3 class="item_desc_title fk-uppercase">         Specifications of Lupine Azalea Hand Bag (Blue::Black)    </h3> <table cellspacing="0" class="fk-specs-type2"> <tr> <th class="group-head" colspan="2">General</th> </tr> <tr class=""> <td class="specs-key">Type</td> <td class="specs-value fk-data">Hand Bag</td> </tr> <tr class=""> <td class="specs-key">Ideal For</td> <td class="specs-value fk-data">Women</td> </tr> <tr class=""> <td class="specs-key">Material</td> <td class="specs-value fk-data">Nylon</td> </tr> <tr class=""> <td class="specs-key">Style Code</td> <td class="specs-value fk-data">LB-1048</td> </tr> <tr class=""> <td class="specs-key">Color Code</td> <td class="specs-value fk-data">Blue::Black</td> </tr> </table> <table cellspacing="0" class="fk-specs-type2"> <tr> <th class="group-head" colspan="2">Body Features</th> </tr> <tr class=""> <td class="specs-key">Number of Compartments</td> <td class="specs-value fk-data">1</td> </tr> </table> </div>,10:03:2014,None
LSTHMBDZM2TRNWUCPGBVA1JUT,Lupine Sunflower Hand Bag,http://www.flipkart.com/lifestyle/bags-wallets-belts/women?otracker=hp_nmenu_sub_women_1_Bags%2C%20Wallets%20and%20Belts,Rs. 1999,Bags  Wallets and Belts,Handbags,Lupine,http://img6a.flixcart.com/image/hand-messenger-bag/p/g/b/lb-1062-lupine-hand-bag-sunflower-400x400-imadzmn7bgb9w7tg.jpeg,Rs. 2499,Green,women,http://www.flipkart.com/lupine-sunflower-hand-bag/p/itmdpznc6y5jq28v?pid=HMBDZM2TRNWUCPGB&srno=b_31&ref=21319c83-07c6-48c5-a798-93f2fede9ddc,lupine,Lupine Sunflower Hand Bag Green - Price in India | Flipkart.com,Flipkart.com: Buy Lupine Sunflower Hand Bag for Rs. 1999 from Flipkart.com. Only Genuine Products. 30 Day Replacement Guarantee. Free Shipping. Cash On,[],<div class="item_left_column" id="description"> <h3 class="item_desc_title fk-uppercase">Lupine Sunflower Hand Bag (Green)         Price: Rs.1999</h3> <div class="cls"></div> <div class="item_desc_text line"> <div style="float:right"> </div>                         Dimensions of the Bag L 21 X W 29 X D 13 cms. The Bag is Bag is made of leather look material(PU). With Center long zip for wider opening has a body lining zip on one side and other side has a mobile case and slip pocket. Bag has two handle with rings for easy handle movements.        </div> <div style="clear: both;"></div> </div>,<div class="item_left_column" id="specifications"> <h3 class="item_desc_title fk-uppercase">         Specifications of Lupine Sunflower Hand Bag (Green)    </h3> <table cellspacing="0" class="fk-specs-type2"> <tr> <th class="group-head" colspan="2">General</th> </tr> <tr class=""> <td class="specs-key">Type</td> <td class="specs-value fk-data">Hand Bag</td> </tr> <tr class=""> <td class="specs-key">Ideal For</td> <td class="specs-value fk-data">Women</td> </tr> <tr class=""> <td class="specs-key">Material</td> <td class="specs-value fk-data">Leatherite</td> </tr> <tr class=""> <td class="specs-key">Style Code</td> <td class="specs-value fk-data">LB-1062</td> </tr> <tr class=""> <td class="specs-key">Color Code</td> <td class="specs-value fk-data">Green</td> </tr> </table> <table cellspacing="0" class="fk-specs-type2"> <tr> <th class="group-head" colspan="2">Body Features</th> </tr> <tr class=""> <td class="specs-key">Number of Compartments</td> <td class="specs-value fk-data">1</td> </tr> </table> </div>,10:03:2014,None
LSTHMBDZ42GGCKNY8PYYCG1MK,Lupine Ren Hand Bag,http://www.flipkart.com/lifestyle/bags-wallets-belts/women?otracker=hp_nmenu_sub_women_1_Bags%2C%20Wallets%20and%20Belts,Rs. 2399,Bags  Wallets and Belts,Handbags,Lupine,http://img5a.flixcart.com/image/hand-messenger-bag/8/p/y/lb-1035-lupine-hand-bag-ren-400x400-imadz455hpvyfy7t.jpeg,Rs. 2999,Black,women,http://www.flipkart.com/lupine-ren-hand-bag/p/itmdpzncecfmchwy?pid=HMBDZ42GGCKNY8PY&srno=b_20&ref=b2c59b07-5219-4c13-9eb6-a2846557e293,lupine,Lupine Ren Hand Bag Black - Price in India | Flipkart.com,Flipkart.com: Buy Lupine Ren Hand Bag for Rs. 2399 from Flipkart.com. Only Genuine Products. 30 Day Replacement Guarantee. Free Shipping. Cash On,[],<div class="item_left_column" id="description"> <h3 class="item_desc_title fk-uppercase">Lupine Ren Hand Bag (Black)         Price: Rs.2399</h3> <div class="cls"></div> <div class="item_desc_text line"> <div style="float:right"> </div>                         A stylish Genuine leather Bag. Dimensions in cm: L 33 x W 19 x D 8 cms  Bag has 61 cms Long shoulder  Two handles with two visible side pockets that has two leather strings for tightening Leather Bag has long Center Flap with magnetic snap button acts as additional Safety. There is long Zip on top with deep open pocket and has additional zip pocket on one side of the lining and separate slot for mobile.        </div> <div style="clear: both;"></div> </div>,<div class="item_left_column" id="specifications"> <h3 class="item_desc_title fk-uppercase">         Specifications of Lupine Ren Hand Bag (Black)    </h3> <table cellspacing="0" class="fk-specs-type2"> <tr> <th class="group-head" colspan="2">General</th> </tr> <tr class=""> <td class="specs-key">Type</td> <td class="specs-value fk-data">Hand Bag</td> </tr> <tr class=""> <td class="specs-key">Ideal For</td> <td class="specs-value fk-data">Women</td> </tr> <tr class=""> <td class="specs-key">Material</td> <td class="specs-value fk-data">Genuine Leather</td> </tr> <tr class=""> <td class="specs-key">Style Code</td> <td class="specs-value fk-data">LB-1035</td> </tr> <tr class=""> <td class="specs-key">Color Code</td> <td class="specs-value fk-data">Black</td> </tr> </table> <table cellspacing="0" class="fk-specs-type2"> <tr> <th class="group-head" colspan="2">Body Features</th> </tr> <tr class=""> <td class="specs-key">Number of Compartments</td> <td class="specs-value fk-data">1</td> </tr> </table> </div>,10:03:2014,None
LSTHMBDZM2TGWUJSUTHOCRM6X,Lupine Snowball Hand Bag,http://www.flipkart.com/lifestyle/bags-wallets-belts/women?otracker=hp_nmenu_sub_women_1_Bags%2C%20Wallets%20and%20Belts,Rs. 1999,Bags  Wallets and Belts,Handbags,Lupine,http://img5a.flixcart.com/image/hand-messenger-bag/u/t/h/lb-1057-lupine-hand-bag-snowball-400x400-imadzmn6usjv6erx.jpeg,Rs. 2499,Blue,women,http://www.flipkart.com/lupine-snowball-hand-bag/p/itmdpznchfkts9dn?pid=HMBDZM2TGWUJSUTH&srno=b_30&ref=b2c59b07-5219-4c13-9eb6-a2846557e293,lupine,Lupine Snowball Hand Bag Blue - Price in India | Flipkart.com,Flipkart.com: Buy Lupine Snowball Hand Bag for Rs. 1999 from Flipkart.com. Only Genuine Products. 30 Day Replacement Guarantee. Free Shipping. Cash On,[],<div class="item_left_column" id="description"> <h3 class="item_desc_title fk-uppercase">Lupine Snowball Hand Bag (Blue)         Price: Rs.1999</h3> <div class="cls"></div> <div class="item_desc_text line"> <div style="float:right"> </div>                         Dimensions of the Bag L 32 X W 29 X D 12.5 cms. This Bag is made of leather look material(PU). The Bag is made with special hand stitched handles for elegant look as it appears in image with single long Zip for wide opening Lining has two zips Pockets and opther side of lining has a Mobile casing and also a small slot for accessories. This Bag has sling as added feature and four studs at bottom for longevity.        </div> <div style="clear: both;"></div> </div>,<div class="item_left_column" id="specifications"> <h3 class="item_desc_title fk-uppercase">         Specifications of Lupine Snowball Hand Bag (Blue)    </h3> <table cellspacing="0" class="fk-specs-type2"> <tr> <th class="group-head" colspan="2">General</th> </tr> <tr class=""> <td class="specs-key">Type</td> <td class="specs-value fk-data">Hand Bag</td> </tr> <tr class=""> <td class="specs-key">Ideal For</td> <td class="specs-value fk-data">Women</td> </tr> <tr class=""> <td class="specs-key">Material</td> <td class="specs-value fk-data">Leatherite</td> </tr> <tr class=""> <td class="specs-key">Style Code</td> <td class="specs-value fk-data">LB-1057</td> </tr> <tr class=""> <td class="specs-key">Color Code</td> <td class="specs-value fk-data">Blue</td> </tr> </table> <table cellspacing="0" class="fk-specs-type2"> <tr> <th class="group-head" colspan="2">Body Features</th> </tr> <tr class=""> <td class="specs-key">Number of Compartments</td> <td class="specs-value fk-data">1</td> </tr> </table> </div>,10:03:2014,None
LSTHMBDZM2TRFHJZZQVVNIVTM,Lupine Succory Hand Bag,http://www.flipkart.com/lifestyle/bags-wallets-belts/women?otracker=hp_nmenu_sub_women_1_Bags%2C%20Wallets%20and%20Belts,Rs. 2199,Bags  Wallets and Belts,Handbags,Lupine,http://img6a.flixcart.com/image/hand-messenger-bag/z/q/v/lb-1061-lupine-hand-bag-succory-400x400-imadzmn6h4p5xwpn.jpeg,Rs. 2499,Tan,women,http://www.flipkart.com/lupine-succory-hand-bag/p/itmdpzncyxgzwzhn?pid=HMBDZM2TRFHJZZQV&srno=b_32&ref=21319c83-07c6-48c5-a798-93f2fede9ddc,lupine,Lupine Succory Hand Bag Tan - Price in India | Flipkart.com,Flipkart.com: Buy Lupine Succory Hand Bag for Rs. 2199 from Flipkart.com. Only Genuine Products. 30 Day Replacement Guarantee. Free Shipping. Cash On,[],<div class="item_left_column" id="description"> <h3 class="item_desc_title fk-uppercase">Lupine Succory Hand Bag (Tan)         Price: Rs.2199</h3> <div class="cls"></div> <div class="item_desc_text line"> <div style="float:right"> </div>                         Dimensions of the Bag L 29 X W 36 X D 11 cms. Bag is made of leather look material(PU). The Bag has a visible transperent opening   which is stitched along with Body. The bag has a detachable small zip pouch which is attached with loop to main Bag. A carefree bag has a small mini zip pocket on the body with a mobile casing thats visible through transperent sheet. Bag comes with sling and also a Bigger detachable pouch of size 30x26 cms.        </div> <div style="clear: both;"></div> </div>,<div class="item_left_column" id="specifications"> <h3 class="item_desc_title fk-uppercase">         Specifications of Lupine Succory Hand Bag (Tan)    </h3> <table cellspacing="0" class="fk-specs-type2"> <tr> <th class="group-head" colspan="2">General</th> </tr> <tr class=""> <td class="specs-key">Type</td> <td class="specs-value fk-data">Hand Bag</td> </tr> <tr class=""> <td class="specs-key">Ideal For</td> <td class="specs-value fk-data">Women</td> </tr> <tr class=""> <td class="specs-key">Material</td> <td class="specs-value fk-data">Leatherite</td> </tr> <tr class=""> <td class="specs-key">Style Code</td> <td class="specs-value fk-data">LB-1061</td> </tr> <tr class=""> <td class="specs-key">Color Code</td> <td class="specs-value fk-data">Tan</td> </tr> </table> <table cellspacing="0" class="fk-specs-type2"> <tr> <th class="group-head" colspan="2">Body Features</th> </tr> <tr class=""> <td class="specs-key">Number of Compartments</td> <td class="specs-value fk-data">1</td> </tr> </table> </div>,10:03:2014,None
LSTHMBDZM2TSUHZAVMPVFERRY,Lupine Starwort Hand Bag,http://www.flipkart.com/lifestyle/bags-wallets-belts/women?otracker=hp_nmenu_sub_women_1_Bags%2C%20Wallets%20and%20Belts,Rs. 1999,Bags  Wallets and Belts,Handbags,Lupine,http://img5a.flixcart.com/image/hand-messenger-bag/v/m/p/lb-1060-lupine-hand-bag-starwort-400x400-imadzmn7bkdntq2z.jpeg,Rs. 2200,Brown  Tan,women,http://www.flipkart.com/lupine-starwort-hand-bag/p/itmdpznczrhftgfv?pid=HMBDZM2TSUHZAVMP&srno=b_34&ref=21319c83-07c6-48c5-a798-93f2fede9ddc,lupine,Lupine Starwort Hand Bag Brown::Tan - Price in India | Flipkart.com,Flipkart.com: Buy Lupine Starwort Hand Bag for Rs. 1999 from Flipkart.com. Only Genuine Products. 30 Day Replacement Guarantee. Free Shipping. Cash On,[],<div class="item_left_column" id="description"> <h3 class="item_desc_title fk-uppercase">Lupine Starwort Hand Bag (Brown::Tan)         Price: Rs.1999</h3> <div class="cls"></div> <div class="item_desc_text line"> <div style="float:right"> </div>                         Dimensions of the Bag L 28 X W 40 X D 10 cms. Bag is made of leather look material(PU) With Center long zip for wider opening has a body lining zip on one side and other side has a mobile case and slip pocket.        </div> <div style="clear: both;"></div> </div>,<div class="item_left_column" id="specifications"> <h3 class="item_desc_title fk-uppercase">         Specifications of Lupine Starwort Hand Bag (Brown::Tan)    </h3> <table cellspacing="0" class="fk-specs-type2"> <tr> <th class="group-head" colspan="2">General</th> </tr> <tr class=""> <td class="specs-key">Type</td> <td class="specs-value fk-data">Hand Bag</td> </tr> <tr class=""> <td class="specs-key">Ideal For</td> <td class="specs-value fk-data">Women</td> </tr> <tr class=""> <td class="specs-key">Material</td> <td class="specs-value fk-data">Leatherite</td> </tr> <tr class=""> <td class="specs-key">Style Code</td> <td class="specs-value fk-data">LB-1060</td> </tr> <tr class=""> <td class="specs-key">Color Code</td> <td class="specs-value fk-data">Brown::Tan</td> </tr> </table> <table cellspacing="0" class="fk-specs-type2"> <tr> <th class="group-head" colspan="2">Body Features</th> </tr> <tr class=""> <td class="specs-key">Number of Compartments</td> <td class="specs-value fk-data">1</td> </tr> </table> </div>,10:03:2014,None
LSTHMBDZE7VCBV5P2YBJ00HCK,Lupine Aygul Hand Bag,http://www.flipkart.com/lifestyle/bags-wallets-belts/women?otracker=hp_nmenu_sub_women_1_Bags%2C%20Wallets%20and%20Belts,Rs. 2309,Bags  Wallets and Belts,Handbags,Lupine,http://img6a.flixcart.com/image/hand-messenger-bag/2/y/b/lb-1049-lupine-hand-bag-aygul-400x400-imadzkjabxbhv5jp.jpeg,Rs. 3299,Black,women,http://www.flipkart.com/lupine-aygul-hand-bag/p/itmdpznchfmmdfqz?pid=HMBDZE7VCBV5P2YB&srno=b_29&ref=b2c59b07-5219-4c13-9eb6-a2846557e293,lupine,Lupine Aygul Hand Bag Black - Price in India | Flipkart.com,Flipkart.com: Buy Lupine Aygul Hand Bag for Rs. 2309 from Flipkart.com. Only Genuine Products. 30 Day Replacement Guarantee. Free Shipping. Cash On,[],<div class="item_left_column" id="description"> <h3 class="item_desc_title fk-uppercase">Lupine Aygul Hand Bag (Black)         Price: Rs.2309</h3> <div class="cls"></div> <div class="item_desc_text line"> <div style="float:right"> </div>                         Genuine Leather Hand Bag. Dimensions in cms : L 23 x W 49 x D 20 cms. This elegant design Genuine leather bag from lupine is special edition in black grained leather joined in artistic way and left as raw at edges to feel. Bag has an elegant handle style with two side pockets on either side  with two main zips for open area. one side of lining has zip pocket and otherside has mobile casing pouch.        </div> <div style="clear: both;"></div> </div>,<div class="item_left_column" id="specifications"> <h3 class="item_desc_title fk-uppercase">         Specifications of Lupine Aygul Hand Bag (Black)    </h3> <table cellspacing="0" class="fk-specs-type2"> <tr> <th class="group-head" colspan="2">General</th> </tr> <tr class=""> <td class="specs-key">Type</td> <td class="specs-value fk-data">Hand Bag</td> </tr> <tr class=""> <td class="specs-key">Ideal For</td> <td class="specs-value fk-data">Women</td> </tr> <tr class=""> <td class="specs-key">Material</td> <td class="specs-value fk-data">Genuine Leather</td> </tr> <tr class=""> <td class="specs-key">Style Code</td> <td class="specs-value fk-data">LB-1049</td> </tr> <tr class=""> <td class="specs-key">Color Code</td> <td class="specs-value fk-data">Black</td> </tr> </table> <table cellspacing="0" class="fk-specs-type2"> <tr> <th class="group-head" colspan="2">Body Features</th> </tr> <tr class=""> <td class="specs-key">Number of Compartments</td> <td class="specs-value fk-data">1</td> </tr> </table> </div>,10:03:2014,None
LSTHMBDNF6E7SFBFXQRW76MAM,Lupine Veraine Hand Bag,http://www.flipkart.com/lifestyle/bags-wallets-belts/women?otracker=hp_nmenu_sub_women_1_Bags%2C%20Wallets%20and%20Belts,Rs. 839,Bags  Wallets and Belts,Handbags,Lupine,http://img5a.flixcart.com/image/hand-messenger-bag/x/q/r/lb-1033-lupine-hand-bag-veraine-400x400-imadn2bmgbexcfmh.jpeg,Rs. 1199,Blue  Green,women,http://www.flipkart.com/lupine-veraine-hand-bag/p/itmdpznbfwctjch9?pid=HMBDNF6E7SFBFXQR&srno=b_3&ref=f239b80e-8d50-408b-89d7-6072db65b44e,lupine,Lupine Veraine Hand Bag Green::Blue - Price in India | Flipkart.com,Flipkart.com: Buy Lupine Veraine Hand Bag for Rs. 839 from Flipkart.com. Only Genuine Products. 30 Day Replacement Guarantee. Free Shipping. Cash On,[],<div class="item_left_column" id="description"> <h3 class="item_desc_title fk-uppercase">Lupine Veraine Hand Bag (Green::Blue)         Price: Rs.839</h3> <div class="cls"></div> <div class="item_desc_text line"> <div style="float:right"> </div>                         Designed for everyday use  this handbag from Lupine is perfect for carrying all your stuff in style. Measurement in cms Bag size - L 32 x W 25 x D 9. Features - Green color canvas and Blue colour leatherite combination vertical bag  Bag has front two decoartive zips  which also act as feasible area for extra space  bag has Nylon zip on top with cotton lining with zipped pocket on one side &amp; mobile and little bigger pocket on the other side of lining. A long sturdy Blue leatherite handles are perfect companion for shoulder.        </div> <div style="clear: both;"></div> </div>,<div class="item_left_column" id="specifications"> <h3 class="item_desc_title fk-uppercase">         Specifications of Lupine Veraine Hand Bag (Green::Blue)    </h3> <table cellspacing="0" class="fk-specs-type2"> <tr> <th class="group-head" colspan="2">General</th> </tr> <tr class=""> <td class="specs-key">Type</td> <td class="specs-value fk-data">Hand Bag</td> </tr> <tr class=""> <td class="specs-key">Ideal For</td> <td class="specs-value fk-data">Women</td> </tr> <tr class=""> <td class="specs-key">Material</td> <td class="specs-value fk-data">Leatherite  Canvas</td> </tr> <tr class=""> <td class="specs-key">Style Code</td> <td class="specs-value fk-data">LB-1033</td> </tr> <tr class=""> <td class="specs-key">Color Code</td> <td class="specs-value fk-data">Green::Blue</td> </tr> </table> <table cellspacing="0" class="fk-specs-type2"> <tr> <th class="group-head" colspan="2">Body Features</th> </tr> <tr class=""> <td class="specs-key">Number of Compartments</td> <td class="specs-value fk-data">1</td> </tr> </table> </div>,10:03:2014,None
