LSTHMBDHGSY4ZAAG7XPQ0J2BH,Lupine Black Pearl Hand Bag,http://www.flipkart.com/lifestyle/bags-wallets-belts/women?otracker=hp_nmenu_sub_women_1_Bags%2C%20Wallets%20and%20Belts,Rs. 999,Bags  Wallets and Belts,Handbags,Lupine,http://img5a.flixcart.com/image/hand-messenger-bag/7/x/p/lb-1012-lupine-hand-bag-black-pearl-400x400-imadhgsxhhd2nvw7.jpeg,Rs. 999,Black  Gold,women,http://www.flipkart.com/lupine-black-pearl-hand-bag/p/itmdpznazgkuwf5z?pid=HMBDHGSY4ZAAG7XP&srno=b_5&ref=f239b80e-8d50-408b-89d7-6072db65b44e,lupine,Lupine Black Pearl Hand Bag Black::Gold - Price in India | Flipkart.com,Flipkart.com: Buy Lupine Black Pearl Hand Bag for Rs. 999 from Flipkart.com. Only Genuine Products. 30 Day Replacement Guarantee. Free Shipping. Cash On,[],<div class="item_left_column" id="description"> <h3 class="item_desc_title fk-uppercase">Lupine Black Pearl Hand Bag (Black::Gold)         Price: Rs.999</h3> <div class="cls"></div> <div class="item_desc_text line"> <div style="float:right"> </div>                         Leatherite material with beautiful combination of black and gold.        </div> <div style="clear: both;"></div> </div>,<div class="item_left_column" id="specifications"> <h3 class="item_desc_title fk-uppercase">         Specifications of Lupine Black Pearl Hand Bag (Black::Gold)    </h3> <table cellspacing="0" class="fk-specs-type2"> <tr> <th class="group-head" colspan="2">General</th> </tr> <tr class=""> <td class="specs-key">Type</td> <td class="specs-value fk-data">Hand Bag</td> </tr> <tr class=""> <td class="specs-key">Ideal For</td> <td class="specs-value fk-data">Women</td> </tr> <tr class=""> <td class="specs-key">Material</td> <td class="specs-value fk-data">Leatherite</td> </tr> <tr class=""> <td class="specs-key">Style Code</td> <td class="specs-value fk-data">LB-1012</td> </tr> <tr class=""> <td class="specs-key">Color Code</td> <td class="specs-value fk-data">Black::Gold</td> </tr> </table> <table cellspacing="0" class="fk-specs-type2"> <tr> <th class="group-head" colspan="2">Body Features</th> </tr> <tr class=""> <td class="specs-key">Number of Compartments</td> <td class="specs-value fk-data">1</td> </tr> </table> </div>,10:03:2014,None
LSTHMBDHGSYTEEFXZZRZVR4IH,Lupine Bluerope Hand Bag,http://www.flipkart.com/lifestyle/bags-wallets-belts/women?otracker=hp_nmenu_sub_women_1_Bags%2C%20Wallets%20and%20Belts,Rs. 1539,Bags  Wallets and Belts,Handbags,Lupine,http://img6a.flixcart.com/image/hand-messenger-bag/z/z/r/lb-1013-lupine-hand-bag-bluerope-400x400-imadhgsxhg27ymg7.jpeg,Rs. 2199,Beige  Blue,women,http://www.flipkart.com/lupine-bluerope-hand-bag/p/itmdpznadswajs9f?pid=HMBDHGSYTEEFXZZR&srno=b_4&ref=f239b80e-8d50-408b-89d7-6072db65b44e,lupine,Lupine Bluerope Hand Bag Blue::Beige - Price in India | Flipkart.com,Flipkart.com: Buy Lupine Bluerope Hand Bag for Rs. 1539 from Flipkart.com. Only Genuine Products. 30 Day Replacement Guarantee. Free Shipping. Cash On,[],<div class="item_left_column" id="description"> <h3 class="item_desc_title fk-uppercase">Lupine Bluerope Hand Bag (Blue::Beige)         Price: Rs.1539</h3> <div class="cls"></div> <div class="item_desc_text line"> <div style="float:right"> </div>                         Genuine leather bag with no zip on top  just a loop to hold and clear stylish beauty.        </div> <div style="clear: both;"></div> </div>,<div class="item_left_column" id="specifications"> <h3 class="item_desc_title fk-uppercase">         Specifications of Lupine Bluerope Hand Bag (Blue::Beige)    </h3> <table cellspacing="0" class="fk-specs-type2"> <tr> <th class="group-head" colspan="2">General</th> </tr> <tr class=""> <td class="specs-key">Type</td> <td class="specs-value fk-data">Hand Bag</td> </tr> <tr class=""> <td class="specs-key">Ideal For</td> <td class="specs-value fk-data">Women</td> </tr> <tr class=""> <td class="specs-key">Material</td> <td class="specs-value fk-data">Genuine Leather</td> </tr> <tr class=""> <td class="specs-key">Style Code</td> <td class="specs-value fk-data">LB-1013</td> </tr> <tr class=""> <td class="specs-key">Color Code</td> <td class="specs-value fk-data">Blue::Beige</td> </tr> </table> <table cellspacing="0" class="fk-specs-type2"> <tr> <th class="group-head" colspan="2">Body Features</th> </tr> <tr class=""> <td class="specs-key">Number of Compartments</td> <td class="specs-value fk-data">0</td> </tr> </table> </div>,10:03:2014,None
LSTHMBDHGSYFGGY5NVUUSZDVO,Lupine Arum Hand Bag,http://www.flipkart.com/lifestyle/bags-wallets-belts/women?otracker=hp_nmenu_sub_women_1_Bags%2C%20Wallets%20and%20Belts,Rs. 2300,Bags  Wallets and Belts,Handbags,Lupine,http://img6a.flixcart.com/image/hand-messenger-bag/n/v/u/lb-1003-lupine-hand-bag-arum-400x400-imadhgsxz8hfngxg.jpeg,Rs. 2899,Brown,women,http://www.flipkart.com/lupine-arum-hand-bag/p/itmdpznahrgrf27e?pid=HMBDHGSYFGGY5NVU&srno=b_6&ref=f239b80e-8d50-408b-89d7-6072db65b44e,lupine,Lupine Arum Hand Bag Brown - Price in India | Flipkart.com,Flipkart.com: Buy Lupine Arum Hand Bag for Rs. 2300 from Flipkart.com. Only Genuine Products. 30 Day Replacement Guarantee. Free Shipping. Cash On,[],<div class="item_left_column" id="description"> <h3 class="item_desc_title fk-uppercase">Lupine Arum Hand Bag (Brown)         Price: Rs.2300</h3> <div class="cls"></div> <div class="item_desc_text line"> <div style="float:right"> </div>                         Genuine Leather bag with Zip pouch in lining and a mobile pocket.        </div> <div style="clear: both;"></div> </div>,<div class="item_left_column" id="specifications"> <h3 class="item_desc_title fk-uppercase">         Specifications of Lupine Arum Hand Bag (Brown)    </h3> <table cellspacing="0" class="fk-specs-type2"> <tr> <th class="group-head" colspan="2">General</th> </tr> <tr class=""> <td class="specs-key">Type</td> <td class="specs-value fk-data">Hand Bag</td> </tr> <tr class=""> <td class="specs-key">Ideal For</td> <td class="specs-value fk-data">Women</td> </tr> <tr class=""> <td class="specs-key">Material</td> <td class="specs-value fk-data">Genuine Leather</td> </tr> <tr class=""> <td class="specs-key">Style Code</td> <td class="specs-value fk-data">LB-1003</td> </tr> <tr class=""> <td class="specs-key">Color Code</td> <td class="specs-value fk-data">Brown</td> </tr> </table> <table cellspacing="0" class="fk-specs-type2"> <tr> <th class="group-head" colspan="2">Body Features</th> </tr> <tr class=""> <td class="specs-key">Number of Compartments</td> <td class="specs-value fk-data">1</td> </tr> </table> </div>,10:03:2014,None
LSTHMBDHGSYQDJHM7EBCORZBY,Lupine Thyme Hand Bag,http://www.flipkart.com/lifestyle/bags-wallets-belts/women?otracker=hp_nmenu_sub_women_1_Bags%2C%20Wallets%20and%20Belts,Rs. 1199,Bags  Wallets and Belts,Handbags,Lupine,http://img6a.flixcart.com/image/hand-messenger-bag/7/e/b/lb-1008-lupine-hand-bag-thyme-400x400-imadhgsxjkdfnfhw.jpeg,Rs. 1199,Beige,women,http://www.flipkart.com/lupine-thyme-hand-bag/p/itmdpznau9zxzghb?pid=HMBDHGSYQDJHM7EB&srno=b_2&ref=f239b80e-8d50-408b-89d7-6072db65b44e,lupine,Lupine Thyme Hand Bag Beige - Price in India | Flipkart.com,Flipkart.com: Buy Lupine Thyme Hand Bag for Rs. 1199 from Flipkart.com. Only Genuine Products. 30 Day Replacement Guarantee. Free Shipping. Cash On,[],<div class="item_left_column" id="description"> <h3 class="item_desc_title fk-uppercase">Lupine Thyme Hand Bag (Beige)         Price: Rs.1199</h3> <div class="cls"></div> <div class="item_desc_text line"> <div style="float:right"> </div>                         Genuine leather and canvas blended light weight ladies office bag  with inside provision for Mobile and a zip pocket.        </div> <div style="clear: both;"></div> </div>,<div class="item_left_column" id="specifications"> <h3 class="item_desc_title fk-uppercase">         Specifications of Lupine Thyme Hand Bag (Beige)    </h3> <table cellspacing="0" class="fk-specs-type2"> <tr> <th class="group-head" colspan="2">General</th> </tr> <tr class=""> <td class="specs-key">Type</td> <td class="specs-value fk-data">Hand Bag</td> </tr> <tr class=""> <td class="specs-key">Ideal For</td> <td class="specs-value fk-data">Women</td> </tr> <tr class=""> <td class="specs-key">Material</td> <td class="specs-value fk-data">Leather  Canvas</td> </tr> <tr class=""> <td class="specs-key">Style Code</td> <td class="specs-value fk-data">LB-1008</td> </tr> <tr class=""> <td class="specs-key">Color Code</td> <td class="specs-value fk-data">Beige</td> </tr> </table> <table cellspacing="0" class="fk-specs-type2"> <tr> <th class="group-head" colspan="2">Body Features</th> </tr> <tr class=""> <td class="specs-key">Number of Compartments</td> <td class="specs-value fk-data">1</td> </tr> </table> </div>,10:03:2014,None
LSTHMBDHZEEGHGRGNYQGS8BHR,Lupine Harmony Hand Bag,http://www.flipkart.com/lifestyle/bags-wallets-belts/women?otracker=hp_nmenu_sub_women_1_Bags%2C%20Wallets%20and%20Belts,Rs. 2449,Bags  Wallets and Belts,Handbags,Lupine,http://img5a.flixcart.com/image/hand-messenger-bag/n/y/q/lb-1029-lupine-hand-bag-harmony-400x400-imadhzjecbauw6cj.jpeg,Rs. 3499,Black  Silver,women,http://www.flipkart.com/lupine-harmony-hand-bag/p/itmdpznatx5nwgdh?pid=HMBDHZEEGHGRGNYQ&srno=b_10&ref=f239b80e-8d50-408b-89d7-6072db65b44e,lupine,Lupine Harmony Hand Bag Black::Silver - Price in India | Flipkart.com,Flipkart.com: Buy Lupine Harmony Hand Bag for Rs. 2449 from Flipkart.com. Only Genuine Products. 30 Day Replacement Guarantee. Free Shipping. Cash On,[],<div class="item_left_column" id="description"> <h3 class="item_desc_title fk-uppercase">Lupine Harmony Hand Bag (Black::Silver)         Price: Rs.2449</h3> <div class="cls"></div> <div class="item_desc_text line"> <div style="float:right"> </div>                         A stylish genuine leather bag a perfect friend in travel center long zip with strip of leather attached to the body  a blue colour leatherite on which decorate leather rounds are revetted artistically  with lineage on the handles too  makes the bag look beautiful        </div> <div style="clear: both;"></div> </div>,<div class="item_left_column" id="specifications"> <h3 class="item_desc_title fk-uppercase">         Specifications of Lupine Harmony Hand Bag (Black::Silver)    </h3> <table cellspacing="0" class="fk-specs-type2"> <tr> <th class="group-head" colspan="2">General</th> </tr> <tr class=""> <td class="specs-key">Type</td> <td class="specs-value fk-data">Hand Bag</td> </tr> <tr class=""> <td class="specs-key">Ideal For</td> <td class="specs-value fk-data">Women</td> </tr> <tr class=""> <td class="specs-key">Material</td> <td class="specs-value fk-data">Leather</td> </tr> <tr class=""> <td class="specs-key">Style Code</td> <td class="specs-value fk-data">LB-1029</td> </tr> <tr class=""> <td class="specs-key">Color Code</td> <td class="specs-value fk-data">Black::Silver</td> </tr> </table> <table cellspacing="0" class="fk-specs-type2"> <tr> <th class="group-head" colspan="2">Body Features</th> </tr> <tr class=""> <td class="specs-key">Number of Compartments</td> <td class="specs-value fk-data">1</td> </tr> </table> </div>,10:03:2014,None
LSTHMBDHZEEDN65GRHN7FQHXS,Lupine Toad Hand Bag,http://www.flipkart.com/lifestyle/bags-wallets-belts/women?otracker=hp_nmenu_sub_women_1_Bags%2C%20Wallets%20and%20Belts,Rs. 1299,Bags  Wallets and Belts,Handbags,Lupine,http://img5a.flixcart.com/image/hand-messenger-bag/r/h/n/lb-1022-lupine-hand-bag-toad-400x400-imadhzjegbpqzh6h.jpeg,Rs. 2999,Black  Grey,women,http://www.flipkart.com/lupine-toad-hand-bag/p/itmdpznae7vcyfzm?pid=HMBDHZEEDN65GRHN&srno=b_13&ref=f239b80e-8d50-408b-89d7-6072db65b44e,lupine,Lupine Toad Hand Bag Grey::Black - Price in India | Flipkart.com,Flipkart.com: Buy Lupine Toad Hand Bag for Rs. 1299 from Flipkart.com. Only Genuine Products. 30 Day Replacement Guarantee. Free Shipping. Cash On,[],<div class="item_left_column" id="description"> <h3 class="item_desc_title fk-uppercase">Lupine Toad Hand Bag (Grey::Black)         Price: Rs.1299</h3> <div class="cls"></div> <div class="item_desc_text line"> <div style="float:right"> </div>                         Superior canvas with genuine leather combination bag having following features superior quality canvas perfectly blended with genuine leather is stylish bag for all purpose.The bag is styling is blended with genuine leather at the bottom for longivity and also a strong lether handles for the shoulder wear. Added is detachable cotton sling that can be used fro cross body or heavy stuffing with collapsable leather patch that is fitted with invisible magnet.The bag has inside small pocket to keep essentials and there are three front pockets for easy picks and center pocket is again gaurded well by magnetic invisible snap button.Bag come with genuine letaher blended with premium canvas.Its a light grey colour premium canvas with black genuine leather trims.        </div> <div style="clear: both;"></div> </div>,<div class="item_left_column" id="specifications"> <h3 class="item_desc_title fk-uppercase">         Specifications of Lupine Toad Hand Bag (Grey::Black)    </h3> <table cellspacing="0" class="fk-specs-type2"> <tr> <th class="group-head" colspan="2">General</th> </tr> <tr class=""> <td class="specs-key">Type</td> <td class="specs-value fk-data">Hand Bag</td> </tr> <tr class=""> <td class="specs-key">Ideal For</td> <td class="specs-value fk-data">Women</td> </tr> <tr class=""> <td class="specs-key">Material</td> <td class="specs-value fk-data">Leather</td> </tr> <tr class=""> <td class="specs-key">Style Code</td> <td class="specs-value fk-data">LB-1022</td> </tr> <tr class=""> <td class="specs-key">Color Code</td> <td class="specs-value fk-data">Grey::Black</td> </tr> </table> <table cellspacing="0" class="fk-specs-type2"> <tr> <th class="group-head" colspan="2">Body Features</th> </tr> <tr class=""> <td class="specs-key">Number of Compartments</td> <td class="specs-value fk-data">1</td> </tr> </table> </div>,10:03:2014,None
LSTHMBDHZEEN2NJQFUG9L4BAP,Lupine Wisdom Hand Bag,http://www.flipkart.com/lifestyle/bags-wallets-belts/women?otracker=hp_nmenu_sub_women_1_Bags%2C%20Wallets%20and%20Belts,Rs. 1299,Bags  Wallets and Belts,Handbags,Lupine,http://img5a.flixcart.com/image/hand-messenger-bag/f/u/g/lb-1025-lupine-hand-bag-wisdom-400x400-imadhzjeb6q2nbkm.jpeg,Rs. 2999,Beige  White,women,http://www.flipkart.com/lupine-wisdom-hand-bag/p/itmdpznachmfwzx9?pid=HMBDHZEEN2NJQFUG&srno=b_11&ref=f239b80e-8d50-408b-89d7-6072db65b44e,lupine,Lupine Wisdom Hand Bag White::Beige White - Price in India | Flipkart.com,Flipkart.com: Buy Lupine Wisdom Hand Bag for Rs. 1299 from Flipkart.com. Only Genuine Products. 30 Day Replacement Guarantee. Free Shipping. Cash On,[],<div class="item_left_column" id="description"> <h3 class="item_desc_title fk-uppercase">Lupine Wisdom Hand Bag (White::Beige White)         Price: Rs.1299</h3> <div class="cls"></div> <div class="item_desc_text line"> <div style="float:right"> </div>                         A stylish canvas and genuine leather combination bag is for unisex.Features includes a high quality canvas and a genuine leather blended bag  that can used for office or to shop.The bag has two metal zip pockets in front with extra bead for expansion  and is well protected with strong revet for long life.Bag has 23 cms long small pouch inside the bag and has leather used at handle grip for longivity.This bag is in milky white colour canvas with tone in tone genuine leather combination is stylish bag.Its a milky white colour premium canvas with creamy genuine leather trims.Dimensions in cms L 42 x W 33 x D 18.        </div> <div style="clear: both;"></div> </div>,<div class="item_left_column" id="specifications"> <h3 class="item_desc_title fk-uppercase">         Specifications of Lupine Wisdom Hand Bag (White::Beige White)    </h3> <table cellspacing="0" class="fk-specs-type2"> <tr> <th class="group-head" colspan="2">General</th> </tr> <tr class=""> <td class="specs-key">Type</td> <td class="specs-value fk-data">Hand Bag</td> </tr> <tr class=""> <td class="specs-key">Ideal For</td> <td class="specs-value fk-data">Women</td> </tr> <tr class=""> <td class="specs-key">Material</td> <td class="specs-value fk-data">Leather</td> </tr> <tr class=""> <td class="specs-key">Style Code</td> <td class="specs-value fk-data">LB-1025</td> </tr> <tr class=""> <td class="specs-key">Color Code</td> <td class="specs-value fk-data">White::Beige White</td> </tr> </table> <table cellspacing="0" class="fk-specs-type2"> <tr> <th class="group-head" colspan="2">Body Features</th> </tr> <tr class=""> <td class="specs-key">Number of Compartments</td> <td class="specs-value fk-data">1</td> </tr> </table> </div>,10:03:2014,None
LSTHMBDHZEEAGGXA7GYLRWXFB,Lupine Alisier Hand Bag,http://www.flipkart.com/lifestyle/bags-wallets-belts/women?otracker=hp_nmenu_sub_women_1_Bags%2C%20Wallets%20and%20Belts,Rs. 2799,Bags  Wallets and Belts,Handbags,Lupine,http://img5a.flixcart.com/image/hand-messenger-bag/7/g/y/lb-1028-lupine-hand-bag-alisier-400x400-imadhzjehs3gxxsx.jpeg,Rs. 3999,Green,women,http://www.flipkart.com/lupine-alisier-hand-bag/p/itmdpzna7qdrynnz?pid=HMBDHZEEAGGXA7GY&srno=b_16&ref=b2c59b07-5219-4c13-9eb6-a2846557e293,lupine,Lupine Alisier Hand Bag Light Green - Price in India | Flipkart.com,Flipkart.com: Buy Lupine Alisier Hand Bag for Rs. 2799 from Flipkart.com. Only Genuine Products. 30 Day Replacement Guarantee. Free Shipping. Cash On,[],<div class="item_left_column" id="description"> <h3 class="item_desc_title fk-uppercase">Lupine Alisier Hand Bag (Light Green)         Price: Rs.2799</h3> <div class="cls"></div> <div class="item_desc_text line"> <div style="float:right"> </div>                         A stylish Genuine leather Bag a perfect friend in travel Center long zip with strip of leather attached to the body  A blue colour leatherite on which decorate leather rounds are revetted artistically  with lineage on the handles too  makes the bag look beautiful.Added is the front long zip pocket to keep essentials and inside the bag there is quite space and provision for Mobile and a zip pocket for saftey essentials.Dimensions in cms L43.5xW25xD 11.5.        </div> <div style="clear: both;"></div> </div>,<div class="item_left_column" id="specifications"> <h3 class="item_desc_title fk-uppercase">         Specifications of Lupine Alisier Hand Bag (Light Green)    </h3> <table cellspacing="0" class="fk-specs-type2"> <tr> <th class="group-head" colspan="2">General</th> </tr> <tr class=""> <td class="specs-key">Type</td> <td class="specs-value fk-data">Hand Bag</td> </tr> <tr class=""> <td class="specs-key">Ideal For</td> <td class="specs-value fk-data">Women</td> </tr> <tr class=""> <td class="specs-key">Material</td> <td class="specs-value fk-data">Leather</td> </tr> <tr class=""> <td class="specs-key">Style Code</td> <td class="specs-value fk-data">LB-1028</td> </tr> <tr class=""> <td class="specs-key">Color Code</td> <td class="specs-value fk-data">Light Green</td> </tr> </table> <table cellspacing="0" class="fk-specs-type2"> <tr> <th class="group-head" colspan="2">Body Features</th> </tr> <tr class=""> <td class="specs-key">Number of Compartments</td> <td class="specs-value fk-data">1</td> </tr> </table> </div>,10:03:2014,None
LSTHMBDHZEEYRJKVKEMCU4KZE,Lupine Trumpet Hand Bag,http://www.flipkart.com/lifestyle/bags-wallets-belts/women?otracker=hp_nmenu_sub_women_1_Bags%2C%20Wallets%20and%20Belts,Rs. 1299,Bags  Wallets and Belts,Handbags,Lupine,http://img5a.flixcart.com/image/hand-messenger-bag/k/e/m/lb-1023-lupine-hand-bag-trumpet-400x400-imadhzjeuyfwezar.jpeg,Rs. 2999,Black,women,http://www.flipkart.com/lupine-trumpet-hand-bag/p/itmdpznajz8nrhxp?pid=HMBDHZEEYRJKVKEM&srno=b_15&ref=f239b80e-8d50-408b-89d7-6072db65b44e,lupine,Lupine Trumpet Hand Bag Black - Price in India | Flipkart.com,Flipkart.com: Buy Lupine Trumpet Hand Bag for Rs. 1299 from Flipkart.com. Only Genuine Products. 30 Day Replacement Guarantee. Free Shipping. Cash On,[],<div class="item_left_column" id="description"> <h3 class="item_desc_title fk-uppercase">Lupine Trumpet Hand Bag (Black)         Price: Rs.1299</h3> <div class="cls"></div> <div class="item_desc_text line"> <div style="float:right"> </div>                         Superior canvas with genuine leather combination bag having following features superior quality canvas perfectly blended with genuine leather is stylish bag for all purpose.The bag is styling is blended with genuine leather at the bottom for longivity and also a strong lether handles for the shoulder wear. Added is detachable cotton sling that can be used fro cross body or heavy stuffing with collapsable leather patch that is fitted with invisible magnet.The bag has inside small pocket to keep essentials and there are three front pockets for easy picks and center pocket is again gaurded well by magnetic invisible snap button.Bag come with genuine letaher blended with premium canvas.Its a light grey colour premium canvas with black genuine leather trims.Dimensions in cms L 43.5 x W 43 x D 13.        </div> <div style="clear: both;"></div> </div>,<div class="item_left_column" id="specifications"> <h3 class="item_desc_title fk-uppercase">         Specifications of Lupine Trumpet Hand Bag (Black)    </h3> <table cellspacing="0" class="fk-specs-type2"> <tr> <th class="group-head" colspan="2">General</th> </tr> <tr class=""> <td class="specs-key">Type</td> <td class="specs-value fk-data">Hand Bag</td> </tr> <tr class=""> <td class="specs-key">Ideal For</td> <td class="specs-value fk-data">Women</td> </tr> <tr class=""> <td class="specs-key">Material</td> <td class="specs-value fk-data">Leather</td> </tr> <tr class=""> <td class="specs-key">Style Code</td> <td class="specs-value fk-data">LB-1023</td> </tr> <tr class=""> <td class="specs-key">Color Code</td> <td class="specs-value fk-data">Black</td> </tr> </table> <table cellspacing="0" class="fk-specs-type2"> <tr> <th class="group-head" colspan="2">Body Features</th> </tr> <tr class=""> <td class="specs-key">Number of Compartments</td> <td class="specs-value fk-data">1</td> </tr> </table> </div>,10:03:2014,None
LSTHMBDZ42GJZHSJF5NNXMKMY,Lupine Nergis Hand Bag,http://www.flipkart.com/lifestyle/bags-wallets-belts/women?otracker=hp_nmenu_sub_women_1_Bags%2C%20Wallets%20and%20Belts,Rs. 2399,Bags  Wallets and Belts,Handbags,Lupine,http://img5a.flixcart.com/image/hand-messenger-bag/f/5/n/lb-1034-lupine-hand-bag-nergis-400x400-imadz455swkyhz6y.jpeg,Rs. 2999,Orange,women,http://www.flipkart.com/lupine-nergis-hand-bag/p/itmdpznc9jgngyp5?pid=HMBDZ42GJZHSJF5N&srno=b_19&ref=b2c59b07-5219-4c13-9eb6-a2846557e293,lupine,Lupine Nergis Hand Bag Orange - Price in India | Flipkart.com,Flipkart.com: Buy Lupine Nergis Hand Bag for Rs. 2399 from Flipkart.com. Only Genuine Products. 30 Day Replacement Guarantee. Free Shipping. Cash On,[],<div class="item_left_column" id="description"> <h3 class="item_desc_title fk-uppercase">Lupine Nergis Hand Bag (Orange)         Price: Rs.2399</h3> <div class="cls"></div> <div class="item_desc_text line"> <div style="float:right"> </div>                         A stylish Genuine leather Bag. Dimensions in cm: L 33 x W 19 x D 8 cms  Bag has 61 cms Long shoulder  Two handles with two visible side pockets that has two leather strings for tightening Leather Bag has long Center Flap with magnetic snap button acts as additional Safety. There is long Zip on top with deep open pocket and has additional zip pocket on one side of the lining and separate slot for mobile.        </div> <div style="clear: both;"></div> </div>,<div class="item_left_column" id="specifications"> <h3 class="item_desc_title fk-uppercase">         Specifications of Lupine Nergis Hand Bag (Orange)    </h3> <table cellspacing="0" class="fk-specs-type2"> <tr> <th class="group-head" colspan="2">General</th> </tr> <tr class=""> <td class="specs-key">Type</td> <td class="specs-value fk-data">Hand Bag</td> </tr> <tr class=""> <td class="specs-key">Ideal For</td> <td class="specs-value fk-data">Women</td> </tr> <tr class=""> <td class="specs-key">Material</td> <td class="specs-value fk-data">Genuine Leather</td> </tr> <tr class=""> <td class="specs-key">Style Code</td> <td class="specs-value fk-data">LB-1034</td> </tr> <tr class=""> <td class="specs-key">Color Code</td> <td class="specs-value fk-data">Orange</td> </tr> </table> <table cellspacing="0" class="fk-specs-type2"> <tr> <th class="group-head" colspan="2">Body Features</th> </tr> <tr class=""> <td class="specs-key">Number of Compartments</td> <td class="specs-value fk-data">1</td> </tr> </table> </div>,10:03:2014,None
