LSTHMBDZM2TZBBFBFUVWFOFSG,Lupine Syringa Hand Bag,http://www.flipkart.com/lifestyle/bags-wallets-belts/women?otracker=hp_nmenu_sub_women_1_Bags%2C%20Wallets%20and%20Belts,Rs. 1999,Bags  Wallets and Belts,Handbags,Lupine,http://img6a.flixcart.com/image/hand-messenger-bag/f/u/v/lb-1063-lupine-hand-bag-syringa-400x400-imadzmn62fcvqwuz.jpeg,Rs. 2499,Blue,women,http://www.flipkart.com/lupine-syringa-hand-bag/p/itmdpzncrbteuwym?pid=HMBDZM2TZBBFBFUV&srno=b_37&ref=21319c83-07c6-48c5-a798-93f2fede9ddc,lupine,Lupine Syringa Hand Bag Blue - Price in India | Flipkart.com,Flipkart.com: Buy Lupine Syringa Hand Bag for Rs. 1999 from Flipkart.com. Only Genuine Products. 30 Day Replacement Guarantee. Free Shipping. Cash On,[],<div class="item_left_column" id="description"> <h3 class="item_desc_title fk-uppercase">Lupine Syringa Hand Bag (Blue)         Price: Rs.1999</h3> <div class="cls"></div> <div class="item_desc_text line"> <div style="float:right"> </div>                         Dimensions of the Bag L 21 X W 29 X D 13 cms. The Bag is Bag is made of leather look material(PU). With Center long zip for wider opening has a body lining zip on one side and other side has a mobile case and slip pocket. Bag has two handle with rings for easy handle movements.        </div> <div style="clear: both;"></div> </div>,<div class="item_left_column" id="specifications"> <h3 class="item_desc_title fk-uppercase">         Specifications of Lupine Syringa Hand Bag (Blue)    </h3> <table cellspacing="0" class="fk-specs-type2"> <tr> <th class="group-head" colspan="2">General</th> </tr> <tr class=""> <td class="specs-key">Type</td> <td class="specs-value fk-data">Hand Bag</td> </tr> <tr class=""> <td class="specs-key">Ideal For</td> <td class="specs-value fk-data">Women</td> </tr> <tr class=""> <td class="specs-key">Material</td> <td class="specs-value fk-data">Leatherite</td> </tr> <tr class=""> <td class="specs-key">Style Code</td> <td class="specs-value fk-data">LB-1063</td> </tr> <tr class=""> <td class="specs-key">Color Code</td> <td class="specs-value fk-data">Blue</td> </tr> </table> <table cellspacing="0" class="fk-specs-type2"> <tr> <th class="group-head" colspan="2">Body Features</th> </tr> <tr class=""> <td class="specs-key">Number of Compartments</td> <td class="specs-value fk-data">1</td> </tr> </table> </div>,10:03:2014,None
LSTHMBDZM2TXN5UJDZZWVOMGD,Lupine Speedwell Hand Bag,http://www.flipkart.com/lifestyle/bags-wallets-belts/women?otracker=hp_nmenu_sub_women_1_Bags%2C%20Wallets%20and%20Belts,Rs. 1899,Bags  Wallets and Belts,Handbags,Lupine,http://img5a.flixcart.com/image/hand-messenger-bag/d/z/z/lb-1059-lupine-hand-bag-speedwell-400x400-imadzmn6hbpaqfmv.jpeg,Rs. 2199,Pink,women,http://www.flipkart.com/lupine-speedwell-hand-bag/p/itmdpzncct27jahr?pid=HMBDZM2TXN5UJDZZ&srno=b_35&ref=21319c83-07c6-48c5-a798-93f2fede9ddc,lupine,Lupine Speedwell Hand Bag Pink - Price in India | Flipkart.com,Flipkart.com: Buy Lupine Speedwell Hand Bag for Rs. 1899 from Flipkart.com. Only Genuine Products. 30 Day Replacement Guarantee. Free Shipping. Cash On,[],<div class="item_left_column" id="description"> <h3 class="item_desc_title fk-uppercase">Lupine Speedwell Hand Bag (Pink)         Price: Rs.1899</h3> <div class="cls"></div> <div class="item_desc_text line"> <div style="float:right"> </div>                         Dimensions of the Bag L 26 X W 34.5 X D 11 cms. Bag is made of leather look material(PU) With Center long zip for wider opening has a body lining zip on one side and other side has a mobile case and slip pocket.        </div> <div style="clear: both;"></div> </div>,<div class="item_left_column" id="specifications"> <h3 class="item_desc_title fk-uppercase">         Specifications of Lupine Speedwell Hand Bag (Pink)    </h3> <table cellspacing="0" class="fk-specs-type2"> <tr> <th class="group-head" colspan="2">General</th> </tr> <tr class=""> <td class="specs-key">Type</td> <td class="specs-value fk-data">Hand Bag</td> </tr> <tr class=""> <td class="specs-key">Ideal For</td> <td class="specs-value fk-data">Women</td> </tr> <tr class=""> <td class="specs-key">Material</td> <td class="specs-value fk-data">Leatherite</td> </tr> <tr class=""> <td class="specs-key">Style Code</td> <td class="specs-value fk-data">LB-1059</td> </tr> <tr class=""> <td class="specs-key">Color Code</td> <td class="specs-value fk-data">Pink</td> </tr> </table> <table cellspacing="0" class="fk-specs-type2"> <tr> <th class="group-head" colspan="2">Body Features</th> </tr> <tr class=""> <td class="specs-key">Number of Compartments</td> <td class="specs-value fk-data">1</td> </tr> </table> </div>,10:03:2014,None
LSTHMBDZM2TKSA5XRPX279QNZ,Lupine Purity Hand Bag,http://www.flipkart.com/lifestyle/bags-wallets-belts/women?otracker=hp_nmenu_sub_women_1_Bags%2C%20Wallets%20and%20Belts,Rs. 3499,Bags  Wallets and Belts,Handbags,Lupine,http://img5a.flixcart.com/image/hand-messenger-bag/r/p/x/lb-1055-lupine-hand-bag-purity-400x400-imadzmn7fmprmqjh.jpeg,Rs. 4999,Beige  Red,women,http://www.flipkart.com/lupine-purity-hand-bag/p/itmdpzncnjxqktzh?pid=HMBDZM2TKSA5XRPX&srno=b_36&ref=21319c83-07c6-48c5-a798-93f2fede9ddc,lupine,Lupine Purity Hand Bag Beige::Red - Price in India | Flipkart.com,Flipkart.com: Buy Lupine Purity Hand Bag for Rs. 3499 from Flipkart.com. Only Genuine Products. 30 Day Replacement Guarantee. Free Shipping. Cash On,[],<div class="item_left_column" id="description"> <h3 class="item_desc_title fk-uppercase">Lupine Purity Hand Bag (Beige::Red)         Price: Rs.3499</h3> <div class="cls"></div> <div class="item_desc_text line"> <div style="float:right"> </div>                         Genuine letaher Hand Bag Dimensions of the Bag L 26 X W 42 X D 13 cms. This Genuine leather Hand bag from lupine is made with lots of detailing by revetting on leather  visible red is pu while beige is complete genuine leather. The Bag has both sides long zips and has main zip. The lining material has a seperate zip pocket and anothersdie of the lining has mobile casing. Here its a limited edition.        </div> <div style="clear: both;"></div> </div>,<div class="item_left_column" id="specifications"> <h3 class="item_desc_title fk-uppercase">         Specifications of Lupine Purity Hand Bag (Beige::Red)    </h3> <table cellspacing="0" class="fk-specs-type2"> <tr> <th class="group-head" colspan="2">General</th> </tr> <tr class=""> <td class="specs-key">Type</td> <td class="specs-value fk-data">Hand Bag</td> </tr> <tr class=""> <td class="specs-key">Ideal For</td> <td class="specs-value fk-data">Women</td> </tr> <tr class=""> <td class="specs-key">Material</td> <td class="specs-value fk-data">Genuine Leather</td> </tr> <tr class=""> <td class="specs-key">Style Code</td> <td class="specs-value fk-data">LB-1055</td> </tr> <tr class=""> <td class="specs-key">Color Code</td> <td class="specs-value fk-data">Beige::Red</td> </tr> </table> <table cellspacing="0" class="fk-specs-type2"> <tr> <th class="group-head" colspan="2">Body Features</th> </tr> <tr class=""> <td class="specs-key">Number of Compartments</td> <td class="specs-value fk-data">1</td> </tr> </table> </div>,10:03:2014,None
LSTHMBDZE7VATPXPJBGVXSNLE,Lupine Tares Hand Bag,http://www.flipkart.com/lifestyle/bags-wallets-belts/women?otracker=hp_nmenu_sub_women_1_Bags%2C%20Wallets%20and%20Belts,Rs. 3499,Bags  Wallets and Belts,Handbags,Lupine,http://img5a.flixcart.com/image/hand-messenger-bag/j/b/g/lb-1053-lupine-hand-bag-tares-400x400-imadzms9e8bgfvmr.jpeg,Rs. 4999,Green  Purple,women,http://www.flipkart.com/lupine-tares-hand-bag/p/itmdpznct2wcd34b?pid=HMBDZE7VATPXPJBG&srno=b_24&ref=b2c59b07-5219-4c13-9eb6-a2846557e293,lupine,Lupine Tares Hand Bag Purple::Green - Price in India | Flipkart.com,Flipkart.com: Buy Lupine Tares Hand Bag for Rs. 3499 from Flipkart.com. Only Genuine Products. 30 Day Replacement Guarantee. Free Shipping. Cash On,[],<div class="item_left_column" id="description"> <h3 class="item_desc_title fk-uppercase">Lupine Tares Hand Bag (Purple::Green)         Price: Rs.3499</h3> <div class="cls"></div> <div class="item_desc_text line"> <div style="float:right"> </div>                         Dimensions in cms :L 39 x W 33 x D 8 cms .The Unique edition leather Bag has suede leather on body with soft green leather as trims all over. The Bag has a small mini cross pocket infront and a zip pocket at the back. With long zip opens to main area in bag has zip lining and a pocket for mobile on ther side        </div> <div style="clear: both;"></div> </div>,<div class="item_left_column" id="specifications"> <h3 class="item_desc_title fk-uppercase">         Specifications of Lupine Tares Hand Bag (Purple::Green)    </h3> <table cellspacing="0" class="fk-specs-type2"> <tr> <th class="group-head" colspan="2">General</th> </tr> <tr class=""> <td class="specs-key">Type</td> <td class="specs-value fk-data">Hand Bag</td> </tr> <tr class=""> <td class="specs-key">Ideal For</td> <td class="specs-value fk-data">Women</td> </tr> <tr class=""> <td class="specs-key">Material</td> <td class="specs-value fk-data">Genuine Leather</td> </tr> <tr class=""> <td class="specs-key">Style Code</td> <td class="specs-value fk-data">LB-1053</td> </tr> <tr class=""> <td class="specs-key">Color Code</td> <td class="specs-value fk-data">Purple::Green</td> </tr> </table> <table cellspacing="0" class="fk-specs-type2"> <tr> <th class="group-head" colspan="2">Body Features</th> </tr> <tr class=""> <td class="specs-key">Number of Compartments</td> <td class="specs-value fk-data">1</td> </tr> </table> </div>,10:03:2014,None
LSTHMBDP2QFYK3FREXGENCB37,Lupine Nosegay Hand Bag,http://www.flipkart.com/lifestyle/bags-wallets-belts/women?otracker=hp_nmenu_sub_women_1_Bags%2C%20Wallets%20and%20Belts,Rs. 2099,Bags  Wallets and Belts,Handbags,Lupine,http://img6a.flixcart.com/image/hand-messenger-bag/e/x/g/lb-1088-lupine-hand-bag-nosegay-400x400-imadp5nxjwwfgmsm.jpeg,Rs. 2999,Blue  Yellow,women,http://www.flipkart.com/lupine-nosegay-hand-bag/p/itmdpzncheuhhfwm?pid=HMBDP2QFYK3FREXG&srno=b_38&ref=21319c83-07c6-48c5-a798-93f2fede9ddc,lupine,Lupine Nosegay Hand Bag Yellow::Blue - Price in India | Flipkart.com,Flipkart.com: Buy Lupine Nosegay Hand Bag for Rs. 2099 from Flipkart.com. Only Genuine Products. 30 Day Replacement Guarantee. Free Shipping. Cash On,[],<div class="item_left_column" id="description"> <h3 class="item_desc_title fk-uppercase">Lupine Nosegay Hand Bag (Yellow::Blue)         Price: Rs.2099</h3> <div class="cls"></div> <div class="item_desc_text line"> <div style="float:right"> </div>                         A Genuine leather ladies hand bag from Lupine dimensions in cms-L 30 x W 40 x D 14 cms this Genuine leather bag has a silk look poly lining with a zip on one side and a casing for mobile on the other side. The bag has lots of Inner space a great bag.        </div> <div style="clear: both;"></div> </div>,<div class="item_left_column" id="specifications"> <h3 class="item_desc_title fk-uppercase">         Specifications of Lupine Nosegay Hand Bag (Yellow::Blue)    </h3> <table cellspacing="0" class="fk-specs-type2"> <tr> <th class="group-head" colspan="2">General</th> </tr> <tr class=""> <td class="specs-key">Type</td> <td class="specs-value fk-data">Hand Bag</td> </tr> <tr class=""> <td class="specs-key">Ideal For</td> <td class="specs-value fk-data">Women</td> </tr> <tr class=""> <td class="specs-key">Material</td> <td class="specs-value fk-data">Genuine Leather</td> </tr> <tr class=""> <td class="specs-key">Style Code</td> <td class="specs-value fk-data">LB-1088</td> </tr> <tr class=""> <td class="specs-key">Color Code</td> <td class="specs-value fk-data">Yellow::Blue</td> </tr> </table> <table cellspacing="0" class="fk-specs-type2"> <tr> <th class="group-head" colspan="2">Body Features</th> </tr> <tr class=""> <td class="specs-key">Number of Compartments</td> <td class="specs-value fk-data">1</td> </tr> </table> </div>,10:03:2014,None
LSTHMBDSBEJGWFTNZ9PRPMMXZ,Lupine Vera Hand Bag,http://www.flipkart.com/lifestyle/bags-wallets-belts/women?otracker=hp_nmenu_sub_women_1_Bags%2C%20Wallets%20and%20Belts,Rs. 1099,Bags  Wallets and Belts,Handbags,Lupine,http://img5a.flixcart.com/image/hand-messenger-bag/z/9/p/lb-1092-lupine-hand-bag-vera-400x400-imadsbzdyp6ymc2b.jpeg,Rs. 1299,Red,women,http://www.flipkart.com/lupine-vera-hand-bag/p/itmdt5a23chzzsz7?pid=HMBDSBEJGWFTNZ9P&srno=b_40&ref=21319c83-07c6-48c5-a798-93f2fede9ddc,lupine,Lupine Vera Hand Bag Red - Price in India | Flipkart.com,Flipkart.com: Buy Lupine Vera Hand Bag for Rs. 1099 from Flipkart.com. Only Genuine Products. 30 Day Replacement Guarantee. Free Shipping. Cash On,[],<div class="item_left_column" id="description"> <h3 class="item_desc_title fk-uppercase">Lupine Vera Hand Bag (Red)         Price: Rs.1099</h3> <div class="cls"></div> <div class="item_desc_text line"> <div style="float:right"> </div>                         Dimensions of Bag in cms - L 32 x W 25 x D 9. Brocade and Red colour leatherite combination vertical bag. Bag has front two decoartive zips  which also act as feasible area for extra space. Bag has zip on top with lining with zipped pocket on one side &amp; mobile and little bigger pocket on the other side of lining. A long sturdy leatherite handles are perfect companion for shoulder.        </div> <div style="clear: both;"></div> </div>,<div class="item_left_column" id="specifications"> <h3 class="item_desc_title fk-uppercase">         Specifications of Lupine Vera Hand Bag (Red)    </h3> <table cellspacing="0" class="fk-specs-type2"> <tr> <th class="group-head" colspan="2">General</th> </tr> <tr class=""> <td class="specs-key">Type</td> <td class="specs-value fk-data">Hand Bag</td> </tr> <tr class=""> <td class="specs-key">Ideal For</td> <td class="specs-value fk-data">Women</td> </tr> <tr class=""> <td class="specs-key">Material</td> <td class="specs-value fk-data">Leatherite</td> </tr> <tr class=""> <td class="specs-key">Style Code</td> <td class="specs-value fk-data">LB-1099</td> </tr> <tr class=""> <td class="specs-key">Color Code</td> <td class="specs-value fk-data">Red</td> </tr> </table> <table cellspacing="0" class="fk-specs-type2"> <tr> <th class="group-head" colspan="2">Body Features</th> </tr> <tr class=""> <td class="specs-key">Number of Compartments</td> <td class="specs-value fk-data">1</td> </tr> </table> </div>,10:03:2014,None
LSTHMBDNYKESMYPGHNFZMJPGL,Lupine Rombus Hand Bag,http://www.flipkart.com/lifestyle/bags-wallets-belts/women?otracker=hp_nmenu_sub_women_1_Bags%2C%20Wallets%20and%20Belts,Rs. 1200,Bags  Wallets and Belts,Handbags,Lupine,http://img5a.flixcart.com/image/hand-messenger-bag/h/n/f/lb-1017-lupine-hand-bag-rombus-400x400-imadzkjac6k4hehh.jpeg,Rs. 1500,Black,women,http://www.flipkart.com/lupine-rombus-hand-bag/p/itmdpznbfqbfafhy?pid=HMBDNYKESMYPGHNF&srno=b_18&ref=b2c59b07-5219-4c13-9eb6-a2846557e293,lupine,Lupine Rombus Hand Bag Black - Price in India | Flipkart.com,Flipkart.com: Buy Lupine Rombus Hand Bag for Rs. 1200 from Flipkart.com. Only Genuine Products. 30 Day Replacement Guarantee. Free Shipping. Cash On,[],<div class="item_left_column" id="description"> <h3 class="item_desc_title fk-uppercase">Lupine Rombus Hand Bag (Black)         Price: Rs.1200</h3> <div class="cls"></div> <div class="item_desc_text line"> <div style="float:right"> </div>                         A stylish Genuine leather Bag a perfect friend in travel. Dimensions in cms : L26xW20xD10  Center long zip with strip of leather attached to the body  a delicate Square stitching in multi colours with beige Pipeing makes it look awesome. Added are the stylish small pipeing at the handles makes it cute bag. This bag is available in multi color stitching and stitching colors are red  blue  yellow  purple etc. you might receive any one of them.        </div> <div style="clear: both;"></div> </div>,<div class="item_left_column" id="specifications"> <h3 class="item_desc_title fk-uppercase">         Specifications of Lupine Rombus Hand Bag (Black)    </h3> <table cellspacing="0" class="fk-specs-type2"> <tr> <th class="group-head" colspan="2">General</th> </tr> <tr class=""> <td class="specs-key">Type</td> <td class="specs-value fk-data">Hand Bag</td> </tr> <tr class=""> <td class="specs-key">Ideal For</td> <td class="specs-value fk-data">Women</td> </tr> <tr class=""> <td class="specs-key">Material</td> <td class="specs-value fk-data">Genuine Leather</td> </tr> <tr class=""> <td class="specs-key">Style Code</td> <td class="specs-value fk-data">LB-1017</td> </tr> <tr class=""> <td class="specs-key">Color Code</td> <td class="specs-value fk-data">Black</td> </tr> </table> <table cellspacing="0" class="fk-specs-type2"> <tr> <th class="group-head" colspan="2">Body Features</th> </tr> <tr class=""> <td class="specs-key">Number of Compartments</td> <td class="specs-value fk-data">1</td> </tr> </table> </div>,10:03:2014,None
LSTHMBDP2QFK8UWU4ZAOMNCQZ,Lupine Saffron Hand Bag,http://www.flipkart.com/lifestyle/bags-wallets-belts/women?otracker=hp_nmenu_sub_women_1_Bags%2C%20Wallets%20and%20Belts,Rs. 839,Bags  Wallets and Belts,Handbags,Lupine,http://img6a.flixcart.com/image/hand-messenger-bag/4/z/a/lb-1056-lupine-hand-bag-saffron-400x400-imadp5nxcz8uqf4m.jpeg,Rs. 1199,Black,women,http://www.flipkart.com/lupine-saffron-hand-bag/p/itmdpznc5htnfzgn?pid=HMBDP2QFK8UWU4ZA&srno=b_39&ref=21319c83-07c6-48c5-a798-93f2fede9ddc,lupine,Lupine Saffron Hand Bag Black - Price in India | Flipkart.com,Flipkart.com: Buy Lupine Saffron Hand Bag for Rs. 839 from Flipkart.com. Only Genuine Products. 30 Day Replacement Guarantee. Free Shipping. Cash On,[],<div class="item_left_column" id="description"> <h3 class="item_desc_title fk-uppercase">Lupine Saffron Hand Bag (Black)         Price: Rs.839</h3> <div class="cls"></div> <div class="item_desc_text line"> <div style="float:right"> </div>                         Dimensions of the Bag L 27.5 X W 27.5 X D 9 cms. This limited edition Lupine Bag is made in genuine leather and has a main zip and a lining has a zip pouch and a mobile sleeve on otherside of the lining.        </div> <div style="clear: both;"></div> </div>,<div class="item_left_column" id="specifications"> <h3 class="item_desc_title fk-uppercase">         Specifications of Lupine Saffron Hand Bag (Black)    </h3> <table cellspacing="0" class="fk-specs-type2"> <tr> <th class="group-head" colspan="2">General</th> </tr> <tr class=""> <td class="specs-key">Type</td> <td class="specs-value fk-data">Hand Bag</td> </tr> <tr class=""> <td class="specs-key">Ideal For</td> <td class="specs-value fk-data">Women</td> </tr> <tr class=""> <td class="specs-key">Material</td> <td class="specs-value fk-data">Genuine Leather</td> </tr> <tr class=""> <td class="specs-key">Style Code</td> <td class="specs-value fk-data">LB-1056</td> </tr> <tr class=""> <td class="specs-key">Color Code</td> <td class="specs-value fk-data">Black</td> </tr> </table> <table cellspacing="0" class="fk-specs-type2"> <tr> <th class="group-head" colspan="2">Body Features</th> </tr> <tr class=""> <td class="specs-key">Number of Compartments</td> <td class="specs-value fk-data">1</td> </tr> </table> </div>,10:03:2014,None
LSTHMBDTD46BHXGWGZNFYJ3F8,Lupine Presage Hand Bag,http://www.flipkart.com/lifestyle/bags-wallets-belts/women?otracker=hp_nmenu_sub_women_1_Bags%2C%20Wallets%20and%20Belts,Rs. 5500,Bags  Wallets and Belts,Handbags,Lupine,http://img6a.flixcart.com/image/hand-messenger-bag/g/z/n/lb-1100-lupine-hand-bag-presage-400x400-imadtdtgbmpcrpm3.jpeg,Rs. 5500,Brown  Yellow,women,http://www.flipkart.com/lupine-presage-hand-bag/p/itmdtd46xuehvvep?pid=HMBDTD46BHXGWGZN&srno=b_43&ref=21319c83-07c6-48c5-a798-93f2fede9ddc,lupine,Lupine Presage Hand Bag Brown  Yellow - Price in India | Flipkart.com,Flipkart.com: Buy Lupine Presage Hand Bag for Rs. 5500 from Flipkart.com. Only Genuine Products. 30 Day Replacement Guarantee. Free Shipping. Cash On,[],<div class="item_left_column" id="description"> <h3 class="item_desc_title fk-uppercase">Lupine Presage Hand Bag (Brown  Yellow)         Price: Rs.5500</h3> <div class="cls"></div> <div class="item_desc_text line"> <div style="float:right"> </div>                         Dimensions of the bag  h 29 x w 36 x d 11 cms. Genuine leather hand bag from lupine  made in crocodile grain and nubuck leather combination trims  bag is simple but stylish. The bag has long zip opening with zip pocket on lining and a mobile casing and a card holder casing. A limited edition bag.        </div> <div style="clear: both;"></div> </div>,<div class="item_left_column" id="specifications"> <h3 class="item_desc_title fk-uppercase">         Specifications of Lupine Presage Hand Bag (Brown  Yellow)    </h3> <table cellspacing="0" class="fk-specs-type2"> <tr> <th class="group-head" colspan="2">General</th> </tr> <tr class=""> <td class="specs-key">Type</td> <td class="specs-value fk-data">Hand Bag</td> </tr> <tr class=""> <td class="specs-key">Ideal For</td> <td class="specs-value fk-data">Women</td> </tr> <tr class=""> <td class="specs-key">Material</td> <td class="specs-value fk-data">Genuine Leather</td> </tr> <tr class=""> <td class="specs-key">Style Code</td> <td class="specs-value fk-data">LB-1100</td> </tr> <tr class=""> <td class="specs-key">Color Code</td> <td class="specs-value fk-data">Brown  Yellow</td> </tr> </table> <table cellspacing="0" class="fk-specs-type2"> <tr> <th class="group-head" colspan="2">Body Features</th> </tr> <tr class=""> <td class="specs-key">Number of Compartments</td> <td class="specs-value fk-data">1</td> </tr> </table> </div>,10:03:2014,None
LSTHMBDTD469RNDDGVZCALYDZ,Lupine Happiness Hand Bag,http://www.flipkart.com/lifestyle/bags-wallets-belts/women?otracker=hp_nmenu_sub_women_1_Bags%2C%20Wallets%20and%20Belts,Rs. 5500,Bags  Wallets and Belts,Handbags,Lupine,http://img6a.flixcart.com/image/hand-messenger-bag/g/v/z/lb-1102-lupine-hand-bag-happiness-400x400-imadtdtd5ndtjgf3.jpeg,Rs. 5500,White,women,http://www.flipkart.com/lupine-happiness-hand-bag/p/itmdtd466krzeghg?pid=HMBDTD469RNDDGVZ&srno=b_42&ref=21319c83-07c6-48c5-a798-93f2fede9ddc,lupine,Lupine Happiness Hand Bag White - Price in India | Flipkart.com,Flipkart.com: Buy Lupine Happiness Hand Bag for Rs. 5500 from Flipkart.com. Only Genuine Products. 30 Day Replacement Guarantee. Free Shipping. Cash On,[],<div class="item_left_column" id="description"> <h3 class="item_desc_title fk-uppercase">Lupine Happiness Hand Bag (White)         Price: Rs.5500</h3> <div class="cls"></div> <div class="item_desc_text line"> <div style="float:right"> </div>                         Dimensions of the bag  h 28 x w 44 x d 11 cms. Genuine leather cut into strips and woven bag  this limited edition lupine bag has front zip pocket for easy pick things. The main zip has wide opening  with three sleeve areas  middle portion is for the laptop  and other two sides are for your storage of files and papers  one side of lining has again a added zip pocket and other side has casing for mobile and cards. All metal fittings are antique in colour and are unique  bag comes with bottom bushes for longevity of leather.        </div> <div style="clear: both;"></div> </div>,<div class="item_left_column" id="specifications"> <h3 class="item_desc_title fk-uppercase">         Specifications of Lupine Happiness Hand Bag (White)    </h3> <table cellspacing="0" class="fk-specs-type2"> <tr> <th class="group-head" colspan="2">General</th> </tr> <tr class=""> <td class="specs-key">Type</td> <td class="specs-value fk-data">Hand Bag</td> </tr> <tr class=""> <td class="specs-key">Ideal For</td> <td class="specs-value fk-data">Women</td> </tr> <tr class=""> <td class="specs-key">Material</td> <td class="specs-value fk-data">Genuine Leather</td> </tr> <tr class=""> <td class="specs-key">Style Code</td> <td class="specs-value fk-data">LB-1102</td> </tr> <tr class=""> <td class="specs-key">Color Code</td> <td class="specs-value fk-data">White</td> </tr> </table> <table cellspacing="0" class="fk-specs-type2"> <tr> <th class="group-head" colspan="2">Body Features</th> </tr> <tr class=""> <td class="specs-key">Number of Compartments</td> <td class="specs-value fk-data">2</td> </tr> </table> </div>,10:03:2014,None
