LSTHMBDHZEEGZZWUZESFJMQPF,Lupine Ble Hand Bag,http://www.flipkart.com/lifestyle/bags-wallets-belts/women?otracker=hp_nmenu_sub_women_1_Bags%2C%20Wallets%20and%20Belts,Rs. 1299,Bags  Wallets and Belts,Handbags,Lupine,http://img5a.flixcart.com/image/hand-messenger-bag/z/e/s/lb-1027-lupine-hand-bag-ble-400x400-imadhzjerdbqa77g.jpeg,Rs. 2999,Black  Grey,women,http://www.flipkart.com/lupine-ble-hand-bag/p/itmdpznaswhrfhbc?pid=HMBDHZEEGZZWUZES&srno=b_9&ref=f239b80e-8d50-408b-89d7-6072db65b44e,lupine,Lupine Ble Hand Bag Grey::Black - Price in India | Flipkart.com,Flipkart.com: Buy Lupine Ble Hand Bag for Rs. 1299 from Flipkart.com. Only Genuine Products. 30 Day Replacement Guarantee. Free Shipping. Cash On,[],<div class="item_left_column" id="description"> <h3 class="item_desc_title fk-uppercase">Lupine Ble Hand Bag (Grey::Black)         Price: Rs.1299</h3> <div class="cls"></div> <div class="item_desc_text line"> <div style="float:right"> </div>                         A stylish Canvas and genuine leather combination Bag is for unisex.Features includes a high quality Canvas and a genuine leather Blended Bag  that can used for Office or to shop.The bag has two metal zip pockets in front with extra bead for expansion  and is well protected with strong revet for long life.Bag has 23 cms long small pouch inside the bag and has leather used at handle grip for longivity.This Bag is in light Grey colour canvas with Black genuine leather combination is stylish bag.Dimensions in cms L 42 x W 33 x D 18.        </div> <div style="clear: both;"></div> </div>,<div class="item_left_column" id="specifications"> <h3 class="item_desc_title fk-uppercase">         Specifications of Lupine Ble Hand Bag (Grey::Black)    </h3> <table cellspacing="0" class="fk-specs-type2"> <tr> <th class="group-head" colspan="2">General</th> </tr> <tr class=""> <td class="specs-key">Type</td> <td class="specs-value fk-data">Hand Bag</td> </tr> <tr class=""> <td class="specs-key">Ideal For</td> <td class="specs-value fk-data">Women</td> </tr> <tr class=""> <td class="specs-key">Material</td> <td class="specs-value fk-data">Leather</td> </tr> <tr class=""> <td class="specs-key">Style Code</td> <td class="specs-value fk-data">LB-1027</td> </tr> <tr class=""> <td class="specs-key">Color Code</td> <td class="specs-value fk-data">Grey::Black</td> </tr> </table> <table cellspacing="0" class="fk-specs-type2"> <tr> <th class="group-head" colspan="2">Body Features</th> </tr> <tr class=""> <td class="specs-key">Number of Compartments</td> <td class="specs-value fk-data">1</td> </tr> </table> </div>,10:03:2014,None
LSTHMBDHREBDGQNBXDGYWLNFM,Lupine Double Strip Hand Bag,http://www.flipkart.com/lifestyle/bags-wallets-belts/women?otracker=hp_nmenu_sub_women_1_Bags%2C%20Wallets%20and%20Belts,Rs. 2799,Bags  Wallets and Belts,Handbags,Lupine,http://img6a.flixcart.com/image/hand-messenger-bag/x/d/g/lb-1014-lupine-hand-bag-double-strip-400x400-imadhrjkpb686xjv.jpeg,Rs. 3999,Beige  Brown,women,http://www.flipkart.com/lupine-double-strip-hand-bag/p/itmdpznbgajkuhsq?pid=HMBDHREBDGQNBXDG&srno=b_8&ref=f239b80e-8d50-408b-89d7-6072db65b44e,lupine,Lupine Double Strip Hand Bag Brown::Beige - Price in India | Flipkart.com,Flipkart.com: Buy Lupine Double Strip Hand Bag for Rs. 2799 from Flipkart.com. Only Genuine Products. 30 Day Replacement Guarantee. Free Shipping. Cash On,[],<div class="item_left_column" id="description"> <h3 class="item_desc_title fk-uppercase">Lupine Double Strip Hand Bag (Brown::Beige)         Price: Rs.2799</h3> <div class="cls"></div> <div class="item_desc_text line"> <div style="float:right"> </div>                         A stylish Genuine leather Bag a perfect friend in travel  Dimensions (cms): 52 (L) x 34 (W) x 15 (D)  Center long zip for total protection and there is additional zip pocket inside the Bag for essentials and a slot for mobile case.        </div> <div style="clear: both;"></div> </div>,<div class="item_left_column" id="specifications"> <h3 class="item_desc_title fk-uppercase">         Specifications of Lupine Double Strip Hand Bag (Brown::Beige)    </h3> <table cellspacing="0" class="fk-specs-type2"> <tr> <th class="group-head" colspan="2">General</th> </tr> <tr class=""> <td class="specs-key">Type</td> <td class="specs-value fk-data">Hand Bag</td> </tr> <tr class=""> <td class="specs-key">Ideal For</td> <td class="specs-value fk-data">Women</td> </tr> <tr class=""> <td class="specs-key">Material</td> <td class="specs-value fk-data">Leather</td> </tr> <tr class=""> <td class="specs-key">Style Code</td> <td class="specs-value fk-data">LB-1014</td> </tr> <tr class=""> <td class="specs-key">Color Code</td> <td class="specs-value fk-data">Brown::Beige</td> </tr> </table> <table cellspacing="0" class="fk-specs-type2"> <tr> <th class="group-head" colspan="2">Body Features</th> </tr> <tr class=""> <td class="specs-key">Number of Compartments</td> <td class="specs-value fk-data">1</td> </tr> </table> </div>,10:03:2014,None
LSTHMBDHRP8CEBZPFCEBIQKIE,Lupine Double Strip BK Hand Bag,http://www.flipkart.com/lifestyle/bags-wallets-belts/women?otracker=hp_nmenu_sub_women_1_Bags%2C%20Wallets%20and%20Belts,Rs. 2799,Bags  Wallets and Belts,Handbags,Lupine,http://img5a.flixcart.com/image/hand-messenger-bag/f/c/e/lb-1015-lupine-hand-bag-double-strip-bk-400x400-imadhsee5ywxfqb3.jpeg,Rs. 3999,Beige  Black,women,http://www.flipkart.com/lupine-double-strip-bk-hand-bag/p/itmdpznbx96qshuh?pid=HMBDHRP8CEBZPFCE&srno=b_1&ref=f239b80e-8d50-408b-89d7-6072db65b44e,lupine,Lupine Double Strip BK Hand Bag Black::Beige - Price in India | Flipkart.com,Flipkart.com: Buy Lupine Double Strip BK Hand Bag for Rs. 2799 from Flipkart.com. Only Genuine Products. 30 Day Replacement Guarantee. Free Shipping. Cash On,[],<div class="item_left_column" id="description"> <h3 class="item_desc_title fk-uppercase">Lupine Double Strip BK Hand Bag (Black::Beige)         Price: Rs.2799</h3> <div class="cls"></div> <div class="item_desc_text line"> <div style="float:right"> </div>                         A stylish genuine leather bag a perfect friend in travel. Center long zip for total protection and there is additional zip pocket inside the bag for essentials and a slot for mobile case.        </div> <div style="clear: both;"></div> </div>,<div class="item_left_column" id="specifications"> <h3 class="item_desc_title fk-uppercase">         Specifications of Lupine Double Strip BK Hand Bag (Black::Beige)    </h3> <table cellspacing="0" class="fk-specs-type2"> <tr> <th class="group-head" colspan="2">General</th> </tr> <tr class=""> <td class="specs-key">Type</td> <td class="specs-value fk-data">Hand Bag</td> </tr> <tr class=""> <td class="specs-key">Ideal For</td> <td class="specs-value fk-data">Women</td> </tr> <tr class=""> <td class="specs-key">Material</td> <td class="specs-value fk-data">Leather</td> </tr> <tr class=""> <td class="specs-key">Style Code</td> <td class="specs-value fk-data">LB-1015</td> </tr> <tr class=""> <td class="specs-key">Color Code</td> <td class="specs-value fk-data">Black::Beige</td> </tr> </table> <table cellspacing="0" class="fk-specs-type2"> <tr> <th class="group-head" colspan="2">Body Features</th> </tr> <tr class=""> <td class="specs-key">Number of Compartments</td> <td class="specs-value fk-data">1</td> </tr> </table> <table cellspacing="0" class="fk-specs-type2"> <tr> <th class="group-head" colspan="2">Dimensions</th> </tr> <tr class=""> <td class="specs-key">Width</td> <td class="specs-value fk-data">340 mm</td> </tr> <tr class=""> <td class="specs-key">Height</td> <td class="specs-value fk-data">520 mm</td> </tr> <tr class=""> <td class="specs-key">Depth</td> <td class="specs-value fk-data">150 mm</td> </tr> </table> </div>,10:03:2014,None
LSTHMBDZE7VZWUUWTNFTPJLMZ,Lupine Rue Hand Bag,http://www.flipkart.com/lifestyle/bags-wallets-belts/women?otracker=hp_nmenu_sub_women_1_Bags%2C%20Wallets%20and%20Belts,Rs. 2589,Bags  Wallets and Belts,Handbags,Lupine,http://img5a.flixcart.com/image/hand-messenger-bag/t/n/f/lb-1051-lupine-hand-bag-rue-400x400-imadzkjhcr9tpwcx.jpeg,Rs. 3699,Brown,women,http://www.flipkart.com/lupine-rue-hand-bag/p/itmdpzncwarsuztg?pid=HMBDZE7VZWUUWTNF&srno=b_23&ref=b2c59b07-5219-4c13-9eb6-a2846557e293,lupine,Lupine Rue Hand Bag Brown - Price in India | Flipkart.com,Flipkart.com: Buy Lupine Rue Hand Bag for Rs. 2589 from Flipkart.com. Only Genuine Products. 30 Day Replacement Guarantee. Free Shipping. Cash On,[],<div class="item_left_column" id="description"> <h3 class="item_desc_title fk-uppercase">Lupine Rue Hand Bag (Brown)         Price: Rs.2589</h3> <div class="cls"></div> <div class="item_desc_text line"> <div style="float:right"> </div>                         Genuine Leather Hand Bag. Dimensions in cms :L 25 x W 38 x D 11 cms. This elegant design Genuine leather bag from lupine is special edition with crocodile look print leather that is joined in artistic way and left as raw at edges to feel. Bag has an elegant handle with two main zips for open area.One lining side has zip pocket and otherside has mobile casing pouch.        </div> <div style="clear: both;"></div> </div>,<div class="item_left_column" id="specifications"> <h3 class="item_desc_title fk-uppercase">         Specifications of Lupine Rue Hand Bag (Brown)    </h3> <table cellspacing="0" class="fk-specs-type2"> <tr> <th class="group-head" colspan="2">General</th> </tr> <tr class=""> <td class="specs-key">Type</td> <td class="specs-value fk-data">Hand Bag</td> </tr> <tr class=""> <td class="specs-key">Ideal For</td> <td class="specs-value fk-data">Women</td> </tr> <tr class=""> <td class="specs-key">Material</td> <td class="specs-value fk-data">Genuine Leather</td> </tr> <tr class=""> <td class="specs-key">Style Code</td> <td class="specs-value fk-data">LB-1051</td> </tr> <tr class=""> <td class="specs-key">Color Code</td> <td class="specs-value fk-data">Brown</td> </tr> </table> <table cellspacing="0" class="fk-specs-type2"> <tr> <th class="group-head" colspan="2">Body Features</th> </tr> <tr class=""> <td class="specs-key">Number of Compartments</td> <td class="specs-value fk-data">2</td> </tr> </table> </div>,10:03:2014,None
LSTHMBDZ42GH4V84JWKTGHSSQ,Lupine Alyssa Hand Bag,http://www.flipkart.com/lifestyle/bags-wallets-belts/women?otracker=hp_nmenu_sub_women_1_Bags%2C%20Wallets%20and%20Belts,Rs. 2099,Bags  Wallets and Belts,Handbags,Lupine,http://img6a.flixcart.com/image/hand-messenger-bag/j/w/k/lb-1043-lupine-hand-bag-alyssa-400x400-imadz455hchhgvd5.jpeg,Rs. 2999,Black  Blue,women,http://www.flipkart.com/lupine-alyssa-hand-bag/p/itmdpznc64ucbaae?pid=HMBDZ42GH4V84JWK&srno=b_21&ref=b2c59b07-5219-4c13-9eb6-a2846557e293,lupine,Lupine Alyssa Hand Bag Black  Blue - Price in India | Flipkart.com,Flipkart.com: Buy Lupine Alyssa Hand Bag for Rs. 2099 from Flipkart.com. Only Genuine Products. 30 Day Replacement Guarantee. Free Shipping. Cash On,[],<div class="item_left_column" id="description"> <h3 class="item_desc_title fk-uppercase">Lupine Alyssa Hand Bag (Black  Blue)         Price: Rs.2099</h3> <div class="cls"></div> <div class="item_desc_text line"> <div style="float:right"> </div>                         A Genuine leather Bag. Dimensions in cm: L 46 x W 24 x D 11 cms  Genuine leather Bag has Front visible pocket guarded by two magnetic snap buttons. The two Handles held by four strong buckles. Bag has long center Zip as additional safety. Inside the bag has center long lining as divider long deep pocket with side zip pouch on one side of the lining.        </div> <div style="clear: both;"></div> </div>,<div class="item_left_column" id="specifications"> <h3 class="item_desc_title fk-uppercase">         Specifications of Lupine Alyssa Hand Bag (Black  Blue)    </h3> <table cellspacing="0" class="fk-specs-type2"> <tr> <th class="group-head" colspan="2">General</th> </tr> <tr class=""> <td class="specs-key">Type</td> <td class="specs-value fk-data">Hand Bag</td> </tr> <tr class=""> <td class="specs-key">Ideal For</td> <td class="specs-value fk-data">Women</td> </tr> <tr class=""> <td class="specs-key">Material</td> <td class="specs-value fk-data">Genuine Leather</td> </tr> <tr class=""> <td class="specs-key">Style Code</td> <td class="specs-value fk-data">LB-1043</td> </tr> <tr class=""> <td class="specs-key">Color Code</td> <td class="specs-value fk-data">Black  Blue</td> </tr> </table> <table cellspacing="0" class="fk-specs-type2"> <tr> <th class="group-head" colspan="2">Body Features</th> </tr> <tr class=""> <td class="specs-key">Number of Compartments</td> <td class="specs-value fk-data">1</td> </tr> </table> </div>,10:03:2014,None
LSTHMBDHREBZDSBGMMBEE6VKT,Lupine DOUBLE STRIP hlfbr Hand Bag,http://www.flipkart.com/lifestyle/bags-wallets-belts/women?otracker=hp_nmenu_sub_women_1_Bags%2C%20Wallets%20and%20Belts,Rs. 3399,Bags  Wallets and Belts,Handbags,Lupine,http://img6a.flixcart.com/image/hand-messenger-bag/m/m/b/lb-1016-lupine-hand-bag-double-strip-hlfbr-400x400-imadhrjkkmhr4ru8.jpeg,Rs. 3999,Beige  Brown,women,http://www.flipkart.com/lupine-double-strip-hlfbr-hand-bag/p/itmdpznbuhhhhtsx?pid=HMBDHREBZDSBGMMB&srno=b_7&ref=f239b80e-8d50-408b-89d7-6072db65b44e,lupine,Lupine DOUBLE STRIP hlfbr Hand Bag Brown::Beige - Price in India | Flipkart.com,Flipkart.com: Buy Lupine DOUBLE STRIP hlfbr Hand Bag for Rs. 3399 from Flipkart.com. Only Genuine Products. 30 Day Replacement Guarantee. Free Shipping. Cash On,[],<div class="item_left_column" id="description"> <h3 class="item_desc_title fk-uppercase">Lupine DOUBLE STRIP hlfbr Hand Bag (Brown::Beige)         Price: Rs.3399</h3> <div class="cls"></div> <div class="item_desc_text line"> <div style="float:right"> </div>                         A stylish Genuine leather Bag a perfect friend in travel with special colour half each of Brown and Beige on one side Dimensions (cms): 52 (L) x 34 (W) x 15 (D)  Center long zip for total protection and there is additional zip pocket inside the Bag for essentials and a slot for mobile case.        </div> <div style="clear: both;"></div> </div>,<div class="item_left_column" id="specifications"> <h3 class="item_desc_title fk-uppercase">         Specifications of Lupine DOUBLE STRIP hlfbr Hand Bag (Brown::Beige)    </h3> <table cellspacing="0" class="fk-specs-type2"> <tr> <th class="group-head" colspan="2">General</th> </tr> <tr class=""> <td class="specs-key">Type</td> <td class="specs-value fk-data">Hand Bag</td> </tr> <tr class=""> <td class="specs-key">Ideal For</td> <td class="specs-value fk-data">Women</td> </tr> <tr class=""> <td class="specs-key">Material</td> <td class="specs-value fk-data">Leather</td> </tr> <tr class=""> <td class="specs-key">Style Code</td> <td class="specs-value fk-data">LB-1016</td> </tr> <tr class=""> <td class="specs-key">Color Code</td> <td class="specs-value fk-data">Brown::Beige</td> </tr> </table> <table cellspacing="0" class="fk-specs-type2"> <tr> <th class="group-head" colspan="2">Body Features</th> </tr> <tr class=""> <td class="specs-key">Number of Compartments</td> <td class="specs-value fk-data">1</td> </tr> </table> </div>,10:03:2014,None
LSTHMBDZ42GNAD5MM5ZLNDHFN,Lupine Alysa Hand Bag,http://www.flipkart.com/lifestyle/bags-wallets-belts/women?otracker=hp_nmenu_sub_women_1_Bags%2C%20Wallets%20and%20Belts,Rs. 2099,Bags  Wallets and Belts,Handbags,Lupine,http://img6a.flixcart.com/image/hand-messenger-bag/m/5/z/lb-1042-lupine-hand-bag-alysa-400x400-imadz454dcj36dqn.jpeg,Rs. 2999,Beige  Blue,women,http://www.flipkart.com/lupine-alysa-hand-bag/p/itmdpznc7dych3rv?pid=HMBDZ42GNAD5MM5Z&srno=b_22&ref=b2c59b07-5219-4c13-9eb6-a2846557e293,lupine,Lupine Alysa Hand Bag Beige  Blue - Price in India | Flipkart.com,Flipkart.com: Buy Lupine Alysa Hand Bag for Rs. 2099 from Flipkart.com. Only Genuine Products. 30 Day Replacement Guarantee. Free Shipping. Cash On,[],<div class="item_left_column" id="description"> <h3 class="item_desc_title fk-uppercase">Lupine Alysa Hand Bag (Beige  Blue)         Price: Rs.2099</h3> <div class="cls"></div> <div class="item_desc_text line"> <div style="float:right"> </div>                         A Genuine leather Bag. Dimensions in cm: L 46 x W 24 x D 11 cms  Genuine leather Bag has Front visible pocket guarded by two magnetic snap buttons. The two Handles held by four strong buckles. Bag has long center Zip as additional safety. Inside the bag has center long lining as divider long deep pocket with side zip pouch on one side of the lining.        </div> <div style="clear: both;"></div> </div>,<div class="item_left_column" id="specifications"> <h3 class="item_desc_title fk-uppercase">         Specifications of Lupine Alysa Hand Bag (Beige  Blue)    </h3> <table cellspacing="0" class="fk-specs-type2"> <tr> <th class="group-head" colspan="2">General</th> </tr> <tr class=""> <td class="specs-key">Type</td> <td class="specs-value fk-data">Hand Bag</td> </tr> <tr class=""> <td class="specs-key">Ideal For</td> <td class="specs-value fk-data">Women</td> </tr> <tr class=""> <td class="specs-key">Material</td> <td class="specs-value fk-data">Genuine Leather</td> </tr> <tr class=""> <td class="specs-key">Style Code</td> <td class="specs-value fk-data">LB-1042</td> </tr> <tr class=""> <td class="specs-key">Color Code</td> <td class="specs-value fk-data">Beige  Blue</td> </tr> </table> <table cellspacing="0" class="fk-specs-type2"> <tr> <th class="group-head" colspan="2">Body Features</th> </tr> <tr class=""> <td class="specs-key">Number of Compartments</td> <td class="specs-value fk-data">1</td> </tr> </table> </div>,10:03:2014,None
LSTHMBDZE7VNMKZWTZTRDIDKD,Lupine Arrosa Hand Bag,http://www.flipkart.com/lifestyle/bags-wallets-belts/women?otracker=hp_nmenu_sub_women_1_Bags%2C%20Wallets%20and%20Belts,Rs. 2099,Bags  Wallets and Belts,Handbags,Lupine,http://img6a.flixcart.com/image/hand-messenger-bag/t/z/t/lb-1044-lupine-hand-bag-arrosa-400x400-imadzkjbgnyr5rsc.jpeg,Rs. 4200,Beige  Brown,women,http://www.flipkart.com/lupine-arrosa-hand-bag/p/itmdpznc2nhxfyft?pid=HMBDZE7VNMKZWTZT&srno=b_25&ref=b2c59b07-5219-4c13-9eb6-a2846557e293,lupine,Lupine Arrosa Hand Bag Beige::Brown - Price in India | Flipkart.com,Flipkart.com: Buy Lupine Arrosa Hand Bag for Rs. 2099 from Flipkart.com. Only Genuine Products. 30 Day Replacement Guarantee. Free Shipping. Cash On,[],<div class="item_left_column" id="description"> <h3 class="item_desc_title fk-uppercase">Lupine Arrosa Hand Bag (Beige::Brown)         Price: Rs.2099</h3> <div class="cls"></div> <div class="item_desc_text line"> <div style="float:right"> </div>                         A Genuine leather Bag. Dimensions in cms : L 30 x W 36 x D 11 cms. Genuine leather Bag has front pocket on the first colour slot and othertwo colour slots are stitched. Handle each sid eof the bag run through a loop but is stitched to the body and other end is in the zip joint. Bag has long center Zip as additional saftey. Inside the bag has zip pouch on one side of the lining and other side a pocket for mobile case and a pen slot        </div> <div style="clear: both;"></div> </div>,<div class="item_left_column" id="specifications"> <h3 class="item_desc_title fk-uppercase">         Specifications of Lupine Arrosa Hand Bag (Beige::Brown)    </h3> <table cellspacing="0" class="fk-specs-type2"> <tr> <th class="group-head" colspan="2">General</th> </tr> <tr class=""> <td class="specs-key">Type</td> <td class="specs-value fk-data">Hand Bag</td> </tr> <tr class=""> <td class="specs-key">Ideal For</td> <td class="specs-value fk-data">Women</td> </tr> <tr class=""> <td class="specs-key">Material</td> <td class="specs-value fk-data">Genuine Leather</td> </tr> <tr class=""> <td class="specs-key">Style Code</td> <td class="specs-value fk-data">LB-1044</td> </tr> <tr class=""> <td class="specs-key">Color Code</td> <td class="specs-value fk-data">Beige::Brown</td> </tr> </table> <table cellspacing="0" class="fk-specs-type2"> <tr> <th class="group-head" colspan="2">Body Features</th> </tr> <tr class=""> <td class="specs-key">Number of Compartments</td> <td class="specs-value fk-data">1</td> </tr> </table> </div>,10:03:2014,None
LSTHMBDMDMHVUDPYKH6VGCGNK,Lupine Libludablu Hand Bag,http://www.flipkart.com/lifestyle/bags-wallets-belts/women?otracker=hp_nmenu_sub_women_1_Bags%2C%20Wallets%20and%20Belts,Rs. 3999,Bags  Wallets and Belts,Handbags,Lupine,http://img5a.flixcart.com/image/hand-messenger-bag/k/h/6/lb-1031-lupine-hand-bag-libludablu-400x400-imadmdnfjek79gfw.jpeg,Rs. 4999,Blue,women,http://www.flipkart.com/lupine-libludablu-hand-bag/p/itmdpzna9h5u9gud?pid=HMBDMDMHVUDPYKH6&srno=b_17&ref=b2c59b07-5219-4c13-9eb6-a2846557e293,lupine,Lupine Libludablu Hand Bag Light blue::Dark Blue - Price in India | Flipkart.com,Flipkart.com: Buy Lupine Libludablu Hand Bag for Rs. 3999 from Flipkart.com. Only Genuine Products. 30 Day Replacement Guarantee. Free Shipping. Cash On,[],<div class="item_left_column" id="description"> <h3 class="item_desc_title fk-uppercase">Lupine Libludablu Hand Bag (Light blue::Dark Blue)         Price: Rs.3999</h3> <div class="cls"></div> <div class="item_desc_text line"> <div style="float:right"> </div>                         Elegant design from Lupine  it's a Genuine leather bag has front two stylish pockets with and lupine fittings as pullers  as visible it?s a perfect stylish bag with two rectangular rings that grip the handle for easy movement and longevity of the use  Bag top has zip length seamed by leather border that closes either side with snap buttons for nice look as well as acts as grip while sliding puller the bag inside has a cotton lining with zipped pocket on one side and a mobile pocket and a little larger pocket for essentials.        </div> <div style="clear: both;"></div> </div>,<div class="item_left_column" id="specifications"> <h3 class="item_desc_title fk-uppercase">         Specifications of Lupine Libludablu Hand Bag (Light blue::Dark Blue)    </h3> <table cellspacing="0" class="fk-specs-type2"> <tr> <th class="group-head" colspan="2">General</th> </tr> <tr class=""> <td class="specs-key">Type</td> <td class="specs-value fk-data">Hand Bag</td> </tr> <tr class=""> <td class="specs-key">Ideal For</td> <td class="specs-value fk-data">Women</td> </tr> <tr class=""> <td class="specs-key">Material</td> <td class="specs-value fk-data">Leather</td> </tr> <tr class=""> <td class="specs-key">Style Code</td> <td class="specs-value fk-data">LB-1031</td> </tr> <tr class=""> <td class="specs-key">Color Code</td> <td class="specs-value fk-data">Light blue::Dark Blue</td> </tr> </table> <table cellspacing="0" class="fk-specs-type2"> <tr> <th class="group-head" colspan="2">Body Features</th> </tr> <tr class=""> <td class="specs-key">Number of Compartments</td> <td class="specs-value fk-data">1</td> </tr> </table> </div>,10:03:2014,None
LSTHMBDZE7VYKNHVH5HJ1ESRU,Lupine Ayaka Hand Bag,http://www.flipkart.com/lifestyle/bags-wallets-belts/women?otracker=hp_nmenu_sub_women_1_Bags%2C%20Wallets%20and%20Belts,Rs. 2940,Bags  Wallets and Belts,Handbags,Lupine,http://img5a.flixcart.com/image/hand-messenger-bag/h/5/h/lb-1045-lupine-hand-bag-ayaka-400x400-imadzebkfaw9gtvz.jpeg,Rs. 4200,Beige  Black,women,http://www.flipkart.com/lupine-ayaka-hand-bag/p/itmdpzncyz5sxgyw?pid=HMBDZE7VYKNHVH5H&srno=b_26&ref=b2c59b07-5219-4c13-9eb6-a2846557e293,lupine,Lupine Ayaka Hand Bag Beige::Black - Price in India | Flipkart.com,Flipkart.com: Buy Lupine Ayaka Hand Bag for Rs. 2940 from Flipkart.com. Only Genuine Products. 30 Day Replacement Guarantee. Free Shipping. Cash On,[],<div class="item_left_column" id="description"> <h3 class="item_desc_title fk-uppercase">Lupine Ayaka Hand Bag (Beige::Black)         Price: Rs.2940</h3> <div class="cls"></div> <div class="item_desc_text line"> <div style="float:right"> </div>                         A Genuine leather Bag. Dimensions in cms : L 30 x W 36 x D 11 cms. Genuine leather Bag has front pocket on the first colour slot and othertwo colour slots are stitched. Handle each sid eof the bag run through a loop but is stitched to the body and other end is in the zip joint. Bag has long center Zip as additional saftey. Inside the bag has zip pouch on one side of the lining and other side a pocket for mobile case and a pen slot        </div> <div style="clear: both;"></div> </div>,<div class="item_left_column" id="specifications"> <h3 class="item_desc_title fk-uppercase">         Specifications of Lupine Ayaka Hand Bag (Beige::Black)    </h3> <table cellspacing="0" class="fk-specs-type2"> <tr> <th class="group-head" colspan="2">General</th> </tr> <tr class=""> <td class="specs-key">Type</td> <td class="specs-value fk-data">Hand Bag</td> </tr> <tr class=""> <td class="specs-key">Ideal For</td> <td class="specs-value fk-data">Women</td> </tr> <tr class=""> <td class="specs-key">Material</td> <td class="specs-value fk-data">Genuine Leather</td> </tr> <tr class=""> <td class="specs-key">Style Code</td> <td class="specs-value fk-data">LB-1045</td> </tr> <tr class=""> <td class="specs-key">Color Code</td> <td class="specs-value fk-data">Beige::Black</td> </tr> </table> <table cellspacing="0" class="fk-specs-type2"> <tr> <th class="group-head" colspan="2">Body Features</th> </tr> <tr class=""> <td class="specs-key">Number of Compartments</td> <td class="specs-value fk-data">1</td> </tr> </table> </div>,10:03:2014,None
