LSTWATDSGYZM2JACV8WGT9WD2,Seiko Analog Watch  - For Women,http://www.flipkart.com/watches/women?otracker=hp_nmenu_sub_women_1_Watches,Rs. 37500,Watches,Watches,Seiko,http://img6a.flixcart.com/image/watch/v/8/w/srkz93p1-seiko-400x400-imadr58rjhgtzgpz.jpeg,Rs. 37500,None,women,http://www.flipkart.com/seiko-analog-watch-women/p/itmdsgyskcvrx2jc?pid=WATDSGYZM2JACV8W&srno=b_5&ref=b04c933f-86a8-4e5e-9de4-7aafd9dd7f65,Thewatchshoppe,Seiko Analog Watch - For Women - Buy Seiko Analog Watch - For Women SRKZ93P1 Online at Best Prices in India | Flipkart.com,Seiko Analog Watch - For Women - Buy Seiko Analog Watch - For Women SRKZ93P1 Online at Rs.37500 in India Only at Flipkart.com. - Great Discounts, Only Genuine Products, 30 Day Replacement Guarantee, Free Shipping. Cash,[],<div class="item_left_column" id="description"> <h3 class="item_desc_title fk-uppercase">Seiko Analog Watch  - For Women (Silver)         Price: Rs.37500</h3> <div class="cls"></div> <div class="item_desc_text line"> <div style="float:right"> </div>                         Delightful with looks, is what this SEIKO SRKZ93P1 silver stone studded watch indicates. This watch has arrived from the house SEIKO especially designed for women who loves to flaunt their accessories. SEIKO SRKZ93P1 has a metal strap &amp; mother of pearl?stone studded dial, adds charms to it.        </div> <div style="clear: both;"></div> </div>,<div class="item_left_column" id="specifications"> <h3 class="item_desc_title fk-uppercase">         Specifications of Seiko Analog Watch  - For Women (Silver)    </h3> <table cellspacing="0" class="fk-specs-type2"> <tr> <th class="group-head" colspan="2">In the Box</th> </tr> <tr class=""> <td class="specs-value fk-data" colspan="2">Watch</td> </tr> </table> <table cellspacing="0" class="fk-specs-type2"> <tr> <th class="group-head" colspan="2">General</th> </tr> <tr class=""> <td class="specs-key">Type</td> <td class="specs-value fk-data">Analog</td> </tr> <tr class=""> <td class="specs-key">Ideal For</td> <td class="specs-value fk-data">Women</td> </tr> <tr class=""> <td class="specs-key">Mechanism</td> <td class="specs-value fk-data">Quartz</td> </tr> <tr class=""> <td class="specs-key">Style Code</td> <td class="specs-value fk-data">SRKZ93P1</td> </tr> </table> <table cellspacing="0" class="fk-specs-type2"> <tr> <th class="group-head" colspan="2">Body Features</th> </tr> <tr class=""> <td class="specs-key">Strap Material</td> <td class="specs-value fk-data">Metal Strap</td> </tr> <tr class=""> <td class="specs-key">Strap Color</td> <td class="specs-value fk-data">Silver</td> </tr> <tr class=""> <td class="specs-key">Case / Bezel Material</td> <td class="specs-value fk-data">Stainless Steel</td> </tr> <tr class=""> <td class="specs-key">Dial Color</td> <td class="specs-value fk-data">White</td> </tr> <tr class=""> <td class="specs-key">Dial Shape</td> <td class="specs-value fk-data">Round</td> </tr> <tr class=""> <td class="specs-key">Water Resistant</td> <td class="specs-value fk-data">Yes</td> </tr> <tr class=""> <td class="specs-key">Water Resistance Depth</td> <td class="specs-value fk-data">100 m</td> </tr> </table> <table cellspacing="0" class="fk-specs-type2"> <tr> <th class="group-head" colspan="2">Functions</th> </tr> <tr class=""> <td class="specs-key">Chronograph</td> <td class="specs-value fk-data">No</td> </tr> </table> <table cellspacing="0" class="fk-specs-type2"> <tr> <th class="group-head" colspan="2">Warranty</th> </tr> <tr class=""> <td class="specs-key"> </td> <td class="specs-value fk-data">2 Years</td> </tr> </table> </div>,10:03:2014,None
LSTWATDSJ3RRMKXKH2D7PBH2A,Seiko Sportura Analog Watch  - For Women,http://www.flipkart.com/watches/women?otracker=hp_nmenu_sub_women_1_Watches,Rs. 37500,Watches,Watches,Seiko,http://img6a.flixcart.com/image/watch/h/2/d/sndx95p1-seiko-400x400-imadstzrswdbfgpa.jpeg,Rs. 37500,None,women,http://www.flipkart.com/seiko-sportura-analog-watch-women/p/itmdsj3uvdnvbzcr?pid=WATDSJ3RRMKXKH2D&srno=b_8&ref=b04c933f-86a8-4e5e-9de4-7aafd9dd7f65,Thewatchshoppe,Seiko Sportura Analog Watch - For Women - Buy Seiko Sportura Analog Watch - For Women SNDX95P1 Online at Best Prices in India | Flipkart.com,Seiko Sportura Analog Watch - For Women - Buy Seiko Sportura Analog Watch - For Women SNDX95P1 Online at Rs.37500 in India Only at Flipkart.com. Silver and Off White Strap, Chronograph Function, Water Resistant, Round,[],<div class="item_left_column" id="description"> <h3 class="item_desc_title fk-uppercase">                 Key Features of Seiko Sportura Analog Watch  - For Women (Off White, Silver)            </h3> <div class="cls"></div> <div class="item_desc_text"> <ul class="fk-key-features"> <li>Silver and Off White Strap</li><li>Chronograph Function</li><li>Water Resistant</li><li>Round Dial</li><li>Ceramic Bezel</li><li>Push Button Three Fold Clasp</li> </ul> </div> <div style="clear: both;"></div> </div>,<div class="item_left_column" id="specifications"> <h3 class="item_desc_title fk-uppercase">         Specifications of Seiko Sportura Analog Watch  - For Women (Off White, Silver)    </h3> <table cellspacing="0" class="fk-specs-type2"> <tr> <th class="group-head" colspan="2">General</th> </tr> <tr class=""> <td class="specs-key">Type</td> <td class="specs-value fk-data">Analog</td> </tr> <tr class=""> <td class="specs-key">Series</td> <td class="specs-value fk-data">Sportura</td> </tr> <tr class=""> <td class="specs-key">Ideal For</td> <td class="specs-value fk-data">Women</td> </tr> <tr class=""> <td class="specs-key">Novelty Feature</td> <td class="specs-value fk-data">Diamonds Studded on Dial</td> </tr> <tr class=""> <td class="specs-key">Style Code</td> <td class="specs-value fk-data">SNDX95P1</td> </tr> </table> <table cellspacing="0" class="fk-specs-type2"> <tr> <th class="group-head" colspan="2">Body Features</th> </tr> <tr class=""> <td class="specs-key">Strap Material</td> <td class="specs-value fk-data">Stainless Steel, Ceramic Strap</td> </tr> <tr class=""> <td class="specs-key">Strap Color</td> <td class="specs-value fk-data">Off White, Silver</td> </tr> <tr class=""> <td class="specs-key">Strap Type</td> <td class="specs-value fk-data">Bracelet</td> </tr> <tr class=""> <td class="specs-key">Case / Bezel Material</td> <td class="specs-value fk-data">Ceramic Bezel</td> </tr> <tr class=""> <td class="specs-key">Dial Color</td> <td class="specs-value fk-data">Off White</td> </tr> <tr class=""> <td class="specs-key">Dial Shape</td> <td class="specs-value fk-data">Round</td> </tr> <tr class=""> <td class="specs-key">Clasp Type</td> <td class="specs-value fk-data">Push Button Three Fold Clasp</td> </tr> <tr class=""> <td class="specs-key">Water Resistant</td> <td class="specs-value fk-data">Yes</td> </tr> <tr class=""> <td class="specs-key">Water Resistance Depth</td> <td class="specs-value fk-data">100 m</td> </tr> <tr class=""> <td class="specs-key">Other Body Features</td> <td class="specs-value fk-data">Sapphire Crystal Glass with Anti-reflective Coating</td> </tr> </table> <table cellspacing="0" class="fk-specs-type2"> <tr> <th class="group-head" colspan="2">Functions</th> </tr> <tr class=""> <td class="specs-key">Chronograph</td> <td class="specs-value fk-data">Yes</td> </tr> <tr class=""> <td class="specs-key">Chronograph Feature</td> <td class="specs-value fk-data">Analog Chronograph Function upto 12 Hours in 1/20 Second Increments</td> </tr> <tr class=""> <td class="specs-key">Date Display</td> <td class="specs-value fk-data">Yes</td> </tr> <tr class=""> <td class="specs-key">Other Functions</td> <td class="specs-value fk-data">Tachymeter, Split Time Measurement</td> </tr> </table> <table cellspacing="0" class="fk-specs-type2"> <tr> <th class="group-head" colspan="2">Warranty</th> </tr> <tr class=""> <td class="specs-key"> </td> <td class="specs-value fk-data">2 Years Domestic Warranty</td> </tr> </table> </div>,10:03:2014,None
LSTWATDNK9GA3GF5EDRXGXNI2,Seiko Analog Watch  - For Women,http://www.flipkart.com/watches/women?otracker=hp_nmenu_sub_women_1_Watches,Rs. 13320,Watches,Watches,Seiko,http://img5a.flixcart.com/image/watch/e/d/r/sup088p1-seiko-400x400-imadnn5fdygfrnky.jpeg,Rs. 14800,None,women,http://www.flipkart.com/seiko-analog-watch-women/p/itmdp2nz77wvhzez?pid=WATDNK9GA3GF5EDR&srno=b_4&ref=b04c933f-86a8-4e5e-9de4-7aafd9dd7f65,Thewatchshoppe,Seiko Analog Watch - For Women - Buy Seiko Analog Watch - For Women SUP088P1 Online at Best Prices in India | Flipkart.com,Seiko Analog Watch - For Women - Buy Seiko Analog Watch - For Women SUP088P1 Online at Rs.13320 in India Only at Flipkart.com. - Great Discounts, Only Genuine Products, 30 Day Replacement Guarantee, Free Shipping. Cash,[],<div class="item_left_column" id="description"> <h3 class="item_desc_title fk-uppercase">Seiko Analog Watch  - For Women (Rose Gold, Silver)         Price: Rs.13320</h3> <div class="cls"></div> <div class="item_desc_text line"> <div style="float:right"> </div>                         Cherish your feminism with this designer wrist watch for women by Seiko. The golden colored, stainless steel frame of the watch is enough to make you fall in love with it, while the designer bezel and the white dial with golden symbolic metrics add to the charm. The most exceptional feature of this watch is the watch is its solar movement, which restricts any change of battery.        </div> <div style="clear: both;"></div> </div>,<div class="item_left_column" id="specifications"> <h3 class="item_desc_title fk-uppercase">         Specifications of Seiko Analog Watch  - For Women (Rose Gold, Silver)    </h3> <table cellspacing="0" class="fk-specs-type2"> <tr> <th class="group-head" colspan="2">General</th> </tr> <tr class=""> <td class="specs-key">Type</td> <td class="specs-value fk-data">Analog</td> </tr> <tr class=""> <td class="specs-key">Ideal For</td> <td class="specs-value fk-data">Women</td> </tr> <tr class=""> <td class="specs-key">Style Code</td> <td class="specs-value fk-data">SUP088P1</td> </tr> </table> <table cellspacing="0" class="fk-specs-type2"> <tr> <th class="group-head" colspan="2">Body Features</th> </tr> <tr class=""> <td class="specs-key">Strap Material</td> <td class="specs-value fk-data">Stainless Steel Strap</td> </tr> <tr class=""> <td class="specs-key">Strap Color</td> <td class="specs-value fk-data">Rose Gold, Silver</td> </tr> <tr class=""> <td class="specs-key">Strap Type</td> <td class="specs-value fk-data">Bracelet</td> </tr> <tr class=""> <td class="specs-key">Case / Bezel Material</td> <td class="specs-value fk-data">stainless steel case</td> </tr> <tr class=""> <td class="specs-key">Dial Shape</td> <td class="specs-value fk-data">Round</td> </tr> </table> </div>,10:03:2014,None
LSTWATDNK9G2KWY4TBYX1VLIQ,Seiko Analog Watch  - For Women,http://www.flipkart.com/watches/women?otracker=hp_nmenu_sub_women_1_Watches,Rs. 16826,Watches,Watches,Seiko,http://img6a.flixcart.com/image/watch/t/b/y/srz386p1-seiko-400x400-imadnn5fsmph3hsn.jpeg,Rs. 17900,None,women,http://www.flipkart.com/seiko-analog-watch-women/p/itmdp2nzufbvpm8g?pid=WATDNK9G2KWY4TBY&srno=b_2&ref=b04c933f-86a8-4e5e-9de4-7aafd9dd7f65,Crosssales,Seiko Analog Watch - For Women - Buy Seiko Analog Watch - For Women SRZ386P1 Online at Best Prices in India | Flipkart.com,Seiko Analog Watch - For Women - Buy Seiko Analog Watch - For Women SRZ386P1 Online at Rs.16826 in India Only at Flipkart.com. - Great Discounts, Only Genuine Products, 30 Day Replacement Guarantee, Free Shipping. Cash,[],<div class="item_left_column" id="description"> <h3 class="item_desc_title fk-uppercase">Seiko Analog Watch  - For Women (Golden)         Price: Rs.16826</h3> <div class="cls"></div> <div class="item_desc_text line"> <div style="float:right"> </div>                         This Seiko ladies watch comes with a gold tone steel bracelet and a bright white dial that is surrounded by a sparkling stone set bezel.        </div> <div style="clear: both;"></div> </div>,<div class="item_left_column" id="specifications"> <h3 class="item_desc_title fk-uppercase">         Specifications of Seiko Analog Watch  - For Women (Golden)    </h3> <table cellspacing="0" class="fk-specs-type2"> <tr> <th class="group-head" colspan="2">General</th> </tr> <tr class=""> <td class="specs-key">Type</td> <td class="specs-value fk-data">Analog</td> </tr> <tr class=""> <td class="specs-key">Ideal For</td> <td class="specs-value fk-data">Women</td> </tr> <tr class=""> <td class="specs-key">Style Code</td> <td class="specs-value fk-data">SRZ386P1</td> </tr> </table> <table cellspacing="0" class="fk-specs-type2"> <tr> <th class="group-head" colspan="2">Body Features</th> </tr> <tr class=""> <td class="specs-key">Strap Material</td> <td class="specs-value fk-data">stainless steel Strap</td> </tr> <tr class=""> <td class="specs-key">Strap Color</td> <td class="specs-value fk-data">Golden</td> </tr> <tr class=""> <td class="specs-key">Strap Type</td> <td class="specs-value fk-data">Bracelet</td> </tr> <tr class=""> <td class="specs-key">Case / Bezel Material</td> <td class="specs-value fk-data">stainless steel case</td> </tr> <tr class=""> <td class="specs-key">Dial Shape</td> <td class="specs-value fk-data">Round</td> </tr> </table> </div>,10:03:2014,None
LSTWATDJSCPG8YZF3VMKZ1DS9,Seiko Lord Analog Watch  - For Women,http://www.flipkart.com/watches/women?otracker=hp_nmenu_sub_women_1_Watches,Rs. 19500,Watches,Watches,Seiko,http://img5a.flixcart.com/image/watch/3/v/m/srlz92p1-seiko-400x400-imadky7pxzx2zvww.jpeg,Rs. 19500,None,women,http://www.flipkart.com/seiko-lord-analog-watch-women/p/itmdjscrz4nbgsuj?pid=WATDJSCPG8YZF3VM&srno=b_1&ref=b04c933f-86a8-4e5e-9de4-7aafd9dd7f65,RRTC,Seiko Lord Analog Watch - For Women - Buy Seiko Lord Analog Watch - For Women SRLZ92P1 Online at Best Prices in India | Flipkart.com,Seiko Lord Analog Watch - For Women - Buy Seiko Lord Analog Watch - For Women SRLZ92P1 Online at Rs.19500 in India Only at Flipkart.com. Chronograph Function, White Strap, Round Dial, Stainless Steel Case, Water,[],<div class="item_left_column" id="description"> <h3 class="item_desc_title fk-uppercase">Seiko Lord Analog Watch  - For Women (White)         Price: Rs.19500</h3> <div class="cls"></div> <div class="item_desc_text line"> <div style="float:right"> </div> <h3><b> Key Features </b></h3> <div class="line bmargin10"> <ul class="feature_bullet"> <li><span>Chronograph Function</span></li><li><span>White Strap</span></li><li><span>Round Dial</span></li><li><span>Stainless Steel Case</span></li><li><span>Water Resistant</span></li> </ul> </div> <p style="text-align: justify;">   Seiko brings to you this Lord Analog Watch - For Women that reflects grace and elegance. The Lord series from Seiko is perfect for all those women craving to add a tinge of glamour to their wrist. Be it for a formal dinner with your colleagues or for a wedding, this S<strong>eiko Lord Analog Watch - For Women</strong> never fails to set you apart. With the <strong>quartz mechanism</strong>, you are sure to be on time for every event as electro oscillations of the quartz regulate the timekeeping of the watch.</p> <p style="text-align: justify;"> <strong>Body and Design</strong></p> <p style="text-align: justify;">   Furnished with a<strong> round dial</strong>, this Seiko Watch makes every woman’s wrist look appealing. This watch is crafted with a<strong> leather strap</strong> that makes this watch a unique timepiece. Also, the <strong>swarovski crystals</strong> studded on the bezel lend this watch an aesthetic appeal. This watch is durable and rust resistant as the stainless steel case protects the internal components of the watch. The dial is protected by a hardlex glass dial cover that keeps the watch safe from scratches that occur when you accidentally graze the watch against the wall.</p> <p style="text-align: justify;"> <strong>Function and Other Features</strong></p> <p style="text-align: justify;">   This Analog Watch is equipped with the <strong>chronograph function </strong>that helps you keep a track of elapsed time. You can set an accurate start and stop time for your morning workout sessions. During a heavy downpour you need not worry about this watch getting damaged, as it is<strong> water-resistant up to a depth of 100 m.</strong> Furthermore, this watch is equipped with a <strong>date and day display.</strong></p> </div> <div style="clear: both;"></div> </div>,<div class="item_left_column" id="specifications"> <h3 class="item_desc_title fk-uppercase">         Specifications of Seiko Lord Analog Watch  - For Women (White)    </h3> <table cellspacing="0" class="fk-specs-type2"> <tr> <th class="group-head" colspan="2">General</th> </tr> <tr class=""> <td class="specs-key">Type</td> <td class="specs-value fk-data">Analog</td> </tr> <tr class=""> <td class="specs-key">Series</td> <td class="specs-value fk-data">Lord</td> </tr> <tr class=""> <td class="specs-key">Ideal For</td> <td class="specs-value fk-data">Women</td> </tr> <tr class=""> <td class="specs-key">Occasion</td> <td class="specs-value fk-data">Formal</td> </tr> <tr class=""> <td class="specs-key">Mechanism</td> <td class="specs-value fk-data">Quartz</td> </tr> <tr class=""> <td class="specs-key">Novelty Feature</td> <td class="specs-value fk-data">Swarovski Crystals Studded Bezel</td> </tr> <tr class=""> <td class="specs-key">Style Code</td> <td class="specs-value fk-data">SRLZ92P1</td> </tr> </table> <table cellspacing="0" class="fk-specs-type2"> <tr> <th class="group-head" colspan="2">Body Features</th> </tr> <tr class=""> <td class="specs-key">Strap Material</td> <td class="specs-value fk-data">Leather Strap</td> </tr> <tr class=""> <td class="specs-key">Strap Color</td> <td class="specs-value fk-data">White</td> </tr> <tr class=""> <td class="specs-key">Case / Bezel Material</td> <td class="specs-value fk-data">Stainless Steel Case</td> </tr> <tr class=""> <td class="specs-key">Dial Color</td> <td class="specs-value fk-data">Silver</td> </tr> <tr class=""> <td class="specs-key">Dial Shape</td> <td class="specs-value fk-data">Round</td> </tr> <tr class=""> <td class="specs-key">Water Resistant</td> <td class="specs-value fk-data">Yes</td> </tr> <tr class=""> <td class="specs-key">Water Resistance Depth</td> <td class="specs-value fk-data">100 m</td> </tr> <tr class=""> <td class="specs-key">Other Body Features</td> <td class="specs-value fk-data">Rose Gold Color Case, Hardlex Glass</td> </tr> </table> <table cellspacing="0" class="fk-specs-type2"> <tr> <th class="group-head" colspan="2">Functions</th> </tr> <tr class=""> <td class="specs-key">Chronograph</td> <td class="specs-value fk-data">Yes</td> </tr> <tr class=""> <td class="specs-key">Chronograph Feature</td> <td class="specs-value fk-data">Analog Chronograph Function</td> </tr> <tr class=""> <td class="specs-key">Date Display</td> <td class="specs-value fk-data">Yes</td> </tr> <tr class=""> <td class="specs-key">Other Functions</td> <td class="specs-value fk-data">24 Hours Format</td> </tr> </table> <table cellspacing="0" class="fk-specs-type2"> <tr> <th class="group-head" colspan="2">Warranty</th> </tr> <tr class=""> <td class="specs-key"> </td> <td class="specs-value fk-data">2 Years Domestic Warranty</td> </tr> </table> </div>,10:03:2014,None
LSTWATDSGYZM2JACV8WGT9WD2,Seiko Analog Watch  - For Women,http://www.flipkart.com/watches/women?otracker=hp_nmenu_sub_women_1_Watches,Rs. 37500,Watches,Watches,Seiko,http://img6a.flixcart.com/image/watch/v/8/w/srkz93p1-seiko-400x400-imadr58rjhgtzgpz.jpeg,Rs. 37500,None,women,http://www.flipkart.com/seiko-analog-watch-women/p/itmdsgyskcvrx2jc?pid=WATDSGYZM2JACV8W&srno=b_5&ref=b04c933f-86a8-4e5e-9de4-7aafd9dd7f65,Thewatchshoppe,Seiko Analog Watch - For Women - Buy Seiko Analog Watch - For Women SRKZ93P1 Online at Best Prices in India | Flipkart.com,Seiko Analog Watch - For Women - Buy Seiko Analog Watch - For Women SRKZ93P1 Online at Rs.37500 in India Only at Flipkart.com. - Great Discounts, Only Genuine Products, 30 Day Replacement Guarantee, Free Shipping. Cash,[],<div class="item_left_column" id="description"> <h3 class="item_desc_title fk-uppercase">Seiko Analog Watch  - For Women (Silver)         Price: Rs.37500</h3> <div class="cls"></div> <div class="item_desc_text line"> <div style="float:right"> </div>                         Delightful with looks, is what this SEIKO SRKZ93P1 silver stone studded watch indicates. This watch has arrived from the house SEIKO especially designed for women who loves to flaunt their accessories. SEIKO SRKZ93P1 has a metal strap &amp; mother of pearl?stone studded dial, adds charms to it.        </div> <div style="clear: both;"></div> </div>,<div class="item_left_column" id="specifications"> <h3 class="item_desc_title fk-uppercase">         Specifications of Seiko Analog Watch  - For Women (Silver)    </h3> <table cellspacing="0" class="fk-specs-type2"> <tr> <th class="group-head" colspan="2">In the Box</th> </tr> <tr class=""> <td class="specs-value fk-data" colspan="2">Watch</td> </tr> </table> <table cellspacing="0" class="fk-specs-type2"> <tr> <th class="group-head" colspan="2">General</th> </tr> <tr class=""> <td class="specs-key">Type</td> <td class="specs-value fk-data">Analog</td> </tr> <tr class=""> <td class="specs-key">Ideal For</td> <td class="specs-value fk-data">Women</td> </tr> <tr class=""> <td class="specs-key">Mechanism</td> <td class="specs-value fk-data">Quartz</td> </tr> <tr class=""> <td class="specs-key">Style Code</td> <td class="specs-value fk-data">SRKZ93P1</td> </tr> </table> <table cellspacing="0" class="fk-specs-type2"> <tr> <th class="group-head" colspan="2">Body Features</th> </tr> <tr class=""> <td class="specs-key">Strap Material</td> <td class="specs-value fk-data">Metal Strap</td> </tr> <tr class=""> <td class="specs-key">Strap Color</td> <td class="specs-value fk-data">Silver</td> </tr> <tr class=""> <td class="specs-key">Case / Bezel Material</td> <td class="specs-value fk-data">Stainless Steel</td> </tr> <tr class=""> <td class="specs-key">Dial Color</td> <td class="specs-value fk-data">White</td> </tr> <tr class=""> <td class="specs-key">Dial Shape</td> <td class="specs-value fk-data">Round</td> </tr> <tr class=""> <td class="specs-key">Water Resistant</td> <td class="specs-value fk-data">Yes</td> </tr> <tr class=""> <td class="specs-key">Water Resistance Depth</td> <td class="specs-value fk-data">100 m</td> </tr> </table> <table cellspacing="0" class="fk-specs-type2"> <tr> <th class="group-head" colspan="2">Functions</th> </tr> <tr class=""> <td class="specs-key">Chronograph</td> <td class="specs-value fk-data">No</td> </tr> </table> <table cellspacing="0" class="fk-specs-type2"> <tr> <th class="group-head" colspan="2">Warranty</th> </tr> <tr class=""> <td class="specs-key"> </td> <td class="specs-value fk-data">2 Years</td> </tr> </table> </div>,10:03:2014,None
