{'sku': [u'/viewcart?eid=LSTSHODRBHA8FXKTGZDYRG60P'], 'seller': [u'WS Retail', u'[?]'], 'title': [u'\n                    Enroute Women Bellies            '], 'colour': [u'Red', u'Tan'], 'sp': [u' Rs. 899', u'(1,977,144'], 'mrp': [u'Rs. 1999'], 'titleimg': [u'http://img5a.flixcart.com/image/shoe/z/n/h/blue-ew50891-enroute-women-36-400x400-imadrukfzb5t2c3m.jpeg'], 'catname': ['bellies'], 'brandname': ['Enroute Women.'], 'date': ['18:02:2014'], 'itemlink': ['http://www.flipkart.com/enroute-women-bellies/p/itmdrbhfzt5tguz9?pid=SHODRBHA8FXKTGZD&srno=b_9&ref=fcdd3e02-b719-4622-b5d3-8e80373f46e0'], 'desc': [u'<div class="item_left_column" id="description">\n        <h3 class="item_desc_title fk-uppercase">Enroute Women Bellies         Price: Rs.899</h3>\n        <div class="cls"></div>\n        <div class="item_desc_text line">\n            <div style="float:right">\n                \n \n            </div>\n                        <p>\r\n\tPep up your style quotient in an instant by completing your casual attire with this pair of trendy bellies from Enroute Women. The luxe suede body of these blue bellies is highlighted by<strong> bead detailing </strong>for an alluring edge. You can team these bellies with a printed top and a pair of denim shorts.\xa0</p>\r\n<p>\r\n\tCombining classy sophistication with a rugged chic sense, <strong>Enroute</strong> brings to you a range of cosmopolitan styles that is sure to up your fashion quotient.</p>\r\n<p>\r\n\t<strong>Footwear Care</strong></p>\r\n<p>\r\n\tWipe clean with a soft cloth.</p>        </div>\n        <div style="clear: both;"></div>\n            </div>'], 'spec': [u'<div id="specifications" class="item_left_column">\n    <h3 class="item_desc_title fk-uppercase">\n        Specifications of Enroute Women Bellies    </h3>\n\n            <table cellspacing="0" class="fk-specs-type2"><tr><th class="group-head" colspan="2">General</th>\n            </tr><tr class=""><td class="specs-key">Ideal For</td>\n                                        <td class="specs-value fk-data">Women</td>\n                </tr></table><table cellspacing="0" class="fk-specs-type2"><tr><th class="group-head" colspan="2">Shoe Details</th>\n            </tr><tr class=""><td class="specs-key">Style</td>\n                                        <td class="specs-value fk-data">Bead Detailing, Panel and Stitch Detail, Suede Body</td>\n                </tr><tr class=""><td class="specs-key">Color</td>\n                                        <td class="specs-value fk-data">Blue</td>\n                </tr><tr class=""><td class="specs-key">Tip Shape</td>\n                                        <td class="specs-value fk-data">Round</td>\n                </tr><tr class=""><td class="specs-key">Weight</td>\n                                        <td class="specs-value fk-data">137 gm (per single Shoe) - Weight of the product may vary depending on size.</td>\n                </tr></table><table cellspacing="0" class="fk-specs-type2"><tr><th class="group-head" colspan="2">Additional Details</th>\n            </tr><tr class=""><td class="specs-key">Other Details</td>\n                                        <td class="specs-value fk-data">Textured Sole, Padded Footbed</td>\n                </tr></table></div>'], 'size': [u'36', u'37', u'38', u'39', u'40']}
{'sku': [u'javascript:void(0);'], 'seller': [u'WS Retail'], 'title': [u'\n                    Enroute Women Bellies            '], 'colour': [u'Pink'], 'sp': [u' Rs. 764'], 'mrp': [u'Rs. 1699'], 'titleimg': [u'http://img6a.flixcart.com/image/shoe/u/f/f/black-ew48884-enroute-women-36-400x400-imadrvdmhbjazhty.jpeg'], 'catname': ['bellies'], 'brandname': ['Enroute Women.'], 'date': ['18:02:2014'], 'itemlink': ['http://www.flipkart.com/enroute-women-bellies/p/itmdrbhfrwe2ndm5?pid=SHODRBHA9JQ8FGVP&srno=b_5&ref=fcdd3e02-b719-4622-b5d3-8e80373f46e0'], 'desc': [u'<div class="item_left_column" id="description">\n        <h3 class="item_desc_title fk-uppercase">Enroute Women Bellies         Price: Rs.764</h3>\n        <div class="cls"></div>\n        <div class="item_desc_text line">\n            <div style="float:right">\n                \n \n            </div>\n                        <p style="text-align: justify;">\r\n\tRevealing the depths of design and immensity of confidence that come with these black Enroute Bellies, your casual as well as formal attire is sure to be instantly upgraded wearing them. Styled with a <strong>bow on the front</strong> and a slight heel, these comfortable bellies can be worn with jeans, dresses, skirts or even semi-formal pants.</p>\r\n<p style="text-align: justify;">\r\n\tCombining classy sophistication with a rugged chic sense, <strong>Enroute </strong>brings to you a range of cosmopolitan styles that is sure to up your fashion quotient.</p>\r\n<p style="text-align: justify;">\r\n\t<strong>Footwear care</strong></p>\r\n<p style="text-align: justify;">\r\n\tAir the shoes out after every use. Wipe clean with soft cloth.</p>        </div>\n        <div style="clear: both;"></div>\n            </div>'], 'spec': [u'<div id="specifications" class="item_left_column">\n    <h3 class="item_desc_title fk-uppercase">\n        Specifications of Enroute Women Bellies    </h3>\n\n            <table cellspacing="0" class="fk-specs-type2"><tr><th class="group-head" colspan="2">General</th>\n            </tr><tr class=""><td class="specs-key">Ideal For</td>\n                                        <td class="specs-value fk-data">Women</td>\n                </tr></table><table cellspacing="0" class="fk-specs-type2"><tr><th class="group-head" colspan="2">Shoe Details</th>\n            </tr><tr class=""><td class="specs-key">Style</td>\n                                        <td class="specs-value fk-data">Panel and Stitch Detail, Bow Detail at Front</td>\n                </tr><tr class=""><td class="specs-key">Color</td>\n                                        <td class="specs-value fk-data">Black</td>\n                </tr><tr class=""><td class="specs-key">Heel Height</td>\n                                        <td class="specs-value fk-data">0.6 inch</td>\n                </tr><tr class=""><td class="specs-key">Tip Shape</td>\n                                        <td class="specs-value fk-data">Round</td>\n                </tr><tr class=""><td class="specs-key">Weight</td>\n                                        <td class="specs-value fk-data">128 gm (per single Shoe) - Weight of the product may vary depending on size.</td>\n                </tr></table><table cellspacing="0" class="fk-specs-type2"><tr><th class="group-head" colspan="2">Additional Details</th>\n            </tr><tr class=""><td class="specs-key">Other Details</td>\n                                        <td class="specs-value fk-data">Padded Footbed, Textured Outsole</td>\n                </tr></table></div>'], 'size': [u'37', u'38', u'39', u'40']}
{'sku': [u'/viewcart?eid=LSTSHODRBHAE6MXDQEJBEHINR'], 'seller': [u'WS Retail', u'[?]'], 'title': [u'\n                    Enroute Women Bellies            '], 'colour': [u'Blue', u'Tan'], 'sp': [u' Rs. 899', u'(1,977,144'], 'mrp': [u'Rs. 1999'], 'titleimg': [u'http://img5a.flixcart.com/image/shoe/c/y/e/red-ew50891-enroute-women-36-400x400-imadrukfpyhaevaz.jpeg'], 'catname': ['bellies'], 'brandname': ['Enroute Women.'], 'date': ['18:02:2014'], 'itemlink': ['http://www.flipkart.com/enroute-women-bellies/p/itmdrbhf3ajbyrpq?pid=SHODRBHAE6MXDQEJ&srno=b_12&ref=fcdd3e02-b719-4622-b5d3-8e80373f46e0'], 'desc': [u'<div class="item_left_column" id="description">\n        <h3 class="item_desc_title fk-uppercase">Enroute Women Bellies         Price: Rs.899</h3>\n        <div class="cls"></div>\n        <div class="item_desc_text line">\n            <div style="float:right">\n                \n \n            </div>\n                        <p>\r\n\tGive your collegiate style a touch of casual attitude and panache by slipping into this pair of trendy bellies from Enroute Women. Enhanced with a suede body for a luxe appeal, this pair of red bellies comes with <strong>bead detailing</strong> to complement your casual look. Team these bellies with a ruffled top and skirt.</p>\r\n<p>\r\n\tCombining classy sophistication with a rugged chic sense, <strong>Enroute</strong> brings to you a range of cosmopolitan styles that is sure to up your fashion quotient.</p>\r\n<p>\r\n\t<strong>Footwear Care</strong></p>\r\n<p>\r\n\tWipe clean with a soft cloth.</p>\r\n<p>\r\n\t\xa0</p>        </div>\n        <div style="clear: both;"></div>\n            </div>'], 'spec': [u'<div id="specifications" class="item_left_column">\n    <h3 class="item_desc_title fk-uppercase">\n        Specifications of Enroute Women Bellies    </h3>\n\n            <table cellspacing="0" class="fk-specs-type2"><tr><th class="group-head" colspan="2">General</th>\n            </tr><tr class=""><td class="specs-key">Ideal For</td>\n                                        <td class="specs-value fk-data">Women</td>\n                </tr></table><table cellspacing="0" class="fk-specs-type2"><tr><th class="group-head" colspan="2">Shoe Details</th>\n            </tr><tr class=""><td class="specs-key">Style</td>\n                                        <td class="specs-value fk-data">Panel and Stitch Detail, Suede Body, Bead Detailing</td>\n                </tr><tr class=""><td class="specs-key">Color</td>\n                                        <td class="specs-value fk-data">Red</td>\n                </tr><tr class=""><td class="specs-key">Tip Shape</td>\n                                        <td class="specs-value fk-data">Round</td>\n                </tr><tr class=""><td class="specs-key">Weight</td>\n                                        <td class="specs-value fk-data">137 gm (per single Shoe) - Weight of the product may vary depending on size.</td>\n                </tr></table><table cellspacing="0" class="fk-specs-type2"><tr><th class="group-head" colspan="2">Additional Details</th>\n            </tr><tr class=""><td class="specs-key">Other Details</td>\n                                        <td class="specs-value fk-data">Textured Sole, Padded Footbed</td>\n                </tr></table></div>'], 'size': [u'36', u'37', u'38', u'39', u'40']}
{'sku': [u'/viewcart?eid=LSTSHODRBHA9PWKFUCXWY44P7'], 'seller': [u'WS Retail', u'[?]'], 'title': [u'\n                    Enroute Women Bellies            '], 'colour': [u'Blue', u'Red'], 'sp': [u' Rs. 899', u'(1,977,144'], 'mrp': [u'Rs. 1999'], 'titleimg': [u'http://img5a.flixcart.com/image/shoe/j/f/q/tan-ew50891-enroute-women-36-400x400-imadrukhgvk57bnr.jpeg'], 'catname': ['bellies'], 'brandname': ['Enroute Women.'], 'date': ['18:02:2014'], 'itemlink': ['http://www.flipkart.com/enroute-women-bellies/p/itmdrbhgnct4ghxr?pid=SHODRBHA9PWKFUCX&srno=b_11&ref=fcdd3e02-b719-4622-b5d3-8e80373f46e0'], 'desc': [u'<div class="item_left_column" id="description">\n        <h3 class="item_desc_title fk-uppercase">Enroute Women Bellies         Price: Rs.899</h3>\n        <div class="cls"></div>\n        <div class="item_desc_text line">\n            <div style="float:right">\n                \n \n            </div>\n                        <p>\r\n\tStriking a unique design while still creating a classy appearance, this pair of tan coloured suede bellies from Enroute Women comes with a <strong>bead detail in the front </strong>of the shoe which will engage any onlookers in your one of a kind style statement. Team it with black pants or skinny jeans along with a beige coloured top.</p>\r\n<p>\r\n\tCombining classy sophistication with a rugged chic sense,<strong> Enroute</strong> brings to you a range of cosmopolitan styles that is sure to up your fashion quotient.</p>\r\n<p>\r\n\t<strong>Footwear Care</strong></p>\r\n<p>\r\n\tWipe gently with a soft and dry cloth.</p>        </div>\n        <div style="clear: both;"></div>\n            </div>'], 'spec': [u'<div id="specifications" class="item_left_column">\n    <h3 class="item_desc_title fk-uppercase">\n        Specifications of Enroute Women Bellies    </h3>\n\n            <table cellspacing="0" class="fk-specs-type2"><tr><th class="group-head" colspan="2">General</th>\n            </tr><tr class=""><td class="specs-key">Ideal For</td>\n                                        <td class="specs-value fk-data">Women</td>\n                </tr></table><table cellspacing="0" class="fk-specs-type2"><tr><th class="group-head" colspan="2">Shoe Details</th>\n            </tr><tr class=""><td class="specs-key">Style</td>\n                                        <td class="specs-value fk-data">Bead Detail, Panel and Stitch Detail, Suede Body</td>\n                </tr><tr class=""><td class="specs-key">Color</td>\n                                        <td class="specs-value fk-data">Tan</td>\n                </tr><tr class=""><td class="specs-key">Tip Shape</td>\n                                        <td class="specs-value fk-data">Round</td>\n                </tr><tr class=""><td class="specs-key">Weight</td>\n                                        <td class="specs-value fk-data">137 gm (per single Shoe) - Weight of the product may vary depending on size.</td>\n                </tr></table><table cellspacing="0" class="fk-specs-type2"><tr><th class="group-head" colspan="2">Additional Details</th>\n            </tr><tr class=""><td class="specs-key">Other Details</td>\n                                        <td class="specs-value fk-data">Textured Sole, Padded Footbed</td>\n                </tr></table></div>'], 'size': [u'36', u'37', u'38']}
{'sku': [u'/viewcart?eid=LSTSHODRBHAJ7AHGZKYHYPP3L'], 'seller': [u'WS Retail', u'[?]'], 'title': [u'\n                    Enroute Women Bellies            '], 'colour': [u'Black'], 'sp': [u' Rs. 1124', u'(1,977,144'], 'mrp': [u'Rs. 2499'], 'titleimg': [u'http://img6a.flixcart.com/image/shoe/3/2/b/pink-ew48884-enroute-women-36-400x400-imadrukfef4spy6h.jpeg'], 'catname': ['bellies'], 'brandname': ['Enroute Women.'], 'date': ['18:02:2014'], 'itemlink': ['http://www.flipkart.com/enroute-women-bellies/p/itmdrbhfdgpgpzyk?pid=SHODRBHAJ7AHGZKY&srno=b_13&ref=fcdd3e02-b719-4622-b5d3-8e80373f46e0'], 'desc': [u'<div class="item_left_column" id="description">\n        <h3 class="item_desc_title fk-uppercase">Enroute Women Bellies         Price: Rs.1124</h3>\n        <div class="cls"></div>\n        <div class="item_desc_text line">\n            <div style="float:right">\n                \n \n            </div>\n                        <p>\r\n\tSassy and elegant in a refined shade of pink with a polished finish, this pair of trendy bellies from Enroute Women adds a dash of classic style to your look. The <strong>bow detailing</strong> gives a smart finish to these bellies. Team this pair of bellies with a light-hued top and cropped trousers.\xa0</p>\r\n<p>\r\n\tCombining classy sophistication with a rugged chic sense, <strong>Enroute</strong> brings to you a range of cosmopolitan styles that is sure to up your fashion quotient.</p>\r\n<p>\r\n\t<strong>Footwear Care</strong></p>\r\n<p>\r\n\tWipe gently with a soft cloth.</p>        </div>\n        <div style="clear: both;"></div>\n            </div>'], 'spec': [u'<div id="specifications" class="item_left_column">\n    <h3 class="item_desc_title fk-uppercase">\n        Specifications of Enroute Women Bellies    </h3>\n\n            <table cellspacing="0" class="fk-specs-type2"><tr><th class="group-head" colspan="2">General</th>\n            </tr><tr class=""><td class="specs-key">Ideal For</td>\n                                        <td class="specs-value fk-data">Women</td>\n                </tr></table><table cellspacing="0" class="fk-specs-type2"><tr><th class="group-head" colspan="2">Shoe Details</th>\n            </tr><tr class=""><td class="specs-key">Style</td>\n                                        <td class="specs-value fk-data">Bow Detailing, Panel and Stitch Detail</td>\n                </tr><tr class=""><td class="specs-key">Color</td>\n                                        <td class="specs-value fk-data">Pink</td>\n                </tr><tr class=""><td class="specs-key">Heel Height</td>\n                                        <td class="specs-value fk-data">0.5 inch</td>\n                </tr><tr class=""><td class="specs-key">Tip Shape</td>\n                                        <td class="specs-value fk-data">Round</td>\n                </tr><tr class=""><td class="specs-key">Weight</td>\n                                        <td class="specs-value fk-data">137 gm (per single Shoe) - Weight of the product may vary depending on size.</td>\n                </tr></table><table cellspacing="0" class="fk-specs-type2"><tr><th class="group-head" colspan="2">Additional Details</th>\n            </tr><tr class=""><td class="specs-key">Other Details</td>\n                                        <td class="specs-value fk-data">Textured Sole, Padded Footbed</td>\n                </tr></table></div>'], 'size': [u'36', u'37', u'38']}
{'sku': [u'/viewcart?eid=LSTSHODRBHA5Y7SDGHGP9YHVU'], 'seller': [u'WS Retail', u'[?]'], 'title': [u'\n                    Enroute Women Bellies            '], 'colour': [u'Pink, Blue'], 'sp': [u' Rs. 1574', u'(1,977,144'], 'mrp': [u'Rs. 3499'], 'titleimg': [u'http://img5a.flixcart.com/image/shoe/7/8/s/beige-blue-ew49067-enroute-women-36-400x400-imadrvdmsffsatex.jpeg'], 'catname': ['bellies'], 'brandname': ['Enroute Women.'], 'date': ['18:02:2014'], 'itemlink': ['http://www.flipkart.com/enroute-women-bellies/p/itmdrbhfffxzsezw?pid=SHODRBHA5Y7SDGHG&srno=b_16&ref=9c486cde-f921-437e-b86e-25c4e1062166'], 'desc': [], 'spec': [u'<div id="specifications" class="item_left_column">\n    <h3 class="item_desc_title fk-uppercase">\n        Specifications of Enroute Women Bellies    </h3>\n\n            <table cellspacing="0" class="fk-specs-type2"><tr><th class="group-head" colspan="2">General</th>\n            </tr><tr class=""><td class="specs-key">Ideal For</td>\n                                        <td class="specs-value fk-data">Women</td>\n                </tr></table><table cellspacing="0" class="fk-specs-type2"><tr><th class="group-head" colspan="2">Shoe Details</th>\n            </tr><tr class=""><td class="specs-key">Style</td>\n                                        <td class="specs-value fk-data">Elastic Ankle Strap, Panel and Stitch Detail</td>\n                </tr><tr class=""><td class="specs-key">Color</td>\n                                        <td class="specs-value fk-data">Beige, Blue</td>\n                </tr><tr class=""><td class="specs-key">Closure</td>\n                                        <td class="specs-value fk-data">Buckle</td>\n                </tr><tr class=""><td class="specs-key">Heel Height</td>\n                                        <td class="specs-value fk-data">3.7 inch</td>\n                </tr><tr class=""><td class="specs-key">Tip Shape</td>\n                                        <td class="specs-value fk-data">Pointed</td>\n                </tr><tr class=""><td class="specs-key">Weight</td>\n                                        <td class="specs-value fk-data">144 gm (per single Shoe) - Weight of the product may vary depending on size.</td>\n                </tr></table></div>'], 'size': [u'38', u'39', u'40']}
{'sku': [u'javascript:void(0);'], 'seller': [u'WS Retail'], 'title': [u'\n                    Enroute Women Bellies            '], 'colour': [], 'sp': [u' Rs. 899'], 'mrp': [u'Rs. 1999'], 'titleimg': [u'http://img6a.flixcart.com/image/shoe/z/3/g/white-tan-ew50898-enroute-women-39-400x400-imadt6bru3vwfxzu.jpeg'], 'catname': ['bellies'], 'brandname': ['Enroute Women.'], 'date': ['18:02:2014'], 'itemlink': ['http://www.flipkart.com/enroute-women-bellies/p/itmdrbhg4hc4ezq5?pid=SHODRBHAYJW3TBNX&srno=b_15&ref=fcdd3e02-b719-4622-b5d3-8e80373f46e0'], 'desc': [], 'spec': [u'<div id="specifications" class="item_left_column">\n    <h3 class="item_desc_title fk-uppercase">\n        Specifications of Enroute Women Bellies    </h3>\n\n            <table cellspacing="0" class="fk-specs-type2"><tr><th class="group-head" colspan="2">General</th>\n            </tr><tr class=""><td class="specs-key">Ideal For</td>\n                                        <td class="specs-value fk-data">Women</td>\n                </tr></table><table cellspacing="0" class="fk-specs-type2"><tr><th class="group-head" colspan="2">Shoe Details</th>\n            </tr><tr class=""><td class="specs-key">Style</td>\n                                        <td class="specs-value fk-data">Bow Detail, Perforation Detail, Panel and Stitch Detail</td>\n                </tr><tr class=""><td class="specs-key">Color</td>\n                                        <td class="specs-value fk-data">White, Tan</td>\n                </tr><tr class=""><td class="specs-key">Tip Shape</td>\n                                        <td class="specs-value fk-data">Round</td>\n                </tr><tr class=""><td class="specs-key">Weight</td>\n                                        <td class="specs-value fk-data">157 gm (per single Shoe) - Weight of the product may vary depending on size.</td>\n                </tr></table><table cellspacing="0" class="fk-specs-type2"><tr><th class="group-head" colspan="2">Additional Details</th>\n            </tr><tr class=""><td class="specs-key">Other Details</td>\n                                        <td class="specs-value fk-data">Padded Footbed</td>\n                </tr></table></div>'], 'size': []}
{'sku': [u'javascript:void(0);'], 'seller': [u'WS Retail'], 'title': [u'\n                    Enroute Women Bellies            '], 'colour': [u'Grey'], 'sp': [u' Rs. 899'], 'mrp': [u'Rs. 1999'], 'titleimg': [u'http://img6a.flixcart.com/image/shoe/b/s/q/brown-ew70095-enroute-women-36-400x400-imadrukfwjkhd8np.jpeg'], 'catname': ['bellies'], 'brandname': ['Enroute Women.'], 'date': ['18:02:2014'], 'itemlink': ['http://www.flipkart.com/enroute-women-bellies/p/itmdrbhgqjtjeanc?pid=SHODRBHATHWZGKRC&srno=b_18&ref=9c486cde-f921-437e-b86e-25c4e1062166'], 'desc': [u'<div class="item_left_column" id="description">\n        <h3 class="item_desc_title fk-uppercase">Enroute Women Bellies         Price: Rs.899</h3>\n        <div class="cls"></div>\n        <div class="item_desc_text line">\n            <div style="float:right">\n                \n \n            </div>\n                        <p>\r\n\tFlaunting a <strong>snake textured panel\xa0</strong>that shows-off powerful character, this pair of casual bellies from Enroute Women allows your feet to enjoy the envious looks that will come your way. Team it with black skinny jeans and an animal printed top for a grand appearance.</p>\r\n<p>\r\n\tCombining classy sophistication with a rugged chic sense, <strong>Enroute </strong>brings to you a range of cosmopolitan styles that is sure to up your fashion quotient.</p>\r\n<p>\r\n\t<strong>Footwear Care</strong></p>\r\n<p>\r\n\tUse a soft cloth to remove any dust or grime.\xa0</p>        </div>\n        <div style="clear: both;"></div>\n            </div>'], 'spec': [u'<div id="specifications" class="item_left_column">\n    <h3 class="item_desc_title fk-uppercase">\n        Specifications of Enroute Women Bellies    </h3>\n\n            <table cellspacing="0" class="fk-specs-type2"><tr><th class="group-head" colspan="2">General</th>\n            </tr><tr class=""><td class="specs-key">Ideal For</td>\n                                        <td class="specs-value fk-data">Women</td>\n                </tr></table><table cellspacing="0" class="fk-specs-type2"><tr><th class="group-head" colspan="2">Shoe Details</th>\n            </tr><tr class=""><td class="specs-key">Style</td>\n                                        <td class="specs-value fk-data">Panel and Stitch Detail</td>\n                </tr><tr class=""><td class="specs-key">Color</td>\n                                        <td class="specs-value fk-data">Brown</td>\n                </tr><tr class=""><td class="specs-key">Tip Shape</td>\n                                        <td class="specs-value fk-data">Round</td>\n                </tr><tr class=""><td class="specs-key">Weight</td>\n                                        <td class="specs-value fk-data">108 gm (per single Shoe) - Weight of the product may vary depending on size.</td>\n                </tr></table><table cellspacing="0" class="fk-specs-type2"><tr><th class="group-head" colspan="2">Additional Details</th>\n            </tr><tr class=""><td class="specs-key">Other Details</td>\n                                        <td class="specs-value fk-data">Padded Footbed, Textured Sole</td>\n                </tr></table></div>'], 'size': []}
