{'sku': [u'/viewcart?eid=LSTSHODRBHAD3RNVFRYRZ0HRO'], 'seller': [u'WS Retail', u'[?]'], 'title': [u'\n                    Enroute Women Bellies            '], 'colour': [u'Blue', u'Turquoise'], 'sp': [u' Rs. 764', u'(1,977,144'], 'mrp': [u'Rs. 1699'], 'titleimg': [u'http://img5a.flixcart.com/image/shoe/b/3/5/coral-ew48560-enroute-women-36-400x400-imadrukghyxtbgzf.jpeg'], 'catname': ['bellies'], 'brandname': ['Enroute Women.'], 'date': ['18:02:2014'], 'itemlink': ['http://www.flipkart.com/enroute-women-bellies/p/itmdrbhfbfemy9dg?pid=SHODRBHAD3RNVFRY&srno=b_1&ref=fcdd3e02-b719-4622-b5d3-8e80373f46e0'], 'desc': [u'<div class="item_left_column" id="description">\n        <h3 class="item_desc_title fk-uppercase">Enroute Women Bellies         Price: Rs.764</h3>\n        <div class="cls"></div>\n        <div class="item_desc_text line">\n            <div style="float:right">\n                \n \n            </div>\n                        <p>\r\n\tVibrant and classy, this pair of bright coral coloured bellies from Enroute Women can be worn with skinny jeans or formal pants along with an orange top for flair. Its petite <strong>bow detail in the front</strong> gives a chic appearance to its onlookers.</p>\r\n<p>\r\n\tCombining classy sophistication with a rugged chic sense,<strong> Enroute</strong> brings to you a range of cosmopolitan styles that is sure to up your fashion quotient.</p>\r\n<p>\r\n\t<strong>Footwear Care</strong></p>\r\n<p>\r\n\tWipe gently with a soft cloth.</p>        </div>\n        <div style="clear: both;"></div>\n            </div>'], 'spec': [u'<div id="specifications" class="item_left_column">\n    <h3 class="item_desc_title fk-uppercase">\n        Specifications of Enroute Women Bellies    </h3>\n\n            <table cellspacing="0" class="fk-specs-type2"><tr><th class="group-head" colspan="2">General</th>\n            </tr><tr class=""><td class="specs-key">Ideal For</td>\n                                        <td class="specs-value fk-data">Women</td>\n                </tr></table><table cellspacing="0" class="fk-specs-type2"><tr><th class="group-head" colspan="2">Shoe Details</th>\n            </tr><tr class=""><td class="specs-key">Style</td>\n                                        <td class="specs-value fk-data">Panel and Stitch Detail, Bow Detail</td>\n                </tr><tr class=""><td class="specs-key">Color</td>\n                                        <td class="specs-value fk-data">Coral</td>\n                </tr><tr class=""><td class="specs-key">Tip Shape</td>\n                                        <td class="specs-value fk-data">Round</td>\n                </tr><tr class=""><td class="specs-key">Weight</td>\n                                        <td class="specs-value fk-data">95 gm (per single Shoe) - Weight of the product may vary depending on size.</td>\n                </tr></table><table cellspacing="0" class="fk-specs-type2"><tr><th class="group-head" colspan="2">Additional Details</th>\n            </tr><tr class=""><td class="specs-key">Other Details</td>\n                                        <td class="specs-value fk-data">Padded Footbed, Textured Sole</td>\n                </tr></table></div>'], 'size': [u'36', u'37', u'38', u'39', u'40']}
{'sku': [u'/viewcart?eid=LSTSHODRBHAJSSVZZX51SHTLQ'], 'seller': [u'WS Retail', u'[?]'], 'title': [u'\n                    Enroute Women Bellies            '], 'colour': [], 'sp': [u' Rs. 494', u'(1,977,144'], 'mrp': [u'Rs. 1099'], 'titleimg': [u'http://img6a.flixcart.com/image/shoe/k/y/m/blue-48210v-enroute-women-36-400x400-imadrukhbjvqgsf3.jpeg'], 'catname': ['bellies'], 'brandname': ['Enroute Women.'], 'date': ['18:02:2014'], 'itemlink': ['http://www.flipkart.com/enroute-women-bellies/p/itmdrbhek9hxwb9d?pid=SHODRBHAJSSVZZX5&srno=b_2&ref=fcdd3e02-b719-4622-b5d3-8e80373f46e0'], 'desc': [u'<div class="item_left_column" id="description">\n        <h3 class="item_desc_title fk-uppercase">Enroute Women Bellies         Price: Rs.494</h3>\n        <div class="cls"></div>\n        <div class="item_desc_text line">\n            <div style="float:right">\n                \n \n            </div>\n                        <p>\r\n\tChic yet so simply designed, this pair of blue bellies from Enroute women gives a wholesome and innocent appearance to your full ensemble. The unruly <strong>bow detail in the front</strong>, although messy, has its own style, especially when paired with formal pants and a light blue top.</p>\r\n<p>\r\n\tCombining classy sophistication with a rugged chic sense, <strong>Enroute</strong> brings to you a range of cosmopolitan styles that is sure to up your fashion quotient.</p>\r\n<p>\r\n\t<strong>Footwear Care</strong></p>\r\n<p>\r\n\tWipe gently with a soft and dry cloth.</p>        </div>\n        <div style="clear: both;"></div>\n            </div>'], 'spec': [u'<div id="specifications" class="item_left_column">\n    <h3 class="item_desc_title fk-uppercase">\n        Specifications of Enroute Women Bellies    </h3>\n\n            <table cellspacing="0" class="fk-specs-type2"><tr><th class="group-head" colspan="2">General</th>\n            </tr><tr class=""><td class="specs-key">Ideal For</td>\n                                        <td class="specs-value fk-data">Women</td>\n                </tr></table><table cellspacing="0" class="fk-specs-type2"><tr><th class="group-head" colspan="2">Shoe Details</th>\n            </tr><tr class=""><td class="specs-key">Style</td>\n                                        <td class="specs-value fk-data">Bow Detail in Front, Panel and Stitch Detail</td>\n                </tr><tr class=""><td class="specs-key">Color</td>\n                                        <td class="specs-value fk-data">Blue</td>\n                </tr><tr class=""><td class="specs-key">Tip Shape</td>\n                                        <td class="specs-value fk-data">Round</td>\n                </tr><tr class=""><td class="specs-key">Weight</td>\n                                        <td class="specs-value fk-data">147 gm (per single Shoe) - Weight of the product may vary depending on size.</td>\n                </tr></table><table cellspacing="0" class="fk-specs-type2"><tr><th class="group-head" colspan="2">Additional Details</th>\n            </tr><tr class=""><td class="specs-key">Other Details</td>\n                                        <td class="specs-value fk-data">Textured Sole, Padded Footbed</td>\n                </tr></table></div>'], 'size': [u'36', u'37', u'39', u'40']}
{'sku': [u'/viewcart?eid=LSTSHODRBHAS9HWGBPY9E0YSH'], 'seller': [u'WS Retail', u'[?]'], 'title': [u'\n                    Enroute Women Bellies            '], 'colour': [u'Blue', u'Coral'], 'sp': [u' Rs. 764', u'(1,977,144'], 'mrp': [u'Rs. 1699'], 'titleimg': [u'http://img6a.flixcart.com/image/shoe/r/e/u/turquoise-ew48560-enroute-women-36-400x400-imadrvdmcsgg4ucp.jpeg'], 'catname': ['bellies'], 'brandname': ['Enroute Women.'], 'date': ['18:02:2014'], 'itemlink': ['http://www.flipkart.com/enroute-women-bellies/p/itmdrbhfsexcbrv4?pid=SHODRBHAS9HWGBPY&srno=b_3&ref=fcdd3e02-b719-4622-b5d3-8e80373f46e0'], 'desc': [u'<div class="item_left_column" id="description">\n        <h3 class="item_desc_title fk-uppercase">Enroute Women Bellies         Price: Rs.764</h3>\n        <div class="cls"></div>\n        <div class="item_desc_text line">\n            <div style="float:right">\n                \n \n            </div>\n                        <p style="text-align: justify;">\r\n\tIndulge in an overdose of luxury and elegance wearing these marvellous Bellies from Enroute that have been fabricated in <strong>turquoise </strong>with a pretty little <strong>bow on the front</strong> and panel design. Wear these gorgeous bellies with a white and green floral printed dress.</p>\r\n<p style="text-align: justify;">\r\n\tCombining classy sophistication with a rugged chic sense, <strong>Enroute </strong>brings to you a range of cosmopolitan styles that is sure to up your fashion quotient.</p>\r\n<p style="text-align: justify;">\r\n\t<strong>Footwear Care</strong></p>\r\n<p style="text-align: justify;">\r\n\tAir the shoes out after every use. Wipe clean with soft cloth.</p>        </div>\n        <div style="clear: both;"></div>\n            </div>'], 'spec': [u'<div id="specifications" class="item_left_column">\n    <h3 class="item_desc_title fk-uppercase">\n        Specifications of Enroute Women Bellies    </h3>\n\n            <table cellspacing="0" class="fk-specs-type2"><tr><th class="group-head" colspan="2">General</th>\n            </tr><tr class=""><td class="specs-key">Ideal For</td>\n                                        <td class="specs-value fk-data">Women</td>\n                </tr></table><table cellspacing="0" class="fk-specs-type2"><tr><th class="group-head" colspan="2">Shoe Details</th>\n            </tr><tr class=""><td class="specs-key">Style</td>\n                                        <td class="specs-value fk-data">Panel and Stitch Detail, Bow Detail at Front</td>\n                </tr><tr class=""><td class="specs-key">Color</td>\n                                        <td class="specs-value fk-data">Turquoise</td>\n                </tr><tr class=""><td class="specs-key">Tip Shape</td>\n                                        <td class="specs-value fk-data">Round</td>\n                </tr><tr class=""><td class="specs-key">Weight</td>\n                                        <td class="specs-value fk-data">113 gm (per single Shoe) - Weight of the product may vary depending on size.</td>\n                </tr></table><table cellspacing="0" class="fk-specs-type2"><tr><th class="group-head" colspan="2">Additional Details</th>\n            </tr><tr class=""><td class="specs-key">Other Details</td>\n                                        <td class="specs-value fk-data">Textured Outsole, Padded Footbed</td>\n                </tr></table></div>'], 'size': [u'36', u'37', u'38', u'39', u'40']}
{'sku': [u'/viewcart?eid=LSTSHODZTH7QMM4VWVNA48OSV'], 'seller': [u'WS Retail', u'[?]'], 'title': [u'\n                    Enroute Women Bellies            '], 'colour': [], 'sp': [u' Rs. 899', u'(1,977,144'], 'mrp': [u'Rs. 1999'], 'titleimg': [u'http://img5a.flixcart.com/image/shoe/d/r/g/white-pink-46209v-enroute-women-40-400x400-imadqbvdrztbscz3.jpeg'], 'catname': ['bellies'], 'brandname': ['Enroute Women.'], 'date': ['18:02:2014'], 'itemlink': ['http://www.flipkart.com/enroute-women-bellies/p/itmdzth8tbnhhnrs?pid=SHODZTH7QMM4VWVN&srno=b_7&ref=fcdd3e02-b719-4622-b5d3-8e80373f46e0'], 'desc': [u'<div class="item_left_column" id="description">\n        <h3 class="item_desc_title fk-uppercase">Enroute Women Bellies         Price: Rs.899</h3>\n        <div class="cls"></div>\n        <div class="item_desc_text line">\n            <div style="float:right">\n                \n \n            </div>\n                        <p>\r\n\tThese adorable braided bellies from Enroute\xa0Women are enhanced with a bow detail at the front to give your casual look a playful style. A chic mix of <strong>pink, beige and white</strong>, this pair of bellies with a panel and stitch detail will look picture perfect when teamed with a trendy top and shorts.</p>\r\n<p>\r\n\tCombining classy sophistication with a rugged chic sense, <strong>Enroute Women</strong> brings to you a range of cosmopolitan styles that is sure to up your fashion quotient.</p>\r\n<p>\r\n\t<strong>Footwear Care</strong></p>\r\n<p>\r\n\tTreat these bellies with utmost care by wiping them with a dry cloth.</p>        </div>\n        <div style="clear: both;"></div>\n            </div>'], 'spec': [u'<div id="specifications" class="item_left_column">\n    <h3 class="item_desc_title fk-uppercase">\n        Specifications of Enroute Women Bellies    </h3>\n\n            <table cellspacing="0" class="fk-specs-type2"><tr><th class="group-head" colspan="2">General</th>\n            </tr><tr class=""><td class="specs-key">Ideal For</td>\n                                        <td class="specs-value fk-data">Women</td>\n                </tr></table><table cellspacing="0" class="fk-specs-type2"><tr><th class="group-head" colspan="2">Shoe Details</th>\n            </tr><tr class=""><td class="specs-key">Style</td>\n                                        <td class="specs-value fk-data">Bow Detail at Front, Braided Body, Panel and Stitch Detail</td>\n                </tr><tr class=""><td class="specs-key">Color</td>\n                                        <td class="specs-value fk-data">White, Pink</td>\n                </tr><tr class=""><td class="specs-key">Tip Shape</td>\n                                        <td class="specs-value fk-data">Round</td>\n                </tr><tr class=""><td class="specs-key">Weight</td>\n                                        <td class="specs-value fk-data">134 gm (per single Shoe) - Weight of the product may vary depending on size.</td>\n                </tr></table><table cellspacing="0" class="fk-specs-type2"><tr><th class="group-head" colspan="2">Additional Details</th>\n            </tr><tr class=""><td class="specs-key">Other Details</td>\n                                        <td class="specs-value fk-data">Textured Outsole, Padded Footbed</td>\n                </tr></table></div>'], 'size': [u'36', u'37', u'39']}
{'sku': [u'javascript:void(0);'], 'seller': [u'WS Retail'], 'title': [u'\n                    Enroute Women Bellies            '], 'colour': [u'White, Pink'], 'sp': [u' Rs. 899'], 'mrp': [u'Rs. 1999'], 'titleimg': [u'http://img6a.flixcart.com/image/shoe/p/m/h/blue-green-46209v-enroute-women-36-400x400-imadrvdjhgzrhra2.jpeg'], 'catname': ['bellies'], 'brandname': ['Enroute Women.'], 'date': ['18:02:2014'], 'itemlink': ['http://www.flipkart.com/enroute-women-bellies/p/itmdrbheeupguzme?pid=SHODRBH9P6FXBGPF&srno=b_6&ref=fcdd3e02-b719-4622-b5d3-8e80373f46e0'], 'desc': [u'<div class="item_left_column" id="description">\n        <h3 class="item_desc_title fk-uppercase">Enroute Women Bellies         Price: Rs.899</h3>\n        <div class="cls"></div>\n        <div class="item_desc_text line">\n            <div style="float:right">\n                \n \n            </div>\n                        <p style="text-align: justify;">\r\n\tSet the style statement this season wearing these pretty little Enroute Bellies with a pair of solid shaded green dress carrying a blue clutch along. Styled with a<strong> blue and green panel design</strong> along the outer, these bellies bear a <strong>bow on the front</strong> and a padded footbed for extra comfort.</p>\r\n<p style="text-align: justify;">\r\n\tCombining classy sophistication with a rugged chic sense, <strong>Enroute </strong>brings to you a range of cosmopolitan styles that is sure to up your fashion quotient.</p>\r\n<p style="text-align: justify;">\r\n\t<strong>Footwear Care</strong></p>\r\n<p style="text-align: justify;">\r\n\tAir the shoes out after every use. Wipe clean with soft cloth.</p>        </div>\n        <div style="clear: both;"></div>\n            </div>'], 'spec': [u'<div id="specifications" class="item_left_column">\n    <h3 class="item_desc_title fk-uppercase">\n        Specifications of Enroute Women Bellies    </h3>\n\n            <table cellspacing="0" class="fk-specs-type2"><tr><th class="group-head" colspan="2">General</th>\n            </tr><tr class=""><td class="specs-key">Ideal For</td>\n                                        <td class="specs-value fk-data">Women</td>\n                </tr></table><table cellspacing="0" class="fk-specs-type2"><tr><th class="group-head" colspan="2">Shoe Details</th>\n            </tr><tr class=""><td class="specs-key">Style</td>\n                                        <td class="specs-value fk-data">Bow Detail at Front, Panel and Stitch Detail</td>\n                </tr><tr class=""><td class="specs-key">Color</td>\n                                        <td class="specs-value fk-data">Blue, Green</td>\n                </tr><tr class=""><td class="specs-key">Tip Shape</td>\n                                        <td class="specs-value fk-data">Round</td>\n                </tr><tr class=""><td class="specs-key">Weight</td>\n                                        <td class="specs-value fk-data">118 gm (per single Shoe) - Weight of the product may vary depending on size.</td>\n                </tr></table><table cellspacing="0" class="fk-specs-type2"><tr><th class="group-head" colspan="2">Additional Details</th>\n            </tr><tr class=""><td class="specs-key">Other Details</td>\n                                        <td class="specs-value fk-data">Textured Outsole, Padded Footbed</td>\n                </tr></table></div>'], 'size': []}
{'sku': [u'/viewcart?eid=LSTSHODRBHAVZZHBNFFU2WBGI'], 'seller': [u'WS Retail', u'[?]'], 'title': [u'\n                    Enroute Women Bellies            '], 'colour': [u'Coral', u'Turquoise'], 'sp': [u' Rs. 764', u'(1,977,144'], 'mrp': [u'Rs. 1699'], 'titleimg': [u'http://img5a.flixcart.com/image/shoe/n/f/f/blue-ew48560-enroute-women-39-400x400-imadsuvbgjdfjxju.jpeg'], 'catname': ['bellies'], 'brandname': ['Enroute Women.'], 'date': ['18:02:2014'], 'itemlink': ['http://www.flipkart.com/enroute-women-bellies/p/itmdrbhfpagx5gvz?pid=SHODRBHAVZZHBNFF&srno=b_8&ref=fcdd3e02-b719-4622-b5d3-8e80373f46e0'], 'desc': [], 'spec': [u'<div id="specifications" class="item_left_column">\n    <h3 class="item_desc_title fk-uppercase">\n        Specifications of Enroute Women Bellies    </h3>\n\n            <table cellspacing="0" class="fk-specs-type2"><tr><th class="group-head" colspan="2">General</th>\n            </tr><tr class=""><td class="specs-key">Ideal For</td>\n                                        <td class="specs-value fk-data">Women</td>\n                </tr></table><table cellspacing="0" class="fk-specs-type2"><tr><th class="group-head" colspan="2">Shoe Details</th>\n            </tr><tr class=""><td class="specs-key">Style</td>\n                                        <td class="specs-value fk-data">Panel and Stitch Detail, Bow Detailing</td>\n                </tr><tr class=""><td class="specs-key">Color</td>\n                                        <td class="specs-value fk-data">Blue</td>\n                </tr><tr class=""><td class="specs-key">Closure</td>\n                                        <td class="specs-value fk-data">Laced</td>\n                </tr><tr class=""><td class="specs-key">Tip Shape</td>\n                                        <td class="specs-value fk-data">Round</td>\n                </tr><tr class=""><td class="specs-key">Weight</td>\n                                        <td class="specs-value fk-data">129 gm (per single Shoe) - Weight of the product may vary depending on size.</td>\n                </tr></table><table cellspacing="0" class="fk-specs-type2"><tr><th class="group-head" colspan="2">Additional Details</th>\n            </tr><tr class=""><td class="specs-key">Other Details</td>\n                                        <td class="specs-value fk-data">Padded Footbed</td>\n                </tr></table></div>'], 'size': [u'36', u'37', u'38', u'39', u'40']}
{'sku': [], 'seller': [], 'title': [], 'colour': [], 'sp': [], 'mrp': [u'Rs. 1999'], 'titleimg': [u'http://img5a.flixcart.com/image/shoe/g/h/s/navy-tan-ew50898-enroute-women-36-400x400-imadrvdm2up37kyh.jpeg'], 'catname': ['bellies'], 'brandname': ['Enroute Women.'], 'date': ['18:02:2014'], 'itemlink': ['http://www.flipkart.com/enroute-women-bellies/p/itmdrbhgyztwet7d?pid=SHODRBHAGGBQVGHS&srno=b_4&ref=fcdd3e02-b719-4622-b5d3-8e80373f46e0'], 'desc': [u'<div class="item_left_column" id="description">\n        <h3 class="item_desc_title fk-uppercase">Enroute Women Bellies         Price: Rs.899</h3>\n        <div class="cls"></div>\n        <div class="item_desc_text line">\n            <div style="float:right">\n                \n \n            </div>\n                        <p style="text-align: justify;">\r\n\tRespecting your standards of elite fashion, Enroute crafts these beautiful Bellies that you can wear with a beautiful blue dress or even a pair of jeans for an instant style upgrade. These<strong> tan and navy </strong>bellies have been crafted with a pretty <strong>bow on the front</strong>, while the perforated outer also bears a <strong>panel design</strong> to add to the looks.</p>\r\n<p style="text-align: justify;">\r\n\tCombining classy sophistication with a rugged chic sense, <strong>Enroute </strong>brings to you a range of cosmopolitan styles that is sure to up your fashion quotient.</p>\r\n<p style="text-align: justify;">\r\n\t<strong>Footwear Care</strong></p>\r\n<p style="text-align: justify;">\r\n\tAir the shoes out after every use. Wipe clean with soft cloth.</p>        </div>\n        <div style="clear: both;"></div>\n            </div>'], 'spec': [u'<div id="specifications" class="item_left_column">\n    <h3 class="item_desc_title fk-uppercase">\n        Specifications of Enroute Women Bellies    </h3>\n\n            <table cellspacing="0" class="fk-specs-type2"><tr><th class="group-head" colspan="2">General</th>\n            </tr><tr class=""><td class="specs-key">Ideal For</td>\n                                        <td class="specs-value fk-data">Women</td>\n                </tr></table><table cellspacing="0" class="fk-specs-type2"><tr><th class="group-head" colspan="2">Shoe Details</th>\n            </tr><tr class=""><td class="specs-key">Style</td>\n                                        <td class="specs-value fk-data">Bow Detail at Front, Panel and Stitch Detail</td>\n                </tr><tr class=""><td class="specs-key">Color</td>\n                                        <td class="specs-value fk-data">Navy, Tan</td>\n                </tr><tr class=""><td class="specs-key">Tip Shape</td>\n                                        <td class="specs-value fk-data">Round</td>\n                </tr><tr class=""><td class="specs-key">Weight</td>\n                                        <td class="specs-value fk-data">113 gm (per single Shoe) - Weight of the product may vary depending on size.</td>\n                </tr></table><table cellspacing="0" class="fk-specs-type2"><tr><th class="group-head" colspan="2">Additional Details</th>\n            </tr><tr class=""><td class="specs-key">Other Details</td>\n                                        <td class="specs-value fk-data">Padded Footbed, Textured Outsole</td>\n                </tr></table></div>'], 'size': []}
{'sku': [u'javascript:void(0);'], 'seller': [u'WS Retail'], 'title': [u'\n                    Enroute Women Bellies            '], 'colour': [u'White, Pink'], 'sp': [u' Rs. 899'], 'mrp': [u'Rs. 1999'], 'titleimg': [u'http://img6a.flixcart.com/image/shoe/x/y/g/fushia-46209v-enroute-women-36-400x400-imadrvdmbwhmhay4.jpeg'], 'catname': ['bellies'], 'brandname': ['Enroute Women.'], 'date': ['18:02:2014'], 'itemlink': ['http://www.flipkart.com/enroute-women-bellies/p/itmdrbhe26xb7dy3?pid=SHODRBH92GDUG4BX&srno=b_10&ref=fcdd3e02-b719-4622-b5d3-8e80373f46e0'], 'desc': [u'<div class="item_left_column" id="description">\n        <h3 class="item_desc_title fk-uppercase">Enroute Women Bellies         Price: Rs.899</h3>\n        <div class="cls"></div>\n        <div class="item_desc_text line">\n            <div style="float:right">\n                \n \n            </div>\n                        <p style="text-align: justify;">\r\n\tPamper the princess in you wearing these gorgeous fushia coloured Enroute Women\u2019s Bellies while you dress up wearing a pair of slim fit jeans and a casual purple cotton top. Crafted with a <strong>bow on the front</strong> and a stylish<strong> panel design</strong>, these bellies are extremely comfortable to be worn every day.</p>\r\n<p style="text-align: justify;">\r\n\tCombining classy sophistication with a rugged chic sense, <strong>Enroute </strong>brings to you a range of cosmopolitan styles that is sure to up your fashion quotient.</p>\r\n<p style="text-align: justify;">\r\n\t<strong>Footwear Care</strong></p>\r\n<p style="text-align: justify;">\r\n\tAir the shoes out after every use. Wipe clean with soft cloth.</p>        </div>\n        <div style="clear: both;"></div>\n            </div>'], 'spec': [u'<div id="specifications" class="item_left_column">\n    <h3 class="item_desc_title fk-uppercase">\n        Specifications of Enroute Women Bellies    </h3>\n\n            <table cellspacing="0" class="fk-specs-type2"><tr><th class="group-head" colspan="2">General</th>\n            </tr><tr class=""><td class="specs-key">Ideal For</td>\n                                        <td class="specs-value fk-data">Women</td>\n                </tr></table><table cellspacing="0" class="fk-specs-type2"><tr><th class="group-head" colspan="2">Shoe Details</th>\n            </tr><tr class=""><td class="specs-key">Style</td>\n                                        <td class="specs-value fk-data">Panel and Stitch Detail, Bow Detail at Front</td>\n                </tr><tr class=""><td class="specs-key">Color</td>\n                                        <td class="specs-value fk-data">Fushia</td>\n                </tr><tr class=""><td class="specs-key">Tip Shape</td>\n                                        <td class="specs-value fk-data">Round</td>\n                </tr><tr class=""><td class="specs-key">Weight</td>\n                                        <td class="specs-value fk-data">118 gm (per single Shoe) - Weight of the product may vary depending on size.</td>\n                </tr></table><table cellspacing="0" class="fk-specs-type2"><tr><th class="group-head" colspan="2">Additional Details</th>\n            </tr><tr class=""><td class="specs-key">Other Details</td>\n                                        <td class="specs-value fk-data">Padded Footbed, Textured Outsole</td>\n                </tr></table></div>'], 'size': []}
