15:02:2014,saris,Petrafab.,Petrafab Kosa Printed Georgette Sari,Rs. 610,http://img5a.flixcart.com/image/sari/r/6/q/mpzsr8320oc-petrafab-400x400-imadszguzrhgh2se.jpeg, No more colour,Rs. 610,FABDEAL,http://www.flipkart.com/petrafab-kosa-printed-georgette-sari/p/itmdsn7gjexj3vhb?pid=SARDSBCBMXS5ZR6Q&srno=b_1&ref=4c52040f-b039-40ac-a3aa-625ec21f51b4,LSTSARDSBCBMXS5ZR6Q1YHLAR,,<div class="item_left_column" id="description"><h3 class="item_desc_title fk-uppercase">Petrafab Kosa Printed Georgette Sari         Price: Rs.610</h3><div class="cls"></div><div class="item_desc_text line"><div style="float:right"></div>                        A desire of today?s modern women has hit the market that has an appealing faux georgette fabric. This sea green colored faux georgette saree has all the possibilities to attain glamorous getup like never before. One should hit an ultimate purchase on this attire to grab unique attire. There May Be Color Variation Due To Resolution Of The Actual Photo.        </div><div style="clear: both;"></div></div>,<div class="item_left_column" id="specifications"><h3 class="item_desc_title fk-uppercase">        Specifications of Petrafab Kosa Printed Georgette Sari    </h3><table cellspacing="0" class="fk-specs-type2"><tr><th class="group-head" colspan="2">General Details<a class="see-more unitExt rmargin10 no-underline" href="javascript:void(0);" onclick="$(this).closest('.fk-specs-type2').toggleClass('expandedMore')" title="Expand">[+]</a><a class="hidden unitExt rmargin10 no-underline" href="javascript:void(0);" onclick="$(this).closest('.fk-specs-type2').toggleClass('expandedMore')" title="Collapse">[-]</a></th></tr><tr class="hidden"><td class="specs-key">Occasion</td><td class="specs-value fk-data">Casual</td></tr><tr class="hidden"><td class="specs-key">Pattern</td><td class="specs-value fk-data">Printed</td></tr></table><table cellspacing="0" class="fk-specs-type2"><tr><th class="group-head" colspan="2">Sari Details</th></tr><tr class=""><td class="specs-key">Type</td><td class="specs-value fk-data">Kosa</td></tr><tr class=""><td class="specs-key">Fabric</td><td class="specs-value fk-data">Georgette</td></tr><tr class=""><td class="specs-key">Region</td><td class="specs-value fk-data">Gujarat</td></tr><tr class=""><td class="specs-key">Number of Contents in Sales Package</td><td class="specs-value fk-data">Pack of 1</td></tr><tr class=""><td class="specs-key">Blouse Piece</td><td class="specs-value fk-data">Yes</td></tr></table><table cellspacing="0" class="fk-specs-type2"><tr><th class="group-head" colspan="2">Dimensions</th></tr><tr class=""><td class="specs-key">Length</td><td class="specs-value fk-data">6.3 m</td></tr></table><table cellspacing="0" class="fk-specs-type2"><tr><th class="group-head" colspan="2">Fabric Care</th></tr><tr class=""><td class="specs-value fk-data" colspan="2">Wash and Iron Inside Out</td></tr></table><table cellspacing="0" class="fk-specs-type2"><tr><th class="group-head" colspan="2">In The Box</th></tr><tr class=""><td class="specs-key"> </td><td class="specs-value fk-data">Sari, Blouse</td></tr></table></div>
15:02:2014,saris,Petrafab.,Petrafab Floral Print Georgette Sari,Rs. 681,http://img5a.flixcart.com/image/sari/g/w/d/mnxsr8313adp-petrafab-400x400-imadsgsagx3ksnbn.jpeg, No more colour,Rs. 681,FABDEAL,http://www.flipkart.com/petrafab-floral-print-georgette-sari/p/itmdsn7gkfpg7g3r?pid=SARDSBCBZ6HKSGWD&srno=b_3&ref=4c52040f-b039-40ac-a3aa-625ec21f51b4,LSTSARDSBCBZ6HKSGWD2FYRPI,,<div class="item_left_column" id="description"><h3 class="item_desc_title fk-uppercase">Petrafab Floral Print Georgette Sari         Price: Rs.681</h3><div class="cls"></div><div class="item_desc_text line"><div style="float:right"></div>                        Add a delightful charm to your persona by wearing this marvelous piece from Fabdeal house. The saree carries amazing fabrication which is faux georgette with luscious red color. One should get going with this apparel that leads the way this season.        </div><div style="clear: both;"></div></div>,<div class="item_left_column" id="specifications"><h3 class="item_desc_title fk-uppercase">        Specifications of Petrafab Floral Print Georgette Sari    </h3><table cellspacing="0" class="fk-specs-type2"><tr><th class="group-head" colspan="2">General Details<a class="see-more unitExt rmargin10 no-underline" href="javascript:void(0);" onclick="$(this).closest('.fk-specs-type2').toggleClass('expandedMore')" title="Expand">[+]</a><a class="hidden unitExt rmargin10 no-underline" href="javascript:void(0);" onclick="$(this).closest('.fk-specs-type2').toggleClass('expandedMore')" title="Collapse">[-]</a></th></tr><tr class="hidden"><td class="specs-key">Occasion</td><td class="specs-value fk-data">Casual</td></tr><tr class="hidden"><td class="specs-key">Pattern</td><td class="specs-value fk-data">Floral Print</td></tr></table><table cellspacing="0" class="fk-specs-type2"><tr><th class="group-head" colspan="2">Sari Details</th></tr><tr class=""><td class="specs-key">Type</td><td class="specs-value fk-data">Kosa</td></tr><tr class=""><td class="specs-key">Fabric</td><td class="specs-value fk-data">Georgette</td></tr><tr class=""><td class="specs-key">Region</td><td class="specs-value fk-data">Gujarat</td></tr><tr class=""><td class="specs-key">Number of Contents in Sales Package</td><td class="specs-value fk-data">Pack of 1</td></tr><tr class=""><td class="specs-key">Blouse Piece</td><td class="specs-value fk-data">Yes</td></tr></table><table cellspacing="0" class="fk-specs-type2"><tr><th class="group-head" colspan="2">Dimensions</th></tr><tr class=""><td class="specs-key">Length</td><td class="specs-value fk-data">6.3 m</td></tr></table><table cellspacing="0" class="fk-specs-type2"><tr><th class="group-head" colspan="2">Fabric Care</th></tr><tr class=""><td class="specs-value fk-data" colspan="2">Wash and Iron Inside Out</td></tr></table><table cellspacing="0" class="fk-specs-type2"><tr><th class="group-head" colspan="2">In The Box</th></tr><tr class=""><td class="specs-key"> </td><td class="specs-value fk-data">Blouse, Sari</td></tr></table></div>
15:02:2014,saris,Petrafab.,Petrafab Kosa Floral Print Georgette Sari,Rs. 629,http://img5a.flixcart.com/image/sari/h/r/g/mnasr8306trp-petrafab-400x400-imadsgsava7ssfke.jpeg, No more colour,Rs. 629,FABDEAL,http://www.flipkart.com/petrafab-kosa-floral-print-georgette-sari/p/itmdsn7gjjxsurgv?pid=SARDSBCBHAMUDHRG&srno=b_2&ref=4c52040f-b039-40ac-a3aa-625ec21f51b4,LSTSARDSBCBHAMUDHRGKF9KLI,,<div class="item_left_column" id="description"><h3 class="item_desc_title fk-uppercase">Petrafab Kosa Floral Print Georgette Sari         Price: Rs.629</h3><div class="cls"></div><div class="item_desc_text line"><div style="float:right"></div>                        The amazing outfit for casual wear has hit the market to give an ultimate choice. This printed saree is sure to keep you in fashion and appeals gazing veiws as desired. The faux georgette fabric in multi color makes it much more demanding to grab the attention in a huge mob.        </div><div style="clear: both;"></div></div>,<div class="item_left_column" id="specifications"><h3 class="item_desc_title fk-uppercase">        Specifications of Petrafab Kosa Floral Print Georgette Sari    </h3><table cellspacing="0" class="fk-specs-type2"><tr><th class="group-head" colspan="2">General Details<a class="see-more unitExt rmargin10 no-underline" href="javascript:void(0);" onclick="$(this).closest('.fk-specs-type2').toggleClass('expandedMore')" title="Expand">[+]</a><a class="hidden unitExt rmargin10 no-underline" href="javascript:void(0);" onclick="$(this).closest('.fk-specs-type2').toggleClass('expandedMore')" title="Collapse">[-]</a></th></tr><tr class="hidden"><td class="specs-key">Occasion</td><td class="specs-value fk-data">Casual</td></tr><tr class="hidden"><td class="specs-key">Pattern</td><td class="specs-value fk-data">Floral Print</td></tr></table><table cellspacing="0" class="fk-specs-type2"><tr><th class="group-head" colspan="2">Sari Details</th></tr><tr class=""><td class="specs-key">Type</td><td class="specs-value fk-data">Kosa</td></tr><tr class=""><td class="specs-key">Fabric</td><td class="specs-value fk-data">Georgette</td></tr><tr class=""><td class="specs-key">Region</td><td class="specs-value fk-data">Gujarat</td></tr><tr class=""><td class="specs-key">Number of Contents in Sales Package</td><td class="specs-value fk-data">Pack of 1</td></tr><tr class=""><td class="specs-key">Blouse Piece</td><td class="specs-value fk-data">Yes</td></tr></table><table cellspacing="0" class="fk-specs-type2"><tr><th class="group-head" colspan="2">Dimensions</th></tr><tr class=""><td class="specs-key">Length</td><td class="specs-value fk-data">6.3 m</td></tr></table><table cellspacing="0" class="fk-specs-type2"><tr><th class="group-head" colspan="2">Fabric Care</th></tr><tr class=""><td class="specs-value fk-data" colspan="2">Wash and Iron Inside Out</td></tr></table><table cellspacing="0" class="fk-specs-type2"><tr><th class="group-head" colspan="2">In The Box</th></tr><tr class=""><td class="specs-key"> </td><td class="specs-value fk-data">Sari, Blouse</td></tr></table></div>
15:02:2014,saris,Petrafab.,Petrafab Kosa Printed Georgette Sari,Rs. 610,http://img5a.flixcart.com/image/sari/e/z/h/mpysr8319oc-petrafab-400x400-imadszgvhyeh8yhh.jpeg, No more colour,Rs. 610,FABDEAL,http://www.flipkart.com/petrafab-kosa-printed-georgette-sari/p/itmdsn7gazhxzvka?pid=SARDSBCBMEQFREZH&srno=b_5&ref=4c52040f-b039-40ac-a3aa-625ec21f51b4,LSTSARDSBCBMEQFREZHWLE3H5,,<div class="item_left_column" id="description"><h3 class="item_desc_title fk-uppercase">Petrafab Kosa Printed Georgette Sari         Price: Rs.610</h3><div class="cls"></div><div class="item_desc_text line"><div style="float:right"></div>                        Initiate to experience newly fashion trend that has come with faux georgette material. This yellow in colored faux georgette saree for casual wear gives a majestic feel as you step in a special gathering. It is worth to make an ultimate choice on this attire. There May Be Color Variation Due To Resolution Of The Actual Photo.        </div><div style="clear: both;"></div></div>,<div class="item_left_column" id="specifications"><h3 class="item_desc_title fk-uppercase">        Specifications of Petrafab Kosa Printed Georgette Sari    </h3><table cellspacing="0" class="fk-specs-type2"><tr><th class="group-head" colspan="2">General Details<a class="see-more unitExt rmargin10 no-underline" href="javascript:void(0);" onclick="$(this).closest('.fk-specs-type2').toggleClass('expandedMore')" title="Expand">[+]</a><a class="hidden unitExt rmargin10 no-underline" href="javascript:void(0);" onclick="$(this).closest('.fk-specs-type2').toggleClass('expandedMore')" title="Collapse">[-]</a></th></tr><tr class="hidden"><td class="specs-key">Occasion</td><td class="specs-value fk-data">Casual</td></tr><tr class="hidden"><td class="specs-key">Pattern</td><td class="specs-value fk-data">Printed</td></tr></table><table cellspacing="0" class="fk-specs-type2"><tr><th class="group-head" colspan="2">Sari Details</th></tr><tr class=""><td class="specs-key">Type</td><td class="specs-value fk-data">Kosa</td></tr><tr class=""><td class="specs-key">Fabric</td><td class="specs-value fk-data">Georgette</td></tr><tr class=""><td class="specs-key">Region</td><td class="specs-value fk-data">Gujarat</td></tr><tr class=""><td class="specs-key">Number of Contents in Sales Package</td><td class="specs-value fk-data">Pack of 1</td></tr><tr class=""><td class="specs-key">Blouse Piece</td><td class="specs-value fk-data">Yes</td></tr></table><table cellspacing="0" class="fk-specs-type2"><tr><th class="group-head" colspan="2">Dimensions</th></tr><tr class=""><td class="specs-key">Length</td><td class="specs-value fk-data">6.3 m</td></tr></table><table cellspacing="0" class="fk-specs-type2"><tr><th class="group-head" colspan="2">Fabric Care</th></tr><tr class=""><td class="specs-value fk-data" colspan="2">Wash and Iron Inside Out</td></tr></table><table cellspacing="0" class="fk-specs-type2"><tr><th class="group-head" colspan="2">In The Box</th></tr><tr class=""><td class="specs-key"> </td><td class="specs-value fk-data">Blouse, Sari</td></tr></table></div>
15:02:2014,saris,Petrafab.,Petrafab Kosa Polka Print, Printed Georgette Sari,Rs. 610,http://img6a.flixcart.com/image/sari/5/9/a/mqasr8321oc-petrafab-400x400-imadszgvfxucfkud.jpeg, No more colour,Rs. 610,FABDEAL,http://www.flipkart.com/petrafab-kosa-polka-print-printed-georgette-sari/p/itmdsn7heahgzydt?pid=SARDSBCBJ5QGZ59A&srno=b_4&ref=4c52040f-b039-40ac-a3aa-625ec21f51b4,LSTSARDSBCBJ5QGZ59ATF9MMQ,,<div class="item_left_column" id="description"><h3 class="item_desc_title fk-uppercase">Petrafab Kosa Polka Print, Printed Georgette Sari         Price: Rs.610</h3><div class="cls"></div><div class="item_desc_text line"><div style="float:right"></div>                        The perfect attire has come to fulfill a desired quality that has most appealing faux georgette on its material quality. It gives an alluring getup that makes you a spotting persona in the huge mob. There May Be Color Variation Due To Resolution Of The Actual Photo.        </div><div style="clear: both;"></div></div>,<div class="item_left_column" id="specifications"><h3 class="item_desc_title fk-uppercase">        Specifications of Petrafab Kosa Polka Print, Printed Georgette Sari    </h3><table cellspacing="0" class="fk-specs-type2"><tr><th class="group-head" colspan="2">General Details<a class="see-more unitExt rmargin10 no-underline" href="javascript:void(0);" onclick="$(this).closest('.fk-specs-type2').toggleClass('expandedMore')" title="Expand">[+]</a><a class="hidden unitExt rmargin10 no-underline" href="javascript:void(0);" onclick="$(this).closest('.fk-specs-type2').toggleClass('expandedMore')" title="Collapse">[-]</a></th></tr><tr class="hidden"><td class="specs-key">Occasion</td><td class="specs-value fk-data">Casual</td></tr><tr class="hidden"><td class="specs-key">Pattern</td><td class="specs-value fk-data">Polka Print, Printed</td></tr></table><table cellspacing="0" class="fk-specs-type2"><tr><th class="group-head" colspan="2">Sari Details</th></tr><tr class=""><td class="specs-key">Type</td><td class="specs-value fk-data">Kosa</td></tr><tr class=""><td class="specs-key">Fabric</td><td class="specs-value fk-data">Georgette</td></tr><tr class=""><td class="specs-key">Region</td><td class="specs-value fk-data">Gujarat</td></tr><tr class=""><td class="specs-key">Number of Contents in Sales Package</td><td class="specs-value fk-data">Pack of 1</td></tr><tr class=""><td class="specs-key">Blouse Piece</td><td class="specs-value fk-data">Yes</td></tr></table><table cellspacing="0" class="fk-specs-type2"><tr><th class="group-head" colspan="2">Dimensions</th></tr><tr class=""><td class="specs-key">Length</td><td class="specs-value fk-data">6.3 m</td></tr></table><table cellspacing="0" class="fk-specs-type2"><tr><th class="group-head" colspan="2">Fabric Care</th></tr><tr class=""><td class="specs-value fk-data" colspan="2">Wash and Iron Inside Out</td></tr></table><table cellspacing="0" class="fk-specs-type2"><tr><th class="group-head" colspan="2">In The Box</th></tr><tr class=""><td class="specs-key"> </td><td class="specs-value fk-data">Blouse, Sari</td></tr></table></div>
15:02:2014,saris,Petrafab.,Petrafab Kosa Geometric Print Georgette Sari,Rs. 629,http://img6a.flixcart.com/image/sari/p/u/h/mncsr8308trp-petrafab-400x400-imadszgnuhr3qzdm.jpeg, No more colour,Rs. 629,FABDEAL,http://www.flipkart.com/petrafab-kosa-geometric-print-georgette-sari/p/itmdsn7hzyrshadj?pid=SARDSBCBFNJW5PUH&srno=b_8&ref=4c52040f-b039-40ac-a3aa-625ec21f51b4,LSTSARDSBCBFNJW5PUHTFSDSR, ,<div class="item_left_column" id="description"><h3 class="item_desc_title fk-uppercase">Petrafab Kosa Geometric Print Georgette Sari         Price: Rs.629</h3><div class="cls"></div><div class="item_desc_text line"><div style="float:right"></div>                        Presenting you a fantabulous assortment for casual wear with most appealing faux georgette fabric. It has an eye attaining quality with intricate design. The saree has got desired orange color shade with superb printed design. One has to hit a wise purchase to gain marvelous change.        </div><div style="clear: both;"></div></div>,<div class="item_left_column" id="specifications"><h3 class="item_desc_title fk-uppercase">        Specifications of Petrafab Kosa Geometric Print Georgette Sari    </h3><table cellspacing="0" class="fk-specs-type2"><tr><th class="group-head" colspan="2">General Details<a class="see-more unitExt rmargin10 no-underline" href="javascript:void(0);" onclick="$(this).closest('.fk-specs-type2').toggleClass('expandedMore')" title="Expand">[+]</a><a class="hidden unitExt rmargin10 no-underline" href="javascript:void(0);" onclick="$(this).closest('.fk-specs-type2').toggleClass('expandedMore')" title="Collapse">[-]</a></th></tr><tr class="hidden"><td class="specs-key">Occasion</td><td class="specs-value fk-data">Casual</td></tr><tr class="hidden"><td class="specs-key">Pattern</td><td class="specs-value fk-data">Geometric Print</td></tr></table><table cellspacing="0" class="fk-specs-type2"><tr><th class="group-head" colspan="2">Sari Details</th></tr><tr class=""><td class="specs-key">Type</td><td class="specs-value fk-data">Kosa</td></tr><tr class=""><td class="specs-key">Fabric</td><td class="specs-value fk-data">Georgette</td></tr><tr class=""><td class="specs-key">Region</td><td class="specs-value fk-data">Gujarat</td></tr><tr class=""><td class="specs-key">Number of Contents in Sales Package</td><td class="specs-value fk-data">Pack of 1</td></tr><tr class=""><td class="specs-key">Blouse Piece</td><td class="specs-value fk-data">Yes</td></tr></table><table cellspacing="0" class="fk-specs-type2"><tr><th class="group-head" colspan="2">Dimensions</th></tr><tr class=""><td class="specs-key">Length</td><td class="specs-value fk-data">6.3 m</td></tr></table><table cellspacing="0" class="fk-specs-type2"><tr><th class="group-head" colspan="2">Fabric Care</th></tr><tr class=""><td class="specs-value fk-data" colspan="2">Wash and Iron Inside Out</td></tr></table><table cellspacing="0" class="fk-specs-type2"><tr><th class="group-head" colspan="2">In The Box</th></tr><tr class=""><td class="specs-key"> </td><td class="specs-value fk-data">Blouse, Sari</td></tr></table></div>
15:02:2014,saris,Petrafab.,Petrafab Kosa Printed Cotton Sari,Rs. 907,http://img5a.flixcart.com/image/sari/9/m/g/mknsr10267vtk-petrafab-400x400-imadsgsattwrxmpa.jpeg, No more colour,Rs. 907,FABDEAL,http://www.flipkart.com/petrafab-kosa-printed-cotton-sari/p/itmdsn7ghtbsjgtb?pid=SARDSBCBVGMP69MG&srno=b_7&ref=4c52040f-b039-40ac-a3aa-625ec21f51b4,LSTSARDSBCBVGMP69MGVLU4TT,,<div class="item_left_column" id="description"><h3 class="item_desc_title fk-uppercase">Petrafab Kosa Printed Cotton Sari         Price: Rs.907</h3><div class="cls"></div><div class="item_desc_text line"><div style="float:right"></div>                        Discover the real elegance to lure the audience by wearing this enchanting saree that carries appealing South Cotton With Jacquard with jacquard material with amazing lace border. Catchy color shades with desired fabrication makes it worth to hit ultimate purchase.        </div><div style="clear: both;"></div></div>,<div class="item_left_column" id="specifications"><h3 class="item_desc_title fk-uppercase">        Specifications of Petrafab Kosa Printed Cotton Sari    </h3><table cellspacing="0" class="fk-specs-type2"><tr><th class="group-head" colspan="2">General Details<a class="see-more unitExt rmargin10 no-underline" href="javascript:void(0);" onclick="$(this).closest('.fk-specs-type2').toggleClass('expandedMore')" title="Expand">[+]</a><a class="hidden unitExt rmargin10 no-underline" href="javascript:void(0);" onclick="$(this).closest('.fk-specs-type2').toggleClass('expandedMore')" title="Collapse">[-]</a></th></tr><tr class="hidden"><td class="specs-key">Occasion</td><td class="specs-value fk-data">Casual</td></tr><tr class="hidden"><td class="specs-key">Pattern</td><td class="specs-value fk-data">Printed</td></tr></table><table cellspacing="0" class="fk-specs-type2"><tr><th class="group-head" colspan="2">Sari Details</th></tr><tr class=""><td class="specs-key">Type</td><td class="specs-value fk-data">Kosa</td></tr><tr class=""><td class="specs-key">Fabric</td><td class="specs-value fk-data">Cotton</td></tr><tr class=""><td class="specs-key">Region</td><td class="specs-value fk-data">Gujarat</td></tr><tr class=""><td class="specs-key">Number of Contents in Sales Package</td><td class="specs-value fk-data">Pack of 1</td></tr><tr class=""><td class="specs-key">Blouse Piece</td><td class="specs-value fk-data">Yes</td></tr></table><table cellspacing="0" class="fk-specs-type2"><tr><th class="group-head" colspan="2">Dimensions</th></tr><tr class=""><td class="specs-key">Length</td><td class="specs-value fk-data">6.3 m</td></tr></table><table cellspacing="0" class="fk-specs-type2"><tr><th class="group-head" colspan="2">Fabric Care</th></tr><tr class=""><td class="specs-value fk-data" colspan="2">Wash and Iron Inside Out</td></tr></table><table cellspacing="0" class="fk-specs-type2"><tr><th class="group-head" colspan="2">In The Box</th></tr><tr class=""><td class="specs-key"> </td><td class="specs-value fk-data">Sari, Blouse</td></tr></table></div>
15:02:2014,saris,Petrafab.,Petrafab Floral Print Georgette Sari,Rs. 629,http://img5a.flixcart.com/image/sari/s/k/6/mnbsr8307trp-petrafab-400x400-imadszh4axvzajz6.jpeg, No more colour,Rs. 629,FABDEAL,http://www.flipkart.com/petrafab-kosa-floral-print-georgette-sari/p/itmdsn7ggt4zfkwu?pid=SARDSBCBGJZFSSK6&srno=b_6&ref=4c52040f-b039-40ac-a3aa-625ec21f51b4,LSTSARDSBCBGJZFSSK6FBXNEI,,<div class="item_left_column" id="description"><h3 class="item_desc_title fk-uppercase">Petrafab Floral Print Georgette Sari         Price: Rs.629</h3><div class="cls"></div><div class="item_desc_text line"><div style="float:right"></div>                        This casual wear printed saree is a mesmerizing assortment that appeals a pick to adjoin fabulous getup in the occasion you are. This collection assures you to give a spotting look as it got superb faux georgette fabric and multi colored printed design. The glittering material of the assortment appeals an ultimate choice.        </div><div style="clear: both;"></div></div>,<div class="item_left_column" id="specifications"><h3 class="item_desc_title fk-uppercase">        Specifications of Petrafab Floral Print Georgette Sari    </h3><table cellspacing="0" class="fk-specs-type2"><tr><th class="group-head" colspan="2">General Details<a class="see-more unitExt rmargin10 no-underline" href="javascript:void(0);" onclick="$(this).closest('.fk-specs-type2').toggleClass('expandedMore')" title="Expand">[+]</a><a class="hidden unitExt rmargin10 no-underline" href="javascript:void(0);" onclick="$(this).closest('.fk-specs-type2').toggleClass('expandedMore')" title="Collapse">[-]</a></th></tr><tr class="hidden"><td class="specs-key">Occasion</td><td class="specs-value fk-data">Casual</td></tr><tr class="hidden"><td class="specs-key">Pattern</td><td class="specs-value fk-data">Floral Print</td></tr></table><table cellspacing="0" class="fk-specs-type2"><tr><th class="group-head" colspan="2">Sari Details</th></tr><tr class=""><td class="specs-key">Type</td><td class="specs-value fk-data">Kosa</td></tr><tr class=""><td class="specs-key">Fabric</td><td class="specs-value fk-data">Georgette</td></tr><tr class=""><td class="specs-key">Region</td><td class="specs-value fk-data">Gujarat</td></tr><tr class=""><td class="specs-key">Number of Contents in Sales Package</td><td class="specs-value fk-data">Pack of 1</td></tr><tr class=""><td class="specs-key">Blouse Piece</td><td class="specs-value fk-data">Yes</td></tr></table><table cellspacing="0" class="fk-specs-type2"><tr><th class="group-head" colspan="2">Dimensions</th></tr><tr class=""><td class="specs-key">Length</td><td class="specs-value fk-data">6.3 m</td></tr></table><table cellspacing="0" class="fk-specs-type2"><tr><th class="group-head" colspan="2">Fabric Care</th></tr><tr class=""><td class="specs-value fk-data" colspan="2">Wash and Iron Inside Out</td></tr></table><table cellspacing="0" class="fk-specs-type2"><tr><th class="group-head" colspan="2">In The Box</th></tr><tr class=""><td class="specs-key"> </td><td class="specs-value fk-data">Sari, Blouse</td></tr></table></div>
