15:02:2014,saris,Petrafab.,Petrafab Kosa Printed Cotton Sari,Rs. 907,http://img6a.flixcart.com/image/sari/d/f/y/mngsr10284vtk-petrafab-400x400-imadszgsaeyrjf7r.jpeg, No more colour,Rs. 907,FABDEAL,http://www.flipkart.com/petrafab-kosa-printed-cotton-sari/p/itmdsn7hdx2xq4gd?pid=SARDSBCBSTZRWDFY&srno=b_9&ref=4c52040f-b039-40ac-a3aa-625ec21f51b4,LSTSARDSBCBSTZRWDFYUHEMEX,,<div class="item_left_column" id="description"><h3 class="item_desc_title fk-uppercase">Petrafab Kosa Printed Cotton Sari         Price: Rs.907</h3><div class="cls"></div><div class="item_desc_text line"><div style="float:right"></div>                        Fabdeal brings you nice designer Saree Made from Standard Fabrics, Fabdeal sarees are beautifully Crafted and Colorful. Match up with your accessories.        </div><div style="clear: both;"></div></div>,<div class="item_left_column" id="specifications"><h3 class="item_desc_title fk-uppercase">        Specifications of Petrafab Kosa Printed Cotton Sari    </h3><table cellspacing="0" class="fk-specs-type2"><tr><th class="group-head" colspan="2">General Details<a class="see-more unitExt rmargin10 no-underline" href="javascript:void(0);" onclick="$(this).closest('.fk-specs-type2').toggleClass('expandedMore')" title="Expand">[+]</a><a class="hidden unitExt rmargin10 no-underline" href="javascript:void(0);" onclick="$(this).closest('.fk-specs-type2').toggleClass('expandedMore')" title="Collapse">[-]</a></th></tr><tr class="hidden"><td class="specs-key">Occasion</td><td class="specs-value fk-data">Casual</td></tr><tr class="hidden"><td class="specs-key">Pattern</td><td class="specs-value fk-data">Printed</td></tr></table><table cellspacing="0" class="fk-specs-type2"><tr><th class="group-head" colspan="2">Sari Details</th></tr><tr class=""><td class="specs-key">Type</td><td class="specs-value fk-data">Kosa</td></tr><tr class=""><td class="specs-key">Fabric</td><td class="specs-value fk-data">Cotton</td></tr><tr class=""><td class="specs-key">Region</td><td class="specs-value fk-data">Gujarat</td></tr><tr class=""><td class="specs-key">Number of Contents in Sales Package</td><td class="specs-value fk-data">Pack of 1</td></tr><tr class=""><td class="specs-key">Blouse Piece</td><td class="specs-value fk-data">Yes</td></tr></table><table cellspacing="0" class="fk-specs-type2"><tr><th class="group-head" colspan="2">Dimensions</th></tr><tr class=""><td class="specs-key">Length</td><td class="specs-value fk-data">6.3 m</td></tr></table><table cellspacing="0" class="fk-specs-type2"><tr><th class="group-head" colspan="2">Fabric Care</th></tr><tr class=""><td class="specs-value fk-data" colspan="2">Wash and Iron Inside Out</td></tr></table><table cellspacing="0" class="fk-specs-type2"><tr><th class="group-head" colspan="2">In The Box</th></tr><tr class=""><td class="specs-key"> </td><td class="specs-value fk-data">Sari, Blouse</td></tr></table></div>
15:02:2014,saris,Petrafab.,Petrafab Kosa Geometric Print Georgette Sari,Rs. 629,http://img6a.flixcart.com/image/sari/b/v/g/mndsr8309trp-petrafab-400x400-imadszh3gajfqajb.jpeg, No more colour,Rs. 629,FABDEAL,http://www.flipkart.com/petrafab-kosa-geometric-print-georgette-sari/p/itmdsn7hfnznmtxh?pid=SARDSBCBJZV8WBVG&srno=b_11&ref=4c52040f-b039-40ac-a3aa-625ec21f51b4,LSTSARDSBCBJZV8WBVGKZM0CZ, ,<div class="item_left_column" id="description"><h3 class="item_desc_title fk-uppercase">Petrafab Kosa Geometric Print Georgette Sari         Price: Rs.629</h3><div class="cls"></div><div class="item_desc_text line"><div style="float:right"></div>                        The fantabulous casual wear saree with gazing quality has come to you with superb faux georgette fabric. The simple yet elegant saree comes with an awe-inspiring intricate design. It assures you to give a royal persona in huge midst with gazing looks.        </div><div style="clear: both;"></div></div>,<div class="item_left_column" id="specifications"><h3 class="item_desc_title fk-uppercase">        Specifications of Petrafab Kosa Geometric Print Georgette Sari    </h3><table cellspacing="0" class="fk-specs-type2"><tr><th class="group-head" colspan="2">General Details<a class="see-more unitExt rmargin10 no-underline" href="javascript:void(0);" onclick="$(this).closest('.fk-specs-type2').toggleClass('expandedMore')" title="Expand">[+]</a><a class="hidden unitExt rmargin10 no-underline" href="javascript:void(0);" onclick="$(this).closest('.fk-specs-type2').toggleClass('expandedMore')" title="Collapse">[-]</a></th></tr><tr class="hidden"><td class="specs-key">Occasion</td><td class="specs-value fk-data">Casual</td></tr><tr class="hidden"><td class="specs-key">Pattern</td><td class="specs-value fk-data">Geometric Print</td></tr></table><table cellspacing="0" class="fk-specs-type2"><tr><th class="group-head" colspan="2">Sari Details</th></tr><tr class=""><td class="specs-key">Type</td><td class="specs-value fk-data">Kosa</td></tr><tr class=""><td class="specs-key">Fabric</td><td class="specs-value fk-data">Georgette</td></tr><tr class=""><td class="specs-key">Region</td><td class="specs-value fk-data">Gujarat</td></tr><tr class=""><td class="specs-key">Number of Contents in Sales Package</td><td class="specs-value fk-data">Pack of 1</td></tr><tr class=""><td class="specs-key">Blouse Piece</td><td class="specs-value fk-data">Yes</td></tr></table><table cellspacing="0" class="fk-specs-type2"><tr><th class="group-head" colspan="2">Dimensions</th></tr><tr class=""><td class="specs-key">Length</td><td class="specs-value fk-data">6.3 m</td></tr></table><table cellspacing="0" class="fk-specs-type2"><tr><th class="group-head" colspan="2">Fabric Care</th></tr><tr class=""><td class="specs-value fk-data" colspan="2">Wash and Iron Inside Out</td></tr></table><table cellspacing="0" class="fk-specs-type2"><tr><th class="group-head" colspan="2">In The Box</th></tr><tr class=""><td class="specs-key"> </td><td class="specs-value fk-data">Blouse, Sari</td></tr></table></div>
15:02:2014,saris,Petrafab.,Petrafab Kosa Printed Georgette Sari,Rs. 636,http://img5a.flixcart.com/image/sari/k/h/v/micsr309mdsc-petrafab-400x400-imadszgvf44zyepy.jpeg, No more colour,Rs. 636,FABDEAL,http://www.flipkart.com/petrafab-kosa-printed-georgette-sari/p/itmdsn7gfrxyrrac?pid=SARDSBCBACFB5KHV&srno=b_10&ref=4c52040f-b039-40ac-a3aa-625ec21f51b4,LSTSARDSBCBACFB5KHVR7OMGB,,<div class="item_left_column" id="description"><h3 class="item_desc_title fk-uppercase">Petrafab Kosa Printed Georgette Sari         Price: Rs.636</h3><div class="cls"></div><div class="item_desc_text line"><div style="float:right"></div>                        This season getr ready to drape an amamzing attrie that carries faux georgette material with enchanting multi color shade. If you aim to reveal your real elegance as desired. Drape this lucrative piece with matching jewels to complete the desired getup like never before.        </div><div style="clear: both;"></div></div>,<div class="item_left_column" id="specifications"><h3 class="item_desc_title fk-uppercase">        Specifications of Petrafab Kosa Printed Georgette Sari    </h3><table cellspacing="0" class="fk-specs-type2"><tr><th class="group-head" colspan="2">General Details<a class="see-more unitExt rmargin10 no-underline" href="javascript:void(0);" onclick="$(this).closest('.fk-specs-type2').toggleClass('expandedMore')" title="Expand">[+]</a><a class="hidden unitExt rmargin10 no-underline" href="javascript:void(0);" onclick="$(this).closest('.fk-specs-type2').toggleClass('expandedMore')" title="Collapse">[-]</a></th></tr><tr class="hidden"><td class="specs-key">Occasion</td><td class="specs-value fk-data">Casual</td></tr><tr class="hidden"><td class="specs-key">Pattern</td><td class="specs-value fk-data">Printed</td></tr></table><table cellspacing="0" class="fk-specs-type2"><tr><th class="group-head" colspan="2">Sari Details</th></tr><tr class=""><td class="specs-key">Type</td><td class="specs-value fk-data">Kosa</td></tr><tr class=""><td class="specs-key">Fabric</td><td class="specs-value fk-data">Georgette</td></tr><tr class=""><td class="specs-key">Region</td><td class="specs-value fk-data">Gujarat</td></tr><tr class=""><td class="specs-key">Number of Contents in Sales Package</td><td class="specs-value fk-data">Pack of 1</td></tr><tr class=""><td class="specs-key">Blouse Piece</td><td class="specs-value fk-data">Yes</td></tr></table><table cellspacing="0" class="fk-specs-type2"><tr><th class="group-head" colspan="2">Dimensions</th></tr><tr class=""><td class="specs-key">Length</td><td class="specs-value fk-data">6.3 m</td></tr></table><table cellspacing="0" class="fk-specs-type2"><tr><th class="group-head" colspan="2">Fabric Care</th></tr><tr class=""><td class="specs-value fk-data" colspan="2">Wash and Iron Inside Out</td></tr></table><table cellspacing="0" class="fk-specs-type2"><tr><th class="group-head" colspan="2">In The Box</th></tr><tr class=""><td class="specs-key"> </td><td class="specs-value fk-data">Blouse, Sari</td></tr></table></div>
15:02:2014,saris,Petrafab.,Petrafab Kosa Polka Print Silk Sari,Rs. 933,http://img5a.flixcart.com/image/sari/w/5/j/mnjsr6996brm-petrafab-400x400-imadsekqyxxw96fa.jpeg, No more colour,Rs. 933,FABDEAL,http://www.flipkart.com/petrafab-kosa-polka-print-silk-sari/p/itmdsn7gs65wwvfh?pid=SARDSBCB6DYRPW5J&srno=b_13&ref=4c52040f-b039-40ac-a3aa-625ec21f51b4,LSTSARDSBCB6DYRPW5J9TQAGF, ,<div class="item_left_column" id="description"><h3 class="item_desc_title fk-uppercase">Petrafab Kosa Polka Print Silk Sari         Price: Rs.933</h3><div class="cls"></div><div class="item_desc_text line"><div style="float:right"></div>                        If you aim to be desi diva on the floor? Here is the attire that keeps you distinct with its marvelous color shade and amazing material which is khadi silk. Adjoin this superb piece to your wardrobe to experience drastic change in fashion sense.        </div><div style="clear: both;"></div></div>,<div class="item_left_column" id="specifications"><h3 class="item_desc_title fk-uppercase">        Specifications of Petrafab Kosa Polka Print Silk Sari    </h3><table cellspacing="0" class="fk-specs-type2"><tr><th class="group-head" colspan="2">General Details<a class="see-more unitExt rmargin10 no-underline" href="javascript:void(0);" onclick="$(this).closest('.fk-specs-type2').toggleClass('expandedMore')" title="Expand">[+]</a><a class="hidden unitExt rmargin10 no-underline" href="javascript:void(0);" onclick="$(this).closest('.fk-specs-type2').toggleClass('expandedMore')" title="Collapse">[-]</a></th></tr><tr class="hidden"><td class="specs-key">Occasion</td><td class="specs-value fk-data">Casual</td></tr><tr class="hidden"><td class="specs-key">Pattern</td><td class="specs-value fk-data">Polka Print</td></tr></table><table cellspacing="0" class="fk-specs-type2"><tr><th class="group-head" colspan="2">Sari Details</th></tr><tr class=""><td class="specs-key">Type</td><td class="specs-value fk-data">Kosa</td></tr><tr class=""><td class="specs-key">Fabric</td><td class="specs-value fk-data">Silk</td></tr><tr class=""><td class="specs-key">Region</td><td class="specs-value fk-data">Gujarat</td></tr><tr class=""><td class="specs-key">Number of Contents in Sales Package</td><td class="specs-value fk-data">Pack of 1</td></tr><tr class=""><td class="specs-key">Blouse Piece</td><td class="specs-value fk-data">Yes</td></tr></table><table cellspacing="0" class="fk-specs-type2"><tr><th class="group-head" colspan="2">Dimensions</th></tr><tr class=""><td class="specs-key">Length</td><td class="specs-value fk-data">6.3 m</td></tr></table><table cellspacing="0" class="fk-specs-type2"><tr><th class="group-head" colspan="2">Fabric Care</th></tr><tr class=""><td class="specs-value fk-data" colspan="2">Wash and Iron Inside Out</td></tr></table><table cellspacing="0" class="fk-specs-type2"><tr><th class="group-head" colspan="2">In The Box</th></tr><tr class=""><td class="specs-key"> </td><td class="specs-value fk-data">Sari, Blouse</td></tr></table></div>
15:02:2014,saris,Petrafab.,Petrafab Kosa Geometric Print Georgette Sari,Rs. 681,http://img6a.flixcart.com/image/sari/t/d/k/mobsr8317adp-petrafab-400x400-imadsekp7hbme8xy.jpeg, No more colour,Rs. 681,FABDEAL,http://www.flipkart.com/petrafab-kosa-geometric-print-georgette-sari/p/itmdsn7hwgmgrxyf?pid=SARDSBCBACTSBTDK&srno=b_12&ref=4c52040f-b039-40ac-a3aa-625ec21f51b4,LSTSARDSBCBACTSBTDKNO6VSI,,<div class="item_left_column" id="description"><h3 class="item_desc_title fk-uppercase">Petrafab Kosa Geometric Print Georgette Sari         Price: Rs.681</h3><div class="cls"></div><div class="item_desc_text line"><div style="float:right"></div>                        Get ready to infuse your stunning side to grab gazing views like never before. Here is the apparel that assures to keep you distinct in a huge midst. One should get going with this faux georgette saree to attain desired look which you are longing for.        </div><div style="clear: both;"></div></div>,<div class="item_left_column" id="specifications"><h3 class="item_desc_title fk-uppercase">        Specifications of Petrafab Kosa Geometric Print Georgette Sari    </h3><table cellspacing="0" class="fk-specs-type2"><tr><th class="group-head" colspan="2">General Details<a class="see-more unitExt rmargin10 no-underline" href="javascript:void(0);" onclick="$(this).closest('.fk-specs-type2').toggleClass('expandedMore')" title="Expand">[+]</a><a class="hidden unitExt rmargin10 no-underline" href="javascript:void(0);" onclick="$(this).closest('.fk-specs-type2').toggleClass('expandedMore')" title="Collapse">[-]</a></th></tr><tr class="hidden"><td class="specs-key">Occasion</td><td class="specs-value fk-data">Casual</td></tr><tr class="hidden"><td class="specs-key">Pattern</td><td class="specs-value fk-data">Geometric Print</td></tr></table><table cellspacing="0" class="fk-specs-type2"><tr><th class="group-head" colspan="2">Sari Details</th></tr><tr class=""><td class="specs-key">Type</td><td class="specs-value fk-data">Kosa</td></tr><tr class=""><td class="specs-key">Fabric</td><td class="specs-value fk-data">Georgette</td></tr><tr class=""><td class="specs-key">Region</td><td class="specs-value fk-data">Gujarat</td></tr><tr class=""><td class="specs-key">Number of Contents in Sales Package</td><td class="specs-value fk-data">Pack of 1</td></tr><tr class=""><td class="specs-key">Blouse Piece</td><td class="specs-value fk-data">Yes</td></tr></table><table cellspacing="0" class="fk-specs-type2"><tr><th class="group-head" colspan="2">Dimensions</th></tr><tr class=""><td class="specs-key">Length</td><td class="specs-value fk-data">6.3 m</td></tr></table><table cellspacing="0" class="fk-specs-type2"><tr><th class="group-head" colspan="2">Fabric Care</th></tr><tr class=""><td class="specs-value fk-data" colspan="2">Wash and Iron Inside Out</td></tr></table><table cellspacing="0" class="fk-specs-type2"><tr><th class="group-head" colspan="2">In The Box</th></tr><tr class=""><td class="specs-key"> </td><td class="specs-value fk-data">Blouse, Sari</td></tr></table></div>
15:02:2014,saris,Petrafab.,Petrafab Printed Georgette Sari,Rs. 681,http://img5a.flixcart.com/image/sari/u/4/d/moasr8316adp-petrafab-400x400-imadszgsaqbgcjnb.jpeg, No more colour,Rs. 681,FABDEAL,http://www.flipkart.com/petrafab-kosa-printed-georgette-sari/p/itmdsn7hfzgxzxjm?pid=SARDSBCBYXV2TU4D&srno=b_14&ref=4c52040f-b039-40ac-a3aa-625ec21f51b4,LSTSARDSBCBYXV2TU4DJY6HVY,,<div class="item_left_column" id="description"><h3 class="item_desc_title fk-uppercase">Petrafab Printed Georgette Sari         Price: Rs.681</h3><div class="cls"></div><div class="item_desc_text line"><div style="float:right"></div>                        Surprise the viewers and make them stunned with a newly getup with this marvelous piece. This collection assures to give desired getup and makes an iconic personality in the occasion you step in.        </div><div style="clear: both;"></div></div>,<div class="item_left_column" id="specifications"><h3 class="item_desc_title fk-uppercase">        Specifications of Petrafab Printed Georgette Sari    </h3><table cellspacing="0" class="fk-specs-type2"><tr><th class="group-head" colspan="2">General Details<a class="see-more unitExt rmargin10 no-underline" href="javascript:void(0);" onclick="$(this).closest('.fk-specs-type2').toggleClass('expandedMore')" title="Expand">[+]</a><a class="hidden unitExt rmargin10 no-underline" href="javascript:void(0);" onclick="$(this).closest('.fk-specs-type2').toggleClass('expandedMore')" title="Collapse">[-]</a></th></tr><tr class="hidden"><td class="specs-key">Occasion</td><td class="specs-value fk-data">Casual</td></tr><tr class="hidden"><td class="specs-key">Pattern</td><td class="specs-value fk-data">Printed</td></tr></table><table cellspacing="0" class="fk-specs-type2"><tr><th class="group-head" colspan="2">Sari Details</th></tr><tr class=""><td class="specs-key">Type</td><td class="specs-value fk-data">Kosa</td></tr><tr class=""><td class="specs-key">Fabric</td><td class="specs-value fk-data">Georgette</td></tr><tr class=""><td class="specs-key">Region</td><td class="specs-value fk-data">Gujarat</td></tr><tr class=""><td class="specs-key">Number of Contents in Sales Package</td><td class="specs-value fk-data">Pack of 1</td></tr><tr class=""><td class="specs-key">Blouse Piece</td><td class="specs-value fk-data">Yes</td></tr></table><table cellspacing="0" class="fk-specs-type2"><tr><th class="group-head" colspan="2">Dimensions</th></tr><tr class=""><td class="specs-key">Length</td><td class="specs-value fk-data">6.3 m</td></tr></table><table cellspacing="0" class="fk-specs-type2"><tr><th class="group-head" colspan="2">Fabric Care</th></tr><tr class=""><td class="specs-value fk-data" colspan="2">Wash and Iron Inside Out</td></tr></table><table cellspacing="0" class="fk-specs-type2"><tr><th class="group-head" colspan="2">In The Box</th></tr><tr class=""><td class="specs-key"> </td><td class="specs-value fk-data">Sari, Blouse</td></tr></table></div>
15:02:2014,saris,Petrafab.,Petrafab Kosa Polka Print Silk Sari,Rs. 933,http://img5a.flixcart.com/image/sari/c/e/s/mnisr6996arm-petrafab-400x400-imadszguyy6z76w9.jpeg, No more colour,Rs. 933,FABDEAL,http://www.flipkart.com/petrafab-kosa-polka-print-silk-sari/p/itmdsn7hzgr3qepv?pid=SARDSBCBZYDT3CES&srno=b_15&ref=4c52040f-b039-40ac-a3aa-625ec21f51b4,LSTSARDSBCBZYDT3CESDWEUCR, ,<div class="item_left_column" id="description"><h3 class="item_desc_title fk-uppercase">Petrafab Kosa Polka Print Silk Sari         Price: Rs.933</h3><div class="cls"></div><div class="item_desc_text line"><div style="float:right"></div>                        Infuse your feminine look by wearing this fabulous saree that carries most appealing khadi silk material to give majestic feel as you drape it for any special gathering. One should get going with this marvelous attire to gain desired getup like never before.        </div><div style="clear: both;"></div></div>,<div class="item_left_column" id="specifications"><h3 class="item_desc_title fk-uppercase">        Specifications of Petrafab Kosa Polka Print Silk Sari    </h3><table cellspacing="0" class="fk-specs-type2"><tr><th class="group-head" colspan="2">General Details<a class="see-more unitExt rmargin10 no-underline" href="javascript:void(0);" onclick="$(this).closest('.fk-specs-type2').toggleClass('expandedMore')" title="Expand">[+]</a><a class="hidden unitExt rmargin10 no-underline" href="javascript:void(0);" onclick="$(this).closest('.fk-specs-type2').toggleClass('expandedMore')" title="Collapse">[-]</a></th></tr><tr class="hidden"><td class="specs-key">Occasion</td><td class="specs-value fk-data">Casual</td></tr><tr class="hidden"><td class="specs-key">Pattern</td><td class="specs-value fk-data">Polka Print</td></tr></table><table cellspacing="0" class="fk-specs-type2"><tr><th class="group-head" colspan="2">Sari Details</th></tr><tr class=""><td class="specs-key">Type</td><td class="specs-value fk-data">Kosa</td></tr><tr class=""><td class="specs-key">Fabric</td><td class="specs-value fk-data">Silk</td></tr><tr class=""><td class="specs-key">Region</td><td class="specs-value fk-data">Gujarat</td></tr><tr class=""><td class="specs-key">Number of Contents in Sales Package</td><td class="specs-value fk-data">Pack of 1</td></tr><tr class=""><td class="specs-key">Blouse Piece</td><td class="specs-value fk-data">Yes</td></tr></table><table cellspacing="0" class="fk-specs-type2"><tr><th class="group-head" colspan="2">Dimensions</th></tr><tr class=""><td class="specs-key">Length</td><td class="specs-value fk-data">6.3 m</td></tr></table><table cellspacing="0" class="fk-specs-type2"><tr><th class="group-head" colspan="2">Fabric Care</th></tr><tr class=""><td class="specs-value fk-data" colspan="2">Wash and Iron Inside Out</td></tr></table><table cellspacing="0" class="fk-specs-type2"><tr><th class="group-head" colspan="2">In The Box</th></tr><tr class=""><td class="specs-key"> </td><td class="specs-value fk-data">Blouse, Sari</td></tr></table></div>
15:02:2014,saris,Petrafab.,Petrafab Kosa Polka Print Georgette Sari,Rs. 681,http://img5a.flixcart.com/image/sari/x/s/b/mnwsr8312adp-petrafab-400x400-imadszhyf32mw7ex.jpeg, No more colour,Rs. 681,FABDEAL,http://www.flipkart.com/petrafab-kosa-polka-print-georgette-sari/p/itmdsn7huhqeeybf?pid=SARDSBCBYHGHJXSB&srno=b_16&ref=1efae296-6063-4733-b5e1-aa4b10f61939,LSTSARDSBCBYHGHJXSBQPYQVB,,<div class="item_left_column" id="description"><h3 class="item_desc_title fk-uppercase">Petrafab Kosa Polka Print Georgette Sari         Price: Rs.681</h3><div class="cls"></div><div class="item_desc_text line"><div style="float:right"></div>                        Bring a bold and classy change to your feminine look this season by draping this marvelous saree that comes with most appealing faux georgette fabric in its material quality. As the saree is shaded in gray color that really attracts the viewers. Pair this saree with matching jewels to gain desired getup like never before.        </div><div style="clear: both;"></div></div>,<div class="item_left_column" id="specifications"><h3 class="item_desc_title fk-uppercase">        Specifications of Petrafab Kosa Polka Print Georgette Sari    </h3><table cellspacing="0" class="fk-specs-type2"><tr><th class="group-head" colspan="2">General Details<a class="see-more unitExt rmargin10 no-underline" href="javascript:void(0);" onclick="$(this).closest('.fk-specs-type2').toggleClass('expandedMore')" title="Expand">[+]</a><a class="hidden unitExt rmargin10 no-underline" href="javascript:void(0);" onclick="$(this).closest('.fk-specs-type2').toggleClass('expandedMore')" title="Collapse">[-]</a></th></tr><tr class="hidden"><td class="specs-key">Occasion</td><td class="specs-value fk-data">Casual</td></tr><tr class="hidden"><td class="specs-key">Pattern</td><td class="specs-value fk-data">Polka Print</td></tr></table><table cellspacing="0" class="fk-specs-type2"><tr><th class="group-head" colspan="2">Sari Details</th></tr><tr class=""><td class="specs-key">Type</td><td class="specs-value fk-data">Kosa</td></tr><tr class=""><td class="specs-key">Fabric</td><td class="specs-value fk-data">Georgette</td></tr><tr class=""><td class="specs-key">Region</td><td class="specs-value fk-data">Gujarat</td></tr><tr class=""><td class="specs-key">Number of Contents in Sales Package</td><td class="specs-value fk-data">Pack of 1</td></tr><tr class=""><td class="specs-key">Blouse Piece</td><td class="specs-value fk-data">Yes</td></tr></table><table cellspacing="0" class="fk-specs-type2"><tr><th class="group-head" colspan="2">Dimensions</th></tr><tr class=""><td class="specs-key">Length</td><td class="specs-value fk-data">6.3 m</td></tr></table><table cellspacing="0" class="fk-specs-type2"><tr><th class="group-head" colspan="2">Fabric Care</th></tr><tr class=""><td class="specs-value fk-data" colspan="2">Wash and Iron Inside Out</td></tr></table><table cellspacing="0" class="fk-specs-type2"><tr><th class="group-head" colspan="2">In The Box</th></tr><tr class=""><td class="specs-key"> </td><td class="specs-value fk-data">Blouse, Sari</td></tr></table></div>
