15:02:2014,saris,Sunaina.,Sunaina Striped Silk, Synthetic Sari,Rs. 649,http://img5a.flixcart.com/image/sari/9/s/h/18102-sunaina-free-size-400x400-imadnhwarkvrnugb.jpeg, No more colour,Rs. 649,Gallibazaar,http://www.flipkart.com/sunaina-striped-silk-synthetic-sari/p/itmdz65eh8n6gwxm?pid=SARDNHV5VYYMS9SH&srno=b_1&ref=65058641-2a4f-4d97-8ddb-fb62f737ed21,LSTSARDNHV5VYYMS9SH3HMTDC,,<div class="item_left_column" id="description"><h3 class="item_desc_title fk-uppercase">Sunaina Striped Silk, Synthetic Sari         Price: Rs.649</h3><div class="cls"></div><div class="item_desc_text line"><div style="float:right"></div><p>	Make a grand entry and look very beautiful in this orange printed sari from Sunaina that is designed with an ethnic pattern and gives you a traditional look. Style this <strong>synthetic silk sari</strong> with gold jhumkis and bangles and look stunning.</p> </div><div style="clear: both;"></div></div>,<div class="item_left_column" id="specifications"><h3 class="item_desc_title fk-uppercase">        Specifications of Sunaina Striped Silk, Synthetic Sari    </h3><table cellspacing="0" class="fk-specs-type2"><tr><th class="group-head" colspan="2">General Details<a class="see-more unitExt rmargin10 no-underline" href="javascript:void(0);" onclick="$(this).closest('.fk-specs-type2').toggleClass('expandedMore')" title="Expand">[+]</a><a class="hidden unitExt rmargin10 no-underline" href="javascript:void(0);" onclick="$(this).closest('.fk-specs-type2').toggleClass('expandedMore')" title="Collapse">[-]</a></th></tr><tr class="hidden"><td class="specs-key">Ideal For</td><td class="specs-value fk-data">Women's</td></tr><tr class="hidden"><td class="specs-key">Occasion</td><td class="specs-value fk-data">Casual</td></tr><tr class="hidden"><td class="specs-key">Pattern</td><td class="specs-value fk-data">Striped</td></tr></table><table cellspacing="0" class="fk-specs-type2"><tr><th class="group-head" colspan="2">Sari Details</th></tr><tr class=""><td class="specs-key">Ideal For</td><td class="specs-value fk-data">Women's</td></tr><tr class=""><td class="specs-key">Fabric</td><td class="specs-value fk-data">Silk, Synthetic</td></tr><tr class=""><td class="specs-key">Number of Contents in Sales Package</td><td class="specs-value fk-data">Pack of 1</td></tr></table><table cellspacing="0" class="fk-specs-type2"><tr><th class="group-head" colspan="2">In The Box</th></tr><tr class=""><td class="specs-key"> </td><td class="specs-value fk-data">Blouse, Saree</td></tr></table></div>
15:02:2014,saris,Sunaina.,Sunaina Solid Synthetic, Silk Sari,Rs. 649,http://img5a.flixcart.com/image/sari/8/6/f/18145-sunaina-free-size-400x400-imadnhw9fqbdhcgj.jpeg, No more colour,Rs. 649,Gallibazaar,http://www.flipkart.com/sunaina-solid-synthetic-silk-sari/p/itmdz65ep6awhapg?pid=SARDNHV5U5RHJ86F&srno=b_2&ref=65058641-2a4f-4d97-8ddb-fb62f737ed21,LSTSARDNHV5U5RHJ86FRVQSTD,,<div class="item_left_column" id="description"><h3 class="item_desc_title fk-uppercase">Sunaina Solid Synthetic, Silk Sari         Price: Rs.649</h3><div class="cls"></div><div class="item_desc_text line"><div style="float:right"></div><p>	Tiled to soothing colors, this synthetic silk sari from the house of <strong>Sunaina</strong> has gorgeous <strong>paisley print</strong> all over. The elegant style of prints, especially on the pallu that glamorize your persona and make you ready to grab compliments at social events and gatherings.</p> </div><div style="clear: both;"></div></div>,<div class="item_left_column" id="specifications"><h3 class="item_desc_title fk-uppercase">        Specifications of Sunaina Solid Synthetic, Silk Sari    </h3><table cellspacing="0" class="fk-specs-type2"><tr><th class="group-head" colspan="2">General Details<a class="see-more unitExt rmargin10 no-underline" href="javascript:void(0);" onclick="$(this).closest('.fk-specs-type2').toggleClass('expandedMore')" title="Expand">[+]</a><a class="hidden unitExt rmargin10 no-underline" href="javascript:void(0);" onclick="$(this).closest('.fk-specs-type2').toggleClass('expandedMore')" title="Collapse">[-]</a></th></tr><tr class="hidden"><td class="specs-key">Ideal For</td><td class="specs-value fk-data">Women's</td></tr><tr class="hidden"><td class="specs-key">Occasion</td><td class="specs-value fk-data">Casual</td></tr><tr class="hidden"><td class="specs-key">Pattern</td><td class="specs-value fk-data">Solid</td></tr></table><table cellspacing="0" class="fk-specs-type2"><tr><th class="group-head" colspan="2">Sari Details</th></tr><tr class=""><td class="specs-key">Ideal For</td><td class="specs-value fk-data">Women's</td></tr><tr class=""><td class="specs-key">Fabric</td><td class="specs-value fk-data">Synthetic, Silk</td></tr><tr class=""><td class="specs-key">Number of Contents in Sales Package</td><td class="specs-value fk-data">Pack of 1</td></tr></table><table cellspacing="0" class="fk-specs-type2"><tr><th class="group-head" colspan="2">In The Box</th></tr><tr class=""><td class="specs-key"> </td><td class="specs-value fk-data">Blouse, Saree</td></tr></table></div>
15:02:2014,saris,Sunaina.,Sunaina Printed Synthetic, Silk Sari,Rs. 649,http://img6a.flixcart.com/image/sari/f/j/y/18061-sunaina-free-size-400x400-imadnhwaghmn6cdc.jpeg, No more colour,Rs. 649,Gallibazaar,http://www.flipkart.com/sunaina-printed-synthetic-silk-sari/p/itmdz65en4suuqn2?pid=SARDNHV5STSPJFJY&srno=b_6&ref=65058641-2a4f-4d97-8ddb-fb62f737ed21,LSTSARDNHV5STSPJFJYOXDXPH,,<div class="item_left_column" id="description"><h3 class="item_desc_title fk-uppercase">Sunaina Printed Synthetic, Silk Sari         Price: Rs.649</h3><div class="cls"></div><div class="item_desc_text line"><div style="float:right"></div><p style="text-align: justify;">	Jazz up your ensemble with this stylish<strong> silver printed sari from Sunaina</strong> that gives you a stylish appeal. The blend of silk and synthetic assures you comfort. Get ready to go to the temple by teaming this sari with a matching three-fourth sleeved blouse and sandals.</p> </div><div style="clear: both;"></div></div>,<div class="item_left_column" id="specifications"><h3 class="item_desc_title fk-uppercase">        Specifications of Sunaina Printed Synthetic, Silk Sari    </h3><table cellspacing="0" class="fk-specs-type2"><tr><th class="group-head" colspan="2">General Details<a class="see-more unitExt rmargin10 no-underline" href="javascript:void(0);" onclick="$(this).closest('.fk-specs-type2').toggleClass('expandedMore')" title="Expand">[+]</a><a class="hidden unitExt rmargin10 no-underline" href="javascript:void(0);" onclick="$(this).closest('.fk-specs-type2').toggleClass('expandedMore')" title="Collapse">[-]</a></th></tr><tr class="hidden"><td class="specs-key">Ideal For</td><td class="specs-value fk-data">Women's</td></tr><tr class="hidden"><td class="specs-key">Occasion</td><td class="specs-value fk-data">Casual</td></tr><tr class="hidden"><td class="specs-key">Pattern</td><td class="specs-value fk-data">Printed</td></tr></table><table cellspacing="0" class="fk-specs-type2"><tr><th class="group-head" colspan="2">Sari Details</th></tr><tr class=""><td class="specs-key">Ideal For</td><td class="specs-value fk-data">Women's</td></tr><tr class=""><td class="specs-key">Fabric</td><td class="specs-value fk-data">Synthetic, Silk</td></tr><tr class=""><td class="specs-key">Number of Contents in Sales Package</td><td class="specs-value fk-data">Pack of 1</td></tr></table><table cellspacing="0" class="fk-specs-type2"><tr><th class="group-head" colspan="2">In The Box</th></tr><tr class=""><td class="specs-key"> </td><td class="specs-value fk-data">Saree, Blouse</td></tr></table></div>
15:02:2014,saris,Sunaina.,Sunaina Printed Art Silk Sari,Rs. 649,http://img5a.flixcart.com/image/sari/u/h/u/18187-sunaina-400x400-imadpdqhafhc9wzs.jpeg, No more colour,Rs. 649,Gallibazaar,http://www.flipkart.com/sunaina-printed-art-silk-sari/p/itmdpdzfuafhmmcy?pid=SARDPDZEU9VHBUHU&srno=b_3&ref=65058641-2a4f-4d97-8ddb-fb62f737ed21,LSTSARDPDZEU9VHBUHUPVOGOC,,<div class="item_left_column" id="description"><h3 class="item_desc_title fk-uppercase">Sunaina Printed Art Silk Sari         Price: Rs.649</h3><div class="cls"></div><div class="item_desc_text line"><div style="float:right"></div><p style="text-align: justify;">	Representing fashion at its best, Sunaina designs this <strong>printed sari </strong>that takes your style a notch higher. Be a fashionista when you drape this silk sari that has been inspired by the region of South India. Look your best by wearing a sleeveless blouse and shimmery heels with this sari.</p> </div><div style="clear: both;"></div></div>,<div class="item_left_column" id="specifications"><h3 class="item_desc_title fk-uppercase">        Specifications of Sunaina Printed Art Silk Sari    </h3><table cellspacing="0" class="fk-specs-type2"><tr><th class="group-head" colspan="2">General Details<a class="see-more unitExt rmargin10 no-underline" href="javascript:void(0);" onclick="$(this).closest('.fk-specs-type2').toggleClass('expandedMore')" title="Expand">[+]</a><a class="hidden unitExt rmargin10 no-underline" href="javascript:void(0);" onclick="$(this).closest('.fk-specs-type2').toggleClass('expandedMore')" title="Collapse">[-]</a></th></tr><tr class="hidden"><td class="specs-key">Occasion</td><td class="specs-value fk-data">Party, Casual</td></tr><tr class="hidden"><td class="specs-key">Pattern</td><td class="specs-value fk-data">Printed</td></tr></table><table cellspacing="0" class="fk-specs-type2"><tr><th class="group-head" colspan="2">Sari Details</th></tr><tr class=""><td class="specs-key">Fabric</td><td class="specs-value fk-data">Art Silk</td></tr><tr class=""><td class="specs-key">Region</td><td class="specs-value fk-data">South Indian</td></tr><tr class=""><td class="specs-key">Number of Contents in Sales Package</td><td class="specs-value fk-data">Pack of 1</td></tr><tr class=""><td class="specs-key">Blouse Piece</td><td class="specs-value fk-data">Yes</td></tr></table><table cellspacing="0" class="fk-specs-type2"><tr><th class="group-head" colspan="2">Dimensions</th></tr><tr class=""><td class="specs-key">Length</td><td class="specs-value fk-data">5.5 m</td></tr></table><table cellspacing="0" class="fk-specs-type2"><tr><th class="group-head" colspan="2">In The Box</th></tr><tr class=""><td class="specs-key"> </td><td class="specs-value fk-data">Blouse Piece, Saree</td></tr></table></div>
15:02:2014,saris,Sunaina.,Sunaina Printed Silk Sari,Rs. 899,http://img5a.flixcart.com/image/sari/g/3/4/55-sunaina-400x400-imadpdqhnjujfmcm.jpeg, No more colour,Rs. 899,Gallibazaar,http://www.flipkart.com/sunaina-printed-silk-sari/p/itmdpdzfjfypnugh?pid=SARDPDZETFMFMG34&srno=b_8&ref=65058641-2a4f-4d97-8ddb-fb62f737ed21,LSTSARDPDZETFMFMG34XCHEJ3,,<div class="item_left_column" id="description"><h3 class="item_desc_title fk-uppercase">Sunaina Printed Silk Sari         Price: Rs.899</h3><div class="cls"></div><div class="item_desc_text line"><div style="float:right"></div>                        Peppy colors, designer trends, comfortable and a trendy look in ethnic wear. Just peep into the style quotient of popular onscreen divas following this thumb rule. You have caught us right. Vibrant shades, floral motifs, splendid stripes.        </div><div style="clear: both;"></div></div>,<div class="item_left_column" id="specifications"><h3 class="item_desc_title fk-uppercase">        Specifications of Sunaina Printed Silk Sari    </h3><table cellspacing="0" class="fk-specs-type2"><tr><th class="group-head" colspan="2">General Details<a class="see-more unitExt rmargin10 no-underline" href="javascript:void(0);" onclick="$(this).closest('.fk-specs-type2').toggleClass('expandedMore')" title="Expand">[+]</a><a class="hidden unitExt rmargin10 no-underline" href="javascript:void(0);" onclick="$(this).closest('.fk-specs-type2').toggleClass('expandedMore')" title="Collapse">[-]</a></th></tr><tr class="hidden"><td class="specs-key">Occasion</td><td class="specs-value fk-data">Casual, Party</td></tr><tr class="hidden"><td class="specs-key">Pattern</td><td class="specs-value fk-data">Printed</td></tr></table><table cellspacing="0" class="fk-specs-type2"><tr><th class="group-head" colspan="2">Sari Details</th></tr><tr class=""><td class="specs-key">Fabric</td><td class="specs-value fk-data">Silk</td></tr><tr class=""><td class="specs-key">Region</td><td class="specs-value fk-data">South Indian</td></tr></table><table cellspacing="0" class="fk-specs-type2"><tr><th class="group-head" colspan="2">In The Box</th></tr><tr class=""><td class="specs-key"> </td><td class="specs-value fk-data">Blouse Piece, Saree</td></tr></table></div>
15:02:2014,saris,Sunaina.,Sunaina Striped Silk, Synthetic Sari,Rs. 649,http://img6a.flixcart.com/image/sari/9/c/7/18008-sunaina-free-size-400x400-imadnhwaaqghgrdr.jpeg, No more colour,Rs. 649,Gallibazaar,http://www.flipkart.com/sunaina-striped-silk-synthetic-sari/p/itmdz65eycq4hbyg?pid=SARDNHV5FK3EY9C7&srno=b_5&ref=65058641-2a4f-4d97-8ddb-fb62f737ed21,LSTSARDNHV5FK3EY9C7V96WPN,,<div class="item_left_column" id="description"><h3 class="item_desc_title fk-uppercase">Sunaina Striped Silk, Synthetic Sari         Price: Rs.649</h3><div class="cls"></div><div class="item_desc_text line"><div style="float:right"></div><p style="text-align: justify;">	Reveal your modish appeal and express your uniqueness in dressing by draping this<strong> brown printed sari from the house of Sunaina</strong>. The ethnic wear is a bend of synthetic and silk that give you a relaxed feel. Wear heels, a matching blouse and stylish earrings with this sari.</p> </div><div style="clear: both;"></div></div>,<div class="item_left_column" id="specifications"><h3 class="item_desc_title fk-uppercase">        Specifications of Sunaina Striped Silk, Synthetic Sari    </h3><table cellspacing="0" class="fk-specs-type2"><tr><th class="group-head" colspan="2">General Details<a class="see-more unitExt rmargin10 no-underline" href="javascript:void(0);" onclick="$(this).closest('.fk-specs-type2').toggleClass('expandedMore')" title="Expand">[+]</a><a class="hidden unitExt rmargin10 no-underline" href="javascript:void(0);" onclick="$(this).closest('.fk-specs-type2').toggleClass('expandedMore')" title="Collapse">[-]</a></th></tr><tr class="hidden"><td class="specs-key">Ideal For</td><td class="specs-value fk-data">Women's</td></tr><tr class="hidden"><td class="specs-key">Occasion</td><td class="specs-value fk-data">Casual</td></tr><tr class="hidden"><td class="specs-key">Pattern</td><td class="specs-value fk-data">Striped</td></tr></table><table cellspacing="0" class="fk-specs-type2"><tr><th class="group-head" colspan="2">Sari Details</th></tr><tr class=""><td class="specs-key">Ideal For</td><td class="specs-value fk-data">Women's</td></tr><tr class=""><td class="specs-key">Fabric</td><td class="specs-value fk-data">Silk, Synthetic</td></tr><tr class=""><td class="specs-key">Number of Contents in Sales Package</td><td class="specs-value fk-data">Pack of 1</td></tr></table><table cellspacing="0" class="fk-specs-type2"><tr><th class="group-head" colspan="2">In The Box</th></tr><tr class=""><td class="specs-key"> </td><td class="specs-value fk-data">Saree, Blouse</td></tr></table></div>
15:02:2014,saris,Sunaina.,Sunaina Printed Silk, Synthetic Sari,Rs. 649,http://img6a.flixcart.com/image/sari/y/j/w/18169-sunaina-free-size-400x400-imadnhwaxpy4hsgh.jpeg, No more colour,Rs. 649,Gallibazaar,http://www.flipkart.com/sunaina-printed-silk-synthetic-sari/p/itmdz65e4dzvhe6t?pid=SARDNHV5V6Z9ZYJW&srno=b_7&ref=65058641-2a4f-4d97-8ddb-fb62f737ed21,LSTSARDNHV5V6Z9ZYJWPXO6DD,,<div class="item_left_column" id="description"><h3 class="item_desc_title fk-uppercase">Sunaina Printed Silk, Synthetic Sari         Price: Rs.649</h3><div class="cls"></div><div class="item_desc_text line"><div style="float:right"></div><p>	Elegant and completely traditional, this <strong>printed brown sari</strong> from Sunaina drapes beautifully and gives you a chic look effortlessly. Complete your ethnic look with simple drop earrings, matching bangles and look really gorgeous at your friend’s house warming ceremony.</p> </div><div style="clear: both;"></div></div>,<div class="item_left_column" id="specifications"><h3 class="item_desc_title fk-uppercase">        Specifications of Sunaina Printed Silk, Synthetic Sari    </h3><table cellspacing="0" class="fk-specs-type2"><tr><th class="group-head" colspan="2">General Details<a class="see-more unitExt rmargin10 no-underline" href="javascript:void(0);" onclick="$(this).closest('.fk-specs-type2').toggleClass('expandedMore')" title="Expand">[+]</a><a class="hidden unitExt rmargin10 no-underline" href="javascript:void(0);" onclick="$(this).closest('.fk-specs-type2').toggleClass('expandedMore')" title="Collapse">[-]</a></th></tr><tr class="hidden"><td class="specs-key">Ideal For</td><td class="specs-value fk-data">Women's</td></tr><tr class="hidden"><td class="specs-key">Occasion</td><td class="specs-value fk-data">Casual</td></tr><tr class="hidden"><td class="specs-key">Pattern</td><td class="specs-value fk-data">Printed</td></tr></table><table cellspacing="0" class="fk-specs-type2"><tr><th class="group-head" colspan="2">Sari Details</th></tr><tr class=""><td class="specs-key">Ideal For</td><td class="specs-value fk-data">Women's</td></tr><tr class=""><td class="specs-key">Fabric</td><td class="specs-value fk-data">Silk, Synthetic</td></tr><tr class=""><td class="specs-key">Number of Contents in Sales Package</td><td class="specs-value fk-data">Pack of 1</td></tr></table><table cellspacing="0" class="fk-specs-type2"><tr><th class="group-head" colspan="2">In The Box</th></tr><tr class=""><td class="specs-key"> </td><td class="specs-value fk-data">Saree, Blouse</td></tr></table></div>
15:02:2014,saris,Sunaina.,Sunaina Checkered Cotton, Silk Sari,Rs. 699,http://img6a.flixcart.com/image/sari/r/b/h/5071-sunaina-400x400-imadpdqhugbsggvd.jpeg, No more colour,Rs. 699,Gallibazaar,http://www.flipkart.com/sunaina-checkered-cotton-silk-sari/p/itmdpdzfdzwmxbgz?pid=SARDPDZENH8TJRBH&srno=b_4&ref=65058641-2a4f-4d97-8ddb-fb62f737ed21,LSTSARDPDZENH8TJRBHQ7JBJM,,<div class="item_left_column" id="description"><h3 class="item_desc_title fk-uppercase">Sunaina Checkered Cotton, Silk Sari         Price: Rs.699</h3><div class="cls"></div><div class="item_desc_text line"><div style="float:right"></div>                        Peppy colors, designer trends, comfortable and a trendy look in ethnic wear. Just peep into the style quotient of popular onscreen divas following this thumb rule. You have caught us right. Vibrant shades, floral motifs, splendid stripes.        </div><div style="clear: both;"></div></div>,<div class="item_left_column" id="specifications"><h3 class="item_desc_title fk-uppercase">        Specifications of Sunaina Checkered Cotton, Silk Sari    </h3><table cellspacing="0" class="fk-specs-type2"><tr><th class="group-head" colspan="2">General Details<a class="see-more unitExt rmargin10 no-underline" href="javascript:void(0);" onclick="$(this).closest('.fk-specs-type2').toggleClass('expandedMore')" title="Expand">[+]</a><a class="hidden unitExt rmargin10 no-underline" href="javascript:void(0);" onclick="$(this).closest('.fk-specs-type2').toggleClass('expandedMore')" title="Collapse">[-]</a></th></tr><tr class="hidden"><td class="specs-key">Occasion</td><td class="specs-value fk-data">Party, Casual</td></tr><tr class="hidden"><td class="specs-key">Pattern</td><td class="specs-value fk-data">Checkered</td></tr></table><table cellspacing="0" class="fk-specs-type2"><tr><th class="group-head" colspan="2">Sari Details</th></tr><tr class=""><td class="specs-key">Fabric</td><td class="specs-value fk-data">Cotton, Silk</td></tr><tr class=""><td class="specs-key">Region</td><td class="specs-value fk-data">South Indian</td></tr><tr class=""><td class="specs-key">Number of Contents in Sales Package</td><td class="specs-value fk-data">Pack of 1</td></tr><tr class=""><td class="specs-key">Blouse Piece</td><td class="specs-value fk-data">Yes</td></tr></table><table cellspacing="0" class="fk-specs-type2"><tr><th class="group-head" colspan="2">Dimensions</th></tr><tr class=""><td class="specs-key">Length</td><td class="specs-value fk-data">5.5 m</td></tr></table><table cellspacing="0" class="fk-specs-type2"><tr><th class="group-head" colspan="2">In The Box</th></tr><tr class=""><td class="specs-key"> </td><td class="specs-value fk-data">Saree, Blouse Piece</td></tr></table></div>
15:02:2014,saris,Sunaina.,Sunaina Printed Art Silk Sari,Rs. 649,http://img5a.flixcart.com/image/sari/f/4/p/18122-sunaina-400x400-imadqsh58wkkgscf.jpeg, No more colour,Rs. 649,Gallibazaar,http://www.flipkart.com/sunaina-printed-art-silk-sari/p/itmdqrun3trmccbc?pid=SARDQRUNPY5YXF4P&srno=b_9&ref=65058641-2a4f-4d97-8ddb-fb62f737ed21,LSTSARDQRUNPY5YXF4PWLZCNQ,,<div class="item_left_column" id="description"><h3 class="item_desc_title fk-uppercase">Sunaina Printed Art Silk Sari         Price: Rs.649</h3><div class="cls"></div><div class="item_desc_text line"><div style="float:right"></div>                        Peppy colors, designer trends, comfortable and a trendy look in ethnic wear. Just peep into the style quotient of popular onscreen divas following this thumb rule. You have caught us right. Vibrant shades, floral motifs, splendid stripes.        </div><div style="clear: both;"></div></div>,<div class="item_left_column" id="specifications"><h3 class="item_desc_title fk-uppercase">        Specifications of Sunaina Printed Art Silk Sari    </h3><table cellspacing="0" class="fk-specs-type2"><tr><th class="group-head" colspan="2">General Details<a class="see-more unitExt rmargin10 no-underline" href="javascript:void(0);" onclick="$(this).closest('.fk-specs-type2').toggleClass('expandedMore')" title="Expand">[+]</a><a class="hidden unitExt rmargin10 no-underline" href="javascript:void(0);" onclick="$(this).closest('.fk-specs-type2').toggleClass('expandedMore')" title="Collapse">[-]</a></th></tr><tr class="hidden"><td class="specs-key">Occasion</td><td class="specs-value fk-data">Party, Casual</td></tr><tr class="hidden"><td class="specs-key">Pattern</td><td class="specs-value fk-data">Printed</td></tr></table><table cellspacing="0" class="fk-specs-type2"><tr><th class="group-head" colspan="2">Sari Details</th></tr><tr class=""><td class="specs-key">Fabric</td><td class="specs-value fk-data">Art Silk</td></tr></table><table cellspacing="0" class="fk-specs-type2"><tr><th class="group-head" colspan="2">In The Box</th></tr><tr class=""><td class="specs-key"> </td><td class="specs-value fk-data">Saree, Blouse Piece</td></tr></table></div>
15:02:2014,saris,Sunaina.,Sunaina Geometric Print Art Silk Sari,Rs. 649,http://img5a.flixcart.com/image/sari/k/d/t/5399-sunaina-400x400-imadpdqhfpqf5bcg.jpeg, No more colour,Rs. 649,Gallibazaar,http://www.flipkart.com/sunaina-geometric-print-art-silk-sari/p/itmdpdzfzkwv67mt?pid=SARDPDZEZCKN9KDT&srno=b_10&ref=65058641-2a4f-4d97-8ddb-fb62f737ed21,LSTSARDPDZEZCKN9KDTMMJUOX,,<div class="item_left_column" id="description"><h3 class="item_desc_title fk-uppercase">Sunaina Geometric Print Art Silk Sari         Price: Rs.649</h3><div class="cls"></div><div class="item_desc_text line"><div style="float:right"></div><p>	Made from fine art silk, this lovely printed sari is a designer piece that makes you look very beautiful in ethnic wear. Drape this <strong>Sunaina South Indian sari</strong> with matching bangles and carry an embellished clutch bag along for a look divalicious.</p> </div><div style="clear: both;"></div></div>,<div class="item_left_column" id="specifications"><h3 class="item_desc_title fk-uppercase">        Specifications of Sunaina Geometric Print Art Silk Sari    </h3><table cellspacing="0" class="fk-specs-type2"><tr><th class="group-head" colspan="2">General Details<a class="see-more unitExt rmargin10 no-underline" href="javascript:void(0);" onclick="$(this).closest('.fk-specs-type2').toggleClass('expandedMore')" title="Expand">[+]</a><a class="hidden unitExt rmargin10 no-underline" href="javascript:void(0);" onclick="$(this).closest('.fk-specs-type2').toggleClass('expandedMore')" title="Collapse">[-]</a></th></tr><tr class="hidden"><td class="specs-key">Occasion</td><td class="specs-value fk-data">Casual, Party</td></tr><tr class="hidden"><td class="specs-key">Pattern</td><td class="specs-value fk-data">Geometric Print</td></tr></table><table cellspacing="0" class="fk-specs-type2"><tr><th class="group-head" colspan="2">Sari Details</th></tr><tr class=""><td class="specs-key">Fabric</td><td class="specs-value fk-data">Art Silk</td></tr><tr class=""><td class="specs-key">Region</td><td class="specs-value fk-data">South Indian</td></tr><tr class=""><td class="specs-key">Number of Contents in Sales Package</td><td class="specs-value fk-data">Pack of 1</td></tr><tr class=""><td class="specs-key">Blouse Piece</td><td class="specs-value fk-data">Yes</td></tr></table><table cellspacing="0" class="fk-specs-type2"><tr><th class="group-head" colspan="2">Dimensions</th></tr><tr class=""><td class="specs-key">Length</td><td class="specs-value fk-data">5.5 m</td></tr></table><table cellspacing="0" class="fk-specs-type2"><tr><th class="group-head" colspan="2">In The Box</th></tr><tr class=""><td class="specs-key"> </td><td class="specs-value fk-data">Blouse Piece, Saree</td></tr></table></div>
