15:02:2014,saris,Sunaina.,Sunaina Printed Synthetic, Silk Sari,Rs. 649,http://img5a.flixcart.com/image/sari/g/g/c/5326-sunaina-free-size-400x400-imadnhw9crgqqxuk.jpeg, No more colour,Rs. 649,Gallibazaar,http://www.flipkart.com/sunaina-printed-synthetic-silk-sari/p/itmdz65evjgaknvx?pid=SARDNHV5J8CFXGGC&srno=b_21&ref=588ff42e-93df-4ef7-afc3-d5e1145292a9,LSTSARDNHV5J8CFXGGCUARVYI,,<div class="item_left_column" id="description"><h3 class="item_desc_title fk-uppercase">Sunaina Printed Synthetic, Silk Sari         Price: Rs.649</h3><div class="cls"></div><div class="item_desc_text line"><div style="float:right"></div>                        Peppy colors, designer trends, comfortable and a trendy look in ethnic wear. Just peep into the style quotient of popular onscreen divas following this thumb rule. Saree. You have caught us right. Vibrant shades, floral motifs, splendid stripes and much more for your revamped wardrobe. Were sure you have gathered enough inspiration to ditch your westerns for the sake of stylish sarees. Go ahead. Product Overview - Fancy saree with amazing color combos &amp; prints. It gives an amazing outlook to the lady who is dressed in it. It is made of malbari silk fabric. Saree length is 6.3 m with blouse piece. Fabric Superior Quality Malbari Silk with Digital High Quality printing        </div><div style="clear: both;"></div></div>,<div class="item_left_column" id="specifications"><h3 class="item_desc_title fk-uppercase">        Specifications of Sunaina Printed Synthetic, Silk Sari    </h3><table cellspacing="0" class="fk-specs-type2"><tr><th class="group-head" colspan="2">General Details<a class="see-more unitExt rmargin10 no-underline" href="javascript:void(0);" onclick="$(this).closest('.fk-specs-type2').toggleClass('expandedMore')" title="Expand">[+]</a><a class="hidden unitExt rmargin10 no-underline" href="javascript:void(0);" onclick="$(this).closest('.fk-specs-type2').toggleClass('expandedMore')" title="Collapse">[-]</a></th></tr><tr class="hidden"><td class="specs-key">Ideal For</td><td class="specs-value fk-data">Women's</td></tr><tr class="hidden"><td class="specs-key">Occasion</td><td class="specs-value fk-data">Casual</td></tr><tr class="hidden"><td class="specs-key">Pattern</td><td class="specs-value fk-data">Printed</td></tr></table><table cellspacing="0" class="fk-specs-type2"><tr><th class="group-head" colspan="2">Sari Details</th></tr><tr class=""><td class="specs-key">Ideal For</td><td class="specs-value fk-data">Women's</td></tr><tr class=""><td class="specs-key">Fabric</td><td class="specs-value fk-data">Synthetic, Silk</td></tr><tr class=""><td class="specs-key">Number of Contents in Sales Package</td><td class="specs-value fk-data">Pack of 1</td></tr></table><table cellspacing="0" class="fk-specs-type2"><tr><th class="group-head" colspan="2">In The Box</th></tr><tr class=""><td class="specs-key"> </td><td class="specs-value fk-data">Blouse, Saree</td></tr></table></div>
15:02:2014,saris,Sunaina.,Sunaina Printed Silk, Cotton Sari,Rs. 699,http://img6a.flixcart.com/image/sari/v/k/z/5081-sunaina-400x400-imadqsh5pqghrvgs.jpeg, No more colour,Rs. 699,Gallibazaar,http://www.flipkart.com/sunaina-printed-silk-cotton-sari/p/itmdqrunevd5zwkm?pid=SARDQRUNYBK7FVKZ&srno=b_22&ref=588ff42e-93df-4ef7-afc3-d5e1145292a9,LSTSARDQRUNYBK7FVKZ6EJVHJ,,<div class="item_left_column" id="description"><h3 class="item_desc_title fk-uppercase">Sunaina Printed Silk, Cotton Sari         Price: Rs.699</h3><div class="cls"></div><div class="item_desc_text line"><div style="float:right"></div>                        Peppy colors, designer trends, comfortable and a trendy look in ethnic wear. Just peep into the style quotient of popular onscreen divas following this thumb rule. You have caught us right. Vibrant shades, floral motifs, splendid stripes.        </div><div style="clear: both;"></div></div>,<div class="item_left_column" id="specifications"><h3 class="item_desc_title fk-uppercase">        Specifications of Sunaina Printed Silk, Cotton Sari    </h3><table cellspacing="0" class="fk-specs-type2"><tr><th class="group-head" colspan="2">General Details<a class="see-more unitExt rmargin10 no-underline" href="javascript:void(0);" onclick="$(this).closest('.fk-specs-type2').toggleClass('expandedMore')" title="Expand">[+]</a><a class="hidden unitExt rmargin10 no-underline" href="javascript:void(0);" onclick="$(this).closest('.fk-specs-type2').toggleClass('expandedMore')" title="Collapse">[-]</a></th></tr><tr class="hidden"><td class="specs-key">Occasion</td><td class="specs-value fk-data">Casual, Party</td></tr><tr class="hidden"><td class="specs-key">Pattern</td><td class="specs-value fk-data">Printed</td></tr></table><table cellspacing="0" class="fk-specs-type2"><tr><th class="group-head" colspan="2">Sari Details</th></tr><tr class=""><td class="specs-key">Fabric</td><td class="specs-value fk-data">Silk, Cotton</td></tr></table><table cellspacing="0" class="fk-specs-type2"><tr><th class="group-head" colspan="2">In The Box</th></tr><tr class=""><td class="specs-key"> </td><td class="specs-value fk-data">Blouse Piece, Saree</td></tr></table></div>
15:02:2014,saris,Sunaina.,Sunaina Printed Art Silk Sari,Rs. 649,http://img6a.flixcart.com/image/sari/7/c/k/18088-sunaina-400x400-imadqsh5chu7txcq.jpeg, No more colour,Rs. 649,Gallibazaar,http://www.flipkart.com/sunaina-printed-art-silk-sari/p/itmdqrunhcpxcetg?pid=SARDQRUN3SFSH7CK&srno=b_23&ref=588ff42e-93df-4ef7-afc3-d5e1145292a9,LSTSARDQRUN3SFSH7CK6W2HLI,,<div class="item_left_column" id="description"><h3 class="item_desc_title fk-uppercase">Sunaina Printed Art Silk Sari         Price: Rs.649</h3><div class="cls"></div><div class="item_desc_text line"><div style="float:right"></div>                        Peppy colors, designer trends, comfortable and a trendy look in ethnic wear. Just peep into the style quotient of popular onscreen divas following this thumb rule. You have caught us right. Vibrant shades, floral motifs, splendid stripes.        </div><div style="clear: both;"></div></div>,<div class="item_left_column" id="specifications"><h3 class="item_desc_title fk-uppercase">        Specifications of Sunaina Printed Art Silk Sari    </h3><table cellspacing="0" class="fk-specs-type2"><tr><th class="group-head" colspan="2">General Details<a class="see-more unitExt rmargin10 no-underline" href="javascript:void(0);" onclick="$(this).closest('.fk-specs-type2').toggleClass('expandedMore')" title="Expand">[+]</a><a class="hidden unitExt rmargin10 no-underline" href="javascript:void(0);" onclick="$(this).closest('.fk-specs-type2').toggleClass('expandedMore')" title="Collapse">[-]</a></th></tr><tr class="hidden"><td class="specs-key">Occasion</td><td class="specs-value fk-data">Casual, Party</td></tr><tr class="hidden"><td class="specs-key">Pattern</td><td class="specs-value fk-data">Printed</td></tr></table><table cellspacing="0" class="fk-specs-type2"><tr><th class="group-head" colspan="2">Sari Details</th></tr><tr class=""><td class="specs-key">Fabric</td><td class="specs-value fk-data">Art Silk</td></tr></table><table cellspacing="0" class="fk-specs-type2"><tr><th class="group-head" colspan="2">In The Box</th></tr><tr class=""><td class="specs-key"> </td><td class="specs-value fk-data">Blouse Piece, Saree</td></tr></table></div>
15:02:2014,saris,Sunaina.,Sunaina Printed Silk Sari,Rs. 799,http://img6a.flixcart.com/image/sari/y/h/8/53-sunaina-400x400-imadpdqhpxqbmhu4.jpeg, No more colour,Rs. 799,Gallibazaar,http://www.flipkart.com/sunaina-printed-silk-sari/p/itmdpdzfvcuy7s6p?pid=SARDPDZE6PVAMYH8&srno=b_24&ref=588ff42e-93df-4ef7-afc3-d5e1145292a9,LSTSARDPDZE6PVAMYH8RDXUR1,,<div class="item_left_column" id="description"><h3 class="item_desc_title fk-uppercase">Sunaina Printed Silk Sari         Price: Rs.799</h3><div class="cls"></div><div class="item_desc_text line"><div style="float:right"></div><p>	Look very pretty at the next festive occasion in this <strong>beautiful silk sari</strong> from Sunaina that combines subtle checks with chic traditional motifs. Accessorise this printed sari with matching green earrings and bangles for a divalicious style.</p> </div><div style="clear: both;"></div></div>,<div class="item_left_column" id="specifications"><h3 class="item_desc_title fk-uppercase">        Specifications of Sunaina Printed Silk Sari    </h3><table cellspacing="0" class="fk-specs-type2"><tr><th class="group-head" colspan="2">General Details<a class="see-more unitExt rmargin10 no-underline" href="javascript:void(0);" onclick="$(this).closest('.fk-specs-type2').toggleClass('expandedMore')" title="Expand">[+]</a><a class="hidden unitExt rmargin10 no-underline" href="javascript:void(0);" onclick="$(this).closest('.fk-specs-type2').toggleClass('expandedMore')" title="Collapse">[-]</a></th></tr><tr class="hidden"><td class="specs-key">Occasion</td><td class="specs-value fk-data">Party, Casual</td></tr><tr class="hidden"><td class="specs-key">Pattern</td><td class="specs-value fk-data">Printed</td></tr></table><table cellspacing="0" class="fk-specs-type2"><tr><th class="group-head" colspan="2">Sari Details</th></tr><tr class=""><td class="specs-key">Fabric</td><td class="specs-value fk-data">Silk</td></tr><tr class=""><td class="specs-key">Region</td><td class="specs-value fk-data">South Indian</td></tr></table><table cellspacing="0" class="fk-specs-type2"><tr><th class="group-head" colspan="2">In The Box</th></tr><tr class=""><td class="specs-key"> </td><td class="specs-value fk-data">Saree, Blouse Piece</td></tr></table></div>
15:02:2014,saris,Sunaina.,Sunaina Printed Silk, Synthetic Sari,Rs. 649,http://img5a.flixcart.com/image/sari/z/m/d/5328-sunaina-free-size-400x400-imadnhwbwgq7zn9s.jpeg, No more colour,Rs. 649,Gallibazaar,http://www.flipkart.com/sunaina-printed-silk-synthetic-sari/p/itmdz65edquh4gwf?pid=SARDNHV5CTGP9ZMD&srno=b_27&ref=588ff42e-93df-4ef7-afc3-d5e1145292a9,LSTSARDNHV5CTGP9ZMDTWMJ2V,,<div class="item_left_column" id="description"><h3 class="item_desc_title fk-uppercase">Sunaina Printed Silk, Synthetic Sari         Price: Rs.649</h3><div class="cls"></div><div class="item_desc_text line"><div style="float:right"></div><p>	Vibrant shades, floral motifs, splendid stripes-all against a dark yellow canvas, this sari is crafted from <strong>synthetic silk fabric</strong>. With hints of blue on the border this sari looks best with a matching blouse and long chains to give you a raw ethnic appeal.</p> </div><div style="clear: both;"></div></div>,<div class="item_left_column" id="specifications"><h3 class="item_desc_title fk-uppercase">        Specifications of Sunaina Printed Silk, Synthetic Sari    </h3><table cellspacing="0" class="fk-specs-type2"><tr><th class="group-head" colspan="2">General Details<a class="see-more unitExt rmargin10 no-underline" href="javascript:void(0);" onclick="$(this).closest('.fk-specs-type2').toggleClass('expandedMore')" title="Expand">[+]</a><a class="hidden unitExt rmargin10 no-underline" href="javascript:void(0);" onclick="$(this).closest('.fk-specs-type2').toggleClass('expandedMore')" title="Collapse">[-]</a></th></tr><tr class="hidden"><td class="specs-key">Ideal For</td><td class="specs-value fk-data">Women's</td></tr><tr class="hidden"><td class="specs-key">Occasion</td><td class="specs-value fk-data">Casual</td></tr><tr class="hidden"><td class="specs-key">Pattern</td><td class="specs-value fk-data">Printed</td></tr></table><table cellspacing="0" class="fk-specs-type2"><tr><th class="group-head" colspan="2">Sari Details</th></tr><tr class=""><td class="specs-key">Ideal For</td><td class="specs-value fk-data">Women's</td></tr><tr class=""><td class="specs-key">Fabric</td><td class="specs-value fk-data">Silk, Synthetic</td></tr><tr class=""><td class="specs-key">Number of Contents in Sales Package</td><td class="specs-value fk-data">Pack of 1</td></tr></table><table cellspacing="0" class="fk-specs-type2"><tr><th class="group-head" colspan="2">In The Box</th></tr><tr class=""><td class="specs-key"> </td><td class="specs-value fk-data">Saree, Blouse</td></tr></table></div>
15:02:2014,saris,Sunaina.,Sunaina Printed Art Silk Sari,Rs. 649,http://img5a.flixcart.com/image/sari/z/p/g/5409-sunaina-400x400-imadqsh5y9wyzghq.jpeg, No more colour,Rs. 649,Gallibazaar,http://www.flipkart.com/sunaina-printed-art-silk-sari/p/itmdqrunhgkqkyqx?pid=SARDQRUNBN7WFZPG&srno=b_26&ref=588ff42e-93df-4ef7-afc3-d5e1145292a9,LSTSARDQRUNBN7WFZPGNRVF9F,,<div class="item_left_column" id="description"><h3 class="item_desc_title fk-uppercase">Sunaina Printed Art Silk Sari         Price: Rs.649</h3><div class="cls"></div><div class="item_desc_text line"><div style="float:right"></div>                        Peppy colors, designer trends, comfortable and a trendy look in ethnic wear. Just peep into the style quotient of popular onscreen divas following this thumb rule. You have caught us right. Vibrant shades, floral motifs, splendid stripes.        </div><div style="clear: both;"></div></div>,<div class="item_left_column" id="specifications"><h3 class="item_desc_title fk-uppercase">        Specifications of Sunaina Printed Art Silk Sari    </h3><table cellspacing="0" class="fk-specs-type2"><tr><th class="group-head" colspan="2">General Details<a class="see-more unitExt rmargin10 no-underline" href="javascript:void(0);" onclick="$(this).closest('.fk-specs-type2').toggleClass('expandedMore')" title="Expand">[+]</a><a class="hidden unitExt rmargin10 no-underline" href="javascript:void(0);" onclick="$(this).closest('.fk-specs-type2').toggleClass('expandedMore')" title="Collapse">[-]</a></th></tr><tr class="hidden"><td class="specs-key">Occasion</td><td class="specs-value fk-data">Party, Casual, Wedding</td></tr><tr class="hidden"><td class="specs-key">Pattern</td><td class="specs-value fk-data">Printed</td></tr></table><table cellspacing="0" class="fk-specs-type2"><tr><th class="group-head" colspan="2">Sari Details</th></tr><tr class=""><td class="specs-key">Fabric</td><td class="specs-value fk-data">Art Silk</td></tr></table><table cellspacing="0" class="fk-specs-type2"><tr><th class="group-head" colspan="2">In The Box</th></tr><tr class=""><td class="specs-key"> </td><td class="specs-value fk-data">Saree, Blouse Piece</td></tr></table></div>
15:02:2014,saris,Sunaina.,Sunaina Printed Synthetic Sari,Price: Not Available,http://img6a.flixcart.com/image/sari/z/c/2/7712-sunaina-400x400-imadpdqhwafgj4wz.jpeg, No more colour,Price: Not Available,WS Retail,http://www.flipkart.com/sunaina-printed-synthetic-sari/p/itmdpdzfvygksywg?pid=SARDPDZF3JAZFZC2&srno=b_25&ref=588ff42e-93df-4ef7-afc3-d5e1145292a9,no sku defined,,<div class="item_left_column" id="description"><h3 class="item_desc_title fk-uppercase">Sunaina Printed Synthetic Sari        </h3><div class="cls"></div><div class="item_desc_text line"><div style="float:right"></div><p style="text-align: justify;">	Look stunning and gorgeous as ever as you drape yourself in this <strong>multicolored sari</strong> from Sunaina. The beautiful prints and the exceptionally comfortable synthetic fabric, make this sari a fabulous piece. Add on dangle earrings, a few bangles and slip into stilettos for a ravishing look.</p> </div><div style="clear: both;"></div></div>,<div class="item_left_column" id="specifications"><h3 class="item_desc_title fk-uppercase">        Specifications of Sunaina Printed Synthetic Sari    </h3><table cellspacing="0" class="fk-specs-type2"><tr><th class="group-head" colspan="2">General Details<a class="see-more unitExt rmargin10 no-underline" href="javascript:void(0);" onclick="$(this).closest('.fk-specs-type2').toggleClass('expandedMore')" title="Expand">[+]</a><a class="hidden unitExt rmargin10 no-underline" href="javascript:void(0);" onclick="$(this).closest('.fk-specs-type2').toggleClass('expandedMore')" title="Collapse">[-]</a></th></tr><tr class="hidden"><td class="specs-key">Occasion</td><td class="specs-value fk-data">Party, Casual</td></tr><tr class="hidden"><td class="specs-key">Pattern</td><td class="specs-value fk-data">Printed</td></tr></table><table cellspacing="0" class="fk-specs-type2"><tr><th class="group-head" colspan="2">Sari Details</th></tr><tr class=""><td class="specs-key">Fabric</td><td class="specs-value fk-data">Synthetic</td></tr><tr class=""><td class="specs-key">Region</td><td class="specs-value fk-data">South Indian</td></tr></table><table cellspacing="0" class="fk-specs-type2"><tr><th class="group-head" colspan="2">In The Box</th></tr><tr class=""><td class="specs-key"> </td><td class="specs-value fk-data">Blouse Piece, Saree</td></tr></table></div>
15:02:2014,saris,Sunaina.,Sunaina Printed Cotton, Silk Sari,Rs. 699,http://img6a.flixcart.com/image/sari/e/y/h/5084-sunaina-400x400-imadpdqhhpjc6hqy.jpeg, No more colour,Rs. 699,Gallibazaar,http://www.flipkart.com/sunaina-printed-cotton-silk-sari/p/itmdpdzfvbwhnh5d?pid=SARDPDZEMFW8UEYH&srno=b_29&ref=588ff42e-93df-4ef7-afc3-d5e1145292a9,LSTSARDPDZEMFW8UEYH0CD8SZ,,<div class="item_left_column" id="description"><h3 class="item_desc_title fk-uppercase">Sunaina Printed Cotton, Silk Sari         Price: Rs.699</h3><div class="cls"></div><div class="item_desc_text line"><div style="float:right"></div>                        Peppy colors, designer trends, comfortable and a trendy look in ethnic wear. Just peep into the style quotient of popular onscreen divas following this thumb rule. You have caught us right. Vibrant shades, floral motifs, splendid stripes.        </div><div style="clear: both;"></div></div>,<div class="item_left_column" id="specifications"><h3 class="item_desc_title fk-uppercase">        Specifications of Sunaina Printed Cotton, Silk Sari    </h3><table cellspacing="0" class="fk-specs-type2"><tr><th class="group-head" colspan="2">General Details<a class="see-more unitExt rmargin10 no-underline" href="javascript:void(0);" onclick="$(this).closest('.fk-specs-type2').toggleClass('expandedMore')" title="Expand">[+]</a><a class="hidden unitExt rmargin10 no-underline" href="javascript:void(0);" onclick="$(this).closest('.fk-specs-type2').toggleClass('expandedMore')" title="Collapse">[-]</a></th></tr><tr class="hidden"><td class="specs-key">Occasion</td><td class="specs-value fk-data">Casual, Party</td></tr><tr class="hidden"><td class="specs-key">Pattern</td><td class="specs-value fk-data">Printed</td></tr></table><table cellspacing="0" class="fk-specs-type2"><tr><th class="group-head" colspan="2">Sari Details</th></tr><tr class=""><td class="specs-key">Fabric</td><td class="specs-value fk-data">Cotton, Silk</td></tr><tr class=""><td class="specs-key">Region</td><td class="specs-value fk-data">South Indian</td></tr><tr class=""><td class="specs-key">Number of Contents in Sales Package</td><td class="specs-value fk-data">Pack of 1</td></tr><tr class=""><td class="specs-key">Blouse Piece</td><td class="specs-value fk-data">Yes</td></tr></table><table cellspacing="0" class="fk-specs-type2"><tr><th class="group-head" colspan="2">Dimensions</th></tr><tr class=""><td class="specs-key">Length</td><td class="specs-value fk-data">5.5 m</td></tr></table><table cellspacing="0" class="fk-specs-type2"><tr><th class="group-head" colspan="2">In The Box</th></tr><tr class=""><td class="specs-key"> </td><td class="specs-value fk-data">Saree, Blouse Piece</td></tr></table></div>
15:02:2014,saris,Sunaina.,Sunaina Printed Silk, Synthetic Sari,Price: Not Available,http://img5a.flixcart.com/image/sari/g/9/m/18-sunaina-free-size-400x400-imadnhwb75s4fgra.jpeg, No more colour,Price: Not Available,WS Retail,http://www.flipkart.com/sunaina-printed-silk-synthetic-sari/p/itmdz65evrffxqxp?pid=SARDNHV5GZZPPG9M&srno=b_28&ref=588ff42e-93df-4ef7-afc3-d5e1145292a9,no sku defined,,<div class="item_left_column" id="description"><h3 class="item_desc_title fk-uppercase">Sunaina Printed Silk, Synthetic Sari        </h3><div class="cls"></div><div class="item_desc_text line"><div style="float:right"></div><p style="text-align: justify;">	Add a feminine touch to your ensemble by donning this <strong>white printed sari</strong> from Sunaina. The stylish ethnic wear is made from a blend of silk and synthetic that gives you a relaxed feel. Wear a trendy blouse and heels with this sari.</p> </div><div style="clear: both;"></div></div>,<div class="item_left_column" id="specifications"><h3 class="item_desc_title fk-uppercase">        Specifications of Sunaina Printed Silk, Synthetic Sari    </h3><table cellspacing="0" class="fk-specs-type2"><tr><th class="group-head" colspan="2">General Details<a class="see-more unitExt rmargin10 no-underline" href="javascript:void(0);" onclick="$(this).closest('.fk-specs-type2').toggleClass('expandedMore')" title="Expand">[+]</a><a class="hidden unitExt rmargin10 no-underline" href="javascript:void(0);" onclick="$(this).closest('.fk-specs-type2').toggleClass('expandedMore')" title="Collapse">[-]</a></th></tr><tr class="hidden"><td class="specs-key">Ideal For</td><td class="specs-value fk-data">Women's</td></tr><tr class="hidden"><td class="specs-key">Occasion</td><td class="specs-value fk-data">Casual</td></tr><tr class="hidden"><td class="specs-key">Pattern</td><td class="specs-value fk-data">Printed</td></tr></table><table cellspacing="0" class="fk-specs-type2"><tr><th class="group-head" colspan="2">Sari Details</th></tr><tr class=""><td class="specs-key">Ideal For</td><td class="specs-value fk-data">Women's</td></tr><tr class=""><td class="specs-key">Fabric</td><td class="specs-value fk-data">Silk, Synthetic</td></tr><tr class=""><td class="specs-key">Number of Contents in Sales Package</td><td class="specs-value fk-data">Pack of 1</td></tr></table><table cellspacing="0" class="fk-specs-type2"><tr><th class="group-head" colspan="2">In The Box</th></tr><tr class=""><td class="specs-key"> </td><td class="specs-value fk-data">Saree, Blouse</td></tr></table></div>
15:02:2014,saris,Sunaina.,Sunaina Printed Synthetic, Silk Sari,Rs. 649,http://img5a.flixcart.com/image/sari/d/r/f/5199-sunaina-free-size-400x400-imadnhw9mqghkh2z.jpeg, No more colour,Rs. 649,Gallibazaar,http://www.flipkart.com/sunaina-printed-synthetic-silk-sari/p/itmdz65eggtjrwgm?pid=SARDNHV5UAP4MDRF&srno=b_30&ref=588ff42e-93df-4ef7-afc3-d5e1145292a9,LSTSARDNHV5UAP4MDRFBJFBVO,,<div class="item_left_column" id="description"><h3 class="item_desc_title fk-uppercase">Sunaina Printed Synthetic, Silk Sari         Price: Rs.649</h3><div class="cls"></div><div class="item_desc_text line"><div style="float:right"></div><p>	With a halter-neck blouse and a long chain of beads to complement it, this <strong>printed silk synthetic</strong> sari from Sunaina comes in a ravishing cream and grey that will ensure that you make your presence felt in any room.</p> </div><div style="clear: both;"></div></div>,<div class="item_left_column" id="specifications"><h3 class="item_desc_title fk-uppercase">        Specifications of Sunaina Printed Synthetic, Silk Sari    </h3><table cellspacing="0" class="fk-specs-type2"><tr><th class="group-head" colspan="2">General Details<a class="see-more unitExt rmargin10 no-underline" href="javascript:void(0);" onclick="$(this).closest('.fk-specs-type2').toggleClass('expandedMore')" title="Expand">[+]</a><a class="hidden unitExt rmargin10 no-underline" href="javascript:void(0);" onclick="$(this).closest('.fk-specs-type2').toggleClass('expandedMore')" title="Collapse">[-]</a></th></tr><tr class="hidden"><td class="specs-key">Ideal For</td><td class="specs-value fk-data">Women's</td></tr><tr class="hidden"><td class="specs-key">Occasion</td><td class="specs-value fk-data">Casual</td></tr><tr class="hidden"><td class="specs-key">Pattern</td><td class="specs-value fk-data">Printed</td></tr></table><table cellspacing="0" class="fk-specs-type2"><tr><th class="group-head" colspan="2">Sari Details</th></tr><tr class=""><td class="specs-key">Ideal For</td><td class="specs-value fk-data">Women's</td></tr><tr class=""><td class="specs-key">Fabric</td><td class="specs-value fk-data">Synthetic, Silk</td></tr><tr class=""><td class="specs-key">Number of Contents in Sales Package</td><td class="specs-value fk-data">Pack of 1</td></tr></table><table cellspacing="0" class="fk-specs-type2"><tr><th class="group-head" colspan="2">In The Box</th></tr><tr class=""><td class="specs-key"> </td><td class="specs-value fk-data">Saree, Blouse</td></tr></table></div>
