15:02:2014,saris,Sunaina.,Sunaina Printed Silk, Cotton Sari,Rs. 999,http://img5a.flixcart.com/image/sari/w/k/m/7720-sunaina-400x400-imadpdqhe3q68x3d.jpeg, No more colour,Rs. 999,Gallibazaar,http://www.flipkart.com/sunaina-printed-silk-cotton-sari/p/itmdpdzfkwyyda66?pid=SARDPDZFGGYCGWKM&srno=b_41&ref=c1ffcdac-b38a-492b-9f67-9ce99fe84aa2,LSTSARDPDZFGGYCGWKMFRON4A,,<div class="item_left_column" id="description"><h3 class="item_desc_title fk-uppercase">Sunaina Printed Silk, Cotton Sari         Price: Rs.999</h3><div class="cls"></div><div class="item_desc_text line"><div style="float:right"></div>                        Peppy colors, designer trends, comfortable and a trendy look in ethnic wear. Just peep into the style quotient of popular onscreen divas following this thumb rule. You have caught us right. Vibrant shades, floral motifs, splendid stripes.        </div><div style="clear: both;"></div></div>,<div class="item_left_column" id="specifications"><h3 class="item_desc_title fk-uppercase">        Specifications of Sunaina Printed Silk, Cotton Sari    </h3><table cellspacing="0" class="fk-specs-type2"><tr><th class="group-head" colspan="2">General Details<a class="see-more unitExt rmargin10 no-underline" href="javascript:void(0);" onclick="$(this).closest('.fk-specs-type2').toggleClass('expandedMore')" title="Expand">[+]</a><a class="hidden unitExt rmargin10 no-underline" href="javascript:void(0);" onclick="$(this).closest('.fk-specs-type2').toggleClass('expandedMore')" title="Collapse">[-]</a></th></tr><tr class="hidden"><td class="specs-key">Occasion</td><td class="specs-value fk-data">Casual, Party</td></tr><tr class="hidden"><td class="specs-key">Pattern</td><td class="specs-value fk-data">Printed</td></tr></table><table cellspacing="0" class="fk-specs-type2"><tr><th class="group-head" colspan="2">Sari Details</th></tr><tr class=""><td class="specs-key">Fabric</td><td class="specs-value fk-data">Silk, Cotton</td></tr><tr class=""><td class="specs-key">Region</td><td class="specs-value fk-data">South Indian</td></tr></table><table cellspacing="0" class="fk-specs-type2"><tr><th class="group-head" colspan="2">In The Box</th></tr><tr class=""><td class="specs-key"> </td><td class="specs-value fk-data">Saree, Blouse Piece</td></tr></table></div>
15:02:2014,saris,Sunaina.,Sunaina Printed Georgette Sari,Rs. 849,http://img5a.flixcart.com/image/sari/m/q/r/7717-sunaina-400x400-imadpdqh7vh7xftt.jpeg, No more colour,Rs. 849,Gallibazaar,http://www.flipkart.com/sunaina-printed-georgette-sari/p/itmdpdzfvnzdgubw?pid=SARDPDZFXGEXKMQR&srno=b_42&ref=c1ffcdac-b38a-492b-9f67-9ce99fe84aa2,LSTSARDPDZFXGEXKMQRHP7FPP,,<div class="item_left_column" id="description"><h3 class="item_desc_title fk-uppercase">Sunaina Printed Georgette Sari         Price: Rs.849</h3><div class="cls"></div><div class="item_desc_text line"><div style="float:right"></div><p style="text-align: justify;">	Understated drama and splendour mark the beauty of this lovely printed sari from Sunaina. The <strong>contrast hued border</strong> makes this georgette sari a wardrobe solution for all occassion. Available with a matching blouse piece, style this sari with a set of bangles and earrings.</p> </div><div style="clear: both;"></div></div>,<div class="item_left_column" id="specifications"><h3 class="item_desc_title fk-uppercase">        Specifications of Sunaina Printed Georgette Sari    </h3><table cellspacing="0" class="fk-specs-type2"><tr><th class="group-head" colspan="2">General Details<a class="see-more unitExt rmargin10 no-underline" href="javascript:void(0);" onclick="$(this).closest('.fk-specs-type2').toggleClass('expandedMore')" title="Expand">[+]</a><a class="hidden unitExt rmargin10 no-underline" href="javascript:void(0);" onclick="$(this).closest('.fk-specs-type2').toggleClass('expandedMore')" title="Collapse">[-]</a></th></tr><tr class="hidden"><td class="specs-key">Occasion</td><td class="specs-value fk-data">Casual, Party</td></tr><tr class="hidden"><td class="specs-key">Pattern</td><td class="specs-value fk-data">Printed</td></tr></table><table cellspacing="0" class="fk-specs-type2"><tr><th class="group-head" colspan="2">Sari Details</th></tr><tr class=""><td class="specs-key">Fabric</td><td class="specs-value fk-data">Georgette</td></tr><tr class=""><td class="specs-key">Region</td><td class="specs-value fk-data">South Indian</td></tr></table><table cellspacing="0" class="fk-specs-type2"><tr><th class="group-head" colspan="2">In The Box</th></tr><tr class=""><td class="specs-key"> </td><td class="specs-value fk-data">Blouse Piece, Saree</td></tr></table></div>
15:02:2014,saris,Sunaina.,Sunaina Printed Silk, Cotton Sari,Rs. 1199,http://img5a.flixcart.com/image/sari/w/u/h/8542-sunaina-400x400-imadqsh5nhgafayb.jpeg, No more colour,Rs. 1199,Gallibazaar,http://www.flipkart.com/sunaina-printed-silk-cotton-sari/p/itmdqrunrhnfbyqf?pid=SARDQRUN3TQV8WUH&srno=b_44&ref=c1ffcdac-b38a-492b-9f67-9ce99fe84aa2,LSTSARDQRUN3TQV8WUH7TVWKD,,<div class="item_left_column" id="description"><h3 class="item_desc_title fk-uppercase">Sunaina Printed Silk, Cotton Sari         Price: Rs.1199</h3><div class="cls"></div><div class="item_desc_text line"><div style="float:right"></div>                        Peppy colors, designer trends, comfortable and a trendy look in ethnic wear. Just peep into the style quotient of popular onscreen divas following this thumb rule. You have caught us right. Vibrant shades, floral motifs, splendid stripes.        </div><div style="clear: both;"></div></div>,<div class="item_left_column" id="specifications"><h3 class="item_desc_title fk-uppercase">        Specifications of Sunaina Printed Silk, Cotton Sari    </h3><table cellspacing="0" class="fk-specs-type2"><tr><th class="group-head" colspan="2">General Details<a class="see-more unitExt rmargin10 no-underline" href="javascript:void(0);" onclick="$(this).closest('.fk-specs-type2').toggleClass('expandedMore')" title="Expand">[+]</a><a class="hidden unitExt rmargin10 no-underline" href="javascript:void(0);" onclick="$(this).closest('.fk-specs-type2').toggleClass('expandedMore')" title="Collapse">[-]</a></th></tr><tr class="hidden"><td class="specs-key">Occasion</td><td class="specs-value fk-data">Wedding, Casual, Party</td></tr><tr class="hidden"><td class="specs-key">Pattern</td><td class="specs-value fk-data">Printed</td></tr></table><table cellspacing="0" class="fk-specs-type2"><tr><th class="group-head" colspan="2">Sari Details</th></tr><tr class=""><td class="specs-key">Fabric</td><td class="specs-value fk-data">Silk, Cotton</td></tr></table><table cellspacing="0" class="fk-specs-type2"><tr><th class="group-head" colspan="2">In The Box</th></tr><tr class=""><td class="specs-key"> </td><td class="specs-value fk-data">Saree, Blouse Piece</td></tr></table></div>
15:02:2014,saris,Sunaina.,Sunaina Printed Cotton, Silk Sari,Rs. 1199,http://img5a.flixcart.com/image/sari/6/p/s/8509-sunaina-400x400-imadqsh5gqzfa8kn.jpeg, No more colour,Rs. 1199,Gallibazaar,http://www.flipkart.com/sunaina-printed-cotton-silk-sari/p/itmdqrunhbkknyrk?pid=SARDQRUN5ZJFR6PS&srno=b_46&ref=0863ded5-58b8-4355-9ab6-49326e56e1b1,LSTSARDQRUN5ZJFR6PSQKKZKB,,<div class="item_left_column" id="description"><h3 class="item_desc_title fk-uppercase">Sunaina Printed Cotton, Silk Sari         Price: Rs.1199</h3><div class="cls"></div><div class="item_desc_text line"><div style="float:right"></div>                        Peppy colors, designer trends, comfortable and a trendy look in ethnic wear. Just peep into the style quotient of popular onscreen divas following this thumb rule. You have caught us right. Vibrant shades, floral motifs, splendid stripes.        </div><div style="clear: both;"></div></div>,<div class="item_left_column" id="specifications"><h3 class="item_desc_title fk-uppercase">        Specifications of Sunaina Printed Cotton, Silk Sari    </h3><table cellspacing="0" class="fk-specs-type2"><tr><th class="group-head" colspan="2">General Details<a class="see-more unitExt rmargin10 no-underline" href="javascript:void(0);" onclick="$(this).closest('.fk-specs-type2').toggleClass('expandedMore')" title="Expand">[+]</a><a class="hidden unitExt rmargin10 no-underline" href="javascript:void(0);" onclick="$(this).closest('.fk-specs-type2').toggleClass('expandedMore')" title="Collapse">[-]</a></th></tr><tr class="hidden"><td class="specs-key">Occasion</td><td class="specs-value fk-data">Casual, Party</td></tr><tr class="hidden"><td class="specs-key">Pattern</td><td class="specs-value fk-data">Printed</td></tr></table><table cellspacing="0" class="fk-specs-type2"><tr><th class="group-head" colspan="2">Sari Details</th></tr><tr class=""><td class="specs-key">Fabric</td><td class="specs-value fk-data">Cotton, Silk</td></tr></table><table cellspacing="0" class="fk-specs-type2"><tr><th class="group-head" colspan="2">In The Box</th></tr><tr class=""><td class="specs-key"> </td><td class="specs-value fk-data">Blouse Piece, Saree</td></tr></table></div>
15:02:2014,saris,Sunaina.,Sunaina Printed Cotton, Silk Sari,Rs. 1199,http://img5a.flixcart.com/image/sari/f/n/w/8533-sunaina-400x400-imadqsh8tdvu9d7j.jpeg, No more colour,Rs. 1199,Gallibazaar,http://www.flipkart.com/sunaina-printed-cotton-silk-sari/p/itmdqrunc9ak79bz?pid=SARDQRUNFJ9X8FNW&srno=b_45&ref=c1ffcdac-b38a-492b-9f67-9ce99fe84aa2,LSTSARDQRUNFJ9X8FNW5K2OH0,,<div class="item_left_column" id="description"><h3 class="item_desc_title fk-uppercase">Sunaina Printed Cotton, Silk Sari         Price: Rs.1199</h3><div class="cls"></div><div class="item_desc_text line"><div style="float:right"></div>                        Peppy colors, designer trends, comfortable and a trendy look in ethnic wear. Just peep into the style quotient of popular onscreen divas following this thumb rule. You have caught us right. Vibrant shades, floral motifs, splendid stripes.        </div><div style="clear: both;"></div></div>,<div class="item_left_column" id="specifications"><h3 class="item_desc_title fk-uppercase">        Specifications of Sunaina Printed Cotton, Silk Sari    </h3><table cellspacing="0" class="fk-specs-type2"><tr><th class="group-head" colspan="2">General Details<a class="see-more unitExt rmargin10 no-underline" href="javascript:void(0);" onclick="$(this).closest('.fk-specs-type2').toggleClass('expandedMore')" title="Expand">[+]</a><a class="hidden unitExt rmargin10 no-underline" href="javascript:void(0);" onclick="$(this).closest('.fk-specs-type2').toggleClass('expandedMore')" title="Collapse">[-]</a></th></tr><tr class="hidden"><td class="specs-key">Occasion</td><td class="specs-value fk-data">Party, Wedding, Casual</td></tr><tr class="hidden"><td class="specs-key">Pattern</td><td class="specs-value fk-data">Printed</td></tr></table><table cellspacing="0" class="fk-specs-type2"><tr><th class="group-head" colspan="2">Sari Details</th></tr><tr class=""><td class="specs-key">Fabric</td><td class="specs-value fk-data">Cotton, Silk</td></tr></table><table cellspacing="0" class="fk-specs-type2"><tr><th class="group-head" colspan="2">In The Box</th></tr><tr class=""><td class="specs-key"> </td><td class="specs-value fk-data">Saree, Blouse Piece</td></tr></table></div>
15:02:2014,saris,Sunaina.,Sunaina Printed Cotton, Silk Sari,Rs. 1199,http://img6a.flixcart.com/image/sari/r/8/d/8529-sunaina-400x400-imadqsh8pgzzsuqd.jpeg, No more colour,Rs. 1199,Gallibazaar,http://www.flipkart.com/sunaina-printed-cotton-silk-sari/p/itmdqrungh5utkzz?pid=SARDQRUNZYQCRR8D&srno=b_43&ref=c1ffcdac-b38a-492b-9f67-9ce99fe84aa2,LSTSARDQRUNZYQCRR8DC5XB8R,,<div class="item_left_column" id="description"><h3 class="item_desc_title fk-uppercase">Sunaina Printed Cotton, Silk Sari         Price: Rs.1199</h3><div class="cls"></div><div class="item_desc_text line"><div style="float:right"></div>                        Peppy colors, designer trends, comfortable and a trendy look in ethnic wear. Just peep into the style quotient of popular onscreen divas following this thumb rule. You have caught us right. Vibrant shades, floral motifs, splendid stripes.        </div><div style="clear: both;"></div></div>,<div class="item_left_column" id="specifications"><h3 class="item_desc_title fk-uppercase">        Specifications of Sunaina Printed Cotton, Silk Sari    </h3><table cellspacing="0" class="fk-specs-type2"><tr><th class="group-head" colspan="2">General Details<a class="see-more unitExt rmargin10 no-underline" href="javascript:void(0);" onclick="$(this).closest('.fk-specs-type2').toggleClass('expandedMore')" title="Expand">[+]</a><a class="hidden unitExt rmargin10 no-underline" href="javascript:void(0);" onclick="$(this).closest('.fk-specs-type2').toggleClass('expandedMore')" title="Collapse">[-]</a></th></tr><tr class="hidden"><td class="specs-key">Occasion</td><td class="specs-value fk-data">Casual, Party, Wedding</td></tr><tr class="hidden"><td class="specs-key">Pattern</td><td class="specs-value fk-data">Printed</td></tr></table><table cellspacing="0" class="fk-specs-type2"><tr><th class="group-head" colspan="2">Sari Details</th></tr><tr class=""><td class="specs-key">Fabric</td><td class="specs-value fk-data">Cotton, Silk</td></tr></table><table cellspacing="0" class="fk-specs-type2"><tr><th class="group-head" colspan="2">In The Box</th></tr><tr class=""><td class="specs-key"> </td><td class="specs-value fk-data">Blouse Piece, Saree</td></tr></table></div>
15:02:2014,saris,Sunaina.,Sunaina Printed Synthetic, Silk Sari,Rs. 649,http://img5a.flixcart.com/image/sari/u/w/s/18173-sunaina-free-size-400x400-imadnhwadgureggd.jpeg, No more colour,Rs. 649,Gallibazaar,http://www.flipkart.com/sunaina-printed-synthetic-silk-sari/p/itmdz65etwfw9eg9?pid=SARDNHV5EPFARUWS&srno=b_47&ref=0863ded5-58b8-4355-9ab6-49326e56e1b1,LSTSARDNHV5EPFARUWSFEPFJP,,<div class="item_left_column" id="description"><h3 class="item_desc_title fk-uppercase">Sunaina Printed Synthetic, Silk Sari         Price: Rs.649</h3><div class="cls"></div><div class="item_desc_text line"><div style="float:right"></div><p>	Green with a contrasting purple border and silver accents, this sari from Sunaina is crafted out of <strong>printed silk</strong>. Complement the synthetic sari with a pair of silver strappy sandals and chunky black metal jewelry to ensure that all eyes are on you as you walk in.</p> </div><div style="clear: both;"></div></div>,<div class="item_left_column" id="specifications"><h3 class="item_desc_title fk-uppercase">        Specifications of Sunaina Printed Synthetic, Silk Sari    </h3><table cellspacing="0" class="fk-specs-type2"><tr><th class="group-head" colspan="2">General Details<a class="see-more unitExt rmargin10 no-underline" href="javascript:void(0);" onclick="$(this).closest('.fk-specs-type2').toggleClass('expandedMore')" title="Expand">[+]</a><a class="hidden unitExt rmargin10 no-underline" href="javascript:void(0);" onclick="$(this).closest('.fk-specs-type2').toggleClass('expandedMore')" title="Collapse">[-]</a></th></tr><tr class="hidden"><td class="specs-key">Ideal For</td><td class="specs-value fk-data">Women's</td></tr><tr class="hidden"><td class="specs-key">Occasion</td><td class="specs-value fk-data">Casual</td></tr><tr class="hidden"><td class="specs-key">Pattern</td><td class="specs-value fk-data">Printed</td></tr></table><table cellspacing="0" class="fk-specs-type2"><tr><th class="group-head" colspan="2">Sari Details</th></tr><tr class=""><td class="specs-key">Ideal For</td><td class="specs-value fk-data">Women's</td></tr><tr class=""><td class="specs-key">Fabric</td><td class="specs-value fk-data">Synthetic, Silk</td></tr><tr class=""><td class="specs-key">Number of Contents in Sales Package</td><td class="specs-value fk-data">Pack of 1</td></tr></table><table cellspacing="0" class="fk-specs-type2"><tr><th class="group-head" colspan="2">In The Box</th></tr><tr class=""><td class="specs-key"> </td><td class="specs-value fk-data">Saree, Blouse</td></tr></table></div>
15:02:2014,saris,Sunaina.,Sunaina Printed Cotton, Silk Sari,Rs. 1199,http://img5a.flixcart.com/image/sari/u/q/b/8510-sunaina-400x400-imadqsh5ywdemjgg.jpeg, No more colour,Rs. 1199,Gallibazaar,http://www.flipkart.com/sunaina-printed-cotton-silk-sari/p/itmdqrunfg56yrzg?pid=SARDQRUNNGZKYUQB&srno=b_48&ref=0863ded5-58b8-4355-9ab6-49326e56e1b1,LSTSARDQRUNNGZKYUQB5VRO9W,,<div class="item_left_column" id="description"><h3 class="item_desc_title fk-uppercase">Sunaina Printed Cotton, Silk Sari         Price: Rs.1199</h3><div class="cls"></div><div class="item_desc_text line"><div style="float:right"></div>                        Peppy colors, designer trends, comfortable and a trendy look in ethnic wear. Just peep into the style quotient of popular onscreen divas following this thumb rule. You have caught us right. Vibrant shades, floral motifs, splendid stripes.        </div><div style="clear: both;"></div></div>,<div class="item_left_column" id="specifications"><h3 class="item_desc_title fk-uppercase">        Specifications of Sunaina Printed Cotton, Silk Sari    </h3><table cellspacing="0" class="fk-specs-type2"><tr><th class="group-head" colspan="2">General Details<a class="see-more unitExt rmargin10 no-underline" href="javascript:void(0);" onclick="$(this).closest('.fk-specs-type2').toggleClass('expandedMore')" title="Expand">[+]</a><a class="hidden unitExt rmargin10 no-underline" href="javascript:void(0);" onclick="$(this).closest('.fk-specs-type2').toggleClass('expandedMore')" title="Collapse">[-]</a></th></tr><tr class="hidden"><td class="specs-key">Occasion</td><td class="specs-value fk-data">Party, Casual</td></tr><tr class="hidden"><td class="specs-key">Pattern</td><td class="specs-value fk-data">Printed</td></tr></table><table cellspacing="0" class="fk-specs-type2"><tr><th class="group-head" colspan="2">Sari Details</th></tr><tr class=""><td class="specs-key">Fabric</td><td class="specs-value fk-data">Cotton, Silk</td></tr></table><table cellspacing="0" class="fk-specs-type2"><tr><th class="group-head" colspan="2">In The Box</th></tr><tr class=""><td class="specs-key"> </td><td class="specs-value fk-data">Saree, Blouse Piece</td></tr></table></div>
15:02:2014,saris,Sunaina.,Sunaina Printed Silk, Cotton Sari,Rs. 799,http://img5a.flixcart.com/image/sari/e/g/y/5055-sunaina-400x400-imadpdqh2jq4w5hh.jpeg, No more colour,Rs. 799,Gallibazaar,http://www.flipkart.com/sunaina-printed-silk-cotton-sari/p/itmdpdzfva5q2njk?pid=SARDPDZEE2JX5EGY&srno=b_49&ref=0863ded5-58b8-4355-9ab6-49326e56e1b1,LSTSARDPDZEE2JX5EGYDLB1EX,,<div class="item_left_column" id="description"><h3 class="item_desc_title fk-uppercase">Sunaina Printed Silk, Cotton Sari         Price: Rs.799</h3><div class="cls"></div><div class="item_desc_text line"><div style="float:right"></div>                        Peppy colors, designer trends, comfortable and a trendy look in ethnic wear. Just peep into the style quotient of popular onscreen divas following this thumb rule. You have caught us right. Vibrant shades, floral motifs, splendid stripes.        </div><div style="clear: both;"></div></div>,<div class="item_left_column" id="specifications"><h3 class="item_desc_title fk-uppercase">        Specifications of Sunaina Printed Silk, Cotton Sari    </h3><table cellspacing="0" class="fk-specs-type2"><tr><th class="group-head" colspan="2">General Details<a class="see-more unitExt rmargin10 no-underline" href="javascript:void(0);" onclick="$(this).closest('.fk-specs-type2').toggleClass('expandedMore')" title="Expand">[+]</a><a class="hidden unitExt rmargin10 no-underline" href="javascript:void(0);" onclick="$(this).closest('.fk-specs-type2').toggleClass('expandedMore')" title="Collapse">[-]</a></th></tr><tr class="hidden"><td class="specs-key">Occasion</td><td class="specs-value fk-data">Casual, Party</td></tr><tr class="hidden"><td class="specs-key">Pattern</td><td class="specs-value fk-data">Printed</td></tr></table><table cellspacing="0" class="fk-specs-type2"><tr><th class="group-head" colspan="2">Sari Details</th></tr><tr class=""><td class="specs-key">Fabric</td><td class="specs-value fk-data">Silk, Cotton</td></tr><tr class=""><td class="specs-key">Region</td><td class="specs-value fk-data">South Indian</td></tr><tr class=""><td class="specs-key">Number of Contents in Sales Package</td><td class="specs-value fk-data">Pack of 1</td></tr><tr class=""><td class="specs-key">Blouse Piece</td><td class="specs-value fk-data">Yes</td></tr></table><table cellspacing="0" class="fk-specs-type2"><tr><th class="group-head" colspan="2">Dimensions</th></tr><tr class=""><td class="specs-key">Length</td><td class="specs-value fk-data">5.5 m</td></tr></table><table cellspacing="0" class="fk-specs-type2"><tr><th class="group-head" colspan="2">In The Box</th></tr><tr class=""><td class="specs-key"> </td><td class="specs-value fk-data">Blouse Piece, Saree</td></tr></table></div>
15:02:2014,saris,Sunaina.,Sunaina Printed Cotton, Silk Sari,Rs. 1199,http://img6a.flixcart.com/image/sari/8/s/w/8511-sunaina-400x400-imadqsh5whwepadx.jpeg, No more colour,Rs. 1199,Gallibazaar,http://www.flipkart.com/sunaina-printed-cotton-silk-sari/p/itmdqrunrqmz5dsa?pid=SARDQRUNJGECC8SW&srno=b_50&ref=0863ded5-58b8-4355-9ab6-49326e56e1b1,LSTSARDQRUNJGECC8SWCRHOUL,,<div class="item_left_column" id="description"><h3 class="item_desc_title fk-uppercase">Sunaina Printed Cotton, Silk Sari         Price: Rs.1199</h3><div class="cls"></div><div class="item_desc_text line"><div style="float:right"></div>                        Peppy colors, designer trends, comfortable and a trendy look in ethnic wear. Just peep into the style quotient of popular onscreen divas following this thumb rule. You have caught us right. Vibrant shades, floral motifs, splendid stripes.        </div><div style="clear: both;"></div></div>,<div class="item_left_column" id="specifications"><h3 class="item_desc_title fk-uppercase">        Specifications of Sunaina Printed Cotton, Silk Sari    </h3><table cellspacing="0" class="fk-specs-type2"><tr><th class="group-head" colspan="2">General Details<a class="see-more unitExt rmargin10 no-underline" href="javascript:void(0);" onclick="$(this).closest('.fk-specs-type2').toggleClass('expandedMore')" title="Expand">[+]</a><a class="hidden unitExt rmargin10 no-underline" href="javascript:void(0);" onclick="$(this).closest('.fk-specs-type2').toggleClass('expandedMore')" title="Collapse">[-]</a></th></tr><tr class="hidden"><td class="specs-key">Occasion</td><td class="specs-value fk-data">Party, Casual</td></tr><tr class="hidden"><td class="specs-key">Pattern</td><td class="specs-value fk-data">Printed</td></tr></table><table cellspacing="0" class="fk-specs-type2"><tr><th class="group-head" colspan="2">Sari Details</th></tr><tr class=""><td class="specs-key">Fabric</td><td class="specs-value fk-data">Cotton, Silk</td></tr></table><table cellspacing="0" class="fk-specs-type2"><tr><th class="group-head" colspan="2">In The Box</th></tr><tr class=""><td class="specs-key"> </td><td class="specs-value fk-data">Blouse Piece, Saree</td></tr></table></div>
15:02:2014,saris,Sunaina.,Sunaina Printed Cotton, Silk Sari,Rs. 1199,http://img6a.flixcart.com/image/sari/b/g/d/8537-sunaina-400x400-imadqsh6qjmnqmsf.jpeg, No more colour,Rs. 1199,Gallibazaar,http://www.flipkart.com/sunaina-printed-cotton-silk-sari/p/itmdqrunq6byzbtd?pid=SARDQRUNJJDYNBGD&srno=b_53&ref=0863ded5-58b8-4355-9ab6-49326e56e1b1,LSTSARDQRUNJJDYNBGDVIROIU,,<div class="item_left_column" id="description"><h3 class="item_desc_title fk-uppercase">Sunaina Printed Cotton, Silk Sari         Price: Rs.1199</h3><div class="cls"></div><div class="item_desc_text line"><div style="float:right"></div>                        Peppy colors, designer trends, comfortable and a trendy look in ethnic wear. Just peep into the style quotient of popular onscreen divas following this thumb rule. You have caught us right. Vibrant shades, floral motifs, splendid stripes.        </div><div style="clear: both;"></div></div>,<div class="item_left_column" id="specifications"><h3 class="item_desc_title fk-uppercase">        Specifications of Sunaina Printed Cotton, Silk Sari    </h3><table cellspacing="0" class="fk-specs-type2"><tr><th class="group-head" colspan="2">General Details<a class="see-more unitExt rmargin10 no-underline" href="javascript:void(0);" onclick="$(this).closest('.fk-specs-type2').toggleClass('expandedMore')" title="Expand">[+]</a><a class="hidden unitExt rmargin10 no-underline" href="javascript:void(0);" onclick="$(this).closest('.fk-specs-type2').toggleClass('expandedMore')" title="Collapse">[-]</a></th></tr><tr class="hidden"><td class="specs-key">Occasion</td><td class="specs-value fk-data">Party, Wedding, Casual</td></tr><tr class="hidden"><td class="specs-key">Pattern</td><td class="specs-value fk-data">Printed</td></tr></table><table cellspacing="0" class="fk-specs-type2"><tr><th class="group-head" colspan="2">Sari Details</th></tr><tr class=""><td class="specs-key">Fabric</td><td class="specs-value fk-data">Cotton, Silk</td></tr></table><table cellspacing="0" class="fk-specs-type2"><tr><th class="group-head" colspan="2">In The Box</th></tr><tr class=""><td class="specs-key"> </td><td class="specs-value fk-data">Blouse Piece, Saree</td></tr></table></div>
