LSTWATDJ3V6TB59YMZVDTZQLN,Marc Ecko The Collegiate Analog Watch  - For Women  Men,http://www.flipkart.com/watches/women?otracker=hp_nmenu_sub_women_1_Watches,Rs. 5465,Watches,Watches,Marc Ecko,http://img6a.flixcart.com/image/watch/m/z/v/e11596g3-marc-ecko-400x400-imadjhjmctfzyhnd.jpeg,Rs. 6210,None,women,http://www.flipkart.com/marc-ecko-collegiate-analog-watch-women-men/p/itmdj3xdkhd3xvaz?pid=WATDJ3V6TB59YMZV&srno=b_9&ref=436fd84d-2b17-4084-8319-96f5349bdfdd,Watch,Marc Ecko The Collegiate Analog Watch - For Women  Men - Buy Marc Ecko The Collegiate Analog Watch - For Women  Men E11596G3 Online at Best Prices in India | Flipkart.com,Marc Ecko The Collegiate Analog Watch - For Women  Men - Buy Marc Ecko The Collegiate Analog Watch - For Women  Men E11596G3 Online at Rs.5465 in India Only at Flipkart.com. Black Strap  Round Dial - Great Discounts,[],<div class="item_left_column" id="description"> <h3 class="item_desc_title fk-uppercase">Marc Ecko The Collegiate Analog Watch  - For Women  Men (Black)         Price: Rs.5465</h3> <div class="cls"></div> <div class="item_desc_text line"> <div style="float:right"> </div> <h3><b> Key Features </b></h3> <div class="line bmargin10"> <ul class="feature_bullet"> <li><span>Black Strap</span></li><li><span>Round Dial</span></li> </ul> </div> <p style="text-align: justify;">   Watches represent the kind of person you are while also telling people why you are not part of the herd. This is why a lot of thought must go into choosing each watch for your collection and pairing them with the right outfits for the right occasions. <strong>The Collegiate collection of watches</strong> is designed to bring out the stylish side in the wearer and highlight their uniqueness. Turn on the heat with this <strong>Marc Ecko The Collegiate Analog Unisex Watch</strong>; its analog dial is classy and sleek and the watch paired with any dress to elicit a few compliments.</p> <p style="text-align: justify;"> <strong>Body and Design</strong></p> <p style="text-align: justify;">   The Marc Ecko analog wristwatch of The Collegiate series is also equipped with a <strong>canvas strap</strong> that makes the timepiece a pleasurable wear. Moreover  the strap makes sure that the chic timepiece has the right grip on your wrist. The dark-coloured strap will take care of your comfort when you wear this watch for prolonged durations of time.</p> <p style="text-align: justify;">   The <strong>round dial </strong>of the dainty time wear sports a tidy look. The charm of the watch face is highlighted in the brightly-coloured watch hands that provide a contrast to the dark background of the timepiece. The dial of the watch is encased in an <strong>ion-plated case</strong> which looks both balanced and solid. Stride around with an air of confidence that the <strong>unisex analog watch from Marc Ecko </strong>exudes and be showered with admiration and accolades from others.</p> </div> <div style="clear: both;"></div> </div>,<div class="item_left_column" id="specifications"> <h3 class="item_desc_title fk-uppercase">         Specifications of Marc Ecko The Collegiate Analog Watch  - For Women  Men (Black)    </h3> <table cellspacing="0" class="fk-specs-type2"> <tr> <th class="group-head" colspan="2">General</th> </tr> <tr class=""> <td class="specs-key">Type</td> <td class="specs-value fk-data">Analog</td> </tr> <tr class=""> <td class="specs-key">Series</td> <td class="specs-value fk-data">The Collegiate</td> </tr> <tr class=""> <td class="specs-key">Ideal For</td> <td class="specs-value fk-data">Women  Men</td> </tr> <tr class=""> <td class="specs-key">Style Code</td> <td class="specs-value fk-data">E11596G3</td> </tr> </table> <table cellspacing="0" class="fk-specs-type2"> <tr> <th class="group-head" colspan="2">Body Features</th> </tr> <tr class=""> <td class="specs-key">Strap Material</td> <td class="specs-value fk-data">Canvas Strap</td> </tr> <tr class=""> <td class="specs-key">Strap Color</td> <td class="specs-value fk-data">Black</td> </tr> <tr class=""> <td class="specs-key">Dial Color</td> <td class="specs-value fk-data">Black</td> </tr> <tr class=""> <td class="specs-key">Dial Shape</td> <td class="specs-value fk-data">Round</td> </tr> <tr class=""> <td class="specs-key">Other Body Features</td> <td class="specs-value fk-data">Ion-plated Case</td> </tr> </table> </div>,10:03:2014,None
LSTWATDJ3V68QNZX5AZIVFTNZ,Marc Ecko The Zero G Analog Watch  - For Men  Women,http://www.flipkart.com/watches/women?otracker=hp_nmenu_sub_women_1_Watches,Rs. 1995,Watches,Watches,Marc Ecko,http://img5a.flixcart.com/image/watch/5/a/z/e08513g6-marc-ecko-400x400-imadjhjmbbgnum8g.jpeg,Rs. 4990,None,women,http://www.flipkart.com/marc-ecko-zero-g-analog-watch-men-women/p/itmdj3xcdf4xdrvg?pid=WATDJ3V68QNZX5AZ&srno=b_4&ref=3fe41401-8087-4e07-b10a-c3124de035c6,WS Retail,Marc Ecko The Zero G Analog Watch - For Men  Women - Buy Marc Ecko The Zero G Analog Watch - For Men  Women E08513G6 Online at Best Prices in India | Flipkart.com,Marc Ecko The Zero G Analog Watch - For Men  Women - Buy Marc Ecko The Zero G Analog Watch - For Men  Women E08513G6 Online at Rs.1995 in India Only at Flipkart.com. Plastic Case  Square Dial  Black Strap - Great,[],<div class="item_left_column" id="description"> <h3 class="item_desc_title fk-uppercase">Marc Ecko The Zero G Analog Watch  - For Men  Women (Black)         Price: Rs.1995</h3> <div class="cls"></div> <div class="item_desc_text line"> <div style="float:right"> </div> <h3><b> Key Features </b></h3> <div class="line bmargin10"> <ul class="feature_bullet"> <li><span>Plastic Case</span></li><li><span>Square Dial</span></li><li><span>Black Strap</span></li> </ul> </div> <p style="text-align: justify;">   Beyond the luxury car and your classic laptop  something that grabs attention when are at a business conference is this The Zero G Analog Watch - For Men  Women from Marc Ecko . When you sign those important documents  this<strong> Marc Ecko The Zero G Analog Watch - For Men  Women</strong> never goes unnoticed because of its magnificent charm. The<strong> Zero G series</strong> watch from Marc Ecko is perfect for all those men and women craving to add a tinge of glamour to their wrist. You can team this watch with your formal attire and get that professional look.</p> <p style="text-align: justify;"> <strong>Body and Design</strong></p> <p style="text-align: justify;">   This Analog Watch is designed with a<strong> square dial</strong> that looks brilliant on every man’s wrist. Crafted with a <strong>silicone strap</strong>  this Analog Watch effortlessly lends a stylish appeal. This Analog Watch is durable and rust resistant as the <strong>plastic case</strong> protects the internal components of the watch. This Analog Watch is sturdy enough to keep the timepiece fastened around your wrist for prolonged hours  without the slightest discomfort. With the impeccable clarity this offers  you can easily view time within a blink of an eye. This Marc Ecko watch will prove to be a worthwhile addition to your collection of watches.</p> </div> <div style="clear: both;"></div> </div>,<div class="item_left_column" id="specifications"> <h3 class="item_desc_title fk-uppercase">         Specifications of Marc Ecko The Zero G Analog Watch  - For Men  Women (Black)    </h3> <table cellspacing="0" class="fk-specs-type2"> <tr> <th class="group-head" colspan="2">General</th> </tr> <tr class=""> <td class="specs-key">Type</td> <td class="specs-value fk-data">Analog</td> </tr> <tr class=""> <td class="specs-key">Series</td> <td class="specs-value fk-data">The Zero G</td> </tr> <tr class=""> <td class="specs-key">Ideal For</td> <td class="specs-value fk-data">Men  Women</td> </tr> <tr class=""> <td class="specs-key">Style Code</td> <td class="specs-value fk-data">E08513G6</td> </tr> </table> <table cellspacing="0" class="fk-specs-type2"> <tr> <th class="group-head" colspan="2">Body Features</th> </tr> <tr class=""> <td class="specs-key">Strap Material</td> <td class="specs-value fk-data">Silicone Strap</td> </tr> <tr class=""> <td class="specs-key">Strap Color</td> <td class="specs-value fk-data">Black</td> </tr> <tr class=""> <td class="specs-key">Case / Bezel Material</td> <td class="specs-value fk-data">Plastic Case</td> </tr> <tr class=""> <td class="specs-key">Dial Color</td> <td class="specs-value fk-data">Black</td> </tr> <tr class=""> <td class="specs-key">Dial Shape</td> <td class="specs-value fk-data">Square</td> </tr> </table> <table cellspacing="0" class="fk-specs-type2"> <tr> <th class="group-head" colspan="2">Warranty</th> </tr> <tr class=""> <td class="specs-key"> </td> <td class="specs-value fk-data">1 Year Domestic Warranty</td> </tr> </table> </div>,10:03:2014,None
LSTWATDJ3V6ZJETQCHRDEG6KG,Marc Ecko The Encore Oz Analog Watch  - For Women  Men,http://www.flipkart.com/watches/women?otracker=hp_nmenu_sub_women_1_Watches,Rs. 1620,Watches,Watches,Marc Ecko,http://img6a.flixcart.com/image/watch/c/h/r/e07502g3-marc-ecko-400x400-imadjhk4tbagpxpf.jpeg,Rs. 4050,None,women,http://www.flipkart.com/marc-ecko-encore-oz-analog-watch-women-men/p/itmdj3xchsxwep5c?pid=WATDJ3V6ZJETQCHR&srno=b_5&ref=3fe41401-8087-4e07-b10a-c3124de035c6,WS Retail,Marc Ecko The Encore Oz Analog Watch - For Women  Men - Buy Marc Ecko The Encore Oz Analog Watch - For Women  Men E07502G3 Online at Best Prices in India | Flipkart.com,Marc Ecko The Encore Oz Analog Watch - For Women  Men - Buy Marc Ecko The Encore Oz Analog Watch - For Women  Men E07502G3 Online at Rs.1620 in India Only at Flipkart.com. Stainless Steel Case  Water Resistant  Black,[],<div class="item_left_column" id="description"> <h3 class="item_desc_title fk-uppercase">Marc Ecko The Encore Oz Analog Watch  - For Women  Men (Black)         Price: Rs.1620</h3> <div class="cls"></div> <div class="item_desc_text line"> <div style="float:right"> </div> <h3><b> Key Features </b></h3> <div class="line bmargin10"> <ul class="feature_bullet"> <li><span>Stainless Steel Case</span></li><li><span>Water Resistant</span></li><li><span>Black Strap</span></li><li><span>Round Dial</span></li> </ul> </div> <p style="text-align: justify;">   For a perfect look you need the right accessories to suit your persona. Marc Ecko brings to you this he Encore Oz Analog Watch - For Women  Men to complement your trendy appearance. Be it for a casual outing with your friends or for a formal dinner  this <strong>Marc Ecko The Encore Oz Analog Watch - For Women </strong> Men infuses an extra charm into your personality. The Encore Oz series from Marc Ecko is perfect for all those men and women on the lookout for a stylish watch.</p> <p style="text-align: justify;"> <strong>Body and Design</strong></p> <p style="text-align: justify;">   This watch is designed with a <strong>round dial </strong>that looks brilliant on every wrist. Also  this watch is crafted with a<strong> leather strap </strong>that provides extreme comfort and style. Also  leather is known for its breathability and keeps your skin safe during any climatic condition. The stainless steel case protects the internal components of the watch  thereby making it durable and rust resistant. Without much of an effort and strain you can view time  as this Analog Watch offers impeccable clarity.</p> <p style="text-align: justify;"> <strong>Function and Other Features</strong></p> <p style="text-align: justify;">   This watch is designed to be <strong>water-resistant </strong> making it a perfect accessory that you can wear even while you go for a beach party. You can now adorn your wrist with this The Encore Oz Analog Watch from Marc Ecko.</p> </div> <div style="clear: both;"></div> </div>,<div class="item_left_column" id="specifications"> <h3 class="item_desc_title fk-uppercase">         Specifications of Marc Ecko The Encore Oz Analog Watch  - For Women  Men (Black)    </h3> <table cellspacing="0" class="fk-specs-type2"> <tr> <th class="group-head" colspan="2">General</th> </tr> <tr class=""> <td class="specs-key">Type</td> <td class="specs-value fk-data">Analog</td> </tr> <tr class=""> <td class="specs-key">Series</td> <td class="specs-value fk-data">The Encore Oz</td> </tr> <tr class=""> <td class="specs-key">Ideal For</td> <td class="specs-value fk-data">Women  Men</td> </tr> <tr class=""> <td class="specs-key">Style Code</td> <td class="specs-value fk-data">E07502G3</td> </tr> </table> <table cellspacing="0" class="fk-specs-type2"> <tr> <th class="group-head" colspan="2">Body Features</th> </tr> <tr class=""> <td class="specs-key">Strap Material</td> <td class="specs-value fk-data">Leather Strap</td> </tr> <tr class=""> <td class="specs-key">Strap Color</td> <td class="specs-value fk-data">Black</td> </tr> <tr class=""> <td class="specs-key">Case / Bezel Material</td> <td class="specs-value fk-data">Stainless Steel Case</td> </tr> <tr class=""> <td class="specs-key">Dial Color</td> <td class="specs-value fk-data">Multicolor</td> </tr> <tr class=""> <td class="specs-key">Dial Shape</td> <td class="specs-value fk-data">Round</td> </tr> <tr class=""> <td class="specs-key">Water Resistant</td> <td class="specs-value fk-data">Yes</td> </tr> <tr class=""> <td class="specs-key">Other Body Features</td> <td class="specs-value fk-data">Silver Color Case</td> </tr> </table> <table cellspacing="0" class="fk-specs-type2"> <tr> <th class="group-head" colspan="2">Warranty</th> </tr> <tr class=""> <td class="specs-key"> </td> <td class="specs-value fk-data">1 Year Domestic Warranty</td> </tr> </table> </div>,10:03:2014,None
LSTWATDJ3V6H4BZ3U7JGBTWTP,Marc Ecko The Utmost Analog Watch  - For Men  Women,http://www.flipkart.com/watches/women?otracker=hp_nmenu_sub_women_1_Watches,Rs. 5465,Watches,Watches,Marc Ecko,http://img6a.flixcart.com/image/watch/u/7/j/e11524g1-marc-ecko-400x400-imadjhjmfmheacnw.jpeg,Rs. 6210,None,women,http://www.flipkart.com/marc-ecko-utmost-analog-watch-men-women/p/itmdj3xdhnqtpy9u?pid=WATDJ3V6H4BZ3U7J&srno=b_17&ref=bbb85499-8d36-4673-9828-db1046decfa6,Watch,Marc Ecko The Utmost Analog Watch - For Men  Women - Buy Marc Ecko The Utmost Analog Watch - For Men  Women E11524G1 Online at Best Prices in India | Flipkart.com,Marc Ecko The Utmost Analog Watch - For Men  Women - Buy Marc Ecko The Utmost Analog Watch - For Men  Women E11524G1 Online at Rs.5465 in India Only at Flipkart.com. Stainless Steel Case  Stainless Steel Bezel  Round,[],<div class="item_left_column" id="description"> <h3 class="item_desc_title fk-uppercase">Marc Ecko The Utmost Analog Watch  - For Men  Women (Silver  White)         Price: Rs.5465</h3> <div class="cls"></div> <div class="item_desc_text line"> <div style="float:right"> </div> <h3><b> Key Features </b></h3> <div class="line bmargin10"> <ul class="feature_bullet"> <li><span>Stainless Steel Case  Stainless Steel Bezel</span></li><li><span>Round Dial</span></li><li><span>Push Button Deployment Clasp</span></li><li><span>Silver Strap</span></li><li><span>Water Resistant</span></li> </ul> </div> <p style="text-align: justify;">   Dainty  out-of-the-box and contemporary  the watches of The Utmost collection from Marc Ecko will definitely win your heart thanks to its classy features. Complement your cool looks with these flamboyant timepieces and stand out in a crowd.</p> <p style="text-align: justify;">   Here is a bright and interesting watch that will spice up your attire to add a smart confident aura to your persona. This is a <strong>Marc Ecko The Utmost Analog Unisex</strong> Watch and you can wear the watch to a reunion with your friends and make the right impression. Strap on the <strong>quartz watch</strong> when you are heading out with family for a watching a late night movie or sport the dainty timepiece when you head to your evening game of tennis or squash.</p> <p style="text-align: justify;"> <strong>Body and Design</strong></p> <p style="text-align: justify;">   The Marc Ecko analog unisex watch comes with an interesting <strong>round dial</strong> that gives an abstract and fancy look to the timepiece. The dial has been set on a <strong>stainless steel strap</strong> that is easy to keep clean and maintain. The strap is endowed with a <strong>push button deployment clasp</strong> that fastens the timepiece to your wrist without causing any irritation. Thanks to the presence of a <strong>mineral glass</strong> cover  the dial remains protected from scratches and bumps.</p> <p style="text-align: justify;">   A stainless steel case encloses the dial providing protection against corrosive substances floating in the air  and also lends a clean finish to the watch. With a beautiful <strong>stainless steel bezel</strong> surrounding the dial  the watch sports a funky look that will appeal to the young minds.</p> <p style="text-align: justify;"> <strong>Functions and Other Features</strong></p> <p style="text-align: justify;">   The intelligent timepiece will not be rendered dysfunctional if a few accidental splashes from a spilt beverage. You might as well wear the chic time wear as you take those water themed rides at an amusement park; the Marc Ecko watch is<strong> water-resistant up to a depth of 50 m</strong>. So  without further ado  add the <strong>unisex analog watch from Marc Ecko</strong> to your collection and revel in the innovation of its craftsmanship.</p> </div> <div style="clear: both;"></div> </div>,<div class="item_left_column" id="specifications"> <h3 class="item_desc_title fk-uppercase">         Specifications of Marc Ecko The Utmost Analog Watch  - For Men  Women (Silver  White)    </h3> <table cellspacing="0" class="fk-specs-type2"> <tr> <th class="group-head" colspan="2">General</th> </tr> <tr class=""> <td class="specs-key">Type</td> <td class="specs-value fk-data">Analog</td> </tr> <tr class=""> <td class="specs-key">Series</td> <td class="specs-value fk-data">The Utmost</td> </tr> <tr class=""> <td class="specs-key">Ideal For</td> <td class="specs-value fk-data">Men  Women</td> </tr> <tr class=""> <td class="specs-key">Mechanism</td> <td class="specs-value fk-data">Quartz</td> </tr> <tr class=""> <td class="specs-key">Style Code</td> <td class="specs-value fk-data">E11524G1</td> </tr> </table> <table cellspacing="0" class="fk-specs-type2"> <tr> <th class="group-head" colspan="2">Body Features</th> </tr> <tr class=""> <td class="specs-key">Strap Material</td> <td class="specs-value fk-data">Stainless Steel Strap</td> </tr> <tr class=""> <td class="specs-key">Strap Color</td> <td class="specs-value fk-data">Silver  White</td> </tr> <tr class=""> <td class="specs-key">Case / Bezel Material</td> <td class="specs-value fk-data">Stainless Steel Bezel  Stainless Steel Case</td> </tr> <tr class=""> <td class="specs-key">Dial Color</td> <td class="specs-value fk-data">White</td> </tr> <tr class=""> <td class="specs-key">Dial Shape</td> <td class="specs-value fk-data">Round</td> </tr> <tr class=""> <td class="specs-key">Clasp Type</td> <td class="specs-value fk-data">Push Button Deployment Clasp</td> </tr> <tr class=""> <td class="specs-key">Water Resistant</td> <td class="specs-value fk-data">Yes</td> </tr> <tr class=""> <td class="specs-key">Water Resistance Depth</td> <td class="specs-value fk-data">50 m</td> </tr> <tr class=""> <td class="specs-key">Other Body Features</td> <td class="specs-value fk-data">Mineral Glass</td> </tr> </table> <table cellspacing="0" class="fk-specs-type2"> <tr> <th class="group-head" colspan="2">Dial Dimensions</th> </tr> <tr class=""> <td class="specs-key">Thickness</td> <td class="specs-value fk-data">8 mm</td> </tr> <tr class=""> <td class="specs-key">Other Dimensions</td> <td class="specs-value fk-data">42 mm Case Diameter  22 mm Band Width</td> </tr> </table> </div>,10:03:2014,None
LSTWATDJ3V6B77URHSUSENV29,Marc Ecko The Rollie Analog Watch  - For Men  Women,http://www.flipkart.com/watches/women?otracker=hp_nmenu_sub_women_1_Watches,Rs. 2160,Watches,Watches,Marc Ecko,http://img5a.flixcart.com/image/watch/h/s/u/e10038m8-marc-ecko-400x400-imadrmz55g2927vx.jpeg,Rs. 5400,None,women,http://www.flipkart.com/marc-ecko-rollie-analog-watch-men-women/p/itmdj3xdhbwtzgz6?pid=WATDJ3V6B77URHSU&srno=b_14&ref=436fd84d-2b17-4084-8319-96f5349bdfdd,WS Retail,Marc Ecko The Rollie Analog Watch - For Men  Women - Buy Marc Ecko The Rollie Analog Watch - For Men  Women E10038M8 Online at Best Prices in India | Flipkart.com,Marc Ecko The Rollie Analog Watch - For Men  Women - Buy Marc Ecko The Rollie Analog Watch - For Men  Women E10038M8 Online at Rs.2160 in India Only at Flipkart.com. Black Strap  Round Dial  Stainless Steel Case - Great,[],<div class="item_left_column" id="description"> <h3 class="item_desc_title fk-uppercase">Marc Ecko The Rollie Analog Watch  - For Men  Women (Black)         Price: Rs.2160</h3> <div class="cls"></div> <div class="item_desc_text line"> <div style="float:right"> </div> <h3><b> Key Features </b></h3> <div class="line bmargin10"> <ul class="feature_bullet"> <li><span>Black Strap</span></li><li><span>Round Dial</span></li><li><span>Stainless Steel Case</span></li> </ul> </div> <p style="text-align: justify;">   A reputed name among fashion brands  Marc Ecko stands out as the pre-eminent symbol of elegance and style. <strong>The Rollie series</strong> of watches from the watchmaking company easily adds to the sophistication of the wearer  irrespective of the gender. This <strong>Marc Ecko The Rollie Analog Unisex Watch</strong> epitomises novelty and grace and boasts of superlative style and an enigmatic appearance. Wear the <strong>battery-powered watch</strong> at a Saturday night party or carry it along to a theatre to enjoy a movie with friends; the funky timepiece will give you the dainty look.</p> <p style="text-align: justify;"> <strong>Body and Design</strong></p> <p style="text-align: justify;">   Sporting a dark yet attractive colour in the background  the <strong>round dial</strong> looks stunning  easily making a mark in the hearts of the users. The absence of the hour markers on the dial of the trendy watch is compensated by the brilliant depiction of a heart studded with crystals; the design makes the unisex watch stand out in a crowd. Even the <strong>stone-studded bezel</strong> accentuates the glamorous appeal of the wearer.</p> <p style="text-align: justify;">   The Marc Ecko unisex analog wristwatch is also equipped with a <strong>leather strap</strong> that makes this timepiece a pleasurable wear. The <strong>croco-design strap</strong> not only enhances your charm but also ensures that wearing the watch for long durations does not cause any discomfort.</p> <p style="text-align: justify;">   A <strong>stainless steel case</strong> encloses the dial and keeps the internal components of the timepiece safe from corrosive substances present in the air or water. The silver colour of the case only adds to your infallible charm. In short  the <strong>Marc Ecko analog watch</strong> is crafted to impress with its glamorous design and stylish lustre.</p> </div> <div style="clear: both;"></div> </div>,<div class="item_left_column" id="specifications"> <h3 class="item_desc_title fk-uppercase">         Specifications of Marc Ecko The Rollie Analog Watch  - For Men  Women (Black)    </h3> <table cellspacing="0" class="fk-specs-type2"> <tr> <th class="group-head" colspan="2">General</th> </tr> <tr class=""> <td class="specs-key">Type</td> <td class="specs-value fk-data">Analog</td> </tr> <tr class=""> <td class="specs-key">Series</td> <td class="specs-value fk-data">The Rollie</td> </tr> <tr class=""> <td class="specs-key">Ideal For</td> <td class="specs-value fk-data">Men  Women</td> </tr> <tr class=""> <td class="specs-key">Power Source</td> <td class="specs-value fk-data">Battery Powered</td> </tr> <tr class=""> <td class="specs-key">Style Code</td> <td class="specs-value fk-data">E10038M8</td> </tr> </table> <table cellspacing="0" class="fk-specs-type2"> <tr> <th class="group-head" colspan="2">Body Features</th> </tr> <tr class=""> <td class="specs-key">Strap Material</td> <td class="specs-value fk-data">Leather Strap</td> </tr> <tr class=""> <td class="specs-key">Strap Design</td> <td class="specs-value fk-data">Croco</td> </tr> <tr class=""> <td class="specs-key">Strap Color</td> <td class="specs-value fk-data">Black</td> </tr> <tr class=""> <td class="specs-key">Case / Bezel Material</td> <td class="specs-value fk-data">Stainless Steel Case</td> </tr> <tr class=""> <td class="specs-key">Dial Color</td> <td class="specs-value fk-data">Black  Grey</td> </tr> <tr class=""> <td class="specs-key">Dial Shape</td> <td class="specs-value fk-data">Round</td> </tr> <tr class=""> <td class="specs-key">Other Body Features</td> <td class="specs-value fk-data">Silver Color Case  Stone Studded on Dial and Bezel</td> </tr> </table> <table cellspacing="0" class="fk-specs-type2"> <tr> <th class="group-head" colspan="2">Warranty</th> </tr> <tr class=""> <td class="specs-key"> </td> <td class="specs-value fk-data">1 Year Domestic Warranty</td> </tr> </table> </div>,10:03:2014,None
