LSTWATDJ3V6TGKKKHNHDJICZI,Marc Ecko The Rykstar Analog Watch  - For Men  Women,http://www.flipkart.com/watches/women?otracker=hp_nmenu_sub_women_1_Watches,Rs. 4514,Watches,Watches,Marc Ecko,http://img5a.flixcart.com/image/watch/h/n/h/e09525m1-marc-ecko-400x400-imadrmzhnnrva6my.jpeg,Rs. 5130,None,women,http://www.flipkart.com/marc-ecko-rykstar-analog-watch-men-women/p/itmdj3xd6wytrmwz?pid=WATDJ3V6TGKKKHNH&srno=b_3&ref=436fd84d-2b17-4084-8319-96f5349bdfdd,Watch,Marc Ecko The Rykstar Analog Watch - For Men  Women - Buy Marc Ecko The Rykstar Analog Watch - For Men  Women E09525M1 Online at Best Prices in India | Flipkart.com,Marc Ecko The Rykstar Analog Watch - For Men  Women - Buy Marc Ecko The Rykstar Analog Watch - For Men  Women E09525M1 Online at Rs.4514 in India Only at Flipkart.com. White and Copper Strap  Round Dial  Stainless Steel,[],<div class="item_left_column" id="description"> <h3 class="item_desc_title fk-uppercase">Marc Ecko The Rykstar Analog Watch  - For Men  Women (White  Copper)         Price: Rs.4514</h3> <div class="cls"></div> <div class="item_desc_text line"> <div style="float:right"> </div> <h3><b> Key Features </b></h3> <div class="line bmargin10"> <ul class="feature_bullet"> <li><span>White and Copper Strap</span></li><li><span>Round Dial</span></li><li><span>Stainless Steel Case</span></li><li><span>Water Resistant</span></li> </ul> </div> <p style="text-align: justify;">   As the name suggests  The Rykstar collection from marc Ecko is designed to be worn with funky tees  only to be complemented by dainty skirts or denims to give you a rockstar look. This <strong>Marc Ecko The Rykstar Analog Unisex Watch</strong> boasts of superlative style and enigmatic appearance. The <strong>quartz watch</strong> will easily impress anyone who is young at heart with its sporty look.</p> <p style="text-align: justify;"> <strong>Body and Design</strong></p> <p style="text-align: justify;">   The unparalleled innovation in the design of the <strong>rose gold coloured pyramid studs</strong> exemplifies why the brand has earned the coveted epithet of being an icon for the youth of the nation. Splattered with regal colours  the <strong>round dial</strong> looks stunning  easily making a mark in the hearts of the users. The sensitive dial is protected from unwanted scratches  thanks to the presence of a <strong>mineral crystal glass</strong> window.</p> <p style="text-align: justify;">   The Marc Ecko analog wristwatch of The Rykstar series is also equipped with a <strong>leather strap</strong> that makes this timepiece a pleasurable wear. The sensitive dial and the other internal components of the watch are enclosed within a <strong>rose gold coloured stainless steel case</strong> that keeps the watch parts protected from accidental damages. Resistant to corrosion  the watch case ensures that your precious timepiece is durable against wear and tear.</p> <p style="text-align: justify;"> <strong>Functions and Other Features</strong></p> <p style="text-align: justify;">   The unisex analog watch from Marc Ecko is built to be water-resistant. The water-resistant feature of the watch comes in handy if you're ever out of home and get caught in the rain without an umbrella. With a <strong>water diving capacity up to a depth of 50 m</strong>  the timepiece qualifies as the perfect accessory to be worn during the weekend trips to amusement parks and family picnics to a lake side. In short  the <strong>Marc Ecko analog watch</strong> is crafted to impress with its glamorous design and stylish lustre.</p> </div> <div style="clear: both;"></div> </div>,<div class="item_left_column" id="specifications"> <h3 class="item_desc_title fk-uppercase">         Specifications of Marc Ecko The Rykstar Analog Watch  - For Men  Women (White  Copper)    </h3> <table cellspacing="0" class="fk-specs-type2"> <tr> <th class="group-head" colspan="2">General</th> </tr> <tr class=""> <td class="specs-key">Type</td> <td class="specs-value fk-data">Analog</td> </tr> <tr class=""> <td class="specs-key">Series</td> <td class="specs-value fk-data">The Rykstar</td> </tr> <tr class=""> <td class="specs-key">Ideal For</td> <td class="specs-value fk-data">Men  Women</td> </tr> <tr class=""> <td class="specs-key">Mechanism</td> <td class="specs-value fk-data">Quartz</td> </tr> <tr class=""> <td class="specs-key">Style Code</td> <td class="specs-value fk-data">E09525M1</td> </tr> </table> <table cellspacing="0" class="fk-specs-type2"> <tr> <th class="group-head" colspan="2">Body Features</th> </tr> <tr class=""> <td class="specs-key">Strap Material</td> <td class="specs-value fk-data">Leather Strap</td> </tr> <tr class=""> <td class="specs-key">Strap Color</td> <td class="specs-value fk-data">White  Copper</td> </tr> <tr class=""> <td class="specs-key">Case / Bezel Material</td> <td class="specs-value fk-data">Stainless Steel Case</td> </tr> <tr class=""> <td class="specs-key">Dial Color</td> <td class="specs-value fk-data">Cream</td> </tr> <tr class=""> <td class="specs-key">Dial Shape</td> <td class="specs-value fk-data">Round</td> </tr> <tr class=""> <td class="specs-key">Water Resistant</td> <td class="specs-value fk-data">Yes</td> </tr> <tr class=""> <td class="specs-key">Water Resistance Depth</td> <td class="specs-value fk-data">50 m</td> </tr> <tr class=""> <td class="specs-key">Other Body Features</td> <td class="specs-value fk-data">Mineral Crystal Glass  Rose Gold Color Pyramid Studs  Rose Gold Color Case</td> </tr> </table> <table cellspacing="0" class="fk-specs-type2"> <tr> <th class="group-head" colspan="2">Dial Dimensions</th> </tr> <tr class=""> <td class="specs-key">Other Dimensions</td> <td class="specs-value fk-data">41 mm Case Diameter</td> </tr> </table> <table cellspacing="0" class="fk-specs-type2"> <tr> <th class="group-head" colspan="2">Warranty</th> </tr> <tr class=""> <td class="specs-key"> </td> <td class="specs-value fk-data">1 Year Domestic Warranty</td> </tr> </table> </div>,10:03:2014,None
LSTWATDJ3V6Z5AVWEAUKVOQJT,Marc Ecko The Gwen Analog Watch  - For Women,http://www.flipkart.com/watches/women?otracker=hp_nmenu_sub_women_1_Watches,Rs. 2480,Watches,Watches,Marc Ecko,http://img5a.flixcart.com/image/watch/e/a/u/e11509l2-marc-ecko-400x400-imadrmznj8bhgsey.jpeg,Rs. 6210,None,women,http://www.flipkart.com/marc-ecko-gwen-analog-watch-women/p/itmdj3xdnx7e2yyt?pid=WATDJ3V6Z5AVWEAU&srno=b_8&ref=3fe41401-8087-4e07-b10a-c3124de035c6,WS Retail,Marc Ecko The Gwen Analog Watch - For Women - Buy Marc Ecko The Gwen Analog Watch - For Women E11509L2 Online at Best Prices in India | Flipkart.com,Marc Ecko The Gwen Analog Watch - For Women - Buy Marc Ecko The Gwen Analog Watch - For Women E11509L2 Online at Rs.2480 in India Only at Flipkart.com. Black Strap  Round Dial  Stainless Steel Case  Buckle Clasp  Water,[],<div class="item_left_column" id="description"> <h3 class="item_desc_title fk-uppercase">Marc Ecko The Gwen Analog Watch  - For Women (Black)         Price: Rs.2480</h3> <div class="cls"></div> <div class="item_desc_text line"> <div style="float:right"> </div> <h3><b> Key Features </b></h3> <div class="line bmargin10"> <ul class="feature_bullet"> <li><span>Black Strap</span></li><li><span>Round Dial</span></li><li><span>Stainless Steel Case</span></li><li><span>Buckle Clasp</span></li><li><span>Water Resistant</span></li> </ul> </div> <p style="text-align: justify;">   When it comes to stylish designer watches for women  the American fashion brand  Marc Ecko  qualifies as one of the top choices among users. From the very popular brand comes this exquisite personal timepiece for women. Belonging to <strong>The Gwen series</strong> of Marc Ecko  the chic women’s watch seamlessly fits in as the perfect accessory for any attire you wear at work through the week or while partying during the weekend.</p> <p style="text-align: justify;">   An ideal ornament to boost your fashion quotient  this <strong>Marc Ecko The Gwen Analog Watch for women</strong> is the perfect way to make a style statement at a party or social gathering. The timekeeping function in the Marc Ecko watch is maintained by the<strong> quartz mechanism</strong>.</p> <p style="text-align: justify;"> <strong>Body and Design</strong></p> <p style="text-align: justify;">   The innovative craftsmanship of the <strong>women’s analog wristwatch from Marc Ecko</strong> reflects the artistic calibre of the watchmakers. The stone-studded index hour markers of the <strong>round dial</strong> give this timepiece an aura of elegance. To prevent the beautiful dial from getting disfigured due to scratches  the wristwatch makes use of a <strong>mineral glass</strong> window.</p> <p style="text-align: justify;">   The Marc Ecko analog women’s watch is equipped with a <strong>leather strap</strong>. The <strong>croco-design strap</strong> is highly durable too; it ensures the wearer the utmost levels of comfort when worn for prolonged durations of time.</p> <p style="text-align: justify;">   To keep the delicate internal components of the wristwatch safe from accidental damages when you sport the accessory  the gorgeous timepiece features a silver-coloured <strong>stainless steel case</strong>. The dial is surrounded by a <strong>leather inlay bezel</strong> that glitters with an ethereal sheen  transforming you into a diva.</p> <p style="text-align: justify;"> <strong>Functions and Other Features</strong></p> <p style="text-align: justify;">   The women’s Marc Ecko watch from The Gwen series is designed to be <strong>water-resistant up to a depth of 50 m</strong>  thus allowing you to sport this stylish and trendy time wear the next time you take a dip at your apartment’s swimming pool. In short  the multifunctional <strong>analog watch from Marc Ecko</strong> is not just a fashion accessory  but also the embodiment of the inherent elegance in women.</p> </div> <div style="clear: both;"></div> </div>,<div class="item_left_column" id="specifications"> <h3 class="item_desc_title fk-uppercase">         Specifications of Marc Ecko The Gwen Analog Watch  - For Women (Black)    </h3> <table cellspacing="0" class="fk-specs-type2"> <tr> <th class="group-head" colspan="2">General</th> </tr> <tr class=""> <td class="specs-key">Type</td> <td class="specs-value fk-data">Analog</td> </tr> <tr class=""> <td class="specs-key">Series</td> <td class="specs-value fk-data">The Gwen</td> </tr> <tr class=""> <td class="specs-key">Ideal For</td> <td class="specs-value fk-data">Women</td> </tr> <tr class=""> <td class="specs-key">Mechanism</td> <td class="specs-value fk-data">Quartz</td> </tr> <tr class=""> <td class="specs-key">Style Code</td> <td class="specs-value fk-data">E11509L2</td> </tr> </table> <table cellspacing="0" class="fk-specs-type2"> <tr> <th class="group-head" colspan="2">Body Features</th> </tr> <tr class=""> <td class="specs-key">Strap Material</td> <td class="specs-value fk-data">Leather Strap</td> </tr> <tr class=""> <td class="specs-key">Strap Design</td> <td class="specs-value fk-data">Croco</td> </tr> <tr class=""> <td class="specs-key">Strap Color</td> <td class="specs-value fk-data">Black</td> </tr> <tr class=""> <td class="specs-key">Case / Bezel Material</td> <td class="specs-value fk-data">Stainless Steel Case</td> </tr> <tr class=""> <td class="specs-key">Dial Color</td> <td class="specs-value fk-data">Silver</td> </tr> <tr class=""> <td class="specs-key">Dial Shape</td> <td class="specs-value fk-data">Round</td> </tr> <tr class=""> <td class="specs-key">Clasp Type</td> <td class="specs-value fk-data">Buckle</td> </tr> <tr class=""> <td class="specs-key">Water Resistant</td> <td class="specs-value fk-data">Yes</td> </tr> <tr class=""> <td class="specs-key">Water Resistance Depth</td> <td class="specs-value fk-data">50 m</td> </tr> <tr class=""> <td class="specs-key">Other Body Features</td> <td class="specs-value fk-data">Silver Color Case  Mineral Glass  Leather Inlay Bezel  Stone Studded Index</td> </tr> </table> <table cellspacing="0" class="fk-specs-type2"> <tr> <th class="group-head" colspan="2">Warranty</th> </tr> <tr class=""> <td class="specs-key"> </td> <td class="specs-value fk-data">1 Year Domestic Warranty</td> </tr> </table> </div>,10:03:2014,None
LSTWATDJ3V6HHHQWFFZ6U9TWC,Marc Ecko The Rollie Analog Watch  - For Women,http://www.flipkart.com/watches/women?otracker=hp_nmenu_sub_women_1_Watches,Rs. 4752,Watches,Watches,Marc Ecko,http://img5a.flixcart.com/image/watch/f/f/z/e10038m7-marc-ecko-400x400-imadrmzezbupzugt.jpeg,Rs. 5400,None,women,http://www.flipkart.com/marc-ecko-rollie-analog-watch-women/p/itmdj3xdnnfrw4mf?pid=WATDJ3V6HHHQWFFZ&srno=b_1&ref=436fd84d-2b17-4084-8319-96f5349bdfdd,Watch,Marc Ecko The Rollie Analog Watch - For Women - Buy Marc Ecko The Rollie Analog Watch - For Women E10038M7 Online at Best Prices in India | Flipkart.com,Marc Ecko The Rollie Analog Watch - For Women - Buy Marc Ecko The Rollie Analog Watch - For Women E10038M7 Online at Rs.4752 in India Only at Flipkart.com. Stainless Steel Case  Round Dial  Pink Strap - Great Discounts,[],<div class="item_left_column" id="description"> <h3 class="item_desc_title fk-uppercase">Marc Ecko The Rollie Analog Watch  - For Women (Pink)         Price: Rs.4752</h3> <div class="cls"></div> <div class="item_desc_text line"> <div style="float:right"> </div> <h3><b> Key Features </b></h3> <div class="line bmargin10"> <ul class="feature_bullet"> <li><span>Stainless Steel Case</span></li><li><span>Round Dial</span></li><li><span>Pink Strap</span></li> </ul> </div> <p style="text-align: justify;">   The Marc Ecko The Rollie series of watches is the perfect accessory to team up with a pair of blue cotton shorts  a T-shirt and comfortable loafers on your feet when you are on a road trip. The watches also suffice as everyday wear as they would go well with a variety of attires you have gathered in your wardrobe.</p> <p style="text-align: justify;">   Here is a sleek and classy watch with a distinctly different look that is bound to catch attention for being more than just a watch  working also as a stylish piece of jewellery. This is a<strong> Marc Ecko The Rollie Analog Unisex Watch</strong>; strap on the battery-powered watch when you are dressed in your favourite pair of blue jeans  a white and pastel-pink knit top and matching sandals when you are heading out on a casual day to catch up with friends at the favourite hangout.</p> <p style="text-align: justify;"> <strong>Body and Design</strong></p> <p style="text-align: justify;">   The Marc Ecko The Rollie analog wristwatch comes with a <strong>round dial</strong>. The watch has a <strong>leather strap</strong> that gives the timepiece a dainty look while making it easy to wear on. The strap keeps the time wear fastened to your wrist for hours on end without causing the slightest discomfort.</p> <p style="text-align: justify;">   The beautiful analog unisex watch also comes with a <strong>crystal-studded bezel</strong> that surrounds the dial and adds a tinge of glamour to its casual style. The case of the watch is made of stainless steel  a sturdy metal alloy  which makes the Marc Ecko timepiece durable against corrosion. The internal components of the timepiece will be kept in running condition by the sturdy metal alloy. Undoubtedly  the <strong>analog unisex wristwatch from Marc Ecko</strong> is a classic amalgamation of beauty and efficacy.</p> </div> <div style="clear: both;"></div> </div>,<div class="item_left_column" id="specifications"> <h3 class="item_desc_title fk-uppercase">         Specifications of Marc Ecko The Rollie Analog Watch  - For Women (Pink)    </h3> <table cellspacing="0" class="fk-specs-type2"> <tr> <th class="group-head" colspan="2">General</th> </tr> <tr class=""> <td class="specs-key">Type</td> <td class="specs-value fk-data">Analog</td> </tr> <tr class=""> <td class="specs-key">Series</td> <td class="specs-value fk-data">The Rollie</td> </tr> <tr class=""> <td class="specs-key">Ideal For</td> <td class="specs-value fk-data">Women</td> </tr> <tr class=""> <td class="specs-key">Power Source</td> <td class="specs-value fk-data">Battery Powered</td> </tr> <tr class=""> <td class="specs-key">Style Code</td> <td class="specs-value fk-data">E10038M7</td> </tr> </table> <table cellspacing="0" class="fk-specs-type2"> <tr> <th class="group-head" colspan="2">Body Features</th> </tr> <tr class=""> <td class="specs-key">Strap Material</td> <td class="specs-value fk-data">Leather Strap</td> </tr> <tr class=""> <td class="specs-key">Strap Color</td> <td class="specs-value fk-data">Pink</td> </tr> <tr class=""> <td class="specs-key">Case / Bezel Material</td> <td class="specs-value fk-data">Stainless Steel Case</td> </tr> <tr class=""> <td class="specs-key">Dial Color</td> <td class="specs-value fk-data">Silver</td> </tr> <tr class=""> <td class="specs-key">Dial Shape</td> <td class="specs-value fk-data">Round</td> </tr> </table> <table cellspacing="0" class="fk-specs-type2"> <tr> <th class="group-head" colspan="2">Warranty</th> </tr> <tr class=""> <td class="specs-key"> </td> <td class="specs-value fk-data">1 Year Domestic Warranty</td> </tr> </table> </div>,10:03:2014,None
LSTWATDJ3V6ZJETQCHRDEG6KG,Marc Ecko The Encore Oz Analog Watch  - For Women  Men,http://www.flipkart.com/watches/women?otracker=hp_nmenu_sub_women_1_Watches,Rs. 1620,Watches,Watches,Marc Ecko,http://img6a.flixcart.com/image/watch/c/h/r/e07502g3-marc-ecko-400x400-imadjhk4tbagpxpf.jpeg,Rs. 4050,None,women,http://www.flipkart.com/marc-ecko-encore-oz-analog-watch-women-men/p/itmdj3xchsxwep5c?pid=WATDJ3V6ZJETQCHR&srno=b_5&ref=436fd84d-2b17-4084-8319-96f5349bdfdd,WS Retail,Marc Ecko The Encore Oz Analog Watch - For Women  Men - Buy Marc Ecko The Encore Oz Analog Watch - For Women  Men E07502G3 Online at Best Prices in India | Flipkart.com,Marc Ecko The Encore Oz Analog Watch - For Women  Men - Buy Marc Ecko The Encore Oz Analog Watch - For Women  Men E07502G3 Online at Rs.1620 in India Only at Flipkart.com. Stainless Steel Case  Water Resistant  Black,[],<div class="item_left_column" id="description"> <h3 class="item_desc_title fk-uppercase">Marc Ecko The Encore Oz Analog Watch  - For Women  Men (Black)         Price: Rs.1620</h3> <div class="cls"></div> <div class="item_desc_text line"> <div style="float:right"> </div> <h3><b> Key Features </b></h3> <div class="line bmargin10"> <ul class="feature_bullet"> <li><span>Stainless Steel Case</span></li><li><span>Water Resistant</span></li><li><span>Black Strap</span></li><li><span>Round Dial</span></li> </ul> </div> <p style="text-align: justify;">   For a perfect look you need the right accessories to suit your persona. Marc Ecko brings to you this he Encore Oz Analog Watch - For Women  Men to complement your trendy appearance. Be it for a casual outing with your friends or for a formal dinner  this <strong>Marc Ecko The Encore Oz Analog Watch - For Women </strong> Men infuses an extra charm into your personality. The Encore Oz series from Marc Ecko is perfect for all those men and women on the lookout for a stylish watch.</p> <p style="text-align: justify;"> <strong>Body and Design</strong></p> <p style="text-align: justify;">   This watch is designed with a <strong>round dial </strong>that looks brilliant on every wrist. Also  this watch is crafted with a<strong> leather strap </strong>that provides extreme comfort and style. Also  leather is known for its breathability and keeps your skin safe during any climatic condition. The stainless steel case protects the internal components of the watch  thereby making it durable and rust resistant. Without much of an effort and strain you can view time  as this Analog Watch offers impeccable clarity.</p> <p style="text-align: justify;"> <strong>Function and Other Features</strong></p> <p style="text-align: justify;">   This watch is designed to be <strong>water-resistant </strong> making it a perfect accessory that you can wear even while you go for a beach party. You can now adorn your wrist with this The Encore Oz Analog Watch from Marc Ecko.</p> </div> <div style="clear: both;"></div> </div>,<div class="item_left_column" id="specifications"> <h3 class="item_desc_title fk-uppercase">         Specifications of Marc Ecko The Encore Oz Analog Watch  - For Women  Men (Black)    </h3> <table cellspacing="0" class="fk-specs-type2"> <tr> <th class="group-head" colspan="2">General</th> </tr> <tr class=""> <td class="specs-key">Type</td> <td class="specs-value fk-data">Analog</td> </tr> <tr class=""> <td class="specs-key">Series</td> <td class="specs-value fk-data">The Encore Oz</td> </tr> <tr class=""> <td class="specs-key">Ideal For</td> <td class="specs-value fk-data">Women  Men</td> </tr> <tr class=""> <td class="specs-key">Style Code</td> <td class="specs-value fk-data">E07502G3</td> </tr> </table> <table cellspacing="0" class="fk-specs-type2"> <tr> <th class="group-head" colspan="2">Body Features</th> </tr> <tr class=""> <td class="specs-key">Strap Material</td> <td class="specs-value fk-data">Leather Strap</td> </tr> <tr class=""> <td class="specs-key">Strap Color</td> <td class="specs-value fk-data">Black</td> </tr> <tr class=""> <td class="specs-key">Case / Bezel Material</td> <td class="specs-value fk-data">Stainless Steel Case</td> </tr> <tr class=""> <td class="specs-key">Dial Color</td> <td class="specs-value fk-data">Multicolor</td> </tr> <tr class=""> <td class="specs-key">Dial Shape</td> <td class="specs-value fk-data">Round</td> </tr> <tr class=""> <td class="specs-key">Water Resistant</td> <td class="specs-value fk-data">Yes</td> </tr> <tr class=""> <td class="specs-key">Other Body Features</td> <td class="specs-value fk-data">Silver Color Case</td> </tr> </table> <table cellspacing="0" class="fk-specs-type2"> <tr> <th class="group-head" colspan="2">Warranty</th> </tr> <tr class=""> <td class="specs-key"> </td> <td class="specs-value fk-data">1 Year Domestic Warranty</td> </tr> </table> </div>,10:03:2014,None
