LSTWATDJ3V6Z5AVWEAUKVOQJT,Marc Ecko The Gwen Analog Watch  - For Women,http://www.flipkart.com/watches/women?otracker=hp_nmenu_sub_women_1_Watches,Rs. 2480,Watches,Watches,Marc Ecko,http://img5a.flixcart.com/image/watch/e/a/u/e11509l2-marc-ecko-400x400-imadrmznj8bhgsey.jpeg,Rs. 6210,None,women,http://www.flipkart.com/marc-ecko-gwen-analog-watch-women/p/itmdj3xdnx7e2yyt?pid=WATDJ3V6Z5AVWEAU&srno=b_8&ref=3fe41401-8087-4e07-b10a-c3124de035c6,WS Retail,Marc Ecko The Gwen Analog Watch - For Women - Buy Marc Ecko The Gwen Analog Watch - For Women E11509L2 Online at Best Prices in India | Flipkart.com,Marc Ecko The Gwen Analog Watch - For Women - Buy Marc Ecko The Gwen Analog Watch - For Women E11509L2 Online at Rs.2480 in India Only at Flipkart.com. Black Strap, Round Dial, Stainless Steel Case, Buckle Clasp, Water,[],<div class="item_left_column" id="description"> <h3 class="item_desc_title fk-uppercase">Marc Ecko The Gwen Analog Watch  - For Women (Black)         Price: Rs.2480</h3> <div class="cls"></div> <div class="item_desc_text line"> <div style="float:right"> </div> <h3><b> Key Features </b></h3> <div class="line bmargin10"> <ul class="feature_bullet"> <li><span>Black Strap</span></li><li><span>Round Dial</span></li><li><span>Stainless Steel Case</span></li><li><span>Buckle Clasp</span></li><li><span>Water Resistant</span></li> </ul> </div> <p style="text-align: justify;">   When it comes to stylish designer watches for women, the American fashion brand, Marc Ecko, qualifies as one of the top choices among users. From the very popular brand comes this exquisite personal timepiece for women. Belonging to <strong>The Gwen series</strong> of Marc Ecko, the chic women’s watch seamlessly fits in as the perfect accessory for any attire you wear at work through the week or while partying during the weekend.</p> <p style="text-align: justify;">   An ideal ornament to boost your fashion quotient, this <strong>Marc Ecko The Gwen Analog Watch for women</strong> is the perfect way to make a style statement at a party or social gathering. The timekeeping function in the Marc Ecko watch is maintained by the<strong> quartz mechanism</strong>.</p> <p style="text-align: justify;"> <strong>Body and Design</strong></p> <p style="text-align: justify;">   The innovative craftsmanship of the <strong>women’s analog wristwatch from Marc Ecko</strong> reflects the artistic calibre of the watchmakers. The stone-studded index hour markers of the <strong>round dial</strong> give this timepiece an aura of elegance. To prevent the beautiful dial from getting disfigured due to scratches, the wristwatch makes use of a <strong>mineral glass</strong> window.</p> <p style="text-align: justify;">   The Marc Ecko analog women’s watch is equipped with a <strong>leather strap</strong>. The <strong>croco-design strap</strong> is highly durable too; it ensures the wearer the utmost levels of comfort when worn for prolonged durations of time.</p> <p style="text-align: justify;">   To keep the delicate internal components of the wristwatch safe from accidental damages when you sport the accessory, the gorgeous timepiece features a silver-coloured <strong>stainless steel case</strong>. The dial is surrounded by a <strong>leather inlay bezel</strong> that glitters with an ethereal sheen, transforming you into a diva.</p> <p style="text-align: justify;"> <strong>Functions and Other Features</strong></p> <p style="text-align: justify;">   The women’s Marc Ecko watch from The Gwen series is designed to be <strong>water-resistant up to a depth of 50 m</strong>, thus allowing you to sport this stylish and trendy time wear the next time you take a dip at your apartment’s swimming pool. In short, the multifunctional <strong>analog watch from Marc Ecko</strong> is not just a fashion accessory, but also the embodiment of the inherent elegance in women.</p> </div> <div style="clear: both;"></div> </div>,<div class="item_left_column" id="specifications"> <h3 class="item_desc_title fk-uppercase">         Specifications of Marc Ecko The Gwen Analog Watch  - For Women (Black)    </h3> <table cellspacing="0" class="fk-specs-type2"> <tr> <th class="group-head" colspan="2">General</th> </tr> <tr class=""> <td class="specs-key">Type</td> <td class="specs-value fk-data">Analog</td> </tr> <tr class=""> <td class="specs-key">Series</td> <td class="specs-value fk-data">The Gwen</td> </tr> <tr class=""> <td class="specs-key">Ideal For</td> <td class="specs-value fk-data">Women</td> </tr> <tr class=""> <td class="specs-key">Mechanism</td> <td class="specs-value fk-data">Quartz</td> </tr> <tr class=""> <td class="specs-key">Style Code</td> <td class="specs-value fk-data">E11509L2</td> </tr> </table> <table cellspacing="0" class="fk-specs-type2"> <tr> <th class="group-head" colspan="2">Body Features</th> </tr> <tr class=""> <td class="specs-key">Strap Material</td> <td class="specs-value fk-data">Leather Strap</td> </tr> <tr class=""> <td class="specs-key">Strap Design</td> <td class="specs-value fk-data">Croco</td> </tr> <tr class=""> <td class="specs-key">Strap Color</td> <td class="specs-value fk-data">Black</td> </tr> <tr class=""> <td class="specs-key">Case / Bezel Material</td> <td class="specs-value fk-data">Stainless Steel Case</td> </tr> <tr class=""> <td class="specs-key">Dial Color</td> <td class="specs-value fk-data">Silver</td> </tr> <tr class=""> <td class="specs-key">Dial Shape</td> <td class="specs-value fk-data">Round</td> </tr> <tr class=""> <td class="specs-key">Clasp Type</td> <td class="specs-value fk-data">Buckle</td> </tr> <tr class=""> <td class="specs-key">Water Resistant</td> <td class="specs-value fk-data">Yes</td> </tr> <tr class=""> <td class="specs-key">Water Resistance Depth</td> <td class="specs-value fk-data">50 m</td> </tr> <tr class=""> <td class="specs-key">Other Body Features</td> <td class="specs-value fk-data">Silver Color Case, Mineral Glass, Leather Inlay Bezel, Stone Studded Index</td> </tr> </table> <table cellspacing="0" class="fk-specs-type2"> <tr> <th class="group-head" colspan="2">Warranty</th> </tr> <tr class=""> <td class="specs-key"> </td> <td class="specs-value fk-data">1 Year Domestic Warranty</td> </tr> </table> </div>,10:03:2014,None
LSTWATDJ3V6ZJETQCHRDEG6KG,Marc Ecko The Encore Oz Analog Watch  - For Women, Men,http://www.flipkart.com/watches/women?otracker=hp_nmenu_sub_women_1_Watches,Rs. 1620,Watches,Watches,Marc Ecko,http://img6a.flixcart.com/image/watch/c/h/r/e07502g3-marc-ecko-400x400-imadjhk4tbagpxpf.jpeg,Rs. 4050,None,women,http://www.flipkart.com/marc-ecko-encore-oz-analog-watch-women-men/p/itmdj3xchsxwep5c?pid=WATDJ3V6ZJETQCHR&srno=b_5&ref=3fe41401-8087-4e07-b10a-c3124de035c6,WS Retail,Marc Ecko The Encore Oz Analog Watch - For Women, Men - Buy Marc Ecko The Encore Oz Analog Watch - For Women, Men E07502G3 Online at Best Prices in India | Flipkart.com,Marc Ecko The Encore Oz Analog Watch - For Women, Men - Buy Marc Ecko The Encore Oz Analog Watch - For Women, Men E07502G3 Online at Rs.1620 in India Only at Flipkart.com. Stainless Steel Case, Water Resistant, Black,[],<div class="item_left_column" id="description"> <h3 class="item_desc_title fk-uppercase">Marc Ecko The Encore Oz Analog Watch  - For Women, Men (Black)         Price: Rs.1620</h3> <div class="cls"></div> <div class="item_desc_text line"> <div style="float:right"> </div> <h3><b> Key Features </b></h3> <div class="line bmargin10"> <ul class="feature_bullet"> <li><span>Stainless Steel Case</span></li><li><span>Water Resistant</span></li><li><span>Black Strap</span></li><li><span>Round Dial</span></li> </ul> </div> <p style="text-align: justify;">   For a perfect look you need the right accessories to suit your persona. Marc Ecko brings to you this he Encore Oz Analog Watch - For Women, Men to complement your trendy appearance. Be it for a casual outing with your friends or for a formal dinner, this <strong>Marc Ecko The Encore Oz Analog Watch - For Women,</strong> Men infuses an extra charm into your personality. The Encore Oz series from Marc Ecko is perfect for all those men and women on the lookout for a stylish watch.</p> <p style="text-align: justify;"> <strong>Body and Design</strong></p> <p style="text-align: justify;">   This watch is designed with a <strong>round dial </strong>that looks brilliant on every wrist. Also, this watch is crafted with a<strong> leather strap </strong>that provides extreme comfort and style. Also, leather is known for its breathability and keeps your skin safe during any climatic condition. The stainless steel case protects the internal components of the watch, thereby making it durable and rust resistant. Without much of an effort and strain you can view time, as this Analog Watch offers impeccable clarity.</p> <p style="text-align: justify;"> <strong>Function and Other Features</strong></p> <p style="text-align: justify;">   This watch is designed to be <strong>water-resistant,</strong> making it a perfect accessory that you can wear even while you go for a beach party. You can now adorn your wrist with this The Encore Oz Analog Watch from Marc Ecko.</p> </div> <div style="clear: both;"></div> </div>,<div class="item_left_column" id="specifications"> <h3 class="item_desc_title fk-uppercase">         Specifications of Marc Ecko The Encore Oz Analog Watch  - For Women, Men (Black)    </h3> <table cellspacing="0" class="fk-specs-type2"> <tr> <th class="group-head" colspan="2">General</th> </tr> <tr class=""> <td class="specs-key">Type</td> <td class="specs-value fk-data">Analog</td> </tr> <tr class=""> <td class="specs-key">Series</td> <td class="specs-value fk-data">The Encore Oz</td> </tr> <tr class=""> <td class="specs-key">Ideal For</td> <td class="specs-value fk-data">Women, Men</td> </tr> <tr class=""> <td class="specs-key">Style Code</td> <td class="specs-value fk-data">E07502G3</td> </tr> </table> <table cellspacing="0" class="fk-specs-type2"> <tr> <th class="group-head" colspan="2">Body Features</th> </tr> <tr class=""> <td class="specs-key">Strap Material</td> <td class="specs-value fk-data">Leather Strap</td> </tr> <tr class=""> <td class="specs-key">Strap Color</td> <td class="specs-value fk-data">Black</td> </tr> <tr class=""> <td class="specs-key">Case / Bezel Material</td> <td class="specs-value fk-data">Stainless Steel Case</td> </tr> <tr class=""> <td class="specs-key">Dial Color</td> <td class="specs-value fk-data">Multicolor</td> </tr> <tr class=""> <td class="specs-key">Dial Shape</td> <td class="specs-value fk-data">Round</td> </tr> <tr class=""> <td class="specs-key">Water Resistant</td> <td class="specs-value fk-data">Yes</td> </tr> <tr class=""> <td class="specs-key">Other Body Features</td> <td class="specs-value fk-data">Silver Color Case</td> </tr> </table> <table cellspacing="0" class="fk-specs-type2"> <tr> <th class="group-head" colspan="2">Warranty</th> </tr> <tr class=""> <td class="specs-key"> </td> <td class="specs-value fk-data">1 Year Domestic Warranty</td> </tr> </table> </div>,10:03:2014,None
LSTWATDJ3V68QNZX5AZIVFTNZ,Marc Ecko The Zero G Analog Watch  - For Men, Women,http://www.flipkart.com/watches/women?otracker=hp_nmenu_sub_women_1_Watches,Rs. 1995,Watches,Watches,Marc Ecko,http://img5a.flixcart.com/image/watch/5/a/z/e08513g6-marc-ecko-400x400-imadjhjmbbgnum8g.jpeg,Rs. 4990,None,women,http://www.flipkart.com/marc-ecko-zero-g-analog-watch-men-women/p/itmdj3xcdf4xdrvg?pid=WATDJ3V68QNZX5AZ&srno=b_4&ref=3fe41401-8087-4e07-b10a-c3124de035c6,WS Retail,Marc Ecko The Zero G Analog Watch - For Men, Women - Buy Marc Ecko The Zero G Analog Watch - For Men, Women E08513G6 Online at Best Prices in India | Flipkart.com,Marc Ecko The Zero G Analog Watch - For Men, Women - Buy Marc Ecko The Zero G Analog Watch - For Men, Women E08513G6 Online at Rs.1995 in India Only at Flipkart.com. Plastic Case, Square Dial, Black Strap - Great,[],<div class="item_left_column" id="description"> <h3 class="item_desc_title fk-uppercase">Marc Ecko The Zero G Analog Watch  - For Men, Women (Black)         Price: Rs.1995</h3> <div class="cls"></div> <div class="item_desc_text line"> <div style="float:right"> </div> <h3><b> Key Features </b></h3> <div class="line bmargin10"> <ul class="feature_bullet"> <li><span>Plastic Case</span></li><li><span>Square Dial</span></li><li><span>Black Strap</span></li> </ul> </div> <p style="text-align: justify;">   Beyond the luxury car and your classic laptop, something that grabs attention when are at a business conference is this The Zero G Analog Watch - For Men, Women from Marc Ecko . When you sign those important documents, this<strong> Marc Ecko The Zero G Analog Watch - For Men, Women</strong> never goes unnoticed because of its magnificent charm. The<strong> Zero G series</strong> watch from Marc Ecko is perfect for all those men and women craving to add a tinge of glamour to their wrist. You can team this watch with your formal attire and get that professional look.</p> <p style="text-align: justify;"> <strong>Body and Design</strong></p> <p style="text-align: justify;">   This Analog Watch is designed with a<strong> square dial</strong> that looks brilliant on every man’s wrist. Crafted with a <strong>silicone strap</strong>, this Analog Watch effortlessly lends a stylish appeal. This Analog Watch is durable and rust resistant as the <strong>plastic case</strong> protects the internal components of the watch. This Analog Watch is sturdy enough to keep the timepiece fastened around your wrist for prolonged hours, without the slightest discomfort. With the impeccable clarity this offers, you can easily view time within a blink of an eye. This Marc Ecko watch will prove to be a worthwhile addition to your collection of watches.</p> </div> <div style="clear: both;"></div> </div>,<div class="item_left_column" id="specifications"> <h3 class="item_desc_title fk-uppercase">         Specifications of Marc Ecko The Zero G Analog Watch  - For Men, Women (Black)    </h3> <table cellspacing="0" class="fk-specs-type2"> <tr> <th class="group-head" colspan="2">General</th> </tr> <tr class=""> <td class="specs-key">Type</td> <td class="specs-value fk-data">Analog</td> </tr> <tr class=""> <td class="specs-key">Series</td> <td class="specs-value fk-data">The Zero G</td> </tr> <tr class=""> <td class="specs-key">Ideal For</td> <td class="specs-value fk-data">Men, Women</td> </tr> <tr class=""> <td class="specs-key">Style Code</td> <td class="specs-value fk-data">E08513G6</td> </tr> </table> <table cellspacing="0" class="fk-specs-type2"> <tr> <th class="group-head" colspan="2">Body Features</th> </tr> <tr class=""> <td class="specs-key">Strap Material</td> <td class="specs-value fk-data">Silicone Strap</td> </tr> <tr class=""> <td class="specs-key">Strap Color</td> <td class="specs-value fk-data">Black</td> </tr> <tr class=""> <td class="specs-key">Case / Bezel Material</td> <td class="specs-value fk-data">Plastic Case</td> </tr> <tr class=""> <td class="specs-key">Dial Color</td> <td class="specs-value fk-data">Black</td> </tr> <tr class=""> <td class="specs-key">Dial Shape</td> <td class="specs-value fk-data">Square</td> </tr> </table> <table cellspacing="0" class="fk-specs-type2"> <tr> <th class="group-head" colspan="2">Warranty</th> </tr> <tr class=""> <td class="specs-key"> </td> <td class="specs-value fk-data">1 Year Domestic Warranty</td> </tr> </table> </div>,10:03:2014,None
LSTWATDJ3V65J28GDJGXCJVH6,Marc Ecko The Rykstar Analog Watch  - For Men, Women,http://www.flipkart.com/watches/women?otracker=hp_nmenu_sub_women_1_Watches,Rs. 4039,Watches,Watches,Marc Ecko,http://img5a.flixcart.com/image/watch/d/j/g/e08510m1-marc-ecko-400x400-imadjhjmrkcau3xd.jpeg,Rs. 4590,None,women,http://www.flipkart.com/marc-ecko-rykstar-analog-watch-men-women/p/itmdj3xcejfgtvyx?pid=WATDJ3V65J28GDJG&srno=b_2&ref=3fe41401-8087-4e07-b10a-c3124de035c6,Watch,Marc Ecko The Rykstar Analog Watch - For Men, Women - Buy Marc Ecko The Rykstar Analog Watch - For Men, Women E08510M1 Online at Best Prices in India | Flipkart.com,Marc Ecko The Rykstar Analog Watch - For Men, Women - Buy Marc Ecko The Rykstar Analog Watch - For Men, Women E08510M1 Online at Rs.4039 in India Only at Flipkart.com. Round Dial, Water Resistant, Black Strap, Stainless,[],<div class="item_left_column" id="description"> <h3 class="item_desc_title fk-uppercase">Marc Ecko The Rykstar Analog Watch  - For Men, Women (Black)         Price: Rs.4039</h3> <div class="cls"></div> <div class="item_desc_text line"> <div style="float:right"> </div> <h3><b> Key Features </b></h3> <div class="line bmargin10"> <ul class="feature_bullet"> <li><span>Round Dial</span></li><li><span>Water Resistant</span></li><li><span>Black Strap</span></li><li><span>Stainless Steel Case</span></li> </ul> </div> <p style="text-align: justify;">   Make that profound style statement by adorning your wrist with this The Rykstar Analog Watch - For Men, Women from Marc Ecko. This watch effortlessly lends you a classic appeal. Be it for a family wedding or for an international client meeting, this <strong>Marc Ecko The Rykstar Analog Watch - For Men, Women</strong> is sure to grab attention. The <strong>Rykstar series </strong>watch from Marc Eckois perfect for all those men and women on the lookout for a unique watch. Also, the <strong>quartz mechanism </strong>keeps you on time for every event as electro oscillations of the quartz regulate the timekeeping of the watch.</p> <p style="text-align: justify;"> <strong>Body and Design</strong></p> <p style="text-align: justify;">   Furnished with a <strong>round dial,</strong> this Marc Ecko watch enhances the beauty of your wrist. This watch is crafted with a<strong> leather strap</strong> that provides extreme comfort. Also, leather is known for its breathability and keeps your skin safe during any climatic condition. The stainless steel case protects the internal components of the watch, thereby making it durable and rust resistant. Also, with the <strong>stainless steel case</strong> you can be sure that those bumps and grazes are no longer a problem. With the mineral crystal glass on the watch face, this watch becomes scratch resistant. This Analog Watch is sturdy enough to keep the timepiece fastened around your wrist for prolonged hours, without the slightest discomfort.</p> <p style="text-align: justify;"> <strong>Function and Other Features</strong></p> <p style="text-align: justify;">   This Marc Ecko The Rykstar Analog Watch is designed to be <strong>water-resistant</strong>, making it a perfect accessory that you can wear for a pool party.</p> </div> <div style="clear: both;"></div> </div>,<div class="item_left_column" id="specifications"> <h3 class="item_desc_title fk-uppercase">         Specifications of Marc Ecko The Rykstar Analog Watch  - For Men, Women (Black)    </h3> <table cellspacing="0" class="fk-specs-type2"> <tr> <th class="group-head" colspan="2">General</th> </tr> <tr class=""> <td class="specs-key">Type</td> <td class="specs-value fk-data">Analog</td> </tr> <tr class=""> <td class="specs-key">Series</td> <td class="specs-value fk-data">The Rykstar</td> </tr> <tr class=""> <td class="specs-key">Ideal For</td> <td class="specs-value fk-data">Men, Women</td> </tr> <tr class=""> <td class="specs-key">Mechanism</td> <td class="specs-value fk-data">Quartz</td> </tr> <tr class=""> <td class="specs-key">Style Code</td> <td class="specs-value fk-data">E08510M1</td> </tr> </table> <table cellspacing="0" class="fk-specs-type2"> <tr> <th class="group-head" colspan="2">Body Features</th> </tr> <tr class=""> <td class="specs-key">Strap Material</td> <td class="specs-value fk-data">Leather Strap</td> </tr> <tr class=""> <td class="specs-key">Strap Color</td> <td class="specs-value fk-data">Black</td> </tr> <tr class=""> <td class="specs-key">Case / Bezel Material</td> <td class="specs-value fk-data">Stainless Steel Case</td> </tr> <tr class=""> <td class="specs-key">Dial Color</td> <td class="specs-value fk-data">Grey, Black</td> </tr> <tr class=""> <td class="specs-key">Dial Shape</td> <td class="specs-value fk-data">Round</td> </tr> <tr class=""> <td class="specs-key">Water Resistant</td> <td class="specs-value fk-data">Yes</td> </tr> <tr class=""> <td class="specs-key">Other Body Features</td> <td class="specs-value fk-data">Mineral Crystal Glass</td> </tr> </table> <table cellspacing="0" class="fk-specs-type2"> <tr> <th class="group-head" colspan="2">Warranty</th> </tr> <tr class=""> <td class="specs-key"> </td> <td class="specs-value fk-data">1 Year Domestic Warranty</td> </tr> </table> </div>,10:03:2014,None
