LSTTSHDP74ZMCNBFWQ5FQRKWV,Lee Printed Women's Round Neck T-Shirt,http://www.flipkart.com/womens-clothing?otracker=hp_nmenu_sub_women_1_Clothing,Rs. 418,Clothing,Polos & T-Shirts,Lee,http://img6a.flixcart.com/image/t-shirt/5/a/n/lets5315-beige-lee-l-400x400-imadpa92ww2amqkr.jpeg,Rs. 599,Beige,women,http://www.flipkart.com/lee-printed-women-s-round-neck-t-shirt/p/itmdp74zhsykgshe?pid=TSHDP74ZMCNBFWQ5&srno=b_13&ref=c4a1ad25-d7a3-4296-ab3a-194cd16cd28f,Fashionara,Lee Printed Women's Round Neck T-Shirt - Buy Beige Lee Printed Women's Round Neck T-Shirt Online at Best Prices in India | Flipkart.com,Lee Printed Women's Round Neck T-Shirt - Buy Beige Lee Printed Women's Round Neck T-Shirt For Only Rs. 0.0 Online in India. Shop Online For Apparels. Huge Collection of Branded Clothes Only at,['S'  'M'  'L'  'XL'],<div class="item_left_column" id="description"> <h3 class="item_desc_title fk-uppercase">Lee Printed Women's Round Neck T-Shirt         Price: Rs.418</h3> <div class="cls"></div> <div class="item_desc_text line"> <div style="float:right"> </div>                         A casual tee for those off-duty days. Whether a walk at the park or just a fun time at an eating joint. This cotton tee  is sure to keep you super-comfy all through the day. The typo print on the front panel conveys a message. So. . soft that you'd love to wear it all-day everyday. Club it with coloured jeans  bright shoes  sweater and stud earring for the perfect weekends look.        </div> <div style="clear: both;"></div> </div>,<div class="item_left_column" id="specifications"> <h3 class="item_desc_title fk-uppercase">         Specifications of Lee Printed Women's Round Neck T-Shirt    </h3> <table cellspacing="0" class="fk-specs-type2"> <tr> <th class="group-head" colspan="2">General Details<a class="see-more unitExt rmargin10 no-underline" href="javascript:void(0);" onclick="$(this).closest('.fk-specs-type2').toggleClass('expandedMore')" title="Expand">[+]</a><a class="hidden unitExt rmargin10 no-underline" href="javascript:void(0);" onclick="$(this).closest('.fk-specs-type2').toggleClass('expandedMore')" title="Collapse">[-]</a></th> </tr> <tr class="hidden"> <td class="specs-key">Ideal For</td> <td class="specs-value fk-data">Women's</td> </tr> <tr class="hidden"> <td class="specs-key">Occasion</td> <td class="specs-value fk-data">Casual</td> </tr> <tr class="hidden"> <td class="specs-key">Pattern</td> <td class="specs-value fk-data">Printed</td> </tr> </table> <table cellspacing="0" class="fk-specs-type2"> <tr> <th class="group-head" colspan="2">T-shirt Details</th> </tr> <tr class=""> <td class="specs-key">Type</td> <td class="specs-value fk-data">Round Neck</td> </tr> <tr class=""> <td class="specs-key">Fabric</td> <td class="specs-value fk-data">Cotton</td> </tr> <tr class=""> <td class="specs-key">Number of Contents in Sales Package</td> <td class="specs-value fk-data">Pack of 1</td> </tr> </table> <table cellspacing="0" class="fk-specs-type2"> <tr> <th class="group-head" colspan="2">Additional Details<a class="see-more unitExt rmargin10 no-underline" href="javascript:void(0);" onclick="$(this).closest('.fk-specs-type2').toggleClass('expandedMore')" title="Expand">[+]</a><a class="hidden unitExt rmargin10 no-underline" href="javascript:void(0);" onclick="$(this).closest('.fk-specs-type2').toggleClass('expandedMore')" title="Collapse">[-]</a></th> </tr> <tr class="hidden"> <td class="specs-key">Style Code</td> <td class="specs-value fk-data">LETS5315__Beige</td> </tr> </table> <table cellspacing="0" class="fk-specs-type2"> <tr> <th class="group-head" colspan="2">In the Box</th> </tr> <tr class=""> <td class="specs-key"> </td> <td class="specs-value fk-data">T-Shirt</td> </tr> </table> </div>,11:03:2014,None
LSTTSHDP74ZZDBAZ6HGLEIFHE,Lee Women's Round Neck T-Shirt,http://www.flipkart.com/womens-clothing?otracker=hp_nmenu_sub_women_1_Clothing,Rs. 628,Clothing,Polos & T-Shirts,Lee,http://img6a.flixcart.com/image/t-shirt/6/h/g/lets5283-aqua-lee-m-400x400-imadpa94ruvsrg6d.jpeg,Rs. 899,Aqua,women,http://www.flipkart.com/lee-women-s-round-neck-t-shirt/p/itmdp74zr9bjmvfg?pid=TSHDP74ZZDBAZ6HG&srno=b_15&ref=c4a1ad25-d7a3-4296-ab3a-194cd16cd28f,Fashionara,Lee Women's Round Neck T-Shirt - Buy Aqua Lee Women's Round Neck T-Shirt Online at Best Prices in India | Flipkart.com,Lee Women's Round Neck T-Shirt - Buy Aqua Lee Women's Round Neck T-Shirt For Only Rs. 0.0 Online in India. Shop Online For Apparels. Huge Collection of Branded Clothes Only at,['S'  'M'  'L'  'XL'],<div class="item_left_column" id="description"> <h3 class="item_desc_title fk-uppercase">Lee Women's Round Neck T-Shirt         Price: Rs.628</h3> <div class="cls"></div> <div class="item_desc_text line"> <div style="float:right"> </div>                         Cool off in this casual top. You'd instantly fall in love with the soft  smooth feels of this cotton fabric. The graphic print looks absolutely cool and trendy. Perfect for a casual off-duty day. Club it with bright hue denims with chic glads and wrap around a printed scarf for a stylish look.        </div> <div style="clear: both;"></div> </div>,<div class="item_left_column" id="specifications"> <h3 class="item_desc_title fk-uppercase">         Specifications of Lee Women's Round Neck T-Shirt    </h3> <table cellspacing="0" class="fk-specs-type2"> <tr> <th class="group-head" colspan="2">General Details<a class="see-more unitExt rmargin10 no-underline" href="javascript:void(0);" onclick="$(this).closest('.fk-specs-type2').toggleClass('expandedMore')" title="Expand">[+]</a><a class="hidden unitExt rmargin10 no-underline" href="javascript:void(0);" onclick="$(this).closest('.fk-specs-type2').toggleClass('expandedMore')" title="Collapse">[-]</a></th> </tr> <tr class="hidden"> <td class="specs-key">Ideal For</td> <td class="specs-value fk-data">Women's</td> </tr> <tr class="hidden"> <td class="specs-key">Occasion</td> <td class="specs-value fk-data">Casual</td> </tr> </table> <table cellspacing="0" class="fk-specs-type2"> <tr> <th class="group-head" colspan="2">T-shirt Details</th> </tr> <tr class=""> <td class="specs-key">Type</td> <td class="specs-value fk-data">Round Neck</td> </tr> <tr class=""> <td class="specs-key">Fabric</td> <td class="specs-value fk-data">Cotton</td> </tr> <tr class=""> <td class="specs-key">Number of Contents in Sales Package</td> <td class="specs-value fk-data">Pack of 1</td> </tr> </table> <table cellspacing="0" class="fk-specs-type2"> <tr> <th class="group-head" colspan="2">Additional Details<a class="see-more unitExt rmargin10 no-underline" href="javascript:void(0);" onclick="$(this).closest('.fk-specs-type2').toggleClass('expandedMore')" title="Expand">[+]</a><a class="hidden unitExt rmargin10 no-underline" href="javascript:void(0);" onclick="$(this).closest('.fk-specs-type2').toggleClass('expandedMore')" title="Collapse">[-]</a></th> </tr> <tr class="hidden"> <td class="specs-key">Style Code</td> <td class="specs-value fk-data">LETS5283__Aqua</td> </tr> </table> <table cellspacing="0" class="fk-specs-type2"> <tr> <th class="group-head" colspan="2">In the Box</th> </tr> <tr class=""> <td class="specs-key"> </td> <td class="specs-value fk-data">T-Shirt</td> </tr> </table> </div>,11:03:2014,None
LSTTSHDT59GSMHSP9SDG3WQ0A,Lee Printed Women's Round Neck T-Shirt,http://www.flipkart.com/womens-clothing?otracker=hp_nmenu_sub_women_1_Clothing,Rs. 488,Clothing,Polos & T-Shirts,Lee,http://img6a.flixcart.com/image/t-shirt/h/k/g/lets5332-black-f-lee-xl-400x400-imadt5f6gqnm22kv.jpeg,Rs. 699,Black,women,http://www.flipkart.com/lee-printed-women-s-round-neck-t-shirt/p/itmdt59wkhgc4wja?pid=TSHDT59GSMHSP9SD&srno=b_19&ref=4c178453-3e50-48fd-bbff-4328cd77e3b0,Fashionara,Lee Printed Women's Round Neck T-Shirt - Buy Black Lee Printed Women's Round Neck T-Shirt Online at Best Prices in India | Flipkart.com,Lee Printed Women's Round Neck T-Shirt - Buy Black Lee Printed Women's Round Neck T-Shirt For Only Rs. 0.0 Online in India. Shop Online For Apparels. Huge Collection of Branded Clothes Only at,['S'  'M'  'L'  'XL'],<div class="item_left_column" id="description"> <h3 class="item_desc_title fk-uppercase">Lee Printed Women's Round Neck T-Shirt         Price: Rs.488</h3> <div class="cls"></div> <div class="item_desc_text line"> <div style="float:right"> </div>                         This cotton tee is just right for those casual outings. Made from cotton  the soft  smooth fabric keeps you at ease. So comfy that you'd never want to take them off. Match it with denim shorts or pants and strappy sandals.        </div> <div style="clear: both;"></div> </div>,<div class="item_left_column" id="specifications"> <h3 class="item_desc_title fk-uppercase">         Specifications of Lee Printed Women's Round Neck T-Shirt    </h3> <table cellspacing="0" class="fk-specs-type2"> <tr> <th class="group-head" colspan="2">General Details<a class="see-more unitExt rmargin10 no-underline" href="javascript:void(0);" onclick="$(this).closest('.fk-specs-type2').toggleClass('expandedMore')" title="Expand">[+]</a><a class="hidden unitExt rmargin10 no-underline" href="javascript:void(0);" onclick="$(this).closest('.fk-specs-type2').toggleClass('expandedMore')" title="Collapse">[-]</a></th> </tr> <tr class="hidden"> <td class="specs-key">Ideal For</td> <td class="specs-value fk-data">Women's</td> </tr> <tr class="hidden"> <td class="specs-key">Occasion</td> <td class="specs-value fk-data">Casual</td> </tr> <tr class="hidden"> <td class="specs-key">Pattern</td> <td class="specs-value fk-data">Printed</td> </tr> </table> <table cellspacing="0" class="fk-specs-type2"> <tr> <th class="group-head" colspan="2">T-shirt Details</th> </tr> <tr class=""> <td class="specs-key">Type</td> <td class="specs-value fk-data">Round Neck</td> </tr> <tr class=""> <td class="specs-key">Fabric</td> <td class="specs-value fk-data">Cotton</td> </tr> <tr class=""> <td class="specs-key">Sleeve</td> <td class="specs-value fk-data">Half Sleeve</td> </tr> <tr class=""> <td class="specs-key">Number of Contents in Sales Package</td> <td class="specs-value fk-data">Pack of 1</td> </tr> </table> <table cellspacing="0" class="fk-specs-type2"> <tr> <th class="group-head" colspan="2">Fabric Care</th> </tr> <tr class=""> <td class="specs-value fk-data" colspan="2">Hand wash cold  Use mild detergent  Do not iron on print  Wash dark colours separate  Mild iron</td> </tr> </table> <table cellspacing="0" class="fk-specs-type2"> <tr> <th class="group-head" colspan="2">Additional Details<a class="see-more unitExt rmargin10 no-underline" href="javascript:void(0);" onclick="$(this).closest('.fk-specs-type2').toggleClass('expandedMore')" title="Expand">[+]</a><a class="hidden unitExt rmargin10 no-underline" href="javascript:void(0);" onclick="$(this).closest('.fk-specs-type2').toggleClass('expandedMore')" title="Collapse">[-]</a></th> </tr> <tr class="hidden"> <td class="specs-key">Style Code</td> <td class="specs-value fk-data">LETS5332_Black..F</td> </tr> </table> <table cellspacing="0" class="fk-specs-type2"> <tr> <th class="group-head" colspan="2">In the Box</th> </tr> <tr class=""> <td class="specs-key"> </td> <td class="specs-value fk-data">T Shirt</td> </tr> </table> </div>,11:03:2014,None
LSTTSHDT59GZ57ZVPJGZTS2GR,Lee Printed Women's Round Neck T-Shirt,http://www.flipkart.com/womens-clothing?otracker=hp_nmenu_sub_women_1_Clothing,Rs. 449,Clothing,Polos & T-Shirts,Lee,http://img5a.flixcart.com/image/t-shirt/p/j/g/lets5286-grey-f-lee-m-400x400-imadt5fqsetnhmqg.jpeg,Rs. 899,Grey,women,http://www.flipkart.com/lee-printed-women-s-round-neck-t-shirt/p/itmdt59wwyy6y7w6?pid=TSHDT59GZ57ZVPJG&srno=b_20&ref=4c178453-3e50-48fd-bbff-4328cd77e3b0,Fashionara,Lee Printed Women's Round Neck T-Shirt - Buy Grey Lee Printed Women's Round Neck T-Shirt Online at Best Prices in India | Flipkart.com,Lee Printed Women's Round Neck T-Shirt - Buy Grey Lee Printed Women's Round Neck T-Shirt For Only Rs. 0.0 Online in India. Shop Online For Apparels. Huge Collection of Branded Clothes Only at,['L'],<div class="item_left_column" id="description"> <h3 class="item_desc_title fk-uppercase">Lee Printed Women's Round Neck T-Shirt         Price: Rs.449</h3> <div class="cls"></div> <div class="item_desc_text line"> <div style="float:right"> </div>                         This cool printed cotton blend tee shirt is just right for your casual wardrobe. The textured soft knit fabric adds a worn out yet stylish look. Team it with skinny jeans and sneakers for a nonchalant high fashion look!        </div> <div style="clear: both;"></div> </div>,<div class="item_left_column" id="specifications"> <h3 class="item_desc_title fk-uppercase">         Specifications of Lee Printed Women's Round Neck T-Shirt    </h3> <table cellspacing="0" class="fk-specs-type2"> <tr> <th class="group-head" colspan="2">General Details<a class="see-more unitExt rmargin10 no-underline" href="javascript:void(0);" onclick="$(this).closest('.fk-specs-type2').toggleClass('expandedMore')" title="Expand">[+]</a><a class="hidden unitExt rmargin10 no-underline" href="javascript:void(0);" onclick="$(this).closest('.fk-specs-type2').toggleClass('expandedMore')" title="Collapse">[-]</a></th> </tr> <tr class="hidden"> <td class="specs-key">Ideal For</td> <td class="specs-value fk-data">Women's</td> </tr> <tr class="hidden"> <td class="specs-key">Occasion</td> <td class="specs-value fk-data">Casual</td> </tr> <tr class="hidden"> <td class="specs-key">Pattern</td> <td class="specs-value fk-data">Printed</td> </tr> </table> <table cellspacing="0" class="fk-specs-type2"> <tr> <th class="group-head" colspan="2">T-shirt Details</th> </tr> <tr class=""> <td class="specs-key">Type</td> <td class="specs-value fk-data">Round Neck</td> </tr> <tr class=""> <td class="specs-key">Fabric</td> <td class="specs-value fk-data">Cotton</td> </tr> <tr class=""> <td class="specs-key">Sleeve</td> <td class="specs-value fk-data">Half Sleeve</td> </tr> <tr class=""> <td class="specs-key">Number of Contents in Sales Package</td> <td class="specs-value fk-data">Pack of 1</td> </tr> </table> <table cellspacing="0" class="fk-specs-type2"> <tr> <th class="group-head" colspan="2">Fabric Care</th> </tr> <tr class=""> <td class="specs-value fk-data" colspan="2">Use mild detergent  Wash with like colours  Hand or machine wash  Dry in shade  Warm iron</td> </tr> </table> <table cellspacing="0" class="fk-specs-type2"> <tr> <th class="group-head" colspan="2">Additional Details<a class="see-more unitExt rmargin10 no-underline" href="javascript:void(0);" onclick="$(this).closest('.fk-specs-type2').toggleClass('expandedMore')" title="Expand">[+]</a><a class="hidden unitExt rmargin10 no-underline" href="javascript:void(0);" onclick="$(this).closest('.fk-specs-type2').toggleClass('expandedMore')" title="Collapse">[-]</a></th> </tr> <tr class="hidden"> <td class="specs-key">Style Code</td> <td class="specs-value fk-data">LETS5286 _Grey..F</td> </tr> </table> <table cellspacing="0" class="fk-specs-type2"> <tr> <th class="group-head" colspan="2">In the Box</th> </tr> <tr class=""> <td class="specs-key"> </td> <td class="specs-value fk-data">T Shirt</td> </tr> </table> </div>,11:03:2014,None
LSTTSHDT59RHEY5VZZR1FZVSN,Lee Solid Women's Round Neck T-Shirt,http://www.flipkart.com/womens-clothing?otracker=hp_nmenu_sub_women_1_Clothing,Rs. 558,Clothing,Polos & T-Shirts,Lee,http://img6a.flixcart.com/image/t-shirt/z/z/r/lets5682-black-f-lee-xl-400x400-imadt5fbg8chdtqr.jpeg,Rs. 799,Black,women,http://www.flipkart.com/lee-solid-women-s-round-neck-t-shirt/p/itmdt5agbqu2wazt?pid=TSHDT59RHEY5VZZR&srno=b_21&ref=4c178453-3e50-48fd-bbff-4328cd77e3b0,Fashionara,Lee Solid Women's Round Neck T-Shirt - Buy Black Lee Solid Women's Round Neck T-Shirt Online at Best Prices in India | Flipkart.com,Lee Solid Women's Round Neck T-Shirt - Buy Black Lee Solid Women's Round Neck T-Shirt For Only Rs. 0.0 Online in India. Shop Online For Apparels. Huge Collection of Branded Clothes Only at,['S'  'M'  'L'],<div class="item_left_column" id="description"> <h3 class="item_desc_title fk-uppercase">Lee Solid Women's Round Neck T-Shirt         Price: Rs.558</h3> <div class="cls"></div> <div class="item_desc_text line"> <div style="float:right"> </div>                         A summer staple  this will be your go to summer pick from the first time you try it. Featuring a light viscose rayon fabric  this is designed to fit you perfectly and add curves. It also has a sheen and a high-low hem making it perfect for a casual evening out! Wear this with shorts and glitter ballerinas. Accessorise with wayfarers!        </div> <div style="clear: both;"></div> </div>,<div class="item_left_column" id="specifications"> <h3 class="item_desc_title fk-uppercase">         Specifications of Lee Solid Women's Round Neck T-Shirt    </h3> <table cellspacing="0" class="fk-specs-type2"> <tr> <th class="group-head" colspan="2">General Details<a class="see-more unitExt rmargin10 no-underline" href="javascript:void(0);" onclick="$(this).closest('.fk-specs-type2').toggleClass('expandedMore')" title="Expand">[+]</a><a class="hidden unitExt rmargin10 no-underline" href="javascript:void(0);" onclick="$(this).closest('.fk-specs-type2').toggleClass('expandedMore')" title="Collapse">[-]</a></th> </tr> <tr class="hidden"> <td class="specs-key">Ideal For</td> <td class="specs-value fk-data">Women's</td> </tr> <tr class="hidden"> <td class="specs-key">Occasion</td> <td class="specs-value fk-data">Casual</td> </tr> <tr class="hidden"> <td class="specs-key">Pattern</td> <td class="specs-value fk-data">Solid</td> </tr> </table> <table cellspacing="0" class="fk-specs-type2"> <tr> <th class="group-head" colspan="2">T-shirt Details</th> </tr> <tr class=""> <td class="specs-key">Type</td> <td class="specs-value fk-data">Round Neck</td> </tr> <tr class=""> <td class="specs-key">Fabric</td> <td class="specs-value fk-data">Cotton</td> </tr> <tr class=""> <td class="specs-key">Sleeve</td> <td class="specs-value fk-data">Half Sleeve</td> </tr> <tr class=""> <td class="specs-key">Number of Contents in Sales Package</td> <td class="specs-value fk-data">Pack of 1</td> </tr> </table> <table cellspacing="0" class="fk-specs-type2"> <tr> <th class="group-head" colspan="2">Fabric Care</th> </tr> <tr class=""> <td class="specs-value fk-data" colspan="2">Prone to pill  Machine wash cold  Mild iron  Do not wring</td> </tr> </table> <table cellspacing="0" class="fk-specs-type2"> <tr> <th class="group-head" colspan="2">Additional Details<a class="see-more unitExt rmargin10 no-underline" href="javascript:void(0);" onclick="$(this).closest('.fk-specs-type2').toggleClass('expandedMore')" title="Expand">[+]</a><a class="hidden unitExt rmargin10 no-underline" href="javascript:void(0);" onclick="$(this).closest('.fk-specs-type2').toggleClass('expandedMore')" title="Collapse">[-]</a></th> </tr> <tr class="hidden"> <td class="specs-key">Style Code</td> <td class="specs-value fk-data">LETS5682_Black..F</td> </tr> </table> <table cellspacing="0" class="fk-specs-type2"> <tr> <th class="group-head" colspan="2">In the Box</th> </tr> <tr class=""> <td class="specs-key"> </td> <td class="specs-value fk-data">T Shirt</td> </tr> </table> </div>,11:03:2014,None
LSTTSHDR72AVZCE9MADLZYBRU,Lee Printed Women's Round Neck T-Shirt,http://www.flipkart.com/womens-clothing?otracker=hp_nmenu_sub_women_1_Clothing,Rs. 488,Clothing,Polos & T-Shirts,Lee,http://img6a.flixcart.com/image/t-shirt/w/x/f/lets5613light-grey-f-lee-xl-400x400-imadrcwvpznkncz4.jpeg,Rs. 699,Light Grey,women,http://www.flipkart.com/lee-printed-women-s-round-neck-t-shirt/p/itmdr72gsjthw2k7?pid=TSHDR72AVZCE9MAD&srno=b_5&ref=c4a1ad25-d7a3-4296-ab3a-194cd16cd28f,Fashionara,Lee Printed Women's Round Neck T-Shirt - Buy Light Grey Lee Printed Women's Round Neck T-Shirt Online at Best Prices in India | Flipkart.com,Lee Printed Women's Round Neck T-Shirt - Buy Light Grey Lee Printed Women's Round Neck T-Shirt For Only Rs. 0.0 Online in India. Shop Online For Apparels. Huge Collection of Branded Clothes Only at,['S'  'M'  'L'],<div class="item_left_column" id="description"> <h3 class="item_desc_title fk-uppercase">Lee Printed Women's Round Neck T-Shirt         Price: Rs.488</h3> <div class="cls"></div> <div class="item_desc_text line"> <div style="float:right"> </div>                         Simple yet funky is how this tee can be described. With a quote printed in front  it adds fun to the garment. Wear this with coloured denims and converse sneakers.        </div> <div style="clear: both;"></div> </div>,<div class="item_left_column" id="specifications"> <h3 class="item_desc_title fk-uppercase">         Specifications of Lee Printed Women's Round Neck T-Shirt    </h3> <table cellspacing="0" class="fk-specs-type2"> <tr> <th class="group-head" colspan="2">General Details<a class="see-more unitExt rmargin10 no-underline" href="javascript:void(0);" onclick="$(this).closest('.fk-specs-type2').toggleClass('expandedMore')" title="Expand">[+]</a><a class="hidden unitExt rmargin10 no-underline" href="javascript:void(0);" onclick="$(this).closest('.fk-specs-type2').toggleClass('expandedMore')" title="Collapse">[-]</a></th> </tr> <tr class="hidden"> <td class="specs-key">Ideal For</td> <td class="specs-value fk-data">Women's</td> </tr> <tr class="hidden"> <td class="specs-key">Occasion</td> <td class="specs-value fk-data">Casual</td> </tr> <tr class="hidden"> <td class="specs-key">Pattern</td> <td class="specs-value fk-data">Printed</td> </tr> </table> <table cellspacing="0" class="fk-specs-type2"> <tr> <th class="group-head" colspan="2">T-shirt Details</th> </tr> <tr class=""> <td class="specs-key">Type</td> <td class="specs-value fk-data">Round Neck</td> </tr> <tr class=""> <td class="specs-key">Fabric</td> <td class="specs-value fk-data">Cotton</td> </tr> <tr class=""> <td class="specs-key">Sleeve</td> <td class="specs-value fk-data">Half Sleeve</td> </tr> <tr class=""> <td class="specs-key">Number of Contents in Sales Package</td> <td class="specs-value fk-data">Pack of 1</td> </tr> </table> <table cellspacing="0" class="fk-specs-type2"> <tr> <th class="group-head" colspan="2">Additional Details<a class="see-more unitExt rmargin10 no-underline" href="javascript:void(0);" onclick="$(this).closest('.fk-specs-type2').toggleClass('expandedMore')" title="Expand">[+]</a><a class="hidden unitExt rmargin10 no-underline" href="javascript:void(0);" onclick="$(this).closest('.fk-specs-type2').toggleClass('expandedMore')" title="Collapse">[-]</a></th> </tr> <tr class="hidden"> <td class="specs-key">Style Code</td> <td class="specs-value fk-data">LETS5613Light Grey..f</td> </tr> </table> <table cellspacing="0" class="fk-specs-type2"> <tr> <th class="group-head" colspan="2">In the Box</th> </tr> <tr class=""> <td class="specs-key"> </td> <td class="specs-value fk-data">T Shirt</td> </tr> </table> </div>,11:03:2014,None
