LSTTSHDP74NBQDWU4FCVTVGOJ,Lee Printed Women's Round Neck T-Shirt,http://www.flipkart.com/womens-clothing?otracker=hp_nmenu_sub_women_1_Clothing,Rs. 558,Clothing,Polos & T-Shirts,Lee,http://img6a.flixcart.com/image/t-shirt/k/g/8/lets5281-white-lee-xl-400x400-imadpa92akntmpj6.jpeg,Rs. 799,White,women,http://www.flipkart.com/lee-printed-women-s-round-neck-t-shirt/p/itmdp74z3encdzsg?pid=TSHDP74NBQDWU4FC&srno=b_1&ref=675ea2d5-ab3e-4845-8cdd-21bcfe1e5c8a,Fashionara,Lee Printed Women's Round Neck T-Shirt - Buy White Lee Printed Women's Round Neck T-Shirt Online at Best Prices in India | Flipkart.com,Lee Printed Women's Round Neck T-Shirt - Buy White Lee Printed Women's Round Neck T-Shirt For Only Rs. 0.0 Online in India. Shop Online For Apparels. Huge Collection of Branded Clothes Only at,['S'  'M'  'L'  'XL'],<div class="item_left_column" id="description"> <h3 class="item_desc_title fk-uppercase">Lee Printed Women's Round Neck T-Shirt         Price: Rs.558</h3> <div class="cls"></div> <div class="item_desc_text line"> <div style="float:right"> </div>                         Get a chic casual look by slipping on this trendy t-shirt. Features a high-fashion graphic print that looks super-cool. You'd love the comfortable fit that looks flattering at the same time. Made from 100% cotton  it is light  smooth and extremely comfortable. Wear it with bright hue crop pants  wedge heels and wrap around a printed scarf.        </div> <div style="clear: both;"></div> </div>,<div class="item_left_column" id="specifications"> <h3 class="item_desc_title fk-uppercase">         Specifications of Lee Printed Women's Round Neck T-Shirt    </h3> <table cellspacing="0" class="fk-specs-type2"> <tr> <th class="group-head" colspan="2">General Details<a class="see-more unitExt rmargin10 no-underline" href="javascript:void(0);" onclick="$(this).closest('.fk-specs-type2').toggleClass('expandedMore')" title="Expand">[+]</a><a class="hidden unitExt rmargin10 no-underline" href="javascript:void(0);" onclick="$(this).closest('.fk-specs-type2').toggleClass('expandedMore')" title="Collapse">[-]</a></th> </tr> <tr class="hidden"> <td class="specs-key">Ideal For</td> <td class="specs-value fk-data">Women's</td> </tr> <tr class="hidden"> <td class="specs-key">Occasion</td> <td class="specs-value fk-data">Casual</td> </tr> <tr class="hidden"> <td class="specs-key">Pattern</td> <td class="specs-value fk-data">Printed</td> </tr> </table> <table cellspacing="0" class="fk-specs-type2"> <tr> <th class="group-head" colspan="2">T-shirt Details</th> </tr> <tr class=""> <td class="specs-key">Type</td> <td class="specs-value fk-data">Round Neck</td> </tr> <tr class=""> <td class="specs-key">Fabric</td> <td class="specs-value fk-data">Cotton</td> </tr> <tr class=""> <td class="specs-key">Number of Contents in Sales Package</td> <td class="specs-value fk-data">Pack of 1</td> </tr> </table> <table cellspacing="0" class="fk-specs-type2"> <tr> <th class="group-head" colspan="2">Additional Details<a class="see-more unitExt rmargin10 no-underline" href="javascript:void(0);" onclick="$(this).closest('.fk-specs-type2').toggleClass('expandedMore')" title="Expand">[+]</a><a class="hidden unitExt rmargin10 no-underline" href="javascript:void(0);" onclick="$(this).closest('.fk-specs-type2').toggleClass('expandedMore')" title="Collapse">[-]</a></th> </tr> <tr class="hidden"> <td class="specs-key">Style Code</td> <td class="specs-value fk-data">LETS5281__White</td> </tr> </table> <table cellspacing="0" class="fk-specs-type2"> <tr> <th class="group-head" colspan="2">In the Box</th> </tr> <tr class=""> <td class="specs-key"> </td> <td class="specs-value fk-data">T-Shirt</td> </tr> </table> </div>,11:03:2014,None
LSTTSHDPVHFAXFGAZJJZTYCBC,Lee Solid Women's Round Neck T-Shirt,http://www.flipkart.com/womens-clothing?otracker=hp_nmenu_sub_women_1_Clothing,Rs. 629,Clothing,Polos & T-Shirts,Lee,http://img5a.flixcart.com/image/t-shirt/z/j/j/lets5752vivacious-lee-s-400x400-imadqz8azmaskhnf.jpeg,Rs. 899,Pink,women,http://www.flipkart.com/lee-solid-women-s-round-neck-t-shirt/p/itmdpvhgtwjjay3k?pid=TSHDPVHFAXFGAZJJ&srno=b_8&ref=675ea2d5-ab3e-4845-8cdd-21bcfe1e5c8a,WS Retail,Lee Solid Women's Round Neck T-Shirt - Buy Pink Lee Solid Women's Round Neck T-Shirt Online at Best Prices in India | Flipkart.com,Lee Solid Women's Round Neck T-Shirt - Buy Pink Lee Solid Women's Round Neck T-Shirt For Only Rs. 899.0 Online in India. Shop Online For Apparels. Huge Collection of Branded Clothes Only at,['S'  'M'],None,<div class="item_left_column" id="specifications"> <h3 class="item_desc_title fk-uppercase">         Specifications of Lee Solid Women's Round Neck T-Shirt    </h3> <table cellspacing="0" class="fk-specs-type2"> <tr> <th class="group-head" colspan="2">General Details<a class="see-more unitExt rmargin10 no-underline" href="javascript:void(0);" onclick="$(this).closest('.fk-specs-type2').toggleClass('expandedMore')" title="Expand">[+]</a><a class="hidden unitExt rmargin10 no-underline" href="javascript:void(0);" onclick="$(this).closest('.fk-specs-type2').toggleClass('expandedMore')" title="Collapse">[-]</a></th> </tr> <tr class="hidden"> <td class="specs-key">Ideal For</td> <td class="specs-value fk-data">Women's</td> </tr> <tr class="hidden"> <td class="specs-key">Occasion</td> <td class="specs-value fk-data">Casual</td> </tr> <tr class="hidden"> <td class="specs-key">Pattern</td> <td class="specs-value fk-data">Solid</td> </tr> </table> <table cellspacing="0" class="fk-specs-type2"> <tr> <th class="group-head" colspan="2">T-shirt Details</th> </tr> <tr class=""> <td class="specs-key">Type</td> <td class="specs-value fk-data">Round Neck</td> </tr> <tr class=""> <td class="specs-key">Fabric</td> <td class="specs-value fk-data">Vortex  Viscose</td> </tr> <tr class=""> <td class="specs-key">Style</td> <td class="specs-value fk-data">Panelled Back</td> </tr> <tr class=""> <td class="specs-key">Sleeve</td> <td class="specs-value fk-data">Full Sleeve</td> </tr> </table> <table cellspacing="0" class="fk-specs-type2"> <tr> <th class="group-head" colspan="2">Fabric Care</th> </tr> <tr class=""> <td class="specs-value fk-data" colspan="2">Hand Wash  Low Iron  Do Not Bleach  Do Not Tumble Dry  Do Not Wring  Dry in Shade</td> </tr> </table> <table cellspacing="0" class="fk-specs-type2"> <tr> <th class="group-head" colspan="2">Additional Details<a class="see-more unitExt rmargin10 no-underline" href="javascript:void(0);" onclick="$(this).closest('.fk-specs-type2').toggleClass('expandedMore')" title="Expand">[+]</a><a class="hidden unitExt rmargin10 no-underline" href="javascript:void(0);" onclick="$(this).closest('.fk-specs-type2').toggleClass('expandedMore')" title="Collapse">[-]</a></th> </tr> <tr class="hidden"> <td class="specs-key">Style Code</td> <td class="specs-value fk-data">LETS5752VIVACIOUS</td> </tr> <tr class="hidden"> <td class="specs-key">Other Details</td> <td class="specs-value fk-data">Ribbed Neck</td> </tr> <tr class="hidden"> <td class="specs-key">Model Details</td> <td class="specs-value fk-data">This model has a height of 5 feet 8 inches  bust size of 34 inches and is wearing a T-Shirt of Size S</td> </tr> </table> </div>,11:03:2014,None
LSTTSHDP74MEFJVBAY8OWPUJ9,Lee Printed Women's Round Neck T-Shirt,http://www.flipkart.com/womens-clothing?otracker=hp_nmenu_sub_women_1_Clothing,Rs. 558,Clothing,Polos & T-Shirts,Lee,http://img6a.flixcart.com/image/t-shirt/a/y/8/lets5280-aqua-lee-xl-400x400-imadpa7dzvyu7ez7.jpeg,Rs. 799,Aqua,women,http://www.flipkart.com/lee-printed-women-s-round-neck-t-shirt/p/itmdp74nszp7xcpc?pid=TSHDP74MEFJVBAY8&srno=b_4&ref=675ea2d5-ab3e-4845-8cdd-21bcfe1e5c8a,Fashionara,Lee Printed Women's Round Neck T-Shirt - Buy Aqua Lee Printed Women's Round Neck T-Shirt Online at Best Prices in India | Flipkart.com,Lee Printed Women's Round Neck T-Shirt - Buy Aqua Lee Printed Women's Round Neck T-Shirt For Only Rs. 0.0 Online in India. Shop Online For Apparels. Huge Collection of Branded Clothes Only at,['S'  'XL'],<div class="item_left_column" id="description"> <h3 class="item_desc_title fk-uppercase">Lee Printed Women's Round Neck T-Shirt         Price: Rs.558</h3> <div class="cls"></div> <div class="item_desc_text line"> <div style="float:right"> </div>                         Get a chic casual look by slipping on this trendy t-shirt. Features a high-fashion graphic print that looks super-cool. You'd love the comfortable fit that looks flattering at the same time. Made from 100% cotton  it is light  smooth and extremely comfortable. Wear it with bright hue crop pants  wedge heels and wrap around a printed scarf.        </div> <div style="clear: both;"></div> </div>,<div class="item_left_column" id="specifications"> <h3 class="item_desc_title fk-uppercase">         Specifications of Lee Printed Women's Round Neck T-Shirt    </h3> <table cellspacing="0" class="fk-specs-type2"> <tr> <th class="group-head" colspan="2">General Details<a class="see-more unitExt rmargin10 no-underline" href="javascript:void(0);" onclick="$(this).closest('.fk-specs-type2').toggleClass('expandedMore')" title="Expand">[+]</a><a class="hidden unitExt rmargin10 no-underline" href="javascript:void(0);" onclick="$(this).closest('.fk-specs-type2').toggleClass('expandedMore')" title="Collapse">[-]</a></th> </tr> <tr class="hidden"> <td class="specs-key">Ideal For</td> <td class="specs-value fk-data">Women's</td> </tr> <tr class="hidden"> <td class="specs-key">Occasion</td> <td class="specs-value fk-data">Casual</td> </tr> <tr class="hidden"> <td class="specs-key">Pattern</td> <td class="specs-value fk-data">Printed</td> </tr> </table> <table cellspacing="0" class="fk-specs-type2"> <tr> <th class="group-head" colspan="2">T-shirt Details</th> </tr> <tr class=""> <td class="specs-key">Type</td> <td class="specs-value fk-data">Round Neck</td> </tr> <tr class=""> <td class="specs-key">Fabric</td> <td class="specs-value fk-data">Cotton</td> </tr> <tr class=""> <td class="specs-key">Number of Contents in Sales Package</td> <td class="specs-value fk-data">Pack of 1</td> </tr> </table> <table cellspacing="0" class="fk-specs-type2"> <tr> <th class="group-head" colspan="2">Additional Details<a class="see-more unitExt rmargin10 no-underline" href="javascript:void(0);" onclick="$(this).closest('.fk-specs-type2').toggleClass('expandedMore')" title="Expand">[+]</a><a class="hidden unitExt rmargin10 no-underline" href="javascript:void(0);" onclick="$(this).closest('.fk-specs-type2').toggleClass('expandedMore')" title="Collapse">[-]</a></th> </tr> <tr class="hidden"> <td class="specs-key">Style Code</td> <td class="specs-value fk-data">LETS5280__Aqua</td> </tr> </table> <table cellspacing="0" class="fk-specs-type2"> <tr> <th class="group-head" colspan="2">In the Box</th> </tr> <tr class=""> <td class="specs-key"> </td> <td class="specs-value fk-data">T-Shirt</td> </tr> </table> </div>,11:03:2014,None
LSTTSHDP74MGGMHUGENXB7LPW,Lee Women's Round Neck T-Shirt,http://www.flipkart.com/womens-clothing?otracker=hp_nmenu_sub_women_1_Clothing,Rs. 628,Clothing,Polos & T-Shirts,Lee,http://img5a.flixcart.com/image/t-shirt/w/z/e/lets5284-purple-lee-xl-400x400-imadpa7a8tyruagg.jpeg,Rs. 899,Purple,women,http://www.flipkart.com/lee-women-s-round-neck-t-shirt/p/itmdp74htzwqdmwb?pid=TSHDP74MGGMHUGEN&srno=b_9&ref=675ea2d5-ab3e-4845-8cdd-21bcfe1e5c8a,Fashionara,Lee Women's Round Neck T-Shirt - Buy Purple Lee Women's Round Neck T-Shirt Online at Best Prices in India | Flipkart.com,Lee Women's Round Neck T-Shirt - Buy Purple Lee Women's Round Neck T-Shirt For Only Rs. 0.0 Online in India. Shop Online For Apparels. Huge Collection of Branded Clothes Only at,['S'  'M'  'L'  'XL'],<div class="item_left_column" id="description"> <h3 class="item_desc_title fk-uppercase">Lee Women's Round Neck T-Shirt         Price: Rs.628</h3> <div class="cls"></div> <div class="item_desc_text line"> <div style="float:right"> </div>                         Cool off in this casual top. You'd instantly fall in love with the soft  smooth feels of this cotton fabric. The graphic print looks absolutely cool and trendy. Perfect for a casual off-duty day. Club it with bright hue denims with chic glads and wrap around a printed scarf for a stylish look.        </div> <div style="clear: both;"></div> </div>,<div class="item_left_column" id="specifications"> <h3 class="item_desc_title fk-uppercase">         Specifications of Lee Women's Round Neck T-Shirt    </h3> <table cellspacing="0" class="fk-specs-type2"> <tr> <th class="group-head" colspan="2">General Details<a class="see-more unitExt rmargin10 no-underline" href="javascript:void(0);" onclick="$(this).closest('.fk-specs-type2').toggleClass('expandedMore')" title="Expand">[+]</a><a class="hidden unitExt rmargin10 no-underline" href="javascript:void(0);" onclick="$(this).closest('.fk-specs-type2').toggleClass('expandedMore')" title="Collapse">[-]</a></th> </tr> <tr class="hidden"> <td class="specs-key">Ideal For</td> <td class="specs-value fk-data">Women's</td> </tr> <tr class="hidden"> <td class="specs-key">Occasion</td> <td class="specs-value fk-data">Casual</td> </tr> </table> <table cellspacing="0" class="fk-specs-type2"> <tr> <th class="group-head" colspan="2">T-shirt Details</th> </tr> <tr class=""> <td class="specs-key">Type</td> <td class="specs-value fk-data">Round Neck</td> </tr> <tr class=""> <td class="specs-key">Fabric</td> <td class="specs-value fk-data">Cotton</td> </tr> <tr class=""> <td class="specs-key">Number of Contents in Sales Package</td> <td class="specs-value fk-data">Pack of 1</td> </tr> </table> <table cellspacing="0" class="fk-specs-type2"> <tr> <th class="group-head" colspan="2">Additional Details<a class="see-more unitExt rmargin10 no-underline" href="javascript:void(0);" onclick="$(this).closest('.fk-specs-type2').toggleClass('expandedMore')" title="Expand">[+]</a><a class="hidden unitExt rmargin10 no-underline" href="javascript:void(0);" onclick="$(this).closest('.fk-specs-type2').toggleClass('expandedMore')" title="Collapse">[-]</a></th> </tr> <tr class="hidden"> <td class="specs-key">Style Code</td> <td class="specs-value fk-data">LETS5284__Purple</td> </tr> </table> <table cellspacing="0" class="fk-specs-type2"> <tr> <th class="group-head" colspan="2">In the Box</th> </tr> <tr class=""> <td class="specs-key"> </td> <td class="specs-value fk-data">T-Shirt</td> </tr> </table> </div>,11:03:2014,None
LSTTSHDR729GNX3MMHBXGGBZX,Lee Printed Women's Round Neck T-Shirt,http://www.flipkart.com/womens-clothing?otracker=hp_nmenu_sub_women_1_Clothing,Rs. 488,Clothing,Polos & T-Shirts,Lee,http://img5a.flixcart.com/image/t-shirt/8/w/x/lets5612white-f-lee-l-400x400-imadrcwpqsrtyywb.jpeg,Rs. 699,White,women,http://www.flipkart.com/lee-printed-women-s-round-neck-t-shirt/p/itmdr728mchvseyx?pid=TSHDR729GNX3MMHB&srno=b_17&ref=3b900ddf-72dd-4b6e-9f78-dbccc05d4056,Fashionara,Lee Printed Women's Round Neck T-Shirt - Buy White Lee Printed Women's Round Neck T-Shirt Online at Best Prices in India | Flipkart.com,Lee Printed Women's Round Neck T-Shirt - Buy White Lee Printed Women's Round Neck T-Shirt For Only Rs. 0.0 Online in India. Shop Online For Apparels. Huge Collection of Branded Clothes Only at,['M'  'L'  'XL'],<div class="item_left_column" id="description"> <h3 class="item_desc_title fk-uppercase">Lee Printed Women's Round Neck T-Shirt         Price: Rs.488</h3> <div class="cls"></div> <div class="item_desc_text line"> <div style="float:right"> </div>                         A perfect day tee. Features cool graphics and with quirky writings and has a shaded effect. The bright colors stand out and look gorgeous. It's extremely pretty and peppy. Cotton fabric ensures comfort too. Slip it on with ripped denims and sneakers for an absolute casual look.        </div> <div style="clear: both;"></div> </div>,<div class="item_left_column" id="specifications"> <h3 class="item_desc_title fk-uppercase">         Specifications of Lee Printed Women's Round Neck T-Shirt    </h3> <table cellspacing="0" class="fk-specs-type2"> <tr> <th class="group-head" colspan="2">General Details<a class="see-more unitExt rmargin10 no-underline" href="javascript:void(0);" onclick="$(this).closest('.fk-specs-type2').toggleClass('expandedMore')" title="Expand">[+]</a><a class="hidden unitExt rmargin10 no-underline" href="javascript:void(0);" onclick="$(this).closest('.fk-specs-type2').toggleClass('expandedMore')" title="Collapse">[-]</a></th> </tr> <tr class="hidden"> <td class="specs-key">Ideal For</td> <td class="specs-value fk-data">Women's</td> </tr> <tr class="hidden"> <td class="specs-key">Occasion</td> <td class="specs-value fk-data">Casual</td> </tr> <tr class="hidden"> <td class="specs-key">Pattern</td> <td class="specs-value fk-data">Printed</td> </tr> </table> <table cellspacing="0" class="fk-specs-type2"> <tr> <th class="group-head" colspan="2">T-shirt Details</th> </tr> <tr class=""> <td class="specs-key">Type</td> <td class="specs-value fk-data">Round Neck</td> </tr> <tr class=""> <td class="specs-key">Fabric</td> <td class="specs-value fk-data">Cotton</td> </tr> <tr class=""> <td class="specs-key">Sleeve</td> <td class="specs-value fk-data">Half Sleeve</td> </tr> <tr class=""> <td class="specs-key">Number of Contents in Sales Package</td> <td class="specs-value fk-data">Pack of 1</td> </tr> </table> <table cellspacing="0" class="fk-specs-type2"> <tr> <th class="group-head" colspan="2">Additional Details<a class="see-more unitExt rmargin10 no-underline" href="javascript:void(0);" onclick="$(this).closest('.fk-specs-type2').toggleClass('expandedMore')" title="Expand">[+]</a><a class="hidden unitExt rmargin10 no-underline" href="javascript:void(0);" onclick="$(this).closest('.fk-specs-type2').toggleClass('expandedMore')" title="Collapse">[-]</a></th> </tr> <tr class="hidden"> <td class="specs-key">Style Code</td> <td class="specs-value fk-data">LETS5612White..f</td> </tr> </table> <table cellspacing="0" class="fk-specs-type2"> <tr> <th class="group-head" colspan="2">In the Box</th> </tr> <tr class=""> <td class="specs-key"> </td> <td class="specs-value fk-data">T Shirt</td> </tr> </table> </div>,11:03:2014,None
LSTTSHDP74N7HQ3QGT38DOVMC,Lee Printed Women's Round Neck T-Shirt,http://www.flipkart.com/womens-clothing?otracker=hp_nmenu_sub_women_1_Clothing,Rs. 488,Clothing,Polos & T-Shirts,Lee,http://img5a.flixcart.com/image/t-shirt/h/s/q/lets5322-dark-blue-lee-s-400x400-imadpa7erfgfgb3p.jpeg,Rs. 699,Dark Blue,women,http://www.flipkart.com/lee-printed-women-s-round-neck-t-shirt/p/itmdp74n2grzgagk?pid=TSHDP74N7HQ3QGT3&srno=b_14&ref=675ea2d5-ab3e-4845-8cdd-21bcfe1e5c8a,Fashionara,Lee Printed Women's Round Neck T-Shirt - Buy Dark Blue Lee Printed Women's Round Neck T-Shirt Online at Best Prices in India | Flipkart.com,Lee Printed Women's Round Neck T-Shirt - Buy Dark Blue Lee Printed Women's Round Neck T-Shirt For Only Rs. 0.0 Online in India. Shop Online For Apparels. Huge Collection of Branded Clothes Only at,['S'  'M'  'L'  'XL'],<div class="item_left_column" id="description"> <h3 class="item_desc_title fk-uppercase">Lee Printed Women's Round Neck T-Shirt         Price: Rs.488</h3> <div class="cls"></div> <div class="item_desc_text line"> <div style="float:right"> </div>                         Give your everyday dressing a casually chic appeal with this printed tee. The pastel print adds a feminine touch to the regular silhouette. The cotton tee promises to keep you feeling fresh and comfortable all day long. Wear this tee with skinny jeans and some on-trend ballerinas for an effortlessly stylish look.        </div> <div style="clear: both;"></div> </div>,<div class="item_left_column" id="specifications"> <h3 class="item_desc_title fk-uppercase">         Specifications of Lee Printed Women's Round Neck T-Shirt    </h3> <table cellspacing="0" class="fk-specs-type2"> <tr> <th class="group-head" colspan="2">General Details<a class="see-more unitExt rmargin10 no-underline" href="javascript:void(0);" onclick="$(this).closest('.fk-specs-type2').toggleClass('expandedMore')" title="Expand">[+]</a><a class="hidden unitExt rmargin10 no-underline" href="javascript:void(0);" onclick="$(this).closest('.fk-specs-type2').toggleClass('expandedMore')" title="Collapse">[-]</a></th> </tr> <tr class="hidden"> <td class="specs-key">Ideal For</td> <td class="specs-value fk-data">Women's</td> </tr> <tr class="hidden"> <td class="specs-key">Occasion</td> <td class="specs-value fk-data">Casual</td> </tr> <tr class="hidden"> <td class="specs-key">Pattern</td> <td class="specs-value fk-data">Printed</td> </tr> </table> <table cellspacing="0" class="fk-specs-type2"> <tr> <th class="group-head" colspan="2">T-shirt Details</th> </tr> <tr class=""> <td class="specs-key">Type</td> <td class="specs-value fk-data">Round Neck</td> </tr> <tr class=""> <td class="specs-key">Fabric</td> <td class="specs-value fk-data">Cotton</td> </tr> <tr class=""> <td class="specs-key">Number of Contents in Sales Package</td> <td class="specs-value fk-data">Pack of 1</td> </tr> </table> <table cellspacing="0" class="fk-specs-type2"> <tr> <th class="group-head" colspan="2">Additional Details<a class="see-more unitExt rmargin10 no-underline" href="javascript:void(0);" onclick="$(this).closest('.fk-specs-type2').toggleClass('expandedMore')" title="Expand">[+]</a><a class="hidden unitExt rmargin10 no-underline" href="javascript:void(0);" onclick="$(this).closest('.fk-specs-type2').toggleClass('expandedMore')" title="Collapse">[-]</a></th> </tr> <tr class="hidden"> <td class="specs-key">Style Code</td> <td class="specs-value fk-data">LETS5322__Dark Blue</td> </tr> </table> <table cellspacing="0" class="fk-specs-type2"> <tr> <th class="group-head" colspan="2">In the Box</th> </tr> <tr class=""> <td class="specs-key"> </td> <td class="specs-value fk-data">T-Shirt</td> </tr> </table> </div>,11:03:2014,None
LSTTSHDP74ZGCGEYYJKJLXWL0,Lee Printed Women's Round Neck T-Shirt,http://www.flipkart.com/womens-clothing?otracker=hp_nmenu_sub_women_1_Clothing,Rs. 628,Clothing,Polos & T-Shirts,Lee,http://img5a.flixcart.com/image/t-shirt/a/v/3/lets5290-white-lee-m-400x400-imadpa92gsvwghds.jpeg,Rs. 899,White,women,http://www.flipkart.com/lee-printed-women-s-round-neck-t-shirt/p/itmdp74zgeyupxm5?pid=TSHDP74ZGCGEYYJK&srno=b_12&ref=675ea2d5-ab3e-4845-8cdd-21bcfe1e5c8a,Fashionara,Lee Printed Women's Round Neck T-Shirt - Buy White Lee Printed Women's Round Neck T-Shirt Online at Best Prices in India | Flipkart.com,Lee Printed Women's Round Neck T-Shirt - Buy White Lee Printed Women's Round Neck T-Shirt For Only Rs. 0.0 Online in India. Shop Online For Apparels. Huge Collection of Branded Clothes Only at,['M'  'XL'],<div class="item_left_column" id="description"> <h3 class="item_desc_title fk-uppercase">Lee Printed Women's Round Neck T-Shirt         Price: Rs.628</h3> <div class="cls"></div> <div class="item_desc_text line"> <div style="float:right"> </div>                         Work this seasons sporty mood with this splendid tee. The abstract print adds a touch of bright colour. Comes with magyar sleeves and a relaxed fit  perfect for those off-duty days. Club it with washed fitted denim  ankle high sneakers and a leather sling bag for a casual outing.        </div> <div style="clear: both;"></div> </div>,<div class="item_left_column" id="specifications"> <h3 class="item_desc_title fk-uppercase">         Specifications of Lee Printed Women's Round Neck T-Shirt    </h3> <table cellspacing="0" class="fk-specs-type2"> <tr> <th class="group-head" colspan="2">General Details<a class="see-more unitExt rmargin10 no-underline" href="javascript:void(0);" onclick="$(this).closest('.fk-specs-type2').toggleClass('expandedMore')" title="Expand">[+]</a><a class="hidden unitExt rmargin10 no-underline" href="javascript:void(0);" onclick="$(this).closest('.fk-specs-type2').toggleClass('expandedMore')" title="Collapse">[-]</a></th> </tr> <tr class="hidden"> <td class="specs-key">Ideal For</td> <td class="specs-value fk-data">Women's</td> </tr> <tr class="hidden"> <td class="specs-key">Occasion</td> <td class="specs-value fk-data">Casual</td> </tr> <tr class="hidden"> <td class="specs-key">Pattern</td> <td class="specs-value fk-data">Printed</td> </tr> </table> <table cellspacing="0" class="fk-specs-type2"> <tr> <th class="group-head" colspan="2">T-shirt Details</th> </tr> <tr class=""> <td class="specs-key">Type</td> <td class="specs-value fk-data">Round Neck</td> </tr> <tr class=""> <td class="specs-key">Fabric</td> <td class="specs-value fk-data">Cotton</td> </tr> <tr class=""> <td class="specs-key">Number of Contents in Sales Package</td> <td class="specs-value fk-data">Pack of 1</td> </tr> </table> <table cellspacing="0" class="fk-specs-type2"> <tr> <th class="group-head" colspan="2">Additional Details<a class="see-more unitExt rmargin10 no-underline" href="javascript:void(0);" onclick="$(this).closest('.fk-specs-type2').toggleClass('expandedMore')" title="Expand">[+]</a><a class="hidden unitExt rmargin10 no-underline" href="javascript:void(0);" onclick="$(this).closest('.fk-specs-type2').toggleClass('expandedMore')" title="Collapse">[-]</a></th> </tr> <tr class="hidden"> <td class="specs-key">Style Code</td> <td class="specs-value fk-data">LETS5290__White</td> </tr> </table> <table cellspacing="0" class="fk-specs-type2"> <tr> <th class="group-head" colspan="2">In the Box</th> </tr> <tr class=""> <td class="specs-key"> </td> <td class="specs-value fk-data">T-Shirt</td> </tr> </table> </div>,11:03:2014,None
