LSTTSHDT59RYKHUUNAC1QYRJF,Lee Printed Women's Round Neck T-Shirt,http://www.flipkart.com/womens-clothing?otracker=hp_nmenu_sub_women_1_Clothing,Rs. 399,Clothing,Polos & T-Shirts,Lee,http://img6a.flixcart.com/image/t-shirt/n/a/c/lets5619-black-f-lee-m-400x400-imadt5fzwxsgxx6h.jpeg,Rs. 799,Black,women,http://www.flipkart.com/lee-printed-women-s-round-neck-t-shirt/p/itmdt5a3szbehtax?pid=TSHDT59RYKHUUNAC&srno=b_25&ref=3b900ddf-72dd-4b6e-9f78-dbccc05d4056,Fashionara,Lee Printed Women's Round Neck T-Shirt - Buy Black Lee Printed Women's Round Neck T-Shirt Online at Best Prices in India | Flipkart.com,Lee Printed Women's Round Neck T-Shirt - Buy Black Lee Printed Women's Round Neck T-Shirt For Only Rs. 0.0 Online in India. Shop Online For Apparels. Huge Collection of Branded Clothes Only at,['M'],<div class="item_left_column" id="description"> <h3 class="item_desc_title fk-uppercase">Lee Printed Women's Round Neck T-Shirt         Price: Rs.399</h3> <div class="cls"></div> <div class="item_desc_text line"> <div style="float:right"> </div>                         An absolutely delightful tee  this one has a funky face print within a broken puzzle  enhanced with vivid colors to add to the look! A back inner neck binding provides comfort and the soft fabric keeps you going all day! Wear this with your denims and boots! Add aviator sunglasses to complete the look!        </div> <div style="clear: both;"></div> </div>,<div class="item_left_column" id="specifications"> <h3 class="item_desc_title fk-uppercase">         Specifications of Lee Printed Women's Round Neck T-Shirt    </h3> <table cellspacing="0" class="fk-specs-type2"> <tr> <th class="group-head" colspan="2">General Details<a class="see-more unitExt rmargin10 no-underline" href="javascript:void(0);" onclick="$(this).closest('.fk-specs-type2').toggleClass('expandedMore')" title="Expand">[+]</a><a class="hidden unitExt rmargin10 no-underline" href="javascript:void(0);" onclick="$(this).closest('.fk-specs-type2').toggleClass('expandedMore')" title="Collapse">[-]</a></th> </tr> <tr class="hidden"> <td class="specs-key">Ideal For</td> <td class="specs-value fk-data">Women's</td> </tr> <tr class="hidden"> <td class="specs-key">Occasion</td> <td class="specs-value fk-data">Casual</td> </tr> <tr class="hidden"> <td class="specs-key">Pattern</td> <td class="specs-value fk-data">Printed</td> </tr> </table> <table cellspacing="0" class="fk-specs-type2"> <tr> <th class="group-head" colspan="2">T-shirt Details</th> </tr> <tr class=""> <td class="specs-key">Type</td> <td class="specs-value fk-data">Round Neck</td> </tr> <tr class=""> <td class="specs-key">Fabric</td> <td class="specs-value fk-data">Cotton</td> </tr> <tr class=""> <td class="specs-key">Sleeve</td> <td class="specs-value fk-data">Half Sleeve</td> </tr> <tr class=""> <td class="specs-key">Number of Contents in Sales Package</td> <td class="specs-value fk-data">Pack of 1</td> </tr> </table> <table cellspacing="0" class="fk-specs-type2"> <tr> <th class="group-head" colspan="2">Fabric Care</th> </tr> <tr class=""> <td class="specs-value fk-data" colspan="2">Mild iron  Do not wring  Machine wash cold</td> </tr> </table> <table cellspacing="0" class="fk-specs-type2"> <tr> <th class="group-head" colspan="2">Additional Details<a class="see-more unitExt rmargin10 no-underline" href="javascript:void(0);" onclick="$(this).closest('.fk-specs-type2').toggleClass('expandedMore')" title="Expand">[+]</a><a class="hidden unitExt rmargin10 no-underline" href="javascript:void(0);" onclick="$(this).closest('.fk-specs-type2').toggleClass('expandedMore')" title="Collapse">[-]</a></th> </tr> <tr class="hidden"> <td class="specs-key">Style Code</td> <td class="specs-value fk-data">LETS5619_Black..F</td> </tr> </table> <table cellspacing="0" class="fk-specs-type2"> <tr> <th class="group-head" colspan="2">In the Box</th> </tr> <tr class=""> <td class="specs-key"> </td> <td class="specs-value fk-data">T Shirt</td> </tr> </table> </div>,11:03:2014,None
LSTTSHDP74ZZDBAZ6HGLEIFHE,Lee Women's Round Neck T-Shirt,http://www.flipkart.com/womens-clothing?otracker=hp_nmenu_sub_women_1_Clothing,Rs. 628,Clothing,Polos & T-Shirts,Lee,http://img6a.flixcart.com/image/t-shirt/6/h/g/lets5283-aqua-lee-m-400x400-imadpa94ruvsrg6d.jpeg,Rs. 899,Aqua,women,http://www.flipkart.com/lee-women-s-round-neck-t-shirt/p/itmdp74zr9bjmvfg?pid=TSHDP74ZZDBAZ6HG&srno=b_15&ref=675ea2d5-ab3e-4845-8cdd-21bcfe1e5c8a,Fashionara,Lee Women's Round Neck T-Shirt - Buy Aqua Lee Women's Round Neck T-Shirt Online at Best Prices in India | Flipkart.com,Lee Women's Round Neck T-Shirt - Buy Aqua Lee Women's Round Neck T-Shirt For Only Rs. 0.0 Online in India. Shop Online For Apparels. Huge Collection of Branded Clothes Only at,['S'  'M'  'L'  'XL'],<div class="item_left_column" id="description"> <h3 class="item_desc_title fk-uppercase">Lee Women's Round Neck T-Shirt         Price: Rs.628</h3> <div class="cls"></div> <div class="item_desc_text line"> <div style="float:right"> </div>                         Cool off in this casual top. You'd instantly fall in love with the soft  smooth feels of this cotton fabric. The graphic print looks absolutely cool and trendy. Perfect for a casual off-duty day. Club it with bright hue denims with chic glads and wrap around a printed scarf for a stylish look.        </div> <div style="clear: both;"></div> </div>,<div class="item_left_column" id="specifications"> <h3 class="item_desc_title fk-uppercase">         Specifications of Lee Women's Round Neck T-Shirt    </h3> <table cellspacing="0" class="fk-specs-type2"> <tr> <th class="group-head" colspan="2">General Details<a class="see-more unitExt rmargin10 no-underline" href="javascript:void(0);" onclick="$(this).closest('.fk-specs-type2').toggleClass('expandedMore')" title="Expand">[+]</a><a class="hidden unitExt rmargin10 no-underline" href="javascript:void(0);" onclick="$(this).closest('.fk-specs-type2').toggleClass('expandedMore')" title="Collapse">[-]</a></th> </tr> <tr class="hidden"> <td class="specs-key">Ideal For</td> <td class="specs-value fk-data">Women's</td> </tr> <tr class="hidden"> <td class="specs-key">Occasion</td> <td class="specs-value fk-data">Casual</td> </tr> </table> <table cellspacing="0" class="fk-specs-type2"> <tr> <th class="group-head" colspan="2">T-shirt Details</th> </tr> <tr class=""> <td class="specs-key">Type</td> <td class="specs-value fk-data">Round Neck</td> </tr> <tr class=""> <td class="specs-key">Fabric</td> <td class="specs-value fk-data">Cotton</td> </tr> <tr class=""> <td class="specs-key">Number of Contents in Sales Package</td> <td class="specs-value fk-data">Pack of 1</td> </tr> </table> <table cellspacing="0" class="fk-specs-type2"> <tr> <th class="group-head" colspan="2">Additional Details<a class="see-more unitExt rmargin10 no-underline" href="javascript:void(0);" onclick="$(this).closest('.fk-specs-type2').toggleClass('expandedMore')" title="Expand">[+]</a><a class="hidden unitExt rmargin10 no-underline" href="javascript:void(0);" onclick="$(this).closest('.fk-specs-type2').toggleClass('expandedMore')" title="Collapse">[-]</a></th> </tr> <tr class="hidden"> <td class="specs-key">Style Code</td> <td class="specs-value fk-data">LETS5283__Aqua</td> </tr> </table> <table cellspacing="0" class="fk-specs-type2"> <tr> <th class="group-head" colspan="2">In the Box</th> </tr> <tr class=""> <td class="specs-key"> </td> <td class="specs-value fk-data">T-Shirt</td> </tr> </table> </div>,11:03:2014,None
LSTTSHDT59GSMHSP9SDG3WQ0A,Lee Printed Women's Round Neck T-Shirt,http://www.flipkart.com/womens-clothing?otracker=hp_nmenu_sub_women_1_Clothing,Rs. 488,Clothing,Polos & T-Shirts,Lee,http://img6a.flixcart.com/image/t-shirt/h/k/g/lets5332-black-f-lee-xl-400x400-imadt5f6gqnm22kv.jpeg,Rs. 699,Black,women,http://www.flipkart.com/lee-printed-women-s-round-neck-t-shirt/p/itmdt59wkhgc4wja?pid=TSHDT59GSMHSP9SD&srno=b_19&ref=3b900ddf-72dd-4b6e-9f78-dbccc05d4056,Fashionara,Lee Printed Women's Round Neck T-Shirt - Buy Black Lee Printed Women's Round Neck T-Shirt Online at Best Prices in India | Flipkart.com,Lee Printed Women's Round Neck T-Shirt - Buy Black Lee Printed Women's Round Neck T-Shirt For Only Rs. 0.0 Online in India. Shop Online For Apparels. Huge Collection of Branded Clothes Only at,['S'  'M'  'L'  'XL'],<div class="item_left_column" id="description"> <h3 class="item_desc_title fk-uppercase">Lee Printed Women's Round Neck T-Shirt         Price: Rs.488</h3> <div class="cls"></div> <div class="item_desc_text line"> <div style="float:right"> </div>                         This cotton tee is just right for those casual outings. Made from cotton  the soft  smooth fabric keeps you at ease. So comfy that you'd never want to take them off. Match it with denim shorts or pants and strappy sandals.        </div> <div style="clear: both;"></div> </div>,<div class="item_left_column" id="specifications"> <h3 class="item_desc_title fk-uppercase">         Specifications of Lee Printed Women's Round Neck T-Shirt    </h3> <table cellspacing="0" class="fk-specs-type2"> <tr> <th class="group-head" colspan="2">General Details<a class="see-more unitExt rmargin10 no-underline" href="javascript:void(0);" onclick="$(this).closest('.fk-specs-type2').toggleClass('expandedMore')" title="Expand">[+]</a><a class="hidden unitExt rmargin10 no-underline" href="javascript:void(0);" onclick="$(this).closest('.fk-specs-type2').toggleClass('expandedMore')" title="Collapse">[-]</a></th> </tr> <tr class="hidden"> <td class="specs-key">Ideal For</td> <td class="specs-value fk-data">Women's</td> </tr> <tr class="hidden"> <td class="specs-key">Occasion</td> <td class="specs-value fk-data">Casual</td> </tr> <tr class="hidden"> <td class="specs-key">Pattern</td> <td class="specs-value fk-data">Printed</td> </tr> </table> <table cellspacing="0" class="fk-specs-type2"> <tr> <th class="group-head" colspan="2">T-shirt Details</th> </tr> <tr class=""> <td class="specs-key">Type</td> <td class="specs-value fk-data">Round Neck</td> </tr> <tr class=""> <td class="specs-key">Fabric</td> <td class="specs-value fk-data">Cotton</td> </tr> <tr class=""> <td class="specs-key">Sleeve</td> <td class="specs-value fk-data">Half Sleeve</td> </tr> <tr class=""> <td class="specs-key">Number of Contents in Sales Package</td> <td class="specs-value fk-data">Pack of 1</td> </tr> </table> <table cellspacing="0" class="fk-specs-type2"> <tr> <th class="group-head" colspan="2">Fabric Care</th> </tr> <tr class=""> <td class="specs-value fk-data" colspan="2">Hand wash cold  Use mild detergent  Do not iron on print  Wash dark colours separate  Mild iron</td> </tr> </table> <table cellspacing="0" class="fk-specs-type2"> <tr> <th class="group-head" colspan="2">Additional Details<a class="see-more unitExt rmargin10 no-underline" href="javascript:void(0);" onclick="$(this).closest('.fk-specs-type2').toggleClass('expandedMore')" title="Expand">[+]</a><a class="hidden unitExt rmargin10 no-underline" href="javascript:void(0);" onclick="$(this).closest('.fk-specs-type2').toggleClass('expandedMore')" title="Collapse">[-]</a></th> </tr> <tr class="hidden"> <td class="specs-key">Style Code</td> <td class="specs-value fk-data">LETS5332_Black..F</td> </tr> </table> <table cellspacing="0" class="fk-specs-type2"> <tr> <th class="group-head" colspan="2">In the Box</th> </tr> <tr class=""> <td class="specs-key"> </td> <td class="specs-value fk-data">T Shirt</td> </tr> </table> </div>,11:03:2014,None
LSTTSHDTSKVWT8SYCGYSCPHOI,Lee Solid Women's Round Neck T-Shirt,http://www.flipkart.com/womens-clothing?otracker=hp_nmenu_sub_women_1_Clothing,Rs. 299,Clothing,Polos & T-Shirts,Lee,http://img6a.flixcart.com/image/t-shirt/c/g/y/lets5687-yellow-f-lee-m-400x400-imadtsp6kmgabkgg.jpeg,Rs. 599,Yellow,women,http://www.flipkart.com/lee-solid-women-s-round-neck-t-shirt/p/itmdtskvwt8sycgy?pid=TSHDTSKVWT8SYCGY&srno=b_28&ref=3b900ddf-72dd-4b6e-9f78-dbccc05d4056,Fashionara,Lee Solid Women's Round Neck T-Shirt - Buy Yellow Lee Solid Women's Round Neck T-Shirt Online at Best Prices in India | Flipkart.com,Lee Solid Women's Round Neck T-Shirt - Buy Yellow Lee Solid Women's Round Neck T-Shirt For Only Rs. 599.00 Online in India. Shop Online For Apparels. Huge Collection of Branded Clothes Only at,['L'],<div class="item_left_column" id="description"> <h3 class="item_desc_title fk-uppercase">Lee Solid Women's Round Neck T-Shirt         Price: Rs.299</h3> <div class="cls"></div> <div class="item_desc_text line"> <div style="float:right"> </div>                         This essential racer back top is just what you need to soup up your dressing!  Perfect for that summers or layering with in the chilly season  this features  a classic racer back style with a curved hem-line to give it girly appeal!    Pair it up with denim shorts and flats for a casual relaxed look!  Accessorise with a neon scarf on the neck!        </div> <div style="clear: both;"></div> </div>,<div class="item_left_column" id="specifications"> <h3 class="item_desc_title fk-uppercase">         Specifications of Lee Solid Women's Round Neck T-Shirt    </h3> <table cellspacing="0" class="fk-specs-type2"> <tr> <th class="group-head" colspan="2">General Details<a class="see-more unitExt rmargin10 no-underline" href="javascript:void(0);" onclick="$(this).closest('.fk-specs-type2').toggleClass('expandedMore')" title="Expand">[+]</a><a class="hidden unitExt rmargin10 no-underline" href="javascript:void(0);" onclick="$(this).closest('.fk-specs-type2').toggleClass('expandedMore')" title="Collapse">[-]</a></th> </tr> <tr class="hidden"> <td class="specs-key">Ideal For</td> <td class="specs-value fk-data">Women's</td> </tr> <tr class="hidden"> <td class="specs-key">Occasion</td> <td class="specs-value fk-data">Casual</td> </tr> <tr class="hidden"> <td class="specs-key">Pattern</td> <td class="specs-value fk-data">Solid</td> </tr> </table> <table cellspacing="0" class="fk-specs-type2"> <tr> <th class="group-head" colspan="2">T-shirt Details</th> </tr> <tr class=""> <td class="specs-key">Type</td> <td class="specs-value fk-data">Round Neck</td> </tr> <tr class=""> <td class="specs-key">Fabric</td> <td class="specs-value fk-data">Cotton</td> </tr> <tr class=""> <td class="specs-key">Sleeve</td> <td class="specs-value fk-data">Sleeveless</td> </tr> <tr class=""> <td class="specs-key">Number of Contents in Sales Package</td> <td class="specs-value fk-data">Pack of 1</td> </tr> </table> <table cellspacing="0" class="fk-specs-type2"> <tr> <th class="group-head" colspan="2">Fabric Care</th> </tr> <tr class=""> <td class="specs-value fk-data" colspan="2">Machine Wash Cold  Mild Iron  Do Not Wring</td> </tr> </table> <table cellspacing="0" class="fk-specs-type2"> <tr> <th class="group-head" colspan="2">Additional Details<a class="see-more unitExt rmargin10 no-underline" href="javascript:void(0);" onclick="$(this).closest('.fk-specs-type2').toggleClass('expandedMore')" title="Expand">[+]</a><a class="hidden unitExt rmargin10 no-underline" href="javascript:void(0);" onclick="$(this).closest('.fk-specs-type2').toggleClass('expandedMore')" title="Collapse">[-]</a></th> </tr> <tr class="hidden"> <td class="specs-key">Style Code</td> <td class="specs-value fk-data">LETS5687_Yellow..F</td> </tr> </table> <table cellspacing="0" class="fk-specs-type2"> <tr> <th class="group-head" colspan="2">In the Box</th> </tr> <tr class=""> <td class="specs-key"> </td> <td class="specs-value fk-data">T Shirt</td> </tr> </table> </div>,11:03:2014,None
LSTTSHDR72AVZCE9MADLZYBRU,Lee Printed Women's Round Neck T-Shirt,http://www.flipkart.com/womens-clothing?otracker=hp_nmenu_sub_women_1_Clothing,Rs. 488,Clothing,Polos & T-Shirts,Lee,http://img6a.flixcart.com/image/t-shirt/w/x/f/lets5613light-grey-f-lee-xl-400x400-imadrcwvpznkncz4.jpeg,Rs. 699,Light Grey,women,http://www.flipkart.com/lee-printed-women-s-round-neck-t-shirt/p/itmdr72gsjthw2k7?pid=TSHDR72AVZCE9MAD&srno=b_6&ref=675ea2d5-ab3e-4845-8cdd-21bcfe1e5c8a,Fashionara,Lee Printed Women's Round Neck T-Shirt - Buy Light Grey Lee Printed Women's Round Neck T-Shirt Online at Best Prices in India | Flipkart.com,Lee Printed Women's Round Neck T-Shirt - Buy Light Grey Lee Printed Women's Round Neck T-Shirt For Only Rs. 0.0 Online in India. Shop Online For Apparels. Huge Collection of Branded Clothes Only at,['S'  'M'  'L'],<div class="item_left_column" id="description"> <h3 class="item_desc_title fk-uppercase">Lee Printed Women's Round Neck T-Shirt         Price: Rs.488</h3> <div class="cls"></div> <div class="item_desc_text line"> <div style="float:right"> </div>                         Simple yet funky is how this tee can be described. With a quote printed in front  it adds fun to the garment. Wear this with coloured denims and converse sneakers.        </div> <div style="clear: both;"></div> </div>,<div class="item_left_column" id="specifications"> <h3 class="item_desc_title fk-uppercase">         Specifications of Lee Printed Women's Round Neck T-Shirt    </h3> <table cellspacing="0" class="fk-specs-type2"> <tr> <th class="group-head" colspan="2">General Details<a class="see-more unitExt rmargin10 no-underline" href="javascript:void(0);" onclick="$(this).closest('.fk-specs-type2').toggleClass('expandedMore')" title="Expand">[+]</a><a class="hidden unitExt rmargin10 no-underline" href="javascript:void(0);" onclick="$(this).closest('.fk-specs-type2').toggleClass('expandedMore')" title="Collapse">[-]</a></th> </tr> <tr class="hidden"> <td class="specs-key">Ideal For</td> <td class="specs-value fk-data">Women's</td> </tr> <tr class="hidden"> <td class="specs-key">Occasion</td> <td class="specs-value fk-data">Casual</td> </tr> <tr class="hidden"> <td class="specs-key">Pattern</td> <td class="specs-value fk-data">Printed</td> </tr> </table> <table cellspacing="0" class="fk-specs-type2"> <tr> <th class="group-head" colspan="2">T-shirt Details</th> </tr> <tr class=""> <td class="specs-key">Type</td> <td class="specs-value fk-data">Round Neck</td> </tr> <tr class=""> <td class="specs-key">Fabric</td> <td class="specs-value fk-data">Cotton</td> </tr> <tr class=""> <td class="specs-key">Sleeve</td> <td class="specs-value fk-data">Half Sleeve</td> </tr> <tr class=""> <td class="specs-key">Number of Contents in Sales Package</td> <td class="specs-value fk-data">Pack of 1</td> </tr> </table> <table cellspacing="0" class="fk-specs-type2"> <tr> <th class="group-head" colspan="2">Additional Details<a class="see-more unitExt rmargin10 no-underline" href="javascript:void(0);" onclick="$(this).closest('.fk-specs-type2').toggleClass('expandedMore')" title="Expand">[+]</a><a class="hidden unitExt rmargin10 no-underline" href="javascript:void(0);" onclick="$(this).closest('.fk-specs-type2').toggleClass('expandedMore')" title="Collapse">[-]</a></th> </tr> <tr class="hidden"> <td class="specs-key">Style Code</td> <td class="specs-value fk-data">LETS5613Light Grey..f</td> </tr> </table> <table cellspacing="0" class="fk-specs-type2"> <tr> <th class="group-head" colspan="2">In the Box</th> </tr> <tr class=""> <td class="specs-key"> </td> <td class="specs-value fk-data">T Shirt</td> </tr> </table> </div>,11:03:2014,None
LSTTSHDT59QAD3C93VEWUH1UY,Lee Printed Women's Round Neck T-Shirt,http://www.flipkart.com/womens-clothing?otracker=hp_nmenu_sub_women_1_Clothing,Rs. 558,Clothing,Polos & T-Shirts,Lee,http://img5a.flixcart.com/image/t-shirt/3/v/e/lets5656-blue-f-lee-m-400x400-imadt5fdzygecz77.jpeg,Rs. 799,Medium Blue,women,http://www.flipkart.com/lee-printed-women-s-round-neck-t-shirt/p/itmdtavy7qzkzwka?pid=TSHDT59QAD3C93VE&srno=b_27&ref=3b900ddf-72dd-4b6e-9f78-dbccc05d4056,Fashionara,Lee Printed Women's Round Neck T-Shirt - Buy Medium Blue Lee Printed Women's Round Neck T-Shirt Online at Best Prices in India | Flipkart.com,Lee Printed Women's Round Neck T-Shirt - Buy Medium Blue Lee Printed Women's Round Neck T-Shirt For Only Rs. 0.0 Online in India. Shop Online For Apparels. Huge Collection of Branded Clothes Only at,['S'  'L'  'XL'],<div class="item_left_column" id="description"> <h3 class="item_desc_title fk-uppercase">Lee Printed Women's Round Neck T-Shirt         Price: Rs.558</h3> <div class="cls"></div> <div class="item_desc_text line"> <div style="float:right"> </div>                         Flaunt your new style trend with this printed tee. Features polka print and a message that says "the past was once the future". it's so comfortable as it is made out of the finest cotton fabric. The most fashionable way to wear it? With peppy shorts and heels.        </div> <div style="clear: both;"></div> </div>,<div class="item_left_column" id="specifications"> <h3 class="item_desc_title fk-uppercase">         Specifications of Lee Printed Women's Round Neck T-Shirt    </h3> <table cellspacing="0" class="fk-specs-type2"> <tr> <th class="group-head" colspan="2">General Details<a class="see-more unitExt rmargin10 no-underline" href="javascript:void(0);" onclick="$(this).closest('.fk-specs-type2').toggleClass('expandedMore')" title="Expand">[+]</a><a class="hidden unitExt rmargin10 no-underline" href="javascript:void(0);" onclick="$(this).closest('.fk-specs-type2').toggleClass('expandedMore')" title="Collapse">[-]</a></th> </tr> <tr class="hidden"> <td class="specs-key">Ideal For</td> <td class="specs-value fk-data">Women's</td> </tr> <tr class="hidden"> <td class="specs-key">Occasion</td> <td class="specs-value fk-data">Casual</td> </tr> <tr class="hidden"> <td class="specs-key">Pattern</td> <td class="specs-value fk-data">Printed</td> </tr> </table> <table cellspacing="0" class="fk-specs-type2"> <tr> <th class="group-head" colspan="2">T-shirt Details</th> </tr> <tr class=""> <td class="specs-key">Type</td> <td class="specs-value fk-data">Round Neck</td> </tr> <tr class=""> <td class="specs-key">Fabric</td> <td class="specs-value fk-data">Cotton</td> </tr> <tr class=""> <td class="specs-key">Sleeve</td> <td class="specs-value fk-data">Half Sleeve</td> </tr> <tr class=""> <td class="specs-key">Number of Contents in Sales Package</td> <td class="specs-value fk-data">Pack of 1</td> </tr> </table> <table cellspacing="0" class="fk-specs-type2"> <tr> <th class="group-head" colspan="2">Fabric Care</th> </tr> <tr class=""> <td class="specs-value fk-data" colspan="2">Warm iron if required  Wash with like colours  Do not iron on print  Machine wash warm</td> </tr> </table> <table cellspacing="0" class="fk-specs-type2"> <tr> <th class="group-head" colspan="2">Additional Details<a class="see-more unitExt rmargin10 no-underline" href="javascript:void(0);" onclick="$(this).closest('.fk-specs-type2').toggleClass('expandedMore')" title="Expand">[+]</a><a class="hidden unitExt rmargin10 no-underline" href="javascript:void(0);" onclick="$(this).closest('.fk-specs-type2').toggleClass('expandedMore')" title="Collapse">[-]</a></th> </tr> <tr class="hidden"> <td class="specs-key">Style Code</td> <td class="specs-value fk-data">LETS5656_Blue..F</td> </tr> </table> <table cellspacing="0" class="fk-specs-type2"> <tr> <th class="group-head" colspan="2">In the Box</th> </tr> <tr class=""> <td class="specs-key"> </td> <td class="specs-value fk-data">T Shirt</td> </tr> </table> </div>,11:03:2014,None
