{'sku': [], 'seller': [], 'title': [], 'colour': [], 'sp': [], 'mrp': [u'Rs. 299'], 'titleimg': [u'http://img5a.flixcart.com/image/slipper-flip-flop/t/y/d/blk-bronze-brenda-globalite-7-400x400-imadmt42mpz89hbn.jpeg'], 'catname': ['slippers-flip-flops'], 'brandname': ['Globalite.'], 'date': ['18:02:2014'], 'itemlink': ['http://www.flipkart.com/globalite-brenda-flip-flops/p/itmdm84bnmvx5mew?pid=SFFDHWZGXAHYR7H8&srno=b_3&ref=856c4c0c-52cb-4b2b-9abc-7d97429ca382'], 'desc': [u'<div class="item_left_column" id="description">\n        <h3 class="item_desc_title fk-uppercase">Globalite Brenda Flip Flops         Price: Rs.209</h3>\n        <div class="cls"></div>\n        <div class="item_desc_text line">\n            <div style="float:right">\n                \n \n            </div>\n                        <p>\r\n\tPick these funky flip-flops from Globalite as they guarantee to give you complete style and a massaged feel throughout the day. The printed straps and<strong> embossed detailings</strong> on the footbeds can give you the desired look along with comfortable experience. Pair these trendy slippers with a casual tee and jeans.</p>\r\n<p>\r\n\tEnsuring a sturdy stride, encompassing the finest materials, slippers from <strong>Globalite </strong>endorse a futuristic fashion sense for the style-conscious individual and offer a surfeit of comfy, fuss-free walking experience.</p>\r\n<p>\r\n\t<strong>Footwear Care</strong></p>\r\n<p>\r\n\tUse a soft, damp cloth to clean these flip-flops.</p>        </div>\n        <div style="clear: both;"></div>\n            </div>'], 'spec': [u'<div id="specifications" class="item_left_column">\n    <h3 class="item_desc_title fk-uppercase">\n        Specifications of Globalite Brenda Flip Flops    </h3>\n\n            <table cellspacing="0" class="fk-specs-type2"><tr><th class="group-head" colspan="2">General</th>\n            </tr><tr class=""><td class="specs-key">Ideal For</td>\n                                        <td class="specs-value fk-data">Women</td>\n                </tr></table><table cellspacing="0" class="fk-specs-type2"><tr><th class="group-head" colspan="2">Slipper &amp; Flip Flop Details</th>\n            </tr><tr class=""><td class="specs-key">Style</td>\n                                        <td class="specs-value fk-data">Embossed Detail, Textured Footbed</td>\n                </tr><tr class=""><td class="specs-key">Design</td>\n                                        <td class="specs-value fk-data">Print on Strap</td>\n                </tr><tr class=""><td class="specs-key">Color</td>\n                                        <td class="specs-value fk-data">Black, Bronze</td>\n                </tr><tr class=""><td class="specs-key">Type</td>\n                                        <td class="specs-value fk-data">Flip Flops</td>\n                </tr><tr class=""><td class="specs-key">Outer Material</td>\n                                        <td class="specs-value fk-data">EVA</td>\n                </tr><tr class=""><td class="specs-key">Inner Material</td>\n                                        <td class="specs-value fk-data">EVA</td>\n                </tr><tr class=""><td class="specs-key">Sole Material</td>\n                                        <td class="specs-value fk-data">EVA</td>\n                </tr><tr class=""><td class="specs-key">Tip Shape</td>\n                                        <td class="specs-value fk-data">Round</td>\n                </tr><tr class=""><td class="specs-key">Weight</td>\n                                        <td class="specs-value fk-data">77 gm (per single Slipper) - Weight of the product may vary depending on size.</td>\n                </tr></table><table cellspacing="0" class="fk-specs-type2"><tr><th class="group-head" colspan="2">Additional Details</th>\n            </tr><tr class=""><td class="specs-key">Other Details</td>\n                                        <td class="specs-value fk-data">Rubber Sole, Toe Partition</td>\n                </tr></table><table cellspacing="0" class="fk-specs-type2"><tr><th class="group-head" colspan="2">In the Box</th>\n            </tr><tr class=""><td colspan="2" class="specs-value fk-data">Fabric Bag</td>\n                </tr></table></div>'], 'size': []}
{'sku': [u'/viewcart?eid=LSTSFFDHH7A5NMYGZVEGQGGQH'], 'seller': [u'WS Retail', u'[?]'], 'title': [u'\n                    Globalite Snug Slippers            '], 'colour': [u'Black, Red'], 'sp': [u' Rs. 279', u'(1,977,144'], 'mrp': [u'Rs. 399'], 'titleimg': [u'http://img5a.flixcart.com/image/slipper-flip-flop/7/v/c/green-light-green-snug-globalite-7-400x400-imadgkvus9sgw6hs.jpeg'], 'catname': ['slippers-flip-flops'], 'brandname': ['Globalite.'], 'date': ['18:02:2014'], 'itemlink': ['http://www.flipkart.com/globalite-snug-slippers/p/itmdm83gvza9yddp?pid=SFFDHH7A5NMYGZVE&srno=b_2&ref=856c4c0c-52cb-4b2b-9abc-7d97429ca382'], 'desc': [u'<div class="item_left_column" id="description">\n        <h3 class="item_desc_title fk-uppercase">Globalite Snug Slippers         Price: Rs.279</h3>\n        <div class="cls"></div>\n        <div class="item_desc_text line">\n            <div style="float:right">\n                \n \n            </div>\n                        <p>\r\n\tGlobalite believes in designing footwear for women that not only is comfortable and sturdy but also keeps their style quotient enhanced and attractive. These <strong>Globalite Snug Slippers</strong> are the perfect pair of casual footwear that ensure you are always at your best whether you have to run around for household chores or take care of your sister\u2019s babies. These green and light green slippers are open on the sides and front and always keep your comfort as number one priority.<strong> Crafted from EVA</strong> material, these slippers will be lightweight and they also deliver superior grip.</p>\r\n<p>\r\n\tWith a wink to international trends, each pair of Globalite\u2019s sports shoes offers unmatched quality and style to ensure comfort whether you\u2019re skateboarding, jogging or simply stealing the limelight.\xa0\xa0\xa0\xa0</p>\r\n<p>\r\n\t<strong>Footwear Care</strong></p>\r\n<p>\r\n\tClean these shoes with a damp cloth.</p>        </div>\n        <div style="clear: both;"></div>\n            </div>'], 'spec': [u'<div id="specifications" class="item_left_column">\n    <h3 class="item_desc_title fk-uppercase">\n        Specifications of Globalite Snug Slippers    </h3>\n\n            <table cellspacing="0" class="fk-specs-type2"><tr><th class="group-head" colspan="2">General</th>\n            </tr><tr class=""><td class="specs-key">Ideal For</td>\n                                        <td class="specs-value fk-data">Women</td>\n                </tr></table><table cellspacing="0" class="fk-specs-type2"><tr><th class="group-head" colspan="2">Slipper &amp; Flip Flop Details</th>\n            </tr><tr class=""><td class="specs-key">Style</td>\n                                        <td class="specs-value fk-data">Broad Strap, Perforations on Top</td>\n                </tr><tr class=""><td class="specs-key">Color</td>\n                                        <td class="specs-value fk-data">Green, Light Green</td>\n                </tr><tr class=""><td class="specs-key">Type</td>\n                                        <td class="specs-value fk-data">Slippers</td>\n                </tr><tr class=""><td class="specs-key">Outer Material</td>\n                                        <td class="specs-value fk-data">EVA</td>\n                </tr><tr class=""><td class="specs-key">Inner Material</td>\n                                        <td class="specs-value fk-data">EVA</td>\n                </tr><tr class=""><td class="specs-key">Sole Material</td>\n                                        <td class="specs-value fk-data">EVA</td>\n                </tr><tr class=""><td class="specs-key">Tip Shape</td>\n                                        <td class="specs-value fk-data">Round</td>\n                </tr><tr class=""><td class="specs-key">Weight</td>\n                                        <td class="specs-value fk-data">110 gm (per single Slipper) - Weight of the product may vary depending on size.</td>\n                </tr></table><table cellspacing="0" class="fk-specs-type2"><tr><th class="group-head" colspan="2">Additional Details</th>\n            </tr><tr class=""><td class="specs-key">Other Details</td>\n                                        <td class="specs-value fk-data">Cushioned Footbed, Open Sides and Front</td>\n                </tr></table></div>'], 'size': [u'5']}
{'sku': [], 'seller': [], 'title': [], 'colour': [], 'sp': [], 'mrp': [u'Rs. 199'], 'titleimg': [u'http://img6a.flixcart.com/image/slipper-flip-flop/c/q/f/red-blue-iris-globalite-7-400x400-imadm5y6z9pvybud.jpeg'], 'catname': ['slippers-flip-flops'], 'brandname': ['Globalite.'], 'date': ['18:02:2014'], 'itemlink': ['http://www.flipkart.com/globalite-iris-flip-flops/p/itmdm846g3qm2jtd?pid=SFFDKM9DA3FBZCQF&srno=b_5&ref=856c4c0c-52cb-4b2b-9abc-7d97429ca382'], 'desc': [u'<div class="item_left_column" id="description">\n        <h3 class="item_desc_title fk-uppercase">Globalite Iris Flip Flops         Price: Rs.139</h3>\n        <div class="cls"></div>\n        <div class="item_desc_text line">\n            <div style="float:right">\n                \n \n            </div>\n                        <p>\r\n\tLend that girly charm and fun attitude to your stylish appearance by slipping into this pair of Iris Flip Flops from the esteemed fashion house of Globalite. Promising unbeatable comfort and style while you walk, this pair of <strong>printed flip flops</strong> is designed with a padded footbed and panel detail.</p>\r\n<p>\r\n\tEnsuring a sturdy stride, encompassing the finest materials, slippers from <strong>Globalite </strong>endorse a futuristic fashion sense for the style-conscious individual and offer a surfeit of comfy, fuss-free walking experience.</p>\r\n<p>\r\n\t<strong>Footwear Care</strong></p>\r\n<p>\r\n\tUse a soft cloth to clean these flip flops.</p>        </div>\n        <div style="clear: both;"></div>\n            </div>'], 'spec': [u'<div id="specifications" class="item_left_column">\n    <h3 class="item_desc_title fk-uppercase">\n        Specifications of Globalite Iris Flip Flops    </h3>\n\n            <table cellspacing="0" class="fk-specs-type2"><tr><th class="group-head" colspan="2">General</th>\n            </tr><tr class=""><td class="specs-key">Ideal For</td>\n                                        <td class="specs-value fk-data">Women</td>\n                </tr></table><table cellspacing="0" class="fk-specs-type2"><tr><th class="group-head" colspan="2">Slipper &amp; Flip Flop Details</th>\n            </tr><tr class=""><td class="specs-key">Style</td>\n                                        <td class="specs-value fk-data">Panel Detail, Narrow Strap</td>\n                </tr><tr class=""><td class="specs-key">Design</td>\n                                        <td class="specs-value fk-data">Printed Footbed</td>\n                </tr><tr class=""><td class="specs-key">Color</td>\n                                        <td class="specs-value fk-data">Red, Blue</td>\n                </tr><tr class=""><td class="specs-key">Type</td>\n                                        <td class="specs-value fk-data">Flip Flops</td>\n                </tr><tr class=""><td class="specs-key">Outer Material</td>\n                                        <td class="specs-value fk-data">EVA</td>\n                </tr><tr class=""><td class="specs-key">Inner Material</td>\n                                        <td class="specs-value fk-data">EVA</td>\n                </tr><tr class=""><td class="specs-key">Sole Material</td>\n                                        <td class="specs-value fk-data">EVA</td>\n                </tr><tr class=""><td class="specs-key">Tip Shape</td>\n                                        <td class="specs-value fk-data">Round</td>\n                </tr><tr class=""><td class="specs-key">Weight</td>\n                                        <td class="specs-value fk-data">106 gm (per single Slipper) - Weight of the product may vary depending on size.</td>\n                </tr></table><table cellspacing="0" class="fk-specs-type2"><tr><th class="group-head" colspan="2">Additional Details</th>\n            </tr><tr class=""><td class="specs-key">Other Details</td>\n                                        <td class="specs-value fk-data">Textured Outsole, Padded Footbed, Toe Separation</td>\n                </tr></table></div>'], 'size': []}
{'sku': [u'/viewcart?eid=LSTSFFDHH7AUYHSH48QCZYPET'], 'seller': [u'WS Retail', u'[?]'], 'title': [u'\n                    Globalite Snug Slippers            '], 'colour': [u'Green, Light Green'], 'sp': [u' Rs. 279', u'(1,977,144'], 'mrp': [u'Rs. 399'], 'titleimg': [u'http://img5a.flixcart.com/image/slipper-flip-flop/r/n/q/black-red-snug-globalite-3-400x400-imadgkugbasdqkgx.jpeg'], 'catname': ['slippers-flip-flops'], 'brandname': ['Globalite.'], 'date': ['18:02:2014'], 'itemlink': ['http://www.flipkart.com/globalite-snug-slippers/p/itmdm83gjmuza84t?pid=SFFDHH7AUYHSH48Q&srno=b_4&ref=856c4c0c-52cb-4b2b-9abc-7d97429ca382'], 'desc': [u'<div class="item_left_column" id="description">\n        <h3 class="item_desc_title fk-uppercase">Globalite Snug Slippers         Price: Rs.279</h3>\n        <div class="cls"></div>\n        <div class="item_desc_text line">\n            <div style="float:right">\n                \n \n            </div>\n                        <p style="text-align: justify;">\r\n\tThe scorching summer eagerly calls for a celebration at the poolside. Wear these attractive slippers that come to you in shades of black and red and revel in supreme comfort and style. Tailored using top-notch EVA material, these slippers come with <strong>perforations on top</strong> for better breathability and a cushioned footbed for a better walking experience.</p>\r\n<p style="text-align: justify;">\r\n\tYou could make a clever combination by teaming these <strong>Globalite Snug Slippers</strong> with a printed T-shirt along with a pair of breezy cotton shorts to complete your summer-ready look.\xa0Ensuring a sturdy stride, encompassing the finest materials, slippers from Globalite endorse a futuristic fashion sense for the style-conscious individual and offer a surfeit of comfy, fuss-free walking experience.</p>\r\n<p>\r\n\t<strong>Footwear Care</strong></p>\r\n<p>\r\n\tGently clean these slippers with plenty of water and mild soap solution to scrub those dirty patches away.</p>\r\n<p>\r\n\t\xa0</p>        </div>\n        <div style="clear: both;"></div>\n            </div>'], 'spec': [u'<div id="specifications" class="item_left_column">\n    <h3 class="item_desc_title fk-uppercase">\n        Specifications of Globalite Snug Slippers    </h3>\n\n            <table cellspacing="0" class="fk-specs-type2"><tr><th class="group-head" colspan="2">General</th>\n            </tr><tr class=""><td class="specs-key">Ideal For</td>\n                                        <td class="specs-value fk-data">Women</td>\n                </tr></table><table cellspacing="0" class="fk-specs-type2"><tr><th class="group-head" colspan="2">Slipper &amp; Flip Flop Details</th>\n            </tr><tr class=""><td class="specs-key">Style</td>\n                                        <td class="specs-value fk-data">Perforations on Top, Broad Strap</td>\n                </tr><tr class=""><td class="specs-key">Color</td>\n                                        <td class="specs-value fk-data">Black, Red</td>\n                </tr><tr class=""><td class="specs-key">Type</td>\n                                        <td class="specs-value fk-data">Slippers</td>\n                </tr><tr class=""><td class="specs-key">Outer Material</td>\n                                        <td class="specs-value fk-data">EVA</td>\n                </tr><tr class=""><td class="specs-key">Inner Material</td>\n                                        <td class="specs-value fk-data">EVA</td>\n                </tr><tr class=""><td class="specs-key">Sole Material</td>\n                                        <td class="specs-value fk-data">EVA</td>\n                </tr><tr class=""><td class="specs-key">Tip Shape</td>\n                                        <td class="specs-value fk-data">Round</td>\n                </tr><tr class=""><td class="specs-key">Weight</td>\n                                        <td class="specs-value fk-data">110 gm (per single Slipper) - Weight of the product may vary depending on size.</td>\n                </tr></table><table cellspacing="0" class="fk-specs-type2"><tr><th class="group-head" colspan="2">Additional Details</th>\n            </tr><tr class=""><td class="specs-key">Other Details</td>\n                                        <td class="specs-value fk-data">Cushioned Footbed, Open Sides and Front</td>\n                </tr></table></div>'], 'size': [u'5']}
{'sku': [], 'seller': [], 'title': [], 'colour': [], 'sp': [], 'mrp': [u'Rs. 199'], 'titleimg': [u'http://img5a.flixcart.com/image/slipper-flip-flop/g/a/k/blue-green-gff0022-globalite-4-400x400-imadsxgyvyecbqnx.jpeg'], 'catname': ['slippers-flip-flops'], 'brandname': ['Globalite.'], 'date': ['18:02:2014'], 'itemlink': ['http://www.flipkart.com/globalite-flip-flops/p/itmds7vcf4gmt6xb?pid=SFFDRYTR3EDANGAK&srno=b_1&ref=856c4c0c-52cb-4b2b-9abc-7d97429ca382'], 'desc': [], 'spec': [u'<div id="specifications" class="item_left_column">\n    <h3 class="item_desc_title fk-uppercase">\n        Specifications of Globalite Flip Flops    </h3>\n\n            <table cellspacing="0" class="fk-specs-type2"><tr><th class="group-head" colspan="2">General</th>\n            </tr><tr class=""><td class="specs-key">Ideal For</td>\n                                        <td class="specs-value fk-data">Women</td>\n                </tr></table><table cellspacing="0" class="fk-specs-type2"><tr><th class="group-head" colspan="2">Slipper &amp; Flip Flop Details</th>\n            </tr><tr class=""><td class="specs-key">Design</td>\n                                        <td class="specs-value fk-data">Print on Footbed</td>\n                </tr><tr class=""><td class="specs-key">Color</td>\n                                        <td class="specs-value fk-data">Blue, Green</td>\n                </tr><tr class=""><td class="specs-key">Type</td>\n                                        <td class="specs-value fk-data">Flip Flops</td>\n                </tr><tr class=""><td class="specs-key">Strap Material</td>\n                                        <td class="specs-value fk-data">Rubber</td>\n                </tr><tr class=""><td class="specs-key">Tip Shape</td>\n                                        <td class="specs-value fk-data">Round</td>\n                </tr><tr class=""><td class="specs-key">Weight</td>\n                                        <td class="specs-value fk-data">89 gm (per single Slipper) - Weight of the product may vary depending on size.</td>\n                </tr></table><table cellspacing="0" class="fk-specs-type2"><tr><th class="group-head" colspan="2">Additional Details</th>\n            </tr><tr class=""><td class="specs-key">Other Details</td>\n                                        <td class="specs-value fk-data">Textured Sole, Toe Partition</td>\n                </tr></table></div>'], 'size': []}
{'sku': [u'/viewcart?eid=LSTSFFDRYTRUGHJAHHYIGGZRN'], 'seller': [u'WS Retail', u'[?]'], 'title': [u'\n                    Globalite Flip Flops            '], 'colour': [], 'sp': [u' Rs. 139', u'(1,977,144'], 'mrp': [u'Rs. 199'], 'titleimg': [u'http://img6a.flixcart.com/image/slipper-flip-flop/k/d/y/red-blue-gff0021-globalite-4-400x400-imadsxgfdng7g5fz.jpeg'], 'catname': ['slippers-flip-flops'], 'brandname': ['Globalite.'], 'date': ['18:02:2014'], 'itemlink': ['http://www.flipkart.com/globalite-flip-flops/p/itmdrytss5hbcggs?pid=SFFDRYTRUGHJAHHY&srno=b_6&ref=856c4c0c-52cb-4b2b-9abc-7d97429ca382'], 'desc': [], 'spec': [u'<div id="specifications" class="item_left_column">\n    <h3 class="item_desc_title fk-uppercase">\n        Specifications of Globalite Flip Flops    </h3>\n\n            <table cellspacing="0" class="fk-specs-type2"><tr><th class="group-head" colspan="2">General</th>\n            </tr><tr class=""><td class="specs-key">Id