{'sku': [u'/viewcart?eid=LSTSFFDN3C8WHWNRVUGHYT3EH'], 'seller': [u'WS Retail', u'[?]'], 'title': [u'\n                    Reebok Possession II Lp Flip Flops            '], 'colour': [u'Black, Graphite, Radar Yellow', u'Buff Blue, Light Grey, Black', u'Infinite Blue, Red, White'], 'sp': [u' Rs. 524', u'(1,977,241'], 'mrp': [u'Rs. 699'], 'titleimg': [u'http://img5a.flixcart.com/image/slipper-flip-flop/p/z/9/prospect-purple-lime-grey-possession-ii-lp-reebok-6-400x400-imadz2yav9zjqc7f.jpeg'], 'catname': ['slippers-flip-flops'], 'brandname': ['Reebok.'], 'date': ['18:02:2014'], 'itemlink': ['http://www.flipkart.com/reebok-possession-ii-lp-flip-flops/p/itmdn4bkzu25becw?pid=SFFDN3C8WHWNRVUG&srno=b_3&ref=8ebe543b-50d9-452d-a90b-eb928198b2b8'], 'desc': [u'<div class="item_left_column" id="description">\n        <h3 class="item_desc_title fk-uppercase">Reebok Possession II Lp Flip Flops         Price: Rs.524</h3>\n        <div class="cls"></div>\n        <div class="item_desc_text line">\n            <div style="float:right">\n                \n \n            </div>\n                        <p>\r\n\tFreshen up your weekend look by a whole extra notch in these\xa0<strong>Reebok Possession II Lp Flip Flops\xa0</strong>that are designed in cool hues and take your style factor, a level higher. Wear these slippers with a printed T-shirt paired with shorts.</p>\r\n<p>\r\n\tIngenious technology and an intimidating passion are employed by <strong>Reebok</strong> while fashioning its irresistible range of footwear; the discerning outdoor-lover can now enjoy all escapades to the hilt.</p>\r\n<p>\r\n\t<strong>Footwear Care</strong></p>\r\n<p>\r\n\tClean these flip-flops regularly by washing them with a gentle, fabric-friendly cleanser to remove dirt.</p>        </div>\n        <div style="clear: both;"></div>\n            </div>'], 'spec': [u'<div id="specifications" class="item_left_column">\n    <h3 class="item_desc_title fk-uppercase">\n        Specifications of Reebok Possession II Lp Flip Flops    </h3>\n\n            <table cellspacing="0" class="fk-specs-type2"><tr><th class="group-head" colspan="2">General</th>\n            </tr><tr class=""><td class="specs-key">Ideal For</td>\n                                        <td class="specs-value fk-data">Women</td>\n                </tr></table><table cellspacing="0" class="fk-specs-type2"><tr><th class="group-head" colspan="2">Slipper &amp; Flip Flop Details</th>\n            </tr><tr class=""><td class="specs-key">Style</td>\n                                        <td class="specs-value fk-data">Fabric Strap, Panel and Stitch Detail</td>\n                </tr><tr class=""><td class="specs-key">Design</td>\n                                        <td class="specs-value fk-data">Print on Footbed</td>\n                </tr><tr class=""><td class="specs-key">Color</td>\n                                        <td class="specs-value fk-data">Prospect Purple, Lime, Grey</td>\n                </tr><tr class=""><td class="specs-key">Type</td>\n                                        <td class="specs-value fk-data">Flip Flops</td>\n                </tr><tr class=""><td class="specs-key">Tip Shape</td>\n                                        <td class="specs-value fk-data">Round</td>\n                </tr><tr class=""><td class="specs-key">Weight</td>\n                                        <td class="specs-value fk-data">100 gm (per single Slipper) - Weight of the product may vary depending on size.</td>\n                </tr></table><table cellspacing="0" class="fk-specs-type2"><tr><th class="group-head" colspan="2">Additional Details</th>\n            </tr><tr class=""><td class="specs-key">Other Details</td>\n                                        <td class="specs-value fk-data">Rubber Sole</td>\n                </tr></table></div>'], 'size': [u'4', u'5', u'6', u'7']}
{'sku': [u'/viewcart?eid=LSTSFFDQXYV2NNYNMZPD4UWQV'], 'seller': [u'WS Retail', u'[?]'], 'title': [u'\n                    Reebok Possession Lp Flip Flops            '], 'colour': [u'Lime, Black', u'Pink, Black'], 'sp': [u' Rs. 418', u'(1,977,241'], 'mrp': [u'Rs. 599'], 'titleimg': [u'http://img6a.flixcart.com/image/slipper-flip-flop/z/g/t/blue-black-possession-lp-reebok-6-400x400-imadrvz3gbtsztpc.jpeg'], 'catname': ['slippers-flip-flops'], 'brandname': ['Reebok.'], 'date': ['18:02:2014'], 'itemlink': ['http://www.flipkart.com/reebok-possession-lp-flip-flops/p/itmdqxyve2pknakb?pid=SFFDQXYV2NNYNMZP&srno=b_4&ref=8ebe543b-50d9-452d-a90b-eb928198b2b8'], 'desc': [u'<div class="item_left_column" id="description">\n        <h3 class="item_desc_title fk-uppercase">Reebok Possession Lp Flip Flops         Price: Rs.418</h3>\n        <div class="cls"></div>\n        <div class="item_desc_text line">\n            <div style="float:right">\n                \n \n            </div>\n                        <p style="text-align: justify;">\r\n\tIt\'s easy to see where her style quotient lies, even on her off-duty days. Clearly, it\'s the charm of these<strong>\xa0Possession Lp Flip Flops</strong> from Reebok. Constructed with a <strong>padded footbed</strong> to mitigate sore heels and fashioned with a <strong>printed footbed</strong>, these funky flip-flops are truly, a must-have. These flip-flops look best paired with capris or denim hot pants.</p>\r\n<p style="text-align: justify;">\r\n\tIngenious technology and an intimidating passion are employed by <strong>Reebok </strong>while fashioning its irresistible range of footwear; the discerning outdoor-lover can now enjoy all escapades to the hilt.</p>\r\n<p>\r\n\t<strong>Footwear Care</strong></p>\r\n<p>\r\n\tWash gently with a mild cleanser.</p>        </div>\n        <div style="clear: both;"></div>\n            </div>'], 'spec': [u'<div id="specifications" class="item_left_column">\n    <h3 class="item_desc_title fk-uppercase">\n        Specifications of Reebok Possession Lp Flip Flops    </h3>\n\n            <table cellspacing="0" class="fk-specs-type2"><tr><th class="group-head" colspan="2">General</th>\n            </tr><tr class=""><td class="specs-key">Ideal For</td>\n                                        <td class="specs-value fk-data">Women</td>\n                </tr></table><table cellspacing="0" class="fk-specs-type2"><tr><th class="group-head" colspan="2">Slipper &amp; Flip Flop Details</th>\n            </tr><tr class=""><td class="specs-key">Style</td>\n                                        <td class="specs-value fk-data">Broad Strap, Panel Detail</td>\n                </tr><tr class=""><td class="specs-key">Design</td>\n                                        <td class="specs-value fk-data">Printed Footbed</td>\n                </tr><tr class=""><td class="specs-key">Color</td>\n                                        <td class="specs-value fk-data">Blue, Black</td>\n                </tr><tr class=""><td class="specs-key">Type</td>\n                                        <td class="specs-value fk-data">Flip Flops</td>\n                </tr><tr class=""><td class="specs-key">Tip Shape</td>\n                                        <td class="specs-value fk-data">Round</td>\n                </tr><tr class=""><td class="specs-key">Weight</td>\n                                        <td class="specs-value fk-data">56 gm (per single Slipper) - Weight of the product may vary depending on size.</td>\n                </tr></table><table cellspacing="0" class="fk-specs-type2"><tr><th class="group-head" colspan="2">Additional Details</th>\n            </tr><tr class=""><td class="specs-key">Other Details</td>\n                                        <td class="specs-value fk-data">Padded Footbed, Textured Outsole</td>\n                </tr></table></div>'], 'size': [u'4', u'5', u'6', u'7']}
{'sku': [u'/viewcart?eid=LSTSFFDQXYVXWVFD9GNOQP93Z'], 'seller': [u'WS Retail', u'[?]'], 'title': [u'\n                    Reebok Coyaba Ii Lp Flip Flops            '], 'colour': [u'Pink, Yellow', u'Royal,White'], 'sp': [u' Rs. 628', u'(1,977,241'], 'mrp': [u'Rs. 899'], 'titleimg': [u'http://img5a.flixcart.com/image/slipper-flip-flop/9/g/n/radar-yellow-hero-green-coyaba-ii-lp-reebok-4-400x400-imads357xmzf7aju.jpeg'], 'catname': ['slippers-flip-flops'], 'brandname': ['Reebok.'], 'date': ['18:02:2014'], 'itemlink': ['http://www.flipkart.com/reebok-coyaba-ii-lp-flip-flops/p/itmdqxyv7nnydc9g?pid=SFFDQXYVXWVFD9GN&srno=b_8&ref=8ebe543b-50d9-452d-a90b-eb928198b2b8'], 'desc': [u'<div class="item_left_column" id="description">\n        <h3 class="item_desc_title fk-uppercase">Reebok Coyaba Ii Lp Flip Flops         Price: Rs.628</h3>\n        <div class="cls"></div>\n        <div class="item_desc_text line">\n            <div style="float:right">\n                \n \n            </div>\n                        <p style="text-align: justify;">\r\n\tAdding a splash of colour to a rather simple pair of Flip Flops, Reebok makes sure your casual days are made interesting wearing them. Crafted with a <strong>woven strap</strong> and a rubber sole, these flip flops bear a stylish <strong>printed footbed</strong> in radar yellow and hero green. Team them with a pair of shorts and a casual tee.</p>\r\n<p style="text-align: justify;">\r\n\tIngenious technology and an intimidating passion are employed by <strong>Reebok </strong>while fashioning its irresistible range of footwear; the discerning outdoor-lover can now enjoy all escapades to the hilt.</p>\r\n<p style="text-align: justify;">\r\n\t<strong>Footwear Care</strong></p>\r\n<p style="text-align: justify;">\r\n\tWipe clean with a soft cloth.</p>        </div>\n        <div style="clear: both;"></div>\n            </div>'], 'spec': [u'<div id="specifications" class="item_left_column">\n    <h3 class="item_desc_title fk-uppercase">\n        Specifications of Reebok Coyaba Ii Lp Flip Flops    </h3>\n\n            <table cellspacing="0" class="fk-specs-type2"><tr><th class="group-head" colspan="2">General</th>\n            </tr><tr class=""><td class="specs-key">Ideal For</td>\n                                        <td class="specs-value fk-data">Women</td>\n                </tr></table><table cellspacing="0" class="fk-specs-type2"><tr><th class="group-head" colspan="2">Slipper &amp; Flip Flop Details</th>\n            </tr><tr class=""><td class="specs-key">Style</td>\n                                        <td class="specs-value fk-data">Rubber Sole, Woven Strap</td>\n                </tr><tr class=""><td class="specs-key">Design</td>\n                                        <td class="specs-value fk-data">Printed Footbed</td>\n                </tr><tr class=""><td class="specs-key">Color</td>\n                                        <td class="specs-value fk-data">Radar Yellow, Hero Green</td>\n                </tr><tr class=""><td class="specs-key">Type</td>\n                                        <td class="specs-value fk-data">Flip Flops</td>\n                </tr><tr class=""><td class="specs-key">Tip Shape</td>\n                                        <td class="specs-value fk-data">Round</td>\n                </tr><tr class=""><td class="specs-key">Weight</td>\n                                        <td class="specs-value fk-data">73 gm (per single Slipper) - Weight of the product may vary depending on size.</td>\n                </tr></table><table cellspacing="0" class="fk-specs-type2"><tr><th class="group-head" colspan="2">Additional Details</th>\n            </tr><tr class=""><td class="specs-key">Other Details</td>\n                                        <td class="specs-value fk-data">Toe Partition</td>\n                </tr></table></div>'], 'size': [u'4', u'5', u'6', u'7']}
{'sku': [u'/viewcart?eid=LSTSFFDZDYAAGBUKPHAKUQFDX'], 'seller': [u'WS Retail', u'[?]'], 'title': [u'\n                    Reebok Transition Flip Lp Flip Flops            '], 'colour': [u'Risk Blue, Purple, Grey'], 'sp': [u' Rs. 674', u'(1,977,241'], 'mrp': [u'Rs. 899'], 'titleimg': [u'http://img5a.flixcart.com/image/slipper-flip-flop/d/v/t/purple-yellow-black-transition-flip-lp-reebok-7-400x400-imadp7fg5c3m8j5e.jpeg'], 'catname': ['slippers-flip-flops'], 'brandname': ['Reebok.'], 'date': ['18:02:2014'], 'itemlink': ['http://www.flipkart.com/reebok-transition-flip-lp-flops/p/itmdzdyh4yzme2zg?pid=SFFDZDYAAGBUKPHA&srno=b_5&ref=8ebe543b-50d9-452d-a90b-eb928198b2b8'], 'desc': [u'<div class="item_left_column" id="description">\n        <h3 class="item_desc_title fk-uppercase">Reebok Transition Flip Lp Flip Flops         Price: Rs.674</h3>\n        <div class="cls"></div>\n        <div class="item_desc_text line">\n            <div style="float:right">\n                \n \n            </div>\n                        <p>\r\n\tIn addition to the unrivaled style these flip-flops offer, what these\xa0<strong>Transition Flip Lp Flip Flops from Reebok</strong> really stand out for is the high degree of comfort your feet receive when you unwind during your off-duty days. Thanks to the firm <strong>textured sole and a fabric-made toe partition</strong> for grip.</p>\r\n<p style="text-align: justify;">\r\n\tIngenious technology and an intimidating passion are employed by <strong>Reebok</strong> while fashioning its irresistible range of footwear; the discerning outdoor-lover can now enjoy all escapades to the hilt.</p>\r\n<p>\r\n\t<strong>Footwear Care</strong></p>\r\n<p>\r\n\tWipe clean with a soft cloth to retain their look.</p>        </div>\n        <div style="clear: both;"></div>\n            </div>'], 'spec': [u'<div id="specifications" class="item_left_column">\n    <h3 class="item_desc_title fk-uppercase">\n        Specifications of Reebok Transition Flip Lp Flip Flops    </h3>\n\n            <table cellspacing="0" class="fk-specs-type2"><tr><th class="group-head" colspan="2">General</th>\n            </tr><tr class=""><td class="specs-key">Ideal For</td>\n                                        <td class="specs-value fk-data">Women</td>\n                </tr></table><table cellspacing="0" class="fk-specs-type2"><tr><th class="group-head" colspan="2">Slipper &amp; Flip Flop Details</th>\n            </tr><tr class=""><td class="specs-key">Style</td>\n                                        <td class="specs-value fk-data">Panel and Stitch Detail, Cut Work Detail</td>\n                </tr><tr class=""><td class="specs-key">Design</td>\n                                        <td class="specs-value fk-data">Printed Footbed</td>\n                </tr><tr class=""><td class="specs-key">Color</td>\n                                        <td class="specs-value fk-data">Purple, Yellow, Black</td>\n                </tr><tr class=""><td class="specs-key">Type</td>\n                                        <td class="specs-value fk-data">Flip Flops</td>\n                </tr><tr class=""><td class="specs-key">Strap Material</td>\n                                        <td class="specs-value fk-data">Rubber</td>\n                </tr><tr class=""><td class="specs-key">Tip Shape</td>\n                                        <td class="specs-value fk-data">Round</td>\n                </tr><tr class=""><td class="specs-key">Weight</td>\n                                        <td class="specs-value fk-data">83 gm (per single Slipper) - Weight of the product may vary depending on size.</td>\n                </tr></table><table cellspacing="0" class="fk-specs-type2"><tr><th class="group-head" colspan="2">Additional Details</th>\n            </tr><tr class=""><td class="specs-key">Other Details</td>\n                                        <td class="specs-value fk-data">Fabric Toe Partition, Textured Sole</td>\n                </tr></table></div>'], 'size': [u'4', u'5', u'6', u'7']}
{'sku': [u'/viewcart?eid=LSTSFFDZDYAHVDEFPWNJLBFR9'], 'seller': [u'WS Retail', u'[?]'], 'title': [u'\n                    Reebok Transition Flip Lp Flip Flops            '], 'colour': [u'Purple Shade, Optimal Pink', u'Purple, Yellow, Black'], 'sp': [u' Rs. 674', u'(1,977,241'], 'mrp': [u'Rs. 899'], 'titleimg': [u'http://img6a.flixcart.com/image/slipper-flip-flop/3/a/r/risk-blue-purple-grey-transition-flip-lp-reebok-7-400x400-imadp6zubyucxmqd.jpeg'], 'catname': ['slippers-flip-flops'], 'brandname': ['Reebok.'], 'date': ['18:02:2014'], 'itemlink': ['http://www.flipkart.com/reebok-transition-flip-lp-flops/p/itmdzdyhnh68u33p?pid=SFFDZDYAHVDEFPWN&srno=b_7&ref=8ebe543b-50d9-452d-a90b-eb928198b2b8'], 'desc': [u'<div class="item_left_column" id="description">\n        <h3 class="item_desc_title fk-uppercase">Reebok Transition Flip Lp Flip Flops         Price: Rs.674</h3>\n        <div class="cls"></div>\n        <div class="item_desc_text line">\n            <div style="float:right">\n                \n \n            </div>\n                        <p style="text-align: justify;">\r\n\tThe transition of the weekday to the weekend is a joyful one as comfort is a certainty in these cool\xa0<strong>Flip Lp Flip Flops</strong> from Reebok. While your feet enjoy unparalleled bliss in the soft footbed and roomy contours of these flip-flops, what really makes you take notice is the quirky print.</p>\r\n<p style="text-align: justify;">\r\n\tIngenious technology and an intimidating passion are employed by<strong> Reebok</strong> while fashioning its irresistible range of footwear; the discerning outdoor-lover can now enjoy all escapades to the hilt.</p>\r\n<p style="text-align: justify;">\r\n\t<strong>Footwear Care</strong></p>\r\n<p style="text-align: justify;">\r\n\tWash these slippers gently with a mild cleanser to keep them clean.</p>        </div>\n        <div style="clear: both;"></div>\n            </div>'], 'spec': [u'<div id="specifications" class="item_left_column">\n    <h3 class="item_desc_title fk-uppercase">\n        Specifications of Reebok Transition Flip Lp Flip Flops    </h3>\n\n            <table cellspacing="0" class="fk-specs-type2"><tr><th class="group-head" colspan="2">General</th>\n            </tr><tr class=""><td class="specs-key">Ideal For</td>\n                                        <td class="specs-value fk-data">Women</td>\n                </tr></table><table cellspacing="0" class="fk-specs-type2"><tr><th class="group-head" colspan="2">Slipper &amp; Flip Flop Details</th>\n            </tr><tr class=""><td class="specs-key">Style</td>\n                                        <td class="specs-value fk-data">Panel and Stitch Detail</td>\n                </tr><tr class=""><td class="specs-key">Design</td>\n                                        <td class="specs-value fk-data">Print on Footbed</td>\n                </tr><tr class=""><td class="specs-key">Color</td>\n                                        <td class="specs-value fk-data">Risk Blue, Purple, Grey</td>\n                </tr><tr class=""><td class="specs-key">Type</td>\n                                        <td class="specs-value fk-data">Flip Flops</td>\n                </tr><tr class=""><td class="specs-key">Strap Material</td>\n                                        <td class="specs-value fk-data">Rubber</td>\n                </tr><tr class=""><td class="specs-key">Tip Shape</td>\n                                        <td class="specs-value fk-data">Round</td>\n                </tr><tr class=""><td class="specs-key">Weight</td>\n                                        <td class="specs-value fk-data">83 gm (per single Slipper) - Weight of the product may vary depending on size.</td>\n                </tr></table><table cellspacing="0" class="fk-specs-type2"><tr><th class="group-head" colspan="2">Additional Details</th>\n            </tr><tr class=""><td class="specs-key">Other Details</td>\n                                        <td class="specs-value fk-data">Textured Sole, Fabric Toe Partition</td>\n                </tr></table></div>'], 'size': [u'4', u'5', u'6', u'7']}
{'sku': [], 'seller': [], 'title': [], 'colour': [], 'sp': [], 'mrp': [u'Rs. 899'], 'titleimg': [u'http://img5a.flixcart.com/image/slipper-flip-flop/z/b/m/purple-shade-optimal-pink-transition-flip-lp-reebok-7-400x400-imadrs3dkgpt6zyz.jpeg'], 'catname': ['slippers-flip-flops'], 'brandname': ['Reebok.'], 'date': ['18:02:2014'], 'itemlink': ['http://www.flipkart.com/reebok-transition-flip-lp-flops/p/itmdzdyhehympqnc?pid=SFFDZDYAZGX98ZBM&srno=b_1&ref=8ebe543b-50d9-452d-a90b-eb928198b2b8'], 'desc': [u'<div class="item_left_column" id="description">\n        <h3 class="item_desc_title fk-uppercase">Reebok Transition Flip Lp Flip Flops         Price: Rs.674</h3>\n        <div class="cls"></div>\n        <div class="item_desc_text line">\n            <div style="float:right">\n                \n \n            </div>\n                        <p style="text-align: justify;">\r\n\tThe generous splash of optimal pink on the footbed\xa0of these\xa0<strong>Transition Flip Lp Flip Flops from Reebok\xa0</strong>is the first thing that grabs her attention, in addition to the unrivaled comfort they offer. As the textured sole provides grip for a fuss-free stride, what really stands apart in these flip-flops is the quirky print on the footbed.</p>\r\n<p style="text-align: justify;">\r\n\tIngenious technology and an intimidating passion are employed by <strong>Reebok</strong> while fashioning its irresistible range of footwear; the discerning outdoor-lover can now enjoy all escapades to the hilt.</p>\r\n<p style="text-align: justify;">\r\n\t<strong>Footwear Care</strong></p>\r\n<p style="text-align: justify;">\r\n\tWash these slippers gently with water.</p>        </div>\n        <div style="clear: both;"></div>\n            </div>'], 'spec': [u'<div id="specifications" class="item_left_column">\n    <h3 class="item_desc_title fk-uppercase">\n        Specifications of Reebok Transition Flip Lp Flip Flops    </h3>\n\n            <table cellspacing="0" class="fk-specs-type2"><tr><th class="group-head" colspan="2">General</th>\n            </tr><tr class=""><td class="specs-key">Ideal For</td>\n                                        <td class="specs-value fk-data">Women</td>\n                </tr></table><table cellspacing="0" class="fk-specs-type2"><tr><th class="group-head" colspan="2">Slipper &amp; Flip Flop Details</th>\n            </tr><tr class=""><td class="specs-key">Design</td>\n                                        <td class="specs-value fk-data">Print on Footbed</td>\n                </tr><tr class=""><td class="specs-key">Color</td>\n                                        <td class="specs-value fk-data">Purple Shade, Optimal Pink</td>\n                </tr><tr class=""><td class="specs-key">Type</td>\n                                        <td class="specs-value fk-data">Flip Flops</td>\n                </tr><tr class=""><td class="specs-key">Strap Material</td>\n                                        <td class="specs-value fk-data">Rubber</td>\n                </tr><tr class=""><td class="specs-key">Tip Shape</td>\n                                        <td class="specs-value fk-data">Round</td>\n                </tr><tr class=""><td class="specs-key">Weight</td>\n                                        <td class="specs-value fk-data">83 gm (per single Slipper) - Weight of the product may vary depending on size.</td>\n                </tr></table><table cellspacing="0" class="fk-specs-type2"><tr><th class="group-head" colspan="2">Additional Details</th>\n            </tr><tr class=""><td class="specs-key">Other Details</td>\n                                        <td class="specs-value fk-data">Textured Sole, Fabric Toe Partition</td>\n                </tr></table></div>'], 'size': []}
