{'sku': [u'/viewcart?eid=LSTSFFDP8XFJTZUQV5BOQD0NN'], 'seller': [u'WS Retail', u'[?]'], 'title': [u'\n                    tZaro Slipa Slippers            '], 'colour': [], 'sp': [u' Rs. 919', u'(1,978,982'], 'mrp': [u'Rs. 1149'], 'titleimg': [u'http://img5a.flixcart.com/image/slipper-flip-flop/v/5/b/tan-iqpmgud201-tzaro-8-400x400-imadqqhrjemdhvfj.jpeg'], 'catname': ['mens-footwear'], 'brandname': ['tZaro.'], 'date': ['18:02:2014'], 'itemlink': ['http://www.flipkart.com/tzaro-slipa-slippers/p/itmdp8xfjemzrza5?pid=SFFDP8XFJTZUQV5B&srno=b_2&ref=abe79598-8acd-4d79-a80f-245dbafb69d9'], 'desc': [u'<div class="item_left_column" id="description">\n        <h3 class="item_desc_title fk-uppercase">tZaro Slipa Slippers         Price: Rs.919</h3>\n        <div class="cls"></div>\n        <div class="item_desc_text line">\n            <div style="float:right">\n                \n \n            </div>\n                        <p>\r\n\tTake a joyful stride on those off-duty days by slipping into this pair of\xa0Slipa Slippers exquisitely designed by tZaro. The wide straps of these tan-shaded slippers are complemented by <strong>buckle closure</strong>. Enhanced with a padded footbed for extra comfort, these slippers can be teamed with a striped kurti and a pair of pyjamas.</p>\r\n<p>\r\n\tReinforcing a unique style for men that is indirect and bold,<strong> tZaro</strong> reaches the masses through its high quality comfort and durability; slip in to some rustic and fashionable footwear that will set your style meter whizzing out of control.</p>\r\n<p>\r\n\t<strong>Footwear Care</strong></p>\r\n<p>\r\n\tWipe clean with a soft cloth.</p>        </div>\n        <div style="clear: both;"></div>\n            </div>'], 'spec': [u'<div id="specifications" class="item_left_column">\n    <h3 class="item_desc_title fk-uppercase">\n        Specifications of tZaro Slipa Slippers    </h3>\n\n            <table cellspacing="0" class="fk-specs-type2"><tr><th class="group-head" colspan="2">General</th>\n            </tr><tr class=""><td class="specs-key">Ideal For</td>\n                                        <td class="specs-value fk-data">Men</td>\n                </tr></table><table cellspacing="0" class="fk-specs-type2"><tr><th class="group-head" colspan="2">Slipper &amp; Flip Flop Details</th>\n            </tr><tr class=""><td class="specs-key">Style</td>\n                                        <td class="specs-value fk-data">Panel and Stitch Detail, Wide Strap, Buckle Closure on Strap</td>\n                </tr><tr class=""><td class="specs-key">Color</td>\n                                        <td class="specs-value fk-data">Tan</td>\n                </tr><tr class=""><td class="specs-key">Type</td>\n                                        <td class="specs-value fk-data">Slippers</td>\n                </tr><tr class=""><td class="specs-key">Heel Height</td>\n                                        <td class="specs-value fk-data">0.5 inch</td>\n                </tr><tr class=""><td class="specs-key">Tip Shape</td>\n                                        <td class="specs-value fk-data">Round</td>\n                </tr><tr class=""><td class="specs-key">Weight</td>\n                                        <td class="specs-value fk-data">250 gm (per single Slipper) - Weight of the product may vary depending on size.</td>\n                </tr></table><table cellspacing="0" class="fk-specs-type2"><tr><th class="group-head" colspan="2">Additional Details</th>\n            </tr><tr class=""><td class="specs-key">Other Details</td>\n                                        <td class="specs-value fk-data">Padded Footbed, Toe Partition, Heel Construction, Textured Sole and Footbed</td>\n                </tr></table></div>'], 'size': [u'6', u'7', u'8', u'9', u'10']}
{'sku': [u'/viewcart?eid=LSTSFFDP8XF6QE2GHTRAEK1N6'], 'seller': [u'WS Retail', u'[?]'], 'title': [u'\n                    tZaro Zslip Slippers            '], 'colour': [], 'sp': [u' Rs. 919', u'(1,978,982'], 'mrp': [u'Rs. 1149'], 'titleimg': [u'http://img5a.flixcart.com/image/slipper-flip-flop/w/v/r/tan-brown-iqpmgud205-tzaro-9-400x400-imadqxcfggpernv4.jpeg'], 'catname': ['mens-footwear'], 'brandname': ['tZaro.'], 'date': ['18:02:2014'], 'itemlink': ['http://www.flipkart.com/tzaro-zslip-slippers/p/itmdp8xfzcptwn5a?pid=SFFDP8XF6QE2GHTR&srno=b_1&ref=abe79598-8acd-4d79-a80f-245dbafb69d9'], 'desc': [u'<div class="item_left_column" id="description">\n        <h3 class="item_desc_title fk-uppercase">tZaro Zslip Slippers         Price: Rs.919</h3>\n        <div class="cls"></div>\n        <div class="item_desc_text line">\n            <div style="float:right">\n                \n \n            </div>\n                        <p>\r\n\tA perfect amalgamation of timeless comfort and style, this pair of Zslip Slippers from tZaro is sure to elevate your off-duty look in an instant. The <strong>cushiony effect under the broad straps </strong>lets your feet revel in absolute comfort. A trendy fusion of brown and tan, these slippers can be teamed with a printed tee and jeans.\xa0</p>\r\n<p>\r\n\tReinforcing a unique style for men that is indirect and bold, <strong>tZaro</strong> reaches the masses through its high quality comfort and durability; slip in to some rustic and fashionable footwear that will set your style meter whizzing out of control.</p>\r\n<p>\r\n\t<strong>Footwear Care</strong></p>\r\n<p>\r\n\tWipe clean with a soft cloth.</p>        </div>\n        <div style="clear: both;"></div>\n            </div>'], 'spec': [u'<div id="specifications" class="item_left_column">\n    <h3 class="item_desc_title fk-uppercase">\n        Specifications of tZaro Zslip Slippers    </h3>\n\n            <table cellspacing="0" class="fk-specs-type2"><tr><th class="group-head" colspan="2">General</th>\n            </tr><tr class=""><td class="specs-key">Ideal For</td>\n                                        <td class="specs-value fk-data">Men</td>\n                </tr></table><table cellspacing="0" class="fk-specs-type2"><tr><th class="group-head" colspan="2">Slipper &amp; Flip Flop Details</th>\n            </tr><tr class=""><td class="specs-key">Style</td>\n                                        <td class="specs-value fk-data">Broad Strap, Panel and Stitch Detail, Cushiony Effect Under the Strap</td>\n                </tr><tr class=""><td class="specs-key">Color</td>\n                                        <td class="specs-value fk-data">Tan, Brown</td>\n                </tr><tr class=""><td class="specs-key">Type</td>\n                                        <td class="specs-value fk-data">Slippers</td>\n                </tr><tr class=""><td class="specs-key">Tip Shape</td>\n                                        <td class="specs-value fk-data">Round</td>\n                </tr><tr class=""><td class="specs-key">Weight</td>\n                                        <td class="specs-value fk-data">168 gm (per single Slipper) - Weight of the product may vary depending on size.</td>\n                </tr></table><table cellspacing="0" class="fk-specs-type2"><tr><th class="group-head" colspan="2">Additional Details</th>\n            </tr><tr class=""><td class="specs-key">Other Details</td>\n                                        <td class="specs-value fk-data">Textured Outsole, Padded Footbed</td>\n                </tr></table></div>'], 'size': [u'6', u'7', u'8', u'9', u'10']}
{'sku': [u'/viewcart?eid=LSTSFFDP8XFDYZ8HDGHDJQT7G'], 'seller': [u'WS Retail', u'[?]'], 'title': [u'\n                    tZaro Tslip Slippers            '], 'colour': [], 'sp': [u' Rs. 919', u'(1,978,982'], 'mrp': [u'Rs. 1149'], 'titleimg': [u'http://img5a.flixcart.com/image/slipper-flip-flop/d/g/h/tan-brown-iqpmgud204-tzaro-8-400x400-imadqqhrt6wgd3ew.jpeg'], 'catname': ['mens-footwear'], 'brandname': ['tZaro.'], 'date': ['18:02:2014'], 'itemlink': ['http://www.flipkart.com/tzaro-tslip-slippers/p/itmdp8xfvczfhnvy?pid=SFFDP8XFDYZ8HDGH&srno=b_8&ref=abe79598-8acd-4d79-a80f-245dbafb69d9'], 'desc': [u'<div class="item_left_column" id="description">\n        <h3 class="item_desc_title fk-uppercase">tZaro Tslip Slippers         Price: Rs.919</h3>\n        <div class="cls"></div>\n        <div class="item_desc_text line">\n            <div style="float:right">\n                \n \n            </div>\n                        <p>\r\n\tTake a light stroll in your garden by slipping into this pair of\xa0Tslip Slippers meticulously crafted by\xa0tZaro. A smart blend of tan and brown shades, this pair of slippers comes with<strong> rivet and cutwork detailing</strong>. These slippers are perfect to be teamed with a loose shirt and a pair of pyjamas.\xa0</p>\r\n<p>\r\n\tReinforcing a unique style for men that is indirect and bold, <strong>tZaro</strong> reaches the masses through its high quality comfort and durability; slip in to some rustic and fashionable footwear that will set your style meter whizzing out of control.</p>\r\n<p>\r\n\t<strong>Footwear Care</strong></p>\r\n<p>\r\n\tWipe clean with a soft cloth.</p>        </div>\n        <div style="clear: both;"></div>\n            </div>'], 'spec': [u'<div id="specifications" class="item_left_column">\n    <h3 class="item_desc_title fk-uppercase">\n        Specifications of tZaro Tslip Slippers    </h3>\n\n            <table cellspacing="0" class="fk-specs-type2"><tr><th class="group-head" colspan="2">General</th>\n            </tr><tr class=""><td class="specs-key">Ideal For</td>\n                                        <td class="specs-value fk-data">Men</td>\n                </tr></table><table cellspacing="0" class="fk-specs-type2"><tr><th class="group-head" colspan="2">Slipper &amp; Flip Flop Details</th>\n            </tr><tr class=""><td class="specs-key">Style</td>\n                                        <td class="specs-value fk-data">Cut Work Detail, Panel and Stitch Detail, Rivet Detail</td>\n                </tr><tr class=""><td class="specs-key">Color</td>\n                                        <td class="specs-value fk-data">Tan, Brown</td>\n                </tr><tr class=""><td class="specs-key">Type</td>\n                                        <td class="specs-value fk-data">Slippers</td>\n                </tr><tr class=""><td class="specs-key">Heel Height</td>\n                                        <td class="specs-value fk-data">0.5 inch</td>\n                </tr><tr class=""><td class="specs-key">Tip Shape</td>\n                                        <td class="specs-value fk-data">Round</td>\n                </tr><tr class=""><td class="specs-key">Weight</td>\n                                        <td class="specs-value fk-data">209 gm (per single Slipper) - Weight of the product may vary depending on size.</td>\n                </tr></table><table cellspacing="0" class="fk-specs-type2"><tr><th class="group-head" colspan="2">Additional Details</th>\n            </tr><tr class=""><td class="specs-key">Other Details</td>\n                                        <td class="specs-value fk-data">Textured Sole and Footbed, Toe Partition, Heel Construction</td>\n                </tr></table></div>'], 'size': [u'7', u'8', u'9', u'10']}
{'sku': [u'/viewcart?eid=LSTSHODP8X8FHHHDTN4CELX6O'], 'seller': [u'WS Retail', u'[?]'], 'title': [u'\n                    tZaro Zig23 Corporate Casuals            '], 'colour': [], 'sp': [u' Rs. 2969', u'(1,979,018'], 'mrp': [u'Rs. 3299'], 'titleimg': [u'http://img5a.flixcart.com/image/shoe/9/m/h/cream-choco-saha3205-tzaro-6-400x400-imadqgsv6h8rzqyp.jpeg'], 'catname': ['mens-footwear'], 'brandname': ['tZaro.'], 'date': ['18:02:2014'], 'itemlink': ['http://www.flipkart.com/tzaro-zig23-corporate-casuals/p/itmdp8x85rq88bhm?pid=SHODP8X8FHHHDTN4&srno=b_5&ref=abe79598-8acd-4d79-a80f-245dbafb69d9'], 'desc': [u'<div class="item_left_column" id="description">\n        <h3 class="item_desc_title fk-uppercase">tZaro Zig23 Corporate Casuals         Price: Rs.2969</h3>\n        <div class="cls"></div>\n        <div class="item_desc_text line">\n            <div style="float:right">\n                \n \n            </div>\n                        <p>\r\n\tLending a subtle twist to your everyday style is this pair of\xa0Zig23 Corporate Casuals from tZaro. Crafted with a <strong>raised ankle</strong>, this pair of casual shoes gives a perfect style definition to your casual look. You can team these shoes with a casual shirt and a pair of jeans to make a fashion statement at work.\xa0</p>\r\n<p>\r\n\tReinforcing a unique style for men that is indirect and bold,<strong> tZaro</strong> reaches the masses through its high quality comfort and durability; slip in to some rustic and fashionable footwear that will set your style meter whizzing out of control.</p>\r\n<p>\r\n\t<strong>Footwear Care</strong></p>\r\n<p>\r\n\tAir the shoes out after every use. Use a soft brush to dust the shoes clean.</p>        </div>\n        <div style="clear: both;"></div>\n            </div>'], 'spec': [u'<div id="specifications" class="item_left_column">\n    <h3 class="item_desc_title fk-uppercase">\n        Specifications of tZaro Zig23 Corporate Casuals    </h3>\n\n            <table cellspacing="0" class="fk-specs-type2"><tr><th class="group-head" colspan="2">General</th>\n            </tr><tr class=""><td class="specs-key">Ideal For</td>\n                                        <td class="specs-value fk-data">Men</td>\n                </tr><tr class=""><td class="specs-key">Occasion</td>\n                                        <td class="specs-value fk-data">Casual</td>\n                </tr></table><table cellspacing="0" class="fk-specs-type2"><tr><th class="group-head" colspan="2">Shoe Details</th>\n            </tr><tr class=""><td class="specs-key">Style</td>\n                                        <td class="specs-value fk-data">Raised Ankle, Panel and Stitch Detail</td>\n                </tr><tr class=""><td class="specs-key">Color</td>\n                                        <td class="specs-value fk-data">Cream, Choco</td>\n                </tr><tr class=""><td class="specs-key">Closure</td>\n                                        <td class="specs-value fk-data">Laced</td>\n                </tr><tr class=""><td class="specs-key">Heel Height</td>\n                                        <td class="specs-value fk-data">1.25 inch</td>\n                </tr><tr class=""><td class="specs-key">Boot Shaft Height</td>\n                                        <td class="specs-value fk-data">3.5 inch</td>\n                </tr><tr class=""><td class="specs-key">Tip Shape</td>\n                                        <td class="specs-value fk-data">Round</td>\n                </tr><tr class=""><td class="specs-key">Weight</td>\n                                        <td class="specs-value fk-data">472 gm (per single Shoe) - Weight of the product may vary depending on size.</td>\n                </tr></table><table cellspacing="0" class="fk-specs-type2"><tr><th class="group-head" colspan="2">Additional Details</th>\n            </tr><tr class=""><td class="specs-key">Other Details</td>\n                                        <td class="specs-value fk-data">Textured Sole, Padded Footbed, Heel Construction</td>\n                </tr></table></div>'], 'size': [u'6', u'7', u'8', u'9', u'10']}
{'sku': [u'/viewcart?eid=LSTSHODP8X9HEHR6GSGUHEB8M'], 'seller': [u'WS Retail', u'[?]'], 'title': [u'\n                    tZaro Trcrunch Boots            '], 'colour': [], 'sp': [u' Rs. 2969', u'(1,979,018'], 'mrp': [u'Rs. 3299'], 'titleimg': [u'http://img5a.flixcart.com/image/shoe/g/s/g/tan-opu-saha3209-tzaro-6-400x400-imadqgt2gqqddjqn.jpeg'], 'catname': ['mens-footwear'], 'brandname': ['tZaro.'], 'date': ['18:02:2014'], 'itemlink': ['http://www.flipkart.com/tzaro-trcrunch-boots/p/itmdp8x9ntyyfzq6?pid=SHODP8X9HEHR6GSG&srno=b_6&ref=abe79598-8acd-4d79-a80f-245dbafb69d9'], 'desc': [u'<div class="item_left_column" id="description">\n        <h3 class="item_desc_title fk-uppercase">tZaro Trcrunch Boots         Price: Rs.2969</h3>\n        <div class="cls"></div>\n        <div class="item_desc_text line">\n            <div style="float:right">\n                \n \n            </div>\n                        <p>\r\n\tLet the Wild West come to you with this pair of Trcrunch Boots from tZaro. Its tan appearance gives it a rugged charm that is improved by its unique heel construction with a<strong> height of 1.25 inches</strong>. Team this with blue boot leg jeans and a checkered shirt.</p>\r\n<p>\r\n\tReinforcing a unique style for men that is indirect and bold,<strong> tZaro</strong> reaches the masses through its high quality comfort and durability; slip in to some rustic and fashionable footwear that will set your style meter whizzing out of control.<br>\r\n\t\xa0</p>\r\n<p>\r\n\t<strong>Footwear Care</strong><br>\r\n\tStore them away from water or moisture. Dry out in the sun if wet.</p>        </div>\n        <div style="clear: both;"></div>\n            </div>'], 'spec': [u'<div id="specifications" class="item_left_column">\n    <h3 class="item_desc_title fk-uppercase">\n        Specifications of tZaro Trcrunch Boots    </h3>\n\n            <table cellspacing="0" class="fk-specs-type2"><tr><th class="group-head" colspan="2">General</th>\n            </tr><tr class=""><td class="specs-key">Ideal For</td>\n                                        <td class="specs-value fk-data">Men</td>\n                </tr><tr class=""><td class="specs-key">Occasion</td>\n                                        <td class="specs-value fk-data">Casual</td>\n                </tr></table><table cellspacing="0" class="fk-specs-type2"><tr><th class="group-head" colspan="2">Shoe Details</th>\n            </tr><tr class=""><td class="specs-key">Style</td>\n                                        <td class="specs-value fk-data">Panel and Stitch Detail, Raised Ankle</td>\n                </tr><tr class=""><td class="specs-key">Color</td>\n                                        <td class="specs-value fk-data">Tan</td>\n                </tr><tr class=""><td class="specs-key">Closure</td>\n                                        <td class="specs-value fk-data">Laced</td>\n                </tr><tr class=""><td class="specs-key">Heel Height</td>\n                                        <td class="specs-value fk-data">1.25 inch</td>\n                </tr><tr class=""><td class="specs-key">Boot Shaft Height</td>\n                                        <td class="specs-value fk-data">3.5 inch</td>\n                </tr><tr class=""><td class="specs-key">Tip Shape</td>\n                                        <td class="specs-value fk-data">Round</td>\n                </tr><tr class=""><td class="specs-key">Weight</td>\n                                        <td class="specs-value fk-data">449 gm (per single Shoe) - Weight of the product may vary depending on size.</td>\n                </tr></table><table cellspacing="0" class="fk-specs-type2"><tr><th class="group-head" colspan="2">Additional Details</th>\n            </tr><tr class=""><td class="specs-key">Other Details</td>\n                                        <td class="specs-value fk-data">Heel Construction, Textured Sole, Padded Footbed</td>\n                </tr></table></div>'], 'size': [u'8', u'9']}
{'sku': [u'/viewcart?eid=LSTSFFDP8XF4CVZKYZJ1SUTWX'], 'seller': [u'WS Retail', u'[?]'], 'title': [u'\n                    tZaro Isplip Slippers            '], 'colour': [], 'sp': [u' Rs. 919', u'(1,979,018'], 'mrp': [u'Rs. 1149'], 'titleimg': [u'http://img5a.flixcart.com/image/slipper-flip-flop/h/z/y/tan-black-iqpmgud202-tzaro-8-400x400-imadqrphkxtzu9fw.jpeg'], 'catname': ['mens-footwear'], 'brandname': ['tZaro.'], 'date': ['18:02:2014'], 'itemlink': ['http://www.flipkart.com/tzaro-isplip-slippers/p/itmdp8xfkrvpcthz?pid=SFFDP8XF4CVZKYZJ&srno=b_9&ref=abe79598-8acd-4d79-a80f-245dbafb69d9'], 'desc': [u'<div class="item_left_column" id="description">\n        <h3 class="item_desc_title fk-uppercase">tZaro Isplip Slippers         Price: Rs.919</h3>\n        <div class="cls"></div>\n        <div class="item_desc_text line">\n            <div style="float:right">\n                \n \n            </div>\n                        <p>\r\n\tWhen you want to flaunt your cool, casual look on those off-duty days, slip into this pair of\xa0Isplip Slippers from tZaro. Your feet are sure to enjoy a dash of luxe comfort when walking as this pair of slippers comes with a <strong>velvet lined footbed</strong>. Team these trendy slippers with a printed tee and a pair of jeans.\xa0</p>\r\n<p>\r\n\tReinforcing a unique style for men that is indirect and bold, <strong>tZaro </strong>reaches the masses through its high quality comfort and durability; slip into some rustic and fashionable footwear that will set your style meter whizzing out of control.</p>\r\n<p>\r\n\t<strong>Footwear Care</strong></p>\r\n<p>\r\n\tWipe clean with a soft cloth.</p>        </div>\n        <div style="clear: both;"></div>\n            </div>'], 'spec': [u'<div id="specifications" class="item_left_column">\n    <h3 class="item_desc_title fk-uppercase">\n        Specifications of tZaro Isplip Slippers    </h3>\n\n            <table cellspacing="0" class="fk-specs-type2"><tr><th class="group-head" colspan="2">General</th>\n            </tr><tr class=""><td class="specs-key">Ideal For</td>\n                                        <td class="specs-value fk-data">Men</td>\n                </tr></table><table cellspacing="0" class="fk-specs-type2"><tr><th class="group-head" colspan="2">Slipper &amp; Flip Flop Details</th>\n            </tr><tr class=""><td class="specs-key">Style</td>\n                                        <td class="specs-value fk-data">Wide Strap, Velvet Lined Footbed</td>\n                </tr><tr class=""><td class="specs-key">Color</td>\n                                        <td class="specs-value fk-data">Tan, Black</td>\n                </tr><tr class=""><td class="specs-key">Type</td>\n                                        <td class="specs-value fk-data">Slippers</td>\n                </tr><tr class=""><td class="specs-key">Tip Shape</td>\n                                        <td class="specs-value fk-data">Round</td>\n                </tr><tr class=""><td class="specs-key">Weight</td>\n                                        <td class="specs-value fk-data">220 gm (per single Slipper) - Weight of the product may vary depending on size.</td>\n                </tr></table><table cellspacing="0" class="fk-specs-type2"><tr><th class="group-head" colspan="2">Additional Details</th>\n            </tr><tr class=""><td class="specs-key">Other Details</td>\n                                        <td class="specs-value fk-data">Textured Sole, Toe Partition</td>\n                </tr></table></div>'], 'size': [u'6', u'7', u'8', u'9', u'10']}
