{'sku': [u'/viewcart?eid=LSTSHODP8X8FS9UYYYMXOGH36'], 'seller': [u'WS Retail', u'[?]'], 'title': [u'\n                    tZaro Bluejazz Loafers            '], 'colour': [], 'sp': [u' Rs. 2698', u'(1,978,982'], 'mrp': [u'Rs. 2999'], 'titleimg': [u'http://img6a.flixcart.com/image/shoe/f/h/h/blu-blk-stn2305-tzaro-6-400x400-imadqgsvemmfh6hj.jpeg'], 'catname': ['mens-footwear'], 'brandname': ['tZaro.'], 'date': ['18:02:2014'], 'itemlink': ['http://www.flipkart.com/tzaro-bluejazz-loafers/p/itmdp8x8ftqyf3vf?pid=SHODP8X8FS9UYYYM&srno=b_13&ref=abe79598-8acd-4d79-a80f-245dbafb69d9'], 'desc': [u'<div class="item_left_column" id="description">\n        <h3 class="item_desc_title fk-uppercase">tZaro Bluejazz Loafers         Price: Rs.2698</h3>\n        <div class="cls"></div>\n        <div class="item_desc_text line">\n            <div style="float:right">\n                \n \n            </div>\n                        <p>\r\n\tDesigned with a padded footbed, this pair of\xa0Bluejazz Loafers from tZaro\xa0cradles your feet to some luxe\xa0and cushioned comfort whenever you step out. The <strong>lace running through the ankle</strong> brings out the classic charm of this pair of loafers. A trendy fusion of black and blue, these loafers can be teamed with a polo tee and chinos.</p>\r\n<p>\r\n\tReinforcing a unique style for men that is indirect and bold, <strong>tZaro </strong>reaches the masses through its high quality comfort and durability; slip in to some rustic and fashionable footwear that will set your style meter whizzing out of control.</p>\r\n<p>\r\n\t<strong>Footwear Care</strong></p>\r\n<p>\r\n\tWipe clean with a soft cloth.</p>        </div>\n        <div style="clear: both;"></div>\n            </div>'], 'spec': [u'<div id="specifications" class="item_left_column">\n    <h3 class="item_desc_title fk-uppercase">\n        Specifications of tZaro Bluejazz Loafers    </h3>\n\n            <table cellspacing="0" class="fk-specs-type2"><tr><th class="group-head" colspan="2">General</th>\n            </tr><tr class=""><td class="specs-key">Ideal For</td>\n                                        <td class="specs-value fk-data">Men</td>\n                </tr><tr class=""><td class="specs-key">Occasion</td>\n                                        <td class="specs-value fk-data">Casual</td>\n                </tr></table><table cellspacing="0" class="fk-specs-type2"><tr><th class="group-head" colspan="2">Shoe Details</th>\n            </tr><tr class=""><td class="specs-key">Style</td>\n                                        <td class="specs-value fk-data">Panel and Stitch Detail, Lace Running Through Ankle</td>\n                </tr><tr class=""><td class="specs-key">Color</td>\n                                        <td class="specs-value fk-data">Blue, Black</td>\n                </tr><tr class=""><td class="specs-key">Tip Shape</td>\n                                        <td class="specs-value fk-data">Square</td>\n                </tr><tr class=""><td class="specs-key">Weight</td>\n                                        <td class="specs-value fk-data">256 gm (per single Shoe) - Weight of the product may vary depending on size.</td>\n                </tr></table><table cellspacing="0" class="fk-specs-type2"><tr><th class="group-head" colspan="2">Additional Details</th>\n            </tr><tr class=""><td class="specs-key">Other Details</td>\n                                        <td class="specs-value fk-data">Padded Footbed, Textured Sole</td>\n                </tr></table><table cellspacing="0" class="fk-specs-type2"><tr><th class="group-head" colspan="2">In the Box</th>\n            </tr><tr class=""><td colspan="2" class="specs-value fk-data">Shoe Stick</td>\n                </tr></table></div>'], 'size': [u'6', u'7', u'8', u'9']}
{'sku': [u'/viewcart?eid=LSTSNDDP8XEEFN8VBGZA31I8K'], 'seller': [u'WS Retail', u'[?]'], 'title': [u'\n                    tZaro Leather            '], 'colour': [], 'sp': [u' Rs. 1598', u'(1,978,982'], 'mrp': [u'Rs. 1999'], 'titleimg': [u'http://img5a.flixcart.com/image/sandal/7/k/s/dark-choclate-ronny4106-tzaro-6-400x400-imadqgsw6agqrfg9.jpeg'], 'catname': ['mens-footwear'], 'brandname': ['tZaro.'], 'date': ['18:02:2014'], 'itemlink': ['http://www.flipkart.com/tzaro-leather/p/itmdp8xedh9znv6k?pid=SNDDP8XEEFN8VBGZ&srno=b_17&ref=e3a7da33-a2be-45cc-8a98-d9986a1b8208'], 'desc': [u'<div class="item_left_column" id="description">\n        <h3 class="item_desc_title fk-uppercase">tZaro Leather         Price: Rs.1598</h3>\n        <div class="cls"></div>\n        <div class="item_desc_text line">\n            <div style="float:right">\n                \n \n            </div>\n                        <p>\r\n\tBring out the fun side of your personality and casual vibe of your everyday look by slipping into this pair of casual sandals from tZaro. Crafted from the <strong>finest leather</strong> in dark chocolate shade, this pair of sandals gives a perfect definition to your look. Team these sandals with a casual shirt and jeans.\xa0</p>\r\n<p>\r\n\tReinforcing a unique style for men that is indirect and bold, <strong>tZaro</strong> reaches the masses through its high quality comfort and durability; slip in to some rustic and fashionable footwear that will set your style meter whizzing out of control.</p>\r\n<p>\r\n\t<strong>Footwear Care</strong></p>\r\n<p>\r\n\tWipe clean with a soft cloth.</p>        </div>\n        <div style="clear: both;"></div>\n            </div>'], 'spec': [u'<div id="specifications" class="item_left_column">\n    <h3 class="item_desc_title fk-uppercase">\n        Specifications of tZaro Leather    </h3>\n\n            <table cellspacing="0" class="fk-specs-type2"><tr><th class="group-head" colspan="2">General</th>\n            </tr><tr class=""><td class="specs-key">Ideal For</td>\n                                        <td class="specs-value fk-data">Men</td>\n                </tr></table><table cellspacing="0" class="fk-specs-type2"><tr><th class="group-head" colspan="2">Sandal Details</th>\n            </tr><tr class=""><td class="specs-key">Style</td>\n                                        <td class="specs-value fk-data">Panel and Stitch Detail, Cut Work Detail</td>\n                </tr><tr class=""><td class="specs-key">Color</td>\n                                        <td class="specs-value fk-data">Dark Chocolate</td>\n                </tr><tr class=""><td class="specs-key">Tip Shape</td>\n                                        <td class="specs-value fk-data">Round</td>\n                </tr><tr class=""><td class="specs-key">Weight</td>\n                                        <td class="specs-value fk-data">254 gm (per single Sandal) - Weight of the product may vary depending on size.</td>\n                </tr></table><table cellspacing="0" class="fk-specs-type2"><tr><th class="group-head" colspan="2">Additional Details</th>\n            </tr><tr class=""><td class="specs-key">Other Details</td>\n                                        <td class="specs-value fk-data">Padded Footbed, Textured Sole</td>\n                </tr></table></div>'], 'size': [u'6', u'7', u'9']}
{'sku': [u'/viewcart?eid=LSTSHODP8X85FBFGRJNIRU2ET'], 'seller': [u'WS Retail', u'[?]'], 'title': [u'\n                    tZaro Tango Corporate Casuals            '], 'colour': [], 'sp': [u' Rs. 2698', u'(1,978,982'], 'mrp': [u'Rs. 2999'], 'titleimg': [u'http://img6a.flixcart.com/image/shoe/c/v/f/camel-tan-opu-saha3208-tzaro-6-400x400-imadqgt2hpkfrhzg.jpeg'], 'catname': ['mens-footwear'], 'brandname': ['tZaro.'], 'date': ['18:02:2014'], 'itemlink': ['http://www.flipkart.com/tzaro-tango-corporate-casuals/p/itmdp8x9bshaa4ky?pid=SHODP8X85FBFGRJN&srno=b_14&ref=abe79598-8acd-4d79-a80f-245dbafb69d9'], 'desc': [u'<div class="item_left_column" id="description">\n        <h3 class="item_desc_title fk-uppercase">tZaro Tango Corporate Casuals         Price: Rs.2698</h3>\n        <div class="cls"></div>\n        <div class="item_desc_text line">\n            <div style="float:right">\n                \n \n            </div>\n                        <p>\r\n\tDress up in casual by slipping into this pair of\xa0Tango Corporate Casuals from tZaro and get ready to receive compliments that come your way as you enter the floor. A classic fusion of tan and camel shades, this pair of casual shoes features a <strong>panel and stitch detail</strong>. Team these shoes with a casual shirt and jeans.\xa0</p>\r\n<p>\r\n\tReinforcing a unique style for men that is indirect and bold,<strong> tZaro</strong> reaches the masses through its high quality comfort and durability; slip in to some rustic and fashionable footwear that will set your style meter whizzing out of control.</p>\r\n<p>\r\n\t<strong>Footwear Care</strong></p>\r\n<p>\r\n\tAir the shoes out after every use. Use a soft brush to dust the shoes clean.</p>        </div>\n        <div style="clear: both;"></div>\n            </div>'], 'spec': [u'<div id="specifications" class="item_left_column">\n    <h3 class="item_desc_title fk-uppercase">\n        Specifications of tZaro Tango Corporate Casuals    </h3>\n\n            <table cellspacing="0" class="fk-specs-type2"><tr><th class="group-head" colspan="2">General</th>\n            </tr><tr class=""><td class="specs-key">Ideal For</td>\n                                        <td class="specs-value fk-data">Men</td>\n                </tr><tr class=""><td class="specs-key">Occasion</td>\n                                        <td class="specs-value fk-data">Casual</td>\n                </tr></table><table cellspacing="0" class="fk-specs-type2"><tr><th class="group-head" colspan="2">Shoe Details</th>\n            </tr><tr class=""><td class="specs-key">Style</td>\n                                        <td class="specs-value fk-data">Panel and Stitch Detail</td>\n                </tr><tr class=""><td class="specs-key">Color</td>\n                                        <td class="specs-value fk-data">Camel, Tan</td>\n                </tr><tr class=""><td class="specs-key">Closure</td>\n                                        <td class="specs-value fk-data">Laced</td>\n                </tr><tr class=""><td class="specs-key">Heel Height</td>\n                                        <td class="specs-value fk-data">1.25 inch</td>\n                </tr><tr class=""><td class="specs-key">Tip Shape</td>\n                                        <td class="specs-value fk-data">Round</td>\n                </tr><tr class=""><td class="specs-key">Weight</td>\n                                        <td class="specs-value fk-data">477 gm (per single Shoe) - Weight of the product may vary depending on size.</td>\n                </tr></table><table cellspacing="0" class="fk-specs-type2"><tr><th class="group-head" colspan="2">Additional Details</th>\n            </tr><tr class=""><td class="specs-key">Other Details</td>\n                                        <td class="specs-value fk-data">Textured Sole, Heel Construction, Padded Footbed, Cushioned Ankle and Tongue</td>\n                </tr></table></div>'], 'size': [u'6', u'7', u'8', u'9', u'10', u'11']}
{'sku': [u'/viewcart?eid=LSTSNDDP8XEPYJHHEMHXQXPVP'], 'seller': [u'WS Retail', u'[?]'], 'title': [u'\n                    tZaro Leather            '], 'colour': [], 'sp': [u' Rs. 1598', u'(1,978,982'], 'mrp': [u'Rs. 1999'], 'titleimg': [u'http://img5a.flixcart.com/image/sandal/g/v/p/dark-chocolate-ronny4105-tzaro-6-400x400-imadr8cgwtzkdkst.jpeg'], 'catname': ['mens-footwear'], 'brandname': ['tZaro.'], 'date': ['18:02:2014'], 'itemlink': ['http://www.flipkart.com/tzaro-leather/p/itmdp8xew994zgax?pid=SNDDP8XEPYJHHEMH&srno=b_18&ref=e3a7da33-a2be-45cc-8a98-d9986a1b8208'], 'desc': [u'<div class="item_left_column" id="description">\n        <h3 class="item_desc_title fk-uppercase">tZaro Leather         Price: Rs.1598</h3>\n        <div class="cls"></div>\n        <div class="item_desc_text line">\n            <div style="float:right">\n                \n \n            </div>\n                        <p>\r\n\tSlip into this pair of casual sandals from tZaro\xa0to make a style statement on those off-duty days. Crafted from the finest leather, this pair of dark chocolate shaded sandals features a\xa0<strong>cutwork\xa0and inlacing detail</strong>. Finished with panel and stitch detailing, these sandals are perfect to be teamed with a printed tee and jeans.\xa0</p>\r\n<p>\r\n\tReinforcing a unique style for men that is indirect and bold,<strong> tZaro </strong>reaches the masses through its high quality comfort and durability; slip into some rustic and fashionable footwear that will set your style meter whizzing out of control.</p>\r\n<p>\r\n\t<strong>Footwear Care</strong></p>\r\n<p>\r\n\tWipe clean with a soft cloth.</p>        </div>\n        <div style="clear: both;"></div>\n            </div>'], 'spec': [u'<div id="specifications" class="item_left_column">\n    <h3 class="item_desc_title fk-uppercase">\n        Specifications of tZaro Leather    </h3>\n\n            <table cellspacing="0" class="fk-specs-type2"><tr><th class="group-head" colspan="2">General</th>\n            </tr><tr class=""><td class="specs-key">Ideal For</td>\n                                        <td class="specs-value fk-data">Men</td>\n                </tr></table><table cellspacing="0" class="fk-specs-type2"><tr><th class="group-head" colspan="2">Sandal Details</th>\n            </tr><tr class=""><td class="specs-key">Style</td>\n                                        <td class="specs-value fk-data">Panel and Stitch Detail, Cut Work and Inlacing Detail</td>\n                </tr><tr class=""><td class="specs-key">Color</td>\n                                        <td class="specs-value fk-data">Dark Chocolate</td>\n                </tr><tr class=""><td class="specs-key">Tip Shape</td>\n                                        <td class="specs-value fk-data">Round</td>\n                </tr><tr class=""><td class="specs-key">Weight</td>\n                                        <td class="specs-value fk-data">242 gm (per single Sandal) - Weight of the product may vary depending on size.</td>\n                </tr></table><table cellspacing="0" class="fk-specs-type2"><tr><th class="group-head" colspan="2">Additional Details</th>\n            </tr><tr class=""><td class="specs-key">Other Details</td>\n                                        <td class="specs-value fk-data">Cushioned Footbed, Textured Sole</td>\n                </tr></table></div>'], 'size': [u'6', u'7', u'9']}
{'sku': [u'/viewcart?eid=LSTSHODP8X9KJAMZAJUSPXY2H'], 'seller': [u'WS Retail', u'[?]'], 'title': [u'\n                    tZaro Sandune Corporate Casuals            '], 'colour': [], 'sp': [u' Rs. 2698', u'(1,979,018'], 'mrp': [u'Rs. 2999'], 'titleimg': [u'http://img6a.flixcart.com/image/shoe/w/j/w/tan-saha3211-tzaro-6-400x400-imadqgtfz39fwv7j.jpeg'], 'catname': ['mens-footwear'], 'brandname': ['tZaro.'], 'date': ['18:02:2014'], 'itemlink': ['http://www.flipkart.com/tzaro-sandune-corporate-casuals/p/itmdp8xaea2hkhj9?pid=SHODP8X9KJAMZAJU&srno=b_12&ref=abe79598-8acd-4d79-a80f-245dbafb69d9'], 'desc': [u'<div class="item_left_column" id="description">\n        <h3 class="item_desc_title fk-uppercase">tZaro Sandune Corporate Casuals         Price: Rs.2698</h3>\n        <div class="cls"></div>\n        <div class="item_desc_text line">\n            <div style="float:right">\n                \n \n            </div>\n                        <p>\r\n\tBreak free from the shackles of your everyday work clothes and enjoy these Sandune Corporate Casual shoes from tZaro. With an interesting heel construction and a <strong>heel height of 1.25 inches</strong>, liberation and a commanding stride are not far behind. Pair it off with dark blue jeans and a black half sleeved shirt.</p>\r\n<p>\r\n\tReinforcing a unique style for men that is indirect and bold, <strong>tZaro</strong> reaches the masses through its high quality comfort and durability; slip in to some rustic and fashionable footwear that will set your style meter whizzing out of control.<br>\r\n\t\xa0</p>\r\n<p>\r\n\t<strong>Footwear Care</strong><br>\r\n\tWipe gently with a dry cloth.</p>        </div>\n        <div style="clear: both;"></div>\n            </div>'], 'spec': [u'<div id="specifications" class="item_left_column">\n    <h3 class="item_desc_title fk-uppercase">\n        Specifications of tZaro Sandune Corporate Casuals    </h3>\n\n            <table cellspacing="0" class="fk-specs-type2"><tr><th class="group-head" colspan="2">General</th>\n            </tr><tr class=""><td class="specs-key">Ideal For</td>\n                                        <td class="specs-value fk-data">Men</td>\n                </tr><tr class=""><td class="specs-key">Occasion</td>\n                                        <td class="specs-value fk-data">Casual</td>\n                </tr></table><table cellspacing="0" class="fk-specs-type2"><tr><th class="group-head" colspan="2">Shoe Details</th>\n            </tr><tr class=""><td class="specs-key">Style</td>\n                                        <td class="specs-value fk-data">Panel and Stitch Detail, Raised Ankle</td>\n                </tr><tr class=""><td class="specs-key">Color</td>\n                                        <td class="specs-value fk-data">Tan</td>\n                </tr><tr class=""><td class="specs-key">Closure</td>\n                                        <td class="specs-value fk-data">Laced</td>\n                </tr><tr class=""><td class="specs-key">Heel Height</td>\n                                        <td class="specs-value fk-data">1.25 inch</td>\n                </tr><tr class=""><td class="specs-key">Boot Shaft Height</td>\n                                        <td class="specs-value fk-data">3.5 inch</td>\n                </tr><tr class=""><td class="specs-key">Tip Shape</td>\n                                        <td class="specs-value fk-data">Round</td>\n                </tr><tr class=""><td class="specs-key">Weight</td>\n                                        <td class="specs-value fk-data">477 gm (per single Shoe) - Weight of the product may vary depending on size.</td>\n                </tr></table><table cellspacing="0" class="fk-specs-type2"><tr><th class="group-head" colspan="2">Additional Details</th>\n            </tr><tr class=""><td class="specs-key">Other Details</td>\n                                        <td class="specs-value fk-data">Padded Footbed, Heel Construction, Textured Sole</td>\n                </tr></table></div>'], 'size': [u'6', u'7', u'8', u'9', u'10', u'11']}
{'sku': [u'/viewcart?eid=LSTSHODP8X8DUTRGCHPKLVMGX'], 'seller': [u'WS Retail', u'[?]'], 'title': [u'\n                    tZaro Z2Crunch Loafers            '], 'colour': [], 'sp': [u' Rs. 2698', u'(1,979,018'], 'mrp': [u'Rs. 2999'], 'titleimg': [u'http://img5a.flixcart.com/image/shoe/c/h/p/choco-tan-z2crunch-tzaro-10-400x400-imadt44avcrd2afy.jpeg'], 'catname': ['mens-footwear'], 'brandname': ['tZaro.'], 'date': ['18:02:2014'], 'itemlink': ['http://www.flipkart.com/tzaro-z2crunch-loafers/p/itmdp8x8jpzkdfgg?pid=SHODP8X8DUTRGCHP&srno=b_19&ref=e3a7da33-a2be-45cc-8a98-d9986a1b8208'], 'desc': [], 'spec': [u'<div id="specifications" class="item_left_column">\n    <h3 class="item_desc_title fk-uppercase">\n        Specifications of tZaro Z2Crunch Loafers    </h3>\n\n            <table cellspacing="0" class="fk-specs-type2"><tr><th class="group-head" colspan="2">General</th>\n            </tr><tr class=""><td class="specs-key">Ideal For</td>\n                                        <td class="specs-value fk-data">Men</td>\n                </tr><tr class=""><td class="specs-key">Occasion</td>\n                                        <td class="specs-value fk-data">Casual</td>\n                </tr></table><table cellspacing="0" class="fk-specs-type2"><tr><th class="group-head" colspan="2">Shoe Details</th>\n            </tr><tr class=""><td class="specs-key">Style</td>\n                                        <td class="specs-value fk-data">Lace Running Through Ankle, Panel and Stitch Detail</td>\n                </tr><tr class=""><td class="specs-key">Color</td>\n                                        <td class="specs-value fk-data">Choco, Tan</td>\n                </tr><tr class=""><td class="specs-key">Tip Shape</td>\n                                        <td class="specs-value fk-data">Square</td>\n                </tr><tr class=""><td class="specs-key">Weight</td>\n                                        <td class="specs-value fk-data">268 gm (per single Shoe) - Weight of the product may vary depending on size.</td>\n                </tr></table><table cellspacing="0" class="fk-specs-type2"><tr><th class="group-head" colspan="2">Additional Details</th>\n            </tr><tr class=""><td class="specs-key">Other Details</td>\n                                        <td class="specs-value fk-data">Textured Sole, Padded Footbed</td>\n                </tr></table></div>'], 'size': [u'6', u'7', u'8', u'9', u'10', u'11']}
{'sku': [u'/viewcart?eid=LSTSHODSB7H9BESVYKGMKN80H'], 'seller': [u'WS Retail', u'[?]'], 'title': [u'\n                    tZaro Elastic Blue Loafers            '], 'colour': [], 'sp': [u' Rs. 2969', u'(1,978,982'], 'mrp': [u'Rs. 3299'], 'titleimg': [u'http://img6a.flixcart.com/image/shoe/g/t/g/mad-blu-elastic-blue-tzaro-11-400x400-imadtakemhhnqxdz.jpeg'], 'catname': ['mens-footwear'], 'brandname': ['tZaro.'], 'date': ['18:02:2014'], 'itemlink': ['http://www.flipkart.com/tzaro-elastic-blue-loafers/p/itmdtfuh8kxshsgz?pid=SHODSB7H9BESVYKG&srno=b_21&ref=e3a7da33-a2be-45cc-8a98-d9986a1b8208'], 'desc': [], 'spec': [u'<div id="specifications" class="item_left_column">\n    <h3 class="item_desc_title fk-uppercase">\n        Specifications of tZaro Elastic Blue Loafers    </h3>\n\n            <table cellspacing="0" class="fk-specs-type2"><tr><th class="group-head" colspan="2">General</th>\n            </tr><tr class=""><td class="specs-key">Ideal For</td>\n                                        <td class="specs-value fk-data">Men</td>\n                </tr><tr class=""><td class="specs-key">Occasion</td>\n                                        <td class="specs-value fk-data">Casual</td>\n                </tr></table><table cellspacing="0" class="fk-specs-type2"><tr><th class="group-head" colspan="2">Shoe Details</th>\n            </tr><tr class=""><td class="specs-key">Style</td>\n                                        <td class="specs-value fk-data">Panel and Stitch Detail, Lace Detail Along the Ankle</td>\n                </tr><tr class=""><td class="specs-key">Color</td>\n                                        <td class="specs-value fk-data">Blue</td>\n                </tr><tr class=""><td class="specs-key">Tip Shape</td>\n                                        <td class="specs-value fk-data">Square</td>\n                </tr><tr class=""><td class="specs-key">Weight</td>\n                                        <td class="specs-value fk-data">260 gm (per single Shoe) - Weight of the product may vary depending on size.</td>\n                </tr></table><table cellspacing="0" class="fk-specs-type2"><tr><th class="group-head" colspan="2">Additional Details</th>\n            </tr><tr class=""><td class="specs-key">Other Details</td>\n                                        <td class="specs-value fk-data">Textured Outsole, Padded Footbed</td>\n                </tr></table></div>'], 'size': [u'6', u'7', u'10']}
{'sku': [u'/viewcart?eid=LSTSHODSB7HAGPDARFHEAWBTQ'], 'seller': [u'WS Retail', u'[?]'], 'title': [u'\n                    tZaro Lace Twin Loafers            '], 'colour': [], 'sp': [u' Rs. 2969', u'(1,978,982'], 'mrp': [u'Rs. 3299'], 'titleimg': [u'http://img6a.flixcart.com/image/shoe/z/f/s/mad-lace-lace-twin-tzaro-11-400x400-imadtakehqmv2ce6.jpeg'], 'catname': ['mens-footwear'], 'brandname': ['tZaro.'], 'date': ['18:02:2014'], 'itemlink': ['http://www.flipkart.com/tzaro-lace-twin-loafers/p/itmdtfuhyysufyaf?pid=SHODSB7HAGPDARFH&srno=b_20&ref=e3a7da33-a2be-45cc-8a98-d9986a1b8208'], 'desc': [], 'spec': [u'<div id="specifications" class="item_left_column">\n    <h3 class="item_desc_title fk-uppercase">\n        Specifications of tZaro Lace Twin Loafers    </h3>\n\n            <table cellspacing="0" class="fk-specs-type2"><tr><th class="group-head" colspan="2">General</th>\n            </tr><tr class=""><td class="specs-key">Ideal For</td>\n                                        <td class="specs-value fk-data">Men</td>\n                </tr><tr class=""><td class="specs-key">Occasion</td>\n                                        <td class="specs-value fk-data">Casual</td>\n                </tr></table><table cellspacing="0" class="fk-specs-type2"><tr><th class="group-head" colspan="2">Shoe Details</th>\n            </tr><tr class=""><td class="specs-key">Style</td>\n                                        <td class="specs-value fk-data">Lace Detail Along the Ankle, Panel and Stitch Detail</td>\n                </tr><tr class=""><td class="specs-key">Color</td>\n                                        <td class="specs-value fk-data">Tan</td>\n                </tr><tr class=""><td class="specs-key">Tip Shape</td>\n                                        <td class="specs-value fk-data">Square</td>\n                </tr><tr class=""><td class="specs-key">Weight</td>\n                                        <td class="specs-value fk-data">250 gm (per single Shoe) - Weight of the product may vary depending on size.</td>\n                </tr></table><table cellspacing="0" class="fk-specs-type2"><tr><th class="group-head" colspan="2">Additional Details</th>\n            </tr><tr class=""><td class="specs-key">Other Details</td>\n                                        <td class="specs-value fk-data">Padded Footbed, Textured Outsole</td>\n                </tr></table></div>'], 'size': [u'9', u'11']}
