{'sku': [], 'seller': [], 'title': [], 'colour': [], 'sp': [], 'mrp': [u'Rs. 2999'], 'titleimg': [u'http://img5a.flixcart.com/image/shoe/r/6/s/tan-opu-stn2309-tzaro-6-400x400-imadqgtyg9ucvxkk.jpeg'], 'catname': ['mens-footwear'], 'brandname': ['tZaro.'], 'date': ['18:02:2014'], 'itemlink': ['http://www.flipkart.com/tzaro-itan-loafers/p/itmdp8x8bhzj2ncy?pid=SHODP8X8GCVHGR6S&srno=b_3&ref=abe79598-8acd-4d79-a80f-245dbafb69d9'], 'desc': [u'<div class="item_left_column" id="description">\n        <h3 class="item_desc_title fk-uppercase">tZaro Itan Loafers         Price: Rs.2698</h3>\n        <div class="cls"></div>\n        <div class="item_desc_text line">\n            <div style="float:right">\n                \n \n            </div>\n                        <p>\r\n\tElegance personified with every step, this pair of Itan loafers from tZaro is quite simply, yet differently designed with a<strong> lace that runs through the ankle</strong>, and to top it all off, it is just as comfortable with the use of a padded footbed. Team this with cream coloured pants and a dark green half sleeved shirt.</p>\r\n<p>\r\n\tReinforcing a unique style for men that is indirect and bold,<strong> tZaro</strong> reaches the masses through its high quality comfort and durability; slip in to some rustic and fashionable footwear that will set your style meter whizzing out of control.<br>\r\n\t\xa0</p>\r\n<p>\r\n\t<strong>Footwear Care</strong><br>\r\n\tWipe gently with a soft cloth.</p>        </div>\n        <div style="clear: both;"></div>\n            </div>'], 'spec': [u'<div id="specifications" class="item_left_column">\n    <h3 class="item_desc_title fk-uppercase">\n        Specifications of tZaro Itan Loafers    </h3>\n\n            <table cellspacing="0" class="fk-specs-type2"><tr><th class="group-head" colspan="2">General</th>\n            </tr><tr class=""><td class="specs-key">Ideal For</td>\n                                        <td class="specs-value fk-data">Men</td>\n                </tr><tr class=""><td class="specs-key">Occasion</td>\n                                        <td class="specs-value fk-data">Casual</td>\n                </tr></table><table cellspacing="0" class="fk-specs-type2"><tr><th class="group-head" colspan="2">Shoe Details</th>\n            </tr><tr class=""><td class="specs-key">Style</td>\n                                        <td class="specs-value fk-data">Panel and Stitch Detail, Lace Running Through Ankle</td>\n                </tr><tr class=""><td class="specs-key">Color</td>\n                                        <td class="specs-value fk-data">Tan</td>\n                </tr><tr class=""><td class="specs-key">Tip Shape</td>\n                                        <td class="specs-value fk-data">Square</td>\n                </tr><tr class=""><td class="specs-key">Weight</td>\n                                        <td class="specs-value fk-data">272 gm (per single Shoe) - Weight of the product may vary depending on size.</td>\n                </tr></table><table cellspacing="0" class="fk-specs-type2"><tr><th class="group-head" colspan="2">Additional Details</th>\n            </tr><tr class=""><td class="specs-key">Other Details</td>\n                                        <td class="specs-value fk-data">Padded Footbed, Textured Sole</td>\n                </tr></table><table cellspacing="0" class="fk-specs-type2"><tr><th class="group-head" colspan="2">In the Box</th>\n            </tr><tr class=""><td colspan="2" class="specs-value fk-data">Shoe Stick</td>\n                </tr></table></div>'], 'size': []}
{'sku': [u'/viewcart?eid=LSTSHODP8X9GQSF9ZTPE3X3NI'], 'seller': [u'WS Retail', u'[?]'], 'title': [u'\n                    tZaro Santana Corporate Casuals            '], 'colour': [], 'sp': [u' Rs. 2698', u'(1,979,018'], 'mrp': [u'Rs. 2999'], 'titleimg': [u'http://img5a.flixcart.com/image/shoe/6/g/p/camel-choco-saha3206-tzaro-6-400x400-imadqgsv9tkusxeh.jpeg'], 'catname': ['mens-footwear'], 'brandname': ['tZaro.'], 'date': ['18:02:2014'], 'itemlink': ['http://www.flipkart.com/tzaro-santana-corporate-casuals/p/itmdp8x8rw3dnbyh?pid=SHODP8X9GQSF9ZTP&srno=b_11&ref=abe79598-8acd-4d79-a80f-245dbafb69d9'], 'desc': [u'<div class="item_left_column" id="description">\n        <h3 class="item_desc_title fk-uppercase">tZaro Santana Corporate Casuals         Price: Rs.2698</h3>\n        <div class="cls"></div>\n        <div class="item_desc_text line">\n            <div style="float:right">\n                \n \n            </div>\n                        <p>\r\n\tInject a dose of style and attitude to your casual ensemble by slipping into this pair of\xa0Santana Corporate Casuals from tZaro. Finished with a panel and stitch detail, this pair of casual shoes comes with a<strong> padded footbed</strong> for maximum comfort. Team these shoes with a casual shirt and a pair of low waist jeans.</p>\r\n<p>\r\n\tReinforcing a unique style for men that is indirect and bold, <strong>tZaro </strong>reaches the masses through its high quality comfort and durability; slip in to some rustic and fashionable footwear that will set your style meter whizzing out of control.</p>\r\n<p>\r\n\t<strong>Footwear Care</strong></p>\r\n<p>\r\n\tAir the shoes out after every use. Use a soft brush to dust the shoes clean.</p>        </div>\n        <div style="clear: both;"></div>\n            </div>'], 'spec': [u'<div id="specifications" class="item_left_column">\n    <h3 class="item_desc_title fk-uppercase">\n        Specifications of tZaro Santana Corporate Casuals    </h3>\n\n            <table cellspacing="0" class="fk-specs-type2"><tr><th class="group-head" colspan="2">General</th>\n            </tr><tr class=""><td class="specs-key">Ideal For</td>\n                                        <td class="specs-value fk-data">Men</td>\n                </tr><tr class=""><td class="specs-key">Occasion</td>\n                                        <td class="specs-value fk-data">Casual</td>\n                </tr></table><table cellspacing="0" class="fk-specs-type2"><tr><th class="group-head" colspan="2">Shoe Details</th>\n            </tr><tr class=""><td class="specs-key">Style</td>\n                                        <td class="specs-value fk-data">Panel and Stitch Detail</td>\n                </tr><tr class=""><td class="specs-key">Color</td>\n                                        <td class="specs-value fk-data">Camel, Choco</td>\n                </tr><tr class=""><td class="specs-key">Closure</td>\n                                        <td class="specs-value fk-data">Laced</td>\n                </tr><tr class=""><td class="specs-key">Heel Height</td>\n                                        <td class="specs-value fk-data">1.25 inch</td>\n                </tr><tr class=""><td class="specs-key">Tip Shape</td>\n                                        <td class="specs-value fk-data">Round</td>\n                </tr><tr class=""><td class="specs-key">Weight</td>\n                                        <td class="specs-value fk-data">457 gm (per single Shoe) - Weight of the product may vary depending on size.</td>\n                </tr></table><table cellspacing="0" class="fk-specs-type2"><tr><th class="group-head" colspan="2">Additional Details</th>\n            </tr><tr class=""><td class="specs-key">Other Details</td>\n                                        <td class="specs-value fk-data">Textured Sole, Padded Footbed, Cushioned Ankle and Tongue, Heel Construction</td>\n                </tr></table></div>'], 'size': [u'6', u'7', u'8', u'9', u'10', u'11']}
{'sku': [u'/viewcart?eid=LSTSHODP8X9Q7YDJEB5YAKJHK'], 'seller': [u'WS Retail', u'[?]'], 'title': [u'\n                    tZaro Oliver Corporate Casuals            '], 'colour': [], 'sp': [u' Rs. 2698', u'(1,979,018'], 'mrp': [u'Rs. 2999'], 'titleimg': [u'http://img5a.flixcart.com/image/shoe/x/n/h/olive-saha3210-tzaro-6-400x400-imadqgt2yhxxm83f.jpeg'], 'catname': ['mens-footwear'], 'brandname': ['tZaro.'], 'date': ['18:02:2014'], 'itemlink': ['http://www.flipkart.com/tzaro-oliver-corporate-casuals/p/itmdp8x9zrrdvwff?pid=SHODP8X9Q7YDJEB5&srno=b_4&ref=abe79598-8acd-4d79-a80f-245dbafb69d9'], 'desc': [u'<div class="item_left_column" id="description">\n        <h3 class="item_desc_title fk-uppercase">tZaro Oliver Corporate Casuals         Price: Rs.2698</h3>\n        <div class="cls"></div>\n        <div class="item_desc_text line">\n            <div style="float:right">\n                \n \n            </div>\n                        <p>\r\n\tFlaunt your casual best at the workplace without compromising on your comfort by slipping into this pair of\xa0Oliver Corporate Casuals from tZaro. Crafted in an olive shade, this pair of casual shoes sports a<strong> raised ankle</strong> to add style and comfort to your look. You can team these shoes with checkered shirt and skinny fit jeans.</p>\r\n<p>\r\n\tReinforcing a unique style for men that is indirect and bold, <strong>tZaro</strong> reaches the masses through its high quality comfort and durability; slip in to some rustic and fashionable footwear that will set your style meter whizzing out of control.</p>\r\n<p>\r\n\t<strong>Footwear Care</strong></p>\r\n<p>\r\n\tAir the shoes out after every use. Use a soft brush to dust the shoes clean.</p>        </div>\n        <div style="clear: both;"></div>\n            </div>'], 'spec': [u'<div id="specifications" class="item_left_column">\n    <h3 class="item_desc_title fk-uppercase">\n        Specifications of tZaro Oliver Corporate Casuals    </h3>\n\n            <table cellspacing="0" class="fk-specs-type2"><tr><th class="group-head" colspan="2">General</th>\n            </tr><tr class=""><td class="specs-key">Ideal For</td>\n                                        <td class="specs-value fk-data">Men</td>\n                </tr><tr class=""><td class="specs-key">Occasion</td>\n                                        <td class="specs-value fk-data">Casual</td>\n                </tr></table><table cellspacing="0" class="fk-specs-type2"><tr><th class="group-head" colspan="2">Shoe Details</th>\n            </tr><tr class=""><td class="specs-key">Style</td>\n                                        <td class="specs-value fk-data">Raised Ankle, Panel and Stitch Detail</td>\n                </tr><tr class=""><td class="specs-key">Color</td>\n                                        <td class="specs-value fk-data">Olive</td>\n                </tr><tr class=""><td class="specs-key">Closure</td>\n                                        <td class="specs-value fk-data">Laced</td>\n                </tr><tr class=""><td class="specs-key">Heel Height</td>\n                                        <td class="specs-value fk-data">1.25 inch</td>\n                </tr><tr class=""><td class="specs-key">Boot Shaft Height</td>\n                                        <td class="specs-value fk-data">3.5 inch</td>\n                </tr><tr class=""><td class="specs-key">Tip Shape</td>\n                                        <td class="specs-value fk-data">Round</td>\n                </tr><tr class=""><td class="specs-key">Weight</td>\n                                        <td class="specs-value fk-data">500 gm (per single Shoe) - Weight of the product may vary depending on size.</td>\n                </tr></table><table cellspacing="0" class="fk-specs-type2"><tr><th class="group-head" colspan="2">Additional Details</th>\n            </tr><tr class=""><td class="specs-key">Other Details</td>\n                                        <td class="specs-value fk-data">Textured Sole, Padded Footbed, Heel Construction</td>\n                </tr></table></div>'], 'size': [u'7', u'8', u'9', u'10']}
{'sku': [u'/viewcart?eid=LSTSHODP8X9VZDMRH2BHITNVS'], 'seller': [u'WS Retail', u'[?]'], 'title': [u'\n                    tZaro Snow Corporate Casuals            '], 'colour': [], 'sp': [u' Rs. 2969', u'(1,979,018'], 'mrp': [u'Rs. 3299'], 'titleimg': [u'http://img5a.flixcart.com/image/shoe/x/z/s/cream-saha3207-tzaro-8-400x400-imadqpg4jenerjzx.jpeg'], 'catname': ['mens-footwear'], 'brandname': ['tZaro.'], 'date': ['18:02:2014'], 'itemlink': ['http://www.flipkart.com/tzaro-snow-corporate-casuals/p/itmds92uf7vusmfz?pid=SHODP8X9VZDMRH2B&srno=b_7&ref=abe79598-8acd-4d79-a80f-245dbafb69d9'], 'desc': [u'<div class="item_left_column" id="description">\n        <h3 class="item_desc_title fk-uppercase">tZaro Snow Corporate Casuals         Price: Rs.2969</h3>\n        <div class="cls"></div>\n        <div class="item_desc_text line">\n            <div style="float:right">\n                \n \n            </div>\n                        <p>\r\n\tEnhanced with a raised ankle, this pair of\xa0Snow Corporate Casuals from tZaro helps you make a style statement at work on those casual days. Constructed with a <strong>padded footbed and textured sole</strong>, this pair of casual shoes ensures extreme comfort to your feet. Team these shoes with a casual shirt and jeans.\xa0</p>\r\n<p>\r\n\tReinforcing a unique style for men that is indirect and bold,<strong> tZaro </strong>reaches the masses through its high quality comfort and durability; slip in to some rustic and fashionable footwear that will set your style meter whizzing out of control.</p>\r\n<p>\r\n\t<strong>Footwear Care</strong></p>\r\n<p>\r\n\tAir the shoes out after every use. Use a soft brush to dust the shoes clean.</p>        </div>\n        <div style="clear: both;"></div>\n            </div>'], 'spec': [u'<div id="specifications" class="item_left_column">\n    <h3 class="item_desc_title fk-uppercase">\n        Specifications of tZaro Snow Corporate Casuals    </h3>\n\n            <table cellspacing="0" class="fk-specs-type2"><tr><th class="group-head" colspan="2">General</th>\n            </tr><tr class=""><td class="specs-key">Ideal For</td>\n                                        <td class="specs-value fk-data">Men</td>\n                </tr><tr class=""><td class="specs-key">Occasion</td>\n                                        <td class="specs-value fk-data">Casual</td>\n                </tr></table><table cellspacing="0" class="fk-specs-type2"><tr><th class="group-head" colspan="2">Shoe Details</th>\n            </tr><tr class=""><td class="specs-key">Style</td>\n                                        <td class="specs-value fk-data">Raised Ankle, Panel and Stitch Detail</td>\n                </tr><tr class=""><td class="specs-key">Color</td>\n                                        <td class="specs-value fk-data">Cream</td>\n                </tr><tr class=""><td class="specs-key">Closure</td>\n                                        <td class="specs-value fk-data">Laced</td>\n                </tr><tr class=""><td class="specs-key">Heel Height</td>\n                                        <td class="specs-value fk-data">1 inch</td>\n                </tr><tr class=""><td class="specs-key">Boot Shaft Height</td>\n                                        <td class="specs-value fk-data">4 inch</td>\n                </tr><tr class=""><td class="specs-key">Tip Shape</td>\n                                        <td class="specs-value fk-data">Round</td>\n                </tr><tr class=""><td class="specs-key">Weight</td>\n                                        <td class="specs-value fk-data">503 gm (per single Shoe) - Weight of the product may vary depending on size.</td>\n                </tr></table><table cellspacing="0" class="fk-specs-type2"><tr><th class="group-head" colspan="2">Additional Details</th>\n            </tr><tr class=""><td class="specs-key">Other Details</td>\n                                        <td class="specs-value fk-data">Padded Footbed, Textured Sole, Heel Construction</td>\n                </tr></table></div>'], 'size': [u'7', u'10', u'11']}
{'sku': [u'/viewcart?eid=LSTSHODP8X8V5QVQE7VIAXFU7'], 'seller': [u'WS Retail', u'[?]'], 'title': [u'\n                    tZaro Twin Loafers            '], 'colour': [u'Choco, Tan'], 'sp': [u' Rs. 2518', u'(1,978,982'], 'mrp': [u'Rs. 2799'], 'titleimg': [u'http://img5a.flixcart.com/image/shoe/z/j/q/tan-choco-stn2311-tzaro-6-400x400-imadqgtfxeqrxvyd.jpeg'], 'catname': ['mens-footwear'], 'brandname': ['tZaro.'], 'date': ['18:02:2014'], 'itemlink': ['http://www.flipkart.com/tzaro-twin-loafers/p/itmdp8x8gjfccxzj?pid=SHODP8X8V5QVQE7V&srno=b_15&ref=abe79598-8acd-4d79-a80f-245dbafb69d9'], 'desc': [u'<div class="item_left_column" id="description">\n        <h3 class="item_desc_title fk-uppercase">tZaro Twin Loafers         Price: Rs.2518</h3>\n        <div class="cls"></div>\n        <div class="item_desc_text line">\n            <div style="float:right">\n                \n \n            </div>\n                        <p>\r\n\tA style companion like no other, this pair of twin loafers from tZaro gives a unique take on casual style with the <strong>lace running through the ankle </strong>and its tan and choco colour combination. Team this with cream coloured pants and a maroon half sleeved shirt.</p>\r\n<p>\r\n\tReinforcing a unique style for men that is indirect and bold,<strong> tZaro</strong> reaches the masses through its high quality comfort and durability; slip in to some rustic and fashionable footwear that will set your style meter whizzing out of control.<br>\r\n\t\xa0</p>\r\n<p>\r\n\t<strong>Footwear Care</strong><br>\r\n\tWipe gently with a dry cloth.</p>        </div>\n        <div style="clear: both;"></div>\n            </div>'], 'spec': [u'<div id="specifications" class="item_left_column">\n    <h3 class="item_desc_title fk-uppercase">\n        Specifications of tZaro Twin Loafers    </h3>\n\n            <table cellspacing="0" class="fk-specs-type2"><tr><th class="group-head" colspan="2">General</th>\n            </tr><tr class=""><td class="specs-key">Ideal For</td>\n                                        <td class="specs-value fk-data">Men</td>\n                </tr><tr class=""><td class="specs-key">Occasion</td>\n                                        <td class="specs-value fk-data">Casual</td>\n                </tr></table><table cellspacing="0" class="fk-specs-type2"><tr><th class="group-head" colspan="2">Shoe Details</th>\n            </tr><tr class=""><td class="specs-key">Style</td>\n                                        <td class="specs-value fk-data">Lace Running Through Ankle, Panel and Stitch Detail</td>\n                </tr><tr class=""><td class="specs-key">Color</td>\n                                        <td class="specs-value fk-data">Tan, Choco</td>\n                </tr><tr class=""><td class="specs-key">Tip Shape</td>\n                                        <td class="specs-value fk-data">Square</td>\n                </tr><tr class=""><td class="specs-key">Weight</td>\n                                        <td class="specs-value fk-data">297 gm (per single Shoe) - Weight of the product may vary depending on size.</td>\n                </tr></table><table cellspacing="0" class="fk-specs-type2"><tr><th class="group-head" colspan="2">Additional Details</th>\n            </tr><tr class=""><td class="specs-key">Other Details</td>\n                                        <td class="specs-value fk-data">Textured Sole, Padded Footbed</td>\n                </tr></table><table cellspacing="0" class="fk-specs-type2"><tr><th class="group-head" colspan="2">In the Box</th>\n            </tr><tr class=""><td colspan="2" class="specs-value fk-data">Shoe Stick</td>\n                </tr></table></div>'], 'size': [u'8']}
{'sku': [u'/viewcart?eid=LSTSHODP8X99A5YAZR9E1RGB7'], 'seller': [u'WS Retail', u'[?]'], 'title': [u'\n                    tZaro Grande Corporate Casuals            '], 'colour': [], 'sp': [u' Rs. 2698', u'(1,979,018'], 'mrp': [u'Rs. 2999'], 'titleimg': [u'http://img5a.flixcart.com/image/shoe/v/b/g/choco-choco-sah3212-tzaro-6-400x400-imadqgsw2gxpjbdj.jpeg'], 'catname': ['mens-footwear'], 'brandname': ['tZaro.'], 'date': ['18:02:2014'], 'itemlink': ['http://www.flipkart.com/tzaro-grande-corporate-casuals/p/itmdp8xaadxphmqz?pid=SHODP8X99A5YAZR9&srno=b_16&ref=e3a7da33-a2be-45cc-8a98-d9986a1b8208'], 'desc': [u'<div class="item_left_column" id="description">\n        <h3 class="item_desc_title fk-uppercase">tZaro Grande Corporate Casuals         Price: Rs.2698</h3>\n        <div class="cls"></div>\n        <div class="item_desc_text line">\n            <div style="float:right">\n                \n \n            </div>\n                        <p>\r\n\tExude your attitude-rich masculinity and charming persona at work by slipping into this pair of\xa0Grande Corporate Casuals from tZaro. Crafted in a rich shade of choco, this pair of casual shoes features a<strong> panel and stitch detail</strong>. For an appealing look, you can team these shoes with a checkered shirt and a pair of jeans.\xa0</p>\r\n<p>\r\n\tReinforcing a unique style for men that is indirect and bold, <strong>tZaro</strong> reaches the masses through its high quality comfort and durability; slip in to some rustic and fashionable footwear that will set your style meter whizzing out of control.</p>\r\n<p>\r\n\t<strong>Footwear Care</strong></p>\r\n<p>\r\n\tAir the shoes out after every use. Use a soft brush to dust the shoes clean.</p>        </div>\n        <div style="clear: both;"></div>\n            </div>'], 'spec': [u'<div id="specifications" class="item_left_column">\n    <h3 class="item_desc_title fk-uppercase">\n        Specifications of tZaro Grande Corporate Casuals    </h3>\n\n            <table cellspacing="0" class="fk-specs-type2"><tr><th class="group-head" colspan="2">General</th>\n            </tr><tr class=""><td class="specs-key">Ideal For</td>\n                                        <td class="specs-value fk-data">Men</td>\n                </tr><tr class=""><td class="specs-key">Occasion</td>\n                                        <td class="specs-value fk-data">Casual</td>\n                </tr></table><table cellspacing="0" class="fk-specs-type2"><tr><th class="group-head" colspan="2">Shoe Details</th>\n            </tr><tr class=""><td class="specs-key">Style</td>\n                                        <td class="specs-value fk-data">Panel and Stitch Detail</td>\n                </tr><tr class=""><td class="specs-key">Color</td>\n                                        <td class="specs-value fk-data">Choco, Choco</td>\n                </tr><tr class=""><td class="specs-key">Closure</td>\n                                        <td class="specs-value fk-data">Laced</td>\n                </tr><tr class=""><td class="specs-key">Heel Height</td>\n                                        <td class="specs-value fk-data">1.25 inch</td>\n                </tr><tr class=""><td class="specs-key">Tip Shape</td>\n                                        <td class="specs-value fk-data">Round</td>\n                </tr><tr class=""><td class="specs-key">Weight</td>\n                                        <td class="specs-value fk-data">355 gm (per single Shoe) - Weight of the product may vary depending on size.</td>\n                </tr></table><table cellspacing="0" class="fk-specs-type2"><tr><th class="group-head" colspan="2">Additional Details</th>\n            </tr><tr class=""><td class="specs-key">Other Details</td>\n                                        <td class="specs-value fk-data">Heel Construction, Textured Sole, Padded Footbed</td>\n                </tr></table></div>'], 'size': [u'6', u'7', u'8', u'9', u'10', u'11']}
