{'sku': [u'/viewcart?eid=LSTHTTDNA7NXVQDCRA2R9XUDB'], 'seller': [u'martnaturals', u'[?]'], 'title': [u'\n                    purenaturals Hair Growth Anti Graying Solution            '], 'colour': [], 'sp': [u' Rs. 685', u'(32'], 'mrp': [], 'titleimg': [u'http://img6a.flixcart.com/image/hair-treatment/r/a/2/purenaturals-200-hair-growth-anti-graying-solution-400x400-imadnaathwbhzpzr.jpeg'], 'catname': ['hair-care'], 'brandname': ['purenaturals.'], 'date': ['18:02:2014'], 'itemlink': ['http://www.flipkart.com/purenaturals-hair-growth-anti-graying-solution/p/itmdn8yvfgbvfhry?pid=HTTDNA7NXVQDCRA2&srno=b_8&ref=5875b3e8-3a66-4c5f-8a1a-bbc3bc07ca88'], 'desc': [u'<div class="item_left_column" id="description">\n        <h3 class="item_desc_title fk-uppercase">purenaturals Hair Growth Anti Graying Solution (200 ml)         Price: Rs.685</h3>\n        <div class="cls"></div>\n        <div class="item_desc_text line">\n            <div style="float:right">\n                \n \n            </div>\n                        Fenugreek and bhringraj extracts in aloevera base - effective for premature graying, early hair loss and dandruff prevention. Re-growth hair solution, a powerful non oily formulation enriched with Hibiscus, Aloevera, Fenugreek, Basil, Neem, Bhringraj helps in hair growth, prevention of hair loss, pre-mature graying and works as anti-dandruff treatment. Applicare: Pump out sufficient quantity, apply on roots and scalp, massage thoroughly. Best results use daily, preferably at night.        </div>\n        <div style="clear: both;"></div>\n            </div>'], 'spec': [u'<div id="specifications" class="item_left_column">\n    <h3 class="item_desc_title fk-uppercase">\n        Specifications of purenaturals Hair Growth Anti Graying Solution (200 ml)    </h3>\n\n            <table cellspacing="0" class="fk-specs-type2"><tr><th class="group-head" colspan="2">In the Box</th>\n            </tr><tr class=""><td class="specs-key">Package</td>\n                                        <td class="specs-value fk-data">Hair Solution</td>\n                </tr></table><table cellspacing="0" class="fk-specs-type2"><tr><th class="group-head" colspan="2">General Traits</th>\n            </tr><tr class=""><td class="specs-key">Treatment Type</td>\n                                        <td class="specs-value fk-data">Hair Repair Therapy</td>\n                </tr><tr class=""><td class="specs-key">Container Type</td>\n                                        <td class="specs-value fk-data">Bottle</td>\n                </tr><tr class=""><td class="specs-key">Quantity</td>\n                                        <td class="specs-value fk-data">200 ml</td>\n                </tr></table><table cellspacing="0" class="fk-specs-type2"><tr><th class="group-head" colspan="2">Hair Treatment Details</th>\n            </tr><tr class=""><td class="specs-key">Suitable Hair Type</td>\n                                        <td class="specs-value fk-data">Natural</td>\n                </tr><tr class=""><td class="specs-key">Formula</td>\n                                        <td class="specs-value fk-data">Oil</td>\n                </tr><tr class=""><td class="specs-key">Application Area</td>\n                                        <td class="specs-value fk-data">Hair::Scalp</td>\n                </tr><tr class=""><td class="specs-key">Application Frequency</td>\n                                        <td class="specs-value fk-data">Everyday</td>\n                </tr><tr class=""><td class="specs-key">Treatment Time</td>\n                                        <td class="specs-value fk-data">30 Days</td>\n                </tr><tr class=""><td class="specs-key">Applied For</td>\n                                        <td class="specs-value fk-data">works as anti-dandruff treatment, prevention of hair loss, hair growth, pre-mature graying</td>\n                </tr><tr class=""><td class="specs-key">Organic Type</td>\n                                        <td class="specs-value fk-data">Natural</td>\n                </tr></table></div>'], 'size': []}
{'sku': [u'/viewcart?eid=LSTHOLDNYY6BZEGYMCGK5NWIR'], 'seller': [u'martnaturals', u'[?]'], 'title': [u'\n                    purenaturals Herb Rich Amla Hair Oil            '], 'colour': [], 'sp': [u' Rs. 395', u'(32'], 'mrp': [], 'titleimg': [u'http://img5a.flixcart.com/image/hair-oil/m/c/g/pure-naturals-100-herb-rich-amla-400x400-imadnywygfxcxe7y.jpeg'], 'catname': ['hair-care'], 'brandname': ['purenaturals.'], 'date': ['18:02:2014'], 'itemlink': ['http://www.flipkart.com/purenaturals-herb-rich-amla-hair-oil/p/itmdn24hzqxywzdu?pid=HOLDNYY6BZEGYMCG&srno=b_11&ref=5875b3e8-3a66-4c5f-8a1a-bbc3bc07ca88'], 'desc': [u'<div class="item_left_column" id="description">\n        <h3 class="item_desc_title fk-uppercase">purenaturals Herb Rich Amla Hair Oil (100 ml)         Price: Rs.395</h3>\n        <div class="cls"></div>\n        <div class="item_desc_text line">\n            <div style="float:right">\n                \n \n            </div>\n                        Bhringraj &amp; hibiscus extracts with organic amla juice uniquely blended for thick &amp; shining long hair - unlimited evergrowing happy users. Amla hair oil, a blend of various herbs with cold pressed amla fruit oil. Nutrients &amp; vitamin C rich oil helps roots strengthening. Give thick &amp; shiny hair. Applicare: pour out sufficient quantity, apply on roots &amp; scalp, massage thoroughly. Keep it for minimum of one hour before rinsing. Hair wash with Pure Naturals shine &amp; bounce shampoo.        </div>\n        <div style="clear: both;"></div>\n            </div>'], 'spec': [u'<div id="specifications" class="item_left_column">\n    <h3 class="item_desc_title fk-uppercase">\n        Specifications of purenaturals Herb Rich Amla Hair Oil (100 ml)    </h3>\n\n            <table cellspacing="0" class="fk-specs-type2"><tr><th class="group-head" colspan="2">In the Box</th>\n            </tr><tr class=""><td colspan="2" class="specs-value fk-data">Herb Rich Amla Hair Oil- 100ml</td>\n                </tr></table><table cellspacing="0" class="fk-specs-type2"><tr><th class="group-head" colspan="2">Hair Oil Traits</th>\n            </tr><tr class=""><td class="specs-key">Hair Type</td>\n                                        <td class="specs-value fk-data">All Hair Types</td>\n                </tr><tr class=""><td class="specs-key">Composition</td>\n                                        <td class="specs-value fk-data">Jojoba Oil &amp; Vitamin E Oil, hibiscus, brahmi, shikakai, Coconut Oil, Almond Oil, Sunflower Oil, Sesame Oil processed with Amla, vetiver root and bhringraj</td>\n                </tr><tr class=""><td class="specs-key">Applied For</td>\n                                        <td class="specs-value fk-data">Conditioning, Lustre &amp; Shine, Hair Strengthening, Anti-dandruff</td>\n                </tr></table><table cellspacing="0" class="fk-specs-type2"><tr><th class="group-head" colspan="2">General Traits</th>\n            </tr><tr class=""><td class="specs-key">Container Type</td>\n                                        <td class="specs-value fk-data">Bottle</td>\n                </tr><tr class=""><td class="specs-key">Quantity</td>\n                                        <td class="specs-value fk-data">100 ml</td>\n                </tr><tr class=""><td class="specs-key">Organic Type</td>\n                                        <td class="specs-value fk-data">Natural</td>\n                </tr></table></div>'], 'size': []}
{'sku': [u'/viewcart?eid=LSTSMPDN8YS9JXXRY38BEDBD8'], 'seller': [u'martnaturals', u'[?]'], 'title': [u'\n                    purenaturals Anti Dandruff Shampoo            '], 'colour': [], 'sp': [u' Rs. 645', u'(32'], 'mrp': [], 'titleimg': [u'http://img5a.flixcart.com/image/shampoo/y/3/8/purenaturals-200-anti-dandruff-shampoo-400x400-imadn8u8zmtdydaa.jpeg'], 'catname': ['hair-care'], 'brandname': ['purenaturals.'], 'date': ['18:02:2014'], 'itemlink': ['http://www.flipkart.com/purenaturals-anti-dandruff-shampoo/p/itmdn8yv3keb3zje?pid=SMPDN8YS9JXXRY38&srno=b_10&ref=5875b3e8-3a66-4c5f-8a1a-bbc3bc07ca88'], 'desc': [u'<div class="item_left_column" id="description">\n        <h3 class="item_desc_title fk-uppercase">purenaturals Anti Dandruff Shampoo (200 ml)         Price: Rs.645</h3>\n        <div class="cls"></div>\n        <div class="item_desc_text line">\n            <div style="float:right">\n                \n \n            </div>\n                        Proven anti-dandruff vedic formula ? rosemary &amp; tea tree oil with itch relief sandalwood extracts. Anti dandruff shampoo, strengthens hair roots &amp; contains combination of herbs based on proven vedic anti-dandruff formula. Tea Tree and Rosemary Oil provide effective anti-dandruff action while Sandalwood relieves scalp itching. Applicare:Pump out sufficient quantity,apply on roots &amp; scalp, lather thoroughly. For best results leave on for 5 minutes &amp; Rinse Off. Tip: 100% natural shampoos give best performance if used twice,i.e after first rinse off use again small quantity leave on 5 minutes &amp; rinse off all in one head bath        </div>\n        <div style="clear: both;"></div>\n            </div>'], 'spec': [u'<div id="specifications" class="item_left_column">\n    <h3 class="item_desc_title fk-uppercase">\n        Specifications of purenaturals Anti Dandruff Shampoo (200 ml)    </h3>\n\n            <table cellspacing="0" class="fk-specs-type2"><tr><th class="group-head" colspan="2">In the Box</th>\n            </tr><tr class=""><td colspan="2" class="specs-value fk-data">Anti Dandruff Shampoo</td>\n                </tr></table><table cellspacing="0" class="fk-specs-type2"><tr><th class="group-head" colspan="2">Shampoo Traits</th>\n            </tr><tr class=""><td class="specs-key">Applied For</td>\n                                        <td class="specs-value fk-data">Anti-dandruff, Scalp Cleansing</td>\n                </tr><tr class=""><td class="specs-key">Hair Type</td>\n                                        <td class="specs-value fk-data">All Hair Types</td>\n                </tr><tr class=""><td class="specs-key">Organic Type</td>\n                                        <td class="specs-value fk-data">Natural</td>\n                </tr></table><table cellspacing="0" class="fk-specs-type2"><tr><th class="group-head" colspan="2">General Traits</th>\n            </tr><tr class=""><td class="specs-key">Brand</td>\n                                        <td class="specs-value fk-data">purenaturals</td>\n                </tr><tr class=""><td class="specs-key">Quantity</td>\n                                        <td class="specs-value fk-data">200 ml</td>\n                </tr><tr class=""><td class="specs-key">Model Name</td>\n                                        <td class="specs-value fk-data">Anti Dandruff Shampoo</td>\n                </tr></table></div>'], 'size': []}
{'sku': [u'/viewcart?eid=LSTSMPDN8YSSRZZJ32RNGC5UY'], 'seller': [u'martnaturals', u'[?]'], 'title': [u'\n                    purenaturals Damage Repair Shampoo            '], 'colour': [], 'sp': [u' Rs. 695', u'(32'], 'mrp': [], 'titleimg': [u'http://img5a.flixcart.com/image/shampoo/3/2/r/purenaturals-200-damage-repair-shampoo-400x400-imadn8u8fhjczhkr.jpeg'], 'catname': ['hair-care'], 'brandname': ['purenaturals.'], 'date': ['18:02:2014'], 'itemlink': ['http://www.flipkart.com/purenaturals-damage-repair-shampoo/p/itmdn8yvgsnag2sx?pid=SMPDN8YSSRZZJ32R&srno=b_13&ref=5875b3e8-3a66-4c5f-8a1a-bbc3bc07ca88'], 'desc': [u'<div class="item_left_column" id="description">\n        <h3 class="item_desc_title fk-uppercase">purenaturals Damage Repair Shampoo (200 ml)         Price: Rs.695</h3>\n        <div class="cls"></div>\n        <div class="item_desc_text line">\n            <div style="float:right">\n                \n \n            </div>\n                        100 percent Naturals patented formula ? henna, green tea, shikakai &amp; brhami extracts; treats split-ends, keratin loss damage repair shampoo, deep cleanses the hair follicles provides much required moisture and nourishment to the roots to give extra shine to hair.Very effective for split ends &amp; frizzy hair. It acts as a restructuring agent for damaged hair that retards aging process and prevents hair loss. Applicare:Pump out sufficient quantity,apply on roots &amp; scalp, lather thoroughly. For best results leave on for 5 minutes &amp; Rinse Off. Tip: 100% natural shampoos give best performance if used twice,i.e after first rinse off use again small quantity leave on 5 minutes &amp; rinse off all in one head bath        </div>\n        <div style="clear: both;"></div>\n            </div>'], 'spec': [u'<div id="specifications" class="item_left_column">\n    <h3 class="item_desc_title fk-uppercase">\n        Specifications of purenaturals Damage Repair Shampoo (200 ml)    </h3>\n\n            <table cellspacing="0" class="fk-specs-type2"><tr><th class="group-head" colspan="2">In the Box</th>\n            </tr><tr class=""><td colspan="2" class="specs-value fk-data">Damage Repair Shampoo</td>\n                </tr></table><table cellspacing="0" class="fk-specs-type2"><tr><th class="group-head" colspan="2">Shampoo Traits</th>\n            </tr><tr class=""><td class="specs-key">Applied For</td>\n                                        <td class="specs-value fk-data">Frizz Control, Damage Repair</td>\n                </tr><tr class=""><td class="specs-key">Hair Type</td>\n                                        <td class="specs-value fk-data">Dry Hair</td>\n                </tr><tr class=""><td class="specs-key">Hair Condition</td>\n                                        <td class="specs-value fk-data">Damaged Hair</td>\n                </tr><tr class=""><td class="specs-key">Organic Type</td>\n                                        <td class="specs-value fk-data">Natural</td>\n                </tr></table><table cellspacing="0" class="fk-specs-type2"><tr><th class="group-head" colspan="2">General Traits</th>\n            </tr><tr class=""><td class="specs-key">Brand</td>\n                                        <td class="specs-value fk-data">purenaturals</td>\n                </tr><tr class=""><td class="specs-key">Quantity</td>\n                                        <td class="specs-value fk-data">200 ml</td>\n                </tr><tr class=""><td class="specs-key">Model Name</td>\n                                        <td class="specs-value fk-data">Damage Repair Shampoo</td>\n                </tr></table></div>'], 'size': []}
{'sku': [u'/viewcart?eid=LSTHOLDNYY6PJJ3RTBAOZPMRQ'], 'seller': [u'martnaturals', u'[?]'], 'title': [u'\n                    purenaturals Nourishing Hair Oil            '], 'colour': [], 'sp': [u' Rs. 295', u'(32'], 'mrp': [], 'titleimg': [u'http://img5a.flixcart.com/image/hair-oil/t/b/a/pure-naturals-50-nourishing-400x400-imadnywy9bqudgdk.jpeg'], 'catname': ['hair-care'], 'brandname': ['purenaturals.'], 'date': ['18:02:2014'], 'itemlink': ['http://www.flipkart.com/purenaturals-nourishing-hair-oil/p/itmdn24h3hxqtbdv?pid=HOLDNYY6PJJ3RTBA&srno=b_14&ref=5875b3e8-3a66-4c5f-8a1a-bbc3bc07ca88'], 'desc': [u'<div class="item_left_column" id="description">\n        <h3 class="item_desc_title fk-uppercase">purenaturals Nourishing Hair Oil (50 ml)         Price: Rs.295</h3>\n        <div class="cls"></div>\n        <div class="item_desc_text line">\n            <div style="float:right">\n                \n \n            </div>\n                        Ancient preparation of henna &amp; amla extracts in cotton seed oil - helps hair thickening &amp; regular nutritional diet for every hair.Herbal hair oil, regular use hair nourishing oil strengthens hair by providing nutrition, clears pollution &amp; Prevents Hair Fall. Applicare: pour out sufficient quantity, apply on roots &amp; scalp, massage thoroughly. Keep it for minimum of one hour before rinsing. Hair wash with p?rnaturals shine &amp; bounce shampoo.        </div>\n        <div style="clear: both;"></div>\n            </div>'], 'spec': [u'<div id="specifications" class="item_left_column">\n    <h3 class="item_desc_title fk-uppercase">\n        Specifications of purenaturals Nourishing Hair Oil (50 ml)    </h3>\n\n            <table cellspacing="0" class="fk-specs-type2"><tr><th class="group-head" colspan="2">In the Box</th>\n            </tr><tr class=""><td colspan="2" class="specs-value fk-data">Nourishing Hair Oil- 50ml</td>\n                </tr></table><table cellspacing="0" class="fk-specs-type2"><tr><th class="group-head" colspan="2">Hair Oil Traits</th>\n            </tr><tr class=""><td class="specs-key">Hair Type</td>\n                                        <td class="specs-value fk-data">All Hair Types</td>\n                </tr><tr class=""><td class="specs-key">Composition</td>\n                                        <td class="specs-value fk-data">Sesame, Coconut, Shikaki, Hibiscus, Sandal Wood, Rubia Cordifolia Extracts, Olive And Almond Essential Oils., Amla, Cotton Seed</td>\n                </tr><tr class=""><td class="specs-key">Applied For</td>\n                                        <td class="specs-value fk-data">Hair Thickening, Hair Strengthening, Anti-hair Fall</td>\n                </tr></table><table cellspacing="0" class="fk-specs-type2"><tr><th class="group-head" colspan="2">General Traits</th>\n            </tr><tr class=""><td class="specs-key">Container Type</td>\n                                        <td class="specs-value fk-data">Bottle</td>\n                </tr><tr class=""><td class="specs-key">Quantity</td>\n                                        <td class="specs-value fk-data">50 ml</td>\n                </tr><tr class=""><td class="specs-key">Organic Type</td>\n                                        <td class="specs-value fk-data">Natural</td>\n                </tr></table></div>'], 'size': []}
{'sku': [u'/viewcart?eid=LSTSMPDN8YS4F2HYPCYAF9AKA'], 'seller': [u'martnaturals', u'[?]'], 'title': [u'\n                    purenaturals Shine and Bounce Shampoo            '], 'colour': [], 'sp': [u' Rs. 385', u'(32'], 'mrp': [], 'titleimg': [u'http://img5a.flixcart.com/image/shampoo/p/c/y/purenaturals-100-shine-and-bounce-shampoo-400x400-imadn8u8wz8m8hht.jpeg'], 'catname': ['hair-care'], 'brandname': ['purenaturals.'], 'date': ['18:02:2014'], 'itemlink': ['http://www.flipkart.com/purenaturals-shine-bounce-shampoo/p/itmdn8yvw9yf5ngm?pid=SMPDN8YS4F2HYPCY&srno=b_12&ref=5875b3e8-3a66-4c5f-8a1a-bbc3bc07ca88'], 'desc': [u'<div class="item_left_column" id="description">\n        <h3 class="item_desc_title fk-uppercase">purenaturals Shine and Bounce Shampoo (100 ml)         Price: Rs.385</h3>\n        <div class="cls"></div>\n        <div class="item_desc_text line">\n            <div style="float:right">\n                \n \n            </div>\n                        Daily all hair strengthening &amp; conditioning shampoo, physician patented formula ? green almonds, brahmi &amp; amla extracts; loved by daughters &amp; mothers, sons too. shine &amp; bounce shampoo, cleanses and nourishes hair roots with Natural Proteins. Ensures healthy scalp. Brahmi has been added to nourish the hair and make it stronger, thicker and shine with luster. Gentle on hair it volumes and detangles hair. Also it moisturizes and deeply conditions the hair strand by strand. also use for perm, straighten &amp; afro hair. Applicare:Pump out sufficient quantity,apply on roots &amp; scalp, lather thoroughly. For best results leave on for 5 minutes &amp; Rinse Off. Tip: 100% natural shampoos give best performance if used twice,i.e after first rinse off use again small quantity leave on 5 minutes &amp; rinse off all in one head bath        </div>\n        <div style="clear: both;"></div>\n            </div>'], 'spec': [u'<div id="specifications" class="item_left_column">\n    <h3 class="item_desc_title fk-uppercase">\n        Specifications of purenaturals Shine and Bounce Shampoo (100 ml)    </h3>\n\n            <table cellspacing="0" class="fk-specs-type2"><tr><th class="group-head" colspan="2">In the Box</th>\n            </tr><tr class=""><td colspan="2" class="specs-value fk-data">Shine and Bounce Shampoo</td>\n                </tr></table><table cellspacing="0" class="fk-specs-type2"><tr><th class="group-head" colspan="2">Shampoo Traits</th>\n            </tr><tr class=""><td class="specs-key">Applied For</td>\n                                        <td class="specs-value fk-data">Hair Shine</td>\n                </tr><tr class=""><td class="specs-key">Hair Type</td>\n                                        <td class="specs-value fk-data">All Hair Types</td>\n                </tr><tr class=""><td class="specs-key">Organic Type</td>\n                                        <td class="specs-value fk-data">Natural</td>\n                </tr></table><table cellspacing="0" class="fk-specs-type2"><tr><th class="group-head" colspan="2">General Traits</th>\n            </tr><tr class=""><td class="specs-key">Brand</td>\n                                        <td class="specs-value fk-data">purenaturals</td>\n                </tr><tr class=""><td class="specs-key">Quantity</td>\n                                        <td class="specs-value fk-data">100 ml</td>\n                </tr><tr class=""><td class="specs-key">Model Name</td>\n                                        <td class="specs-value fk-data">Shine and Bounce Shampoo</td>\n                </tr></table></div>'], 'size': []}
{'sku': [u'/viewcart?eid=LSTHTTDN8YSZPD57C7PPNEEIM'], 'seller': [u'martnaturals', u'[?]'], 'title': [u'\n                    purenaturals Pure Herbs Aroma Pack            '], 'colour': [], 'sp': [u' Rs. 385', u'(32'], 'mrp': [], 'titleimg': [u'http://img5a.flixcart.com/image/hair-treatment/c/7/p/purenaturals-120-pure-herbs-aroma-pack-400x400-imadn8u8aaskhehj.jpeg'], 'catname': ['hair-care'], 'brandname': ['purenaturals.'], 'date': ['18:02:2014'], 'itemlink': ['http://www.flipkart.com/purenaturals-pure-herbs-aroma-pack/p/itmdn8yvkuapb4uz?pid=HTTDN8YSZPD57C7P&srno=b_15&ref=5875b3e8-3a66-4c5f-8a1a-bbc3bc07ca88'], 'desc': [u'<div class="item_left_column" id="description">\n        <h3 class="item_desc_title fk-uppercase">purenaturals Pure Herbs Aroma Pack (120 g)         Price: Rs.385</h3>\n        <div class="cls"></div>\n        <div class="item_desc_text line">\n            <div style="float:right">\n                \n \n            </div>\n                        Best for sensitive skin, no side effects, loved by happy users, physician formulated 100% Pure Herbs Aroma Pack. Applicare:mix in warm water, apply with hand or brush, cover head with hair cap, run hot air blower for quick color, rinse wash after 60-90 minutes. shampoo after 2 days. first time users do it twice in 3 days interval.        </div>\n        <div style="clear: both;"></div>\n            </div>'], 'spec': [u'<div id="specifications" class="item_left_column">\n    <h3 class="item_desc_title fk-uppercase">\n        Specifications of purenaturals Pure Herbs Aroma Pack (120 g)    </h3>\n\n            <table cellspacing="0" class="fk-specs-type2"><tr><th class="group-head" colspan="2">In the Box</th>\n            </tr><tr class=""><td class="specs-key">Package</td>\n                                        <td class="specs-value fk-data">applicator brush, detailed applicare leaflet inside, Free color protect &amp; perm care 100% natural shampoo(50 ml), Hair Cap, Hair Color, pair of gloves, two double sealed color pouches, Hand Sanitizer(50 ml)</td>\n                </tr></table><table cellspacing="0" class="fk-specs-type2"><tr><th class="group-head" colspan="2">General Traits</th>\n            </tr><tr class=""><td class="specs-key">Treatment Type</td>\n                                        <td class="specs-value fk-data">Hair Repair Therapy</td>\n                </tr><tr class=""><td class="specs-key">Container Type</td>\n                                        <td class="specs-value fk-data">Packet</td>\n                </tr><tr class=""><td class="specs-key">Quantity</td>\n                                        <td class="specs-value fk-data">120 g</td>\n                </tr></table><table cellspacing="0" class="fk-specs-type2"><tr><th class="group-head" colspan="2">Hair Treatment Details</th>\n            </tr><tr class=""><td class="specs-key">Suitable Hair Type</td>\n                                        <td class="specs-value fk-data">All Hair Types</td>\n                </tr><tr class=""><td class="specs-key">Formula</td>\n                                        <td class="specs-value fk-data">hair Pack</td>\n                </tr><tr class=""><td class="specs-key">Application Area</td>\n                                        <td class="specs-value fk-data">Hair::Scalp</td>\n                </tr><tr class=""><td class="specs-key">Application Frequency</td>\n                                        <td class="specs-value fk-data">Twice a Week</td>\n                </tr><tr class=""><td class="specs-key">Treatment Time</td>\n                                        <td class="specs-value fk-data">30 Days</td>\n                </tr><tr class=""><td class="specs-key">Applied For</td>\n                                        <td class="specs-value fk-data">Volume, Hair Growth</td>\n                </tr><tr class=""><td class="specs-key">Organic Type</td>\n                                        <td class="specs-value fk-data">Natural</td>\n                </tr></table></div>'], 'size': []}
