{'sku': [u'/viewcart?eid=LSTHSYDNYY7JXGDK4ESAO0U8H'], 'seller': [u'martnaturals', u'[?]'], 'title': [u'\n                    purenaturals Hair Styling Gel Hair Styler            '], 'colour': [], 'sp': [u' Rs. 385', u'(32'], 'mrp': [], 'titleimg': [u'http://img5a.flixcart.com/image/hair-styling/4/e/s/pure-naturals-100-hair-styling-gel-400x400-imadnywwzzpg67g7.jpeg'], 'catname': ['hair-care'], 'brandname': ['purenaturals.'], 'date': ['18:02:2014'], 'itemlink': ['http://www.flipkart.com/purenaturals-hair-styling-gel-styler/p/itmdn24hasksyu56?pid=HSYDNYY7JXGDK4ES&srno=b_2&ref=5875b3e8-3a66-4c5f-8a1a-bbc3bc07ca88'], 'desc': [u'<div class="item_left_column" id="description">\n        <h3 class="item_desc_title fk-uppercase">purenaturals Hair Styling Gel Hair Styler         Price: Rs.385</h3>\n        <div class="cls"></div>\n        <div class="item_desc_text line">\n            <div style="float:right">\n                \n \n            </div>\n                        Natural gums in coconut water base with hibiscus extracts ? easily restyle hair with wet hands. 100 percent Natural Organic Active Wet &amp; Trendy Hair Styling Gel, unique special vedic formulation of natural gums with nourishing extracts of basil, hibiscus &amp; coconut water. Keeps hair styled your way. Applicare: Take on fingertips on wet / dry hair. Apply thoroughly and style. Tip; natural gums help keratin protection &amp; retard graying hair. Good for non oil users. Available in 100 ml &amp; special 50 ml travel pack.        </div>\n        <div style="clear: both;"></div>\n            </div>'], 'spec': [u'<div id="specifications" class="item_left_column">\n    <h3 class="item_desc_title fk-uppercase">\n        Specifications of purenaturals Hair Styling Gel Hair Styler    </h3>\n\n            <table cellspacing="0" class="fk-specs-type2"><tr><th class="group-head" colspan="2">In the Box</th>\n            </tr><tr class=""><td colspan="2" class="specs-value fk-data">Hair Styling Gel</td>\n                </tr></table><table cellspacing="0" class="fk-specs-type2"><tr><th class="group-head" colspan="2">General Traits</th>\n            </tr><tr class=""><td class="specs-key">Container Type</td>\n                                        <td class="specs-value fk-data">Bottle</td>\n                </tr><tr class=""><td class="specs-key">Quantity</td>\n                                        <td class="specs-value fk-data">100 ml</td>\n                </tr><tr class=""><td class="specs-key">Composition</td>\n                                        <td class="specs-value fk-data">Purified Water, Coconut Water, Basil, Peppermint Oil, Guar Gum, Hibiscus &amp; Aloe Vera extracts, carbopol.</td>\n                </tr><tr class=""><td class="specs-key">Organic Type</td>\n                                        <td class="specs-value fk-data">Natural</td>\n                </tr></table><table cellspacing="0" class="fk-specs-type2"><tr><th class="group-head" colspan="2">Hair Styling Traits</th>\n            </tr><tr class=""><td class="specs-key">Hair Type</td>\n                                        <td class="specs-value fk-data">All Hair Types</td>\n                </tr><tr class=""><td class="specs-key">Hair Styling Type</td>\n                                        <td class="specs-value fk-data">Gel</td>\n                </tr></table></div>'], 'size': []}
{'sku': [u'/viewcart?eid=LSTHOLDNYY7HGQAZK9ZL73QF6'], 'seller': [u'martnaturals', u'[?]'], 'title': [u'\n                    purenaturals Anti Dandruff Hair Oil            '], 'colour': [], 'sp': [u' Rs. 535', u'(32'], 'mrp': [], 'titleimg': [u'http://img5a.flixcart.com/image/hair-oil/k/9/z/pure-naturals-100-anti-dandruff-400x400-imadnywxdhhtkhth.jpeg'], 'catname': ['hair-care'], 'brandname': ['purenaturals.'], 'date': ['18:02:2014'], 'itemlink': ['http://www.flipkart.com/purenaturals-anti-dandruff-hair-oil/p/itmdn24hzet6zdhj?pid=HOLDNYY7HGQAZK9Z&srno=b_3&ref=5875b3e8-3a66-4c5f-8a1a-bbc3bc07ca88'], 'desc': [u'<div class="item_left_column" id="description">\n        <h3 class="item_desc_title fk-uppercase">purenaturals Anti Dandruff Hair Oil (100 ml)         Price: Rs.535</h3>\n        <div class="cls"></div>\n        <div class="item_desc_text line">\n            <div style="float:right">\n                \n \n            </div>\n                        Apply directly on hair scalp - heals infection &amp; dandruff surely - rare therapeutic formulation of cotton seed &amp; tea tree oil with lemon peel extracts. Anti dandruff scalp hair oil, uniquely formulated clears infections and dandruff. Strengthens hair roots by providing proper nutrition. Regular use keeps hair safe from affects of daily pollution. Use in combination with purnaturals anti dandruff shampoo for dandruff care in only 10 washes. Applicare: Pour out sufficient quantity, apply on roots &amp; scalp, massage thoroughly. Keep it for minimum one hour before rinsing.Use preferably at night. Hair wash with Pure Naturals anti dandruff shampoo.        </div>\n        <div style="clear: both;"></div>\n            </div>'], 'spec': [u'<div id="specifications" class="item_left_column">\n    <h3 class="item_desc_title fk-uppercase">\n        Specifications of purenaturals Anti Dandruff Hair Oil (100 ml)    </h3>\n\n            <table cellspacing="0" class="fk-specs-type2"><tr><th class="group-head" colspan="2">In the Box</th>\n            </tr><tr class=""><td colspan="2" class="specs-value fk-data">Anti Dandruff Hair Oil- 100ml</td>\n                </tr></table><table cellspacing="0" class="fk-specs-type2"><tr><th class="group-head" colspan="2">Hair Oil Traits</th>\n            </tr><tr class=""><td class="specs-key">Hair Type</td>\n                                        <td class="specs-value fk-data">All Hair Types</td>\n                </tr><tr class=""><td class="specs-key">Composition</td>\n                                        <td class="specs-value fk-data">Purified Water, Basil, Hibiscus &amp; Aloe Vera Extracts, Coconut Water, Peppermint Oil, Guar Gum, Carbopol</td>\n                </tr><tr class=""><td class="specs-key">Applied For</td>\n                                        <td class="specs-value fk-data">Anti-dandruff, Healthy Scalp, Hair Strengthening</td>\n                </tr></table><table cellspacing="0" class="fk-specs-type2"><tr><th class="group-head" colspan="2">General Traits</th>\n            </tr><tr class=""><td class="specs-key">Container Type</td>\n                                        <td class="specs-value fk-data">Bottle</td>\n                </tr><tr class=""><td class="specs-key">Quantity</td>\n                                        <td class="specs-value fk-data">100 ml</td>\n                </tr><tr class=""><td class="specs-key">Organic Type</td>\n                                        <td class="specs-value fk-data">Natural</td>\n                </tr></table></div>'], 'size': []}
{'sku': [u'/viewcart?eid=LSTHRCDNYY7DRVCYH5HVTMDX1'], 'seller': [u'martnaturals', u'[?]'], 'title': [u'\n                    purenaturals Natural  Hair Color            '], 'colour': [], 'sp': [u' Rs. 635', u'(32'], 'mrp': [], 'titleimg': [u'http://img6a.flixcart.com/image/hair-color/h/5/h/pure-naturals-natural-hair-color-400x400-imadnywwn4hr62yw.jpeg'], 'catname': ['hair-care'], 'brandname': ['purenaturals.'], 'date': ['18:02:2014'], 'itemlink': ['http://www.flipkart.com/purenaturals-natural-hair-color/p/itmdn24hnycdkzvx?pid=HRCDNYY7DRVCYH5H&srno=b_4&ref=5875b3e8-3a66-4c5f-8a1a-bbc3bc07ca88'], 'desc': [u'<div class="item_left_column" id="description">\n        <h3 class="item_desc_title fk-uppercase">purenaturals Natural  Hair Color (Soft Black)         Price: Rs.635</h3>\n        <div class="cls"></div>\n        <div class="item_desc_text line">\n            <div style="float:right">\n                \n \n            </div>\n                        Best for sensitive skin, no side effects, loved by happy users, physician formulated 100percentage Natural Black Hair Color. Applicare:mix in warm water, apply with hand or brush, cover head with hair cap, run hot air blower for quick color, rinse wash after 60-90 minutes. shampoo after 2 days. first time users do it twice in 3 days interval.        </div>\n        <div style="clear: both;"></div>\n            </div>'], 'spec': [u'<div id="specifications" class="item_left_column">\n    <h3 class="item_desc_title fk-uppercase">\n        Specifications of purenaturals Natural  Hair Color (Soft Black)    </h3>\n\n            <table cellspacing="0" class="fk-specs-type2"><tr><th class="group-head" colspan="2">In the Box</th>\n            </tr><tr class=""><td colspan="2" class="specs-value fk-data">Free color protect &amp; perm care 100% natural shampoo(50 ml), Hand Sanitizer(50 ml), Hair Cap, detailed applicare leaflet inside, two double sealed color pouches, applicator brush, Hair Color, pair of gloves</td>\n                </tr></table><table cellspacing="0" class="fk-specs-type2"><tr><th class="group-head" colspan="2">General Traits</th>\n            </tr><tr class=""><td class="specs-key">Color</td>\n                                        <td class="specs-value fk-data">Soft Black</td>\n                </tr><tr class=""><td class="specs-key">Container Type</td>\n                                        <td class="specs-value fk-data">Packet</td>\n                </tr><tr class=""><td class="specs-key">Quantity</td>\n                                        <td class="specs-value fk-data">120 g</td>\n                </tr><tr class=""><td class="specs-key">Organic Type</td>\n                                        <td class="specs-value fk-data">Natural</td>\n                </tr></table><table cellspacing="0" class="fk-specs-type2"><tr><th class="group-head" colspan="2">Hair Color Traits</th>\n            </tr><tr class=""><td class="specs-key">Composition</td>\n                                        <td class="specs-value fk-data">neel patti (indigofera tinctoria) 61%, neel patti satva(indigo extract) 20%, rajasthani mehandi (lawsonia inermis) 10%, katha (acacia catechu) 1%, brahmi (baccopa monnieri) 2%, amla (emblica officinalis) 1%, shikakai (accacia concina) 1%, bhringraj (eclipta alba) 1%, manjistha (rubia cordifolia) 1%, ratanjyot (alkaline tinctoria) 1% &amp; rose oil crystalised 1%.</td>\n                </tr><tr class=""><td class="specs-key">Hair Color Form</td>\n                                        <td class="specs-value fk-data">Powder</td>\n                </tr><tr class=""><td class="specs-key">Ammonia Free</td>\n                                        <td class="specs-value fk-data">Yes</td>\n                </tr></table></div>'], 'size': []}
{'sku': [u'/viewcart?eid=LSTHOLDNYY6NJVJ7MEHRLWUSY'], 'seller': [u'martnaturals', u'[?]'], 'title': [u'\n                    purenaturals Anti Graying Hair Oil            '], 'colour': [], 'sp': [u' Rs. 295', u'(32'], 'mrp': [], 'titleimg': [u'http://img5a.flixcart.com/image/hair-oil/m/e/h/pure-naturals-50-anti-graying-400x400-imadnywx9neth6vd.jpeg'], 'catname': ['hair-care'], 'brandname': ['purenaturals.'], 'date': ['18:02:2014'], 'itemlink': ['http://www.flipkart.com/purenaturals-anti-graying-hair-oil/p/itmdn24ht4grzzwz?pid=HOLDNYY6NJVJ7MEH&srno=b_5&ref=5875b3e8-3a66-4c5f-8a1a-bbc3bc07ca88'], 'desc': [u'<div class="item_left_column" id="description">\n        <h3 class="item_desc_title fk-uppercase">purenaturals Anti Graying Hair Oil (50 ml)         Price: Rs.295</h3>\n        <div class="cls"></div>\n        <div class="item_desc_text line">\n            <div style="float:right">\n                \n \n            </div>\n                        Unique therapeutic treatment ? regular use slows down graying hair strands ? wheat germ oil with organic henna &amp; hibiscus extracts. Strands hair oil, helps open blocked capilliaries, improves blood circulation, gradually restores lost Hair Color. Prevents further graying of hair. Physician formulated for natural hair oil care people. Applicare: pour out sufficient quantity, apply on roots &amp; scalp, massage thoroughly. Keep it for minimum one hour before rinsing. Hair wash with Pure Naturals color protect &amp; perm care shampoo.        </div>\n        <div style="clear: both;"></div>\n            </div>'], 'spec': [u'<div id="specifications" class="item_left_column">\n    <h3 class="item_desc_title fk-uppercase">\n        Specifications of purenaturals Anti Graying Hair Oil (50 ml)    </h3>\n\n            <table cellspacing="0" class="fk-specs-type2"><tr><th class="group-head" colspan="2">In the Box</th>\n            </tr><tr class=""><td colspan="2" class="specs-value fk-data">Anti Graying Hair Oil- 50ml</td>\n                </tr></table><table cellspacing="0" class="fk-specs-type2"><tr><th class="group-head" colspan="2">Hair Oil Traits</th>\n            </tr><tr class=""><td class="specs-key">Hair Type</td>\n                                        <td class="specs-value fk-data">All Hair Types</td>\n                </tr><tr class=""><td class="specs-key">Composition</td>\n                                        <td class="specs-value fk-data">Hibiscus, Orange &amp; Wheat Germ Oils., Almond, Aloe Vera Extracts, Sesame, Cotton Seed, Amla, Olive, Shikaki, Henna, Coconut</td>\n                </tr><tr class=""><td class="specs-key">Applied For</td>\n                                        <td class="specs-value fk-data">Prevents Greying</td>\n                </tr></table><table cellspacing="0" class="fk-specs-type2"><tr><th class="group-head" colspan="2">General Traits</th>\n            </tr><tr class=""><td class="specs-key">Container Type</td>\n                                        <td class="specs-value fk-data">Bottle</td>\n                </tr><tr class=""><td class="specs-key">Quantity</td>\n                                        <td class="specs-value fk-data">50 ml</td>\n                </tr><tr class=""><td class="specs-key">Organic Type</td>\n                                        <td class="specs-value fk-data">Natural</td>\n                </tr></table></div>'], 'size': []}
{'sku': [u'/viewcart?eid=LSTHNADN8YSNHZSGMKPJVMKED'], 'seller': [u'martnaturals', u'[?]'], 'title': [u'\n                    purenaturals Herbs Rich Hair Henna            '], 'colour': [], 'sp': [u' Rs. 425', u'(32'], 'mrp': [], 'titleimg': [u'http://img5a.flixcart.com/image/henna/m/k/p/purenaturals-120-herbs-rich-hair-henna-400x400-imadn8u8cdeqrgfq.jpeg'], 'catname': ['hair-care'], 'brandname': ['purenaturals.'], 'date': ['18:02:2014'], 'itemlink': ['http://www.flipkart.com/purenaturals-herbs-rich-hair-henna/p/itmdn8yvtq8zgbgt?pid=HNADN8YSNHZSGMKP&srno=b_7&ref=5875b3e8-3a66-4c5f-8a1a-bbc3bc07ca88'], 'desc': [u'<div class="item_left_column" id="description">\n        <h3 class="item_desc_title fk-uppercase">purenaturals Herbs Rich Hair Henna (120 g)         Price: Rs.425</h3>\n        <div class="cls"></div>\n        <div class="item_desc_text line">\n            <div style="float:right">\n                \n \n            </div>\n                        Best for sensitive skin, no side effects, loved by happy users, physician formulated 100 percent herbs rich hair henna natural hair color. Applicare:mix in warm water, apply with hand or brush, cover head with hair cap, run hot air blower for quick color, rinse wash after 60-90 minutes. shampoo after 2 days. first time users do it twice in 3 days interval.        </div>\n        <div style="clear: both;"></div>\n            </div>'], 'spec': [u'<div id="specifications" class="item_left_column">\n    <h3 class="item_desc_title fk-uppercase">\n        Specifications of purenaturals Herbs Rich Hair Henna (120 g)    </h3>\n\n            <table cellspacing="0" class="fk-specs-type2"><tr><th class="group-head" colspan="2">In the Box</th>\n            </tr><tr class=""><td colspan="2" class="specs-value fk-data">Hair Color, detailed applicare leaflet inside, Free color protect &amp; perm care 100% natural shampoo(50 ml), pair of gloves, Two double sealed color pouches, Hair Cap, applicator brush</td>\n                </tr></table><table cellspacing="0" class="fk-specs-type2"><tr><th class="group-head" colspan="2">General Traits</th>\n            </tr><tr class=""><td class="specs-key">Container Type</td>\n                                        <td class="specs-value fk-data">Packet</td>\n                </tr><tr class=""><td class="specs-key">Quantity</td>\n                                        <td class="specs-value fk-data">120 g</td>\n                </tr><tr class=""><td class="specs-key">Organic Type</td>\n                                        <td class="specs-value fk-data">Natural</td>\n                </tr></table><table cellspacing="0" class="fk-specs-type2"><tr><th class="group-head" colspan="2">Henna Traits</th>\n            </tr><tr class=""><td class="specs-key">Hair Type</td>\n                                        <td class="specs-value fk-data">Natural</td>\n                </tr><tr class=""><td class="specs-key">Composition</td>\n                                        <td class="specs-value fk-data">Rajasthani mehandi (lawsonia inermis) 80%, shikakai (accacia concina) 4%, coffee seed (coffee arabica) 3%, amla (emblica officinalis) 3%, brahmi (centella asiatica) 2%, neem (azadirachta indica) 2%, ghritkumari (aloe barbadensis) 2%, jaswand (hibiscus rosasinensis) 2%, kathaa (acacia catechu) 1%, bhringraj (eclipta alba) 1%.</td>\n                </tr></table></div>'], 'size': []}
{'sku': [u'/viewcart?eid=LSTSMPDN8YSZ2WVNUSJ59IXCF'], 'seller': [u'martnaturals', u'[?]'], 'title': [u'\n                    purenaturals Strengthening Shampoo            '], 'colour': [], 'sp': [u' Rs. 695', u'(32'], 'mrp': [], 'titleimg': [u'http://img6a.flixcart.com/image/shampoo/u/s/j/purenaturals-200-strengthening-shampoo-400x400-imadn8u8jwzecehq.jpeg'], 'catname': ['hair-care'], 'brandname': ['purenaturals.'], 'date': ['18:02:2014'], 'itemlink': ['http://www.flipkart.com/purenaturals-strengthening-shampoo/p/itmdn8yvq4seqjvz?pid=SMPDN8YSZ2WVNUSJ&srno=b_1&ref=5875b3e8-3a66-4c5f-8a1a-bbc3bc07ca88'], 'desc': [u'<div class="item_left_column" id="description">\n        <h3 class="item_desc_title fk-uppercase">purenaturals Strengthening Shampoo (200 ml)         Price: Rs.695</h3>\n        <div class="cls"></div>\n        <div class="item_desc_text line">\n            <div style="float:right">\n                \n \n            </div>\n                        Coconut milk, basil &amp; hibiscus ? secret ancient formula archived by sages for strengthening every hair. good for kids to senior citizens shampoo. strengthening shampoo, time tested vedic formulations, Almond Extract &amp; Coconut milk work towards strengthening the hair strand by strand, reducing hair fall. Herbs like Shikakai, Basil and Hibiscus effectively clean and nourish the hair from the root to the tip, making it shine. with all its health. The deep conditioning formula makes Hair soft &amp; silky. Applicare: Pump out sufficient quantity,apply on roots &amp; scalp, lather thoroughly. For best results leave on for 5 minutes &amp; Rinse Off. Tip: 100% natural shampoos give best performance if used twice,i.e after first rinse off use again small quantity leave on 5 minutes &amp; rinse off all in one head bath        </div>\n        <div style="clear: both;"></div>\n            </div>'], 'spec': [u'<div id="specifications" class="item_left_column">\n    <h3 class="item_desc_title fk-uppercase">\n        Specifications of purenaturals Strengthening Shampoo (200 ml)    </h3>\n\n            <table cellspacing="0" class="fk-specs-type2"><tr><th class="group-head" colspan="2">In the Box</th>\n            </tr><tr class=""><td colspan="2" class="specs-value fk-data">Strengthening Shampoo</td>\n                </tr></table><table cellspacing="0" class="fk-specs-type2"><tr><th class="group-head" colspan="2">Shampoo Traits</th>\n            </tr><tr class=""><td class="specs-key">Applied For</td>\n                                        <td class="specs-value fk-data">Straightening &amp; Smoothening, Nourishment &amp; Moisturization</td>\n                </tr><tr class=""><td class="specs-key">Hair Type</td>\n                                        <td class="specs-value fk-data">All Hair Types</td>\n                </tr><tr class=""><td class="specs-key">Organic Type</td>\n                                        <td class="specs-value fk-data">Natural</td>\n                </tr></table><table cellspacing="0" class="fk-specs-type2"><tr><th class="group-head" colspan="2">General Traits</th>\n            </tr><tr class=""><td class="specs-key">Brand</td>\n                                        <td class="specs-value fk-data">purenaturals</td>\n                </tr><tr class=""><td class="specs-key">Quantity</td>\n                                        <td class="specs-value fk-data">200 ml</td>\n                </tr><tr class=""><td class="specs-key">Model Name</td>\n                                        <td class="specs-value fk-data">Strengthening Shampoo</td>\n                </tr></table></div>'], 'size': []}
{'sku': [u'/viewcart?eid=LSTHOLDNYY7UY4NJWHCKXSKZS'], 'seller': [u'martnaturals', u'[?]'], 'title': [u'\n                    purenaturals Roots Strengthening Hair Oil            '], 'colour': [], 'sp': [u' Rs. 525', u'(32'], 'mrp': [], 'titleimg': [u'http://img5a.flixcart.com/image/hair-oil/w/h/c/pure-naturals-100-roots-strengthening-400x400-imadnywxwjtazhsx.jpeg'], 'catname': ['hair-care'], 'brandname': ['purenaturals.'], 'date': ['18:02:2014'], 'itemlink': ['http://www.flipkart.com/purenaturals-roots-strengthening-hair-oil/p/itmdn24hm9jgxwqh?pid=HOLDNYY7UY4NJWHC&srno=b_6&ref=5875b3e8-3a66-4c5f-8a1a-bbc3bc07ca88'], 'desc': [u'<div class="item_left_column" id="description">\n        <h3 class="item_desc_title fk-uppercase">purenaturals Roots Strengthening Hair Oil (100 ml)         Price: Rs.525</h3>\n        <div class="cls"></div>\n        <div class="item_desc_text line">\n            <div style="float:right">\n                \n \n            </div>\n                        Jojoba oil in coconut milk with hibiscus extract ? magical potion for all hair fall problems ? unlimited happy users. Roots strengthening hair oil, unique vedic formulation helps in preventing hair fall, provides extra nutrition and restores your confidence. Ideal for early hair fall problems &amp; general maintenance. Applicare: Pour out sufficient quantity, apply on roots &amp; scalp, massage thoroughly. Keep it for minimum one hour before rinsing. Hair wash with Pure Naturals strengthening shampoo.        </div>\n        <div style="clear: both;"></div>\n            </div>'], 'spec': [u'<div id="specifications" class="item_left_column">\n    <h3 class="item_desc_title fk-uppercase">\n        Specifications of purenaturals Roots Strengthening Hair Oil (100 ml)    </h3>\n\n            <table cellspacing="0" class="fk-specs-type2"><tr><th class="group-head" colspan="2">In the Box</th>\n            </tr><tr class=""><td colspan="2" class="specs-value fk-data">Roots Strengthning Hair Oil - 100ml</td>\n                </tr></table><table cellspacing="0" class="fk-specs-type2"><tr><th class="group-head" colspan="2">Hair Oil Traits</th>\n            </tr><tr class=""><td class="specs-key">Hair Type</td>\n                                        <td class="specs-value fk-data">All Hair Types</td>\n                </tr><tr class=""><td class="specs-key">Composition</td>\n                                        <td class="specs-value fk-data">Coconut, Sesame,, Brahmi Extracts, Coconut Milk, Almond, Sunflower, Shikakai, Vitamin E Oils, Basil, Jojoba, Jatamansi, Hibiscus</td>\n                </tr><tr class=""><td class="specs-key">Applied For</td>\n                                        <td class="specs-value fk-data">Anti-hair Fall, Hair Thickening, Hair Strengthening</td>\n                </tr></table><table cellspacing="0" class="fk-specs-type2"><tr><th class="group-head" colspan="2">General Traits</th>\n            </tr><tr class=""><td class="specs-key">Container Type</td>\n                                        <td class="specs-value fk-data">Bottle</td>\n                </tr><tr class=""><td class="specs-key">Quantity</td>\n                                        <td class="specs-value fk-data">100 ml</td>\n                </tr><tr class=""><td class="specs-key">Organic Type</td>\n                                        <td class="specs-value fk-data">Natural</td>\n                </tr></table></div>'], 'size': []}
