LSTPERD8AYHFWR5KYDSUIK4OO,Paris Hilton Can Can Eau de Parfum  -  100 ml,http://www.flipkart.com/lifestyle/fragrances-for-women?otracker=hp_nmenu_sub_women_0_Fragrances,Rs. 2250,Fragrances,Perfumes,Paris Hilton,http://img6a.flixcart.com/image/perfume/y/d/s/eau-de-parfum-women-paris-hilton-100-can-can-400x400-imad86v8887szmaz.jpeg,Rs. 3850,None,women,http://www.flipkart.com/paris-hilton-can-eau-de-parfum-100-ml/p/itmdtatgavxjnvyk?pid=PERD8AYHFWR5KYDS&srno=b_2&ref=a979ae81-88ee-4a58-a57d-bb7513425960,TahaBros,Paris Hilton Can Can Eau de Parfum - 100 ml - Price in India  Buy Paris Hilton Can Can Eau de Parfum - 100 ml Online In India  Reviews  Ratings & Features | Flipkart.com,Flipkart.com: Buy Paris Hilton Can Can Eau de Parfum - 100 ml for Rs. 2062.5 from Flipkart.com. - Lowest Prices  Only Genuine Products  30 Day Replacement Guarantee  Free Shipping. Cash On,[],<div class="item_left_column" id="description"> <h3 class="item_desc_title fk-uppercase">Paris Hilton Can Can Eau de Parfum  -  100 ml (For Women)         Price: Rs.2250</h3> <div class="cls"></div> <div class="item_desc_text line"> <div style="float:right"> </div> <p>   Flirtatious and mysterious  this luxury scent is inspired from the extravagant and larger than life spirit of Moulin Rouge. Embodying the spirit of the wild and spirited dance <strong> Paris Hilton Can Can</strong> sets your senses on fire. Created by Jean-Claude Delville  this animated <strong>Eau de Parfum</strong> is made for the popular brand of Paris Hilton.</p> <p>   A citrusy infusion of succulent clementine  tart notes of blackcurrant and apricot-peachy scent of nectarine make up an explosive top note. It is followed by a stunning and upbeat heart note that is composed of powdery-floral hints of wild orchid along with sweet and refreshing notes of orange blossom. This inviting fragrance ends with a warming base note that exudes smoky hints of amber along with the distinctly heavy yet soothing scent of musk. The sprightly mix of natural extracts create a<strong> floral fruity oriental fragrance</strong> that wraps you in an electrifying garb any time you choose to wear it. This tantalising perfume comes encased in a playful bottle with a slender neck that flows into a curvaceous base. It flaunts a striking colour scheme  of fuchsia and ivory white along with a chic asymmetrical stopper radiating a pink hue. It is delicately decorated with a detailed sketch of a single feather in fuschia against the white surface. A single whiff of Can Can and slip into your dancing shoes for a wild night on the town.</p> </div> <div style="clear: both;"></div> </div>,<div class="item_left_column" id="specifications"> <h3 class="item_desc_title fk-uppercase">         Specifications of Paris Hilton Can Can Eau de Parfum  -  100 ml (For Women)    </h3> <table cellspacing="0" class="fk-specs-type2"> <tr> <th class="group-head" colspan="2">Fragrance Traits</th> </tr> <tr class=""> <td class="specs-key">Ideal For</td> <td class="specs-value fk-data">Women</td> </tr> <tr class=""> <td class="specs-key">Fragrance Segment</td> <td class="specs-value fk-data">Luxury</td> </tr> <tr class=""> <td class="specs-key">Fragrance Classification</td> <td class="specs-value fk-data">Eau de Parfum</td> </tr> <tr class=""> <td class="specs-key">Fragrance Family</td> <td class="specs-value fk-data">Floral</td> </tr> <tr class=""> <td class="specs-key">Quantity</td> <td class="specs-value fk-data">100 ml</td> </tr> </table> <table cellspacing="0" class="fk-specs-type2"> <tr> <th class="group-head" colspan="2">Fragrance Notes</th> </tr> <tr class=""> <td class="specs-key">Top Note</td> <td class="specs-value fk-data">Clementine  Black Currant  Nectarine</td> </tr> <tr class=""> <td class="specs-key">Heart Note</td> <td class="specs-value fk-data">Orange Blossom  Wild Orchid</td> </tr> <tr class=""> <td class="specs-key">Base Note</td> <td class="specs-value fk-data">Amber  Musk</td> </tr> </table> </div>,10:03:2014,None
LSTPERD8AYH3HVMWDWZIHEZKB,Paris Hilton Heiress Eau de Parfum  -  100 ml,http://www.flipkart.com/lifestyle/fragrances-for-women?otracker=hp_nmenu_sub_women_0_Fragrances,Rs. 1980,Fragrances,Perfumes,Paris Hilton,http://img6a.flixcart.com/image/perfume/d/w/z/eau-de-parfum-women-paris-hilton-100-heiress-400x400-imadkabhzgyqsutb.jpeg,Rs. 2750,None,women,http://www.flipkart.com/paris-hilton-heiress-eau-de-parfum-100-ml/p/itmdtkqphfjhhgfz?pid=PERD8AYH3HVMWDWZ&srno=b_1&ref=a979ae81-88ee-4a58-a57d-bb7513425960,buyanyperfume,Paris Hilton Heiress Eau de Parfum - 100 ml - Price in India  Buy Paris Hilton Heiress Eau de Parfum - 100 ml Online In India  Reviews  Ratings & Features | Flipkart.com,Flipkart.com: Buy Paris Hilton Heiress Eau de Parfum - 100 ml for Rs. 2062.5 from Flipkart.com. - Lowest Prices  Only Genuine Products  30 Day Replacement Guarantee  Free Shipping. Cash On,[],<div class="item_left_column" id="description"> <h3 class="item_desc_title fk-uppercase">Paris Hilton Heiress Eau de Parfum  -  100 ml (For Women)         Price: Rs.1980</h3> <div class="cls"></div> <div class="item_desc_text line"> <div style="float:right"> </div>                         Heiress from the fashion house of Paris Hilton infuses myriad hues of fruity and floral essences into an accord that is emblematic of poised sensuality and glamour. Inspired by Paris Hilton herself - heiress to the Hilton fortune  this exotic Eau de Perfume is a charmingly flirtatious embodiment of cool youthful energy. Refreshing and exciting at the same time  Heiress is opulent luxury encased in a bottle  with an invigorating aroma that seduces you with its mysterious magnetism. <p>The exhilarating top note opens with accords of passion fruit  succulent orange  peach granite and delicious champagne mimosa. The sparkling heart note of tiare lily  star jasmine  sweet honeysuckle  grenadine and the pleasing aroma of candied ylang-ylang  is perfectly complimented by a sheer floral base note of violet leaf  vetiver  Tahiti tonka and blonde woods. Adroitly blended and artistically bottled by Henry de Monclin  this sparkling and bright fragrance is an essential expression of feminine chic  unquestionably meant for the heiress in you. </p> </div> <div style="clear: both;"></div> </div>,<div class="item_left_column" id="specifications"> <h3 class="item_desc_title fk-uppercase">         Specifications of Paris Hilton Heiress Eau de Parfum  -  100 ml (For Women)    </h3> <table cellspacing="0" class="fk-specs-type2"> <tr> <th class="group-head" colspan="2">Fragrance Traits</th> </tr> <tr class=""> <td class="specs-key">Ideal For</td> <td class="specs-value fk-data">Women</td> </tr> <tr class=""> <td class="specs-key">Fragrance Segment</td> <td class="specs-value fk-data">Luxury</td> </tr> <tr class=""> <td class="specs-key">Fragrance Classification</td> <td class="specs-value fk-data">Eau de Parfum</td> </tr> <tr class=""> <td class="specs-key">Fragrance Family</td> <td class="specs-value fk-data">Floral</td> </tr> <tr class=""> <td class="specs-key">Quantity</td> <td class="specs-value fk-data">100 ml</td> </tr> </table> <table cellspacing="0" class="fk-specs-type2"> <tr> <th class="group-head" colspan="2">Fragrance Notes</th> </tr> <tr class=""> <td class="specs-key">Top Note</td> <td class="specs-value fk-data">Orange  Mimose  Peach  Passionfrui</td> </tr> <tr class=""> <td class="specs-key">Heart Note</td> <td class="specs-value fk-data">Honeysuckle  Jasmine</td> </tr> <tr class=""> <td class="specs-key">Base Note</td> <td class="specs-value fk-data">Violet</td> </tr> </table> </div>,10:03:2014,None
LSTPERDKWCBCYDVBFTHCAGN0Q,Paris Hilton just-me-by-paris-for-her Eau de Toilette  -  100 ml,http://www.flipkart.com/lifestyle/fragrances-for-women?otracker=hp_nmenu_sub_women_0_Fragrances,Rs. 2806,Fragrances,Perfumes,Paris Hilton,http://img5a.flixcart.com/image/perfume/f/t/h/eau-de-toilette-women-paris-hilton-100-just-me-by-paris-for-her-400x400-imadh2wftqczdjh4.jpeg,Rs. 3500,None,women,http://www.flipkart.com/paris-hilton-just-me-by-paris-for-her-eau-de-toilette-100-ml/p/itmdtaucfh3beygw?pid=PERDKWCBCYDVBFTH&srno=b_7&ref=a979ae81-88ee-4a58-a57d-bb7513425960,perfume2order,Paris Hilton just-me-by-paris-for-her Eau de Toilette - 100 ml - Price in India  Buy Paris Hilton just-me-by-paris-for-her Eau de Toilette - 100 ml Online In India  Reviews  Ratings & Features | Flipkart.com,Flipkart.com: Buy Paris Hilton just-me-by-paris-for-her Eau de Toilette - 100 ml for Rs. 0.0 from Flipkart.com. - Lowest Prices  Only Genuine Products  30 Day Replacement Guarantee  Free Shipping. Cash On,[],<div class="item_left_column" id="description"> <h3 class="item_desc_title fk-uppercase">Paris Hilton just-me-by-paris-for-her Eau de Toilette  -  100 ml (For Women)         Price: Rs.2806</h3> <div class="cls"></div> <div class="item_desc_text line"> <div style="float:right"> </div>                         Paris Hilton Just me For Women EDT is a captivating and enticing fragrance that brags of it's extremely seductive nature It is a fascinating fragrance that captures attention in a way that you can't get your eyes off her she has the looks  the sex-appeal and the right attitude to carry them off.        </div> <div style="clear: both;"></div> </div>,<div class="item_left_column" id="specifications"> <h3 class="item_desc_title fk-uppercase">         Specifications of Paris Hilton just-me-by-paris-for-her Eau de Toilette  -  100 ml (For Women)    </h3> <table cellspacing="0" class="fk-specs-type2"> <tr> <th class="group-head" colspan="2">Fragrance Traits</th> </tr> <tr class=""> <td class="specs-key">Ideal For</td> <td class="specs-value fk-data">Women</td> </tr> <tr class=""> <td class="specs-key">Fragrance Classification</td> <td class="specs-value fk-data">Eau de Toilette</td> </tr> <tr class=""> <td class="specs-key">Fragrance Family</td> <td class="specs-value fk-data">Floral</td> </tr> <tr class=""> <td class="specs-key">Quantity</td> <td class="specs-value fk-data">100 ml</td> </tr> </table> </div>,10:03:2014,None
LSTPERD8AYHY5FF2XXHYCK5YZ,Paris Hilton Just Me Eau de Parfum  -  100 ml,http://www.flipkart.com/lifestyle/fragrances-for-women?otracker=hp_nmenu_sub_women_0_Fragrances,Rs. 1835,Fragrances,Perfumes,Paris Hilton,http://img5a.flixcart.com/image/perfume/x/x/h/eau-de-parfum-women-paris-hilton-100-just-me-400x400-imad86v4afzxczh8.jpeg,Rs. 2450,None,women,http://www.flipkart.com/paris-hilton-just-me-eau-de-parfum-100-ml/p/itmdtathwumfqrhh?pid=PERD8AYHY5FF2XXH&srno=b_5&ref=a979ae81-88ee-4a58-a57d-bb7513425960,buyanyperfume,Paris Hilton Just Me Eau de Parfum - 100 ml - Price in India  Buy Paris Hilton Just Me Eau de Parfum - 100 ml Online In India  Reviews  Ratings & Features | Flipkart.com,Flipkart.com: Buy Paris Hilton Just Me Eau de Parfum - 100 ml for Rs. 1837.5 from Flipkart.com. - Lowest Prices  Only Genuine Products  30 Day Replacement Guarantee  Free Shipping. Cash On,[],<div class="item_left_column" id="description"> <h3 class="item_desc_title fk-uppercase">Paris Hilton Just Me Eau de Parfum  -  100 ml (For Women)         Price: Rs.1835</h3> <div class="cls"></div> <div class="item_desc_text line"> <div style="float:right"> </div>                         Young  sensual and entrancingly feminine  the charm of Just Me lies in its heady fruity-floral cocktail essence. But the delightful Just Me by Paris Hilton is not just a sculpted vial of youthful exuberance. The enlivening aroma of this fragrance is the reflection of a self-assured woman in her prime  who exudes confidence and embraces life with energy and passion. <p>Created by acclaimed perfumer Steve Demercado  the luxurious aroma of Just Me enthralls your senses with sparkling top notes of luscious raspberry  fresh and juicy bergamot  the dust of violet and pink pepper. The bewitching heart note of iris  lily of the valley  freesia  creamy white rose and honeyed ylang-ylang gently mingles with the soft note of Tahitian vanilla  Egyptian sandalwood  velvety musk and a hint of woody accords of the warm base note. Flirty and fun  Just Me adds a vibrant zest to your aura  be it during a sultry summer evening or the cosy  romantic winter date. This certainly is a fragrance that is forever just you.</p> </div> <div style="clear: both;"></div> </div>,<div class="item_left_column" id="specifications"> <h3 class="item_desc_title fk-uppercase">         Specifications of Paris Hilton Just Me Eau de Parfum  -  100 ml (For Women)    </h3> <table cellspacing="0" class="fk-specs-type2"> <tr> <th class="group-head" colspan="2">Fragrance Traits</th> </tr> <tr class=""> <td class="specs-key">Ideal For</td> <td class="specs-value fk-data">Women</td> </tr> <tr class=""> <td class="specs-key">Fragrance Segment</td> <td class="specs-value fk-data">Luxury</td> </tr> <tr class=""> <td class="specs-key">Fragrance Classification</td> <td class="specs-value fk-data">Eau de Parfum</td> </tr> <tr class=""> <td class="specs-key">Fragrance Family</td> <td class="specs-value fk-data">Floral</td> </tr> <tr class=""> <td class="specs-key">Quantity</td> <td class="specs-value fk-data">100 ml</td> </tr> </table> <table cellspacing="0" class="fk-specs-type2"> <tr> <th class="group-head" colspan="2">Fragrance Notes</th> </tr> <tr class=""> <td class="specs-key">Top Note</td> <td class="specs-value fk-data">Red Berries  Bergamot  Pink Pepper</td> </tr> <tr class=""> <td class="specs-key">Heart Note</td> <td class="specs-value fk-data">Violet  White Rose  Lily of the Valley</td> </tr> <tr class=""> <td class="specs-key">Base Note</td> <td class="specs-value fk-data">Musk  Vanilla</td> </tr> </table> </div>,10:03:2014,None
LSTPERD8AYHYZBXSCZ6F5FDKB,Paris Hilton EDP - 100 ml,http://www.flipkart.com/lifestyle/fragrances-for-women?otracker=hp_nmenu_sub_women_0_Fragrances,Rs. 2150,Fragrances,Perfumes,Paris Hilton,http://img6a.flixcart.com/image/perfume/c/z/6/eau-de-parfum-women-paris-hilton-100-paris-hilton-400x400-imad86v9dzqz7gcp.jpeg,Rs. 2750,None,women,http://www.flipkart.com/paris-hilton-edp-100-ml/p/itmdthjdzvcfeqnk?pid=PERD8AYHYZBXSCZ6&srno=b_6&ref=a979ae81-88ee-4a58-a57d-bb7513425960,buyanyperfume,Paris Hilton EDP - 100 ml - Price in India  Buy Paris Hilton EDP - 100 ml Online In India  Reviews  Ratings & Features | Flipkart.com,Flipkart.com: Buy Paris Hilton EDP - 100 ml for Rs. 2062.5 from Flipkart.com. - Lowest Prices  Only Genuine Products  30 Day Replacement Guarantee  Free Shipping. Cash On,[],<div class="item_left_column" id="description"> <h3 class="item_desc_title fk-uppercase">Paris Hilton EDP - 100 ml (For Women)         Price: Rs.2150</h3> <div class="cls"></div> <div class="item_desc_text line"> <div style="float:right"> </div> <p>   Extravagant and bewitching  popular artist Paris Hilton presents the woman of today with the essence of her charm captured in the a luxury fragrance. The <strong>Eau de Parfum</strong> is for the woman who is effervescent and cheery. <strong>Paris Hilton EDP </strong>is her constant companion through tears and smiles and all the trials that life takes her through. She is a woman who is embraces her femininity and is not afraid of reaching out for what she wants.</p> <p>   Created by perfumers <strong>James Krivda and Steve Demercado</strong>  Paris Hilton EDP has juicy top notes with accords of luscious peach and red apple. The heart note trails into the combined assault of mimosa  freesia and jasmine petals. The dry down leaves behind a sultry freshness that comes with sandalwood  oakmoss and vibrant ylang ylang. The organic yet soothing range of ingredients is perfect for any time of the day and carries you through your week in a cloud of euphoria. The seductive fragrance is encaptured in a cylindrical flacon that radiates a pretty pink aura decorated with black vertical waves. Slather yourself in the trendy and upbeat quality of <strong>Paris Hilton EDP</strong> that appeals to the modern and fun-loving woman.</p> </div> <div style="clear: both;"></div> </div>,<div class="item_left_column" id="specifications"> <h3 class="item_desc_title fk-uppercase">         Specifications of Paris Hilton EDP - 100 ml (For Women)    </h3> <table cellspacing="0" class="fk-specs-type2"> <tr> <th class="group-head" colspan="2">Fragrance Traits</th> </tr> <tr class=""> <td class="specs-key">Ideal For</td> <td class="specs-value fk-data">Women</td> </tr> <tr class=""> <td class="specs-key">Fragrance Segment</td> <td class="specs-value fk-data">Luxury</td> </tr> <tr class=""> <td class="specs-key">Fragrance Classification</td> <td class="specs-value fk-data">Eau de Parfum</td> </tr> <tr class=""> <td class="specs-key">Fragrance Family</td> <td class="specs-value fk-data">Floral</td> </tr> <tr class=""> <td class="specs-key">Quantity</td> <td class="specs-value fk-data">100 ml</td> </tr> </table> <table cellspacing="0" class="fk-specs-type2"> <tr> <th class="group-head" colspan="2">Fragrance Notes</th> </tr> <tr class=""> <td class="specs-key">Top Note</td> <td class="specs-value fk-data">Peach  Apple</td> </tr> <tr class=""> <td class="specs-key">Heart Note</td> <td class="specs-value fk-data">Mimose  Freesia  Jasmine Petals</td> </tr> <tr class=""> <td class="specs-key">Base Note</td> <td class="specs-value fk-data">Sandalwood  Oakmoss  Ylang Ylang</td> </tr> </table> </div>,10:03:2014,None
LSTPERD8AYHNKMFUUDR28PJX4,Paris Hilton Fairy Dust Eau de Parfum  -  100 ml,http://www.flipkart.com/lifestyle/fragrances-for-women?otracker=hp_nmenu_sub_women_0_Fragrances,Rs. 3389,Fragrances,Perfumes,Paris Hilton,http://img6a.flixcart.com/image/perfume/u/d/r/eau-de-parfum-women-paris-hilton-100-fairy-dust-400x400-imad86vfqtyqefhv.jpeg,Rs. 3499,None,women,http://www.flipkart.com/paris-hilton-fairy-dust-eau-de-parfum-100-ml/p/itmdtatg3mmeaff6?pid=PERD8AYHNKMFUUDR&srno=b_4&ref=a979ae81-88ee-4a58-a57d-bb7513425960,perfume2order,Paris Hilton Fairy Dust Eau de Parfum - 100 ml - Price in India  Buy Paris Hilton Fairy Dust Eau de Parfum - 100 ml Online In India  Reviews  Ratings & Features | Flipkart.com,Flipkart.com: Buy Paris Hilton Fairy Dust Eau de Parfum - 100 ml for Rs. 2062.5 from Flipkart.com. - Lowest Prices  Only Genuine Products  30 Day Replacement Guarantee  Free Shipping. Cash On,[],<div class="item_left_column" id="description"> <h3 class="item_desc_title fk-uppercase">Paris Hilton Fairy Dust Eau de Parfum  -  100 ml (For Women)         Price: Rs.3389</h3> <div class="cls"></div> <div class="item_desc_text line"> <div style="float:right"> </div> <p>   An enchanting and radiant aroma makes this luxury scent stand apart in a class of its own. A fragrant concoction of natural extracts gives <strong>Paris Hilton Fairy Dust</strong> a sensuous aura  perfect for a magical woman. Mane USA is credited with the creation of this delectable <strong>Eau de Parfum</strong> for the upscale brand of Paris Hilton.</p> <p>   This lovely fragrance starts off with a beautiful top note comprised of fragrant pink peony extracts and zesty notes of orange blossom. Trailing into the heart note that combines the fruity essence of peach with the silky aroma of gardenia and refreshing water lily. Finishing off this delightful fragrance is a lovely and deep scented base note that marries earthy patchouli  soothing notes of musk and creamy vanilla. The <strong>fresh  oriental  woody fragrance</strong> is perfect for a special evening out. A light green tinted fragrance glimmers through the crystal clear vial  decorated with the silhouette of a fairy in the center. With a metallic neck and a stopper shaped like a jewel emitting a blue tint  this vial represents the epitome of femininity. A whiff of this entrancing perfume converts any woman into a celestial nymph.</p> </div> <div style="clear: both;"></div> </div>,<div class="item_left_column" id="specifications"> <h3 class="item_desc_title fk-uppercase">         Specifications of Paris Hilton Fairy Dust Eau de Parfum  -  100 ml (For Women)    </h3> <table cellspacing="0" class="fk-specs-type2"> <tr> <th class="group-head" colspan="2">Fragrance Traits</th> </tr> <tr class=""> <td class="specs-key">Ideal For</td> <td class="specs-value fk-data">Women</td> </tr> <tr class=""> <td class="specs-key">Fragrance Segment</td> <td class="specs-value fk-data">Luxury</td> </tr> <tr class=""> <td class="specs-key">Fragrance Classification</td> <td class="specs-value fk-data">Eau de Parfum</td> </tr> <tr class=""> <td class="specs-key">Fragrance Family</td> <td class="specs-value fk-data">Floral</td> </tr> <tr class=""> <td class="specs-key">Quantity</td> <td class="specs-value fk-data">100 ml</td> </tr> </table> <table cellspacing="0" class="fk-specs-type2"> <tr> <th class="group-head" colspan="2">Fragrance Notes</th> </tr> <tr class=""> <td class="specs-key">Top Note</td> <td class="specs-value fk-data">Pink Peony  Orange Blossom</td> </tr> <tr class=""> <td class="specs-key">Heart Note</td> <td class="specs-value fk-data">Gardenia  Water Lily  Peach</td> </tr> <tr class=""> <td class="specs-key">Base Note</td> <td class="specs-value fk-data">Patchouli  Musk  Vanilla</td> </tr> </table> </div>,10:03:2014,None
LSTPERD8AYHZSWHEEH2B6TPEI,Paris Hilton Tease Eau de Parfum  -  50 ml,http://www.flipkart.com/lifestyle/fragrances-for-women?otracker=hp_nmenu_sub_women_0_Fragrances,Rs. 3204,Fragrances,Perfumes,Paris Hilton,http://img6a.flixcart.com/image/perfume/e/h/2/eau-de-parfum-women-paris-hilton-50-tease-400x400-imad8bcdgjcthkyg.jpeg,Rs. 3636,None,women,http://www.flipkart.com/paris-hilton-tease-eau-de-parfum-50-ml/p/itmdtathmyb6jfqb?pid=PERD8AYHZSWHEEH2&srno=b_3&ref=a979ae81-88ee-4a58-a57d-bb7513425960,perfume2order,Paris Hilton Tease Eau de Parfum - 50 ml - Price in India  Buy Paris Hilton Tease Eau de Parfum - 50 ml Online In India  Reviews  Ratings & Features | Flipkart.com,Flipkart.com: Buy Paris Hilton Tease Eau de Parfum - 50 ml for Rs. 1687.5 from Flipkart.com. - Lowest Prices  Only Genuine Products  30 Day Replacement Guarantee  Free Shipping. Cash On,[],<div class="item_left_column" id="description"> <h3 class="item_desc_title fk-uppercase">Paris Hilton Tease Eau de Parfum  -  50 ml (For Women)         Price: Rs.3204</h3> <div class="cls"></div> <div class="item_desc_text line"> <div style="float:right"> </div> <p>   An ode to the glamorous Hollywood diva  Marilyn Monroe  Tease is an inspired creation from Paris Hilton  and pays tribute to the beauty and seductive charm of the classic sensation and her Hollywood connection  in retrospect. Created by perfumer Steve De Mercado  this mesmerizing fragrance was launched in 2010 and designed specifically for the quintessentially feminine seductress  who inspires sighs with a flick of her locks or a quiver on her lips. Filled with passionate sensuality and an intense  invigorating appeal  the<strong> Paris Hilton Tease Luxury Eau</strong> <strong>de Parfum </strong>is a warm and exotic<strong> Chypre-floral-oriental scent </strong>that appears in an elegantly designed vial with a purple tinge. While the expository notes indulge you in the fruity richness of Bergamot  Peach and Red Apple  the heart of the perfume leads you to a sweet  floral treat with Frangipani  Jasmine and Tuberose. The final  lingering dry-down brings forth the aromas of Sand and Amber. With an enigma surrounding the vintage charm of this <strong>Women’s Eau de Parfum</strong>  the Paris Hilton Tease flatters and flirts with the senses  to make its way straight to the hearts of your admirers.</p> </div> <div style="clear: both;"></div> </div>,<div class="item_left_column" id="specifications"> <h3 class="item_desc_title fk-uppercase">         Specifications of Paris Hilton Tease Eau de Parfum  -  50 ml (For Women)    </h3> <table cellspacing="0" class="fk-specs-type2"> <tr> <th class="group-head" colspan="2">Fragrance Traits</th> </tr> <tr class=""> <td class="specs-key">Ideal For</td> <td class="specs-value fk-data">Women</td> </tr> <tr class=""> <td class="specs-key">Fragrance Segment</td> <td class="specs-value fk-data">Luxury</td> </tr> <tr class=""> <td class="specs-key">Fragrance Classification</td> <td class="specs-value fk-data">Eau de Parfum</td> </tr> <tr class=""> <td class="specs-key">Fragrance Family</td> <td class="specs-value fk-data">Floral</td> </tr> <tr class=""> <td class="specs-key">Quantity</td> <td class="specs-value fk-data">50 ml</td> </tr> </table> <table cellspacing="0" class="fk-specs-type2"> <tr> <th class="group-head" colspan="2">Fragrance Notes</th> </tr> <tr class=""> <td class="specs-key">Top Note</td> <td class="specs-value fk-data">Bergamot  Peach  Red Apple</td> </tr> <tr class=""> <td class="specs-key">Heart Note</td> <td class="specs-value fk-data">Frangipani  Jasmine  Tuberose</td> </tr> <tr class=""> <td class="specs-key">Base Note</td> <td class="specs-value fk-data">Sand  Amber</td> </tr> </table> </div>,10:03:2014,None
