LSTPANDHFQAZY64BACC9HXNTC,Morph Maternity Women's Maternity Panty Panty,http://www.flipkart.com/womens-clothing?otracker=hp_nmenu_sub_women_0_Clothing,Rs. 275,Clothing,Maternity Wear,Roxy,http://img6a.flixcart.com/image/panty/a/c/c/mphs017copch00peach-morph-maternity-xl-400x400-imadmv9wehyf4uy5.jpeg,Rs. 275,Peach,women,http://www.flipkart.com/morph-maternity-women-s-panty/p/itmdmwg732dshj7u?pid=PANDHFQAZY64BACC&srno=b_6&ref=c8297172-76d4-4a9c-94be-3ed88a3534f4,WS Retail,Morph Maternity Women's Maternity Panty Panty - Buy Peach Morph Maternity Women's Maternity Panty Panty Online at Best Prices in India | Flipkart.com,Morph Maternity Women's Maternity Panty Panty - Buy Peach Morph Maternity Women's Maternity Panty Panty For Only Rs. 275.0 Online in India. Shop Online For Apparels. Huge Collection of Branded Clothes Only at,['L'  'XL'],<div class="item_left_column" id="description"> <h3 class="item_desc_title fk-uppercase">Morph Maternity Women's Maternity Panty Panty         Price: Rs.275</h3> <div class="cls"></div> <div class="item_desc_text line"> <div style="float:right"> </div> <p>   Crafted from the finest cotton material  this maternity panty from Morph Maternity ensures a right amount of relaxed and breathable comfort to all those expecting mothers. The <strong>elastic waistband </strong>of this comfortable panty ensures perfect grip and fit.</p> </div> <div style="clear: both;"></div> </div>,<div class="item_left_column" id="specifications"> <h3 class="item_desc_title fk-uppercase">         Specifications of Morph Maternity Women's Maternity Panty Panty    </h3> <table cellspacing="0" class="fk-specs-type2"> <tr> <th class="group-head" colspan="2">General Details<a class="see-more unitExt rmargin10 no-underline" href="javascript:void(0);" onclick="$(this).closest('.fk-specs-type2').toggleClass('expandedMore')" title="Expand">[+]</a><a class="hidden unitExt rmargin10 no-underline" href="javascript:void(0);" onclick="$(this).closest('.fk-specs-type2').toggleClass('expandedMore')" title="Collapse">[-]</a></th> </tr> <tr class="hidden"> <td class="specs-key">Ideal For</td> <td class="specs-value fk-data">Women's</td> </tr> <tr class="hidden"> <td class="specs-key">Occasion</td> <td class="specs-value fk-data">Casual</td> </tr> <tr class="hidden"> <td class="specs-key">Pattern</td> <td class="specs-value fk-data">Solid</td> </tr> </table> <table cellspacing="0" class="fk-specs-type2"> <tr> <th class="group-head" colspan="2">Panty Details</th> </tr> <tr class=""> <td class="specs-key">Type</td> <td class="specs-value fk-data">Maternity Panty</td> </tr> <tr class=""> <td class="specs-key">Fabric</td> <td class="specs-value fk-data">100% Cotton</td> </tr> <tr class=""> <td class="specs-key">Design</td> <td class="specs-value fk-data">Logo Print at Front</td> </tr> </table> <table cellspacing="0" class="fk-specs-type2"> <tr> <th class="group-head" colspan="2">Fabric Care</th> </tr> <tr class=""> <td class="specs-value fk-data" colspan="2">Machine Wash at 40°C  Do Not Bleach  Do Not Wring  Do Not Iron</td> </tr> </table> <table cellspacing="0" class="fk-specs-type2"> <tr> <th class="group-head" colspan="2">Additional Details<a class="see-more unitExt rmargin10 no-underline" href="javascript:void(0);" onclick="$(this).closest('.fk-specs-type2').toggleClass('expandedMore')" title="Expand">[+]</a><a class="hidden unitExt rmargin10 no-underline" href="javascript:void(0);" onclick="$(this).closest('.fk-specs-type2').toggleClass('expandedMore')" title="Collapse">[-]</a></th> </tr> <tr class="hidden"> <td class="specs-key"> </td> <td class="specs-value fk-data">Elasticated Waistband and Leg Opening</td> </tr> </table> </div>,10:03:2014,None
LSTCPIDQWZHRMNGV3YRLKBTND,Morph Maternity Women's Capri,http://www.flipkart.com/womens-clothing?otracker=hp_nmenu_sub_women_0_Clothing,Rs. 995,Clothing,Maternity Wear,Roxy,http://img6a.flixcart.com/image/capri/g/x/7/cccp611cpblk0-morph-maternity-m-400x400-imadrcqau9hqpsus.jpeg,Rs. 995,Black,women,http://www.flipkart.com/morph-maternity-women-s-capri/p/itmdqwzgu9ukfzhs?pid=CPIDQWZHRMNGV3YR&srno=b_4&ref=c8297172-76d4-4a9c-94be-3ed88a3534f4,WS Retail,Morph Maternity Women's Capri - Buy Black Morph Maternity Women's Capri Online at Best Prices in India | Flipkart.com,Morph Maternity Women's Capri - Buy Black Morph Maternity Women's Capri For Only Rs. 995.0 Online in India. Shop Online For Apparels. Huge Collection of Branded Clothes Only at,['S'  'M'  'L'],None,<div class="item_left_column" id="specifications"> <h3 class="item_desc_title fk-uppercase">         Specifications of Morph Maternity Women's Capri    </h3> <table cellspacing="0" class="fk-specs-type2"> <tr> <th class="group-head" colspan="2">General Details<a class="see-more unitExt rmargin10 no-underline" href="javascript:void(0);" onclick="$(this).closest('.fk-specs-type2').toggleClass('expandedMore')" title="Expand">[+]</a><a class="hidden unitExt rmargin10 no-underline" href="javascript:void(0);" onclick="$(this).closest('.fk-specs-type2').toggleClass('expandedMore')" title="Collapse">[-]</a></th> </tr> <tr class="hidden"> <td class="specs-key">Ideal For</td> <td class="specs-value fk-data">Women's</td> </tr> <tr class="hidden"> <td class="specs-key">Occasion</td> <td class="specs-value fk-data">Casual</td> </tr> </table> <table cellspacing="0" class="fk-specs-type2"> <tr> <th class="group-head" colspan="2">Capri Details</th> </tr> <tr class=""> <td class="specs-key">Fabric</td> <td class="specs-value fk-data">Cotton</td> </tr> </table> <table cellspacing="0" class="fk-specs-type2"> <tr> <th class="group-head" colspan="2">Fabric Care</th> </tr> <tr class=""> <td class="specs-value fk-data" colspan="2">Hand or Machine Wash in Normal Cycle</td> </tr> </table> <table cellspacing="0" class="fk-specs-type2"> <tr> <th class="group-head" colspan="2">Additional Details<a class="see-more unitExt rmargin10 no-underline" href="javascript:void(0);" onclick="$(this).closest('.fk-specs-type2').toggleClass('expandedMore')" title="Expand">[+]</a><a class="hidden unitExt rmargin10 no-underline" href="javascript:void(0);" onclick="$(this).closest('.fk-specs-type2').toggleClass('expandedMore')" title="Collapse">[-]</a></th> </tr> <tr class="hidden"> <td class="specs-key"> </td> <td class="specs-value fk-data">Casual Capri High Belly Elastic Waist band</td> </tr> </table> </div>,10:03:2014,None
LSTTOPDQX5EYZF56WAAVDEXVN,Morph Maternity Casual Women's Top,http://www.flipkart.com/womens-clothing?otracker=hp_nmenu_sub_women_0_Clothing,Rs. 545,Clothing,Maternity Wear,Roxy,http://img6a.flixcart.com/image/top/7/k/8/cktp608cppch0-morph-maternity-l-400x400-imadrch34acthavg.jpeg,Rs. 545,Beige,women,http://www.flipkart.com/morph-maternity-casual-women-s-top/p/itmdqx5hzjcgghrh?pid=TOPDQX5EYZF56WAA&srno=b_5&ref=c8297172-76d4-4a9c-94be-3ed88a3534f4,WS Retail,Morph Maternity Casual Women's Top - Buy Beige Morph Maternity Casual Women's Top Online at Best Prices in India | Flipkart.com,Morph Maternity Casual Women's Top - Buy Beige Morph Maternity Casual Women's Top For Only Rs. 545.0 Online in India. Shop Online For Apparels. Huge Collection of Branded Clothes Only at,['S'  'M'  'L'],None,<div class="item_left_column" id="specifications"> <h3 class="item_desc_title fk-uppercase">         Specifications of Morph Maternity Casual Women's Top    </h3> <table cellspacing="0" class="fk-specs-type2"> <tr> <th class="group-head" colspan="2">General Details<a class="see-more unitExt rmargin10 no-underline" href="javascript:void(0);" onclick="$(this).closest('.fk-specs-type2').toggleClass('expandedMore')" title="Expand">[+]</a><a class="hidden unitExt rmargin10 no-underline" href="javascript:void(0);" onclick="$(this).closest('.fk-specs-type2').toggleClass('expandedMore')" title="Collapse">[-]</a></th> </tr> <tr class="hidden"> <td class="specs-key">Ideal For</td> <td class="specs-value fk-data">Women's</td> </tr> <tr class="hidden"> <td class="specs-key">Occasion</td> <td class="specs-value fk-data">Casual</td> </tr> </table> <table cellspacing="0" class="fk-specs-type2"> <tr> <th class="group-head" colspan="2">Top Details</th> </tr> <tr class=""> <td class="specs-key">Fabric</td> <td class="specs-value fk-data">Knit Cotton</td> </tr> </table> <table cellspacing="0" class="fk-specs-type2"> <tr> <th class="group-head" colspan="2">Fabric Care</th> </tr> <tr class=""> <td class="specs-value fk-data" colspan="2">Hand or Machine Wash in Normal Cycle</td> </tr> </table> <table cellspacing="0" class="fk-specs-type2"> <tr> <th class="group-head" colspan="2">Additional Details<a class="see-more unitExt rmargin10 no-underline" href="javascript:void(0);" onclick="$(this).closest('.fk-specs-type2').toggleClass('expandedMore')" title="Expand">[+]</a><a class="hidden unitExt rmargin10 no-underline" href="javascript:void(0);" onclick="$(this).closest('.fk-specs-type2').toggleClass('expandedMore')" title="Collapse">[-]</a></th> </tr> <tr class="hidden"> <td class="specs-key"> </td> <td class="specs-value fk-data">Round neck embellished with crotcheted lace.. Short sleeves. Gathers at sides</td> </tr> </table> </div>,10:03:2014,None
LSTBRADQWZPRXA8GVFBE1SNJS,Morph Maternity Women's Nursing Bra,http://www.flipkart.com/womens-clothing?otracker=hp_nmenu_sub_women_0_Clothing,Rs. 595,Clothing,Maternity Wear,Roxy,http://img5a.flixcart.com/image/bra/g/z/7/lpnb026coskn-morph-maternity-32c-400x400-imads7wa8agpebbp.jpeg,Rs. 595,Beige,women,http://www.flipkart.com/morph-maternity-women-s-nursing-bra/p/itmdqwzpb3a5x9u2?pid=BRADQWZPRXA8GVFB&srno=b_10&ref=c8297172-76d4-4a9c-94be-3ed88a3534f4,WS Retail,Morph Maternity Women's Nursing Bra - Buy Beige Morph Maternity Women's Nursing Bra Online at Best Prices in India | Flipkart.com,Morph Maternity Women's Nursing Bra - Buy Beige Morph Maternity Women's Nursing Bra For Only Rs. 595.0 Online in India. Shop Online For Apparels. Huge Collection of Branded Clothes Only at,['32C'  '34C'],None,<div class="item_left_column" id="specifications"> <h3 class="item_desc_title fk-uppercase">         Specifications of Morph Maternity Women's Nursing Bra    </h3> <table cellspacing="0" class="fk-specs-type2"> <tr> <th class="group-head" colspan="2">General Details<a class="see-more unitExt rmargin10 no-underline" href="javascript:void(0);" onclick="$(this).closest('.fk-specs-type2').toggleClass('expandedMore')" title="Expand">[+]</a><a class="hidden unitExt rmargin10 no-underline" href="javascript:void(0);" onclick="$(this).closest('.fk-specs-type2').toggleClass('expandedMore')" title="Collapse">[-]</a></th> </tr> <tr class="hidden"> <td class="specs-key">Ideal For</td> <td class="specs-value fk-data">Women's</td> </tr> <tr class="hidden"> <td class="specs-key">Pattern</td> <td class="specs-value fk-data">Solid</td> </tr> </table> <table cellspacing="0" class="fk-specs-type2"> <tr> <th class="group-head" colspan="2">Bra Details</th> </tr> <tr class=""> <td class="specs-key">Type</td> <td class="specs-value fk-data">Nursing Bra</td> </tr> <tr class=""> <td class="specs-key">Fabric</td> <td class="specs-value fk-data">Cotton</td> </tr> <tr class=""> <td class="specs-key">Style</td> <td class="specs-value fk-data">Panel Detail  Elastic Underbust</td> </tr> <tr class=""> <td class="specs-key">Straps</td> <td class="specs-value fk-data">Adjustable</td> </tr> <tr class=""> <td class="specs-key">Closure</td> <td class="specs-value fk-data">Hooks at Back</td> </tr> </table> <table cellspacing="0" class="fk-specs-type2"> <tr> <th class="group-head" colspan="2">Fabric Care</th> </tr> <tr class=""> <td class="specs-value fk-data" colspan="2">Hand Wash Cold  Low Iron  Do Not Tumble Dry  Do Not Bleach</td> </tr> </table> <table cellspacing="0" class="fk-specs-type2"> <tr> <th class="group-head" colspan="2">Additional Details<a class="see-more unitExt rmargin10 no-underline" href="javascript:void(0);" onclick="$(this).closest('.fk-specs-type2').toggleClass('expandedMore')" title="Expand">[+]</a><a class="hidden unitExt rmargin10 no-underline" href="javascript:void(0);" onclick="$(this).closest('.fk-specs-type2').toggleClass('expandedMore')" title="Collapse">[-]</a></th> </tr> <tr class="hidden"> <td class="specs-key"> </td> <td class="specs-value fk-data">The Cups are leak-proof   so no more embarrassing breast-milk leaks in public It is made of 100% breathable fabric  so very comfortable. Drop cup for easy nursing . Rear Clouser with Adjustable hook &amp; eye Breathable cotton fabric maximizies support &amp; comfort all day and night Discrete nursing clips  featuring one handed access.</td> </tr> </table> </div>,10:03:2014,None
LSTPANDHFQAWVF7ZQ872LBNZO,Morph Maternity Women's Maternity Panty,http://www.flipkart.com/womens-clothing?otracker=hp_nmenu_sub_women_0_Clothing,Rs. 234,Clothing,Maternity Wear,Roxy,http://img5a.flixcart.com/image/panty/q/8/7/mphs013colbl000light-blue-morph-maternity-l-400x400-imadkpgak5p2way3.jpeg,Rs. 275,Green  Light Blue,women,http://www.flipkart.com/morph-maternity-women-s-panty/p/itmdhtgxy4xhjhxr?pid=PANDHFQAWVF7ZQ87&srno=b_9&ref=c8297172-76d4-4a9c-94be-3ed88a3534f4,WS Retail,Morph Maternity Women's Maternity Panty - Buy Light Blue  Green Morph Maternity Women's Maternity Panty Online at Best Prices in India | Flipkart.com,Morph Maternity Women's Maternity Panty - Buy Light Blue  Green Morph Maternity Women's Maternity Panty For Only Rs. 275.0 Online in India. Shop Online For Apparels. Huge Collection of Branded Clothes Only at,['M'  'L'],<div class="item_left_column" id="description"> <h3 class="item_desc_title fk-uppercase">Morph Maternity Women's Maternity Panty         Price: Rs.234</h3> <div class="cls"></div> <div class="item_desc_text line"> <div style="float:right"> </div> <p>   Those crucial few weeks require the maximum care and these soft maternity panties from Morph Maternity provide you gentle support and fit. Made from pure cotton  these panties give you unmatched comfort throughout your expectant weeks.</p> </div> <div style="clear: both;"></div> </div>,<div class="item_left_column" id="specifications"> <h3 class="item_desc_title fk-uppercase">         Specifications of Morph Maternity Women's Maternity Panty    </h3> <table cellspacing="0" class="fk-specs-type2"> <tr> <th class="group-head" colspan="2">General Details<a class="see-more unitExt rmargin10 no-underline" href="javascript:void(0);" onclick="$(this).closest('.fk-specs-type2').toggleClass('expandedMore')" title="Expand">[+]</a><a class="hidden unitExt rmargin10 no-underline" href="javascript:void(0);" onclick="$(this).closest('.fk-specs-type2').toggleClass('expandedMore')" title="Collapse">[-]</a></th> </tr> <tr class="hidden"> <td class="specs-key">Ideal For</td> <td class="specs-value fk-data">Women's</td> </tr> <tr class="hidden"> <td class="specs-key">Occasion</td> <td class="specs-value fk-data">Casual</td> </tr> <tr class="hidden"> <td class="specs-key">Pattern</td> <td class="specs-value fk-data">Solid</td> </tr> </table> <table cellspacing="0" class="fk-specs-type2"> <tr> <th class="group-head" colspan="2">Panty Details</th> </tr> <tr class=""> <td class="specs-key">Type</td> <td class="specs-value fk-data">Maternity</td> </tr> <tr class=""> <td class="specs-key">Fabric</td> <td class="specs-value fk-data">100% Cotton</td> </tr> <tr class=""> <td class="specs-key">Design</td> <td class="specs-value fk-data">Logo Print Below Waistband</td> </tr> </table> <table cellspacing="0" class="fk-specs-type2"> <tr> <th class="group-head" colspan="2">Fabric Care</th> </tr> <tr class=""> <td class="specs-value fk-data" colspan="2">Do Not Wring  Machine Wash at 40°C  Do Not Bleach  Do Not Iron</td> </tr> </table> <table cellspacing="0" class="fk-specs-type2"> <tr> <th class="group-head" colspan="2">Additional Details<a class="see-more unitExt rmargin10 no-underline" href="javascript:void(0);" onclick="$(this).closest('.fk-specs-type2').toggleClass('expandedMore')" title="Expand">[+]</a><a class="hidden unitExt rmargin10 no-underline" href="javascript:void(0);" onclick="$(this).closest('.fk-specs-type2').toggleClass('expandedMore')" title="Collapse">[-]</a></th> </tr> <tr class="hidden"> <td class="specs-key"> </td> <td class="specs-value fk-data">Elasticated Waistband and Leghole</td> </tr> </table> </div>,10:03:2014,None
LSTNDNDQXFCZ8ZQG3CVVTIN86,Morph Maternity Women's Nighty,http://www.flipkart.com/womens-clothing?otracker=hp_nmenu_sub_women_0_Clothing,Rs. 1095,Clothing,Maternity Wear,Roxy,http://img5a.flixcart.com/image/night-dress-nighty/7/v/w/swsh800bpblu0-morph-maternity-s-400x400-imadryv89yz7e4ga.jpeg,Rs. 1095,Blue  White,women,http://www.flipkart.com/morph-maternity-women-s-nighty/p/itmdqxfd9fdxyepv?pid=NDNDQXFCZ8ZQG3CV&srno=b_11&ref=c8297172-76d4-4a9c-94be-3ed88a3534f4,WS Retail,Morph Maternity Women's Nighty - Buy Blue  White Morph Maternity Women's Nighty Online at Best Prices in India | Flipkart.com,Morph Maternity Women's Nighty - Buy Blue  White Morph Maternity Women's Nighty For Only Rs. 1095.0 Online in India. Shop Online For Apparels. Huge Collection of Branded Clothes Only at,['S'  'M'],None,<div class="item_left_column" id="specifications"> <h3 class="item_desc_title fk-uppercase">         Specifications of Morph Maternity Women's Nighty    </h3> <table cellspacing="0" class="fk-specs-type2"> <tr> <th class="group-head" colspan="2">General Details<a class="see-more unitExt rmargin10 no-underline" href="javascript:void(0);" onclick="$(this).closest('.fk-specs-type2').toggleClass('expandedMore')" title="Expand">[+]</a><a class="hidden unitExt rmargin10 no-underline" href="javascript:void(0);" onclick="$(this).closest('.fk-specs-type2').toggleClass('expandedMore')" title="Collapse">[-]</a></th> </tr> <tr class="hidden"> <td class="specs-key">Ideal For</td> <td class="specs-value fk-data">Women's</td> </tr> </table> <table cellspacing="0" class="fk-specs-type2"> <tr> <th class="group-head" colspan="2">Night Dress/Nighty Details</th> </tr> <tr class=""> <td class="specs-key">Type</td> <td class="specs-value fk-data">Nighty</td> </tr> <tr class=""> <td class="specs-key">Fabric</td> <td class="specs-value fk-data">100% Cotton</td> </tr> <tr class=""> <td class="specs-key">Fit</td> <td class="specs-value fk-data">Print Allover</td> </tr> <tr class=""> <td class="specs-key">Design</td> <td class="specs-value fk-data">Button Detail at Front  Pleat Detail at Front  Tie-up at Back</td> </tr> <tr class=""> <td class="specs-key">Style</td> <td class="specs-value fk-data">Printed</td> </tr> <tr class=""> <td class="specs-key">Sleeve</td> <td class="specs-value fk-data">Half Sleeve</td> </tr> </table> <table cellspacing="0" class="fk-specs-type2"> <tr> <th class="group-head" colspan="2">Cup Details</th> </tr> <tr class=""> <td class="specs-key">Cup Size</td> <td class="specs-value fk-data">Zipper Under the Bust</td> </tr> </table> <table cellspacing="0" class="fk-specs-type2"> <tr> <th class="group-head" colspan="2">Fabric Care</th> </tr> <tr class=""> <td class="specs-value fk-data" colspan="2">Tumble Dry Low  Do Not Bleach  Do Not Wring  Medium Iron  Wash Before Wearing  Hand or Machine Wash Cold with Like Colors</td> </tr> </table> <table cellspacing="0" class="fk-specs-type2"> <tr> <th class="group-head" colspan="2">Additional Details<a class="see-more unitExt rmargin10 no-underline" href="javascript:void(0);" onclick="$(this).closest('.fk-specs-type2').toggleClass('expandedMore')" title="Expand">[+]</a><a class="hidden unitExt rmargin10 no-underline" href="javascript:void(0);" onclick="$(this).closest('.fk-specs-type2').toggleClass('expandedMore')" title="Collapse">[-]</a></th> </tr> <tr class="hidden"> <td class="specs-key"> </td> <td class="specs-value fk-data">Square neck. Short sleeve. Horizontal Zipper for Nursing.Has Patent Pending Leak-Proof layer. Has a back tie that can be adjusted to fit.</td> </tr> </table> </div>,10:03:2014,None
LSTPANDHFQANF2EHVYZVHX5AW,Morph Maternity Women's Maternity Panty Panty,http://www.flipkart.com/womens-clothing?otracker=hp_nmenu_sub_women_0_Clothing,Rs. 275,Clothing,Maternity Wear,Roxy,http://img5a.flixcart.com/image/panty/v/y/z/mphs013colbl00light-blue-morph-maternity-xl-400x400-imadmv9wzpcvmmgg.jpeg,Rs. 275,Green  Light Blue,women,http://www.flipkart.com/morph-maternity-women-s-panty/p/itmdmwg7bnwwgb82?pid=PANDHFQANF2EHVYZ&srno=b_7&ref=c8297172-76d4-4a9c-94be-3ed88a3534f4,WS Retail,Morph Maternity Women's Maternity Panty Panty - Buy Light Blue Morph Maternity Women's Maternity Panty Panty Online at Best Prices in India | Flipkart.com,Morph Maternity Women's Maternity Panty Panty - Buy Light Blue Morph Maternity Women's Maternity Panty Panty For Only Rs. 275.0 Online in India. Shop Online For Apparels. Huge Collection of Branded Clothes Only at,[],<div class="item_left_column" id="description"> <h3 class="item_desc_title fk-uppercase">Morph Maternity Women's Maternity Panty Panty         Price: Rs.275</h3> <div class="cls"></div> <div class="item_desc_text line"> <div style="float:right"> </div> <p>   Let fashion collide with comfort in a piece of clothing no pregnant woman can do without. This Morph maternity panty is crafted with ideal fit and fabric for better care  every single minute. Light blue and necessary suit this panty just right.</p> </div> <div style="clear: both;"></div> </div>,<div class="item_left_column" id="specifications"> <h3 class="item_desc_title fk-uppercase">         Specifications of Morph Maternity Women's Maternity Panty Panty    </h3> <table cellspacing="0" class="fk-specs-type2"> <tr> <th class="group-head" colspan="2">General Details<a class="see-more unitExt rmargin10 no-underline" href="javascript:void(0);" onclick="$(this).closest('.fk-specs-type2').toggleClass('expandedMore')" title="Expand">[+]</a><a class="hidden unitExt rmargin10 no-underline" href="javascript:void(0);" onclick="$(this).closest('.fk-specs-type2').toggleClass('expandedMore')" title="Collapse">[-]</a></th> </tr> <tr class="hidden"> <td class="specs-key">Ideal For</td> <td class="specs-value fk-data">Women's</td> </tr> <tr class="hidden"> <td class="specs-key">Occasion</td> <td class="specs-value fk-data">Casual</td> </tr> <tr class="hidden"> <td class="specs-key">Pattern</td> <td class="specs-value fk-data">Solid</td> </tr> </table> <table cellspacing="0" class="fk-specs-type2"> <tr> <th class="group-head" colspan="2">Panty Details</th> </tr> <tr class=""> <td class="specs-key">Type</td> <td class="specs-value fk-data">Maternity Panty</td> </tr> <tr class=""> <td class="specs-key">Fabric</td> <td class="specs-value fk-data">100% Cotton</td> </tr> <tr class=""> <td class="specs-key">Design</td> <td class="specs-value fk-data">Logo Print at Front</td> </tr> </table> <table cellspacing="0" class="fk-specs-type2"> <tr> <th class="group-head" colspan="2">Fabric Care</th> </tr> <tr class=""> <td class="specs-value fk-data" colspan="2">Machine Wash at 40°C  Do Not Bleach  Do Not Iron  Do Not Wring</td> </tr> </table> <table cellspacing="0" class="fk-specs-type2"> <tr> <th class="group-head" colspan="2">Additional Details<a class="see-more unitExt rmargin10 no-underline" href="javascript:void(0);" onclick="$(this).closest('.fk-specs-type2').toggleClass('expandedMore')" title="Expand">[+]</a><a class="hidden unitExt rmargin10 no-underline" href="javascript:void(0);" onclick="$(this).closest('.fk-specs-type2').toggleClass('expandedMore')" title="Collapse">[-]</a></th> </tr> <tr class="hidden"> <td class="specs-key"> </td> <td class="specs-value fk-data">Elasticated Waistband and Leg Opening</td> </tr> </table> </div>,10:03:2014,None
LSTKTADQXFBVGDXWYQXAT9FAI,Morph Maternity Women's Kurta,http://www.flipkart.com/womens-clothing?otracker=hp_nmenu_sub_women_0_Clothing,Rs. 1299,Clothing,Maternity Wear,Roxy,http://img5a.flixcart.com/image/kurta/c/c/e/ekav776ikrbl0-morph-maternity-l-400x400-imadrcqauujqjvdy.jpeg,Rs. 1299,Blue,women,http://www.flipkart.com/morph-maternity-women-s-kurta/p/itmdqxfcmxzcs8yz?pid=KTADQXFBVGDXWYQX&srno=b_1&ref=c8297172-76d4-4a9c-94be-3ed88a3534f4,WS Retail,Morph Maternity Women's Kurta - Buy Blue Morph Maternity Women's Kurta Online at Best Prices in India | Flipkart.com,Morph Maternity Women's Kurta - Buy Blue Morph Maternity Women's Kurta For Only Rs. 1299.0 Online in India. Shop Online For Apparels. Huge Collection of Branded Clothes Only at,['S'  'M'  'L'],None,<div class="item_left_column" id="specifications"> <h3 class="item_desc_title fk-uppercase">         Specifications of Morph Maternity Women's Kurta    </h3> <table cellspacing="0" class="fk-specs-type2"> <tr> <th class="group-head" colspan="2">General Details<a class="see-more unitExt rmargin10 no-underline" href="javascript:void(0);" onclick="$(this).closest('.fk-specs-type2').toggleClass('expandedMore')" title="Expand">[+]</a><a class="hidden unitExt rmargin10 no-underline" href="javascript:void(0);" onclick="$(this).closest('.fk-specs-type2').toggleClass('expandedMore')" title="Collapse">[-]</a></th> </tr> <tr class="hidden"> <td class="specs-key">Ideal For</td> <td class="specs-value fk-data">Women's</td> </tr> </table> <table cellspacing="0" class="fk-specs-type2"> <tr> <th class="group-head" colspan="2">Kurta Details</th> </tr> <tr class=""> <td class="specs-key">Fabric</td> <td class="specs-value fk-data">100% Cotton</td> </tr> </table> <table cellspacing="0" class="fk-specs-type2"> <tr> <th class="group-head" colspan="2">Additional Details<a class="see-more unitExt rmargin10 no-underline" href="javascript:void(0);" onclick="$(this).closest('.fk-specs-type2').toggleClass('expandedMore')" title="Expand">[+]</a><a class="hidden unitExt rmargin10 no-underline" href="javascript:void(0);" onclick="$(this).closest('.fk-specs-type2').toggleClass('expandedMore')" title="Collapse">[-]</a></th> </tr> <tr class="hidden"> <td class="specs-key">Style Code</td> <td class="specs-value fk-data">EKAV776IKRBL0</td> </tr> </table> </div>,10:03:2014,None
