LSTTRODQX66FECV3GDHOSMQXR,Morph Maternity Women's Trousers,http://www.flipkart.com/womens-clothing?otracker=hp_nmenu_sub_women_0_Clothing,Rs. 1047,Clothing,Maternity Wear,Roxy,http://img5a.flixcart.com/image/trouser/y/v/s/cfps828sblk0-morph-maternity-l-400x400-imadrch3e3stxuus.jpeg,Rs. 1495,Black,women,http://www.flipkart.com/morph-maternity-women-s-trousers/p/itmdqx69mx7betxh?pid=TRODQX66FECV3GDH&srno=b_28&ref=0647a713-fdd4-4716-a689-b2eaab182478,WS Retail,Morph Maternity Women's Trousers - Buy Black Morph Maternity Women's Trousers Online at Best Prices in India | Flipkart.com,Morph Maternity Women's Trousers - Buy Black Morph Maternity Women's Trousers For Only Rs. 1495.0 Online in India. Shop Online For Apparels. Huge Collection of Branded Clothes Only at,['S'  'M'  'L'],None,<div class="item_left_column" id="specifications"> <h3 class="item_desc_title fk-uppercase">         Specifications of Morph Maternity Women's Trousers    </h3> <table cellspacing="0" class="fk-specs-type2"> <tr> <th class="group-head" colspan="2">General Details<a class="see-more unitExt rmargin10 no-underline" href="javascript:void(0);" onclick="$(this).closest('.fk-specs-type2').toggleClass('expandedMore')" title="Expand">[+]</a><a class="hidden unitExt rmargin10 no-underline" href="javascript:void(0);" onclick="$(this).closest('.fk-specs-type2').toggleClass('expandedMore')" title="Collapse">[-]</a></th> </tr> <tr class="hidden"> <td class="specs-key">Ideal For</td> <td class="specs-value fk-data">Women's</td> </tr> <tr class="hidden"> <td class="specs-key">Occasion</td> <td class="specs-value fk-data">Casual</td> </tr> </table> <table cellspacing="0" class="fk-specs-type2"> <tr> <th class="group-head" colspan="2">Trouser Details</th> </tr> <tr class=""> <td class="specs-key">Fabric</td> <td class="specs-value fk-data">Cotton Polyester</td> </tr> </table> <table cellspacing="0" class="fk-specs-type2"> <tr> <th class="group-head" colspan="2">Fabric Care</th> </tr> <tr class=""> <td class="specs-value fk-data" colspan="2">Hand or Machine Wash in Normal Cycle</td> </tr> </table> <table cellspacing="0" class="fk-specs-type2"> <tr> <th class="group-head" colspan="2">Additional Details<a class="see-more unitExt rmargin10 no-underline" href="javascript:void(0);" onclick="$(this).closest('.fk-specs-type2').toggleClass('expandedMore')" title="Expand">[+]</a><a class="hidden unitExt rmargin10 no-underline" href="javascript:void(0);" onclick="$(this).closest('.fk-specs-type2').toggleClass('expandedMore')" title="Collapse">[-]</a></th> </tr> <tr class="hidden"> <td class="specs-key">Style Code</td> <td class="specs-value fk-data">CFPS828SBLK0</td> </tr> <tr class="hidden"> <td class="specs-key">Other Details</td> <td class="specs-value fk-data">Straight fit Side belly panel Super streatch adjustable elastic</td> </tr> </table> </div>,10:03:2014,None
LSTSWDDQXFCYVFJEYEXIO6APV,Morph Maternity,http://www.flipkart.com/womens-clothing?otracker=hp_nmenu_sub_women_0_Clothing,Rs. 2699,Clothing,Maternity Wear,Roxy,http://img6a.flixcart.com/image/salwar-kurta-dupatta/n/m/m/sksh797cpwht0-morph-maternity-l-400x400-imadrcqampvfghue.jpeg,Rs. 2699,White,women,http://www.flipkart.com/morph-maternity/p/itmdqxfdaangc8gu?pid=SWDDQXFCYVFJEYEX&srno=b_30&ref=0647a713-fdd4-4716-a689-b2eaab182478,WS Retail,Morph Maternity - Buy White Morph Maternity Online at Best Prices in India | Flipkart.com,Morph Maternity - Buy White Morph Maternity For Only Rs. 2699.0 Online in India. Shop Online For Apparels. Huge Collection of Branded Clothes Only at,['S'  'M'  'L'],None,<div class="item_left_column" id="specifications"> <h3 class="item_desc_title fk-uppercase">         Specifications of Morph Maternity    </h3> <table cellspacing="0" class="fk-specs-type2"> <tr> <th class="group-head" colspan="2">General Details<a class="see-more unitExt rmargin10 no-underline" href="javascript:void(0);" onclick="$(this).closest('.fk-specs-type2').toggleClass('expandedMore')" title="Expand">[+]</a><a class="hidden unitExt rmargin10 no-underline" href="javascript:void(0);" onclick="$(this).closest('.fk-specs-type2').toggleClass('expandedMore')" title="Collapse">[-]</a></th> </tr> <tr class="hidden"> <td class="specs-key">Ideal For</td> <td class="specs-value fk-data">Women's</td> </tr> <tr class="hidden"> <td class="specs-key">Occasion</td> <td class="specs-value fk-data">Casual</td> </tr> </table> <table cellspacing="0" class="fk-specs-type2"> <tr> <th class="group-head" colspan="2">Salwar Kurta Dupatta Details</th> </tr> <tr class=""> <td class="specs-key">Kurta Fabric</td> <td class="specs-value fk-data">100% Cotton</td> </tr> <tr class=""> <td class="specs-key">Number of Contents in Sales Package</td> <td class="specs-value fk-data">3</td> </tr> </table> <table cellspacing="0" class="fk-specs-type2"> <tr> <th class="group-head" colspan="2">Additional Details<a class="see-more unitExt rmargin10 no-underline" href="javascript:void(0);" onclick="$(this).closest('.fk-specs-type2').toggleClass('expandedMore')" title="Expand">[+]</a><a class="hidden unitExt rmargin10 no-underline" href="javascript:void(0);" onclick="$(this).closest('.fk-specs-type2').toggleClass('expandedMore')" title="Collapse">[-]</a></th> </tr> <tr class="hidden"> <td class="specs-key"> </td> <td class="specs-value fk-data">Square Neck with detailing 3/4th Sleeve Salwar Kameez &amp; Dupatta Set. Has Patent Pending Leak-Proof layer Has a back tie that can be adjusted to fit Horizontal Zipper for Nursing</td> </tr> </table> </div>,10:03:2014,None
LSTNDNDQXFCWWNGDSSNX4NPXN,Morph Maternity Women's,http://www.flipkart.com/womens-clothing?otracker=hp_nmenu_sub_women_0_Clothing,Rs. 1299,Clothing,Maternity Wear,Roxy,http://img6a.flixcart.com/image/night-dress-nighty/k/z/n/swlg736japnk0-morph-maternity-l-400x400-imadrcqaq7zvatz2.jpeg,Rs. 1299,Pink,women,http://www.flipkart.com/morph-maternity-women-s/p/itmdqxfdggyb2hrd?pid=NDNDQXFCWWNGDSSN&srno=b_19&ref=0647a713-fdd4-4716-a689-b2eaab182478,WS Retail,Morph Maternity Women's - Buy Pink Morph Maternity Women's Online at Best Prices in India | Flipkart.com,Morph Maternity Women's - Buy Pink Morph Maternity Women's For Only Rs. 1299.0 Online in India. Shop Online For Apparels. Huge Collection of Branded Clothes Only at,['S'  'M'],None,<div class="item_left_column" id="specifications"> <h3 class="item_desc_title fk-uppercase">         Specifications of Morph Maternity Women's    </h3> <table cellspacing="0" class="fk-specs-type2"> <tr> <th class="group-head" colspan="2">General Details<a class="see-more unitExt rmargin10 no-underline" href="javascript:void(0);" onclick="$(this).closest('.fk-specs-type2').toggleClass('expandedMore')" title="Expand">[+]</a><a class="hidden unitExt rmargin10 no-underline" href="javascript:void(0);" onclick="$(this).closest('.fk-specs-type2').toggleClass('expandedMore')" title="Collapse">[-]</a></th> </tr> <tr class="hidden"> <td class="specs-key">Ideal For</td> <td class="specs-value fk-data">Women's</td> </tr> </table> <table cellspacing="0" class="fk-specs-type2"> <tr> <th class="group-head" colspan="2">Night Dress/Nighty Details</th> </tr> <tr class=""> <td class="specs-key">Fabric</td> <td class="specs-value fk-data">100% Cotton</td> </tr> </table> <table cellspacing="0" class="fk-specs-type2"> <tr> <th class="group-head" colspan="2">Fabric Care</th> </tr> <tr class=""> <td class="specs-value fk-data" colspan="2">Hand or Machine Wash in Normal Cycle</td> </tr> </table> <table cellspacing="0" class="fk-specs-type2"> <tr> <th class="group-head" colspan="2">Additional Details<a class="see-more unitExt rmargin10 no-underline" href="javascript:void(0);" onclick="$(this).closest('.fk-specs-type2').toggleClass('expandedMore')" title="Expand">[+]</a><a class="hidden unitExt rmargin10 no-underline" href="javascript:void(0);" onclick="$(this).closest('.fk-specs-type2').toggleClass('expandedMore')" title="Collapse">[-]</a></th> </tr> <tr class="hidden"> <td class="specs-key"> </td> <td class="specs-value fk-data">Square neck.. 3/4th Puffed sleeve. Vertical Zipper for Nursing.Has Patent Pending Leak-Proof layer. Has a back tie that can be adjusted to fit.</td> </tr> </table> </div>,10:03:2014,None
LSTTRODQX66NGKZHGKJG0C42J,Morph Maternity Women's Trousers,http://www.flipkart.com/womens-clothing?otracker=hp_nmenu_sub_women_0_Clothing,Rs. 1395,Clothing,Maternity Wear,Roxy,http://img5a.flixcart.com/image/trouser/g/k/j/cphs844pldgy0-morph-maternity-l-400x400-imadrch5wqnqsz44.jpeg,Rs. 1395,Grey,women,http://www.flipkart.com/morph-maternity-women-s-trousers/p/itmdqx69gy8rewsj?pid=TRODQX66NGKZHGKJ&srno=b_18&ref=0647a713-fdd4-4716-a689-b2eaab182478,WS Retail,Morph Maternity Women's Trousers - Buy Grey Morph Maternity Women's Trousers Online at Best Prices in India | Flipkart.com,Morph Maternity Women's Trousers - Buy Grey Morph Maternity Women's Trousers For Only Rs. 1395.0 Online in India. Shop Online For Apparels. Huge Collection of Branded Clothes Only at,['S'  'M'  'L'],None,<div class="item_left_column" id="specifications"> <h3 class="item_desc_title fk-uppercase">         Specifications of Morph Maternity Women's Trousers    </h3> <table cellspacing="0" class="fk-specs-type2"> <tr> <th class="group-head" colspan="2">General Details<a class="see-more unitExt rmargin10 no-underline" href="javascript:void(0);" onclick="$(this).closest('.fk-specs-type2').toggleClass('expandedMore')" title="Expand">[+]</a><a class="hidden unitExt rmargin10 no-underline" href="javascript:void(0);" onclick="$(this).closest('.fk-specs-type2').toggleClass('expandedMore')" title="Collapse">[-]</a></th> </tr> <tr class="hidden"> <td class="specs-key">Ideal For</td> <td class="specs-value fk-data">Women's</td> </tr> <tr class="hidden"> <td class="specs-key">Occasion</td> <td class="specs-value fk-data">Casual</td> </tr> </table> <table cellspacing="0" class="fk-specs-type2"> <tr> <th class="group-head" colspan="2">Trouser Details</th> </tr> <tr class=""> <td class="specs-key">Fabric</td> <td class="specs-value fk-data">Polyester</td> </tr> </table> <table cellspacing="0" class="fk-specs-type2"> <tr> <th class="group-head" colspan="2">Fabric Care</th> </tr> <tr class=""> <td class="specs-value fk-data" colspan="2">Hand or Machine Wash in Normal Cycle</td> </tr> </table> <table cellspacing="0" class="fk-specs-type2"> <tr> <th class="group-head" colspan="2">Additional Details<a class="see-more unitExt rmargin10 no-underline" href="javascript:void(0);" onclick="$(this).closest('.fk-specs-type2').toggleClass('expandedMore')" title="Expand">[+]</a><a class="hidden unitExt rmargin10 no-underline" href="javascript:void(0);" onclick="$(this).closest('.fk-specs-type2').toggleClass('expandedMore')" title="Collapse">[-]</a></th> </tr> <tr class="hidden"> <td class="specs-key">Style Code</td> <td class="specs-value fk-data">CPHS844PLDGY0</td> </tr> <tr class="hidden"> <td class="specs-key">Other Details</td> <td class="specs-value fk-data">Straight fit High belly panel stretches over the belly providing great support</td> </tr> </table> </div>,10:03:2014,None
LSTTOPDQX5GVZ6K3FCJMWAMSL,Morph Maternity Casual Women's Top,http://www.flipkart.com/womens-clothing?otracker=hp_nmenu_sub_women_0_Clothing,Rs. 522,Clothing,Maternity Wear,Roxy,http://img5a.flixcart.com/image/top/b/z/z/cktp708ckdpk0-morph-maternity-l-400x400-imadrch7trsaha9c.jpeg,Rs. 745,Dark Pink,women,http://www.flipkart.com/morph-maternity-casual-women-s-top/p/itmdqx5h2hz6xqph?pid=TOPDQX5GVZ6K3FCJ&srno=b_26&ref=0647a713-fdd4-4716-a689-b2eaab182478,WS Retail,Morph Maternity Casual Women's Top - Buy Dark Pink Morph Maternity Casual Women's Top Online at Best Prices in India | Flipkart.com,Morph Maternity Casual Women's Top - Buy Dark Pink Morph Maternity Casual Women's Top For Only Rs. 745.0 Online in India. Shop Online For Apparels. Huge Collection of Branded Clothes Only at,['S'  'M'  'L'],None,<div class="item_left_column" id="specifications"> <h3 class="item_desc_title fk-uppercase">         Specifications of Morph Maternity Casual Women's Top    </h3> <table cellspacing="0" class="fk-specs-type2"> <tr> <th class="group-head" colspan="2">General Details<a class="see-more unitExt rmargin10 no-underline" href="javascript:void(0);" onclick="$(this).closest('.fk-specs-type2').toggleClass('expandedMore')" title="Expand">[+]</a><a class="hidden unitExt rmargin10 no-underline" href="javascript:void(0);" onclick="$(this).closest('.fk-specs-type2').toggleClass('expandedMore')" title="Collapse">[-]</a></th> </tr> <tr class="hidden"> <td class="specs-key">Ideal For</td> <td class="specs-value fk-data">Women's</td> </tr> <tr class="hidden"> <td class="specs-key">Occasion</td> <td class="specs-value fk-data">Casual</td> </tr> </table> <table cellspacing="0" class="fk-specs-type2"> <tr> <th class="group-head" colspan="2">Top Details</th> </tr> <tr class=""> <td class="specs-key">Fabric</td> <td class="specs-value fk-data">Knit Cotton</td> </tr> </table> <table cellspacing="0" class="fk-specs-type2"> <tr> <th class="group-head" colspan="2">Fabric Care</th> </tr> <tr class=""> <td class="specs-value fk-data" colspan="2">Hand or Machine Wash in Normal Cycle</td> </tr> </table> <table cellspacing="0" class="fk-specs-type2"> <tr> <th class="group-head" colspan="2">Additional Details<a class="see-more unitExt rmargin10 no-underline" href="javascript:void(0);" onclick="$(this).closest('.fk-specs-type2').toggleClass('expandedMore')" title="Expand">[+]</a><a class="hidden unitExt rmargin10 no-underline" href="javascript:void(0);" onclick="$(this).closest('.fk-specs-type2').toggleClass('expandedMore')" title="Collapse">[-]</a></th> </tr> <tr class="hidden"> <td class="specs-key"> </td> <td class="specs-value fk-data">Collared neck Conceled verticle nursing Short sleeve Mock layered</td> </tr> </table> </div>,10:03:2014,None
LSTPANDHFQA7VWNB2YE4AHHMB,Morph Maternity Women's Maternity Panty Panty,http://www.flipkart.com/womens-clothing?otracker=hp_nmenu_sub_women_0_Clothing,Rs. 275,Clothing,Maternity Wear,Roxy,http://img6a.flixcart.com/image/panty/p/f/u/mphs011colpk000light-pink-morph-maternity-m-400x400-imadkpngjyukkfpk.jpeg,Rs. 275,Light Pink,women,http://www.flipkart.com/morph-maternity-women-s-panty/p/itmdhtgxutzehnty?pid=PANDHFQA7VWNB2YE&srno=b_3&ref=d7257db0-7f2d-42f0-a538-2750dd2e9037,WS Retail,Morph Maternity Women's Maternity Panty Panty - Buy Pink Morph Maternity Women's Maternity Panty Panty Online at Best Prices in India | Flipkart.com,Morph Maternity Women's Maternity Panty Panty - Buy Pink Morph Maternity Women's Maternity Panty Panty For Only Rs. 275.0 Online in India. Shop Online For Apparels. Huge Collection of Branded Clothes Only at,['M'  'L'],None,<div class="item_left_column" id="specifications"> <h3 class="item_desc_title fk-uppercase">         Specifications of Morph Maternity Women's Maternity Panty Panty    </h3> <table cellspacing="0" class="fk-specs-type2"> <tr> <th class="group-head" colspan="2">General Details<a class="see-more unitExt rmargin10 no-underline" href="javascript:void(0);" onclick="$(this).closest('.fk-specs-type2').toggleClass('expandedMore')" title="Expand">[+]</a><a class="hidden unitExt rmargin10 no-underline" href="javascript:void(0);" onclick="$(this).closest('.fk-specs-type2').toggleClass('expandedMore')" title="Collapse">[-]</a></th> </tr> <tr class="hidden"> <td class="specs-key">Ideal For</td> <td class="specs-value fk-data">Women's</td> </tr> <tr class="hidden"> <td class="specs-key">Pattern</td> <td class="specs-value fk-data">Solid</td> </tr> </table> <table cellspacing="0" class="fk-specs-type2"> <tr> <th class="group-head" colspan="2">Panty Details</th> </tr> <tr class=""> <td class="specs-key">Type</td> <td class="specs-value fk-data">Maternity Panty</td> </tr> <tr class=""> <td class="specs-key">Fabric</td> <td class="specs-value fk-data">100% Cotton</td> </tr> <tr class=""> <td class="specs-key">Design</td> <td class="specs-value fk-data">Logo Print at Front Below Waistband</td> </tr> </table> <table cellspacing="0" class="fk-specs-type2"> <tr> <th class="group-head" colspan="2">Fabric Care</th> </tr> <tr class=""> <td class="specs-value fk-data" colspan="2">Machine Wash at 50°C  Do Not Wring  Do Not Iron  Do Not Bleach</td> </tr> </table> <table cellspacing="0" class="fk-specs-type2"> <tr> <th class="group-head" colspan="2">Additional Details<a class="see-more unitExt rmargin10 no-underline" href="javascript:void(0);" onclick="$(this).closest('.fk-specs-type2').toggleClass('expandedMore')" title="Expand">[+]</a><a class="hidden unitExt rmargin10 no-underline" href="javascript:void(0);" onclick="$(this).closest('.fk-specs-type2').toggleClass('expandedMore')" title="Collapse">[-]</a></th> </tr> <tr class="hidden"> <td class="specs-key"> </td> <td class="specs-value fk-data">Elasticated Waistband and Leghole</td> </tr> </table> </div>,10:03:2014,None
LSTTOPDQX5G4XBJR7RPGLLQU1,Morph Maternity Casual Women's Top,http://www.flipkart.com/womens-clothing?otracker=hp_nmenu_sub_women_0_Clothing,Rs. 557,Clothing,Maternity Wear,Roxy,http://img5a.flixcart.com/image/top/g/g/z/cktp621kcgry0-morph-maternity-l-400x400-imadrch3gzwuhmzh.jpeg,Rs. 795,Grey,women,http://www.flipkart.com/morph-maternity-casual-women-s-top/p/itmdqx5hqnm4sd9h?pid=TOPDQX5G4XBJR7RP&srno=b_20&ref=0647a713-fdd4-4716-a689-b2eaab182478,WS Retail,Morph Maternity Casual Women's Top - Buy Grey Morph Maternity Casual Women's Top Online at Best Prices in India | Flipkart.com,Morph Maternity Casual Women's Top - Buy Grey Morph Maternity Casual Women's Top For Only Rs. 795.0 Online in India. Shop Online For Apparels. Huge Collection of Branded Clothes Only at,['S'  'L'],None,<div class="item_left_column" id="specifications"> <h3 class="item_desc_title fk-uppercase">         Specifications of Morph Maternity Casual Women's Top    </h3> <table cellspacing="0" class="fk-specs-type2"> <tr> <th class="group-head" colspan="2">General Details<a class="see-more unitExt rmargin10 no-underline" href="javascript:void(0);" onclick="$(this).closest('.fk-specs-type2').toggleClass('expandedMore')" title="Expand">[+]</a><a class="hidden unitExt rmargin10 no-underline" href="javascript:void(0);" onclick="$(this).closest('.fk-specs-type2').toggleClass('expandedMore')" title="Collapse">[-]</a></th> </tr> <tr class="hidden"> <td class="specs-key">Ideal For</td> <td class="specs-value fk-data">Women's</td> </tr> <tr class="hidden"> <td class="specs-key">Occasion</td> <td class="specs-value fk-data">Casual</td> </tr> </table> <table cellspacing="0" class="fk-specs-type2"> <tr> <th class="group-head" colspan="2">Top Details</th> </tr> <tr class=""> <td class="specs-key">Fabric</td> <td class="specs-value fk-data">Knit Cotton</td> </tr> </table> <table cellspacing="0" class="fk-specs-type2"> <tr> <th class="group-head" colspan="2">Fabric Care</th> </tr> <tr class=""> <td class="specs-value fk-data" colspan="2">Hand or Machine Wash in Normal Cycle</td> </tr> </table> <table cellspacing="0" class="fk-specs-type2"> <tr> <th class="group-head" colspan="2">Additional Details<a class="see-more unitExt rmargin10 no-underline" href="javascript:void(0);" onclick="$(this).closest('.fk-specs-type2').toggleClass('expandedMore')" title="Expand">[+]</a><a class="hidden unitExt rmargin10 no-underline" href="javascript:void(0);" onclick="$(this).closest('.fk-specs-type2').toggleClass('expandedMore')" title="Collapse">[-]</a></th> </tr> <tr class="hidden"> <td class="specs-key"> </td> <td class="specs-value fk-data">Ruffle U neck 3/4th Elastic sleeve. Ruffle band waist with draw string</td> </tr> </table> </div>,10:03:2014,None
LSTKTADQXFBE5KC3HPKIFRSEV,Morph Maternity Women's Kurta,http://www.flipkart.com/womens-clothing?otracker=hp_nmenu_sub_women_0_Clothing,Rs. 1395,Clothing,Maternity Wear,Roxy,http://img5a.flixcart.com/image/kurta/n/y/h/ekav865ikorg0-morph-maternity-l-400x400-imadrch6ffpxzpgv.jpeg,Rs. 1395,Orange,women,http://www.flipkart.com/morph-maternity-women-s-kurta/p/itmdqxfcmtz7zszq?pid=KTADQXFBE5KC3HPK&srno=b_7&ref=d7257db0-7f2d-42f0-a538-2750dd2e9037,WS Retail,Morph Maternity Women's Kurta - Buy Orange Morph Maternity Women's Kurta Online at Best Prices in India | Flipkart.com,Morph Maternity Women's Kurta - Buy Orange Morph Maternity Women's Kurta For Only Rs. 1395.0 Online in India. Shop Online For Apparels. Huge Collection of Branded Clothes Only at,['S'  'M'  'L'],None,<div class="item_left_column" id="specifications"> <h3 class="item_desc_title fk-uppercase">         Specifications of Morph Maternity Women's Kurta    </h3> <table cellspacing="0" class="fk-specs-type2"> <tr> <th class="group-head" colspan="2">General Details<a class="see-more unitExt rmargin10 no-underline" href="javascript:void(0);" onclick="$(this).closest('.fk-specs-type2').toggleClass('expandedMore')" title="Expand">[+]</a><a class="hidden unitExt rmargin10 no-underline" href="javascript:void(0);" onclick="$(this).closest('.fk-specs-type2').toggleClass('expandedMore')" title="Collapse">[-]</a></th> </tr> <tr class="hidden"> <td class="specs-key">Ideal For</td> <td class="specs-value fk-data">Women's</td> </tr> </table> <table cellspacing="0" class="fk-specs-type2"> <tr> <th class="group-head" colspan="2">Kurta Details</th> </tr> <tr class=""> <td class="specs-key">Fabric</td> <td class="specs-value fk-data">100% Cotton</td> </tr> </table> <table cellspacing="0" class="fk-specs-type2"> <tr> <th class="group-head" colspan="2">Additional Details<a class="see-more unitExt rmargin10 no-underline" href="javascript:void(0);" onclick="$(this).closest('.fk-specs-type2').toggleClass('expandedMore')" title="Expand">[+]</a><a class="hidden unitExt rmargin10 no-underline" href="javascript:void(0);" onclick="$(this).closest('.fk-specs-type2').toggleClass('expandedMore')" title="Collapse">[-]</a></th> </tr> <tr class="hidden"> <td class="specs-key">Style Code</td> <td class="specs-value fk-data">EKAV865IKORG0</td> </tr> </table> </div>,10:03:2014,None
LSTBRADQWZPMEDM5HCH75BTWO,Morph Maternity Women's Nursing Bra,http://www.flipkart.com/womens-clothing?otracker=hp_nmenu_sub_women_0_Clothing,Rs. 395,Clothing,Maternity Wear,Roxy,http://img5a.flixcart.com/image/bra/z/s/z/nurb21coblk-morph-maternity-32b-400x400-imads7wep2a9yupn.jpeg,Rs. 395,Black,women,http://www.flipkart.com/morph-maternity-women-s-nursing-bra/p/itmdqwzpct6nxrjz?pid=BRADQWZPMEDM5HCH&srno=b_29&ref=0647a713-fdd4-4716-a689-b2eaab182478,WS Retail,Morph Maternity Women's Nursing Bra - Buy Black Morph Maternity Women's Nursing Bra Online at Best Prices in India | Flipkart.com,Morph Maternity Women's Nursing Bra - Buy Black Morph Maternity Women's Nursing Bra For Only Rs. 395.0 Online in India. Shop Online For Apparels. Huge Collection of Branded Clothes Only at,['32B'  '34B'],None,<div class="item_left_column" id="specifications"> <h3 class="item_desc_title fk-uppercase">         Specifications of Morph Maternity Women's Nursing Bra    </h3> <table cellspacing="0" class="fk-specs-type2"> <tr> <th class="group-head" colspan="2">General Details<a class="see-more unitExt rmargin10 no-underline" href="javascript:void(0);" onclick="$(this).closest('.fk-specs-type2').toggleClass('expandedMore')" title="Expand">[+]</a><a class="hidden unitExt rmargin10 no-underline" href="javascript:void(0);" onclick="$(this).closest('.fk-specs-type2').toggleClass('expandedMore')" title="Collapse">[-]</a></th> </tr> <tr class="hidden"> <td class="specs-key">Ideal For</td> <td class="specs-value fk-data">Women's</td> </tr> <tr class="hidden"> <td class="specs-key">Pattern</td> <td class="specs-value fk-data">Solid</td> </tr> </table> <table cellspacing="0" class="fk-specs-type2"> <tr> <th class="group-head" colspan="2">Bra Details</th> </tr> <tr class=""> <td class="specs-key">Type</td> <td class="specs-value fk-data">Nursing Bra</td> </tr> <tr class=""> <td class="specs-key">Fabric</td> <td class="specs-value fk-data">Cotton</td> </tr> <tr class=""> <td class="specs-key">Style</td> <td class="specs-value fk-data">Elastic Underbust  Panel Detail</td> </tr> <tr class=""> <td class="specs-key">Straps</td> <td class="specs-value fk-data">Adjustable</td> </tr> <tr class=""> <td class="specs-key">Closure</td> <td class="specs-value fk-data">Hooks at Back</td> </tr> </table> <table cellspacing="0" class="fk-specs-type2"> <tr> <th class="group-head" colspan="2">Fabric Care</th> </tr> <tr class=""> <td class="specs-value fk-data" colspan="2">Low Iron  Hand Wash Cold  Do Not Tumble Dry  Do Not Bleach</td> </tr> </table> <table cellspacing="0" class="fk-specs-type2"> <tr> <th class="group-head" colspan="2">Additional Details<a class="see-more unitExt rmargin10 no-underline" href="javascript:void(0);" onclick="$(this).closest('.fk-specs-type2').toggleClass('expandedMore')" title="Expand">[+]</a><a class="hidden unitExt rmargin10 no-underline" href="javascript:void(0);" onclick="$(this).closest('.fk-specs-type2').toggleClass('expandedMore')" title="Collapse">[-]</a></th> </tr> <tr class="hidden"> <td class="specs-key"> </td> <td class="specs-value fk-data">Adjustable elastic shoulder straps Drop cup for easy nursing . Rear Clouser with Adjustable hook &amp; eye Breathable cotton fabric maximizies support &amp; comfort all day and night Discrete nursing clips  featuring one handed access.</td> </tr> </table> </div>,10:03:2014,None
