LSTPANDHFQAN2XSJFFJNH2LID,Morph Maternity Women's Maternity Panty Panty,http://www.flipkart.com/womens-clothing?otracker=hp_nmenu_sub_women_0_Clothing,Rs. 275,Clothing,Maternity Wear,Roxy,http://img5a.flixcart.com/image/panty/f/f/j/mphs011colpk00light-pink-morph-maternity-xl-400x400-imadmv9xzjjqfjgh.jpeg,Rs. 275,Light Pink,women,http://www.flipkart.com/morph-maternity-women-s-panty/p/itmdmwg7ufrydh8m?pid=PANDHFQAN2XSJFFJ&srno=b_11&ref=d7257db0-7f2d-42f0-a538-2750dd2e9037,WS Retail,Morph Maternity Women's Maternity Panty Panty - Buy Light Pink Morph Maternity Women's Maternity Panty Panty Online at Best Prices in India | Flipkart.com,Morph Maternity Women's Maternity Panty Panty - Buy Light Pink Morph Maternity Women's Maternity Panty Panty For Only Rs. 275.0 Online in India. Shop Online For Apparels. Huge Collection of Branded Clothes Only at,[],<div class="item_left_column" id="description"> <h3 class="item_desc_title fk-uppercase">Morph Maternity Women's Maternity Panty Panty         Price: Rs.275</h3> <div class="cls"></div> <div class="item_desc_text line"> <div style="float:right"> </div> <p style="text-align: justify;">   Morph Maternity designs inners for pregnant women that gives them comfort. Crafted from <strong>100 per cent cotton</strong> the panty is a must-have in your wardrobe. The elasticated waistband and leg openings give you a good grip.</p> </div> <div style="clear: both;"></div> </div>,<div class="item_left_column" id="specifications"> <h3 class="item_desc_title fk-uppercase">         Specifications of Morph Maternity Women's Maternity Panty Panty    </h3> <table cellspacing="0" class="fk-specs-type2"> <tr> <th class="group-head" colspan="2">General Details<a class="see-more unitExt rmargin10 no-underline" href="javascript:void(0);" onclick="$(this).closest('.fk-specs-type2').toggleClass('expandedMore')" title="Expand">[+]</a><a class="hidden unitExt rmargin10 no-underline" href="javascript:void(0);" onclick="$(this).closest('.fk-specs-type2').toggleClass('expandedMore')" title="Collapse">[-]</a></th> </tr> <tr class="hidden"> <td class="specs-key">Ideal For</td> <td class="specs-value fk-data">Women's</td> </tr> <tr class="hidden"> <td class="specs-key">Occasion</td> <td class="specs-value fk-data">Casual</td> </tr> <tr class="hidden"> <td class="specs-key">Pattern</td> <td class="specs-value fk-data">Solid</td> </tr> </table> <table cellspacing="0" class="fk-specs-type2"> <tr> <th class="group-head" colspan="2">Panty Details</th> </tr> <tr class=""> <td class="specs-key">Type</td> <td class="specs-value fk-data">Maternity Panty</td> </tr> <tr class=""> <td class="specs-key">Fabric</td> <td class="specs-value fk-data">100% Cotton</td> </tr> <tr class=""> <td class="specs-key">Design</td> <td class="specs-value fk-data">Logo Print at Front</td> </tr> </table> <table cellspacing="0" class="fk-specs-type2"> <tr> <th class="group-head" colspan="2">Fabric Care</th> </tr> <tr class=""> <td class="specs-value fk-data" colspan="2">Machine Wash at 50°C  Do Not Iron  Do Not Bleach  Do Not Wring</td> </tr> </table> <table cellspacing="0" class="fk-specs-type2"> <tr> <th class="group-head" colspan="2">Additional Details<a class="see-more unitExt rmargin10 no-underline" href="javascript:void(0);" onclick="$(this).closest('.fk-specs-type2').toggleClass('expandedMore')" title="Expand">[+]</a><a class="hidden unitExt rmargin10 no-underline" href="javascript:void(0);" onclick="$(this).closest('.fk-specs-type2').toggleClass('expandedMore')" title="Collapse">[-]</a></th> </tr> <tr class="hidden"> <td class="specs-key"> </td> <td class="specs-value fk-data">Elasticated Waistband and Leg Opening</td> </tr> </table> </div>,10:03:2014,None
LSTTRODQX66FECV3GDHOSMQXR,Morph Maternity Women's Trousers,http://www.flipkart.com/womens-clothing?otracker=hp_nmenu_sub_women_0_Clothing,Rs. 1047,Clothing,Maternity Wear,Roxy,http://img5a.flixcart.com/image/trouser/y/v/s/cfps828sblk0-morph-maternity-l-400x400-imadrch3e3stxuus.jpeg,Rs. 1495,Black,women,http://www.flipkart.com/morph-maternity-women-s-trousers/p/itmdqx69mx7betxh?pid=TRODQX66FECV3GDH&srno=b_29&ref=6f4b0b62-5ca3-4ff6-96a5-34c2eb4a7755,WS Retail,Morph Maternity Women's Trousers - Buy Black Morph Maternity Women's Trousers Online at Best Prices in India | Flipkart.com,Morph Maternity Women's Trousers - Buy Black Morph Maternity Women's Trousers For Only Rs. 1495.0 Online in India. Shop Online For Apparels. Huge Collection of Branded Clothes Only at,['S'  'M'  'L'],None,<div class="item_left_column" id="specifications"> <h3 class="item_desc_title fk-uppercase">         Specifications of Morph Maternity Women's Trousers    </h3> <table cellspacing="0" class="fk-specs-type2"> <tr> <th class="group-head" colspan="2">General Details<a class="see-more unitExt rmargin10 no-underline" href="javascript:void(0);" onclick="$(this).closest('.fk-specs-type2').toggleClass('expandedMore')" title="Expand">[+]</a><a class="hidden unitExt rmargin10 no-underline" href="javascript:void(0);" onclick="$(this).closest('.fk-specs-type2').toggleClass('expandedMore')" title="Collapse">[-]</a></th> </tr> <tr class="hidden"> <td class="specs-key">Ideal For</td> <td class="specs-value fk-data">Women's</td> </tr> <tr class="hidden"> <td class="specs-key">Occasion</td> <td class="specs-value fk-data">Casual</td> </tr> </table> <table cellspacing="0" class="fk-specs-type2"> <tr> <th class="group-head" colspan="2">Trouser Details</th> </tr> <tr class=""> <td class="specs-key">Fabric</td> <td class="specs-value fk-data">Cotton Polyester</td> </tr> </table> <table cellspacing="0" class="fk-specs-type2"> <tr> <th class="group-head" colspan="2">Fabric Care</th> </tr> <tr class=""> <td class="specs-value fk-data" colspan="2">Hand or Machine Wash in Normal Cycle</td> </tr> </table> <table cellspacing="0" class="fk-specs-type2"> <tr> <th class="group-head" colspan="2">Additional Details<a class="see-more unitExt rmargin10 no-underline" href="javascript:void(0);" onclick="$(this).closest('.fk-specs-type2').toggleClass('expandedMore')" title="Expand">[+]</a><a class="hidden unitExt rmargin10 no-underline" href="javascript:void(0);" onclick="$(this).closest('.fk-specs-type2').toggleClass('expandedMore')" title="Collapse">[-]</a></th> </tr> <tr class="hidden"> <td class="specs-key">Style Code</td> <td class="specs-value fk-data">CFPS828SBLK0</td> </tr> <tr class="hidden"> <td class="specs-key">Other Details</td> <td class="specs-value fk-data">Straight fit Side belly panel Super streatch adjustable elastic</td> </tr> </table> </div>,10:03:2014,None
LSTSWDDQXFCYVFJEYEXIO6APV,Morph Maternity,http://www.flipkart.com/womens-clothing?otracker=hp_nmenu_sub_women_0_Clothing,Rs. 2699,Clothing,Maternity Wear,Roxy,http://img6a.flixcart.com/image/salwar-kurta-dupatta/n/m/m/sksh797cpwht0-morph-maternity-l-400x400-imadrcqampvfghue.jpeg,Rs. 2699,White,women,http://www.flipkart.com/morph-maternity/p/itmdqxfdaangc8gu?pid=SWDDQXFCYVFJEYEX&srno=b_31&ref=6a1b5919-ff36-4e02-a4a4-90aab4a61f6d,WS Retail,Morph Maternity - Buy White Morph Maternity Online at Best Prices in India | Flipkart.com,Morph Maternity - Buy White Morph Maternity For Only Rs. 2699.0 Online in India. Shop Online For Apparels. Huge Collection of Branded Clothes Only at,['S'  'M'  'L'],None,<div class="item_left_column" id="specifications"> <h3 class="item_desc_title fk-uppercase">         Specifications of Morph Maternity    </h3> <table cellspacing="0" class="fk-specs-type2"> <tr> <th class="group-head" colspan="2">General Details<a class="see-more unitExt rmargin10 no-underline" href="javascript:void(0);" onclick="$(this).closest('.fk-specs-type2').toggleClass('expandedMore')" title="Expand">[+]</a><a class="hidden unitExt rmargin10 no-underline" href="javascript:void(0);" onclick="$(this).closest('.fk-specs-type2').toggleClass('expandedMore')" title="Collapse">[-]</a></th> </tr> <tr class="hidden"> <td class="specs-key">Ideal For</td> <td class="specs-value fk-data">Women's</td> </tr> <tr class="hidden"> <td class="specs-key">Occasion</td> <td class="specs-value fk-data">Casual</td> </tr> </table> <table cellspacing="0" class="fk-specs-type2"> <tr> <th class="group-head" colspan="2">Salwar Kurta Dupatta Details</th> </tr> <tr class=""> <td class="specs-key">Kurta Fabric</td> <td class="specs-value fk-data">100% Cotton</td> </tr> <tr class=""> <td class="specs-key">Number of Contents in Sales Package</td> <td class="specs-value fk-data">3</td> </tr> </table> <table cellspacing="0" class="fk-specs-type2"> <tr> <th class="group-head" colspan="2">Additional Details<a class="see-more unitExt rmargin10 no-underline" href="javascript:void(0);" onclick="$(this).closest('.fk-specs-type2').toggleClass('expandedMore')" title="Expand">[+]</a><a class="hidden unitExt rmargin10 no-underline" href="javascript:void(0);" onclick="$(this).closest('.fk-specs-type2').toggleClass('expandedMore')" title="Collapse">[-]</a></th> </tr> <tr class="hidden"> <td class="specs-key"> </td> <td class="specs-value fk-data">Square Neck with detailing 3/4th Sleeve Salwar Kameez &amp; Dupatta Set. Has Patent Pending Leak-Proof layer Has a back tie that can be adjusted to fit Horizontal Zipper for Nursing</td> </tr> </table> </div>,10:03:2014,None
LSTNDNDQXFCEPU5HGZQ6VBDOP,Morph Maternity Women's,http://www.flipkart.com/womens-clothing?otracker=hp_nmenu_sub_women_0_Clothing,Rs. 1195,Clothing,Maternity Wear,Roxy,http://img6a.flixcart.com/image/night-dress-nighty/c/f/h/swsg853knlgr0-morph-maternity-s-400x400-imadrcqbwqnwtzn9.jpeg,Rs. 1195,Green,women,http://www.flipkart.com/morph-maternity-women-s/p/itmdqxfdhyuhrfbg?pid=NDNDQXFCEPU5HGZQ&srno=b_34&ref=6a1b5919-ff36-4e02-a4a4-90aab4a61f6d,WS Retail,Morph Maternity Women's - Buy Green Morph Maternity Women's Online at Best Prices in India | Flipkart.com,Morph Maternity Women's - Buy Green Morph Maternity Women's For Only Rs. 1195.0 Online in India. Shop Online For Apparels. Huge Collection of Branded Clothes Only at,['S'],None,<div class="item_left_column" id="specifications"> <h3 class="item_desc_title fk-uppercase">         Specifications of Morph Maternity Women's    </h3> <table cellspacing="0" class="fk-specs-type2"> <tr> <th class="group-head" colspan="2">General Details<a class="see-more unitExt rmargin10 no-underline" href="javascript:void(0);" onclick="$(this).closest('.fk-specs-type2').toggleClass('expandedMore')" title="Expand">[+]</a><a class="hidden unitExt rmargin10 no-underline" href="javascript:void(0);" onclick="$(this).closest('.fk-specs-type2').toggleClass('expandedMore')" title="Collapse">[-]</a></th> </tr> <tr class="hidden"> <td class="specs-key">Ideal For</td> <td class="specs-value fk-data">Women's</td> </tr> </table> <table cellspacing="0" class="fk-specs-type2"> <tr> <th class="group-head" colspan="2">Night Dress/Nighty Details</th> </tr> <tr class=""> <td class="specs-key">Fabric</td> <td class="specs-value fk-data">Knit Cotton</td> </tr> </table> <table cellspacing="0" class="fk-specs-type2"> <tr> <th class="group-head" colspan="2">Fabric Care</th> </tr> <tr class=""> <td class="specs-value fk-data" colspan="2">Hand or Machine Wash in Normal Cycle</td> </tr> </table> <table cellspacing="0" class="fk-specs-type2"> <tr> <th class="group-head" colspan="2">Additional Details<a class="see-more unitExt rmargin10 no-underline" href="javascript:void(0);" onclick="$(this).closest('.fk-specs-type2').toggleClass('expandedMore')" title="Expand">[+]</a><a class="hidden unitExt rmargin10 no-underline" href="javascript:void(0);" onclick="$(this).closest('.fk-specs-type2').toggleClass('expandedMore')" title="Collapse">[-]</a></th> </tr> <tr class="hidden"> <td class="specs-key"> </td> <td class="specs-value fk-data">U Neck Short sleeve Floral printed layer Pull Up nursing with vertical opening. Fits great during and post pregnancy</td> </tr> </table> </div>,10:03:2014,None
LSTDREDP2CKBFBEPGPKQDJH5I,Roxy Women's A-line Dress,http://www.flipkart.com/womens-clothing?otracker=hp_nmenu_sub_women_0_Clothing,Rs. 1397,Clothing,Maternity Wear,Roxy,http://img6a.flixcart.com/image/dress/g/p/k/xmwdr054-sky-blue-roxy-l-400x400-imadp34gugh5n7ez.jpeg,Rs. 2795,Red,women,http://www.flipkart.com/roxy-women-s-a-line-dress/p/itmdp2chv7mveydu?pid=DREDP2CKBFBEPGPK&srno=b_36&ref=6a1b5919-ff36-4e02-a4a4-90aab4a61f6d,Fashionara,Roxy Women's A-line Dress - Buy Sky blue Roxy Women's A-line Dress Online at Best Prices in India | Flipkart.com,Roxy Women's A-line Dress - Buy Sky blue Roxy Women's A-line Dress For Only Rs. 0.0 Online in India. Shop Online For Apparels. Huge Collection of Branded Clothes Only at,['XS'  'S'],<div class="item_left_column" id="description"> <h3 class="item_desc_title fk-uppercase">Roxy Women's A-line Dress         Price: Rs.1397</h3> <div class="cls"></div> <div class="item_desc_text line"> <div style="float:right"> </div>                         Be that pretty lady  in this adorable knotted strap dress. With iket print all over and comfortable fabric  it's "Oh. So lovely. " Flaunt it and sashay in to a dance club. Look gorgeous as you add on pearl earrings with sleek sandals. You are sure to find many admirers who would like to dance with you.        </div> <div style="clear: both;"></div> </div>,<div class="item_left_column" id="specifications"> <h3 class="item_desc_title fk-uppercase">         Specifications of Roxy Women's A-line Dress    </h3> <table cellspacing="0" class="fk-specs-type2"> <tr> <th class="group-head" colspan="2">General Details<a class="see-more unitExt rmargin10 no-underline" href="javascript:void(0);" onclick="$(this).closest('.fk-specs-type2').toggleClass('expandedMore')" title="Expand">[+]</a><a class="hidden unitExt rmargin10 no-underline" href="javascript:void(0);" onclick="$(this).closest('.fk-specs-type2').toggleClass('expandedMore')" title="Collapse">[-]</a></th> </tr> <tr class="hidden"> <td class="specs-key">Ideal For</td> <td class="specs-value fk-data">Women's</td> </tr> <tr class="hidden"> <td class="specs-key">Occasion</td> <td class="specs-value fk-data">Casual  Party</td> </tr> </table> <table cellspacing="0" class="fk-specs-type2"> <tr> <th class="group-head" colspan="2">Dress Details</th> </tr> <tr class=""> <td class="specs-key">Type</td> <td class="specs-value fk-data">A-line</td> </tr> </table> <table cellspacing="0" class="fk-specs-type2"> <tr> <th class="group-head" colspan="2">In The Box</th> </tr> <tr class=""> <td class="specs-key"> </td> <td class="specs-value fk-data">Dress</td> </tr> </table> </div>,10:03:2014,None
LSTDREDP2CK6QHQQEZCCPEMQA,Roxy Women's A-line Dress,http://www.flipkart.com/womens-clothing?otracker=hp_nmenu_sub_women_0_Clothing,Rs. 1397,Clothing,Maternity Wear,Roxy,http://img5a.flixcart.com/image/dress/g/x/j/xmwdr054-red-roxy-xs-400x400-imadp348czanheke.jpeg,Rs. 2795,Red,women,http://www.flipkart.com/roxy-women-s-a-line-dress/p/itmdp2chempmsyk7?pid=DREDP2CK6QHQQEZC&srno=b_35&ref=6a1b5919-ff36-4e02-a4a4-90aab4a61f6d,Fashionara,Roxy Women's A-line Dress - Buy Red Roxy Women's A-line Dress Online at Best Prices in India | Flipkart.com,Roxy Women's A-line Dress - Buy Red Roxy Women's A-line Dress For Only Rs. 0.0 Online in India. Shop Online For Apparels. Huge Collection of Branded Clothes Only at,['XS'  'S'],<div class="item_left_column" id="description"> <h3 class="item_desc_title fk-uppercase">Roxy Women's A-line Dress         Price: Rs.1397</h3> <div class="cls"></div> <div class="item_desc_text line"> <div style="float:right"> </div>                         Be that pretty lady  in this adorable knotted strap dress. With ikat print all over and comfortable fabric  it's a fab noon dress. Flaunt it and sashay in to a pub. Look gorgeous as you add on pearl earrings with sleek sandals. You are sure to find many admirers who would like to buy you a drink. . .        </div> <div style="clear: both;"></div> </div>,<div class="item_left_column" id="specifications"> <h3 class="item_desc_title fk-uppercase">         Specifications of Roxy Women's A-line Dress    </h3> <table cellspacing="0" class="fk-specs-type2"> <tr> <th class="group-head" colspan="2">General Details<a class="see-more unitExt rmargin10 no-underline" href="javascript:void(0);" onclick="$(this).closest('.fk-specs-type2').toggleClass('expandedMore')" title="Expand">[+]</a><a class="hidden unitExt rmargin10 no-underline" href="javascript:void(0);" onclick="$(this).closest('.fk-specs-type2').toggleClass('expandedMore')" title="Collapse">[-]</a></th> </tr> <tr class="hidden"> <td class="specs-key">Ideal For</td> <td class="specs-value fk-data">Women's</td> </tr> <tr class="hidden"> <td class="specs-key">Occasion</td> <td class="specs-value fk-data">Party  Casual</td> </tr> </table> <table cellspacing="0" class="fk-specs-type2"> <tr> <th class="group-head" colspan="2">Dress Details</th> </tr> <tr class=""> <td class="specs-key">Type</td> <td class="specs-value fk-data">A-line</td> </tr> </table> <table cellspacing="0" class="fk-specs-type2"> <tr> <th class="group-head" colspan="2">In The Box</th> </tr> <tr class=""> <td class="specs-key"> </td> <td class="specs-value fk-data">Dress</td> </tr> </table> </div>,10:03:2014,None
LSTBRADQWZPHJQYGBU6H6IWLX,Morph Maternity Women's Bra,http://www.flipkart.com/womens-clothing?otracker=hp_nmenu_sub_women_0_Clothing,Rs. 595,Clothing,Maternity Wear,Roxy,http://img5a.flixcart.com/image/bra/j/e/n/lpnb023cowht-morph-maternity-32b-400x400-imadrcqatzmuy6vm.jpeg,Rs. 595,White,women,http://www.flipkart.com/morph-maternity-women-s-bra/p/itmdqwzpmh3pfeuh?pid=BRADQWZPHJQYGBU6&srno=b_28&ref=6f4b0b62-5ca3-4ff6-96a5-34c2eb4a7755,WS Retail,Morph Maternity Women's Bra - Buy White Morph Maternity Women's Bra Online at Best Prices in India | Flipkart.com,Morph Maternity Women's Bra - Buy White Morph Maternity Women's Bra For Only Rs. 595.0 Online in India. Shop Online For Apparels. Huge Collection of Branded Clothes Only at,['32B'  '34B'  '36B'],None,<div class="item_left_column" id="specifications"> <h3 class="item_desc_title fk-uppercase">         Specifications of Morph Maternity Women's Bra    </h3> <table cellspacing="0" class="fk-specs-type2"> <tr> <th class="group-head" colspan="2">General Details<a class="see-more unitExt rmargin10 no-underline" href="javascript:void(0);" onclick="$(this).closest('.fk-specs-type2').toggleClass('expandedMore')" title="Expand">[+]</a><a class="hidden unitExt rmargin10 no-underline" href="javascript:void(0);" onclick="$(this).closest('.fk-specs-type2').toggleClass('expandedMore')" title="Collapse">[-]</a></th> </tr> <tr class="hidden"> <td class="specs-key">Ideal For</td> <td class="specs-value fk-data">Women's</td> </tr> </table> <table cellspacing="0" class="fk-specs-type2"> <tr> <th class="group-head" colspan="2">Bra Details</th> </tr> <tr class=""> <td class="specs-key">Fabric</td> <td class="specs-value fk-data">Cotton</td> </tr> </table> <table cellspacing="0" class="fk-specs-type2"> <tr> <th class="group-head" colspan="2">Fabric Care</th> </tr> <tr class=""> <td class="specs-value fk-data" colspan="2">Hand or Machine Wash in Normal Cycle</td> </tr> </table> <table cellspacing="0" class="fk-specs-type2"> <tr> <th class="group-head" colspan="2">Additional Details<a class="see-more unitExt rmargin10 no-underline" href="javascript:void(0);" onclick="$(this).closest('.fk-specs-type2').toggleClass('expandedMore')" title="Expand">[+]</a><a class="hidden unitExt rmargin10 no-underline" href="javascript:void(0);" onclick="$(this).closest('.fk-specs-type2').toggleClass('expandedMore')" title="Collapse">[-]</a></th> </tr> <tr class="hidden"> <td class="specs-key"> </td> <td class="specs-value fk-data">The Cups are leak-proof   so no more embarrassing breast-milk leaks in public It is made of 100% breathable fabric  so very comfortable. Drop cup for easy nursing . Rear Clouser with Adjustable hook &amp; eye Breathable cotton fabric maximizies support &amp; comfort all day and night Discrete nursing clips  featuring one handed access.</td> </tr> </table> </div>,10:03:2014,None
LSTCPIDQWZHGKVQF7QHX14WVD,Morph Maternity Women's Capri,http://www.flipkart.com/womens-clothing?otracker=hp_nmenu_sub_women_0_Clothing,Rs. 977,Clothing,Maternity Wear,Roxy,http://img6a.flixcart.com/image/capri/7/q/h/cchs860clmbl0-morph-maternity-m-400x400-imadrch3w6vfwgx3.jpeg,Rs. 1395,Blue,women,http://www.flipkart.com/morph-maternity-women-s-capri/p/itmdqwzgwxsukwf9?pid=CPIDQWZHGKVQF7QH&srno=b_17&ref=6f4b0b62-5ca3-4ff6-96a5-34c2eb4a7755,WS Retail,Morph Maternity Women's Capri - Buy Blue Morph Maternity Women's Capri Online at Best Prices in India | Flipkart.com,Morph Maternity Women's Capri - Buy Blue Morph Maternity Women's Capri For Only Rs. 1395.0 Online in India. Shop Online For Apparels. Huge Collection of Branded Clothes Only at,['S'  'M'  'L'  'XL'],None,<div class="item_left_column" id="specifications"> <h3 class="item_desc_title fk-uppercase">         Specifications of Morph Maternity Women's Capri    </h3> <table cellspacing="0" class="fk-specs-type2"> <tr> <th class="group-head" colspan="2">General Details<a class="see-more unitExt rmargin10 no-underline" href="javascript:void(0);" onclick="$(this).closest('.fk-specs-type2').toggleClass('expandedMore')" title="Expand">[+]</a><a class="hidden unitExt rmargin10 no-underline" href="javascript:void(0);" onclick="$(this).closest('.fk-specs-type2').toggleClass('expandedMore')" title="Collapse">[-]</a></th> </tr> <tr class="hidden"> <td class="specs-key">Ideal For</td> <td class="specs-value fk-data">Women's</td> </tr> <tr class="hidden"> <td class="specs-key">Occasion</td> <td class="specs-value fk-data">Casual</td> </tr> </table> <table cellspacing="0" class="fk-specs-type2"> <tr> <th class="group-head" colspan="2">Capri Details</th> </tr> <tr class=""> <td class="specs-key">Fabric</td> <td class="specs-value fk-data">Denim</td> </tr> </table> <table cellspacing="0" class="fk-specs-type2"> <tr> <th class="group-head" colspan="2">Fabric Care</th> </tr> <tr class=""> <td class="specs-value fk-data" colspan="2">Hand or Machine Wash in Normal Cycle</td> </tr> </table> <table cellspacing="0" class="fk-specs-type2"> <tr> <th class="group-head" colspan="2">Additional Details<a class="see-more unitExt rmargin10 no-underline" href="javascript:void(0);" onclick="$(this).closest('.fk-specs-type2').toggleClass('expandedMore')" title="Expand">[+]</a><a class="hidden unitExt rmargin10 no-underline" href="javascript:void(0);" onclick="$(this).closest('.fk-specs-type2').toggleClass('expandedMore')" title="Collapse">[-]</a></th> </tr> <tr class="hidden"> <td class="specs-key"> </td> <td class="specs-value fk-data">Light blue denim capri High belly panel provides maximum support Back signature pocket with embroidery</td> </tr> </table> </div>,10:03:2014,None
LSTTUNDP2BXTYQ4Q5GH5ZUCTI,Roxy Women's Tunic,http://www.flipkart.com/womens-clothing?otracker=hp_nmenu_sub_women_0_Clothing,Rs. 1846,Clothing,Maternity Wear,Roxy,http://img5a.flixcart.com/image/tunic/x/s/z/xmwdr123green-f-roxy-s-400x400-imadp2zv2wgwmqyv.jpeg,Rs. 3695,Aqua,women,http://www.flipkart.com/roxy-women-s-tunic/p/itmdp2bxejugjhbx?pid=TUNDP2BXTYQ4Q5GH&srno=b_41&ref=6a1b5919-ff36-4e02-a4a4-90aab4a61f6d,Fashionara,Roxy Women's Tunic - Buy Aqua Roxy Women's Tunic Online at Best Prices in India | Flipkart.com,Roxy Women's Tunic - Buy Aqua Roxy Women's Tunic For Only Rs. 0.0 Online in India. Shop Online For Apparels. Huge Collection of Branded Clothes Only at,['XS'  'S'  'M'],<div class="item_left_column" id="description"> <h3 class="item_desc_title fk-uppercase">Roxy Women's Tunic         Price: Rs.1846</h3> <div class="cls"></div> <div class="item_desc_text line"> <div style="float:right"> </div>                         A smart tunic in a blend of plaids. Lovely combination of colours adds on charm. The contrast colours add a playful touch to your dressing. Pair it with leggings and heels and put on your your shades for stylish daytime look.        </div> <div style="clear: both;"></div> </div>,<div class="item_left_column" id="specifications"> <h3 class="item_desc_title fk-uppercase">         Specifications of Roxy Women's Tunic    </h3> <table cellspacing="0" class="fk-specs-type2"> <tr> <th class="group-head" colspan="2">General Details<a class="see-more unitExt rmargin10 no-underline" href="javascript:void(0);" onclick="$(this).closest('.fk-specs-type2').toggleClass('expandedMore')" title="Expand">[+]</a><a class="hidden unitExt rmargin10 no-underline" href="javascript:void(0);" onclick="$(this).closest('.fk-specs-type2').toggleClass('expandedMore')" title="Collapse">[-]</a></th> </tr> <tr class="hidden"> <td class="specs-key">Ideal For</td> <td class="specs-value fk-data">Women's</td> </tr> <tr class="hidden"> <td class="specs-key">Occasion</td> <td class="specs-value fk-data">Casual</td> </tr> </table> <table cellspacing="0" class="fk-specs-type2"> <tr> <th class="group-head" colspan="2">Tunic Details</th> </tr> <tr class=""> <td class="specs-key">Fabric</td> <td class="specs-value fk-data">Cotton</td> </tr> <tr class=""> <td class="specs-key">Sleeve</td> <td class="specs-value fk-data">Half Sleeve</td> </tr> </table> <table cellspacing="0" class="fk-specs-type2"> <tr> <th class="group-head" colspan="2">In the Box</th> </tr> <tr class=""> <td class="specs-key"> </td> <td class="specs-value fk-data">Tunic</td> </tr> </table> </div>,10:03:2014,None
