LSTPERDZSH6R7ZKSKHCFGSZZH,WPC Renne Natural Tantalizing - 103 Eau de Toilette  -  50 ml,http://www.flipkart.com/lifestyle/fragrances-for-women?otracker=hp_nmenu_sub_women_0_Fragrances,Rs. 249,Fragrances,Perfumes,WPC,http://img6a.flixcart.com/image/perfume/k/h/c/eau-de-toilette-women-wpc-50-renne-natural-tantalizing-103-400x400-imadzxugsbztrneu.jpeg,Rs. 249,None,women,http://www.flipkart.com/wpc-renne-natural-tantalizing-103-eau-de-toilette-50-ml/p/itmdthjcyn6zdeew?pid=PERDZSH6R7ZKSKHC&srno=b_1&ref=06e7d129-d414-4d20-a909-6b159656df3d,Angel-Fragrance,WPC Renne Natural Tantalizing - 103 Eau de Toilette - 50 ml - Price in India  Buy WPC Renne Natural Tantalizing - 103 Eau de Toilette - 50 ml Online In India  Reviews  Ratings & Features | Flipkart.com,Flipkart.com: Buy WPC Renne Natural Tantalizing - 103 Eau de Toilette - 50 ml for Rs. 0.0 from Flipkart.com. - Lowest Prices  Only Genuine Products  30 Day Replacement Guarantee  Free Shipping. Cash On,[],<div class="item_left_column" id="description"> <h3 class="item_desc_title fk-uppercase">WPC Renne Natural Tantalizing - 103 Eau de Toilette  -  50 ml (For Women)         Price: Rs.249</h3> <div class="cls"></div> <div class="item_desc_text line"> <div style="float:right"> </div>                         This perfume is exotic version of French brand Edhardy. This exciting creation opens with tantalizing notes of tropical mango  wild strawberries and red grapefruit. The heart of the aroma introduces mystic black freesia  while the base follows with amber and rose accords. A luscious fragrance keeps you craving for more.        </div> <div style="clear: both;"></div> </div>,<div class="item_left_column" id="specifications"> <h3 class="item_desc_title fk-uppercase">         Specifications of WPC Renne Natural Tantalizing - 103 Eau de Toilette  -  50 ml (For Women)    </h3> <table cellspacing="0" class="fk-specs-type2"> <tr> <th class="group-head" colspan="2">In the Box</th> </tr> <tr class=""> <td class="specs-value fk-data" colspan="2">Perfume</td> </tr> </table> <table cellspacing="0" class="fk-specs-type2"> <tr> <th class="group-head" colspan="2">Fragrance Traits</th> </tr> <tr class=""> <td class="specs-key">Ideal For</td> <td class="specs-value fk-data">Women</td> </tr> <tr class=""> <td class="specs-key">Fragrance Segment</td> <td class="specs-value fk-data">Mass Premium</td> </tr> <tr class=""> <td class="specs-key">Fragrance Classification</td> <td class="specs-value fk-data">Eau de Toilette</td> </tr> <tr class=""> <td class="specs-key">Quantity</td> <td class="specs-value fk-data">50 ml</td> </tr> <tr class=""> <td class="specs-key">Limited Edition</td> <td class="specs-value fk-data">No</td> </tr> </table> </div>,10:03:2014,None
LSTPERDZSH6UVWQFA2YDGL8SP,WPC Preety Rich Romantic Eau de Parfum  -  50 ml,http://www.flipkart.com/lifestyle/fragrances-for-women?otracker=hp_nmenu_sub_women_0_Fragrances,Rs. 399,Fragrances,Perfumes,WPC,http://img5a.flixcart.com/image/perfume/a/2/y/eau-de-parfum-women-wpc-50-preety-rich-romantic-400x400-imadzxuhpkvtkahq.jpeg,Rs. 399,None,women,http://www.flipkart.com/wpc-preety-rich-romantic-eau-de-parfum-50-ml/p/itmdtauhsfzjhwnh?pid=PERDZSH6UVWQFA2Y&srno=b_11&ref=06e7d129-d414-4d20-a909-6b159656df3d,Little-India,WPC Preety Rich Romantic Eau de Parfum - 50 ml - Price in India  Buy WPC Preety Rich Romantic Eau de Parfum - 50 ml Online In India  Reviews  Ratings & Features | Flipkart.com,Flipkart.com: Buy WPC Preety Rich Romantic Eau de Parfum - 50 ml for Rs. 0.0 from Flipkart.com. - Lowest Prices  Only Genuine Products  30 Day Replacement Guarantee  Free Shipping. Cash On,[],<div class="item_left_column" id="description"> <h3 class="item_desc_title fk-uppercase">WPC Preety Rich Romantic Eau de Parfum  -  50 ml (For Women)         Price: Rs.399</h3> <div class="cls"></div> <div class="item_desc_text line"> <div style="float:right"> </div>                         Pretty is a ultra-feminine fresh  rich and romantic bouquet of flowers. Transparent orange blossom with heady hyacinth opens the composition. The intensive floral heart blends sweet rose  delicate white lily and magical jasmine. The base is composed of comforting amber  warm sandalwood with a tender touch of mysterious incense.        </div> <div style="clear: both;"></div> </div>,<div class="item_left_column" id="specifications"> <h3 class="item_desc_title fk-uppercase">         Specifications of WPC Preety Rich Romantic Eau de Parfum  -  50 ml (For Women)    </h3> <table cellspacing="0" class="fk-specs-type2"> <tr> <th class="group-head" colspan="2">In the Box</th> </tr> <tr class=""> <td class="specs-value fk-data" colspan="2">Perfume</td> </tr> </table> <table cellspacing="0" class="fk-specs-type2"> <tr> <th class="group-head" colspan="2">Fragrance Traits</th> </tr> <tr class=""> <td class="specs-key">Ideal For</td> <td class="specs-value fk-data">Women</td> </tr> <tr class=""> <td class="specs-key">Fragrance Segment</td> <td class="specs-value fk-data">Mass Premium</td> </tr> <tr class=""> <td class="specs-key">Fragrance Classification</td> <td class="specs-value fk-data">Eau de Parfum</td> </tr> <tr class=""> <td class="specs-key">Quantity</td> <td class="specs-value fk-data">50 ml</td> </tr> <tr class=""> <td class="specs-key">Limited Edition</td> <td class="specs-value fk-data">No</td> </tr> </table> </div>,10:03:2014,None
LSTPERDZSH6RWRYUSNHU1OKVI,WPC Kenzo Bouquet of Red Flower - 101 Eau de Toilette  -  50 ml,http://www.flipkart.com/lifestyle/fragrances-for-women?otracker=hp_nmenu_sub_women_0_Fragrances,Rs. 249,Fragrances,Perfumes,WPC,http://img5a.flixcart.com/image/perfume/s/n/h/eau-de-toilette-women-wpc-50-kenzo-bouquet-of-red-flower-101-400x400-imadzxuhuagz9m2a.jpeg,Rs. 249,None,women,http://www.flipkart.com/wpc-kenzo-bouquet-red-flower-101-eau-de-toilette-50-ml/p/itmdtauhgzjj4zfz?pid=PERDZSH6RWRYUSNH&srno=b_9&ref=06e7d129-d414-4d20-a909-6b159656df3d,Angel-Fragrance,WPC Kenzo Bouquet of Red Flower - 101 Eau de Toilette - 50 ml - Price in India  Buy WPC Kenzo Bouquet of Red Flower - 101 Eau de Toilette - 50 ml Online In India  Reviews  Ratings & Features | Flipkart.com,Flipkart.com: Buy WPC Kenzo Bouquet of Red Flower - 101 Eau de Toilette - 50 ml for Rs. 0.0 from Flipkart.com. - Lowest Prices  Only Genuine Products  30 Day Replacement Guarantee  Free Shipping. Cash On,[],<div class="item_left_column" id="description"> <h3 class="item_desc_title fk-uppercase">WPC Kenzo Bouquet of Red Flower - 101 Eau de Toilette  -  50 ml (For Women)         Price: Rs.249</h3> <div class="cls"></div> <div class="item_desc_text line"> <div style="float:right"> </div>                         This perfume is exotic version of French brand Kenzo. It would remind you of the freshly cut bouquet of flowers gifted by your beloved  of lovely vibrant colours and scents  frangipani  cherry blossoms  Thanaka wood  incense  rice  vanilla and white tea. Very suitable for everyday casual wear. Your guy would swoon over you for that vibrant lovely fragrance.        </div> <div style="clear: both;"></div> </div>,<div class="item_left_column" id="specifications"> <h3 class="item_desc_title fk-uppercase">         Specifications of WPC Kenzo Bouquet of Red Flower - 101 Eau de Toilette  -  50 ml (For Women)    </h3> <table cellspacing="0" class="fk-specs-type2"> <tr> <th class="group-head" colspan="2">In the Box</th> </tr> <tr class=""> <td class="specs-value fk-data" colspan="2">Perfume</td> </tr> </table> <table cellspacing="0" class="fk-specs-type2"> <tr> <th class="group-head" colspan="2">Fragrance Traits</th> </tr> <tr class=""> <td class="specs-key">Ideal For</td> <td class="specs-value fk-data">Women</td> </tr> <tr class=""> <td class="specs-key">Fragrance Segment</td> <td class="specs-value fk-data">Mass Premium</td> </tr> <tr class=""> <td class="specs-key">Fragrance Classification</td> <td class="specs-value fk-data">Eau de Toilette</td> </tr> <tr class=""> <td class="specs-key">Quantity</td> <td class="specs-value fk-data">50 ml</td> </tr> <tr class=""> <td class="specs-key">Limited Edition</td> <td class="specs-value fk-data">No</td> </tr> </table> </div>,10:03:2014,None
LSTPERDZSH66XZTDSWBQ43RMI,WPC Flower Shower French - 105 Eau de Toilette  -  50 ml,http://www.flipkart.com/lifestyle/fragrances-for-women?otracker=hp_nmenu_sub_women_0_Fragrances,Rs. 249,Fragrances,Perfumes,WPC,http://img5a.flixcart.com/image/perfume/s/w/b/eau-de-toilette-women-wpc-50-flower-shower-french-105-400x400-imadzxuhwpsgzsmk.jpeg,Rs. 249,None,women,http://www.flipkart.com/wpc-flower-shower-french-105-eau-de-toilette-50-ml/p/itmdthjcbrzbeawn?pid=PERDZSH66XZTDSWB&srno=b_15&ref=06e7d129-d414-4d20-a909-6b159656df3d,Angel-Fragrance,WPC Flower Shower French - 105 Eau de Toilette - 50 ml - Price in India  Buy WPC Flower Shower French - 105 Eau de Toilette - 50 ml Online In India  Reviews  Ratings & Features | Flipkart.com,Flipkart.com: Buy WPC Flower Shower French - 105 Eau de Toilette - 50 ml for Rs. 0.0 from Flipkart.com. - Lowest Prices  Only Genuine Products  30 Day Replacement Guarantee  Free Shipping. Cash On,[],<div class="item_left_column" id="description"> <h3 class="item_desc_title fk-uppercase">WPC Flower Shower French - 105 Eau de Toilette  -  50 ml (For Women)         Price: Rs.249</h3> <div class="cls"></div> <div class="item_desc_text line"> <div style="float:right"> </div>                         This perfume is our version of French brand Flower Bomb by Viktor &amp; Rolf. Flower shower is a flowery  fresh feminine fragrance for the girly you. With notes of bergamot  tea  patchouli and flowers like jasmine  freesia  orchids and centiflora rose  it enhances your personality and style  adding to your elegance and keeps your partner lusting for you.        </div> <div style="clear: both;"></div> </div>,<div class="item_left_column" id="specifications"> <h3 class="item_desc_title fk-uppercase">         Specifications of WPC Flower Shower French - 105 Eau de Toilette  -  50 ml (For Women)    </h3> <table cellspacing="0" class="fk-specs-type2"> <tr> <th class="group-head" colspan="2">In the Box</th> </tr> <tr class=""> <td class="specs-value fk-data" colspan="2">Perfume</td> </tr> </table> <table cellspacing="0" class="fk-specs-type2"> <tr> <th class="group-head" colspan="2">Fragrance Traits</th> </tr> <tr class=""> <td class="specs-key">Ideal For</td> <td class="specs-value fk-data">Women</td> </tr> <tr class=""> <td class="specs-key">Fragrance Segment</td> <td class="specs-value fk-data">Mass Premium</td> </tr> <tr class=""> <td class="specs-key">Fragrance Classification</td> <td class="specs-value fk-data">Eau de Toilette</td> </tr> <tr class=""> <td class="specs-key">Fragrance Family</td> <td class="specs-value fk-data">Fresh</td> </tr> <tr class=""> <td class="specs-key">Quantity</td> <td class="specs-value fk-data">50 ml</td> </tr> <tr class=""> <td class="specs-key">Limited Edition</td> <td class="specs-value fk-data">No</td> </tr> </table> </div>,10:03:2014,None
LSTPERDZSH6UFDCVECMAWL2HW,WPC London Perfume is Wave of Extreme Freshness - 125 Eau de Parfum  -  50 ml,http://www.flipkart.com/lifestyle/fragrances-for-women?otracker=hp_nmenu_sub_women_0_Fragrances,Rs. 399,Fragrances,Perfumes,WPC,http://img5a.flixcart.com/image/perfume/e/c/m/eau-de-parfum-women-wpc-50-london-perfume-is-wave-of-extreme-freshness-125-400x400-imadzxuhcuebuy5s.jpeg,Rs. 399,None,women,http://www.flipkart.com/wpc-london-perfume-wave-extreme-freshness-125-eau-de-parfum-50-ml/p/itmdtauhykabsuza?pid=PERDZSH6UFDCVECM&srno=b_12&ref=06e7d129-d414-4d20-a909-6b159656df3d,Little-India,WPC London Perfume is Wave of Extreme Freshness - 125 Eau de Parfum - 50 ml - Price in India  Buy WPC London Perfume is Wave of Extreme Freshness - 125 Eau de Parfum - 50 ml Online In India  Reviews  Ratings & Features | Flipkart.com,Flipkart.com: Buy WPC London Perfume is Wave of Extreme Freshness - 125 Eau de Parfum - 50 ml for Rs. 0.0 from Flipkart.com. - Lowest Prices  Only Genuine Products  30 Day Replacement Guarantee  Free Shipping. Cash On,[],<div class="item_left_column" id="description"> <h3 class="item_desc_title fk-uppercase">WPC London Perfume is Wave of Extreme Freshness - 125 Eau de Parfum  -  50 ml (For Women)         Price: Rs.399</h3> <div class="cls"></div> <div class="item_desc_text line"> <div style="float:right"> </div>                         This perfume is a wave of extreme freshness that meets with the flowery notes and continues with sensual spicy composition. It is a tornado. The door is open to adventure and unknown  just like lips ready for a kiss. There are pink pepper  lemon and pineapple in the top notes. The heart encompasses hyacinth  jasmine and iris  while the base is composed of amber  patchouli  vetiver and white musk.        </div> <div style="clear: both;"></div> </div>,<div class="item_left_column" id="specifications"> <h3 class="item_desc_title fk-uppercase">         Specifications of WPC London Perfume is Wave of Extreme Freshness - 125 Eau de Parfum  -  50 ml (For Women)    </h3> <table cellspacing="0" class="fk-specs-type2"> <tr> <th class="group-head" colspan="2">In the Box</th> </tr> <tr class=""> <td class="specs-value fk-data" colspan="2">Perfume</td> </tr> </table> <table cellspacing="0" class="fk-specs-type2"> <tr> <th class="group-head" colspan="2">Fragrance Traits</th> </tr> <tr class=""> <td class="specs-key">Ideal For</td> <td class="specs-value fk-data">Women</td> </tr> <tr class=""> <td class="specs-key">Fragrance Segment</td> <td class="specs-value fk-data">Mass Premium</td> </tr> <tr class=""> <td class="specs-key">Fragrance Classification</td> <td class="specs-value fk-data">Eau de Parfum</td> </tr> <tr class=""> <td class="specs-key">Quantity</td> <td class="specs-value fk-data">50 ml</td> </tr> <tr class=""> <td class="specs-key">Limited Edition</td> <td class="specs-value fk-data">No</td> </tr> </table> </div>,10:03:2014,None
LSTPERDZSH6QA6DGGZYOGSINO,WPC Sexy Rhyme Excellent Branded - 112 Eau de Parfum  -  100 ml,http://www.flipkart.com/lifestyle/fragrances-for-women?otracker=hp_nmenu_sub_women_0_Fragrances,Rs. 799,Fragrances,Perfumes,WPC,http://img5a.flixcart.com/image/perfume/g/z/y/eau-de-parfum-women-wpc-100-sexy-rhyme-excellent-branded-112-400x400-imadzxuhvqhayxfx.jpeg,Rs. 799,None,women,http://www.flipkart.com/wpc-sexy-rhyme-excellent-branded-112-eau-de-parfum-100-ml/p/itmdthjcg2yvgcb9?pid=PERDZSH6QA6DGGZY&srno=b_17&ref=c0cc5370-4fed-4c06-acaf-450e6d108893,Little-India,WPC Sexy Rhyme Excellent Branded - 112 Eau de Parfum - 100 ml - Price in India  Buy WPC Sexy Rhyme Excellent Branded - 112 Eau de Parfum - 100 ml Online In India  Reviews  Ratings & Features | Flipkart.com,Flipkart.com: Buy WPC Sexy Rhyme Excellent Branded - 112 Eau de Parfum - 100 ml for Rs. 0.0 from Flipkart.com. - Lowest Prices  Only Genuine Products  30 Day Replacement Guarantee  Free Shipping. Cash On,[],<div class="item_left_column" id="description"> <h3 class="item_desc_title fk-uppercase">WPC Sexy Rhyme Excellent Branded - 112 Eau de Parfum  -  100 ml (For Women)         Price: Rs.799</h3> <div class="cls"></div> <div class="item_desc_text line"> <div style="float:right"> </div>                         It is a classic floral oriental fragrance of French excellence. The notes feature Himalayan blue poppy  white and yellow flowers  black currant  peach  mandarin  bergamot  orange blossom  freesia  jasmine  tuberose  vanilla  Tonka  amber  musk and vanilla flower. This perfume is very feminine making her more moving  passionate and giving her a special sensual aura.        </div> <div style="clear: both;"></div> </div>,<div class="item_left_column" id="specifications"> <h3 class="item_desc_title fk-uppercase">         Specifications of WPC Sexy Rhyme Excellent Branded - 112 Eau de Parfum  -  100 ml (For Women)    </h3> <table cellspacing="0" class="fk-specs-type2"> <tr> <th class="group-head" colspan="2">In the Box</th> </tr> <tr class=""> <td class="specs-value fk-data" colspan="2">Perfume</td> </tr> </table> <table cellspacing="0" class="fk-specs-type2"> <tr> <th class="group-head" colspan="2">Fragrance Traits</th> </tr> <tr class=""> <td class="specs-key">Ideal For</td> <td class="specs-value fk-data">Women</td> </tr> <tr class=""> <td class="specs-key">Fragrance Segment</td> <td class="specs-value fk-data">Mass Premium</td> </tr> <tr class=""> <td class="specs-key">Fragrance Classification</td> <td class="specs-value fk-data">Eau de Parfum</td> </tr> <tr class=""> <td class="specs-key">Quantity</td> <td class="specs-value fk-data">100 ml</td> </tr> <tr class=""> <td class="specs-key">Limited Edition</td> <td class="specs-value fk-data">No</td> </tr> </table> </div>,10:03:2014,None
LSTPERDZSH6QRG7XMQZ3KD1FO,WPC Floral Fragrance Angel Pink - 113 Eau de Parfum  -  100 ml,http://www.flipkart.com/lifestyle/fragrances-for-women?otracker=hp_nmenu_sub_women_0_Fragrances,Rs. 799,Fragrances,Perfumes,WPC,http://img6a.flixcart.com/image/perfume/m/q/z/eau-de-parfum-women-wpc-100-floral-fragrance-angel-pink-113-400x400-imadzxugmp9ffw9s.jpeg,Rs. 799,None,women,http://www.flipkart.com/wpc-floral-fragrance-angel-pink-113-eau-de-parfum-100-ml/p/itmdthjbguzh6mqw?pid=PERDZSH6QRG7XMQZ&srno=b_22&ref=c0cc5370-4fed-4c06-acaf-450e6d108893,Little-India,WPC Floral Fragrance Angel Pink - 113 Eau de Parfum - 100 ml - Price in India  Buy WPC Floral Fragrance Angel Pink - 113 Eau de Parfum - 100 ml Online In India  Reviews  Ratings & Features | Flipkart.com,Flipkart.com: Buy WPC Floral Fragrance Angel Pink - 113 Eau de Parfum - 100 ml for Rs. 0.0 from Flipkart.com. - Lowest Prices  Only Genuine Products  30 Day Replacement Guarantee  Free Shipping. Cash On,[],<div class="item_left_column" id="description"> <h3 class="item_desc_title fk-uppercase">WPC Floral Fragrance Angel Pink - 113 Eau de Parfum  -  100 ml (For Women)         Price: Rs.799</h3> <div class="cls"></div> <div class="item_desc_text line"> <div style="float:right"> </div>                         This perfume is a blend of fresh  fruity  floral fragrance  which is classic &amp; young  with a modern edge too. Top note is fresh  citric &amp; spicy with coriander leaves  blood orange  peach &amp; cardamom. The heart of jasmine  violet &amp; carrot seed oil leaves you feel young. The base of sandalwood  musk &amp; vanilla all go together in making the woman of today in you more energetic  joyful &amp; feminine.        </div> <div style="clear: both;"></div> </div>,<div class="item_left_column" id="specifications"> <h3 class="item_desc_title fk-uppercase">         Specifications of WPC Floral Fragrance Angel Pink - 113 Eau de Parfum  -  100 ml (For Women)    </h3> <table cellspacing="0" class="fk-specs-type2"> <tr> <th class="group-head" colspan="2">In the Box</th> </tr> <tr class=""> <td class="specs-value fk-data" colspan="2">Perfume</td> </tr> </table> <table cellspacing="0" class="fk-specs-type2"> <tr> <th class="group-head" colspan="2">Fragrance Traits</th> </tr> <tr class=""> <td class="specs-key">Ideal For</td> <td class="specs-value fk-data">Women</td> </tr> <tr class=""> <td class="specs-key">Fragrance Segment</td> <td class="specs-value fk-data">Mass Premium</td> </tr> <tr class=""> <td class="specs-key">Fragrance Classification</td> <td class="specs-value fk-data">Eau de Parfum</td> </tr> <tr class=""> <td class="specs-key">Fragrance Family</td> <td class="specs-value fk-data">Floral  Fresh</td> </tr> <tr class=""> <td class="specs-key">Quantity</td> <td class="specs-value fk-data">100 ml</td> </tr> <tr class=""> <td class="specs-key">Limited Edition</td> <td class="specs-value fk-data">No</td> </tr> </table> </div>,10:03:2014,None
LSTPERDZSH6SNGH5JTGNOMBF7,WPC Classical Fragrance Sexy Miss - 120 Eau de Parfum  -  30 ml,http://www.flipkart.com/lifestyle/fragrances-for-women?otracker=hp_nmenu_sub_women_0_Fragrances,Rs. 299,Fragrances,Perfumes,WPC,http://img5a.flixcart.com/image/perfume/j/t/g/eau-de-parfum-women-wpc-30-classical-fragrance-sexy-miss-120-400x400-imadzxugyktrdx9f.jpeg,Rs. 299,None,women,http://www.flipkart.com/wpc-classical-fragrance-sexy-miss-120-eau-de-parfum-30-ml/p/itmdtauhsjbymmg6?pid=PERDZSH6SNGH5JTG&srno=b_20&ref=c0cc5370-4fed-4c06-acaf-450e6d108893,Little-India,WPC Classical Fragrance Sexy Miss - 120 Eau de Parfum - 30 ml - Price in India  Buy WPC Classical Fragrance Sexy Miss - 120 Eau de Parfum - 30 ml Online In India  Reviews  Ratings & Features | Flipkart.com,Flipkart.com: Buy WPC Classical Fragrance Sexy Miss - 120 Eau de Parfum - 30 ml for Rs. 0.0 from Flipkart.com. - Lowest Prices  Only Genuine Products  30 Day Replacement Guarantee  Free Shipping. Cash On,[],<div class="item_left_column" id="description"> <h3 class="item_desc_title fk-uppercase">WPC Classical Fragrance Sexy Miss - 120 Eau de Parfum  -  30 ml (For Women)         Price: Rs.299</h3> <div class="cls"></div> <div class="item_desc_text line"> <div style="float:right"> </div>                         Sexy Miss is a rare essence; sensual and delicate. The central note of the composition is mysterious gardenia  fresh  sensual  luminous and creamy  reproduced by headspace technology. Amber and musk in the base make the scent dark and mysterious  very sensual and distinct.        </div> <div style="clear: both;"></div> </div>,<div class="item_left_column" id="specifications"> <h3 class="item_desc_title fk-uppercase">         Specifications of WPC Classical Fragrance Sexy Miss - 120 Eau de Parfum  -  30 ml (For Women)    </h3> <table cellspacing="0" class="fk-specs-type2"> <tr> <th class="group-head" colspan="2">In the Box</th> </tr> <tr class=""> <td class="specs-value fk-data" colspan="2">Perfume</td> </tr> </table> <table cellspacing="0" class="fk-specs-type2"> <tr> <th class="group-head" colspan="2">Fragrance Traits</th> </tr> <tr class=""> <td class="specs-key">Ideal For</td> <td class="specs-value fk-data">Women</td> </tr> <tr class=""> <td class="specs-key">Fragrance Segment</td> <td class="specs-value fk-data">Mass Premium</td> </tr> <tr class=""> <td class="specs-key">Fragrance Classification</td> <td class="specs-value fk-data">Eau de Parfum</td> </tr> <tr class=""> <td class="specs-key">Quantity</td> <td class="specs-value fk-data">30 ml</td> </tr> <tr class=""> <td class="specs-key">Limited Edition</td> <td class="specs-value fk-data">No</td> </tr> </table> </div>,10:03:2014,None
LSTPERDZSH6GU5QRUZKUI7QIH,WPC Renaissance Feminine Satin Touch - 115 Eau de Parfum  -  100 ml,http://www.flipkart.com/lifestyle/fragrances-for-women?otracker=hp_nmenu_sub_women_0_Fragrances,Rs. 449,Fragrances,Perfumes,WPC,http://img6a.flixcart.com/image/perfume/u/z/k/eau-de-parfum-women-wpc-100-renaissance-feminine-satin-touch-115-400x400-imadzxuhzgvk3ubj.jpeg,Rs. 475,None,women,http://www.flipkart.com/wpc-renaissance-feminine-satin-touch-115-eau-de-parfum-100-ml/p/itmdtauhdn2k2tbb?pid=PERDZSH6GU5QRUZK&srno=b_24&ref=c0cc5370-4fed-4c06-acaf-450e6d108893,Angel-Fragrance,WPC Renaissance Feminine Satin Touch - 115 Eau de Parfum - 100 ml - Price in India  Buy WPC Renaissance Feminine Satin Touch - 115 Eau de Parfum - 100 ml Online In India  Reviews  Ratings & Features | Flipkart.com,Flipkart.com: Buy WPC Renaissance Feminine Satin Touch - 115 Eau de Parfum - 100 ml for Rs. 0.0 from Flipkart.com. - Lowest Prices  Only Genuine Products  30 Day Replacement Guarantee  Free Shipping. Cash On,[],<div class="item_left_column" id="description"> <h3 class="item_desc_title fk-uppercase">WPC Renaissance Feminine Satin Touch - 115 Eau de Parfum  -  100 ml (For Women)         Price: Rs.449</h3> <div class="cls"></div> <div class="item_desc_text line"> <div style="float:right"> </div>                         A feminine scent that enchants and fills the woman of today with bold strength. The fresh notes of bergamot and jasmine attract instantly; then white flowers come in. Erotic and intoxicating white sandalwood and amber in the base give it depth. It is fresh  warm  subtle  uniting insolence and gentle too. It defines every woman who hides great passion behind her fragile look &amp; charms her way ahead.        </div> <div style="clear: both;"></div> </div>,<div class="item_left_column" id="specifications"> <h3 class="item_desc_title fk-uppercase">         Specifications of WPC Renaissance Feminine Satin Touch - 115 Eau de Parfum  -  100 ml (For Women)    </h3> <table cellspacing="0" class="fk-specs-type2"> <tr> <th class="group-head" colspan="2">In the Box</th> </tr> <tr class=""> <td class="specs-value fk-data" colspan="2">Perfume</td> </tr> </table> <table cellspacing="0" class="fk-specs-type2"> <tr> <th class="group-head" colspan="2">Fragrance Traits</th> </tr> <tr class=""> <td class="specs-key">Ideal For</td> <td class="specs-value fk-data">Women</td> </tr> <tr class=""> <td class="specs-key">Fragrance Segment</td> <td class="specs-value fk-data">Mass Premium</td> </tr> <tr class=""> <td class="specs-key">Fragrance Classification</td> <td class="specs-value fk-data">Eau de Parfum</td> </tr> <tr class=""> <td class="specs-key">Fragrance Family</td> <td class="specs-value fk-data">Fresh</td> </tr> <tr class=""> <td class="specs-key">Quantity</td> <td class="specs-value fk-data">100 ml</td> </tr> <tr class=""> <td class="specs-key">Limited Edition</td> <td class="specs-value fk-data">No</td> </tr> </table> </div>,10:03:2014,None
