LSTPERDZSH6ZUPCGDGMAJOQL1,WPC Original Ice Ice Romantic Women - 109 Eau de Parfum  -  100 ml,http://www.flipkart.com/lifestyle/fragrances-for-women?otracker=hp_nmenu_sub_women_0_Fragrances,Rs. 349,Fragrances,Perfumes,WPC,http://img5a.flixcart.com/image/perfume/d/g/m/eau-de-parfum-women-wpc-100-original-ice-ice-romantic-women-109-400x400-imadzxuhdyr6sytc.jpeg,Rs. 375,None,women,http://www.flipkart.com/wpc-original-ice-romantic-women-109-eau-de-parfum-100-ml/p/itmdtauhyjm2p8pw?pid=PERDZSH6ZUPCGDGM&srno=b_16&ref=c0cc5370-4fed-4c06-acaf-450e6d108893,Angel-Fragrance,WPC Original Ice Ice Romantic Women - 109 Eau de Parfum - 100 ml - Price in India  Buy WPC Original Ice Ice Romantic Women - 109 Eau de Parfum - 100 ml Online In India  Reviews  Ratings & Features | Flipkart.com,Flipkart.com: Buy WPC Original Ice Ice Romantic Women - 109 Eau de Parfum - 100 ml for Rs. 0.0 from Flipkart.com. - Lowest Prices  Only Genuine Products  30 Day Replacement Guarantee  Free Shipping. Cash On,[],<div class="item_left_column" id="description"> <h3 class="item_desc_title fk-uppercase">WPC Original Ice Ice Romantic Women - 109 Eau de Parfum  -  100 ml (For Women)         Price: Rs.349</h3> <div class="cls"></div> <div class="item_desc_text line"> <div style="float:right"> </div>                         This version of perfume is from Anais by Cacharel. It is an ultra-feminine scent  fresh  rich and romantic just like the bouquet of flowers from your man. Transparent orange blossom with heady hyacinth opens the creation. Intense floral heart blends sweet rose  delicate white lily and magical jasmine. The base is of camphorating amber  warm sandalwood with a tender whiff of mysterious incense.        </div> <div style="clear: both;"></div> </div>,<div class="item_left_column" id="specifications"> <h3 class="item_desc_title fk-uppercase">         Specifications of WPC Original Ice Ice Romantic Women - 109 Eau de Parfum  -  100 ml (For Women)    </h3> <table cellspacing="0" class="fk-specs-type2"> <tr> <th class="group-head" colspan="2">In the Box</th> </tr> <tr class=""> <td class="specs-value fk-data" colspan="2">Perfume</td> </tr> </table> <table cellspacing="0" class="fk-specs-type2"> <tr> <th class="group-head" colspan="2">Fragrance Traits</th> </tr> <tr class=""> <td class="specs-key">Ideal For</td> <td class="specs-value fk-data">Women</td> </tr> <tr class=""> <td class="specs-key">Fragrance Segment</td> <td class="specs-value fk-data">Mass Premium</td> </tr> <tr class=""> <td class="specs-key">Fragrance Classification</td> <td class="specs-value fk-data">Eau de Parfum</td> </tr> <tr class=""> <td class="specs-key">Fragrance Family</td> <td class="specs-value fk-data">Fresh  Floral</td> </tr> <tr class=""> <td class="specs-key">Quantity</td> <td class="specs-value fk-data">100 ml</td> </tr> <tr class=""> <td class="specs-key">Limited Edition</td> <td class="specs-value fk-data">No</td> </tr> </table> </div>,10:03:2014,None
LSTPERDZSH6ZUTZFYTCNK732X,WPC Honey Moon Branded Romantic - 121 Eau de Parfum  -  50 ml,http://www.flipkart.com/lifestyle/fragrances-for-women?otracker=hp_nmenu_sub_women_0_Fragrances,Rs. 399,Fragrances,Perfumes,WPC,http://img5a.flixcart.com/image/perfume/y/t/c/eau-de-parfum-women-wpc-50-honey-moon-branded-romantic-121-400x400-imadzxuhmuyx4q3b.jpeg,Rs. 399,None,women,http://www.flipkart.com/wpc-honey-moon-branded-romantic-121-eau-de-parfum-50-ml/p/itmdtauhzq32jvsr?pid=PERDZSH6ZUTZFYTC&srno=b_18&ref=c0cc5370-4fed-4c06-acaf-450e6d108893,Little-India,WPC Honey Moon Branded Romantic - 121 Eau de Parfum - 50 ml - Price in India  Buy WPC Honey Moon Branded Romantic - 121 Eau de Parfum - 50 ml Online In India  Reviews  Ratings & Features | Flipkart.com,Flipkart.com: Buy WPC Honey Moon Branded Romantic - 121 Eau de Parfum - 50 ml for Rs. 0.0 from Flipkart.com. - Lowest Prices  Only Genuine Products  30 Day Replacement Guarantee  Free Shipping. Cash On,[],<div class="item_left_column" id="description"> <h3 class="item_desc_title fk-uppercase">WPC Honey Moon Branded Romantic - 121 Eau de Parfum  -  50 ml (For Women)         Price: Rs.399</h3> <div class="cls"></div> <div class="item_desc_text line"> <div style="float:right"> </div>                         Honeymoon is young and romantic perfume for the woman who possesses good taste and style. The top notes are wild strawberry leaves and green tangerine. The heart features caramel pop corns surrounded by violets  strong and seductive wild strawberry  and pink jasmine. The base is created of fresh patchouli leaves and crystalline musk.        </div> <div style="clear: both;"></div> </div>,<div class="item_left_column" id="specifications"> <h3 class="item_desc_title fk-uppercase">         Specifications of WPC Honey Moon Branded Romantic - 121 Eau de Parfum  -  50 ml (For Women)    </h3> <table cellspacing="0" class="fk-specs-type2"> <tr> <th class="group-head" colspan="2">In the Box</th> </tr> <tr class=""> <td class="specs-value fk-data" colspan="2">Perfume</td> </tr> </table> <table cellspacing="0" class="fk-specs-type2"> <tr> <th class="group-head" colspan="2">Fragrance Traits</th> </tr> <tr class=""> <td class="specs-key">Ideal For</td> <td class="specs-value fk-data">Women</td> </tr> <tr class=""> <td class="specs-key">Fragrance Segment</td> <td class="specs-value fk-data">Mass Premium</td> </tr> <tr class=""> <td class="specs-key">Fragrance Classification</td> <td class="specs-value fk-data">Eau de Parfum</td> </tr> <tr class=""> <td class="specs-key">Quantity</td> <td class="specs-value fk-data">50 ml</td> </tr> <tr class=""> <td class="specs-key">Limited Edition</td> <td class="specs-value fk-data">No</td> </tr> </table> </div>,10:03:2014,None
LSTPERDSNHJGS79GBVK37HXF1,WPC Eara Collection XS Romance Eau de Toilette  -  50 ml,http://www.flipkart.com/lifestyle/fragrances-for-women?otracker=hp_nmenu_sub_women_0_Fragrances,Rs. 249,Fragrances,Perfumes,WPC,http://img5a.flixcart.com/image/perfume/b/v/k/eau-de-toilette-women-wpc-50-eara-collection-xs-romance-400x400-imadsz7jwgwuavrb.jpeg,Rs. 249,None,women,http://www.flipkart.com/wpc-eara-collection-xs-romance-eau-de-toilette-50-ml/p/itmdtaufty4wfxcj?pid=PERDSNHJGS79GBVK&srno=b_26&ref=c0cc5370-4fed-4c06-acaf-450e6d108893,Angel-Fragrance,WPC Eara Collection XS Romance Eau de Toilette - 50 ml - Price in India  Buy WPC Eara Collection XS Romance Eau de Toilette - 50 ml Online In India  Reviews  Ratings & Features | Flipkart.com,Flipkart.com: Buy WPC Eara Collection XS Romance Eau de Toilette - 50 ml for Rs. 0.0 from Flipkart.com. - Lowest Prices  Only Genuine Products  30 Day Replacement Guarantee  Free Shipping. Cash On,[],<div class="item_left_column" id="description"> <h3 class="item_desc_title fk-uppercase">WPC Eara Collection XS Romance Eau de Toilette  -  50 ml (For Women)         Price: Rs.249</h3> <div class="cls"></div> <div class="item_desc_text line"> <div style="float:right"> </div>                         Xs romance  a fragrance for women and a scent of love  romanticism and intimacy  it opens with top notes of rose blend and citrusy oils  embracing a heart of water lily  lily and white violet. With base notes of carnation  ginger  patchouli  oak moss and white musk this makes an excellent evening wear but can be used during day time too but beware it is going to bring out the heights of romanticism in you as well as your partner!        </div> <div style="clear: both;"></div> </div>,<div class="item_left_column" id="specifications"> <h3 class="item_desc_title fk-uppercase">         Specifications of WPC Eara Collection XS Romance Eau de Toilette  -  50 ml (For Women)    </h3> <table cellspacing="0" class="fk-specs-type2"> <tr> <th class="group-head" colspan="2">Fragrance Traits</th> </tr> <tr class=""> <td class="specs-key">Ideal For</td> <td class="specs-value fk-data">Women</td> </tr> <tr class=""> <td class="specs-key">Fragrance Classification</td> <td class="specs-value fk-data">Eau de Toilette</td> </tr> <tr class=""> <td class="specs-key">Fragrance Family</td> <td class="specs-value fk-data">Floral</td> </tr> <tr class=""> <td class="specs-key">Quantity</td> <td class="specs-value fk-data">50 ml</td> </tr> </table> </div>,10:03:2014,None
LSTPERDZSH6FGVH9HU6VHT1FX,WPC Sexy Dance Fantastic Branded - 111 Eau de Parfum  -  100 ml,http://www.flipkart.com/lifestyle/fragrances-for-women?otracker=hp_nmenu_sub_women_0_Fragrances,Rs. 799,Fragrances,Perfumes,WPC,http://img6a.flixcart.com/image/perfume/h/u/6/eau-de-parfum-women-wpc-100-sexy-dance-fantastic-branded-111-400x400-imads4q574zgqzrx.jpeg,Rs. 799,None,women,http://www.flipkart.com/wpc-sexy-dance-fantastic-branded-111-eau-de-parfum-100-ml/p/itmdtauhzrzfzcbe?pid=PERDZSH6FGVH9HU6&srno=b_25&ref=c0cc5370-4fed-4c06-acaf-450e6d108893,Little-India,WPC Sexy Dance Fantastic Branded - 111 Eau de Parfum - 100 ml - Price in India  Buy WPC Sexy Dance Fantastic Branded - 111 Eau de Parfum - 100 ml Online In India  Reviews  Ratings & Features | Flipkart.com,Flipkart.com: Buy WPC Sexy Dance Fantastic Branded - 111 Eau de Parfum - 100 ml for Rs. 0.0 from Flipkart.com. - Lowest Prices  Only Genuine Products  30 Day Replacement Guarantee  Free Shipping. Cash On,[],<div class="item_left_column" id="description"> <h3 class="item_desc_title fk-uppercase">WPC Sexy Dance Fantastic Branded - 111 Eau de Parfum  -  100 ml (For Women)         Price: Rs.799</h3> <div class="cls"></div> <div class="item_desc_text line"> <div style="float:right"> </div>                         This is a sharp  oriental floral fragrance for women. The sexy scent is a fantastic blend of fresh fruits and leaves  musk and patchouli  rose  caramel  coconut  pineapple  black currant  melon  red berries  cassia  litchi  magnolia  orris  green leaves  freesia  basil  jasmine  caraway  heliotrope  lily of the valley  rose  sandalwood  amber  patchouli  musk  benzoin  caramel  vetiver and cashmere vanilla. A scent to make her more attractive  glamorous and seductive.        </div> <div style="clear: both;"></div> </div>,<div class="item_left_column" id="specifications"> <h3 class="item_desc_title fk-uppercase">         Specifications of WPC Sexy Dance Fantastic Branded - 111 Eau de Parfum  -  100 ml (For Women)    </h3> <table cellspacing="0" class="fk-specs-type2"> <tr> <th class="group-head" colspan="2">In the Box</th> </tr> <tr class=""> <td class="specs-value fk-data" colspan="2">Perfume</td> </tr> </table> <table cellspacing="0" class="fk-specs-type2"> <tr> <th class="group-head" colspan="2">Fragrance Traits</th> </tr> <tr class=""> <td class="specs-key">Ideal For</td> <td class="specs-value fk-data">Women</td> </tr> <tr class=""> <td class="specs-key">Fragrance Segment</td> <td class="specs-value fk-data">Mass Premium</td> </tr> <tr class=""> <td class="specs-key">Fragrance Classification</td> <td class="specs-value fk-data">Eau de Parfum</td> </tr> <tr class=""> <td class="specs-key">Quantity</td> <td class="specs-value fk-data">100 ml</td> </tr> <tr class=""> <td class="specs-key">Limited Edition</td> <td class="specs-value fk-data">No</td> </tr> </table> </div>,10:03:2014,None
LSTPERDZSH67BM6HXDD3FMWXW,WPC Eara Collection Sinamor Luscious - 104 Eau de Toilette  -  50 ml,http://www.flipkart.com/lifestyle/fragrances-for-women?otracker=hp_nmenu_sub_women_0_Fragrances,Rs. 249,Fragrances,Perfumes,WPC,http://img6a.flixcart.com/image/perfume/x/d/d/eau-de-toilette-women-wpc-50-eara-collection-sinamor-luscious-104-400x400-imadzxuhu9upmwag.jpeg,Rs. 249,None,women,http://www.flipkart.com/wpc-eara-collection-sinamor-luscious-104-eau-de-toilette-50-ml/p/itmdthjbby7hzya5?pid=PERDZSH67BM6HXDD&srno=b_19&ref=c0cc5370-4fed-4c06-acaf-450e6d108893,Angel-Fragrance,WPC Eara Collection Sinamor Luscious - 104 Eau de Toilette - 50 ml - Price in India  Buy WPC Eara Collection Sinamor Luscious - 104 Eau de Toilette - 50 ml Online In India  Reviews  Ratings & Features | Flipkart.com,Flipkart.com: Buy WPC Eara Collection Sinamor Luscious - 104 Eau de Toilette - 50 ml for Rs. 0.0 from Flipkart.com. - Lowest Prices  Only Genuine Products  30 Day Replacement Guarantee  Free Shipping. Cash On,[],<div class="item_left_column" id="description"> <h3 class="item_desc_title fk-uppercase">WPC Eara Collection Sinamor Luscious - 104 Eau de Toilette  -  50 ml (For Women)         Price: Rs.249</h3> <div class="cls"></div> <div class="item_desc_text line"> <div style="float:right"> </div>                         Our version of French brand Amor Amor by Cacharel. This fragrance with luscious aroma of fruits  flowers  fragrant woods &amp; vanilla sinamor for women is a strong &amp; crazy love poison to seduce your man. With the top notes of pink grapefruit  apricot  mandarin and bergamot  followed by a mid note of Tahitian Tiare  orchid and peony  all balanced on a base of vanilla  jasmine and musk notes. You will fall in love with sinamor for its deep  sensual aroma that stimulates the senses and is perfect for your romantic evenings.        </div> <div style="clear: both;"></div> </div>,<div class="item_left_column" id="specifications"> <h3 class="item_desc_title fk-uppercase">         Specifications of WPC Eara Collection Sinamor Luscious - 104 Eau de Toilette  -  50 ml (For Women)    </h3> <table cellspacing="0" class="fk-specs-type2"> <tr> <th class="group-head" colspan="2">In the Box</th> </tr> <tr class=""> <td class="specs-value fk-data" colspan="2">Perfume</td> </tr> </table> <table cellspacing="0" class="fk-specs-type2"> <tr> <th class="group-head" colspan="2">Fragrance Traits</th> </tr> <tr class=""> <td class="specs-key">Ideal For</td> <td class="specs-value fk-data">Women</td> </tr> <tr class=""> <td class="specs-key">Fragrance Segment</td> <td class="specs-value fk-data">Mass Premium</td> </tr> <tr class=""> <td class="specs-key">Fragrance Classification</td> <td class="specs-value fk-data">Eau de Toilette</td> </tr> <tr class=""> <td class="specs-key">Quantity</td> <td class="specs-value fk-data">50 ml</td> </tr> <tr class=""> <td class="specs-key">Limited Edition</td> <td class="specs-value fk-data">No</td> </tr> </table> </div>,10:03:2014,None
LSTPERDZSH62YTTETFNGI7DSU,WPC Catchy Fragrance High Flyer - 118 Eau de Parfum  -  100 ml,http://www.flipkart.com/lifestyle/fragrances-for-women?otracker=hp_nmenu_sub_women_0_Fragrances,Rs. 449,Fragrances,Perfumes,WPC,http://img5a.flixcart.com/image/perfume/t/f/n/eau-de-parfum-women-wpc-100-catchy-fragrance-high-flyer-118-400x400-imadzxuheckyqbkc.jpeg,Rs. 475,None,women,http://www.flipkart.com/wpc-catchy-fragrance-high-flyer-118-eau-de-parfum-100-ml/p/itmdthjcxa2efg3g?pid=PERDZSH62YTTETFN&srno=b_23&ref=c0cc5370-4fed-4c06-acaf-450e6d108893,Angel-Fragrance,WPC Catchy Fragrance High Flyer - 118 Eau de Parfum - 100 ml - Price in India  Buy WPC Catchy Fragrance High Flyer - 118 Eau de Parfum - 100 ml Online In India  Reviews  Ratings & Features | Flipkart.com,Flipkart.com: Buy WPC Catchy Fragrance High Flyer - 118 Eau de Parfum - 100 ml for Rs. 0.0 from Flipkart.com. - Lowest Prices  Only Genuine Products  30 Day Replacement Guarantee  Free Shipping. Cash On,[],<div class="item_left_column" id="description"> <h3 class="item_desc_title fk-uppercase">WPC Catchy Fragrance High Flyer - 118 Eau de Parfum  -  100 ml (For Women)         Price: Rs.449</h3> <div class="cls"></div> <div class="item_desc_text line"> <div style="float:right"> </div>                         It is the exotic version of French perfume with a spicy fragrance having notes of bergamot  cypress  sandalwood  lavender &amp; star anise rock &amp; rolling into each other like the high flying woman &amp; the jet setting man. A refreshing &amp; catchy fragrance that will never fail to attract people to you.        </div> <div style="clear: both;"></div> </div>,<div class="item_left_column" id="specifications"> <h3 class="item_desc_title fk-uppercase">         Specifications of WPC Catchy Fragrance High Flyer - 118 Eau de Parfum  -  100 ml (For Women)    </h3> <table cellspacing="0" class="fk-specs-type2"> <tr> <th class="group-head" colspan="2">In the Box</th> </tr> <tr class=""> <td class="specs-value fk-data" colspan="2">Perfume</td> </tr> </table> <table cellspacing="0" class="fk-specs-type2"> <tr> <th class="group-head" colspan="2">Fragrance Traits</th> </tr> <tr class=""> <td class="specs-key">Ideal For</td> <td class="specs-value fk-data">Women</td> </tr> <tr class=""> <td class="specs-key">Fragrance Segment</td> <td class="specs-value fk-data">Mass Premium</td> </tr> <tr class=""> <td class="specs-key">Fragrance Classification</td> <td class="specs-value fk-data">Eau de Parfum</td> </tr> <tr class=""> <td class="specs-key">Quantity</td> <td class="specs-value fk-data">100 ml</td> </tr> <tr class=""> <td class="specs-key">Limited Edition</td> <td class="specs-value fk-data">No</td> </tr> </table> </div>,10:03:2014,None
LSTPERDTZ8YVVAZTPQVIODX8B,WPC Deziner Buotique Hillare Eau de Parfum  -  100 ml,http://www.flipkart.com/lifestyle/fragrances-for-women?otracker=hp_nmenu_sub_women_0_Fragrances,Rs. 370,Fragrances,Perfumes,WPC,http://img6a.flixcart.com/image/perfume/p/q/v/eau-de-parfum-wpc-100-deziner-buotique-hillare-400x400-imadsz7jzfejfpzp.jpeg,Rs. 399,None,women,http://www.flipkart.com/wpc-deziner-buotique-hillare-eau-de-parfum-100-ml/p/itmdtz8yvvaztpqv?pid=PERDTZ8YVVAZTPQV&srno=b_28&ref=c0cc5370-4fed-4c06-acaf-450e6d108893,Angel-Fragrance,WPC Deziner Buotique Hillare Eau de Parfum - 100 ml - Price in India  Buy WPC Deziner Buotique Hillare Eau de Parfum - 100 ml Online In India  Reviews  Ratings & Features | Flipkart.com,Flipkart.com: Buy WPC Deziner Buotique Hillare Eau de Parfum - 100 ml for Rs. 370.00 from Flipkart.com. - Lowest Prices  Only Genuine Products  30 Day Replacement Guarantee  Free Shipping. Cash On,[],<div class="item_left_column" id="description"> <h3 class="item_desc_title fk-uppercase">WPC Deziner Buotique Hillare Eau de Parfum  -  100 ml (For Women)         Price: Rs.370</h3> <div class="cls"></div> <div class="item_desc_text line"> <div style="float:right"> </div>                         Hillare  a voluptuous and seductive feminine fragrance with notes of apple  orange and melon  followed by a heart that exhibits abundance  opulence and is sweet  floral and pure like the jasmine  freesia  lily  tuberose  mimosa and lily of the valley flowers. The base is a sweet tone of ylang-ylang  milky-powdery and intensive sandalwood  musk and oak moss. A wonderful fragrance for the socialite in you  with a beautiful temperament who loves to charm her way through scores of admirers.        </div> <div style="clear: both;"></div> </div>,<div class="item_left_column" id="specifications"> <h3 class="item_desc_title fk-uppercase">         Specifications of WPC Deziner Buotique Hillare Eau de Parfum  -  100 ml (For Women)    </h3> <table cellspacing="0" class="fk-specs-type2"> <tr> <th class="group-head" colspan="2">Fragrance Traits</th> </tr> <tr class=""> <td class="specs-key">Ideal For</td> <td class="specs-value fk-data">Women</td> </tr> <tr class=""> <td class="specs-key">Fragrance Classification</td> <td class="specs-value fk-data">Eau de Parfum</td> </tr> <tr class=""> <td class="specs-key">Fragrance Family</td> <td class="specs-value fk-data">Woody</td> </tr> <tr class=""> <td class="specs-key">Quantity</td> <td class="specs-value fk-data">100 ml</td> </tr> </table> </div>,10:03:2014,None
LSTPERDTZ83A9WGMY3YKGTP3V,WPC Deziner Buotique Cool Fire Eau de Toilette  -  100 ml,http://www.flipkart.com/lifestyle/fragrances-for-women?otracker=hp_nmenu_sub_women_0_Fragrances,Rs. 375,Fragrances,Perfumes,WPC,http://img6a.flixcart.com/image/perfume/y/3/y/eau-de-toilette-wpc-100-deziner-buotique-cool-fire-400x400-imadtzfxarqtxmfd.jpeg,Rs. 399,None,women,http://www.flipkart.com/wpc-deziner-buotique-cool-fire-eau-de-toilette-100-ml/p/itmdtz83a9wgmy3y?pid=PERDTZ83A9WGMY3Y&srno=b_27&ref=c0cc5370-4fed-4c06-acaf-450e6d108893,Angel-Fragrance,WPC Deziner Buotique Cool Fire Eau de Toilette - 100 ml - Price in India  Buy WPC Deziner Buotique Cool Fire Eau de Toilette - 100 ml Online In India  Reviews  Ratings & Features | Flipkart.com,Flipkart.com: Buy WPC Deziner Buotique Cool Fire Eau de Toilette - 100 ml for Rs. 375.00 from Flipkart.com. - Lowest Prices  Only Genuine Products  30 Day Replacement Guarantee  Free Shipping. Cash On,[],<div class="item_left_column" id="description"> <h3 class="item_desc_title fk-uppercase">WPC Deziner Buotique Cool Fire Eau de Toilette  -  100 ml (For Women)         Price: Rs.375</h3> <div class="cls"></div> <div class="item_desc_text line"> <div style="float:right"> </div>                         Cool fire  is an edgy scent  with notes of absinthe  red basil  pimento  patchouli  styrax and benzoin to create a sensual  oriental fragrance. This is very popular amongst the young males for its deep  spicy scent that makes it ideal for evening wear. A fiery oriental  masculine fragrance to make your girl fall fiercely in love with you  with notes of absynth and red basil  hot accords of pimento and patchouli form the mid notes  with a base of styrax and benzoin.        </div> <div style="clear: both;"></div> </div>,<div class="item_left_column" id="specifications"> <h3 class="item_desc_title fk-uppercase">         Specifications of WPC Deziner Buotique Cool Fire Eau de Toilette  -  100 ml (For Women)    </h3> <table cellspacing="0" class="fk-specs-type2"> <tr> <th class="group-head" colspan="2">Fragrance Traits</th> </tr> <tr class=""> <td class="specs-key">Ideal For</td> <td class="specs-value fk-data">Women</td> </tr> <tr class=""> <td class="specs-key">Fragrance Classification</td> <td class="specs-value fk-data">Eau de Toilette</td> </tr> <tr class=""> <td class="specs-key">Fragrance Family</td> <td class="specs-value fk-data">Oriental</td> </tr> <tr class=""> <td class="specs-key">Quantity</td> <td class="specs-value fk-data">100 ml</td> </tr> </table> </div>,10:03:2014,None
LSTPERDZSH6AGUH6ZFXO5NUUE,WPC Branded Marvina Fresh Fruity - 106 Eau de Toilette  -  50 ml,http://www.flipkart.com/lifestyle/fragrances-for-women?otracker=hp_nmenu_sub_women_0_Fragrances,Rs. 249,Fragrances,Perfumes,WPC,http://img6a.flixcart.com/image/perfume/z/f/x/eau-de-toilette-women-wpc-50-branded-marvina-fresh-fruity-106-400x400-imadzxuhdgzkxayz.jpeg,Rs. 249,None,women,http://www.flipkart.com/wpc-branded-marvina-fresh-fruity-106-eau-de-toilette-50-ml/p/itmdtauhhaypzg64?pid=PERDZSH6AGUH6ZFX&srno=b_10&ref=06e7d129-d414-4d20-a909-6b159656df3d,Angel-Fragrance,WPC Branded Marvina Fresh Fruity - 106 Eau de Toilette - 50 ml - Price in India  Buy WPC Branded Marvina Fresh Fruity - 106 Eau de Toilette - 50 ml Online In India  Reviews  Ratings & Features | Flipkart.com,Flipkart.com: Buy WPC Branded Marvina Fresh Fruity - 106 Eau de Toilette - 50 ml for Rs. 0.0 from Flipkart.com. - Lowest Prices  Only Genuine Products  30 Day Replacement Guarantee  Free Shipping. Cash On,[],<div class="item_left_column" id="description"> <h3 class="item_desc_title fk-uppercase">WPC Branded Marvina Fresh Fruity - 106 Eau de Toilette  -  50 ml (For Women)         Price: Rs.249</h3> <div class="cls"></div> <div class="item_desc_text line"> <div style="float:right"> </div>                         Our version of French perfume Le Paradis de Nina by Nina Ricci. Being a fragrance for women  Marvina is a fresh  fruity scent with a light feminine aroma that is perfect for all occasions. It includes the top notes of orange  mandarin orange  blossom and almonds  blended with a heart of heliotrope  glazed apple and gardenia  on a base of sandalwood  blond wood  patchouli and vanilla. Helps you in pulling the crowds.        </div> <div style="clear: both;"></div> </div>,<div class="item_left_column" id="specifications"> <h3 class="item_desc_title fk-uppercase">         Specifications of WPC Branded Marvina Fresh Fruity - 106 Eau de Toilette  -  50 ml (For Women)    </h3> <table cellspacing="0" class="fk-specs-type2"> <tr> <th class="group-head" colspan="2">In the Box</th> </tr> <tr class=""> <td class="specs-value fk-data" colspan="2">Perfume</td> </tr> </table> <table cellspacing="0" class="fk-specs-type2"> <tr> <th class="group-head" colspan="2">Fragrance Traits</th> </tr> <tr class=""> <td class="specs-key">Ideal For</td> <td class="specs-value fk-data">Women</td> </tr> <tr class=""> <td class="specs-key">Fragrance Segment</td> <td class="specs-value fk-data">Mass Premium</td> </tr> <tr class=""> <td class="specs-key">Fragrance Classification</td> <td class="specs-value fk-data">Eau de Toilette</td> </tr> <tr class=""> <td class="specs-key">Quantity</td> <td class="specs-value fk-data">50 ml</td> </tr> <tr class=""> <td class="specs-key">Limited Edition</td> <td class="specs-value fk-data">No</td> </tr> </table> </div>,10:03:2014,None
