LSTPERDZSH6HFZPUNVEHSM02O,WPC XS Romance Version of Romance and Love - 107 Eau de Toilette  -  50 ml,http://www.flipkart.com/lifestyle/fragrances-for-women?otracker=hp_nmenu_sub_women_0_Fragrances,Rs. 240,Fragrances,Perfumes,WPC,http://img5a.flixcart.com/image/perfume/n/v/e/eau-de-toilette-women-wpc-50-xs-romance-version-of-romance-and-love-107-400x400-imadzxuhgz3xuyxr.jpeg,Rs. 249,None,women,http://www.flipkart.com/wpc-xs-romance-version-love-107-eau-de-toilette-50-ml/p/itmdtauhkxp6bztz?pid=PERDZSH6HFZPUNVE&srno=b_2&ref=06e7d129-d414-4d20-a909-6b159656df3d,Angel-Fragrance,WPC XS Romance Version of Romance and Love - 107 Eau de Toilette - 50 ml - Price in India  Buy WPC XS Romance Version of Romance and Love - 107 Eau de Toilette - 50 ml Online In India  Reviews  Ratings & Features | Flipkart.com,Flipkart.com: Buy WPC XS Romance Version of Romance and Love - 107 Eau de Toilette - 50 ml for Rs. 0.0 from Flipkart.com. - Lowest Prices  Only Genuine Products  30 Day Replacement Guarantee  Free Shipping. Cash On,[],<div class="item_left_column" id="description"> <h3 class="item_desc_title fk-uppercase">WPC XS Romance Version of Romance and Love - 107 Eau de Toilette  -  50 ml (For Women)         Price: Rs.240</h3> <div class="cls"></div> <div class="item_desc_text line"> <div style="float:right"> </div>                         This excellent version of romantic perfume is by Ralph Lauren. This is a fragrance for women and a scent of love  romanticism &amp; intimacy. It opens with top notes of rose blend and citrusy oils  embracing a heart of water lily  lily and white violet. With base notes of carnation  ginger  patchouli  oak moss and white musk  this makes an excellent evening wear and can be used during day time too. But beware it is going to bring out the heights of romanticism in you as well as your partner.        </div> <div style="clear: both;"></div> </div>,<div class="item_left_column" id="specifications"> <h3 class="item_desc_title fk-uppercase">         Specifications of WPC XS Romance Version of Romance and Love - 107 Eau de Toilette  -  50 ml (For Women)    </h3> <table cellspacing="0" class="fk-specs-type2"> <tr> <th class="group-head" colspan="2">In the Box</th> </tr> <tr class=""> <td class="specs-value fk-data" colspan="2">Perfume</td> </tr> </table> <table cellspacing="0" class="fk-specs-type2"> <tr> <th class="group-head" colspan="2">Fragrance Traits</th> </tr> <tr class=""> <td class="specs-key">Ideal For</td> <td class="specs-value fk-data">Women</td> </tr> <tr class=""> <td class="specs-key">Fragrance Segment</td> <td class="specs-value fk-data">Mass Premium</td> </tr> <tr class=""> <td class="specs-key">Fragrance Classification</td> <td class="specs-value fk-data">Eau de Toilette</td> </tr> <tr class=""> <td class="specs-key">Quantity</td> <td class="specs-value fk-data">50 ml</td> </tr> <tr class=""> <td class="specs-key">Limited Edition</td> <td class="specs-value fk-data">No</td> </tr> </table> </div>,10:03:2014,None
LSTPERDZSH6Y8A29RPNNDEOCF,WPC Angel Perfume with Vivid Scent - 124 Eau de Parfum  -  50 ml,http://www.flipkart.com/lifestyle/fragrances-for-women?otracker=hp_nmenu_sub_women_0_Fragrances,Rs. 399,Fragrances,Perfumes,WPC,http://img6a.flixcart.com/image/perfume/r/p/n/eau-de-parfum-women-wpc-50-angel-perfume-with-vivid-scent-124-400x400-imadzxuhekccxnye.jpeg,Rs. 399,None,women,http://www.flipkart.com/wpc-angel-perfume-vivid-scent-124-eau-de-parfum-50-ml/p/itmdtauhhftbabf5?pid=PERDZSH6Y8A29RPN&srno=b_8&ref=06e7d129-d414-4d20-a909-6b159656df3d,Little-India,WPC Angel Perfume with Vivid Scent - 124 Eau de Parfum - 50 ml - Price in India  Buy WPC Angel Perfume with Vivid Scent - 124 Eau de Parfum - 50 ml Online In India  Reviews  Ratings & Features | Flipkart.com,Flipkart.com: Buy WPC Angel Perfume with Vivid Scent - 124 Eau de Parfum - 50 ml for Rs. 0.0 from Flipkart.com. - Lowest Prices  Only Genuine Products  30 Day Replacement Guarantee  Free Shipping. Cash On,[],<div class="item_left_column" id="description"> <h3 class="item_desc_title fk-uppercase">WPC Angel Perfume with Vivid Scent - 124 Eau de Parfum  -  50 ml (For Women)         Price: Rs.399</h3> <div class="cls"></div> <div class="item_desc_text line"> <div style="float:right"> </div>                         Angel is fresh and vivid fragrance  ideal for young women during summer and for parties till dawn. It opens with sunny red fruits and juicy peach  followed by the heart of white flowers and rose petals. The base is formed of patchouli  sandalwood and vanilla.        </div> <div style="clear: both;"></div> </div>,<div class="item_left_column" id="specifications"> <h3 class="item_desc_title fk-uppercase">         Specifications of WPC Angel Perfume with Vivid Scent - 124 Eau de Parfum  -  50 ml (For Women)    </h3> <table cellspacing="0" class="fk-specs-type2"> <tr> <th class="group-head" colspan="2">In the Box</th> </tr> <tr class=""> <td class="specs-value fk-data" colspan="2">Perfume</td> </tr> </table> <table cellspacing="0" class="fk-specs-type2"> <tr> <th class="group-head" colspan="2">Fragrance Traits</th> </tr> <tr class=""> <td class="specs-key">Ideal For</td> <td class="specs-value fk-data">Women</td> </tr> <tr class=""> <td class="specs-key">Fragrance Segment</td> <td class="specs-value fk-data">Mass Premium</td> </tr> <tr class=""> <td class="specs-key">Fragrance Classification</td> <td class="specs-value fk-data">Eau de Parfum</td> </tr> <tr class=""> <td class="specs-key">Quantity</td> <td class="specs-value fk-data">50 ml</td> </tr> <tr class=""> <td class="specs-key">Limited Edition</td> <td class="specs-value fk-data">No</td> </tr> </table> </div>,10:03:2014,None
LSTPERDZSH6D4UUB7QQF9OEBR,WPC Hillare Seductive Version of Paris Hilton Eau de Parfum  -  100 ml,http://www.flipkart.com/lifestyle/fragrances-for-women?otracker=hp_nmenu_sub_women_0_Fragrances,Rs. 349,Fragrances,Perfumes,WPC,http://img5a.flixcart.com/image/perfume/7/q/q/eau-de-parfum-women-wpc-100-hillare-seductive-version-of-paris-hilton-400x400-imadzxugcqz3fm6u.jpeg,Rs. 375,None,women,http://www.flipkart.com/wpc-hillare-seductive-version-paris-hilton-eau-de-parfum-100-ml/p/itmdtauh5vzjs9gk?pid=PERDZSH6D4UUB7QQ&srno=b_7&ref=06e7d129-d414-4d20-a909-6b159656df3d,Angel-Fragrance,WPC Hillare Seductive Version of Paris Hilton Eau de Parfum - 100 ml - Price in India  Buy WPC Hillare Seductive Version of Paris Hilton Eau de Parfum - 100 ml Online In India  Reviews  Ratings & Features | Flipkart.com,Flipkart.com: Buy WPC Hillare Seductive Version of Paris Hilton Eau de Parfum - 100 ml for Rs. 0.0 from Flipkart.com. - Lowest Prices  Only Genuine Products  30 Day Replacement Guarantee  Free Shipping. Cash On,[],<div class="item_left_column" id="description"> <h3 class="item_desc_title fk-uppercase">WPC Hillare Seductive Version of Paris Hilton Eau de Parfum  -  100 ml (For Women)         Price: Rs.349</h3> <div class="cls"></div> <div class="item_desc_text line"> <div style="float:right"> </div>                         Our version of Paris Hilton perfume is a voluptuous and seductive feminine fragrance with notes of apple  orange and melon  followed by a heart that exhibits abundance  opulence and is sweet  floral &amp; pure like the jasmine  freesia  lily  tuberose  mimosa and lily of the valley flowers. The base is sweet tone of ylang-ylang  milk powdery and intensive sandalwood  musk and oak moss. A wonderful fragrance for the socialite in you  with a beautiful temperament who loves to charm her way through scores of admirers.        </div> <div style="clear: both;"></div> </div>,<div class="item_left_column" id="specifications"> <h3 class="item_desc_title fk-uppercase">         Specifications of WPC Hillare Seductive Version of Paris Hilton Eau de Parfum  -  100 ml (For Women)    </h3> <table cellspacing="0" class="fk-specs-type2"> <tr> <th class="group-head" colspan="2">In the Box</th> </tr> <tr class=""> <td class="specs-value fk-data" colspan="2">Perfume</td> </tr> </table> <table cellspacing="0" class="fk-specs-type2"> <tr> <th class="group-head" colspan="2">Fragrance Traits</th> </tr> <tr class=""> <td class="specs-key">Ideal For</td> <td class="specs-value fk-data">Women</td> </tr> <tr class=""> <td class="specs-key">Fragrance Segment</td> <td class="specs-value fk-data">Mass Premium</td> </tr> <tr class=""> <td class="specs-key">Fragrance Classification</td> <td class="specs-value fk-data">Eau de Parfum</td> </tr> <tr class=""> <td class="specs-key">Quantity</td> <td class="specs-value fk-data">100 ml</td> </tr> <tr class=""> <td class="specs-key">Limited Edition</td> <td class="specs-value fk-data">No</td> </tr> </table> </div>,10:03:2014,None
LSTPERDZSH6MBQHVNEZTLTKCM,WPC Ennis Branded Exotic Touchy - 102 Eau de Toilette  -  50 ml,http://www.flipkart.com/lifestyle/fragrances-for-women?otracker=hp_nmenu_sub_women_0_Fragrances,Rs. 249,Fragrances,Perfumes,WPC,http://img5a.flixcart.com/image/perfume/n/e/z/eau-de-toilette-women-wpc-50-ennis-branded-exotic-touchy-102-400x400-imadzxuhjzbams2r.jpeg,Rs. 249,None,women,http://www.flipkart.com/wpc-ennis-branded-exotic-touchy-102-eau-de-toilette-50-ml/p/itmdthjbzvgqzfgu?pid=PERDZSH6MBQHVNEZ&srno=b_3&ref=06e7d129-d414-4d20-a909-6b159656df3d,Angel-Fragrance,WPC Ennis Branded Exotic Touchy - 102 Eau de Toilette - 50 ml - Price in India  Buy WPC Ennis Branded Exotic Touchy - 102 Eau de Toilette - 50 ml Online In India  Reviews  Ratings & Features | Flipkart.com,Flipkart.com: Buy WPC Ennis Branded Exotic Touchy - 102 Eau de Toilette - 50 ml for Rs. 0.0 from Flipkart.com. - Lowest Prices  Only Genuine Products  30 Day Replacement Guarantee  Free Shipping. Cash On,[],<div class="item_left_column" id="description"> <h3 class="item_desc_title fk-uppercase">WPC Ennis Branded Exotic Touchy - 102 Eau de Toilette  -  50 ml (For Women)         Price: Rs.249</h3> <div class="cls"></div> <div class="item_desc_text line"> <div style="float:right"> </div>                         This perfume is exotic version of French brand Anais Anais by Cacharel Ennis. It is a fresh  flowery scent  opening with top notes of white flowers  lilly of the valley  gardenia and jasmine  blending with accords of leather  fresh cut flowers and cedar. It is a big favorite amongst women because it is light &amp; very feminine. An ideal wear during day time. It helps woman to create a magical aura.        </div> <div style="clear: both;"></div> </div>,<div class="item_left_column" id="specifications"> <h3 class="item_desc_title fk-uppercase">         Specifications of WPC Ennis Branded Exotic Touchy - 102 Eau de Toilette  -  50 ml (For Women)    </h3> <table cellspacing="0" class="fk-specs-type2"> <tr> <th class="group-head" colspan="2">In the Box</th> </tr> <tr class=""> <td class="specs-value fk-data" colspan="2">Perfume</td> </tr> </table> <table cellspacing="0" class="fk-specs-type2"> <tr> <th class="group-head" colspan="2">Fragrance Traits</th> </tr> <tr class=""> <td class="specs-key">Ideal For</td> <td class="specs-value fk-data">Women</td> </tr> <tr class=""> <td class="specs-key">Fragrance Segment</td> <td class="specs-value fk-data">Mass Premium</td> </tr> <tr class=""> <td class="specs-key">Fragrance Classification</td> <td class="specs-value fk-data">Eau de Toilette</td> </tr> <tr class=""> <td class="specs-key">Quantity</td> <td class="specs-value fk-data">50 ml</td> </tr> <tr class=""> <td class="specs-key">Limited Edition</td> <td class="specs-value fk-data">No</td> </tr> </table> </div>,10:03:2014,None
LSTPERDZYUZYNPZF7FZ7RLZNI,WPC Ocean Magical Perfume - 215 Eau de Parfum  -  100 ml,http://www.flipkart.com/lifestyle/fragrances-for-women?otracker=hp_nmenu_sub_women_0_Fragrances,Rs. 450,Fragrances,Perfumes,WPC,http://img5a.flixcart.com/image/perfume/7/f/z/eau-de-parfum-unisex-wpc-100-ocean-magical-perfume-215-400x400-imadzxuhrnewggpz.jpeg,Rs. 475,None,women,http://www.flipkart.com/wpc-ocean-magical-perfume-215-eau-de-parfum-100-ml/p/itmdtauhzmhypmxu?pid=PERDZYUZYNPZF7FZ&srno=b_5&ref=06e7d129-d414-4d20-a909-6b159656df3d,Angel-Fragrance,WPC Ocean Magical Perfume - 215 Eau de Parfum - 100 ml - Price in India  Buy WPC Ocean Magical Perfume - 215 Eau de Parfum - 100 ml Online In India  Reviews  Ratings & Features | Flipkart.com,Flipkart.com: Buy WPC Ocean Magical Perfume - 215 Eau de Parfum - 100 ml for Rs. 0.0 from Flipkart.com. - Lowest Prices  Only Genuine Products  30 Day Replacement Guarantee  Free Shipping. Cash On,[],<div class="item_left_column" id="description"> <h3 class="item_desc_title fk-uppercase">WPC Ocean Magical Perfume - 215 Eau de Parfum  -  100 ml (For Men)         Price: Rs.450</h3> <div class="cls"></div> <div class="item_desc_text line"> <div style="float:right"> </div>                         A magical fragrance for both women &amp; men with a mix of sensuality  delicacy and warmth. The scent is oriental floral  warm and sweet with intoxicating notes of opulent white flowers  gardenia  tuberose and jasmine  ylang-ylang  soft vanilla  nutmeg  amber  sandal  cedar. A spicy &amp; floral fragrance with mossy  woody tones for both him &amp; her rendering sharp sensuality.        </div> <div style="clear: both;"></div> </div>,<div class="item_left_column" id="specifications"> <h3 class="item_desc_title fk-uppercase">         Specifications of WPC Ocean Magical Perfume - 215 Eau de Parfum  -  100 ml (For Men)    </h3> <table cellspacing="0" class="fk-specs-type2"> <tr> <th class="group-head" colspan="2">In the Box</th> </tr> <tr class=""> <td class="specs-value fk-data" colspan="2">Perfume</td> </tr> </table> <table cellspacing="0" class="fk-specs-type2"> <tr> <th class="group-head" colspan="2">Fragrance Traits</th> </tr> <tr class=""> <td class="specs-key">Ideal For</td> <td class="specs-value fk-data">Men</td> </tr> <tr class=""> <td class="specs-key">Fragrance Segment</td> <td class="specs-value fk-data">Mass Premium</td> </tr> <tr class=""> <td class="specs-key">Fragrance Classification</td> <td class="specs-value fk-data">Eau de Parfum</td> </tr> <tr class=""> <td class="specs-key">Fragrance Family</td> <td class="specs-value fk-data">Woody  Floral</td> </tr> <tr class=""> <td class="specs-key">Quantity</td> <td class="specs-value fk-data">100 ml</td> </tr> <tr class=""> <td class="specs-key">Limited Edition</td> <td class="specs-value fk-data">No</td> </tr> </table> </div>,10:03:2014,None
LSTPERDZSH66WGT9RZSBR2EMG,WPC A Rich Romantic Perfume I Love You - 116 Eau de Parfum  -  100 ml,http://www.flipkart.com/lifestyle/fragrances-for-women?otracker=hp_nmenu_sub_women_0_Fragrances,Rs. 450,Fragrances,Perfumes,WPC,http://img5a.flixcart.com/image/perfume/r/z/s/eau-de-parfum-women-wpc-100-a-rich-romantic-perfume-i-love-you-116-400x400-imadzxug5bvtpfvy.jpeg,Rs. 475,None,women,http://www.flipkart.com/wpc-rich-romantic-perfume-love-you-116-eau-de-parfum-100-ml/p/itmdthjbcmxjghdg?pid=PERDZSH66WGT9RZS&srno=b_6&ref=06e7d129-d414-4d20-a909-6b159656df3d,Angel-Fragrance,WPC A Rich Romantic Perfume I Love You - 116 Eau de Parfum - 100 ml - Price in India  Buy WPC A Rich Romantic Perfume I Love You - 116 Eau de Parfum - 100 ml Online In India  Reviews  Ratings & Features | Flipkart.com,Flipkart.com: Buy WPC A Rich Romantic Perfume I Love You - 116 Eau de Parfum - 100 ml for Rs. 0.0 from Flipkart.com. - Lowest Prices  Only Genuine Products  30 Day Replacement Guarantee  Free Shipping. Cash On,[],<div class="item_left_column" id="description"> <h3 class="item_desc_title fk-uppercase">WPC A Rich Romantic Perfume I Love You - 116 Eau de Parfum  -  100 ml (For Women)         Price: Rs.450</h3> <div class="cls"></div> <div class="item_desc_text line"> <div style="float:right"> </div>                         I LOVE YOU - is a scent of romantic love and intimate moments full of joy and happiness  with an endlessly positive aura. At the beginning of the composition  the notes of rose blend with citrusy oils and receive an unusual  unique melody. The pellucid flower of water lily  lily and romantic white violet give this perfume its silent grace. The spicy notes of carnation and ginger refresh  Patchouli  oak moss and white musk finish the composition gently.        </div> <div style="clear: both;"></div> </div>,<div class="item_left_column" id="specifications"> <h3 class="item_desc_title fk-uppercase">         Specifications of WPC A Rich Romantic Perfume I Love You - 116 Eau de Parfum  -  100 ml (For Women)    </h3> <table cellspacing="0" class="fk-specs-type2"> <tr> <th class="group-head" colspan="2">In the Box</th> </tr> <tr class=""> <td class="specs-value fk-data" colspan="2">Perfume</td> </tr> </table> <table cellspacing="0" class="fk-specs-type2"> <tr> <th class="group-head" colspan="2">Fragrance Traits</th> </tr> <tr class=""> <td class="specs-key">Ideal For</td> <td class="specs-value fk-data">Women</td> </tr> <tr class=""> <td class="specs-key">Fragrance Segment</td> <td class="specs-value fk-data">Mass Premium</td> </tr> <tr class=""> <td class="specs-key">Fragrance Classification</td> <td class="specs-value fk-data">Eau de Parfum</td> </tr> <tr class=""> <td class="specs-key">Quantity</td> <td class="specs-value fk-data">100 ml</td> </tr> <tr class=""> <td class="specs-key">Limited Edition</td> <td class="specs-value fk-data">No</td> </tr> </table> </div>,10:03:2014,None
LSTPERDZSH6QXET5QH4M6EKWZ,WPC Versace Hibiscus Soft Feel Aroma Women - 108 Eau de Parfum  -  100 ml,http://www.flipkart.com/lifestyle/fragrances-for-women?otracker=hp_nmenu_sub_women_0_Fragrances,Rs. 345,Fragrances,Perfumes,WPC,http://img6a.flixcart.com/image/perfume/q/h/4/eau-de-parfum-women-wpc-100-versace-hibiscus-soft-feel-aroma-women-108-400x400-imadzxuhnztnzgww.jpeg,Rs. 345,None,women,http://www.flipkart.com/wpc-versace-hibiscus-soft-feel-aroma-women-108-eau-de-parfum-100-ml/p/itmdthjczz4surzu?pid=PERDZSH6QXET5QH4&srno=b_4&ref=06e7d129-d414-4d20-a909-6b159656df3d,Little-India,WPC Versace Hibiscus Soft Feel Aroma Women - 108 Eau de Parfum - 100 ml - Price in India  Buy WPC Versace Hibiscus Soft Feel Aroma Women - 108 Eau de Parfum - 100 ml Online In India  Reviews  Ratings & Features | Flipkart.com,Flipkart.com: Buy WPC Versace Hibiscus Soft Feel Aroma Women - 108 Eau de Parfum - 100 ml for Rs. 0.0 from Flipkart.com. - Lowest Prices  Only Genuine Products  30 Day Replacement Guarantee  Free Shipping. Cash On,[],<div class="item_left_column" id="description"> <h3 class="item_desc_title fk-uppercase">WPC Versace Hibiscus Soft Feel Aroma Women - 108 Eau de Parfum  -  100 ml (For Women)         Price: Rs.345</h3> <div class="cls"></div> <div class="item_desc_text line"> <div style="float:right"> </div>                         This is our version of French brand Versus Versace. This perfume offers a total relaxation with its floral green notes and a soft aroma of fresh cut flowers. The top is bursts of freesia  apple tree blossom and hawthorn. The middle notes are of avocado  settling with the base of cedar  amber and sandalwood. A nice  calming fragrance for the sporty &amp; casual woman to stay fit &amp; smell fresh.        </div> <div style="clear: both;"></div> </div>,<div class="item_left_column" id="specifications"> <h3 class="item_desc_title fk-uppercase">         Specifications of WPC Versace Hibiscus Soft Feel Aroma Women - 108 Eau de Parfum  -  100 ml (For Women)    </h3> <table cellspacing="0" class="fk-specs-type2"> <tr> <th class="group-head" colspan="2">In the Box</th> </tr> <tr class=""> <td class="specs-value fk-data" colspan="2">Perfume</td> </tr> </table> <table cellspacing="0" class="fk-specs-type2"> <tr> <th class="group-head" colspan="2">Fragrance Traits</th> </tr> <tr class=""> <td class="specs-key">Ideal For</td> <td class="specs-value fk-data">Women</td> </tr> <tr class=""> <td class="specs-key">Fragrance Segment</td> <td class="specs-value fk-data">Mass Premium</td> </tr> <tr class=""> <td class="specs-key">Fragrance Classification</td> <td class="specs-value fk-data">Eau de Parfum</td> </tr> <tr class=""> <td class="specs-key">Fragrance Family</td> <td class="specs-value fk-data">Fresh</td> </tr> <tr class=""> <td class="specs-key">Quantity</td> <td class="specs-value fk-data">100 ml</td> </tr> <tr class=""> <td class="specs-key">Limited Edition</td> <td class="specs-value fk-data">No</td> </tr> </table> </div>,10:03:2014,None
LSTPERDZSH6HG2WWGR3N3VKD1,WPC WPC La Creativite Trance Sensual - 110 Eau de Parfum  -  100 ml,http://www.flipkart.com/lifestyle/fragrances-for-women?otracker=hp_nmenu_sub_women_0_Fragrances,Rs. 799,Fragrances,Perfumes,WPC,http://img6a.flixcart.com/image/perfume/g/r/3/eau-de-parfum-women-wpc-100-wpc-la-creativite-trance-sensual-110-400x400-imads4q5dggjtnrg.jpeg,Rs. 799,None,women,http://www.flipkart.com/wpc-la-creativite-trance-sensual-110-eau-de-parfum-100-ml/p/itmdtauhgabajqff?pid=PERDZSH6HG2WWGR3&srno=b_14&ref=06e7d129-d414-4d20-a909-6b159656df3d,Little-India,WPC WPC La Creativite Trance Sensual - 110 Eau de Parfum - 100 ml - Price in India  Buy WPC WPC La Creativite Trance Sensual - 110 Eau de Parfum - 100 ml Online In India  Reviews  Ratings & Features | Flipkart.com,Flipkart.com: Buy WPC WPC La Creativite Trance Sensual - 110 Eau de Parfum - 100 ml for Rs. 0.0 from Flipkart.com. - Lowest Prices  Only Genuine Products  30 Day Replacement Guarantee  Free Shipping. Cash On,[],<div class="item_left_column" id="description"> <h3 class="item_desc_title fk-uppercase">WPC WPC La Creativite Trance Sensual - 110 Eau de Parfum  -  100 ml (For Women)         Price: Rs.799</h3> <div class="cls"></div> <div class="item_desc_text line"> <div style="float:right"> </div>                         Trance is an excellent blend of many French perfumes that carve an air of extreme freshness with flowery notes continuing with sensual spicy notes. Top notes of pink pepper  lemon &amp; pineapple weave their way into a heart of hyacinth  jasmine with iris. The base of amber  patchouli  vetiver &amp; white musk is an invitation to the unknown like the lips ready with a kiss.        </div> <div style="clear: both;"></div> </div>,<div class="item_left_column" id="specifications"> <h3 class="item_desc_title fk-uppercase">         Specifications of WPC WPC La Creativite Trance Sensual - 110 Eau de Parfum  -  100 ml (For Women)    </h3> <table cellspacing="0" class="fk-specs-type2"> <tr> <th class="group-head" colspan="2">In the Box</th> </tr> <tr class=""> <td class="specs-value fk-data" colspan="2">Perfume</td> </tr> </table> <table cellspacing="0" class="fk-specs-type2"> <tr> <th class="group-head" colspan="2">Fragrance Traits</th> </tr> <tr class=""> <td class="specs-key">Ideal For</td> <td class="specs-value fk-data">Women</td> </tr> <tr class=""> <td class="specs-key">Fragrance Segment</td> <td class="specs-value fk-data">Mass Premium</td> </tr> <tr class=""> <td class="specs-key">Fragrance Classification</td> <td class="specs-value fk-data">Eau de Parfum</td> </tr> <tr class=""> <td class="specs-key">Quantity</td> <td class="specs-value fk-data">100 ml</td> </tr> <tr class=""> <td class="specs-key">Limited Edition</td> <td class="specs-value fk-data">No</td> </tr> </table> </div>,10:03:2014,None
LSTPERDZSH6XACA54ZBWFXZMI,WPC Classical French Magnetic Blue - 117 Eau de Parfum  -  100 ml,http://www.flipkart.com/lifestyle/fragrances-for-women?otracker=hp_nmenu_sub_women_0_Fragrances,Rs. 449,Fragrances,Perfumes,WPC,http://img6a.flixcart.com/image/perfume/4/z/b/eau-de-parfum-women-wpc-100-classical-french-magnetic-blue-117-400x400-imadzxughhygn6ze.jpeg,Rs. 475,None,women,http://www.flipkart.com/wpc-classical-french-magnetic-blue-117-eau-de-parfum-100-ml/p/itmdtauhjgkdzuy7?pid=PERDZSH6XACA54ZB&srno=b_13&ref=06e7d129-d414-4d20-a909-6b159656df3d,Angel-Fragrance,WPC Classical French Magnetic Blue - 117 Eau de Parfum - 100 ml - Price in India  Buy WPC Classical French Magnetic Blue - 117 Eau de Parfum - 100 ml Online In India  Reviews  Ratings & Features | Flipkart.com,Flipkart.com: Buy WPC Classical French Magnetic Blue - 117 Eau de Parfum - 100 ml for Rs. 0.0 from Flipkart.com. - Lowest Prices  Only Genuine Products  30 Day Replacement Guarantee  Free Shipping. Cash On,[],<div class="item_left_column" id="description"> <h3 class="item_desc_title fk-uppercase">WPC Classical French Magnetic Blue - 117 Eau de Parfum  -  100 ml (For Women)         Price: Rs.449</h3> <div class="cls"></div> <div class="item_desc_text line"> <div style="float:right"> </div>                         The legacy of French perfume  elegant and masculine woodsy note of patchouli and atlas cedar develop after the metal accord of mint and lavender. At the end  the intensive woodsy composition turns into an explosive energy of coffee and stirax in the warm musk and Tonka surrounding.        </div> <div style="clear: both;"></div> </div>,<div class="item_left_column" id="specifications"> <h3 class="item_desc_title fk-uppercase">         Specifications of WPC Classical French Magnetic Blue - 117 Eau de Parfum  -  100 ml (For Women)    </h3> <table cellspacing="0" class="fk-specs-type2"> <tr> <th class="group-head" colspan="2">In the Box</th> </tr> <tr class=""> <td class="specs-value fk-data" colspan="2">Perfume</td> </tr> </table> <table cellspacing="0" class="fk-specs-type2"> <tr> <th class="group-head" colspan="2">Fragrance Traits</th> </tr> <tr class=""> <td class="specs-key">Ideal For</td> <td class="specs-value fk-data">Women</td> </tr> <tr class=""> <td class="specs-key">Fragrance Segment</td> <td class="specs-value fk-data">Mass Premium</td> </tr> <tr class=""> <td class="specs-key">Fragrance Classification</td> <td class="specs-value fk-data">Eau de Parfum</td> </tr> <tr class=""> <td class="specs-key">Quantity</td> <td class="specs-value fk-data">100 ml</td> </tr> <tr class=""> <td class="specs-key">Limited Edition</td> <td class="specs-value fk-data">No</td> </tr> </table> </div>,10:03:2014,None
