LSTWATD9H77WPP6UDH2O8DKXP,Timex Analog Watch  - For Women,http://www.flipkart.com/watches/women?otracker=hp_nmenu_sub_women_1_Watches,Rs. 2595,Watches,Watches,Timex,http://img6a.flixcart.com/image/watch/d/h/2/k501-timex-400x400-imadpv87vdkyqzck.jpeg,Rs. 2595,None,women,http://www.flipkart.com/timex-analog-watch-women/p/itmd9gjg99wghzbh?pid=WATD9H77WPP6UDH2&srno=b_56&ref=06ab3e0f-8eba-49a8-90f2-803b40ee5cb2,WS Retail,Timex Analog Watch - For Women - Buy Timex Analog Watch - For Women K501 Online at Best Prices in India | Flipkart.com,Timex Analog Watch - For Women - Buy Timex Analog Watch - For Women K501 Online at Rs.2595 in India Only at Flipkart.com. Golden Strap  Water Resistant  Oval Dial  Jewelry Clasp - Great Discounts  Only Genuine Products,[],<div class="item_left_column" id="description"> <h3 class="item_desc_title fk-uppercase">Timex Analog Watch  - For Women (Gold)         Price: Rs.2595</h3> <div class="cls"></div> <div class="item_desc_text line"> <div style="float:right"> </div> <h3><b> Key Features </b></h3> <div class="line bmargin10"> <ul class="feature_bullet"> <li><span>Golden Strap</span></li><li><span>Water Resistant</span></li><li><span>Oval Dial</span></li><li><span>Jewelry Clasp</span></li> </ul> </div> <p style="text-align: justify;">   Adding a touch of glamour to your fashion quotient  the famous fashion brand Timex boasts of a collection of watches for the people whose unique style defines their bold personality. With attractive designs that are topped off with sophisticated elements  the collection of watches from Timex sparkles up your style statement.</p> <p style="text-align: justify;">   This <strong style="text-align: justify;">Timex Analog Watch for women</strong> is the ultimate fashion accessory  which pleases one and all with its incredible design. Meant for <strong style="text-align: justify;">dressy occasions</strong>  the beautiful timepiece gels with your attire seamlessly and can be worn with a range of attire to let the world know about your sense of style. The timekeeping mechanism of the chic timepiece is kept in sync with your allied time zone; punctuality will now become a known trait of your personality.</p> <p style="text-align: justify;"> <strong>Body and Design</strong></p> <p style="text-align: justify;">   The <strong style="text-align: justify;">Timex women’s watch</strong> breaks away from the traditional craftsmanship of watches  in possessing an <strong style="text-align: justify;">oval dial</strong>. The watch face basks in the glory of innovation  while presenting a tidy look. The swanky shape of the watch hands will accentuate your appeal. The watch appears even more alluring courtesy of the spectacular watch case coloured in regal hues. The floral design and the beautifully-crafted watch hands grace the dial  adding to your infallible charm. Index hour markers are absent on the dial  but shiny studs gloriously adorn the 12 and 6 o’clock positions.</p> <p style="text-align: justify;">   The Timex ladies' analog watch is equipped with a <strong>metal strap</strong>  which not only keeps your beloved time wear fastened to your wrist  but also ensures that you do not feel a tinge of irritation as you wear the watch for hours on end. The two-tone colour scheme of the strap complements that of the dial  thus enhancing your glamorous appeal. A great mix of technology and design  the <strong>women’s analog wristwatch from Timex </strong>will simply charm you with its brilliance; prepare to entice the world with your unique style by sporting the gracious wristwatch from Timex.</p> </div> <div style="clear: both;"></div> </div>,<div class="item_left_column" id="specifications"> <h3 class="item_desc_title fk-uppercase">         Specifications of Timex Analog Watch  - For Women (Gold)    </h3> <table cellspacing="0" class="fk-specs-type2"> <tr> <th class="group-head" colspan="2">General</th> </tr> <tr class=""> <td class="specs-key">Type</td> <td class="specs-value fk-data">Analog</td> </tr> <tr class=""> <td class="specs-key">Ideal For</td> <td class="specs-value fk-data">Women</td> </tr> <tr class=""> <td class="specs-key">Novelty Feature</td> <td class="specs-value fk-data">Stones Studded on Strap</td> </tr> <tr class=""> <td class="specs-key">Style Code</td> <td class="specs-value fk-data">K501</td> </tr> </table> <table cellspacing="0" class="fk-specs-type2"> <tr> <th class="group-head" colspan="2">Body Features</th> </tr> <tr class=""> <td class="specs-key">Strap Material</td> <td class="specs-value fk-data">Metal Strap</td> </tr> <tr class=""> <td class="specs-key">Strap Color</td> <td class="specs-value fk-data">Gold</td> </tr> <tr class=""> <td class="specs-key">Dial Color</td> <td class="specs-value fk-data">Champagne</td> </tr> <tr class=""> <td class="specs-key">Dial Shape</td> <td class="specs-value fk-data">Oval</td> </tr> <tr class=""> <td class="specs-key">Clasp Type</td> <td class="specs-value fk-data">Jewelry Clasp</td> </tr> <tr class=""> <td class="specs-key">Water Resistant</td> <td class="specs-value fk-data">Yes</td> </tr> <tr class=""> <td class="specs-key">Box Material</td> <td class="specs-value fk-data">Cardboard</td> </tr> </table> <table cellspacing="0" class="fk-specs-type2"> <tr> <th class="group-head" colspan="2">Dial Dimensions</th> </tr> <tr class=""> <td class="specs-key">Width</td> <td class="specs-value fk-data">17 mm</td> </tr> <tr class=""> <td class="specs-key">Height</td> <td class="specs-value fk-data">19 mm</td> </tr> <tr class=""> <td class="specs-key">Thickness</td> <td class="specs-value fk-data">6 mm</td> </tr> <tr class=""> <td class="specs-key">Weight</td> <td class="specs-value fk-data">25 g</td> </tr> </table> <table cellspacing="0" class="fk-specs-type2"> <tr> <th class="group-head" colspan="2">Warranty</th> </tr> <tr class=""> <td class="specs-key"> </td> <td class="specs-value fk-data">1 Year Domestic Warranty</td> </tr> </table> </div>,10:03:2014,None
LSTWATDKNFDHAPJKAFFCQINWT,Timex Fashion Analog Watch  - For Women,http://www.flipkart.com/watches/women?otracker=hp_nmenu_sub_women_1_Watches,Rs. 2290,Watches,Watches,Timex,http://img6a.flixcart.com/image/watch/a/f/f/j600-timex-400x400-imadqgfffgsf4epy.jpeg,Rs. 2695,None,women,http://www.flipkart.com/timex-fashion-analog-watch-women/p/itmdknfwt5mb48gy?pid=WATDKNFDHAPJKAFF&srno=b_58&ref=06ab3e0f-8eba-49a8-90f2-803b40ee5cb2,WS Retail,Timex Fashion Analog Watch - For Women - Buy Timex Fashion Analog Watch - For Women J600 Online at Best Prices in India | Flipkart.com,Timex Fashion Analog Watch - For Women - Buy Timex Fashion Analog Watch - For Women J600 Online at Rs.2290 in India Only at Flipkart.com. Rectangular Dial  Silver Strap  Water Resistant  Stainless Steel Case  Deployment,[],<div class="item_left_column" id="description"> <h3 class="item_desc_title fk-uppercase">                 Key Features of Timex Fashion Analog Watch  - For Women (Silver)            </h3> <div class="cls"></div> <div class="item_desc_text"> <ul class="fk-key-features"> <li>Rectangular Dial</li><li>Silver Strap</li><li>Water Resistant</li><li>Stainless Steel Case</li><li>Deployment Clasp</li> </ul> </div> <div style="clear: both;"></div> </div>,<div class="item_left_column" id="specifications"> <h3 class="item_desc_title fk-uppercase">         Specifications of Timex Fashion Analog Watch  - For Women (Silver)    </h3> <table cellspacing="0" class="fk-specs-type2"> <tr> <th class="group-head" colspan="2">General</th> </tr> <tr class=""> <td class="specs-key">Type</td> <td class="specs-value fk-data">Analog</td> </tr> <tr class=""> <td class="specs-key">Series</td> <td class="specs-value fk-data">Fashion</td> </tr> <tr class=""> <td class="specs-key">Ideal For</td> <td class="specs-value fk-data">Women</td> </tr> <tr class=""> <td class="specs-key">Mechanism</td> <td class="specs-value fk-data">Quartz</td> </tr> <tr class=""> <td class="specs-key">Style Code</td> <td class="specs-value fk-data">J600</td> </tr> </table> <table cellspacing="0" class="fk-specs-type2"> <tr> <th class="group-head" colspan="2">Body Features</th> </tr> <tr class=""> <td class="specs-key">Strap Material</td> <td class="specs-value fk-data">Metal Strap</td> </tr> <tr class=""> <td class="specs-key">Strap Color</td> <td class="specs-value fk-data">Silver</td> </tr> <tr class=""> <td class="specs-key">Strap Type</td> <td class="specs-value fk-data">Mesh</td> </tr> <tr class=""> <td class="specs-key">Case / Bezel Material</td> <td class="specs-value fk-data">Stainless Steel Case</td> </tr> <tr class=""> <td class="specs-key">Dial Color</td> <td class="specs-value fk-data">Purple</td> </tr> <tr class=""> <td class="specs-key">Dial Shape</td> <td class="specs-value fk-data">Rectangle</td> </tr> <tr class=""> <td class="specs-key">Clasp Type</td> <td class="specs-value fk-data">Deployment Clasp</td> </tr> <tr class=""> <td class="specs-key">Water Resistant</td> <td class="specs-value fk-data">Yes</td> </tr> <tr class=""> <td class="specs-key">Box Material</td> <td class="specs-value fk-data">Cardboard</td> </tr> <tr class=""> <td class="specs-key">Other Body Features</td> <td class="specs-value fk-data">Stainless Steel Back Case</td> </tr> </table> <table cellspacing="0" class="fk-specs-type2"> <tr> <th class="group-head" colspan="2">Dial Dimensions</th> </tr> <tr class=""> <td class="specs-key">Width</td> <td class="specs-value fk-data">17 mm</td> </tr> <tr class=""> <td class="specs-key">Height</td> <td class="specs-value fk-data">29 mm</td> </tr> <tr class=""> <td class="specs-key">Thickness</td> <td class="specs-value fk-data">7 mm</td> </tr> <tr class=""> <td class="specs-key">Weight</td> <td class="specs-value fk-data">25 g</td> </tr> <tr class=""> <td class="specs-key">Other Dimensions</td> <td class="specs-value fk-data">Case Dimension : Height - 29.26 mm  Width - 17.05 mm</td> </tr> </table> <table cellspacing="0" class="fk-specs-type2"> <tr> <th class="group-head" colspan="2">Warranty</th> </tr> <tr class=""> <td class="specs-key"> </td> <td class="specs-value fk-data">1 Year Domestic Warranty</td> </tr> </table> </div>,10:03:2014,None
LSTWATDEZ72QXMMSFEEO3AMG0,Timex Aura Analog Watch  - For Women,http://www.flipkart.com/watches/women?otracker=hp_nmenu_sub_women_1_Watches,Rs. 3055,Watches,Watches,Timex,http://img5a.flixcart.com/image/watch/f/e/e/e501-timex-400x400-imadpxb7mevqfg4x.jpeg,Rs. 3395,None,women,http://www.flipkart.com/timex-aura-analog-watch-women/p/itmdez87m5t2da6c?pid=WATDEZ72QXMMSFEE&srno=b_54&ref=06ab3e0f-8eba-49a8-90f2-803b40ee5cb2,BuyMore,Timex Aura Analog Watch - For Women - Buy Timex Aura Analog Watch - For Women E501 Online at Best Prices in India | Flipkart.com,Timex Aura Analog Watch - For Women - Buy Timex Aura Analog Watch - For Women E501 Online at Rs.3055 in India Only at Flipkart.com. Golden Strap  Water Resistant  Deployment Clasp  Stainless Steel Case  Rectangular Dial,[],<div class="item_left_column" id="description"> <h3 class="item_desc_title fk-uppercase">Timex Aura Analog Watch  - For Women (Gold)         Price: Rs.3055</h3> <div class="cls"></div> <div class="item_desc_text line"> <div style="float:right"> </div> <h3><b> Key Features </b></h3> <div class="line bmargin10"> <ul class="feature_bullet"> <li><span>Golden Strap</span></li><li><span>Water Resistant</span></li><li><span>Deployment Clasp</span></li><li><span>Stainless Steel Case</span></li><li><span>Rectangular Dial</span></li> </ul> </div> <p style="text-align: justify;">   Timex has enjoyed the reputation of being a watchmaking company that understands the pulse of the customer. The <strong>Timex Aura series of watches</strong> are crafted for women who hate to compromise on their style or comfort  be it at their office or at home. The exquisite<strong> Timex Aura Analog Watch for women</strong> is designed elegantly and will effortlessly create a niche for itself in the heart of the wearer.</p> <p style="text-align: justify;">   This is a <strong style="text-align: justify;">quartz watch</strong>  which will make you the heartthrob at any party or social event. A perfect fashion accessory  the efficient timepiece will impress you with its superlative performance. A trendy time wear for any occasion  the watch will grace your wrist whether you are partying on a weekend or planning to go out for shopping.</p> <p style="text-align: justify;"> <strong>Body and Design</strong></p> <p style="text-align: justify;">   The spectacular <strong style="text-align: justify;">women’s analog watch from Timex</strong> is a stylish piece of art. The design of the illustrious timepiece is splattered with vibrant colours. The <strong style="text-align: justify;">rectangular dial</strong> of the watch will appeal to women with refined taste  thanks to its enigmatic elegance. The beauty of the Timex watch is further enhanced by the presence of gemstones on the dial  which will definitely earn you a string of admirers at a party.</p> <p style="text-align: justify;">   The delicate dial is protected from scratches thanks to the presence of a <strong>mineral glass </strong>cover on it  which also accentuates the alluring dazzle of the chic timepiece. Your precious <strong>Timex Aura analog watch</strong> remains shielded from accidental damages  thanks to the presence of a gold-plated case. The <strong>stainless steel case</strong> possesses the capacity to resist corrosive substances  thus ensuring a long lifespan for your beloved watch.</p> <p style="text-align: justify;">   A <strong style="text-align: justify;">gold-plated stainless steel strap</strong> that this watch is equipped with will lift up your spirits on a gloomy courtesy of its bright colour. The <strong style="text-align: justify;">bracelet-type strap</strong> makes sure that your comfort is not compromised as you dress stylishly.</p> <p style="text-align: justify;"> <strong>Functions and Other Features</strong></p> <p style="text-align: justify;">   The gorgeous <strong style="text-align: justify;">Timex Aura women’s watch</strong> not only boasts of a beautiful design  but will also charm you with its superlative performance. The water-resistant watch can <strong style="text-align: justify;">withstand water up to a depth of 30 m</strong>  so the next time a car splashes a puddle of water on you during the monsoon  you need not fret about the damages that might cause to your prized time wear. A beautiful amalgamation of elegance and technical brilliance  the <strong style="text-align: justify;">Timex Aura analog wristwatch for women</strong> is a worthy companion for the modern woman.</p> </div> <div style="clear: both;"></div> </div>,<div class="item_left_column" id="specifications"> <h3 class="item_desc_title fk-uppercase">         Specifications of Timex Aura Analog Watch  - For Women (Gold)    </h3> <table cellspacing="0" class="fk-specs-type2"> <tr> <th class="group-head" colspan="2">General</th> </tr> <tr class=""> <td class="specs-key">Type</td> <td class="specs-value fk-data">Analog</td> </tr> <tr class=""> <td class="specs-key">Series</td> <td class="specs-value fk-data">Aura</td> </tr> <tr class=""> <td class="specs-key">Ideal For</td> <td class="specs-value fk-data">Women</td> </tr> <tr class=""> <td class="specs-key">Mechanism</td> <td class="specs-value fk-data">Quartz</td> </tr> <tr class=""> <td class="specs-key">Novelty Feature</td> <td class="specs-value fk-data">Gold Plated Case and Strap</td> </tr> <tr class=""> <td class="specs-key">Style Code</td> <td class="specs-value fk-data">E501</td> </tr> </table> <table cellspacing="0" class="fk-specs-type2"> <tr> <th class="group-head" colspan="2">Body Features</th> </tr> <tr class=""> <td class="specs-key">Strap Material</td> <td class="specs-value fk-data">Metal Strap</td> </tr> <tr class=""> <td class="specs-key">Strap Design</td> <td class="specs-value fk-data">Mesh</td> </tr> <tr class=""> <td class="specs-key">Strap Color</td> <td class="specs-value fk-data">Gold</td> </tr> <tr class=""> <td class="specs-key">Strap Type</td> <td class="specs-value fk-data">Bracelet</td> </tr> <tr class=""> <td class="specs-key">Case / Bezel Material</td> <td class="specs-value fk-data">Stainless Steel Case</td> </tr> <tr class=""> <td class="specs-key">Dial Color</td> <td class="specs-value fk-data">Champagne</td> </tr> <tr class=""> <td class="specs-key">Dial Shape</td> <td class="specs-value fk-data">Rectangle</td> </tr> <tr class=""> <td class="specs-key">Clasp Type</td> <td class="specs-value fk-data">Deployment Clasp</td> </tr> <tr class=""> <td class="specs-key">Water Resistant</td> <td class="specs-value fk-data">Yes</td> </tr> <tr class=""> <td class="specs-key">Water Resistance Depth</td> <td class="specs-value fk-data">30 m</td> </tr> <tr class=""> <td class="specs-key">Box Material</td> <td class="specs-value fk-data">Cardboard</td> </tr> <tr class=""> <td class="specs-key">Other Body Features</td> <td class="specs-value fk-data">Mineral Glass</td> </tr> </table> <table cellspacing="0" class="fk-specs-type2"> <tr> <th class="group-head" colspan="2">Dial Dimensions</th> </tr> <tr class=""> <td class="specs-key">Width</td> <td class="specs-value fk-data">16 mm</td> </tr> <tr class=""> <td class="specs-key">Height</td> <td class="specs-value fk-data">30 mm</td> </tr> <tr class=""> <td class="specs-key">Thickness</td> <td class="specs-value fk-data">7 mm</td> </tr> <tr class=""> <td class="specs-key">Weight</td> <td class="specs-value fk-data">26 g</td> </tr> </table> <table cellspacing="0" class="fk-specs-type2"> <tr> <th class="group-head" colspan="2">Warranty</th> </tr> <tr class=""> <td class="specs-key"> </td> <td class="specs-value fk-data">1 Year Domestic Warranty</td> </tr> </table> </div>,10:03:2014,None
LSTWATDPXF9M3UQ82JV5N4EIH,Timex Analog Watch  - For Women,http://www.flipkart.com/watches/women?otracker=hp_nmenu_sub_women_1_Watches,Rs. 4670,Watches,Watches,Timex,http://img5a.flixcart.com/image/watch/2/j/v/ti000n20500-timex-400x400-imadtavfasy9chez.jpeg,Rs. 5495,None,women,http://www.flipkart.com/timex-analog-watch-women/p/itmdpxf9rhgwhbda?pid=WATDPXF9M3UQ82JV&srno=b_61&ref=dd273cc9-afa2-4541-80c6-f60d41655ea0,WS Retail,Timex Analog Watch - For Women - Buy Timex Analog Watch - For Women TI000N20500 Online at Best Prices in India | Flipkart.com,Timex Analog Watch - For Women - Buy Timex Analog Watch - For Women TI000N20500 Online at Rs.4670 in India Only at Flipkart.com. Contemporary Dial  Golden Strap - Great Discounts  Only Genuine Products  30 Day,[],<div class="item_left_column" id="description"> <h3 class="item_desc_title fk-uppercase">                 Key Features of Timex Analog Watch  - For Women (Gold)            </h3> <div class="cls"></div> <div class="item_desc_text"> <ul class="fk-key-features"> <li>Contemporary Dial</li><li>Golden Strap</li> </ul> </div> <div style="clear: both;"></div> </div>,<div class="item_left_column" id="specifications"> <h3 class="item_desc_title fk-uppercase">         Specifications of Timex Analog Watch  - For Women (Gold)    </h3> <table cellspacing="0" class="fk-specs-type2"> <tr> <th class="group-head" colspan="2">General</th> </tr> <tr class=""> <td class="specs-key">Type</td> <td class="specs-value fk-data">Analog</td> </tr> <tr class=""> <td class="specs-key">Ideal For</td> <td class="specs-value fk-data">Women</td> </tr> <tr class=""> <td class="specs-key">Style Code</td> <td class="specs-value fk-data">TI000N20500</td> </tr> </table> <table cellspacing="0" class="fk-specs-type2"> <tr> <th class="group-head" colspan="2">Body Features</th> </tr> <tr class=""> <td class="specs-key">Strap Material</td> <td class="specs-value fk-data">Stainless Steel Strap</td> </tr> <tr class=""> <td class="specs-key">Strap Color</td> <td class="specs-value fk-data">Gold</td> </tr> <tr class=""> <td class="specs-key">Dial Color</td> <td class="specs-value fk-data">Gold  Mother of Pearl</td> </tr> <tr class=""> <td class="specs-key">Dial Shape</td> <td class="specs-value fk-data">Contemporary</td> </tr> <tr class=""> <td class="specs-key">Other Body Features</td> <td class="specs-value fk-data">Mineral Glass</td> </tr> </table> <table cellspacing="0" class="fk-specs-type2"> <tr> <th class="group-head" colspan="2">Warranty</th> </tr> <tr class=""> <td class="specs-key"> </td> <td class="specs-value fk-data">1 Year Domestic Warranty</td> </tr> </table> </div>,10:03:2014,None
LSTWATDGDAUZRZCZHPM8HE5MB,Timex Analog Watch  - For Women,http://www.flipkart.com/watches/women?otracker=hp_nmenu_sub_women_1_Watches,Rs. 1945,Watches,Watches,Timex,http://img5a.flixcart.com/image/watch/h/p/m/xe01-timex-400x400-imadsn4kf7wnkks8.jpeg,Rs. 2995,None,women,http://www.flipkart.com/timex-analog-watch-women/p/itmdgdb5qkskgtpd?pid=WATDGDAUZRZCZHPM&srno=b_59&ref=06ab3e0f-8eba-49a8-90f2-803b40ee5cb2,WS Retail,Timex Analog Watch - For Women - Buy Timex Analog Watch - For Women XE01 Online at Best Prices in India | Flipkart.com,Timex Analog Watch - For Women - Buy Timex Analog Watch - For Women XE01 Online at Rs.1945 in India Only at Flipkart.com. Contemporary Dial  Steel Case  Water Resistant  Silver Strap - Great Discounts  Only Genuine,[],<div class="item_left_column" id="description"> <h3 class="item_desc_title fk-uppercase">                 Key Features of Timex Analog Watch  - For Women (Silver)            </h3> <div class="cls"></div> <div class="item_desc_text"> <ul class="fk-key-features"> <li>Contemporary Dial</li><li>Steel Case</li><li>Water Resistant</li><li>Silver Strap</li> </ul> </div> <div style="clear: both;"></div> </div>,<div class="item_left_column" id="specifications"> <h3 class="item_desc_title fk-uppercase">         Specifications of Timex Analog Watch  - For Women (Silver)    </h3> <table cellspacing="0" class="fk-specs-type2"> <tr> <th class="group-head" colspan="2">General</th> </tr> <tr class=""> <td class="specs-key">Type</td> <td class="specs-value fk-data">Analog</td> </tr> <tr class=""> <td class="specs-key">Ideal For</td> <td class="specs-value fk-data">Women</td> </tr> <tr class=""> <td class="specs-key">Style Code</td> <td class="specs-value fk-data">XE01</td> </tr> </table> <table cellspacing="0" class="fk-specs-type2"> <tr> <th class="group-head" colspan="2">Body Features</th> </tr> <tr class=""> <td class="specs-key">Strap Material</td> <td class="specs-value fk-data">Steel Strap</td> </tr> <tr class=""> <td class="specs-key">Strap Color</td> <td class="specs-value fk-data">Silver</td> </tr> <tr class=""> <td class="specs-key">Strap Type</td> <td class="specs-value fk-data">Bracelet</td> </tr> <tr class=""> <td class="specs-key">Case / Bezel Material</td> <td class="specs-value fk-data">Steel Case</td> </tr> <tr class=""> <td class="specs-key">Dial Color</td> <td class="specs-value fk-data">Purple</td> </tr> <tr class=""> <td class="specs-key">Dial Shape</td> <td class="specs-value fk-data">Contemporary</td> </tr> <tr class=""> <td class="specs-key">Water Resistant</td> <td class="specs-value fk-data">Yes</td> </tr> <tr class=""> <td class="specs-key">Box Material</td> <td class="specs-value fk-data">Cardboard</td> </tr> <tr class=""> <td class="specs-key">Other Body Features</td> <td class="specs-value fk-data">Stones Studded on Bezel  Stainless Steel Back Case</td> </tr> </table> <table cellspacing="0" class="fk-specs-type2"> <tr> <th class="group-head" colspan="2">Dial Dimensions</th> </tr> <tr class=""> <td class="specs-key">Width</td> <td class="specs-value fk-data">18 mm</td> </tr> <tr class=""> <td class="specs-key">Height</td> <td class="specs-value fk-data">18 mm</td> </tr> <tr class=""> <td class="specs-key">Thickness</td> <td class="specs-value fk-data">6 mm</td> </tr> <tr class=""> <td class="specs-key">Weight</td> <td class="specs-value fk-data">16 g</td> </tr> </table> <table cellspacing="0" class="fk-specs-type2"> <tr> <th class="group-head" colspan="2">Warranty</th> </tr> <tr class=""> <td class="specs-key"> </td> <td class="specs-value fk-data">1 Year Domestic Warranty</td> </tr> </table> </div>,10:03:2014,None
