LSTWATD9H78KAZZ3FN86TGWIP,Timex Expedition Military Classic Analog Watch  - For Men, Women,http://www.flipkart.com/watches/women?otracker=hp_nmenu_sub_women_1_Watches,Rs. 3245,Watches,Watches,Timex,http://img6a.flixcart.com/image/watch/f/n/8/t49820-timex-400x400-imadhga49zantfhs.jpeg,Rs. 4995,None,women,http://www.flipkart.com/timex-expedition-military-classic-analog-watch-men-women/p/itmd9gjgccxubsqz?pid=WATD9H78KAZZ3FN8&srno=b_4&ref=cce96034-f0c9-4299-83d0-b72a1c785ed2,WS Retail,Timex Expedition Military Classic Analog Watch - For Men, Women - Buy Timex Expedition Military Classic Analog Watch - For Men, Women T49820 Online at Best Prices in India | Flipkart.com,Timex Expedition Military Classic Analog Watch - For Men, Women - Buy Timex Expedition Military Classic Analog Watch - For Men, Women T49820 Online at Rs.3245 in India Only at Flipkart.com. Round Dial, Black Strap,,[],<div class="item_left_column" id="description"> <h3 class="item_desc_title fk-uppercase">Timex Expedition Military Classic Analog Watch  - For Men, Women (Black)         Price: Rs.3245</h3> <div class="cls"></div> <div class="item_desc_text line"> <div style="float:right"> </div> <h3><b> Key Features </b></h3> <div class="line bmargin10"> <ul class="feature_bullet"> <li><span>Round Dial</span></li><li><span>Black Strap</span></li><li><span>Stainless Steel Case</span></li><li><span>Water and Scratch Resistant</span></li> </ul> </div> <p>   Every watch is designed for a purpose, some feature ornamentation to highlight the clothes you wear when you dress up formally, while others are designed to be highly functional if ever you need to calculate split times at the racetrack, the altitude and temperature of your city or even the average distance you covered over a period of time.</p> <p>   The <strong>Timex Expedition Military Classic analog watch</strong> is the kind of device that is built to handle the adventurous side of you. Whether it is trekking through forests or scaling mountain slopes, this <strong>unisex watch from Timex</strong> is the perfect watch to deal with the harsh conditions of the wild outdoors. Since the watch is a part of the <strong>Classic series</strong>, the simple design of the Timex analog watch enables it to be worn on formal occasions as well.</p> <p> <strong>Body and Design</strong><br/> <br/>   The<strong> Expedition Military Classic series watch from Timex</strong> features a highly durable <strong>canvas strap</strong>. The strap besides being exceptionally comfortable to wear over long periods of time highlights the detailed<strong> round dial</strong>. To prevent the dial window from chipping or picking up scratches while you walk through bushes and pick berries off shrubs, the dial is protected by a<strong> mineral glass window</strong>.</p> <p>   The<strong> Timex watch for either sex from the Expedition Military Classic series</strong> features a <strong>stainless steel case</strong>, protecting the internal workings of the watch from jolts, shocks and that occasional fall. Furthermore, to add to the expensive feel of the watch case, the timepiece makes use of a<strong> knurled finish</strong>.</p> <p> <strong>Functions and Other Features</strong></p> <p>   The <strong>unisex Timex analog watch from the Expedition series</strong> is equipped to be water resistant. This water resistant feature should come in useful if you find yourself attempting to pitch camp on that hill slope, while it rains. The watch is also <strong>water resistant up to a depth of 100 m</strong>, making it fully capable of handling those few times your canoe flips over when you go river rafting.</p> <p>   To ensure that you don’t have to rummage around in your rucksack for a flashlight only to find out the time of night, Timex has equipped the <strong>Classic Military series analog watch</strong> with its patented<strong> Indiglo nightlight feature</strong>.</p> <p>   The <strong>unisex analog watch from Timex</strong> comes with a built-in date display. This <strong>date display </strong>should help you keep track of the number of days you’ve spent out of home, camping. The <strong>Timex Expedition Military Classic Analog Watch for men and women</strong> is just the watch to take with you when you want to experience nature in its truest form, the outdoors.</p> </div> <div style="clear: both;"></div> </div>,<div class="item_left_column" id="specifications"> <h3 class="item_desc_title fk-uppercase">         Specifications of Timex Expedition Military Classic Analog Watch  - For Men, Women (Black)    </h3> <table cellspacing="0" class="fk-specs-type2"> <tr> <th class="group-head" colspan="2">General</th> </tr> <tr class=""> <td class="specs-key">Type</td> <td class="specs-value fk-data">Analog</td> </tr> <tr class=""> <td class="specs-key">Series</td> <td class="specs-value fk-data">Expedition Military Classic</td> </tr> <tr class=""> <td class="specs-key">Ideal For</td> <td class="specs-value fk-data">Men, Women</td> </tr> <tr class=""> <td class="specs-key">Occasion</td> <td class="specs-value fk-data">Sports</td> </tr> <tr class=""> <td class="specs-key">Style Code</td> <td class="specs-value fk-data">T49820</td> </tr> </table> <table cellspacing="0" class="fk-specs-type2"> <tr> <th class="group-head" colspan="2">Body Features</th> </tr> <tr class=""> <td class="specs-key">Strap Material</td> <td class="specs-value fk-data">Canvas Strap</td> </tr> <tr class=""> <td class="specs-key">Strap Color</td> <td class="specs-value fk-data">Black</td> </tr> <tr class=""> <td class="specs-key">Case / Bezel Material</td> <td class="specs-value fk-data">Stainless Steel Case</td> </tr> <tr class=""> <td class="specs-key">Dial Shape</td> <td class="specs-value fk-data">Round</td> </tr> <tr class=""> <td class="specs-key">Scratch Resistant</td> <td class="specs-value fk-data">Yes</td> </tr> <tr class=""> <td class="specs-key">Water Resistant</td> <td class="specs-value fk-data">Yes</td> </tr> <tr class=""> <td class="specs-key">Water Resistance Depth</td> <td class="specs-value fk-data">100 m</td> </tr> <tr class=""> <td class="specs-key">Other Body Features</td> <td class="specs-value fk-data">Knurled Finish, Mineral Glass</td> </tr> </table> <table cellspacing="0" class="fk-specs-type2"> <tr> <th class="group-head" colspan="2">Functions</th> </tr> <tr class=""> <td class="specs-key">Light</td> <td class="specs-value fk-data">Indiglo Night-light</td> </tr> <tr class=""> <td class="specs-key">Date Display</td> <td class="specs-value fk-data">Yes</td> </tr> </table> <table cellspacing="0" class="fk-specs-type2"> <tr> <th class="group-head" colspan="2">Additional Features</th> </tr> <tr class=""> <td class="specs-key"> </td> <td class="specs-value fk-data">Chip Resistant Mineral Glass</td> </tr> </table> <table cellspacing="0" class="fk-specs-type2"> <tr> <th class="group-head" colspan="2">Warranty</th> </tr> <tr class=""> <td class="specs-key"> </td> <td class="specs-value fk-data">1 Year Domestic Warranty</td> </tr> </table> </div>,10:03:2014,None
LSTWATD9H77HDPGMQHZFVB880,Timex Analog Watch  - For Women,http://www.flipkart.com/watches/women?otracker=hp_nmenu_sub_women_1_Watches,Rs. 5650,Watches,Watches,Timex,http://img5a.flixcart.com/image/watch/q/h/z/t2n151-timex-400x400-imadh88fdgph9mfg.jpeg,Rs. 8695,None,women,http://www.flipkart.com/timex-analog-watch-women/p/itmd9gjguf6fwf4c?pid=WATD9H77HDPGMQHZ&srno=b_2&ref=cce96034-f0c9-4299-83d0-b72a1c785ed2,WS Retail,Timex Analog Watch - For Women - Buy Timex Analog Watch - For Women T2N151 Online at Best Prices in India | Flipkart.com,Timex Analog Watch - For Women - Buy Timex Analog Watch - For Women T2N151 Online at Rs.5650 in India Only at Flipkart.com. Water Resistant, Buckle Clasp, Round Dial, White Strap, Stainless Steel Case - Great Discounts,,[],<div class="item_left_column" id="description"> <h3 class="item_desc_title fk-uppercase">Timex Analog Watch  - For Women (White)         Price: Rs.5650</h3> <div class="cls"></div> <div class="item_desc_text line"> <div style="float:right"> </div> <h3><b> Key Features </b></h3> <div class="line bmargin10"> <ul class="feature_bullet"> <li><span>Water Resistant</span></li><li><span>Buckle Clasp</span></li><li><span>Round Dial</span></li><li><span>White Strap</span></li><li><span>Stainless Steel Case</span></li> </ul> </div> <p style="text-align: justify;">   From the popular and prominent international watchmakers Timex, comes this extremely elegant analog women’s watch. Apart from helping you always keep track of time, this exquisitely designed personal timepiece also make a <strong>perfect fashion accessory for the modern day woman</strong>.</p> <p style="text-align: justify;"> <strong>Body and Design</strong></p> <p style="text-align: justify;">   This highly fashionable timepiece from Timex’s specialised range of women’s analog watches features a <strong>well-rounded sunray dial</strong>. This sunray dial sports a very purposefully finished background with a subtle <strong>filigree printed pattern</strong> that is designed to react to the sun’s rays with a brilliant yet conducive sheen, making it easier to read the time of the watch face. This dial is encircled by a very prominent and sturdy case composed entirely of stainless steel.</p> <p style="text-align: justify;">   The upper surface of this protective stainless steel ring is utterly dominated with a <strong>crystal embellished bezel</strong>, which along with the sunray dial makes this watch a spectacular vision and a definite eye-catcher. The <strong>stainless steel case</strong> gives the dial a considerable amount of durability while also notching up the aesthetic value of the watch. This all-important dial is firmly and securely attached to your wrist with a very classy and stylish<strong> leather strap</strong>.</p> <p style="text-align: justify;"> <strong>Functions and Other Features</strong></p> <p style="text-align: justify;">   All the time adjustment operations on this watch can be done using its rotating screw crown which is located on the right side of the bezel. The clear glass cover of the dial along with the watch’s sturdy stainless steel case gives it a maximum <strong>water-resistance capability of up to a depth of 50 m</strong>. With such a high level of functionality, durability and aesthetics, this personal time keeper from the house of Timex gives its wearer a highly improved sense of style and sophistication while also giving great flaunt value.</p> </div> <div style="clear: both;"></div> </div>,<div class="item_left_column" id="specifications"> <h3 class="item_desc_title fk-uppercase">         Specifications of Timex Analog Watch  - For Women (White)    </h3> <table cellspacing="0" class="fk-specs-type2"> <tr> <th class="group-head" colspan="2">General</th> </tr> <tr class=""> <td class="specs-key">Type</td> <td class="specs-value fk-data">Analog</td> </tr> <tr class=""> <td class="specs-key">Ideal For</td> <td class="specs-value fk-data">Women</td> </tr> <tr class=""> <td class="specs-key">Style Code</td> <td class="specs-value fk-data">T2N151</td> </tr> </table> <table cellspacing="0" class="fk-specs-type2"> <tr> <th class="group-head" colspan="2">Body Features</th> </tr> <tr class=""> <td class="specs-key">Strap Material</td> <td class="specs-value fk-data">Leather Strap</td> </tr> <tr class=""> <td class="specs-key">Strap Color</td> <td class="specs-value fk-data">White</td> </tr> <tr class=""> <td class="specs-key">Case / Bezel Material</td> <td class="specs-value fk-data">Stainless Steel Case</td> </tr> <tr class=""> <td class="specs-key">Dial Color</td> <td class="specs-value fk-data">Pearl White</td> </tr> <tr class=""> <td class="specs-key">Dial Shape</td> <td class="specs-value fk-data">Round</td> </tr> <tr class=""> <td class="specs-key">Clasp Type</td> <td class="specs-value fk-data">Buckle</td> </tr> <tr class=""> <td class="specs-key">Water Resistant</td> <td class="specs-value fk-data">Yes</td> </tr> <tr class=""> <td class="specs-key">Water Resistance Depth</td> <td class="specs-value fk-data">50 m</td> </tr> <tr class=""> <td class="specs-key">Box Material</td> <td class="specs-value fk-data">Plastic</td> </tr> <tr class=""> <td class="specs-key">Other Body Features</td> <td class="specs-value fk-data">Crystal Embellished Case, Sunray Dials with Filigree Printed Pattern, Rose Gold Toned Accents</td> </tr> </table> <table cellspacing="0" class="fk-specs-type2"> <tr> <th class="group-head" colspan="2">Dial Dimensions</th> </tr> <tr class=""> <td class="specs-key">Diameter</td> <td class="specs-value fk-data">36 mm</td> </tr> <tr class=""> <td class="specs-key">Weight</td> <td class="specs-value fk-data">46 g</td> </tr> </table> <table cellspacing="0" class="fk-specs-type2"> <tr> <th class="group-head" colspan="2">Warranty</th> </tr> <tr class=""> <td class="specs-key"> </td> <td class="specs-value fk-data">1 Year Domestic Warranty</td> </tr> </table> </div>,10:03:2014,None
LSTWATD9H77UYMTUMF9SEVPSI,Timex Analog Watch  - For Women,http://www.flipkart.com/watches/women?otracker=hp_nmenu_sub_women_1_Watches,Rs. 3505,Watches,Watches,Timex,http://img6a.flixcart.com/image/watch/m/f/9/e701-timex-400x400-imad9gnapugrkhn8.jpeg,Rs. 4395,None,women,http://www.flipkart.com/timex-analog-watch-women/p/itmd9gjgxgqcesty?pid=WATD9H77UYMTUMF9&srno=b_5&ref=cce96034-f0c9-4299-83d0-b72a1c785ed2,RRTC,Timex Analog Watch - For Women - Buy Timex Analog Watch - For Women E701 Online at Best Prices in India | Flipkart.com,Timex Analog Watch - For Women - Buy Timex Analog Watch - For Women E701 Online at Rs.3505 in India Only at Flipkart.com. Contemporary Dial, Golden Strap, Water Resistant - Great Discounts, Only Genuine Products, 30 Day,[],<div class="item_left_column" id="description"> <h3 class="item_desc_title fk-uppercase">Timex Analog Watch  - For Women (Gold)         Price: Rs.3505</h3> <div class="cls"></div> <div class="item_desc_text line"> <div style="float:right"> </div> <h3><b> Key Features </b></h3> <div class="line bmargin10"> <ul class="feature_bullet"> <li><span>Contemporary Dial</span></li><li><span>Golden Strap</span></li><li><span>Water Resistant</span></li> </ul> </div> <p>   There are various ways to complement and accessorize the clothes you wear. From matching that pencil thin red belt to those stilettoes, to accentuating your earrings by picking just the right handbag, making a style statement is far harder than most people give it credit for. The <strong>Timex analog watch for women</strong> proves to be just the accessory to go with almost every single piece of clothing from your wardrobe, making looking classy and elegant to one of those chic parties, an absolute breeze.</p> <p> <strong>Body and Design</strong><br/> <br/>   The<strong> analog watch from Timex</strong> is designed around the <strong>contemporary shaped dial</strong>. The<strong> 8 mm thick teardrop shaped dial</strong> is designed keeping in mind that this watch from Timex is supposed to be the ultimate styling accessory to complement both your weekday office wear as well as your casual weekend wear. The watch features a <strong>metal strap</strong> that is of the bangle type. This <strong>bangle strap is spring loaded </strong>to enable it to easily adjust to the size of your wrist. Furthermore, the strap on this elegant watch is <strong>adorned with jewels</strong> and that gives it a very glamorous look and feel.</p> <p> <strong>Functions and Other Features</strong></p> <p>   The <strong>women’s analog watch from Timex</strong> is equipped to be water resistant. This water resistant feature is extremely useful when it comes to protecting the watch from moisture if by chance you live or move to one those overly humid coastal cities. The Timex watch is<strong> water resistant up to a depth of 30 m</strong> as well, making this watch the ideal choice to wear to one of those swanky rooftop poolside parties on a Saturday night.</p> <p>   This <strong>Timex women’s watch </strong>is just the accessory to have, if you are the kind of person who loves being the centre of attention while that spotlight follows you wherever you go.</p> </div> <div style="clear: both;"></div> </div>,<div class="item_left_column" id="specifications"> <h3 class="item_desc_title fk-uppercase">         Specifications of Timex Analog Watch  - For Women (Gold)    </h3> <table cellspacing="0" class="fk-specs-type2"> <tr> <th class="group-head" colspan="2">General</th> </tr> <tr class=""> <td class="specs-key">Type</td> <td class="specs-value fk-data">Analog</td> </tr> <tr class=""> <td class="specs-key">Ideal For</td> <td class="specs-value fk-data">Women</td> </tr> <tr class=""> <td class="specs-key">Style Code</td> <td class="specs-value fk-data">E701</td> </tr> </table> <table cellspacing="0" class="fk-specs-type2"> <tr> <th class="group-head" colspan="2">Body Features</th> </tr> <tr class=""> <td class="specs-key">Strap Material</td> <td class="specs-value fk-data">Metal Strap</td> </tr> <tr class=""> <td class="specs-key">Strap Color</td> <td class="specs-value fk-data">Gold</td> </tr> <tr class=""> <td class="specs-key">Strap Type</td> <td class="specs-value fk-data">Bangle</td> </tr> <tr class=""> <td class="specs-key">Dial Color</td> <td class="specs-value fk-data">Maroon</td> </tr> <tr class=""> <td class="specs-key">Dial Shape</td> <td class="specs-value fk-data">Contemporary</td> </tr> <tr class=""> <td class="specs-key">Water Resistant</td> <td class="specs-value fk-data">Yes</td> </tr> <tr class=""> <td class="specs-key">Water Resistance Depth</td> <td class="specs-value fk-data">30 m</td> </tr> <tr class=""> <td class="specs-key">Other Body Features</td> <td class="specs-value fk-data">Spring Loaded Bejeweled Bangle</td> </tr> </table> <table cellspacing="0" class="fk-specs-type2"> <tr> <th class="group-head" colspan="2">Dial Dimensions</th> </tr> <tr class=""> <td class="specs-key">Thickness</td> <td class="specs-value fk-data">8 mm</td> </tr> </table> <table cellspacing="0" class="fk-specs-type2"> <tr> <th class="group-head" colspan="2">Warranty</th> </tr> <tr class=""> <td class="specs-key"> </td> <td class="specs-value fk-data">1 Year Domestic Warranty</td> </tr> </table> </div>,10:03:2014,None
LSTWATD9H77UXMKKHTPK7H4HW,Timex Analog Watch  - For Women,http://www.flipkart.com/watches/women?otracker=hp_nmenu_sub_women_1_Watches,Rs. 650,Watches,Watches,Timex,http://img5a.flixcart.com/image/watch/h/t/p/b301-timex-400x400-imad9gnadzpgqndh.jpeg,Rs. 650,None,women,http://www.flipkart.com/timex-analog-watch-women/p/itmd9gjhab4kcxfn?pid=WATD9H77UXMKKHTP&srno=b_7&ref=cce96034-f0c9-4299-83d0-b72a1c785ed2,HARetails,Timex Analog Watch - For Women - Buy Timex Analog Watch - For Women B301 Online at Best Prices in India | Flipkart.com,Timex Analog Watch - For Women - Buy Timex Analog Watch - For Women B301 Online at Rs.650 in India Only at Flipkart.com. Round Dial, Brown Strap, Stainless Steel Case, Water Resistant - Great Discounts, Only Genuine,[],<div class="item_left_column" id="description"> <h3 class="item_desc_title fk-uppercase">Timex Analog Watch  - For Women (Brown)         Price: Rs.650</h3> <div class="cls"></div> <div class="item_desc_text line"> <div style="float:right"> </div> <h3><b> Key Features </b></h3> <div class="line bmargin10"> <ul class="feature_bullet"> <li><span>Round Dial</span></li><li><span>Brown Strap</span></li><li><span>Stainless Steel Case</span></li><li><span>Water Resistant</span></li> </ul> </div> <p>   Do you believe that however much the society and technology advance, classics will remain cherished for the antique feeling they bring to your life? Feeling sentimental about that precious watch that you grandmother gifted to your mother on her eighteenth birthday? Here’s Timex offering you a chance to bring back the exquisite simplicity of the past.</p> <p>   This <strong>Timex Analog watch for women</strong> exemplifies all that was right with time-honored watch designs. Made for women who cherish heirlooms, the <strong>analog mechanism </strong>with the gold markers reinforces the overall effect of the watch. This is the type of watch that projects your taste for fine, elegant things. Pair it with a quiet button-down shirt or even ethnic wear to radiate an aura of the vintage class. </p> <p> <strong>Body and Design</strong><br/>   This Timex Analog watch exudes a charm that is peculiar to antique designs. If you want an daily wear watch that is sombre yet dainty, try this watch on for size. The <strong>yellow gold dial is round</strong> in shape and the <strong>stainless steel case</strong> around it reinforces the resilient dial glass. The metal also absorbs shocks to a certain extent. The<strong> leather strap</strong> is a classic brown; pair it with suede shoes and an oversized tote bag to be ready to shop till you drop. The leather is known for its breathability which keeps the skin at a comfortable temperature, come rain or shine.</p> <p> <strong>Functions and Other Features</strong><br/>   This is the perfect accessory to complement your need to clear out the clutter from your head and get the week in order. Organise the dates of your lectures or your children’s recitals with ease as this Timex Analog watch for women has a smart <strong>date display feature</strong>. This feature is also handy when you need to quickly refer to the date to calculate the number of days left for payday. Project the lady you are and the elegance you exude with this watch from Timex that will perfectly complement both your wardrobe and your personality.</p> </div> <div style="clear: both;"></div> </div>,<div class="item_left_column" id="specifications"> <h3 class="item_desc_title fk-uppercase">         Specifications of Timex Analog Watch  - For Women (Brown)    </h3> <table cellspacing="0" class="fk-specs-type2"> <tr> <th class="group-head" colspan="2">General</th> </tr> <tr class=""> <td class="specs-key">Type</td> <td class="specs-value fk-data">Analog</td> </tr> <tr class=""> <td class="specs-key">Ideal For</td> <td class="specs-value fk-data">Women</td> </tr> <tr class=""> <td class="specs-key">Style Code</td> <td class="specs-value fk-data">B301</td> </tr> </table> <table cellspacing="0" class="fk-specs-type2"> <tr> <th class="group-head" colspan="2">Body Features</th> </tr> <tr class=""> <td class="specs-key">Strap Material</td> <td class="specs-value fk-data">Leather Strap</td> </tr> <tr class=""> <td class="specs-key">Strap Color</td> <td class="specs-value fk-data">Brown</td> </tr> <tr class=""> <td class="specs-key">Case / Bezel Material</td> <td class="specs-value fk-data">Stainless Steel Case</td> </tr> <tr class=""> <td class="specs-key">Dial Color</td> <td class="specs-value fk-data">Yellow, Gold</td> </tr> <tr class=""> <td class="specs-key">Dial Shape</td> <td class="specs-value fk-data">Round</td> </tr> <tr class=""> <td class="specs-key">Water Resistant</td> <td class="specs-value fk-data">Yes</td> </tr> <tr class=""> <td class="specs-key">Water Resistance Depth</td> <td class="specs-value fk-data">30 m</td> </tr> </table> <table cellspacing="0" class="fk-specs-type2"> <tr> <th class="group-head" colspan="2">Warranty</th> </tr> <tr class=""> <td class="specs-key"> </td> <td class="specs-value fk-data">1 Year Domestic Warranty</td> </tr> </table> </div>,10:03:2014,None
