15:02:2014,flats,Portia.,Portia Flats,Rs. 697,http://img5a.flixcart.com/image/sandal/z/s/h/white-pgam-10-portia-38-400x400-imadhazqhxzgva8h.jpeg, No more colour,Rs. 697,WS Retail,http://www.flipkart.com/portia-flats/p/itmdm9gbvnhzb2ze?pid=SNDDJCR935CZC9WG&srno=b_1&ref=fb0eb57a-4786-4bf4-ac70-035bdbc5fcbd,no sku defined,   36 37 38 39,<div class="item_left_column" id="description"><h3 class="item_desc_title fk-uppercase">Portia Flats         Price: Rs.697</h3><div class="cls"></div><div class="item_desc_text line"><div style="float:right"></div><p style="text-align: justify;">15:02:2014,flats,Portia.,Portia Flats,Rs. 1395,http://img5a.flixcart.com/image/shoe/m/k/4/black-pt8j805-1-portia-37-400x400-imadqsk9gsvhyymt.jpeg, No more colour,Rs. 1395,WS Retail,http://www.flipkart.com/portia-flats/p/itmdpmfxsvkzprz2?pid=SHODPMFXCC9TFAZK&srno=b_18&ref=40f50c5a-c871-457d-bc7d-5122ca68214e,LSTSHODPMFXCC9TFAZKKPGNA6,  36 37 38 39 40,<div class="item_left_column" id="description"><h3 class="item_desc_title fk-uppercase">Portia Flats         Price: Rs.1395</h3><div class="cls"></div><div class="item_desc_text line"><div style="float:right"></div><p>	Intricately embellished with rich stone work, this pair of Portia flats blings up your casual attire to keep you looking suave and elegant. A definite trendsetter, this pair of black flats is enhanced with<strong> rivet detailing and flap at the back </strong>for added style. These flats are perfect to be teamed with a sequined blouse and skirt.</p><p>	For the confident modern woman who does not compromise on style, <strong>Portia </strong>offers delightful voguish choices in its collection of footwear, designed skillfully keeping in mind the comfort factor.</p><p><strong>Footwear Care</strong></p><p>	Clean these flats with a dry cloth.</p> </div><div style="clear: both;"></div></div>,<div class="item_left_column" id="specifications"><h3 class="item_desc_title fk-uppercase">        Specifications of Portia Flats    </h3><table cellspacing="0" class="fk-specs-type2"><tr><th class="group-head" colspan="2">General</th></tr><tr class=""><td class="specs-key">Ideal For</td><td class="specs-value fk-data">Women</td></tr></table><table cellspacing="0" class="fk-specs-type2"><tr><th class="group-head" colspan="2">Shoe Details</th></tr><tr class=""><td class="specs-key">Style</td><td class="specs-value fk-data">Panel and Stitch Detail, Stone Embellishment, Flap at Back, Revit Detail</td></tr><tr class=""><td class="specs-key">Color</td><td class="specs-value fk-data">Black</td></tr><tr class=""><td class="specs-key">Outer Material</td><td class="specs-value fk-data">Synthetic Leather</td></tr><tr class=""><td class="specs-key">Inner Material</td><td class="specs-value fk-data">Non-Leather</td></tr><tr class=""><td class="specs-key">Sole Material</td><td class="specs-value fk-data">Sheet</td></tr><tr class=""><td class="specs-key">Heel Height</td><td class="specs-value fk-data">0.5 inch</td></tr><tr class=""><td class="specs-key">Tip Shape</td><td class="specs-value fk-data">Round</td></tr><tr class=""><td class="specs-key">Weight</td><td class="specs-value fk-data">172 gm (per single Shoe) - Weight of the product may vary depending on size.</td></tr></table><table cellspacing="0" class="fk-specs-type2"><tr><th class="group-head" colspan="2">Additional Details</th></tr><tr class=""><td class="specs-key">Other Details</td><td class="specs-value fk-data">Textured Sole and Footbed, Toe Partition, Heel Construction</td></tr></table></div>
15:02:2014,flats,Portia.,Portia Flats,Rs. 1116,http://img5a.flixcart.com/image/shoe/5/e/9/blue-pt8y2099-10-portia-37-400x400-imadqsk9t4frpzw3.jpeg, No more colour,Rs. 1116,WS Retail,http://www.flipkart.com/portia-flats/p/itmdpmfxfygdega3?pid=SHODPMFXFE89ZEQQ&srno=b_20&ref=40f50c5a-c871-457d-bc7d-5122ca68214e,LSTSHODPMFXFE89ZEQQZNFMZV,   36 37 38 39 40,<div class="item_left_column" id="description"><h3 class="item_desc_title fk-uppercase">Portia Flats         Price: Rs.1116</h3><div class="cls"></div><div class="item_desc_text line"><div style="float:right"></div><p>	Offering you a gorgeous feminine look is this pair of fashionable flats which is exclusively designed by Portia. The <strong>jute and stone embellishment</strong> adds a touch of glamor to your overall appeal. Enhanced with a buckle closure at the ankle straps, these flats are perfect to be styled with a sequined kurta and leggings.</p><p>	For the confident modern woman who does not compromise on style, <strong>Portia </strong>offers delightful voguish choices in its collection of footwear, designed skillfully keeping in mind the comfort factor.</p><p><strong>Footwear Care</strong></p><p>	Gently wipe these flats with a soft and dry cloth.</p> </div><div style="clear: both;"></div></div>,<div class="item_left_column" id="specifications"><h3 class="item_desc_title fk-uppercase">        Specifications of Portia Flats    </h3><table cellspacing="0" class="fk-specs-type2"><tr><th class="group-head" colspan="2">General</th></tr><tr class=""><td class="specs-key">Ideal For</td><td class="specs-value fk-data">Women</td></tr></table><table cellspacing="0" class="fk-specs-type2"><tr><th class="group-head" colspan="2">Shoe Details</th></tr><tr class=""><td class="specs-key">Style</td><td class="specs-value fk-data">Buckle Closure at Ankle Strap, Panel and Stitch Detail, Jute and Stone Embellishment</td></tr><tr class=""><td class="specs-key">Color</td><td class="specs-value fk-data">Blue</td></tr><tr class=""><td class="specs-key">Outer Material</td><td class="specs-value fk-data">Synthetic Leather</td></tr><tr class=""><td class="specs-key">Inner Material</td><td class="specs-value fk-data">Non-Leather</td></tr><tr class=""><td class="specs-key">Sole Material</td><td class="specs-value fk-data">Sheet</td></tr><tr class=""><td class="specs-key">Tip Shape</td><td class="specs-value fk-data">Round</td></tr><tr class=""><td class="specs-key">Weight</td><td class="specs-value fk-data">174 gm (per single Shoe) - Weight of the product may vary depending on size.</td></tr></table><table cellspacing="0" class="fk-specs-type2"><tr><th class="group-head" colspan="2">Additional Details</th></tr><tr class=""><td class="specs-key">Other Details</td><td class="specs-value fk-data">Textured Sole and Footbed</td></tr></table></div>
15:02:2014,flats,Portia.,Portia Flats,Rs. 697,http://img5a.flixcart.com/image/sandal/g/x/g/white-pgam-02-portia-38-400x400-imadhctfmc8gpryg.jpeg, No more colour,Rs. 697,WS Retail,http://www.flipkart.com/portia-flats/p/itmdm9gbgkychpfv?pid=SNDDJCR9HBTBYHAJ&srno=b_22&ref=40f50c5a-c871-457d-bc7d-5122ca68214e,LSTSNDDJCR9HBTBYHAJGGFWYZ,  36 37 38 40 41,<div class="item_left_column" id="description"><h3 class="item_desc_title fk-uppercase">Portia Flats         Price: Rs.697</h3><div class="cls"></div><div class="item_desc_text line"><div style="float:right"></div><p>	Look classy and smart at office by slipping into this pair of stylish flats from the esteemed fashion house of Portia. Crafted using the finest <strong>synthetic</strong> materials, this pair of white flats can be used for longer without compromising on your comfort.</p><p>	For the confident modern woman who does not compromise on style, <strong>Portia </strong>offers delightful voguish choices in its collection of footwear, designed skilfully keeping in mind the comfort factor.</p><p><strong>Footwear Care</strong></p><p>	Treat these flats with utmost care by cleaning them with a soft and damp cloth.</p> </div><div style="clear: both;"></div></div>,<div class="item_left_column" id="specifications"><h3 class="item_desc_title fk-uppercase">        Specifications of Portia Flats    </h3><table cellspacing="0" class="fk-specs-type2"><tr><th class="group-head" colspan="2">General</th></tr><tr class=""><td class="specs-key">Ideal For</td><td class="specs-value fk-data">Women</td></tr></table><table cellspacing="0" class="fk-specs-type2"><tr><th class="group-head" colspan="2">Sandal Details</th></tr><tr class=""><td class="specs-key">Style</td><td class="specs-value fk-data">Stitch Detail, Perforations on Strap, Paneled Strap with Cut Work Detailing</td></tr><tr class=""><td class="specs-key">Color</td><td class="specs-value fk-data">White</td></tr><tr class=""><td class="specs-key">Type</td><td class="specs-value fk-data">Flats</td></tr><tr class=""><td class="specs-key">Outer Material</td><td class="specs-value fk-data">Synthetic</td></tr><tr class=""><td class="specs-key">Inner Material</td><td class="specs-value fk-data">Synthetic</td></tr><tr class=""><td class="specs-key">Sole Material</td><td class="specs-value fk-data">PU</td></tr><tr class=""><td class="specs-key">Tip Shape</td><td class="specs-value fk-data">Round</td></tr><tr class=""><td class="specs-key">Weight</td><td class="specs-value fk-data">193 gm (per single Sandal) - Weight of the product may vary depending on size.</td></tr></table><table cellspacing="0" class="fk-specs-type2"><tr><th class="group-head" colspan="2">Additional Details</th></tr><tr class=""><td class="specs-key">Other Details</td><td class="specs-value fk-data">Textured Sole, Padded Footbed</td></tr></table></div>
15:02:2014,flats,Portia.,Portia Flats,Rs. 558,http://img6a.flixcart.com/image/sandal/g/q/2/red-psh-1405-portia-40-400x400-imadhr9tfgsu8er6.jpeg, No more colour,Rs. 558,WS Retail,http://www.flipkart.com/portia-flats/p/itmdm9gbfk5feggs?pid=SNDDJCR9KHBWFGQ2&srno=b_23&ref=40f50c5a-c871-457d-bc7d-5122ca68214e,LSTSNDDJCR9KHBWFGQ2TK2DBR,  36 37 38 39 40 41,None,<div class="item_left_column" id="specifications"><h3 class="item_desc_title fk-uppercase">        Specifications of Portia Flats    </h3><table cellspacing="0" class="fk-specs-type2"><tr><th class="group-head" colspan="2">General</th></tr><tr class=""><td class="specs-key">Ideal For</td><td class="specs-value fk-data">Women</td></tr></table><table cellspacing="0" class="fk-specs-type2"><tr><th class="group-head" colspan="2">Sandal Details</th></tr><tr class=""><td class="specs-key">Style</td><td class="specs-value fk-data">Transparent Strap</td></tr><tr class=""><td class="specs-key">Color</td><td class="specs-value fk-data">Red</td></tr><tr class=""><td class="specs-key">Type</td><td class="specs-value fk-data">Flats</td></tr><tr class=""><td class="specs-key">Outer Material</td><td class="specs-value fk-data">Synthetic</td></tr><tr class=""><td class="specs-key">Inner Material</td><td class="specs-value fk-data">Synthetic</td></tr><tr class=""><td class="specs-key">Sole Material</td><td class="specs-value fk-data">PU</td></tr><tr class=""><td class="specs-key">Straps</td><td class="specs-value fk-data">Narrow Strap</td></tr><tr class=""><td class="specs-key">Tip Shape</td><td class="specs-value fk-data">Pointed</td></tr><tr class=""><td class="specs-key">Weight</td><td class="specs-value fk-data">135 gm (per single Sandal) - Weight of the product may vary depending on size.</td></tr></table><table cellspacing="0" class="fk-specs-type2"><tr><th class="group-head" colspan="2">Additional Details</th></tr><tr class=""><td class="specs-key">Other Details</td><td class="specs-value fk-data">Padded Footbed, Textured Sole</td></tr></table></div>
15:02:2014,flats,Portia.,Portia Flats,Rs. 1116,http://img5a.flixcart.com/image/shoe/h/t/c/camel-pt8y2099-10-portia-37-400x400-imadqsk8rhscxpvb.jpeg, No more colour,Rs. 1116,WS Retail,http://www.flipkart.com/portia-flats/p/itmdpmfxqew669eq?pid=SHODPMFXGGH5PHTC&srno=b_21&ref=40f50c5a-c871-457d-bc7d-5122ca68214e,LSTSHODPMFXGGH5PHTCJJDPXJ,   36 37 38 39 40,<div class="item_left_column" id="description"><h3 class="item_desc_title fk-uppercase">Portia Flats         Price: Rs.1116</h3><div class="cls"></div><div class="item_desc_text line"><div style="float:right"></div><p>	Lend divalicious elegance and feminine flair to your suave appeal by slipping into this pair of Portia flats. The<strong> jute and stone embellishment </strong>turns on your girly charm in an instant. The buckle closure at the ankle straps ensures perfect grip and easy adjustment. For a birthday bash of your friend, you can team these flats with a sequined top and skirt.</p><p>	For the confident modern woman who does not compromise on style, <strong>Portia </strong>offers delightful voguish choices in its collection of footwear, designed skillfully keeping in mind the comfort factor.</p><p><strong>Footwear Care</strong></p><p>	Clean them with a dry cloth.</p> </div><div style="clear: both;"></div></div>,<div class="item_left_column" id="specifications"><h3 class="item_desc_title fk-uppercase">        Specifications of Portia Flats    </h3><table cellspacing="0" class="fk-specs-type2"><tr><th class="group-head" colspan="2">General</th></tr><tr class=""><td class="specs-key">Ideal For</td><td class="specs-value fk-data">Women</td></tr></table><table cellspacing="0" class="fk-specs-type2"><tr><th class="group-head" colspan="2">Shoe Details</th></tr><tr class=""><td class="specs-key">Style</td><td class="specs-value fk-data">Panel and Stitch Detail, Buckle Closure at Ankle Strap, Jute and Stone Embellishment</td></tr><tr class=""><td class="specs-key">Color</td><td class="specs-value fk-data">Camel</td></tr><tr class=""><td class="specs-key">Outer Material</td><td class="specs-value fk-data">Synthetic Leather</td></tr><tr class=""><td class="specs-key">Inner Material</td><td class="specs-value fk-data">Non-Leather</td></tr><tr class=""><td class="specs-key">Sole Material</td><td class="specs-value fk-data">Sheet</td></tr><tr class=""><td class="specs-key">Tip Shape</td><td class="specs-value fk-data">Round</td></tr><tr class=""><td class="specs-key">Weight</td><td class="specs-value fk-data">174 gm (per single Shoe) - Weight of the product may vary depending on size.</td></tr></table><table cellspacing="0" class="fk-specs-type2"><tr><th class="group-head" colspan="2">Additional Details</th></tr><tr class=""><td class="specs-key">Other Details</td><td class="specs-value fk-data">Textured Sole and Footbed</td></tr></table></div>
15:02:2014,flats,Portia.,Portia Flats,Rs. 418,http://img5a.flixcart.com/image/sandal/7/q/r/frozy-psh2212-portia-37-400x400-imadhcvxne3ytec6.jpeg, No more colour,Rs. 418,WS Retail,http://www.flipkart.com/portia-flats/p/itmdm9g8gzaftvmc?pid=SNDDJCR9UY7GA7QR&srno=b_24&ref=40f50c5a-c871-457d-bc7d-5122ca68214e,LSTSNDDJCR9UY7GA7QREGZHXT, 35 36 37 40 41 42,<div class="item_left_column" id="description"><h3 class="item_desc_title fk-uppercase">Portia Flats         Price: Rs.418</h3><div class="cls"></div><div class="item_desc_text line"><div style="float:right"></div><p>	Experience a dash of relaxed comfort with every step you take in this pair of smart flats from the esteemed fashion house of Portia. Enhanced with a <strong>knot detail </strong>on the panelled straps, this pair of flats makes a perfect addition to your everyday accessories.</p><p>	For the confident modern woman who does not compromise on style, <strong>Portia</strong> offers delightful voguish choices in its collection of footwear, designed skilfully keeping in mind the comfort factor.</p><p><strong>Footwear Care</strong></p><p>	Keep these flats clean and neat by wiping them with a soft and damp cloth.</p> </div><div style="clear: both;"></div></div>,<div class="item_left_column" id="specifications"><h3 class="item_desc_title fk-uppercase">        Specifications of Portia Flats    </h3><table cellspacing="0" class="fk-specs-type2"><tr><th class="group-head" colspan="2">General</th></tr><tr class=""><td class="specs-key">Ideal For</td><td class="specs-value fk-data">Women</td></tr></table><table cellspacing="0" class="fk-specs-type2"><tr><th class="group-head" colspan="2">Sandal Details</th></tr><tr class=""><td class="specs-key">Style</td><td class="specs-value fk-data">Stitch Detail, Panelled Strap with Knot Detail</td></tr><tr class=""><td class="specs-key">Color</td><td class="specs-value fk-data">Firoze</td></tr><tr class=""><td class="specs-key">Type</td><td class="specs-value fk-data">Flats</td></tr><tr class=""><td class="specs-key">Outer Material</td><td class="specs-value fk-data">Synthetic</td></tr><tr class=""><td class="specs-key">Inner Material</td><td class="specs-value fk-data">Synthetic</td></tr><tr class=""><td class="specs-key">Sole Material</td><td class="specs-value fk-data">PU</td></tr><tr class=""><td class="specs-key">Tip Shape</td><td class="specs-value fk-data">Pointed</td></tr><tr class=""><td class="specs-key">Weight</td><td class="specs-value fk-data">119 gm (per single Sandal) - Weight of the product may vary depending on size.</td></tr></table><table cellspacing="0" class="fk-specs-type2"><tr><th class="group-head" colspan="2">Additional Details</th></tr><tr class=""><td class="specs-key">Other Details</td><td class="specs-value fk-data">Textured Sole, Padded Footbed, Toe Hold</td></tr></table></div>
15:02:2014,flats,Portia.,Portia Flats,Rs. 1116,http://img5a.flixcart.com/image/shoe/p/t/j/brown-pt0988-2-portia-37-400x400-imadqrpdmgqzkpdw.jpeg, No more colour,Rs. 1116,WS Retail,http://www.flipkart.com/portia-flats/p/itmdpmfwsgp9k9a4?pid=SHODPMFW7HMUY2GM&srno=b_25&ref=40f50c5a-c871-457d-bc7d-5122ca68214e,LSTSHODPMFW7HMUY2GMCYGHC0,   36 37 38 39 40,None,<div class="item_left_column" id="specifications"><h3 class="item_desc_title fk-uppercase">        Specifications of Portia Flats    </h3><table cellspacing="0" class="fk-specs-type2"><tr><th class="group-head" colspan="2">General</th></tr><tr class=""><td class="specs-key">Ideal For</td><td class="specs-value fk-data">Women</td></tr></table><table cellspacing="0" class="fk-specs-type2"><tr><th class="group-head" colspan="2">Shoe Details</th></tr><tr class=""><td class="specs-key">Style</td><td class="specs-value fk-data">Panel and Stitch Detail, Criss-cross and Braided Strap</td></tr><tr class=""><td class="specs-key">Color</td><td class="specs-value fk-data">Brown</td></tr><tr class=""><td class="specs-key">Outer Material</td><td class="specs-value fk-data">Synthetic Leather</td></tr><tr class=""><td class="specs-key">Inner Material</td><td class="specs-value fk-data">Non-Leather</td></tr><tr class=""><td class="specs-key">Sole Material</td><td class="specs-value fk-data">Sheet</td></tr><tr class=""><td class="specs-key">Closure</td><td class="specs-value fk-data">Zipper</td></tr><tr class=""><td class="specs-key">Tip Shape</td><td class="specs-value fk-data">Round</td></tr><tr class=""><td class="specs-key">Weight</td><td class="specs-value fk-data">164 gm (per single Shoe) - Weight of the product may vary depending on size.</td></tr></table><table cellspacing="0" class="fk-specs-type2"><tr><th class="group-head" colspan="2">Additional Details</th></tr><tr class=""><td class="specs-key">Other Details</td><td class="specs-value fk-data">Textured Sole, Padded Footbed</td></tr></table></div>
15:02:2014,flats,Portia.,Portia Flats,Rs. 1395,http://img6a.flixcart.com/image/shoe/z/z/x/camel-pts8913-61-portia-37-400x400-imadqrpfgqcgjkfw.jpeg, No more colour,Rs. 1395,WS Retail,http://www.flipkart.com/portia-flats/p/itmdpmfx4mntwzx5?pid=SHODPMFXYZHR6ZZX&srno=b_26&ref=40f50c5a-c871-457d-bc7d-5122ca68214e,LSTSHODPMFXYZHR6ZZXAXOIQH,  36 37 38 39 40,None,<div class="item_left_column" id="specifications"><h3 class="item_desc_title fk-uppercase">        Specifications of Portia Flats    </h3><table cellspacing="0" class="fk-specs-type2"><tr><th class="group-head" colspan="2">General</th></tr><tr class=""><td class="specs-key">Ideal For</td><td class="specs-value fk-data">Women</td></tr></table><table cellspacing="0" class="fk-specs-type2"><tr><th class="group-head" colspan="2">Shoe Details</th></tr><tr class=""><td class="specs-key">Style</td><td class="specs-value fk-data">Criss-cross Straps, Snake Textured Strap, Panel and Stitch Detail</td></tr><tr class=""><td class="specs-key">Color</td><td class="specs-value fk-data">Camel</td></tr><tr class=""><td class="specs-key">Outer Material</td><td class="specs-value fk-data">Synthetic Leather</td></tr><tr class=""><td class="specs-key">Inner Material</td><td class="specs-value fk-data">Non-Leather</td></tr><tr class=""><td class="specs-key">Sole Material</td><td class="specs-value fk-data">Sheet</td></tr><tr class=""><td class="specs-key">Closure</td><td class="specs-value fk-data">Zipper</td></tr><tr class=""><td class="specs-key">Tip Shape</td><td class="specs-value fk-data">Round</td></tr><tr class=""><td class="specs-key">Weight</td><td class="specs-value fk-data">155 gm (per single Shoe) - Weight of the product may vary depending on size.</td></tr></table><table cellspacing="0" class="fk-specs-type2"><tr><th class="group-head" colspan="2">Additional Details</th></tr><tr class=""><td class="specs-key">Other Details</td><td class="specs-value fk-data">Padded Footbed, Textured Sole, Toe Loop</td></tr></table></div>
