15:02:2014,heels,Tresmode.,Tresmode Jeump Heels,Rs. 1500,http://img5a.flixcart.com/image/sandal/g/e/r/beige-jeump-tresmode-40-400x400-imadr689nzmx5tk3.jpeg, No more colour,Rs. 1500,WS Retail,http://www.flipkart.com/tresmode-jeump-heels/p/itmdqjqhpvndpkwg?pid=SNDDQJQHHZQ3BZSJ&srno=b_1&ref=be13003f-c278-4643-af03-e6284683b6a7,LSTSNDDQJQHHZQ3BZSJWVYUGC,  35 36 37 38 39 40 41,<div class="item_left_column" id="description"><h3 class="item_desc_title fk-uppercase">Tresmode Jeump Heels         Price: Rs.1500</h3><div class="cls"></div><div class="item_desc_text line"><div style="float:right"></div><p style="text-align: justify;">	Her allegiance to high-fashion remains steadfast and so it's natural that she chooses these <strong>heels </strong>from Tresmode to finish her 9-5 look or for making a statement at the next cocktail party. Fashioned with a moderate <strong>3 inch heel</strong>, this pair is a must-have for the voguish belle. Team these heels with a knee-length skirt or with cigarette pants.</p><p style="text-align: justify;">	Living up to its uber chic standards, the colourful array of heels, wedges and flats from <strong>Tresmode</strong> have created a very large niche in the industry with its young, cool and fashion forward designs.</p><p style="text-align: justify;"><strong>Footwear Care</strong></p><p style="text-align: justify;">	Gently wipe with a dry cloth.</p> </div><div style="clear: both;"></div></div>,<div class="item_left_column" id="specifications"><h3 class="item_desc_title fk-uppercase">        Specifications of Tresmode Klump Heels    </h3><table cellspacing="0" class="fk-specs-type2"><tr><th class="group-head" colspan="2">General</th></tr><tr class=""><td class="specs-key">Ideal For</td><td class="specs-value fk-data">Women</td></tr></table><table cellspacing="0" class="fk-specs-type2"><tr><th class="group-head" colspan="2">Sandal Details</th></tr><tr class=""><td class="specs-key">Style</td><td class="specs-value fk-data">Panel and Stitch Detail</td></tr><tr class=""><td class="specs-key">Color</td><td class="specs-value fk-data">Beige</td></tr><tr class=""><td class="specs-key">Type</td><td class="specs-value fk-data">Heels</td></tr><tr class=""><td class="specs-key">Heel Height</td><td class="specs-value fk-data">3 inch</td></tr><tr class=""><td class="specs-key">Tip Shape</td><td class="specs-value fk-data">Pointed</td></tr><tr class=""><td class="specs-key">Weight</td><td class="specs-value fk-data">212 gm (per single Sandal) - Weight of the product may vary depending on size.</td></tr></table><table cellspacing="0" class="fk-specs-type2"><tr><th class="group-head" colspan="2">Additional Details</th></tr><tr class=""><td class="specs-key">Other Details</td><td class="specs-value fk-data">Textured Sole, Padded Footbed, Heel Construction</td></tr></table><table cellspacing="0" class="fk-specs-type2"><tr><th class="group-head" colspan="2">In the Box</th></tr><tr class=""><td class="specs-value fk-data" colspan="2">Heel Tip</td></tr></table></div>
15:02:2014,heels,Tresmode.,Tresmode Uberwork Heels,Rs. 1200,http://img6a.flixcart.com/image/sandal/r/p/w/black-uberwork-tresmode-40-400x400-imadr75wxncyvrbp.jpeg, No more colour,Rs. 1200,WS Retail,http://www.flipkart.com/tresmode-uberwork-heels/p/itmdqjqhyaarfdch?pid=SNDDQJQHZXJBZYFF&srno=b_12&ref=be13003f-c278-4643-af03-e6284683b6a7,LSTSNDDQJQHZXJBZYFFGCLKQW,  35 36 37 38 39 40 41,<div class="item_left_column" id="description"><h3 class="item_desc_title fk-uppercase">Tresmode Uberwork Heels         Price: Rs.1200</h3><div class="cls"></div><div class="item_desc_text line"><div style="float:right"></div><p>	Classy in its design, this pair of black Uberwork heels from Tresmode is for the superwoman within you. Flaunting a 2.8 inch heel height and the <strong>pointed tip shape</strong>, you can walk in to that big meeting, head held high. The gather detail in the front adds to the full ensemble of formal black pants and a tan coloured top.</p><p>	Living up to its uber chic standards, the colourful array of heels, wedges and flats from <strong>Tresmode </strong>have created a very large niche in the industry with its young, cool and fashion forward designs.</p><p><strong>Footwear Care</strong></p><p>	Wipe clean with a soft and slightly damp cloth.</p> </div><div style="clear: both;"></div></div>,<div class="item_left_column" id="specifications"><h3 class="item_desc_title fk-uppercase">        Specifications of Tresmode Uberwork Heels    </h3><table cellspacing="0" class="fk-specs-type2"><tr><th class="group-head" colspan="2">General</th></tr><tr class=""><td class="specs-key">Ideal For</td><td class="specs-value fk-data">Women</td></tr></table><table cellspacing="0" class="fk-specs-type2"><tr><th class="group-head" colspan="2">Sandal Details</th></tr><tr class=""><td class="specs-key">Style</td><td class="specs-value fk-data">Gathered Detailing at Front, Panel and Stitch Detail</td></tr><tr class=""><td class="specs-key">Color</td><td class="specs-value fk-data">Black</td></tr><tr class=""><td class="specs-key">Type</td><td class="specs-value fk-data">Heels</td></tr><tr class=""><td class="specs-key">Heel Height</td><td class="specs-value fk-data">2.8 inch</td></tr><tr class=""><td class="specs-key">Tip Shape</td><td class="specs-value fk-data">Pointed</td></tr><tr class=""><td class="specs-key">Weight</td><td class="specs-value fk-data">168 gm (per single Sandal) - Weight of the product may vary depending on size.</td></tr></table><table cellspacing="0" class="fk-specs-type2"><tr><th class="group-head" colspan="2">Additional Details</th></tr><tr class=""><td class="specs-key">Other Details</td><td class="specs-value fk-data">Padded Footbed, Textured Outsole</td></tr></table></div>
15:02:2014,heels,Tresmode.,Tresmode Jackpeep Heels,Rs. 3000,http://img6a.flixcart.com/image/sandal/s/p/b/black-jackpeep-tresmode-38-400x400-imadryfxy7nnmxez.jpeg, No more colour,Rs. 3000,WS Retail,http://www.flipkart.com/tresmode-jackpeep-heels/p/itmdqjqhfqz72vcg?pid=SNDDQJQGFKTRHGZH&srno=b_13&ref=be13003f-c278-4643-af03-e6284683b6a7,LSTSNDDQJQGFKTRHGZHU6ROPI,  36 37 38 39 40 41,<div class="item_left_column" id="description"><h3 class="item_desc_title fk-uppercase">Tresmode Jackpeep Heels         Price: Rs.3000</h3><div class="cls"></div><div class="item_desc_text line"><div style="float:right"></div><p>	Never underestimate the power of black, with this pair of Jackpeep heels from Tresmode. The <strong>peep toe feature</strong> is an added style feature that exemplifies the elegantly designed 2.2 inch heels. Pair it with dark blue skinny jeans and a satin blue top.</p><p>	Living up to its uber chic standards, the colourful array of heels, wedges and flats from<strong> Tresmode</strong> have created a very large niche in the industry with its young, cool and fashion forward designs.</p><p><strong>Footwear Care</strong></p><p>	Use a dry cloth to remove dust and grime.</p> </div><div style="clear: both;"></div></div>,<div class="item_left_column" id="specifications"><h3 class="item_desc_title fk-uppercase">        Specifications of Tresmode Jackpeep Heels    </h3><table cellspacing="0" class="fk-specs-type2"><tr><th class="group-head" colspan="2">General</th></tr><tr class=""><td class="specs-key">Ideal For</td><td class="specs-value fk-data">Women</td></tr></table><table cellspacing="0" class="fk-specs-type2"><tr><th class="group-head" colspan="2">Sandal Details</th></tr><tr class=""><td class="specs-key">Style</td><td class="specs-value fk-data">Peep Toe, Panel and Stitch Detail</td></tr><tr class=""><td class="specs-key">Color</td><td class="specs-value fk-data">Black</td></tr><tr class=""><td class="specs-key">Type</td><td class="specs-value fk-data">Heels</td></tr><tr class=""><td class="specs-key">Heel Height</td><td class="specs-value fk-data">2.2 inch</td></tr><tr class=""><td class="specs-key">Tip Shape</td><td class="specs-value fk-data">Round</td></tr><tr class=""><td class="specs-key">Weight</td><td class="specs-value fk-data">149 gm (per single Sandal) - Weight of the product may vary depending on size.</td></tr></table><table cellspacing="0" class="fk-specs-type2"><tr><th class="group-head" colspan="2">Additional Details</th></tr><tr class=""><td class="specs-key">Other Details</td><td class="specs-value fk-data">Textured Sole, Padded Footbed, Heel Construction</td></tr></table><table cellspacing="0" class="fk-specs-type2"><tr><th class="group-head" colspan="2">In the Box</th></tr><tr class=""><td class="specs-value fk-data" colspan="2">Heel Tip</td></tr></table></div>
