LSTSLBDQAXFMR8CCY5VCVLU20,Khoobsurati Vivid Contemporary Sling Bag,http://www.flipkart.com/lifestyle/bags-wallets-belts/women?otracker=hp_nmenu_sub_women_1_Bags%2C%20Wallets%20and%20Belts,Rs. 2228,Bags  Wallets and Belts,Slingbags,Khoobsurati,http://img5a.flixcart.com/image/sling-bag/y/5/v/ch1hbyl117-khoobsurati-vivid-contemporary-400x400-imadqa4yzuvnjgcx.jpeg,Rs. 2622,Yellow,women,http://www.flipkart.com/khoobsurati-vivid-contemporary-sling-bag/p/itmdqaxfefwh5rmx?pid=SLBDQAXFMR8CCY5V&srno=b_6&ref=c010f2eb-92a8-457f-a516-23c83f806be2,KhoobSurati,Khoobsurati Vivid Contemporary Sling Bag Yellow - Price in India | Flipkart.com,Flipkart.com: Buy Khoobsurati Vivid Contemporary Sling Bag for Rs. 2228 from Flipkart.com. Only Genuine Products. 30 Day Replacement Guarantee. Free Shipping. Cash On,[],<div class="item_left_column" id="description"> <h3 class="item_desc_title fk-uppercase">Khoobsurati Vivid Contemporary Sling Bag (Yellow)         Price: Rs.2228</h3> <div class="cls"></div> <div class="item_desc_text line"> <div style="float:right"> </div>                         Get the combo of cute and trendy looks with this wonderful slingbag Its attractive design features map-like drawings while its pleasant colour makes it match any attire. It easily stuffs all essentials and endures even on rough use.        </div> <div style="clear: both;"></div> </div>,<div class="item_left_column" id="specifications"> <h3 class="item_desc_title fk-uppercase">         Specifications of Khoobsurati Vivid Contemporary Sling Bag (Yellow)    </h3> <table cellspacing="0" class="fk-specs-type2"> <tr> <th class="group-head" colspan="2">General</th> </tr> <tr class=""> <td class="specs-key">Ideal For</td> <td class="specs-value fk-data">Women</td> </tr> <tr class=""> <td class="specs-key">Occasion</td> <td class="specs-value fk-data">Evening</td> </tr> <tr class=""> <td class="specs-key">Material</td> <td class="specs-value fk-data">Faux Leather</td> </tr> <tr class=""> <td class="specs-key">Closure</td> <td class="specs-value fk-data">Zipper</td> </tr> <tr class=""> <td class="specs-key">Style Code</td> <td class="specs-value fk-data">CH1HBYL117</td> </tr> <tr class=""> <td class="specs-key">Color Code</td> <td class="specs-value fk-data">Yellow</td> </tr> </table> <table cellspacing="0" class="fk-specs-type2"> <tr> <th class="group-head" colspan="2">Body Features</th> </tr> <tr class=""> <td class="specs-key">Number of Pockets</td> <td class="specs-value fk-data">4</td> </tr> </table> <table cellspacing="0" class="fk-specs-type2"> <tr> <th class="group-head" colspan="2">Dimensions</th> </tr> <tr class=""> <td class="specs-key">Width</td> <td class="specs-value fk-data">85 mm</td> </tr> <tr class=""> <td class="specs-key">Height</td> <td class="specs-value fk-data">240 mm</td> </tr> </table> </div>,10:03:2014,None
LSTSLBDRZ5JZK6PTDK3XEMA5P,Khoobsurati Uber Cool Chic Medium Sling Bag,http://www.flipkart.com/lifestyle/bags-wallets-belts/women?otracker=hp_nmenu_sub_women_1_Bags%2C%20Wallets%20and%20Belts,Rs. 916,Bags  Wallets and Belts,Slingbags,Khoobsurati,http://img5a.flixcart.com/image/sling-bag/d/k/3/ch2hbmclr425-khoobsurati-sling-bag-uber-cool-chic-400x400-imadrwqtrxf28w9e.jpeg,Rs. 1018,Multi-color,women,http://www.flipkart.com/khoobsurati-uber-cool-chic-medium-sling-bag/p/itmdrz5kqngcrhc4?pid=SLBDRZ5JZK6PTDK3&srno=b_1&ref=c010f2eb-92a8-457f-a516-23c83f806be2,KhoobSurati,Khoobsurati Uber Cool Chic Medium Sling Bag Multicolor - Price in India | Flipkart.com,Flipkart.com: Buy Khoobsurati Uber Cool Chic Medium Sling Bag for Rs. 916 from Flipkart.com. Only Genuine Products. 30 Day Replacement Guarantee. Free Shipping. Cash On,[],<div class="item_left_column" id="description"> <h3 class="item_desc_title fk-uppercase">Khoobsurati Uber Cool Chic Medium Sling Bag (Multicolor)         Price: Rs.916</h3> <div class="cls"></div> <div class="item_desc_text line"> <div style="float:right"> </div>                         Set a new definition of your persona by carrying this contemporary  stylish and versatile sling bag. Made from fine quality faux leather and accorded with multiple pockets and zip openings  this fashion accessory will enhance the way people characterize you. Features - Multiple  spacious compartments and pockets  Attractive exterior with a versatile interior with zip openings  Durable  quality Material - for a long life and rough use  Light-weight  Easy to carry and handle  Ideal for daily carry. Disclaimer - Product color may slightly vary due to photographic lighting sources or your monitor settings. Specifications - Material - Faux Leather  Dimensions (inch. )Approx. (13 x 35 x 3. 5). Color - Multicolor . Waterproof - Yes. No. Of Pockets Inside - 2. No. Of Pockets Outside - 1. Mesh Pocket Outside - No. Card Holder - 1. Extra Belt Size - No        </div> <div style="clear: both;"></div> </div>,<div class="item_left_column" id="specifications"> <h3 class="item_desc_title fk-uppercase">         Specifications of Khoobsurati Uber Cool Chic Medium Sling Bag (Multicolor)    </h3> <table cellspacing="0" class="fk-specs-type2"> <tr> <th class="group-head" colspan="2">General</th> </tr> <tr class=""> <td class="specs-key">Type</td> <td class="specs-value fk-data">Sling Bag</td> </tr> <tr class=""> <td class="specs-key">Ideal For</td> <td class="specs-value fk-data">Women</td> </tr> <tr class=""> <td class="specs-key">Bag Size</td> <td class="specs-value fk-data">Medium</td> </tr> <tr class=""> <td class="specs-key">Occasion</td> <td class="specs-value fk-data">Evening - - Casual</td> </tr> <tr class=""> <td class="specs-key">Material</td> <td class="specs-value fk-data">Faux Leather</td> </tr> <tr class=""> <td class="specs-key">Closure</td> <td class="specs-value fk-data">Zip</td> </tr> <tr class=""> <td class="specs-key">Style Code</td> <td class="specs-value fk-data">CH2HBMCLR425</td> </tr> <tr class=""> <td class="specs-key">Color Code</td> <td class="specs-value fk-data">Multicolor</td> </tr> </table> <table cellspacing="0" class="fk-specs-type2"> <tr> <th class="group-head" colspan="2">Body Features</th> </tr> <tr class=""> <td class="specs-key">Number of Pockets</td> <td class="specs-value fk-data">3</td> </tr> <tr class=""> <td class="specs-key">Number of Compartments</td> <td class="specs-value fk-data">1</td> </tr> </table> <table cellspacing="0" class="fk-specs-type2"> <tr> <th class="group-head" colspan="2">Dimensions</th> </tr> <tr class=""> <td class="specs-key">Width</td> <td class="specs-value fk-data">330 mm</td> </tr> <tr class=""> <td class="specs-key">Height</td> <td class="specs-value fk-data">889 mm</td> </tr> <tr class=""> <td class="specs-key">Depth</td> <td class="specs-value fk-data">89 mm</td> </tr> </table> </div>,10:03:2014,None
LSTSLBDQAXFA7G7N9ZSDMIAG2,Khoobsurati Peppy Sling Bag,http://www.flipkart.com/lifestyle/bags-wallets-belts/women?otracker=hp_nmenu_sub_women_1_Bags%2C%20Wallets%20and%20Belts,Rs. 1049,Bags  Wallets and Belts,Slingbags,Khoobsurati,http://img6a.flixcart.com/image/sling-bag/9/z/s/ch1hbbr028-khoobsurati-peppy-400x400-imadqa4yaftzsgc7.jpeg,Rs. 1235,Brown,women,http://www.flipkart.com/khoobsurati-peppy-sling-bag/p/itmdqaxfp75qbz3d?pid=SLBDQAXFA7G7N9ZS&srno=b_3&ref=c010f2eb-92a8-457f-a516-23c83f806be2,KhoobSurati,Khoobsurati Peppy Sling Bag Brown - Price in India | Flipkart.com,Flipkart.com: Buy Khoobsurati Peppy Sling Bag for Rs. 1049 from Flipkart.com. Only Genuine Products. 30 Day Replacement Guarantee. Free Shipping. Cash On,[],<div class="item_left_column" id="description"> <h3 class="item_desc_title fk-uppercase">Khoobsurati Peppy Sling Bag (Brown)         Price: Rs.1049</h3> <div class="cls"></div> <div class="item_desc_text line"> <div style="float:right"> </div>                         Make a distinct style statement carrying this peppy Brown sling bag. Designed to perfection  this sling bag will look stylish and as it is made with good quality material  it is durable as well. While its long and detachable strap allows it to sling across in style  its trendy flap closure boosts the overall appearance.        </div> <div style="clear: both;"></div> </div>,<div class="item_left_column" id="specifications"> <h3 class="item_desc_title fk-uppercase">         Specifications of Khoobsurati Peppy Sling Bag (Brown)    </h3> <table cellspacing="0" class="fk-specs-type2"> <tr> <th class="group-head" colspan="2">General</th> </tr> <tr class=""> <td class="specs-key">Ideal For</td> <td class="specs-value fk-data">Women</td> </tr> <tr class=""> <td class="specs-key">Occasion</td> <td class="specs-value fk-data">Evening</td> </tr> <tr class=""> <td class="specs-key">Material</td> <td class="specs-value fk-data">Faux Leather</td> </tr> <tr class=""> <td class="specs-key">Closure</td> <td class="specs-value fk-data">Zipper</td> </tr> <tr class=""> <td class="specs-key">Style Code</td> <td class="specs-value fk-data">CH1HBBR028</td> </tr> <tr class=""> <td class="specs-key">Color Code</td> <td class="specs-value fk-data">Brown</td> </tr> </table> <table cellspacing="0" class="fk-specs-type2"> <tr> <th class="group-head" colspan="2">Body Features</th> </tr> <tr class=""> <td class="specs-key">Number of Pockets</td> <td class="specs-value fk-data">2</td> </tr> </table> <table cellspacing="0" class="fk-specs-type2"> <tr> <th class="group-head" colspan="2">Dimensions</th> </tr> <tr class=""> <td class="specs-key">Width</td> <td class="specs-value fk-data">35 mm</td> </tr> <tr class=""> <td class="specs-key">Height</td> <td class="specs-value fk-data">275 mm</td> </tr> </table> </div>,10:03:2014,None
LSTSLBDQAXFMZ3JCB8ZGB1ACD,Khoobsurati Gorgeous Craftsy Typical Sling Bag,http://www.flipkart.com/lifestyle/bags-wallets-belts/women?otracker=hp_nmenu_sub_women_1_Bags%2C%20Wallets%20and%20Belts,Rs. 1624,Bags  Wallets and Belts,Slingbags,Khoobsurati,http://img6a.flixcart.com/image/sling-bag/b/8/z/ch1hbgy110-khoobsurati-gorgeous-craftsy-typical-400x400-imadqa4ytsazhca2.jpeg,Rs. 1911,Grey,women,http://www.flipkart.com/khoobsurati-gorgeous-craftsy-typical-sling-bag/p/itmdqaxfxgywv8ev?pid=SLBDQAXFMZ3JCB8Z&srno=b_4&ref=c010f2eb-92a8-457f-a516-23c83f806be2,KhoobSurati,Khoobsurati Gorgeous Craftsy Typical Sling Bag Grey - Price in India | Flipkart.com,Flipkart.com: Buy Khoobsurati Gorgeous Craftsy Typical Sling Bag for Rs. 1624 from Flipkart.com. Only Genuine Products. 30 Day Replacement Guarantee. Free Shipping. Cash On,[],<div class="item_left_column" id="description"> <h3 class="item_desc_title fk-uppercase">Khoobsurati Gorgeous Craftsy Typical Sling Bag (Grey)         Price: Rs.1624</h3> <div class="cls"></div> <div class="item_desc_text line"> <div style="float:right"> </div>                         Flaunt an attractive look carrying this astonishingly modish sling bag With the combination of blissful colour and eye-catchy design  this bag will look exceptionally stylish with any outfit you choose to wear.        </div> <div style="clear: both;"></div> </div>,<div class="item_left_column" id="specifications"> <h3 class="item_desc_title fk-uppercase">         Specifications of Khoobsurati Gorgeous Craftsy Typical Sling Bag (Grey)    </h3> <table cellspacing="0" class="fk-specs-type2"> <tr> <th class="group-head" colspan="2">General</th> </tr> <tr class=""> <td class="specs-key">Ideal For</td> <td class="specs-value fk-data">Women</td> </tr> <tr class=""> <td class="specs-key">Occasion</td> <td class="specs-value fk-data">Evening</td> </tr> <tr class=""> <td class="specs-key">Material</td> <td class="specs-value fk-data">Faux Leather</td> </tr> <tr class=""> <td class="specs-key">Closure</td> <td class="specs-value fk-data">Zipper</td> </tr> <tr class=""> <td class="specs-key">Style Code</td> <td class="specs-value fk-data">CH1HBGY110</td> </tr> <tr class=""> <td class="specs-key">Color Code</td> <td class="specs-value fk-data">Grey</td> </tr> </table> <table cellspacing="0" class="fk-specs-type2"> <tr> <th class="group-head" colspan="2">Body Features</th> </tr> <tr class=""> <td class="specs-key">Number of Pockets</td> <td class="specs-value fk-data">4</td> </tr> </table> <table cellspacing="0" class="fk-specs-type2"> <tr> <th class="group-head" colspan="2">Dimensions</th> </tr> <tr class=""> <td class="specs-key">Width</td> <td class="specs-value fk-data">85 mm</td> </tr> <tr class=""> <td class="specs-key">Height</td> <td class="specs-value fk-data">225 mm</td> </tr> </table> </div>,10:03:2014,None
LSTSLBDQAXF4AHA5NHFZGGPUQ,Khoobsurati Classic Artistic Sling Bag,http://www.flipkart.com/lifestyle/bags-wallets-belts/women?otracker=hp_nmenu_sub_women_1_Bags%2C%20Wallets%20and%20Belts,Rs. 653,Bags  Wallets and Belts,Slingbags,Khoobsurati,http://img6a.flixcart.com/image/sling-bag/n/h/f/ch1hbdgr062-khoobsurati-classic-artistic-400x400-imadqa4yxxhbdezr.jpeg,Rs. 769,Green,women,http://www.flipkart.com/khoobsurati-classic-artistic-sling-bag/p/itmdqaxfcvm2gdy6?pid=SLBDQAXF4AHA5NHF&srno=b_2&ref=c010f2eb-92a8-457f-a516-23c83f806be2,KhoobSurati,Khoobsurati Classic Artistic Sling Bag Green - Price in India | Flipkart.com,Flipkart.com: Buy Khoobsurati Classic Artistic Sling Bag for Rs. 653 from Flipkart.com. Only Genuine Products. 30 Day Replacement Guarantee. Free Shipping. Cash On,[],<div class="item_left_column" id="description"> <h3 class="item_desc_title fk-uppercase">Khoobsurati Classic Artistic Sling Bag (Green)         Price: Rs.653</h3> <div class="cls"></div> <div class="item_desc_text line"> <div style="float:right"> </div>                         Crafted with unique design  this hand bag with elegant and regal print is very special in its class. The traditional pattern printed on this bag allows you to match with all your ethnic wears and designer costumes.        </div> <div style="clear: both;"></div> </div>,<div class="item_left_column" id="specifications"> <h3 class="item_desc_title fk-uppercase">         Specifications of Khoobsurati Classic Artistic Sling Bag (Green)    </h3> <table cellspacing="0" class="fk-specs-type2"> <tr> <th class="group-head" colspan="2">General</th> </tr> <tr class=""> <td class="specs-key">Ideal For</td> <td class="specs-value fk-data">Women</td> </tr> <tr class=""> <td class="specs-key">Occasion</td> <td class="specs-value fk-data">Evening</td> </tr> <tr class=""> <td class="specs-key">Material</td> <td class="specs-value fk-data">Faux Leather</td> </tr> <tr class=""> <td class="specs-key">Closure</td> <td class="specs-value fk-data">Zipper</td> </tr> <tr class=""> <td class="specs-key">Style Code</td> <td class="specs-value fk-data">CH1HBDGR062</td> </tr> <tr class=""> <td class="specs-key">Color Code</td> <td class="specs-value fk-data">Green</td> </tr> </table> <table cellspacing="0" class="fk-specs-type2"> <tr> <th class="group-head" colspan="2">Body Features</th> </tr> <tr class=""> <td class="specs-key">Number of Pockets</td> <td class="specs-value fk-data">2</td> </tr> </table> <table cellspacing="0" class="fk-specs-type2"> <tr> <th class="group-head" colspan="2">Dimensions</th> </tr> <tr class=""> <td class="specs-key">Width</td> <td class="specs-value fk-data">200 mm</td> </tr> <tr class=""> <td class="specs-key">Height</td> <td class="specs-value fk-data">225 mm</td> </tr> </table> </div>,10:03:2014,None
LSTSLBDQAXFCUNRVBPV3P4K0Z,Khoobsurati Gracious Contemporary Sling Bag,http://www.flipkart.com/lifestyle/bags-wallets-belts/women?otracker=hp_nmenu_sub_women_1_Bags%2C%20Wallets%20and%20Belts,Rs. 663,Bags  Wallets and Belts,Slingbags,Khoobsurati,http://img5a.flixcart.com/image/sling-bag/b/p/v/ch1hbbr078-khoobsurati-gracious-contemporary-400x400-imadqa4ynge7ybx2.jpeg,Rs. 780,Brown,women,http://www.flipkart.com/khoobsurati-gracious-contemporary-sling-bag/p/itmdqaxf3xra86zx?pid=SLBDQAXFCUNRVBPV&srno=b_8&ref=c010f2eb-92a8-457f-a516-23c83f806be2,KhoobSurati,Khoobsurati Gracious Contemporary Sling Bag Yellowish-Brown - Price in India | Flipkart.com,Flipkart.com: Buy Khoobsurati Gracious Contemporary Sling Bag for Rs. 663 from Flipkart.com. Only Genuine Products. 30 Day Replacement Guarantee. Free Shipping. Cash On,[],<div class="item_left_column" id="description"> <h3 class="item_desc_title fk-uppercase">Khoobsurati Gracious Contemporary Sling Bag (Yellowish-Brown)         Price: Rs.663</h3> <div class="cls"></div> <div class="item_desc_text line"> <div style="float:right"> </div>                         This yellowish brown belt studded sling bag is a cool and handy piece to carry on. Designed as a semi-pouched bag with chain compartment on its front  its look gets more elaborated with flap and zipper in front. An elegant product designed for today.        </div> <div style="clear: both;"></div> </div>,<div class="item_left_column" id="specifications"> <h3 class="item_desc_title fk-uppercase">         Specifications of Khoobsurati Gracious Contemporary Sling Bag (Yellowish-Brown)    </h3> <table cellspacing="0" class="fk-specs-type2"> <tr> <th class="group-head" colspan="2">General</th> </tr> <tr class=""> <td class="specs-key">Ideal For</td> <td class="specs-value fk-data">Women</td> </tr> <tr class=""> <td class="specs-key">Occasion</td> <td class="specs-value fk-data">Evening</td> </tr> <tr class=""> <td class="specs-key">Material</td> <td class="specs-value fk-data">Faux Leather</td> </tr> <tr class=""> <td class="specs-key">Closure</td> <td class="specs-value fk-data">Zipper</td> </tr> <tr class=""> <td class="specs-key">Style Code</td> <td class="specs-value fk-data">CH1HBBR078</td> </tr> <tr class=""> <td class="specs-key">Color Code</td> <td class="specs-value fk-data">Yellowish-Brown</td> </tr> </table> <table cellspacing="0" class="fk-specs-type2"> <tr> <th class="group-head" colspan="2">Body Features</th> </tr> <tr class=""> <td class="specs-key">Number of Pockets</td> <td class="specs-value fk-data">3</td> </tr> </table> <table cellspacing="0" class="fk-specs-type2"> <tr> <th class="group-head" colspan="2">Dimensions</th> </tr> <tr class=""> <td class="specs-key">Width</td> <td class="specs-value fk-data">35 mm</td> </tr> <tr class=""> <td class="specs-key">Height</td> <td class="specs-value fk-data">175 mm</td> </tr> </table> </div>,10:03:2014,None
LSTSLBDQAXF8BEJZG8BLWYSNK,Khoobsurati Pretty Silver Sparkling Sling Bag,http://www.flipkart.com/lifestyle/bags-wallets-belts/women?otracker=hp_nmenu_sub_women_1_Bags%2C%20Wallets%20and%20Belts,Rs. 1700,Bags  Wallets and Belts,Slingbags,Khoobsurati,http://img6a.flixcart.com/image/sling-bag/g/8/b/ch1hbsl046-khoobsurati-pretty-silver-sparkling-400x400-imadqa4ywgrvpuey.jpeg,Rs. 2000,Silver,women,http://www.flipkart.com/khoobsurati-pretty-silver-sparkling-sling-bag/p/itmdqaxfaffy5wav?pid=SLBDQAXF8BEJZG8B&srno=b_12&ref=c010f2eb-92a8-457f-a516-23c83f806be2,KhoobSurati,Khoobsurati Pretty Silver Sparkling Sling Bag Silver - Price in India | Flipkart.com,Flipkart.com: Buy Khoobsurati Pretty Silver Sparkling Sling Bag for Rs. 1700 from Flipkart.com. Only Genuine Products. 30 Day Replacement Guarantee. Free Shipping. Cash On,[],<div class="item_left_column" id="description"> <h3 class="item_desc_title fk-uppercase">Khoobsurati Pretty Silver Sparkling Sling Bag (Silver)         Price: Rs.1700</h3> <div class="cls"></div> <div class="item_desc_text line"> <div style="float:right"> </div>                         Are you among those who love to get the benefits of two in one thing? Then check-out this clutch style pouch which is made only for you. It will go brilliantly with any kind of attire you put on. Team it with your cute short dress or a pair of denim.        </div> <div style="clear: both;"></div> </div>,<div class="item_left_column" id="specifications"> <h3 class="item_desc_title fk-uppercase">         Specifications of Khoobsurati Pretty Silver Sparkling Sling Bag (Silver)    </h3> <table cellspacing="0" class="fk-specs-type2"> <tr> <th class="group-head" colspan="2">General</th> </tr> <tr class=""> <td class="specs-key">Ideal For</td> <td class="specs-value fk-data">Women</td> </tr> <tr class=""> <td class="specs-key">Occasion</td> <td class="specs-value fk-data">Evening</td> </tr> <tr class=""> <td class="specs-key">Material</td> <td class="specs-value fk-data">Faux Leather</td> </tr> <tr class=""> <td class="specs-key">Closure</td> <td class="specs-value fk-data">Zipper</td> </tr> <tr class=""> <td class="specs-key">Style Code</td> <td class="specs-value fk-data">CH1HBSL046</td> </tr> <tr class=""> <td class="specs-key">Color Code</td> <td class="specs-value fk-data">Silver</td> </tr> </table> <table cellspacing="0" class="fk-specs-type2"> <tr> <th class="group-head" colspan="2">Body Features</th> </tr> <tr class=""> <td class="specs-key">Number of Pockets</td> <td class="specs-value fk-data">2</td> </tr> </table> <table cellspacing="0" class="fk-specs-type2"> <tr> <th class="group-head" colspan="2">Dimensions</th> </tr> <tr class=""> <td class="specs-key">Width</td> <td class="specs-value fk-data">25 mm</td> </tr> <tr class=""> <td class="specs-key">Height</td> <td class="specs-value fk-data">200 mm</td> </tr> </table> </div>,10:03:2014,None
LSTSLBDQAXF25FDWWMXAGOWKM,Khoobsurati Vivid Contemporary Sling Bag,http://www.flipkart.com/lifestyle/bags-wallets-belts/women?otracker=hp_nmenu_sub_women_1_Bags%2C%20Wallets%20and%20Belts,Rs. 2228,Bags  Wallets and Belts,Slingbags,Khoobsurati,http://img5a.flixcart.com/image/sling-bag/w/m/x/ch1hbpc118-khoobsurati-vivid-contemporary-400x400-imadqa4ynucazvgp.jpeg,Rs. 2622,Pink,women,http://www.flipkart.com/khoobsurati-vivid-contemporary-sling-bag/p/itmdqaxfnr82hkaj?pid=SLBDQAXF25FDWWMX&srno=b_16&ref=ce662836-e9af-4b4d-982a-0fa14ab8cf65,KhoobSurati,Khoobsurati Vivid Contemporary Sling Bag Peach - Price in India | Flipkart.com,Flipkart.com: Buy Khoobsurati Vivid Contemporary Sling Bag for Rs. 2228 from Flipkart.com. Only Genuine Products. 30 Day Replacement Guarantee. Free Shipping. Cash On,[],<div class="item_left_column" id="description"> <h3 class="item_desc_title fk-uppercase">Khoobsurati Vivid Contemporary Sling Bag (Peach)         Price: Rs.2228</h3> <div class="cls"></div> <div class="item_desc_text line"> <div style="float:right"> </div>                         Get the combo of cute and trendy looks with this wonderful slingbag Its attractive design features map-like drawings while its pleasant colour makes it match any attire. It easily stuffs all essentials and endures even on rough use. First-class material. Impressive design  Plenty of space  Simple maintenance. Disclaimer:Product color may slightly vary due to photographic lighting sources or your monitor settings.        </div> <div style="clear: both;"></div> </div>,<div class="item_left_column" id="specifications"> <h3 class="item_desc_title fk-uppercase">         Specifications of Khoobsurati Vivid Contemporary Sling Bag (Peach)    </h3> <table cellspacing="0" class="fk-specs-type2"> <tr> <th class="group-head" colspan="2">General</th> </tr> <tr class=""> <td class="specs-key">Ideal For</td> <td class="specs-value fk-data">Women</td> </tr> <tr class=""> <td class="specs-key">Occasion</td> <td class="specs-value fk-data">Evening</td> </tr> <tr class=""> <td class="specs-key">Material</td> <td class="specs-value fk-data">Faux Leather</td> </tr> <tr class=""> <td class="specs-key">Closure</td> <td class="specs-value fk-data">Zipper</td> </tr> <tr class=""> <td class="specs-key">Style Code</td> <td class="specs-value fk-data">CH1HBPC118</td> </tr> <tr class=""> <td class="specs-key">Color Code</td> <td class="specs-value fk-data">Peach</td> </tr> </table> <table cellspacing="0" class="fk-specs-type2"> <tr> <th class="group-head" colspan="2">Body Features</th> </tr> <tr class=""> <td class="specs-key">Number of Pockets</td> <td class="specs-value fk-data">4</td> </tr> </table> <table cellspacing="0" class="fk-specs-type2"> <tr> <th class="group-head" colspan="2">Dimensions</th> </tr> <tr class=""> <td class="specs-key">Width</td> <td class="specs-value fk-data">85 mm</td> </tr> <tr class=""> <td class="specs-key">Height</td> <td class="specs-value fk-data">240 mm</td> </tr> </table> </div>,10:03:2014,None
