LSTSLBDRZ5J54KZFZWM8ZOKEP,Khoobsurati Designer Rarefied Medium Sling Bag,http://www.flipkart.com/lifestyle/bags-wallets-belts/women?otracker=hp_nmenu_sub_women_1_Bags%2C%20Wallets%20and%20Belts,Rs. 916,Bags  Wallets and Belts,Slingbags,Khoobsurati,http://img5a.flixcart.com/image/sling-bag/d/a/q/ch2hbmclr428-khoobsurati-slingbag-designer-rarefied-400x400-imadrwq6jpmmdajf.jpeg,Rs. 1018,Multi-color,women,http://www.flipkart.com/khoobsurati-designer-rarefied-medium-sling-bag/p/itmdrz5k7nhqt3ux?pid=SLBDRZ5J54KZFZWM&srno=b_23&ref=ce662836-e9af-4b4d-982a-0fa14ab8cf65,KhoobSurati,Khoobsurati Designer Rarefied Medium Sling Bag Multicolor - Price in India | Flipkart.com,Flipkart.com: Buy Khoobsurati Designer Rarefied Medium Sling Bag for Rs. 916 from Flipkart.com. Only Genuine Products. 30 Day Replacement Guarantee. Free Shipping. Cash On,[],<div class="item_left_column" id="description"> <h3 class="item_desc_title fk-uppercase">Khoobsurati Designer Rarefied Medium Sling Bag (Multicolor)         Price: Rs.916</h3> <div class="cls"></div> <div class="item_desc_text line"> <div style="float:right"> </div>                         The impressive and stylish-looking handbag is marked with the dapples of sporty. Color that arouse a sense of exuberance and liveliness while it is useful and versatile. Features makes you drool over it. Shop for this bag now and let the world know your quintessential fashion mien. Features - Alluring features and marvelous design  Distinctive multiple pockets for versatile use  Good quality Material - lets to have a long life  Easy to carry and easy to handle. Ideal to take along everyday. Disclaimer - Product color may slightly vary due to photographic lighting sources or your monitor settings. . Specifications - Material - Faux Leather  Dimensions (inch. )Approx. (13 x 35 x 3. 5). Color - MultiColor . Waterproof - Yes. No. Of Pockets Inside - 2. No. Of Pockets Outside - 1. Mesh Pocket Outside - No. Card Holder - 1. Extra Belt Size - No        </div> <div style="clear: both;"></div> </div>,<div class="item_left_column" id="specifications"> <h3 class="item_desc_title fk-uppercase">         Specifications of Khoobsurati Designer Rarefied Medium Sling Bag (Multicolor)    </h3> <table cellspacing="0" class="fk-specs-type2"> <tr> <th class="group-head" colspan="2">General</th> </tr> <tr class=""> <td class="specs-key">Type</td> <td class="specs-value fk-data">Sling Bag</td> </tr> <tr class=""> <td class="specs-key">Ideal For</td> <td class="specs-value fk-data">Women</td> </tr> <tr class=""> <td class="specs-key">Bag Size</td> <td class="specs-value fk-data">Medium</td> </tr> <tr class=""> <td class="specs-key">Occasion</td> <td class="specs-value fk-data">Evening - - Casual</td> </tr> <tr class=""> <td class="specs-key">Material</td> <td class="specs-value fk-data">Faux Leather</td> </tr> <tr class=""> <td class="specs-key">Closure</td> <td class="specs-value fk-data">Zip</td> </tr> <tr class=""> <td class="specs-key">Style Code</td> <td class="specs-value fk-data">CH2HBMCLR428</td> </tr> <tr class=""> <td class="specs-key">Color Code</td> <td class="specs-value fk-data">Multicolor</td> </tr> </table> <table cellspacing="0" class="fk-specs-type2"> <tr> <th class="group-head" colspan="2">Body Features</th> </tr> <tr class=""> <td class="specs-key">Number of Pockets</td> <td class="specs-value fk-data">3</td> </tr> <tr class=""> <td class="specs-key">Number of Compartments</td> <td class="specs-value fk-data">1</td> </tr> </table> <table cellspacing="0" class="fk-specs-type2"> <tr> <th class="group-head" colspan="2">Dimensions</th> </tr> <tr class=""> <td class="specs-key">Width</td> <td class="specs-value fk-data">330 mm</td> </tr> <tr class=""> <td class="specs-key">Height</td> <td class="specs-value fk-data">889 mm</td> </tr> <tr class=""> <td class="specs-key">Depth</td> <td class="specs-value fk-data">89 mm</td> </tr> </table> </div>,10:03:2014,None
LSTSLBDQAXF4THPYWUSNQLVMC,Khoobsurati Exclusive Seraphic Sling Bag,http://www.flipkart.com/lifestyle/bags-wallets-belts/women?otracker=hp_nmenu_sub_women_1_Bags%2C%20Wallets%20and%20Belts,Rs. 1102,Bags  Wallets and Belts,Slingbags,Khoobsurati,http://img5a.flixcart.com/image/sling-bag/w/u/s/ch1hbrd101-khoobsurati-exclusive-seraphic-400x400-imadqa4yqfw2ura4.jpeg,Rs. 1297,Red,women,http://www.flipkart.com/khoobsurati-exclusive-seraphic-sling-bag/p/itmdqaxf63tqcfqm?pid=SLBDQAXF4THPYWUS&srno=b_13&ref=c010f2eb-92a8-457f-a516-23c83f806be2,KhoobSurati,Khoobsurati Exclusive Seraphic Sling Bag Red - Price in India | Flipkart.com,Flipkart.com: Buy Khoobsurati Exclusive Seraphic Sling Bag for Rs. 1102 from Flipkart.com. Only Genuine Products. 30 Day Replacement Guarantee. Free Shipping. Cash On,[],<div class="item_left_column" id="description"> <h3 class="item_desc_title fk-uppercase">Khoobsurati Exclusive Seraphic Sling Bag (Red)         Price: Rs.1102</h3> <div class="cls"></div> <div class="item_desc_text line"> <div style="float:right"> </div>                         You will surely get lots of appreciation carrying this amazing slingbag Having excellent design and style  this bag will complement any of your favorite outfit. Not only this  it will easily stuff all your essentials and lasts for pretty long time.        </div> <div style="clear: both;"></div> </div>,<div class="item_left_column" id="specifications"> <h3 class="item_desc_title fk-uppercase">         Specifications of Khoobsurati Exclusive Seraphic Sling Bag (Red)    </h3> <table cellspacing="0" class="fk-specs-type2"> <tr> <th class="group-head" colspan="2">General</th> </tr> <tr class=""> <td class="specs-key">Ideal For</td> <td class="specs-value fk-data">Women</td> </tr> <tr class=""> <td class="specs-key">Occasion</td> <td class="specs-value fk-data">Evening</td> </tr> <tr class=""> <td class="specs-key">Material</td> <td class="specs-value fk-data">Faux Leather</td> </tr> <tr class=""> <td class="specs-key">Closure</td> <td class="specs-value fk-data">Zipper</td> </tr> <tr class=""> <td class="specs-key">Style Code</td> <td class="specs-value fk-data">CH1HBRD101</td> </tr> <tr class=""> <td class="specs-key">Color Code</td> <td class="specs-value fk-data">Red</td> </tr> </table> <table cellspacing="0" class="fk-specs-type2"> <tr> <th class="group-head" colspan="2">Body Features</th> </tr> <tr class=""> <td class="specs-key">Number of Pockets</td> <td class="specs-value fk-data">2</td> </tr> </table> <table cellspacing="0" class="fk-specs-type2"> <tr> <th class="group-head" colspan="2">Dimensions</th> </tr> <tr class=""> <td class="specs-key">Width</td> <td class="specs-value fk-data">75 mm</td> </tr> <tr class=""> <td class="specs-key">Height</td> <td class="specs-value fk-data">300 mm</td> </tr> </table> </div>,10:03:2014,None
LSTSLBDQAXFU8GUDVRH7G4QCQ,Khoobsurati Trendy Detachable Tri-alcove Sling Bag,http://www.flipkart.com/lifestyle/bags-wallets-belts/women?otracker=hp_nmenu_sub_women_1_Bags%2C%20Wallets%20and%20Belts,Rs. 1228,Bags  Wallets and Belts,Slingbags,Khoobsurati,http://img5a.flixcart.com/image/sling-bag/v/r/h/ch1hbmclr040c-khoobsurati-trendy-detachable-tri-alcove-400x400-imadqa4yvy2ccguk.jpeg,Rs. 1445,Multi-color,women,http://www.flipkart.com/khoobsurati-trendy-detachable-tri-alcove-sling-bag/p/itmdqaxfbwpbyp4j?pid=SLBDQAXFU8GUDVRH&srno=b_10&ref=c010f2eb-92a8-457f-a516-23c83f806be2,KhoobSurati,Khoobsurati Trendy Detachable Tri-alcove Sling Bag Sky Blue-Orange - Price in India | Flipkart.com,Flipkart.com: Buy Khoobsurati Trendy Detachable Tri-alcove Sling Bag for Rs. 1228 from Flipkart.com. Only Genuine Products. 30 Day Replacement Guarantee. Free Shipping. Cash On,[],<div class="item_left_column" id="description"> <h3 class="item_desc_title fk-uppercase">Khoobsurati Trendy Detachable Tri-alcove Sling Bag (Sky Blue-Orange)         Price: Rs.1228</h3> <div class="cls"></div> <div class="item_desc_text line"> <div style="float:right"> </div>                         This elegant trendy slingbag is specially designed for all those busy women who needs  a simple closure style bag to carry-on every day. It is elegantly designed without any complexity in its locking pattern or difficulty in handling.        </div> <div style="clear: both;"></div> </div>,<div class="item_left_column" id="specifications"> <h3 class="item_desc_title fk-uppercase">         Specifications of Khoobsurati Trendy Detachable Tri-alcove Sling Bag (Sky Blue-Orange)    </h3> <table cellspacing="0" class="fk-specs-type2"> <tr> <th class="group-head" colspan="2">General</th> </tr> <tr class=""> <td class="specs-key">Ideal For</td> <td class="specs-value fk-data">Women</td> </tr> <tr class=""> <td class="specs-key">Occasion</td> <td class="specs-value fk-data">Evening</td> </tr> <tr class=""> <td class="specs-key">Material</td> <td class="specs-value fk-data">Faux Leather</td> </tr> <tr class=""> <td class="specs-key">Closure</td> <td class="specs-value fk-data">Zipper</td> </tr> <tr class=""> <td class="specs-key">Style Code</td> <td class="specs-value fk-data">CH1HBMCLR040C</td> </tr> <tr class=""> <td class="specs-key">Color Code</td> <td class="specs-value fk-data">Sky Blue-Orange</td> </tr> </table> <table cellspacing="0" class="fk-specs-type2"> <tr> <th class="group-head" colspan="2">Body Features</th> </tr> <tr class=""> <td class="specs-key">Number of Pockets</td> <td class="specs-value fk-data">3</td> </tr> </table> <table cellspacing="0" class="fk-specs-type2"> <tr> <th class="group-head" colspan="2">Dimensions</th> </tr> <tr class=""> <td class="specs-key">Width</td> <td class="specs-value fk-data">25 mm</td> </tr> <tr class=""> <td class="specs-key">Height</td> <td class="specs-value fk-data">210 mm</td> </tr> </table> </div>,10:03:2014,None
LSTSLBDRZ5JYUTZH2JP4SYV9S,Khoobsurati Groovy Lace Patterned Medium Sling Bag,http://www.flipkart.com/lifestyle/bags-wallets-belts/women?otracker=hp_nmenu_sub_women_1_Bags%2C%20Wallets%20and%20Belts,Rs. 916,Bags  Wallets and Belts,Slingbags,Khoobsurati,http://img5a.flixcart.com/image/sling-bag/2/j/p/ch2hbmclr423-khoobsurati-sling-bag-groovy-lace-patterned-400x400-imadrwq66hpyxs7h.jpeg,Rs. 1018,Multi-color,women,http://www.flipkart.com/khoobsurati-groovy-lace-patterned-medium-sling-bag/p/itmdrz5kqyyqatu2?pid=SLBDRZ5JYUTZH2JP&srno=b_21&ref=ce662836-e9af-4b4d-982a-0fa14ab8cf65,KhoobSurati,Khoobsurati Groovy Lace Patterned Medium Sling Bag Multicolor - Price in India | Flipkart.com,Flipkart.com: Buy Khoobsurati Groovy Lace Patterned Medium Sling Bag for Rs. 916 from Flipkart.com. Only Genuine Products. 30 Day Replacement Guarantee. Free Shipping. Cash On,[],<div class="item_left_column" id="description"> <h3 class="item_desc_title fk-uppercase">Khoobsurati Groovy Lace Patterned Medium Sling Bag (Multicolor)         Price: Rs.916</h3> <div class="cls"></div> <div class="item_desc_text line"> <div style="float:right"> </div>                         A must-have fashion accessory; this cute and versatile handbag is an ideal carryon for all your important stuff. Made from a durable Material and accorded with spacious zip compartments  this petite handbag is one of most likeable additions to your contemporary wardrobe. Features - Made from a durable and quality stuff for a long life  endowed with multiple pockets for a versatile use  Matches equally well with casual and semi-formal attires  Ideal for everyday carry. Disclaimer ? Product Color may slightly vary due to photographic lighting sources or your monitor settings. Specifications - Material - Faux Leather  Dimensions (inch.)Approx. (13 x 35 x 3. 5). Color - Multicolor. Waterproof - Yes. No. Of Pockets Inside - 2. No. Of Pockets Outside - 1. Mesh Pocket outside - No. Card Holder - 1. Extra Belt Size - No        </div> <div style="clear: both;"></div> </div>,<div class="item_left_column" id="specifications"> <h3 class="item_desc_title fk-uppercase">         Specifications of Khoobsurati Groovy Lace Patterned Medium Sling Bag (Multicolor)    </h3> <table cellspacing="0" class="fk-specs-type2"> <tr> <th class="group-head" colspan="2">General</th> </tr> <tr class=""> <td class="specs-key">Type</td> <td class="specs-value fk-data">Sling Bag</td> </tr> <tr class=""> <td class="specs-key">Ideal For</td> <td class="specs-value fk-data">Women</td> </tr> <tr class=""> <td class="specs-key">Bag Size</td> <td class="specs-value fk-data">Medium</td> </tr> <tr class=""> <td class="specs-key">Occasion</td> <td class="specs-value fk-data">Evening - - Casual</td> </tr> <tr class=""> <td class="specs-key">Material</td> <td class="specs-value fk-data">Faux Leather</td> </tr> <tr class=""> <td class="specs-key">Closure</td> <td class="specs-value fk-data">Zip</td> </tr> <tr class=""> <td class="specs-key">Style Code</td> <td class="specs-value fk-data">CH2HBMCLR423</td> </tr> <tr class=""> <td class="specs-key">Color Code</td> <td class="specs-value fk-data">Multicolor</td> </tr> </table> <table cellspacing="0" class="fk-specs-type2"> <tr> <th class="group-head" colspan="2">Body Features</th> </tr> <tr class=""> <td class="specs-key">Number of Pockets</td> <td class="specs-value fk-data">3</td> </tr> <tr class=""> <td class="specs-key">Number of Compartments</td> <td class="specs-value fk-data">1</td> </tr> </table> <table cellspacing="0" class="fk-specs-type2"> <tr> <th class="group-head" colspan="2">Dimensions</th> </tr> <tr class=""> <td class="specs-key">Width</td> <td class="specs-value fk-data">330 mm</td> </tr> <tr class=""> <td class="specs-key">Height</td> <td class="specs-value fk-data">889 mm</td> </tr> <tr class=""> <td class="specs-key">Depth</td> <td class="specs-value fk-data">89 mm</td> </tr> </table> </div>,10:03:2014,None
LSTSLBDRZ5JGYRMTPACIQMI1P,Khoobsurati Crazy Patterned Medium Sling Bag,http://www.flipkart.com/lifestyle/bags-wallets-belts/women?otracker=hp_nmenu_sub_women_1_Bags%2C%20Wallets%20and%20Belts,Rs. 916,Bags  Wallets and Belts,Slingbags,Khoobsurati,http://img6a.flixcart.com/image/sling-bag/p/a/c/ch2hbmclr422-khoobsurati-sling-bag-crazy-patterned-400x400-imadrwqta29t4q66.jpeg,Rs. 1018,Multi-color,women,http://www.flipkart.com/khoobsurati-crazy-patterned-medium-sling-bag/p/itmdrz5kgpnw4wcb?pid=SLBDRZ5JGYRMTPAC&srno=b_26&ref=ce662836-e9af-4b4d-982a-0fa14ab8cf65,KhoobSurati,Khoobsurati Crazy Patterned Medium Sling Bag Multicolor - Price in India | Flipkart.com,Flipkart.com: Buy Khoobsurati Crazy Patterned Medium Sling Bag for Rs. 916 from Flipkart.com. Only Genuine Products. 30 Day Replacement Guarantee. Free Shipping. Cash On,[],<div class="item_left_column" id="description"> <h3 class="item_desc_title fk-uppercase">Khoobsurati Crazy Patterned Medium Sling Bag (Multicolor)         Price: Rs.916</h3> <div class="cls"></div> <div class="item_desc_text line"> <div style="float:right"> </div>                         Append a glamorous touch to your persona and make yourself feel special every time by carrying this exclusive handbag. Accorded with versatile features  this fashion embellishment is a sure-shot head turner. Give a finishing touch to your social persona by carrying this fashionable hand bag with you every time you step-out. Features - Spacious  multiple pockets for carrying all the necessary stuff  Durable  quality Material - for a rough use and long life  Easy handling with smooth carry  Ideal for everyday carrying. Disclaimer - Product color may slightly vary due to photographic lighting sources or your monitor settings. Specifications - Material - Faux Leather  Dimensions (inch.)Approx. (35 x 13 x 3.5). Color - MultiColor. Waterproof - Yes. No. Of Pockets Inside - 2. No. Of Pockets Outside - 1. Mesh Pocket Outside - No. Card Holder - 1. Extra Belt Size - No        </div> <div style="clear: both;"></div> </div>,<div class="item_left_column" id="specifications"> <h3 class="item_desc_title fk-uppercase">         Specifications of Khoobsurati Crazy Patterned Medium Sling Bag (Multicolor)    </h3> <table cellspacing="0" class="fk-specs-type2"> <tr> <th class="group-head" colspan="2">General</th> </tr> <tr class=""> <td class="specs-key">Type</td> <td class="specs-value fk-data">Sling Bag</td> </tr> <tr class=""> <td class="specs-key">Ideal For</td> <td class="specs-value fk-data">Women</td> </tr> <tr class=""> <td class="specs-key">Bag Size</td> <td class="specs-value fk-data">Medium</td> </tr> <tr class=""> <td class="specs-key">Occasion</td> <td class="specs-value fk-data">Evening - - Casual</td> </tr> <tr class=""> <td class="specs-key">Material</td> <td class="specs-value fk-data">Faux Leather</td> </tr> <tr class=""> <td class="specs-key">Closure</td> <td class="specs-value fk-data">Zip</td> </tr> <tr class=""> <td class="specs-key">Style Code</td> <td class="specs-value fk-data">CH2HBMCLR422</td> </tr> <tr class=""> <td class="specs-key">Color Code</td> <td class="specs-value fk-data">Multicolor</td> </tr> </table> <table cellspacing="0" class="fk-specs-type2"> <tr> <th class="group-head" colspan="2">Body Features</th> </tr> <tr class=""> <td class="specs-key">Number of Pockets</td> <td class="specs-value fk-data">3</td> </tr> <tr class=""> <td class="specs-key">Number of Compartments</td> <td class="specs-value fk-data">1</td> </tr> </table> <table cellspacing="0" class="fk-specs-type2"> <tr> <th class="group-head" colspan="2">Dimensions</th> </tr> <tr class=""> <td class="specs-key">Width</td> <td class="specs-value fk-data">889 mm</td> </tr> <tr class=""> <td class="specs-key">Height</td> <td class="specs-value fk-data">330 mm</td> </tr> <tr class=""> <td class="specs-key">Depth</td> <td class="specs-value fk-data">89 mm</td> </tr> </table> </div>,10:03:2014,None
LSTSLBDQAXF6STGMN5YU0QQ0I,Khoobsurati Trendy Detachable Tri-alcove Sling Bag,http://www.flipkart.com/lifestyle/bags-wallets-belts/women?otracker=hp_nmenu_sub_women_1_Bags%2C%20Wallets%20and%20Belts,Rs. 1228,Bags  Wallets and Belts,Slingbags,Khoobsurati,http://img5a.flixcart.com/image/sling-bag/n/5/y/ch1hbmclr040d-khoobsurati-trendy-detachable-tri-alcove-400x400-imadqa4ypc8vuagq.jpeg,Rs. 1445,Multi-color,women,http://www.flipkart.com/khoobsurati-trendy-detachable-tri-alcove-sling-bag/p/itmdqaxfseekcg8v?pid=SLBDQAXF6STGMN5Y&srno=b_17&ref=ce662836-e9af-4b4d-982a-0fa14ab8cf65,KhoobSurati,Khoobsurati Trendy Detachable Tri-alcove Sling Bag Orange-Brown - Price in India | Flipkart.com,Flipkart.com: Buy Khoobsurati Trendy Detachable Tri-alcove Sling Bag for Rs. 1228 from Flipkart.com. Only Genuine Products. 30 Day Replacement Guarantee. Free Shipping. Cash On,[],<div class="item_left_column" id="description"> <h3 class="item_desc_title fk-uppercase">Khoobsurati Trendy Detachable Tri-alcove Sling Bag (Orange-Brown)         Price: Rs.1228</h3> <div class="cls"></div> <div class="item_desc_text line"> <div style="float:right"> </div>                         This elegant trendy slingbag is specially designed for all those busy women who needs  a simple closure style bag to carry-on every day. It is elegantly designed without any complexity in its locking pattern or difficulty in handling.        </div> <div style="clear: both;"></div> </div>,<div class="item_left_column" id="specifications"> <h3 class="item_desc_title fk-uppercase">         Specifications of Khoobsurati Trendy Detachable Tri-alcove Sling Bag (Orange-Brown)    </h3> <table cellspacing="0" class="fk-specs-type2"> <tr> <th class="group-head" colspan="2">General</th> </tr> <tr class=""> <td class="specs-key">Ideal For</td> <td class="specs-value fk-data">Women</td> </tr> <tr class=""> <td class="specs-key">Occasion</td> <td class="specs-value fk-data">Evening</td> </tr> <tr class=""> <td class="specs-key">Material</td> <td class="specs-value fk-data">Faux Leather</td> </tr> <tr class=""> <td class="specs-key">Closure</td> <td class="specs-value fk-data">Zipper</td> </tr> <tr class=""> <td class="specs-key">Style Code</td> <td class="specs-value fk-data">CH1HBMCLR040D</td> </tr> <tr class=""> <td class="specs-key">Color Code</td> <td class="specs-value fk-data">Orange-Brown</td> </tr> </table> <table cellspacing="0" class="fk-specs-type2"> <tr> <th class="group-head" colspan="2">Body Features</th> </tr> <tr class=""> <td class="specs-key">Number of Pockets</td> <td class="specs-value fk-data">3</td> </tr> </table> <table cellspacing="0" class="fk-specs-type2"> <tr> <th class="group-head" colspan="2">Dimensions</th> </tr> <tr class=""> <td class="specs-key">Width</td> <td class="specs-value fk-data">25 mm</td> </tr> <tr class=""> <td class="specs-key">Height</td> <td class="specs-value fk-data">210 mm</td> </tr> </table> </div>,10:03:2014,None
LSTSLBDQAXFHHXG3U4W7CNNAX,Khoobsurati Gorgeous Craftsy Typical Sling Bag,http://www.flipkart.com/lifestyle/bags-wallets-belts/women?otracker=hp_nmenu_sub_women_1_Bags%2C%20Wallets%20and%20Belts,Rs. 1624,Bags  Wallets and Belts,Slingbags,Khoobsurati,http://img6a.flixcart.com/image/sling-bag/u/4/w/ch1hbblk112-khoobsurati-gorgeous-craftsy-typical-400x400-imadqa4yqwmxx2kx.jpeg,Rs. 1911,Black,women,http://www.flipkart.com/khoobsurati-gorgeous-craftsy-typical-sling-bag/p/itmdqaxfmgnx6uam?pid=SLBDQAXFHHXG3U4W&srno=b_14&ref=c010f2eb-92a8-457f-a516-23c83f806be2,KhoobSurati,Khoobsurati Gorgeous Craftsy Typical Sling Bag Black - Price in India | Flipkart.com,Flipkart.com: Buy Khoobsurati Gorgeous Craftsy Typical Sling Bag for Rs. 1624 from Flipkart.com. Only Genuine Products. 30 Day Replacement Guarantee. Free Shipping. Cash On,[],<div class="item_left_column" id="description"> <h3 class="item_desc_title fk-uppercase">Khoobsurati Gorgeous Craftsy Typical Sling Bag (Black)         Price: Rs.1624</h3> <div class="cls"></div> <div class="item_desc_text line"> <div style="float:right"> </div>                         Flaunt an attractive look carrying this astonishingly modish sling bag With the combination of blissful colour and eye-catchy design  this bag will look exceptionally stylish with any outfit you choose to wear.        </div> <div style="clear: both;"></div> </div>,<div class="item_left_column" id="specifications"> <h3 class="item_desc_title fk-uppercase">         Specifications of Khoobsurati Gorgeous Craftsy Typical Sling Bag (Black)    </h3> <table cellspacing="0" class="fk-specs-type2"> <tr> <th class="group-head" colspan="2">General</th> </tr> <tr class=""> <td class="specs-key">Ideal For</td> <td class="specs-value fk-data">Women</td> </tr> <tr class=""> <td class="specs-key">Occasion</td> <td class="specs-value fk-data">Evening</td> </tr> <tr class=""> <td class="specs-key">Material</td> <td class="specs-value fk-data">Faux Leather</td> </tr> <tr class=""> <td class="specs-key">Closure</td> <td class="specs-value fk-data">Zipper</td> </tr> <tr class=""> <td class="specs-key">Style Code</td> <td class="specs-value fk-data">CH1HBBLK112</td> </tr> <tr class=""> <td class="specs-key">Color Code</td> <td class="specs-value fk-data">Black</td> </tr> </table> <table cellspacing="0" class="fk-specs-type2"> <tr> <th class="group-head" colspan="2">Body Features</th> </tr> <tr class=""> <td class="specs-key">Number of Pockets</td> <td class="specs-value fk-data">4</td> </tr> </table> <table cellspacing="0" class="fk-specs-type2"> <tr> <th class="group-head" colspan="2">Dimensions</th> </tr> <tr class=""> <td class="specs-key">Width</td> <td class="specs-value fk-data">85 mm</td> </tr> <tr class=""> <td class="specs-key">Height</td> <td class="specs-value fk-data">225 mm</td> </tr> </table> </div>,10:03:2014,None
LSTSLBDMP9Y9S4VTHKH5R7UYL,Khoobsurati Gorgeous Implausible Sling Bag,http://www.flipkart.com/lifestyle/bags-wallets-belts/women?otracker=hp_nmenu_sub_women_1_Bags%2C%20Wallets%20and%20Belts,Rs. 1170,Bags  Wallets and Belts,Slingbags,Khoobsurati,http://img6a.flixcart.com/image/sling-bag/h/k/h/khblcl1015-khoobsurati-gorgeous-implausible-400x400-imadmsyhqmseh74y.jpeg,Rs. 1950,,women,http://www.flipkart.com/khoobsurati-gorgeous-implausible-sling-bag/p/itmdp2nhamtjzevw?pid=SLBDMP9Y9S4VTHKH&srno=b_25&ref=ce662836-e9af-4b4d-982a-0fa14ab8cf65,KhoobSurati,Khoobsurati Gorgeous Implausible Sling Bag Blue - Price in India | Flipkart.com,Flipkart.com: Buy Khoobsurati Gorgeous Implausible Sling Bag for Rs. 1170 from Flipkart.com. Only Genuine Products. 30 Day Replacement Guarantee. Free Shipping. Cash On,[],<div class="item_left_column" id="description"> <h3 class="item_desc_title fk-uppercase">Khoobsurati Gorgeous Implausible Sling Bag (Blue)         Price: Rs.1170</h3> <div class="cls"></div> <div class="item_desc_text line"> <div style="float:right"> </div>                         Featuring a wonderful pattern  this beautiful sling bag is an ideal choice for everyday use. Its attractive design on the front adds some more appeal to this bag. Easy to use  this stunning bag also has enough space for carrying your essentials with simplicity. Features: Perfect for everyday use Easy to use and durable Extra spacious Attractive design Disclaimer:Product color may slightly vary due to photographic lighting sources or your monitor settings.        </div> <div style="clear: both;"></div> </div>,<div class="item_left_column" id="specifications"> <h3 class="item_desc_title fk-uppercase">         Specifications of Khoobsurati Gorgeous Implausible Sling Bag (Blue)    </h3> <table cellspacing="0" class="fk-specs-type2"> <tr> <th class="group-head" colspan="2">General</th> </tr> <tr class=""> <td class="specs-key">Ideal For</td> <td class="specs-value fk-data">Women</td> </tr> <tr class=""> <td class="specs-key">Material</td> <td class="specs-value fk-data">Faux Leather</td> </tr> <tr class=""> <td class="specs-key">Style Code</td> <td class="specs-value fk-data">KHBLCL1015</td> </tr> <tr class=""> <td class="specs-key">Color Code</td> <td class="specs-value fk-data">Blue</td> </tr> </table> </div>,10:03:2014,None
