LSTSLBDQAXFGHHUHGUYFRQ1M3,Khoobsurati Trendy Detachable Tri-alcove Sling Bag,http://www.flipkart.com/lifestyle/bags-wallets-belts/women?otracker=hp_nmenu_sub_women_1_Bags%2C%20Wallets%20and%20Belts,Rs. 1228,Bags  Wallets and Belts,Slingbags,Khoobsurati,http://img6a.flixcart.com/image/sling-bag/g/u/y/ch1hbmclr040a-khoobsurati-trendy-detachable-tri-alcove-400x400-imadqa4yc5y5sgcr.jpeg,Rs. 1445,Multi-color,women,http://www.flipkart.com/khoobsurati-trendy-detachable-tri-alcove-sling-bag/p/itmdqaxfrfezmrug?pid=SLBDQAXFGHHUHGUY&srno=b_11&ref=c010f2eb-92a8-457f-a516-23c83f806be2,KhoobSurati,Khoobsurati Trendy Detachable Tri-alcove Sling Bag Yellow-Black - Price in India | Flipkart.com,Flipkart.com: Buy Khoobsurati Trendy Detachable Tri-alcove Sling Bag for Rs. 1228 from Flipkart.com. Only Genuine Products. 30 Day Replacement Guarantee. Free Shipping. Cash On,[],<div class="item_left_column" id="description"> <h3 class="item_desc_title fk-uppercase">Khoobsurati Trendy Detachable Tri-alcove Sling Bag (Yellow-Black)         Price: Rs.1228</h3> <div class="cls"></div> <div class="item_desc_text line"> <div style="float:right"> </div>                         This elegant trendy slingbag is specially designed for all those busy women who needs  a simple closure style bag to carry-on every day. It is elegantly designed without any complexity in its locking pattern or difficulty in handling.        </div> <div style="clear: both;"></div> </div>,<div class="item_left_column" id="specifications"> <h3 class="item_desc_title fk-uppercase">         Specifications of Khoobsurati Trendy Detachable Tri-alcove Sling Bag (Yellow-Black)    </h3> <table cellspacing="0" class="fk-specs-type2"> <tr> <th class="group-head" colspan="2">General</th> </tr> <tr class=""> <td class="specs-key">Ideal For</td> <td class="specs-value fk-data">Women</td> </tr> <tr class=""> <td class="specs-key">Occasion</td> <td class="specs-value fk-data">Evening</td> </tr> <tr class=""> <td class="specs-key">Material</td> <td class="specs-value fk-data">Faux Leather</td> </tr> <tr class=""> <td class="specs-key">Closure</td> <td class="specs-value fk-data">Zipper</td> </tr> <tr class=""> <td class="specs-key">Style Code</td> <td class="specs-value fk-data">CH1HBMCLR040A</td> </tr> <tr class=""> <td class="specs-key">Color Code</td> <td class="specs-value fk-data">Yellow-Black</td> </tr> </table> <table cellspacing="0" class="fk-specs-type2"> <tr> <th class="group-head" colspan="2">Body Features</th> </tr> <tr class=""> <td class="specs-key">Number of Pockets</td> <td class="specs-value fk-data">3</td> </tr> </table> <table cellspacing="0" class="fk-specs-type2"> <tr> <th class="group-head" colspan="2">Dimensions</th> </tr> <tr class=""> <td class="specs-key">Width</td> <td class="specs-value fk-data">25 mm</td> </tr> <tr class=""> <td class="specs-key">Height</td> <td class="specs-value fk-data">210 mm</td> </tr> </table> </div>,10:03:2014,None
LSTSLBDQAXFCGEWWQHSIB88LG,Khoobsurati Exclusive Seraphic Sling Bag,http://www.flipkart.com/lifestyle/bags-wallets-belts/women?otracker=hp_nmenu_sub_women_1_Bags%2C%20Wallets%20and%20Belts,Rs. 1102,Bags  Wallets and Belts,Slingbags,Khoobsurati,http://img6a.flixcart.com/image/sling-bag/q/h/s/ch1hbdgy099-khoobsurati-exclusive-seraphic-400x400-imadqa4yge6ug5uf.jpeg,Rs. 1297,Grey,women,http://www.flipkart.com/khoobsurati-exclusive-seraphic-sling-bag/p/itmdqaxfmgyw77nm?pid=SLBDQAXFCGEWWQHS&srno=b_18&ref=ce662836-e9af-4b4d-982a-0fa14ab8cf65,KhoobSurati,Khoobsurati Exclusive Seraphic Sling Bag Grey - Price in India | Flipkart.com,Flipkart.com: Buy Khoobsurati Exclusive Seraphic Sling Bag for Rs. 1102 from Flipkart.com. Only Genuine Products. 30 Day Replacement Guarantee. Free Shipping. Cash On,[],<div class="item_left_column" id="description"> <h3 class="item_desc_title fk-uppercase">Khoobsurati Exclusive Seraphic Sling Bag (Grey)         Price: Rs.1102</h3> <div class="cls"></div> <div class="item_desc_text line"> <div style="float:right"> </div>                         You will surely get lots of appreciation carrying this amazing slingbag Having excellent design and style  this bag will complement any of your favorite outfit. Not only this  it will easily stuff all your essentials and lasts for pretty long time.        </div> <div style="clear: both;"></div> </div>,<div class="item_left_column" id="specifications"> <h3 class="item_desc_title fk-uppercase">         Specifications of Khoobsurati Exclusive Seraphic Sling Bag (Grey)    </h3> <table cellspacing="0" class="fk-specs-type2"> <tr> <th class="group-head" colspan="2">General</th> </tr> <tr class=""> <td class="specs-key">Ideal For</td> <td class="specs-value fk-data">Women</td> </tr> <tr class=""> <td class="specs-key">Occasion</td> <td class="specs-value fk-data">Evening</td> </tr> <tr class=""> <td class="specs-key">Material</td> <td class="specs-value fk-data">Faux Leather</td> </tr> <tr class=""> <td class="specs-key">Closure</td> <td class="specs-value fk-data">Zipper</td> </tr> <tr class=""> <td class="specs-key">Style Code</td> <td class="specs-value fk-data">CH1HBDGY099</td> </tr> <tr class=""> <td class="specs-key">Color Code</td> <td class="specs-value fk-data">Grey</td> </tr> </table> <table cellspacing="0" class="fk-specs-type2"> <tr> <th class="group-head" colspan="2">Body Features</th> </tr> <tr class=""> <td class="specs-key">Number of Pockets</td> <td class="specs-value fk-data">2</td> </tr> </table> <table cellspacing="0" class="fk-specs-type2"> <tr> <th class="group-head" colspan="2">Dimensions</th> </tr> <tr class=""> <td class="specs-key">Width</td> <td class="specs-value fk-data">75 mm</td> </tr> <tr class=""> <td class="specs-key">Height</td> <td class="specs-value fk-data">300 mm</td> </tr> </table> </div>,10:03:2014,None
LSTSLBDQSQEMCNZGZMWUPHIKB,Khoobsurati Contemporary Style Small Sling Bag,http://www.flipkart.com/lifestyle/bags-wallets-belts/women?otracker=hp_nmenu_sub_women_1_Bags%2C%20Wallets%20and%20Belts,Rs. 1552,Bags  Wallets and Belts,Slingbags,Khoobsurati,http://img5a.flixcart.com/image/sling-bag/z/m/w/ch1hbkk029-khoobsurati-sling-bag-contemporary-style-400x400-imadqzj6uwgswxgx.jpeg,Rs. 1827,Brown,women,http://www.flipkart.com/khoobsurati-contemporary-style-small-sling-bag/p/itmdqsqftcnze4aa?pid=SLBDQSQEMCNZGZMW&srno=b_20&ref=ce662836-e9af-4b4d-982a-0fa14ab8cf65,KhoobSurati,Khoobsurati Contemporary Style Small Sling Bag Khaki - Price in India | Flipkart.com,Flipkart.com: Buy Khoobsurati Contemporary Style Small Sling Bag for Rs. 1552 from Flipkart.com. Only Genuine Products. 30 Day Replacement Guarantee. Free Shipping. Cash On,[],<div class="item_left_column" id="description"> <h3 class="item_desc_title fk-uppercase">Khoobsurati Contemporary Style Small Sling Bag (Khaki)         Price: Rs.1552</h3> <div class="cls"></div> <div class="item_desc_text line"> <div style="float:right"> </div>                         Make a distinct style statement carrying this contemporary style sling bag. Designed to perfection  this sling bag will look stylish and as it is made with good quality material  it is durable as well. While its long and detachable strap allows it to sling across in style  its trendy flap closure boosts the overall appearance.        </div> <div style="clear: both;"></div> </div>,<div class="item_left_column" id="specifications"> <h3 class="item_desc_title fk-uppercase">         Specifications of Khoobsurati Contemporary Style Small Sling Bag (Khaki)    </h3> <table cellspacing="0" class="fk-specs-type2"> <tr> <th class="group-head" colspan="2">General</th> </tr> <tr class=""> <td class="specs-key">Type</td> <td class="specs-value fk-data">Sling Bag</td> </tr> <tr class=""> <td class="specs-key">Ideal For</td> <td class="specs-value fk-data">Women</td> </tr> <tr class=""> <td class="specs-key">Bag Size</td> <td class="specs-value fk-data">Small</td> </tr> <tr class=""> <td class="specs-key">Occasion</td> <td class="specs-value fk-data">Evening</td> </tr> <tr class=""> <td class="specs-key">Material</td> <td class="specs-value fk-data">Faux Leather</td> </tr> <tr class=""> <td class="specs-key">Closure</td> <td class="specs-value fk-data">Zipper</td> </tr> <tr class=""> <td class="specs-key">Style Code</td> <td class="specs-value fk-data">CH1HBKK029</td> </tr> <tr class=""> <td class="specs-key">Color Code</td> <td class="specs-value fk-data">Khaki</td> </tr> </table> <table cellspacing="0" class="fk-specs-type2"> <tr> <th class="group-head" colspan="2">Body Features</th> </tr> <tr class=""> <td class="specs-key">Number of Pockets</td> <td class="specs-value fk-data">3</td> </tr> </table> <table cellspacing="0" class="fk-specs-type2"> <tr> <th class="group-head" colspan="2">Dimensions</th> </tr> <tr class=""> <td class="specs-key">Width</td> <td class="specs-value fk-data">125 mm</td> </tr> <tr class=""> <td class="specs-key">Height</td> <td class="specs-value fk-data">437 mm</td> </tr> </table> </div>,10:03:2014,None
LSTSLBDQAXFWD8QP5FA8N3PUI,Khoobsurati Urbane Sling Bag,http://www.flipkart.com/lifestyle/bags-wallets-belts/women?otracker=hp_nmenu_sub_women_1_Bags%2C%20Wallets%20and%20Belts,Rs. 1300,Bags  Wallets and Belts,Slingbags,Khoobsurati,http://img6a.flixcart.com/image/sling-bag/5/f/a/ch1hbbr027-khoobsurati-urbane-400x400-imadqa4yjby4bzuz.jpeg,Rs. 1530,Brown,women,http://www.flipkart.com/khoobsurati-urbane-sling-bag/p/itmdqaxfmsyj83kz?pid=SLBDQAXFWD8QP5FA&srno=b_19&ref=ce662836-e9af-4b4d-982a-0fa14ab8cf65,KhoobSurati,Khoobsurati Urbane Sling Bag Brown - Price in India | Flipkart.com,Flipkart.com: Buy Khoobsurati Urbane Sling Bag for Rs. 1300 from Flipkart.com. Only Genuine Products. 30 Day Replacement Guarantee. Free Shipping. Cash On,[],<div class="item_left_column" id="description"> <h3 class="item_desc_title fk-uppercase">Khoobsurati Urbane Sling Bag (Brown)         Price: Rs.1300</h3> <div class="cls"></div> <div class="item_desc_text line"> <div style="float:right"> </div>                         Compact and stylish  this amazing brown sling bag besides allowing you carry all the essential stuff with ease  also helps in creating a style statement. Carry it with formals or casuals  either ways  it will look appealing enough to complete your looks. Have it in your wardrobe and get the look you have ever desired for.        </div> <div style="clear: both;"></div> </div>,<div class="item_left_column" id="specifications"> <h3 class="item_desc_title fk-uppercase">         Specifications of Khoobsurati Urbane Sling Bag (Brown)    </h3> <table cellspacing="0" class="fk-specs-type2"> <tr> <th class="group-head" colspan="2">General</th> </tr> <tr class=""> <td class="specs-key">Ideal For</td> <td class="specs-value fk-data">Women</td> </tr> <tr class=""> <td class="specs-key">Occasion</td> <td class="specs-value fk-data">Evening</td> </tr> <tr class=""> <td class="specs-key">Material</td> <td class="specs-value fk-data">Faux Leather</td> </tr> <tr class=""> <td class="specs-key">Closure</td> <td class="specs-value fk-data">Zipper</td> </tr> <tr class=""> <td class="specs-key">Style Code</td> <td class="specs-value fk-data">CH1HBBR027</td> </tr> <tr class=""> <td class="specs-key">Color Code</td> <td class="specs-value fk-data">Brown</td> </tr> </table> <table cellspacing="0" class="fk-specs-type2"> <tr> <th class="group-head" colspan="2">Body Features</th> </tr> <tr class=""> <td class="specs-key">Number of Pockets</td> <td class="specs-value fk-data">5</td> </tr> </table> <table cellspacing="0" class="fk-specs-type2"> <tr> <th class="group-head" colspan="2">Dimensions</th> </tr> <tr class=""> <td class="specs-key">Width</td> <td class="specs-value fk-data">75 mm</td> </tr> <tr class=""> <td class="specs-key">Height</td> <td class="specs-value fk-data">475 mm</td> </tr> </table> </div>,10:03:2014,None
LSTSLBDQAXFQYVG3VZJPNZAAZ,Khoobsurati Exclusive Seraphic Sling Bag,http://www.flipkart.com/lifestyle/bags-wallets-belts/women?otracker=hp_nmenu_sub_women_1_Bags%2C%20Wallets%20and%20Belts,Rs. 1102,Bags  Wallets and Belts,Slingbags,Khoobsurati,http://img5a.flixcart.com/image/sling-bag/v/z/j/ch1hbpc100-khoobsurati-exclusive-seraphic-400x400-imadqa4y539utbhm.jpeg,Rs. 1297,Pink,women,http://www.flipkart.com/khoobsurati-exclusive-seraphic-sling-bag/p/itmdqaxfujszg3ap?pid=SLBDQAXFQYVG3VZJ&srno=b_9&ref=c010f2eb-92a8-457f-a516-23c83f806be2,KhoobSurati,Khoobsurati Exclusive Seraphic Sling Bag Peach - Price in India | Flipkart.com,Flipkart.com: Buy Khoobsurati Exclusive Seraphic Sling Bag for Rs. 1102 from Flipkart.com. Only Genuine Products. 30 Day Replacement Guarantee. Free Shipping. Cash On,[],<div class="item_left_column" id="description"> <h3 class="item_desc_title fk-uppercase">Khoobsurati Exclusive Seraphic Sling Bag (Peach)         Price: Rs.1102</h3> <div class="cls"></div> <div class="item_desc_text line"> <div style="float:right"> </div>                         You will surely get lots of appreciation carrying this amazing slingbag Having excellent design and style  this bag will complement any of your favorite outfit. Not only this  it will easily stuff all your essentials and lasts for pretty long time.        </div> <div style="clear: both;"></div> </div>,<div class="item_left_column" id="specifications"> <h3 class="item_desc_title fk-uppercase">         Specifications of Khoobsurati Exclusive Seraphic Sling Bag (Peach)    </h3> <table cellspacing="0" class="fk-specs-type2"> <tr> <th class="group-head" colspan="2">General</th> </tr> <tr class=""> <td class="specs-key">Ideal For</td> <td class="specs-value fk-data">Women</td> </tr> <tr class=""> <td class="specs-key">Occasion</td> <td class="specs-value fk-data">Evening</td> </tr> <tr class=""> <td class="specs-key">Material</td> <td class="specs-value fk-data">Faux Leather</td> </tr> <tr class=""> <td class="specs-key">Closure</td> <td class="specs-value fk-data">Zipper</td> </tr> <tr class=""> <td class="specs-key">Style Code</td> <td class="specs-value fk-data">CH1HBPC100</td> </tr> <tr class=""> <td class="specs-key">Color Code</td> <td class="specs-value fk-data">Peach</td> </tr> </table> <table cellspacing="0" class="fk-specs-type2"> <tr> <th class="group-head" colspan="2">Body Features</th> </tr> <tr class=""> <td class="specs-key">Number of Pockets</td> <td class="specs-value fk-data">2</td> </tr> </table> <table cellspacing="0" class="fk-specs-type2"> <tr> <th class="group-head" colspan="2">Dimensions</th> </tr> <tr class=""> <td class="specs-key">Width</td> <td class="specs-value fk-data">75 mm</td> </tr> <tr class=""> <td class="specs-key">Height</td> <td class="specs-value fk-data">300 mm</td> </tr> </table> </div>,10:03:2014,None
LSTSLBDQAXF2CSWARWY9C7OI9,Khoobsurati Vivid Contemporary Sling Bag,http://www.flipkart.com/lifestyle/bags-wallets-belts/women?otracker=hp_nmenu_sub_women_1_Bags%2C%20Wallets%20and%20Belts,Rs. 2228,Bags  Wallets and Belts,Slingbags,Khoobsurati,http://img5a.flixcart.com/image/sling-bag/r/w/y/ch1hbgr119-khoobsurati-vivid-contemporary-400x400-imadqa4y7bkagzpg.jpeg,Rs. 2622,Green,women,http://www.flipkart.com/khoobsurati-vivid-contemporary-sling-bag/p/itmdqaxfmaspme9f?pid=SLBDQAXF2CSWARWY&srno=b_7&ref=c010f2eb-92a8-457f-a516-23c83f806be2,KhoobSurati,Khoobsurati Vivid Contemporary Sling Bag Green - Price in India | Flipkart.com,Flipkart.com: Buy Khoobsurati Vivid Contemporary Sling Bag for Rs. 2228 from Flipkart.com. Only Genuine Products. 30 Day Replacement Guarantee. Free Shipping. Cash On,[],<div class="item_left_column" id="description"> <h3 class="item_desc_title fk-uppercase">Khoobsurati Vivid Contemporary Sling Bag (Green)         Price: Rs.2228</h3> <div class="cls"></div> <div class="item_desc_text line"> <div style="float:right"> </div>                         Get the combo of cute and trendy looks with this wonderful slingbag Its attractive design features map-like drawings while its pleasant colour makes it match any attire. It easily stuffs all essentials and endures even on rough use.        </div> <div style="clear: both;"></div> </div>,<div class="item_left_column" id="specifications"> <h3 class="item_desc_title fk-uppercase">         Specifications of Khoobsurati Vivid Contemporary Sling Bag (Green)    </h3> <table cellspacing="0" class="fk-specs-type2"> <tr> <th class="group-head" colspan="2">General</th> </tr> <tr class=""> <td class="specs-key">Ideal For</td> <td class="specs-value fk-data">Women</td> </tr> <tr class=""> <td class="specs-key">Occasion</td> <td class="specs-value fk-data">Evening</td> </tr> <tr class=""> <td class="specs-key">Material</td> <td class="specs-value fk-data">Faux Leather</td> </tr> <tr class=""> <td class="specs-key">Closure</td> <td class="specs-value fk-data">Zipper</td> </tr> <tr class=""> <td class="specs-key">Style Code</td> <td class="specs-value fk-data">CH1HBGR119</td> </tr> <tr class=""> <td class="specs-key">Color Code</td> <td class="specs-value fk-data">Green</td> </tr> </table> <table cellspacing="0" class="fk-specs-type2"> <tr> <th class="group-head" colspan="2">Body Features</th> </tr> <tr class=""> <td class="specs-key">Number of Pockets</td> <td class="specs-value fk-data">4</td> </tr> </table> <table cellspacing="0" class="fk-specs-type2"> <tr> <th class="group-head" colspan="2">Dimensions</th> </tr> <tr class=""> <td class="specs-key">Width</td> <td class="specs-value fk-data">85 mm</td> </tr> <tr class=""> <td class="specs-key">Height</td> <td class="specs-value fk-data">240 mm</td> </tr> </table> </div>,10:03:2014,None
LSTSLBDRZ5JGZTZVBHFAPFEUZ,Khoobsurati Crazy Stylo Medium Sling Bag,http://www.flipkart.com/lifestyle/bags-wallets-belts/women?otracker=hp_nmenu_sub_women_1_Bags%2C%20Wallets%20and%20Belts,Rs. 916,Bags  Wallets and Belts,Slingbags,Khoobsurati,http://img6a.flixcart.com/image/sling-bag/b/h/f/ch2hbmclr424-khoobsurati-sling-bag-crazy-stylo-400x400-imadrwqvdhzu7j7s.jpeg,Rs. 1018,Multi-color,women,http://www.flipkart.com/khoobsurati-crazy-stylo-medium-sling-bag/p/itmdrz5kgkfgu7fq?pid=SLBDRZ5JGZTZVBHF&srno=b_22&ref=ce662836-e9af-4b4d-982a-0fa14ab8cf65,KhoobSurati,Khoobsurati Crazy Stylo Medium Sling Bag Multicolor - Price in India | Flipkart.com,Flipkart.com: Buy Khoobsurati Crazy Stylo Medium Sling Bag for Rs. 916 from Flipkart.com. Only Genuine Products. 30 Day Replacement Guarantee. Free Shipping. Cash On,[],<div class="item_left_column" id="description"> <h3 class="item_desc_title fk-uppercase">Khoobsurati Crazy Stylo Medium Sling Bag (Multicolor)         Price: Rs.916</h3> <div class="cls"></div> <div class="item_desc_text line"> <div style="float:right"> </div>                         Enjoy being fashionable every time you step out your home by carrying this unique and trendy handbag. Made for the next-generation women  who loves staying afoot with latest trends  this contemporary and chichi fashion accessory makes a perfect complement to your urbane and modish persona. Features - Attractive Features and elegant design  endowed with multiple pockets for versatile use  Ideal for everyday carry  Made from durable quality material for a long life. Disclaimer ? Product color may slightly vary due to photographic lighting sources or your monitor settings. Specifications - Material - Faux Leather  Dimensions (inch. )Approx. (13 x 35 x 3. 5). Color ? MultiColor  Waterproof - Yes. No. Of Pockets Inside - 2. No. Of Pockets Outside - 1. Mesh Pocket Outside - No. Card Holder - 1. Extra Belt Size - No        </div> <div style="clear: both;"></div> </div>,<div class="item_left_column" id="specifications"> <h3 class="item_desc_title fk-uppercase">         Specifications of Khoobsurati Crazy Stylo Medium Sling Bag (Multicolor)    </h3> <table cellspacing="0" class="fk-specs-type2"> <tr> <th class="group-head" colspan="2">General</th> </tr> <tr class=""> <td class="specs-key">Type</td> <td class="specs-value fk-data">Sling Bag</td> </tr> <tr class=""> <td class="specs-key">Ideal For</td> <td class="specs-value fk-data">Women</td> </tr> <tr class=""> <td class="specs-key">Bag Size</td> <td class="specs-value fk-data">Medium</td> </tr> <tr class=""> <td class="specs-key">Occasion</td> <td class="specs-value fk-data">Evening - - Casual</td> </tr> <tr class=""> <td class="specs-key">Material</td> <td class="specs-value fk-data">Faux Leather</td> </tr> <tr class=""> <td class="specs-key">Closure</td> <td class="specs-value fk-data">Zip</td> </tr> <tr class=""> <td class="specs-key">Style Code</td> <td class="specs-value fk-data">CH2HBMCLR424</td> </tr> <tr class=""> <td class="specs-key">Color Code</td> <td class="specs-value fk-data">Multicolor</td> </tr> </table> <table cellspacing="0" class="fk-specs-type2"> <tr> <th class="group-head" colspan="2">Body Features</th> </tr> <tr class=""> <td class="specs-key">Number of Pockets</td> <td class="specs-value fk-data">3</td> </tr> <tr class=""> <td class="specs-key">Number of Compartments</td> <td class="specs-value fk-data">1</td> </tr> </table> <table cellspacing="0" class="fk-specs-type2"> <tr> <th class="group-head" colspan="2">Dimensions</th> </tr> <tr class=""> <td class="specs-key">Width</td> <td class="specs-value fk-data">330 mm</td> </tr> <tr class=""> <td class="specs-key">Height</td> <td class="specs-value fk-data">889 mm</td> </tr> <tr class=""> <td class="specs-key">Depth</td> <td class="specs-value fk-data">89 mm</td> </tr> </table> </div>,10:03:2014,None
LSTSLBDQAXFYXJDUFSVQQ5QB9,Khoobsurati Vivid Contemporary Sling Bag,http://www.flipkart.com/lifestyle/bags-wallets-belts/women?otracker=hp_nmenu_sub_women_1_Bags%2C%20Wallets%20and%20Belts,Rs. 2228,Bags  Wallets and Belts,Slingbags,Khoobsurati,http://img6a.flixcart.com/image/sling-bag/f/s/v/ch1hbcr116-khoobsurati-vivid-contemporary-400x400-imadqa4yrjcrzqnj.jpeg,Rs. 2622,White,women,http://www.flipkart.com/khoobsurati-vivid-contemporary-sling-bag/p/itmdqaxfdzg5uef4?pid=SLBDQAXFYXJDUFSV&srno=b_5&ref=c010f2eb-92a8-457f-a516-23c83f806be2,KhoobSurati,Khoobsurati Vivid Contemporary Sling Bag Cream - Price in India | Flipkart.com,Flipkart.com: Buy Khoobsurati Vivid Contemporary Sling Bag for Rs. 2228 from Flipkart.com. Only Genuine Products. 30 Day Replacement Guarantee. Free Shipping. Cash On,[],<div class="item_left_column" id="description"> <h3 class="item_desc_title fk-uppercase">Khoobsurati Vivid Contemporary Sling Bag (Cream)         Price: Rs.2228</h3> <div class="cls"></div> <div class="item_desc_text line"> <div style="float:right"> </div>                         Get the combo of cute and trendy looks with this wonderful slingbag Its attractive design features map-like drawings while its pleasant colour makes it match any attire. It easily stuffs all essentials and endures even on rough use.        </div> <div style="clear: both;"></div> </div>,<div class="item_left_column" id="specifications"> <h3 class="item_desc_title fk-uppercase">         Specifications of Khoobsurati Vivid Contemporary Sling Bag (Cream)    </h3> <table cellspacing="0" class="fk-specs-type2"> <tr> <th class="group-head" colspan="2">General</th> </tr> <tr class=""> <td class="specs-key">Ideal For</td> <td class="specs-value fk-data">Women</td> </tr> <tr class=""> <td class="specs-key">Occasion</td> <td class="specs-value fk-data">Evening</td> </tr> <tr class=""> <td class="specs-key">Material</td> <td class="specs-value fk-data">Faux Leather</td> </tr> <tr class=""> <td class="specs-key">Closure</td> <td class="specs-value fk-data">Zipper</td> </tr> <tr class=""> <td class="specs-key">Style Code</td> <td class="specs-value fk-data">CH1HBCR116</td> </tr> <tr class=""> <td class="specs-key">Color Code</td> <td class="specs-value fk-data">Cream</td> </tr> </table> <table cellspacing="0" class="fk-specs-type2"> <tr> <th class="group-head" colspan="2">Body Features</th> </tr> <tr class=""> <td class="specs-key">Number of Pockets</td> <td class="specs-value fk-data">4</td> </tr> </table> <table cellspacing="0" class="fk-specs-type2"> <tr> <th class="group-head" colspan="2">Dimensions</th> </tr> <tr class=""> <td class="specs-key">Width</td> <td class="specs-value fk-data">85 mm</td> </tr> <tr class=""> <td class="specs-key">Height</td> <td class="specs-value fk-data">240 mm</td> </tr> </table> </div>,10:03:2014,None
