LSTSHTDPWGTX5C6JZZJOVUNCS,StyleToss Women's Polka Print Casual Shirt,http://www.flipkart.com/womens-clothing?otracker=hp_nmenu_sub_women_0_Clothing,Rs. 490,Clothing,Maternity Wear,StyleToss,http://img5a.flixcart.com/image/shirt/s/e/w/1587-styletoss-xs-400x400-imadpws9ugqme9ya.jpeg,Rs. 699,White,women,http://www.flipkart.com/styletoss-women-s-polka-print-casual-shirt/p/itmdpwgtwe8jkxgm?pid=SHTDPWGTX5C6JZZJ&srno=b_3&ref=cc7f1b6e-4890-4d3d-bebe-ba3bcf9863a4,BunrickFashions,StyleToss Women's Polka Print Casual Shirt - Buy White StyleToss Women's Polka Print Casual Shirt Online at Best Prices in India | Flipkart.com,StyleToss Women's Polka Print Casual Shirt - Buy White StyleToss Women's Polka Print Casual Shirt For Only Rs. 0.0 Online in India. Shop Online For Apparels. Huge Collection of Branded Clothes Only at,['XS'  'S'],<div class="item_left_column" id="description"> <h3 class="item_desc_title fk-uppercase">StyleToss Women's Polka Print Casual Shirt (Pack of 1587)         Price: Rs.490</h3> <div class="cls"></div> <div class="item_desc_text line"> <div style="float:right"> </div>                         Give your wardrobe a new classic peace of white polka dot shirt by Styletoss. Featuring a full sleeves design with regular collar.        </div> <div style="clear: both;"></div> </div>,<div class="item_left_column" id="specifications"> <h3 class="item_desc_title fk-uppercase">         Specifications of StyleToss Women's Polka Print Casual Shirt (Pack of 1587)    </h3> <table cellspacing="0" class="fk-specs-type2"> <tr> <th class="group-head" colspan="2">General Details<a class="see-more unitExt rmargin10 no-underline" href="javascript:void(0);" onclick="$(this).closest('.fk-specs-type2').toggleClass('expandedMore')" title="Expand">[+]</a><a class="hidden unitExt rmargin10 no-underline" href="javascript:void(0);" onclick="$(this).closest('.fk-specs-type2').toggleClass('expandedMore')" title="Collapse">[-]</a></th> </tr> <tr class="hidden"> <td class="specs-key">Ideal For</td> <td class="specs-value fk-data">Women's</td> </tr> <tr class="hidden"> <td class="specs-key">Occasion</td> <td class="specs-value fk-data">Casual</td> </tr> <tr class="hidden"> <td class="specs-key">Pattern</td> <td class="specs-value fk-data">Polka Print</td> </tr> </table> <table cellspacing="0" class="fk-specs-type2"> <tr> <th class="group-head" colspan="2">Shirt Details</th> </tr> <tr class=""> <td class="specs-key">Fabric</td> <td class="specs-value fk-data">Cotton</td> </tr> <tr class=""> <td class="specs-key">Collar</td> <td class="specs-value fk-data">Button Down Collar</td> </tr> <tr class=""> <td class="specs-key">Sleeve</td> <td class="specs-value fk-data">Full Sleeve</td> </tr> <tr class=""> <td class="specs-key">Number of Contents in Sales Package</td> <td class="specs-value fk-data">Pack of 1587</td> </tr> </table> <table cellspacing="0" class="fk-specs-type2"> <tr> <th class="group-head" colspan="2">Fabric Care</th> </tr> <tr class=""> <td class="specs-value fk-data" colspan="2">Soft Wash</td> </tr> </table> <table cellspacing="0" class="fk-specs-type2"> <tr> <th class="group-head" colspan="2">In the Box</th> </tr> <tr class=""> <td class="specs-key"> </td> <td class="specs-value fk-data">Shirt</td> </tr> </table> <table cellspacing="0" class="fk-specs-type2"> <tr> <th class="group-head" colspan="2">Additional Details<a class="see-more unitExt rmargin10 no-underline" href="javascript:void(0);" onclick="$(this).closest('.fk-specs-type2').toggleClass('expandedMore')" title="Expand">[+]</a><a class="hidden unitExt rmargin10 no-underline" href="javascript:void(0);" onclick="$(this).closest('.fk-specs-type2').toggleClass('expandedMore')" title="Collapse">[-]</a></th> </tr> <tr class="hidden"> <td class="specs-key">Style Code</td> <td class="specs-value fk-data">1587</td> </tr> </table> </div>,10:03:2014,None
LSTBRADQWZPVU3KHJJGBKAELV,Morph Maternity Women's Bra,http://www.flipkart.com/womens-clothing?otracker=hp_nmenu_sub_women_0_Clothing,Rs. 595,Clothing,Maternity Wear,StyleToss,http://img5a.flixcart.com/image/bra/y/e/c/lpnb025coskn-morph-maternity-32b-400x400-imadrcqaaytmf8h3.jpeg,Rs. 595,Beige,women,http://www.flipkart.com/morph-maternity-women-s-bra/p/itmdqwzptjqacycq?pid=BRADQWZPVU3KHJJG&srno=b_28&ref=67413aa2-59c8-44eb-843b-4bcf02bd3c3a,WS Retail,Morph Maternity Women's Bra - Buy Beige Morph Maternity Women's Bra Online at Best Prices in India | Flipkart.com,Morph Maternity Women's Bra - Buy Beige Morph Maternity Women's Bra For Only Rs. 595.0 Online in India. Shop Online For Apparels. Huge Collection of Branded Clothes Only at,['32B'  '34B'  '36B'],None,<div class="item_left_column" id="specifications"> <h3 class="item_desc_title fk-uppercase">         Specifications of Morph Maternity Women's Bra    </h3> <table cellspacing="0" class="fk-specs-type2"> <tr> <th class="group-head" colspan="2">General Details<a class="see-more unitExt rmargin10 no-underline" href="javascript:void(0);" onclick="$(this).closest('.fk-specs-type2').toggleClass('expandedMore')" title="Expand">[+]</a><a class="hidden unitExt rmargin10 no-underline" href="javascript:void(0);" onclick="$(this).closest('.fk-specs-type2').toggleClass('expandedMore')" title="Collapse">[-]</a></th> </tr> <tr class="hidden"> <td class="specs-key">Ideal For</td> <td class="specs-value fk-data">Women's</td> </tr> </table> <table cellspacing="0" class="fk-specs-type2"> <tr> <th class="group-head" colspan="2">Bra Details</th> </tr> <tr class=""> <td class="specs-key">Fabric</td> <td class="specs-value fk-data">Cotton</td> </tr> </table> <table cellspacing="0" class="fk-specs-type2"> <tr> <th class="group-head" colspan="2">Fabric Care</th> </tr> <tr class=""> <td class="specs-value fk-data" colspan="2">Hand or Machine Wash in Normal Cycle</td> </tr> </table> <table cellspacing="0" class="fk-specs-type2"> <tr> <th class="group-head" colspan="2">Additional Details<a class="see-more unitExt rmargin10 no-underline" href="javascript:void(0);" onclick="$(this).closest('.fk-specs-type2').toggleClass('expandedMore')" title="Expand">[+]</a><a class="hidden unitExt rmargin10 no-underline" href="javascript:void(0);" onclick="$(this).closest('.fk-specs-type2').toggleClass('expandedMore')" title="Collapse">[-]</a></th> </tr> <tr class="hidden"> <td class="specs-key"> </td> <td class="specs-value fk-data">The Cups are leak-proof   so no more embarrassing breast-milk leaks in public It is made of 100% breathable fabric  so very comfortable. Drop cup for easy nursing . Rear Clouser with Adjustable hook &amp; eye Breathable cotton fabric maximizies support &amp; comfort all day and night Discrete nursing clips  featuring one handed access.</td> </tr> </table> </div>,10:03:2014,None
LSTBRADQWZPRXA8GVFBE1SNJS,Morph Maternity Women's Nursing Bra,http://www.flipkart.com/womens-clothing?otracker=hp_nmenu_sub_women_0_Clothing,Rs. 595,Clothing,Maternity Wear,StyleToss,http://img5a.flixcart.com/image/bra/g/z/7/lpnb026coskn-morph-maternity-32c-400x400-imads7wa8agpebbp.jpeg,Rs. 595,Beige,women,http://www.flipkart.com/morph-maternity-women-s-nursing-bra/p/itmdqwzpb3a5x9u2?pid=BRADQWZPRXA8GVFB&srno=b_23&ref=67413aa2-59c8-44eb-843b-4bcf02bd3c3a,WS Retail,Morph Maternity Women's Nursing Bra - Buy Beige Morph Maternity Women's Nursing Bra Online at Best Prices in India | Flipkart.com,Morph Maternity Women's Nursing Bra - Buy Beige Morph Maternity Women's Nursing Bra For Only Rs. 595.0 Online in India. Shop Online For Apparels. Huge Collection of Branded Clothes Only at,['32C'  '34C'],None,<div class="item_left_column" id="specifications"> <h3 class="item_desc_title fk-uppercase">         Specifications of Morph Maternity Women's Nursing Bra    </h3> <table cellspacing="0" class="fk-specs-type2"> <tr> <th class="group-head" colspan="2">General Details<a class="see-more unitExt rmargin10 no-underline" href="javascript:void(0);" onclick="$(this).closest('.fk-specs-type2').toggleClass('expandedMore')" title="Expand">[+]</a><a class="hidden unitExt rmargin10 no-underline" href="javascript:void(0);" onclick="$(this).closest('.fk-specs-type2').toggleClass('expandedMore')" title="Collapse">[-]</a></th> </tr> <tr class="hidden"> <td class="specs-key">Ideal For</td> <td class="specs-value fk-data">Women's</td> </tr> <tr class="hidden"> <td class="specs-key">Pattern</td> <td class="specs-value fk-data">Solid</td> </tr> </table> <table cellspacing="0" class="fk-specs-type2"> <tr> <th class="group-head" colspan="2">Bra Details</th> </tr> <tr class=""> <td class="specs-key">Type</td> <td class="specs-value fk-data">Nursing Bra</td> </tr> <tr class=""> <td class="specs-key">Fabric</td> <td class="specs-value fk-data">Cotton</td> </tr> <tr class=""> <td class="specs-key">Style</td> <td class="specs-value fk-data">Panel Detail  Elastic Underbust</td> </tr> <tr class=""> <td class="specs-key">Straps</td> <td class="specs-value fk-data">Adjustable</td> </tr> <tr class=""> <td class="specs-key">Closure</td> <td class="specs-value fk-data">Hooks at Back</td> </tr> </table> <table cellspacing="0" class="fk-specs-type2"> <tr> <th class="group-head" colspan="2">Fabric Care</th> </tr> <tr class=""> <td class="specs-value fk-data" colspan="2">Hand Wash Cold  Low Iron  Do Not Tumble Dry  Do Not Bleach</td> </tr> </table> <table cellspacing="0" class="fk-specs-type2"> <tr> <th class="group-head" colspan="2">Additional Details<a class="see-more unitExt rmargin10 no-underline" href="javascript:void(0);" onclick="$(this).closest('.fk-specs-type2').toggleClass('expandedMore')" title="Expand">[+]</a><a class="hidden unitExt rmargin10 no-underline" href="javascript:void(0);" onclick="$(this).closest('.fk-specs-type2').toggleClass('expandedMore')" title="Collapse">[-]</a></th> </tr> <tr class="hidden"> <td class="specs-key"> </td> <td class="specs-value fk-data">The Cups are leak-proof   so no more embarrassing breast-milk leaks in public It is made of 100% breathable fabric  so very comfortable. Drop cup for easy nursing . Rear Clouser with Adjustable hook &amp; eye Breathable cotton fabric maximizies support &amp; comfort all day and night Discrete nursing clips  featuring one handed access.</td> </tr> </table> </div>,10:03:2014,None
LSTCPIDQWZHRMNGV3YRLKBTND,Morph Maternity Women's Capri,http://www.flipkart.com/womens-clothing?otracker=hp_nmenu_sub_women_0_Clothing,Rs. 995,Clothing,Maternity Wear,StyleToss,http://img6a.flixcart.com/image/capri/g/x/7/cccp611cpblk0-morph-maternity-m-400x400-imadrcqau9hqpsus.jpeg,Rs. 995,Black,women,http://www.flipkart.com/morph-maternity-women-s-capri/p/itmdqwzgu9ukfzhs?pid=CPIDQWZHRMNGV3YR&srno=b_13&ref=cc7f1b6e-4890-4d3d-bebe-ba3bcf9863a4,WS Retail,Morph Maternity Women's Capri - Buy Black Morph Maternity Women's Capri Online at Best Prices in India | Flipkart.com,Morph Maternity Women's Capri - Buy Black Morph Maternity Women's Capri For Only Rs. 995.0 Online in India. Shop Online For Apparels. Huge Collection of Branded Clothes Only at,['S'  'M'  'L'],None,<div class="item_left_column" id="specifications"> <h3 class="item_desc_title fk-uppercase">         Specifications of Morph Maternity Women's Capri    </h3> <table cellspacing="0" class="fk-specs-type2"> <tr> <th class="group-head" colspan="2">General Details<a class="see-more unitExt rmargin10 no-underline" href="javascript:void(0);" onclick="$(this).closest('.fk-specs-type2').toggleClass('expandedMore')" title="Expand">[+]</a><a class="hidden unitExt rmargin10 no-underline" href="javascript:void(0);" onclick="$(this).closest('.fk-specs-type2').toggleClass('expandedMore')" title="Collapse">[-]</a></th> </tr> <tr class="hidden"> <td class="specs-key">Ideal For</td> <td class="specs-value fk-data">Women's</td> </tr> <tr class="hidden"> <td class="specs-key">Occasion</td> <td class="specs-value fk-data">Casual</td> </tr> </table> <table cellspacing="0" class="fk-specs-type2"> <tr> <th class="group-head" colspan="2">Capri Details</th> </tr> <tr class=""> <td class="specs-key">Fabric</td> <td class="specs-value fk-data">Cotton</td> </tr> </table> <table cellspacing="0" class="fk-specs-type2"> <tr> <th class="group-head" colspan="2">Fabric Care</th> </tr> <tr class=""> <td class="specs-value fk-data" colspan="2">Hand or Machine Wash in Normal Cycle</td> </tr> </table> <table cellspacing="0" class="fk-specs-type2"> <tr> <th class="group-head" colspan="2">Additional Details<a class="see-more unitExt rmargin10 no-underline" href="javascript:void(0);" onclick="$(this).closest('.fk-specs-type2').toggleClass('expandedMore')" title="Expand">[+]</a><a class="hidden unitExt rmargin10 no-underline" href="javascript:void(0);" onclick="$(this).closest('.fk-specs-type2').toggleClass('expandedMore')" title="Collapse">[-]</a></th> </tr> <tr class="hidden"> <td class="specs-key"> </td> <td class="specs-value fk-data">Casual Capri High Belly Elastic Waist band</td> </tr> </table> </div>,10:03:2014,None
None,StyleToss Women's Layered Dress,http://www.flipkart.com/womens-clothing?otracker=hp_nmenu_sub_women_0_Clothing,Rs. 990,Clothing,Maternity Wear,StyleToss,http://img5a.flixcart.com/image/dress/d/t/y/1526-styletoss-s-400x400-imadpws9gumumcph.jpeg,Rs. 990,Brown,women,http://www.flipkart.com/styletoss-women-s-layered-dress/p/itmdpwgtvy6eyh6p?pid=DREDPWGT59FDFMBP&srno=b_30&ref=67413aa2-59c8-44eb-843b-4bcf02bd3c3a,BunrickFashions,StyleToss Women's Layered Dress - Buy Brown StyleToss Women's Layered Dress Online at Best Prices in India | Flipkart.com,StyleToss Women's Layered Dress - Buy Brown StyleToss Women's Layered Dress For Only Rs. 0.0 Online in India. Shop Online For Apparels. Huge Collection of Branded Clothes Only at,['M'  'L'],<div class="item_left_column" id="description"> <h3 class="item_desc_title fk-uppercase">StyleToss Women's Layered Dress         Price: Rs.990</h3> <div class="cls"></div> <div class="item_desc_text line"> <div style="float:right"> </div>                         give your femininity a perfect look with this fine peace of brown polka dot dress by style toss.pair up with heels or trendy jewellery        </div> <div style="clear: both;"></div> </div>,<div class="item_left_column" id="specifications"> <h3 class="item_desc_title fk-uppercase">         Specifications of StyleToss Women's Layered Dress    </h3> <table cellspacing="0" class="fk-specs-type2"> <tr> <th class="group-head" colspan="2">General Details<a class="see-more unitExt rmargin10 no-underline" href="javascript:void(0);" onclick="$(this).closest('.fk-specs-type2').toggleClass('expandedMore')" title="Expand">[+]</a><a class="hidden unitExt rmargin10 no-underline" href="javascript:void(0);" onclick="$(this).closest('.fk-specs-type2').toggleClass('expandedMore')" title="Collapse">[-]</a></th> </tr> <tr class="hidden"> <td class="specs-key">Ideal For</td> <td class="specs-value fk-data">Women's</td> </tr> <tr class="hidden"> <td class="specs-key">Occasion</td> <td class="specs-value fk-data">Party</td> </tr> <tr class="hidden"> <td class="specs-key">Pattern</td> <td class="specs-value fk-data">Polka Print</td> </tr> </table> <table cellspacing="0" class="fk-specs-type2"> <tr> <th class="group-head" colspan="2">Dress Details</th> </tr> <tr class=""> <td class="specs-key">Type</td> <td class="specs-value fk-data">Layered</td> </tr> <tr class=""> <td class="specs-key">Fabric</td> <td class="specs-value fk-data">Polyester</td> </tr> </table> <table cellspacing="0" class="fk-specs-type2"> <tr> <th class="group-head" colspan="2">Fabric Care</th> </tr> <tr class=""> <td class="specs-value fk-data" colspan="2">Soft Wash</td> </tr> </table> <table cellspacing="0" class="fk-specs-type2"> <tr> <th class="group-head" colspan="2">Dimensions</th> </tr> <tr class=""> <td class="specs-key">Length</td> <td class="specs-value fk-data">Mini/Short</td> </tr> </table> <table cellspacing="0" class="fk-specs-type2"> <tr> <th class="group-head" colspan="2">In The Box</th> </tr> <tr class=""> <td class="specs-key"> </td> <td class="specs-value fk-data">Dress</td> </tr> </table> </div>,10:03:2014,None
LSTPANDHFQAFUM3WGF2AUGEWA,Morph Maternity Women's Maternity Panty,http://www.flipkart.com/womens-clothing?otracker=hp_nmenu_sub_women_0_Clothing,Rs. 275,Clothing,Maternity Wear,StyleToss,http://img6a.flixcart.com/image/panty/y/6/m/mphs017copch000peach-morph-maternity-l-400x400-imadkpgbs4e3ubgz.jpeg,Rs. 275,Peach,women,http://www.flipkart.com/morph-maternity-women-s-panty/p/itmdhtgxvzhe9guf?pid=PANDHFQAFUM3WGF2&srno=b_26&ref=67413aa2-59c8-44eb-843b-4bcf02bd3c3a,WS Retail,Morph Maternity Women's Maternity Panty - Buy Peach Morph Maternity Women's Maternity Panty Online at Best Prices in India | Flipkart.com,Morph Maternity Women's Maternity Panty - Buy Peach Morph Maternity Women's Maternity Panty For Only Rs. 275.0 Online in India. Shop Online For Apparels. Huge Collection of Branded Clothes Only at,['L'  'XL'],<div class="item_left_column" id="description"> <h3 class="item_desc_title fk-uppercase">Morph Maternity Women's Maternity Panty         Price: Rs.275</h3> <div class="cls"></div> <div class="item_desc_text line"> <div style="float:right"> </div> <p style="text-align: justify;">   Aiming to provide all those expecting mothers unparalleled comfort during their pregnancy  these <strong>maternity panties</strong> from Morph Maternity are exceptionally crafted from pure cotton to keep you at ease at all times. The elasticated waistband and leg hole see to it that you slip into them without any difficulty.</p> </div> <div style="clear: both;"></div> </div>,<div class="item_left_column" id="specifications"> <h3 class="item_desc_title fk-uppercase">         Specifications of Morph Maternity Women's Maternity Panty    </h3> <table cellspacing="0" class="fk-specs-type2"> <tr> <th class="group-head" colspan="2">General Details<a class="see-more unitExt rmargin10 no-underline" href="javascript:void(0);" onclick="$(this).closest('.fk-specs-type2').toggleClass('expandedMore')" title="Expand">[+]</a><a class="hidden unitExt rmargin10 no-underline" href="javascript:void(0);" onclick="$(this).closest('.fk-specs-type2').toggleClass('expandedMore')" title="Collapse">[-]</a></th> </tr> <tr class="hidden"> <td class="specs-key">Ideal For</td> <td class="specs-value fk-data">Women's</td> </tr> <tr class="hidden"> <td class="specs-key">Occasion</td> <td class="specs-value fk-data">Casual</td> </tr> <tr class="hidden"> <td class="specs-key">Pattern</td> <td class="specs-value fk-data">Solid</td> </tr> </table> <table cellspacing="0" class="fk-specs-type2"> <tr> <th class="group-head" colspan="2">Panty Details</th> </tr> <tr class=""> <td class="specs-key">Type</td> <td class="specs-value fk-data">Maternity</td> </tr> <tr class=""> <td class="specs-key">Fabric</td> <td class="specs-value fk-data">100% Cotton</td> </tr> <tr class=""> <td class="specs-key">Design</td> <td class="specs-value fk-data">Logo Print Below Waistband</td> </tr> </table> <table cellspacing="0" class="fk-specs-type2"> <tr> <th class="group-head" colspan="2">Fabric Care</th> </tr> <tr class=""> <td class="specs-value fk-data" colspan="2">Do Not Bleach  Do Not Iron  Machine Wash at 40°C  Do Not Wring</td> </tr> </table> <table cellspacing="0" class="fk-specs-type2"> <tr> <th class="group-head" colspan="2">Additional Details<a class="see-more unitExt rmargin10 no-underline" href="javascript:void(0);" onclick="$(this).closest('.fk-specs-type2').toggleClass('expandedMore')" title="Expand">[+]</a><a class="hidden unitExt rmargin10 no-underline" href="javascript:void(0);" onclick="$(this).closest('.fk-specs-type2').toggleClass('expandedMore')" title="Collapse">[-]</a></th> </tr> <tr class="hidden"> <td class="specs-key"> </td> <td class="specs-value fk-data">Elasticated Waistband and Leghole</td> </tr> </table> </div>,10:03:2014,None
None,StyleToss Women's Solid Casual Shirt,http://www.flipkart.com/womens-clothing?otracker=hp_nmenu_sub_women_0_Clothing,Rs. 699,Clothing,Maternity Wear,StyleToss,http://img5a.flixcart.com/image/shirt/f/t/8/st1622-styletoss-xs-400x400-imadsfe4ztsyzhre.jpeg,Rs. 699,Blue,women,http://www.flipkart.com/styletoss-women-s-solid-casual-shirt/p/itmdsfyd4jfgehve?pid=SHTDSFYCTTYGGFT8&srno=b_29&ref=67413aa2-59c8-44eb-843b-4bcf02bd3c3a,BunrickFashions,StyleToss Women's Solid Casual Shirt - Buy Blue StyleToss Women's Solid Casual Shirt Online at Best Prices in India | Flipkart.com,StyleToss Women's Solid Casual Shirt - Buy Blue StyleToss Women's Solid Casual Shirt For Only Rs. 0.0 Online in India. Shop Online For Apparels. Huge Collection of Branded Clothes Only at,['XS'  'S'  'M'  'L'],<div class="item_left_column" id="description"> <h3 class="item_desc_title fk-uppercase">StyleToss Women's Solid Casual Shirt         Price: Rs.699</h3> <div class="cls"></div> <div class="item_desc_text line"> <div style="float:right"> </div>                         StyleToss classic shirt with front pockets.        </div> <div style="clear: both;"></div> </div>,<div class="item_left_column" id="specifications"> <h3 class="item_desc_title fk-uppercase">         Specifications of StyleToss Women's Solid Casual Shirt    </h3> <table cellspacing="0" class="fk-specs-type2"> <tr> <th class="group-head" colspan="2">General Details<a class="see-more unitExt rmargin10 no-underline" href="javascript:void(0);" onclick="$(this).closest('.fk-specs-type2').toggleClass('expandedMore')" title="Expand">[+]</a><a class="hidden unitExt rmargin10 no-underline" href="javascript:void(0);" onclick="$(this).closest('.fk-specs-type2').toggleClass('expandedMore')" title="Collapse">[-]</a></th> </tr> <tr class="hidden"> <td class="specs-key">Ideal For</td> <td class="specs-value fk-data">Women's</td> </tr> <tr class="hidden"> <td class="specs-key">Occasion</td> <td class="specs-value fk-data">Casual</td> </tr> <tr class="hidden"> <td class="specs-key">Pattern</td> <td class="specs-value fk-data">Solid</td> </tr> </table> <table cellspacing="0" class="fk-specs-type2"> <tr> <th class="group-head" colspan="2">Shirt Details</th> </tr> <tr class=""> <td class="specs-key">Fabric</td> <td class="specs-value fk-data">Polyester</td> </tr> <tr class=""> <td class="specs-key">Fit</td> <td class="specs-value fk-data">Regular</td> </tr> <tr class=""> <td class="specs-key">Collar</td> <td class="specs-value fk-data">Semi Spread Collar</td> </tr> <tr class=""> <td class="specs-key">Sleeve</td> <td class="specs-value fk-data">3/4 Sleeve</td> </tr> <tr class=""> <td class="specs-key">Number of Contents in Sales Package</td> <td class="specs-value fk-data">Pack of 1</td> </tr> </table> <table cellspacing="0" class="fk-specs-type2"> <tr> <th class="group-head" colspan="2">Fabric Care</th> </tr> <tr class=""> <td class="specs-value fk-data" colspan="2">Soft Wash</td> </tr> </table> <table cellspacing="0" class="fk-specs-type2"> <tr> <th class="group-head" colspan="2">In the Box</th> </tr> <tr class=""> <td class="specs-key"> </td> <td class="specs-value fk-data">Shirt</td> </tr> </table> <table cellspacing="0" class="fk-specs-type2"> <tr> <th class="group-head" colspan="2">Additional Details<a class="see-more unitExt rmargin10 no-underline" href="javascript:void(0);" onclick="$(this).closest('.fk-specs-type2').toggleClass('expandedMore')" title="Expand">[+]</a><a class="hidden unitExt rmargin10 no-underline" href="javascript:void(0);" onclick="$(this).closest('.fk-specs-type2').toggleClass('expandedMore')" title="Collapse">[-]</a></th> </tr> <tr class="hidden"> <td class="specs-key">Style Code</td> <td class="specs-value fk-data">ST1622</td> </tr> </table> </div>,10:03:2014,None
