LSTDREDSXGRXBRGYQKZ4JENHO,StyleToss Women's Gathered Dress,http://www.flipkart.com/womens-clothing?otracker=hp_nmenu_sub_women_0_Clothing,Rs. 999,Clothing,Maternity Wear,StyleToss,http://img6a.flixcart.com/image/dress/q/k/z/st1616-styletoss-m-400x400-imadsuvzhvqxhgxs.jpeg,Rs. 999,Black,women,http://www.flipkart.com/styletoss-women-s-gathered-dress/p/itmdsxgukfzuwmce?pid=DREDSXGRXBRGYQKZ&srno=b_4&ref=cc7f1b6e-4890-4d3d-bebe-ba3bcf9863a4,BunrickFashions,StyleToss Women's Gathered Dress - Buy Purple StyleToss Women's Gathered Dress Online at Best Prices in India | Flipkart.com,StyleToss Women's Gathered Dress - Buy Purple StyleToss Women's Gathered Dress For Only Rs. 0.0 Online in India. Shop Online For Apparels. Huge Collection of Branded Clothes Only at,['S'  'M'  'L'  'XL'  'XXL'],<div class="item_left_column" id="description"> <h3 class="item_desc_title fk-uppercase">StyleToss Women's Gathered Dress         Price: Rs.999</h3> <div class="cls"></div> <div class="item_desc_text line"> <div style="float:right"> </div>                         StyleToss purple one shoulder dress.        </div> <div style="clear: both;"></div> </div>,<div class="item_left_column" id="specifications"> <h3 class="item_desc_title fk-uppercase">         Specifications of StyleToss Women's Gathered Dress    </h3> <table cellspacing="0" class="fk-specs-type2"> <tr> <th class="group-head" colspan="2">General Details<a class="see-more unitExt rmargin10 no-underline" href="javascript:void(0);" onclick="$(this).closest('.fk-specs-type2').toggleClass('expandedMore')" title="Expand">[+]</a><a class="hidden unitExt rmargin10 no-underline" href="javascript:void(0);" onclick="$(this).closest('.fk-specs-type2').toggleClass('expandedMore')" title="Collapse">[-]</a></th> </tr> <tr class="hidden"> <td class="specs-key">Ideal For</td> <td class="specs-value fk-data">Women's</td> </tr> <tr class="hidden"> <td class="specs-key">Occasion</td> <td class="specs-value fk-data">Party</td> </tr> <tr class="hidden"> <td class="specs-key">Pattern</td> <td class="specs-value fk-data">Solid</td> </tr> </table> <table cellspacing="0" class="fk-specs-type2"> <tr> <th class="group-head" colspan="2">Dress Details</th> </tr> <tr class=""> <td class="specs-key">Type</td> <td class="specs-value fk-data">Gathered</td> </tr> <tr class=""> <td class="specs-key">Fabric</td> <td class="specs-value fk-data">Polyester</td> </tr> <tr class=""> <td class="specs-key">Sleeve</td> <td class="specs-value fk-data">Sleeveless</td> </tr> </table> <table cellspacing="0" class="fk-specs-type2"> <tr> <th class="group-head" colspan="2">Fabric Care</th> </tr> <tr class=""> <td class="specs-value fk-data" colspan="2">Soft Wash</td> </tr> </table> <table cellspacing="0" class="fk-specs-type2"> <tr> <th class="group-head" colspan="2">Dimensions</th> </tr> <tr class=""> <td class="specs-key">Length</td> <td class="specs-value fk-data">Mini/Short</td> </tr> </table> <table cellspacing="0" class="fk-specs-type2"> <tr> <th class="group-head" colspan="2">In The Box</th> </tr> <tr class=""> <td class="specs-key"> </td> <td class="specs-value fk-data">Dress</td> </tr> </table> </div>,10:03:2014,None
LSTDREDPWGTFGFHJQZ8TDEGJI,StyleToss Women's Sheath Dress,http://www.flipkart.com/womens-clothing?otracker=hp_nmenu_sub_women_0_Clothing,Rs. 1499,Clothing,Maternity Wear,StyleToss,http://img6a.flixcart.com/image/dress/q/z/8/1573-styletoss-s-400x400-imadpws7sfhnyj2f.jpeg,Rs. 1499,Grey,women,http://www.flipkart.com/styletoss-women-s-sheath-dress/p/itmdpwgtnmzpedpg?pid=DREDPWGTFGFHJQZ8&srno=b_2&ref=cc7f1b6e-4890-4d3d-bebe-ba3bcf9863a4,BunrickFashions,StyleToss Women's Sheath Dress - Buy Grey StyleToss Women's Sheath Dress Online at Best Prices in India | Flipkart.com,StyleToss Women's Sheath Dress - Buy Grey StyleToss Women's Sheath Dress For Only Rs. 0.0 Online in India. Shop Online For Apparels. Huge Collection of Branded Clothes Only at,['XS'  'S'  'M'  'L'  'XL'],<div class="item_left_column" id="description"> <h3 class="item_desc_title fk-uppercase">StyleToss Women's Sheath Dress         Price: Rs.1499</h3> <div class="cls"></div> <div class="item_desc_text line"> <div style="float:right"> </div>                         For pretty going out style look no further than this grey sequin dress by StyleToss. Pair it with heels/boots for smart &amp; stylish look        </div> <div style="clear: both;"></div> </div>,<div class="item_left_column" id="specifications"> <h3 class="item_desc_title fk-uppercase">         Specifications of StyleToss Women's Sheath Dress    </h3> <table cellspacing="0" class="fk-specs-type2"> <tr> <th class="group-head" colspan="2">General Details<a class="see-more unitExt rmargin10 no-underline" href="javascript:void(0);" onclick="$(this).closest('.fk-specs-type2').toggleClass('expandedMore')" title="Expand">[+]</a><a class="hidden unitExt rmargin10 no-underline" href="javascript:void(0);" onclick="$(this).closest('.fk-specs-type2').toggleClass('expandedMore')" title="Collapse">[-]</a></th> </tr> <tr class="hidden"> <td class="specs-key">Ideal For</td> <td class="specs-value fk-data">Women's</td> </tr> <tr class="hidden"> <td class="specs-key">Occasion</td> <td class="specs-value fk-data">Party</td> </tr> <tr class="hidden"> <td class="specs-key">Pattern</td> <td class="specs-value fk-data">Solid</td> </tr> </table> <table cellspacing="0" class="fk-specs-type2"> <tr> <th class="group-head" colspan="2">Dress Details</th> </tr> <tr class=""> <td class="specs-key">Type</td> <td class="specs-value fk-data">Sheath</td> </tr> <tr class=""> <td class="specs-key">Fabric</td> <td class="specs-value fk-data">Polyester</td> </tr> </table> <table cellspacing="0" class="fk-specs-type2"> <tr> <th class="group-head" colspan="2">Fabric Care</th> </tr> <tr class=""> <td class="specs-value fk-data" colspan="2">Soft Wash</td> </tr> </table> <table cellspacing="0" class="fk-specs-type2"> <tr> <th class="group-head" colspan="2">Dimensions</th> </tr> <tr class=""> <td class="specs-key">Length</td> <td class="specs-value fk-data">Mini/Short</td> </tr> </table> <table cellspacing="0" class="fk-specs-type2"> <tr> <th class="group-head" colspan="2">In The Box</th> </tr> <tr class=""> <td class="specs-key"> </td> <td class="specs-value fk-data">Dress</td> </tr> </table> </div>,10:03:2014,None
LSTTUNDTPF8EVQWAUB6SVWMKC,StyleToss Solid Women's Tunic,http://www.flipkart.com/womens-clothing?otracker=hp_nmenu_sub_women_0_Clothing,Rs. 599,Clothing,Maternity Wear,StyleToss,http://img5a.flixcart.com/image/tunic/u/b/6/1624-black-f-styletoss-s-400x400-imadtkkxqc92gg4m.jpeg,Rs. 599,Black,women,http://www.flipkart.com/styletoss-solid-women-s-tunic/p/itmdtpf8qdyw74yw?pid=TUNDTPF8EVQWAUB6&srno=b_8&ref=cc7f1b6e-4890-4d3d-bebe-ba3bcf9863a4,Fashionara,StyleToss Solid Women's Tunic - Buy Black StyleToss Solid Women's Tunic Online at Best Prices in India | Flipkart.com,StyleToss Solid Women's Tunic - Buy Black StyleToss Solid Women's Tunic For Only Rs. 599.00 Online in India. Shop Online For Apparels. Huge Collection of Branded Clothes Only at,['S'  'M'  'L'  'XL'],<div class="item_left_column" id="description"> <h3 class="item_desc_title fk-uppercase">StyleToss Solid Women's Tunic         Price: Rs.599</h3> <div class="cls"></div> <div class="item_desc_text line"> <div style="float:right"> </div>                         Chic  stylish and comfy! A trendy top that assures a flattering fit. This top comes with elasticised ruching on the sides that adds a touch of oomph factor to this style. Short sleeves  a rounded V-neck and a curved hem complete this design.  This top looks great over skinny jeans  tapered pants or shorts. Choose a bottom and complete  the style with an oversized bag  button earrings and oxford shoes.        </div> <div style="clear: both;"></div> </div>,<div class="item_left_column" id="specifications"> <h3 class="item_desc_title fk-uppercase">         Specifications of StyleToss Solid Women's Tunic    </h3> <table cellspacing="0" class="fk-specs-type2"> <tr> <th class="group-head" colspan="2">General Details<a class="see-more unitExt rmargin10 no-underline" href="javascript:void(0);" onclick="$(this).closest('.fk-specs-type2').toggleClass('expandedMore')" title="Expand">[+]</a><a class="hidden unitExt rmargin10 no-underline" href="javascript:void(0);" onclick="$(this).closest('.fk-specs-type2').toggleClass('expandedMore')" title="Collapse">[-]</a></th> </tr> <tr class="hidden"> <td class="specs-key">Ideal For</td> <td class="specs-value fk-data">Women's</td> </tr> <tr class="hidden"> <td class="specs-key">Occasion</td> <td class="specs-value fk-data">Casual</td> </tr> <tr class="hidden"> <td class="specs-key">Pattern</td> <td class="specs-value fk-data">Solid</td> </tr> </table> <table cellspacing="0" class="fk-specs-type2"> <tr> <th class="group-head" colspan="2">Tunic Details</th> </tr> <tr class=""> <td class="specs-key">Fabric</td> <td class="specs-value fk-data">Synthetic</td> </tr> <tr class=""> <td class="specs-key">Sleeve</td> <td class="specs-value fk-data">Half Sleeve</td> </tr> </table> <table cellspacing="0" class="fk-specs-type2"> <tr> <th class="group-head" colspan="2">Fabric Care</th> </tr> <tr class=""> <td class="specs-value fk-data" colspan="2">Machine wash cold  Wash dark colours separately  Tumble dry low  Cool iron low</td> </tr> </table> <table cellspacing="0" class="fk-specs-type2"> <tr> <th class="group-head" colspan="2">In the Box</th> </tr> <tr class=""> <td class="specs-key"> </td> <td class="specs-value fk-data">Tunic</td> </tr> </table> </div>,10:03:2014,None
LSTSHTDSFYCDUGWY4FUXBEBKZ,StyleToss Women's Solid Casual Shirt,http://www.flipkart.com/womens-clothing?otracker=hp_nmenu_sub_women_0_Clothing,Rs. 699,Clothing,Maternity Wear,StyleToss,http://img6a.flixcart.com/image/shirt/7/h/v/st1623-styletoss-l-400x400-imadsfe4akmk9wpf.jpeg,Rs. 699,Blue,women,http://www.flipkart.com/styletoss-women-s-solid-casual-shirt/p/itmdsfydn9pzyz4m?pid=SHTDSFYCDUGWY4FU&srno=b_5&ref=cc7f1b6e-4890-4d3d-bebe-ba3bcf9863a4,BunrickFashions,StyleToss Women's Solid Casual Shirt - Buy Green StyleToss Women's Solid Casual Shirt Online at Best Prices in India | Flipkart.com,StyleToss Women's Solid Casual Shirt - Buy Green StyleToss Women's Solid Casual Shirt For Only Rs. 0.0 Online in India. Shop Online For Apparels. Huge Collection of Branded Clothes Only at,['S'  'M'  'L'  'XL'],<div class="item_left_column" id="description"> <h3 class="item_desc_title fk-uppercase">StyleToss Women's Solid Casual Shirt         Price: Rs.699</h3> <div class="cls"></div> <div class="item_desc_text line"> <div style="float:right"> </div>                         StyleToss classic shirt with front pockets.        </div> <div style="clear: both;"></div> </div>,<div class="item_left_column" id="specifications"> <h3 class="item_desc_title fk-uppercase">         Specifications of StyleToss Women's Solid Casual Shirt    </h3> <table cellspacing="0" class="fk-specs-type2"> <tr> <th class="group-head" colspan="2">General Details<a class="see-more unitExt rmargin10 no-underline" href="javascript:void(0);" onclick="$(this).closest('.fk-specs-type2').toggleClass('expandedMore')" title="Expand">[+]</a><a class="hidden unitExt rmargin10 no-underline" href="javascript:void(0);" onclick="$(this).closest('.fk-specs-type2').toggleClass('expandedMore')" title="Collapse">[-]</a></th> </tr> <tr class="hidden"> <td class="specs-key">Ideal For</td> <td class="specs-value fk-data">Women's</td> </tr> <tr class="hidden"> <td class="specs-key">Occasion</td> <td class="specs-value fk-data">Casual</td> </tr> <tr class="hidden"> <td class="specs-key">Pattern</td> <td class="specs-value fk-data">Solid</td> </tr> </table> <table cellspacing="0" class="fk-specs-type2"> <tr> <th class="group-head" colspan="2">Shirt Details</th> </tr> <tr class=""> <td class="specs-key">Fabric</td> <td class="specs-value fk-data">Polyester</td> </tr> <tr class=""> <td class="specs-key">Fit</td> <td class="specs-value fk-data">Regular</td> </tr> <tr class=""> <td class="specs-key">Collar</td> <td class="specs-value fk-data">Semi Spread Collar</td> </tr> <tr class=""> <td class="specs-key">Sleeve</td> <td class="specs-value fk-data">3/4 Sleeve</td> </tr> <tr class=""> <td class="specs-key">Number of Contents in Sales Package</td> <td class="specs-value fk-data">Pack of 1</td> </tr> </table> <table cellspacing="0" class="fk-specs-type2"> <tr> <th class="group-head" colspan="2">Fabric Care</th> </tr> <tr class=""> <td class="specs-value fk-data" colspan="2">Soft Wash</td> </tr> </table> <table cellspacing="0" class="fk-specs-type2"> <tr> <th class="group-head" colspan="2">In the Box</th> </tr> <tr class=""> <td class="specs-key"> </td> <td class="specs-value fk-data">Shirt</td> </tr> </table> <table cellspacing="0" class="fk-specs-type2"> <tr> <th class="group-head" colspan="2">Additional Details<a class="see-more unitExt rmargin10 no-underline" href="javascript:void(0);" onclick="$(this).closest('.fk-specs-type2').toggleClass('expandedMore')" title="Expand">[+]</a><a class="hidden unitExt rmargin10 no-underline" href="javascript:void(0);" onclick="$(this).closest('.fk-specs-type2').toggleClass('expandedMore')" title="Collapse">[-]</a></th> </tr> <tr class="hidden"> <td class="specs-key">Style Code</td> <td class="specs-value fk-data">ST1623</td> </tr> </table> </div>,10:03:2014,None
LSTDREDPWGTYGGCS84GUZ3EZG,StyleToss Women's Sheath Dress,http://www.flipkart.com/womens-clothing?otracker=hp_nmenu_sub_women_0_Clothing,Rs. 699,Clothing,Maternity Wear,StyleToss,http://img6a.flixcart.com/image/dress/n/g/e/1576-styletoss-xl-400x400-imadpws7bhmcyadx.jpeg,Rs. 999,Cream,women,http://www.flipkart.com/styletoss-women-s-sheath-dress/p/itmdpwgt9cjafheg?pid=DREDPWGTYGGCS84G&srno=b_11&ref=cc7f1b6e-4890-4d3d-bebe-ba3bcf9863a4,BunrickFashions,StyleToss Women's Sheath Dress - Buy Cream StyleToss Women's Sheath Dress Online at Best Prices in India | Flipkart.com,StyleToss Women's Sheath Dress - Buy Cream StyleToss Women's Sheath Dress For Only Rs. 0.0 Online in India. Shop Online For Apparels. Huge Collection of Branded Clothes Only at,['S'  'M'  'L'  'XL'],<div class="item_left_column" id="description"> <h3 class="item_desc_title fk-uppercase">StyleToss Women's Sheath Dress         Price: Rs.699</h3> <div class="cls"></div> <div class="item_desc_text line"> <div style="float:right"> </div>                         Keep it sweet and chic in this timeless off beige cottton dress by Styletoss. In a wrap effect with sobar design  this is a fail-safe evening look you can dig out year-round. Features cinched in waist.        </div> <div style="clear: both;"></div> </div>,<div class="item_left_column" id="specifications"> <h3 class="item_desc_title fk-uppercase">         Specifications of StyleToss Women's Sheath Dress    </h3> <table cellspacing="0" class="fk-specs-type2"> <tr> <th class="group-head" colspan="2">General Details<a class="see-more unitExt rmargin10 no-underline" href="javascript:void(0);" onclick="$(this).closest('.fk-specs-type2').toggleClass('expandedMore')" title="Expand">[+]</a><a class="hidden unitExt rmargin10 no-underline" href="javascript:void(0);" onclick="$(this).closest('.fk-specs-type2').toggleClass('expandedMore')" title="Collapse">[-]</a></th> </tr> <tr class="hidden"> <td class="specs-key">Ideal For</td> <td class="specs-value fk-data">Women's</td> </tr> <tr class="hidden"> <td class="specs-key">Occasion</td> <td class="specs-value fk-data">Party</td> </tr> <tr class="hidden"> <td class="specs-key">Pattern</td> <td class="specs-value fk-data">Solid</td> </tr> </table> <table cellspacing="0" class="fk-specs-type2"> <tr> <th class="group-head" colspan="2">Dress Details</th> </tr> <tr class=""> <td class="specs-key">Type</td> <td class="specs-value fk-data">Sheath</td> </tr> <tr class=""> <td class="specs-key">Fabric</td> <td class="specs-value fk-data">Cotton</td> </tr> </table> <table cellspacing="0" class="fk-specs-type2"> <tr> <th class="group-head" colspan="2">Fabric Care</th> </tr> <tr class=""> <td class="specs-value fk-data" colspan="2">Soft Wash</td> </tr> </table> <table cellspacing="0" class="fk-specs-type2"> <tr> <th class="group-head" colspan="2">Dimensions</th> </tr> <tr class=""> <td class="specs-key">Length</td> <td class="specs-value fk-data">Mini/Short</td> </tr> </table> <table cellspacing="0" class="fk-specs-type2"> <tr> <th class="group-head" colspan="2">In The Box</th> </tr> <tr class=""> <td class="specs-key"> </td> <td class="specs-value fk-data">Dress</td> </tr> </table> </div>,10:03:2014,None
LSTPANDHFQAZY64BACC9HXNTC,Morph Maternity Women's Maternity Panty Panty,http://www.flipkart.com/womens-clothing?otracker=hp_nmenu_sub_women_0_Clothing,Rs. 275,Clothing,Maternity Wear,StyleToss,http://img6a.flixcart.com/image/panty/a/c/c/mphs017copch00peach-morph-maternity-xl-400x400-imadmv9wehyf4uy5.jpeg,Rs. 275,Peach,women,http://www.flipkart.com/morph-maternity-women-s-panty/p/itmdmwg732dshj7u?pid=PANDHFQAZY64BACC&srno=b_16&ref=67413aa2-59c8-44eb-843b-4bcf02bd3c3a,WS Retail,Morph Maternity Women's Maternity Panty Panty - Buy Peach Morph Maternity Women's Maternity Panty Panty Online at Best Prices in India | Flipkart.com,Morph Maternity Women's Maternity Panty Panty - Buy Peach Morph Maternity Women's Maternity Panty Panty For Only Rs. 275.0 Online in India. Shop Online For Apparels. Huge Collection of Branded Clothes Only at,['L'  'XL'],<div class="item_left_column" id="description"> <h3 class="item_desc_title fk-uppercase">Morph Maternity Women's Maternity Panty Panty         Price: Rs.275</h3> <div class="cls"></div> <div class="item_desc_text line"> <div style="float:right"> </div> <p>   Crafted from the finest cotton material  this maternity panty from Morph Maternity ensures a right amount of relaxed and breathable comfort to all those expecting mothers. The <strong>elastic waistband </strong>of this comfortable panty ensures perfect grip and fit.</p> </div> <div style="clear: both;"></div> </div>,<div class="item_left_column" id="specifications"> <h3 class="item_desc_title fk-uppercase">         Specifications of Morph Maternity Women's Maternity Panty Panty    </h3> <table cellspacing="0" class="fk-specs-type2"> <tr> <th class="group-head" colspan="2">General Details<a class="see-more unitExt rmargin10 no-underline" href="javascript:void(0);" onclick="$(this).closest('.fk-specs-type2').toggleClass('expandedMore')" title="Expand">[+]</a><a class="hidden unitExt rmargin10 no-underline" href="javascript:void(0);" onclick="$(this).closest('.fk-specs-type2').toggleClass('expandedMore')" title="Collapse">[-]</a></th> </tr> <tr class="hidden"> <td class="specs-key">Ideal For</td> <td class="specs-value fk-data">Women's</td> </tr> <tr class="hidden"> <td class="specs-key">Occasion</td> <td class="specs-value fk-data">Casual</td> </tr> <tr class="hidden"> <td class="specs-key">Pattern</td> <td class="specs-value fk-data">Solid</td> </tr> </table> <table cellspacing="0" class="fk-specs-type2"> <tr> <th class="group-head" colspan="2">Panty Details</th> </tr> <tr class=""> <td class="specs-key">Type</td> <td class="specs-value fk-data">Maternity Panty</td> </tr> <tr class=""> <td class="specs-key">Fabric</td> <td class="specs-value fk-data">100% Cotton</td> </tr> <tr class=""> <td class="specs-key">Design</td> <td class="specs-value fk-data">Logo Print at Front</td> </tr> </table> <table cellspacing="0" class="fk-specs-type2"> <tr> <th class="group-head" colspan="2">Fabric Care</th> </tr> <tr class=""> <td class="specs-value fk-data" colspan="2">Machine Wash at 40°C  Do Not Bleach  Do Not Wring  Do Not Iron</td> </tr> </table> <table cellspacing="0" class="fk-specs-type2"> <tr> <th class="group-head" colspan="2">Additional Details<a class="see-more unitExt rmargin10 no-underline" href="javascript:void(0);" onclick="$(this).closest('.fk-specs-type2').toggleClass('expandedMore')" title="Expand">[+]</a><a class="hidden unitExt rmargin10 no-underline" href="javascript:void(0);" onclick="$(this).closest('.fk-specs-type2').toggleClass('expandedMore')" title="Collapse">[-]</a></th> </tr> <tr class="hidden"> <td class="specs-key"> </td> <td class="specs-value fk-data">Elasticated Waistband and Leg Opening</td> </tr> </table> </div>,10:03:2014,None
LSTTOPDQX5EYZF56WAAVDEXVN,Morph Maternity Casual Women's Top,http://www.flipkart.com/womens-clothing?otracker=hp_nmenu_sub_women_0_Clothing,Rs. 545,Clothing,Maternity Wear,StyleToss,http://img6a.flixcart.com/image/top/7/k/8/cktp608cppch0-morph-maternity-l-400x400-imadrch34acthavg.jpeg,Rs. 545,Beige,women,http://www.flipkart.com/morph-maternity-casual-women-s-top/p/itmdqx5hzjcgghrh?pid=TOPDQX5EYZF56WAA&srno=b_14&ref=cc7f1b6e-4890-4d3d-bebe-ba3bcf9863a4,WS Retail,Morph Maternity Casual Women's Top - Buy Beige Morph Maternity Casual Women's Top Online at Best Prices in India | Flipkart.com,Morph Maternity Casual Women's Top - Buy Beige Morph Maternity Casual Women's Top For Only Rs. 545.0 Online in India. Shop Online For Apparels. Huge Collection of Branded Clothes Only at,['S'  'M'  'L'],None,<div class="item_left_column" id="specifications"> <h3 class="item_desc_title fk-uppercase">         Specifications of Morph Maternity Casual Women's Top    </h3> <table cellspacing="0" class="fk-specs-type2"> <tr> <th class="group-head" colspan="2">General Details<a class="see-more unitExt rmargin10 no-underline" href="javascript:void(0);" onclick="$(this).closest('.fk-specs-type2').toggleClass('expandedMore')" title="Expand">[+]</a><a class="hidden unitExt rmargin10 no-underline" href="javascript:void(0);" onclick="$(this).closest('.fk-specs-type2').toggleClass('expandedMore')" title="Collapse">[-]</a></th> </tr> <tr class="hidden"> <td class="specs-key">Ideal For</td> <td class="specs-value fk-data">Women's</td> </tr> <tr class="hidden"> <td class="specs-key">Occasion</td> <td class="specs-value fk-data">Casual</td> </tr> </table> <table cellspacing="0" class="fk-specs-type2"> <tr> <th class="group-head" colspan="2">Top Details</th> </tr> <tr class=""> <td class="specs-key">Fabric</td> <td class="specs-value fk-data">Knit Cotton</td> </tr> </table> <table cellspacing="0" class="fk-specs-type2"> <tr> <th class="group-head" colspan="2">Fabric Care</th> </tr> <tr class=""> <td class="specs-value fk-data" colspan="2">Hand or Machine Wash in Normal Cycle</td> </tr> </table> <table cellspacing="0" class="fk-specs-type2"> <tr> <th class="group-head" colspan="2">Additional Details<a class="see-more unitExt rmargin10 no-underline" href="javascript:void(0);" onclick="$(this).closest('.fk-specs-type2').toggleClass('expandedMore')" title="Expand">[+]</a><a class="hidden unitExt rmargin10 no-underline" href="javascript:void(0);" onclick="$(this).closest('.fk-specs-type2').toggleClass('expandedMore')" title="Collapse">[-]</a></th> </tr> <tr class="hidden"> <td class="specs-key"> </td> <td class="specs-value fk-data">Round neck embellished with crotcheted lace.. Short sleeves. Gathers at sides</td> </tr> </table> </div>,10:03:2014,None
LSTTOPDTHT2FBWVQDFWZI0VPJ,StyleToss Casual Sleeveless Solid Women's Top,http://www.flipkart.com/womens-clothing?otracker=hp_nmenu_sub_women_0_Clothing,Rs. 299,Clothing,Maternity Wear,StyleToss,http://img6a.flixcart.com/image/top/4/t/f/st1642-styletoss-xxl-400x400-imadthvhbvpw9tee.jpeg,Rs. 399,Navy Blue,women,http://www.flipkart.com/styletoss-casual-sleeveless-solid-women-s-top/p/itmdthtfjxfjyfw7?pid=TOPDTHT2FBWVQDFW&srno=b_18&ref=67413aa2-59c8-44eb-843b-4bcf02bd3c3a,BunrickFashions,StyleToss Casual Sleeveless Solid Women's Top - Buy Pink StyleToss Casual Sleeveless Solid Women's Top Online at Best Prices in India | Flipkart.com,StyleToss Casual Sleeveless Solid Women's Top - Buy Pink StyleToss Casual Sleeveless Solid Women's Top For Only Rs. 399.00 Online in India. Shop Online For Apparels. Huge Collection of Branded Clothes Only at,['XS'  'S'  'M'  'L'  'XL'  'XXL'],None,<div class="item_left_column" id="specifications"> <h3 class="item_desc_title fk-uppercase">         Specifications of StyleToss Casual Sleeveless Solid Women's Top    </h3> <table cellspacing="0" class="fk-specs-type2"> <tr> <th class="group-head" colspan="2">General Details<a class="see-more unitExt rmargin10 no-underline" href="javascript:void(0);" onclick="$(this).closest('.fk-specs-type2').toggleClass('expandedMore')" title="Expand">[+]</a><a class="hidden unitExt rmargin10 no-underline" href="javascript:void(0);" onclick="$(this).closest('.fk-specs-type2').toggleClass('expandedMore')" title="Collapse">[-]</a></th> </tr> <tr class="hidden"> <td class="specs-key">Ideal For</td> <td class="specs-value fk-data">Women's</td> </tr> <tr class="hidden"> <td class="specs-key">Occasion</td> <td class="specs-value fk-data">Casual</td> </tr> <tr class="hidden"> <td class="specs-key">Pattern</td> <td class="specs-value fk-data">Solid</td> </tr> </table> <table cellspacing="0" class="fk-specs-type2"> <tr> <th class="group-head" colspan="2">Top Details</th> </tr> <tr class=""> <td class="specs-key">Type</td> <td class="specs-value fk-data">Top</td> </tr> <tr class=""> <td class="specs-key">Fabric</td> <td class="specs-value fk-data">Cotton</td> </tr> <tr class=""> <td class="specs-key">Neck</td> <td class="specs-value fk-data">Boat Neck</td> </tr> <tr class=""> <td class="specs-key">Sleeve</td> <td class="specs-value fk-data">Sleeveless</td> </tr> <tr class=""> <td class="specs-key">Number of Contents in Sales Package</td> <td class="specs-value fk-data">Pack of 1</td> </tr> </table> <table cellspacing="0" class="fk-specs-type2"> <tr> <th class="group-head" colspan="2">Fabric Care</th> </tr> <tr class=""> <td class="specs-value fk-data" colspan="2">Soft Wash</td> </tr> </table> <table cellspacing="0" class="fk-specs-type2"> <tr> <th class="group-head" colspan="2">In the Box</th> </tr> <tr class=""> <td class="specs-key"> </td> <td class="specs-value fk-data">Top</td> </tr> </table> </div>,10:03:2014,None
