LSTHPDDFXJTGRMK4B5B2S8ODX,JSB H04 Deluxe Heating Pad,http://www.flipkart.com/health-and-beauty?otracker=hp_nmenu_sub_women_0_Beauty%20and%20Wellness,Rs. 600,Beauty and Wellness,Health Care Devices,JSB,http://img6a.flixcart.com/image/heating-pad/b/5/b/jsb-h04-deluxe-400x400-imadfxhpe4zpryqx.jpeg,Rs. 750,None,women,http://www.flipkart.com/jsb-h04-deluxe-heating-pad/p/itmdzauwrxkupccx?pid=HPDDFXJTGRMK4B5B&srno=b_4&ref=da38ccf0-de5f-4934-9118-be867921446f,WS Retail,JSB H04 Deluxe Heating Pad - JSB: Flipkart.com,Buy JSB H04 Deluxe Heating Pad only for Rs. 600.0 from Flipkart.com. Only Genuine Products. 30 Day Replacement Guarantee. Free Shipping. Cash On,[],<div class="item_left_column" id="description"> <h3 class="item_desc_title fk-uppercase">                 Key Features of JSB H04 Deluxe Heating Pad            </h3> <div class="cls"></div> <div class="item_desc_text"> <ul class="fk-key-features"> <li>3 Temperature Settings</li> </ul> </div> <div style="clear: both;"></div> </div>,<div class="item_left_column" id="specifications"> <h3 class="item_desc_title fk-uppercase">         Specifications of JSB H04 Deluxe Heating Pad    </h3> <table cellspacing="0" class="fk-specs-type2"> <tr> <th class="group-head" colspan="2">General</th> </tr> <tr class=""> <td class="specs-key">Number of Temperature Settings</td> <td class="specs-value fk-data">3</td> </tr> <tr class=""> <td class="specs-key">Used for</td> <td class="specs-value fk-data">Back Pains  Joint Pains  Shoulder Pains and Other Muscle Aches</td> </tr> </table> <table cellspacing="0" class="fk-specs-type2"> <tr> <th class="group-head" colspan="2">Convenience Features</th> </tr> <tr class=""> <td class="specs-key">Other Convenience Features</td> <td class="specs-value fk-data">Maximum Comfort with Fur Type Fabric  For Preheating Switch to Maximum Temperature and Adjust as per Convenience  LED Indicator for Clear Viewing</td> </tr> </table> <table cellspacing="0" class="fk-specs-type2"> <tr> <th class="group-head" colspan="2">Safety Features</th> </tr> <tr class=""> <td class="specs-key">Insulation</td> <td class="specs-value fk-data">Yes</td> </tr> <tr class=""> <td class="specs-key">Other Safety Features</td> <td class="specs-value fk-data">Four Built-in Thermal Cut-outs for 100% Safety  Well Insulated on Either Side for Complete Safety and Comfort  Teflon Coated Wiring for Protection Against Overheat</td> </tr> </table> <table cellspacing="0" class="fk-specs-type2"> <tr> <th class="group-head" colspan="2">Additional Features</th> </tr> <tr class=""> <td class="specs-value fk-data" colspan="2">Most Convenient and Economical Way of Keeping a Person Warm  Very Useful for Arthritics / Diabetic Patients  Long Lasting Heating Elements  Dimensions: 381 x 267 mm  Not to be used by the Patients with Pacemakers</td> </tr> </table> <table cellspacing="0" class="fk-specs-type2"> <tr> <th class="group-head" colspan="2">Dimensions</th> </tr> <tr class=""> <td class="specs-key">Weight</td> <td class="specs-value fk-data">280 gms</td> </tr> </table> <table cellspacing="0" class="fk-specs-type2"> <tr> <th class="group-head" colspan="2">Warranty</th> </tr> <tr class=""> <td class="specs-key">Domestic Term</td> <td class="specs-value fk-data">1 Year</td> </tr> </table> </div>,10:03:2014,None
LSTMASCZZYMGJVWNFCGCXURW9,JSB HF05 Leg & Foot Massager,http://www.flipkart.com/health-and-beauty?otracker=hp_nmenu_sub_women_0_Beauty%20and%20Wellness,Rs. 10900,Beauty and Wellness,Health Care Devices,JSB,http://img6a.flixcart.com/image/massager/f/c/g/jsb-leg-foot-hf05-400x400-imadekfmxutn4ngw.jpeg,Rs. 19500,None,women,http://www.flipkart.com/jsb-hf05-leg-foot-massager/p/itmczzyze5swfem5?pid=MASCZZYMGJVWNFCG&srno=b_1&ref=da38ccf0-de5f-4934-9118-be867921446f,WS Retail,JSB HF05 Leg & Foot Massager - JSB: Flipkart.com,Buy JSB HF05 Leg & Foot Massager only for Rs. 10900.0 from Flipkart.com. Only Genuine Products. 30 Day Replacement Guarantee. Free Shipping. Cash On,[],<div class="item_left_column" id="description"> <h3 class="item_desc_title fk-uppercase">JSB HF05 Leg &amp; Foot Massager (Black and Silver)         Price: Rs.10900</h3> <div class="cls"></div> <div class="item_desc_text line"> <div style="float:right"> </div> <h3><b> Key Features </b></h3> <div class="line bmargin10"> <ul class="feature_bullet"> <li><span>2 Speed Settings</span></li><li><span>Vibratory Method</span></li><li><span>Special Rollers for Calve Muscle / Ball and Arch of Foot</span></li><li><span>Reflexology Foot Plate</span></li><li><span>15-minute Auto Shut-off</span></li><li><span>Air-pressure Knead Pad</span></li><li><span>Dimensions: 16 (H) x 17 (W) cm</span></li><li><span>Squeezes and Massages Feet / Ankles and Calves</span></li> </ul> </div> <p>   If you are on your feet the whole day and need a quick and efficient method of relief  then JSB-HF05 Leg and Foot Massager could be suitable for you. This massager is specially designed to massage your feet  ankle and calves  all at the same time  hence taking care of your whole lower leg.<strong> This JSB lower leg massager stimulates and massages the nerves of your feet</strong> and increases the flow of blood  thus helping to reduce pain and all the symptoms associated with tired aching legs.</p> <p> <strong>Integrated with 2 speed levels</strong>  you have total control over the intensity levels for a personalised massage. The electronic foot and leg massager also<strong> features an auto shut-off function</strong> that automatically shuts down the device after 15 minute of its usage.</p> <p> <strong>Build</strong></p> <p>   This <strong>electronic JSB-HF05 leg and foot massager has been designed to release pain and discomfort in your leg</strong> by providing a relaxing and revitalizing massage experience. The in-built kneading plates concealed under the fabric of the foot rest work effectively to massage your calves.</p> <p>   Located at the bottom of the unit are the <strong>reflexology foot plates</strong> that vibrate to enhance the massage. This reflexology foot plates have nodes attached to them which presses into your reflex points in rhythmic patterns  leaving you relaxed and rejuvenated. <strong>A special roller</strong> integrated in the unit brings relief to the calf muscles and arch of the foot.</p> <p>   The fabric is designed to meet health and hygiene standards as it can be detached and hand washed. The control panel consists of <strong>easy access on/off program</strong> making it very user friendly. In order to eliminate pain and discomfort in your legs  you just have to insert your legs into the leg rest and press the easy access control buttons for the device to function.</p> <p> <strong>Performance</strong></p> <p>   The JSB leg massager gives you an overall sense of wellbeing. The flexible air-pressure kneading pads effectively squeeze your feet  ankle and claves replicating the hands of a professional masseur. This<strong> soothes your leg muscles</strong> therefore reducing pain and ailments in your leg.</p> <p>   The reflexology foot plates with gentle vibration modes  functions not only to relax you but also <strong>promotes blood circulation</strong>. Moreover you can adjust the vibration modes to your desired intensity. With the combined effort of the kneading and vibratory actions  you feel refreshed and alive even after a hectic day. This JSB HF05 leg and foot massager consumes 90 watts of electricity and requires a power supply of 220 to 240 volts to operate.</p> </div> <div style="clear: both;"></div> </div>,<div class="item_left_column" id="specifications"> <h3 class="item_desc_title fk-uppercase">         Specifications of JSB HF05 Leg &amp; Foot Massager (Black and Silver)    </h3> <table cellspacing="0" class="fk-specs-type2"> <tr> <th class="group-head" colspan="2">In The Box</th> </tr> <tr class=""> <td class="specs-key">Sales Package</td> <td class="specs-value fk-data">Main Unit  Power Cord  Manual</td> </tr> </table> <table cellspacing="0" class="fk-specs-type2"> <tr> <th class="group-head" colspan="2">Product Details</th> </tr> <tr class=""> <td class="specs-key">Type</td> <td class="specs-value fk-data">Leg||Foot</td> </tr> <tr class=""> <td class="specs-key">Model Name</td> <td class="specs-value fk-data">Leg &amp; Foot</td> </tr> <tr class=""> <td class="specs-key">Color</td> <td class="specs-value fk-data">Black and Silver</td> </tr> <tr class=""> <td class="specs-key">Model Id</td> <td class="specs-value fk-data">HF05</td> </tr> <tr class=""> <td class="specs-key">Brand</td> <td class="specs-value fk-data">JSB</td> </tr> </table> <table cellspacing="0" class="fk-specs-type2"> <tr> <th class="group-head" colspan="2">Power Requirements</th> </tr> <tr class=""> <td class="specs-key">Power Source</td> <td class="specs-value fk-data">Electricity</td> </tr> <tr class=""> <td class="specs-key">Power Consumption (Watts)</td> <td class="specs-value fk-data">80 W</td> </tr> <tr class=""> <td class="specs-key">Power Required (Volts)</td> <td class="specs-value fk-data">220 - 240 V</td> </tr> </table> <table cellspacing="0" class="fk-specs-type2"> <tr> <th class="group-head" colspan="2">Warranty</th> </tr> <tr class=""> <td class="specs-value fk-data" colspan="2">1 Year JSB India Warranty and Free Transit Insurance.</td> </tr> </table> </div>,10:03:2014,None
LSTMASD38VCAABGKYH49UFXMG,JSB -03 Powerful Body Massager,http://www.flipkart.com/health-and-beauty?otracker=hp_nmenu_sub_women_0_Beauty%20and%20Wellness,Rs. 1690,Beauty and Wellness,Health Care Devices,JSB,http://img5a.flixcart.com//image/massager/y/h/4/jsb-body-jsb-03-400x400-imad3a26begvqjcm.jpeg,Rs. 2990,None,women,http://www.flipkart.com/jsb-03-powerful-body-massager/p/itmdzxrjdjv5jcqa?pid=MASD38VCAABGKYH4&srno=b_3&ref=da38ccf0-de5f-4934-9118-be867921446f,JSBHealthcare,JSB -03 Powerful Body Massager - JSB: Flipkart.com,Buy JSB -03 Powerful Body Massager only for Rs. 1690.0 from Flipkart.com. Only Genuine Products. 30 Day Replacement Guarantee. Free Shipping. Cash On,[],<div class="item_left_column" id="description"> <h3 class="item_desc_title fk-uppercase">JSB -03 Powerful Body Massager         Price: Rs.1690</h3> <div class="cls"></div> <div class="item_desc_text line"> <div style="float:right"> </div> <h3><b> Key Features </b></h3> <div class="line bmargin10"> <ul class="feature_bullet"> <li><span>Intensity Settings</span></li><li><span>Enhances Blood Circulation</span></li><li><span>Vibratory Method</span></li><li><span>Rubber Grip</span></li><li><span>Relaxes Muscles / Nerves</span></li><li><span>Dual Head for Wide Application</span></li><li><span>Attractive Design</span></li> </ul> </div>                         With the JSB-03 Deluxe Powerful Full Body Massager  you could experience a soothing massage entwined with a therapeutic approach to bring relief to every tired and aching parts of your body. This <strong>03 Deluxe Powerful Full Bis a hand-held massager</strong>  which offers versatile functionalities that are capable of relaxing your body. Integrated with a <strong>Massage Intensity Controller</strong>  this massager comes with different intensity levels. You have the freedom to choose the desired setting in accordance to the intensity of your body ache. <p><strong>Build </strong></p> Compact and lightweight  this <strong>JSB massager weighs a mere 1.8 kg</strong> enabling you to carry the device with you wherever you go. Designed for comfort and ease-of-use  this massager is built with a rubber grip handle enabling you to massage your whole body without any hassle. This <strong>body massager by JSB comes with three attachment options</strong> that are capable of refreshing and invigorating your body. <p>The <strong>dual head</strong> built in the massager has a wide application  allowing you to receive massage for different pain and discomforts in your body. Equipped with a <strong>simple control panel</strong>  this massager houses a slide switch and a push button used for operating and controlling the device.</p> <p><strong>Performance</strong></p> The 03 Deluxe Powerful Full body massager by JSB uses the <strong>vibratory method</strong> to relax your entire body. This body massager vibrates to bring relief to your stiff muscles and nerves. In addition to this  the massager also <strong>enhances your blood circulation</strong>  keeping you healthy and strong. When you adjust the intensity of the massager to high frequency points  this device massages your temples and other points in your head  <strong>eliminating stress and fatigue</strong>. The JSB-03 body massager operates on 220-240 V of electricity.        </div> <div style="clear: both;"></div> </div>,<div class="item_left_column" id="specifications"> <h3 class="item_desc_title fk-uppercase">         Specifications of JSB -03 Powerful Body Massager    </h3> <table cellspacing="0" class="fk-specs-type2"> <tr> <th class="group-head" colspan="2">In The Box</th> </tr> <tr class=""> <td class="specs-key">Sales Package</td> <td class="specs-value fk-data">Main Unit  3 Attachments  Instuction Manual</td> </tr> </table> <table cellspacing="0" class="fk-specs-type2"> <tr> <th class="group-head" colspan="2">Product Details</th> </tr> <tr class=""> <td class="specs-key">Type</td> <td class="specs-value fk-data">Body</td> </tr> <tr class=""> <td class="specs-key">Model Name</td> <td class="specs-value fk-data">Body</td> </tr> <tr class=""> <td class="specs-key">Model Id</td> <td class="specs-value fk-data">-03 Powerful</td> </tr> <tr class=""> <td class="specs-key">Brand</td> <td class="specs-value fk-data">JSB</td> </tr> </table> <table cellspacing="0" class="fk-specs-type2"> <tr> <th class="group-head" colspan="2">Power Requirements</th> </tr> <tr class=""> <td class="specs-key">Power Source</td> <td class="specs-value fk-data">Electricity</td> </tr> <tr class=""> <td class="specs-key">Power Required (Volts)</td> <td class="specs-value fk-data">220 - 240 V</td> </tr> </table> <table cellspacing="0" class="fk-specs-type2"> <tr> <th class="group-head" colspan="2">Warranty</th> </tr> <tr class=""> <td class="specs-value fk-data" colspan="2">1 Year JSB India Warranty and Free Transit Insurance.</td> </tr> </table> </div>,10:03:2014,None
LSTHPDDZHRYEGH5ZJBWCHC2FI,JSB H05 Deluxe Electric Heating Pad,http://www.flipkart.com/health-and-beauty?otracker=hp_nmenu_sub_women_0_Beauty%20and%20Wellness,Rs. 489,Beauty and Wellness,Health Care Devices,JSB,http://img6a.flixcart.com/image/heating-pad/j/b/w/jsb-h05-400x400-imadzhsbgga7fzau.jpeg,Rs. 750,None,women,http://www.flipkart.com/jsb-h05-deluxe-electric-heating-pad/p/itmdzz8fdte6b4ea?pid=HPDDZHRYEGH5ZJBW&srno=b_7&ref=da38ccf0-de5f-4934-9118-be867921446f,JSBHealthcare,JSB H05 Deluxe Electric Heating Pad - JSB: Flipkart.com,Buy JSB H05 Deluxe Electric Heating Pad only for Rs. 550.0 from Flipkart.com. Only Genuine Products. 30 Day Replacement Guarantee. Free Shipping. Cash On,[],<div class="item_left_column" id="description"> <h3 class="item_desc_title fk-uppercase">                 Key Features of JSB H05 Deluxe Electric Heating Pad            </h3> <div class="cls"></div> <div class="item_desc_text"> <ul class="fk-key-features"> <li>3 Temperature Settings</li><li>Overheat Protection</li><li>Teflon Coated</li><li>LED Indicator</li> </ul> </div> <div style="clear: both;"></div> </div>,<div class="item_left_column" id="specifications"> <h3 class="item_desc_title fk-uppercase">         Specifications of JSB H05 Deluxe Electric Heating Pad    </h3> <table cellspacing="0" class="fk-specs-type2"> <tr> <th class="group-head" colspan="2">In The Box</th> </tr> <tr class=""> <td class="specs-key">Sales Package</td> <td class="specs-value fk-data">Main Unit with Wired Remote  Precautions and Instruction Manual</td> </tr> </table> <table cellspacing="0" class="fk-specs-type2"> <tr> <th class="group-head" colspan="2">General</th> </tr> <tr class=""> <td class="specs-key">Number of Temperature Settings</td> <td class="specs-value fk-data">3</td> </tr> <tr class=""> <td class="specs-key">Used for</td> <td class="specs-value fk-data">Back Pains  Joint Pains  Shoulder Pains and Other Muscle Aches</td> </tr> </table> <table cellspacing="0" class="fk-specs-type2"> <tr> <th class="group-head" colspan="2">Convenience Features</th> </tr> <tr class=""> <td class="specs-key">Other Convenience Features</td> <td class="specs-value fk-data">For Preheating Switch to Maximum Temperature and Adjust as per Convenience  LED Indicator for Clear Viewing</td> </tr> </table> <table cellspacing="0" class="fk-specs-type2"> <tr> <th class="group-head" colspan="2">Safety Features</th> </tr> <tr class=""> <td class="specs-key">Insulation</td> <td class="specs-value fk-data">Yes</td> </tr> <tr class=""> <td class="specs-key">Other Safety Features</td> <td class="specs-value fk-data">Four Built-in Thermal Cut-outs for 100% Safety  Well Insulated on Either Side for Complete Safety and Comfort  Teflon Coated Wiring for Protection against Overheat</td> </tr> </table> <table cellspacing="0" class="fk-specs-type2"> <tr> <th class="group-head" colspan="2">Additional Features</th> </tr> <tr class=""> <td class="specs-value fk-data" colspan="2">Most Convenient and Economical Way of Keeping a Person Warm  Very Useful for Arthritics / Diabetic Patients  Long Lasting Heating Elements  Dimensions: 381 x 266.7 mm  Not to be used by the Patients with Pacemakers</td> </tr> </table> <table cellspacing="0" class="fk-specs-type2"> <tr> <th class="group-head" colspan="2">Dimensions</th> </tr> <tr class=""> <td class="specs-key">Weight</td> <td class="specs-value fk-data">280 gms</td> </tr> </table> </div>,10:03:2014,None
LSTMASDFFXGMFFCWZC4NJDBNS,JSB 01 Swing Walker Massager,http://www.flipkart.com/health-and-beauty?otracker=hp_nmenu_sub_women_0_Beauty%20and%20Wellness,Rs. 3400,Beauty and Wellness,Health Care Devices,JSB,http://img6a.flixcart.com//image/massager/z/c/4/jsb-swing-walker-jsb-hf01-400x400-imadffzyygpw3dyt.jpeg,Rs. 4800,None,women,http://www.flipkart.com/jsb-01-swing-walker-massager/p/itmdzxyhhpzmcquk?pid=MASDFFXGMFFCWZC4&srno=b_5&ref=da38ccf0-de5f-4934-9118-be867921446f,JSBHealthcare,JSB 01 Swing Walker Massager - JSB: Flipkart.com,Buy JSB 01 Swing Walker Massager only for Rs. 3400.0 from Flipkart.com. Only Genuine Products. 30 Day Replacement Guarantee. Free Shipping. Cash On,[],<div class="item_left_column" id="description"> <h3 class="item_desc_title fk-uppercase">JSB 01 Swing Walker Massager (White and Blue)         Price: Rs.3400</h3> <div class="cls"></div> <div class="item_desc_text line"> <div style="float:right"> </div> <h3><b> Key Features </b></h3> <div class="line bmargin10"> <ul class="feature_bullet"> <li><span>Increases Metabolism</span></li><li><span>Reduces Body Weight</span></li><li><span>Oscillatory Method</span></li><li><span>Eliminates Fatigue</span></li><li><span>Improves Digestive System Relieves Upper and Lower Back Pain</span></li><li><span>Corrects Certain Spinal Misalignment's</span></li><li><span>Alleviates Stress-related Conditions</span></li> </ul> </div>                         Wouldn't it be nice if you could exercise by sitting at one place and at the same time  feel relaxed with a soothing massage? You could discover this new exercise and massage experience with the JSB-HF01 Swing Walker Massager. The swing walker massager helps to release stress and fatigue which in turn <strong>improves the blood circulation</strong>. Moreover  this massager works in the way your cardio sessions would  as the <strong>vibratory motion dissolves your fatty acids</strong> and increases your metabolism. <p><strong>Build</strong></p> Ergonomically designed  the <strong>JSB swing walker massager is small and handy</strong>. The internal mechanism is well protected by a strong body which is designed <strong>for ease of use</strong>. The main unit has two leg rests where you put your calves to experience the rejuvenating massage. The control buttons are not integrated with the main unit; you have a separate attachment that houses the control buttons. In order to receive the benefits of the JSB- HF01 walker massager  just slip the calves of your legs into the leg rest and switch on the machine for a de-stressing moment. <p><strong>Performance</strong></p> The <strong>HF01 JSB Swing Walker Massager is programmed to serve multi-functional solutions</strong> to combat various types of pain and uneasiness in your leg. <strong>The vibratory motion</strong> that serves a massage to your calf  leg or elbow <strong>increases your blood circulation.</strong> This <strong>increases the supply of oxygen</strong> to all parts of your body which leads to improving the functions of your internal organs. <p>The massage also <strong>corrects certain spinal misalignments and reinforces healthy sleep patterns</strong>. In addition to these functions  the vibratory motion also works to activate your body cells  dissolving your fatty acids and eventually burning calories just like your work out sessions. The massager thus  <strong>helps in reducing your overall body weight</strong> giving you a renewed figure.</p> This JSB swing walker massager also incorporates <strong>a speed control feature</strong>. This speed control feature enables you to set six speed modes according to the desired intensity of your massage or exercise. Powered by electricity  this Swing walker massager functions soundly.        </div> <div style="clear: both;"></div> </div>,<div class="item_left_column" id="specifications"> <h3 class="item_desc_title fk-uppercase">         Specifications of JSB 01 Swing Walker Massager (White and Blue)    </h3> <table cellspacing="0" class="fk-specs-type2"> <tr> <th class="group-head" colspan="2">In The Box</th> </tr> <tr class=""> <td class="specs-key">Sales Package</td> <td class="specs-value fk-data">Main Unit  User Manual</td> </tr> </table> <table cellspacing="0" class="fk-specs-type2"> <tr> <th class="group-head" colspan="2">Product Details</th> </tr> <tr class=""> <td class="specs-key">Type</td> <td class="specs-value fk-data">Leg||Foot</td> </tr> <tr class=""> <td class="specs-key">Model Name</td> <td class="specs-value fk-data">Swing Walker</td> </tr> <tr class=""> <td class="specs-key">Color</td> <td class="specs-value fk-data">White and Blue</td> </tr> <tr class=""> <td class="specs-key">Model Id</td> <td class="specs-value fk-data">01</td> </tr> <tr class=""> <td class="specs-key">Brand</td> <td class="specs-value fk-data">JSB</td> </tr> </table> <table cellspacing="0" class="fk-specs-type2"> <tr> <th class="group-head" colspan="2">Power Requirements</th> </tr> <tr class=""> <td class="specs-key">Power Source</td> <td class="specs-value fk-data">Electricity</td> </tr> <tr class=""> <td class="specs-key">Power Consumption (Watts)</td> <td class="specs-value fk-data">20 W</td> </tr> <tr class=""> <td class="specs-key">Power Required (Volts)</td> <td class="specs-value fk-data">220 - 240 V</td> </tr> </table> <table cellspacing="0" class="fk-specs-type2"> <tr> <th class="group-head" colspan="2">Warranty</th> </tr> <tr class=""> <td class="specs-value fk-data" colspan="2">1 Year JSB India Warranty and Free Transit Insurance.</td> </tr> </table> </div>,10:03:2014,None
