LSTSTHDNYKQHEDDGXPQ0M3QUC,JSB JSB S03 Acoustic Stethoscope,http://www.flipkart.com/health-and-beauty?otracker=hp_nmenu_sub_women_0_Beauty%20and%20Wellness,Rs. 690,Beauty and Wellness,Health Care Devices,JSB,http://img6a.flixcart.com/image/stethoscope/x/p/q/dual-sided-jsb-acoustic-jsb-s03-400x400-imadnza8fpyfnrxe.jpeg,Rs. 980,None,women,http://www.flipkart.com/jsb-s03-acoustic-stethoscope/p/itmdnyha8zttypfv?pid=STHDNYKQHEDDGXPQ&srno=b_10&ref=da38ccf0-de5f-4934-9118-be867921446f,JSBHealthcare,JSB JSB S03 Acoustic Stethoscope: Flipkart.com,Flipkart.com,[],None,<div class="item_left_column" id="specifications"> <h3 class="item_desc_title fk-uppercase">         Specifications of JSB JSB S03 Acoustic Stethoscope (Black)    </h3> <table cellspacing="0" class="fk-specs-type2"> <tr> <th class="group-head" colspan="2">In the Box</th> </tr> <tr class=""> <td class="specs-key">Sales Package</td> <td class="specs-value fk-data">Stethoscope</td> </tr> </table> <table cellspacing="0" class="fk-specs-type2"> <tr> <th class="group-head" colspan="2">General</th> </tr> <tr class=""> <td class="specs-key">Chest-piece Type</td> <td class="specs-value fk-data">Dual-sided Chest-piece</td> </tr> <tr class=""> <td class="specs-key">Lumen Tube Type</td> <td class="specs-value fk-data">Double Lumen</td> </tr> <tr class=""> <td class="specs-key">Battery-operated Chest-piece</td> <td class="specs-value fk-data">No</td> </tr> <tr class=""> <td class="specs-key">Utility</td> <td class="specs-value fk-data">Double Sided Use for both Different Levels of Acoustics</td> </tr> </table> <table cellspacing="0" class="fk-specs-type2"> <tr> <th class="group-head" colspan="2">Body Features</th> </tr> <tr class=""> <td class="specs-key">Tunable Diaphragm</td> <td class="specs-value fk-data">Yes</td> </tr> <tr class=""> <td class="specs-key">Chest-piece Material</td> <td class="specs-value fk-data">Stainless Steel</td> </tr> <tr class=""> <td class="specs-key">Binaurals Material</td> <td class="specs-value fk-data">Brass</td> </tr> <tr class=""> <td class="specs-key">Binaural Coating</td> <td class="specs-value fk-data">Chrome-plated</td> </tr> <tr class=""> <td class="specs-key">Tubing Material</td> <td class="specs-value fk-data">PVC</td> </tr> </table> <table cellspacing="0" class="fk-specs-type2"> <tr> <th class="group-head" colspan="2">Dimensions</th> </tr> <tr class=""> <td class="specs-key">Length</td> <td class="specs-value fk-data">770 mm</td> </tr> <tr class=""> <td class="specs-key">Y-tube Length</td> <td class="specs-value fk-data">80 mm</td> </tr> <tr class=""> <td class="specs-key">Binaurals Length</td> <td class="specs-value fk-data">180 mm</td> </tr> <tr class=""> <td class="specs-key">Chest-piece Height</td> <td class="specs-value fk-data">35 mm</td> </tr> <tr class=""> <td class="specs-key">Diaphragm Diameter</td> <td class="specs-value fk-data">45 mm</td> </tr> </table> <table cellspacing="0" class="fk-specs-type2"> <tr> <th class="group-head" colspan="2">Warranty</th> </tr> <tr class=""> <td class="specs-key">Warranty Summary</td> <td class="specs-value fk-data">1 Year JSB Warranty</td> </tr> <tr class=""> <td class="specs-key">Covered in Warranty</td> <td class="specs-value fk-data">Warranty of the product is limited to manufacturing defects only</td> </tr> <tr class=""> <td class="specs-key">Not Covered in Warranty</td> <td class="specs-value fk-data">Warranty does not cover any external accessories (such as battery  cable  carrying bag)  damage caused to the product due to improper installation by customer  normal wear and tear to magnetic heads  audio  video  laser pick-ups and TV picture tubes  pane</td> </tr> <tr class=""> <td class="specs-key">Warranty Service Type</td> <td class="specs-value fk-data">Carry In</td> </tr> </table> </div>,10:03:2014,None
LSTMASDJZ6UTFFMJZT9VASK85,JSB HF28 Compact Foot HF28 Compact Foot Massager,http://www.flipkart.com/health-and-beauty?otracker=hp_nmenu_sub_women_0_Beauty%20and%20Wellness,Rs. 5800,Beauty and Wellness,Health Care Devices,JSB,http://img5a.flixcart.com/image/massager/z/t/9/jsb-hf28-compact-foot-400x400-imadjz7ydfnjjdkm.jpeg,Rs. 9500,None,women,http://www.flipkart.com/jsb-hf28-compact-foot-massager/p/itmdjz6ug4qxgyfh?pid=MASDJZ6UTFFMJZT9&srno=b_13&ref=da38ccf0-de5f-4934-9118-be867921446f,WS Retail,JSB HF28 Compact Foot HF28 Compact Foot Massager - JSB: Flipkart.com,Buy JSB HF28 Compact Foot HF28 Compact Foot Massager only for Rs. 5800.0 from Flipkart.com. Only Genuine Products. 30 Day Replacement Guarantee. Free Shipping. Cash On,[],<div class="item_left_column" id="description"> <h3 class="item_desc_title fk-uppercase">                 Key Features of JSB HF28 Compact Foot HF28 Compact Foot Massager            </h3> <div class="cls"></div> <div class="item_desc_text"> <ul class="fk-key-features"> <li>Suitable for Home and Office</li><li>Every Massage Time is Automatically Set to 15 mins</li><li>High Grade Multi Functional Massager</li><li>Effective for Housewives</li><li>Kneading Massage to Each Muscle Ache</li><li>Three Programs: Auto</li><li>Foot Massage is based on Traditional</li><li>Model Key Massager to Re-set or Repeat a Cycle of 15 mins Massage</li><li>Acts on Foot to Reduce Fatigue</li><li>Manual</li><li>Suitable for All Age Groups and Both Genders</li><li>Individual Program</li><li>Working Individuals with Heavy Fieldwork and Elderly</li><li>Re-use</li> </ul> </div> <div style="clear: both;"></div> </div>,<div class="item_left_column" id="specifications"> <h3 class="item_desc_title fk-uppercase">         Specifications of JSB HF28 Compact Foot HF28 Compact Foot Massager    </h3> <table cellspacing="0" class="fk-specs-type2"> <tr> <th class="group-head" colspan="2">In The Box</th> </tr> <tr class=""> <td class="specs-key">Sales Package</td> <td class="specs-value fk-data">Main Unit  Instruction Manual</td> </tr> </table> <table cellspacing="0" class="fk-specs-type2"> <tr> <th class="group-head" colspan="2">Product Details</th> </tr> <tr class=""> <td class="specs-key">Type</td> <td class="specs-value fk-data">Foot</td> </tr> <tr class=""> <td class="specs-key">Model Name</td> <td class="specs-value fk-data">HF28 Compact Foot</td> </tr> <tr class=""> <td class="specs-key">Model Id</td> <td class="specs-value fk-data">HF28 Compact Foot</td> </tr> <tr class=""> <td class="specs-key">Brand</td> <td class="specs-value fk-data">JSB</td> </tr> </table> <table cellspacing="0" class="fk-specs-type2"> <tr> <th class="group-head" colspan="2">Warranty</th> </tr> <tr class=""> <td class="specs-value fk-data" colspan="2">1 Year JSB India Warranty and Free Transit Insurance.</td> </tr> </table> </div>,10:03:2014,None
LSTDTHCZZYMTC2EXB2BXQEKLA,JSB CE0197 Digital Thermometer,http://www.flipkart.com/health-and-beauty?otracker=hp_nmenu_sub_women_0_Beauty%20and%20Wellness,Rs. 200,Beauty and Wellness,Health Care Devices,JSB,http://img6a.flixcart.com/image/digital-thermometer/b/2/b/jsb-digital-ce0197-400x400-imadsm3afhx9sznv.jpeg,Rs. 200,None,women,http://www.flipkart.com/jsb-ce0197-digital-thermometer/p/itmdzhnyzhg7n5bh?pid=DTHCZZYMTC2EXB2B&srno=b_15&ref=da38ccf0-de5f-4934-9118-be867921446f,WS Retail,JSB CE0197 Digital Thermometer - JSB: Flipkart.com,Buy JSB CE0197 Digital Thermometer only for Rs. 200.0 from Flipkart.com. Only Genuine Products. 30 Day Replacement Guarantee. Free Shipping. Cash On,[],<div class="item_left_column" id="description"> <h3 class="item_desc_title fk-uppercase">JSB CE0197 Digital Thermometer (White)         Price: Rs.200</h3> <div class="cls"></div> <div class="item_desc_text line"> <div style="float:right"> </div> <h3><b> Key Features </b></h3> <div class="line bmargin10"> <ul class="feature_bullet"> <li><span>Water Resistant</span></li><li><span>Memory Recall</span></li><li><span>LCD Display</span></li><li><span>Auto Shut Off Function</span></li><li><span>High Accuracy</span></li><li><span>Mercury Free</span></li><li><span>Buzzer Alarm</span></li> </ul> </div>                         JSB Fixed Tip digital thermometer could be an ideal option as the thermometer embodies attributes like <strong>high accuracy</strong> and <strong>precise readings</strong>. The thermometer is mercury free making it very safe. Moreover  the JSB thermometer is suitable for all ages. The thermometer also sports an <strong>Auto shut off feature</strong> that supports battery longevity. <p><strong>Body</strong></p> Simple and compact  this fixed tip thermometer is user friendly and portable. The unit comprises of a <strong>LCD display and one On/Off button</strong>  hence making it easy and intuitive for the user to use the device. <p><strong>Feature</strong></p> <strong>The Fixed Tip JSB thermometer</strong> is capable of displaying a measurement range from 90.0 degree Fahrenheit to 109.9 degree Fahrenheit. Like many digital thermometers  this thermometer by JSB comes with a <strong>memory function</strong> that enables the last measurement recall. The <strong>beeper alarm </strong>is set to alert the users as and when required. A replaceable battery is used for powering the thermometer.        </div> <div style="clear: both;"></div> </div>,<div class="item_left_column" id="specifications"> <h3 class="item_desc_title fk-uppercase">         Specifications of JSB CE0197 Digital Thermometer (White)    </h3> <table cellspacing="0" class="fk-specs-type2"> <tr> <th class="group-head" colspan="2">In The Box</th> </tr> <tr class=""> <td class="specs-key">Sales Package</td> <td class="specs-value fk-data">Main Unit</td> </tr> </table> <table cellspacing="0" class="fk-specs-type2"> <tr> <th class="group-head" colspan="2">Product Details</th> </tr> <tr class=""> <td class="specs-key">Brand</td> <td class="specs-value fk-data">JSB</td> </tr> <tr class=""> <td class="specs-key">Model ID</td> <td class="specs-value fk-data">CE0197</td> </tr> <tr class=""> <td class="specs-key">Model Name</td> <td class="specs-value fk-data">Digital</td> </tr> <tr class=""> <td class="specs-key">Color</td> <td class="specs-value fk-data">White</td> </tr> </table> <table cellspacing="0" class="fk-specs-type2"> <tr> <th class="group-head" colspan="2">Device Characteristics</th> </tr> <tr class=""> <td class="specs-key">Temperature Display</td> <td class="specs-value fk-data">&lt;90.0° F : Displays &lt;<l></l>&gt; for too Low Temp. &gt;109.9° F ; Displays &lt;<h></h>&gt; for too High</td> </tr> <tr class=""> <td class="specs-key">Auto Shut Off</td> <td class="specs-value fk-data">Yes</td> </tr> <tr class=""> <td class="specs-key">Flexible Tip</td> <td class="specs-value fk-data">No</td> </tr> <tr class=""> <td class="specs-key">Display</td> <td class="specs-value fk-data">LCD</td> </tr> <tr class=""> <td class="specs-key">Buzzer</td> <td class="specs-value fk-data">Yes</td> </tr> <tr class=""> <td class="specs-key">Water Resistant</td> <td class="specs-value fk-data">Yes</td> </tr> <tr class=""> <td class="specs-key">Memory Function</td> <td class="specs-value fk-data">Yes</td> </tr> </table> <table cellspacing="0" class="fk-specs-type2"> <tr> <th class="group-head" colspan="2">Measurement</th> </tr> <tr class=""> <td class="specs-key">Measurement Accuracy Measurement Range</td> <td class="specs-value fk-data">90.0 - 109.9° F</td> </tr> </table> <table cellspacing="0" class="fk-specs-type2"> <tr> <th class="group-head" colspan="2">Power Requirements</th> </tr> <tr class=""> <td class="specs-key">Power Source</td> <td class="specs-value fk-data">Battery</td> </tr> </table> <table cellspacing="0" class="fk-specs-type2"> <tr> <th class="group-head" colspan="2">Warranty</th> </tr> <tr class=""> <td class="specs-value fk-data" colspan="2">1 Year JSB India Warranty and Free Transit Insurance.</td> </tr> </table> </div>,10:03:2014,None
LSTMASD5DJRKYGMTUG4XOXOAC,JSB HF23 Full Back and Neck Kneading Massager,http://www.flipkart.com/health-and-beauty?otracker=hp_nmenu_sub_women_0_Beauty%20and%20Wellness,Rs. 9900,Beauty and Wellness,Health Care Devices,JSB,http://img6a.flixcart.com/image/massager/u/g/4/jsb-full-back-and-neck-kneading-hf23-400x400-imad9nx6xjkkj3j8.jpeg,Rs. 14500,None,women,http://www.flipkart.com/jsb-hf23-full-back-neck-kneading-massager/p/itmd5djrdykh76uj?pid=MASD5DJRKYGMTUG4&srno=b_14&ref=da38ccf0-de5f-4934-9118-be867921446f,JSBHealthcare,JSB HF23 Full Back and Neck Kneading Massager - JSB: Flipkart.com,Buy JSB HF23 Full Back and Neck Kneading Massager only for Rs. 8000.0 from Flipkart.com. Only Genuine Products. 30 Day Replacement Guarantee. Free Shipping. Cash On,[],<div class="item_left_column" id="description"> <h3 class="item_desc_title fk-uppercase">JSB HF23 Full Back and Neck Kneading Massager         Price: Rs.9900</h3> <div class="cls"></div> <div class="item_desc_text line"> <div style="float:right"> </div> <h3><b> Key Features </b></h3> <div class="line bmargin10"> <ul class="feature_bullet"> <li><span>Two Kneading Neck Massage Heads</span></li><li><span>Four Kneading Infrared Massage Heads</span></li><li><span>Four Massage Section Select</span></li><li><span>Full Function Remote Control</span></li><li><span>Effective for Back Aches and Cervical Aches</span></li><li><span>Can be Used in Car Seats</span></li><li><span>Office Chairs</span></li><li><span>Home Sofas and Chairs</span></li> </ul> </div>                         The JSB HF23 full back and neck kneading massager has been immaculately designed to provide soothing and relaxing massage at home  office or even if you are on the go. This massager especially comes handy while you go for long drives as you can easily attach this device to your car seat. The JSB HF23 back and neck massager also delivers an <strong>effective kneading massage pattern</strong> capable of emulating the fingers of a masseur. You don't have to visit a salon anymore as you can attain a personalized massage in the comforts of your home. <p>Built to reduce stress and fatigue  the <strong>JSB HF23 kneading massager targets all the painful areas</strong> in your body. This massager covers the entire area from the neck to the back  leaving you fresh and rejuvenated.</p> <p><strong>Build</strong></p> Facilitating you with enhanced convenience  the JSB HF23 full back and neck kneading massager is ergonomically designed for practical use. The back and neck kneading massager is <strong>compact and lightweight</strong>  permitting enhanced portability. You can carry the massager with you wherever you go  making it easy and convenient for you. This JSB HF23 massager comes in two parts  one the main unit itself and the <strong>remote control</strong> for regulating and selecting the massage levels and speed. Easy to attach  you can mount this massager in most chairs  sofas or car seats. <p><strong>Performance</strong></p> Operating with efficacy  this <strong>JSB HF23 massager has different massage heads</strong> aimed at massaging different target points. Located at the top are the two kneading massage heads that rotate uniformly to provide gentle massage to your neck areas  therefore effective for cervical aches. Just below these massage heads are the four kneading infrared heads that deliver a relaxing massage to your upper and lower back  alleviating you from back aches. <p>Equipped with <strong>four massage selection settings</strong>  this JSB massager gives you the freedom to choose the target area you desire  pertaining to your body aches. You can select the neck kneading massage heads alone or just the kneading heads for your back to give more effective results. The combination of the <strong>kneading pattern and the infrared function enhances the efficacy of the massager</strong> and makes the massage more proficient and effective  thereby reducing muscle pain or cramps.</p> </div> <div style="clear: both;"></div> </div>,<div class="item_left_column" id="specifications"> <h3 class="item_desc_title fk-uppercase">         Specifications of JSB HF23 Full Back and Neck Kneading Massager    </h3> <table cellspacing="0" class="fk-specs-type2"> <tr> <th class="group-head" colspan="2">In The Box</th> </tr> <tr class=""> <td class="specs-key">Sales Package</td> <td class="specs-value fk-data">Main Unit  Remote Controller  Adapter  Instruction Manual</td> </tr> </table> <table cellspacing="0" class="fk-specs-type2"> <tr> <th class="group-head" colspan="2">Product Details</th> </tr> <tr class=""> <td class="specs-key">Type</td> <td class="specs-value fk-data">Neck</td> </tr> <tr class=""> <td class="specs-key">Model Name</td> <td class="specs-value fk-data">Full Back and Neck Kneading</td> </tr> <tr class=""> <td class="specs-key">Model Id</td> <td class="specs-value fk-data">HF23</td> </tr> <tr class=""> <td class="specs-key">Brand</td> <td class="specs-value fk-data">JSB</td> </tr> </table> <table cellspacing="0" class="fk-specs-type2"> <tr> <th class="group-head" colspan="2">Power Requirements</th> </tr> <tr class=""> <td class="specs-key">Power Source</td> <td class="specs-value fk-data">Electricity</td> </tr> </table> <table cellspacing="0" class="fk-specs-type2"> <tr> <th class="group-head" colspan="2">Warranty</th> </tr> <tr class=""> <td class="specs-value fk-data" colspan="2">6 Months JSB India Warranty and Free Transit Insurance.</td> </tr> </table> </div>,10:03:2014,None
LSTPDOD3ZK32VZYCVNP9RDGR2,JSB Pulse Monitor Pedometer,http://www.flipkart.com/health-and-beauty?otracker=hp_nmenu_sub_women_0_Beauty%20and%20Wellness,Rs. 750,Beauty and Wellness,Health Care Devices,JSB,http://img6a.flixcart.com/image/pedometer/v/n/p/jsb-pulse-monitor-400x400-imadekfmh9fvpmbh.jpeg,Rs. 1150,None,women,http://www.flipkart.com/jsb-pulse-monitor-pedometer/p/itmdmkjdn5fzz3dy?pid=PDOD3ZK32VZYCVNP&srno=b_12&ref=da38ccf0-de5f-4934-9118-be867921446f,WS Retail,JSB Pulse Monitor Pedometer - JSB: Flipkart.com,Buy JSB Pulse Monitor Pedometer only for Rs. 750.0 from Flipkart.com. Only Genuine Products. 30 Day Replacement Guarantee. Free Shipping. Cash On,[],<div class="item_left_column" id="description"> <h3 class="item_desc_title fk-uppercase">JSB Pulse Monitor Pedometer         Price: Rs.750</h3> <div class="cls"></div> <div class="item_desc_text line"> <div style="float:right"> </div> <h3><b> Key Features </b></h3> <div class="line bmargin10"> <ul class="feature_bullet"> <li><span>Horizontal Usage</span></li><li><span>Maximum Steps: 99999</span></li><li><span>LCD Display</span></li><li><span>Fingertip Sensor Technology</span></li><li><span>2 LR44 Non-rechargeable Batteries</span></li> </ul> </div>                         Managing your fitness regime is now made simpler with the portable  electronic JSB pulse monitor pedometer that senses the motion of your body and counts your footsteps. The JSB <b>exercise measurer</b> not only tracks your workout but also comes with an advantage of monitoring your pulse. This <b>motivational weight loss tool</b> encourages a healthy and active lifestyle. <p><b>Design</b></p> The JSB Pulse Monitor Pedometer is designed with a <b>digital display</b> that validates your everyday step count. Tailored to meet your fitness requirements  the JSB pedometer not only tracks your distance travelled  but also has an additional facility of tracking your calories burnt per day. <p>You can even pre-set a desired calorie level that you wish to burn in a day  as this JSB monitor helps you trace the percentage of the desired level of calorie burn that has been achieved at any point of time. For example  if you have <b>pre-set a desired calorie burnt level</b> of 100 Kcal and you have burnt 50 Kcal since morning  then the monitor will show the achieved level as 50% of the desired level.</p> <p>As health conscious individuals  this calorie estimating facility is favourable in keeping you self-motivated and helps you set your everyday fitness goals. Apart from all these beneficial factors  this JSB pulse monitor pedometer is also designed with the capacity to save your daily exercise routine. This fitness log acts as a source of encouragement  allowing you to analyse your daily fitness routine and meet your fitness targets.</p> <p>Powered by an <b>AA 2 LR44 battery</b>  the JSB Pulse Monitor Pedometer comes with a <b>weight of 42 g</b>  permitting easy portability.</p> <p><b>Features </b></p> Apart from identifying your steps walked or jogged  this compact digital device from JSB also has an <b>additional stop watch function</b> that helps you track your accurate stride length and displays your pace. The device is driven by a distinctive <b>pulse monitor through fingertip sensor technology</b>  helping you understand the way your body responds to your fitness workouts. <p>In a nut-shell  this <b>user-friendly</b> JSB pulse monitor pedometer detects and displays your every step  increases your physical activity and eventually helps reduce health risk factors.This JSB pulse monitor pedometer is an apt tool for all those who want to walk their way to an improved  smarter  fit lifestyle.        </p></div> <div style="clear: both;"></div> </div>,<div class="item_left_column" id="specifications"> <h3 class="item_desc_title fk-uppercase">         Specifications of JSB Pulse Monitor Pedometer    </h3> <table cellspacing="0" class="fk-specs-type2"> <tr> <th class="group-head" colspan="2">In The Box</th> </tr> <tr class=""> <td class="specs-key">Sales Package</td> <td class="specs-value fk-data">Pedometer  2 LR44 Battery  Instruction Manual</td> </tr> </table> <table cellspacing="0" class="fk-specs-type2"> <tr> <th class="group-head" colspan="2">General</th> </tr> <tr class=""> <td class="specs-key">Sensing Technology</td> <td class="specs-value fk-data">Fingertip Sensor Technology</td> </tr> <tr class=""> <td class="specs-key">Mode of Usage</td> <td class="specs-value fk-data">Horizontal Usage</td> </tr> <tr class=""> <td class="specs-key">Display</td> <td class="specs-value fk-data">LCD Display</td> </tr> </table> <table cellspacing="0" class="fk-specs-type2"> <tr> <th class="group-head" colspan="2">Functions</th> </tr> <tr class=""> <td class="specs-key">Step Count</td> <td class="specs-value fk-data">Yes</td> </tr> <tr class=""> <td class="specs-key">Distance Travelled</td> <td class="specs-value fk-data">Yes</td> </tr> <tr class=""> <td class="specs-key">Calories Burnt</td> <td class="specs-value fk-data">Yes</td> </tr> </table> <table cellspacing="0" class="fk-specs-type2"> <tr> <th class="group-head" colspan="2">Memory Details</th> </tr> <tr class=""> <td class="specs-key">Maximum Steps</td> <td class="specs-value fk-data">99999</td> </tr> </table> <table cellspacing="0" class="fk-specs-type2"> <tr> <th class="group-head" colspan="2">Power</th> </tr> <tr class=""> <td class="specs-key">Battery</td> <td class="specs-value fk-data">2 LR44 Non-rechargeable Battery</td> </tr> </table> <table cellspacing="0" class="fk-specs-type2"> <tr> <th class="group-head" colspan="2">Additional Features</th> </tr> <tr class=""> <td class="specs-key">Other Features</td> <td class="specs-value fk-data"><ul><li>Inbuilt Stopwatch  Pulse Monitor by Fingertip Sensor</li></ul></td> </tr> </table> <table cellspacing="0" class="fk-specs-type2"> <tr> <th class="group-head" colspan="2">Dimension</th> </tr> <tr class=""> <td class="specs-key">Weight</td> <td class="specs-value fk-data">42 gms</td> </tr> </table> <table cellspacing="0" class="fk-specs-type2"> <tr> <th class="group-head" colspan="2">Warranty</th> </tr> <tr class=""> <td class="specs-key">Service Type</td> <td class="specs-value fk-data">Carry In</td> </tr> <tr class=""> <td class="specs-key">Not Covered in Warranty</td> <td class="specs-value fk-data">No Damage Warranty</td> </tr> <tr class=""> <td class="specs-key">Covered in Warranty</td> <td class="specs-value fk-data">Parts and Labor</td> </tr> <tr class=""> <td class="specs-key">Domestic Term</td> <td class="specs-value fk-data">1 Year</td> </tr> <tr class=""> <td class="specs-key">Warranty Type</td> <td class="specs-value fk-data">Manufacturer's Warranty</td> </tr> </table> </div>,10:03:2014,None
