LSTPOXDH96KSCVPG4HBTPWJOX,JSB Heart Rate Ring Pulse Oximeter,http://www.flipkart.com/health-and-beauty?otracker=hp_nmenu_sub_women_0_Beauty%20and%20Wellness,Rs. 1150,Beauty and Wellness,Health Care Devices,JSB,http://img5a.flixcart.com/image/pulse-oximeter/4/h/b/jsb-heart-rate-ring-400x400-imadhzxfvnfjzess.jpeg,Rs. 2850,None,women,http://www.flipkart.com/jsb-heart-rate-ring-pulse-oximeter/p/itmdh96msnrbkgwt?pid=POXDH96KSCVPG4HB&srno=b_16&ref=366c33aa-a88b-4a44-bc1c-323af6aa2ebc,JSBHealthcare,JSB Heart Rate Ring Pulse Oximeter - JSB: Flipkart.com,Buy JSB Heart Rate Ring Pulse Oximeter only for Rs. 1150.0 from Flipkart.com. Only Genuine Products. 30 Day Replacement Guarantee. Free Shipping. Cash On,[],<div class="item_left_column" id="description"> <h3 class="item_desc_title fk-uppercase">                 Key Features of JSB Heart Rate Ring Pulse Oximeter            </h3> <div class="cls"></div> <div class="item_desc_text"> <ul class="fk-key-features"> <li>Strength Percentage</li><li>Low Battery Warning</li><li>12 hrs Clock Function</li> </ul> </div> <div style="clear: both;"></div> </div>,<div class="item_left_column" id="specifications"> <h3 class="item_desc_title fk-uppercase">         Specifications of JSB Heart Rate Ring Pulse Oximeter    </h3> <table cellspacing="0" class="fk-specs-type2"> <tr> <th class="group-head" colspan="2">Display</th> </tr> <tr class=""> <td class="specs-key">Other Display Features</td> <td class="specs-value fk-data">Display Switchable in Training Mode  Heart Rate and Strength Percentage</td> </tr> </table> <table cellspacing="0" class="fk-specs-type2"> <tr> <th class="group-head" colspan="2">Additional Features</th> </tr> <tr class=""> <td class="specs-value fk-data" colspan="2">Training Mode (Input Personal Data)  Setting of Maximum / Minimum Heart Rate Limits  Ambient Temperature Detection  One Size Fits Most  No Disturbance to Pacemaker Users  No Chest Straps or Wires  Convenient and Comfortable to Wear  Continuous Readout makes Easy to Monitor Heart Rate  Cumulative Training Time  Average Heart Rate  Calorie Burned Cumulatively  Easy Mode</td> </tr> </table> <table cellspacing="0" class="fk-specs-type2"> <tr> <th class="group-head" colspan="2">Warranty</th> </tr> <tr class=""> <td class="specs-key">Domestic Term</td> <td class="specs-value fk-data">1 Year</td> </tr> </table> </div>,10:03:2014,None
LSTMASDJZ6UREW5VD9ZZGTAFT,JSB Foot Master Leg and Foot Massager,http://www.flipkart.com/health-and-beauty?otracker=hp_nmenu_sub_women_0_Beauty%20and%20Wellness,Rs. 19400,Beauty and Wellness,Health Care Devices,JSB,http://img6a.flixcart.com/image/massager/d/9/z/jsb-foot-master-leg-and-foot-400x400-imadjz7ybaayhs3n.jpeg,Rs. 22500,None,women,http://www.flipkart.com/jsb-foot-master-leg-massager/p/itmdjz6ucvnge9kq?pid=MASDJZ6UREW5VD9Z&srno=b_19&ref=366c33aa-a88b-4a44-bc1c-323af6aa2ebc,WS Retail,JSB Foot Master Leg and Foot Massager - JSB: Flipkart.com,Buy JSB Foot Master Leg and Foot Massager only for Rs. 19400.0 from Flipkart.com. Only Genuine Products. 30 Day Replacement Guarantee. Free Shipping. Cash On,[],<div class="item_left_column" id="description"> <h3 class="item_desc_title fk-uppercase">                 Key Features of JSB Foot Master Leg and Foot Massager            </h3> <div class="cls"></div> <div class="item_desc_text"> <ul class="fk-key-features"> <li>Massage Unit is Flexible and can Swing to be Used while Sitting or Lying Down</li><li>Three Shiatsu Lengths on Sole Optional</li><li>3 Level Height Adjustable for Ideal Calf / Thigh Massage</li><li>Air Pressing Massage for Contoured and Close Massage</li><li>Provides Full Flexibility and Customization to the User</li><li>User can Adjust Intensity (Low Medium High)</li><li>Control Panel Ensures Personalized Massage as per the User Likes</li><li>User can Select which Part to Massage (Sole Calf Foot)</li><li>Multi Functional Massager</li> </ul> </div> <div style="clear: both;"></div> </div>,<div class="item_left_column" id="specifications"> <h3 class="item_desc_title fk-uppercase">         Specifications of JSB Foot Master Leg and Foot Massager    </h3> <table cellspacing="0" class="fk-specs-type2"> <tr> <th class="group-head" colspan="2">Product Details</th> </tr> <tr class=""> <td class="specs-key">Type</td> <td class="specs-value fk-data">Leg||Foot</td> </tr> <tr class=""> <td class="specs-key">Model Id</td> <td class="specs-value fk-data">Foot Master Leg and Foot</td> </tr> <tr class=""> <td class="specs-key">Brand</td> <td class="specs-value fk-data">JSB</td> </tr> </table> </div>,10:03:2014,None
LSTMASDFZDWYTG4UCTTQR216U,JSB B S08 Back Support Plus Massager,http://www.flipkart.com/health-and-beauty?otracker=hp_nmenu_sub_women_0_Beauty%20and%20Wellness,Rs. 1470,Beauty and Wellness,Health Care Devices,JSB,http://img5a.flixcart.com//image/massager/c/t/t/jsb-back-support-plus-bs08-400x400-imadfze54w4cdzfx.jpeg,Rs. 1950,None,women,http://www.flipkart.com/jsb-b-s08-back-support-plus-massager/p/itmdpzgyv3uycjh5?pid=MASDFZDWYTG4UCTT&srno=b_9&ref=da38ccf0-de5f-4934-9118-be867921446f,JSBHealthcare,JSB B S08 Back Support Plus Massager - JSB: Flipkart.com,Buy JSB B S08 Back Support Plus Massager only for Rs. 1500.0 from Flipkart.com. Only Genuine Products. 30 Day Replacement Guarantee. Free Shipping. Cash On,[],<div class="item_left_column" id="description"> <h3 class="item_desc_title fk-uppercase">JSB B S08 Back Support Plus Massager (Brown)         Price: Rs.1470</h3> <div class="cls"></div> <div class="item_desc_text line"> <div style="float:right"> </div> <h3><b> Key Features </b></h3> <div class="line bmargin10"> <ul class="feature_bullet"> <li><span>Infrared Heating Pad</span></li><li><span>Belt with Steel Strips</span></li><li><span>Relieves Back Pain</span></li><li><span>Anion/Thermal Material</span></li><li><span>Belt designed to take the shape of lower backs</span></li><li><span>Pad with Permanent Magnets for Back Relieve</span></li> </ul> </div>                         You can take charge of your back pain with the JSB-BS09 Back Support which also works as a massager. One unique feature which the JSB back support massager provides  is the <strong>Infrared heat pad </strong>that comes with it. This JSB back support brings about remedial solution to your back  lumbar and hip pain. <p><strong>Build</strong></p> Designed and conceptualized for bringing relief and proper posture  this Back support massager is very effective as it <strong>comes with two parts; the Back Support or the Traction Belt and the Infrared Heating Pad</strong>. Each element functions thoroughly to maintain correct posture of the body and alleviate back aches. <p>The<strong> Back Support belt is equipped with contoured steel strips</strong>  which are specially designed to take the shape of your lower back  thereby giving an ideal support. It's <strong>highly elastic and breathable fabric</strong> accommodates all waist sizes. The Infrared Heating pad is detachable and uses infrared  anion and thermal material which on coming in contact with your body  gives a soothing heating effect. In addition  this pad is fitted with permanent magnets that helps relieve back pain.</p> <p><strong>Performance</strong></p> As the saying goes  "Maintain a healthy posture to maintain a healthy back." This is exactly what the back support belt helps you to achieve. The Back Support or <strong>the Lumbar Traction belt realigns your spine</strong> that relieves pain and maintains proper posture of your body  preventing you from slouching. The <strong>Infrared heating pad generates infrared heat that penetrates deep into the tissues of your lower back</strong> thus increasing your blood flow and soothing your back. This pad also relaxes your lower back muscles for greater flexibility and relief. <p>Light weight and flexible  this Back support plus massager is incredibly easy to use. All you need to do is  strap the belt around your body in order to attain the soothing effect. The <strong>JSB-BS09 Back Support is portable and manageable</strong> hence giving you the freedom to carry it around with you.</p> </div> <div style="clear: both;"></div> </div>,<div class="item_left_column" id="specifications"> <h3 class="item_desc_title fk-uppercase">         Specifications of JSB B S08 Back Support Plus Massager (Brown)    </h3> <table cellspacing="0" class="fk-specs-type2"> <tr> <th class="group-head" colspan="2">In The Box</th> </tr> <tr class=""> <td class="specs-key">Sales Package</td> <td class="specs-value fk-data">Main Unit  Far Infrared Heatpad  Double lock belt  User Manual</td> </tr> </table> <table cellspacing="0" class="fk-specs-type2"> <tr> <th class="group-head" colspan="2">Product Details</th> </tr> <tr class=""> <td class="specs-key">Type</td> <td class="specs-value fk-data">Lower back</td> </tr> <tr class=""> <td class="specs-key">Model Name</td> <td class="specs-value fk-data">Back Support Plus</td> </tr> <tr class=""> <td class="specs-key">Color</td> <td class="specs-value fk-data">Brown</td> </tr> <tr class=""> <td class="specs-key">Model Id</td> <td class="specs-value fk-data">B S08</td> </tr> <tr class=""> <td class="specs-key">Brand</td> <td class="specs-value fk-data">JSB</td> </tr> <tr class=""> <td class="specs-key">Variant</td> <td class="specs-value fk-data">44" - 50"</td> </tr> </table> <table cellspacing="0" class="fk-specs-type2"> <tr> <th class="group-head" colspan="2">Warranty</th> </tr> <tr class=""> <td class="specs-value fk-data" colspan="2">1 Year JSB India Warranty and Free Transit Insurance.</td> </tr> </table> </div>,10:03:2014,None
LSTSTHDNYKQSHZDZAGEEMFAOE,JSB JSB S01 Acoustic Stethoscope,http://www.flipkart.com/health-and-beauty?otracker=hp_nmenu_sub_women_0_Beauty%20and%20Wellness,Rs. 270,Beauty and Wellness,Health Care Devices,JSB,http://img5a.flixcart.com/image/stethoscope/a/g/e/dual-sided-jsb-acoustic-jsb-s01-400x400-imadnza8qhffzmge.jpeg,Rs. 380,None,women,http://www.flipkart.com/jsb-s01-acoustic-stethoscope/p/itmdnyhaxzwzaufu?pid=STHDNYKQSHZDZAGE&srno=b_8&ref=da38ccf0-de5f-4934-9118-be867921446f,JSBHealthcare,JSB JSB S01 Acoustic Stethoscope: Flipkart.com,Flipkart.com,[],None,<div class="item_left_column" id="specifications"> <h3 class="item_desc_title fk-uppercase">         Specifications of JSB JSB S01 Acoustic Stethoscope (Black)    </h3> <table cellspacing="0" class="fk-specs-type2"> <tr> <th class="group-head" colspan="2">In the Box</th> </tr> <tr class=""> <td class="specs-key">Sales Package</td> <td class="specs-value fk-data">Stethoscope</td> </tr> </table> <table cellspacing="0" class="fk-specs-type2"> <tr> <th class="group-head" colspan="2">General</th> </tr> <tr class=""> <td class="specs-key">Chest-piece Type</td> <td class="specs-value fk-data">Dual-sided Chest-piece</td> </tr> <tr class=""> <td class="specs-key">Lumen Tube Type</td> <td class="specs-value fk-data">Double Lumen</td> </tr> <tr class=""> <td class="specs-key">Battery-operated Chest-piece</td> <td class="specs-value fk-data">No</td> </tr> <tr class=""> <td class="specs-key">Utility</td> <td class="specs-value fk-data">Double Sided Use for both Different Levels of Acoustics</td> </tr> </table> <table cellspacing="0" class="fk-specs-type2"> <tr> <th class="group-head" colspan="2">Body Features</th> </tr> <tr class=""> <td class="specs-key">Tunable Diaphragm</td> <td class="specs-value fk-data">No</td> </tr> <tr class=""> <td class="specs-key">Chest-piece Material</td> <td class="specs-value fk-data">Aluminium</td> </tr> <tr class=""> <td class="specs-key">Binaurals Material</td> <td class="specs-value fk-data">Aluminum</td> </tr> <tr class=""> <td class="specs-key">Binaural Coating</td> <td class="specs-value fk-data">Aluminum finish</td> </tr> <tr class=""> <td class="specs-key">Tubing Material</td> <td class="specs-value fk-data">PVC</td> </tr> </table> <table cellspacing="0" class="fk-specs-type2"> <tr> <th class="group-head" colspan="2">Dimensions</th> </tr> <tr class=""> <td class="specs-key">Length</td> <td class="specs-value fk-data">620 mm</td> </tr> <tr class=""> <td class="specs-key">Y-tube Length</td> <td class="specs-value fk-data">60 mm</td> </tr> <tr class=""> <td class="specs-key">Binaurals Length</td> <td class="specs-value fk-data">140 mm</td> </tr> <tr class=""> <td class="specs-key">Chest-piece Height</td> <td class="specs-value fk-data">25 mm</td> </tr> <tr class=""> <td class="specs-key">Diaphragm Diameter</td> <td class="specs-value fk-data">45 mm</td> </tr> </table> <table cellspacing="0" class="fk-specs-type2"> <tr> <th class="group-head" colspan="2">Warranty</th> </tr> <tr class=""> <td class="specs-key">Warranty Summary</td> <td class="specs-value fk-data">1 Year JSB Warranty</td> </tr> <tr class=""> <td class="specs-key">Covered in Warranty</td> <td class="specs-value fk-data">Warranty of the product is limited to manufacturing defects only</td> </tr> <tr class=""> <td class="specs-key">Not Covered in Warranty</td> <td class="specs-value fk-data">Warranty does not cover any external accessories (such as battery  cable  carrying bag)  damage caused to the product due to improper installation by customer  normal wear and tear to magnetic heads  audio  video  laser pick-ups and TV picture tubes  pane</td> </tr> <tr class=""> <td class="specs-key">Warranty Service Type</td> <td class="specs-value fk-data">Carry In</td> </tr> </table> </div>,10:03:2014,None
LSTSTHDNYKQ2B3Q77DYCM2EZQ,JSB JSB S02 Acoustic Stethoscope,http://www.flipkart.com/health-and-beauty?otracker=hp_nmenu_sub_women_0_Beauty%20and%20Wellness,Rs. 370,Beauty and Wellness,Health Care Devices,JSB,http://img6a.flixcart.com/image/stethoscope/7/d/y/dual-sided-jsb-acoustic-jsb-s02-400x400-imadnza8nupmbc5b.jpeg,Rs. 680,None,women,http://www.flipkart.com/jsb-s02-acoustic-stethoscope/p/itmdnyhamzpcah4g?pid=STHDNYKQ2B3Q77DY&srno=b_18&ref=366c33aa-a88b-4a44-bc1c-323af6aa2ebc,JSBHealthcare,JSB JSB S02 Acoustic Stethoscope: Flipkart.com,Flipkart.com,[],None,<div class="item_left_column" id="specifications"> <h3 class="item_desc_title fk-uppercase">         Specifications of JSB JSB S02 Acoustic Stethoscope (Black)    </h3> <table cellspacing="0" class="fk-specs-type2"> <tr> <th class="group-head" colspan="2">In the Box</th> </tr> <tr class=""> <td class="specs-key">Sales Package</td> <td class="specs-value fk-data">Stethoscope</td> </tr> </table> <table cellspacing="0" class="fk-specs-type2"> <tr> <th class="group-head" colspan="2">General</th> </tr> <tr class=""> <td class="specs-key">Chest-piece Type</td> <td class="specs-value fk-data">Dual-sided Chest-piece</td> </tr> <tr class=""> <td class="specs-key">Lumen Tube Type</td> <td class="specs-value fk-data">Double Lumen</td> </tr> <tr class=""> <td class="specs-key">Battery-operated Chest-piece</td> <td class="specs-value fk-data">No</td> </tr> <tr class=""> <td class="specs-key">Utility</td> <td class="specs-value fk-data">Double Sided Use for both Different Levels of Acoustics</td> </tr> </table> <table cellspacing="0" class="fk-specs-type2"> <tr> <th class="group-head" colspan="2">Body Features</th> </tr> <tr class=""> <td class="specs-key">Tunable Diaphragm</td> <td class="specs-value fk-data">Yes</td> </tr> <tr class=""> <td class="specs-key">Chest-piece Material</td> <td class="specs-value fk-data">Brass</td> </tr> <tr class=""> <td class="specs-key">Binaurals Material</td> <td class="specs-value fk-data">Brass</td> </tr> <tr class=""> <td class="specs-key">Binaural Coating</td> <td class="specs-value fk-data">Chrome-plated</td> </tr> <tr class=""> <td class="specs-key">Tubing Material</td> <td class="specs-value fk-data">PVC</td> </tr> </table> <table cellspacing="0" class="fk-specs-type2"> <tr> <th class="group-head" colspan="2">Dimensions</th> </tr> <tr class=""> <td class="specs-key">Length</td> <td class="specs-value fk-data">750 mm</td> </tr> <tr class=""> <td class="specs-key">Y-tube Length</td> <td class="specs-value fk-data">70 mm</td> </tr> <tr class=""> <td class="specs-key">Binaurals Length</td> <td class="specs-value fk-data">150 mm</td> </tr> <tr class=""> <td class="specs-key">Chest-piece Height</td> <td class="specs-value fk-data">35 mm</td> </tr> <tr class=""> <td class="specs-key">Diaphragm Diameter</td> <td class="specs-value fk-data">45 mm</td> </tr> </table> <table cellspacing="0" class="fk-specs-type2"> <tr> <th class="group-head" colspan="2">Warranty</th> </tr> <tr class=""> <td class="specs-key">Warranty Summary</td> <td class="specs-value fk-data">1 Year JSB Warranty</td> </tr> <tr class=""> <td class="specs-key">Covered in Warranty</td> <td class="specs-value fk-data">Warranty of the product is limited to manufacturing defects only</td> </tr> <tr class=""> <td class="specs-key">Not Covered in Warranty</td> <td class="specs-value fk-data">Warranty does not cover any external accessories (such as battery  cable  carrying bag)  damage caused to the product due to improper installation by customer  normal wear and tear to magnetic heads  audio  video  laser pick-ups and TV picture tubes  pane</td> </tr> <tr class=""> <td class="specs-key">Warranty Service Type</td> <td class="specs-value fk-data">Carry In</td> </tr> </table> </div>,10:03:2014,None
LSTSTHDNYKQKMDUHBUHGUIXSN,JSB JSB S05 Acoustic Stethoscope,http://www.flipkart.com/health-and-beauty?otracker=hp_nmenu_sub_women_0_Beauty%20and%20Wellness,Rs. 1490,Beauty and Wellness,Health Care Devices,JSB,http://img5a.flixcart.com/image/stethoscope/b/u/h/dual-sided-jsb-acoustic-jsb-s05-400x400-imadnza8xhkvzrwh.jpeg,Rs. 2500,None,women,http://www.flipkart.com/jsb-s05-acoustic-stethoscope/p/itmdnyhagdv3jg8p?pid=STHDNYKQKMDUHBUH&srno=b_22&ref=366c33aa-a88b-4a44-bc1c-323af6aa2ebc,JSBHealthcare,JSB JSB S05 Acoustic Stethoscope: Flipkart.com,Flipkart.com,[],None,<div class="item_left_column" id="specifications"> <h3 class="item_desc_title fk-uppercase">         Specifications of JSB JSB S05 Acoustic Stethoscope (Black)    </h3> <table cellspacing="0" class="fk-specs-type2"> <tr> <th class="group-head" colspan="2">In the Box</th> </tr> <tr class=""> <td class="specs-key">Sales Package</td> <td class="specs-value fk-data">Stethoscope</td> </tr> </table> <table cellspacing="0" class="fk-specs-type2"> <tr> <th class="group-head" colspan="2">General</th> </tr> <tr class=""> <td class="specs-key">Chest-piece Type</td> <td class="specs-value fk-data">Dual-sided Chest-piece</td> </tr> <tr class=""> <td class="specs-key">Lumen Tube Type</td> <td class="specs-value fk-data">Double Lumen</td> </tr> <tr class=""> <td class="specs-key">Battery-operated Chest-piece</td> <td class="specs-value fk-data">No</td> </tr> <tr class=""> <td class="specs-key">Utility</td> <td class="specs-value fk-data">Double Sided Use for both Different Levels of Acoustics</td> </tr> </table> <table cellspacing="0" class="fk-specs-type2"> <tr> <th class="group-head" colspan="2">Body Features</th> </tr> <tr class=""> <td class="specs-key">Tunable Diaphragm</td> <td class="specs-value fk-data">Yes</td> </tr> <tr class=""> <td class="specs-key">Chest-piece Material</td> <td class="specs-value fk-data">Stainless Steel</td> </tr> <tr class=""> <td class="specs-key">Binaurals Material</td> <td class="specs-value fk-data">Brass</td> </tr> <tr class=""> <td class="specs-key">Binaural Coating</td> <td class="specs-value fk-data">Chrome-plated</td> </tr> <tr class=""> <td class="specs-key">Tubing Material</td> <td class="specs-value fk-data">PVC</td> </tr> </table> <table cellspacing="0" class="fk-specs-type2"> <tr> <th class="group-head" colspan="2">Dimensions</th> </tr> <tr class=""> <td class="specs-key">Length</td> <td class="specs-value fk-data">720 mm</td> </tr> <tr class=""> <td class="specs-key">Y-tube Length</td> <td class="specs-value fk-data">140 mm</td> </tr> <tr class=""> <td class="specs-key">Binaurals Length</td> <td class="specs-value fk-data">250 mm</td> </tr> <tr class=""> <td class="specs-key">Chest-piece Height</td> <td class="specs-value fk-data">45 mm</td> </tr> <tr class=""> <td class="specs-key">Diaphragm Diameter</td> <td class="specs-value fk-data">45 mm</td> </tr> </table> <table cellspacing="0" class="fk-specs-type2"> <tr> <th class="group-head" colspan="2">Warranty</th> </tr> <tr class=""> <td class="specs-key">Warranty Summary</td> <td class="specs-value fk-data">1 Year JSB Warranty</td> </tr> <tr class=""> <td class="specs-key">Covered in Warranty</td> <td class="specs-value fk-data">Warranty of the product is limited to manufacturing defects only</td> </tr> <tr class=""> <td class="specs-key">Not Covered in Warranty</td> <td class="specs-value fk-data">Warranty does not cover any external accessories (such as battery  cable  carrying bag)  damage caused to the product due to improper installation by customer  normal wear and tear to magnetic heads  audio  video  laser pick-ups and TV picture tubes  pane</td> </tr> <tr class=""> <td class="specs-key">Warranty Service Type</td> <td class="specs-value fk-data">Carry In</td> </tr> </table> </div>,10:03:2014,None
LSTSTHDNYKQGUFH974J5SIGCB,JSB JSB S07 Acoustic Stethoscope,http://www.flipkart.com/health-and-beauty?otracker=hp_nmenu_sub_women_0_Beauty%20and%20Wellness,Rs. 590,Beauty and Wellness,Health Care Devices,JSB,http://img5a.flixcart.com/image/stethoscope/w/j/s/dual-sided-littmann-acoustic-3m-classic-ii-pediatric-s-e-400x400-imadnza8gvcbusay.jpeg,Rs. 990,None,women,http://www.flipkart.com/jsb-s07-acoustic-stethoscope/p/itmdnyhahehwswby?pid=STHDNYKQGUFH974J&srno=b_20&ref=366c33aa-a88b-4a44-bc1c-323af6aa2ebc,JSBHealthcare,JSB JSB S07 Acoustic Stethoscope: Flipkart.com,Flipkart.com,[],None,<div class="item_left_column" id="specifications"> <h3 class="item_desc_title fk-uppercase">         Specifications of JSB JSB S07 Acoustic Stethoscope (Black)    </h3> <table cellspacing="0" class="fk-specs-type2"> <tr> <th class="group-head" colspan="2">In the Box</th> </tr> <tr class=""> <td class="specs-key">Sales Package</td> <td class="specs-value fk-data">Stethoscope</td> </tr> </table> <table cellspacing="0" class="fk-specs-type2"> <tr> <th class="group-head" colspan="2">General</th> </tr> <tr class=""> <td class="specs-key">Chest-piece Type</td> <td class="specs-value fk-data">Dual-sided Chest-piece</td> </tr> <tr class=""> <td class="specs-key">Lumen Tube Type</td> <td class="specs-value fk-data">Double Lumen</td> </tr> <tr class=""> <td class="specs-key">Battery-operated Chest-piece</td> <td class="specs-value fk-data">No</td> </tr> <tr class=""> <td class="specs-key">Utility</td> <td class="specs-value fk-data">Double Sided Use for both Different Levels of Acoustics</td> </tr> </table> <table cellspacing="0" class="fk-specs-type2"> <tr> <th class="group-head" colspan="2">Body Features</th> </tr> <tr class=""> <td class="specs-key">Tunable Diaphragm</td> <td class="specs-value fk-data">No</td> </tr> <tr class=""> <td class="specs-key">Chest-piece Material</td> <td class="specs-value fk-data">Aluminium</td> </tr> <tr class=""> <td class="specs-key">Binaurals Material</td> <td class="specs-value fk-data">Brass</td> </tr> <tr class=""> <td class="specs-key">Binaural Coating</td> <td class="specs-value fk-data">Chrome-plated</td> </tr> <tr class=""> <td class="specs-key">Tubing Material</td> <td class="specs-value fk-data">PVC</td> </tr> </table> <table cellspacing="0" class="fk-specs-type2"> <tr> <th class="group-head" colspan="2">Dimensions</th> </tr> <tr class=""> <td class="specs-key">Length</td> <td class="specs-value fk-data">750 mm</td> </tr> <tr class=""> <td class="specs-key">Y-tube Length</td> <td class="specs-value fk-data">70 mm</td> </tr> <tr class=""> <td class="specs-key">Binaurals Length</td> <td class="specs-value fk-data">170 mm</td> </tr> <tr class=""> <td class="specs-key">Chest-piece Height</td> <td class="specs-value fk-data">20 mm</td> </tr> <tr class=""> <td class="specs-key">Diaphragm Diameter</td> <td class="specs-value fk-data">30 mm</td> </tr> </table> <table cellspacing="0" class="fk-specs-type2"> <tr> <th class="group-head" colspan="2">Warranty</th> </tr> <tr class=""> <td class="specs-key">Warranty Summary</td> <td class="specs-value fk-data">1 Year JSB Warranty</td> </tr> <tr class=""> <td class="specs-key">Covered in Warranty</td> <td class="specs-value fk-data">Warranty of the product is limited to manufacturing defects only</td> </tr> <tr class=""> <td class="specs-key">Not Covered in Warranty</td> <td class="specs-value fk-data">Warranty does not cover any external accessories (such as battery  cable  carrying bag)  damage caused to the product due to improper installation by customer  normal wear and tear to magnetic heads  audio  video  laser pick-ups and TV picture tubes  pane</td> </tr> <tr class=""> <td class="specs-key">Warranty Service Type</td> <td class="specs-value fk-data">Carry In</td> </tr> </table> </div>,10:03:2014,None
