LSTSTHDNYKQYQGY7SPGSTQVQW,JSB JSB S06 Acoustic Stethoscope,http://www.flipkart.com/health-and-beauty?otracker=hp_nmenu_sub_women_0_Beauty%20and%20Wellness,Rs. 690,Beauty and Wellness,Health Care Devices,JSB,http://img5a.flixcart.com/image/stethoscope/s/p/g/dual-sided-jsb-acoustic-jsb-s06-400x400-imadnza82t56eqa5.jpeg,Rs. 990,None,women,http://www.flipkart.com/jsb-s06-acoustic-stethoscope/p/itmdnyhakxzw2kzm?pid=STHDNYKQYQGY7SPG&srno=b_21&ref=366c33aa-a88b-4a44-bc1c-323af6aa2ebc,JSBHealthcare,JSB JSB S06 Acoustic Stethoscope: Flipkart.com,Flipkart.com,[],None,<div class="item_left_column" id="specifications"> <h3 class="item_desc_title fk-uppercase">         Specifications of JSB JSB S06 Acoustic Stethoscope (Black)    </h3> <table cellspacing="0" class="fk-specs-type2"> <tr> <th class="group-head" colspan="2">In the Box</th> </tr> <tr class=""> <td class="specs-key">Sales Package</td> <td class="specs-value fk-data">Stethoscope</td> </tr> </table> <table cellspacing="0" class="fk-specs-type2"> <tr> <th class="group-head" colspan="2">General</th> </tr> <tr class=""> <td class="specs-key">Chest-piece Type</td> <td class="specs-value fk-data">Dual-sided Chest-piece</td> </tr> <tr class=""> <td class="specs-key">Lumen Tube Type</td> <td class="specs-value fk-data">Double Lumen</td> </tr> <tr class=""> <td class="specs-key">Battery-operated Chest-piece</td> <td class="specs-value fk-data">No</td> </tr> <tr class=""> <td class="specs-key">Utility</td> <td class="specs-value fk-data">Double Sided Use for both Different Levels of Acoustics</td> </tr> </table> <table cellspacing="0" class="fk-specs-type2"> <tr> <th class="group-head" colspan="2">Body Features</th> </tr> <tr class=""> <td class="specs-key">Tunable Diaphragm</td> <td class="specs-value fk-data">No</td> </tr> <tr class=""> <td class="specs-key">Chest-piece Material</td> <td class="specs-value fk-data">Aluminium</td> </tr> <tr class=""> <td class="specs-key">Binaurals Material</td> <td class="specs-value fk-data">Brass</td> </tr> <tr class=""> <td class="specs-key">Binaural Coating</td> <td class="specs-value fk-data">Chrome-plated</td> </tr> <tr class=""> <td class="specs-key">Tubing Material</td> <td class="specs-value fk-data">PVC</td> </tr> </table> <table cellspacing="0" class="fk-specs-type2"> <tr> <th class="group-head" colspan="2">Dimensions</th> </tr> <tr class=""> <td class="specs-key">Length</td> <td class="specs-value fk-data">750 mm</td> </tr> <tr class=""> <td class="specs-key">Y-tube Length</td> <td class="specs-value fk-data">70 mm</td> </tr> <tr class=""> <td class="specs-key">Binaurals Length</td> <td class="specs-value fk-data">170 mm</td> </tr> <tr class=""> <td class="specs-key">Chest-piece Height</td> <td class="specs-value fk-data">35 mm</td> </tr> <tr class=""> <td class="specs-key">Diaphragm Diameter</td> <td class="specs-value fk-data">30 mm</td> </tr> </table> <table cellspacing="0" class="fk-specs-type2"> <tr> <th class="group-head" colspan="2">Warranty</th> </tr> <tr class=""> <td class="specs-key">Warranty Summary</td> <td class="specs-value fk-data">1 Year JSB Warranty</td> </tr> <tr class=""> <td class="specs-key">Covered in Warranty</td> <td class="specs-value fk-data">Warranty of the product is limited to manufacturing defects only</td> </tr> <tr class=""> <td class="specs-key">Not Covered in Warranty</td> <td class="specs-value fk-data">Warranty does not cover any external accessories (such as battery  cable  carrying bag)  damage caused to the product due to improper installation by customer  normal wear and tear to magnetic heads  audio  video  laser pick-ups and TV picture tubes  pane</td> </tr> <tr class=""> <td class="specs-key">Warranty Service Type</td> <td class="specs-value fk-data">Carry In</td> </tr> </table> </div>,10:03:2014,None
LSTPDODBM5ZNH7NVARXDGSZXP,JSB Deluxe 3D Pedometer,http://www.flipkart.com/health-and-beauty?otracker=hp_nmenu_sub_women_0_Beauty%20and%20Wellness,Rs. 990,Beauty and Wellness,Health Care Devices,JSB,http://img5a.flixcart.com/image/pedometer/a/r/x/jsb-deluxe-3d-400x400-imadbzb43k3jbcfx.jpeg,Rs. 2450,None,women,http://www.flipkart.com/jsb-deluxe-3d-pedometer/p/itmdbm6usgdbqmzg?pid=PDODBM5ZNH7NVARX&srno=b_11&ref=da38ccf0-de5f-4934-9118-be867921446f,JSBHealthcare,JSB Deluxe 3D Pedometer - JSB: Flipkart.com,Buy JSB Deluxe 3D Pedometer only for Rs. 1332.0 from Flipkart.com. Only Genuine Products. 30 Day Replacement Guarantee. Free Shipping. Cash On,[],<div class="item_left_column" id="description"> <h3 class="item_desc_title fk-uppercase">                 Key Features of JSB Deluxe 3D Pedometer            </h3> <div class="cls"></div> <div class="item_desc_text"> <ul class="fk-key-features"> <li>LCD Display</li><li>7 Days Record</li><li>Low Battery Indicator</li><li>12/24-hour Format</li> </ul> </div> <div style="clear: both;"></div> </div>,<div class="item_left_column" id="specifications"> <h3 class="item_desc_title fk-uppercase">         Specifications of JSB Deluxe 3D Pedometer    </h3> <table cellspacing="0" class="fk-specs-type2"> <tr> <th class="group-head" colspan="2">In The Box</th> </tr> <tr class=""> <td class="specs-key">Sales Package</td> <td class="specs-value fk-data">Main Unit  1 Neck Hanging Rope  1 CR2032 Battery  Instruction Manual</td> </tr> </table> <table cellspacing="0" class="fk-specs-type2"> <tr> <th class="group-head" colspan="2">General</th> </tr> <tr class=""> <td class="specs-key">Sensing Technology</td> <td class="specs-value fk-data">Accelerometer Sensor</td> </tr> <tr class=""> <td class="specs-key">Display</td> <td class="specs-value fk-data">LCD Display</td> </tr> </table> <table cellspacing="0" class="fk-specs-type2"> <tr> <th class="group-head" colspan="2">Functions</th> </tr> <tr class=""> <td class="specs-key">Step Count</td> <td class="specs-value fk-data">Yes</td> </tr> <tr class=""> <td class="specs-key">Walking time</td> <td class="specs-value fk-data">Yes</td> </tr> <tr class=""> <td class="specs-key">Distance Travelled</td> <td class="specs-value fk-data">Yes</td> </tr> <tr class=""> <td class="specs-key">Calories Burnt</td> <td class="specs-value fk-data">Yes</td> </tr> </table> <table cellspacing="0" class="fk-specs-type2"> <tr> <th class="group-head" colspan="2">Memory Details</th> </tr> <tr class=""> <td class="specs-key">Memory Record</td> <td class="specs-value fk-data">7</td> </tr> </table> <table cellspacing="0" class="fk-specs-type2"> <tr> <th class="group-head" colspan="2">Additional Features</th> </tr> <tr class=""> <td class="specs-key">Other Features</td> <td class="specs-value fk-data"><ul><li>Work Accurately at Any Direction  Fat Burnt Counter  No Need to Stay Vertical to the Ground  Displays the Average Speed  10 Steps Buffer Error Correction  Low Battery Indicator  Auto LCD Off and Wake-up to Save Power  Unique Carabiner and 8 mm Ultra-thin Design  12 and 24 hrs Format Display Selectable  Adopt the Accelerometer Sensor Which Allows It Counts Steps in Any Orientation  Monitor the Exercise Time  Color: Blue and Black</li></ul></td> </tr> </table> <table cellspacing="0" class="fk-specs-type2"> <tr> <th class="group-head" colspan="2">Warranty</th> </tr> <tr class=""> <td class="specs-key">Service Type</td> <td class="specs-value fk-data">Carry In</td> </tr> <tr class=""> <td class="specs-key">Domestic Term</td> <td class="specs-value fk-data">1 Year</td> </tr> </table> </div>,10:03:2014,None
LSTBPMCZZYMNA8VF7HFHEOZSN,JSB Deluxe Digital Upper Arm Bp Monitor,http://www.flipkart.com/health-and-beauty?otracker=hp_nmenu_sub_women_0_Beauty%20and%20Wellness,Rs. 2350,Beauty and Wellness,Health Care Devices,JSB,http://img6a.flixcart.com/image/bp-monitor/7/h/f/jsb-upper-arm-deluxe-digital-400x400-imaczvwrcjs4xxxm.jpeg,Rs. 2350,None,women,http://www.flipkart.com/jsb-deluxe-digital-upper-arm-bp-monitor/p/itmczzyz8w4vc7yw?pid=BPMCZZYMNA8VF7HF&srno=b_23&ref=366c33aa-a88b-4a44-bc1c-323af6aa2ebc,WS Retail,JSB Deluxe Digital Upper Arm Bp Monitor - JSB: Flipkart.com,Buy JSB Deluxe Digital Upper Arm Bp Monitor only for Rs. 2350.0 from Flipkart.com. Only Genuine Products. 30 Day Replacement Guarantee. Free Shipping. Cash On,[],<div class="item_left_column" id="description"> <h3 class="item_desc_title fk-uppercase">JSB Deluxe Digital Upper Arm Bp Monitor (White)         Price: Rs.2350</h3> <div class="cls"></div> <div class="item_desc_text line"> <div style="float:right"> </div> <h3><b> Key Features </b></h3> <div class="line bmargin10"> <ul class="feature_bullet"> <li><span>Pulse Rate Indicator</span></li> </ul> </div>                         A <strong>complete automatic measuring function</strong> with personalized inflation level  offered by the JSB Deluxe Upper Arm BP Monitor enables you to measure and monitor your blood pressure efficiently. The JSB BP monitor also features an <strong>Irregular heartbeat indicator </strong>that detects abnormal heartbeats while your pressure is being measured. <p>The JSB deluxe arm BP monitor has been evaluated and proven to meet the rigorous safety and accuracy standards set by CE  FDA and RoHS.</p> <p><strong>Build</strong></p> Crafted to meet comfort  ease of use and simplicity  all at the same time  this digital JSB arm BP monitor offers a <strong>simple and user friendly control panel</strong>. The control panel is made up of a large and clear LCD display and easy to operate control buttons. <p>The BP monitor comes with an <strong>easy-wrap cuff</strong> that naturally conforms to the contours of your arms. The BP monitor provides a medium sized cuff with a circumference ranging from 22 to 32 cm  which auto inflates to an optimal level. The process of operating the BP monitor is very simple and comfortable. All you need to do is  attach the cuff to your arms and press the button to get your digital readings.</p> <p><strong>Performance and Features</strong></p> The <strong>digital deluxe arm BP monitor by JSB utilizes a digital sensor</strong> that uses a fuzzy logic technology to detect your pulse signals. This enables automatic inflation and deflation of the cuff resulting to accurate readings and a shorter measurement time. This deluxe upper arm blood pressure monitor is also equipped with a <strong>memory function</strong> that allows <strong>two users to capture 180 readings</strong>  displayed with an updated date and time. You can use the memory bank for checking the variations of your BP measurements in order to get a better understanding of your blood pressure condition. <p>The deluxe digital arm blood pressure monitor by JSB simultaneously displays digital readings of both systolic/ diastolic pressure and pulse rates. The BP monitor is capable of displaying readings ranging from 0 to 300 mmHg for blood pressure and 40 to 199 beats/minute for pulse rates. Quick and accurate  this digital deluxe arm BP monitor is calibrated at +/-3 mmHg for pressure readings and +/-5% of reading for pulse progress. This JSB BP monitor functions soundly with a power supply of 4 AA batteries.</p> </div> <div style="clear: both;"></div> </div>,<div class="item_left_column" id="specifications"> <h3 class="item_desc_title fk-uppercase">         Specifications of JSB Deluxe Digital Upper Arm Bp Monitor (White)    </h3> <table cellspacing="0" class="fk-specs-type2"> <tr> <th class="group-head" colspan="2">In the Box</th> </tr> <tr class=""> <td class="specs-key">Sales Package</td> <td class="specs-value fk-data">Main Unit  Cuff  4 Batteries  Instruction Manual  Warranty Card</td> </tr> </table> <table cellspacing="0" class="fk-specs-type2"> <tr> <th class="group-head" colspan="2">Product Details</th> </tr> <tr class=""> <td class="specs-key">Type</td> <td class="specs-value fk-data">Upper Arm</td> </tr> <tr class=""> <td class="specs-key">Model ID</td> <td class="specs-value fk-data">Deluxe Digital</td> </tr> <tr class=""> <td class="specs-key">Model Name</td> <td class="specs-value fk-data">Upper Arm</td> </tr> <tr class=""> <td class="specs-key">Color</td> <td class="specs-value fk-data">White</td> </tr> <tr class=""> <td class="specs-key">Brand</td> <td class="specs-value fk-data">JSB</td> </tr> </table> <table cellspacing="0" class="fk-specs-type2"> <tr> <th class="group-head" colspan="2">Device Characteristics</th> </tr> <tr class=""> <td class="specs-key">Date &amp; Time(Clock)</td> <td class="specs-value fk-data">Yes</td> </tr> <tr class=""> <td class="specs-key">Pulse Rate Indicator</td> <td class="specs-value fk-data">Yes</td> </tr> <tr class=""> <td class="specs-key">Display</td> <td class="specs-value fk-data">LCD</td> </tr> <tr class=""> <td class="specs-key">Movement Indicator</td> <td class="specs-value fk-data">Yes</td> </tr> <tr class=""> <td class="specs-key">Memory Function</td> <td class="specs-value fk-data">Yes</td> </tr> </table> <table cellspacing="0" class="fk-specs-type2"> <tr> <th class="group-head" colspan="2">Measurement</th> </tr> <tr class=""> <td class="specs-key">Measurement Range Pressure(mmHg) (Max)</td> <td class="specs-value fk-data">300 mmHg</td> </tr> <tr class=""> <td class="specs-key">Measurement Accuracy Pulse(% of reading)</td> <td class="specs-value fk-data">±5 % of reading</td> </tr> <tr class=""> <td class="specs-key">Measurement Range Pulse(beats/min) (Max)</td> <td class="specs-value fk-data">199 beats/min</td> </tr> <tr class=""> <td class="specs-key">Measurement Range Pulse(beats/min) (Min)</td> <td class="specs-value fk-data">40 beats/min</td> </tr> <tr class=""> <td class="specs-key">Measurement Method</td> <td class="specs-value fk-data">Oscillometric Method</td> </tr> <tr class=""> <td class="specs-key">Measurement Accuracy Pressure(mmHg)</td> <td class="specs-value fk-data">±3 mmHg</td> </tr> <tr class=""> <td class="specs-key">Measurement Range Pressure(mmHg) (Min)</td> <td class="specs-value fk-data">0 mmHg</td> </tr> </table> <table cellspacing="0" class="fk-specs-type2"> <tr> <th class="group-head" colspan="2">Power Requirements</th> </tr> <tr class=""> <td class="specs-key">No. of Battery</td> <td class="specs-value fk-data">4</td> </tr> <tr class=""> <td class="specs-key">Power Source</td> <td class="specs-value fk-data">Battery</td> </tr> <tr class=""> <td class="specs-key">Battery Type</td> <td class="specs-value fk-data">AA</td> </tr> </table> <table cellspacing="0" class="fk-specs-type2"> <tr> <th class="group-head" colspan="2">Warranty</th> </tr> <tr class=""> <td class="specs-value fk-data" colspan="2">1 Year JSB India Warranty and Free Transit Insurance.</td> </tr> </table> </div>,10:03:2014,None
LSTBPMDBHTV5WFAHUNBXKTKZY,JSB DBP05 Digital Arm Bp Monitor,http://www.flipkart.com/health-and-beauty?otracker=hp_nmenu_sub_women_0_Beauty%20and%20Wellness,Rs. 1020,Beauty and Wellness,Health Care Devices,JSB,http://img5a.flixcart.com/image/bp-monitor/u/n/b/jsb-dbp04-400x400-imadbhuyes8gwjz4.jpeg,Rs. 1950,None,women,http://www.flipkart.com/jsb-dbp05-digital-arm-bp-monitor/p/itmdbhu5ha8vcf4w?pid=BPMDBHTV5WFAHUNB&srno=b_2&ref=da38ccf0-de5f-4934-9118-be867921446f,JSBHealthcare,JSB DBP05 Digital Arm Bp Monitor - JSB: Flipkart.com,Buy JSB DBP05 Digital Arm Bp Monitor only for Rs. 1000.0 from Flipkart.com. Only Genuine Products. 30 Day Replacement Guarantee. Free Shipping. Cash On,[],<div class="item_left_column" id="description"> <h3 class="item_desc_title fk-uppercase">                 Key Features of JSB DBP05 Digital Arm Bp Monitor            </h3> <div class="cls"></div> <div class="item_desc_text"> <ul class="fk-key-features"> <li>Alkaline Batteries</li> </ul> </div> <div style="clear: both;"></div> </div>,<div class="item_left_column" id="specifications"> <h3 class="item_desc_title fk-uppercase">         Specifications of JSB DBP05 Digital Arm Bp Monitor    </h3> <table cellspacing="0" class="fk-specs-type2"> <tr> <th class="group-head" colspan="2">In the Box</th> </tr> <tr class=""> <td class="specs-key">Sales Package</td> <td class="specs-value fk-data">Main Unit  Cuff  4 AA batteries  Instruction Manual</td> </tr> </table> <table cellspacing="0" class="fk-specs-type2"> <tr> <th class="group-head" colspan="2">Product Details</th> </tr> <tr class=""> <td class="specs-key">Type</td> <td class="specs-value fk-data">Upper Arm</td> </tr> <tr class=""> <td class="specs-key">Model ID</td> <td class="specs-value fk-data">DBP05 Digital Arm</td> </tr> <tr class=""> <td class="specs-key">Brand</td> <td class="specs-value fk-data">JSB</td> </tr> </table> <table cellspacing="0" class="fk-specs-type2"> <tr> <th class="group-head" colspan="2">Device Characteristics</th> </tr> <tr class=""> <td class="specs-key">Date &amp; Time(Clock)</td> <td class="specs-value fk-data">Yes</td> </tr> <tr class=""> <td class="specs-key">Display</td> <td class="specs-value fk-data">LCD</td> </tr> <tr class=""> <td class="specs-key">Memory Function</td> <td class="specs-value fk-data">Yes</td> </tr> </table> <table cellspacing="0" class="fk-specs-type2"> <tr> <th class="group-head" colspan="2">Measurement</th> </tr> <tr class=""> <td class="specs-key">Measurement Accuracy Pulse(% of reading)</td> <td class="specs-value fk-data">±5 % of reading</td> </tr> <tr class=""> <td class="specs-key">Measurement Accuracy Pressure(mmHg)</td> <td class="specs-value fk-data">±3 mmHg</td> </tr> </table> <table cellspacing="0" class="fk-specs-type2"> <tr> <th class="group-head" colspan="2">Power Requirements</th> </tr> <tr class=""> <td class="specs-key">No. of Battery</td> <td class="specs-value fk-data">4</td> </tr> <tr class=""> <td class="specs-key">Power Source</td> <td class="specs-value fk-data">Battery</td> </tr> <tr class=""> <td class="specs-key">Battery Type</td> <td class="specs-value fk-data">AA</td> </tr> </table> <table cellspacing="0" class="fk-specs-type2"> <tr> <th class="group-head" colspan="2">Warranty</th> </tr> <tr class=""> <td class="specs-value fk-data" colspan="2">1 Year JSB India Warranty and Free Transit Insurance.</td> </tr> </table> </div>,10:03:2014,None
LSTMASDJZ6UW7UHNEEUY49JUB,JSB HF31 Portable Mini Massager,http://www.flipkart.com/health-and-beauty?otracker=hp_nmenu_sub_women_0_Beauty%20and%20Wellness,Rs. 800,Beauty and Wellness,Health Care Devices,JSB,http://img6a.flixcart.com/image/massager/e/e/u/jsb-hf31-portable-mini-400x400-imadjz7ygwcfpsgg.jpeg,Rs. 1950,None,women,http://www.flipkart.com/jsb-hf31-portable-mini-massager/p/itmdjz6uwvgdch5s?pid=MASDJZ6UW7UHNEEU&srno=b_17&ref=366c33aa-a88b-4a44-bc1c-323af6aa2ebc,WS Retail,JSB HF31 Portable Mini Massager - JSB: Flipkart.com,Buy JSB HF31 Portable Mini Massager only for Rs. 800.0 from Flipkart.com. Only Genuine Products. 30 Day Replacement Guarantee. Free Shipping. Cash On,[],<div class="item_left_column" id="description"> <h3 class="item_desc_title fk-uppercase">                 Key Features of JSB HF31 Portable Mini Massager            </h3> <div class="cls"></div> <div class="item_desc_text"> <ul class="fk-key-features"> <li>Used for (Neck Pain Back Pain Thigh Pain Arms Pain and Head Massage)</li><li>Elderly and Practically Anybody</li><li>Easy to Carry</li><li>Used by Housewifes while Working</li><li>Office Going while at Work</li><li>Relaxing Massage</li> </ul> </div> <div style="clear: both;"></div> </div>,<div class="item_left_column" id="specifications"> <h3 class="item_desc_title fk-uppercase">         Specifications of JSB HF31 Portable Mini Massager    </h3> <table cellspacing="0" class="fk-specs-type2"> <tr> <th class="group-head" colspan="2">Product Details</th> </tr> <tr class=""> <td class="specs-key">Type</td> <td class="specs-value fk-data">Body</td> </tr> <tr class=""> <td class="specs-key">Model Id</td> <td class="specs-value fk-data">HF31 Portable Mini</td> </tr> <tr class=""> <td class="specs-key">Brand</td> <td class="specs-value fk-data">JSB</td> </tr> </table> </div>,10:03:2014,None
LSTMASDFFXGJZGFKYEXSMQCT2,JSB HF06 Multi-Functional Leg Massager,http://www.flipkart.com/health-and-beauty?otracker=hp_nmenu_sub_women_0_Beauty%20and%20Wellness,Rs. 19999,Beauty and Wellness,Health Care Devices,JSB,http://img6a.flixcart.com/image/massager/y/e/x/jsb-multi-functional-leg-hf06-400x400-imadekfmxsnnquwh.jpeg,Rs. 22500,None,women,http://www.flipkart.com/jsb-hf06-multi-functional-leg-massager/p/itmdffxgqdn9hurk?pid=MASDFFXGJZGFKYEX&srno=b_24&ref=366c33aa-a88b-4a44-bc1c-323af6aa2ebc,WS Retail,JSB HF06 Multi-Functional Leg Massager - JSB: Flipkart.com,Buy JSB HF06 Multi-Functional Leg Massager only for Rs. 19999.0 from Flipkart.com. Only Genuine Products. 30 Day Replacement Guarantee. Free Shipping. Cash On,[],<div class="item_left_column" id="description"> <h3 class="item_desc_title fk-uppercase">JSB HF06 Multi-Functional Leg Massager (White)         Price: Rs.19999</h3> <div class="cls"></div> <div class="item_desc_text line"> <div style="float:right"> </div> <h3><b> Key Features </b></h3> <div class="line bmargin10"> <ul class="feature_bullet"> <li><span>Air-bag Massager</span></li><li><span>Quick / Relax / Auto Modes</span></li><li><span>Air Bag Massage for a Contoured and Close</span></li><li><span>Oscillatory Method</span></li><li><span>3 Intensity Modes</span></li><li><span>User can Select which Part to Massage- Sole / Calf / Foot or all Together</span></li><li><span>Massage Attractive Whit Body</span></li> </ul> </div>                         The <strong>JSB-HF06 Multi-Functional Leg Massager is an upgraded version</strong> of its predecessor  which provides complete <strong>flexibility and customization</strong> to the user. The JSB massager facilitates you to customize and select the area of body which requires massage according to your convenience. <p>The Leg massager also features an <strong>adjustable intensity speed </strong>which enables you to adjust the speed in accordance to the desired intensity of massage you require. The speed control is set in three different auto modes: Quick (High)  Relax (Medium) and Auto (Low).</p> <p><strong>Built</strong></p> The <strong>Multi-Functional Leg massager is built to relax and alleviate pain</strong> from every part of your leg. The massager delivers gentle and soothing massage right from your sole and ankles to your calves and thighs. This leg massager can be adjusted according to your height as it comes with adjustable hinges. The <strong>user friendly control panel </strong>makes it simple for you to use the device. You just need to switch on the massager  slip your legs in the cushioned massage chambers and adjust the massager according to your need. <p><strong>Performance</strong></p> The exclusive design of this JSB Leg massager enables you to <strong>comfort and rejuvenate each part of your legs</strong> to provide total relaxation of your body. The massager's unique <strong>Air bag massage</strong> provides for a contoured and closed massage thus bringing about a professional massage experience. The flexible <strong>air-pressure kneading pads</strong> effectively squeezes and massages your entire leg. The <strong>HF06 Leg Massager incorporates special rollers</strong> that target your calf muscles  ball and arch of foot. You will feel relaxed and wholly new with the combined effort of these different internal components that the massager encompasses  This Multi-functional Leg massager is powered by electricity.        </div> <div style="clear: both;"></div> </div>,<div class="item_left_column" id="specifications"> <h3 class="item_desc_title fk-uppercase">         Specifications of JSB HF06 Multi-Functional Leg Massager (White)    </h3> <table cellspacing="0" class="fk-specs-type2"> <tr> <th class="group-head" colspan="2">In The Box</th> </tr> <tr class=""> <td class="specs-key">Sales Package</td> <td class="specs-value fk-data">Main Unit  User Manual</td> </tr> </table> <table cellspacing="0" class="fk-specs-type2"> <tr> <th class="group-head" colspan="2">Product Details</th> </tr> <tr class=""> <td class="specs-key">Type</td> <td class="specs-value fk-data">Leg||Foot</td> </tr> <tr class=""> <td class="specs-key">Model Name</td> <td class="specs-value fk-data">Multi-Functional Leg</td> </tr> <tr class=""> <td class="specs-key">Color</td> <td class="specs-value fk-data">White</td> </tr> <tr class=""> <td class="specs-key">Model Id</td> <td class="specs-value fk-data">HF06</td> </tr> <tr class=""> <td class="specs-key">Brand</td> <td class="specs-value fk-data">JSB</td> </tr> </table> <table cellspacing="0" class="fk-specs-type2"> <tr> <th class="group-head" colspan="2">Power Requirements</th> </tr> <tr class=""> <td class="specs-key">Power Source</td> <td class="specs-value fk-data">Electricity</td> </tr> <tr class=""> <td class="specs-key">Power Consumption (Watts)</td> <td class="specs-value fk-data">70 W</td> </tr> <tr class=""> <td class="specs-key">Power Required (Volts)</td> <td class="specs-value fk-data">220 - 240 V</td> </tr> </table> <table cellspacing="0" class="fk-specs-type2"> <tr> <th class="group-head" colspan="2">Warranty</th> </tr> <tr class=""> <td class="specs-value fk-data" colspan="2">1 Year JSB India Warranty and Free Transit Insurance.</td> </tr> </table> </div>,10:03:2014,None
