LSTTOPDQX5GM3SGDETPDYFGSU,Morph Maternity Casual Women's Top,http://www.flipkart.com/womens-clothing?otracker=hp_nmenu_sub_women_0_Clothing,Rs. 522,Clothing,Maternity Wear,Adam N Eve,http://img6a.flixcart.com/image/top/m/w/b/ewtp572vkblk0-morph-maternity-l-400x400-imadrcqamdcnpne5.jpeg,Rs. 745,Black,women,http://www.flipkart.com/morph-maternity-casual-women-s-top/p/itmdqx5h2qcnuhu9?pid=TOPDQX5GM3SGDETP&srno=b_37&ref=fed54cfd-2ace-46b2-98ec-222b6756ef81,WS Retail,Morph Maternity Casual Women's Top - Buy Black Morph Maternity Casual Women's Top Online at Best Prices in India | Flipkart.com,Morph Maternity Casual Women's Top - Buy Black Morph Maternity Casual Women's Top For Only Rs. 745.0 Online in India. Shop Online For Apparels. Huge Collection of Branded Clothes Only at,['S'  'M'],None,<div class="item_left_column" id="specifications"> <h3 class="item_desc_title fk-uppercase">         Specifications of Morph Maternity Casual Women's Top    </h3> <table cellspacing="0" class="fk-specs-type2"> <tr> <th class="group-head" colspan="2">General Details<a class="see-more unitExt rmargin10 no-underline" href="javascript:void(0);" onclick="$(this).closest('.fk-specs-type2').toggleClass('expandedMore')" title="Expand">[+]</a><a class="hidden unitExt rmargin10 no-underline" href="javascript:void(0);" onclick="$(this).closest('.fk-specs-type2').toggleClass('expandedMore')" title="Collapse">[-]</a></th> </tr> <tr class="hidden"> <td class="specs-key">Ideal For</td> <td class="specs-value fk-data">Women's</td> </tr> <tr class="hidden"> <td class="specs-key">Occasion</td> <td class="specs-value fk-data">Casual</td> </tr> </table> <table cellspacing="0" class="fk-specs-type2"> <tr> <th class="group-head" colspan="2">Top Details</th> </tr> <tr class=""> <td class="specs-key">Fabric</td> <td class="specs-value fk-data">Knit Cotton</td> </tr> </table> <table cellspacing="0" class="fk-specs-type2"> <tr> <th class="group-head" colspan="2">Fabric Care</th> </tr> <tr class=""> <td class="specs-value fk-data" colspan="2">Hand or Machine Wash in Normal Cycle</td> </tr> </table> <table cellspacing="0" class="fk-specs-type2"> <tr> <th class="group-head" colspan="2">Additional Details<a class="see-more unitExt rmargin10 no-underline" href="javascript:void(0);" onclick="$(this).closest('.fk-specs-type2').toggleClass('expandedMore')" title="Expand">[+]</a><a class="hidden unitExt rmargin10 no-underline" href="javascript:void(0);" onclick="$(this).closest('.fk-specs-type2').toggleClass('expandedMore')" title="Collapse">[-]</a></th> </tr> <tr class="hidden"> <td class="specs-key"> </td> <td class="specs-value fk-data">Gathered Neck 3/4 Raglan sleeve Detailing at waist Fits elegantly during and post pregnancy</td> </tr> </table> </div>,10:03:2014,None
LSTLJGDS7RQN5N5NSDGTKRYJ3,Adam N Eve Women's Leggings,http://www.flipkart.com/womens-clothing?otracker=hp_nmenu_sub_women_0_Clothing,Rs. 349,Clothing,Maternity Wear,Adam N Eve,http://img5a.flixcart.com/image/legging-jegging/s/d/g/ae-780-grey-f-adam-n-eve-free-400x400-imads7vddpw4d8sc.jpeg,Rs. 599,Grey,women,http://www.flipkart.com/adam-n-eve-women-s-leggings/p/itmds7sds2u6qazn?pid=LJGDS7RQN5N5NSDG&srno=b_58&ref=1ea0d3f2-5416-43c4-ad7e-11db15e1ddbd,Fashionara,Adam N Eve Women's Leggings - Buy Grey Adam N Eve Women's Leggings Online at Best Prices in India | Flipkart.com,Adam N Eve Women's Leggings - Buy Grey Adam N Eve Women's Leggings For Only Rs. 0.0 Online in India. Shop Online For Apparels. Huge Collection of Branded Clothes Only at,[],<div class="item_left_column" id="description"> <h3 class="item_desc_title fk-uppercase">Adam N Eve Women's Leggings         Price: Rs.349</h3> <div class="cls"></div> <div class="item_desc_text line"> <div style="float:right"> </div>                         A closet staple to stock up during those winter days. This pair of leggings crafted from acrylic is just meant to give you extra warmth. Wear yours with your tunics or t- shirts with jackets or sweats to beat the cold and to look stylish.        </div> <div style="clear: both;"></div> </div>,<div class="item_left_column" id="specifications"> <h3 class="item_desc_title fk-uppercase">         Specifications of Adam N Eve Women's Leggings    </h3> <table cellspacing="0" class="fk-specs-type2"> <tr> <th class="group-head" colspan="2">General Details<a class="see-more unitExt rmargin10 no-underline" href="javascript:void(0);" onclick="$(this).closest('.fk-specs-type2').toggleClass('expandedMore')" title="Expand">[+]</a><a class="hidden unitExt rmargin10 no-underline" href="javascript:void(0);" onclick="$(this).closest('.fk-specs-type2').toggleClass('expandedMore')" title="Collapse">[-]</a></th> </tr> <tr class="hidden"> <td class="specs-key">Ideal For</td> <td class="specs-value fk-data">Women's</td> </tr> <tr class="hidden"> <td class="specs-key">Occasion</td> <td class="specs-value fk-data">Casual</td> </tr> <tr class="hidden"> <td class="specs-key">Pattern</td> <td class="specs-value fk-data">Solid</td> </tr> <tr class="hidden"> <td class="specs-key">Type</td> <td class="specs-value fk-data">Leggings</td> </tr> <tr class="hidden"> <td class="specs-key">Fabric</td> <td class="specs-value fk-data">Cotton</td> </tr> <tr class="hidden"> <td class="specs-key">Number of Contents in Sales Package</td> <td class="specs-value fk-data">Pack of 1</td> </tr> </table> <table cellspacing="0" class="fk-specs-type2"> <tr> <th class="group-head" colspan="2">Fabric Care</th> </tr> <tr class=""> <td class="specs-value fk-data" colspan="2">Warm iron  Machine wash  Wash with like colours  Acrylic</td> </tr> </table> </div>,10:03:2014,None
LSTLJGDTQFGQJ3UWHPW7TAEAP,Adam N Eve Women's Jeggings,http://www.flipkart.com/womens-clothing?otracker=hp_nmenu_sub_women_0_Clothing,Rs. 1699,Clothing,Maternity Wear,Adam N Eve,http://img5a.flixcart.com/image/legging-jegging/k/h/y/ae-792-dark-green-f-adam-n-eve-34-400x400-imadtqhhkmjpmdge.jpeg,Rs. 1699,Dark Green,women,http://www.flipkart.com/adam-n-eve-women-s-jeggings/p/itmdtqfgwhbazcw5?pid=LJGDTQFGQJ3UWHPW&srno=b_62&ref=94dfacb2-6286-444d-a0c3-e5d4c3394cf7,Fashionara,Adam N Eve Women's Jeggings - Buy Dark Green Adam N Eve Women's Jeggings Online at Best Prices in India | Flipkart.com,Adam N Eve Women's Jeggings - Buy Dark Green Adam N Eve Women's Jeggings For Only Rs. 1699.00 Online in India. Shop Online For Apparels. Huge Collection of Branded Clothes Only at,['30'  '32'  '34'],<div class="item_left_column" id="description"> <h3 class="item_desc_title fk-uppercase">Adam N Eve Women's Jeggings         Price: Rs.1699</h3> <div class="cls"></div> <div class="item_desc_text line"> <div style="float:right"> </div>                         Body hugging pair of jeggings that accentuate the curves on your legs. This super fine pair comes with two back pockets and side pockets. Diamante embellishments near the front pocket add a spark to the trendy pair.  Wear this pair with a casual printed crop top and oxford shoes.        </div> <div style="clear: both;"></div> </div>,<div class="item_left_column" id="specifications"> <h3 class="item_desc_title fk-uppercase">         Specifications of Adam N Eve Women's Jeggings    </h3> <table cellspacing="0" class="fk-specs-type2"> <tr> <th class="group-head" colspan="2">General Details<a class="see-more unitExt rmargin10 no-underline" href="javascript:void(0);" onclick="$(this).closest('.fk-specs-type2').toggleClass('expandedMore')" title="Expand">[+]</a><a class="hidden unitExt rmargin10 no-underline" href="javascript:void(0);" onclick="$(this).closest('.fk-specs-type2').toggleClass('expandedMore')" title="Collapse">[-]</a></th> </tr> <tr class="hidden"> <td class="specs-key">Ideal For</td> <td class="specs-value fk-data">Women's</td> </tr> <tr class="hidden"> <td class="specs-key">Occasion</td> <td class="specs-value fk-data">Casual</td> </tr> <tr class="hidden"> <td class="specs-key">Pattern</td> <td class="specs-value fk-data">Solid</td> </tr> <tr class="hidden"> <td class="specs-key">Type</td> <td class="specs-value fk-data">Jeggings</td> </tr> <tr class="hidden"> <td class="specs-key">Fabric</td> <td class="specs-value fk-data">Cotton</td> </tr> <tr class="hidden"> <td class="specs-key">Number of Contents in Sales Package</td> <td class="specs-value fk-data">Pack of 1</td> </tr> </table> <table cellspacing="0" class="fk-specs-type2"> <tr> <th class="group-head" colspan="2">Fabric Care</th> </tr> <tr class=""> <td class="specs-value fk-data" colspan="2">Hand/machine wash  Tumble dry low  Do not bleach  Wash dark colours separately  Warm iron if required</td> </tr> </table> <table cellspacing="0" class="fk-specs-type2"> <tr> <th class="group-head" colspan="2">In The Box</th> </tr> <tr class=""> <td class="specs-key"> </td> <td class="specs-value fk-data">Jeggings</td> </tr> </table> </div>,10:03:2014,None
LSTJEADSND64ZVCGR8YQ07TTB,Adam N Eve Regular Fit Women's Jeans,http://www.flipkart.com/womens-clothing?otracker=hp_nmenu_sub_women_0_Clothing,Rs. 999,Clothing,Maternity Wear,Adam N Eve,http://img5a.flixcart.com/image/jean/y/w/x/ae-894-blue-f-adam-n-eve-36-400x400-imadsngegv4aqqkr.jpeg,Rs. 1699,Blue,women,http://www.flipkart.com/adam-n-eve-regular-fit-women-s-jeans/p/itmdsnd98xjtbwcw?pid=JEADSND64ZVCGR8Y&srno=b_52&ref=1ea0d3f2-5416-43c4-ad7e-11db15e1ddbd,Fashionara,Adam N Eve Regular Fit Women's Jeans - Buy Blue Adam N Eve Regular Fit Women's Jeans Online at Best Prices in India | Flipkart.com,Adam N Eve Regular Fit Women's Jeans - Buy Blue Adam N Eve Regular Fit Women's Jeans For Only Rs. 0.0 Online in India. Shop Online For Apparels. Huge Collection of Branded Clothes Only at,['26'  '28'  '30'  '34'  '36'  '38'],<div class="item_left_column" id="description"> <h3 class="item_desc_title fk-uppercase">Adam N Eve Regular Fit Women's Jeans         Price: Rs.999</h3> <div class="cls"></div> <div class="item_desc_text line"> <div style="float:right"> </div>                         Who doesn't want a skinny pair of jeans that fits perfectly! Grab this pair today and be comfortably chic forever. The low waistline and the skinny fit define these jeans. Style it with a graphic tee and look casually cool.        </div> <div style="clear: both;"></div> </div>,<div class="item_left_column" id="specifications"> <h3 class="item_desc_title fk-uppercase">         Specifications of Adam N Eve Regular Fit Women's Jeans    </h3> <table cellspacing="0" class="fk-specs-type2"> <tr> <th class="group-head" colspan="2">General Details<a class="see-more unitExt rmargin10 no-underline" href="javascript:void(0);" onclick="$(this).closest('.fk-specs-type2').toggleClass('expandedMore')" title="Expand">[+]</a><a class="hidden unitExt rmargin10 no-underline" href="javascript:void(0);" onclick="$(this).closest('.fk-specs-type2').toggleClass('expandedMore')" title="Collapse">[-]</a></th> </tr> <tr class="hidden"> <td class="specs-key">Ideal For</td> <td class="specs-value fk-data">Women's</td> </tr> <tr class="hidden"> <td class="specs-key">Occasion</td> <td class="specs-value fk-data">Casual</td> </tr> </table> <table cellspacing="0" class="fk-specs-type2"> <tr> <th class="group-head" colspan="2">Jeans Details</th> </tr> <tr class=""> <td class="specs-key">Fabric</td> <td class="specs-value fk-data">Cotton</td> </tr> <tr class=""> <td class="specs-key">Fit</td> <td class="specs-value fk-data">Regular</td> </tr> <tr class=""> <td class="specs-key">Rise</td> <td class="specs-value fk-data">Low Rise</td> </tr> </table> <table cellspacing="0" class="fk-specs-type2"> <tr> <th class="group-head" colspan="2">Fabric Care</th> </tr> <tr class=""> <td class="specs-value fk-data" colspan="2">Warm Iron if Required  Wash with Like Colors  Machine Wash Cold  Tumble Dry on Low</td> </tr> </table> <table cellspacing="0" class="fk-specs-type2"> <tr> <th class="group-head" colspan="2">Additional Details<a class="see-more unitExt rmargin10 no-underline" href="javascript:void(0);" onclick="$(this).closest('.fk-specs-type2').toggleClass('expandedMore')" title="Expand">[+]</a><a class="hidden unitExt rmargin10 no-underline" href="javascript:void(0);" onclick="$(this).closest('.fk-specs-type2').toggleClass('expandedMore')" title="Collapse">[-]</a></th> </tr> <tr class="hidden"> <td class="specs-key">Style Code</td> <td class="specs-value fk-data">AE-894_Blue..F</td> </tr> <tr class="hidden"> <td class="specs-key">In the Box</td> <td class="specs-value fk-data"><ul><li>Jean</li></ul></td> </tr> </table> </div>,10:03:2014,None
LSTLJGDTQFGQGZDFWX3PF3FOR,Adam N Eve Women's Jeggings,http://www.flipkart.com/womens-clothing?otracker=hp_nmenu_sub_women_0_Clothing,Rs. 1699,Clothing,Maternity Wear,Adam N Eve,http://img5a.flixcart.com/image/legging-jegging/d/w/n/ae-953-dark-blue-f-adam-n-eve-30-400x400-imadtqhepzyqhx97.jpeg,Rs. 1699,Dark Blue,women,http://www.flipkart.com/adam-n-eve-women-s-jeggings/p/itmdtqfgf5uhqdkz?pid=LJGDTQFGQGZDFWX3&srno=b_63&ref=94dfacb2-6286-444d-a0c3-e5d4c3394cf7,Fashionara,Adam N Eve Women's Jeggings - Buy Dark Blue Adam N Eve Women's Jeggings Online at Best Prices in India | Flipkart.com,Adam N Eve Women's Jeggings - Buy Dark Blue Adam N Eve Women's Jeggings For Only Rs. 1699.00 Online in India. Shop Online For Apparels. Huge Collection of Branded Clothes Only at,['30'  '32'  '34'  '36'  '38'],<div class="item_left_column" id="description"> <h3 class="item_desc_title fk-uppercase">Adam N Eve Women's Jeggings         Price: Rs.1699</h3> <div class="cls"></div> <div class="item_desc_text line"> <div style="float:right"> </div>                         A slim and sassy pair that will make your legs look great! Feels like second skin  this pair comes in a cotton stretch material and an elasticated waist band that allows you to slip into them with ease. For a touch of trendy style this pair features zippers on the side and back ankle. Two back pockets that allow you to kip your lip gloss handy!  Wear this pair with a cute crop top and wedge heels for a daytime fabulous look.        </div> <div style="clear: both;"></div> </div>,<div class="item_left_column" id="specifications"> <h3 class="item_desc_title fk-uppercase">         Specifications of Adam N Eve Women's Jeggings    </h3> <table cellspacing="0" class="fk-specs-type2"> <tr> <th class="group-head" colspan="2">General Details<a class="see-more unitExt rmargin10 no-underline" href="javascript:void(0);" onclick="$(this).closest('.fk-specs-type2').toggleClass('expandedMore')" title="Expand">[+]</a><a class="hidden unitExt rmargin10 no-underline" href="javascript:void(0);" onclick="$(this).closest('.fk-specs-type2').toggleClass('expandedMore')" title="Collapse">[-]</a></th> </tr> <tr class="hidden"> <td class="specs-key">Ideal For</td> <td class="specs-value fk-data">Women's</td> </tr> <tr class="hidden"> <td class="specs-key">Occasion</td> <td class="specs-value fk-data">Casual</td> </tr> <tr class="hidden"> <td class="specs-key">Pattern</td> <td class="specs-value fk-data">Solid</td> </tr> <tr class="hidden"> <td class="specs-key">Type</td> <td class="specs-value fk-data">Jeggings</td> </tr> <tr class="hidden"> <td class="specs-key">Fabric</td> <td class="specs-value fk-data">Cotton</td> </tr> <tr class="hidden"> <td class="specs-key">Number of Contents in Sales Package</td> <td class="specs-value fk-data">Pack of 1</td> </tr> </table> <table cellspacing="0" class="fk-specs-type2"> <tr> <th class="group-head" colspan="2">Fabric Care</th> </tr> <tr class=""> <td class="specs-value fk-data" colspan="2">Hand/machine wash  Tumble dry low  Do not bleach  Wash dark colours separately  Warm iron if required</td> </tr> </table> <table cellspacing="0" class="fk-specs-type2"> <tr> <th class="group-head" colspan="2">In The Box</th> </tr> <tr class=""> <td class="specs-key"> </td> <td class="specs-value fk-data">Jeggings</td> </tr> </table> </div>,10:03:2014,None
LSTTRODSND7Z9BKFJWCNC3AYI,Adam N Eve Regular Fit Women's Trousers,http://www.flipkart.com/womens-clothing?otracker=hp_nmenu_sub_women_0_Clothing,Rs. 999,Clothing,Maternity Wear,Adam N Eve,http://img6a.flixcart.com/image/trouser/u/u/6/ae-911-light-green-f-adam-n-eve-26-400x400-imadsnetdzexknqj.jpeg,Rs. 1699,Light green,women,http://www.flipkart.com/adam-n-eve-regular-fit-women-s-trousers/p/itmdsndab9xwne87?pid=TRODSND7Z9BKFJWC&srno=b_44&ref=fed54cfd-2ace-46b2-98ec-222b6756ef81,Fashionara,Adam N Eve Regular Fit Women's Trousers - Buy Light green Adam N Eve Regular Fit Women's Trousers Online at Best Prices in India | Flipkart.com,Adam N Eve Regular Fit Women's Trousers - Buy Light green Adam N Eve Regular Fit Women's Trousers For Only Rs. 0.0 Online in India. Shop Online For Apparels. Huge Collection of Branded Clothes Only at,['28'  '32'  '34'],<div class="item_left_column" id="description"> <h3 class="item_desc_title fk-uppercase">Adam N Eve Regular Fit Women's Trousers         Price: Rs.999</h3> <div class="cls"></div> <div class="item_desc_text line"> <div style="float:right"> </div>                         A pair of leggings that will make you feel like no mile is too long! Created in a solid colour  these have a skinny fit and a great colour that add tonnes of spunk to a basic form with 5 pockets! Hand finished  these are in tune with trends! Wear these with a loose number jersey and boots!        </div> <div style="clear: both;"></div> </div>,<div class="item_left_column" id="specifications"> <h3 class="item_desc_title fk-uppercase">         Specifications of Adam N Eve Regular Fit Women's Trousers    </h3> <table cellspacing="0" class="fk-specs-type2"> <tr> <th class="group-head" colspan="2">General Details<a class="see-more unitExt rmargin10 no-underline" href="javascript:void(0);" onclick="$(this).closest('.fk-specs-type2').toggleClass('expandedMore')" title="Expand">[+]</a><a class="hidden unitExt rmargin10 no-underline" href="javascript:void(0);" onclick="$(this).closest('.fk-specs-type2').toggleClass('expandedMore')" title="Collapse">[-]</a></th> </tr> <tr class="hidden"> <td class="specs-key">Ideal For</td> <td class="specs-value fk-data">Women's</td> </tr> <tr class="hidden"> <td class="specs-key">Occasion</td> <td class="specs-value fk-data">Casual</td> </tr> <tr class="hidden"> <td class="specs-key">Pattern</td> <td class="specs-value fk-data">Solid</td> </tr> </table> <table cellspacing="0" class="fk-specs-type2"> <tr> <th class="group-head" colspan="2">Trouser Details</th> </tr> <tr class=""> <td class="specs-key">Fabric</td> <td class="specs-value fk-data">Cotton</td> </tr> <tr class=""> <td class="specs-key">Fit</td> <td class="specs-value fk-data">Regular Fit</td> </tr> </table> <table cellspacing="0" class="fk-specs-type2"> <tr> <th class="group-head" colspan="2">Fabric Care</th> </tr> <tr class=""> <td class="specs-value fk-data" colspan="2">Warm iron if needed  Machine wash  Wash with like colours  Material: 95%Cotton 5% stretch  Colour may bleed</td> </tr> </table> <table cellspacing="0" class="fk-specs-type2"> <tr> <th class="group-head" colspan="2">Additional Details<a class="see-more unitExt rmargin10 no-underline" href="javascript:void(0);" onclick="$(this).closest('.fk-specs-type2').toggleClass('expandedMore')" title="Expand">[+]</a><a class="hidden unitExt rmargin10 no-underline" href="javascript:void(0);" onclick="$(this).closest('.fk-specs-type2').toggleClass('expandedMore')" title="Collapse">[-]</a></th> </tr> <tr class="hidden"> <td class="specs-key">Style Code</td> <td class="specs-value fk-data">AE-911_Light Green..F</td> </tr> </table> <table cellspacing="0" class="fk-specs-type2"> <tr> <th class="group-head" colspan="2">In the Box</th> </tr> <tr class=""> <td class="specs-key"> </td> <td class="specs-value fk-data">Trouser</td> </tr> </table> </div>,10:03:2014,None
LSTLJGDTQFGXMGH6PSBNFI9FQ,Adam N Eve Women's Jeggings,http://www.flipkart.com/womens-clothing?otracker=hp_nmenu_sub_women_0_Clothing,Rs. 1699,Clothing,Maternity Wear,Adam N Eve,http://img6a.flixcart.com/image/legging-jegging/z/w/3/ae-950-beige-f-adam-n-eve-36-400x400-imadtqhuye6ntxxz.jpeg,Rs. 1699,Beige,women,http://www.flipkart.com/adam-n-eve-women-s-jeggings/p/itmdtqfgjhgxfuaj?pid=LJGDTQFGXMGH6PSB&srno=b_65&ref=94dfacb2-6286-444d-a0c3-e5d4c3394cf7,Fashionara,Adam N Eve Women's Jeggings - Buy Beige Adam N Eve Women's Jeggings Online at Best Prices in India | Flipkart.com,Adam N Eve Women's Jeggings - Buy Beige Adam N Eve Women's Jeggings For Only Rs. 1699.00 Online in India. Shop Online For Apparels. Huge Collection of Branded Clothes Only at,['30'  '32'  '34'  '36'  '38'],<div class="item_left_column" id="description"> <h3 class="item_desc_title fk-uppercase">Adam N Eve Women's Jeggings         Price: Rs.1699</h3> <div class="cls"></div> <div class="item_desc_text line"> <div style="float:right"> </div>                         A slim and sassy pair that will make your legs look great! Feels like second skin  this pair comes in a cotton stretch material and an elasticated waist band that allows you to slip into them with ease. For a touch of trendy style this pair features zippers on the side and back ankle. Two back pockets that allow you to kip your lip gloss handy!  Wear this pair with a cute crop top and wedge heels for a daytime fabulous look.        </div> <div style="clear: both;"></div> </div>,<div class="item_left_column" id="specifications"> <h3 class="item_desc_title fk-uppercase">         Specifications of Adam N Eve Women's Jeggings    </h3> <table cellspacing="0" class="fk-specs-type2"> <tr> <th class="group-head" colspan="2">General Details<a class="see-more unitExt rmargin10 no-underline" href="javascript:void(0);" onclick="$(this).closest('.fk-specs-type2').toggleClass('expandedMore')" title="Expand">[+]</a><a class="hidden unitExt rmargin10 no-underline" href="javascript:void(0);" onclick="$(this).closest('.fk-specs-type2').toggleClass('expandedMore')" title="Collapse">[-]</a></th> </tr> <tr class="hidden"> <td class="specs-key">Ideal For</td> <td class="specs-value fk-data">Women's</td> </tr> <tr class="hidden"> <td class="specs-key">Occasion</td> <td class="specs-value fk-data">Casual</td> </tr> <tr class="hidden"> <td class="specs-key">Pattern</td> <td class="specs-value fk-data">Solid</td> </tr> <tr class="hidden"> <td class="specs-key">Type</td> <td class="specs-value fk-data">Jeggings</td> </tr> <tr class="hidden"> <td class="specs-key">Fabric</td> <td class="specs-value fk-data">Cotton</td> </tr> <tr class="hidden"> <td class="specs-key">Number of Contents in Sales Package</td> <td class="specs-value fk-data">Pack of 1</td> </tr> </table> <table cellspacing="0" class="fk-specs-type2"> <tr> <th class="group-head" colspan="2">Fabric Care</th> </tr> <tr class=""> <td class="specs-value fk-data" colspan="2">Hand/machine wash  Tumble dry low  Do not bleach  Wash dark colours separately  Warm iron if required</td> </tr> </table> <table cellspacing="0" class="fk-specs-type2"> <tr> <th class="group-head" colspan="2">In The Box</th> </tr> <tr class=""> <td class="specs-key"> </td> <td class="specs-value fk-data">Jeggings</td> </tr> </table> </div>,10:03:2014,None
