LSTMASDSFH7UX63RQQTKPGLKV,Healthline BM-15 Multi Function Pillow Massager,http://www.flipkart.com/health-and-beauty?otracker=hp_nmenu_sub_women_0_Beauty%20and%20Wellness,Rs. 4200,Beauty and Wellness,Health Care Devices,Healthline,http://img6a.flixcart.com/image/massager/q/q/t/healthline-multi-function-pillow-bm-15-400x400-imadsfq3hgf6h32t.jpeg,Rs. 5200,None,women,http://www.flipkart.com/healthline-bm-15-multi-function-pillow-massager/p/itmdsfwyfvqd88z5?pid=MASDSFH7UX63RQQT&srno=b_5&ref=0c734668-45ed-4824-aa1f-f097e8ef9951,WS Retail,Healthline BM-15 Multi Function Pillow Massager - Healthline: Flipkart.com,Buy Healthline BM-15 Multi Function Pillow Massager only for Rs. 4200.0 from Flipkart.com. Only Genuine Products. 30 Day Replacement Guarantee. Free Shipping. Cash On,[],<div class="item_left_column" id="description"> <h3 class="item_desc_title fk-uppercase">Healthline BM-15 Multi Function Pillow Massager (Grey)         Price: Rs.4200</h3> <div class="cls"></div> <div class="item_desc_text line"> <div style="float:right"> </div>                         Healthline BM-15 Rotating Massage Pillow. Healthline BM15 beautiful kneading rotating massage pillow  with its ultra-thin and light weight design  brings steady  relaxing massage to tired muscles. Your neck  shoulders and back will sigh with relief when you sooth them with the Healthline BM15 kneading rotating massage pillow but don???t neglect your legs and abdomen they will appreciate the kneading massage as well. The BM-15 kneading massage cushion???s shiatsu massage mechanism delivers a relaxing kneading massage just where you need it  it can be used for vehicle  office and home. Setting a stripe is built in the back of the cushion for convenient mount to car seat.        </div> <div style="clear: both;"></div> </div>,<div class="item_left_column" id="specifications"> <h3 class="item_desc_title fk-uppercase">         Specifications of Healthline BM-15 Multi Function Pillow Massager (Grey)    </h3> <table cellspacing="0" class="fk-specs-type2"> <tr> <th class="group-head" colspan="2">In The Box</th> </tr> <tr class=""> <td class="specs-key">Sales Package</td> <td class="specs-value fk-data">Car Adapter  Power Adapter  BM15 Massager  User Manual</td> </tr> </table> <table cellspacing="0" class="fk-specs-type2"> <tr> <th class="group-head" colspan="2">Product Details</th> </tr> <tr class=""> <td class="specs-key">Type</td> <td class="specs-value fk-data">Back  Leg  Foot  Waist  Neck</td> </tr> <tr class=""> <td class="specs-key">Model Name</td> <td class="specs-value fk-data">Multi Function Pillow</td> </tr> <tr class=""> <td class="specs-key">Color</td> <td class="specs-value fk-data">Grey</td> </tr> <tr class=""> <td class="specs-key">Model Id</td> <td class="specs-value fk-data">BM-15</td> </tr> <tr class=""> <td class="specs-key">Brand</td> <td class="specs-value fk-data">Healthline</td> </tr> </table> <table cellspacing="0" class="fk-specs-type2"> <tr> <th class="group-head" colspan="2">Power Requirements</th> </tr> <tr class=""> <td class="specs-key">Power Source</td> <td class="specs-value fk-data">Power Adapter  Car Adapter</td> </tr> <tr class=""> <td class="specs-key">Power Consumption (Watts)</td> <td class="specs-value fk-data">25 W</td> </tr> <tr class=""> <td class="specs-key">Power Required (Volts)</td> <td class="specs-value fk-data">220 V</td> </tr> </table> </div>,10:03:2014,None
LSTMASDQKTFJKXZTGMUTXYINZ,Healthline MM03 Massager,http://www.flipkart.com/health-and-beauty?otracker=hp_nmenu_sub_women_0_Beauty%20and%20Wellness,Rs. 756,Beauty and Wellness,Health Care Devices,Healthline,http://img6a.flixcart.com/image/massager/g/m/u/healthline-mm03-400x400-imadqz24aggzjdb8.jpeg,Rs. 999,None,women,http://www.flipkart.com/healthline-mm03-massager/p/itmdqktgwf7ahxhd?pid=MASDQKTFJKXZTGMU&srno=b_3&ref=0c734668-45ed-4824-aa1f-f097e8ef9951,WS Retail,Healthline MM03 Massager - Healthline: Flipkart.com,Buy Healthline MM03 Massager only for Rs. 756.0 from Flipkart.com. Only Genuine Products. 30 Day Replacement Guarantee. Free Shipping. Cash On,[],<div class="item_left_column" id="description"> <h3 class="item_desc_title fk-uppercase">                 Key Features of Healthline MM03 Massager            </h3> <div class="cls"></div> <div class="item_desc_text"> <ul class="fk-key-features"> <li>Directly use from Plug)</li><li>Light and Compact</li><li>Gentle Vibration Massage</li><li>3 Power Source Option: (Battery Powered</li><li>USB Cable and Power Adapter Option</li><li>Single Massage Function</li><li>3 Alkaline AAA Batteries</li><li>3 LED Illuminated Massage Heads</li><li>USB Cable Connected to Laptop / Desktop</li> </ul> </div> <div style="clear: both;"></div> </div>,<div class="item_left_column" id="specifications"> <h3 class="item_desc_title fk-uppercase">         Specifications of Healthline MM03 Massager    </h3> <table cellspacing="0" class="fk-specs-type2"> <tr> <th class="group-head" colspan="2">In The Box</th> </tr> <tr class=""> <td class="specs-key">Sales Package</td> <td class="specs-value fk-data">Main Unit  Warranty Card  User Manual</td> </tr> </table> <table cellspacing="0" class="fk-specs-type2"> <tr> <th class="group-head" colspan="2">Product Details</th> </tr> <tr class=""> <td class="specs-key">Type</td> <td class="specs-value fk-data">Neck||Back||Arms||Shoulder||Leg</td> </tr> <tr class=""> <td class="specs-key">Model Id</td> <td class="specs-value fk-data">MM03</td> </tr> <tr class=""> <td class="specs-key">Brand</td> <td class="specs-value fk-data">Healthline</td> </tr> </table> </div>,10:03:2014,None
LSTMASDSFH7VHSFSHN4E0KZPH,Healthline HM-12 Infrared Body Massager,http://www.flipkart.com/health-and-beauty?otracker=hp_nmenu_sub_women_0_Beauty%20and%20Wellness,Rs. 3450,Beauty and Wellness,Health Care Devices,Healthline,http://img5a.flixcart.com/image/massager/h/n/4/healthline-infrared-body-hm-12-400x400-imadsfq3udgfg8ga.jpeg,Rs. 4200,None,women,http://www.flipkart.com/healthline-hm-12-infrared-body-massager/p/itmdsfwyyfgw9zwt?pid=MASDSFH7VHSFSHN4&srno=b_4&ref=0c734668-45ed-4824-aa1f-f097e8ef9951,WS Retail,Healthline HM-12 Infrared Body Massager - Healthline: Flipkart.com,Buy Healthline HM-12 Infrared Body Massager only for Rs. 3450.0 from Flipkart.com. Only Genuine Products. 30 Day Replacement Guarantee. Free Shipping. Cash On,[],<div class="item_left_column" id="description"> <h3 class="item_desc_title fk-uppercase">Healthline HM-12 Infrared Body Massager (Grey)         Price: Rs.3450</h3> <div class="cls"></div> <div class="item_desc_text line"> <div style="float:right"> </div>                         Healthline HM-12 Infrared Body Massager. The Healthline HM12 Infrared Massager features powerful tapping massage for improved effectiveness. The percussion massage head provides extra soothing and relaxing therapy for aching and tired muscles. The removable extension handle caters for inaccessible back and leg areas. Remove the handle for direct and powerful application to accessible areas. The massage intensity can be infinitely adjusted with the rotary dial. In addition  the application of infrared heat reinforces the effect of the massage delivered not only by warming the surface of the skin but also by promoting circulation in the area. This enables the massage to reach deeper layers of tissue and muscles aiding the natural healing process. The ergonomic shape and the well-shaped handle make the unit a joy to use. To provide extra versatility the unit is supplied with two interchangeable heads one of which has reflexology style nodules. Functions - Detachable Handle. It has a long  non-slip handle for safe handling and hard to reach places and is easily detachable for intensive handheld therap. Infrared Heat. Infrared Heat increases the relaxation benefits infinitely. It is perfect for firming  toning and relaxation with hot and/or cold massage. Variable Massage Effects. It features infrared heat option  2 removable massage head attachments for variable massage effects and smooth and variable massage        </div> <div style="clear: both;"></div> </div>,<div class="item_left_column" id="specifications"> <h3 class="item_desc_title fk-uppercase">         Specifications of Healthline HM-12 Infrared Body Massager (Grey)    </h3> <table cellspacing="0" class="fk-specs-type2"> <tr> <th class="group-head" colspan="2">In The Box</th> </tr> <tr class=""> <td class="specs-key">Sales Package</td> <td class="specs-value fk-data">HM12 Massager  Power Adapter  2 Interchangeable Massage patches  User Manual</td> </tr> </table> <table cellspacing="0" class="fk-specs-type2"> <tr> <th class="group-head" colspan="2">Product Details</th> </tr> <tr class=""> <td class="specs-key">Type</td> <td class="specs-value fk-data">Body</td> </tr> <tr class=""> <td class="specs-key">Model Name</td> <td class="specs-value fk-data">Infrared Body</td> </tr> <tr class=""> <td class="specs-key">Color</td> <td class="specs-value fk-data">Grey</td> </tr> <tr class=""> <td class="specs-key">Model Id</td> <td class="specs-value fk-data">HM-12</td> </tr> <tr class=""> <td class="specs-key">Brand</td> <td class="specs-value fk-data">Healthline</td> </tr> </table> <table cellspacing="0" class="fk-specs-type2"> <tr> <th class="group-head" colspan="2">Power Requirements</th> </tr> <tr class=""> <td class="specs-key">Power Source</td> <td class="specs-value fk-data">AC Adapter</td> </tr> <tr class=""> <td class="specs-key">Power Consumption (Watts)</td> <td class="specs-value fk-data">25 W</td> </tr> <tr class=""> <td class="specs-key">Power Required (Volts)</td> <td class="specs-value fk-data">220 V</td> </tr> </table> </div>,10:03:2014,None
LSTBFADJSBSDEQXGYUQ21J5EF,Healthline BF-212 Body Fat Analyzer,http://www.flipkart.com/health-and-beauty?otracker=hp_nmenu_sub_women_0_Beauty%20and%20Wellness,Rs. 2135,Beauty and Wellness,Health Care Devices,Healthline,http://img6a.flixcart.com/image/body-fat-analyzer/y/u/q/healthline-bf-212-400x400-imadjscm4hmefbv8.jpeg,Rs. 3500,None,women,http://www.flipkart.com/healthline-bf-212-body-fat-analyzer/p/itmdjsbxkwgfgkhd?pid=BFADJSBSDEQXGYUQ&srno=b_2&ref=0c734668-45ed-4824-aa1f-f097e8ef9951,WS Retail,Healthline BF-212 Body Fat Analyzer - Healthline: Flipkart.com,Buy Healthline BF-212 Body Fat Analyzer only for Rs. 2135.0 from Flipkart.com. Only Genuine Products. 30 Day Replacement Guarantee. Free Shipping. Cash On,[],<div class="item_left_column" id="description"> <h3 class="item_desc_title fk-uppercase">                 Key Features of Healthline BF-212 Body Fat Analyzer            </h3> <div class="cls"></div> <div class="item_desc_text"> <ul class="fk-key-features"> <li>150 kg Maximum Weight</li><li>8 Users Memory</li><li>Body Fat Percentage</li><li>6 mm Tempered Glass</li><li>BIA Technology</li><li>Athlete Mode Function</li> </ul> </div> <div style="clear: both;"></div> </div>,<div class="item_left_column" id="specifications"> <h3 class="item_desc_title fk-uppercase">         Specifications of Healthline BF-212 Body Fat Analyzer    </h3> <table cellspacing="0" class="fk-specs-type2"> <tr> <th class="group-head" colspan="2">In The Box</th> </tr> <tr class=""> <td class="specs-key">Sales Package</td> <td class="specs-value fk-data">Main Unit  2 Batteries  User Manual</td> </tr> </table> <table cellspacing="0" class="fk-specs-type2"> <tr> <th class="group-head" colspan="2">General</th> </tr> <tr class=""> <td class="specs-key">Age Range</td> <td class="specs-value fk-data">01/06/00 Years</td> </tr> <tr class=""> <td class="specs-key">Method of Measurement</td> <td class="specs-value fk-data">Bioelectrical Impedance Analysis (BIA)</td> </tr> <tr class=""> <td class="specs-key">Maximum Weight Capacity</td> <td class="specs-value fk-data">150 kg</td> </tr> <tr class=""> <td class="specs-key">Operation Modes</td> <td class="specs-value fk-data">Weight Only  Athlete</td> </tr> <tr class=""> <td class="specs-key">Input Required</td> <td class="specs-value fk-data">Age  Gender  Height</td> </tr> <tr class=""> <td class="specs-key">Accuracy</td> <td class="specs-value fk-data">0.1 kg</td> </tr> </table> <table cellspacing="0" class="fk-specs-type2"> <tr> <th class="group-head" colspan="2">Functions</th> </tr> <tr class=""> <td class="specs-key">Body Weight</td> <td class="specs-value fk-data">Yes</td> </tr> <tr class=""> <td class="specs-key">Basal Metabolic Rate (BMR)</td> <td class="specs-value fk-data">Yes</td> </tr> <tr class=""> <td class="specs-key">Body Fat Percentage</td> <td class="specs-value fk-data">Yes</td> </tr> <tr class=""> <td class="specs-key">Other Functions</td> <td class="specs-value fk-data">Body Water Level  Muscle Mass  Bone Mass</td> </tr> </table> <table cellspacing="0" class="fk-specs-type2"> <tr> <th class="group-head" colspan="2">Display</th> </tr> <tr class=""> <td class="specs-key">Readings Displayed</td> <td class="specs-value fk-data">Weight  Body Fat  Water Level Display  Muscle Mass  Bone Mass</td> </tr> </table> <table cellspacing="0" class="fk-specs-type2"> <tr> <th class="group-head" colspan="2">Convenience Features</th> </tr> <tr class=""> <td class="specs-key">Memory</td> <td class="specs-value fk-data">Memory Support with 8 Memory Presets</td> </tr> </table> <table cellspacing="0" class="fk-specs-type2"> <tr> <th class="group-head" colspan="2">Power</th> </tr> <tr class=""> <td class="specs-key">Powered By</td> <td class="specs-value fk-data">Battery</td> </tr> <tr class=""> <td class="specs-key">Power Required</td> <td class="specs-value fk-data">6 V</td> </tr> <tr class=""> <td class="specs-key">Batteries Required</td> <td class="specs-value fk-data">2</td> </tr> </table> <table cellspacing="0" class="fk-specs-type2"> <tr> <th class="group-head" colspan="2">Additional Features</th> </tr> <tr class=""> <td class="specs-value fk-data" colspan="2">Body Fat Percentage Range: (3 - 50%  Graduation 0.1%)  Basal Metabolism Range: (0 - 3640 kcal  Graduation 1 kcal)  Water Percentage Range: (25 - 75%  Graduation 0.1%)  Muscle Mass Percentage Range: (25 - 75%  Graduation 0.1%)  Bone Weight Range: (0.5 - 10 kg  Graduation 0.1 kg)  Height Range: 80 - 220 cm  Automatic Identification of the User based on Weight Reading  2 CR2032 Lithium Battery  Battery Life - 1 Year (with 3 Measurement / Day)  Special Features for People Engage in Approximately 12 hrs of Intense Physical Activity per Week  Having a Resting Heart Rate of Approximately 60 beats per minute or Less  Minimum Weight Display: 5 kg</td> </tr> </table> <table cellspacing="0" class="fk-specs-type2"> <tr> <th class="group-head" colspan="2">Dimensions</th> </tr> <tr class=""> <td class="specs-key">Weight</td> <td class="specs-value fk-data">1.93</td> </tr> </table> </div>,10:03:2014,None
LSTWSLDZD2K76RD6JXNH2Z9IA,Healthline Weight Tracker Weighing Scale,http://www.flipkart.com/health-and-beauty?otracker=hp_nmenu_sub_women_0_Beauty%20and%20Wellness,Rs. 1100,Beauty and Wellness,Health Care Devices,Healthline,http://img5a.flixcart.com/image/weighing-scale/j/x/n/bs-21-healthline-weight-tracker-400x400-imadzdpqdtzshznv.jpeg,Rs. 1800,None,women,http://www.flipkart.com/healthline-weight-tracker-weighing-scale/p/itmdzd2zjhwtqpff?pid=WSLDZD2K76RD6JXN&srno=b_8&ref=0c734668-45ed-4824-aa1f-f097e8ef9951,HealthlineStore,Healthline Weight Tracker Weighing Scale: Flipkart.com,Flipkart.com,[],<div class="item_left_column" id="description"> <h3 class="item_desc_title fk-uppercase">Healthline Weight Tracker Weighing Scale (Grey  White)         Price: Rs.1100</h3> <div class="cls"></div> <div class="item_desc_text line"> <div style="float:right"> </div>                         Healthline presents skid - proof design digital body weighing scale for daily weight track.        </div> <div style="clear: both;"></div> </div>,<div class="item_left_column" id="specifications"> <h3 class="item_desc_title fk-uppercase">         Specifications of Healthline Weight Tracker Weighing Scale (Grey  White)    </h3> <table cellspacing="0" class="fk-specs-type2"> <tr> <th class="group-head" colspan="2">In the Box</th> </tr> <tr class=""> <td class="specs-key">Sales Package</td> <td class="specs-value fk-data">1 CR2032 Battery  Weighing Scale  User Manual</td> </tr> </table> <table cellspacing="0" class="fk-specs-type2"> <tr> <th class="group-head" colspan="2">General</th> </tr> <tr class=""> <td class="specs-key">Type</td> <td class="specs-value fk-data">Personal Weighing Scale</td> </tr> <tr class=""> <td class="specs-key">Model Number</td> <td class="specs-value fk-data">BS-21</td> </tr> <tr class=""> <td class="specs-key">Material</td> <td class="specs-value fk-data">Skid Proof Glass</td> </tr> <tr class=""> <td class="specs-key">Units of Measurement</td> <td class="specs-value fk-data">kg  lb</td> </tr> <tr class=""> <td class="specs-key">Maximum Weighing Capacity</td> <td class="specs-value fk-data">150 kg</td> </tr> <tr class=""> <td class="specs-key">Accuracy</td> <td class="specs-value fk-data">0.2 g</td> </tr> <tr class=""> <td class="specs-key">Tare Function</td> <td class="specs-value fk-data">Yes</td> </tr> </table> <table cellspacing="0" class="fk-specs-type2"> <tr> <th class="group-head" colspan="2">Display Features</th> </tr> <tr class=""> <td class="specs-key">Display Type</td> <td class="specs-value fk-data">Digital</td> </tr> <tr class=""> <td class="specs-key">Display Size</td> <td class="specs-value fk-data">76 x 40 mm</td> </tr> </table> <table cellspacing="0" class="fk-specs-type2"> <tr> <th class="group-head" colspan="2">Power Features</th> </tr> <tr class=""> <td class="specs-key">Powered By</td> <td class="specs-value fk-data">CR2032 Battery</td> </tr> <tr class=""> <td class="specs-key">Battery Requirements</td> <td class="specs-value fk-data">1 Lithium Ion Battery</td> </tr> </table> <table cellspacing="0" class="fk-specs-type2"> <tr> <th class="group-head" colspan="2">Dimensions</th> </tr> <tr class=""> <td class="specs-key">Width</td> <td class="specs-value fk-data">300 mm</td> </tr> <tr class=""> <td class="specs-key">Height</td> <td class="specs-value fk-data">300 mm</td> </tr> <tr class=""> <td class="specs-key">Depth</td> <td class="specs-value fk-data">19 mm</td> </tr> <tr class=""> <td class="specs-key">Platter Width</td> <td class="specs-value fk-data">10 mm</td> </tr> <tr class=""> <td class="specs-key">Weight</td> <td class="specs-value fk-data">1500 g</td> </tr> </table> <table cellspacing="0" class="fk-specs-type2"> <tr> <th class="group-head" colspan="2">Warranty</th> </tr> <tr class=""> <td class="specs-key">Warranty Summary</td> <td class="specs-value fk-data">1 Year Offsite Carry in Warranty</td> </tr> <tr class=""> <td class="specs-key">Covered in Warranty</td> <td class="specs-value fk-data">Manufacturing Defects Only</td> </tr> <tr class=""> <td class="specs-key">Not Covered in Warranty</td> <td class="specs-value fk-data">Physical Damage  Breakage</td> </tr> <tr class=""> <td class="specs-key">Warranty Service Type</td> <td class="specs-value fk-data">Off-site Carry in</td> </tr> </table> </div>,10:03:2014,None
LSTPDODBE3ED8ZVVYF5KRJMQJ,Healthline PD-09 Walk Style 3D Pedometer,http://www.flipkart.com/health-and-beauty?otracker=hp_nmenu_sub_women_0_Beauty%20and%20Wellness,Rs. 1100,Beauty and Wellness,Health Care Devices,Healthline,http://img6a.flixcart.com/image/pedometer/y/f/5/healthline-pd-09-walk-style-3d-400x400-imadbkqunbv3jhgu.jpeg,Rs. 1800,None,women,http://www.flipkart.com/healthline-pd-09-walk-style-3d-pedometer/p/itmdbe4399ayasyh?pid=PDODBE3ED8ZVVYF5&srno=b_1&ref=0c734668-45ed-4824-aa1f-f097e8ef9951,HealthlineStore,Healthline PD-09 Walk Style 3D Pedometer - Healthline: Flipkart.com,Buy Healthline PD-09 Walk Style 3D Pedometer only for Rs. 1304.0 from Flipkart.com. Only Genuine Products. 30 Day Replacement Guarantee. Free Shipping. Cash On,[],<div class="item_left_column" id="description"> <h3 class="item_desc_title fk-uppercase">                 Key Features of Healthline PD-09 Walk Style 3D Pedometer            </h3> <div class="cls"></div> <div class="item_desc_text"> <ul class="fk-key-features"> <li>3D Smart Sensor</li><li>7 Days Memory Record</li><li>3 V Lithium CR2032 Battery</li> </ul> </div> <div style="clear: both;"></div> </div>,<div class="item_left_column" id="specifications"> <h3 class="item_desc_title fk-uppercase">         Specifications of Healthline PD-09 Walk Style 3D Pedometer    </h3> <table cellspacing="0" class="fk-specs-type2"> <tr> <th class="group-head" colspan="2">In The Box</th> </tr> <tr class=""> <td class="specs-key">Sales Package</td> <td class="specs-value fk-data">Main Unit  Belt Clip Holder  3 V Lithium Battery  User Manual</td> </tr> </table> <table cellspacing="0" class="fk-specs-type2"> <tr> <th class="group-head" colspan="2">General</th> </tr> <tr class=""> <td class="specs-key">Sensing Technology</td> <td class="specs-value fk-data">3D Smart Sensor</td> </tr> </table> <table cellspacing="0" class="fk-specs-type2"> <tr> <th class="group-head" colspan="2">Functions</th> </tr> <tr class=""> <td class="specs-key">Step Count</td> <td class="specs-value fk-data">Yes</td> </tr> <tr class=""> <td class="specs-key">Walking time</td> <td class="specs-value fk-data">Yes</td> </tr> <tr class=""> <td class="specs-key">Distance Travelled</td> <td class="specs-value fk-data">Yes</td> </tr> <tr class=""> <td class="specs-key">Calories Burnt</td> <td class="specs-value fk-data">Yes</td> </tr> </table> <table cellspacing="0" class="fk-specs-type2"> <tr> <th class="group-head" colspan="2">Memory Details</th> </tr> <tr class=""> <td class="specs-key">Memory Record</td> <td class="specs-value fk-data">7</td> </tr> </table> <table cellspacing="0" class="fk-specs-type2"> <tr> <th class="group-head" colspan="2">Convenience Features</th> </tr> <tr class=""> <td class="specs-key">Clock</td> <td class="specs-value fk-data">24 hours  Clock</td> </tr> <tr class=""> <td class="specs-key">Reset Function</td> <td class="specs-value fk-data">Yes</td> </tr> <tr class=""> <td class="specs-key">Pedometer Placement</td> <td class="specs-value fk-data">Carry in Pocket  Bag  Purse  Clipped to Belt</td> </tr> </table> <table cellspacing="0" class="fk-specs-type2"> <tr> <th class="group-head" colspan="2">Power</th> </tr> <tr class=""> <td class="specs-key">Battery</td> <td class="specs-value fk-data">Lithium CR2032</td> </tr> <tr class=""> <td class="specs-key">Battery Life</td> <td class="specs-value fk-data">1 Years</td> </tr> </table> <table cellspacing="0" class="fk-specs-type2"> <tr> <th class="group-head" colspan="2">Additional Features</th> </tr> <tr class=""> <td class="specs-key">Other Features</td> <td class="specs-value fk-data"><ul><li>Two Rows Large Scale Display  Time Display in 12/24 hr Display Format  Exercise Timer  Imperial and Metric System Option  3V Lithium Battery  Target Step Count Feature</li></ul></td> </tr> </table> <table cellspacing="0" class="fk-specs-type2"> <tr> <th class="group-head" colspan="2">Dimension</th> </tr> <tr class=""> <td class="specs-key">Width x Height x Depth</td> <td class="specs-value fk-data">32 x 12 x 31.4 mm</td> </tr> <tr class=""> <td class="specs-key">Weight</td> <td class="specs-value fk-data">77 gms</td> </tr> </table> <table cellspacing="0" class="fk-specs-type2"> <tr> <th class="group-head" colspan="2">Warranty</th> </tr> <tr class=""> <td class="specs-key">Domestic Term</td> <td class="specs-value fk-data">1 Year</td> </tr> </table> </div>,10:03:2014,None
