LSTHMBDZ7KAKUQHA4DY6ZPXZW,AAR Posh and Royal Look Hand Bag,http://www.flipkart.com/lifestyle/bags-wallets-belts/women?otracker=hp_nmenu_sub_women_0_Bags%2C%20Belts%20and%20wallets,Rs. 1568,Bags  Belts and wallets,View All,AAR,http://img5a.flixcart.com/image/hand-messenger-bag/4/d/y/aarhbblk60073-aar-hand-bag-posh-and-royal-look-400x400-imadqyqzz3mwzjtz.jpeg,Rs. 1960,Black,women,http://www.flipkart.com/aar-posh-royal-look-hand-bag/p/itmdpznct2f7zds3?pid=HMBDZ7KAKUQHA4DY&srno=b_5&ref=9b4c4009-2e00-4a58-9bb8-2516191d3c9e,KhoobSurati,AAR Posh and Royal Look Hand Bag Black - Price in India | Flipkart.com,Flipkart.com: Buy AAR Posh and Royal Look Hand Bag for Rs. 1568 from Flipkart.com. Only Genuine Products. 30 Day Replacement Guarantee. Free Shipping. Cash On,[],<div class="item_left_column" id="description"> <h3 class="item_desc_title fk-uppercase">AAR Posh and Royal Look Hand Bag (Black)         Price: Rs.1568</h3> <div class="cls"></div> <div class="item_desc_text line"> <div style="float:right"> </div>                         Add more appeal to your looks with this astonishingly stylish ladies handbag from AAR  It has a simple yet stylish design and a pleasant Color - . Suiting almost every outfit  this leather handbag gives an alluring touch to your appearance. Buy this handbag for women online now which is available in different Colors. Features : Prepared using high-quality leather  Stylish design having trendy flaps  Amply spacious along with plenty of pockets  Endures for a significantly long time even on rough usage  Disclaimer : Product Color - may slightly vary due to photographic lighting sources or your monitor settings. Specifications : Material - Leather  Dimensions (inch) - Approx 20x13x5.5(LxHxB)  Colors  Black  Waterproof - Yes  No. Of Pockets Inside - 3  No. Of Pockets Outside - 2  Mesh Pocket Outside - No  Card Holder - Yes.        </div> <div style="clear: both;"></div> </div>,<div class="item_left_column" id="specifications"> <h3 class="item_desc_title fk-uppercase">         Specifications of AAR Posh and Royal Look Hand Bag (Black)    </h3> <table cellspacing="0" class="fk-specs-type2"> <tr> <th class="group-head" colspan="2">General</th> </tr> <tr class=""> <td class="specs-key">Type</td> <td class="specs-value fk-data">Hand Bag</td> </tr> <tr class=""> <td class="specs-key">Ideal For</td> <td class="specs-value fk-data">Women</td> </tr> <tr class=""> <td class="specs-key">Material</td> <td class="specs-value fk-data">Faux Leather</td> </tr> <tr class=""> <td class="specs-key">Style Code</td> <td class="specs-value fk-data">AARHBBLK60073</td> </tr> <tr class=""> <td class="specs-key">Color Code</td> <td class="specs-value fk-data">Black</td> </tr> </table> <table cellspacing="0" class="fk-specs-type2"> <tr> <th class="group-head" colspan="2">Body Features</th> </tr> <tr class=""> <td class="specs-key">Number of Compartments</td> <td class="specs-value fk-data">2</td> </tr> </table> </div>,11:03:2014,None
LSTHMBDZ7KAWER3CK9GEER71E,AAR Dazzling Super-Stylish Hand Bag,http://www.flipkart.com/lifestyle/bags-wallets-belts/women?otracker=hp_nmenu_sub_women_0_Bags%2C%20Belts%20and%20wallets,Rs. 1540,Bags  Belts and wallets,View All,AAR,http://img6a.flixcart.com/image/hand-messenger-bag/k/9/g/aarhbblk60097-aar-hand-bag-dazzling-super-stylish-400x400-imadqyqpvst5k8qu.jpeg,Rs. 1925,Black,women,http://www.flipkart.com/aar-dazzling-super-stylish-hand-bag/p/itmdpznczyhvd4bw?pid=HMBDZ7KAWER3CK9G&srno=b_10&ref=9b4c4009-2e00-4a58-9bb8-2516191d3c9e,KhoobSurati,AAR Dazzling Super-Stylish Hand Bag Black - Price in India | Flipkart.com,Flipkart.com: Buy AAR Dazzling Super-Stylish Hand Bag for Rs. 1540 from Flipkart.com. Only Genuine Products. 30 Day Replacement Guarantee. Free Shipping. Cash On,[],<div class="item_left_column" id="description"> <h3 class="item_desc_title fk-uppercase">AAR Dazzling Super-Stylish Hand Bag (Black)         Price: Rs.1540</h3> <div class="cls"></div> <div class="item_desc_text line"> <div style="float:right"> </div>                         Bringing to you a new ladies handbag from AAR to meet the need for an exciting fashion accessory  Apart from having a royal Color - and good-looking design it endures for a considerably long time. You can get this cute designer handbag in a variety of Colors. Features : Prepared from high-quality leather  Incredible design having braids  Spacious enough to necessary stuff and equipped with multiple pockets  Endures for a long time even on rough use. Disclaimer : Product Color - may slightly vary due to photographic lighting sources or your monitor settings. Specifications : Material - Leather  Dimensions (inch) - Approx 17x16x5(LxHxB)  Colors  Black  Waterproof - Yes  No. Of Pockets Inside - 3  No. Of Pockets Outside - 1  Mesh Pocket Outside - No  Card Holder - No.        </div> <div style="clear: both;"></div> </div>,<div class="item_left_column" id="specifications"> <h3 class="item_desc_title fk-uppercase">         Specifications of AAR Dazzling Super-Stylish Hand Bag (Black)    </h3> <table cellspacing="0" class="fk-specs-type2"> <tr> <th class="group-head" colspan="2">General</th> </tr> <tr class=""> <td class="specs-key">Type</td> <td class="specs-value fk-data">Hand Bag</td> </tr> <tr class=""> <td class="specs-key">Ideal For</td> <td class="specs-value fk-data">Women</td> </tr> <tr class=""> <td class="specs-key">Material</td> <td class="specs-value fk-data">Faux Leather</td> </tr> <tr class=""> <td class="specs-key">Style Code</td> <td class="specs-value fk-data">AARHBBLK60097</td> </tr> <tr class=""> <td class="specs-key">Color Code</td> <td class="specs-value fk-data">Black</td> </tr> </table> <table cellspacing="0" class="fk-specs-type2"> <tr> <th class="group-head" colspan="2">Body Features</th> </tr> <tr class=""> <td class="specs-key">Number of Compartments</td> <td class="specs-value fk-data">2</td> </tr> </table> </div>,11:03:2014,None
LSTHMBDZ7KA2HZSTPVCKJXN6B,AAR Modish Pretty Leather Hand Bag,http://www.flipkart.com/lifestyle/bags-wallets-belts/women?otracker=hp_nmenu_sub_women_0_Bags%2C%20Belts%20and%20wallets,Rs. 1204,Bags  Belts and wallets,View All,AAR,http://img5a.flixcart.com/image/hand-messenger-bag/p/v/c/aarhbbr60092-aar-hand-bag-modish-pretty-leather-400x400-imadqyqmzummpxve.jpeg,Rs. 1505,Brown,women,http://www.flipkart.com/aar-modish-pretty-leather-hand-bag/p/itmdpznchfrtf8cy?pid=HMBDZ7KA2HZSTPVC&srno=b_15&ref=9b4c4009-2e00-4a58-9bb8-2516191d3c9e,KhoobSurati,AAR Modish Pretty Leather Hand Bag Brown - Price in India | Flipkart.com,Flipkart.com: Buy AAR Modish Pretty Leather Hand Bag for Rs. 1204 from Flipkart.com. Only Genuine Products. 30 Day Replacement Guarantee. Free Shipping. Cash On,[],<div class="item_left_column" id="description"> <h3 class="item_desc_title fk-uppercase">AAR Modish Pretty Leather Hand Bag (Brown)         Price: Rs.1204</h3> <div class="cls"></div> <div class="item_desc_text line"> <div style="float:right"> </div>                         Presenting a new trendy ladies handbag from AAR  It has a regal Color - combination and a spectacular design. It suits almost all of your outfits thus allowing you to make a stunning style statement. This leather handbag for women comes in a variety of Colors. Features : Strong structure made from high-quality leather  Has a splendid design featuring sturdy straps  Roomy enough to be comfortably stuffed with essentials  Has multiple pockets and is tough to rough usage  Disclaimer : Product Color - may slightly vary due to photographic lighting sources or your monitor settings. Specifications : Material - Leather  Dimensions (inch) - Approx 15x13x4.5(LxHxB)  Color - Brown  Waterproof - Yes  No. Of Pockets Inside - 2  No. Of Pockets Outside - 1  Mesh Pocket Outside - No  Card Holder - Yes.        </div> <div style="clear: both;"></div> </div>,<div class="item_left_column" id="specifications"> <h3 class="item_desc_title fk-uppercase">         Specifications of AAR Modish Pretty Leather Hand Bag (Brown)    </h3> <table cellspacing="0" class="fk-specs-type2"> <tr> <th class="group-head" colspan="2">General</th> </tr> <tr class=""> <td class="specs-key">Type</td> <td class="specs-value fk-data">Hand Bag</td> </tr> <tr class=""> <td class="specs-key">Ideal For</td> <td class="specs-value fk-data">Women</td> </tr> <tr class=""> <td class="specs-key">Material</td> <td class="specs-value fk-data">Faux Leather</td> </tr> <tr class=""> <td class="specs-key">Style Code</td> <td class="specs-value fk-data">AARHBBR60092</td> </tr> <tr class=""> <td class="specs-key">Color Code</td> <td class="specs-value fk-data">Brown</td> </tr> </table> <table cellspacing="0" class="fk-specs-type2"> <tr> <th class="group-head" colspan="2">Body Features</th> </tr> <tr class=""> <td class="specs-key">Number of Compartments</td> <td class="specs-value fk-data">1</td> </tr> </table> </div>,11:03:2014,None
LSTHMBDZ7KAHY2VSA9TLG73GZ,AAR Ravishing Trendy Leather Hand Bag,http://www.flipkart.com/lifestyle/bags-wallets-belts/women?otracker=hp_nmenu_sub_women_0_Bags%2C%20Belts%20and%20wallets,Rs. 1456,Bags  Belts and wallets,View All,AAR,http://img5a.flixcart.com/image/hand-messenger-bag/a/9/t/aarhbblk60013-aar-hand-bag-ravishing-trendy-leather-400x400-imadz7nk6hby8u2c.jpeg,Rs. 1820,Black,women,http://www.flipkart.com/aar-ravishing-trendy-leather-hand-bag/p/itmdpznczyzrzghf?pid=HMBDZ7KAHY2VSA9T&srno=b_12&ref=9b4c4009-2e00-4a58-9bb8-2516191d3c9e,KhoobSurati,AAR Ravishing Trendy Leather Hand Bag Black - Price in India | Flipkart.com,Flipkart.com: Buy AAR Ravishing Trendy Leather Hand Bag for Rs. 1456 from Flipkart.com. Only Genuine Products. 30 Day Replacement Guarantee. Free Shipping. Cash On,[],<div class="item_left_column" id="description"> <h3 class="item_desc_title fk-uppercase">AAR Ravishing Trendy Leather Hand Bag (Black)         Price: Rs.1456</h3> <div class="cls"></div> <div class="item_desc_text line"> <div style="float:right"> </div>                         AAR presents a new stylish handbag for women who are crazy about fashion  Having a strong leather structure  cute Color - combo of two shades and a stylish design with metallic studs  this bag allows you to make a catchy style statement with most of the outfits that you have. It is available in different shade combinations. Buy this handbag online now  Features : Made from high-quality leather  Neatly adorned with a beautifully-studded design  Adequately spacious to accommodate your stuff  Possesses a considerable durability  Disclaimer : Product Color - may slightly vary due to photographic lighting sources or your monitor settings. Specifications : Material - Leather  Dimensions (inch) - Approx 11 X 10 X 5(LxHxB)  Color - Black  Waterproof - Yes  No. Of Pockets Inside - 4  No. Of Pockets Outside - 1  Mesh Pocket Outside - No  Card Holder - Yes.        </div> <div style="clear: both;"></div> </div>,<div class="item_left_column" id="specifications"> <h3 class="item_desc_title fk-uppercase">         Specifications of AAR Ravishing Trendy Leather Hand Bag (Black)    </h3> <table cellspacing="0" class="fk-specs-type2"> <tr> <th class="group-head" colspan="2">General</th> </tr> <tr class=""> <td class="specs-key">Type</td> <td class="specs-value fk-data">Hand Bag</td> </tr> <tr class=""> <td class="specs-key">Ideal For</td> <td class="specs-value fk-data">Women</td> </tr> <tr class=""> <td class="specs-key">Material</td> <td class="specs-value fk-data">Faux Leather</td> </tr> <tr class=""> <td class="specs-key">Style Code</td> <td class="specs-value fk-data">AARHBBLK60013</td> </tr> <tr class=""> <td class="specs-key">Color Code</td> <td class="specs-value fk-data">Black</td> </tr> </table> <table cellspacing="0" class="fk-specs-type2"> <tr> <th class="group-head" colspan="2">Body Features</th> </tr> <tr class=""> <td class="specs-key">Number of Compartments</td> <td class="specs-value fk-data">1</td> </tr> </table> </div>,11:03:2014,None
LSTHMBDZ7KA3TNWQJZZX2MDMN,AAR Mod Formal Leather Hand Bag,http://www.flipkart.com/lifestyle/bags-wallets-belts/women?otracker=hp_nmenu_sub_women_0_Bags%2C%20Belts%20and%20wallets,Rs. 1512,Bags  Belts and wallets,View All,AAR,http://img5a.flixcart.com/image/hand-messenger-bag/j/z/z/aarhbap60024-aar-hand-bag-mod-formal-leather-400x400-imadz7nmbxf8sj5t.jpeg,Rs. 1890,Beige,women,http://www.flipkart.com/aar-mod-formal-leather-hand-bag/p/itmdpzncyzpwh2wa?pid=HMBDZ7KA3TNWQJZZ&srno=b_3&ref=9b4c4009-2e00-4a58-9bb8-2516191d3c9e,KhoobSurati,AAR Mod Formal Leather Hand Bag Apricot - Price in India | Flipkart.com,Flipkart.com: Buy AAR Mod Formal Leather Hand Bag for Rs. 1512 from Flipkart.com. Only Genuine Products. 30 Day Replacement Guarantee. Free Shipping. Cash On,[],<div class="item_left_column" id="description"> <h3 class="item_desc_title fk-uppercase">AAR Mod Formal Leather Hand Bag (Apricot)         Price: Rs.1512</h3> <div class="cls"></div> <div class="item_desc_text line"> <div style="float:right"> </div>                         Give yourself an elegant look by flaunting these stunning leather handbags from AAR. Featuring ample space to accommodate all your essentials and multiple pockets to arrange them in an organized manner  this chic piece is must to have in your wardrobe. You can carry this bag with any of your formals or casuals. So what are you waiting for  Buy this handbag for ladies online now  Features : Attractive hand bag for fashion freaks  Stylish buckles on either side  Comfortable to carry  Made from fine leather  Disclaimer : Product Color - may slightly vary due to photographic lighting sources or your monitor settings. Specifications : Material - Leather  Dimensions (inch) - Approx 10.5X10.5X6(LxHxB)  Color - Apricot  Waterproof - Yes  No. Of Pockets Inside - 3  No. Of Pockets Outside - 2  Mesh Pocket Outside - No  Card Holder - Yes.        </div> <div style="clear: both;"></div> </div>,<div class="item_left_column" id="specifications"> <h3 class="item_desc_title fk-uppercase">         Specifications of AAR Mod Formal Leather Hand Bag (Apricot)    </h3> <table cellspacing="0" class="fk-specs-type2"> <tr> <th class="group-head" colspan="2">General</th> </tr> <tr class=""> <td class="specs-key">Type</td> <td class="specs-value fk-data">Hand Bag</td> </tr> <tr class=""> <td class="specs-key">Ideal For</td> <td class="specs-value fk-data">Women</td> </tr> <tr class=""> <td class="specs-key">Material</td> <td class="specs-value fk-data">Faux Leather</td> </tr> <tr class=""> <td class="specs-key">Style Code</td> <td class="specs-value fk-data">AARHBAP60024</td> </tr> <tr class=""> <td class="specs-key">Color Code</td> <td class="specs-value fk-data">Apricot</td> </tr> </table> <table cellspacing="0" class="fk-specs-type2"> <tr> <th class="group-head" colspan="2">Body Features</th> </tr> <tr class=""> <td class="specs-key">Number of Compartments</td> <td class="specs-value fk-data">1</td> </tr> </table> </div>,11:03:2014,None
LSTHMBDZ7KAWR9AH6BBURMI2L,AAR Stylish Stripped Leather Hand Bag,http://www.flipkart.com/lifestyle/bags-wallets-belts/women?otracker=hp_nmenu_sub_women_0_Bags%2C%20Belts%20and%20wallets,Rs. 1260,Bags  Belts and wallets,View All,AAR,http://img6a.flixcart.com/image/hand-messenger-bag/6/b/b/aarhbcf60081-aar-hand-bag-stylish-stripped-leather-400x400-imadqyqq7nack7mc.jpeg,Rs. 1575,Brown,women,http://www.flipkart.com/aar-stylish-stripped-leather-hand-bag/p/itmdpznc4xugxbzc?pid=HMBDZ7KAWR9AH6BB&srno=b_1&ref=9b4c4009-2e00-4a58-9bb8-2516191d3c9e,KhoobSurati,AAR Stylish Stripped Leather Hand Bag Coffee - Price in India | Flipkart.com,Flipkart.com: Buy AAR Stylish Stripped Leather Hand Bag for Rs. 1260 from Flipkart.com. Only Genuine Products. 30 Day Replacement Guarantee. Free Shipping. Cash On,[],<div class="item_left_column" id="description"> <h3 class="item_desc_title fk-uppercase">AAR Stylish Stripped Leather Hand Bag (Coffee)         Price: Rs.1260</h3> <div class="cls"></div> <div class="item_desc_text line"> <div style="float:right"> </div>                         Add a touch of impressive style to your appearance with this stylish ladies handbag from AAR  Artfully made  this bag features an attractive design  imperial Color - combination and long endurance. This leather handbag for women is available in a variety of Colors. So  what are you waiting for  Buy this handbag online now   Features : Fabricated using leather of fine quality  Has a wonderful design lined with uniquely-textured straps and studded buckles  Sufficiently roomy to be effortlessly stuffed and has plenty of pockets to keep small things  Considerably tough to forceful use and quite long-lasting  Disclaimer : Product Color - may slightly vary due to photographic lighting sources or your monitor settings. Specifications : Material - Leather  Dimensions (inch) - Approx 12x10.5x4.4(LxHxB)  Color - Coffee  Waterproof - Yes  No. Of Pockets Inside - 2  No. Of Pockets Outside - 1  Mesh Pocket Outside - No  Card Holder - Yes.        </div> <div style="clear: both;"></div> </div>,<div class="item_left_column" id="specifications"> <h3 class="item_desc_title fk-uppercase">         Specifications of AAR Stylish Stripped Leather Hand Bag (Coffee)    </h3> <table cellspacing="0" class="fk-specs-type2"> <tr> <th class="group-head" colspan="2">General</th> </tr> <tr class=""> <td class="specs-key">Type</td> <td class="specs-value fk-data">Hand Bag</td> </tr> <tr class=""> <td class="specs-key">Ideal For</td> <td class="specs-value fk-data">Women</td> </tr> <tr class=""> <td class="specs-key">Material</td> <td class="specs-value fk-data">Faux Leather</td> </tr> <tr class=""> <td class="specs-key">Style Code</td> <td class="specs-value fk-data">AARHBCF60081</td> </tr> <tr class=""> <td class="specs-key">Color Code</td> <td class="specs-value fk-data">Coffee</td> </tr> </table> <table cellspacing="0" class="fk-specs-type2"> <tr> <th class="group-head" colspan="2">Body Features</th> </tr> <tr class=""> <td class="specs-key">Number of Compartments</td> <td class="specs-value fk-data">2</td> </tr> </table> </div>,11:03:2014,None
LSTSLBDZ7K8Y4UZQMTKRUAOVS,AAR Chic n Smart Sling Bag,http://www.flipkart.com/lifestyle/bags-wallets-belts/women?otracker=hp_nmenu_sub_women_0_Bags%2C%20Belts%20and%20wallets,Rs. 980,Bags  Belts and wallets,View All,AAR,http://img6a.flixcart.com/image/sling-bag/m/t/k/aarsbdbr60046-aar-chic-n-smart-400x400-imadptyjthazdvgf.jpeg,Rs. 1225,Brown,women,http://www.flipkart.com/aar-chic-n-smart-sling-bag/p/itmdp2nhfu8rh9zz?pid=SLBDZ7K8Y4UZQMTK&srno=b_9&ref=9b4c4009-2e00-4a58-9bb8-2516191d3c9e,KhoobSurati,AAR Chic n Smart Sling Bag Dark Brown - Price in India | Flipkart.com,Flipkart.com: Buy AAR Chic n Smart Sling Bag for Rs. 980 from Flipkart.com. Only Genuine Products. 30 Day Replacement Guarantee. Free Shipping. Cash On,[],<div class="item_left_column" id="description"> <h3 class="item_desc_title fk-uppercase">AAR Chic n Smart Sling Bag (Dark Brown)         Price: Rs.980</h3> <div class="cls"></div> <div class="item_desc_text line"> <div style="float:right"> </div>                         Give your personality a classy touch while carrying these adorable designer sling bags designed by AAR. Featuring comfortable slim strap  ample space and canvas fabric  this bag will help you to carry all your essentials in the most fashionable way. Not only it is high on durability but in style also. Order this sling bags for girls online now! Features - Fashionable sling bag for girls  High on style and durability  Plenty of zippers to keep your things  Slim comfortable strap  Disclaimer:Product color may slightly vary due to photographic lighting sources or your monitor settings. Specifications : Material - Fabric  Dimensions (inch.) Approx. 9.5X10X2.5(LxHxB)  Color - Dark Brown  Waterproof - No  No. Of Pockets Inside - 5  No. Of Pockets Outside - 2  Mesh Pocket Outside - No  Card Holder ? Yes        </div> <div style="clear: both;"></div> </div>,<div class="item_left_column" id="specifications"> <h3 class="item_desc_title fk-uppercase">         Specifications of AAR Chic n Smart Sling Bag (Dark Brown)    </h3> <table cellspacing="0" class="fk-specs-type2"> <tr> <th class="group-head" colspan="2">General</th> </tr> <tr class=""> <td class="specs-key">Ideal For</td> <td class="specs-value fk-data">Women</td> </tr> <tr class=""> <td class="specs-key">Material</td> <td class="specs-value fk-data">Canvas</td> </tr> <tr class=""> <td class="specs-key">Style Code</td> <td class="specs-value fk-data">AARSBDBR60046</td> </tr> <tr class=""> <td class="specs-key">Color Code</td> <td class="specs-value fk-data">Dark Brown</td> </tr> </table> </div>,11:03:2014,None
