LSTHMBDZ7KADSVWQ4XJ06EL4G,AAR Stylish Stripped Leather Hand Bag,http://www.flipkart.com/lifestyle/bags-wallets-belts/women?otracker=hp_nmenu_sub_women_0_Bags%2C%20Belts%20and%20wallets,Rs. 1260,Bags  Belts and wallets,View All,AAR,http://img6a.flixcart.com/image/hand-messenger-bag/4/x/j/aarhbbr60083-aar-hand-bag-stylish-stripped-leather-400x400-imadqyqnszqfnxsy.jpeg,Rs. 1575,Brown,women,http://www.flipkart.com/aar-stylish-stripped-leather-hand-bag/p/itmdpznchhbuqrdv?pid=HMBDZ7KADSVWQ4XJ&srno=b_2&ref=9b4c4009-2e00-4a58-9bb8-2516191d3c9e,KhoobSurati,AAR Stylish Stripped Leather Hand Bag Brown - Price in India | Flipkart.com,Flipkart.com: Buy AAR Stylish Stripped Leather Hand Bag for Rs. 1260 from Flipkart.com. Only Genuine Products. 30 Day Replacement Guarantee. Free Shipping. Cash On,[],<div class="item_left_column" id="description"> <h3 class="item_desc_title fk-uppercase">AAR Stylish Stripped Leather Hand Bag (Brown)         Price: Rs.1260</h3> <div class="cls"></div> <div class="item_desc_text line"> <div style="float:right"> </div>                         Add a touch of impressive style to your appearance with this stylish ladies handbag from AAR  Artfully made  this bag features an attractive design  imperial Color - combination and long endurance. This leather handbag for women is available in a variety of Colors. So  what are you waiting for  Buy this handbag online now   Features : Fabricated using leather of fine quality  Has a wonderful design lined with uniquely-textured straps and studded buckles  Sufficiently roomy to be effortlessly stuffed and has plenty of pockets to keep small things  Considerably tough to forceful use and quite long-lasting  Disclaimer : Product Color - may slightly vary due to photographic lighting sources or your monitor settings. Specifications : Material - Leather  Dimensions (inch) - Approx 12x10.5x4.4(LxHxB)  Color - Brown  Waterproof - Yes  No. Of Pockets Inside - 2  No. Of Pockets Outside - 1  Mesh Pocket Outside - No  Card Holder - Yes.        </div> <div style="clear: both;"></div> </div>,<div class="item_left_column" id="specifications"> <h3 class="item_desc_title fk-uppercase">         Specifications of AAR Stylish Stripped Leather Hand Bag (Brown)    </h3> <table cellspacing="0" class="fk-specs-type2"> <tr> <th class="group-head" colspan="2">General</th> </tr> <tr class=""> <td class="specs-key">Type</td> <td class="specs-value fk-data">Hand Bag</td> </tr> <tr class=""> <td class="specs-key">Ideal For</td> <td class="specs-value fk-data">Women</td> </tr> <tr class=""> <td class="specs-key">Material</td> <td class="specs-value fk-data">Faux Leather</td> </tr> <tr class=""> <td class="specs-key">Style Code</td> <td class="specs-value fk-data">AARHBBR60083</td> </tr> <tr class=""> <td class="specs-key">Color Code</td> <td class="specs-value fk-data">Brown</td> </tr> </table> <table cellspacing="0" class="fk-specs-type2"> <tr> <th class="group-head" colspan="2">Body Features</th> </tr> <tr class=""> <td class="specs-key">Number of Compartments</td> <td class="specs-value fk-data">2</td> </tr> </table> </div>,11:03:2014,None
LSTSLBDZ7K8UG72NEAGFBBXFO,AAR Exquisite Trendy Leather Sling Bag,http://www.flipkart.com/lifestyle/bags-wallets-belts/women?otracker=hp_nmenu_sub_women_0_Bags%2C%20Belts%20and%20wallets,Rs. 980,Bags  Belts and wallets,View All,AAR,http://img6a.flixcart.com/image/sling-bag/e/a/g/aarsbtl60008-aar-exquisite-trendy-leather-400x400-imadptyjajhy6e8b.jpeg,Rs. 1225,Blue,women,http://www.flipkart.com/aar-exquisite-trendy-leather-sling-bag/p/itmdp2nhgfzjctqg?pid=SLBDZ7K8UG72NEAG&srno=b_7&ref=9b4c4009-2e00-4a58-9bb8-2516191d3c9e,KhoobSurati,AAR Exquisite Trendy Leather Sling Bag Teal - Price in India | Flipkart.com,Flipkart.com: Buy AAR Exquisite Trendy Leather Sling Bag for Rs. 980 from Flipkart.com. Only Genuine Products. 30 Day Replacement Guarantee. Free Shipping. Cash On,[],<div class="item_left_column" id="description"> <h3 class="item_desc_title fk-uppercase">AAR Exquisite Trendy Leather Sling Bag (Teal)         Price: Rs.980</h3> <div class="cls"></div> <div class="item_desc_text line"> <div style="float:right"> </div>                         Make all the heads turn around at yourself by carrying this gorgeous sling cum handbag for girls created by AAR. With presentable looks  lovely color  multiple functionality and long lasting sturdiness  this handbag is a must-have accessory to get along with. Buy it now and accentuate your cool look with these handbags for ladies. Features : Elegant hand bag to get along with  Designer buckle in golden color  Comfortable long thin strap  Uniquely designed with loops at the front  Disclaimer:Product color may slightly vary due to photographic lighting sources or your monitor settings.  Specifications:  Material - Leather &amp; Fabric  Dimensions (inch.) - Approx. 10.5X10.5X3(LxHxB)  Color - Teal  Waterproof - Yes  No. Of Pockets Inside - 2  No. Of Pockets Outside - 1  Mesh Pocket Outside - No  Card Holder ? Yes.        </div> <div style="clear: both;"></div> </div>,<div class="item_left_column" id="specifications"> <h3 class="item_desc_title fk-uppercase">         Specifications of AAR Exquisite Trendy Leather Sling Bag (Teal)    </h3> <table cellspacing="0" class="fk-specs-type2"> <tr> <th class="group-head" colspan="2">General</th> </tr> <tr class=""> <td class="specs-key">Ideal For</td> <td class="specs-value fk-data">Women</td> </tr> <tr class=""> <td class="specs-key">Material</td> <td class="specs-value fk-data">Faux Leather</td> </tr> <tr class=""> <td class="specs-key">Style Code</td> <td class="specs-value fk-data">AARSBTL60008</td> </tr> <tr class=""> <td class="specs-key">Color Code</td> <td class="specs-value fk-data">Teal</td> </tr> </table> </div>,11:03:2014,None
LSTHMBDZ7KAEAZ4ZC5ZEBDCJF,AAR Beauteous Leather Hand Bag,http://www.flipkart.com/lifestyle/bags-wallets-belts/women?otracker=hp_nmenu_sub_women_0_Bags%2C%20Belts%20and%20wallets,Rs. 1204,Bags  Belts and wallets,View All,AAR,http://img5a.flixcart.com/image/hand-messenger-bag/c/5/z/aarhbblk60086-aar-hand-bag-beauteous-leather-400x400-imadqyqn7kyvnhdr.jpeg,Rs. 1505,Black,women,http://www.flipkart.com/aar-beauteous-leather-hand-bag/p/itmdpznctktrg3av?pid=HMBDZ7KAEAZ4ZC5Z&srno=b_6&ref=9b4c4009-2e00-4a58-9bb8-2516191d3c9e,KhoobSurati,AAR Beauteous Leather Hand Bag Black - Price in India | Flipkart.com,Flipkart.com: Buy AAR Beauteous Leather Hand Bag for Rs. 1204 from Flipkart.com. Only Genuine Products. 30 Day Replacement Guarantee. Free Shipping. Cash On,[],<div class="item_left_column" id="description"> <h3 class="item_desc_title fk-uppercase">AAR Beauteous Leather Hand Bag (Black)         Price: Rs.1204</h3> <div class="cls"></div> <div class="item_desc_text line"> <div style="float:right"> </div>                         This new handbag from AAR is the apt fashion accessory for ladies who wish to make an impressive style statement. With its fascinating design  delightful Color - combination and endurance this ladies leather handbag gives you an incredibly stylish look. Also this designer handbag is available in various Color - combinations. Features : Sufficiently strong leather straps  Smart design with multiple pockets and stylish buckles  Has plenty of space for your stuff  Easy to carry and quite long-lasting  Disclaimer : Product Color - may slightly vary due to photographic lighting sources or your monitor settings. Specifications : Material - Leather  Dimensions (inch) - Approx 12x12.5x4.5(LxHxB)  Colors  Black  Waterproof - Yes  No. Of Pockets Inside - 3  No. Of Pockets Outside - 1  Mesh Pocket Outside - No  Card Holder - Yes.        </div> <div style="clear: both;"></div> </div>,<div class="item_left_column" id="specifications"> <h3 class="item_desc_title fk-uppercase">         Specifications of AAR Beauteous Leather Hand Bag (Black)    </h3> <table cellspacing="0" class="fk-specs-type2"> <tr> <th class="group-head" colspan="2">General</th> </tr> <tr class=""> <td class="specs-key">Type</td> <td class="specs-value fk-data">Hand Bag</td> </tr> <tr class=""> <td class="specs-key">Ideal For</td> <td class="specs-value fk-data">Women</td> </tr> <tr class=""> <td class="specs-key">Material</td> <td class="specs-value fk-data">Faux Leather</td> </tr> <tr class=""> <td class="specs-key">Style Code</td> <td class="specs-value fk-data">AARHBBLK60086</td> </tr> <tr class=""> <td class="specs-key">Color Code</td> <td class="specs-value fk-data">Black</td> </tr> </table> <table cellspacing="0" class="fk-specs-type2"> <tr> <th class="group-head" colspan="2">Body Features</th> </tr> <tr class=""> <td class="specs-key">Number of Compartments</td> <td class="specs-value fk-data">2</td> </tr> </table> </div>,11:03:2014,None
LSTSLBDZ7K8AUZQEZH2ZRGYTS,AAR Chic n Smart Sling Bag,http://www.flipkart.com/lifestyle/bags-wallets-belts/women?otracker=hp_nmenu_sub_women_0_Bags%2C%20Belts%20and%20wallets,Rs. 980,Bags  Belts and wallets,View All,AAR,http://img6a.flixcart.com/image/sling-bag/z/h/2/aarsbrd60045-aar-chic-n-smart-400x400-imadptygnzj3qz7c.jpeg,Rs. 1225,Red,women,http://www.flipkart.com/aar-chic-n-smart-sling-bag/p/itmdp2nhheqwu7es?pid=SLBDZ7K8AUZQEZH2&srno=b_8&ref=9b4c4009-2e00-4a58-9bb8-2516191d3c9e,KhoobSurati,AAR Chic n Smart Sling Bag Red - Price in India | Flipkart.com,Flipkart.com: Buy AAR Chic n Smart Sling Bag for Rs. 980 from Flipkart.com. Only Genuine Products. 30 Day Replacement Guarantee. Free Shipping. Cash On,[],<div class="item_left_column" id="description"> <h3 class="item_desc_title fk-uppercase">AAR Chic n Smart Sling Bag (Red)         Price: Rs.980</h3> <div class="cls"></div> <div class="item_desc_text line"> <div style="float:right"> </div>                         Give your personality a classy touch while carrying these adorable designer sling bags designed by AAR. Featuring comfortable slim strap  ample space and canvas fabric  this bag will help you to carry all your essentials in the most fashionable way. Not only it is high on durability but in style also. Order this sling bags for girls online now! Features : Fashionable sling bag for girls  High on style and durability  Plenty of zippers to keep your things  Slim comfortable strap. Disclaimer : Product color may slightly vary due to photographic lighting sources or your monitor settings. Specifications - Material  Fabric  Dimensions (inch.)  Approx. 9.5X10X2.5(LxHxB)  Color - Red  Waterproof - No  No. Of Pockets Inside - 5  No. Of Pockets Outside - 2  Mesh Pocket Outside - No  Card Holder - Yes        </div> <div style="clear: both;"></div> </div>,<div class="item_left_column" id="specifications"> <h3 class="item_desc_title fk-uppercase">         Specifications of AAR Chic n Smart Sling Bag (Red)    </h3> <table cellspacing="0" class="fk-specs-type2"> <tr> <th class="group-head" colspan="2">General</th> </tr> <tr class=""> <td class="specs-key">Ideal For</td> <td class="specs-value fk-data">Women</td> </tr> <tr class=""> <td class="specs-key">Material</td> <td class="specs-value fk-data">Canvas</td> </tr> <tr class=""> <td class="specs-key">Style Code</td> <td class="specs-value fk-data">AARSBRD60045</td> </tr> <tr class=""> <td class="specs-key">Color Code</td> <td class="specs-value fk-data">Red</td> </tr> </table> </div>,11:03:2014,None
LSTHMBDZ7KAGGCW4SPUAI7EWV,AAR Stylish Stripped Leather Hand Bag,http://www.flipkart.com/lifestyle/bags-wallets-belts/women?otracker=hp_nmenu_sub_women_0_Bags%2C%20Belts%20and%20wallets,Rs. 1260,Bags  Belts and wallets,View All,AAR,http://img5a.flixcart.com/image/hand-messenger-bag/s/p/u/aarhbgy60082-aar-hand-bag-stylish-stripped-leather-400x400-imadqyqzphfkwvaz.jpeg,Rs. 1575,Grey,women,http://www.flipkart.com/aar-stylish-stripped-leather-hand-bag/p/itmdpznc7u37ztzy?pid=HMBDZ7KAGGCW4SPU&srno=b_4&ref=9b4c4009-2e00-4a58-9bb8-2516191d3c9e,KhoobSurati,AAR Stylish Stripped Leather Hand Bag Grey - Price in India | Flipkart.com,Flipkart.com: Buy AAR Stylish Stripped Leather Hand Bag for Rs. 1260 from Flipkart.com. Only Genuine Products. 30 Day Replacement Guarantee. Free Shipping. Cash On,[],<div class="item_left_column" id="description"> <h3 class="item_desc_title fk-uppercase">AAR Stylish Stripped Leather Hand Bag (Grey)         Price: Rs.1260</h3> <div class="cls"></div> <div class="item_desc_text line"> <div style="float:right"> </div>                         Add a touch of impressive style to your appearance with this stylish ladies handbag from AAR  Artfully made  this bag features an attractive design  imperial Color - combination and long endurance. This leather handbag for women is available in a variety of Colors. So  what are you waiting for  Buy this handbag online now   Features : Fabricated using leather of fine quality  Has a wonderful design lined with uniquely-textured straps and studded buckles  Sufficiently roomy to be effortlessly stuffed and has plenty of pockets to keep small things  Considerably tough to forceful use and quite long-lasting  Disclaimer : Product Color - may slightly vary due to photographic lighting sources or your monitor settings. Specifications : Material - Leather  Dimensions (inch) - Approx 12x10.5x4.4(LxHxB)  Color - Dark Grey  Waterproof - Yes  No. Of Pockets Inside - 2  No. Of Pockets Outside - 1  Mesh Pocket Outside - No  Card Holder - Yes.        </div> <div style="clear: both;"></div> </div>,<div class="item_left_column" id="specifications"> <h3 class="item_desc_title fk-uppercase">         Specifications of AAR Stylish Stripped Leather Hand Bag (Grey)    </h3> <table cellspacing="0" class="fk-specs-type2"> <tr> <th class="group-head" colspan="2">General</th> </tr> <tr class=""> <td class="specs-key">Type</td> <td class="specs-value fk-data">Hand Bag</td> </tr> <tr class=""> <td class="specs-key">Ideal For</td> <td class="specs-value fk-data">Women</td> </tr> <tr class=""> <td class="specs-key">Material</td> <td class="specs-value fk-data">Faux Leather</td> </tr> <tr class=""> <td class="specs-key">Style Code</td> <td class="specs-value fk-data">AARHBGY60082</td> </tr> <tr class=""> <td class="specs-key">Color Code</td> <td class="specs-value fk-data">Grey</td> </tr> </table> <table cellspacing="0" class="fk-specs-type2"> <tr> <th class="group-head" colspan="2">Body Features</th> </tr> <tr class=""> <td class="specs-key">Number of Compartments</td> <td class="specs-value fk-data">2</td> </tr> </table> </div>,11:03:2014,None
LSTHMBDZ7KACVNGHFZT3JFNBR,AAR Dazzling Super-Stylish Hand Bag,http://www.flipkart.com/lifestyle/bags-wallets-belts/women?otracker=hp_nmenu_sub_women_0_Bags%2C%20Belts%20and%20wallets,Rs. 1540,Bags  Belts and wallets,View All,AAR,http://img5a.flixcart.com/image/hand-messenger-bag/f/z/t/aarhbcr60098-aar-hand-bag-dazzling-super-stylish-400x400-imadqhpqcx2uv7eb.jpeg,Rs. 1925,Cream,women,http://www.flipkart.com/aar-dazzling-super-stylish-hand-bag/p/itmdpzncrny4fvaf?pid=HMBDZ7KACVNGHFZT&srno=b_14&ref=9b4c4009-2e00-4a58-9bb8-2516191d3c9e,KhoobSurati,AAR Dazzling Super-Stylish Hand Bag Cream - Price in India | Flipkart.com,Flipkart.com: Buy AAR Dazzling Super-Stylish Hand Bag for Rs. 1540 from Flipkart.com. Only Genuine Products. 30 Day Replacement Guarantee. Free Shipping. Cash On,[],<div class="item_left_column" id="description"> <h3 class="item_desc_title fk-uppercase">AAR Dazzling Super-Stylish Hand Bag (Cream)         Price: Rs.1540</h3> <div class="cls"></div> <div class="item_desc_text line"> <div style="float:right"> </div>                         Bringing to you a new ladies handbag from AAR to meet the need for an exciting fashion accessory  Apart from having a royal Color - and good-looking design it endures for a considerably long time. You can get this cute designer handbag in a variety of Colors. Features : Prepared from high-quality leather  Incredible design having braids  Spacious enough to necessary stuff and equipped with multiple pockets  Endures for a long time even on rough use. Disclaimer : Product Color - may slightly vary due to photographic lighting sources or your monitor settings. Specifications : Material - Leather  Dimensions (inch) - Approx 17x16x5(LxHxB)  Colors  Cream  Waterproof - Yes  No. Of Pockets Inside - 3  No. Of Pockets Outside - 1  Mesh Pocket Outside - No  Card Holder - No.        </div> <div style="clear: both;"></div> </div>,<div class="item_left_column" id="specifications"> <h3 class="item_desc_title fk-uppercase">         Specifications of AAR Dazzling Super-Stylish Hand Bag (Cream)    </h3> <table cellspacing="0" class="fk-specs-type2"> <tr> <th class="group-head" colspan="2">General</th> </tr> <tr class=""> <td class="specs-key">Type</td> <td class="specs-value fk-data">Hand Bag</td> </tr> <tr class=""> <td class="specs-key">Ideal For</td> <td class="specs-value fk-data">Women</td> </tr> <tr class=""> <td class="specs-key">Material</td> <td class="specs-value fk-data">Faux Leather</td> </tr> <tr class=""> <td class="specs-key">Style Code</td> <td class="specs-value fk-data">AARHBCR60098</td> </tr> <tr class=""> <td class="specs-key">Color Code</td> <td class="specs-value fk-data">Cream</td> </tr> </table> <table cellspacing="0" class="fk-specs-type2"> <tr> <th class="group-head" colspan="2">Body Features</th> </tr> <tr class=""> <td class="specs-key">Number of Compartments</td> <td class="specs-value fk-data">2</td> </tr> </table> </div>,11:03:2014,None
LSTHMBDZ7KAQJK3WGPWS08MFE,AAR Gorgeous Snake Print Hand Bag,http://www.flipkart.com/lifestyle/bags-wallets-belts/women?otracker=hp_nmenu_sub_women_0_Bags%2C%20Belts%20and%20wallets,Rs. 1260,Bags  Belts and wallets,View All,AAR,http://img5a.flixcart.com/image/hand-messenger-bag/g/p/w/aarhbcf60077-aar-hand-bag-gorgeous-snake-print-400x400-imadqyqr9azztjpf.jpeg,Rs. 1575,Brown,women,http://www.flipkart.com/aar-gorgeous-snake-print-hand-bag/p/itmdpzncxhdwbfkd?pid=HMBDZ7KAQJK3WGPW&srno=b_11&ref=9b4c4009-2e00-4a58-9bb8-2516191d3c9e,KhoobSurati,AAR Gorgeous Snake Print Hand Bag Coffee - Price in India | Flipkart.com,Flipkart.com: Buy AAR Gorgeous Snake Print Hand Bag for Rs. 1260 from Flipkart.com. Only Genuine Products. 30 Day Replacement Guarantee. Free Shipping. Cash On,[],<div class="item_left_column" id="description"> <h3 class="item_desc_title fk-uppercase">AAR Gorgeous Snake Print Hand Bag (Coffee)         Price: Rs.1260</h3> <div class="cls"></div> <div class="item_desc_text line"> <div style="float:right"> </div>                         Style yourself with this chic ladies handbag from AAR  Featuring a beautifully-textured design and a trendy Color - combination this leather handbag not only adds a charm to your appearance but also offers maximum durability. It is available in various Color - combinations. Features : Made using leather of premium quality  An excellent design equipped with catchy texture and studs  Spacious enough to be easily stuffed with essentials apart from having sufficient number of pockets  Possesses a high degree of toughness and endures for a considerably long time  Disclaimer : Product Color - may slightly vary due to photographic lighting sources or your monitor settings  Specifications : Material - Leather  Dimensions (inch) - Approx 15.5x10.8x5(LxHxB)  Color - Coffee  Waterproof - Yes  No. Of Pockets Inside - 2  No. Of Pockets Outside - 1  Mesh Pocket Outside - No  Card Holder - Yes.        </div> <div style="clear: both;"></div> </div>,<div class="item_left_column" id="specifications"> <h3 class="item_desc_title fk-uppercase">         Specifications of AAR Gorgeous Snake Print Hand Bag (Coffee)    </h3> <table cellspacing="0" class="fk-specs-type2"> <tr> <th class="group-head" colspan="2">General</th> </tr> <tr class=""> <td class="specs-key">Type</td> <td class="specs-value fk-data">Hand Bag</td> </tr> <tr class=""> <td class="specs-key">Ideal For</td> <td class="specs-value fk-data">Women</td> </tr> <tr class=""> <td class="specs-key">Material</td> <td class="specs-value fk-data">Faux Leather</td> </tr> <tr class=""> <td class="specs-key">Style Code</td> <td class="specs-value fk-data">AARHBCF60077</td> </tr> <tr class=""> <td class="specs-key">Color Code</td> <td class="specs-value fk-data">Coffee</td> </tr> </table> <table cellspacing="0" class="fk-specs-type2"> <tr> <th class="group-head" colspan="2">Body Features</th> </tr> <tr class=""> <td class="specs-key">Number of Compartments</td> <td class="specs-value fk-data">1</td> </tr> </table> </div>,11:03:2014,None
LSTHMBDZ7KAXGHUXYYBSNR0XZ,AAR Gorgeous Snake Print Hand Bag,http://www.flipkart.com/lifestyle/bags-wallets-belts/women?otracker=hp_nmenu_sub_women_0_Bags%2C%20Belts%20and%20wallets,Rs. 1260,Bags  Belts and wallets,View All,AAR,http://img5a.flixcart.com/image/hand-messenger-bag/y/y/b/aarhbgy60080-aar-hand-bag-gorgeous-snake-print-400x400-imadqyqrnjnbgv8e.jpeg,Rs. 1575,Grey,women,http://www.flipkart.com/aar-gorgeous-snake-print-hand-bag/p/itmdpzncvgszbge6?pid=HMBDZ7KAXGHUXYYB&srno=b_13&ref=9b4c4009-2e00-4a58-9bb8-2516191d3c9e,KhoobSurati,AAR Gorgeous Snake Print Hand Bag Grey - Price in India | Flipkart.com,Flipkart.com: Buy AAR Gorgeous Snake Print Hand Bag for Rs. 1260 from Flipkart.com. Only Genuine Products. 30 Day Replacement Guarantee. Free Shipping. Cash On,[],<div class="item_left_column" id="description"> <h3 class="item_desc_title fk-uppercase">AAR Gorgeous Snake Print Hand Bag (Grey)         Price: Rs.1260</h3> <div class="cls"></div> <div class="item_desc_text line"> <div style="float:right"> </div>                         Style yourself with this chic ladies handbag from AAR  Featuring a beautifully-textured design and a trendy Color - combination this leather handbag not only adds a charm to your appearance but also offers maximum durability. It is available in various Color - combinations. Features : Made using leather of premium quality  An excellent design equipped with catchy texture and studs  Spacious enough to be easily stuffed with essentials apart from having sufficient number of pockets  Possesses a high degree of toughness and endures for a considerably long time  Disclaimer : Product Color - may slightly vary due to photographic lighting sources or your monitor settings  Specifications : Material - Leather  Dimensions (inch) - Approx 15.5x10.8x5(LxHxB)  Color - Grey  Waterproof - Yes  No. Of Pockets Inside - 2  No. Of Pockets Outside - 1  Mesh Pocket Outside - No  Card Holder - Yes.        </div> <div style="clear: both;"></div> </div>,<div class="item_left_column" id="specifications"> <h3 class="item_desc_title fk-uppercase">         Specifications of AAR Gorgeous Snake Print Hand Bag (Grey)    </h3> <table cellspacing="0" class="fk-specs-type2"> <tr> <th class="group-head" colspan="2">General</th> </tr> <tr class=""> <td class="specs-key">Type</td> <td class="specs-value fk-data">Hand Bag</td> </tr> <tr class=""> <td class="specs-key">Ideal For</td> <td class="specs-value fk-data">Women</td> </tr> <tr class=""> <td class="specs-key">Material</td> <td class="specs-value fk-data">Faux Leather</td> </tr> <tr class=""> <td class="specs-key">Style Code</td> <td class="specs-value fk-data">AARHBGY60080</td> </tr> <tr class=""> <td class="specs-key">Color Code</td> <td class="specs-value fk-data">Grey</td> </tr> </table> <table cellspacing="0" class="fk-specs-type2"> <tr> <th class="group-head" colspan="2">Body Features</th> </tr> <tr class=""> <td class="specs-key">Number of Compartments</td> <td class="specs-value fk-data">1</td> </tr> </table> </div>,11:03:2014,None
