15:02:2014,laptop-bags,The House of Tara.,The House of Tara 13 inch Laptop Sleeve,Rs. 499,http://img6a.flixcart.com/image/laptop-bag/h/m/t/htlp-07-the-house-of-tara-sleeves-slip-cases-400x400-imadn8nvuvhm7gxx.jpeg,(Multi-color),Rs. 499,TheHouseOfTara,http://www.flipkart.com/house-tara-13-inch-laptop-sleeve/p/itmdfwgsnv3yx68x?pid=LTBDEH49P9XYWHMT&srno=b_2&ref=82e90414-476a-4f0f-9c3a-297c96392929,LSTLTBDEH49P9XYWHMTTAGNTZ,,<div class="item_left_column" id="description"><h3 class="item_desc_title fk-uppercase">The House of Tara 13 inch Laptop Sleeve (Multi-color)         Price: Rs.499</h3><div class="cls"></div><div class="item_desc_text line"><div style="float:right"></div><h3><b> Key Features </b></h3><div class="line bmargin10"><ul class="feature_bullet"><li><span>1 Compartment</span></li><li><span>Zipper Closure</span></li><li><span>13 inch Compatible</span></li><li><span>Flex Material</span></li> </ul></div><p style="text-align: justify;">	Add a tinge of color to your attire with this stylish House of Tara 13 inch Laptop Sleeve. Made of flex material, this sleeve ensures secure and sturdy support to your laptop while use. The commodious interiors of this laptop sleeve are equipped with one compartment and come with the capacity to <strong>accommodate a 13 inch laptop or a tablet </strong>without any hassle. In addition to this, the <strong>zippered closure</strong> in the sleeve safely encases your device within. The classy design of this House of Tara 13 inch Laptop Sleeve makes it ideal for use by men and women.</p><p style="text-align: justify;">	This laptop sleeve is designed with a<strong> 4 mm padding</strong> that comes as an extra-protective shield to your laptop, keeping it away from dust and other damages. Besides this, the polyester lining in the laptop sleeve adds to the sturdiness. The exteriors of this <strong>House of Tara 13 inch Laptop Sleeve </strong>measure 279.6 x 355.6 mm in dimension, is lightweight and is easy to carry along while you are on the move. Furthermore, this sleeve weighs a mere 170 g.</p> </div><div style="clear: both;"></div></div>,<div class="item_left_column" id="specifications"><h3 class="item_desc_title fk-uppercase">        Specifications of The House of Tara 13 inch Laptop Sleeve (Multi-color)    </h3><table cellspacing="0" class="fk-specs-type2"><tr><th class="group-head" colspan="2">General</th></tr><tr class=""><td class="specs-key">Brand</td><td class="specs-value fk-data">The House of Tara</td></tr><tr class=""><td class="specs-key">Type</td><td class="specs-value fk-data">Sleeves/Slip Cases</td></tr><tr class=""><td class="specs-key">Series</td><td class="specs-value fk-data">HTLP</td></tr><tr class=""><td class="specs-key">Color</td><td class="specs-value fk-data">Multi-color</td></tr><tr class=""><td class="specs-key">Ideal For</td><td class="specs-value fk-data">Men, Women</td></tr><tr class=""><td class="specs-key">Compatible Laptop Size</td><td class="specs-value fk-data">13 inch</td></tr><tr class=""><td class="specs-key">Material</td><td class="specs-value fk-data">Flex</td></tr><tr class=""><td class="specs-key">Closure Type</td><td class="specs-value fk-data">Zip</td></tr><tr class=""><td class="specs-key">Style Code</td><td class="specs-value fk-data">HTLP 07</td></tr><tr class=""><td class="specs-key">Color Code</td><td class="specs-value fk-data">Multi-color</td></tr></table><table cellspacing="0" class="fk-specs-type2"><tr><th class="group-head" colspan="2">Body Features</th></tr><tr class=""><td class="specs-key">Number of Compartments</td><td class="specs-value fk-data">1</td></tr><tr class=""><td class="specs-key">Protection Features</td><td class="specs-value fk-data">4 mm Foam Padding</td></tr><tr class=""><td class="specs-key">Other Body Features</td><td class="specs-value fk-data">Polyester Lining, Fits Laptop and Tablet</td></tr></table><table cellspacing="0" class="fk-specs-type2"><tr><th class="group-head" colspan="2">Dimensions</th></tr><tr class=""><td class="specs-key">Exterior Width</td><td class="specs-value fk-data">279.6 mm</td></tr><tr class=""><td class="specs-key">Exterior Height</td><td class="specs-value fk-data">355.6 mm</td></tr><tr class=""><td class="specs-key">Weight</td><td class="specs-value fk-data">170 g</td></tr></table></div>
15:02:2014,laptop-bags,The House of Tara.,The House of Tara 14 inch Laptop Sleeve,Rs. 550,http://img6a.flixcart.com/image/laptop-bag/r/n/f/htlp-011-the-house-of-tara-sleeves-slip-cases-400x400-imadn8nv3ppzhnjg.jpeg,(Multi-color),Rs. 550,TheHouseOfTara,http://www.flipkart.com/house-tara-14-inch-laptop-sleeve/p/itmdfwgsmawyfdyq?pid=LTBDEH49CAH2ZRNF&srno=b_1&ref=82e90414-476a-4f0f-9c3a-297c96392929,LSTLTBDEH49CAH2ZRNFG7NBPW,,<div class="item_left_column" id="description"><h3 class="item_desc_title fk-uppercase">                Key Features of The House of Tara 14 inch Laptop Sleeve (Multi-color)            </h3><div class="cls"></div><div class="item_desc_text"><ul class="fk-key-features"><li>14 inch Compatible</li><li>1 Compartment</li><li>Flex Material</li> </ul></div><div style="clear: both;"></div></div>,<div class="item_left_column" id="specifications"><h3 class="item_desc_title fk-uppercase">        Specifications of The House of Tara 14 inch Laptop Sleeve (Multi-color)    </h3><table cellspacing="0" class="fk-specs-type2"><tr><th class="group-head" colspan="2">General</th></tr><tr class=""><td class="specs-key">Brand</td><td class="specs-value fk-data">The House of Tara</td></tr><tr class=""><td class="specs-key">Type</td><td class="specs-value fk-data">Sleeves/Slip Cases</td></tr><tr class=""><td class="specs-key">Series</td><td class="specs-value fk-data">HTLP</td></tr><tr class=""><td class="specs-key">Color</td><td class="specs-value fk-data">Multi-color</td></tr><tr class=""><td class="specs-key">Ideal For</td><td class="specs-value fk-data">Women, Men</td></tr><tr class=""><td class="specs-key">Compatible Laptop Size</td><td class="specs-value fk-data">14 inch</td></tr><tr class=""><td class="specs-key">Material</td><td class="specs-value fk-data">Flex</td></tr><tr class=""><td class="specs-key">Style Code</td><td class="specs-value fk-data">HTLP 011</td></tr><tr class=""><td class="specs-key">Color Code</td><td class="specs-value fk-data">Multi-color</td></tr></table><table cellspacing="0" class="fk-specs-type2"><tr><th class="group-head" colspan="2">Body Features</th></tr><tr class=""><td class="specs-key">Number of Compartments</td><td class="specs-value fk-data">1</td></tr><tr class=""><td class="specs-key">Protection Features</td><td class="specs-value fk-data">4 mm Foam Padding</td></tr><tr class=""><td class="specs-key">Other Body Features</td><td class="specs-value fk-data">Polyester Lining, Fits Laptop and Tablet</td></tr></table><table cellspacing="0" class="fk-specs-type2"><tr><th class="group-head" colspan="2">Dimensions</th></tr><tr class=""><td class="specs-key">Exterior Width</td><td class="specs-value fk-data">381 mm</td></tr><tr class=""><td class="specs-key">Exterior Height</td><td class="specs-value fk-data">304.8 mm</td></tr><tr class=""><td class="specs-key">Weight</td><td class="specs-value fk-data">210 g</td></tr></table></div>
15:02:2014,laptop-bags,The House of Tara.,The House of Tara 14 inch Laptop Sleeve,Rs. 550,http://img5a.flixcart.com/image/laptop-bag/d/z/g/htlp-09-the-house-of-tara-laptop-sleeve-400x400-imadehkncah3z3mm.jpeg,(Multi-color),Rs. 550,TheHouseOfTara,http://www.flipkart.com/house-tara-14-inch-laptop-sleeve/p/itmdfwgs2mvnjpgy?pid=LTBDEH49MEBXMDZG&srno=b_5&ref=82e90414-476a-4f0f-9c3a-297c96392929,LSTLTBDEH49MEBXMDZGTEXSLN,,<div class="item_left_column" id="description"><h3 class="item_desc_title fk-uppercase">The House of Tara 14 inch Laptop Sleeve (Multi-color)         Price: Rs.550</h3><div class="cls"></div><div class="item_desc_text line"><div style="float:right"></div><h3><b> Key Features </b></h3><div class="line bmargin10"><ul class="feature_bullet"><li><span>14 inch Compatible</span></li><li><span>1 Compartment</span></li><li><span>Flex Material</span></li> </ul></div><p style="text-align: justify;">	Switch from the ordinary laptop bag to this vibrant and trendy laptop sleeve from The House of Tara, an accessory that would keep your laptop safe and secure. This laptop sleeve is <strong>made of flex material</strong> and hence ensures secure and sturdy support to your laptop while you carry it along from one place to another. Designed with compact yet spacious interiors, this laptop sleeve comes with the <strong>capacity to accommodate a 14 inch laptop </strong>without any hassle. This sturdy sleeve comes as a protective case to your laptop, keeping it away from dust, scratches and other such damages.</p><p style="text-align: justify;"><strong>The</strong> <strong>House of Tara 14 inch Laptop Sleeve also comprises of a single compartment,</strong> adding to the convenience. Besides this, the classy design of this laptop sleeve makes it ideal for use by men and women. You could now stop fretting about your laptop getting damaged as this laptop sleeve comes with a <strong>4 mm foam padding. </strong>This sleeve not only holds a laptop but also a tablet. Adding to the sturdiness is the polyester lining in this House of Tara 14 inch Laptop Sleeve. The exteriors of this sleeve measure 381 x 304.8 mm in dimension. Furthermore, this sleeve weighs a mere 210 g.</p> </div><div style="clear: both;"></div></div>,<div class="item_left_column" id="specifications"><h3 class="item_desc_title fk-uppercase">        Specifications of The House of Tara 14 inch Laptop Sleeve (Multi-color)    </h3><table cellspacing="0" class="fk-specs-type2"><tr><th class="group-head" colspan="2">General</th></tr><tr class=""><td class="specs-key">Brand</td><td class="specs-value fk-data">The House of Tara</td></tr><tr class=""><td class="specs-key">Type</td><td class="specs-value fk-data">Sleeves/Slip Cases</td></tr><tr class=""><td class="specs-key">Series</td><td class="specs-value fk-data">HTLP</td></tr><tr class=""><td class="specs-key">Color</td><td class="specs-value fk-data">Multi-color</td></tr><tr class=""><td class="specs-key">Ideal For</td><td class="specs-value fk-data">Men, Women</td></tr><tr class=""><td class="specs-key">Compatible Laptop Size</td><td class="specs-value fk-data">14 inch</td></tr><tr class=""><td class="specs-key">Material</td><td class="specs-value fk-data">Flex</td></tr><tr class=""><td class="specs-key">Style Code</td><td class="specs-value fk-data">HTLP 09</td></tr><tr class=""><td class="specs-key">Color Code</td><td class="specs-value fk-data">Multi-color</td></tr></table><table cellspacing="0" class="fk-specs-type2"><tr><th class="group-head" colspan="2">Body Features</th></tr><tr class=""><td class="specs-key">Number of Compartments</td><td class="specs-value fk-data">1</td></tr><tr class=""><td class="specs-key">Protection Features</td><td class="specs-value fk-data">4 mm Foam Padding</td></tr><tr class=""><td class="specs-key">Other Body Features</td><td class="specs-value fk-data">Polyester Lining, Fits Laptop and Tablet</td></tr></table><table cellspacing="0" class="fk-specs-type2"><tr><th class="group-head" colspan="2">Dimensions</th></tr><tr class=""><td class="specs-key">Exterior Width</td><td class="specs-value fk-data">381 mm</td></tr><tr class=""><td class="specs-key">Exterior Height</td><td class="specs-value fk-data">304.8 mm</td></tr><tr class=""><td class="specs-key">Weight</td><td class="specs-value fk-data">210 g</td></tr></table></div>
15:02:2014,laptop-bags,The House of Tara.,The House of Tara 13 inch Laptop Sleeve,Rs. 499,http://img5a.flixcart.com/image/laptop-bag/5/e/z/htlp-05-the-house-of-tara-sleeves-slip-cases-400x400-imadn8nw5ryghfbt.jpeg,(Multi-color),Rs. 499,TheHouseOfTara,http://www.flipkart.com/house-tara-13-inch-laptop-sleeve/p/itmdfwgsjzgxsyam?pid=LTBDEH49ZMZ4S5EZ&srno=b_6&ref=82e90414-476a-4f0f-9c3a-297c96392929,LSTLTBDEH49ZMZ4S5EZCXDSDI,,<div class="item_left_column" id="description"><h3 class="item_desc_title fk-uppercase">The House of Tara 13 inch Laptop Sleeve (Multi-color)         Price: Rs.499</h3><div class="cls"></div><div class="item_desc_text line"><div style="float:right"></div><h3><b> Key Features </b></h3><div class="line bmargin10"><ul class="feature_bullet"><li><span>Flex Material</span></li><li><span>13 inch Compatible</span></li><li><span>1 Compartment</span></li><li><span>Zipper Closure</span></li> </ul></div><p style="text-align: justify;">	Bring a colorful change to your outlook with this House of Tara 13 inch Laptop Sleeve, designed for use by men and women. This compact laptop sleeve is <strong>made of flex material </strong>and hence ensures secure and sturdy support to your laptop while use. Equipped with one compartment, this laptop sleeve comes with the capacity to <strong>accommodate a 13 inch laptop and also a tablet</strong> without any hassle. In addition to this, the zippered closure in this laptop sleeve safely encases your laptop within, keeping it away from dust, scratches and other common damages.</p><p style="text-align: justify;">	One of the convenient features of this <strong>House of Tara 13 inch Laptop Sleeve is its 4 mm foam padding</strong> that comes as a protective shield to your most functional electronic device. The polyester lining in this laptop sleeve adds to the sturdiness. Besides this, the exteriors of this laptop sleeve measure 279.6 x 355.6 mm in dimension, is lightweight and hence is effortless to carry along during your journey outdoors. Furthermore, this House of Tara 13 inch Laptop Sleeve <strong>weighs a mere 170 g</strong>.</p> </div><div style="clear: both;"></div></div>,<div class="item_left_column" id="specifications"><h3 class="item_desc_title fk-uppercase">        Specifications of The House of Tara 13 inch Laptop Sleeve (Multi-color)    </h3><table cellspacing="0" class="fk-specs-type2"><tr><th class="group-head" colspan="2">General</th></tr><tr class=""><td class="specs-key">Brand</td><td class="specs-value fk-data">The House of Tara</td></tr><tr class=""><td class="specs-key">Type</td><td class="specs-value fk-data">Sleeves/Slip Cases</td></tr><tr class=""><td class="specs-key">Series</td><td class="specs-value fk-data">HTLP</td></tr><tr class=""><td class="specs-key">Color</td><td class="specs-value fk-data">Multi-color</td></tr><tr class=""><td class="specs-key">Ideal For</td><td class="specs-value fk-data">Men, Women</td></tr><tr class=""><td class="specs-key">Compatible Laptop Size</td><td class="specs-value fk-data">13 inch</td></tr><tr class=""><td class="specs-key">Material</td><td class="specs-value fk-data">Flex</td></tr><tr class=""><td class="specs-key">Closure Type</td><td class="specs-value fk-data">Zip</td></tr><tr class=""><td class="specs-key">Style Code</td><td class="specs-value fk-data">HTLP 05</td></tr><tr class=""><td class="specs-key">Color Code</td><td class="specs-value fk-data">Multi-color</td></tr></table><table cellspacing="0" class="fk-specs-type2"><tr><th class="group-head" colspan="2">Body Features</th></tr><tr class=""><td class="specs-key">Number of Compartments</td><td class="specs-value fk-data">1</td></tr><tr class=""><td class="specs-key">Protection Features</td><td class="specs-value fk-data">4 mm Foam Padding</td></tr><tr class=""><td class="specs-key">Other Body Features</td><td class="specs-value fk-data">Polyester Lining, Fits Laptop and Tablet</td></tr></table><table cellspacing="0" class="fk-specs-type2"><tr><th class="group-head" colspan="2">Dimensions</th></tr><tr class=""><td class="specs-key">Exterior Width</td><td class="specs-value fk-data">279.6 mm</td></tr><tr class=""><td class="specs-key">Exterior Height</td><td class="specs-value fk-data">355.6 mm</td></tr><tr class=""><td class="specs-key">Weight</td><td class="specs-value fk-data">170 g</td></tr></table></div>
15:02:2014,laptop-bags,The House of Tara.,The House of Tara Flex Laptop Sleeve 04 13 inch Laptop Sleeve,Rs. 499,http://img6a.flixcart.com/image/laptop-bag/g/c/7/htlp-04-the-house-of-tara-laptop-sleeve-flex-laptop-sleeve-04-400x400-imadhdy9q3mhyzhk.jpeg,(Blue, White, Brown),Rs. 499,TheHouseOfTara,http://www.flipkart.com/house-tara-flex-laptop-sleeve-04-13-inch/p/itmdqfvrxyq4gbk2?pid=LTBDH4DXQCNHWGC7&srno=b_3&ref=82e90414-476a-4f0f-9c3a-297c96392929,LSTLTBDH4DXQCNHWGC7FMUMIB,,<div class="item_left_column" id="description"><h3 class="item_desc_title fk-uppercase">The House of Tara Flex Laptop Sleeve 04 13 inch Laptop Sleeve (Blue, White, Brown)         Price: Rs.499</h3><div class="cls"></div><div class="item_desc_text line"><div style="float:right"></div>                        Laptop/Notebook sleeve bag or cover, fits upto 13 inch x 10 inch, flex shell, polyester lining, 4 mm foam padding, zipper closure and wipe clean wash care.        </div><div style="clear: both;"></div></div>,<div class="item_left_column" id="specifications"><h3 class="item_desc_title fk-uppercase">        Specifications of The House of Tara Flex Laptop Sleeve 04 13 inch Laptop Sleeve (Blue, White, Brown)    </h3><table cellspacing="0" class="fk-specs-type2"><tr><th class="group-head" colspan="2">In the Box</th></tr><tr class=""><td class="specs-value fk-data" colspan="2">Laptop Sleeve</td></tr></table><table cellspacing="0" class="fk-specs-type2"><tr><th class="group-head" colspan="2">General</th></tr><tr class=""><td class="specs-key">Brand</td><td class="specs-value fk-data">The House of Tara</td></tr><tr class=""><td class="specs-key">Model Name</td><td class="specs-value fk-data">Flex Laptop Sleeve 04</td></tr><tr class=""><td class="specs-key">Type</td><td class="specs-value fk-data">Laptop Sleeve</td></tr><tr class=""><td class="specs-key">Ideal For</td><td class="specs-value fk-data">Men, Women</td></tr><tr class=""><td class="specs-key">Compatible Laptop Size</td><td class="specs-value fk-data">13</td></tr><tr class=""><td class="specs-key">Material</td><td class="specs-value fk-data">Flex, Polyester</td></tr><tr class=""><td class="specs-key">Trolley</td><td class="specs-value fk-data">No</td></tr><tr class=""><td class="specs-key">Expandable</td><td class="specs-value fk-data">No</td></tr><tr class=""><td class="specs-key">Style Code</td><td class="specs-value fk-data">HTLP 04</td></tr><tr class=""><td class="specs-key">Color Code</td><td class="specs-value fk-data">Blue, White, Brown</td></tr></table><table cellspacing="0" class="fk-specs-type2"><tr><th class="group-head" colspan="2">Body Features</th></tr><tr class=""><td class="specs-key">Number of Compartments</td><td class="specs-value fk-data">1</td></tr></table><table cellspacing="0" class="fk-specs-type2"><tr><th class="group-head" colspan="2">Dimensions</th></tr><tr class=""><td class="specs-key">Exterior Width</td><td class="specs-value fk-data">304.8 mm</td></tr><tr class=""><td class="specs-key">Exterior Height</td><td class="specs-value fk-data">381 mm</td></tr></table></div>
15:02:2014,laptop-bags,The House of Tara.,The House of Tara 14 inch Laptop Bag,Rs. 550,http://img6a.flixcart.com/image/laptop-bag/v/g/r/htlp-012-the-house-of-tara-laptop-bag-400x400-imadn8nvxefxdufr.jpeg,(Multi-color),Rs. 550,TheHouseOfTara,http://www.flipkart.com/house-tara-14-inch-laptop-bag/p/itmdeh4xvzdp4wwn?pid=LTBDEH49ZJMRTVGR&srno=b_4&ref=82e90414-476a-4f0f-9c3a-297c96392929,LSTLTBDEH49ZJMRTVGR8T0SU1,,<div class="item_left_column" id="description"><h3 class="item_desc_title fk-uppercase">The House of Tara 14 inch Laptop Bag (Multi-color)         Price: Rs.550</h3><div class="cls"></div><div class="item_desc_text line"><div style="float:right"></div><h3><b> Key Features </b></h3><div class="line bmargin10"><ul class="feature_bullet"><li><span>14 inch Compatible</span></li><li><span>1 Compartment</span></li><li><span>Flex Material</span></li> </ul></div><p style="text-align: justify;">	A unisex laptop bag perfect for daily use is this House of Tara 14 inch Laptop Bag. Crafted in flex material, this satchel ensures secure support to your laptop while use. This laptop bag is equipped with <strong>one compartment that holds a 14 inch laptop or a tablet</strong> without any hassle. In addition to this, the House of Tara laptop bag comes with a 4 mm foam padding that safely encases your laptop within, keeping it away from dust, scratches and other such damages.</p><p style="text-align: justify;">	The <strong>polyester lining </strong>in<strong> </strong>this laptop bag adds to the sturdiness. Besides this, the exteriors of this laptop bag measure 381 x 304.8 mm in dimension, is <strong>lightweight </strong>and is easy to carry along while you are on the move. Furthermore, this <strong>House of Tara 14 inch Laptop Bag weighs a mere 210 g</strong>. You could now opt for this stylish and trendy alternative to stash your laptop and say goodbye to ordinary laptop bags.</p> </div><div style="clear: both;"></div></div>,<div class="item_left_column" id="specifications"><h3 class="item_desc_title fk-uppercase">        Specifications of The House of Tara 14 inch Laptop Bag (Multi-color)    </h3><table cellspacing="0" class="fk-specs-type2"><tr><th class="group-head" colspan="2">General</th></tr><tr class=""><td class="specs-key">Brand</td><td class="specs-value fk-data">The House of Tara</td></tr><tr class=""><td class="specs-key">Type</td><td class="specs-value fk-data">Laptop Bag</td></tr><tr class=""><td class="specs-key">Series</td><td class="specs-value fk-data">HTLP</td></tr><tr class=""><td class="specs-key">Color</td><td class="specs-value fk-data">Multi-color</td></tr><tr class=""><td class="specs-key">Ideal For</td><td class="specs-value fk-data">Women, Men</td></tr><tr class=""><td class="specs-key">Compatible Laptop Size</td><td class="specs-value fk-data">14 inch</td></tr><tr class=""><td class="specs-key">Material</td><td class="specs-value fk-data">Flex</td></tr><tr class=""><td class="specs-key">Style Code</td><td class="specs-value fk-data">HTLP 012</td></tr><tr class=""><td class="specs-key">Color Code</td><td class="specs-value fk-data">Multi-color</td></tr></table><table cellspacing="0" class="fk-specs-type2"><tr><th class="group-head" colspan="2">Body Features</th></tr><tr class=""><td class="specs-key">Number of Compartments</td><td class="specs-value fk-data">1</td></tr><tr class=""><td class="specs-key">Protection Features</td><td class="specs-value fk-data">4 mm Foam Padding</td></tr><tr class=""><td class="specs-key">Other Body Features</td><td class="specs-value fk-data">Fits Laptop and Tablet, Polyester Lining</td></tr></table><table cellspacing="0" class="fk-specs-type2"><tr><th class="group-head" colspan="2">Dimensions</th></tr><tr class=""><td class="specs-key">Exterior Width</td><td class="specs-value fk-data">381 mm</td></tr><tr class=""><td class="specs-key">Exterior Height</td><td class="specs-value fk-data">304.8 mm</td></tr><tr class=""><td class="specs-key">Weight</td><td class="specs-value fk-data">210 g</td></tr></table></div>
