LSTTSHDTSKVFAKKADFACVGKLD,Femella Polka Print Women's Round Neck T-Shirt,http://www.flipkart.com/womens-clothing?otracker=hp_nmenu_sub_women_1_Clothing,Rs. 590,Clothing,Polos & T-Shirts,Femella,http://img6a.flixcart.com/image/t-shirt/d/f/a/00sy-black-black-f-femella-xl-400x400-imadtspgwghtsnkz.jpeg,Rs. 590,Black,women,http://www.flipkart.com/femella-polka-print-women-s-round-neck-t-shirt/p/itmdtskvfakkadfa?pid=TSHDTSKVFAKKADFA&srno=b_3&ref=722867ff-baec-4e61-9612-154c5a7add00,Fashionara,Femella Polka Print Women's Round Neck T-Shirt - Buy Black Femella Polka Print Women's Round Neck T-Shirt Online at Best Prices in India | Flipkart.com,Femella Polka Print Women's Round Neck T-Shirt - Buy Black Femella Polka Print Women's Round Neck T-Shirt For Only Rs. 590.00 Online in India. Shop Online For Apparels. Huge Collection of Branded Clothes Only at,[],<div class="item_left_column" id="description"> <h3 class="item_desc_title fk-uppercase">Femella Polka Print Women's Round Neck T-Shirt         Price: Rs.590</h3> <div class="cls"></div> <div class="item_desc_text line"> <div style="float:right"> </div>                         Add some fun to your summer dressing with this polka dot top!  Polka dots are an all time favorite and perfect for layering with.  You can wear this top on a casual day out or layer it under a contrast blazer.    Wear this top with your casual jeans and contrast ballerinas.        </div> <div style="clear: both;"></div> </div>,<div class="item_left_column" id="specifications"> <h3 class="item_desc_title fk-uppercase">         Specifications of Femella Polka Print Women's Round Neck T-Shirt    </h3> <table cellspacing="0" class="fk-specs-type2"> <tr> <th class="group-head" colspan="2">General Details<a class="see-more unitExt rmargin10 no-underline" href="javascript:void(0);" onclick="$(this).closest('.fk-specs-type2').toggleClass('expandedMore')" title="Expand">[+]</a><a class="hidden unitExt rmargin10 no-underline" href="javascript:void(0);" onclick="$(this).closest('.fk-specs-type2').toggleClass('expandedMore')" title="Collapse">[-]</a></th> </tr> <tr class="hidden"> <td class="specs-key">Ideal For</td> <td class="specs-value fk-data">Women's</td> </tr> <tr class="hidden"> <td class="specs-key">Occasion</td> <td class="specs-value fk-data">Casual</td> </tr> <tr class="hidden"> <td class="specs-key">Pattern</td> <td class="specs-value fk-data">Polka Print</td> </tr> </table> <table cellspacing="0" class="fk-specs-type2"> <tr> <th class="group-head" colspan="2">T-shirt Details</th> </tr> <tr class=""> <td class="specs-key">Type</td> <td class="specs-value fk-data">Round Neck</td> </tr> <tr class=""> <td class="specs-key">Fabric</td> <td class="specs-value fk-data">Synthetic</td> </tr> <tr class=""> <td class="specs-key">Sleeve</td> <td class="specs-value fk-data">Sleeveless</td> </tr> <tr class=""> <td class="specs-key">Number of Contents in Sales Package</td> <td class="specs-value fk-data">Pack of 1</td> </tr> </table> <table cellspacing="0" class="fk-specs-type2"> <tr> <th class="group-head" colspan="2">Fabric Care</th> </tr> <tr class=""> <td class="specs-value fk-data" colspan="2">Machine Wash  Wash With Like Colours  Warm Iron If Required</td> </tr> </table> <table cellspacing="0" class="fk-specs-type2"> <tr> <th class="group-head" colspan="2">Additional Details<a class="see-more unitExt rmargin10 no-underline" href="javascript:void(0);" onclick="$(this).closest('.fk-specs-type2').toggleClass('expandedMore')" title="Expand">[+]</a><a class="hidden unitExt rmargin10 no-underline" href="javascript:void(0);" onclick="$(this).closest('.fk-specs-type2').toggleClass('expandedMore')" title="Collapse">[-]</a></th> </tr> <tr class="hidden"> <td class="specs-key">Style Code</td> <td class="specs-value fk-data">00SY-Black_Black..F</td> </tr> </table> <table cellspacing="0" class="fk-specs-type2"> <tr> <th class="group-head" colspan="2">In the Box</th> </tr> <tr class=""> <td class="specs-key"> </td> <td class="specs-value fk-data">T Shirt</td> </tr> </table> </div>,11:03:2014,None
LSTTSHDTSKXUMBQZKSWWRHZ1A,Femella Solid Women's Round Neck T-Shirt,http://www.flipkart.com/womens-clothing?otracker=hp_nmenu_sub_women_1_Clothing,Rs. 450,Clothing,Polos & T-Shirts,Femella,http://img6a.flixcart.com/image/t-shirt/k/s/w/00sd-grey-grey-f-femella-l-400x400-imadtszukhuykugy.jpeg,Rs. 450,Light Grey,women,http://www.flipkart.com/femella-solid-women-s-round-neck-t-shirt/p/itmdtskwxhnpuczu?pid=TSHDTSKXUMBQZKSW&srno=b_5&ref=722867ff-baec-4e61-9612-154c5a7add00,Fashionara,Femella Solid Women's Round Neck T-Shirt - Buy Light Grey Femella Solid Women's Round Neck T-Shirt Online at Best Prices in India | Flipkart.com,Femella Solid Women's Round Neck T-Shirt - Buy Light Grey Femella Solid Women's Round Neck T-Shirt For Only Rs. 450.00 Online in India. Shop Online For Apparels. Huge Collection of Branded Clothes Only at,['M'  'L'  'XL'],<div class="item_left_column" id="description"> <h3 class="item_desc_title fk-uppercase">Femella Solid Women's Round Neck T-Shirt         Price: Rs.450</h3> <div class="cls"></div> <div class="item_desc_text line"> <div style="float:right"> </div>                         Just the perfect pick for casual days    this tank is simple in form and design.  With self stripes all over  it fits snug around   your body and keeps you comfortable.      Slip it on with boyfriend jeans and a favorite biker jacket   for hard-to-miss weekend style.        </div> <div style="clear: both;"></div> </div>,<div class="item_left_column" id="specifications"> <h3 class="item_desc_title fk-uppercase">         Specifications of Femella Solid Women's Round Neck T-Shirt    </h3> <table cellspacing="0" class="fk-specs-type2"> <tr> <th class="group-head" colspan="2">General Details<a class="see-more unitExt rmargin10 no-underline" href="javascript:void(0);" onclick="$(this).closest('.fk-specs-type2').toggleClass('expandedMore')" title="Expand">[+]</a><a class="hidden unitExt rmargin10 no-underline" href="javascript:void(0);" onclick="$(this).closest('.fk-specs-type2').toggleClass('expandedMore')" title="Collapse">[-]</a></th> </tr> <tr class="hidden"> <td class="specs-key">Ideal For</td> <td class="specs-value fk-data">Women's</td> </tr> <tr class="hidden"> <td class="specs-key">Occasion</td> <td class="specs-value fk-data">Casual</td> </tr> <tr class="hidden"> <td class="specs-key">Pattern</td> <td class="specs-value fk-data">Solid</td> </tr> </table> <table cellspacing="0" class="fk-specs-type2"> <tr> <th class="group-head" colspan="2">T-shirt Details</th> </tr> <tr class=""> <td class="specs-key">Type</td> <td class="specs-value fk-data">Round Neck</td> </tr> <tr class=""> <td class="specs-key">Fabric</td> <td class="specs-value fk-data">Blend</td> </tr> <tr class=""> <td class="specs-key">Sleeve</td> <td class="specs-value fk-data">Sleeveless</td> </tr> <tr class=""> <td class="specs-key">Number of Contents in Sales Package</td> <td class="specs-value fk-data">Pack of 1</td> </tr> </table> <table cellspacing="0" class="fk-specs-type2"> <tr> <th class="group-head" colspan="2">Fabric Care</th> </tr> <tr class=""> <td class="specs-value fk-data" colspan="2">Machine Wash  Wash Dark Colours Separately  Warm Iron</td> </tr> </table> <table cellspacing="0" class="fk-specs-type2"> <tr> <th class="group-head" colspan="2">Additional Details<a class="see-more unitExt rmargin10 no-underline" href="javascript:void(0);" onclick="$(this).closest('.fk-specs-type2').toggleClass('expandedMore')" title="Expand">[+]</a><a class="hidden unitExt rmargin10 no-underline" href="javascript:void(0);" onclick="$(this).closest('.fk-specs-type2').toggleClass('expandedMore')" title="Collapse">[-]</a></th> </tr> <tr class="hidden"> <td class="specs-key">Style Code</td> <td class="specs-value fk-data">00SD-Grey_Grey..F</td> </tr> </table> <table cellspacing="0" class="fk-specs-type2"> <tr> <th class="group-head" colspan="2">In the Box</th> </tr> <tr class=""> <td class="specs-key"> </td> <td class="specs-value fk-data">T Shirt</td> </tr> </table> </div>,11:03:2014,None
LSTTSHDR78HNASSGXGHXPR8EO,Femella Solid Women's T-Shirt,http://www.flipkart.com/womens-clothing?otracker=hp_nmenu_sub_women_1_Clothing,Rs. 517,Clothing,Polos & T-Shirts,Femella,http://img6a.flixcart.com/image/t-shirt/n/a/x/00v2-bluemedium-blue-f-femella-xxl-400x400-imadrczaz2xfbwny.jpeg,Rs. 690,Blue,women,http://www.flipkart.com/femella-solid-women-s-t-shirt/p/itmdr78hwnhbqztq?pid=TSHDR78HNASSGXGH&srno=b_1&ref=722867ff-baec-4e61-9612-154c5a7add00,Fashionara,Femella Solid Women's T-Shirt - Buy Blue Femella Solid Women's T-Shirt Online at Best Prices in India | Flipkart.com,Femella Solid Women's T-Shirt - Buy Blue Femella Solid Women's T-Shirt For Only Rs. 0.0 Online in India. Shop Online For Apparels. Huge Collection of Branded Clothes Only at,['XS'  'S'  'M'  'L'  'XL'  'XXL'],<div class="item_left_column" id="description"> <h3 class="item_desc_title fk-uppercase">Femella Solid Women's T-Shirt         Price: Rs.517</h3> <div class="cls"></div> <div class="item_desc_text line"> <div style="float:right"> </div>                         It's nice when vintage trends make a comeback in a cooler form! This jersey knit cropped tee is one such trend that needs to be followed asap! A free-flowing silhouette with side darts give a great style and extreme comfort! Wear this with monochrome printed high waist trousers!        </div> <div style="clear: both;"></div> </div>,<div class="item_left_column" id="specifications"> <h3 class="item_desc_title fk-uppercase">         Specifications of Femella Solid Women's T-Shirt    </h3> <table cellspacing="0" class="fk-specs-type2"> <tr> <th class="group-head" colspan="2">General Details<a class="see-more unitExt rmargin10 no-underline" href="javascript:void(0);" onclick="$(this).closest('.fk-specs-type2').toggleClass('expandedMore')" title="Expand">[+]</a><a class="hidden unitExt rmargin10 no-underline" href="javascript:void(0);" onclick="$(this).closest('.fk-specs-type2').toggleClass('expandedMore')" title="Collapse">[-]</a></th> </tr> <tr class="hidden"> <td class="specs-key">Ideal For</td> <td class="specs-value fk-data">Women's</td> </tr> <tr class="hidden"> <td class="specs-key">Occasion</td> <td class="specs-value fk-data">Casual</td> </tr> <tr class="hidden"> <td class="specs-key">Pattern</td> <td class="specs-value fk-data">Solid</td> </tr> </table> <table cellspacing="0" class="fk-specs-type2"> <tr> <th class="group-head" colspan="2">T-shirt Details</th> </tr> <tr class=""> <td class="specs-key">Fabric</td> <td class="specs-value fk-data">Blend</td> </tr> <tr class=""> <td class="specs-key">Sleeve</td> <td class="specs-value fk-data">3/4 Sleeve</td> </tr> <tr class=""> <td class="specs-key">Number of Contents in Sales Package</td> <td class="specs-value fk-data">Pack of 1</td> </tr> </table> <table cellspacing="0" class="fk-specs-type2"> <tr> <th class="group-head" colspan="2">Additional Details<a class="see-more unitExt rmargin10 no-underline" href="javascript:void(0);" onclick="$(this).closest('.fk-specs-type2').toggleClass('expandedMore')" title="Expand">[+]</a><a class="hidden unitExt rmargin10 no-underline" href="javascript:void(0);" onclick="$(this).closest('.fk-specs-type2').toggleClass('expandedMore')" title="Collapse">[-]</a></th> </tr> <tr class="hidden"> <td class="specs-key">Style Code</td> <td class="specs-value fk-data">00V2-BlueMedium Blue..f</td> </tr> </table> <table cellspacing="0" class="fk-specs-type2"> <tr> <th class="group-head" colspan="2">In the Box</th> </tr> <tr class=""> <td class="specs-key"> </td> <td class="specs-value fk-data">T Shirt</td> </tr> </table> </div>,11:03:2014,None
LSTTSHDR78HNASSGXGHXPR8EO,Femella Solid Women's T-Shirt,http://www.flipkart.com/womens-clothing?otracker=hp_nmenu_sub_women_1_Clothing,Rs. 517,Clothing,Polos & T-Shirts,Femella,http://img6a.flixcart.com/image/t-shirt/n/a/x/00v2-bluemedium-blue-f-femella-xxl-400x400-imadrczaz2xfbwny.jpeg,Rs. 690,Blue,women,http://www.flipkart.com/femella-solid-women-s-t-shirt/p/itmdr78hwnhbqztq?pid=TSHDR78HNASSGXGH&srno=b_1&ref=c761abed-2018-425b-b342-c2a456761562,Fashionara,Femella Solid Women's T-Shirt - Buy Blue Femella Solid Women's T-Shirt Online at Best Prices in India | Flipkart.com,Femella Solid Women's T-Shirt - Buy Blue Femella Solid Women's T-Shirt For Only Rs. 0.0 Online in India. Shop Online For Apparels. Huge Collection of Branded Clothes Only at,['XS'  'S'  'M'  'L'  'XL'  'XXL'],<div class="item_left_column" id="description"> <h3 class="item_desc_title fk-uppercase">Femella Solid Women's T-Shirt         Price: Rs.517</h3> <div class="cls"></div> <div class="item_desc_text line"> <div style="float:right"> </div>                         It's nice when vintage trends make a comeback in a cooler form! This jersey knit cropped tee is one such trend that needs to be followed asap! A free-flowing silhouette with side darts give a great style and extreme comfort! Wear this with monochrome printed high waist trousers!        </div> <div style="clear: both;"></div> </div>,<div class="item_left_column" id="specifications"> <h3 class="item_desc_title fk-uppercase">         Specifications of Femella Solid Women's T-Shirt    </h3> <table cellspacing="0" class="fk-specs-type2"> <tr> <th class="group-head" colspan="2">General Details<a class="see-more unitExt rmargin10 no-underline" href="javascript:void(0);" onclick="$(this).closest('.fk-specs-type2').toggleClass('expandedMore')" title="Expand">[+]</a><a class="hidden unitExt rmargin10 no-underline" href="javascript:void(0);" onclick="$(this).closest('.fk-specs-type2').toggleClass('expandedMore')" title="Collapse">[-]</a></th> </tr> <tr class="hidden"> <td class="specs-key">Ideal For</td> <td class="specs-value fk-data">Women's</td> </tr> <tr class="hidden"> <td class="specs-key">Occasion</td> <td class="specs-value fk-data">Casual</td> </tr> <tr class="hidden"> <td class="specs-key">Pattern</td> <td class="specs-value fk-data">Solid</td> </tr> </table> <table cellspacing="0" class="fk-specs-type2"> <tr> <th class="group-head" colspan="2">T-shirt Details</th> </tr> <tr class=""> <td class="specs-key">Fabric</td> <td class="specs-value fk-data">Blend</td> </tr> <tr class=""> <td class="specs-key">Sleeve</td> <td class="specs-value fk-data">3/4 Sleeve</td> </tr> <tr class=""> <td class="specs-key">Number of Contents in Sales Package</td> <td class="specs-value fk-data">Pack of 1</td> </tr> </table> <table cellspacing="0" class="fk-specs-type2"> <tr> <th class="group-head" colspan="2">Additional Details<a class="see-more unitExt rmargin10 no-underline" href="javascript:void(0);" onclick="$(this).closest('.fk-specs-type2').toggleClass('expandedMore')" title="Expand">[+]</a><a class="hidden unitExt rmargin10 no-underline" href="javascript:void(0);" onclick="$(this).closest('.fk-specs-type2').toggleClass('expandedMore')" title="Collapse">[-]</a></th> </tr> <tr class="hidden"> <td class="specs-key">Style Code</td> <td class="specs-value fk-data">00V2-BlueMedium Blue..f</td> </tr> </table> <table cellspacing="0" class="fk-specs-type2"> <tr> <th class="group-head" colspan="2">In the Box</th> </tr> <tr class=""> <td class="specs-key"> </td> <td class="specs-value fk-data">T Shirt</td> </tr> </table> </div>,11:03:2014,None
LSTTOPDGW75WRFGMFKND7ZMOT,Femella Casual Sleeveless Women's Top,http://www.flipkart.com/womens-clothing?otracker=hp_nmenu_sub_women_1_Clothing,Rs. 450,Clothing,Polos & T-Shirts,Femella,http://img6a.flixcart.com/image/top/f/2/5/00sd-grey-femella-m-400x400-imadjsgdsthbtgkb.jpeg,Rs. 450,Grey,women,http://www.flipkart.com/femella-casual-sleeveless-women-s-top/p/itmdgw76tq2erqb2?pid=TOPDGW75WRFGMFKN&srno=b_6&ref=c761abed-2018-425b-b342-c2a456761562,WS Retail,Femella Casual Sleeveless Women's Top - Buy Grey Femella Casual Sleeveless Women's Top Online at Best Prices in India | Flipkart.com,Femella Casual Sleeveless Women's Top - Buy Grey Femella Casual Sleeveless Women's Top For Only Rs. 450.0 Online in India. Shop Online For Apparels. Huge Collection of Branded Clothes Only at,['XXL'],None,<div class="item_left_column" id="specifications"> <h3 class="item_desc_title fk-uppercase">         Specifications of Femella Casual Sleeveless Women's Top    </h3> <table cellspacing="0" class="fk-specs-type2"> <tr> <th class="group-head" colspan="2">General Details<a class="see-more unitExt rmargin10 no-underline" href="javascript:void(0);" onclick="$(this).closest('.fk-specs-type2').toggleClass('expandedMore')" title="Expand">[+]</a><a class="hidden unitExt rmargin10 no-underline" href="javascript:void(0);" onclick="$(this).closest('.fk-specs-type2').toggleClass('expandedMore')" title="Collapse">[-]</a></th> </tr> <tr class="hidden"> <td class="specs-key">Ideal For</td> <td class="specs-value fk-data">Women's</td> </tr> <tr class="hidden"> <td class="specs-key">Occasion</td> <td class="specs-value fk-data">Casual</td> </tr> </table> <table cellspacing="0" class="fk-specs-type2"> <tr> <th class="group-head" colspan="2">Top Details</th> </tr> <tr class=""> <td class="specs-key">Fabric</td> <td class="specs-value fk-data">Rayon</td> </tr> <tr class=""> <td class="specs-key">Fit</td> <td class="specs-value fk-data">Regular Fit</td> </tr> <tr class=""> <td class="specs-key">Neck</td> <td class="specs-value fk-data">Scoop Neck</td> </tr> <tr class=""> <td class="specs-key">Sleeve</td> <td class="specs-value fk-data">Sleeveless</td> </tr> </table> <table cellspacing="0" class="fk-specs-type2"> <tr> <th class="group-head" colspan="2">Fabric Care</th> </tr> <tr class=""> <td class="specs-value fk-data" colspan="2">Cold Wash</td> </tr> </table> </div>,11:03:2014,None
LSTTSHDTSKXUMBQZKSWWRHZ1A,Femella Solid Women's Round Neck T-Shirt,http://www.flipkart.com/womens-clothing?otracker=hp_nmenu_sub_women_1_Clothing,Rs. 450,Clothing,Polos & T-Shirts,Femella,http://img6a.flixcart.com/image/t-shirt/k/s/w/00sd-grey-grey-f-femella-l-400x400-imadtszukhuykugy.jpeg,Rs. 450,Light Grey,women,http://www.flipkart.com/femella-solid-women-s-round-neck-t-shirt/p/itmdtskwxhnpuczu?pid=TSHDTSKXUMBQZKSW&srno=b_5&ref=c761abed-2018-425b-b342-c2a456761562,Fashionara,Femella Solid Women's Round Neck T-Shirt - Buy Light Grey Femella Solid Women's Round Neck T-Shirt Online at Best Prices in India | Flipkart.com,Femella Solid Women's Round Neck T-Shirt - Buy Light Grey Femella Solid Women's Round Neck T-Shirt For Only Rs. 450.00 Online in India. Shop Online For Apparels. Huge Collection of Branded Clothes Only at,['M'  'L'  'XL'],<div class="item_left_column" id="description"> <h3 class="item_desc_title fk-uppercase">Femella Solid Women's Round Neck T-Shirt         Price: Rs.450</h3> <div class="cls"></div> <div class="item_desc_text line"> <div style="float:right"> </div>                         Just the perfect pick for casual days    this tank is simple in form and design.  With self stripes all over  it fits snug around   your body and keeps you comfortable.      Slip it on with boyfriend jeans and a favorite biker jacket   for hard-to-miss weekend style.        </div> <div style="clear: both;"></div> </div>,<div class="item_left_column" id="specifications"> <h3 class="item_desc_title fk-uppercase">         Specifications of Femella Solid Women's Round Neck T-Shirt    </h3> <table cellspacing="0" class="fk-specs-type2"> <tr> <th class="group-head" colspan="2">General Details<a class="see-more unitExt rmargin10 no-underline" href="javascript:void(0);" onclick="$(this).closest('.fk-specs-type2').toggleClass('expandedMore')" title="Expand">[+]</a><a class="hidden unitExt rmargin10 no-underline" href="javascript:void(0);" onclick="$(this).closest('.fk-specs-type2').toggleClass('expandedMore')" title="Collapse">[-]</a></th> </tr> <tr class="hidden"> <td class="specs-key">Ideal For</td> <td class="specs-value fk-data">Women's</td> </tr> <tr class="hidden"> <td class="specs-key">Occasion</td> <td class="specs-value fk-data">Casual</td> </tr> <tr class="hidden"> <td class="specs-key">Pattern</td> <td class="specs-value fk-data">Solid</td> </tr> </table> <table cellspacing="0" class="fk-specs-type2"> <tr> <th class="group-head" colspan="2">T-shirt Details</th> </tr> <tr class=""> <td class="specs-key">Type</td> <td class="specs-value fk-data">Round Neck</td> </tr> <tr class=""> <td class="specs-key">Fabric</td> <td class="specs-value fk-data">Blend</td> </tr> <tr class=""> <td class="specs-key">Sleeve</td> <td class="specs-value fk-data">Sleeveless</td> </tr> <tr class=""> <td class="specs-key">Number of Contents in Sales Package</td> <td class="specs-value fk-data">Pack of 1</td> </tr> </table> <table cellspacing="0" class="fk-specs-type2"> <tr> <th class="group-head" colspan="2">Fabric Care</th> </tr> <tr class=""> <td class="specs-value fk-data" colspan="2">Machine Wash  Wash Dark Colours Separately  Warm Iron</td> </tr> </table> <table cellspacing="0" class="fk-specs-type2"> <tr> <th class="group-head" colspan="2">Additional Details<a class="see-more unitExt rmargin10 no-underline" href="javascript:void(0);" onclick="$(this).closest('.fk-specs-type2').toggleClass('expandedMore')" title="Expand">[+]</a><a class="hidden unitExt rmargin10 no-underline" href="javascript:void(0);" onclick="$(this).closest('.fk-specs-type2').toggleClass('expandedMore')" title="Collapse">[-]</a></th> </tr> <tr class="hidden"> <td class="specs-key">Style Code</td> <td class="specs-value fk-data">00SD-Grey_Grey..F</td> </tr> </table> <table cellspacing="0" class="fk-specs-type2"> <tr> <th class="group-head" colspan="2">In the Box</th> </tr> <tr class=""> <td class="specs-key"> </td> <td class="specs-value fk-data">T Shirt</td> </tr> </table> </div>,11:03:2014,None
LSTTOPDGW75WRFGMFKND7ZMOT,Femella Casual Sleeveless Women's Top,http://www.flipkart.com/womens-clothing?otracker=hp_nmenu_sub_women_1_Clothing,Rs. 450,Clothing,Polos & T-Shirts,Femella,http://img6a.flixcart.com/image/top/f/2/5/00sd-grey-femella-m-400x400-imadjsgdsthbtgkb.jpeg,Rs. 450,Grey,women,http://www.flipkart.com/femella-casual-sleeveless-women-s-top/p/itmdgw76tq2erqb2?pid=TOPDGW75WRFGMFKN&srno=b_6&ref=722867ff-baec-4e61-9612-154c5a7add00,WS Retail,Femella Casual Sleeveless Women's Top - Buy Grey Femella Casual Sleeveless Women's Top Online at Best Prices in India | Flipkart.com,Femella Casual Sleeveless Women's Top - Buy Grey Femella Casual Sleeveless Women's Top For Only Rs. 450.0 Online in India. Shop Online For Apparels. Huge Collection of Branded Clothes Only at,['XXL'],None,<div class="item_left_column" id="specifications"> <h3 class="item_desc_title fk-uppercase">         Specifications of Femella Casual Sleeveless Women's Top    </h3> <table cellspacing="0" class="fk-specs-type2"> <tr> <th class="group-head" colspan="2">General Details<a class="see-more unitExt rmargin10 no-underline" href="javascript:void(0);" onclick="$(this).closest('.fk-specs-type2').toggleClass('expandedMore')" title="Expand">[+]</a><a class="hidden unitExt rmargin10 no-underline" href="javascript:void(0);" onclick="$(this).closest('.fk-specs-type2').toggleClass('expandedMore')" title="Collapse">[-]</a></th> </tr> <tr class="hidden"> <td class="specs-key">Ideal For</td> <td class="specs-value fk-data">Women's</td> </tr> <tr class="hidden"> <td class="specs-key">Occasion</td> <td class="specs-value fk-data">Casual</td> </tr> </table> <table cellspacing="0" class="fk-specs-type2"> <tr> <th class="group-head" colspan="2">Top Details</th> </tr> <tr class=""> <td class="specs-key">Fabric</td> <td class="specs-value fk-data">Rayon</td> </tr> <tr class=""> <td class="specs-key">Fit</td> <td class="specs-value fk-data">Regular Fit</td> </tr> <tr class=""> <td class="specs-key">Neck</td> <td class="specs-value fk-data">Scoop Neck</td> </tr> <tr class=""> <td class="specs-key">Sleeve</td> <td class="specs-value fk-data">Sleeveless</td> </tr> </table> <table cellspacing="0" class="fk-specs-type2"> <tr> <th class="group-head" colspan="2">Fabric Care</th> </tr> <tr class=""> <td class="specs-value fk-data" colspan="2">Cold Wash</td> </tr> </table> </div>,11:03:2014,None
