LSTPERD9UNRHJUZ2ZVS0L0ORD,Jean Paul Gaultier Classique Eau de Toilette  -  100 ml,http://www.flipkart.com/lifestyle/fragrances-for-women?otracker=hp_nmenu_sub_women_0_Fragrances,Rs. 3510,Fragrances,Perfumes,Jean Paul Gaultier,http://img5a.flixcart.com/image/perfume/z/v/s/eau-de-toilette-women-jean-paul-gaultier-100-classique-400x400-imadjhpr9xjxksng.jpeg,Rs. 5400,None,women,http://www.flipkart.com/jean-paul-gaultier-classique-eau-de-toilette-100-ml/p/itmdtau98jcqgauh?pid=PERD9UNRHJUZ2ZVS&srno=b_1&ref=901b47e9-1322-4349-9e4a-64e938cfea87,WS Retail,Jean Paul Gaultier Classique Eau de Toilette - 100 ml - Price in India  Buy Jean Paul Gaultier Classique Eau de Toilette - 100 ml Online In India  Reviews  Ratings & Features | Flipkart.com,Flipkart.com: Buy Jean Paul Gaultier Classique Eau de Toilette - 100 ml for Rs. 3780.0 from Flipkart.com. - Lowest Prices  Only Genuine Products  30 Day Replacement Guarantee  Free Shipping. Cash On,[],<div class="item_left_column" id="description"> <h3 class="item_desc_title fk-uppercase">Jean Paul Gaultier Classique Eau de Toilette  -  100 ml (For Women)         Price: Rs.3510</h3> <div class="cls"></div> <div class="item_desc_text line"> <div style="float:right"> </div> <p>   For the woman who celebrates her independence from the shackles of the world  Jean Paul Gaultier presents Classique  a <strong>luxury fragrance</strong> that allows her to wallow in the splendour of being a woman. As she lives through the saga of her life  her strength of mind guarantees her every triumph and this<strong> Eau de Toilette </strong>celebrates each of her victories with elan. As peace floods her heart  her senses fill with the sweet flirtations of the fragrance reminding her yet again of who she is supposed to be.</p> <p>   The iridescent aroma was introduced in<strong> September 2008</strong>; with opening notes of seductive rose and anise  the femininity in you embraces <strong>Jean Paul Gaultier Classique</strong> as it mellows down to playful orange blossom and spicy ginger in the heart. Soft  mellow vanilla and contrasting hot amber sends the senses into a catspin in the dry down. Flirty and independent  the fragrance adds spice to the nice one’s life.</p> <p>   The one-of-a-kind bottle which resembles a statuette which has been inspired by the haute couture collection “Les Madone” incorporates the shapely nuances of the feminine form. The gold accents which spell luxury color your life with light of glamor.</p> <p>    </p> </div> <div style="clear: both;"></div> </div>,<div class="item_left_column" id="specifications"> <h3 class="item_desc_title fk-uppercase">         Specifications of Jean Paul Gaultier Classique Eau de Toilette  -  100 ml (For Women)    </h3> <table cellspacing="0" class="fk-specs-type2"> <tr> <th class="group-head" colspan="2">Fragrance Traits</th> </tr> <tr class=""> <td class="specs-key">Ideal For</td> <td class="specs-value fk-data">Women</td> </tr> <tr class=""> <td class="specs-key">Fragrance Segment</td> <td class="specs-value fk-data">Luxury</td> </tr> <tr class=""> <td class="specs-key">Fragrance Classification</td> <td class="specs-value fk-data">Eau de Toilette</td> </tr> <tr class=""> <td class="specs-key">Fragrance Family</td> <td class="specs-value fk-data">Oriental  Floral</td> </tr> <tr class=""> <td class="specs-key">Quantity</td> <td class="specs-value fk-data">100 ml</td> </tr> </table> <table cellspacing="0" class="fk-specs-type2"> <tr> <th class="group-head" colspan="2">Fragrance Notes</th> </tr> <tr class=""> <td class="specs-key">Top Note</td> <td class="specs-value fk-data">Rose  Star Anise</td> </tr> <tr class=""> <td class="specs-key">Heart Note</td> <td class="specs-value fk-data">Orange Blossom  Ginger</td> </tr> <tr class=""> <td class="specs-key">Base Note</td> <td class="specs-value fk-data">Vanilla  Amberwood</td> </tr> </table> </div>,10:03:2014,None
LSTPERDKWCBW4SHHAYEH82CLT,Jean Paul Gaultier Ma Dame Eau de Toilette  -  100 ml,http://www.flipkart.com/lifestyle/fragrances-for-women?otracker=hp_nmenu_sub_women_0_Fragrances,Rs. 3849,Fragrances,Perfumes,Jean Paul Gaultier,http://img5a.flixcart.com/image/perfume/a/y/e/eau-de-toilette-women-jean-paul-gaultier-100-ma-dame-400x400-imadkwhrcte2azxa.jpeg,Rs. 4999,None,women,http://www.flipkart.com/jean-paul-gaultier-ma-dame-eau-de-toilette-100-ml/p/itmdtaudfjhhz45v?pid=PERDKWCBW4SHHAYE&srno=b_2&ref=901b47e9-1322-4349-9e4a-64e938cfea87,perfume2order,Jean Paul Gaultier Ma Dame Eau de Toilette - 100 ml - Price in India  Buy Jean Paul Gaultier Ma Dame Eau de Toilette - 100 ml Online In India  Reviews  Ratings & Features | Flipkart.com,Flipkart.com: Buy Jean Paul Gaultier Ma Dame Eau de Toilette - 100 ml for Rs. 0.0 from Flipkart.com. - Lowest Prices  Only Genuine Products  30 Day Replacement Guarantee  Free Shipping. Cash On,[],<div class="item_left_column" id="description"> <h3 class="item_desc_title fk-uppercase">Jean Paul Gaultier Ma Dame Eau de Toilette  -  100 ml (For Women)         Price: Rs.3849</h3> <div class="cls"></div> <div class="item_desc_text line"> <div style="float:right"> </div>                         Create a stir wherever you go wearing this heavenly fragrance from Jean Paul Gaultier. This fresh floral fragrance opens with notes of juicy and sour orange  followed by fresh roses sprinkled with grenadine syrup on the background of musk and cedar. So wear it on and create an aura of freshness everywhere!        </div> <div style="clear: both;"></div> </div>,<div class="item_left_column" id="specifications"> <h3 class="item_desc_title fk-uppercase">         Specifications of Jean Paul Gaultier Ma Dame Eau de Toilette  -  100 ml (For Women)    </h3> <table cellspacing="0" class="fk-specs-type2"> <tr> <th class="group-head" colspan="2">Fragrance Traits</th> </tr> <tr class=""> <td class="specs-key">Ideal For</td> <td class="specs-value fk-data">Women</td> </tr> <tr class=""> <td class="specs-key">Fragrance Classification</td> <td class="specs-value fk-data">Eau de Toilette</td> </tr> <tr class=""> <td class="specs-key">Fragrance Family</td> <td class="specs-value fk-data">Fresh  Floral</td> </tr> <tr class=""> <td class="specs-key">Quantity</td> <td class="specs-value fk-data">100 ml</td> </tr> </table> </div>,10:03:2014,None
LSTPERDK3EP6DGFCPMHZETRDK,Jean Paul Gaultier By Jean Paul Gaultier Eau de Toilette  -  100 ml,http://www.flipkart.com/lifestyle/fragrances-for-women?otracker=hp_nmenu_sub_women_0_Fragrances,Rs. 3525,Fragrances,Perfumes,Jean Paul Gaultier,http://img6a.flixcart.com/image/perfume/p/m/h/eau-de-toilette-jean-paul-gaultier-100-by-jean-paul-gaultier-400x400-imadkxtfge3hyeqd.jpeg,Rs. 5500,None,women,http://www.flipkart.com/jean-paul-gaultier-eau-de-toilette-100-ml/p/itmdthjbzpqzcrry?pid=PERDK3EP6DGFCPMH&srno=b_5&ref=901b47e9-1322-4349-9e4a-64e938cfea87,PerfumeCrush,Jean Paul Gaultier By Jean Paul Gaultier Eau de Toilette - 100 ml - Price in India  Buy Jean Paul Gaultier By Jean Paul Gaultier Eau de Toilette - 100 ml Online In India  Reviews  Ratings & Features | Flipkart.com,Flipkart.com: Buy Jean Paul Gaultier By Jean Paul Gaultier Eau de Toilette - 100 ml for Rs. 0.0 from Flipkart.com. - Lowest Prices  Only Genuine Products  30 Day Replacement Guarantee  Free Shipping. Cash On,[],<div class="item_left_column" id="description"> <h3 class="item_desc_title fk-uppercase">Jean Paul Gaultier By Jean Paul Gaultier Eau de Toilette  -  100 ml (For Women)         Price: Rs.3525</h3> <div class="cls"></div> <div class="item_desc_text line"> <div style="float:right"> </div>                         Jean Paul Gaultier by Jean Paul Gaultier  Launched by the design house of jean paul gaultier in 1993  jean paul gaultier is classified as a sharp  oriental  floral fragrance. This feminine scent possesses a blend of fresh spicy amber  vanilla and wood. It is recommended for daytime wear.?        </div> <div style="clear: both;"></div> </div>,<div class="item_left_column" id="specifications"> <h3 class="item_desc_title fk-uppercase">         Specifications of Jean Paul Gaultier By Jean Paul Gaultier Eau de Toilette  -  100 ml (For Women)    </h3> <table cellspacing="0" class="fk-specs-type2"> <tr> <th class="group-head" colspan="2">Fragrance Traits</th> </tr> <tr class=""> <td class="specs-key">Ideal For</td> <td class="specs-value fk-data">Women</td> </tr> <tr class=""> <td class="specs-key">Fragrance Classification</td> <td class="specs-value fk-data">Eau de Toilette</td> </tr> <tr class=""> <td class="specs-key">Fragrance Family</td> <td class="specs-value fk-data">Oriental  Floral</td> </tr> <tr class=""> <td class="specs-key">Quantity</td> <td class="specs-value fk-data">100 ml</td> </tr> </table> </div>,10:03:2014,None
LSTPERDN3HWRY8YZMK7CQDR66,Jean Paul Gaultier Gaultier 2 Eau de Parfum  -  38 ml,http://www.flipkart.com/lifestyle/fragrances-for-women?otracker=hp_nmenu_sub_women_0_Fragrances,Rs. 4464,Fragrances,Perfumes,Jean Paul Gaultier,http://img5a.flixcart.com/image/perfume/m/k/7/eau-de-parfum-unisex-jean-paul-gaultier-38-gaultier-2-400x400-imadn7jzgf6yybyw.jpeg,Rs. 4999,None,women,http://www.flipkart.com/jean-paul-gaultier-2-eau-de-parfum-38-ml/p/itmdtauezvsfmhdk?pid=PERDN3HWRY8YZMK7&srno=b_4&ref=901b47e9-1322-4349-9e4a-64e938cfea87,perfume2order,Jean Paul Gaultier Gaultier 2 Eau de Parfum - 38 ml - Price in India  Buy Jean Paul Gaultier Gaultier 2 Eau de Parfum - 38 ml Online In India  Reviews  Ratings & Features | Flipkart.com,Flipkart.com: Buy Jean Paul Gaultier Gaultier 2 Eau de Parfum - 38 ml for Rs. 0.0 from Flipkart.com. - Lowest Prices  Only Genuine Products  30 Day Replacement Guarantee  Free Shipping. Cash On,[],<div class="item_left_column" id="description"> <h3 class="item_desc_title fk-uppercase">Jean Paul Gaultier Gaultier 2 Eau de Parfum  -  38 ml (For Men)         Price: Rs.4464</h3> <div class="cls"></div> <div class="item_desc_text line"> <div style="float:right"> </div>                         The long-lasting  scintillating fragrance will surely turn many heads around. You can also gift it to a dear one! Refreshing and rejuvenating  this perfume is a catch!        </div> <div style="clear: both;"></div> </div>,<div class="item_left_column" id="specifications"> <h3 class="item_desc_title fk-uppercase">         Specifications of Jean Paul Gaultier Gaultier 2 Eau de Parfum  -  38 ml (For Men)    </h3> <table cellspacing="0" class="fk-specs-type2"> <tr> <th class="group-head" colspan="2">Fragrance Traits</th> </tr> <tr class=""> <td class="specs-key">Ideal For</td> <td class="specs-value fk-data">Men</td> </tr> <tr class=""> <td class="specs-key">Fragrance Classification</td> <td class="specs-value fk-data">Eau de Parfum</td> </tr> <tr class=""> <td class="specs-key">Fragrance Family</td> <td class="specs-value fk-data">Oriental</td> </tr> <tr class=""> <td class="specs-key">Quantity</td> <td class="specs-value fk-data">38 ml</td> </tr> </table> </div>,10:03:2014,None
LSTPERDNF86ZWSAGBJX446ECG,Jean Paul Gaultier Madame Eau de Toilette  -  100 ml,http://www.flipkart.com/lifestyle/fragrances-for-women?otracker=hp_nmenu_sub_women_0_Fragrances,Rs. 4225,Fragrances,Perfumes,Jean Paul Gaultier,http://img6a.flixcart.com/image/perfume/b/j/x/eau-de-toilette-women-jean-paul-gaultier-100-madame-400x400-imadnf8rrwmaa8mw.jpeg,Rs. 5000,None,women,http://www.flipkart.com/jean-paul-gaultier-madame-eau-de-toilette-100-ml/p/itmdtaue4c46zm4j?pid=PERDNF86ZWSAGBJX&srno=b_6&ref=901b47e9-1322-4349-9e4a-64e938cfea87,PerfumeCrush,Jean Paul Gaultier Madame Eau de Toilette - 100 ml - Price in India  Buy Jean Paul Gaultier Madame Eau de Toilette - 100 ml Online In India  Reviews  Ratings & Features | Flipkart.com,Flipkart.com: Buy Jean Paul Gaultier Madame Eau de Toilette - 100 ml for Rs. 0.0 from Flipkart.com. - Lowest Prices  Only Genuine Products  30 Day Replacement Guarantee  Free Shipping. Cash On,[],<div class="item_left_column" id="description"> <h3 class="item_desc_title fk-uppercase">Jean Paul Gaultier Madame Eau de Toilette  -  100 ml (For Women)         Price: Rs.4225</h3> <div class="cls"></div> <div class="item_desc_text line"> <div style="float:right"> </div>                         A refreshing fragrance for people who want to mark their presence wherever they go. it creates an aura of freshness and composure.        </div> <div style="clear: both;"></div> </div>,<div class="item_left_column" id="specifications"> <h3 class="item_desc_title fk-uppercase">         Specifications of Jean Paul Gaultier Madame Eau de Toilette  -  100 ml (For Women)    </h3> <table cellspacing="0" class="fk-specs-type2"> <tr> <th class="group-head" colspan="2">In the Box</th> </tr> <tr class=""> <td class="specs-value fk-data" colspan="2">Perfume</td> </tr> </table> <table cellspacing="0" class="fk-specs-type2"> <tr> <th class="group-head" colspan="2">Fragrance Traits</th> </tr> <tr class=""> <td class="specs-key">Ideal For</td> <td class="specs-value fk-data">Women</td> </tr> <tr class=""> <td class="specs-key">Fragrance Classification</td> <td class="specs-value fk-data">Eau de Toilette</td> </tr> <tr class=""> <td class="specs-key">Fragrance Family</td> <td class="specs-value fk-data">Fresh  Floral</td> </tr> <tr class=""> <td class="specs-key">Quantity</td> <td class="specs-value fk-data">100 ml</td> </tr> </table> </div>,10:03:2014,None
LSTPERD9GMBH4HKEEAHXHKYDJ,Jean Paul Gaultier Classiqe Eau de Toilette  -  100 ml,http://www.flipkart.com/lifestyle/fragrances-for-women?otracker=hp_nmenu_sub_women_0_Fragrances,Rs. 3510,Fragrances,Perfumes,Jean Paul Gaultier,http://img6a.flixcart.com/image/perfume/e/a/h/eau-de-toilette-women-jean-paul-gaultier-100-classiqe-400x400-imad9gnkkasjwkrr.jpeg,Rs. 5400,None,women,http://www.flipkart.com/jean-paul-gaultier-classiqe-eau-de-toilette-100-ml/p/itmdtd3bgaypddhp?pid=PERD9GMBH4HKEEAH&srno=b_3&ref=901b47e9-1322-4349-9e4a-64e938cfea87,WS Retail,Jean Paul Gaultier Classiqe Eau de Toilette - 100 ml - Price in India  Buy Jean Paul Gaultier Classiqe Eau de Toilette - 100 ml Online In India  Reviews  Ratings & Features | Flipkart.com,Flipkart.com: Buy Jean Paul Gaultier Classiqe Eau de Toilette - 100 ml for Rs. 3780.0 from Flipkart.com. - Lowest Prices  Only Genuine Products  30 Day Replacement Guarantee  Free Shipping. Cash On,[],<div class="item_left_column" id="description"> <h3 class="item_desc_title fk-uppercase">Jean Paul Gaultier Classiqe Eau de Toilette  -  100 ml (For Women)         Price: Rs.3510</h3> <div class="cls"></div> <div class="item_desc_text line"> <div style="float:right"> </div> <p>   Her chiselled features are the envy of women and her witty banter is the key to your heart. With her head firm on her shoulders and a wardrobe to boot  she’s the toast of the town. Wherever she goes admirers crowd for a glimpse but they have to settle for a twinkle of the eye  a coy smile and a trail of <strong>Jean Paul Gaultier Classique</strong>. Created by esteemed perfumer Jacques Cavallier  this intoxicating <strong>Eau De Toilette </strong>is made for the quintessentially French house of Jean Paul Gaultier.</p> <p>   With pleasing sweet notes of star anise joining hands with delectably feminine extracts of rose  the top note instantly attracts your attention. Moving into the heart note  you can take in the buoyant contrast of fresh floral hints of orange blossom and the vibrant zest of ginger. Trailing off with a base note of creamy rich vanilla with smoky and resinous amber  this decadent combination lulls you into a trance. Wear this entrancing fragrance at any time of the day to add a classic yet chic touch. This <strong>luxury perfume</strong> comes in a meticulously sculpted flacon which flaunt the sensuous curves of the female form. The simple bodice-like decoration on this flacon subtly channels the idea of the perfume’s aroma being the base of your beauty regime. Glowing in a nude hue reminiscent of youthful and blemish-free skin  this perfume radiates a scintillating and luscious aura. A spritz of Classique and mesmerise the town with your delicate charm.</p> </div> <div style="clear: both;"></div> </div>,<div class="item_left_column" id="specifications"> <h3 class="item_desc_title fk-uppercase">         Specifications of Jean Paul Gaultier Classiqe Eau de Toilette  -  100 ml (For Women)    </h3> <table cellspacing="0" class="fk-specs-type2"> <tr> <th class="group-head" colspan="2">Fragrance Traits</th> </tr> <tr class=""> <td class="specs-key">Ideal For</td> <td class="specs-value fk-data">Women</td> </tr> <tr class=""> <td class="specs-key">Fragrance Segment</td> <td class="specs-value fk-data">Luxury</td> </tr> <tr class=""> <td class="specs-key">Fragrance Classification</td> <td class="specs-value fk-data">Eau de Toilette</td> </tr> <tr class=""> <td class="specs-key">Fragrance Family</td> <td class="specs-value fk-data">Floral  Oriental</td> </tr> <tr class=""> <td class="specs-key">Quantity</td> <td class="specs-value fk-data">100 ml</td> </tr> </table> <table cellspacing="0" class="fk-specs-type2"> <tr> <th class="group-head" colspan="2">Fragrance Notes</th> </tr> <tr class=""> <td class="specs-key">Top Note</td> <td class="specs-value fk-data">Rose  Star Anise</td> </tr> <tr class=""> <td class="specs-key">Heart Note</td> <td class="specs-value fk-data">Orange Blossom  Ginger</td> </tr> <tr class=""> <td class="specs-key">Base Note</td> <td class="specs-value fk-data">Vanilla  Amber</td> </tr> </table> </div>,10:03:2014,None
LSTPERDSHPHJTG5FFFGXCG7MV,Jean Paul Gaultier Classique Summer Eau de Parfum  -  100 ml,http://www.flipkart.com/lifestyle/fragrances-for-women?otracker=hp_nmenu_sub_women_0_Fragrances,Rs. 3989,Fragrances,Perfumes,Jean Paul Gaultier,http://img6a.flixcart.com/image/perfume/f/f/g/eau-de-parfum-women-jean-paul-gaultier-100-classique-summer-400x400-imadshxggzgk87cb.jpeg,Rs. 5699,None,women,http://www.flipkart.com/jean-paul-gaultier-classique-summer-eau-de-parfum-100-ml/p/itmdthjefbhsfvgu?pid=PERDSHPHJTG5FFFG&srno=b_7&ref=901b47e9-1322-4349-9e4a-64e938cfea87,WS Retail,Jean Paul Gaultier Classique Summer Eau de Parfum - 100 ml - Price in India  Buy Jean Paul Gaultier Classique Summer Eau de Parfum - 100 ml Online In India  Reviews  Ratings & Features | Flipkart.com,Flipkart.com: Buy Jean Paul Gaultier Classique Summer Eau de Parfum - 100 ml for Rs. 3989.3 from Flipkart.com. - Lowest Prices  Only Genuine Products  30 Day Replacement Guarantee  Free Shipping. Cash On,[],None,<div class="item_left_column" id="specifications"> <h3 class="item_desc_title fk-uppercase">         Specifications of Jean Paul Gaultier Classique Summer Eau de Parfum  -  100 ml (For Women)    </h3> <table cellspacing="0" class="fk-specs-type2"> <tr> <th class="group-head" colspan="2">Fragrance Traits</th> </tr> <tr class=""> <td class="specs-key">Ideal For</td> <td class="specs-value fk-data">Women</td> </tr> <tr class=""> <td class="specs-key">Fragrance Classification</td> <td class="specs-value fk-data">Eau de Parfum</td> </tr> <tr class=""> <td class="specs-key">Fragrance Family</td> <td class="specs-value fk-data">Fresh  Floral  Oriental</td> </tr> <tr class=""> <td class="specs-key">Quantity</td> <td class="specs-value fk-data">100 ml</td> </tr> </table> <table cellspacing="0" class="fk-specs-type2"> <tr> <th class="group-head" colspan="2">Fragrance Notes</th> </tr> <tr class=""> <td class="specs-key">Top Note</td> <td class="specs-value fk-data">Orange Blossom  Clementine  Sicilian Lemon</td> </tr> <tr class=""> <td class="specs-key">Heart Note</td> <td class="specs-value fk-data">Lily of the Valley  Ylang-ylang  White Iris  Sambac Jasmine  Rose</td> </tr> <tr class=""> <td class="specs-key">Base Note</td> <td class="specs-value fk-data">Vanilla  Musk  Amber</td> </tr> </table> </div>,10:03:2014,None
