LSTKRTDRHF2HZGYHEJVPKMRTP,Aparnaa Casual 3/4 Sleeve Printed Women's Kurti,http://www.flipkart.com/womens-clothing?otracker=hp_nmenu_sub_women_0_Clothing,Rs. 1699,Clothing,Maternity Wear,Aparnaa,http://img6a.flixcart.com/image/kurti/d/n/m/ap625-325yellow-aparna-m-400x400-imadrf54msfeqfhe.jpeg,Rs. 2555,Yellow::White,women,http://www.flipkart.com/aparnaa-casual-3-4-sleeve-printed-women-s-kurti/p/itmdsa7mg8qmnxwx?pid=KRTDRHF2HZGYHEJV&srno=b_1&ref=f3632b04-8f10-4a8f-b2f4-38a5e822c05a,Aparnaa,Aparnaa Casual 3/4 Sleeve Printed Women's Kurti - Buy Yellow::White Aparnaa Casual 3/4 Sleeve Printed Women's Kurti Online at Best Prices in India | Flipkart.com,Aparnaa Casual 3/4 Sleeve Printed Women's Kurti - Buy Yellow::White Aparnaa Casual 3/4 Sleeve Printed Women's Kurti For Only Rs. 0.0 Online in India. Shop Online For Apparels. Huge Collection of Branded Clothes Only at,['M'  'L'  'XL'  'XXL'],None,<div class="item_left_column" id="specifications"> <h3 class="item_desc_title fk-uppercase">         Specifications of Aparnaa Casual 3/4 Sleeve Printed Women's Kurti    </h3> <table cellspacing="0" class="fk-specs-type2"> <tr> <th class="group-head" colspan="2">General Details<a class="see-more unitExt rmargin10 no-underline" href="javascript:void(0);" onclick="$(this).closest('.fk-specs-type2').toggleClass('expandedMore')" title="Expand">[+]</a><a class="hidden unitExt rmargin10 no-underline" href="javascript:void(0);" onclick="$(this).closest('.fk-specs-type2').toggleClass('expandedMore')" title="Collapse">[-]</a></th> </tr> <tr class="hidden"> <td class="specs-key">Ideal For</td> <td class="specs-value fk-data">Women's</td> </tr> <tr class="hidden"> <td class="specs-key">Occasion</td> <td class="specs-value fk-data">Casual</td> </tr> <tr class="hidden"> <td class="specs-key">Pattern</td> <td class="specs-value fk-data">Printed</td> </tr> </table> <table cellspacing="0" class="fk-specs-type2"> <tr> <th class="group-head" colspan="2">Kurti Details</th> </tr> <tr class=""> <td class="specs-key">Sleeve</td> <td class="specs-value fk-data">3/4 Sleeve</td> </tr> </table> </div>,10:03:2014,None
LSTTUNDTFUFVY3JCARRSBEWQY,Aparnaa Self Design Women's Tunic,http://www.flipkart.com/womens-clothing?otracker=hp_nmenu_sub_women_0_Clothing,Rs. 1699,Clothing,Maternity Wear,Aparnaa,http://img6a.flixcart.com/image/tunic/a/r/r/590-958pink-aparnaa-xxl-400x400-imadt22ac7fes4gf.jpeg,Rs. 2695,Black,women,http://www.flipkart.com/aparnaa-self-design-women-s-tunic/p/itmdtfuhup5zgkve?pid=TUNDTFUFVY3JCARR&srno=b_13&ref=f3632b04-8f10-4a8f-b2f4-38a5e822c05a,Aparnaa,Aparnaa Self Design Women's Tunic - Buy Pink Aparnaa Self Design Women's Tunic Online at Best Prices in India | Flipkart.com,Aparnaa Self Design Women's Tunic - Buy Pink Aparnaa Self Design Women's Tunic For Only Rs. 0.0 Online in India. Shop Online For Apparels. Huge Collection of Branded Clothes Only at,['S'  'M'  'L'  'XXL'],<div class="item_left_column" id="description"> <h3 class="item_desc_title fk-uppercase">Aparnaa Self Design Women's Tunic         Price: Rs.1699</h3> <div class="cls"></div> <div class="item_desc_text line"> <div style="float:right"> </div>                         Aparnaa Embroidered Pure Georgette Tunics.        </div> <div style="clear: both;"></div> </div>,<div class="item_left_column" id="specifications"> <h3 class="item_desc_title fk-uppercase">         Specifications of Aparnaa Self Design Women's Tunic    </h3> <table cellspacing="0" class="fk-specs-type2"> <tr> <th class="group-head" colspan="2">General Details<a class="see-more unitExt rmargin10 no-underline" href="javascript:void(0);" onclick="$(this).closest('.fk-specs-type2').toggleClass('expandedMore')" title="Expand">[+]</a><a class="hidden unitExt rmargin10 no-underline" href="javascript:void(0);" onclick="$(this).closest('.fk-specs-type2').toggleClass('expandedMore')" title="Collapse">[-]</a></th> </tr> <tr class="hidden"> <td class="specs-key">Ideal For</td> <td class="specs-value fk-data">Women's</td> </tr> <tr class="hidden"> <td class="specs-key">Occasion</td> <td class="specs-value fk-data">Formal  Casual</td> </tr> <tr class="hidden"> <td class="specs-key">Pattern</td> <td class="specs-value fk-data">Self Design</td> </tr> </table> <table cellspacing="0" class="fk-specs-type2"> <tr> <th class="group-head" colspan="2">Tunic Details</th> </tr> <tr class=""> <td class="specs-key">Fabric</td> <td class="specs-value fk-data">Georgette</td> </tr> <tr class=""> <td class="specs-key">Sleeve</td> <td class="specs-value fk-data">Half Sleeve</td> </tr> </table> <table cellspacing="0" class="fk-specs-type2"> <tr> <th class="group-head" colspan="2">Fabric Care</th> </tr> <tr class=""> <td class="specs-value fk-data" colspan="2">Dry Wash Preffered</td> </tr> </table> <table cellspacing="0" class="fk-specs-type2"> <tr> <th class="group-head" colspan="2">In the Box</th> </tr> <tr class=""> <td class="specs-key"> </td> <td class="specs-value fk-data">Tunic</td> </tr> </table> </div>,10:03:2014,None
LSTSARDR9K3XFYBPZ8XV94TVF,Aparnaa Rajshahi Printed Embroidered Embellished Chiffon Sari,http://www.flipkart.com/womens-clothing?otracker=hp_nmenu_sub_women_0_Clothing,Rs. 4099,Clothing,Maternity Wear,Aparnaa,http://img5a.flixcart.com/image/sari/z/8/x/ap229-c179red-aparnaa-400x400-imadr9gsyfcgyv8z.jpeg,Rs. 6115,Red::Black,women,http://www.flipkart.com/aparnaa-rajshahi-printed-embroidered-embellished-chiffon-sari/p/itmdr9k39yvxfgqq?pid=SARDR9K3XFYBPZ8X&srno=b_11&ref=84e4238b-6b56-41c4-8825-cbbf52d5e34a,Aparnaa,Aparnaa Rajshahi Printed Embroidered Embellished Chiffon Sari - Buy Red::Black Aparnaa Rajshahi Printed Embroidered Embellished Chiffon Sari Online at Best Prices in India | Flipkart.com,Aparnaa Rajshahi Printed Embroidered Embellished Chiffon Sari - Buy Red::Black Aparnaa Rajshahi Printed Embroidered Embellished Chiffon Sari For Only Rs. 0.0 Online in India. Shop Online For Apparels. Huge Collection of,[],None,<div class="item_left_column" id="specifications"> <h3 class="item_desc_title fk-uppercase">         Specifications of Aparnaa Rajshahi Printed Embroidered Embellished Chiffon Sari    </h3> <table cellspacing="0" class="fk-specs-type2"> <tr> <th class="group-head" colspan="2">General Details<a class="see-more unitExt rmargin10 no-underline" href="javascript:void(0);" onclick="$(this).closest('.fk-specs-type2').toggleClass('expandedMore')" title="Expand">[+]</a><a class="hidden unitExt rmargin10 no-underline" href="javascript:void(0);" onclick="$(this).closest('.fk-specs-type2').toggleClass('expandedMore')" title="Collapse">[-]</a></th> </tr> <tr class="hidden"> <td class="specs-key">Occasion</td> <td class="specs-value fk-data">Party  Casual</td> </tr> <tr class="hidden"> <td class="specs-key">Pattern</td> <td class="specs-value fk-data">Printed</td> </tr> </table> <table cellspacing="0" class="fk-specs-type2"> <tr> <th class="group-head" colspan="2">Sari Details</th> </tr> <tr class=""> <td class="specs-key">Type</td> <td class="specs-value fk-data">Rajshahi</td> </tr> <tr class=""> <td class="specs-key">Fabric</td> <td class="specs-value fk-data">Chiffon</td> </tr> </table> </div>,10:03:2014,None
LSTKRTDRHF2HZGYHEJVPKMRTP,Aparnaa Casual 3/4 Sleeve Printed Women's Kurti,http://www.flipkart.com/womens-clothing?otracker=hp_nmenu_sub_women_0_Clothing,Rs. 1699,Clothing,Maternity Wear,Aparnaa,http://img6a.flixcart.com/image/kurti/d/n/m/ap625-325yellow-aparna-m-400x400-imadrf54msfeqfhe.jpeg,Rs. 2555,Yellow::White,women,http://www.flipkart.com/aparnaa-casual-3-4-sleeve-printed-women-s-kurti/p/itmdsa7mg8qmnxwx?pid=KRTDRHF2HZGYHEJV&srno=b_2&ref=84e4238b-6b56-41c4-8825-cbbf52d5e34a,Aparnaa,Aparnaa Casual 3/4 Sleeve Printed Women's Kurti - Buy Yellow::White Aparnaa Casual 3/4 Sleeve Printed Women's Kurti Online at Best Prices in India | Flipkart.com,Aparnaa Casual 3/4 Sleeve Printed Women's Kurti - Buy Yellow::White Aparnaa Casual 3/4 Sleeve Printed Women's Kurti For Only Rs. 0.0 Online in India. Shop Online For Apparels. Huge Collection of Branded Clothes Only at,['M'  'L'  'XL'  'XXL'],None,<div class="item_left_column" id="specifications"> <h3 class="item_desc_title fk-uppercase">         Specifications of Aparnaa Casual 3/4 Sleeve Printed Women's Kurti    </h3> <table cellspacing="0" class="fk-specs-type2"> <tr> <th class="group-head" colspan="2">General Details<a class="see-more unitExt rmargin10 no-underline" href="javascript:void(0);" onclick="$(this).closest('.fk-specs-type2').toggleClass('expandedMore')" title="Expand">[+]</a><a class="hidden unitExt rmargin10 no-underline" href="javascript:void(0);" onclick="$(this).closest('.fk-specs-type2').toggleClass('expandedMore')" title="Collapse">[-]</a></th> </tr> <tr class="hidden"> <td class="specs-key">Ideal For</td> <td class="specs-value fk-data">Women's</td> </tr> <tr class="hidden"> <td class="specs-key">Occasion</td> <td class="specs-value fk-data">Casual</td> </tr> <tr class="hidden"> <td class="specs-key">Pattern</td> <td class="specs-value fk-data">Printed</td> </tr> </table> <table cellspacing="0" class="fk-specs-type2"> <tr> <th class="group-head" colspan="2">Kurti Details</th> </tr> <tr class=""> <td class="specs-key">Sleeve</td> <td class="specs-value fk-data">3/4 Sleeve</td> </tr> </table> </div>,10:03:2014,None
LSTPANDHFQAWVF7ZQ872LBNZO,Morph Maternity Women's Maternity Panty,http://www.flipkart.com/womens-clothing?otracker=hp_nmenu_sub_women_0_Clothing,Rs. 234,Clothing,Maternity Wear,Aparnaa,http://img5a.flixcart.com/image/panty/q/8/7/mphs013colbl000light-blue-morph-maternity-l-400x400-imadkpgak5p2way3.jpeg,Rs. 275,Green  Light Blue,women,http://www.flipkart.com/morph-maternity-women-s-panty/p/itmdhtgxy4xhjhxr?pid=PANDHFQAWVF7ZQ87&srno=b_3&ref=84e4238b-6b56-41c4-8825-cbbf52d5e34a,WS Retail,Morph Maternity Women's Maternity Panty - Buy Light Blue  Green Morph Maternity Women's Maternity Panty Online at Best Prices in India | Flipkart.com,Morph Maternity Women's Maternity Panty - Buy Light Blue  Green Morph Maternity Women's Maternity Panty For Only Rs. 275.0 Online in India. Shop Online For Apparels. Huge Collection of Branded Clothes Only at,['M'  'L'],<div class="item_left_column" id="description"> <h3 class="item_desc_title fk-uppercase">Morph Maternity Women's Maternity Panty         Price: Rs.234</h3> <div class="cls"></div> <div class="item_desc_text line"> <div style="float:right"> </div> <p>   Those crucial few weeks require the maximum care and these soft maternity panties from Morph Maternity provide you gentle support and fit. Made from pure cotton  these panties give you unmatched comfort throughout your expectant weeks.</p> </div> <div style="clear: both;"></div> </div>,<div class="item_left_column" id="specifications"> <h3 class="item_desc_title fk-uppercase">         Specifications of Morph Maternity Women's Maternity Panty    </h3> <table cellspacing="0" class="fk-specs-type2"> <tr> <th class="group-head" colspan="2">General Details<a class="see-more unitExt rmargin10 no-underline" href="javascript:void(0);" onclick="$(this).closest('.fk-specs-type2').toggleClass('expandedMore')" title="Expand">[+]</a><a class="hidden unitExt rmargin10 no-underline" href="javascript:void(0);" onclick="$(this).closest('.fk-specs-type2').toggleClass('expandedMore')" title="Collapse">[-]</a></th> </tr> <tr class="hidden"> <td class="specs-key">Ideal For</td> <td class="specs-value fk-data">Women's</td> </tr> <tr class="hidden"> <td class="specs-key">Occasion</td> <td class="specs-value fk-data">Casual</td> </tr> <tr class="hidden"> <td class="specs-key">Pattern</td> <td class="specs-value fk-data">Solid</td> </tr> </table> <table cellspacing="0" class="fk-specs-type2"> <tr> <th class="group-head" colspan="2">Panty Details</th> </tr> <tr class=""> <td class="specs-key">Type</td> <td class="specs-value fk-data">Maternity</td> </tr> <tr class=""> <td class="specs-key">Fabric</td> <td class="specs-value fk-data">100% Cotton</td> </tr> <tr class=""> <td class="specs-key">Design</td> <td class="specs-value fk-data">Logo Print Below Waistband</td> </tr> </table> <table cellspacing="0" class="fk-specs-type2"> <tr> <th class="group-head" colspan="2">Fabric Care</th> </tr> <tr class=""> <td class="specs-value fk-data" colspan="2">Do Not Wring  Machine Wash at 40°C  Do Not Bleach  Do Not Iron</td> </tr> </table> <table cellspacing="0" class="fk-specs-type2"> <tr> <th class="group-head" colspan="2">Additional Details<a class="see-more unitExt rmargin10 no-underline" href="javascript:void(0);" onclick="$(this).closest('.fk-specs-type2').toggleClass('expandedMore')" title="Expand">[+]</a><a class="hidden unitExt rmargin10 no-underline" href="javascript:void(0);" onclick="$(this).closest('.fk-specs-type2').toggleClass('expandedMore')" title="Collapse">[-]</a></th> </tr> <tr class="hidden"> <td class="specs-key"> </td> <td class="specs-value fk-data">Elasticated Waistband and Leghole</td> </tr> </table> </div>,10:03:2014,None
LSTKTADQXFBE5KC3HPKIFRSEV,Morph Maternity Women's Kurta,http://www.flipkart.com/womens-clothing?otracker=hp_nmenu_sub_women_0_Clothing,Rs. 1395,Clothing,Maternity Wear,Aparnaa,http://img5a.flixcart.com/image/kurta/n/y/h/ekav865ikorg0-morph-maternity-l-400x400-imadrch6ffpxzpgv.jpeg,Rs. 1395,Orange,women,http://www.flipkart.com/morph-maternity-women-s-kurta/p/itmdqxfcmtz7zszq?pid=KTADQXFBE5KC3HPK&srno=b_8&ref=84e4238b-6b56-41c4-8825-cbbf52d5e34a,WS Retail,Morph Maternity Women's Kurta - Buy Orange Morph Maternity Women's Kurta Online at Best Prices in India | Flipkart.com,Morph Maternity Women's Kurta - Buy Orange Morph Maternity Women's Kurta For Only Rs. 1395.0 Online in India. Shop Online For Apparels. Huge Collection of Branded Clothes Only at,['S'  'M'  'L'],None,<div class="item_left_column" id="specifications"> <h3 class="item_desc_title fk-uppercase">         Specifications of Morph Maternity Women's Kurta    </h3> <table cellspacing="0" class="fk-specs-type2"> <tr> <th class="group-head" colspan="2">General Details<a class="see-more unitExt rmargin10 no-underline" href="javascript:void(0);" onclick="$(this).closest('.fk-specs-type2').toggleClass('expandedMore')" title="Expand">[+]</a><a class="hidden unitExt rmargin10 no-underline" href="javascript:void(0);" onclick="$(this).closest('.fk-specs-type2').toggleClass('expandedMore')" title="Collapse">[-]</a></th> </tr> <tr class="hidden"> <td class="specs-key">Ideal For</td> <td class="specs-value fk-data">Women's</td> </tr> </table> <table cellspacing="0" class="fk-specs-type2"> <tr> <th class="group-head" colspan="2">Kurta Details</th> </tr> <tr class=""> <td class="specs-key">Fabric</td> <td class="specs-value fk-data">100% Cotton</td> </tr> </table> <table cellspacing="0" class="fk-specs-type2"> <tr> <th class="group-head" colspan="2">Additional Details<a class="see-more unitExt rmargin10 no-underline" href="javascript:void(0);" onclick="$(this).closest('.fk-specs-type2').toggleClass('expandedMore')" title="Expand">[+]</a><a class="hidden unitExt rmargin10 no-underline" href="javascript:void(0);" onclick="$(this).closest('.fk-specs-type2').toggleClass('expandedMore')" title="Collapse">[-]</a></th> </tr> <tr class="hidden"> <td class="specs-key">Style Code</td> <td class="specs-value fk-data">EKAV865IKORG0</td> </tr> </table> </div>,10:03:2014,None
LSTKTADQXFBE5KC3HPKIFRSEV,Morph Maternity Women's Kurta,http://www.flipkart.com/womens-clothing?otracker=hp_nmenu_sub_women_0_Clothing,Rs. 1395,Clothing,Maternity Wear,Aparnaa,http://img5a.flixcart.com/image/kurta/n/y/h/ekav865ikorg0-morph-maternity-l-400x400-imadrch6ffpxzpgv.jpeg,Rs. 1395,Orange,women,http://www.flipkart.com/morph-maternity-women-s-kurta/p/itmdqxfcmtz7zszq?pid=KTADQXFBE5KC3HPK&srno=b_4&ref=f3632b04-8f10-4a8f-b2f4-38a5e822c05a,WS Retail,Morph Maternity Women's Kurta - Buy Orange Morph Maternity Women's Kurta Online at Best Prices in India | Flipkart.com,Morph Maternity Women's Kurta - Buy Orange Morph Maternity Women's Kurta For Only Rs. 1395.0 Online in India. Shop Online For Apparels. Huge Collection of Branded Clothes Only at,['S'  'M'  'L'],None,<div class="item_left_column" id="specifications"> <h3 class="item_desc_title fk-uppercase">         Specifications of Morph Maternity Women's Kurta    </h3> <table cellspacing="0" class="fk-specs-type2"> <tr> <th class="group-head" colspan="2">General Details<a class="see-more unitExt rmargin10 no-underline" href="javascript:void(0);" onclick="$(this).closest('.fk-specs-type2').toggleClass('expandedMore')" title="Expand">[+]</a><a class="hidden unitExt rmargin10 no-underline" href="javascript:void(0);" onclick="$(this).closest('.fk-specs-type2').toggleClass('expandedMore')" title="Collapse">[-]</a></th> </tr> <tr class="hidden"> <td class="specs-key">Ideal For</td> <td class="specs-value fk-data">Women's</td> </tr> </table> <table cellspacing="0" class="fk-specs-type2"> <tr> <th class="group-head" colspan="2">Kurta Details</th> </tr> <tr class=""> <td class="specs-key">Fabric</td> <td class="specs-value fk-data">100% Cotton</td> </tr> </table> <table cellspacing="0" class="fk-specs-type2"> <tr> <th class="group-head" colspan="2">Additional Details<a class="see-more unitExt rmargin10 no-underline" href="javascript:void(0);" onclick="$(this).closest('.fk-specs-type2').toggleClass('expandedMore')" title="Expand">[+]</a><a class="hidden unitExt rmargin10 no-underline" href="javascript:void(0);" onclick="$(this).closest('.fk-specs-type2').toggleClass('expandedMore')" title="Collapse">[-]</a></th> </tr> <tr class="hidden"> <td class="specs-key">Style Code</td> <td class="specs-value fk-data">EKAV865IKORG0</td> </tr> </table> </div>,10:03:2014,None
LSTKTADQXFBVGDXWYQXAT9FAI,Morph Maternity Women's Kurta,http://www.flipkart.com/womens-clothing?otracker=hp_nmenu_sub_women_0_Clothing,Rs. 1299,Clothing,Maternity Wear,Aparnaa,http://img5a.flixcart.com/image/kurta/c/c/e/ekav776ikrbl0-morph-maternity-l-400x400-imadrcqauujqjvdy.jpeg,Rs. 1299,Blue,women,http://www.flipkart.com/morph-maternity-women-s-kurta/p/itmdqxfcmxzcs8yz?pid=KTADQXFBVGDXWYQX&srno=b_6&ref=84e4238b-6b56-41c4-8825-cbbf52d5e34a,WS Retail,Morph Maternity Women's Kurta - Buy Blue Morph Maternity Women's Kurta Online at Best Prices in India | Flipkart.com,Morph Maternity Women's Kurta - Buy Blue Morph Maternity Women's Kurta For Only Rs. 1299.0 Online in India. Shop Online For Apparels. Huge Collection of Branded Clothes Only at,['S'  'M'  'L'],None,<div class="item_left_column" id="specifications"> <h3 class="item_desc_title fk-uppercase">         Specifications of Morph Maternity Women's Kurta    </h3> <table cellspacing="0" class="fk-specs-type2"> <tr> <th class="group-head" colspan="2">General Details<a class="see-more unitExt rmargin10 no-underline" href="javascript:void(0);" onclick="$(this).closest('.fk-specs-type2').toggleClass('expandedMore')" title="Expand">[+]</a><a class="hidden unitExt rmargin10 no-underline" href="javascript:void(0);" onclick="$(this).closest('.fk-specs-type2').toggleClass('expandedMore')" title="Collapse">[-]</a></th> </tr> <tr class="hidden"> <td class="specs-key">Ideal For</td> <td class="specs-value fk-data">Women's</td> </tr> </table> <table cellspacing="0" class="fk-specs-type2"> <tr> <th class="group-head" colspan="2">Kurta Details</th> </tr> <tr class=""> <td class="specs-key">Fabric</td> <td class="specs-value fk-data">100% Cotton</td> </tr> </table> <table cellspacing="0" class="fk-specs-type2"> <tr> <th class="group-head" colspan="2">Additional Details<a class="see-more unitExt rmargin10 no-underline" href="javascript:void(0);" onclick="$(this).closest('.fk-specs-type2').toggleClass('expandedMore')" title="Expand">[+]</a><a class="hidden unitExt rmargin10 no-underline" href="javascript:void(0);" onclick="$(this).closest('.fk-specs-type2').toggleClass('expandedMore')" title="Collapse">[-]</a></th> </tr> <tr class="hidden"> <td class="specs-key">Style Code</td> <td class="specs-value fk-data">EKAV776IKRBL0</td> </tr> </table> </div>,10:03:2014,None
LSTPANDHFQAN2XSJFFJNH2LID,Morph Maternity Women's Maternity Panty Panty,http://www.flipkart.com/womens-clothing?otracker=hp_nmenu_sub_women_0_Clothing,Rs. 275,Clothing,Maternity Wear,Aparnaa,http://img5a.flixcart.com/image/panty/f/f/j/mphs011colpk00light-pink-morph-maternity-xl-400x400-imadmv9xzjjqfjgh.jpeg,Rs. 275,Light Pink,women,http://www.flipkart.com/morph-maternity-women-s-panty/p/itmdmwg7ufrydh8m?pid=PANDHFQAN2XSJFFJ&srno=b_14&ref=84e4238b-6b56-41c4-8825-cbbf52d5e34a,WS Retail,Morph Maternity Women's Maternity Panty Panty - Buy Light Pink Morph Maternity Women's Maternity Panty Panty Online at Best Prices in India | Flipkart.com,Morph Maternity Women's Maternity Panty Panty - Buy Light Pink Morph Maternity Women's Maternity Panty Panty For Only Rs. 275.0 Online in India. Shop Online For Apparels. Huge Collection of Branded Clothes Only at,[],<div class="item_left_column" id="description"> <h3 class="item_desc_title fk-uppercase">Morph Maternity Women's Maternity Panty Panty         Price: Rs.275</h3> <div class="cls"></div> <div class="item_desc_text line"> <div style="float:right"> </div> <p style="text-align: justify;">   Morph Maternity designs inners for pregnant women that gives them comfort. Crafted from <strong>100 per cent cotton</strong> the panty is a must-have in your wardrobe. The elasticated waistband and leg openings give you a good grip.</p> </div> <div style="clear: both;"></div> </div>,<div class="item_left_column" id="specifications"> <h3 class="item_desc_title fk-uppercase">         Specifications of Morph Maternity Women's Maternity Panty Panty    </h3> <table cellspacing="0" class="fk-specs-type2"> <tr> <th class="group-head" colspan="2">General Details<a class="see-more unitExt rmargin10 no-underline" href="javascript:void(0);" onclick="$(this).closest('.fk-specs-type2').toggleClass('expandedMore')" title="Expand">[+]</a><a class="hidden unitExt rmargin10 no-underline" href="javascript:void(0);" onclick="$(this).closest('.fk-specs-type2').toggleClass('expandedMore')" title="Collapse">[-]</a></th> </tr> <tr class="hidden"> <td class="specs-key">Ideal For</td> <td class="specs-value fk-data">Women's</td> </tr> <tr class="hidden"> <td class="specs-key">Occasion</td> <td class="specs-value fk-data">Casual</td> </tr> <tr class="hidden"> <td class="specs-key">Pattern</td> <td class="specs-value fk-data">Solid</td> </tr> </table> <table cellspacing="0" class="fk-specs-type2"> <tr> <th class="group-head" colspan="2">Panty Details</th> </tr> <tr class=""> <td class="specs-key">Type</td> <td class="specs-value fk-data">Maternity Panty</td> </tr> <tr class=""> <td class="specs-key">Fabric</td> <td class="specs-value fk-data">100% Cotton</td> </tr> <tr class=""> <td class="specs-key">Design</td> <td class="specs-value fk-data">Logo Print at Front</td> </tr> </table> <table cellspacing="0" class="fk-specs-type2"> <tr> <th class="group-head" colspan="2">Fabric Care</th> </tr> <tr class=""> <td class="specs-value fk-data" colspan="2">Machine Wash at 50°C  Do Not Iron  Do Not Bleach  Do Not Wring</td> </tr> </table> <table cellspacing="0" class="fk-specs-type2"> <tr> <th class="group-head" colspan="2">Additional Details<a class="see-more unitExt rmargin10 no-underline" href="javascript:void(0);" onclick="$(this).closest('.fk-specs-type2').toggleClass('expandedMore')" title="Expand">[+]</a><a class="hidden unitExt rmargin10 no-underline" href="javascript:void(0);" onclick="$(this).closest('.fk-specs-type2').toggleClass('expandedMore')" title="Collapse">[-]</a></th> </tr> <tr class="hidden"> <td class="specs-key"> </td> <td class="specs-value fk-data">Elasticated Waistband and Leg Opening</td> </tr> </table> </div>,10:03:2014,None
