LSTSLBDQ4H5XFFNSHGUDIYC7E,Adore Me White Wild Sling Bag,http://www.flipkart.com/lifestyle/bags-wallets-belts/women?otracker=hp_nmenu_sub_women_0_Bags%2C%20Belts%20and%20wallets,Rs. 2250,Bags  Belts and wallets,Slingbags,Adore Me,http://img6a.flixcart.com/image/sling-bag/h/g/u/cl-bag-05-adore-me-white-wild-400x400-imadq529jsjbd8zq.jpeg,Rs. 2350,Black  Brown  White,women,http://www.flipkart.com/adore-me-white-wild-sling-bag/p/itmdq4h5hzmjmvqb?pid=SLBDQ4H5XFFNSHGU&srno=b_1&ref=b7cea0ba-0d84-4184-9a73-7d3a7a80cfb8,ADOREME,Adore Me White Wild Sling Bag Black  Brown  White - Price in India | Flipkart.com,Flipkart.com: Buy Adore Me White Wild Sling Bag for Rs. 2250 from Flipkart.com. Only Genuine Products. 30 Day Replacement Guarantee. Free Shipping. Cash On,[],<div class="item_left_column" id="description"> <h3 class="item_desc_title fk-uppercase">Adore Me White Wild Sling Bag (Black  Brown  White)         Price: Rs.2250</h3> <div class="cls"></div> <div class="item_desc_text line"> <div style="float:right"> </div>                         Edgy and sharp  this satchel sports a zebra pattern and is topped with short handles. The dominant red colors appeal in the achromatic color palette conjures up a semi-formal and classic look.        </div> <div style="clear: both;"></div> </div>,<div class="item_left_column" id="specifications"> <h3 class="item_desc_title fk-uppercase">         Specifications of Adore Me White Wild Sling Bag (Black  Brown  White)    </h3> <table cellspacing="0" class="fk-specs-type2"> <tr> <th class="group-head" colspan="2">General</th> </tr> <tr class=""> <td class="specs-key">Ideal For</td> <td class="specs-value fk-data">Women</td> </tr> <tr class=""> <td class="specs-key">Material</td> <td class="specs-value fk-data">Cotton Velvet  Artificial Leather</td> </tr> <tr class=""> <td class="specs-key">Style Code</td> <td class="specs-value fk-data">CL-BAG-05</td> </tr> <tr class=""> <td class="specs-key">Color Code</td> <td class="specs-value fk-data">Black  Brown  White</td> </tr> </table> </div>,11:03:2014,None
LSTSLBDQ4H5ZHD7Z8FGLCCLTV,Adore Me Butterfly Blues Sling Bag,http://www.flipkart.com/lifestyle/bags-wallets-belts/women?otracker=hp_nmenu_sub_women_0_Bags%2C%20Belts%20and%20wallets,Rs. 1271,Bags  Belts and wallets,Slingbags,Adore Me,http://img5a.flixcart.com/image/sling-bag/8/f/g/cl-bag-38-adore-me-butterfly-blues-400x400-imadq529n2ysdxfv.jpeg,Rs. 1371,Multi-color,women,http://www.flipkart.com/adore-me-butterfly-blues-sling-bag/p/itmdq4h5xzuzzsjn?pid=SLBDQ4H5ZHD7Z8FG&srno=b_5&ref=b7cea0ba-0d84-4184-9a73-7d3a7a80cfb8,ADOREME,Adore Me Butterfly Blues Sling Bag Muliti-color - Price in India | Flipkart.com,Flipkart.com: Buy Adore Me Butterfly Blues Sling Bag for Rs. 1271 from Flipkart.com. Only Genuine Products. 30 Day Replacement Guarantee. Free Shipping. Cash On,[],<div class="item_left_column" id="description"> <h3 class="item_desc_title fk-uppercase">Adore Me Butterfly Blues Sling Bag (Muliti-color)         Price: Rs.1271</h3> <div class="cls"></div> <div class="item_desc_text line"> <div style="float:right"> </div>                         Brighten up your wardrobe with Adore Me's butterfly blues . Exquisitely crafted  this deceptively spacious sling bag will work well for summer garden parties.        </div> <div style="clear: both;"></div> </div>,<div class="item_left_column" id="specifications"> <h3 class="item_desc_title fk-uppercase">         Specifications of Adore Me Butterfly Blues Sling Bag (Muliti-color)    </h3> <table cellspacing="0" class="fk-specs-type2"> <tr> <th class="group-head" colspan="2">General</th> </tr> <tr class=""> <td class="specs-key">Ideal For</td> <td class="specs-value fk-data">Women</td> </tr> <tr class=""> <td class="specs-key">Material</td> <td class="specs-value fk-data">Artificial Leather  Plain Weave Cotton</td> </tr> <tr class=""> <td class="specs-key">Style Code</td> <td class="specs-value fk-data">CL-BAG-38</td> </tr> <tr class=""> <td class="specs-key">Color Code</td> <td class="specs-value fk-data">Muliti-color</td> </tr> </table> </div>,11:03:2014,None
LSTSLBDQ4H5R3GYKQGQGLKYYW,Adore Me Nomad Luxe Sling Bag,http://www.flipkart.com/lifestyle/bags-wallets-belts/women?otracker=hp_nmenu_sub_women_0_Bags%2C%20Belts%20and%20wallets,Rs. 1789,Bags  Belts and wallets,Slingbags,Adore Me,http://img5a.flixcart.com/image/sling-bag/q/g/q/cl-bag-30-adore-me-nomad-luxe-400x400-imadq52aydxn6jta.jpeg,Rs. 1889,Brown,women,http://www.flipkart.com/adore-me-nomad-luxe-sling-bag/p/itmdq4h5udafunzc?pid=SLBDQ4H5R3GYKQGQ&srno=b_6&ref=b7cea0ba-0d84-4184-9a73-7d3a7a80cfb8,ADOREME,Adore Me Nomad Luxe Sling Bag Brown - Price in India | Flipkart.com,Flipkart.com: Buy Adore Me Nomad Luxe Sling Bag for Rs. 1789 from Flipkart.com. Only Genuine Products. 30 Day Replacement Guarantee. Free Shipping. Cash On,[],<div class="item_left_column" id="description"> <h3 class="item_desc_title fk-uppercase">Adore Me Nomad Luxe Sling Bag (Brown)         Price: Rs.1789</h3> <div class="cls"></div> <div class="item_desc_text line"> <div style="float:right"> </div>                         A practical and stylish choice of bag with extra roomy space and comfortable to carry  this Sling bag will lend a street smart look to any outfit.        </div> <div style="clear: both;"></div> </div>,<div class="item_left_column" id="specifications"> <h3 class="item_desc_title fk-uppercase">         Specifications of Adore Me Nomad Luxe Sling Bag (Brown)    </h3> <table cellspacing="0" class="fk-specs-type2"> <tr> <th class="group-head" colspan="2">General</th> </tr> <tr class=""> <td class="specs-key">Ideal For</td> <td class="specs-value fk-data">Women</td> </tr> <tr class=""> <td class="specs-key">Material</td> <td class="specs-value fk-data">Plain Weave Fabric  Artificial Leather</td> </tr> <tr class=""> <td class="specs-key">Style Code</td> <td class="specs-value fk-data">CL-BAG-30</td> </tr> <tr class=""> <td class="specs-key">Color Code</td> <td class="specs-value fk-data">Brown</td> </tr> </table> </div>,11:03:2014,None
LSTSLBDQ4H5BRMUNEZH43AIJS,Adore Me Gun Metal Sling Bag,http://www.flipkart.com/lifestyle/bags-wallets-belts/women?otracker=hp_nmenu_sub_women_0_Bags%2C%20Belts%20and%20wallets,Rs. 2400,Bags  Belts and wallets,Slingbags,Adore Me,http://img6a.flixcart.com/image/sling-bag/e/z/h/cl-bag-14-adore-me-gun-metal-400x400-imadq52a7hqhrpy5.jpeg,Rs. 2500,Beige  Blue  White,women,http://www.flipkart.com/adore-me-gun-metal-sling-bag/p/itmdq4h5tzndsmyq?pid=SLBDQ4H5BRMUNEZH&srno=b_7&ref=b7cea0ba-0d84-4184-9a73-7d3a7a80cfb8,ADOREME,Adore Me Gun Metal Sling Bag White  Beige  Blue - Price in India | Flipkart.com,Flipkart.com: Buy Adore Me Gun Metal Sling Bag for Rs. 2400 from Flipkart.com. Only Genuine Products. 30 Day Replacement Guarantee. Free Shipping. Cash On,[],<div class="item_left_column" id="description"> <h3 class="item_desc_title fk-uppercase">Adore Me Gun Metal Sling Bag (White  Beige  Blue)         Price: Rs.2400</h3> <div class="cls"></div> <div class="item_desc_text line"> <div style="float:right"> </div>                         An upscale medley of prints a lends sophisticated savvy look to a toned handbag with a generously proportioned body composed of Pu and textile fabric        </div> <div style="clear: both;"></div> </div>,<div class="item_left_column" id="specifications"> <h3 class="item_desc_title fk-uppercase">         Specifications of Adore Me Gun Metal Sling Bag (White  Beige  Blue)    </h3> <table cellspacing="0" class="fk-specs-type2"> <tr> <th class="group-head" colspan="2">General</th> </tr> <tr class=""> <td class="specs-key">Ideal For</td> <td class="specs-value fk-data">Women</td> </tr> <tr class=""> <td class="specs-key">Material</td> <td class="specs-value fk-data">Pile Weave Fabric  Artificial Leather</td> </tr> <tr class=""> <td class="specs-key">Style Code</td> <td class="specs-value fk-data">CL-BAG-14</td> </tr> <tr class=""> <td class="specs-key">Color Code</td> <td class="specs-value fk-data">White  Beige  Blue</td> </tr> </table> </div>,11:03:2014,None
LSTSLBDQ4H5BGVADPCQZLB0LE,Adore Me Pretty Please Sling Bag,http://www.flipkart.com/lifestyle/bags-wallets-belts/women?otracker=hp_nmenu_sub_women_0_Bags%2C%20Belts%20and%20wallets,Rs. 2141,Bags  Belts and wallets,Slingbags,Adore Me,http://img6a.flixcart.com/image/sling-bag/p/c/q/cl-bag-36-adore-me-pretty-please-400x400-imadq5296gpuwujs.jpeg,Rs. 2241,Blue  Brown  Yellow,women,http://www.flipkart.com/adore-me-pretty-please-sling-bag/p/itmdq4h5yrccnaus?pid=SLBDQ4H5BGVADPCQ&srno=b_4&ref=b7cea0ba-0d84-4184-9a73-7d3a7a80cfb8,ADOREME,Adore Me Pretty Please Sling Bag Blue  Yellow  Brown - Price in India | Flipkart.com,Flipkart.com: Buy Adore Me Pretty Please Sling Bag for Rs. 2141 from Flipkart.com. Only Genuine Products. 30 Day Replacement Guarantee. Free Shipping. Cash On,[],<div class="item_left_column" id="description"> <h3 class="item_desc_title fk-uppercase">Adore Me Pretty Please Sling Bag (Blue  Yellow  Brown)         Price: Rs.2141</h3> <div class="cls"></div> <div class="item_desc_text line"> <div style="float:right"> </div>                         A stylish nomad cut from courdroy cloth and topped with Pu fits all your fun-time essentials.        </div> <div style="clear: both;"></div> </div>,<div class="item_left_column" id="specifications"> <h3 class="item_desc_title fk-uppercase">         Specifications of Adore Me Pretty Please Sling Bag (Blue  Yellow  Brown)    </h3> <table cellspacing="0" class="fk-specs-type2"> <tr> <th class="group-head" colspan="2">General</th> </tr> <tr class=""> <td class="specs-key">Ideal For</td> <td class="specs-value fk-data">Women</td> </tr> <tr class=""> <td class="specs-key">Material</td> <td class="specs-value fk-data">Artificail Leather  Lourdroy</td> </tr> <tr class=""> <td class="specs-key">Style Code</td> <td class="specs-value fk-data">CL-BAG-36</td> </tr> <tr class=""> <td class="specs-key">Color Code</td> <td class="specs-value fk-data">Blue  Yellow  Brown</td> </tr> </table> </div>,11:03:2014,None
LSTSLBDQ4H5DHZZGWFGQYQS3W,Adore Me Purple Haze Sling Bag,http://www.flipkart.com/lifestyle/bags-wallets-belts/women?otracker=hp_nmenu_sub_women_0_Bags%2C%20Belts%20and%20wallets,Rs. 1750,Bags  Belts and wallets,Slingbags,Adore Me,http://img5a.flixcart.com/image/sling-bag/w/f/g/cl-bag-16-adore-me-purple-haze-400x400-imadq52afese6mtk.jpeg,Rs. 1850,Beige  Brown  Purple,women,http://www.flipkart.com/adore-me-purple-haze-sling-bag/p/itmdq4h56jthbnct?pid=SLBDQ4H5DHZZGWFG&srno=b_12&ref=b7cea0ba-0d84-4184-9a73-7d3a7a80cfb8,ADOREME,Adore Me Purple Haze Sling Bag Beige  Purple  Brown - Price in India | Flipkart.com,Flipkart.com: Buy Adore Me Purple Haze Sling Bag for Rs. 1750 from Flipkart.com. Only Genuine Products. 30 Day Replacement Guarantee. Free Shipping. Cash On,[],<div class="item_left_column" id="description"> <h3 class="item_desc_title fk-uppercase">Adore Me Purple Haze Sling Bag (Beige  Purple  Brown)         Price: Rs.1750</h3> <div class="cls"></div> <div class="item_desc_text line"> <div style="float:right"> </div>                         A meticulously tailored non leather Satchel topped with a sleek strap. Demure  sober and spacious  it blends synonymously into any wardrobe.        </div> <div style="clear: both;"></div> </div>,<div class="item_left_column" id="specifications"> <h3 class="item_desc_title fk-uppercase">         Specifications of Adore Me Purple Haze Sling Bag (Beige  Purple  Brown)    </h3> <table cellspacing="0" class="fk-specs-type2"> <tr> <th class="group-head" colspan="2">General</th> </tr> <tr class=""> <td class="specs-key">Ideal For</td> <td class="specs-value fk-data">Women</td> </tr> <tr class=""> <td class="specs-key">Material</td> <td class="specs-value fk-data">Artificial Leather  Basket Weave Fabric</td> </tr> <tr class=""> <td class="specs-key">Style Code</td> <td class="specs-value fk-data">CL-BAG-16</td> </tr> <tr class=""> <td class="specs-key">Color Code</td> <td class="specs-value fk-data">Beige  Purple  Brown</td> </tr> </table> </div>,11:03:2014,None
LSTSLBDQ4H5HQNPZGVUBGTOXW,Adore Me Paisley Delight Sling Bag,http://www.flipkart.com/lifestyle/bags-wallets-belts/women?otracker=hp_nmenu_sub_women_0_Bags%2C%20Belts%20and%20wallets,Rs. 1650,Bags  Belts and wallets,Slingbags,Adore Me,http://img5a.flixcart.com/image/sling-bag/g/v/u/cl-bag-06-adore-me-paisley-delight-400x400-imadq52cmyant4qg.jpeg,Rs. 1750,Green  Grey,women,http://www.flipkart.com/adore-me-paisley-delight-sling-bag/p/itmdq4h6bu9zec7b?pid=SLBDQ4H5HQNPZGVU&srno=b_8&ref=b7cea0ba-0d84-4184-9a73-7d3a7a80cfb8,ADOREME,Adore Me Paisley Delight Sling Bag Green  Grey - Price in India | Flipkart.com,Flipkart.com: Buy Adore Me Paisley Delight Sling Bag for Rs. 1650 from Flipkart.com. Only Genuine Products. 30 Day Replacement Guarantee. Free Shipping. Cash On,[],<div class="item_left_column" id="description"> <h3 class="item_desc_title fk-uppercase">Adore Me Paisley Delight Sling Bag (Green  Grey)         Price: Rs.1650</h3> <div class="cls"></div> <div class="item_desc_text line"> <div style="float:right"> </div>                         Exquisitely patterned and textured fabric this with flattened long handles increases the versatility of the chic piece. A tailored Satchel designed with prim and proper proportions promises endless wear.        </div> <div style="clear: both;"></div> </div>,<div class="item_left_column" id="specifications"> <h3 class="item_desc_title fk-uppercase">         Specifications of Adore Me Paisley Delight Sling Bag (Green  Grey)    </h3> <table cellspacing="0" class="fk-specs-type2"> <tr> <th class="group-head" colspan="2">General</th> </tr> <tr class=""> <td class="specs-key">Ideal For</td> <td class="specs-value fk-data">Women</td> </tr> <tr class=""> <td class="specs-key">Material</td> <td class="specs-value fk-data">Courdroy  Suede Fabric  Artificial Leather</td> </tr> <tr class=""> <td class="specs-key">Style Code</td> <td class="specs-value fk-data">CL-BAG-06</td> </tr> <tr class=""> <td class="specs-key">Color Code</td> <td class="specs-value fk-data">Green  Grey</td> </tr> </table> </div>,11:03:2014,None
LSTSLBDQ4H58YTPNK9GLFEWSV,Adore Me Hawaiian Nights Sling Bag,http://www.flipkart.com/lifestyle/bags-wallets-belts/women?otracker=hp_nmenu_sub_women_0_Bags%2C%20Belts%20and%20wallets,Rs. 1508,Bags  Belts and wallets,Slingbags,Adore Me,http://img5a.flixcart.com/image/sling-bag/k/9/g/cl-bag-35-adore-me-hawaiian-nights-400x400-imadq5297rjewghj.jpeg,Rs. 1608,Grey  Pink,women,http://www.flipkart.com/adore-me-hawaiian-nights-sling-bag/p/itmdq4h5ktm3xd7g?pid=SLBDQ4H58YTPNK9G&srno=b_11&ref=b7cea0ba-0d84-4184-9a73-7d3a7a80cfb8,ADOREME,Adore Me Hawaiian Nights Sling Bag Pink  Grey - Price in India | Flipkart.com,Flipkart.com: Buy Adore Me Hawaiian Nights Sling Bag for Rs. 1508 from Flipkart.com. Only Genuine Products. 30 Day Replacement Guarantee. Free Shipping. Cash On,[],<div class="item_left_column" id="description"> <h3 class="item_desc_title fk-uppercase">Adore Me Hawaiian Nights Sling Bag (Pink  Grey)         Price: Rs.1508</h3> <div class="cls"></div> <div class="item_desc_text line"> <div style="float:right"> </div>                         A practical and stylish choice of bag with extra roomy space and comfortable to carry  this Sling bag will lend a street smart look to any outfit.        </div> <div style="clear: both;"></div> </div>,<div class="item_left_column" id="specifications"> <h3 class="item_desc_title fk-uppercase">         Specifications of Adore Me Hawaiian Nights Sling Bag (Pink  Grey)    </h3> <table cellspacing="0" class="fk-specs-type2"> <tr> <th class="group-head" colspan="2">General</th> </tr> <tr class=""> <td class="specs-key">Ideal For</td> <td class="specs-value fk-data">Women</td> </tr> <tr class=""> <td class="specs-key">Material</td> <td class="specs-value fk-data">Suede  Artificail Leather</td> </tr> <tr class=""> <td class="specs-key">Style Code</td> <td class="specs-value fk-data">CL-BAG-35</td> </tr> <tr class=""> <td class="specs-key">Color Code</td> <td class="specs-value fk-data">Pink  Grey</td> </tr> </table> </div>,11:03:2014,None
LSTSLBDQ4H5GTB5FYXY00F4G2,Adore Me Stripe Life Sling Bag,http://www.flipkart.com/lifestyle/bags-wallets-belts/women?otracker=hp_nmenu_sub_women_0_Bags%2C%20Belts%20and%20wallets,Rs. 1800,Bags  Belts and wallets,Slingbags,Adore Me,http://img6a.flixcart.com/image/sling-bag/y/x/y/cl-bag-09-adore-me-stripe-life-400x400-imadq52bvvsxcktg.jpeg,Rs. 1900,Pink  White,women,http://www.flipkart.com/adore-me-stripe-life-sling-bag/p/itmdq4h5umvbeda8?pid=SLBDQ4H5GTB5FYXY&srno=b_3&ref=b7cea0ba-0d84-4184-9a73-7d3a7a80cfb8,ADOREME,Adore Me Stripe Life Sling Bag White  Pink - Price in India | Flipkart.com,Flipkart.com: Buy Adore Me Stripe Life Sling Bag for Rs. 1800 from Flipkart.com. Only Genuine Products. 30 Day Replacement Guarantee. Free Shipping. Cash On,[],<div class="item_left_column" id="description"> <h3 class="item_desc_title fk-uppercase">Adore Me Stripe Life Sling Bag (White  Pink)         Price: Rs.1800</h3> <div class="cls"></div> <div class="item_desc_text line"> <div style="float:right"> </div>                         An upscale medley of prints and colors lends sophisticated savvy to a toned Satchel with a generously proportioned body composed of Pu and textile fabric.        </div> <div style="clear: both;"></div> </div>,<div class="item_left_column" id="specifications"> <h3 class="item_desc_title fk-uppercase">         Specifications of Adore Me Stripe Life Sling Bag (White  Pink)    </h3> <table cellspacing="0" class="fk-specs-type2"> <tr> <th class="group-head" colspan="2">General</th> </tr> <tr class=""> <td class="specs-key">Ideal For</td> <td class="specs-value fk-data">Women</td> </tr> <tr class=""> <td class="specs-key">Material</td> <td class="specs-value fk-data">Suede Fabric  Multi Coloured Tribal Weave Fabric  Artificial Leather</td> </tr> <tr class=""> <td class="specs-key">Style Code</td> <td class="specs-value fk-data">CL-BAG-09</td> </tr> <tr class=""> <td class="specs-key">Color Code</td> <td class="specs-value fk-data">White  Pink</td> </tr> </table> </div>,11:03:2014,None
LSTSLBDQ4H5SA3VFEHQVDLSLA,Adore Me Brown Ben Sling Bag,http://www.flipkart.com/lifestyle/bags-wallets-belts/women?otracker=hp_nmenu_sub_women_0_Bags%2C%20Belts%20and%20wallets,Rs. 2250,Bags  Belts and wallets,Slingbags,Adore Me,http://img5a.flixcart.com/image/sling-bag/e/h/q/cl-bag-08-adore-me-brown-ben-400x400-imadq52bhefvgn3c.jpeg,Rs. 2350,Beige  Brown,women,http://www.flipkart.com/adore-me-brown-ben-sling-bag/p/itmdq4h5kyzv9mvc?pid=SLBDQ4H5SA3VFEHQ&srno=b_9&ref=b7cea0ba-0d84-4184-9a73-7d3a7a80cfb8,ADOREME,Adore Me Brown Ben Sling Bag Brown  Beige - Price in India | Flipkart.com,Flipkart.com: Buy Adore Me Brown Ben Sling Bag for Rs. 2250 from Flipkart.com. Only Genuine Products. 30 Day Replacement Guarantee. Free Shipping. Cash On,[],<div class="item_left_column" id="description"> <h3 class="item_desc_title fk-uppercase">Adore Me Brown Ben Sling Bag (Brown  Beige)         Price: Rs.2250</h3> <div class="cls"></div> <div class="item_desc_text line"> <div style="float:right"> </div>                         A practical and stylish choice of bag in white and black with extra roomy space and comfortable to carry  this satchel will lend a street smart look to any outfit.        </div> <div style="clear: both;"></div> </div>,<div class="item_left_column" id="specifications"> <h3 class="item_desc_title fk-uppercase">         Specifications of Adore Me Brown Ben Sling Bag (Brown  Beige)    </h3> <table cellspacing="0" class="fk-specs-type2"> <tr> <th class="group-head" colspan="2">General</th> </tr> <tr class=""> <td class="specs-key">Ideal For</td> <td class="specs-value fk-data">Women</td> </tr> <tr class=""> <td class="specs-key">Material</td> <td class="specs-value fk-data">Artificial Leather  Courdroy  Two Tone Basket Weave Fabric</td> </tr> <tr class=""> <td class="specs-key">Style Code</td> <td class="specs-value fk-data">CL-BAG-08</td> </tr> <tr class=""> <td class="specs-key">Color Code</td> <td class="specs-value fk-data">Brown  Beige</td> </tr> </table> </div>,11:03:2014,None
LSTSLBDQ4H5CGEN7KGCAKJAF6,Adore Me Mellow Yellow Sling Bag,http://www.flipkart.com/lifestyle/bags-wallets-belts/women?otracker=hp_nmenu_sub_women_0_Bags%2C%20Belts%20and%20wallets,Rs. 1700,Bags  Belts and wallets,Slingbags,Adore Me,http://img6a.flixcart.com/image/sling-bag/k/g/c/cl-bag-10-adore-me-mellow-yellow-400x400-imadq52bupbw97hr.jpeg,Rs. 1800,White  Yellow,women,http://www.flipkart.com/adore-me-mellow-yellow-sling-bag/p/itmdq4h5gwp7vr8s?pid=SLBDQ4H5CGEN7KGC&srno=b_2&ref=b7cea0ba-0d84-4184-9a73-7d3a7a80cfb8,ADOREME,Adore Me Mellow Yellow Sling Bag Yellow  White - Price in India | Flipkart.com,Flipkart.com: Buy Adore Me Mellow Yellow Sling Bag for Rs. 1700 from Flipkart.com. Only Genuine Products. 30 Day Replacement Guarantee. Free Shipping. Cash On,[],<div class="item_left_column" id="description"> <h3 class="item_desc_title fk-uppercase">Adore Me Mellow Yellow Sling Bag (Yellow  White)         Price: Rs.1700</h3> <div class="cls"></div> <div class="item_desc_text line"> <div style="float:right"> </div>                         A practical and stylish choice of bag with extra roomy space and comfortable to carry  this satchel will lend a street smart look to any outfit.        </div> <div style="clear: both;"></div> </div>,<div class="item_left_column" id="specifications"> <h3 class="item_desc_title fk-uppercase">         Specifications of Adore Me Mellow Yellow Sling Bag (Yellow  White)    </h3> <table cellspacing="0" class="fk-specs-type2"> <tr> <th class="group-head" colspan="2">General</th> </tr> <tr class=""> <td class="specs-key">Ideal For</td> <td class="specs-value fk-data">Women</td> </tr> <tr class=""> <td class="specs-key">Material</td> <td class="specs-value fk-data">Artificial Leather  Twill Weave Fabric  Plain Weave Viscose</td> </tr> <tr class=""> <td class="specs-key">Style Code</td> <td class="specs-value fk-data">CL-BAG-10</td> </tr> <tr class=""> <td class="specs-key">Color Code</td> <td class="specs-value fk-data">Yellow  White</td> </tr> </table> </div>,11:03:2014,None
LSTSLBDQ4H5YYWVDRNND9DGPV,Adore Me Exotic Floral Sling Bag,http://www.flipkart.com/lifestyle/bags-wallets-belts/women?otracker=hp_nmenu_sub_women_0_Bags%2C%20Belts%20and%20wallets,Rs. 1794,Bags  Belts and wallets,Slingbags,Adore Me,http://img5a.flixcart.com/image/sling-bag/r/n/n/cl-bag-39-adore-me-exotic-floral-400x400-imadq529497gagmf.jpeg,Rs. 1894,Multi-color,women,http://www.flipkart.com/adore-me-exotic-floral-sling-bag/p/itmdq4h5zz5jcjup?pid=SLBDQ4H5YYWVDRNN&srno=b_10&ref=b7cea0ba-0d84-4184-9a73-7d3a7a80cfb8,ADOREME,Adore Me Exotic Floral Sling Bag Muliti-color - Price in India | Flipkart.com,Flipkart.com: Buy Adore Me Exotic Floral Sling Bag for Rs. 1794 from Flipkart.com. Only Genuine Products. 30 Day Replacement Guarantee. Free Shipping. Cash On,[],<div class="item_left_column" id="description"> <h3 class="item_desc_title fk-uppercase">Adore Me Exotic Floral Sling Bag (Muliti-color)         Price: Rs.1794</h3> <div class="cls"></div> <div class="item_desc_text line"> <div style="float:right"> </div>                         Exquisitely patterned and textured fabric this with long chain handles increases the versatility of the chic piece. A tailored satchel designed with prim and proper proportions promises endless wear.        </div> <div style="clear: both;"></div> </div>,<div class="item_left_column" id="specifications"> <h3 class="item_desc_title fk-uppercase">         Specifications of Adore Me Exotic Floral Sling Bag (Muliti-color)    </h3> <table cellspacing="0" class="fk-specs-type2"> <tr> <th class="group-head" colspan="2">General</th> </tr> <tr class=""> <td class="specs-key">Ideal For</td> <td class="specs-value fk-data">Women</td> </tr> <tr class=""> <td class="specs-key">Material</td> <td class="specs-value fk-data">Artificial Leather  Plain Weave Cotton</td> </tr> <tr class=""> <td class="specs-key">Style Code</td> <td class="specs-value fk-data">CL-BAG-39</td> </tr> <tr class=""> <td class="specs-key">Color Code</td> <td class="specs-value fk-data">Muliti-color</td> </tr> </table> </div>,11:03:2014,None
