LSTTOPDQX5FXDHSG7JYJLLIHW,Morph Maternity Casual Women's Top,http://www.flipkart.com/womens-clothing?otracker=hp_nmenu_sub_women_0_Clothing,Rs. 545,Clothing,Maternity Wear,Dyefab,http://img6a.flixcart.com/image/top/7/j/y/cktp605kclav0-morph-maternity-l-400x400-imadrch6kfcqx52b.jpeg,Rs. 545,Purple,women,http://www.flipkart.com/morph-maternity-casual-women-s-top/p/itmdqx5he5m2kghy?pid=TOPDQX5FXDHSG7JY&srno=b_41&ref=e802217e-17dd-480c-a2ef-e5f619edbc8c,WS Retail,Morph Maternity Casual Women's Top - Buy Purple Morph Maternity Casual Women's Top Online at Best Prices in India | Flipkart.com,Morph Maternity Casual Women's Top - Buy Purple Morph Maternity Casual Women's Top For Only Rs. 545.0 Online in India. Shop Online For Apparels. Huge Collection of Branded Clothes Only at,['S'  'M'],None,<div class="item_left_column" id="specifications"> <h3 class="item_desc_title fk-uppercase">         Specifications of Morph Maternity Casual Women's Top    </h3> <table cellspacing="0" class="fk-specs-type2"> <tr> <th class="group-head" colspan="2">General Details<a class="see-more unitExt rmargin10 no-underline" href="javascript:void(0);" onclick="$(this).closest('.fk-specs-type2').toggleClass('expandedMore')" title="Expand">[+]</a><a class="hidden unitExt rmargin10 no-underline" href="javascript:void(0);" onclick="$(this).closest('.fk-specs-type2').toggleClass('expandedMore')" title="Collapse">[-]</a></th> </tr> <tr class="hidden"> <td class="specs-key">Ideal For</td> <td class="specs-value fk-data">Women's</td> </tr> <tr class="hidden"> <td class="specs-key">Occasion</td> <td class="specs-value fk-data">Casual</td> </tr> </table> <table cellspacing="0" class="fk-specs-type2"> <tr> <th class="group-head" colspan="2">Top Details</th> </tr> <tr class=""> <td class="specs-key">Fabric</td> <td class="specs-value fk-data">Knit Cotton</td> </tr> </table> <table cellspacing="0" class="fk-specs-type2"> <tr> <th class="group-head" colspan="2">Fabric Care</th> </tr> <tr class=""> <td class="specs-value fk-data" colspan="2">Hand or Machine Wash in Normal Cycle</td> </tr> </table> <table cellspacing="0" class="fk-specs-type2"> <tr> <th class="group-head" colspan="2">Additional Details<a class="see-more unitExt rmargin10 no-underline" href="javascript:void(0);" onclick="$(this).closest('.fk-specs-type2').toggleClass('expandedMore')" title="Expand">[+]</a><a class="hidden unitExt rmargin10 no-underline" href="javascript:void(0);" onclick="$(this).closest('.fk-specs-type2').toggleClass('expandedMore')" title="Collapse">[-]</a></th> </tr> <tr class="hidden"> <td class="specs-key"> </td> <td class="specs-value fk-data">Round neck Inverted box pleats at Neckline Flutter sleeve Satin ribbon</td> </tr> </table> </div>,10:03:2014,None
LSTJEADQX4QN56BHHY65GT5G6,Morph Maternity Women's Jeans,http://www.flipkart.com/womens-clothing?otracker=hp_nmenu_sub_women_0_Clothing,Rs. 1187,Clothing,Maternity Wear,Dyefab,http://img6a.flixcart.com/image/jean/c/h/q/dphs850ldlbl0-morph-maternity-s-400x400-imadryszzxtu5zfa.jpeg,Rs. 1695,Blue,women,http://www.flipkart.com/morph-maternity-women-s-jeans/p/itmdqxfbqz6xtfg8?pid=JEADQX4QN56BHHY6&srno=b_33&ref=e802217e-17dd-480c-a2ef-e5f619edbc8c,WS Retail,Morph Maternity Women's Jeans - Buy Blue Morph Maternity Women's Jeans Online at Best Prices in India | Flipkart.com,Morph Maternity Women's Jeans - Buy Blue Morph Maternity Women's Jeans For Only Rs. 1695.0 Online in India. Shop Online For Apparels. Huge Collection of Branded Clothes Only at,['S'  'M'  'L'  'XL'],None,<div class="item_left_column" id="specifications"> <h3 class="item_desc_title fk-uppercase">         Specifications of Morph Maternity Women's Jeans    </h3> <table cellspacing="0" class="fk-specs-type2"> <tr> <th class="group-head" colspan="2">General Details<a class="see-more unitExt rmargin10 no-underline" href="javascript:void(0);" onclick="$(this).closest('.fk-specs-type2').toggleClass('expandedMore')" title="Expand">[+]</a><a class="hidden unitExt rmargin10 no-underline" href="javascript:void(0);" onclick="$(this).closest('.fk-specs-type2').toggleClass('expandedMore')" title="Collapse">[-]</a></th> </tr> <tr class="hidden"> <td class="specs-key">Ideal For</td> <td class="specs-value fk-data">Women's</td> </tr> <tr class="hidden"> <td class="specs-key">Occasion</td> <td class="specs-value fk-data">Casual</td> </tr> <tr class="hidden"> <td class="specs-key">Pattern</td> <td class="specs-value fk-data">Solid</td> </tr> </table> <table cellspacing="0" class="fk-specs-type2"> <tr> <th class="group-head" colspan="2">Jeans Details</th> </tr> <tr class=""> <td class="specs-key">Fabric</td> <td class="specs-value fk-data">Cotton Blend</td> </tr> <tr class=""> <td class="specs-key">Pockets</td> <td class="specs-value fk-data">Pockets at Front and Back</td> </tr> </table> <table cellspacing="0" class="fk-specs-type2"> <tr> <th class="group-head" colspan="2">Fabric Care</th> </tr> <tr class=""> <td class="specs-value fk-data" colspan="2">Machine Wash Cold  Do Not Bleach  Tumble Dry Low  Cool Iron  Do Not Wring  Gentle Cycle</td> </tr> </table> <table cellspacing="0" class="fk-specs-type2"> <tr> <th class="group-head" colspan="2">Additional Details<a class="see-more unitExt rmargin10 no-underline" href="javascript:void(0);" onclick="$(this).closest('.fk-specs-type2').toggleClass('expandedMore')" title="Expand">[+]</a><a class="hidden unitExt rmargin10 no-underline" href="javascript:void(0);" onclick="$(this).closest('.fk-specs-type2').toggleClass('expandedMore')" title="Collapse">[-]</a></th> </tr> <tr class="hidden"> <td class="specs-key">Style Code</td> <td class="specs-value fk-data">DPHS850LDLBL0</td> </tr> <tr class="hidden"> <td class="specs-key">Other Details</td> <td class="specs-value fk-data">Sky blue denim pant Straight fit High belly panel provides maximum support Back pocket detailing</td> </tr> <tr class="hidden"> <td class="specs-key">Model Details</td> <td class="specs-value fk-data">This model has a height of 5 feet 7 inches   Waist 28 inches   Hip 35 inches and is wearing a Jeans of Size S</td> </tr> </table> </div>,10:03:2014,None
LSTSARDSBCBGHQZHG97KCV0JN,Dyefab Geometric Print Chiffon Sari,http://www.flipkart.com/womens-clothing?otracker=hp_nmenu_sub_women_0_Clothing,Rs. 604,Clothing,Maternity Wear,Dyefab,http://img5a.flixcart.com/image/sari/g/9/7/kubsr10065ps-dyefab-400x400-imadszgjwhcg2ttj.jpeg,Rs. 604,Green,women,http://www.flipkart.com/dyefab-geometric-print-chiffon-sari/p/itmdsn783tv8nebf?pid=SARDSBCBGHQZHG97&srno=b_32&ref=e802217e-17dd-480c-a2ef-e5f619edbc8c,FABDEAL,Dyefab Geometric Print Chiffon Sari - Buy Green Dyefab Geometric Print Chiffon Sari Online at Best Prices in India | Flipkart.com,Dyefab Geometric Print Chiffon Sari - Buy Green Dyefab Geometric Print Chiffon Sari For Only Rs. 0.0 Online in India. Shop Online For Apparels. Huge Collection of Branded Clothes Only at,[],<div class="item_left_column" id="description"> <h3 class="item_desc_title fk-uppercase">Dyefab Geometric Print Chiffon Sari         Price: Rs.604</h3> <div class="cls"></div> <div class="item_desc_text line"> <div style="float:right"> </div>                         Get ready to grab this most fascinating piece from Fabdeal house that assures to be a unique piece this season. One has to take a pick on this marvelous saree which carries green in colored marble chiffon fabrication. Adjoin it to your wardrobe for a newly fashioned getup like never before.        </div> <div style="clear: both;"></div> </div>,<div class="item_left_column" id="specifications"> <h3 class="item_desc_title fk-uppercase">         Specifications of Dyefab Geometric Print Chiffon Sari    </h3> <table cellspacing="0" class="fk-specs-type2"> <tr> <th class="group-head" colspan="2">General Details<a class="see-more unitExt rmargin10 no-underline" href="javascript:void(0);" onclick="$(this).closest('.fk-specs-type2').toggleClass('expandedMore')" title="Expand">[+]</a><a class="hidden unitExt rmargin10 no-underline" href="javascript:void(0);" onclick="$(this).closest('.fk-specs-type2').toggleClass('expandedMore')" title="Collapse">[-]</a></th> </tr> <tr class="hidden"> <td class="specs-key">Occasion</td> <td class="specs-value fk-data">Casual</td> </tr> <tr class="hidden"> <td class="specs-key">Pattern</td> <td class="specs-value fk-data">Geometric Print</td> </tr> </table> <table cellspacing="0" class="fk-specs-type2"> <tr> <th class="group-head" colspan="2">Sari Details</th> </tr> <tr class=""> <td class="specs-key">Type</td> <td class="specs-value fk-data">Kosa</td> </tr> <tr class=""> <td class="specs-key">Fabric</td> <td class="specs-value fk-data">Chiffon</td> </tr> <tr class=""> <td class="specs-key">Region</td> <td class="specs-value fk-data">Gujarat</td> </tr> <tr class=""> <td class="specs-key">Number of Contents in Sales Package</td> <td class="specs-value fk-data">Pack of 1</td> </tr> <tr class=""> <td class="specs-key">Blouse Piece</td> <td class="specs-value fk-data">Yes</td> </tr> </table> <table cellspacing="0" class="fk-specs-type2"> <tr> <th class="group-head" colspan="2">Dimensions</th> </tr> <tr class=""> <td class="specs-key">Length</td> <td class="specs-value fk-data">6.3 m</td> </tr> </table> <table cellspacing="0" class="fk-specs-type2"> <tr> <th class="group-head" colspan="2">Fabric Care</th> </tr> <tr class=""> <td class="specs-value fk-data" colspan="2">Wash and Iron Inside Out</td> </tr> </table> <table cellspacing="0" class="fk-specs-type2"> <tr> <th class="group-head" colspan="2">In The Box</th> </tr> <tr class=""> <td class="specs-key"> </td> <td class="specs-value fk-data">Blouse  Sari</td> </tr> </table> </div>,10:03:2014,None
LSTSARDSBCBZPSJBHRMENYC4N,Dyefab Striped Silk  Jacquard Sari,http://www.flipkart.com/womens-clothing?otracker=hp_nmenu_sub_women_0_Clothing,Rs. 836,Clothing,Maternity Wear,Dyefab,http://img5a.flixcart.com/image/sari/h/r/m/lnksr10140dwt-dyefab-400x400-imadszh6m5qgu7hg.jpeg,Rs. 1194,Green,women,http://www.flipkart.com/dyefab-striped-silk-jacquard-sari/p/itmdsn7attw5hycv?pid=SARDSBCBZPSJBHRM&srno=b_44&ref=e802217e-17dd-480c-a2ef-e5f619edbc8c,FABDEAL,Dyefab Striped Silk  Jacquard Sari - Buy Yellow Dyefab Striped Silk  Jacquard Sari Online at Best Prices in India | Flipkart.com,Dyefab Striped Silk  Jacquard Sari - Buy Yellow Dyefab Striped Silk  Jacquard Sari For Only Rs. 0.0 Online in India. Shop Online For Apparels. Huge Collection of Branded Clothes Only at,[],<div class="item_left_column" id="description"> <h3 class="item_desc_title fk-uppercase">Dyefab Striped Silk  Jacquard Sari         Price: Rs.836</h3> <div class="cls"></div> <div class="item_desc_text line"> <div style="float:right"> </div>                         Here is the perfect match for this season that has come with most appealing and highly praised kota silk fabric that assures to give majestic look through it s material quality and alluring color combination. The yellow color makes you spotting as you step in any special occasion.        </div> <div style="clear: both;"></div> </div>,<div class="item_left_column" id="specifications"> <h3 class="item_desc_title fk-uppercase">         Specifications of Dyefab Striped Silk  Jacquard Sari    </h3> <table cellspacing="0" class="fk-specs-type2"> <tr> <th class="group-head" colspan="2">General Details<a class="see-more unitExt rmargin10 no-underline" href="javascript:void(0);" onclick="$(this).closest('.fk-specs-type2').toggleClass('expandedMore')" title="Expand">[+]</a><a class="hidden unitExt rmargin10 no-underline" href="javascript:void(0);" onclick="$(this).closest('.fk-specs-type2').toggleClass('expandedMore')" title="Collapse">[-]</a></th> </tr> <tr class="hidden"> <td class="specs-key">Occasion</td> <td class="specs-value fk-data">Casual</td> </tr> <tr class="hidden"> <td class="specs-key">Pattern</td> <td class="specs-value fk-data">Striped</td> </tr> </table> <table cellspacing="0" class="fk-specs-type2"> <tr> <th class="group-head" colspan="2">Sari Details</th> </tr> <tr class=""> <td class="specs-key">Type</td> <td class="specs-value fk-data">Kosa</td> </tr> <tr class=""> <td class="specs-key">Fabric</td> <td class="specs-value fk-data">Silk  Jacquard</td> </tr> <tr class=""> <td class="specs-key">Region</td> <td class="specs-value fk-data">Gujarat</td> </tr> <tr class=""> <td class="specs-key">Number of Contents in Sales Package</td> <td class="specs-value fk-data">Pack of 1</td> </tr> <tr class=""> <td class="specs-key">Blouse Piece</td> <td class="specs-value fk-data">Yes</td> </tr> </table> <table cellspacing="0" class="fk-specs-type2"> <tr> <th class="group-head" colspan="2">Dimensions</th> </tr> <tr class=""> <td class="specs-key">Length</td> <td class="specs-value fk-data">6.3 m</td> </tr> </table> <table cellspacing="0" class="fk-specs-type2"> <tr> <th class="group-head" colspan="2">Fabric Care</th> </tr> <tr class=""> <td class="specs-value fk-data" colspan="2">Wash and Iron Inside Out</td> </tr> </table> <table cellspacing="0" class="fk-specs-type2"> <tr> <th class="group-head" colspan="2">In The Box</th> </tr> <tr class=""> <td class="specs-key"> </td> <td class="specs-value fk-data">Sari  Blouse</td> </tr> </table> </div>,10:03:2014,None
LSTBRADQWZPHJQYGBU6H6IWLX,Morph Maternity Women's Bra,http://www.flipkart.com/womens-clothing?otracker=hp_nmenu_sub_women_0_Clothing,Rs. 595,Clothing,Maternity Wear,Dyefab,http://img5a.flixcart.com/image/bra/j/e/n/lpnb023cowht-morph-maternity-32b-400x400-imadrcqatzmuy6vm.jpeg,Rs. 595,White,women,http://www.flipkart.com/morph-maternity-women-s-bra/p/itmdqwzpmh3pfeuh?pid=BRADQWZPHJQYGBU6&srno=b_35&ref=e802217e-17dd-480c-a2ef-e5f619edbc8c,WS Retail,Morph Maternity Women's Bra - Buy White Morph Maternity Women's Bra Online at Best Prices in India | Flipkart.com,Morph Maternity Women's Bra - Buy White Morph Maternity Women's Bra For Only Rs. 595.0 Online in India. Shop Online For Apparels. Huge Collection of Branded Clothes Only at,['32B'  '34B'  '36B'],None,<div class="item_left_column" id="specifications"> <h3 class="item_desc_title fk-uppercase">         Specifications of Morph Maternity Women's Bra    </h3> <table cellspacing="0" class="fk-specs-type2"> <tr> <th class="group-head" colspan="2">General Details<a class="see-more unitExt rmargin10 no-underline" href="javascript:void(0);" onclick="$(this).closest('.fk-specs-type2').toggleClass('expandedMore')" title="Expand">[+]</a><a class="hidden unitExt rmargin10 no-underline" href="javascript:void(0);" onclick="$(this).closest('.fk-specs-type2').toggleClass('expandedMore')" title="Collapse">[-]</a></th> </tr> <tr class="hidden"> <td class="specs-key">Ideal For</td> <td class="specs-value fk-data">Women's</td> </tr> </table> <table cellspacing="0" class="fk-specs-type2"> <tr> <th class="group-head" colspan="2">Bra Details</th> </tr> <tr class=""> <td class="specs-key">Fabric</td> <td class="specs-value fk-data">Cotton</td> </tr> </table> <table cellspacing="0" class="fk-specs-type2"> <tr> <th class="group-head" colspan="2">Fabric Care</th> </tr> <tr class=""> <td class="specs-value fk-data" colspan="2">Hand or Machine Wash in Normal Cycle</td> </tr> </table> <table cellspacing="0" class="fk-specs-type2"> <tr> <th class="group-head" colspan="2">Additional Details<a class="see-more unitExt rmargin10 no-underline" href="javascript:void(0);" onclick="$(this).closest('.fk-specs-type2').toggleClass('expandedMore')" title="Expand">[+]</a><a class="hidden unitExt rmargin10 no-underline" href="javascript:void(0);" onclick="$(this).closest('.fk-specs-type2').toggleClass('expandedMore')" title="Collapse">[-]</a></th> </tr> <tr class="hidden"> <td class="specs-key"> </td> <td class="specs-value fk-data">The Cups are leak-proof   so no more embarrassing breast-milk leaks in public It is made of 100% breathable fabric  so very comfortable. Drop cup for easy nursing . Rear Clouser with Adjustable hook &amp; eye Breathable cotton fabric maximizies support &amp; comfort all day and night Discrete nursing clips  featuring one handed access.</td> </tr> </table> </div>,10:03:2014,None
LSTSARDSBCBZMXPGPVKEPO3MH,Dyefab Solid Silk Sari,http://www.flipkart.com/womens-clothing?otracker=hp_nmenu_sub_women_0_Clothing,Rs. 836,Clothing,Maternity Wear,Dyefab,http://img5a.flixcart.com/image/sari/p/v/k/loasr10156dwt-dyefab-400x400-imadszhygjc7bdzp.jpeg,Rs. 1194,Light Purple,women,http://www.flipkart.com/dyefab-solid-silk-sari/p/itmdsn79pp6ysjvg?pid=SARDSBCBZMXPGPVK&srno=b_46&ref=4affb7d6-25fc-4ee8-a3ee-3e5f1a8a2e65,FABDEAL,Dyefab Solid Silk Sari - Buy Light Purple Dyefab Solid Silk Sari Online at Best Prices in India | Flipkart.com,Dyefab Solid Silk Sari - Buy Light Purple Dyefab Solid Silk Sari For Only Rs. 0.0 Online in India. Shop Online For Apparels. Huge Collection of Branded Clothes Only at,[],<div class="item_left_column" id="description"> <h3 class="item_desc_title fk-uppercase">Dyefab Solid Silk Sari         Price: Rs.836</h3> <div class="cls"></div> <div class="item_desc_text line"> <div style="float:right"> </div>                         Reboot your look with the apparel that leads the ways. Grab this stunning collection that comprises simple plain pattern. The silk butta fabric makes it much more applicable to hit an ultimate purchase.        </div> <div style="clear: both;"></div> </div>,<div class="item_left_column" id="specifications"> <h3 class="item_desc_title fk-uppercase">         Specifications of Dyefab Solid Silk Sari    </h3> <table cellspacing="0" class="fk-specs-type2"> <tr> <th class="group-head" colspan="2">General Details<a class="see-more unitExt rmargin10 no-underline" href="javascript:void(0);" onclick="$(this).closest('.fk-specs-type2').toggleClass('expandedMore')" title="Expand">[+]</a><a class="hidden unitExt rmargin10 no-underline" href="javascript:void(0);" onclick="$(this).closest('.fk-specs-type2').toggleClass('expandedMore')" title="Collapse">[-]</a></th> </tr> <tr class="hidden"> <td class="specs-key">Occasion</td> <td class="specs-value fk-data">Casual</td> </tr> <tr class="hidden"> <td class="specs-key">Pattern</td> <td class="specs-value fk-data">Solid</td> </tr> </table> <table cellspacing="0" class="fk-specs-type2"> <tr> <th class="group-head" colspan="2">Sari Details</th> </tr> <tr class=""> <td class="specs-key">Type</td> <td class="specs-value fk-data">Kosa</td> </tr> <tr class=""> <td class="specs-key">Fabric</td> <td class="specs-value fk-data">Silk</td> </tr> <tr class=""> <td class="specs-key">Region</td> <td class="specs-value fk-data">Gujarat</td> </tr> <tr class=""> <td class="specs-key">Number of Contents in Sales Package</td> <td class="specs-value fk-data">Pack of 1</td> </tr> <tr class=""> <td class="specs-key">Blouse Piece</td> <td class="specs-value fk-data">Yes</td> </tr> </table> <table cellspacing="0" class="fk-specs-type2"> <tr> <th class="group-head" colspan="2">Dimensions</th> </tr> <tr class=""> <td class="specs-key">Length</td> <td class="specs-value fk-data">6.3 m</td> </tr> </table> <table cellspacing="0" class="fk-specs-type2"> <tr> <th class="group-head" colspan="2">Fabric Care</th> </tr> <tr class=""> <td class="specs-value fk-data" colspan="2">Wash and Iron Inside Out</td> </tr> </table> <table cellspacing="0" class="fk-specs-type2"> <tr> <th class="group-head" colspan="2">In The Box</th> </tr> <tr class=""> <td class="specs-key"> </td> <td class="specs-value fk-data">Sari  Blouse</td> </tr> </table> </div>,10:03:2014,None
LSTSARDSBCBTGHUPHT9RS6YBC,Dyefab Solid Georgette Sari,http://www.flipkart.com/womens-clothing?otracker=hp_nmenu_sub_women_0_Clothing,Rs. 522,Clothing,Maternity Wear,Dyefab,http://img6a.flixcart.com/image/sari/h/t/9/lpesr10186pss-dyefab-400x400-imadsgsa5xxht3uz.jpeg,Rs. 746,Purple,women,http://www.flipkart.com/dyefab-solid-georgette-sari/p/itmdsn7axhszgvkn?pid=SARDSBCBTGHUPHT9&srno=b_47&ref=4affb7d6-25fc-4ee8-a3ee-3e5f1a8a2e65,FABDEAL,Dyefab Solid Georgette Sari - Buy Purple Dyefab Solid Georgette Sari Online at Best Prices in India | Flipkart.com,Dyefab Solid Georgette Sari - Buy Purple Dyefab Solid Georgette Sari For Only Rs. 0.0 Online in India. Shop Online For Apparels. Huge Collection of Branded Clothes Only at,[],<div class="item_left_column" id="description"> <h3 class="item_desc_title fk-uppercase">Dyefab Solid Georgette Sari         Price: Rs.522</h3> <div class="cls"></div> <div class="item_desc_text line"> <div style="float:right"> </div>                         One should move parallel with the fashion as it tends to change now and then. Fabdeal has come with lucrative collection that assures to give enchanting quality as it carries faux georgette material in its fabrication.        </div> <div style="clear: both;"></div> </div>,<div class="item_left_column" id="specifications"> <h3 class="item_desc_title fk-uppercase">         Specifications of Dyefab Solid Georgette Sari    </h3> <table cellspacing="0" class="fk-specs-type2"> <tr> <th class="group-head" colspan="2">General Details<a class="see-more unitExt rmargin10 no-underline" href="javascript:void(0);" onclick="$(this).closest('.fk-specs-type2').toggleClass('expandedMore')" title="Expand">[+]</a><a class="hidden unitExt rmargin10 no-underline" href="javascript:void(0);" onclick="$(this).closest('.fk-specs-type2').toggleClass('expandedMore')" title="Collapse">[-]</a></th> </tr> <tr class="hidden"> <td class="specs-key">Occasion</td> <td class="specs-value fk-data">Casual</td> </tr> <tr class="hidden"> <td class="specs-key">Pattern</td> <td class="specs-value fk-data">Solid</td> </tr> </table> <table cellspacing="0" class="fk-specs-type2"> <tr> <th class="group-head" colspan="2">Sari Details</th> </tr> <tr class=""> <td class="specs-key">Type</td> <td class="specs-value fk-data">Kosa</td> </tr> <tr class=""> <td class="specs-key">Fabric</td> <td class="specs-value fk-data">Georgette</td> </tr> <tr class=""> <td class="specs-key">Region</td> <td class="specs-value fk-data">Gujarat</td> </tr> <tr class=""> <td class="specs-key">Number of Contents in Sales Package</td> <td class="specs-value fk-data">Pack of 1</td> </tr> <tr class=""> <td class="specs-key">Blouse Piece</td> <td class="specs-value fk-data">Yes</td> </tr> </table> <table cellspacing="0" class="fk-specs-type2"> <tr> <th class="group-head" colspan="2">Dimensions</th> </tr> <tr class=""> <td class="specs-key">Length</td> <td class="specs-value fk-data">6.3 m</td> </tr> </table> <table cellspacing="0" class="fk-specs-type2"> <tr> <th class="group-head" colspan="2">Fabric Care</th> </tr> <tr class=""> <td class="specs-value fk-data" colspan="2">Wash and Iron Inside Out</td> </tr> </table> <table cellspacing="0" class="fk-specs-type2"> <tr> <th class="group-head" colspan="2">In The Box</th> </tr> <tr class=""> <td class="specs-key"> </td> <td class="specs-value fk-data">Sari  Blouse</td> </tr> </table> </div>,10:03:2014,None
