LSTCPIDQWZHRMNGV3YRLKBTND,Morph Maternity Women's Capri,http://www.flipkart.com/womens-clothing?otracker=hp_nmenu_sub_women_0_Clothing,Rs. 995,Clothing,Maternity Wear,Dyefab,http://img6a.flixcart.com/image/capri/g/x/7/cccp611cpblk0-morph-maternity-m-400x400-imadrcqau9hqpsus.jpeg,Rs. 995,Black,women,http://www.flipkart.com/morph-maternity-women-s-capri/p/itmdqwzgu9ukfzhs?pid=CPIDQWZHRMNGV3YR&srno=b_7&ref=f4f1f658-3640-4e19-9f3a-9091fa95f1ce,WS Retail,Morph Maternity Women's Capri - Buy Black Morph Maternity Women's Capri Online at Best Prices in India | Flipkart.com,Morph Maternity Women's Capri - Buy Black Morph Maternity Women's Capri For Only Rs. 995.0 Online in India. Shop Online For Apparels. Huge Collection of Branded Clothes Only at,['S'  'M'  'L'],None,<div class="item_left_column" id="specifications"> <h3 class="item_desc_title fk-uppercase">         Specifications of Morph Maternity Women's Capri    </h3> <table cellspacing="0" class="fk-specs-type2"> <tr> <th class="group-head" colspan="2">General Details<a class="see-more unitExt rmargin10 no-underline" href="javascript:void(0);" onclick="$(this).closest('.fk-specs-type2').toggleClass('expandedMore')" title="Expand">[+]</a><a class="hidden unitExt rmargin10 no-underline" href="javascript:void(0);" onclick="$(this).closest('.fk-specs-type2').toggleClass('expandedMore')" title="Collapse">[-]</a></th> </tr> <tr class="hidden"> <td class="specs-key">Ideal For</td> <td class="specs-value fk-data">Women's</td> </tr> <tr class="hidden"> <td class="specs-key">Occasion</td> <td class="specs-value fk-data">Casual</td> </tr> </table> <table cellspacing="0" class="fk-specs-type2"> <tr> <th class="group-head" colspan="2">Capri Details</th> </tr> <tr class=""> <td class="specs-key">Fabric</td> <td class="specs-value fk-data">Cotton</td> </tr> </table> <table cellspacing="0" class="fk-specs-type2"> <tr> <th class="group-head" colspan="2">Fabric Care</th> </tr> <tr class=""> <td class="specs-value fk-data" colspan="2">Hand or Machine Wash in Normal Cycle</td> </tr> </table> <table cellspacing="0" class="fk-specs-type2"> <tr> <th class="group-head" colspan="2">Additional Details<a class="see-more unitExt rmargin10 no-underline" href="javascript:void(0);" onclick="$(this).closest('.fk-specs-type2').toggleClass('expandedMore')" title="Expand">[+]</a><a class="hidden unitExt rmargin10 no-underline" href="javascript:void(0);" onclick="$(this).closest('.fk-specs-type2').toggleClass('expandedMore')" title="Collapse">[-]</a></th> </tr> <tr class="hidden"> <td class="specs-key"> </td> <td class="specs-value fk-data">Casual Capri High Belly Elastic Waist band</td> </tr> </table> </div>,10:03:2014,None
LSTKTADQXFBE5KC3HPKIFRSEV,Morph Maternity Women's Kurta,http://www.flipkart.com/womens-clothing?otracker=hp_nmenu_sub_women_0_Clothing,Rs. 1395,Clothing,Maternity Wear,Dyefab,http://img5a.flixcart.com/image/kurta/n/y/h/ekav865ikorg0-morph-maternity-l-400x400-imadrch6ffpxzpgv.jpeg,Rs. 1395,Orange,women,http://www.flipkart.com/morph-maternity-women-s-kurta/p/itmdqxfcmtz7zszq?pid=KTADQXFBE5KC3HPK&srno=b_6&ref=f4f1f658-3640-4e19-9f3a-9091fa95f1ce,WS Retail,Morph Maternity Women's Kurta - Buy Orange Morph Maternity Women's Kurta Online at Best Prices in India | Flipkart.com,Morph Maternity Women's Kurta - Buy Orange Morph Maternity Women's Kurta For Only Rs. 1395.0 Online in India. Shop Online For Apparels. Huge Collection of Branded Clothes Only at,['S'  'M'  'L'],None,<div class="item_left_column" id="specifications"> <h3 class="item_desc_title fk-uppercase">         Specifications of Morph Maternity Women's Kurta    </h3> <table cellspacing="0" class="fk-specs-type2"> <tr> <th class="group-head" colspan="2">General Details<a class="see-more unitExt rmargin10 no-underline" href="javascript:void(0);" onclick="$(this).closest('.fk-specs-type2').toggleClass('expandedMore')" title="Expand">[+]</a><a class="hidden unitExt rmargin10 no-underline" href="javascript:void(0);" onclick="$(this).closest('.fk-specs-type2').toggleClass('expandedMore')" title="Collapse">[-]</a></th> </tr> <tr class="hidden"> <td class="specs-key">Ideal For</td> <td class="specs-value fk-data">Women's</td> </tr> </table> <table cellspacing="0" class="fk-specs-type2"> <tr> <th class="group-head" colspan="2">Kurta Details</th> </tr> <tr class=""> <td class="specs-key">Fabric</td> <td class="specs-value fk-data">100% Cotton</td> </tr> </table> <table cellspacing="0" class="fk-specs-type2"> <tr> <th class="group-head" colspan="2">Additional Details<a class="see-more unitExt rmargin10 no-underline" href="javascript:void(0);" onclick="$(this).closest('.fk-specs-type2').toggleClass('expandedMore')" title="Expand">[+]</a><a class="hidden unitExt rmargin10 no-underline" href="javascript:void(0);" onclick="$(this).closest('.fk-specs-type2').toggleClass('expandedMore')" title="Collapse">[-]</a></th> </tr> <tr class="hidden"> <td class="specs-key">Style Code</td> <td class="specs-value fk-data">EKAV865IKORG0</td> </tr> </table> </div>,10:03:2014,None
LSTSARDSBCBPBUXUHHSUPESIW,Dyefab Solid Georgette Sari,http://www.flipkart.com/womens-clothing?otracker=hp_nmenu_sub_women_0_Clothing,Rs. 507,Clothing,Maternity Wear,Dyefab,http://img5a.flixcart.com/image/sari/h/h/s/kvisr10098vd-dyefab-400x400-imadszgnsg6r9ghx.jpeg,Rs. 724,Green,women,http://www.flipkart.com/dyefab-solid-georgette-sari/p/itmdsn78qz9hzpg8?pid=SARDSBCBPBUXUHHS&srno=b_1&ref=f4f1f658-3640-4e19-9f3a-9091fa95f1ce,FABDEAL,Dyefab Solid Georgette Sari - Buy Green Dyefab Solid Georgette Sari Online at Best Prices in India | Flipkart.com,Dyefab Solid Georgette Sari - Buy Green Dyefab Solid Georgette Sari For Only Rs. 0.0 Online in India. Shop Online For Apparels. Huge Collection of Branded Clothes Only at,[],<div class="item_left_column" id="description"> <h3 class="item_desc_title fk-uppercase">Dyefab Solid Georgette Sari         Price: Rs.507</h3> <div class="cls"></div> <div class="item_desc_text line"> <div style="float:right"> </div>                         You?ll be amazed this season with a newly fashioned getup that can be grabbed with this marvelous attire. Get ready to be an iconic persona with this marvelous apparel that carries an appealing faux georgette fabric as desired. One should get going with this mesmerizing collection for desired persona.        </div> <div style="clear: both;"></div> </div>,<div class="item_left_column" id="specifications"> <h3 class="item_desc_title fk-uppercase">         Specifications of Dyefab Solid Georgette Sari    </h3> <table cellspacing="0" class="fk-specs-type2"> <tr> <th class="group-head" colspan="2">General Details<a class="see-more unitExt rmargin10 no-underline" href="javascript:void(0);" onclick="$(this).closest('.fk-specs-type2').toggleClass('expandedMore')" title="Expand">[+]</a><a class="hidden unitExt rmargin10 no-underline" href="javascript:void(0);" onclick="$(this).closest('.fk-specs-type2').toggleClass('expandedMore')" title="Collapse">[-]</a></th> </tr> <tr class="hidden"> <td class="specs-key">Occasion</td> <td class="specs-value fk-data">Casual</td> </tr> <tr class="hidden"> <td class="specs-key">Pattern</td> <td class="specs-value fk-data">Solid</td> </tr> </table> <table cellspacing="0" class="fk-specs-type2"> <tr> <th class="group-head" colspan="2">Sari Details</th> </tr> <tr class=""> <td class="specs-key">Type</td> <td class="specs-value fk-data">Kosa</td> </tr> <tr class=""> <td class="specs-key">Fabric</td> <td class="specs-value fk-data">Georgette</td> </tr> <tr class=""> <td class="specs-key">Region</td> <td class="specs-value fk-data">Gujarat</td> </tr> <tr class=""> <td class="specs-key">Number of Contents in Sales Package</td> <td class="specs-value fk-data">Pack of 1</td> </tr> <tr class=""> <td class="specs-key">Blouse Piece</td> <td class="specs-value fk-data">Yes</td> </tr> </table> <table cellspacing="0" class="fk-specs-type2"> <tr> <th class="group-head" colspan="2">Dimensions</th> </tr> <tr class=""> <td class="specs-key">Length</td> <td class="specs-value fk-data">6.3 m</td> </tr> </table> <table cellspacing="0" class="fk-specs-type2"> <tr> <th class="group-head" colspan="2">Fabric Care</th> </tr> <tr class=""> <td class="specs-value fk-data" colspan="2">Wash and Iron Inside Out</td> </tr> </table> <table cellspacing="0" class="fk-specs-type2"> <tr> <th class="group-head" colspan="2">In The Box</th> </tr> <tr class=""> <td class="specs-key"> </td> <td class="specs-value fk-data">Sari  Blouse</td> </tr> </table> </div>,10:03:2014,None
LSTSARDSBCB4FMMFZSX5IH2R3,Dyefab Printed Net  Cotton Sari,http://www.flipkart.com/womens-clothing?otracker=hp_nmenu_sub_women_0_Clothing,Rs. 976,Clothing,Maternity Wear,Dyefab,http://img6a.flixcart.com/image/sari/z/s/x/lqusr10202dvf-dyefab-400x400-imadszgzznsg2vvv.jpeg,Rs. 1394,Green,women,http://www.flipkart.com/dyefab-printed-net-cotton-sari/p/itmdsn7a5eujxgbz?pid=SARDSBCB4FMMFZSX&srno=b_9&ref=f4f1f658-3640-4e19-9f3a-9091fa95f1ce,FABDEAL,Dyefab Printed Net  Cotton Sari - Buy Green Dyefab Printed Net  Cotton Sari Online at Best Prices in India | Flipkart.com,Dyefab Printed Net  Cotton Sari - Buy Green Dyefab Printed Net  Cotton Sari For Only Rs. 0.0 Online in India. Shop Online For Apparels. Huge Collection of Branded Clothes Only at,[],<div class="item_left_column" id="description"> <h3 class="item_desc_title fk-uppercase">Dyefab Printed Net  Cotton Sari         Price: Rs.976</h3> <div class="cls"></div> <div class="item_desc_text line"> <div style="float:right"> </div>                         Be a distinct persona in the occasion you step in. Fabdeal has come with simple yet elegant attire that keeps you at your best with its catchy single pattern color shade with super net and cotton material.        </div> <div style="clear: both;"></div> </div>,<div class="item_left_column" id="specifications"> <h3 class="item_desc_title fk-uppercase">         Specifications of Dyefab Printed Net  Cotton Sari    </h3> <table cellspacing="0" class="fk-specs-type2"> <tr> <th class="group-head" colspan="2">General Details<a class="see-more unitExt rmargin10 no-underline" href="javascript:void(0);" onclick="$(this).closest('.fk-specs-type2').toggleClass('expandedMore')" title="Expand">[+]</a><a class="hidden unitExt rmargin10 no-underline" href="javascript:void(0);" onclick="$(this).closest('.fk-specs-type2').toggleClass('expandedMore')" title="Collapse">[-]</a></th> </tr> <tr class="hidden"> <td class="specs-key">Occasion</td> <td class="specs-value fk-data">Casual</td> </tr> <tr class="hidden"> <td class="specs-key">Pattern</td> <td class="specs-value fk-data">Printed</td> </tr> </table> <table cellspacing="0" class="fk-specs-type2"> <tr> <th class="group-head" colspan="2">Sari Details</th> </tr> <tr class=""> <td class="specs-key">Type</td> <td class="specs-value fk-data">Kosa</td> </tr> <tr class=""> <td class="specs-key">Fabric</td> <td class="specs-value fk-data">Net  Cotton</td> </tr> <tr class=""> <td class="specs-key">Region</td> <td class="specs-value fk-data">Gujarat</td> </tr> <tr class=""> <td class="specs-key">Number of Contents in Sales Package</td> <td class="specs-value fk-data">Pack of 1</td> </tr> <tr class=""> <td class="specs-key">Blouse Piece</td> <td class="specs-value fk-data">Yes</td> </tr> </table> <table cellspacing="0" class="fk-specs-type2"> <tr> <th class="group-head" colspan="2">Dimensions</th> </tr> <tr class=""> <td class="specs-key">Length</td> <td class="specs-value fk-data">6.3 m</td> </tr> </table> <table cellspacing="0" class="fk-specs-type2"> <tr> <th class="group-head" colspan="2">Fabric Care</th> </tr> <tr class=""> <td class="specs-value fk-data" colspan="2">Wash and Iron Inside Out</td> </tr> </table> <table cellspacing="0" class="fk-specs-type2"> <tr> <th class="group-head" colspan="2">In The Box</th> </tr> <tr class=""> <td class="specs-key"> </td> <td class="specs-value fk-data">Blouse  Sari</td> </tr> </table> </div>,10:03:2014,None
LSTPANDHFQAZY64BACC9HXNTC,Morph Maternity Women's Maternity Panty Panty,http://www.flipkart.com/womens-clothing?otracker=hp_nmenu_sub_women_0_Clothing,Rs. 275,Clothing,Maternity Wear,Dyefab,http://img6a.flixcart.com/image/panty/a/c/c/mphs017copch00peach-morph-maternity-xl-400x400-imadmv9wehyf4uy5.jpeg,Rs. 275,Peach,women,http://www.flipkart.com/morph-maternity-women-s-panty/p/itmdmwg732dshj7u?pid=PANDHFQAZY64BACC&srno=b_10&ref=f4f1f658-3640-4e19-9f3a-9091fa95f1ce,WS Retail,Morph Maternity Women's Maternity Panty Panty - Buy Peach Morph Maternity Women's Maternity Panty Panty Online at Best Prices in India | Flipkart.com,Morph Maternity Women's Maternity Panty Panty - Buy Peach Morph Maternity Women's Maternity Panty Panty For Only Rs. 275.0 Online in India. Shop Online For Apparels. Huge Collection of Branded Clothes Only at,['L'  'XL'],<div class="item_left_column" id="description"> <h3 class="item_desc_title fk-uppercase">Morph Maternity Women's Maternity Panty Panty         Price: Rs.275</h3> <div class="cls"></div> <div class="item_desc_text line"> <div style="float:right"> </div> <p>   Crafted from the finest cotton material  this maternity panty from Morph Maternity ensures a right amount of relaxed and breathable comfort to all those expecting mothers. The <strong>elastic waistband </strong>of this comfortable panty ensures perfect grip and fit.</p> </div> <div style="clear: both;"></div> </div>,<div class="item_left_column" id="specifications"> <h3 class="item_desc_title fk-uppercase">         Specifications of Morph Maternity Women's Maternity Panty Panty    </h3> <table cellspacing="0" class="fk-specs-type2"> <tr> <th class="group-head" colspan="2">General Details<a class="see-more unitExt rmargin10 no-underline" href="javascript:void(0);" onclick="$(this).closest('.fk-specs-type2').toggleClass('expandedMore')" title="Expand">[+]</a><a class="hidden unitExt rmargin10 no-underline" href="javascript:void(0);" onclick="$(this).closest('.fk-specs-type2').toggleClass('expandedMore')" title="Collapse">[-]</a></th> </tr> <tr class="hidden"> <td class="specs-key">Ideal For</td> <td class="specs-value fk-data">Women's</td> </tr> <tr class="hidden"> <td class="specs-key">Occasion</td> <td class="specs-value fk-data">Casual</td> </tr> <tr class="hidden"> <td class="specs-key">Pattern</td> <td class="specs-value fk-data">Solid</td> </tr> </table> <table cellspacing="0" class="fk-specs-type2"> <tr> <th class="group-head" colspan="2">Panty Details</th> </tr> <tr class=""> <td class="specs-key">Type</td> <td class="specs-value fk-data">Maternity Panty</td> </tr> <tr class=""> <td class="specs-key">Fabric</td> <td class="specs-value fk-data">100% Cotton</td> </tr> <tr class=""> <td class="specs-key">Design</td> <td class="specs-value fk-data">Logo Print at Front</td> </tr> </table> <table cellspacing="0" class="fk-specs-type2"> <tr> <th class="group-head" colspan="2">Fabric Care</th> </tr> <tr class=""> <td class="specs-value fk-data" colspan="2">Machine Wash at 40°C  Do Not Bleach  Do Not Wring  Do Not Iron</td> </tr> </table> <table cellspacing="0" class="fk-specs-type2"> <tr> <th class="group-head" colspan="2">Additional Details<a class="see-more unitExt rmargin10 no-underline" href="javascript:void(0);" onclick="$(this).closest('.fk-specs-type2').toggleClass('expandedMore')" title="Expand">[+]</a><a class="hidden unitExt rmargin10 no-underline" href="javascript:void(0);" onclick="$(this).closest('.fk-specs-type2').toggleClass('expandedMore')" title="Collapse">[-]</a></th> </tr> <tr class="hidden"> <td class="specs-key"> </td> <td class="specs-value fk-data">Elasticated Waistband and Leg Opening</td> </tr> </table> </div>,10:03:2014,None
LSTPANDHFQAN2XSJFFJNH2LID,Morph Maternity Women's Maternity Panty Panty,http://www.flipkart.com/womens-clothing?otracker=hp_nmenu_sub_women_0_Clothing,Rs. 275,Clothing,Maternity Wear,Dyefab,http://img5a.flixcart.com/image/panty/f/f/j/mphs011colpk00light-pink-morph-maternity-xl-400x400-imadmv9xzjjqfjgh.jpeg,Rs. 275,Light Pink,women,http://www.flipkart.com/morph-maternity-women-s-panty/p/itmdmwg7ufrydh8m?pid=PANDHFQAN2XSJFFJ&srno=b_13&ref=f4f1f658-3640-4e19-9f3a-9091fa95f1ce,WS Retail,Morph Maternity Women's Maternity Panty Panty - Buy Light Pink Morph Maternity Women's Maternity Panty Panty Online at Best Prices in India | Flipkart.com,Morph Maternity Women's Maternity Panty Panty - Buy Light Pink Morph Maternity Women's Maternity Panty Panty For Only Rs. 275.0 Online in India. Shop Online For Apparels. Huge Collection of Branded Clothes Only at,[],<div class="item_left_column" id="description"> <h3 class="item_desc_title fk-uppercase">Morph Maternity Women's Maternity Panty Panty         Price: Rs.275</h3> <div class="cls"></div> <div class="item_desc_text line"> <div style="float:right"> </div> <p style="text-align: justify;">   Morph Maternity designs inners for pregnant women that gives them comfort. Crafted from <strong>100 per cent cotton</strong> the panty is a must-have in your wardrobe. The elasticated waistband and leg openings give you a good grip.</p> </div> <div style="clear: both;"></div> </div>,<div class="item_left_column" id="specifications"> <h3 class="item_desc_title fk-uppercase">         Specifications of Morph Maternity Women's Maternity Panty Panty    </h3> <table cellspacing="0" class="fk-specs-type2"> <tr> <th class="group-head" colspan="2">General Details<a class="see-more unitExt rmargin10 no-underline" href="javascript:void(0);" onclick="$(this).closest('.fk-specs-type2').toggleClass('expandedMore')" title="Expand">[+]</a><a class="hidden unitExt rmargin10 no-underline" href="javascript:void(0);" onclick="$(this).closest('.fk-specs-type2').toggleClass('expandedMore')" title="Collapse">[-]</a></th> </tr> <tr class="hidden"> <td class="specs-key">Ideal For</td> <td class="specs-value fk-data">Women's</td> </tr> <tr class="hidden"> <td class="specs-key">Occasion</td> <td class="specs-value fk-data">Casual</td> </tr> <tr class="hidden"> <td class="specs-key">Pattern</td> <td class="specs-value fk-data">Solid</td> </tr> </table> <table cellspacing="0" class="fk-specs-type2"> <tr> <th class="group-head" colspan="2">Panty Details</th> </tr> <tr class=""> <td class="specs-key">Type</td> <td class="specs-value fk-data">Maternity Panty</td> </tr> <tr class=""> <td class="specs-key">Fabric</td> <td class="specs-value fk-data">100% Cotton</td> </tr> <tr class=""> <td class="specs-key">Design</td> <td class="specs-value fk-data">Logo Print at Front</td> </tr> </table> <table cellspacing="0" class="fk-specs-type2"> <tr> <th class="group-head" colspan="2">Fabric Care</th> </tr> <tr class=""> <td class="specs-value fk-data" colspan="2">Machine Wash at 50°C  Do Not Iron  Do Not Bleach  Do Not Wring</td> </tr> </table> <table cellspacing="0" class="fk-specs-type2"> <tr> <th class="group-head" colspan="2">Additional Details<a class="see-more unitExt rmargin10 no-underline" href="javascript:void(0);" onclick="$(this).closest('.fk-specs-type2').toggleClass('expandedMore')" title="Expand">[+]</a><a class="hidden unitExt rmargin10 no-underline" href="javascript:void(0);" onclick="$(this).closest('.fk-specs-type2').toggleClass('expandedMore')" title="Collapse">[-]</a></th> </tr> <tr class="hidden"> <td class="specs-key"> </td> <td class="specs-value fk-data">Elasticated Waistband and Leg Opening</td> </tr> </table> </div>,10:03:2014,None
LSTPANDHFQAZ3FANPFUCI0HUW,Morph Maternity Women's Maternity Panty Panty,http://www.flipkart.com/womens-clothing?otracker=hp_nmenu_sub_women_0_Clothing,Rs. 275,Clothing,Maternity Wear,Dyefab,http://img6a.flixcart.com/image/panty/p/f/u/mphs011colpk000light-pink-morph-maternity-m-400x400-imadkpngjyukkfpk.jpeg,Rs. 275,Light Pink,women,http://www.flipkart.com/morph-maternity-women-s-panty/p/itmdhtgxutzehnty?pid=PANDHFQAZ3FANPFU&srno=b_17&ref=01390c11-612c-4fd0-9a86-2b0ce7e92013,WS Retail,Morph Maternity Women's Maternity Panty Panty - Buy Pink Morph Maternity Women's Maternity Panty Panty Online at Best Prices in India | Flipkart.com,Morph Maternity Women's Maternity Panty Panty - Buy Pink Morph Maternity Women's Maternity Panty Panty For Only Rs. 275.0 Online in India. Shop Online For Apparels. Huge Collection of Branded Clothes Only at,['M'  'L'],<div class="item_left_column" id="description"> <h3 class="item_desc_title fk-uppercase">Morph Maternity Women's Maternity Panty Panty         Price: Rs.275</h3> <div class="cls"></div> <div class="item_desc_text line"> <div style="float:right"> </div> <p style="text-align: justify;">   Morph Maternity brings this well tailored panty that is an essential in an expecting mother’s wardrobe. Feel the comfort every minute by donning this 100 per cent cotton <strong>maternity panty</strong> that takes care of the hygiene and gives maximum support during your pregnancy days.</p> </div> <div style="clear: both;"></div> </div>,<div class="item_left_column" id="specifications"> <h3 class="item_desc_title fk-uppercase">         Specifications of Morph Maternity Women's Maternity Panty Panty    </h3> <table cellspacing="0" class="fk-specs-type2"> <tr> <th class="group-head" colspan="2">General Details<a class="see-more unitExt rmargin10 no-underline" href="javascript:void(0);" onclick="$(this).closest('.fk-specs-type2').toggleClass('expandedMore')" title="Expand">[+]</a><a class="hidden unitExt rmargin10 no-underline" href="javascript:void(0);" onclick="$(this).closest('.fk-specs-type2').toggleClass('expandedMore')" title="Collapse">[-]</a></th> </tr> <tr class="hidden"> <td class="specs-key">Ideal For</td> <td class="specs-value fk-data">Women's</td> </tr> <tr class="hidden"> <td class="specs-key">Pattern</td> <td class="specs-value fk-data">Solid</td> </tr> </table> <table cellspacing="0" class="fk-specs-type2"> <tr> <th class="group-head" colspan="2">Panty Details</th> </tr> <tr class=""> <td class="specs-key">Type</td> <td class="specs-value fk-data">Maternity Panty</td> </tr> <tr class=""> <td class="specs-key">Fabric</td> <td class="specs-value fk-data">100% Cotton</td> </tr> <tr class=""> <td class="specs-key">Design</td> <td class="specs-value fk-data">Logo Print at Front Below Waistband</td> </tr> </table> <table cellspacing="0" class="fk-specs-type2"> <tr> <th class="group-head" colspan="2">Fabric Care</th> </tr> <tr class=""> <td class="specs-value fk-data" colspan="2">Do Not Bleach  Do Not Iron  Machine Wash at 50°C  Do Not Wring</td> </tr> </table> <table cellspacing="0" class="fk-specs-type2"> <tr> <th class="group-head" colspan="2">Additional Details<a class="see-more unitExt rmargin10 no-underline" href="javascript:void(0);" onclick="$(this).closest('.fk-specs-type2').toggleClass('expandedMore')" title="Expand">[+]</a><a class="hidden unitExt rmargin10 no-underline" href="javascript:void(0);" onclick="$(this).closest('.fk-specs-type2').toggleClass('expandedMore')" title="Collapse">[-]</a></th> </tr> <tr class="hidden"> <td class="specs-key"> </td> <td class="specs-value fk-data">Elasticated Waistband and Leghole</td> </tr> </table> </div>,10:03:2014,None
