LSTSARDTFPRMJWUNGRHH2BQY6,Dyefab Solid Silk Sari,http://www.flipkart.com/womens-clothing?otracker=hp_nmenu_sub_women_0_Clothing,Rs. 1500,Clothing,Maternity Wear,Dyefab,http://img6a.flixcart.com/image/sari/g/r/h/lnksr10140dwt-yellow-f-dyefab-400x400-imadtft6f9rpcxta.jpeg,Rs. 1500,Yellow,women,http://www.flipkart.com/dyefab-solid-silk-sari/p/itmdtfq7rs4ttum6?pid=SARDTFPRMJWUNGRH&srno=b_74&ref=939d77d1-413f-4541-adde-564387423c8d,Fashionara,Dyefab Solid Silk Sari - Buy Yellow Dyefab Solid Silk Sari Online at Best Prices in India | Flipkart.com,Dyefab Solid Silk Sari - Buy Yellow Dyefab Solid Silk Sari For Only Rs. 0.0 Online in India. Shop Online For Apparels. Huge Collection of Branded Clothes Only at,[],None,<div class="item_left_column" id="specifications"> <h3 class="item_desc_title fk-uppercase">         Specifications of Dyefab Solid Silk Sari    </h3> <table cellspacing="0" class="fk-specs-type2"> <tr> <th class="group-head" colspan="2">General Details<a class="see-more unitExt rmargin10 no-underline" href="javascript:void(0);" onclick="$(this).closest('.fk-specs-type2').toggleClass('expandedMore')" title="Expand">[+]</a><a class="hidden unitExt rmargin10 no-underline" href="javascript:void(0);" onclick="$(this).closest('.fk-specs-type2').toggleClass('expandedMore')" title="Collapse">[-]</a></th> </tr> <tr class="hidden"> <td class="specs-key">Occasion</td> <td class="specs-value fk-data">Festive</td> </tr> <tr class="hidden"> <td class="specs-key">Pattern</td> <td class="specs-value fk-data">Solid</td> </tr> </table> <table cellspacing="0" class="fk-specs-type2"> <tr> <th class="group-head" colspan="2">Sari Details</th> </tr> <tr class=""> <td class="specs-key">Type</td> <td class="specs-value fk-data">Daily Wear</td> </tr> <tr class=""> <td class="specs-key">Fabric</td> <td class="specs-value fk-data">Silk</td> </tr> </table> <table cellspacing="0" class="fk-specs-type2"> <tr> <th class="group-head" colspan="2">Fabric Care</th> </tr> <tr class=""> <td class="specs-value fk-data" colspan="2">Dry Clean Only</td> </tr> </table> </div>,10:03:2014,None
LSTSARDTFPRFGZGAYHHTTZSHU,Dyefab Self Design Synthetic Sari,http://www.flipkart.com/womens-clothing?otracker=hp_nmenu_sub_women_0_Clothing,Rs. 1215,Clothing,Maternity Wear,Dyefab,http://img5a.flixcart.com/image/sari/y/h/h/kursr10081bl-blue-f-dyefab-400x400-imadtft47vugpzfz.jpeg,Rs. 1215,Sky blue,women,http://www.flipkart.com/dyefab-self-design-synthetic-sari/p/itmdtfq5hgnyhqgg?pid=SARDTFPRFGZGAYHH&srno=b_64&ref=939d77d1-413f-4541-adde-564387423c8d,Fashionara,Dyefab Self Design Synthetic Sari - Buy Sky blue Dyefab Self Design Synthetic Sari Online at Best Prices in India | Flipkart.com,Dyefab Self Design Synthetic Sari - Buy Sky blue Dyefab Self Design Synthetic Sari For Only Rs. 0.0 Online in India. Shop Online For Apparels. Huge Collection of Branded Clothes Only at,[],None,<div class="item_left_column" id="specifications"> <h3 class="item_desc_title fk-uppercase">         Specifications of Dyefab Self Design Synthetic Sari    </h3> <table cellspacing="0" class="fk-specs-type2"> <tr> <th class="group-head" colspan="2">General Details<a class="see-more unitExt rmargin10 no-underline" href="javascript:void(0);" onclick="$(this).closest('.fk-specs-type2').toggleClass('expandedMore')" title="Expand">[+]</a><a class="hidden unitExt rmargin10 no-underline" href="javascript:void(0);" onclick="$(this).closest('.fk-specs-type2').toggleClass('expandedMore')" title="Collapse">[-]</a></th> </tr> <tr class="hidden"> <td class="specs-key">Occasion</td> <td class="specs-value fk-data">Festive</td> </tr> <tr class="hidden"> <td class="specs-key">Pattern</td> <td class="specs-value fk-data">Self Design</td> </tr> </table> <table cellspacing="0" class="fk-specs-type2"> <tr> <th class="group-head" colspan="2">Sari Details</th> </tr> <tr class=""> <td class="specs-key">Type</td> <td class="specs-value fk-data">Daily Wear</td> </tr> <tr class=""> <td class="specs-key">Fabric</td> <td class="specs-value fk-data">Synthetic</td> </tr> </table> <table cellspacing="0" class="fk-specs-type2"> <tr> <th class="group-head" colspan="2">Fabric Care</th> </tr> <tr class=""> <td class="specs-value fk-data" colspan="2">Dry Clean Only</td> </tr> </table> </div>,10:03:2014,None
LSTSWDDQXFCYFAABGBRISGSVU,Morph Maternity,http://www.flipkart.com/womens-clothing?otracker=hp_nmenu_sub_women_0_Clothing,Rs. 1887,Clothing,Maternity Wear,Dyefab,http://img5a.flixcart.com/image/salwar-kurta-dupatta/z/3/b/sksh841kamrn0-morph-maternity-l-400x400-imadrcqazggh8awe.jpeg,Rs. 2695,Maroon,women,http://www.flipkart.com/morph-maternity/p/itmdqxfdgykuhrfj?pid=SWDDQXFCYFAABGBR&srno=b_78&ref=d005652d-31de-41d6-b3b4-680242885076,WS Retail,Morph Maternity - Buy Maroon Morph Maternity Online at Best Prices in India | Flipkart.com,Morph Maternity - Buy Maroon Morph Maternity For Only Rs. 2695.0 Online in India. Shop Online For Apparels. Huge Collection of Branded Clothes Only at,['S'  'M'  'L'],None,<div class="item_left_column" id="specifications"> <h3 class="item_desc_title fk-uppercase">         Specifications of Morph Maternity    </h3> <table cellspacing="0" class="fk-specs-type2"> <tr> <th class="group-head" colspan="2">General Details<a class="see-more unitExt rmargin10 no-underline" href="javascript:void(0);" onclick="$(this).closest('.fk-specs-type2').toggleClass('expandedMore')" title="Expand">[+]</a><a class="hidden unitExt rmargin10 no-underline" href="javascript:void(0);" onclick="$(this).closest('.fk-specs-type2').toggleClass('expandedMore')" title="Collapse">[-]</a></th> </tr> <tr class="hidden"> <td class="specs-key">Ideal For</td> <td class="specs-value fk-data">Women's</td> </tr> <tr class="hidden"> <td class="specs-key">Occasion</td> <td class="specs-value fk-data">Casual</td> </tr> </table> <table cellspacing="0" class="fk-specs-type2"> <tr> <th class="group-head" colspan="2">Salwar Kurta Dupatta Details</th> </tr> <tr class=""> <td class="specs-key">Kurta Fabric</td> <td class="specs-value fk-data">100% Cotton</td> </tr> <tr class=""> <td class="specs-key">Number of Contents in Sales Package</td> <td class="specs-value fk-data">3</td> </tr> </table> <table cellspacing="0" class="fk-specs-type2"> <tr> <th class="group-head" colspan="2">Additional Details<a class="see-more unitExt rmargin10 no-underline" href="javascript:void(0);" onclick="$(this).closest('.fk-specs-type2').toggleClass('expandedMore')" title="Expand">[+]</a><a class="hidden unitExt rmargin10 no-underline" href="javascript:void(0);" onclick="$(this).closest('.fk-specs-type2').toggleClass('expandedMore')" title="Collapse">[-]</a></th> </tr> <tr class="hidden"> <td class="specs-key"> </td> <td class="specs-value fk-data">Round neck. Cap sleeve. Horizontal Zipper for Nursing.Has Patent Pending Leak-Proof layer. Has a back tie that can be adjusted to fit. Has a button to the right seam to fix dupatta's loop.</td> </tr> </table> </div>,10:03:2014,None
LSTDREDQWZXC7DGAQNCMR6ZXR,Morph Maternity Women's Dress,http://www.flipkart.com/womens-clothing?otracker=hp_nmenu_sub_women_0_Clothing,Rs. 1595,Clothing,Maternity Wear,Dyefab,http://img5a.flixcart.com/image/dress/q/n/c/cwdh805cpblk0-morph-maternity-s-400x400-imads6rxnmg7ftff.jpeg,Rs. 1595,Black  White,women,http://www.flipkart.com/morph-maternity-women-s-dress/p/itmdqwzxrfhfyz83?pid=DREDQWZXC7DGAQNC&srno=b_76&ref=d005652d-31de-41d6-b3b4-680242885076,WS Retail,Morph Maternity Women's Dress - Buy White  Black Morph Maternity Women's Dress Online at Best Prices in India | Flipkart.com,Morph Maternity Women's Dress - Buy White  Black Morph Maternity Women's Dress For Only Rs. 1595.0 Online in India. Shop Online For Apparels. Huge Collection of Branded Clothes Only at,['S'],None,<div class="item_left_column" id="specifications"> <h3 class="item_desc_title fk-uppercase">         Specifications of Morph Maternity Women's Dress    </h3> <table cellspacing="0" class="fk-specs-type2"> <tr> <th class="group-head" colspan="2">General Details<a class="see-more unitExt rmargin10 no-underline" href="javascript:void(0);" onclick="$(this).closest('.fk-specs-type2').toggleClass('expandedMore')" title="Expand">[+]</a><a class="hidden unitExt rmargin10 no-underline" href="javascript:void(0);" onclick="$(this).closest('.fk-specs-type2').toggleClass('expandedMore')" title="Collapse">[-]</a></th> </tr> <tr class="hidden"> <td class="specs-key">Ideal For</td> <td class="specs-value fk-data">Women's</td> </tr> <tr class="hidden"> <td class="specs-key">Pattern</td> <td class="specs-value fk-data">Printed</td> </tr> </table> <table cellspacing="0" class="fk-specs-type2"> <tr> <th class="group-head" colspan="2">Dress Details</th> </tr> <tr class=""> <td class="specs-key">Fabric</td> <td class="specs-value fk-data">100% Polyester</td> </tr> <tr class=""> <td class="specs-key">Style</td> <td class="specs-value fk-data">Lace Trims at Hem  Tie-up Detail at Back</td> </tr> <tr class=""> <td class="specs-key">Sleeve</td> <td class="specs-value fk-data">Half Sleeve</td> </tr> <tr class=""> <td class="specs-key">Neck</td> <td class="specs-value fk-data">Boat Neck</td> </tr> </table> <table cellspacing="0" class="fk-specs-type2"> <tr> <th class="group-head" colspan="2">Fabric Care</th> </tr> <tr class=""> <td class="specs-value fk-data" colspan="2">Do Not Tumble Dry  Low Iron  Hand Wash  Do Not Bleach  Wash and Dry Separately  Dry Cleanable</td> </tr> </table> <table cellspacing="0" class="fk-specs-type2"> <tr> <th class="group-head" colspan="2">Dimensions</th> </tr> <tr class=""> <td class="specs-key">Length</td> <td class="specs-value fk-data">Midi/Knee Length</td> </tr> </table> <table cellspacing="0" class="fk-specs-type2"> <tr> <th class="group-head" colspan="2">Additional Details<a class="see-more unitExt rmargin10 no-underline" href="javascript:void(0);" onclick="$(this).closest('.fk-specs-type2').toggleClass('expandedMore')" title="Expand">[+]</a><a class="hidden unitExt rmargin10 no-underline" href="javascript:void(0);" onclick="$(this).closest('.fk-specs-type2').toggleClass('expandedMore')" title="Collapse">[-]</a></th> </tr> <tr class="hidden"> <td class="specs-key"> </td> <td class="specs-value fk-data">Boat neck. Short sleeve with loop &amp; button. Horizontal Zipper for Nursing.Has Patent Pending Leak-Proof layer. Has a back tie that can be adjusted to fit</td> </tr> </table> <table cellspacing="0" class="fk-specs-type2"> <tr> <th class="group-head" colspan="2">Model Details</th> </tr> </table> </div>,10:03:2014,None
LSTKTADQXFBVN3ZJMPR1EC0V0,Morph Maternity Women's Kurta,http://www.flipkart.com/womens-clothing?otracker=hp_nmenu_sub_women_0_Clothing,Rs. 977,Clothing,Maternity Wear,Dyefab,http://img5a.flixcart.com/image/kurta/m/p/r/ekuv803jablk0-morph-maternity-l-400x400-imadrcqajynpsbyb.jpeg,Rs. 1395,Black,women,http://www.flipkart.com/morph-maternity-women-s-kurta/p/itmdqxfcpkk4cmqr?pid=KTADQXFBVN3ZJMPR&srno=b_81&ref=d005652d-31de-41d6-b3b4-680242885076,WS Retail,Morph Maternity Women's Kurta - Buy Black Morph Maternity Women's Kurta Online at Best Prices in India | Flipkart.com,Morph Maternity Women's Kurta - Buy Black Morph Maternity Women's Kurta For Only Rs. 1395.0 Online in India. Shop Online For Apparels. Huge Collection of Branded Clothes Only at,['S'  'M'],None,<div class="item_left_column" id="specifications"> <h3 class="item_desc_title fk-uppercase">         Specifications of Morph Maternity Women's Kurta    </h3> <table cellspacing="0" class="fk-specs-type2"> <tr> <th class="group-head" colspan="2">General Details<a class="see-more unitExt rmargin10 no-underline" href="javascript:void(0);" onclick="$(this).closest('.fk-specs-type2').toggleClass('expandedMore')" title="Expand">[+]</a><a class="hidden unitExt rmargin10 no-underline" href="javascript:void(0);" onclick="$(this).closest('.fk-specs-type2').toggleClass('expandedMore')" title="Collapse">[-]</a></th> </tr> <tr class="hidden"> <td class="specs-key">Ideal For</td> <td class="specs-value fk-data">Women's</td> </tr> </table> <table cellspacing="0" class="fk-specs-type2"> <tr> <th class="group-head" colspan="2">Kurta Details</th> </tr> <tr class=""> <td class="specs-key">Fabric</td> <td class="specs-value fk-data">100% Cotton</td> </tr> </table> <table cellspacing="0" class="fk-specs-type2"> <tr> <th class="group-head" colspan="2">Additional Details<a class="see-more unitExt rmargin10 no-underline" href="javascript:void(0);" onclick="$(this).closest('.fk-specs-type2').toggleClass('expandedMore')" title="Expand">[+]</a><a class="hidden unitExt rmargin10 no-underline" href="javascript:void(0);" onclick="$(this).closest('.fk-specs-type2').toggleClass('expandedMore')" title="Collapse">[-]</a></th> </tr> <tr class="hidden"> <td class="specs-key">Style Code</td> <td class="specs-value fk-data">EKUV803JABLK0</td> </tr> </table> </div>,10:03:2014,None
LSTSARDTFPRQ9HZJ5VNJRQ0HP,Dyefab Self Design Silk Sari,http://www.flipkart.com/womens-clothing?otracker=hp_nmenu_sub_women_0_Clothing,Rs. 1500,Clothing,Maternity Wear,Dyefab,http://img6a.flixcart.com/image/sari/5/v/n/lnvsr10151dwt-yellow-f-dyefab-400x400-imadtftfk2mggdgg.jpeg,Rs. 1500,Yellow,women,http://www.flipkart.com/dyefab-self-design-silk-sari/p/itmdtfq9yd2fgbaz?pid=SARDTFPRQ9HZJ5VN&srno=b_68&ref=939d77d1-413f-4541-adde-564387423c8d,Fashionara,Dyefab Self Design Silk Sari - Buy Yellow Dyefab Self Design Silk Sari Online at Best Prices in India | Flipkart.com,Dyefab Self Design Silk Sari - Buy Yellow Dyefab Self Design Silk Sari For Only Rs. 0.0 Online in India. Shop Online For Apparels. Huge Collection of Branded Clothes Only at,[],None,<div class="item_left_column" id="specifications"> <h3 class="item_desc_title fk-uppercase">         Specifications of Dyefab Self Design Silk Sari    </h3> <table cellspacing="0" class="fk-specs-type2"> <tr> <th class="group-head" colspan="2">General Details<a class="see-more unitExt rmargin10 no-underline" href="javascript:void(0);" onclick="$(this).closest('.fk-specs-type2').toggleClass('expandedMore')" title="Expand">[+]</a><a class="hidden unitExt rmargin10 no-underline" href="javascript:void(0);" onclick="$(this).closest('.fk-specs-type2').toggleClass('expandedMore')" title="Collapse">[-]</a></th> </tr> <tr class="hidden"> <td class="specs-key">Occasion</td> <td class="specs-value fk-data">Festive</td> </tr> <tr class="hidden"> <td class="specs-key">Pattern</td> <td class="specs-value fk-data">Self Design</td> </tr> </table> <table cellspacing="0" class="fk-specs-type2"> <tr> <th class="group-head" colspan="2">Sari Details</th> </tr> <tr class=""> <td class="specs-key">Type</td> <td class="specs-value fk-data">Daily Wear</td> </tr> <tr class=""> <td class="specs-key">Fabric</td> <td class="specs-value fk-data">Silk</td> </tr> </table> <table cellspacing="0" class="fk-specs-type2"> <tr> <th class="group-head" colspan="2">Fabric Care</th> </tr> <tr class=""> <td class="specs-value fk-data" colspan="2">Dry Clean Only</td> </tr> </table> </div>,10:03:2014,None
LSTKTADQXFBKZJ4YVDGPBIXVU,Morph Maternity Printed Women's Kurta,http://www.flipkart.com/womens-clothing?otracker=hp_nmenu_sub_women_0_Clothing,Rs. 1195,Clothing,Maternity Wear,Dyefab,http://img5a.flixcart.com/image/kurta/v/d/g/ekuv822jaorg0-morph-maternity-s-400x400-imadrysmgstxzuxb.jpeg,Rs. 1195,Green  Red  Yellow,women,http://www.flipkart.com/morph-maternity-printed-women-s-kurta/p/itmdqxfczsubcsf5?pid=KTADQXFBKZJ4YVDG&srno=b_82&ref=d005652d-31de-41d6-b3b4-680242885076,WS Retail,Morph Maternity Printed Women's Kurta - Buy Green  Yellow  Red Morph Maternity Printed Women's Kurta Online at Best Prices in India | Flipkart.com,Morph Maternity Printed Women's Kurta - Buy Green  Yellow  Red Morph Maternity Printed Women's Kurta For Only Rs. 1195.0 Online in India. Shop Online For Apparels. Huge Collection of Branded Clothes Only at,['S'  'M'  'L'],None,<div class="item_left_column" id="specifications"> <h3 class="item_desc_title fk-uppercase">         Specifications of Morph Maternity Printed Women's Kurta    </h3> <table cellspacing="0" class="fk-specs-type2"> <tr> <th class="group-head" colspan="2">General Details<a class="see-more unitExt rmargin10 no-underline" href="javascript:void(0);" onclick="$(this).closest('.fk-specs-type2').toggleClass('expandedMore')" title="Expand">[+]</a><a class="hidden unitExt rmargin10 no-underline" href="javascript:void(0);" onclick="$(this).closest('.fk-specs-type2').toggleClass('expandedMore')" title="Collapse">[-]</a></th> </tr> <tr class="hidden"> <td class="specs-key">Ideal For</td> <td class="specs-value fk-data">Women's</td> </tr> <tr class="hidden"> <td class="specs-key">Pattern</td> <td class="specs-value fk-data">Printed</td> </tr> </table> <table cellspacing="0" class="fk-specs-type2"> <tr> <th class="group-head" colspan="2">Kurta Details</th> </tr> <tr class=""> <td class="specs-key">Fabric</td> <td class="specs-value fk-data">Cotton</td> </tr> <tr class=""> <td class="specs-key">Design</td> <td class="specs-value fk-data">Print Allover</td> </tr> <tr class=""> <td class="specs-key">Style</td> <td class="specs-value fk-data">Button Detail at Front  Tie-up at Back  Elastic at Sleeves  Slit on Sides</td> </tr> <tr class=""> <td class="specs-key">Neck</td> <td class="specs-value fk-data">Fashion Neck</td> </tr> <tr class=""> <td class="specs-key">Sleeve</td> <td class="specs-value fk-data">Half Sleeve</td> </tr> </table> <table cellspacing="0" class="fk-specs-type2"> <tr> <th class="group-head" colspan="2">Additional Details<a class="see-more unitExt rmargin10 no-underline" href="javascript:void(0);" onclick="$(this).closest('.fk-specs-type2').toggleClass('expandedMore')" title="Expand">[+]</a><a class="hidden unitExt rmargin10 no-underline" href="javascript:void(0);" onclick="$(this).closest('.fk-specs-type2').toggleClass('expandedMore')" title="Collapse">[-]</a></th> </tr> <tr class="hidden"> <td class="specs-key">Style Code</td> <td class="specs-value fk-data">EKUV822JAORG0</td> </tr> <tr class="hidden"> <td class="specs-key">Other Details</td> <td class="specs-value fk-data">Round Neck. Puffed Sleeves. Vertical Zipper for Nursing.Has Patent Pending Leak-Proof layer. Has a back tie that can be adjusted to fit during and post pregnancy.</td> </tr> <tr class="hidden"> <td class="specs-key">Model Details</td> <td class="specs-value fk-data">This model has a Height of 5 feet 7 inches Bust 32 inches  and is wearing a Kurta of Size S</td> </tr> </table> </div>,10:03:2014,None
LSTKTADQXFBGVA2MFZYKQ2Q4Z,Morph Maternity Women's Kurta,http://www.flipkart.com/womens-clothing?otracker=hp_nmenu_sub_women_0_Clothing,Rs. 1195,Clothing,Maternity Wear,Dyefab,http://img5a.flixcart.com/image/kurta/f/z/y/ekav765kabei0-morph-maternity-l-400x400-imadrcqcxmuhb959.jpeg,Rs. 1195,Beige,women,http://www.flipkart.com/morph-maternity-women-s-kurta/p/itmdqxfc2mudgnpx?pid=KTADQXFBGVA2MFZY&srno=b_87&ref=d005652d-31de-41d6-b3b4-680242885076,WS Retail,Morph Maternity Women's Kurta - Buy Beige Morph Maternity Women's Kurta Online at Best Prices in India | Flipkart.com,Morph Maternity Women's Kurta - Buy Beige Morph Maternity Women's Kurta For Only Rs. 1195.0 Online in India. Shop Online For Apparels. Huge Collection of Branded Clothes Only at,['S'],None,<div class="item_left_column" id="specifications"> <h3 class="item_desc_title fk-uppercase">         Specifications of Morph Maternity Women's Kurta    </h3> <table cellspacing="0" class="fk-specs-type2"> <tr> <th class="group-head" colspan="2">General Details<a class="see-more unitExt rmargin10 no-underline" href="javascript:void(0);" onclick="$(this).closest('.fk-specs-type2').toggleClass('expandedMore')" title="Expand">[+]</a><a class="hidden unitExt rmargin10 no-underline" href="javascript:void(0);" onclick="$(this).closest('.fk-specs-type2').toggleClass('expandedMore')" title="Collapse">[-]</a></th> </tr> <tr class="hidden"> <td class="specs-key">Ideal For</td> <td class="specs-value fk-data">Women's</td> </tr> </table> <table cellspacing="0" class="fk-specs-type2"> <tr> <th class="group-head" colspan="2">Kurta Details</th> </tr> <tr class=""> <td class="specs-key">Fabric</td> <td class="specs-value fk-data">100% Cotton</td> </tr> </table> <table cellspacing="0" class="fk-specs-type2"> <tr> <th class="group-head" colspan="2">Additional Details<a class="see-more unitExt rmargin10 no-underline" href="javascript:void(0);" onclick="$(this).closest('.fk-specs-type2').toggleClass('expandedMore')" title="Expand">[+]</a><a class="hidden unitExt rmargin10 no-underline" href="javascript:void(0);" onclick="$(this).closest('.fk-specs-type2').toggleClass('expandedMore')" title="Collapse">[-]</a></th> </tr> <tr class="hidden"> <td class="specs-key">Style Code</td> <td class="specs-value fk-data">EKAV765KABEI0</td> </tr> </table> </div>,10:03:2014,None
LSTKTADQXFBBHTMCMUJCSVU52,Morph Maternity Women's Kurta,http://www.flipkart.com/womens-clothing?otracker=hp_nmenu_sub_women_0_Clothing,Rs. 697,Clothing,Maternity Wear,Dyefab,http://img5a.flixcart.com/image/kurta/c/h/p/ekuh793cpgrn0-morph-maternity-l-400x400-imadrdkhfkfb5n4t.jpeg,Rs. 995,Green,women,http://www.flipkart.com/morph-maternity-women-s-kurta/p/itmdqxfcwscgfns2?pid=KTADQXFBBHTMCMUJ&srno=b_85&ref=d005652d-31de-41d6-b3b4-680242885076,WS Retail,Morph Maternity Women's Kurta - Buy Green Morph Maternity Women's Kurta Online at Best Prices in India | Flipkart.com,Morph Maternity Women's Kurta - Buy Green Morph Maternity Women's Kurta For Only Rs. 995.0 Online in India. Shop Online For Apparels. Huge Collection of Branded Clothes Only at,['S'  'M'  'L'],None,<div class="item_left_column" id="specifications"> <h3 class="item_desc_title fk-uppercase">         Specifications of Morph Maternity Women's Kurta    </h3> <table cellspacing="0" class="fk-specs-type2"> <tr> <th class="group-head" colspan="2">General Details<a class="see-more unitExt rmargin10 no-underline" href="javascript:void(0);" onclick="$(this).closest('.fk-specs-type2').toggleClass('expandedMore')" title="Expand">[+]</a><a class="hidden unitExt rmargin10 no-underline" href="javascript:void(0);" onclick="$(this).closest('.fk-specs-type2').toggleClass('expandedMore')" title="Collapse">[-]</a></th> </tr> <tr class="hidden"> <td class="specs-key">Ideal For</td> <td class="specs-value fk-data">Women's</td> </tr> </table> <table cellspacing="0" class="fk-specs-type2"> <tr> <th class="group-head" colspan="2">Kurta Details</th> </tr> <tr class=""> <td class="specs-key">Fabric</td> <td class="specs-value fk-data">100% Cotton</td> </tr> </table> <table cellspacing="0" class="fk-specs-type2"> <tr> <th class="group-head" colspan="2">Additional Details<a class="see-more unitExt rmargin10 no-underline" href="javascript:void(0);" onclick="$(this).closest('.fk-specs-type2').toggleClass('expandedMore')" title="Expand">[+]</a><a class="hidden unitExt rmargin10 no-underline" href="javascript:void(0);" onclick="$(this).closest('.fk-specs-type2').toggleClass('expandedMore')" title="Collapse">[-]</a></th> </tr> <tr class="hidden"> <td class="specs-key">Style Code</td> <td class="specs-value fk-data">EKUH793CPGRN0</td> </tr> </table> </div>,10:03:2014,None
LSTKTADQXFBU9HAMHUFNEQIXM,Morph Maternity Women's Kurta,http://www.flipkart.com/womens-clothing?otracker=hp_nmenu_sub_women_0_Clothing,Rs. 697,Clothing,Maternity Wear,Dyefab,http://img5a.flixcart.com/image/kurta/h/u/f/ekuh808cpred0-morph-maternity-l-400x400-imadrcqar7hhfyka.jpeg,Rs. 995,Red,women,http://www.flipkart.com/morph-maternity-women-s-kurta/p/itmdqxfcxn7srrwq?pid=KTADQXFBU9HAMHUF&srno=b_83&ref=d005652d-31de-41d6-b3b4-680242885076,WS Retail,Morph Maternity Women's Kurta - Buy Red Morph Maternity Women's Kurta Online at Best Prices in India | Flipkart.com,Morph Maternity Women's Kurta - Buy Red Morph Maternity Women's Kurta For Only Rs. 995.0 Online in India. Shop Online For Apparels. Huge Collection of Branded Clothes Only at,['S'],None,<div class="item_left_column" id="specifications"> <h3 class="item_desc_title fk-uppercase">         Specifications of Morph Maternity Women's Kurta    </h3> <table cellspacing="0" class="fk-specs-type2"> <tr> <th class="group-head" colspan="2">General Details<a class="see-more unitExt rmargin10 no-underline" href="javascript:void(0);" onclick="$(this).closest('.fk-specs-type2').toggleClass('expandedMore')" title="Expand">[+]</a><a class="hidden unitExt rmargin10 no-underline" href="javascript:void(0);" onclick="$(this).closest('.fk-specs-type2').toggleClass('expandedMore')" title="Collapse">[-]</a></th> </tr> <tr class="hidden"> <td class="specs-key">Ideal For</td> <td class="specs-value fk-data">Women's</td> </tr> </table> <table cellspacing="0" class="fk-specs-type2"> <tr> <th class="group-head" colspan="2">Kurta Details</th> </tr> <tr class=""> <td class="specs-key">Fabric</td> <td class="specs-value fk-data">100% Cotton</td> </tr> </table> <table cellspacing="0" class="fk-specs-type2"> <tr> <th class="group-head" colspan="2">Additional Details<a class="see-more unitExt rmargin10 no-underline" href="javascript:void(0);" onclick="$(this).closest('.fk-specs-type2').toggleClass('expandedMore')" title="Expand">[+]</a><a class="hidden unitExt rmargin10 no-underline" href="javascript:void(0);" onclick="$(this).closest('.fk-specs-type2').toggleClass('expandedMore')" title="Collapse">[-]</a></th> </tr> <tr class="hidden"> <td class="specs-key">Style Code</td> <td class="specs-value fk-data">EKUH808CPRED0</td> </tr> </table> </div>,10:03:2014,None
